,number,value,datetime_start,datetime_complete,duration,params_alpha,params_bagging_fraction,params_bagging_freq,params_booster,params_classifier,params_colsample_bytree,params_dct_criterion,params_dct_max_depth,params_eta,params_feature_fraction,params_gamma,params_grow_policy,params_lambda,params_lambda_l1,params_lambda_l2,params_max_depth,params_min_child_samples,params_min_child_weight,params_mlp_activation,params_mlp_solver,params_n_layers,params_n_units_l_0,params_n_units_l_1,params_n_units_l_2,params_n_units_l_3,params_normalize_type,params_num_leaves,params_rate_drop,params_rf_estimator,params_rf_max_depth,params_sample_type,params_skip_drop,params_subsample,params_svc_c,params_svc_kernel,state,best_trial,dev_acc,dev_recall_macro,dev_precision_macro,dev_f1_macro,dev_recall_0,dev_precision_0,dev_f1_0,dev_recall_1,dev_precision_1,dev_f1_1,test_acc,test_recall_macro,test_precision_macro,test_f1_macro,test_recall_0,test_precision_0,test_f1_0,test_recall_1,test_precision_1,test_f1_1
85,85,0.3357921744708146,2023-08-23 19:10:30.032837,2023-08-23 19:10:30.247031,0 days 00:00:00.214194,0.9156385686792426,,,gblinear,XGBoost,0.9999676305197854,,,,,,,2.353540468966427e-06,,,,,,,,,,,,,,,,,,,,0.7602560254850343,,,COMPLETE,0.0,,,,,,,,,,,,,,,,,,,,
86,86,0.715967868338558,2023-08-23 19:10:30.354751,2023-08-23 19:10:34.556408,0 days 00:00:04.201657,,1.0,1.0,,LightGBM,,,,,0.7000000000000001,,,,0.0751462478950507,1.0016038986997377e-08,,40.0,,,,,,,,,,156.0,,,,,,,,,COMPLETE,0.0,,,,,,,,,,,,,,,,,,,,
87,87,0.7037422083512146,2023-08-23 19:10:31.317903,2023-08-23 19:10:34.142426,0 days 00:00:02.824523,,1.0,1.0,,LightGBM,,,,,0.7000000000000001,,,,0.06239785689325451,5.211827134006737e-07,,90.0,,,,,,,,,,158.0,,,,,,,,,COMPLETE,0.0,,,,,,,,,,,,,,,,,,,,
88,88,0.7034086244215555,2023-08-23 19:10:34.251000,2023-08-23 19:10:38.792346,0 days 00:00:04.541346,,1.0,1.0,,LightGBM,,,,,0.9,,,,0.3803511721366771,7.561179881132848e-08,,40.0,,,,,,,,,,174.0,,,,,,,,,COMPLETE,0.0,,,,,,,,,,,,,,,,,,,,
89,89,0.7100652574833309,2023-08-23 19:10:34.644711,2023-08-23 19:10:38.914058,0 days 00:00:04.269347,,1.0,1.0,,LightGBM,,,,,0.7000000000000001,,,,0.447033202370037,1.0207773392033429e-08,,40.0,,,,,,,,,,174.0,,,,,,,,,COMPLETE,0.0,,,,,,,,,,,,,,,,,,,,
90,90,0.705340815793402,2023-08-23 19:10:38.872994,2023-08-23 19:10:43.355710,0 days 00:00:04.482716,,0.9,1.0,,LightGBM,,,,,0.7000000000000001,,,,0.0776841606015405,1.0606800535612314e-08,,40.0,,,,,,,,,,138.0,,,,,,,,,COMPLETE,0.0,,,,,,,,,,,,,,,,,,,,
91,91,0.7108913951264697,2023-08-23 19:10:39.035203,2023-08-23 19:10:43.807803,0 days 00:00:04.772600,,0.9,1.0,,LightGBM,,,,,0.6000000000000001,,,,0.08817231235634498,2.4879831037198902e-08,,20.0,,,,,,,,,,142.0,,,,,,,,,COMPLETE,0.0,,,,,,,,,,,,,,,,,,,,
92,92,0.7090146180977615,2023-08-23 19:10:43.476871,2023-08-23 19:10:48.270625,0 days 00:00:04.793754,,0.9,1.0,,LightGBM,,,,,0.6000000000000001,,,,0.11055310833830664,2.274445115990942e-08,,30.0,,,,,,,,,,192.0,,,,,,,,,COMPLETE,0.0,,,,,,,,,,,,,,,,,,,,
93,93,0.7008424583513897,2023-08-23 19:10:43.938560,2023-08-23 19:10:46.321362,0 days 00:00:02.382802,,0.5,3.0,,LightGBM,,,,,0.8,,,,0.011330724142168434,1.1022797508911885e-07,,50.0,,,,,,,,,,162.0,,,,,,,,,COMPLETE,0.0,,,,,,,,,,,,,,,,,,,,
94,94,0.7033848252490777,2023-08-23 19:10:46.413230,2023-08-23 19:10:51.029684,0 days 00:00:04.616454,,0.8,1.0,,LightGBM,,,,,0.8,,,,0.11637951088513968,2.417102797320649e-08,,30.0,,,,,,,,,,192.0,,,,,,,,,COMPLETE,0.0,,,,,,,,,,,,,,,,,,,,
95,95,0.7144505903292251,2023-08-23 19:10:47.484289,2023-08-23 19:10:52.036161,0 days 00:00:04.551872,,0.8,1.0,,LightGBM,,,,,0.8,,,,0.11086456570893558,2.3874261701531924e-08,,30.0,,,,,,,,,,194.0,,,,,,,,,COMPLETE,0.0,,,,,,,,,,,,,,,,,,,,
96,96,0.6967627460850008,2023-08-23 19:10:48.360017,2023-08-23 19:10:48.447016,0 days 00:00:00.086999,,,,,DecisionTreeClassifier,,gini,2.0,,,,,,,,,,,,,,,,,,,,,,,,,,,,COMPLETE,0.0,,,,,,,,,,,,,,,,,,,,
97,97,0.7143746250172396,2023-08-23 19:10:48.581063,2023-08-23 19:10:50.668229,0 days 00:00:02.087166,,0.8,1.0,,LightGBM,,,,,0.8,,,,0.5351346160420385,3.0661680418042316e-08,,80.0,,,,,,,,,,184.0,,,,,,,,,COMPLETE,0.0,,,,,,,,,,,,,,,,,,,,
98,98,0.7096587880590401,2023-08-23 19:10:50.800992,2023-08-23 19:10:53.980964,0 days 00:00:03.179972,,1.0,2.0,,LightGBM,,,,,0.9,,,,0.9899355997988665,1.3875669031657138e-07,,90.0,,,,,,,,,,253.0,,,,,,,,,COMPLETE,0.0,,,,,,,,,,,,,,,,,,,,
99,99,0.7119825647056628,2023-08-23 19:10:51.144585,2023-08-23 19:10:53.733203,0 days 00:00:02.588618,,1.0,2.0,,LightGBM,,,,,0.9,,,,0.9249161823461008,1.4941221004209667e-07,,90.0,,,,,,,,,,208.0,,,,,,,,,COMPLETE,0.0,,,,,,,,,,,,,,,,,,,,
100,100,0.7066069034246392,2023-08-23 19:10:52.135782,2023-08-23 19:10:54.786619,0 days 00:00:02.650837,,1.0,2.0,,LightGBM,,,,,0.9,,,,0.9684992545130171,1.6635879003665463e-07,,90.0,,,,,,,,,,210.0,,,,,,,,,COMPLETE,0.0,,,,,,,,,,,,,,,,,,,,
101,101,0.7086232662646512,2023-08-23 19:10:53.828644,2023-08-23 19:10:57.677857,0 days 00:00:03.849213,,1.0,1.0,,LightGBM,,,,,0.9,,,,0.49753251268194804,4.2536202098814166e-07,,80.0,,,,,,,,,,166.0,,,,,,,,,COMPLETE,0.0,,,,,,,,,,,,,,,,,,,,
102,102,0.6827023136623895,2023-08-23 19:10:54.133833,2023-08-23 19:10:54.872372,0 days 00:00:00.738539,1.0481994337011186e-08,,,gbtree,XGBoost,0.7252089335410612,,,1.2867587661454555e-08,,0.5979176396378749,depthwise,0.08203988613248339,,,7.0,,6.0,,,,,,,,,,,,,,,0.21029756275033396,,,COMPLETE,0.0,,,,,,,,,,,,,,,,,,,,
103,103,0.6784806067077503,2023-08-23 19:10:54.858991,2023-08-23 19:10:56.016272,0 days 00:00:01.157281,1.5462763624564847e-08,,,gbtree,XGBoost,0.736265814800056,,,1.2076208931550446e-08,,0.8886838115055086,lossguide,0.5670766980859966,,,7.0,,6.0,,,,,,,,,,,,,,,0.26298026471236946,,,COMPLETE,0.0,,,,,,,,,,,,,,,,,,,,
104,104,0.3357921744708146,2023-08-23 19:10:54.999444,2023-08-23 19:10:59.647690,0 days 00:00:04.648246,,,,,SVC,,,,,,,,,,,,,,,,,,,,,,,,,,,,,6.706469684134605,poly,COMPLETE,0.0,,,,,,,,,,,,,,,,,,,,
105,105,0.7047087916844896,2023-08-23 19:10:56.104844,2023-08-23 19:10:59.333829,0 days 00:00:03.228985,,1.0,1.0,,LightGBM,,,,,0.7000000000000001,,,,0.33397145208915524,3.589197257957631e-07,,100.0,,,,,,,,,,228.0,,,,,,,,,COMPLETE,0.0,,,,,,,,,,,,,,,,,,,,
106,106,0.7148820690878205,2023-08-23 19:10:57.752750,2023-08-23 19:11:01.313332,0 days 00:00:03.560582,,0.7000000000000001,1.0,,LightGBM,,,,,1.0,,,,0.043736428011892405,6.612291476059208e-08,,100.0,,,,,,,,,,228.0,,,,,,,,,COMPLETE,0.0,,,,,,,,,,,,,,,,,,,,
107,107,0.3357921744708146,2023-08-23 19:10:59.464561,2023-08-23 19:11:03.647992,0 days 00:00:04.183431,,,,,SVC,,,,,,,,,,,,,,,,,,,,,,,,,,,,,4.691439664590142,poly,COMPLETE,0.0,,,,,,,,,,,,,,,,,,,,
108,108,0.7096826260584517,2023-08-23 19:10:59.748329,2023-08-23 19:11:02.594839,0 days 00:00:02.846510,,0.5,1.0,,LightGBM,,,,,0.6000000000000001,,,,0.044224040698253204,6.010594924834439e-08,,60.0,,,,,,,,,,23.0,,,,,,,,,COMPLETE,0.0,,,,,,,,,,,,,,,,,,,,
109,109,0.7135783494587482,2023-08-23 19:11:01.422833,2023-08-23 19:11:04.205003,0 days 00:00:02.782170,,0.7000000000000001,1.0,,LightGBM,,,,,1.0,,,,0.05686393974085279,5.6770784465223876e-08,,100.0,,,,,,,,,,234.0,,,,,,,,,COMPLETE,0.0,,,,,,,,,,,,,,,,,,,,
110,110,0.7081323591998865,2023-08-23 19:11:02.672961,2023-08-23 19:11:05.359953,0 days 00:00:02.686992,,0.7000000000000001,1.0,,LightGBM,,,,,1.0,,,,0.014464371571746792,5.830983576211415e-08,,100.0,,,,,,,,,,227.0,,,,,,,,,COMPLETE,0.0,,,,,,,,,,,,,,,,,,,,
111,111,0.7111481695712207,2023-08-23 19:11:03.745747,2023-08-23 19:11:05.847302,0 days 00:00:02.101555,,0.7000000000000001,1.0,,LightGBM,,,,,1.0,,,,0.04821401366993113,4.551359851640645e-08,,100.0,,,,,,,,,,239.0,,,,,,,,,COMPLETE,0.0,,,,,,,,,,,,,,,,,,,,
112,112,0.7187480749306975,2023-08-23 19:11:04.313943,2023-08-23 19:11:07.174664,0 days 00:00:02.860721,,0.9,1.0,,LightGBM,,,,,1.0,,,,0.24127630686961712,9.800048136446509e-07,,100.0,,,,,,,,,,180.0,,,,,,,,,COMPLETE,0.0,,,,,,,,,,,,,,,,,,,,
113,113,0.711896514700253,2023-08-23 19:11:05.429631,2023-08-23 19:11:08.183866,0 days 00:00:02.754235,,0.9,3.0,,LightGBM,,,,,0.8,,,,0.18080868334965425,2.68686049926372e-07,,80.0,,,,,,,,,,177.0,,,,,,,,,COMPLETE,0.0,,,,,,,,,,,,,,,,,,,,
114,114,0.7107860720497543,2023-08-23 19:11:05.922554,2023-08-23 19:11:06.911133,0 days 00:00:00.988579,,0.6000000000000001,3.0,,LightGBM,,,,,0.8,,,,0.21300519164331494,2.92700557445224e-07,,80.0,,,,,,,,,,3.0,,,,,,,,,COMPLETE,0.0,,,,,,,,,,,,,,,,,,,,
115,115,0.720597626672393,2023-08-23 19:11:07.025639,2023-08-23 19:11:09.709497,0 days 00:00:02.683858,,0.9,1.0,,LightGBM,,,,,0.7000000000000001,,,,0.006157435566736007,8.254337587338534e-07,,90.0,,,,,,,,,,177.0,,,,,,,,,COMPLETE,0.0,,,,,,,,,,,,,,,,,,,,
116,116,0.7003677671679129,2023-08-23 19:11:07.244024,2023-08-23 19:11:07.605567,0 days 00:00:00.361543,,,,,DecisionTreeClassifier,,entropy,4.0,,,,,,,,,,,,,,,,,,,,,,,,,,,,COMPLETE,0.0,,,,,,,,,,,,,,,,,,,,
117,117,0.7086232662646512,2023-08-23 19:11:07.683497,2023-08-23 19:11:10.558746,0 days 00:00:02.875249,,0.9,1.0,,LightGBM,,,,,0.7000000000000001,,,,0.16418476395271225,2.396465779674542e-07,,90.0,,,,,,,,,,181.0,,,,,,,,,COMPLETE,0.0,,,,,,,,,,,,,,,,,,,,
118,118,0.7134243593599818,2023-08-23 19:11:08.325199,2023-08-23 19:11:11.003266,0 days 00:00:02.678067,,0.9,1.0,,LightGBM,,,,,1.0,,,,0.14623239704329435,1.0009251017756665e-06,,100.0,,,,,,,,,,221.0,,,,,,,,,COMPLETE,0.0,,,,,,,,,,,,,,,,,,,,
119,119,0.720597626672393,2023-08-23 19:11:09.813677,2023-08-23 19:11:12.758639,0 days 00:00:02.944962,,0.9,1.0,,LightGBM,,,,,0.7000000000000001,,,,0.006450189854139354,1.014231682406587e-06,,90.0,,,,,,,,,,154.0,,,,,,,,,COMPLETE,0.0,,,,,,,,,,,,,,,,,,,,
120,120,0.7178258199742804,2023-08-23 19:11:10.632060,2023-08-23 19:11:14.530470,0 days 00:00:03.898410,,0.9,1.0,,LightGBM,,,,,0.7000000000000001,,,,0.006656773857507406,6.25311108122242e-07,,50.0,,,,,,,,,,201.0,,,,,,,,,COMPLETE,0.0,,,,,,,,,,,,,,,,,,,,
121,121,0.7210719721876568,2023-08-23 19:11:11.185392,2023-08-23 19:11:14.028444,0 days 00:00:02.843052,,0.9,1.0,,LightGBM,,,,,0.7000000000000001,,,,0.005700651360427201,1.1115469363228196e-06,,90.0,,,,,,,,,,153.0,,,,,,,,,COMPLETE,0.0,,,,,,,,,,,,,,,,,,,,
122,122,0.7125573692098648,2023-08-23 19:11:12.836973,2023-08-23 19:11:15.234046,0 days 00:00:02.397073,,0.9,1.0,,LightGBM,,,,,0.7000000000000001,,,,0.002765167448084035,1.351555740605246e-06,,90.0,,,,,,,,,,152.0,,,,,,,,,COMPLETE,0.0,,,,,,,,,,,,,,,,,,,,
123,123,0.7110317066250532,2023-08-23 19:11:14.125669,2023-08-23 19:11:17.959424,0 days 00:00:03.833755,,0.9,1.0,,LightGBM,,,,,0.7000000000000001,,,,0.005473961727180609,1.5102476804031611e-06,,50.0,,,,,,,,,,151.0,,,,,,,,,COMPLETE,0.0,,,,,,,,,,,,,,,,,,,,
124,124,0.6928875096132436,2023-08-23 19:11:14.613080,2023-08-23 19:11:15.940448,0 days 00:00:01.327368,,,,,RandomForestClassifier,,,,,,,,,,,,,,,,,,,,,,,,10.0,11.0,,,,,,COMPLETE,0.0,,,,,,,,,,,,,,,,,,,,
125,125,0.7081828754576829,2023-08-23 19:11:15.333312,2023-08-23 19:11:17.306621,0 days 00:00:01.973309,,,,,RandomForestClassifier,,,,,,,,,,,,,,,,,,,,,,,,23.0,10.0,,,,,,COMPLETE,0.0,,,,,,,,,,,,,,,,,,,,
126,126,0.712949066166382,2023-08-23 19:11:16.068707,2023-08-23 19:11:19.631365,0 days 00:00:03.562658,,0.9,1.0,,LightGBM,,,,,0.7000000000000001,,,,0.005358165768247078,1.7013004900706993e-06,,50.0,,,,,,,,,,200.0,,,,,,,,,COMPLETE,0.0,,,,,,,,,,,,,,,,,,,,
127,127,0.7120132076035179,2023-08-23 19:11:17.412334,2023-08-23 19:11:21.424858,0 days 00:00:04.012524,,0.9,1.0,,LightGBM,,,,,0.7000000000000001,,,,0.006969164930570649,1.5188102801981578e-06,,50.0,,,,,,,,,,129.0,,,,,,,,,COMPLETE,0.0,,,,,,,,,,,,,,,,,,,,
128,128,0.7157636755767598,2023-08-23 19:11:18.024021,2023-08-23 19:11:21.709618,0 days 00:00:03.685597,,0.9,1.0,,LightGBM,,,,,0.7000000000000001,,,,0.009000880615515752,7.734222222776633e-07,,50.0,,,,,,,,,,200.0,,,,,,,,,COMPLETE,0.0,,,,,,,,,,,,,,,,,,,,
129,129,0.7076085416843146,2023-08-23 19:11:19.714463,2023-08-23 19:11:23.179124,0 days 00:00:03.464661,,0.9,1.0,,LightGBM,,,,,0.7000000000000001,,,,0.015864768510858104,6.103996678892578e-07,,60.0,,,,,,,,,,138.0,,,,,,,,,COMPLETE,0.0,,,,,,,,,,,,,,,,,,,,
130,130,0.7130695812807881,2023-08-23 19:11:21.551572,2023-08-23 19:11:24.163154,0 days 00:00:02.611582,,0.9,1.0,,LightGBM,,,,,0.7000000000000001,,,,0.014790842547111847,6.410699548763991e-07,,90.0,,,,,,,,,,168.0,,,,,,,,,COMPLETE,0.0,,,,,,,,,,,,,,,,,,,,
131,131,0.7130695812807881,2023-08-23 19:11:21.799540,2023-08-23 19:11:24.601083,0 days 00:00:02.801543,,0.9,1.0,,LightGBM,,,,,0.7000000000000001,,,,0.015405056752338938,7.048833035649382e-07,,90.0,,,,,,,,,,163.0,,,,,,,,,COMPLETE,0.0,,,,,,,,,,,,,,,,,,,,
132,132,0.712503718393654,2023-08-23 19:11:23.246088,2023-08-23 19:11:26.031791,0 days 00:00:02.785703,,0.9,1.0,,LightGBM,,,,,0.7000000000000001,,,,0.0015604727067657692,6.123565595622192e-07,,90.0,,,,,,,,,,165.0,,,,,,,,,COMPLETE,0.0,,,,,,,,,,,,,,,,,,,,
133,133,0.7102021168818811,2023-08-23 19:11:24.250600,2023-08-23 19:11:26.329897,0 days 00:00:02.079297,,0.4,1.0,,LightGBM,,,,,0.6000000000000001,,,,0.0022728712308406687,4.225750420901058e-07,,80.0,,,,,,,,,,162.0,,,,,,,,,COMPLETE,0.0,,,,,,,,,,,,,,,,,,,,
134,134,0.7102021168818811,2023-08-23 19:11:24.672462,2023-08-23 19:11:26.646336,0 days 00:00:01.973874,,0.4,1.0,,LightGBM,,,,,0.6000000000000001,,,,0.0016051685267294933,3.5714985268077556e-07,,80.0,,,,,,,,,,51.0,,,,,,,,,COMPLETE,0.0,,,,,,,,,,,,,,,,,,,,
135,135,0.7067054740587361,2023-08-23 19:11:26.198773,2023-08-23 19:11:27.694074,0 days 00:00:01.495301,,0.4,1.0,,LightGBM,,,,,0.6000000000000001,,,,0.02889746129268606,3.835689359504011e-07,,80.0,,,,,,,,,,13.0,,,,,,,,,COMPLETE,0.0,,,,,,,,,,,,,,,,,,,,
136,136,0.7124889609079063,2023-08-23 19:11:26.457099,2023-08-23 19:11:29.029792,0 days 00:00:02.572693,,0.9,1.0,,LightGBM,,,,,0.6000000000000001,,,,0.02924005188650989,3.7806222093381723e-07,,100.0,,,,,,,,,,51.0,,,,,,,,,COMPLETE,0.0,,,,,,,,,,,,,,,,,,,,
137,137,0.7088738301171285,2023-08-23 19:11:26.740202,2023-08-23 19:11:28.437111,0 days 00:00:01.696909,,0.9,1.0,,LightGBM,,,,,0.7000000000000001,,,,0.022717451535532018,1.0300207592509262e-06,,70.0,,,,,,,,,,13.0,,,,,,,,,COMPLETE,0.0,,,,,,,,,,,,,,,,,,,,
138,138,0.7009220226967688,2023-08-23 19:11:27.796976,2023-08-23 19:11:31.519544,0 days 00:00:03.722568,,0.9,1.0,,LightGBM,,,,,0.7000000000000001,,,,0.004412289631783001,1.010597882991272e-06,,40.0,,,,,,,,,,200.0,,,,,,,,,COMPLETE,0.0,,,,,,,,,,,,,,,,,,,,
139,139,0.7158639523336644,2023-08-23 19:11:28.490696,2023-08-23 19:11:31.962726,0 days 00:00:03.472030,,0.9,1.0,,LightGBM,,,,,0.7000000000000001,,,,0.008854697371228125,1.5111173075436444e-08,,50.0,,,,,,,,,,200.0,,,,,,,,,COMPLETE,0.0,,,,,,,,,,,,,,,,,,,,
140,140,0.7072101790763431,2023-08-23 19:11:29.147271,2023-08-23 19:11:33.344028,0 days 00:00:04.196757,,0.9,1.0,,LightGBM,,,,,0.7000000000000001,,,,0.008588151297897272,8.996345295127835e-07,,40.0,,,,,,,,,,187.0,,,,,,,,,COMPLETE,0.0,,,,,,,,,,,,,,,,,,,,
141,141,0.7077615761942846,2023-08-23 19:11:31.645338,2023-08-23 19:11:35.617420,0 days 00:00:03.972082,,0.9,1.0,,LightGBM,,,,,0.7000000000000001,,,,0.008269973929888857,1.5520621994517863e-08,,50.0,,,,,,,,,,188.0,,,,,,,,,COMPLETE,0.0,,,,,,,,,,,,,,,,,,,,
142,142,0.7144364665052931,2023-08-23 19:11:32.074305,2023-08-23 19:11:35.991500,0 days 00:00:03.917195,,0.9,1.0,,LightGBM,,,,,0.7000000000000001,,,,0.00780970116126048,1.658552046140068e-08,,60.0,,,,,,,,,,215.0,,,,,,,,,COMPLETE,0.0,,,,,,,,,,,,,,,,,,,,
143,143,0.6207688805705903,2023-08-23 19:11:33.416185,2023-08-23 19:13:41.361499,0 days 00:02:07.945314,,,,,MLPClassifier,,,,,,,,,,,,,,identity,adam,2.0,70.0,60.0,,,,,,,,,,,,,COMPLETE,0.0,,,,,,,,,,,,,,,,,,,,
144,144,0.6345732508643536,2023-08-23 19:11:35.721095,2023-08-23 19:13:24.612630,0 days 00:01:48.891535,,,,,MLPClassifier,,,,,,,,,,,,,,identity,adam,2.0,70.0,60.0,,,,,,,,,,,,,COMPLETE,0.0,,,,,,,,,,,,,,,,,,,,
145,145,0.6309149741138989,2023-08-23 19:11:36.111617,2023-08-23 19:16:21.446267,0 days 00:04:45.334650,,,,,MLPClassifier,,,,,,,,,,,,,,logistic,adam,2.0,100.0,60.0,,,,,,,,,,,,,COMPLETE,0.0,,,,,,,,,,,,,,,,,,,,
146,146,0.6643218522685044,2023-08-23 19:13:20.886332,2023-08-23 19:15:35.919574,0 days 00:02:15.033242,,,,,MLPClassifier,,,,,,,,,,,,,,identity,adam,2.0,60.0,60.0,,,,,,,,,,,,,COMPLETE,0.0,,,,,,,,,,,,,,,,,,,,
147,147,0.6899278419600415,2023-08-23 19:13:24.713097,2023-08-23 19:13:24.932753,0 days 00:00:00.219656,,,,,DecisionTreeClassifier,,gini,5.0,,,,,,,,,,,,,,,,,,,,,,,,,,,,COMPLETE,0.0,,,,,,,,,,,,,,,,,,,,
148,148,0.7139604202479006,2023-08-23 19:13:25.048121,2023-08-23 19:13:27.586295,0 days 00:00:02.538174,,0.8,1.0,,LightGBM,,,,,0.7000000000000001,,,,0.07125769558377025,1.0666793378166512e-07,,50.0,,,,,,,,,,199.0,,,,,,,,,COMPLETE,0.0,,,,,,,,,,,,,,,,,,,,
149,149,0.717257747765724,2023-08-23 19:13:27.693138,2023-08-23 19:13:30.595977,0 days 00:00:02.902839,,0.9,1.0,,LightGBM,,,,,0.7000000000000001,,,,0.004159029634743714,2.583049092242875e-06,,50.0,,,,,,,,,,177.0,,,,,,,,,COMPLETE,0.0,,,,,,,,,,,,,,,,,,,,
150,150,0.7100950205215211,2023-08-23 19:13:30.682737,2023-08-23 19:13:32.576193,0 days 00:00:01.893456,,0.9,1.0,,LightGBM,,,,,0.5,,,,0.004422455504490005,2.3873331294401816e-06,,90.0,,,,,,,,,,180.0,,,,,,,,,COMPLETE,0.0,,,,,,,,,,,,,,,,,,,,
151,151,0.7114037563189447,2023-08-23 19:13:32.649278,2023-08-23 19:13:34.698601,0 days 00:00:02.049323,,0.9,1.0,,LightGBM,,,,,0.4,,,,0.09579426990223791,4.864611804588768e-06,,100.0,,,,,,,,,,144.0,,,,,,,,,COMPLETE,0.0,,,,,,,,,,,,,,,,,,,,
152,152,0.7173883377945729,2023-08-23 19:13:34.773327,2023-08-23 19:13:38.442256,0 days 00:00:03.668929,,0.9,1.0,,LightGBM,,,,,0.7000000000000001,,,,0.28401561676921006,1.826051852128067e-07,,40.0,,,,,,,,,,174.0,,,,,,,,,COMPLETE,0.0,,,,,,,,,,,,,,,,,,,,
153,153,0.7115225372470926,2023-08-23 19:13:38.561325,2023-08-23 19:13:42.223179,0 days 00:00:03.661854,,0.9,1.0,,LightGBM,,,,,0.7000000000000001,,,,0.3021049122823658,2.009352372988667e-07,,40.0,,,,,,,,,,174.0,,,,,,,,,COMPLETE,0.0,,,,,,,,,,,,,,,,,,,,
154,154,0.7077135826154017,2023-08-23 19:13:41.469114,2023-08-23 19:13:44.960906,0 days 00:00:03.491792,,0.6000000000000001,1.0,,LightGBM,,,,,0.8,,,,0.27668951980879086,3.518844490271882e-08,,40.0,,,,,,,,,,158.0,,,,,,,,,COMPLETE,0.0,,,,,,,,,,,,,,,,,,,,
155,155,0.7017734092471208,2023-08-23 19:13:42.296977,2023-08-23 19:13:45.584040,0 days 00:00:03.287063,,0.6000000000000001,1.0,,LightGBM,,,,,0.8,,,,0.26197191653832996,1.529083831564008e-08,,40.0,,,,,,,,,,156.0,,,,,,,,,COMPLETE,0.0,,,,,,,,,,,,,,,,,,,,
156,156,0.7114223475446018,2023-08-23 19:13:45.049404,2023-08-23 19:13:47.290618,0 days 00:00:02.241214,,0.8,1.0,,LightGBM,,,,,0.8,,,,0.012532348360644584,8.054518842565341e-08,,70.0,,,,,,,,,,245.0,,,,,,,,,COMPLETE,0.0,,,,,,,,,,,,,,,,,,,,
157,157,0.7146983281965069,2023-08-23 19:13:45.681516,2023-08-23 19:13:48.466400,0 days 00:00:02.784884,,0.8,1.0,,LightGBM,,,,,0.7000000000000001,,,,0.5635627916604115,9.989983779544994e-08,,50.0,,,,,,,,,,178.0,,,,,,,,,COMPLETE,0.0,,,,,,,,,,,,,,,,,,,,
158,158,0.7144897566437481,2023-08-23 19:13:47.390203,2023-08-23 19:13:49.801545,0 days 00:00:02.411342,,0.9,1.0,,LightGBM,,,,,0.7000000000000001,,,,0.5636966705914032,2.2981447522215853e-07,,60.0,,,,,,,,,,66.0,,,,,,,,,COMPLETE,0.0,,,,,,,,,,,,,,,,,,,,
159,159,0.7057811104343468,2023-08-23 19:13:48.545633,2023-08-23 19:13:50.590634,0 days 00:00:02.045001,,0.9,1.0,,LightGBM,,,,,0.7000000000000001,,,,0.12268841195248083,1.5419811710808566e-07,,100.0,,,,,,,,,,66.0,,,,,,,,,COMPLETE,0.0,,,,,,,,,,,,,,,,,,,,
160,160,0.7164665895605393,2023-08-23 19:13:49.890556,2023-08-23 19:13:52.097402,0 days 00:00:02.206846,,0.9,1.0,,LightGBM,,,,,0.7000000000000001,,,,0.1115531931181756,1.0670984755558886e-08,,100.0,,,,,,,,,,101.0,,,,,,,,,COMPLETE,0.0,,,,,,,,,,,,,,,,,,,,
161,161,0.715012408105385,2023-08-23 19:13:50.692191,2023-08-23 19:13:53.492250,0 days 00:00:02.800059,,0.9,1.0,,LightGBM,,,,,0.7000000000000001,,,,0.08345757035315417,2.2147420152906613e-06,,90.0,,,,,,,,,,189.0,,,,,,,,,COMPLETE,0.0,,,,,,,,,,,,,,,,,,,,
162,162,0.5702892154533206,2023-08-23 19:13:52.254480,2023-08-23 19:13:52.537281,0 days 00:00:00.282801,0.0002180788358997056,,,gblinear,XGBoost,0.39242571322940256,,,,,,,1.5042002258470044e-05,,,,,,,,,,,,,,,,,,,,0.6936033913301203,,,COMPLETE,0.0,,,,,,,,,,,,,,,,,,,,
163,163,0.3357921744708146,2023-08-23 19:13:52.629688,2023-08-23 19:13:58.630940,0 days 00:00:06.001252,,,,,SVC,,,,,,,,,,,,,,,,,,,,,,,,,,,,,0.06552692723607095,rbf,COMPLETE,0.0,,,,,,,,,,,,,,,,,,,,
164,164,0.3357921744708146,2023-08-23 19:13:53.633401,2023-08-23 19:13:59.686047,0 days 00:00:06.052646,,,,,SVC,,,,,,,,,,,,,,,,,,,,,,,,,,,,,0.04248001925437376,rbf,COMPLETE,0.0,,,,,,,,,,,,,,,,,,,,
165,165,0.7109831526751476,2023-08-23 19:13:58.763031,2023-08-23 19:14:01.156961,0 days 00:00:02.393930,,0.9,1.0,,LightGBM,,,,,0.9,,,,0.037387237035538964,1.3693671481074724e-08,,100.0,,,,,,,,,,172.0,,,,,,,,,COMPLETE,0.0,,,,,,,,,,,,,,,,,,,,
166,166,0.7109831526751476,2023-08-23 19:13:59.761213,2023-08-23 19:14:02.329555,0 days 00:00:02.568342,,0.9,1.0,,LightGBM,,,,,0.9,,,,0.034786992734891796,1.1354262349490652e-08,,100.0,,,,,,,,,,90.0,,,,,,,,,COMPLETE,0.0,,,,,,,,,,,,,,,,,,,,
167,167,0.7086077648875546,2023-08-23 19:14:01.236904,2023-08-23 19:14:03.641746,0 days 00:00:02.404842,,0.9,2.0,,LightGBM,,,,,0.7000000000000001,,,,0.13316960120047672,1.893711751369707e-08,,100.0,,,,,,,,,,129.0,,,,,,,,,COMPLETE,0.0,,,,,,,,,,,,,,,,,,,,
168,168,0.7138995454248458,2023-08-23 19:14:02.396192,2023-08-23 19:14:04.273669,0 days 00:00:01.877477,,0.9,1.0,,LightGBM,,,,,0.7000000000000001,,,,0.12982474845458492,1.9313492790515488e-08,,100.0,,,,,,,,,,30.0,,,,,,,,,COMPLETE,0.0,,,,,,,,,,,,,,,,,,,,
169,169,0.7148975031919421,2023-08-23 19:14:03.754013,2023-08-23 19:14:06.028467,0 days 00:00:02.274454,,0.9,1.0,,LightGBM,,,,,0.7000000000000001,,,,0.1812340341473674,3.967309680781925e-08,,90.0,,,,,,,,,,109.0,,,,,,,,,COMPLETE,0.0,,,,,,,,,,,,,,,,,,,,
