,number,value,datetime_start,datetime_complete,duration,params_alpha,params_bagging_fraction,params_bagging_freq,params_booster,params_classifier,params_colsample_bytree,params_dct_criterion,params_dct_max_depth,params_eta,params_feature_fraction,params_gamma,params_grow_policy,params_lambda,params_lambda_l1,params_lambda_l2,params_max_depth,params_min_child_samples,params_min_child_weight,params_mlp_activation,params_mlp_solver,params_n_layers,params_n_units_l_0,params_n_units_l_1,params_n_units_l_2,params_n_units_l_3,params_normalize_type,params_num_leaves,params_rate_drop,params_rf_estimator,params_rf_max_depth,params_sample_type,params_skip_drop,params_subsample,params_svc_c,params_svc_kernel,state,best_trial,dev_acc,dev_recall_macro,dev_precision_macro,dev_f1_macro,dev_recall_0,dev_precision_0,dev_f1_0,dev_recall_1,dev_precision_1,dev_f1_1,test_acc,test_recall_macro,test_precision_macro,test_f1_macro,test_recall_0,test_precision_0,test_f1_0,test_recall_1,test_precision_1,test_f1_1
216,216,0.6025365401705522,2023-08-23 18:44:06.749073,2023-08-23 18:44:08.075872,0 days 00:00:01.326799,0.08805459269463534,,,gbtree,XGBoost,0.8893116341076936,,,0.02406856070861356,,0.2828709360584061,lossguide,0.0003763926052567072,,,3.0,,2.0,,,,,,,,,,,,,,,0.3219508772318261,,,COMPLETE,0.0,,,,,,,,,,,,,,,,,,,,
217,217,0.5850091684152819,2023-08-23 18:44:07.265980,2023-08-23 18:44:08.678735,0 days 00:00:01.412755,0.1000863578280054,,,dart,XGBoost,0.8604649192877405,,,0.026160122747496052,,0.24071389882517044,lossguide,0.07401747106958308,,,3.0,,10.0,,,,,,,,tree,,9.282647911219886e-06,,,weighted,4.876237674058021e-06,0.3163186869940101,,,COMPLETE,0.0,,,,,,,,,,,,,,,,,,,,
218,218,0.5977010730902974,2023-08-23 18:44:07.640854,2023-08-23 18:44:08.753635,0 days 00:00:01.112781,0.08785271196159242,,,gbtree,XGBoost,0.9109207624629632,,,0.038695079874112165,,0.08076994621053868,lossguide,0.0006479884191924971,,,3.0,,6.0,,,,,,,,,,,,,,,0.35102228706830735,,,COMPLETE,0.0,,,,,,,,,,,,,,,,,,,,
219,219,0.5955911973355978,2023-08-23 18:44:07.806616,2023-08-23 18:44:08.886238,0 days 00:00:01.079622,0.041672338283395984,,,gbtree,XGBoost,0.8578227624983377,,,0.04226667008886464,,0.07023169190387146,lossguide,0.0005998191612358081,,,3.0,,9.0,,,,,,,,,,,,,,,0.35555517555440225,,,COMPLETE,0.0,,,,,,,,,,,,,,,,,,,,
220,220,0.595602899803596,2023-08-23 18:44:08.047313,2023-08-23 18:44:09.045606,0 days 00:00:00.998293,0.04042667011860144,,,gbtree,XGBoost,0.9156163898197545,,,0.0041524781627452455,,0.07559215873623051,lossguide,0.0005589623345246685,,,3.0,,6.0,,,,,,,,,,,,,,,0.3525796246692805,,,COMPLETE,0.0,,,,,,,,,,,,,,,,,,,,
221,221,0.6008787801683111,2023-08-23 18:44:08.168995,2023-08-23 18:44:09.353276,0 days 00:00:01.184281,0.03756820001364086,,,gbtree,XGBoost,0.8618449599426405,,,0.04813731787793945,,0.2963861217896042,lossguide,0.0005123749517224022,,,3.0,,10.0,,,,,,,,,,,,,,,0.317327927160924,,,COMPLETE,0.0,,,,,,,,,,,,,,,,,,,,
222,222,0.6029592201905216,2023-08-23 18:44:08.842994,2023-08-23 18:44:09.955596,0 days 00:00:01.112602,0.042372540107072865,,,gbtree,XGBoost,0.8592315522845497,,,0.042664064172769786,,0.4711874916921635,lossguide,0.00040305562390688545,,,3.0,,2.0,,,,,,,,,,,,,,,0.32441066497041093,,,COMPLETE,0.0,,,,,,,,,,,,,,,,,,,,
223,223,0.6019788046193959,2023-08-23 18:44:08.851543,2023-08-23 18:44:09.863564,0 days 00:00:01.012021,0.04560443350192911,,,gbtree,XGBoost,0.8630969138681723,,,0.046638140473926615,,0.44470283109908754,lossguide,0.0003547975650026823,,,3.0,,2.0,,,,,,,,,,,,,,,0.32198815306352635,,,COMPLETE,0.0,,,,,,,,,,,,,,,,,,,,
224,224,0.599529085242396,2023-08-23 18:44:09.000522,2023-08-23 18:44:10.344052,0 days 00:00:01.343530,0.14423147815157109,,,gbtree,XGBoost,0.72239893560684,,,0.018233228155820153,,0.44280608139256633,lossguide,0.0003790080739272867,,,3.0,,2.0,,,,,,,,,,,,,,,0.3264903286156508,,,COMPLETE,0.0,,,,,,,,,,,,,,,,,,,,
225,225,0.5917636080426085,2023-08-23 18:44:09.119952,2023-08-23 18:44:10.438058,0 days 00:00:01.318106,0.13234835355323463,,,gbtree,XGBoost,0.7085019234322367,,,0.008151845735646285,,0.4300485566643865,lossguide,0.0003476566401660092,,,3.0,,2.0,,,,,,,,,,,,,,,0.3203356476708479,,,COMPLETE,0.0,,,,,,,,,,,,,,,,,,,,
226,226,0.5945339059605106,2023-08-23 18:44:09.500224,2023-08-23 18:44:10.781310,0 days 00:00:01.281086,0.13890993009527108,,,gbtree,XGBoost,0.9846883681406429,,,0.0532731444152699,,0.2575362117656581,lossguide,0.00040861597644640965,,,3.0,,10.0,,,,,,,,,,,,,,,0.3181018153532407,,,COMPLETE,0.0,,,,,,,,,,,,,,,,,,,,
227,227,0.6023155992318987,2023-08-23 18:44:10.042389,2023-08-23 18:44:11.319066,0 days 00:00:01.276677,0.02243092856333729,,,gbtree,XGBoost,0.8414536607832821,,,0.07055883343205849,,0.299153529225963,lossguide,0.000362850112287122,,,3.0,,10.0,,,,,,,,,,,,,,,0.3227740971813957,,,COMPLETE,0.0,,,,,,,,,,,,,,,,,,,,
228,228,0.5959420019717391,2023-08-23 18:44:10.055519,2023-08-23 18:44:11.097672,0 days 00:00:01.042153,0.020813449116406663,,,gbtree,XGBoost,0.8330223723722596,,,0.05233117672109999,,0.2666860768762337,lossguide,0.00032265518391511695,,,3.0,,10.0,,,,,,,,,,,,,,,0.3180461497913447,,,COMPLETE,0.0,,,,,,,,,,,,,,,,,,,,
229,229,0.601326972498508,2023-08-23 18:44:10.428389,2023-08-23 18:44:11.574703,0 days 00:00:01.146314,0.15282817513680122,,,gbtree,XGBoost,0.8362925189197197,,,0.05137560313429476,,0.39921324371431005,lossguide,0.00031092084643966766,,,3.0,,10.0,,,,,,,,,,,,,,,0.32341713232503283,,,COMPLETE,0.0,,,,,,,,,,,,,,,,,,,,
230,230,0.5942649753347428,2023-08-23 18:44:10.507669,2023-08-23 18:44:11.700985,0 days 00:00:01.193316,0.022915875874384654,,,gbtree,XGBoost,0.8466573145990456,,,0.057536718155779605,,0.252548689414326,lossguide,0.0002879345807379249,,,3.0,,10.0,,,,,,,,,,,,,,,0.32575329036004697,,,COMPLETE,0.0,,,,,,,,,,,,,,,,,,,,
231,231,0.596570395405003,2023-08-23 18:44:10.861145,2023-08-23 18:44:11.972967,0 days 00:00:01.111822,0.01778446866792407,,,gbtree,XGBoost,0.8443963380977081,,,0.05997917418898019,,0.46241033217159383,lossguide,0.0002810203276811678,,,3.0,,2.0,,,,,,,,,,,,,,,0.3292375545916387,,,COMPLETE,0.0,,,,,,,,,,,,,,,,,,,,
232,232,0.5935616456235399,2023-08-23 18:44:11.244223,2023-08-23 18:44:12.668537,0 days 00:00:01.424314,0.04868646386565673,,,gbtree,XGBoost,0.8509337165008006,,,0.06726939301059637,,0.46059190494374996,lossguide,0.00014679256725995708,,,3.0,,2.0,,,,,,,,,,,,,,,0.33977734664393966,,,COMPLETE,0.0,,,,,,,,,,,,,,,,,,,,
233,233,0.3357921744708146,2023-08-23 18:44:11.450906,2023-08-23 18:44:15.658551,0 days 00:00:04.207645,,,,,SVC,,,,,,,,,,,,,,,,,,,,,,,,,,,,,0.02818303897812828,linear,COMPLETE,0.0,,,,,,,,,,,,,,,,,,,,
234,234,0.5636231127763376,2023-08-23 18:44:11.658592,2023-08-23 18:44:12.247708,0 days 00:00:00.589116,,,,,DecisionTreeClassifier,,log_loss,11.0,,,,,,,,,,,,,,,,,,,,,,,,,,,,COMPLETE,0.0,,,,,,,,,,,,,,,,,,,,
235,235,0.5903559458055988,2023-08-23 18:44:11.804613,2023-08-23 18:44:13.087369,0 days 00:00:01.282756,0.047994433551260304,,,gbtree,XGBoost,0.8654442590369995,,,0.07228743024930152,,0.43848597700015524,lossguide,0.00014543125849528733,,,3.0,,10.0,,,,,,,,,,,,,,,0.3374978269402164,,,COMPLETE,0.0,,,,,,,,,,,,,,,,,,,,
236,236,0.5703506683574291,2023-08-23 18:44:12.103579,2023-08-23 18:44:12.759072,0 days 00:00:00.655493,,,,,DecisionTreeClassifier,,log_loss,10.0,,,,,,,,,,,,,,,,,,,,,,,,,,,,COMPLETE,0.0,,,,,,,,,,,,,,,,,,,,
237,237,0.489463248861578,2023-08-23 18:44:12.346524,2023-08-23 18:44:18.858185,0 days 00:00:06.511661,,,,,SVC,,,,,,,,,,,,,,,,,,,,,,,,,,,,,711.5025870418572,linear,COMPLETE,0.0,,,,,,,,,,,,,,,,,,,,
238,238,0.3357921744708146,2023-08-23 18:44:12.745639,2023-08-23 18:44:17.073106,0 days 00:00:04.327467,,,,,SVC,,,,,,,,,,,,,,,,,,,,,,,,,,,,,0.03761589624608333,linear,COMPLETE,0.0,,,,,,,,,,,,,,,,,,,,
239,239,0.5927419430899676,2023-08-23 18:44:12.846942,2023-08-23 18:44:13.615970,0 days 00:00:00.769028,0.03479734347848008,,,gbtree,XGBoost,0.822239222071492,,,0.0811742373740133,,0.17533476177112858,lossguide,0.0005092945720185159,,,3.0,,10.0,,,,,,,,,,,,,,,0.3041295539048833,,,COMPLETE,0.0,,,,,,,,,,,,,,,,,,,,
240,240,0.3357921744708146,2023-08-23 18:44:13.010681,2023-08-23 18:44:16.950260,0 days 00:00:03.939579,,,,,SVC,,,,,,,,,,,,,,,,,,,,,,,,,,,,,0.035214227939197776,linear,COMPLETE,0.0,,,,,,,,,,,,,,,,,,,,
241,241,0.3357921744708146,2023-08-23 18:44:13.226470,2023-08-23 18:44:17.508406,0 days 00:00:04.281936,,,,,SVC,,,,,,,,,,,,,,,,,,,,,,,,,,,,,0.02489630893355479,linear,COMPLETE,0.0,,,,,,,,,,,,,,,,,,,,
242,242,0.3357921744708146,2023-08-23 18:44:13.698835,2023-08-23 18:44:17.814735,0 days 00:00:04.115900,,,,,SVC,,,,,,,,,,,,,,,,,,,,,,,,,,,,,0.018711801361110992,linear,COMPLETE,0.0,,,,,,,,,,,,,,,,,,,,
243,243,0.5855452595774924,2023-08-23 18:44:15.805342,2023-08-23 18:44:16.268875,0 days 00:00:00.463533,0.07107413156748855,,,gbtree,XGBoost,0.8646701889143317,,,0.019766639966672772,,0.32553504758816615,lossguide,0.0010383940106714026,,,3.0,,10.0,,,,,,,,,,,,,,,0.3021240841705083,,,COMPLETE,0.0,,,,,,,,,,,,,,,,,,,,
244,244,0.5935557006672909,2023-08-23 18:44:16.210602,2023-08-23 18:44:16.839003,0 days 00:00:00.628401,0.06785753612624851,,,gbtree,XGBoost,0.8613068538747833,,,0.019886974428542648,,0.28481758888678604,depthwise,0.0009131943812035592,,,3.0,,10.0,,,,,,,,,,,,,,,0.29101269841643,,,COMPLETE,0.0,,,,,,,,,,,,,,,,,,,,
245,245,0.5955032326000068,2023-08-23 18:44:16.384627,2023-08-23 18:44:16.749053,0 days 00:00:00.364426,0.0306858162769986,,,gbtree,XGBoost,0.8173782394996385,,,0.022707178105982804,,0.18725106185687881,depthwise,0.0003705156548525339,,,3.0,,10.0,,,,,,,,,,,,,,,0.2918842442874428,,,COMPLETE,0.0,,,,,,,,,,,,,,,,,,,,
246,246,0.6023425499231951,2023-08-23 18:44:16.894408,2023-08-23 18:44:17.707413,0 days 00:00:00.813005,0.10063579744028475,,,gbtree,XGBoost,0.8966011050867092,,,0.041103997732150455,,0.5698875354283804,lossguide,0.00025160077833304064,,,3.0,,2.0,,,,,,,,,,,,,,,0.3080122977047951,,,COMPLETE,0.0,,,,,,,,,,,,,,,,,,,,
247,247,0.5959406648890571,2023-08-23 18:44:16.907294,2023-08-23 18:44:17.913336,0 days 00:00:01.006042,0.0025931072389461535,,,gbtree,XGBoost,0.8940454295930159,,,0.0946635013413371,,0.0056251790097342465,lossguide,0.0002465233847808465,,,3.0,,2.0,,,,,,,,,,,,,,,0.31074098165454017,,,COMPLETE,0.0,,,,,,,,,,,,,,,,,,,,
248,248,0.596718658128369,2023-08-23 18:44:17.021898,2023-08-23 18:44:18.011995,0 days 00:00:00.990097,0.15942773190226583,,,gbtree,XGBoost,0.829915696755137,,,0.03755364870522522,,0.6289356277709598,lossguide,0.0004338563743238692,,,3.0,,2.0,,,,,,,,,,,,,,,0.32109378332433464,,,COMPLETE,0.0,,,,,,,,,,,,,,,,,,,,
249,249,0.604938875687068,2023-08-23 18:44:17.172499,2023-08-23 18:44:18.111329,0 days 00:00:00.938830,0.15884654338617685,,,gbtree,XGBoost,0.893758351965392,,,0.09856774813293455,,0.603278332290722,lossguide,0.0002369763409964257,,,3.0,,2.0,,,,,,,,,,,,,,,0.32387600632480706,,,COMPLETE,0.0,,,,,,,,,,,,,,,,,,,,
