,number,value,datetime_start,datetime_complete,duration,params_alpha,params_bagging_fraction,params_bagging_freq,params_booster,params_classifier,params_colsample_bytree,params_dct_criterion,params_dct_max_depth,params_eta,params_feature_fraction,params_gamma,params_grow_policy,params_lambda,params_lambda_l1,params_lambda_l2,params_max_depth,params_min_child_samples,params_min_child_weight,params_mlp_activation,params_mlp_solver,params_n_layers,params_n_units_l_0,params_n_units_l_1,params_n_units_l_2,params_n_units_l_3,params_normalize_type,params_num_leaves,params_rate_drop,params_rf_estimator,params_rf_max_depth,params_sample_type,params_skip_drop,params_subsample,params_svc_c,params_svc_kernel,state,best_trial,dev_acc,dev_recall_macro,dev_precision_macro,dev_f1_macro,dev_recall_0,dev_precision_0,dev_f1_0,dev_recall_1,dev_precision_1,dev_f1_1,test_acc,test_recall_macro,test_precision_macro,test_f1_macro,test_recall_0,test_precision_0,test_f1_0,test_recall_1,test_precision_1,test_f1_1
173,173,0.6657552163505044,2023-08-23 18:59:53.124690,2023-08-23 18:59:54.615654,0 days 00:00:01.490964,,1.0,2.0,,LightGBM,,,,,0.4,,,,0.00023831303905110196,0.0006445439117590301,,90.0,,,,,,,,,,21.0,,,,,,,,,COMPLETE,0.0,,,,,,,,,,,,,,,,,,,,
174,174,0.6622850452147782,2023-08-23 18:59:53.885931,2023-08-23 18:59:55.485582,0 days 00:00:01.599651,,1.0,2.0,,LightGBM,,,,,0.4,,,,0.00022351715923275964,0.0006791865999761502,,90.0,,,,,,,,,,22.0,,,,,,,,,COMPLETE,0.0,,,,,,,,,,,,,,,,,,,,
175,175,0.6691897727921947,2023-08-23 18:59:53.894471,2023-08-23 18:59:55.562520,0 days 00:00:01.668049,,1.0,2.0,,LightGBM,,,,,0.4,,,,0.00025780425626450033,0.0006143172176367114,,90.0,,,,,,,,,,23.0,,,,,,,,,COMPLETE,0.0,,,,,,,,,,,,,,,,,,,,
176,176,0.6561065120331655,2023-08-23 18:59:54.048986,2023-08-23 18:59:55.776200,0 days 00:00:01.727214,,1.0,2.0,,LightGBM,,,,,0.4,,,,6.569509138373474e-05,0.000519700308460199,,100.0,,,,,,,,,,30.0,,,,,,,,,COMPLETE,0.0,,,,,,,,,,,,,,,,,,,,
177,177,0.6571032134695209,2023-08-23 18:59:54.524761,2023-08-23 18:59:56.262519,0 days 00:00:01.737758,,1.0,2.0,,LightGBM,,,,,0.4,,,,0.000239627812236027,0.0004673935011300676,,100.0,,,,,,,,,,33.0,,,,,,,,,COMPLETE,0.0,,,,,,,,,,,,,,,,,,,,
178,178,0.6585566116956143,2023-08-23 18:59:54.689132,2023-08-23 18:59:56.537839,0 days 00:00:01.848707,,1.0,2.0,,LightGBM,,,,,0.4,,,,0.0002690850202392104,0.0006284646919583954,,100.0,,,,,,,,,,34.0,,,,,,,,,COMPLETE,0.0,,,,,,,,,,,,,,,,,,,,
179,179,0.670170409300844,2023-08-23 18:59:54.774317,2023-08-23 18:59:56.453272,0 days 00:00:01.678955,,1.0,2.0,,LightGBM,,,,,0.4,,,,0.0002320012363783641,0.0005897555669504686,,90.0,,,,,,,,,,30.0,,,,,,,,,COMPLETE,1.0,0.6702076291646547,0.670172311515043,0.6701688196614279,0.670170409300844,0.6669921875,0.6663414634146342,0.6666666666666666,0.673352435530086,0.6739961759082218,0.6736741519350214,0.6595744680851063,0.657731764445433,0.6581504178681292,0.6578826855478348,0.6274961597542242,0.640282131661442,0.6338246702870443,0.6879673691366417,0.6760187040748163,0.6819407008086255
180,180,0.6508607272093887,2023-08-23 18:59:55.649090,2023-08-23 18:59:57.626172,0 days 00:00:01.977082,,0.9,2.0,,LightGBM,,,,,0.4,,,,0.0003105941224488704,0.0004533008997523701,,100.0,,,,,,,,,,34.0,,,,,,,,,COMPLETE,0.0,,,,,,,,,,,,,,,,,,,,
181,181,0.6623682216402335,2023-08-23 18:59:55.675327,2023-08-23 18:59:57.374327,0 days 00:00:01.699000,,0.9,2.0,,LightGBM,,,,,0.4,,,,0.0003694178766868936,0.0004435102961635112,,100.0,,,,,,,,,,32.0,,,,,,,,,COMPLETE,0.0,,,,,,,,,,,,,,,,,,,,
182,182,0.6532648153951767,2023-08-23 18:59:55.859086,2023-08-23 18:59:57.489837,0 days 00:00:01.630751,,0.9,2.0,,LightGBM,,,,,0.4,,,,0.0003784517819409659,0.0004360410781635271,,90.0,,,,,,,,,,27.0,,,,,,,,,COMPLETE,0.0,,,,,,,,,,,,,,,,,,,,
183,183,0.6599070309044799,2023-08-23 18:59:56.332946,2023-08-23 18:59:57.843489,0 days 00:00:01.510543,,1.0,2.0,,LightGBM,,,,,0.4,,,,0.0003377300756334697,0.0022391888629215992,,90.0,,,,,,,,,,24.0,,,,,,,,,COMPLETE,0.0,,,,,,,,,,,,,,,,,,,,
184,184,0.6571032134695209,2023-08-23 18:59:56.620198,2023-08-23 18:59:58.219719,0 days 00:00:01.599521,,0.9,2.0,,LightGBM,,,,,0.4,,,,0.00046305024941607054,0.00034932177614729296,,90.0,,,,,,,,,,26.0,,,,,,,,,COMPLETE,0.0,,,,,,,,,,,,,,,,,,,,
185,185,0.6633945571330797,2023-08-23 18:59:56.683987,2023-08-23 18:59:58.364786,0 days 00:00:01.680799,,0.9,2.0,,LightGBM,,,,,0.4,,,,0.000506165447706626,0.00031047702189278595,,90.0,,,,,,,,,,25.0,,,,,,,,,COMPLETE,0.0,,,,,,,,,,,,,,,,,,,,
186,186,0.6537177765376652,2023-08-23 18:59:57.437833,2023-08-23 18:59:59.642564,0 days 00:00:02.204731,,1.0,2.0,,LightGBM,,,,,0.4,,,,7.908548177437112e-05,0.002473129917069401,,80.0,,,,,,,,,,41.0,,,,,,,,,COMPLETE,0.0,,,,,,,,,,,,,,,,,,,,
187,187,0.662791077420342,2023-08-23 18:59:57.568346,2023-08-23 18:59:58.935202,0 days 00:00:01.366856,,1.0,2.0,,LightGBM,,,,,0.4,,,,8.902970398471411e-05,0.00029181985560148297,,90.0,,,,,,,,,,17.0,,,,,,,,,COMPLETE,0.0,,,,,,,,,,,,,,,,,,,,
188,188,0.664708489632906,2023-08-23 18:59:57.712492,2023-08-23 18:59:59.117884,0 days 00:00:01.405392,,1.0,2.0,,LightGBM,,,,,0.4,,,,9.303356090064277e-05,0.002107135529932012,,90.0,,,,,,,,,,18.0,,,,,,,,,COMPLETE,0.0,,,,,,,,,,,,,,,,,,,,
189,189,0.6685252691543849,2023-08-23 18:59:57.932668,2023-08-23 18:59:59.403960,0 days 00:00:01.471292,,1.0,2.0,,LightGBM,,,,,0.4,,,,9.645199520128084e-05,0.0008029087370659262,,90.0,,,,,,,,,,16.0,,,,,,,,,COMPLETE,0.0,,,,,,,,,,,,,,,,,,,,
190,190,0.664708489632906,2023-08-23 18:59:58.304498,2023-08-23 19:00:00.011643,0 days 00:00:01.707145,,1.0,2.0,,LightGBM,,,,,0.4,,,,9.013221263401268e-05,0.0008046871723888804,,90.0,,,,,,,,,,18.0,,,,,,,,,COMPLETE,0.0,,,,,,,,,,,,,,,,,,,,
191,191,0.5912598755286702,2023-08-23 18:59:58.468607,2023-08-23 18:59:58.722254,0 days 00:00:00.253647,,,,,DecisionTreeClassifier,,entropy,4.0,,,,,,,,,,,,,,,,,,,,,,,,,,,,COMPLETE,0.0,,,,,,,,,,,,,,,,,,,,
192,192,0.662791077420342,2023-08-23 18:59:58.800897,2023-08-23 19:00:00.506347,0 days 00:00:01.705450,,1.0,2.0,,LightGBM,,,,,0.4,,,,8.249527948741501e-05,0.0009002427906879207,,90.0,,,,,,,,,,17.0,,,,,,,,,COMPLETE,0.0,,,,,,,,,,,,,,,,,,,,
193,193,0.3357921744708146,2023-08-23 18:59:59.012015,2023-08-23 19:00:00.229880,0 days 00:00:01.217865,,,,,MLPClassifier,,,,,,,,,,,,,,tanh,lbfgs,1.0,40.0,,,,,,,,,,,,,,COMPLETE,0.0,,,,,,,,,,,,,,,,,,,,
194,194,0.3357921744708146,2023-08-23 18:59:59.215693,2023-08-23 19:00:00.313236,0 days 00:00:01.097543,,,,,MLPClassifier,,,,,,,,,,,,,,tanh,lbfgs,1.0,40.0,,,,,,,,,,,,,,COMPLETE,0.0,,,,,,,,,,,,,,,,,,,,
195,195,0.3357921744708146,2023-08-23 18:59:59.468176,2023-08-23 19:00:00.719648,0 days 00:00:01.251472,,,,,MLPClassifier,,,,,,,,,,,,,,tanh,lbfgs,1.0,40.0,,,,,,,,,,,,,,COMPLETE,0.0,,,,,,,,,,,,,,,,,,,,
196,196,0.3357921744708146,2023-08-23 18:59:59.730459,2023-08-23 19:00:00.585392,0 days 00:00:00.854933,,,,,MLPClassifier,,,,,,,,,,,,,,tanh,lbfgs,1.0,40.0,,,,,,,,,,,,,,COMPLETE,0.0,,,,,,,,,,,,,,,,,,,,
197,197,0.6685252691543849,2023-08-23 19:00:00.131169,2023-08-23 19:00:02.271789,0 days 00:00:02.140620,,1.0,2.0,,LightGBM,,,,,0.4,,,,4.081120994763113e-05,0.0007218979480014749,,90.0,,,,,,,,,,16.0,,,,,,,,,COMPLETE,0.0,,,,,,,,,,,,,,,,,,,,
198,198,0.662791077420342,2023-08-23 19:00:00.429222,2023-08-23 19:00:02.069433,0 days 00:00:01.640211,,1.0,2.0,,LightGBM,,,,,0.4,,,,6.288660763702585e-05,0.0006737354376058846,,90.0,,,,,,,,,,17.0,,,,,,,,,COMPLETE,0.0,,,,,,,,,,,,,,,,,,,,
199,199,0.664708489632906,2023-08-23 19:00:00.433222,2023-08-23 19:00:02.143193,0 days 00:00:01.709971,,1.0,2.0,,LightGBM,,,,,0.4,,,,5.327900923349379e-05,0.00238421057018062,,90.0,,,,,,,,,,18.0,,,,,,,,,COMPLETE,0.0,,,,,,,,,,,,,,,,,,,,
200,200,0.6534167892621096,2023-08-23 19:00:00.666335,2023-08-23 19:00:01.477415,0 days 00:00:00.811080,,1.0,2.0,,LightGBM,,,,,0.4,,,,4.330959594141459e-05,0.0007493904939608432,,80.0,,,,,,,,,,2.0,,,,,,,,,COMPLETE,0.0,,,,,,,,,,,,,,,,,,,,
201,201,0.6534167892621096,2023-08-23 19:00:00.679893,2023-08-23 19:00:01.559195,0 days 00:00:00.879302,,1.0,2.0,,LightGBM,,,,,0.4,,,,4.629469932485904e-05,0.0007773526263567137,,80.0,,,,,,,,,,2.0,,,,,,,,,COMPLETE,0.0,,,,,,,,,,,,,,,,,,,,
202,202,0.6566958790711053,2023-08-23 19:00:00.858425,2023-08-23 19:00:01.744792,0 days 00:00:00.886367,,1.0,2.0,,LightGBM,,,,,0.4,,,,4.966400007951629e-05,0.0008974898635939784,,80.0,,,,,,,,,,3.0,,,,,,,,,COMPLETE,0.0,,,,,,,,,,,,,,,,,,,,
203,203,0.662791077420342,2023-08-23 19:00:01.629252,2023-08-23 19:00:03.442683,0 days 00:00:01.813431,,1.0,2.0,,LightGBM,,,,,0.4,,,,2.990371185855547e-05,0.0019440013105572332,,90.0,,,,,,,,,,17.0,,,,,,,,,COMPLETE,0.0,,,,,,,,,,,,,,,,,,,,
204,204,0.664708489632906,2023-08-23 19:00:01.638879,2023-08-23 19:00:03.115097,0 days 00:00:01.476218,,1.0,2.0,,LightGBM,,,,,0.4,,,,3.175998720410888e-05,0.002063222738331379,,90.0,,,,,,,,,,18.0,,,,,,,,,COMPLETE,0.0,,,,,,,,,,,,,,,,,,,,
205,205,0.662791077420342,2023-08-23 19:00:01.831161,2023-08-23 19:00:03.351926,0 days 00:00:01.520765,,1.0,2.0,,LightGBM,,,,,0.4,,,,0.00021494066820139333,0.002073642651578079,,90.0,,,,,,,,,,17.0,,,,,,,,,COMPLETE,0.0,,,,,,,,,,,,,,,,,,,,
206,206,0.6657552163505044,2023-08-23 19:00:02.206816,2023-08-23 19:00:03.721712,0 days 00:00:01.514896,,1.0,2.0,,LightGBM,,,,,0.4,,,,0.00020035080925084734,0.00196043611183354,,90.0,,,,,,,,,,21.0,,,,,,,,,COMPLETE,0.0,,,,,,,,,,,,,,,,,,,,
207,207,0.664360426409599,2023-08-23 19:00:02.224984,2023-08-23 19:00:04.109249,0 days 00:00:01.884265,,1.0,2.0,,LightGBM,,,,,0.4,,,,2.5610274660211164e-05,0.0030301624780251423,,90.0,,,,,,,,,,21.0,,,,,,,,,COMPLETE,0.0,,,,,,,,,,,,,,,,,,,,
208,208,0.6619232850133393,2023-08-23 19:00:02.333655,2023-08-23 19:00:03.911299,0 days 00:00:01.577644,,1.0,2.0,,LightGBM,,,,,0.4,,,,3.0926069384327644e-05,0.0021362471083650834,,90.0,,,,,,,,,,20.0,,,,,,,,,COMPLETE,0.0,,,,,,,,,,,,,,,,,,,,
209,209,0.6541958172422156,2023-08-23 19:00:03.187264,2023-08-23 19:00:04.833565,0 days 00:00:01.646301,,1.0,2.0,,LightGBM,,,,,1.0,,,,0.00022623455360896863,0.002388035001137783,,90.0,,,,,,,,,,21.0,,,,,,,,,COMPLETE,0.0,,,,,,,,,,,,,,,,,,,,
210,210,0.6622850452147782,2023-08-23 19:00:03.417553,2023-08-23 19:00:05.058042,0 days 00:00:01.640489,,1.0,2.0,,LightGBM,,,,,0.4,,,,2.6021514010307503e-05,0.0029507555596013924,,90.0,,,,,,,,,,22.0,,,,,,,,,COMPLETE,0.0,,,,,,,,,,,,,,,,,,,,
211,211,0.6622850452147782,2023-08-23 19:00:03.529082,2023-08-23 19:00:05.306992,0 days 00:00:01.777910,,1.0,2.0,,LightGBM,,,,,0.4,,,,9.598886011254152e-05,0.003035978512358264,,90.0,,,,,,,,,,22.0,,,,,,,,,COMPLETE,0.0,,,,,,,,,,,,,,,,,,,,
212,212,0.6622850452147782,2023-08-23 19:00:03.821122,2023-08-23 19:00:05.518654,0 days 00:00:01.697532,,1.0,2.0,,LightGBM,,,,,0.4,,,,9.557829181163026e-05,0.0021326184901997764,,90.0,,,,,,,,,,22.0,,,,,,,,,COMPLETE,0.0,,,,,,,,,,,,,,,,,,,,
213,213,0.6522736812648664,2023-08-23 19:00:03.997627,2023-08-23 19:00:06.113523,0 days 00:00:02.115896,,1.0,2.0,,LightGBM,,,,,0.9,,,,9.488408336771588e-05,0.0028180316448950878,,90.0,,,,,,,,,,42.0,,,,,,,,,COMPLETE,0.0,,,,,,,,,,,,,,,,,,,,
214,214,0.6474125755396221,2023-08-23 19:00:04.186220,2023-08-23 19:00:06.383434,0 days 00:00:02.197214,,1.0,2.0,,LightGBM,,,,,0.9,,,,8.542524369349728e-05,0.002897099109913435,,90.0,,,,,,,,,,40.0,,,,,,,,,COMPLETE,0.0,,,,,,,,,,,,,,,,,,,,
215,215,0.6585871841452805,2023-08-23 19:00:04.930632,2023-08-23 19:00:06.611193,0 days 00:00:01.680561,,1.0,2.0,,LightGBM,,,,,0.4,,,,9.685169517224651e-05,0.003176614845583443,,90.0,,,,,,,,,,27.0,,,,,,,,,COMPLETE,0.0,,,,,,,,,,,,,,,,,,,,
216,216,0.6662323907773982,2023-08-23 19:00:05.179351,2023-08-23 19:00:07.014585,0 days 00:00:01.835234,,1.0,2.0,,LightGBM,,,,,0.4,,,,6.767193517985915e-05,0.00302445382016855,,90.0,,,,,,,,,,38.0,,,,,,,,,COMPLETE,0.0,,,,,,,,,,,,,,,,,,,,
217,217,0.6570609878740725,2023-08-23 19:00:05.425774,2023-08-23 19:00:07.556723,0 days 00:00:02.130949,,1.0,2.0,,LightGBM,,,,,0.4,,,,8.274636329204746e-05,0.0008112511461361199,,90.0,,,,,,,,,,41.0,,,,,,,,,COMPLETE,0.0,,,,,,,,,,,,,,,,,,,,
218,218,0.6662323907773982,2023-08-23 19:00:05.586148,2023-08-23 19:00:07.652918,0 days 00:00:02.066770,,1.0,2.0,,LightGBM,,,,,0.4,,,,0.00019617972568281228,0.0008419191244656817,,90.0,,,,,,,,,,38.0,,,,,,,,,COMPLETE,0.0,,,,,,,,,,,,,,,,,,,,
219,219,0.6642176057571828,2023-08-23 19:00:06.245240,2023-08-23 19:00:07.369415,0 days 00:00:01.124175,,1.0,2.0,,LightGBM,,,,,0.4,,,,0.00019392599994562328,0.0008203199020708413,,90.0,,,,,,,,,,13.0,,,,,,,,,COMPLETE,0.0,,,,,,,,,,,,,,,,,,,,
220,220,0.6606344537815125,2023-08-23 19:00:06.474747,2023-08-23 19:00:07.836200,0 days 00:00:01.361453,,1.0,2.0,,LightGBM,,,,,0.4,,,,0.00023326131322223,0.0008319633439474743,,90.0,,,,,,,,,,14.0,,,,,,,,,COMPLETE,0.0,,,,,,,,,,,,,,,,,,,,
221,221,0.6606344537815125,2023-08-23 19:00:06.695625,2023-08-23 19:00:08.235510,0 days 00:00:01.539885,,1.0,2.0,,LightGBM,,,,,0.4,,,,3.626628551970407e-05,0.0008506787877697808,,90.0,,,,,,,,,,14.0,,,,,,,,,COMPLETE,0.0,,,,,,,,,,,,,,,,,,,,
222,222,0.6606344537815125,2023-08-23 19:00:07.097756,2023-08-23 19:00:08.465949,0 days 00:00:01.368193,,1.0,2.0,,LightGBM,,,,,0.4,,,,3.370016302282258e-05,0.0008397894234712036,,90.0,,,,,,,,,,14.0,,,,,,,,,COMPLETE,0.0,,,,,,,,,,,,,,,,,,,,
223,223,0.6685252691543849,2023-08-23 19:00:07.449560,2023-08-23 19:00:08.989365,0 days 00:00:01.539805,,1.0,2.0,,LightGBM,,,,,0.4,,,,3.596950059234385e-05,0.0008945428062001659,,90.0,,,,,,,,,,16.0,,,,,,,,,COMPLETE,0.0,,,,,,,,,,,,,,,,,,,,
224,224,0.6609668392332446,2023-08-23 19:00:07.639679,2023-08-23 19:00:09.433951,0 days 00:00:01.794272,,1.0,2.0,,LightGBM,,,,,0.4,,,,3.790048418145168e-05,0.006366611543864719,,90.0,,,,,,,,,,30.0,,,,,,,,,COMPLETE,0.0,,,,,,,,,,,,,,,,,,,,
225,225,0.670170409300844,2023-08-23 19:00:07.780140,2023-08-23 19:00:09.786913,0 days 00:00:02.006773,,1.0,2.0,,LightGBM,,,,,0.4,,,,1.9734164170461074e-05,0.0002927076935460713,,90.0,,,,,,,,,,30.0,,,,,,,,,COMPLETE,0.0,,,,,,,,,,,,,,,,,,,,
226,226,0.6552350762137117,2023-08-23 19:00:07.919843,2023-08-23 19:00:10.196876,0 days 00:00:02.277033,,1.0,2.0,,LightGBM,,,,,0.4,,,,3.861393707317216e-05,0.0002959997351088359,,90.0,,,,,,,,,,53.0,,,,,,,,,COMPLETE,0.0,,,,,,,,,,,,,,,,,,,,
227,227,0.670170409300844,2023-08-23 19:00:08.313193,2023-08-23 19:00:09.982613,0 days 00:00:01.669420,,1.0,2.0,,LightGBM,,,,,0.4,,,,3.3128185040736354e-05,0.00026425252910999267,,90.0,,,,,,,,,,30.0,,,,,,,,,COMPLETE,0.0,,,,,,,,,,,,,,,,,,,,
228,228,0.6605121489582626,2023-08-23 19:00:08.568517,2023-08-23 19:00:10.594520,0 days 00:00:02.026003,,1.0,2.0,,LightGBM,,,,,0.4,,,,5.927780026646782e-05,0.0002851792612595974,,90.0,,,,,,,,,,29.0,,,,,,,,,COMPLETE,0.0,,,,,,,,,,,,,,,,,,,,
229,229,0.6546518041534652,2023-08-23 19:00:09.073415,2023-08-23 19:00:11.252233,0 days 00:00:02.178818,,1.0,2.0,,LightGBM,,,,,0.4,,,,6.020491637419835e-05,0.0002499629114277649,,90.0,,,,,,,,,,49.0,,,,,,,,,COMPLETE,0.0,,,,,,,,,,,,,,,,,,,,
230,230,0.6546518041534652,2023-08-23 19:00:09.517083,2023-08-23 19:00:12.045978,0 days 00:00:02.528895,,1.0,2.0,,LightGBM,,,,,0.4,,,,2.2010786170409335e-05,0.0005392899117671156,,90.0,,,,,,,,,,49.0,,,,,,,,,COMPLETE,0.0,,,,,,,,,,,,,,,,,,,,
231,231,0.6600098127188507,2023-08-23 19:00:09.850676,2023-08-23 19:00:11.793862,0 days 00:00:01.943186,,1.0,2.0,,LightGBM,,,,,0.4,,,,2.3553511015405623e-05,0.0003533015838325679,,90.0,,,,,,,,,,35.0,,,,,,,,,COMPLETE,0.0,,,,,,,,,,,,,,,,,,,,
232,232,0.6517758674930627,2023-08-23 19:00:10.097560,2023-08-23 19:00:12.465962,0 days 00:00:02.368402,,1.0,2.0,,LightGBM,,,,,0.4,,,,1.842599917117304e-05,0.0001988853321353172,,90.0,,,,,,,,,,46.0,,,,,,,,,COMPLETE,0.0,,,,,,,,,,,,,,,,,,,,
233,233,0.6600098127188507,2023-08-23 19:00:10.272858,2023-08-23 19:00:12.295661,0 days 00:00:02.022803,,1.0,2.0,,LightGBM,,,,,0.4,,,,2.0022395707401002e-05,0.00029166284449973407,,90.0,,,,,,,,,,35.0,,,,,,,,,COMPLETE,0.0,,,,,,,,,,,,,,,,,,,,
234,234,0.5880533236521571,2023-08-23 19:00:10.720803,2023-08-23 19:00:11.147184,0 days 00:00:00.426381,,,,,DecisionTreeClassifier,,gini,26.0,,,,,,,,,,,,,,,,,,,,,,,,,,,,COMPLETE,0.0,,,,,,,,,,,,,,,,,,,,
235,235,0.6556396581450119,2023-08-23 19:00:11.316881,2023-08-23 19:00:13.193482,0 days 00:00:01.876601,,1.0,2.0,,LightGBM,,,,,0.4,,,,1.9061687470426377e-05,0.0005545550647235182,,100.0,,,,,,,,,,36.0,,,,,,,,,COMPLETE,0.0,,,,,,,,,,,,,,,,,,,,
236,236,0.6556396581450119,2023-08-23 19:00:11.422240,2023-08-23 19:00:13.353352,0 days 00:00:01.931112,,1.0,2.0,,LightGBM,,,,,0.4,,,,2.4527455228070464e-05,0.00021477927859369757,,100.0,,,,,,,,,,36.0,,,,,,,,,COMPLETE,0.0,,,,,,,,,,,,,,,,,,,,
237,237,0.6556396581450119,2023-08-23 19:00:11.439381,2023-08-23 19:00:13.789999,0 days 00:00:02.350618,,1.0,2.0,,LightGBM,,,,,0.4,,,,1.7784506869984296e-05,0.00021734978236928482,,100.0,,,,,,,,,,36.0,,,,,,,,,COMPLETE,0.0,,,,,,,,,,,,,,,,,,,,
238,238,0.6585871841452805,2023-08-23 19:00:11.876450,2023-08-23 19:00:13.342509,0 days 00:00:01.466059,,1.0,2.0,,LightGBM,,,,,0.4,,,,2.3768064029681212e-05,0.00019283718507354065,,90.0,,,,,,,,,,27.0,,,,,,,,,COMPLETE,0.0,,,,,,,,,,,,,,,,,,,,
239,239,0.664333187111898,2023-08-23 19:00:12.115449,2023-08-23 19:00:13.873715,0 days 00:00:01.758266,,1.0,2.0,,LightGBM,,,,,0.4,,,,1.8102858579121756e-05,0.00019056319656014534,,90.0,,,,,,,,,,26.0,,,,,,,,,COMPLETE,0.0,,,,,,,,,,,,,,,,,,,,
240,240,0.6585871841452805,2023-08-23 19:00:12.381174,2023-08-23 19:00:14.135131,0 days 00:00:01.753957,,1.0,2.0,,LightGBM,,,,,0.4,,,,1.5122472677851043e-05,0.000590721786306345,,90.0,,,,,,,,,,27.0,,,,,,,,,COMPLETE,0.0,,,,,,,,,,,,,,,,,,,,
241,241,0.6609130686270852,2023-08-23 19:00:12.574225,2023-08-23 19:00:14.377442,0 days 00:00:01.803217,,1.0,2.0,,LightGBM,,,,,0.4,,,,2.7884116732204045e-05,0.0005623078410629235,,90.0,,,,,,,,,,26.0,,,,,,,,,COMPLETE,0.0,,,,,,,,,,,,,,,,,,,,
242,242,0.6430713510273713,2023-08-23 19:00:13.321960,2023-08-23 19:00:15.722194,0 days 00:00:02.400234,,1.0,2.0,,LightGBM,,,,,0.4,,,,1.173632262430918e-05,0.0005397060813075776,,90.0,,,,,,,,,,76.0,,,,,,,,,COMPLETE,0.0,,,,,,,,,,,,,,,,,,,,
243,243,0.6637855267503765,2023-08-23 19:00:13.473302,2023-08-23 19:00:15.118123,0 days 00:00:01.644821,,1.0,2.0,,LightGBM,,,,,0.4,,,,6.0660637665436484e-05,0.001015598665312073,,90.0,,,,,,,,,,24.0,,,,,,,,,COMPLETE,0.0,,,,,,,,,,,,,,,,,,,,
244,244,0.6691897727921947,2023-08-23 19:00:13.479026,2023-08-23 19:00:15.018751,0 days 00:00:01.539725,,1.0,2.0,,LightGBM,,,,,0.4,,,,5.7427862011870464e-05,0.0006042063723411061,,90.0,,,,,,,,,,23.0,,,,,,,,,COMPLETE,0.0,,,,,,,,,,,,,,,,,,,,
245,245,0.6637855267503765,2023-08-23 19:00:13.860572,2023-08-23 19:00:15.652640,0 days 00:00:01.792068,,1.0,2.0,,LightGBM,,,,,0.4,,,,6.245191843829494e-05,0.001038052333972681,,90.0,,,,,,,,,,24.0,,,,,,,,,COMPLETE,0.0,,,,,,,,,,,,,,,,,,,,
246,246,0.6619232850133393,2023-08-23 19:00:13.947560,2023-08-23 19:00:15.492400,0 days 00:00:01.544840,,1.0,2.0,,LightGBM,,,,,0.4,,,,5.2924911407830015e-05,0.0006111355331639332,,90.0,,,,,,,,,,20.0,,,,,,,,,COMPLETE,0.0,,,,,,,,,,,,,,,,,,,,
247,247,0.6430713510273713,2023-08-23 19:00:14.224974,2023-08-23 19:00:16.307010,0 days 00:00:02.082036,,1.0,2.0,,LightGBM,,,,,0.4,,,,5.963131101326834e-05,0.0011422266586555343,,90.0,,,,,,,,,,76.0,,,,,,,,,COMPLETE,0.0,,,,,,,,,,,,,,,,,,,,
248,248,0.6622850452147782,2023-08-23 19:00:14.502084,2023-08-23 19:00:16.079806,0 days 00:00:01.577722,,1.0,2.0,,LightGBM,,,,,0.4,,,,5.1546702591316375e-05,0.0010965151426439788,,90.0,,,,,,,,,,22.0,,,,,,,,,COMPLETE,0.0,,,,,,,,,,,,,,,,,,,,
249,249,0.6550459100834218,2023-08-23 19:00:15.093175,2023-08-23 19:00:16.181599,0 days 00:00:01.088424,,1.0,2.0,,LightGBM,,,,,0.4,,,,5.281848252398441e-05,0.0011873294231979352,,90.0,,,,,,,,,,19.0,,,,,,,,,COMPLETE,0.0,,,,,,,,,,,,,,,,,,,,
