,number,value,datetime_start,datetime_complete,duration,params_alpha,params_bagging_fraction,params_bagging_freq,params_booster,params_classifier,params_colsample_bytree,params_dct_criterion,params_dct_max_depth,params_eta,params_feature_fraction,params_gamma,params_grow_policy,params_lambda,params_lambda_l1,params_lambda_l2,params_max_depth,params_min_child_samples,params_min_child_weight,params_mlp_activation,params_mlp_solver,params_n_layers,params_n_units_l_0,params_n_units_l_1,params_n_units_l_2,params_n_units_l_3,params_normalize_type,params_num_leaves,params_rate_drop,params_rf_estimator,params_rf_max_depth,params_sample_type,params_skip_drop,params_subsample,params_svc_c,params_svc_kernel,state,best_trial,dev_acc,dev_recall_macro,dev_precision_macro,dev_f1_macro,dev_recall_0,dev_precision_0,dev_f1_0,dev_recall_1,dev_precision_1,dev_f1_1,test_acc,test_recall_macro,test_precision_macro,test_f1_macro,test_recall_0,test_precision_0,test_f1_0,test_recall_1,test_precision_1,test_f1_1
0,0,0.3573487031700288,2023-08-23 14:39:34.582537,2023-08-23 14:39:36.581512,0 days 00:00:01.998975,,,,,MLPClassifier,,,,,,,,,,,,,,logistic,lbfgs,2.0,90.0,40.0,,,,,,,,,,,,,COMPLETE,0.0,,,,,,,,,,,,,,,,,,,,
1,1,0.5670380846375516,2023-08-23 14:39:34.585659,2023-08-23 14:39:40.209313,0 days 00:00:05.623654,,,,,RandomForestClassifier,,,,,,,,,,,,,,,,,,,,,,,,44.0,30.0,,,,,,COMPLETE,0.0,,,,,,,,,,,,,,,,,,,,
2,2,0.5367568440392596,2023-08-23 14:39:34.586712,2023-08-23 14:39:38.263559,0 days 00:00:03.676847,,,,,RandomForestClassifier,,,,,,,,,,,,,,,,,,,,,,,,59.0,6.0,,,,,,COMPLETE,0.0,,,,,,,,,,,,,,,,,,,,
3,3,0.5308341673856773,2023-08-23 14:39:34.591812,2023-08-23 14:39:34.741562,0 days 00:00:00.149750,,,,,DecisionTreeClassifier,,gini,3.0,,,,,,,,,,,,,,,,,,,,,,,,,,,,COMPLETE,0.0,,,,,,,,,,,,,,,,,,,,
4,4,0.38853512050163197,2023-08-23 14:39:34.595031,2023-08-23 14:39:35.314432,0 days 00:00:00.719401,2.8535285796821414e-06,,,gblinear,XGBoost,0.3585183240079859,,,,,,,0.0001344063131062641,,,,,,,,,,,,,,,,,,,,0.8116606363926919,,,COMPLETE,0.0,,,,,,,,,,,,,,,,,,,,
5,5,0.39249241151375613,2023-08-23 14:39:34.597293,2023-08-23 14:41:47.935269,0 days 00:02:13.337976,,,,,MLPClassifier,,,,,,,,,,,,,,logistic,adam,1.0,70.0,,,,,,,,,,,,,,COMPLETE,0.0,,,,,,,,,,,,,,,,,,,,
6,6,0.3573487031700288,2023-08-23 14:39:34.600584,2023-08-23 14:39:42.271077,0 days 00:00:07.670493,,,,,SVC,,,,,,,,,,,,,,,,,,,,,,,,,,,,,0.14892457601488454,poly,COMPLETE,0.0,,,,,,,,,,,,,,,,,,,,
7,7,0.3919693258067952,2023-08-23 14:39:34.605293,2023-08-23 14:39:36.433566,0 days 00:00:01.828273,,,,,RandomForestClassifier,,,,,,,,,,,,,,,,,,,,,,,,70.0,2.0,,,,,,COMPLETE,0.0,,,,,,,,,,,,,,,,,,,,
8,8,0.3573487031700288,2023-08-23 14:39:34.864628,2023-08-23 14:39:44.067221,0 days 00:00:09.202593,,,,,SVC,,,,,,,,,,,,,,,,,,,,,,,,,,,,,0.043635643174840116,rbf,COMPLETE,0.0,,,,,,,,,,,,,,,,,,,,
9,9,0.549382016967334,2023-08-23 14:39:35.404559,2023-08-23 14:39:35.692705,0 days 00:00:00.288146,,,,,DecisionTreeClassifier,,gini,13.0,,,,,,,,,,,,,,,,,,,,,,,,,,,,COMPLETE,0.0,,,,,,,,,,,,,,,,,,,,
10,10,0.3573487031700288,2023-08-23 14:39:35.797097,2023-08-23 14:39:36.508970,0 days 00:00:00.711873,0.0005848090244898826,,,gblinear,XGBoost,0.556254278276578,,,,,,,1.096710532674201e-07,,,,,,,,,,,,,,,,,,,,0.7449831657727328,,,COMPLETE,0.0,,,,,,,,,,,,,,,,,,,,
11,11,0.3651589595375722,2023-08-23 14:39:36.510138,2023-08-23 14:39:37.454136,0 days 00:00:00.943998,,,,,RandomForestClassifier,,,,,,,,,,,,,,,,,,,,,,,,26.0,2.0,,,,,,COMPLETE,0.0,,,,,,,,,,,,,,,,,,,,
12,12,0.5242666666666667,2023-08-23 14:39:36.575989,2023-08-23 14:39:38.722848,0 days 00:00:02.146859,,,,,RandomForestClassifier,,,,,,,,,,,,,,,,,,,,,,,,38.0,5.0,,,,,,COMPLETE,0.0,,,,,,,,,,,,,,,,,,,,
13,13,0.5308341673856773,2023-08-23 14:39:36.685551,2023-08-23 14:39:36.812837,0 days 00:00:00.127286,,,,,DecisionTreeClassifier,,log_loss,2.0,,,,,,,,,,,,,,,,,,,,,,,,,,,,COMPLETE,0.0,,,,,,,,,,,,,,,,,,,,
14,14,0.5308341673856773,2023-08-23 14:39:36.929042,2023-08-23 14:39:37.113475,0 days 00:00:00.184433,,,,,DecisionTreeClassifier,,entropy,3.0,,,,,,,,,,,,,,,,,,,,,,,,,,,,COMPLETE,0.0,,,,,,,,,,,,,,,,,,,,
15,15,0.5315664445326967,2023-08-23 14:39:37.212920,2023-08-23 14:39:38.606299,0 days 00:00:01.393379,,,,,RandomForestClassifier,,,,,,,,,,,,,,,,,,,,,,,,23.0,6.0,,,,,,COMPLETE,0.0,,,,,,,,,,,,,,,,,,,,
16,16,0.6005363565914617,2023-08-23 14:39:37.544833,2023-08-23 14:39:38.972811,0 days 00:00:01.427978,,0.7000000000000001,1.0,,LightGBM,,,,,0.9,,,,3.63219754591416e-08,0.0014265308899389295,,100.0,,,,,,,,,,131.0,,,,,,,,,COMPLETE,0.0,,,,,,,,,,,,,,,,,,,,
17,17,0.35918496602517125,2023-08-23 14:39:38.366020,2023-08-23 14:39:50.621391,0 days 00:00:12.255371,,,,,SVC,,,,,,,,,,,,,,,,,,,,,,,,,,,,,40.03491135788368,linear,COMPLETE,0.0,,,,,,,,,,,,,,,,,,,,
18,18,0.5849875930521091,2023-08-23 14:39:38.703212,2023-08-23 14:39:40.346366,0 days 00:00:01.643154,,0.4,2.0,,LightGBM,,,,,0.8,,,,2.0019578030532273e-08,6.643427893937981e-05,,60.0,,,,,,,,,,135.0,,,,,,,,,COMPLETE,0.0,,,,,,,,,,,,,,,,,,,,
19,19,0.3573487031700288,2023-08-23 14:39:38.900907,2023-08-23 14:39:47.018451,0 days 00:00:08.117544,,,,,SVC,,,,,,,,,,,,,,,,,,,,,,,,,,,,,0.4607937376134122,poly,COMPLETE,0.0,,,,,,,,,,,,,,,,,,,,
20,20,0.6005363565914617,2023-08-23 14:39:39.037504,2023-08-23 14:39:40.487207,0 days 00:00:01.449703,,0.7000000000000001,1.0,,LightGBM,,,,,0.9,,,,2.1878628264007306e-08,0.0057258412125409715,,100.0,,,,,,,,,,136.0,,,,,,,,,COMPLETE,0.0,,,,,,,,,,,,,,,,,,,,
21,21,0.6005363565914617,2023-08-23 14:39:40.316945,2023-08-23 14:39:41.738577,0 days 00:00:01.421632,,0.7000000000000001,1.0,,LightGBM,,,,,0.9,,,,1.0607134168200368e-08,0.003095706604890431,,100.0,,,,,,,,,,138.0,,,,,,,,,COMPLETE,0.0,,,,,,,,,,,,,,,,,,,,
22,22,0.5925195631077984,2023-08-23 14:39:40.450211,2023-08-23 14:39:41.820537,0 days 00:00:01.370326,,0.6000000000000001,1.0,,LightGBM,,,,,0.9,,,,1.4768088549959886e-08,0.0003613386531178908,,90.0,,,,,,,,,,131.0,,,,,,,,,COMPLETE,0.0,,,,,,,,,,,,,,,,,,,,
23,23,0.5899104795260013,2023-08-23 14:39:40.604703,2023-08-23 14:39:42.864728,0 days 00:00:02.260025,,0.8,1.0,,LightGBM,,,,,1.0,,,,1.6102603775305285e-08,0.021477370594937574,,100.0,,,,,,,,,,148.0,,,,,,,,,COMPLETE,0.0,,,,,,,,,,,,,,,,,,,,
24,24,0.593579786683235,2023-08-23 14:39:41.798886,2023-08-23 14:39:43.696063,0 days 00:00:01.897177,,0.8,1.0,,LightGBM,,,,,1.0,,,,9.736049002482628e-06,0.13866170667448333,,100.0,,,,,,,,,,43.0,,,,,,,,,COMPLETE,0.0,,,,,,,,,,,,,,,,,,,,
25,25,0.3573487031700288,2023-08-23 14:39:41.896508,2023-08-23 14:39:48.005525,0 days 00:00:06.109017,,,,,SVC,,,,,,,,,,,,,,,,,,,,,,,,,,,,,0.0674019637582684,poly,COMPLETE,0.0,,,,,,,,,,,,,,,,,,,,
26,26,0.5915750915750916,2023-08-23 14:39:42.403189,2023-08-23 14:39:43.339418,0 days 00:00:00.936229,,1.0,1.0,,LightGBM,,,,,0.4,,,,8.798814490004704e-05,0.84678446329331,,10.0,,,,,,,,,,14.0,,,,,,,,,COMPLETE,0.0,,,,,,,,,,,,,,,,,,,,
27,27,0.5852436105655685,2023-08-23 14:39:43.020713,2023-08-23 14:39:43.960096,0 days 00:00:00.939383,,1.0,2.0,,LightGBM,,,,,0.5,,,,6.246278116227558e-05,0.9125549873575466,,20.0,,,,,,,,,,12.0,,,,,,,,,COMPLETE,0.0,,,,,,,,,,,,,,,,,,,,
28,28,0.5825065448728829,2023-08-23 14:39:43.432761,2023-08-23 14:39:45.403263,0 days 00:00:01.970502,,0.7000000000000001,1.0,,LightGBM,,,,,0.8,,,,1.049636958944948e-08,0.00255227133579266,,100.0,,,,,,,,,,232.0,,,,,,,,,COMPLETE,0.0,,,,,,,,,,,,,,,,,,,,
29,29,0.5850028316350003,2023-08-23 14:39:43.765914,2023-08-23 14:39:46.005164,0 days 00:00:02.239250,,0.6000000000000001,2.0,,LightGBM,,,,,0.7000000000000001,,,,4.972952619124009e-07,0.0011823230930939632,,80.0,,,,,,,,,,214.0,,,,,,,,,COMPLETE,0.0,,,,,,,,,,,,,,,,,,,,
30,30,0.6054342933711347,2023-08-23 14:39:44.070593,2023-08-23 14:39:45.870525,0 days 00:00:01.799932,,0.6000000000000001,1.0,,LightGBM,,,,,0.7000000000000001,,,,2.5835065703551734e-07,0.0015575271350503094,,80.0,,,,,,,,,,220.0,,,,,,,,,COMPLETE,0.0,,,,,,,,,,,,,,,,,,,,
31,31,0.6054342933711347,2023-08-23 14:39:44.145984,2023-08-23 14:39:45.700234,0 days 00:00:01.554250,,0.6000000000000001,1.0,,LightGBM,,,,,0.7000000000000001,,,,3.4473423871631947e-07,0.0017908877258639763,,80.0,,,,,,,,,,223.0,,,,,,,,,COMPLETE,0.0,,,,,,,,,,,,,,,,,,,,
32,32,0.4369268555819532,2023-08-23 14:39:45.504674,2023-08-23 14:42:24.124972,0 days 00:02:38.620298,,,,,MLPClassifier,,,,,,,,,,,,,,tanh,adam,4.0,10.0,100.0,50.0,20.0,,,,,,,,,,,COMPLETE,0.0,,,,,,,,,,,,,,,,,,,,
33,33,0.3573487031700288,2023-08-23 14:39:45.779931,2023-08-23 14:40:24.224863,0 days 00:00:38.444932,,,,,MLPClassifier,,,,,,,,,,,,,,identity,sgd,4.0,10.0,100.0,100.0,70.0,,,,,,,,,,,COMPLETE,0.0,,,,,,,,,,,,,,,,,,,,
34,34,0.475329133706737,2023-08-23 14:39:45.948302,2023-08-23 14:46:09.465270,0 days 00:06:23.516968,,,,,MLPClassifier,,,,,,,,,,,,,,relu,adam,4.0,10.0,100.0,30.0,30.0,,,,,,,,,,,COMPLETE,0.0,,,,,,,,,,,,,,,,,,,,
35,35,0.3573487031700288,2023-08-23 14:39:46.107003,2023-08-23 14:40:52.080959,0 days 00:01:05.973956,,,,,MLPClassifier,,,,,,,,,,,,,,tanh,sgd,4.0,10.0,100.0,70.0,100.0,,,,,,,,,,,COMPLETE,0.0,,,,,,,,,,,,,,,,,,,,
36,36,0.4533385724657718,2023-08-23 14:39:47.073215,2023-08-23 14:46:37.722769,0 days 00:06:50.649554,,,,,MLPClassifier,,,,,,,,,,,,,,relu,adam,4.0,10.0,100.0,60.0,50.0,,,,,,,,,,,COMPLETE,0.0,,,,,,,,,,,,,,,,,,,,
37,37,0.3573487031700288,2023-08-23 14:39:48.088414,2023-08-23 14:40:02.696654,0 days 00:00:14.608240,,,,,MLPClassifier,,,,,,,,,,,,,,identity,sgd,4.0,10.0,100.0,10.0,80.0,,,,,,,,,,,COMPLETE,0.0,,,,,,,,,,,,,,,,,,,,
38,38,0.43783960292580987,2023-08-23 14:39:50.693443,2023-08-23 14:46:18.138311,0 days 00:06:27.444868,,,,,MLPClassifier,,,,,,,,,,,,,,relu,adam,4.0,10.0,90.0,50.0,100.0,,,,,,,,,,,COMPLETE,0.0,,,,,,,,,,,,,,,,,,,,
39,39,0.41281276732249794,2023-08-23 14:40:02.761443,2023-08-23 14:40:05.531645,0 days 00:00:02.770202,,,,,MLPClassifier,,,,,,,,,,,,,,relu,adam,1.0,20.0,,,,,,,,,,,,,,COMPLETE,0.0,,,,,,,,,,,,,,,,,,,,
40,40,0.582998858394417,2023-08-23 14:40:05.609136,2023-08-23 14:40:07.197564,0 days 00:00:01.588428,,0.6000000000000001,3.0,,LightGBM,,,,,0.6000000000000001,,,,7.155644668735248e-07,4.6132482179366304e-06,,70.0,,,,,,,,,,187.0,,,,,,,,,COMPLETE,0.0,,,,,,,,,,,,,,,,,,,,
41,41,0.6060375954996977,2023-08-23 14:40:07.326007,2023-08-23 14:40:08.762359,0 days 00:00:01.436352,,0.5,1.0,,LightGBM,,,,,0.7000000000000001,,,,0.006811561639929874,0.007307372391137377,,80.0,,,,,,,,,,252.0,,,,,,,,,COMPLETE,0.0,,,,,,,,,,,,,,,,,,,,
42,42,0.6018580511223562,2023-08-23 14:40:08.829917,2023-08-23 14:40:09.994433,0 days 00:00:01.164516,,0.5,1.0,,LightGBM,,,,,0.7000000000000001,,,,0.012133590599401068,9.896406933744942e-05,,80.0,,,,,,,,,,246.0,,,,,,,,,COMPLETE,0.0,,,,,,,,,,,,,,,,,,,,
43,43,0.5475715878980756,2023-08-23 14:40:10.084693,2023-08-23 14:40:10.378409,0 days 00:00:00.293716,0.8492278116512979,,,gbtree,XGBoost,0.9971609965573348,,,0.0780422371722388,,1.179844864325378e-07,lossguide,0.17216397228431551,,,3.0,,5.0,,,,,,,,,,,,,,,0.2842885560141854,,,COMPLETE,0.0,,,,,,,,,,,,,,,,,,,,
44,44,0.5862981312697418,2023-08-23 14:40:10.460875,2023-08-23 14:40:11.676088,0 days 00:00:01.215213,,0.4,1.0,,LightGBM,,,,,0.7000000000000001,,,,0.010861996119959205,7.96785706228177e-05,,70.0,,,,,,,,,,253.0,,,,,,,,,COMPLETE,0.0,,,,,,,,,,,,,,,,,,,,
45,45,0.3573487031700288,2023-08-23 14:40:11.791545,2023-08-23 14:40:52.027387,0 days 00:00:40.235842,,,,,MLPClassifier,,,,,,,,,,,,,,tanh,sgd,4.0,100.0,10.0,100.0,10.0,,,,,,,,,,,COMPLETE,0.0,,,,,,,,,,,,,,,,,,,,
46,46,0.599543272349812,2023-08-23 14:40:24.284857,2023-08-23 14:40:25.670241,0 days 00:00:01.385384,,0.5,1.0,,LightGBM,,,,,0.6000000000000001,,,,0.013277293353486687,8.577187527291246e-08,,80.0,,,,,,,,,,202.0,,,,,,,,,COMPLETE,0.0,,,,,,,,,,,,,,,,,,,,
47,47,0.3573487031700288,2023-08-23 14:40:25.730247,2023-08-23 14:40:26.149562,0 days 00:00:00.419315,1.7805202407663883e-08,,,dart,XGBoost,0.22468978896615555,,,1.1529229332689859e-08,,0.7356916384103008,depthwise,2.5488389993046424e-08,,,9.0,,10.0,,,,,,,,forest,,0.10744966189731928,,,uniform,4.553691362502552e-05,0.9658285684734782,,,COMPLETE,0.0,,,,,,,,,,,,,,,,,,,,
48,48,0.5988746032795128,2023-08-23 14:40:26.208473,2023-08-23 14:40:27.592447,0 days 00:00:01.383974,,0.5,1.0,,LightGBM,,,,,0.7000000000000001,,,,0.11226817029621522,0.00038041948517512783,,80.0,,,,,,,,,,256.0,,,,,,,,,COMPLETE,0.0,,,,,,,,,,,,,,,,,,,,
49,49,0.6044335669579539,2023-08-23 14:40:27.690102,2023-08-23 14:40:29.487122,0 days 00:00:01.797020,,0.5,1.0,,LightGBM,,,,,0.6000000000000001,,,,0.0018292131944019788,0.016100432748436675,,60.0,,,,,,,,,,229.0,,,,,,,,,COMPLETE,0.0,,,,,,,,,,,,,,,,,,,,
50,50,0.5957044629291031,2023-08-23 14:40:29.569258,2023-08-23 14:40:31.699991,0 days 00:00:02.130733,,0.5,1.0,,LightGBM,,,,,0.6000000000000001,,,,0.0016971475128369927,0.025743140601479666,,40.0,,,,,,,,,,226.0,,,,,,,,,COMPLETE,0.0,,,,,,,,,,,,,,,,,,,,
51,51,0.5695019686542118,2023-08-23 14:40:31.761124,2023-08-23 14:40:33.747864,0 days 00:00:01.986740,,0.5,2.0,,LightGBM,,,,,0.6000000000000001,,,,0.0020215020340180914,0.01788813958194533,,50.0,,,,,,,,,,233.0,,,,,,,,,COMPLETE,0.0,,,,,,,,,,,,,,,,,,,,
52,52,0.5823531319105335,2023-08-23 14:40:33.852959,2023-08-23 14:40:35.216163,0 days 00:00:01.363204,,0.6000000000000001,1.0,,LightGBM,,,,,0.7000000000000001,,,,0.0046488439446824405,0.008391310768629279,,70.0,,,,,,,,,,176.0,,,,,,,,,COMPLETE,0.0,,,,,,,,,,,,,,,,,,,,
53,53,0.5088616011136736,2023-08-23 14:40:35.300173,2023-08-23 14:40:35.893192,0 days 00:00:00.593019,,,,,DecisionTreeClassifier,,entropy,21.0,,,,,,,,,,,,,,,,,,,,,,,,,,,,COMPLETE,0.0,,,,,,,,,,,,,,,,,,,,
54,54,0.597000090358724,2023-08-23 14:40:35.987708,2023-08-23 14:40:37.590841,0 days 00:00:01.603133,,0.5,3.0,,LightGBM,,,,,0.8,,,,0.0006586329831583741,0.06115062411574164,,80.0,,,,,,,,,,245.0,,,,,,,,,COMPLETE,0.0,,,,,,,,,,,,,,,,,,,,
55,55,0.5758440323347598,2023-08-23 14:40:37.665791,2023-08-23 14:40:44.443805,0 days 00:00:06.778014,,,,,RandomForestClassifier,,,,,,,,,,,,,,,,,,,,,,,,93.0,21.0,,,,,,COMPLETE,0.0,,,,,,,,,,,,,,,,,,,,
56,56,0.5767554491940791,2023-08-23 14:40:44.588465,2023-08-23 14:40:45.871506,0 days 00:00:01.283041,,0.4,1.0,,LightGBM,,,,,0.7000000000000001,,,,0.04825064021888149,0.00046513020131647,,60.0,,,,,,,,,,209.0,,,,,,,,,COMPLETE,0.0,,,,,,,,,,,,,,,,,,,,
57,57,0.564843811472185,2023-08-23 14:40:45.943824,2023-08-23 14:40:46.643884,0 days 00:00:00.700060,0.48679974447293084,,,dart,XGBoost,0.9184443753199081,,,0.13434706588865827,,2.8471586849931172e-08,lossguide,0.5110323469908249,,,9.0,,3.0,,,,,,,,tree,,4.087660631846186e-08,,,weighted,0.7566693628337199,0.4450276647254977,,,COMPLETE,0.0,,,,,,,,,,,,,,,,,,,,
58,58,0.5806949846838889,2023-08-23 14:40:46.754494,2023-08-23 14:40:48.300288,0 days 00:00:01.545794,,0.6000000000000001,1.0,,LightGBM,,,,,0.8,,,,0.5568537255917474,0.0018681876614862454,,90.0,,,,,,,,,,98.0,,,,,,,,,COMPLETE,0.0,,,,,,,,,,,,,,,,,,,,
59,59,0.5952075277033291,2023-08-23 14:40:48.410046,2023-08-23 14:40:49.508782,0 days 00:00:01.098736,,0.5,1.0,,LightGBM,,,,,0.5,,,,2.1016393159679664e-07,0.0061795881920120735,,90.0,,,,,,,,,,89.0,,,,,,,,,COMPLETE,0.0,,,,,,,,,,,,,,,,,,,,
60,60,0.6020219213410702,2023-08-23 14:40:49.566605,2023-08-23 14:40:51.081346,0 days 00:00:01.514741,,0.6000000000000001,1.0,,LightGBM,,,,,0.6000000000000001,,,,0.0005029237046407441,0.0007728782196246172,,70.0,,,,,,,,,,228.0,,,,,,,,,COMPLETE,0.0,,,,,,,,,,,,,,,,,,,,
61,61,0.6005805694521648,2023-08-23 14:40:51.145090,2023-08-23 14:40:52.635228,0 days 00:00:01.490138,,0.6000000000000001,1.0,,LightGBM,,,,,0.6000000000000001,,,,0.0012589275990772266,0.00024986966826990773,,70.0,,,,,,,,,,232.0,,,,,,,,,COMPLETE,0.0,,,,,,,,,,,,,,,,,,,,
62,62,0.488954800111542,2023-08-23 14:40:52.089217,2023-08-23 14:40:53.145817,0 days 00:00:01.056600,,,,,DecisionTreeClassifier,,log_loss,31.0,,,,,,,,,,,,,,,,,,,,,,,,,,,,COMPLETE,0.0,,,,,,,,,,,,,,,,,,,,
63,63,0.513209336446675,2023-08-23 14:40:52.189102,2023-08-23 14:40:53.035751,0 days 00:00:00.846649,,,,,DecisionTreeClassifier,,log_loss,29.0,,,,,,,,,,,,,,,,,,,,,,,,,,,,COMPLETE,0.0,,,,,,,,,,,,,,,,,,,,
64,64,0.519581093976325,2023-08-23 14:40:52.731741,2023-08-23 14:40:53.403966,0 days 00:00:00.672225,,,,,DecisionTreeClassifier,,log_loss,32.0,,,,,,,,,,,,,,,,,,,,,,,,,,,,COMPLETE,0.0,,,,,,,,,,,,,,,,,,,,
65,65,0.5517401198789753,2023-08-23 14:40:53.109022,2023-08-23 14:40:55.017130,0 days 00:00:01.908108,,0.5,1.0,,LightGBM,,,,,0.7000000000000001,,,,0.0010329229453580249,0.0014198727879327533,,80.0,,,,,,,,,,192.0,,,,,,,,,COMPLETE,0.0,,,,,,,,,,,,,,,,,,,,
66,66,0.3573487031700288,2023-08-23 14:40:53.240965,2023-08-23 14:41:00.805367,0 days 00:00:07.564402,,,,,SVC,,,,,,,,,,,,,,,,,,,,,,,,,,,,,0.0013962588436899728,rbf,COMPLETE,0.0,,,,,,,,,,,,,,,,,,,,
67,67,0.3573487031700288,2023-08-23 14:40:53.534986,2023-08-23 14:41:00.947883,0 days 00:00:07.412897,,,,,SVC,,,,,,,,,,,,,,,,,,,,,,,,,,,,,0.0010624751434945663,rbf,COMPLETE,0.0,,,,,,,,,,,,,,,,,,,,
68,68,0.6020219213410702,2023-08-23 14:40:55.091120,2023-08-23 14:40:56.609815,0 days 00:00:01.518695,,0.6000000000000001,1.0,,LightGBM,,,,,0.6000000000000001,,,,0.0005429789373713337,0.00018982577165011007,,70.0,,,,,,,,,,227.0,,,,,,,,,COMPLETE,0.0,,,,,,,,,,,,,,,,,,,,
69,69,0.5889613751682716,2023-08-23 14:40:56.675530,2023-08-23 14:40:58.338531,0 days 00:00:01.663001,,0.6000000000000001,1.0,,LightGBM,,,,,0.6000000000000001,,,,0.0002925302976858958,3.224309757269782e-05,,60.0,,,,,,,,,,220.0,,,,,,,,,COMPLETE,0.0,,,,,,,,,,,,,,,,,,,,
70,70,0.3573487031700288,2023-08-23 14:40:58.432549,2023-08-23 14:41:03.558277,0 days 00:00:05.125728,,,,,SVC,,,,,,,,,,,,,,,,,,,,,,,,,,,,,0.0016675560565264063,linear,COMPLETE,0.0,,,,,,,,,,,,,,,,,,,,
71,71,0.5846676772327735,2023-08-23 14:41:00.896033,2023-08-23 14:41:02.771393,0 days 00:00:01.875360,,0.6000000000000001,1.0,,LightGBM,,,,,0.5,,,,0.00034713568771901996,0.0006278258019740597,,70.0,,,,,,,,,,241.0,,,,,,,,,COMPLETE,0.0,,,,,,,,,,,,,,,,,,,,
72,72,0.5846676772327735,2023-08-23 14:41:01.053629,2023-08-23 14:41:03.120690,0 days 00:00:02.067061,,0.6000000000000001,1.0,,LightGBM,,,,,0.5,,,,0.0002827420002765236,0.0006182866578893773,,70.0,,,,,,,,,,242.0,,,,,,,,,COMPLETE,0.0,,,,,,,,,,,,,,,,,,,,
73,73,0.5730941704035875,2023-08-23 14:41:02.841266,2023-08-23 14:41:09.689474,0 days 00:00:06.848208,,,,,RandomForestClassifier,,,,,,,,,,,,,,,,,,,,,,,,91.0,14.0,,,,,,COMPLETE,0.0,,,,,,,,,,,,,,,,,,,,
74,74,0.5585233648817464,2023-08-23 14:41:03.243359,2023-08-23 14:41:11.431335,0 days 00:00:08.187976,,,,,RandomForestClassifier,,,,,,,,,,,,,,,,,,,,,,,,98.0,16.0,,,,,,COMPLETE,0.0,,,,,,,,,,,,,,,,,,,,
75,75,0.5707755232977785,2023-08-23 14:41:03.653374,2023-08-23 14:41:11.969101,0 days 00:00:08.315727,,,,,RandomForestClassifier,,,,,,,,,,,,,,,,,,,,,,,,98.0,15.0,,,,,,COMPLETE,0.0,,,,,,,,,,,,,,,,,,,,
76,76,0.5517401198789753,2023-08-23 14:41:09.825647,2023-08-23 14:41:11.143359,0 days 00:00:01.317712,,0.5,1.0,,LightGBM,,,,,0.7000000000000001,,,,0.00499545096565086,0.002414245718109733,,80.0,,,,,,,,,,219.0,,,,,,,,,COMPLETE,0.0,,,,,,,,,,,,,,,,,,,,
77,77,0.5922642132456248,2023-08-23 14:41:11.239166,2023-08-23 14:41:13.032381,0 days 00:00:01.793215,,0.4,1.0,,LightGBM,,,,,0.6000000000000001,,,,9.367903218880992e-08,0.0001870550012527489,,50.0,,,,,,,,,,256.0,,,,,,,,,COMPLETE,0.0,,,,,,,,,,,,,,,,,,,,
78,78,0.6005805694521648,2023-08-23 14:41:11.503523,2023-08-23 14:41:13.567392,0 days 00:00:02.063869,,0.6000000000000001,1.0,,LightGBM,,,,,0.6000000000000001,,,,0.0013739915608643677,0.00028160443408028145,,70.0,,,,,,,,,,232.0,,,,,,,,,COMPLETE,0.0,,,,,,,,,,,,,,,,,,,,
79,79,0.5849200098481147,2023-08-23 14:41:12.082799,2023-08-23 14:41:13.968936,0 days 00:00:01.886137,,0.6000000000000001,1.0,,LightGBM,,,,,0.6000000000000001,,,,0.002530963052068817,0.0001601844485941601,,70.0,,,,,,,,,,231.0,,,,,,,,,COMPLETE,0.0,,,,,,,,,,,,,,,,,,,,
80,80,0.5849200098481147,2023-08-23 14:41:13.104510,2023-08-23 14:41:15.063040,0 days 00:00:01.958530,,0.6000000000000001,1.0,,LightGBM,,,,,0.6000000000000001,,,,0.002116280134643195,0.00017149386459740294,,70.0,,,,,,,,,,230.0,,,,,,,,,COMPLETE,0.0,,,,,,,,,,,,,,,,,,,,
81,81,0.5982850554834991,2023-08-23 14:41:13.635650,2023-08-23 14:41:16.332821,0 days 00:00:02.697171,,0.6000000000000001,1.0,,LightGBM,,,,,0.6000000000000001,,,,0.004393091548130224,0.00010911691461703326,,60.0,,,,,,,,,,224.0,,,,,,,,,COMPLETE,0.0,,,,,,,,,,,,,,,,,,,,
82,82,0.5782072368421053,2023-08-23 14:41:14.051656,2023-08-23 14:41:16.649001,0 days 00:00:02.597345,,0.7000000000000001,1.0,,LightGBM,,,,,0.7000000000000001,,,,0.0068689991731180605,0.00522651269669881,,60.0,,,,,,,,,,204.0,,,,,,,,,COMPLETE,0.0,,,,,,,,,,,,,,,,,,,,
83,83,0.5599601212891361,2023-08-23 14:41:15.156694,2023-08-23 14:41:18.682075,0 days 00:00:03.525381,,0.7000000000000001,1.0,,LightGBM,,,,,0.7000000000000001,,,,0.01019443947012418,0.005789523141023021,,60.0,,,,,,,,,,207.0,,,,,,,,,COMPLETE,0.0,,,,,,,,,,,,,,,,,,,,
