,number,value,datetime_start,datetime_complete,duration,params_alpha,params_bagging_fraction,params_bagging_freq,params_booster,params_classifier,params_colsample_bytree,params_dct_criterion,params_dct_max_depth,params_eta,params_feature_fraction,params_gamma,params_grow_policy,params_lambda,params_lambda_l1,params_lambda_l2,params_max_depth,params_min_child_samples,params_min_child_weight,params_mlp_activation,params_mlp_solver,params_n_layers,params_n_units_l_0,params_n_units_l_1,params_n_units_l_2,params_n_units_l_3,params_normalize_type,params_num_leaves,params_rate_drop,params_rf_estimator,params_rf_max_depth,params_sample_type,params_skip_drop,params_subsample,params_svc_c,params_svc_kernel,state,best_trial,dev_acc,dev_recall_macro,dev_precision_macro,dev_f1_macro,dev_recall_0,dev_precision_0,dev_f1_0,dev_recall_1,dev_precision_1,dev_f1_1,test_acc,test_recall_macro,test_precision_macro,test_f1_macro,test_recall_0,test_precision_0,test_f1_0,test_recall_1,test_precision_1,test_f1_1
84,84,0.7584204413472706,2023-08-23 17:44:00.787212,2023-08-23 17:44:02.026454,0 days 00:00:01.239242,,0.5,2.0,,LightGBM,,,,,0.5,,,,0.1031348541380439,2.2000250387785043e-07,,20.0,,,,,,,,,,88.0,,,,,,,,,COMPLETE,0.0,,,,,,,,,,,,,,,,,,,,
85,85,0.7472538154952852,2023-08-23 17:44:00.935198,2023-08-23 17:44:02.737094,0 days 00:00:01.801896,,0.9,2.0,,LightGBM,,,,,0.9,,,,0.09532340641213616,2.508660723399711e-08,,20.0,,,,,,,,,,201.0,,,,,,,,,COMPLETE,0.0,,,,,,,,,,,,,,,,,,,,
86,86,0.3696969696969697,2023-08-23 17:44:02.108834,2023-08-23 17:44:02.320175,0 days 00:00:00.211341,,,,,SVC,,,,,,,,,,,,,,,,,,,,,,,,,,,,,0.0021583025199977323,rbf,COMPLETE,0.0,,,,,,,,,,,,,,,,,,,,
87,87,0.7493975903614458,2023-08-23 17:44:02.373518,2023-08-23 17:44:03.781123,0 days 00:00:01.407605,,0.8,2.0,,LightGBM,,,,,0.8,,,,0.0375461914655196,3.692515040088654e-08,,50.0,,,,,,,,,,218.0,,,,,,,,,COMPLETE,0.0,,,,,,,,,,,,,,,,,,,,
88,88,0.7803379416282643,2023-08-23 17:44:02.520704,2023-08-23 17:44:04.566146,0 days 00:00:02.045442,,1.0,2.0,,LightGBM,,,,,1.0,,,,0.3316474019376615,3.3544436272688156e-06,,10.0,,,,,,,,,,196.0,,,,,,,,,COMPLETE,0.0,,,,,,,,,,,,,,,,,,,,
89,89,0.7674735102556626,2023-08-23 17:44:02.827184,2023-08-23 17:44:05.302758,0 days 00:00:02.475574,,1.0,2.0,,LightGBM,,,,,1.0,,,,0.34559536922202744,3.065246884444455e-06,,10.0,,,,,,,,,,222.0,,,,,,,,,COMPLETE,0.0,,,,,,,,,,,,,,,,,,,,
90,90,0.7894939759036144,2023-08-23 17:44:03.367317,2023-08-23 17:44:05.763709,0 days 00:00:02.396392,,1.0,2.0,,LightGBM,,,,,1.0,,,,0.032270233279298705,4.061032647960452e-06,,10.0,,,,,,,,,,221.0,,,,,,,,,COMPLETE,0.0,,,,,,,,,,,,,,,,,,,,
91,91,0.7674735102556626,2023-08-23 17:44:03.900948,2023-08-23 17:44:06.327694,0 days 00:00:02.426746,,1.0,2.0,,LightGBM,,,,,1.0,,,,0.37356985786082614,2.145469615690558e-06,,10.0,,,,,,,,,,194.0,,,,,,,,,COMPLETE,0.0,,,,,,,,,,,,,,,,,,,,
92,92,0.7584204413472706,2023-08-23 17:44:04.629374,2023-08-23 17:44:07.085435,0 days 00:00:02.456061,,0.9,2.0,,LightGBM,,,,,0.9,,,,0.4704472365129606,2.819760601051505e-06,,10.0,,,,,,,,,,223.0,,,,,,,,,COMPLETE,0.0,,,,,,,,,,,,,,,,,,,,
93,93,0.6767919799498747,2023-08-23 17:44:05.404668,2023-08-23 17:44:05.513431,0 days 00:00:00.108763,,,,,DecisionTreeClassifier,,gini,5.0,,,,,,,,,,,,,,,,,,,,,,,,,,,,COMPLETE,0.0,,,,,,,,,,,,,,,,,,,,
94,94,0.7584204413472706,2023-08-23 17:44:05.585096,2023-08-23 17:44:07.798470,0 days 00:00:02.213374,,0.9,2.0,,LightGBM,,,,,0.9,,,,0.4894356158575999,9.0145140514173e-08,,10.0,,,,,,,,,,198.0,,,,,,,,,COMPLETE,0.0,,,,,,,,,,,,,,,,,,,,
95,95,0.4793993068925684,2023-08-23 17:44:05.844608,2023-08-23 17:44:06.224410,0 days 00:00:00.379802,0.0003776237539792252,,,gblinear,XGBoost,0.9973280802486277,,,,,,,3.683298541093217e-05,,,,,,,,,,,,,,,,,,,,0.5178509699119486,,,COMPLETE,0.0,,,,,,,,,,,,,,,,,,,,
96,96,0.7603686635944701,2023-08-23 17:44:06.319325,2023-08-23 17:44:07.998486,0 days 00:00:01.679161,,0.9,2.0,,LightGBM,,,,,0.9,,,,0.03384490709753253,5.1564161216566545e-06,,30.0,,,,,,,,,,235.0,,,,,,,,,COMPLETE,0.0,,,,,,,,,,,,,,,,,,,,
97,97,0.7314203730272597,2023-08-23 17:44:06.425502,2023-08-23 17:44:08.251809,0 days 00:00:01.826307,,0.9,2.0,,LightGBM,,,,,0.9,,,,0.03229105292856474,4.785420656631195e-06,,30.0,,,,,,,,,,245.0,,,,,,,,,COMPLETE,0.0,,,,,,,,,,,,,,,,,,,,
98,98,0.7472538154952852,2023-08-23 17:44:07.169493,2023-08-23 17:44:09.004540,0 days 00:00:01.835047,,0.5,2.0,,LightGBM,,,,,0.9,,,,0.04060431791734447,7.446465570061691e-06,,10.0,,,,,,,,,,244.0,,,,,,,,,COMPLETE,0.0,,,,,,,,,,,,,,,,,,,,
99,99,0.7493975903614458,2023-08-23 17:44:07.851176,2023-08-23 17:44:09.387489,0 days 00:00:01.536313,,0.5,2.0,,LightGBM,,,,,0.8,,,,0.040254360721583525,8.166121554139063e-06,,30.0,,,,,,,,,,245.0,,,,,,,,,COMPLETE,0.0,,,,,,,,,,,,,,,,,,,,
100,100,0.7472538154952852,2023-08-23 17:44:08.074531,2023-08-23 17:44:10.068055,0 days 00:00:01.993524,,0.5,2.0,,LightGBM,,,,,0.8,,,,0.109017745864567,5.943920710558502e-07,,10.0,,,,,,,,,,248.0,,,,,,,,,COMPLETE,0.0,,,,,,,,,,,,,,,,,,,,
101,101,0.7584204413472706,2023-08-23 17:44:08.334039,2023-08-23 17:44:10.762832,0 days 00:00:02.428793,,0.8,2.0,,LightGBM,,,,,0.5,,,,0.13554637898054187,7.237429548401509e-07,,10.0,,,,,,,,,,165.0,,,,,,,,,COMPLETE,0.0,,,,,,,,,,,,,,,,,,,,
102,102,0.7493975903614458,2023-08-23 17:44:09.134676,2023-08-23 17:44:11.027888,0 days 00:00:01.893212,,0.8,2.0,,LightGBM,,,,,0.5,,,,0.13178000433538328,6.153122104646634e-07,,20.0,,,,,,,,,,214.0,,,,,,,,,COMPLETE,0.0,,,,,,,,,,,,,,,,,,,,
103,103,0.7603686635944701,2023-08-23 17:44:09.473989,2023-08-23 17:44:11.376112,0 days 00:00:01.902123,,0.8,2.0,,LightGBM,,,,,1.0,,,,0.131758351067137,7.017342427902413e-07,,20.0,,,,,,,,,,161.0,,,,,,,,,COMPLETE,0.0,,,,,,,,,,,,,,,,,,,,
104,104,0.7694457831325301,2023-08-23 17:44:10.193369,2023-08-23 17:44:12.012278,0 days 00:00:01.818909,,0.8,2.0,,LightGBM,,,,,0.5,,,,0.5097852012683233,8.797918876061923e-07,,20.0,,,,,,,,,,105.0,,,,,,,,,COMPLETE,0.0,,,,,,,,,,,,,,,,,,,,
105,105,0.7674735102556626,2023-08-23 17:44:10.837138,2023-08-23 17:44:12.850052,0 days 00:00:02.012914,,0.8,2.0,,LightGBM,,,,,1.0,,,,0.36176866432088,1.273624626632618e-07,,20.0,,,,,,,,,,212.0,,,,,,,,,COMPLETE,0.0,,,,,,,,,,,,,,,,,,,,
106,106,0.7128205128205128,2023-08-23 17:44:11.097411,2023-08-23 17:44:11.541683,0 days 00:00:00.444272,,,,,RandomForestClassifier,,,,,,,,,,,,,,,,,,,,,,,,11.0,6.0,,,,,,COMPLETE,0.0,,,,,,,,,,,,,,,,,,,,
107,107,0.3696969696969697,2023-08-23 17:44:11.461033,2023-08-23 17:44:11.694216,0 days 00:00:00.233183,,,,,SVC,,,,,,,,,,,,,,,,,,,,,,,,,,,,,5.382083892906561,poly,COMPLETE,0.0,,,,,,,,,,,,,,,,,,,,
108,108,0.7694457831325301,2023-08-23 17:44:11.611878,2023-08-23 17:44:14.066040,0 days 00:00:02.454162,,1.0,2.0,,LightGBM,,,,,1.0,,,,0.49332636973224914,1.32744712164856e-06,,10.0,,,,,,,,,,206.0,,,,,,,,,COMPLETE,0.0,,,,,,,,,,,,,,,,,,,,
109,109,0.778552071234998,2023-08-23 17:44:11.784588,2023-08-23 17:44:14.409216,0 days 00:00:02.624628,,1.0,2.0,,LightGBM,,,,,1.0,,,,0.4377580396493763,1.2817790711025992e-07,,10.0,,,,,,,,,,205.0,,,,,,,,,COMPLETE,0.0,,,,,,,,,,,,,,,,,,,,
110,110,0.7493975903614458,2023-08-23 17:44:12.101404,2023-08-23 17:44:14.501516,0 days 00:00:02.400112,,1.0,2.0,,LightGBM,,,,,1.0,,,,0.4723450395045284,3.4720134184686384e-07,,10.0,,,,,,,,,,207.0,,,,,,,,,COMPLETE,0.0,,,,,,,,,,,,,,,,,,,,
111,111,0.7403993855606759,2023-08-23 17:44:12.949622,2023-08-23 17:44:15.456332,0 days 00:00:02.506710,,1.0,2.0,,LightGBM,,,,,1.0,,,,0.20906133989936063,3.106238655326353e-07,,10.0,,,,,,,,,,182.0,,,,,,,,,COMPLETE,0.0,,,,,,,,,,,,,,,,,,,,
112,112,0.7894939759036144,2023-08-23 17:44:14.162404,2023-08-23 17:44:17.259487,0 days 00:00:03.097083,,1.0,1.0,,LightGBM,,,,,1.0,,,,0.0651576563428548,2.785911116398016e-07,,10.0,,,,,,,,,,182.0,,,,,,,,,COMPLETE,0.0,,,,,,,,,,,,,,,,,,,,
113,113,0.7603686635944701,2023-08-23 17:44:14.498684,2023-08-23 17:44:15.826548,0 days 00:00:01.327864,,1.0,1.0,,LightGBM,,,,,0.8,,,,0.19943513336133367,4.384665034575138e-07,,80.0,,,,,,,,,,187.0,,,,,,,,,COMPLETE,0.0,,,,,,,,,,,,,,,,,,,,
114,114,0.7040525954273379,2023-08-23 17:44:14.560499,2023-08-23 17:44:14.765423,0 days 00:00:00.204924,,,,,DecisionTreeClassifier,,entropy,2.0,,,,,,,,,,,,,,,,,,,,,,,,,,,,COMPLETE,0.0,,,,,,,,,,,,,,,,,,,,
115,115,0.7603686635944701,2023-08-23 17:44:14.876578,2023-08-23 17:44:16.397213,0 days 00:00:01.520635,,1.0,1.0,,LightGBM,,,,,0.8,,,,0.06798170815408787,3.6376237617958084e-07,,70.0,,,,,,,,,,78.0,,,,,,,,,COMPLETE,0.0,,,,,,,,,,,,,,,,,,,,
116,116,0.3696969696969697,2023-08-23 17:44:15.539725,2023-08-23 17:44:15.933102,0 days 00:00:00.393377,6.2953862528874555e-06,,,gblinear,XGBoost,0.5264513711669754,,,,,,,0.006026503904067458,,,,,,,,,,,,,,,,,,,,0.7669612400426664,,,COMPLETE,0.0,,,,,,,,,,,,,,,,,,,,
117,117,0.6093680954485197,2023-08-23 17:44:15.897953,2023-08-23 17:44:16.329990,0 days 00:00:00.432037,6.304925614987483e-06,,,gblinear,XGBoost,0.5167557385150571,,,,,,,2.1912941708697224e-08,,,,,,,,,,,,,,,,,,,,0.8220737942510813,,,COMPLETE,0.0,,,,,,,,,,,,,,,,,,,,
118,118,0.7674735102556626,2023-08-23 17:44:15.998969,2023-08-23 17:44:19.192057,0 days 00:00:03.193088,,1.0,2.0,,LightGBM,,,,,1.0,,,,0.05467397805879317,8.375474063530657e-08,,10.0,,,,,,,,,,74.0,,,,,,,,,COMPLETE,0.0,,,,,,,,,,,,,,,,,,,,
119,119,0.7621044605413648,2023-08-23 17:44:16.409707,2023-08-23 17:44:19.452018,0 days 00:00:03.042311,,1.0,2.0,,LightGBM,,,,,1.0,,,,0.20167097635156486,8.793146389217076e-08,,10.0,,,,,,,,,,228.0,,,,,,,,,COMPLETE,0.0,,,,,,,,,,,,,,,,,,,,
120,120,0.778552071234998,2023-08-23 17:44:16.549952,2023-08-23 17:44:19.688949,0 days 00:00:03.138997,,1.0,2.0,,LightGBM,,,,,1.0,,,,0.21546284740661753,1.5480412669046324e-07,,10.0,,,,,,,,,,70.0,,,,,,,,,COMPLETE,0.0,,,,,,,,,,,,,,,,,,,,
121,121,0.7765625,2023-08-23 17:44:17.397482,2023-08-23 17:44:20.458451,0 days 00:00:03.060969,,1.0,1.0,,LightGBM,,,,,1.0,,,,0.06992509680464994,6.697358511135547e-08,,10.0,,,,,,,,,,173.0,,,,,,,,,COMPLETE,0.0,,,,,,,,,,,,,,,,,,,,
122,122,0.778552071234998,2023-08-23 17:44:19.298931,2023-08-23 17:44:21.689819,0 days 00:00:02.390888,,0.6000000000000001,1.0,,LightGBM,,,,,0.6000000000000001,,,,0.07568493156058188,2.3565585794588218e-08,,10.0,,,,,,,,,,136.0,,,,,,,,,COMPLETE,0.0,,,,,,,,,,,,,,,,,,,,
123,123,0.7493975903614458,2023-08-23 17:44:19.566346,2023-08-23 17:44:21.803706,0 days 00:00:02.237360,,0.6000000000000001,1.0,,LightGBM,,,,,0.6000000000000001,,,,0.023053447659918343,1.5664774089964472e-06,,20.0,,,,,,,,,,174.0,,,,,,,,,COMPLETE,0.0,,,,,,,,,,,,,,,,,,,,
124,124,0.7181571815718157,2023-08-23 17:44:19.770949,2023-08-23 17:44:21.552071,0 days 00:00:01.781122,,0.6000000000000001,1.0,,LightGBM,,,,,0.6000000000000001,,,,0.02550032119764139,2.236618244685755e-08,,20.0,,,,,,,,,,177.0,,,,,,,,,COMPLETE,0.0,,,,,,,,,,,,,,,,,,,,
125,125,0.778552071234998,2023-08-23 17:44:20.594181,2023-08-23 17:44:22.291545,0 days 00:00:01.697364,,0.9,1.0,,LightGBM,,,,,0.6000000000000001,,,,0.7417226005791792,2.1878575304097627e-08,,20.0,,,,,,,,,,135.0,,,,,,,,,COMPLETE,0.0,,,,,,,,,,,,,,,,,,,,
126,126,0.7472538154952852,2023-08-23 17:44:21.645535,2023-08-23 17:44:24.037602,0 days 00:00:02.392067,,0.9,1.0,,LightGBM,,,,,0.8,,,,0.008685519322346107,1.9121250878260853e-06,,20.0,,,,,,,,,,190.0,,,,,,,,,COMPLETE,0.0,,,,,,,,,,,,,,,,,,,,
127,127,0.7584204413472706,2023-08-23 17:44:21.804885,2023-08-23 17:44:23.917401,0 days 00:00:02.112516,,1.0,2.0,,LightGBM,,,,,1.0,,,,0.7223072696334797,2.3715132898254634e-07,,10.0,,,,,,,,,,192.0,,,,,,,,,COMPLETE,0.0,,,,,,,,,,,,,,,,,,,,
128,128,0.7986837011227255,2023-08-23 17:44:21.909728,2023-08-23 17:44:24.250085,0 days 00:00:02.340357,,1.0,2.0,,LightGBM,,,,,1.0,,,,0.16833201966754022,1.8879782964070036e-07,,10.0,,,,,,,,,,193.0,,,,,,,,,COMPLETE,0.0,,,,,,,,,,,,,,,,,,,,
129,129,0.7894939759036144,2023-08-23 17:44:22.372972,2023-08-23 17:44:24.593876,0 days 00:00:02.220904,,1.0,2.0,,LightGBM,,,,,1.0,,,,0.16714952231793906,1.9911076068951205e-07,,10.0,,,,,,,,,,194.0,,,,,,,,,COMPLETE,0.0,,,,,,,,,,,,,,,,,,,,
130,130,0.7986837011227255,2023-08-23 17:44:23.201452,2023-08-23 17:44:25.081282,0 days 00:00:01.879830,,1.0,2.0,,LightGBM,,,,,1.0,,,,0.16730948386327074,2.1736407425266455e-07,,10.0,,,,,,,,,,193.0,,,,,,,,,COMPLETE,0.0,,,,,,,,,,,,,,,,,,,,
131,131,0.7472538154952852,2023-08-23 17:44:24.002073,2023-08-23 17:44:25.838064,0 days 00:00:01.835991,,0.7000000000000001,2.0,,LightGBM,,,,,0.8,,,,0.26981329637553336,1.4117157512297982e-07,,10.0,,,,,,,,,,154.0,,,,,,,,,COMPLETE,0.0,,,,,,,,,,,,,,,,,,,,
132,132,0.7472538154952852,2023-08-23 17:44:24.164138,2023-08-23 17:44:26.091068,0 days 00:00:01.926930,,0.7000000000000001,2.0,,LightGBM,,,,,1.0,,,,0.27887134571522953,1.8652023549762115e-07,,10.0,,,,,,,,,,107.0,,,,,,,,,COMPLETE,0.0,,,,,,,,,,,,,,,,,,,,
133,133,0.7333333333333334,2023-08-23 17:44:24.374099,2023-08-23 17:44:25.943524,0 days 00:00:01.569425,,,,,RandomForestClassifier,,,,,,,,,,,,,,,,,,,,,,,,62.0,26.0,,,,,,COMPLETE,0.0,,,,,,,,,,,,,,,,,,,,
134,134,0.7538461538461538,2023-08-23 17:44:24.700455,2023-08-23 17:44:26.414178,0 days 00:00:01.713723,,,,,RandomForestClassifier,,,,,,,,,,,,,,,,,,,,,,,,62.0,24.0,,,,,,COMPLETE,0.0,,,,,,,,,,,,,,,,,,,,
135,135,0.7803379416282643,2023-08-23 17:44:25.195645,2023-08-23 17:44:26.341374,0 days 00:00:01.145729,,0.7000000000000001,2.0,,LightGBM,,,,,0.7000000000000001,,,,0.054268199187746224,5.455231558133254e-08,,40.0,,,,,,,,,,154.0,,,,,,,,,COMPLETE,0.0,,,,,,,,,,,,,,,,,,,,
136,136,0.7244627612599353,2023-08-23 17:44:25.916719,2023-08-23 17:44:27.648259,0 days 00:00:01.731540,,,,,RandomForestClassifier,,,,,,,,,,,,,,,,,,,,,,,,60.0,30.0,,,,,,COMPLETE,0.0,,,,,,,,,,,,,,,,,,,,
137,137,0.3696969696969697,2023-08-23 17:44:26.052986,2023-08-23 17:44:26.203125,0 days 00:00:00.150139,,,,,SVC,,,,,,,,,,,,,,,,,,,,,,,,,,,,,0.15988099167186098,rbf,COMPLETE,0.0,,,,,,,,,,,,,,,,,,,,
138,138,0.778552071234998,2023-08-23 17:44:26.184419,2023-08-23 17:44:29.056830,0 days 00:00:02.872411,,1.0,2.0,,LightGBM,,,,,1.0,,,,0.05344432647593054,5.5843765615746824e-08,,10.0,,,,,,,,,,198.0,,,,,,,,,COMPLETE,0.0,,,,,,,,,,,,,,,,,,,,
139,139,0.75625,2023-08-23 17:44:26.315769,2023-08-23 17:44:28.761320,0 days 00:00:02.445551,,1.0,2.0,,LightGBM,,,,,1.0,,,,0.127686968796085,5.8821336849498345e-08,,10.0,,,,,,,,,,183.0,,,,,,,,,COMPLETE,0.0,,,,,,,,,,,,,,,,,,,,
140,140,0.7803379416282643,2023-08-23 17:44:26.494375,2023-08-23 17:44:27.397983,0 days 00:00:00.903608,,0.7000000000000001,2.0,,LightGBM,,,,,0.7000000000000001,,,,0.05454174578473151,5.255328669126106e-08,,40.0,,,,,,,,,,201.0,,,,,,,,,COMPLETE,0.0,,,,,,,,,,,,,,,,,,,,
141,141,0.7694457831325301,2023-08-23 17:44:26.514378,2023-08-23 17:44:27.336133,0 days 00:00:00.821755,,0.7000000000000001,2.0,,LightGBM,,,,,0.7000000000000001,,,,0.05822736268063261,5.6184304526003344e-08,,50.0,,,,,,,,,,200.0,,,,,,,,,COMPLETE,0.0,,,,,,,,,,,,,,,,,,,,
142,142,0.7986837011227255,2023-08-23 17:44:27.463500,2023-08-23 17:44:28.367706,0 days 00:00:00.904206,,0.8,2.0,,LightGBM,,,,,0.7000000000000001,,,,0.10478406892064437,1.2256565790862983e-07,,30.0,,,,,,,,,,184.0,,,,,,,,,COMPLETE,0.0,,,,,,,,,,,,,,,,,,,,
143,143,0.7694457831325301,2023-08-23 17:44:27.487601,2023-08-23 17:44:28.468392,0 days 00:00:00.980791,,0.8,2.0,,LightGBM,,,,,0.7000000000000001,,,,0.13227429788240316,1.1344043894362696e-07,,40.0,,,,,,,,,,183.0,,,,,,,,,COMPLETE,0.0,,,,,,,,,,,,,,,,,,,,
144,144,0.7621044605413648,2023-08-23 17:44:27.725747,2023-08-23 17:44:28.887224,0 days 00:00:01.161477,,0.8,2.0,,LightGBM,,,,,0.7000000000000001,,,,0.13597313623440785,1.1472374036532833e-07,,30.0,,,,,,,,,,182.0,,,,,,,,,COMPLETE,0.0,,,,,,,,,,,,,,,,,,,,
145,145,0.3696969696969697,2023-08-23 17:44:28.461454,2023-08-23 17:45:18.292330,0 days 00:00:49.830876,,,,,MLPClassifier,,,,,,,,,,,,,,relu,sgd,3.0,70.0,50.0,10.0,,,,,,,,,,,,COMPLETE,0.0,,,,,,,,,,,,,,,,,,,,
146,146,0.3696969696969697,2023-08-23 17:44:28.622334,2023-08-23 17:44:38.327418,0 days 00:00:09.705084,,,,,MLPClassifier,,,,,,,,,,,,,,relu,sgd,3.0,70.0,50.0,10.0,,,,,,,,,,,,COMPLETE,0.0,,,,,,,,,,,,,,,,,,,,
147,147,0.664380798709157,2023-08-23 17:44:28.844967,2023-08-23 17:44:28.968392,0 days 00:00:00.123425,,,,,DecisionTreeClassifier,,log_loss,6.0,,,,,,,,,,,,,,,,,,,,,,,,,,,,COMPLETE,0.0,,,,,,,,,,,,,,,,,,,,
148,148,0.7894939759036144,2023-08-23 17:44:28.961708,2023-08-23 17:44:29.871801,0 days 00:00:00.910093,,0.8,2.0,,LightGBM,,,,,0.7000000000000001,,,,0.08569105537604128,2.9726908197720356e-07,,30.0,,,,,,,,,,117.0,,,,,,,,,COMPLETE,0.0,,,,,,,,,,,,,,,,,,,,
149,149,0.3696969696969697,2023-08-23 17:44:29.123273,2023-08-23 17:44:45.311192,0 days 00:00:16.187919,,,,,MLPClassifier,,,,,,,,,,,,,,relu,sgd,3.0,70.0,50.0,10.0,,,,,,,,,,,,COMPLETE,0.0,,,,,,,,,,,,,,,,,,,,
150,150,0.3696969696969697,2023-08-23 17:44:29.124664,2023-08-23 17:45:03.642066,0 days 00:00:34.517402,,,,,MLPClassifier,,,,,,,,,,,,,,relu,sgd,3.0,70.0,50.0,10.0,,,,,,,,,,,,COMPLETE,0.0,,,,,,,,,,,,,,,,,,,,
151,151,0.3696969696969697,2023-08-23 17:44:29.980637,2023-08-23 17:45:01.663777,0 days 00:00:31.683140,,,,,MLPClassifier,,,,,,,,,,,,,,relu,sgd,3.0,70.0,50.0,10.0,,,,,,,,,,,,COMPLETE,0.0,,,,,,,,,,,,,,,,,,,,
152,152,0.7694457831325301,2023-08-23 17:44:38.415388,2023-08-23 17:44:39.143633,0 days 00:00:00.728245,,0.8,2.0,,LightGBM,,,,,0.7000000000000001,,,,0.10081182383582585,2.8183524353566506e-07,,30.0,,,,,,,,,,118.0,,,,,,,,,COMPLETE,0.0,,,,,,,,,,,,,,,,,,,,
153,153,0.7513151602104255,2023-08-23 17:44:39.203407,2023-08-23 17:44:39.792093,0 days 00:00:00.588686,,0.4,2.0,,LightGBM,,,,,0.8,,,,0.02553210734619302,3.9941684228061343e-07,,20.0,,,,,,,,,,217.0,,,,,,,,,COMPLETE,0.0,,,,,,,,,,,,,,,,,,,,
154,154,0.7584204413472706,2023-08-23 17:44:39.882419,2023-08-23 17:44:40.191205,0 days 00:00:00.308786,,0.8,2.0,,LightGBM,,,,,0.8,,,,0.08137002567751761,1.9131088993907436e-07,,100.0,,,,,,,,,,121.0,,,,,,,,,COMPLETE,0.0,,,,,,,,,,,,,,,,,,,,
155,155,0.6953125,2023-08-23 17:44:40.293718,2023-08-23 17:44:40.774426,0 days 00:00:00.480708,,0.8,3.0,,LightGBM,,,,,0.4,,,,0.08426816250976481,2.685973826607186e-07,,30.0,,,,,,,,,,127.0,,,,,,,,,COMPLETE,0.0,,,,,,,,,,,,,,,,,,,,
156,156,0.7911047345767577,2023-08-23 17:44:40.853561,2023-08-23 17:44:41.691673,0 days 00:00:00.838112,,0.8,2.0,,LightGBM,,,,,0.7000000000000001,,,,0.18367578985770053,1.695221094845743e-07,,20.0,,,,,,,,,,203.0,,,,,,,,,COMPLETE,0.0,,,,,,,,,,,,,,,,,,,,
157,157,0.7911047345767577,2023-08-23 17:44:41.749898,2023-08-23 17:44:42.508265,0 days 00:00:00.758367,,0.8,2.0,,LightGBM,,,,,0.7000000000000001,,,,0.18230890641479763,1.77426614499192e-07,,20.0,,,,,,,,,,113.0,,,,,,,,,COMPLETE,0.0,,,,,,,,,,,,,,,,,,,,
158,158,0.7911047345767577,2023-08-23 17:44:42.573378,2023-08-23 17:44:43.330033,0 days 00:00:00.756655,,0.8,2.0,,LightGBM,,,,,0.7000000000000001,,,,0.14194194993552725,1.6414307115989572e-07,,20.0,,,,,,,,,,205.0,,,,,,,,,COMPLETE,0.0,,,,,,,,,,,,,,,,,,,,
159,159,0.7911047345767577,2023-08-23 17:44:43.395998,2023-08-23 17:44:44.155024,0 days 00:00:00.759026,,0.8,2.0,,LightGBM,,,,,0.7000000000000001,,,,0.16008475337472375,1.7536380213703104e-07,,20.0,,,,,,,,,,102.0,,,,,,,,,COMPLETE,0.0,,,,,,,,,,,,,,,,,,,,
160,160,0.7803379416282643,2023-08-23 17:44:44.314827,2023-08-23 17:44:45.007912,0 days 00:00:00.693085,,0.8,2.0,,LightGBM,,,,,0.7000000000000001,,,,0.17280356342472683,1.9269613695240375e-07,,20.0,,,,,,,,,,97.0,,,,,,,,,COMPLETE,0.0,,,,,,,,,,,,,,,,,,,,
161,161,0.792533485323454,2023-08-23 17:44:45.097625,2023-08-23 17:44:46.029967,0 days 00:00:00.932342,,0.8,2.0,,LightGBM,,,,,0.7000000000000001,,,,0.18191993329162312,3.8496267289771774e-07,,20.0,,,,,,,,,,101.0,,,,,,,,,COMPLETE,0.0,,,,,,,,,,,,,,,,,,,,
162,162,0.7603686635944701,2023-08-23 17:44:45.421345,2023-08-23 17:44:46.554674,0 days 00:00:01.133329,,0.8,2.0,,LightGBM,,,,,0.7000000000000001,,,,0.1487371802507118,4.1266711082303163e-07,,20.0,,,,,,,,,,102.0,,,,,,,,,COMPLETE,0.0,,,,,,,,,,,,,,,,,,,,
163,163,0.792533485323454,2023-08-23 17:44:46.105176,2023-08-23 17:44:46.947312,0 days 00:00:00.842136,,0.8,2.0,,LightGBM,,,,,0.7000000000000001,,,,0.18252855335301907,4.1878604258348256e-07,,20.0,,,,,,,,,,101.0,,,,,,,,,COMPLETE,0.0,,,,,,,,,,,,,,,,,,,,
164,164,0.7493975903614458,2023-08-23 17:44:46.623578,2023-08-23 17:44:47.446841,0 days 00:00:00.823263,,0.8,2.0,,LightGBM,,,,,0.7000000000000001,,,,0.6357400212982981,2.9125837219633387e-07,,20.0,,,,,,,,,,85.0,,,,,,,,,COMPLETE,0.0,,,,,,,,,,,,,,,,,,,,
165,165,0.7603686635944701,2023-08-23 17:44:47.037405,2023-08-23 17:44:47.957007,0 days 00:00:00.919602,,0.8,2.0,,LightGBM,,,,,0.7000000000000001,,,,0.09530845385294237,1.6291001443702566e-07,,20.0,,,,,,,,,,84.0,,,,,,,,,COMPLETE,0.0,,,,,,,,,,,,,,,,,,,,
166,166,0.7603686635944701,2023-08-23 17:44:47.569538,2023-08-23 17:44:48.549712,0 days 00:00:00.980174,,0.8,2.0,,LightGBM,,,,,0.7000000000000001,,,,0.16967284562982737,1.5340862313773029e-07,,20.0,,,,,,,,,,102.0,,,,,,,,,COMPLETE,0.0,,,,,,,,,,,,,,,,,,,,
167,167,0.7803379416282643,2023-08-23 17:44:48.022657,2023-08-23 17:44:49.022370,0 days 00:00:00.999713,,0.8,2.0,,LightGBM,,,,,0.7000000000000001,,,,0.1757231363888971,9.846570194548082e-08,,20.0,,,,,,,,,,113.0,,,,,,,,,COMPLETE,0.0,,,,,,,,,,,,,,,,,,,,
168,168,0.792533485323454,2023-08-23 17:44:48.625967,2023-08-23 17:44:49.571279,0 days 00:00:00.945312,,0.8,2.0,,LightGBM,,,,,0.7000000000000001,,,,0.16709340316512414,4.848271531458768e-07,,20.0,,,,,,,,,,111.0,,,,,,,,,COMPLETE,0.0,,,,,,,,,,,,,,,,,,,,
169,169,0.7603686635944701,2023-08-23 17:44:49.117792,2023-08-23 17:44:50.017427,0 days 00:00:00.899635,,0.8,2.0,,LightGBM,,,,,0.7000000000000001,,,,0.30440843345153473,4.732067266510246e-07,,20.0,,,,,,,,,,109.0,,,,,,,,,COMPLETE,0.0,,,,,,,,,,,,,,,,,,,,
170,170,0.7986837011227255,2023-08-23 17:44:49.633035,2023-08-23 17:44:50.480043,0 days 00:00:00.847008,,0.8,2.0,,LightGBM,,,,,0.7000000000000001,,,,0.1045303615295603,4.903376199441391e-07,,30.0,,,,,,,,,,111.0,,,,,,,,,COMPLETE,0.0,,,,,,,,,,,,,,,,,,,,
171,171,0.7986837011227255,2023-08-23 17:44:50.092998,2023-08-23 17:44:50.829122,0 days 00:00:00.736124,,0.8,2.0,,LightGBM,,,,,0.7000000000000001,,,,0.10509819457043194,2.3247158039515472e-07,,30.0,,,,,,,,,,116.0,,,,,,,,,COMPLETE,0.0,,,,,,,,,,,,,,,,,,,,
