,number,value,datetime_start,datetime_complete,duration,params_alpha,params_bagging_fraction,params_bagging_freq,params_booster,params_classifier,params_colsample_bytree,params_dct_criterion,params_dct_max_depth,params_eta,params_feature_fraction,params_gamma,params_grow_policy,params_lambda,params_lambda_l1,params_lambda_l2,params_max_depth,params_min_child_samples,params_min_child_weight,params_mlp_activation,params_mlp_solver,params_n_layers,params_n_units_l_0,params_n_units_l_1,params_n_units_l_2,params_n_units_l_3,params_normalize_type,params_num_leaves,params_rate_drop,params_rf_estimator,params_rf_max_depth,params_sample_type,params_skip_drop,params_subsample,params_svc_c,params_svc_kernel,state,best_trial,dev_acc,dev_recall_macro,dev_precision_macro,dev_f1_macro,dev_recall_0,dev_precision_0,dev_f1_0,dev_recall_1,dev_precision_1,dev_f1_1,test_acc,test_recall_macro,test_precision_macro,test_f1_macro,test_recall_0,test_precision_0,test_f1_0,test_recall_1,test_precision_1,test_f1_1
171,171,0.675,2023-08-23 17:42:54.857904,2023-08-23 17:42:55.646610,0 days 00:00:00.788706,,0.4,3.0,,LightGBM,,,,,0.8,,,,0.1240238229391471,8.797064919251182e-08,,90.0,,,,,,,,,,215.0,,,,,,,,,COMPLETE,0.0,,,,,,,,,,,,,,,,,,,,
172,172,0.6836424295947405,2023-08-23 17:42:54.927482,2023-08-23 17:42:55.499927,0 days 00:00:00.572445,,0.4,3.0,,LightGBM,,,,,0.8,,,,0.04869701613440449,1.0635806271802754e-08,,90.0,,,,,,,,,,215.0,,,,,,,,,COMPLETE,0.0,,,,,,,,,,,,,,,,,,,,
173,173,0.6836424295947405,2023-08-23 17:42:55.099005,2023-08-23 17:42:55.769914,0 days 00:00:00.670909,,0.4,3.0,,LightGBM,,,,,0.8,,,,0.04814525833475085,8.174012569874374e-08,,90.0,,,,,,,,,,214.0,,,,,,,,,COMPLETE,0.0,,,,,,,,,,,,,,,,,,,,
174,174,0.675,2023-08-23 17:42:55.387933,2023-08-23 17:42:56.348535,0 days 00:00:00.960602,,0.4,3.0,,LightGBM,,,,,0.8,,,,0.10673544365967622,8.42186186844126e-08,,90.0,,,,,,,,,,213.0,,,,,,,,,COMPLETE,0.0,,,,,,,,,,,,,,,,,,,,
175,175,0.3696969696969697,2023-08-23 17:42:55.469109,2023-08-23 17:42:55.599887,0 days 00:00:00.130778,,,,,SVC,,,,,,,,,,,,,,,,,,,,,,,,,,,,,25.05447609016851,linear,COMPLETE,0.0,,,,,,,,,,,,,,,,,,,,
176,176,0.3696969696969697,2023-08-23 17:42:55.589259,2023-08-23 17:42:55.838785,0 days 00:00:00.249526,,,,,SVC,,,,,,,,,,,,,,,,,,,,,,,,,,,,,26.85485859707961,linear,COMPLETE,0.0,,,,,,,,,,,,,,,,,,,,
177,177,0.3696969696969697,2023-08-23 17:42:55.594915,2023-08-23 17:42:55.966865,0 days 00:00:00.371950,,,,,SVC,,,,,,,,,,,,,,,,,,,,,,,,,,,,,21.27320282635503,linear,COMPLETE,0.0,,,,,,,,,,,,,,,,,,,,
178,178,0.6836424295947405,2023-08-23 17:42:55.688574,2023-08-23 17:42:56.589917,0 days 00:00:00.901343,,0.4,3.0,,LightGBM,,,,,0.8,,,,0.16398911562128732,1.5846829685470433e-08,,90.0,,,,,,,,,,15.0,,,,,,,,,COMPLETE,0.0,,,,,,,,,,,,,,,,,,,,
179,179,0.6836424295947405,2023-08-23 17:42:55.692016,2023-08-23 17:42:56.691519,0 days 00:00:00.999503,,0.4,3.0,,LightGBM,,,,,0.8,,,,0.04639779524645915,1.7370529980980907e-08,,90.0,,,,,,,,,,230.0,,,,,,,,,COMPLETE,0.0,,,,,,,,,,,,,,,,,,,,
180,180,0.6836424295947405,2023-08-23 17:42:55.735872,2023-08-23 17:42:56.484429,0 days 00:00:00.748557,,0.4,3.0,,LightGBM,,,,,0.8,,,,0.1764380696638406,1.6033895679008056e-07,,90.0,,,,,,,,,,232.0,,,,,,,,,COMPLETE,0.0,,,,,,,,,,,,,,,,,,,,
181,181,0.6803806880142758,2023-08-23 17:42:55.830684,2023-08-23 17:42:56.589146,0 days 00:00:00.758462,,0.4,3.0,,LightGBM,,,,,0.8,,,,0.1724995965118193,1.6350472946028953e-08,,100.0,,,,,,,,,,232.0,,,,,,,,,COMPLETE,0.0,,,,,,,,,,,,,,,,,,,,
182,182,0.6717948717948719,2023-08-23 17:42:55.894366,2023-08-23 17:42:56.742572,0 days 00:00:00.848206,,0.4,3.0,,LightGBM,,,,,0.8,,,,0.18445034180052616,2.068039604628038e-08,,100.0,,,,,,,,,,232.0,,,,,,,,,COMPLETE,0.0,,,,,,,,,,,,,,,,,,,,
183,183,0.6803806880142758,2023-08-23 17:42:55.963191,2023-08-23 17:42:56.546494,0 days 00:00:00.583303,,0.4,3.0,,LightGBM,,,,,0.8,,,,0.16805737352841643,1.71795768851698e-08,,100.0,,,,,,,,,,230.0,,,,,,,,,COMPLETE,0.0,,,,,,,,,,,,,,,,,,,,
184,184,0.6461553416933994,2023-08-23 17:42:56.016672,2023-08-23 17:42:56.882796,0 days 00:00:00.866124,,0.7000000000000001,3.0,,LightGBM,,,,,0.8,,,,0.1721016217125526,1.688586991219648e-08,,100.0,,,,,,,,,,232.0,,,,,,,,,COMPLETE,0.0,,,,,,,,,,,,,,,,,,,,
185,185,0.6259356469330222,2023-08-23 17:42:56.390097,2023-08-23 17:42:57.010832,0 days 00:00:00.620735,,0.7000000000000001,3.0,,LightGBM,,,,,0.8,,,,0.022319870653134646,1.6531353011645854e-08,,100.0,,,,,,,,,,231.0,,,,,,,,,COMPLETE,0.0,,,,,,,,,,,,,,,,,,,,
186,186,0.6259356469330222,2023-08-23 17:42:56.525272,2023-08-23 17:42:57.534333,0 days 00:00:01.009061,,0.7000000000000001,3.0,,LightGBM,,,,,0.8,,,,0.02283003246142806,1.8112736099668918e-08,,100.0,,,,,,,,,,34.0,,,,,,,,,COMPLETE,0.0,,,,,,,,,,,,,,,,,,,,
187,187,0.675,2023-08-23 17:42:56.675509,2023-08-23 17:42:57.743606,0 days 00:00:01.068097,,0.7000000000000001,3.0,,LightGBM,,,,,0.8,,,,0.09732203825102564,5.737600249603751e-08,,90.0,,,,,,,,,,201.0,,,,,,,,,COMPLETE,0.0,,,,,,,,,,,,,,,,,,,,
188,188,0.6836424295947405,2023-08-23 17:42:56.676713,2023-08-23 17:42:57.457477,0 days 00:00:00.780764,,0.4,3.0,,LightGBM,,,,,0.8,,,,0.08797611488692385,5.578049633007444e-08,,90.0,,,,,,,,,,205.0,,,,,,,,,COMPLETE,0.0,,,,,,,,,,,,,,,,,,,,
189,189,0.6836424295947405,2023-08-23 17:42:56.680846,2023-08-23 17:42:57.575437,0 days 00:00:00.894591,,0.4,3.0,,LightGBM,,,,,0.8,,,,0.023901010581688878,5.5868845361808134e-08,,90.0,,,,,,,,,,197.0,,,,,,,,,COMPLETE,0.0,,,,,,,,,,,,,,,,,,,,
190,190,0.6836424295947405,2023-08-23 17:42:56.738220,2023-08-23 17:42:57.369083,0 days 00:00:00.630863,,0.4,3.0,,LightGBM,,,,,0.8,,,,0.022578569120546992,5.855578526808993e-08,,90.0,,,,,,,,,,54.0,,,,,,,,,COMPLETE,0.0,,,,,,,,,,,,,,,,,,,,
191,191,0.6717948717948719,2023-08-23 17:42:56.799584,2023-08-23 17:42:57.413880,0 days 00:00:00.614296,,0.4,3.0,,LightGBM,,,,,0.8,,,,0.09976382558578308,6.037643195102597e-08,,90.0,,,,,,,,,,200.0,,,,,,,,,COMPLETE,0.0,,,,,,,,,,,,,,,,,,,,
192,192,0.6836424295947405,2023-08-23 17:42:56.937584,2023-08-23 17:42:57.623233,0 days 00:00:00.685649,,0.4,3.0,,LightGBM,,,,,0.8,,,,0.02255857796296179,6.220959561957998e-08,,90.0,,,,,,,,,,33.0,,,,,,,,,COMPLETE,0.0,,,,,,,,,,,,,,,,,,,,
193,193,0.6836424295947405,2023-08-23 17:42:57.053723,2023-08-23 17:42:57.673096,0 days 00:00:00.619373,,0.4,3.0,,LightGBM,,,,,0.8,,,,0.09450877234146467,6.161811944616444e-08,,90.0,,,,,,,,,,199.0,,,,,,,,,COMPLETE,0.0,,,,,,,,,,,,,,,,,,,,
194,194,0.6836424295947405,2023-08-23 17:42:57.410141,2023-08-23 17:42:58.469506,0 days 00:00:01.059365,,0.4,3.0,,LightGBM,,,,,0.8,,,,0.08813670859102453,5.63166831084277e-08,,90.0,,,,,,,,,,33.0,,,,,,,,,COMPLETE,0.0,,,,,,,,,,,,,,,,,,,,
195,195,0.6090602409638555,2023-08-23 17:42:57.454643,2023-08-23 17:42:58.647903,0 days 00:00:01.193260,,0.6000000000000001,3.0,,LightGBM,,,,,0.8,,,,0.09636733913141064,1.170944663746479e-07,,90.0,,,,,,,,,,35.0,,,,,,,,,COMPLETE,0.0,,,,,,,,,,,,,,,,,,,,
196,196,0.6717948717948719,2023-08-23 17:42:57.500869,2023-08-23 17:42:58.525114,0 days 00:00:01.024245,,0.4,3.0,,LightGBM,,,,,0.8,,,,0.3872880789731673,1.3170113437781172e-07,,90.0,,,,,,,,,,34.0,,,,,,,,,COMPLETE,0.0,,,,,,,,,,,,,,,,,,,,
197,197,0.6836424295947405,2023-08-23 17:42:57.669821,2023-08-23 17:42:58.753441,0 days 00:00:01.083620,,0.4,3.0,,LightGBM,,,,,0.8,,,,0.08454192287446291,2.8790729742824074e-08,,90.0,,,,,,,,,,221.0,,,,,,,,,COMPLETE,0.0,,,,,,,,,,,,,,,,,,,,
198,198,0.6546875,2023-08-23 17:42:57.675859,2023-08-23 17:42:58.810401,0 days 00:00:01.134542,,0.4,3.0,,LightGBM,,,,,0.5,,,,0.08019538640390386,3.207270631960384e-08,,90.0,,,,,,,,,,174.0,,,,,,,,,COMPLETE,0.0,,,,,,,,,,,,,,,,,,,,
199,199,0.6836424295947405,2023-08-23 17:42:57.726819,2023-08-23 17:42:58.606606,0 days 00:00:00.879787,,0.4,3.0,,LightGBM,,,,,0.8,,,,0.04501345896828397,2.850591656973238e-08,,90.0,,,,,,,,,,221.0,,,,,,,,,COMPLETE,0.0,,,,,,,,,,,,,,,,,,,,
200,200,0.6836424295947405,2023-08-23 17:42:57.735450,2023-08-23 17:42:58.707995,0 days 00:00:00.972545,,0.4,3.0,,LightGBM,,,,,0.8,,,,0.08380011114931861,3.13391042655369e-08,,90.0,,,,,,,,,,165.0,,,,,,,,,COMPLETE,0.0,,,,,,,,,,,,,,,,,,,,
201,201,0.663232263762143,2023-08-23 17:42:57.802618,2023-08-23 17:42:58.878163,0 days 00:00:01.075545,,0.4,3.0,,LightGBM,,,,,0.5,,,,0.04112112516788759,3.269907091971706e-08,,90.0,,,,,,,,,,221.0,,,,,,,,,COMPLETE,0.0,,,,,,,,,,,,,,,,,,,,
202,202,0.6836424295947405,2023-08-23 17:42:58.510379,2023-08-23 17:42:59.612414,0 days 00:00:01.102035,,0.4,3.0,,LightGBM,,,,,0.8,,,,0.042685151351497974,3.0424235583573137e-08,,90.0,,,,,,,,,,220.0,,,,,,,,,COMPLETE,0.0,,,,,,,,,,,,,,,,,,,,
203,203,0.675,2023-08-23 17:42:58.565491,2023-08-23 17:42:59.685708,0 days 00:00:01.120217,,0.4,3.0,,LightGBM,,,,,0.7000000000000001,,,,0.042599177435024664,2.9755896558258883e-08,,90.0,,,,,,,,,,158.0,,,,,,,,,COMPLETE,0.0,,,,,,,,,,,,,,,,,,,,
204,204,0.5692307692307692,2023-08-23 17:42:58.647357,2023-08-23 17:42:58.955532,0 days 00:00:00.308175,,,,,DecisionTreeClassifier,,entropy,2.0,,,,,,,,,,,,,,,,,,,,,,,,,,,,COMPLETE,0.0,,,,,,,,,,,,,,,,,,,,
205,205,0.5692307692307692,2023-08-23 17:42:58.695601,2023-08-23 17:42:58.999121,0 days 00:00:00.303520,,,,,DecisionTreeClassifier,,gini,2.0,,,,,,,,,,,,,,,,,,,,,,,,,,,,COMPLETE,0.0,,,,,,,,,,,,,,,,,,,,
206,206,0.5692307692307692,2023-08-23 17:42:58.750908,2023-08-23 17:42:59.079288,0 days 00:00:00.328380,,,,,DecisionTreeClassifier,,gini,2.0,,,,,,,,,,,,,,,,,,,,,,,,,,,,COMPLETE,0.0,,,,,,,,,,,,,,,,,,,,
207,207,0.5692307692307692,2023-08-23 17:42:58.809773,2023-08-23 17:42:59.078789,0 days 00:00:00.269016,,,,,DecisionTreeClassifier,,entropy,2.0,,,,,,,,,,,,,,,,,,,,,,,,,,,,COMPLETE,0.0,,,,,,,,,,,,,,,,,,,,
208,208,0.5692307692307692,2023-08-23 17:42:58.929401,2023-08-23 17:42:59.203147,0 days 00:00:00.273746,,,,,DecisionTreeClassifier,,entropy,2.0,,,,,,,,,,,,,,,,,,,,,,,,,,,,COMPLETE,0.0,,,,,,,,,,,,,,,,,,,,
209,209,0.675,2023-08-23 17:42:58.938742,2023-08-23 17:42:59.785609,0 days 00:00:00.846867,,0.4,3.0,,LightGBM,,,,,0.7000000000000001,,,,0.03506550705284816,1.0001560285580035e-05,,90.0,,,,,,,,,,193.0,,,,,,,,,COMPLETE,0.0,,,,,,,,,,,,,,,,,,,,
210,210,0.6836424295947405,2023-08-23 17:42:59.038041,2023-08-23 17:42:59.838169,0 days 00:00:00.800128,,0.4,3.0,,LightGBM,,,,,0.7000000000000001,,,,0.05164128566208051,6.997791864935058e-06,,90.0,,,,,,,,,,13.0,,,,,,,,,COMPLETE,0.0,,,,,,,,,,,,,,,,,,,,
211,211,0.675,2023-08-23 17:42:59.041435,2023-08-23 17:42:59.881981,0 days 00:00:00.840546,,0.4,3.0,,LightGBM,,,,,0.7000000000000001,,,,0.04174274559154786,6.708276731302716e-06,,90.0,,,,,,,,,,6.0,,,,,,,,,COMPLETE,0.0,,,,,,,,,,,,,,,,,,,,
212,212,0.675,2023-08-23 17:42:59.169648,2023-08-23 17:43:00.043910,0 days 00:00:00.874262,,0.4,3.0,,LightGBM,,,,,0.7000000000000001,,,,0.03544209455927138,2.2547272882176756e-07,,90.0,,,,,,,,,,13.0,,,,,,,,,COMPLETE,0.0,,,,,,,,,,,,,,,,,,,,
213,213,0.675,2023-08-23 17:42:59.187908,2023-08-23 17:42:59.937347,0 days 00:00:00.749439,,0.4,3.0,,LightGBM,,,,,0.7000000000000001,,,,0.03448634861258687,8.833606384090947e-06,,90.0,,,,,,,,,,7.0,,,,,,,,,COMPLETE,0.0,,,,,,,,,,,,,,,,,,,,
214,214,0.675,2023-08-23 17:42:59.249666,2023-08-23 17:42:59.987063,0 days 00:00:00.737397,,0.4,3.0,,LightGBM,,,,,0.7000000000000001,,,,0.03519536362699084,4.010696618414117e-07,,90.0,,,,,,,,,,8.0,,,,,,,,,COMPLETE,0.0,,,,,,,,,,,,,,,,,,,,
215,215,0.675,2023-08-23 17:42:59.655419,2023-08-23 17:43:00.469732,0 days 00:00:00.814313,,0.4,3.0,,LightGBM,,,,,0.7000000000000001,,,,0.03141187815402559,1.4290500728386723e-06,,90.0,,,,,,,,,,6.0,,,,,,,,,COMPLETE,0.0,,,,,,,,,,,,,,,,,,,,
216,216,0.675,2023-08-23 17:42:59.727220,2023-08-23 17:43:00.575569,0 days 00:00:00.848349,,0.4,3.0,,LightGBM,,,,,0.7000000000000001,,,,0.03151488625088315,6.443430185016187e-07,,90.0,,,,,,,,,,11.0,,,,,,,,,COMPLETE,0.0,,,,,,,,,,,,,,,,,,,,
217,217,0.6836424295947405,2023-08-23 17:42:59.825560,2023-08-23 17:43:00.818757,0 days 00:00:00.993197,,0.4,3.0,,LightGBM,,,,,0.8,,,,0.0607969537820193,2.285156985938494e-07,,90.0,,,,,,,,,,7.0,,,,,,,,,COMPLETE,0.0,,,,,,,,,,,,,,,,,,,,
218,218,0.6836424295947405,2023-08-23 17:42:59.882728,2023-08-23 17:43:00.776784,0 days 00:00:00.894056,,0.4,3.0,,LightGBM,,,,,0.8,,,,0.0285157677096324,2.4111939433635573e-07,,90.0,,,,,,,,,,187.0,,,,,,,,,COMPLETE,0.0,,,,,,,,,,,,,,,,,,,,
219,219,0.6836424295947405,2023-08-23 17:42:59.936643,2023-08-23 17:43:00.721986,0 days 00:00:00.785343,,0.4,3.0,,LightGBM,,,,,0.8,,,,0.030982052010312306,1.841706779803615e-07,,90.0,,,,,,,,,,180.0,,,,,,,,,COMPLETE,0.0,,,,,,,,,,,,,,,,,,,,
220,220,0.6836424295947405,2023-08-23 17:43:00.038572,2023-08-23 17:43:00.936137,0 days 00:00:00.897565,,0.4,3.0,,LightGBM,,,,,0.8,,,,0.06033396192311911,1.0320938892027569e-07,,90.0,,,,,,,,,,180.0,,,,,,,,,COMPLETE,0.0,,,,,,,,,,,,,,,,,,,,
221,221,0.6836424295947405,2023-08-23 17:43:00.095601,2023-08-23 17:43:00.988425,0 days 00:00:00.892824,,0.4,3.0,,LightGBM,,,,,0.8,,,,0.06534081078013373,8.79192974053796e-08,,90.0,,,,,,,,,,187.0,,,,,,,,,COMPLETE,0.0,,,,,,,,,,,,,,,,,,,,
222,222,0.6836424295947405,2023-08-23 17:43:00.114009,2023-08-23 17:43:00.889464,0 days 00:00:00.775455,,0.4,3.0,,LightGBM,,,,,0.8,,,,0.06675019031382518,5.1016354142118504e-05,,90.0,,,,,,,,,,181.0,,,,,,,,,COMPLETE,0.0,,,,,,,,,,,,,,,,,,,,
223,223,0.6836424295947405,2023-08-23 17:43:00.513222,2023-08-23 17:43:01.144197,0 days 00:00:00.630975,,0.4,3.0,,LightGBM,,,,,0.8,,,,0.0668187284383319,8.796917801054312e-08,,90.0,,,,,,,,,,185.0,,,,,,,,,COMPLETE,0.0,,,,,,,,,,,,,,,,,,,,
224,224,0.6836424295947405,2023-08-23 17:43:00.620243,2023-08-23 17:43:01.233542,0 days 00:00:00.613299,,0.4,3.0,,LightGBM,,,,,0.8,,,,0.06463902674196752,1.0179956020313728e-07,,90.0,,,,,,,,,,237.0,,,,,,,,,COMPLETE,0.0,,,,,,,,,,,,,,,,,,,,
225,225,0.6836424295947405,2023-08-23 17:43:00.762856,2023-08-23 17:43:01.645090,0 days 00:00:00.882234,,0.4,3.0,,LightGBM,,,,,0.8,,,,0.06128586970856557,9.871772253064315e-08,,90.0,,,,,,,,,,250.0,,,,,,,,,COMPLETE,0.0,,,,,,,,,,,,,,,,,,,,
226,226,0.6057159521726451,2023-08-23 17:43:00.856694,2023-08-23 17:43:01.802880,0 days 00:00:00.946186,,0.8,3.0,,LightGBM,,,,,0.8,,,,0.06434485590439143,1.0265985264828827e-07,,90.0,,,,,,,,,,239.0,,,,,,,,,COMPLETE,0.0,,,,,,,,,,,,,,,,,,,,
227,227,0.6836424295947405,2023-08-23 17:43:00.864303,2023-08-23 17:43:01.555158,0 days 00:00:00.690855,,0.4,3.0,,LightGBM,,,,,0.8,,,,0.06537937658973861,9.463707578738506e-08,,90.0,,,,,,,,,,182.0,,,,,,,,,COMPLETE,0.0,,,,,,,,,,,,,,,,,,,,
228,228,0.6836424295947405,2023-08-23 17:43:00.933402,2023-08-23 17:43:01.712341,0 days 00:00:00.778939,,0.4,3.0,,LightGBM,,,,,0.8,,,,0.0655922157368946,7.24743961061977e-08,,90.0,,,,,,,,,,194.0,,,,,,,,,COMPLETE,0.0,,,,,,,,,,,,,,,,,,,,
229,229,0.6836424295947405,2023-08-23 17:43:00.981631,2023-08-23 17:43:01.803415,0 days 00:00:00.821784,,0.4,3.0,,LightGBM,,,,,0.8,,,,0.13007991496870394,7.602764435527566e-08,,90.0,,,,,,,,,,239.0,,,,,,,,,COMPLETE,0.0,,,,,,,,,,,,,,,,,,,,
230,230,0.675,2023-08-23 17:43:01.034014,2023-08-23 17:43:01.888533,0 days 00:00:00.854519,,0.4,3.0,,LightGBM,,,,,0.8,,,,0.11059388171855775,4.6454107460800447e-08,,90.0,,,,,,,,,,193.0,,,,,,,,,COMPLETE,0.0,,,,,,,,,,,,,,,,,,,,
231,231,0.606060606060606,2023-08-23 17:43:01.188339,2023-08-23 17:43:02.055904,0 days 00:00:00.867565,,0.4,3.0,,LightGBM,,,,,0.8,,,,0.12214321778275745,4.4989247757176796e-08,,50.0,,,,,,,,,,192.0,,,,,,,,,COMPLETE,0.0,,,,,,,,,,,,,,,,,,,,
232,232,0.634375,2023-08-23 17:43:01.276120,2023-08-23 17:43:02.124311,0 days 00:00:00.848191,,0.4,3.0,,LightGBM,,,,,0.8,,,,0.115278538326341,4.612663430758059e-08,,50.0,,,,,,,,,,195.0,,,,,,,,,COMPLETE,0.0,,,,,,,,,,,,,,,,,,,,
233,233,0.6836424295947405,2023-08-23 17:43:01.597377,2023-08-23 17:43:02.698017,0 days 00:00:01.100640,,0.4,3.0,,LightGBM,,,,,0.8,,,,0.13682955398487026,4.5901260801696063e-08,,90.0,,,,,,,,,,195.0,,,,,,,,,COMPLETE,0.0,,,,,,,,,,,,,,,,,,,,
234,234,0.675,2023-08-23 17:43:01.688524,2023-08-23 17:43:02.803528,0 days 00:00:01.115004,,0.4,3.0,,LightGBM,,,,,0.8,,,,0.12741862540676271,4.375382389142415e-08,,90.0,,,,,,,,,,194.0,,,,,,,,,COMPLETE,0.0,,,,,,,,,,,,,,,,,,,,
235,235,0.4907721280602637,2023-08-23 17:43:01.756571,2023-08-23 17:43:02.195753,0 days 00:00:00.439182,8.247573796003155e-07,,,gbtree,XGBoost,0.5278083943136667,,,1.0687157516850833e-08,,3.233972555362574e-05,depthwise,0.0008403378096092405,,,7.0,,6.0,,,,,,,,,,,,,,,0.4540057378200134,,,COMPLETE,0.0,,,,,,,,,,,,,,,,,,,,
236,236,0.5477005644489683,2023-08-23 17:43:01.886506,2023-08-23 17:43:02.267627,0 days 00:00:00.381121,1.077607126904968e-06,,,gbtree,XGBoost,0.5338945471966611,,,1.6202622853888996e-08,,4.3810635163087655e-05,depthwise,0.0014597063802447205,,,7.0,,6.0,,,,,,,,,,,,,,,0.44968157930248054,,,COMPLETE,0.0,,,,,,,,,,,,,,,,,,,,
237,237,0.6185188856944581,2023-08-23 17:43:01.887881,2023-08-23 17:43:02.321123,0 days 00:00:00.433242,5.786199283153792e-07,,,gbtree,XGBoost,0.5508756775459835,,,0.00018951738782093183,,3.4559013978236014e-05,depthwise,0.0015817359100080315,,,7.0,,6.0,,,,,,,,,,,,,,,0.4614425064926546,,,COMPLETE,0.0,,,,,,,,,,,,,,,,,,,,
238,238,0.675,2023-08-23 17:43:01.940752,2023-08-23 17:43:02.951738,0 days 00:00:01.010986,,0.4,3.0,,LightGBM,,,,,0.8,,,,0.12577271465627107,4.427866795111538e-08,,90.0,,,,,,,,,,56.0,,,,,,,,,COMPLETE,0.0,,,,,,,,,,,,,,,,,,,,
239,239,0.5267019596916505,2023-08-23 17:43:02.100834,2023-08-23 17:43:02.434340,0 days 00:00:00.333506,1.800122489862979e-06,,,gbtree,XGBoost,0.5276765071491256,,,1.3119145014804015e-08,,3.581211106101045e-05,depthwise,0.0008614255191716048,,,7.0,,6.0,,,,,,,,,,,,,,,0.41901053690896706,,,COMPLETE,0.0,,,,,,,,,,,,,,,,,,,,
240,240,0.6836424295947405,2023-08-23 17:43:02.171549,2023-08-23 17:43:03.069554,0 days 00:00:00.898005,,0.4,3.0,,LightGBM,,,,,0.8,,,,0.04456327112877779,2.202738773608321e-08,,90.0,,,,,,,,,,175.0,,,,,,,,,COMPLETE,0.0,,,,,,,,,,,,,,,,,,,,
241,241,0.6836424295947405,2023-08-23 17:43:02.259451,2023-08-23 17:43:03.016557,0 days 00:00:00.757106,,0.4,3.0,,LightGBM,,,,,0.8,,,,0.00793417987711962,4.906835872454507e-08,,90.0,,,,,,,,,,205.0,,,,,,,,,COMPLETE,0.0,,,,,,,,,,,,,,,,,,,,
242,242,0.6836424295947405,2023-08-23 17:43:02.319898,2023-08-23 17:43:03.193554,0 days 00:00:00.873656,,0.4,3.0,,LightGBM,,,,,0.8,,,,0.044632904658297244,4.58426283404175e-08,,90.0,,,,,,,,,,52.0,,,,,,,,,COMPLETE,0.0,,,,,,,,,,,,,,,,,,,,
243,243,0.6836424295947405,2023-08-23 17:43:02.364716,2023-08-23 17:43:03.145901,0 days 00:00:00.781185,,0.4,3.0,,LightGBM,,,,,0.8,,,,0.007146394378876303,2.1789162745540036e-08,,90.0,,,,,,,,,,205.0,,,,,,,,,COMPLETE,0.0,,,,,,,,,,,,,,,,,,,,
244,244,0.6836424295947405,2023-08-23 17:43:02.478166,2023-08-23 17:43:03.260481,0 days 00:00:00.782315,,0.4,3.0,,LightGBM,,,,,0.8,,,,0.011502830443752105,2.1624914041863157e-08,,90.0,,,,,,,,,,174.0,,,,,,,,,COMPLETE,0.0,,,,,,,,,,,,,,,,,,,,
245,245,0.6717948717948719,2023-08-23 17:43:02.741172,2023-08-23 17:43:03.405839,0 days 00:00:00.664667,,0.4,3.0,,LightGBM,,,,,0.8,,,,0.36185392759360074,2.1196627604960283e-08,,90.0,,,,,,,,,,174.0,,,,,,,,,COMPLETE,0.0,,,,,,,,,,,,,,,,,,,,
246,246,0.6307692307692307,2023-08-23 17:43:02.848112,2023-08-23 17:43:03.493187,0 days 00:00:00.645075,,0.4,3.0,,LightGBM,,,,,1.0,,,,0.04943098982333403,6.392605399972326e-08,,80.0,,,,,,,,,,175.0,,,,,,,,,COMPLETE,0.0,,,,,,,,,,,,,,,,,,,,
247,247,0.6836424295947405,2023-08-23 17:43:02.992383,2023-08-23 17:43:03.670019,0 days 00:00:00.677636,,0.4,3.0,,LightGBM,,,,,0.8,,,,0.04459261659642401,6.733195544020914e-08,,90.0,,,,,,,,,,207.0,,,,,,,,,COMPLETE,0.0,,,,,,,,,,,,,,,,,,,,
248,248,0.6836424295947405,2023-08-23 17:43:03.060289,2023-08-23 17:43:03.588442,0 days 00:00:00.528153,,0.4,3.0,,LightGBM,,,,,0.8,,,,0.046155575586978755,2.091149366445175e-08,,90.0,,,,,,,,,,172.0,,,,,,,,,COMPLETE,0.0,,,,,,,,,,,,,,,,,,,,
249,249,0.6836424295947405,2023-08-23 17:43:03.114665,2023-08-23 17:43:03.630345,0 days 00:00:00.515680,,0.4,3.0,,LightGBM,,,,,0.8,,,,0.04431143677575191,6.607387693404921e-08,,90.0,,,,,,,,,,108.0,,,,,,,,,COMPLETE,0.0,,,,,,,,,,,,,,,,,,,,
