,number,value,datetime_start,datetime_complete,duration,params_alpha,params_bagging_fraction,params_bagging_freq,params_booster,params_classifier,params_colsample_bytree,params_dct_criterion,params_dct_max_depth,params_eta,params_feature_fraction,params_gamma,params_grow_policy,params_lambda,params_lambda_l1,params_lambda_l2,params_max_depth,params_min_child_samples,params_min_child_weight,params_mlp_activation,params_mlp_solver,params_n_layers,params_n_units_l_0,params_n_units_l_1,params_n_units_l_2,params_n_units_l_3,params_normalize_type,params_num_leaves,params_rate_drop,params_rf_estimator,params_rf_max_depth,params_sample_type,params_skip_drop,params_subsample,params_svc_c,params_svc_kernel,state,best_trial,dev_acc,dev_recall_macro,dev_precision_macro,dev_f1_macro,dev_recall_0,dev_precision_0,dev_f1_0,dev_recall_1,dev_precision_1,dev_f1_1,test_acc,test_recall_macro,test_precision_macro,test_f1_macro,test_recall_0,test_precision_0,test_f1_0,test_recall_1,test_precision_1,test_f1_1
71,71,0.5905301835782343,2023-08-23 18:30:46.973556,2023-08-23 18:30:48.054291,0 days 00:00:01.080735,0.0021774123023715233,,,dart,XGBoost,0.438585244761004,,,0.006445738285980592,,0.00018996040667019237,depthwise,1.9618503876055372e-08,,,5.0,,7.0,,,,,,,,forest,,0.14253821083304727,,,weighted,0.09360536196802523,0.4793109255176448,,,COMPLETE,0.0,,,,,,,,,,,,,,,,,,,,
72,72,0.5971121520039286,2023-08-23 18:30:47.142402,2023-08-23 18:30:48.277489,0 days 00:00:01.135087,0.0018149026372983252,,,dart,XGBoost,0.42603614015404023,,,0.00676323636424326,,0.0001696414977302088,depthwise,2.5547981550061123e-08,,,5.0,,7.0,,,,,,,,forest,,0.14221174630800676,,,weighted,0.14970766209022277,0.47102269008461056,,,COMPLETE,0.0,,,,,,,,,,,,,,,,,,,,
73,73,0.5964552368170233,2023-08-23 18:30:47.541018,2023-08-23 18:30:48.955919,0 days 00:00:01.414901,0.0013654671805676353,,,dart,XGBoost,0.44950044484962004,,,0.00711542222515902,,0.0001806455284370623,lossguide,9.490428152654746e-07,,,7.0,,7.0,,,,,,,,forest,,0.18173810338859964,,,weighted,0.08799113476348064,0.46139583051068994,,,COMPLETE,0.0,,,,,,,,,,,,,,,,,,,,
74,74,0.509126411387951,2023-08-23 18:30:47.970567,2023-08-23 18:30:48.536402,0 days 00:00:00.565835,0.0008612130886491626,,,gblinear,XGBoost,0.40604774976337393,,,,,,,5.755356506736241e-07,,,,,,,,,,,,,,,,,,,,0.448754302182083,,,COMPLETE,0.0,,,,,,,,,,,,,,,,,,,,
75,75,0.5638742174499978,2023-08-23 18:30:48.125871,2023-08-23 18:30:48.441634,0 days 00:00:00.315763,,,,,DecisionTreeClassifier,,gini,4.0,,,,,,,,,,,,,,,,,,,,,,,,,,,,COMPLETE,0.0,,,,,,,,,,,,,,,,,,,,
76,76,0.5638742174499978,2023-08-23 18:30:48.365222,2023-08-23 18:30:48.644578,0 days 00:00:00.279356,,,,,DecisionTreeClassifier,,gini,4.0,,,,,,,,,,,,,,,,,,,,,,,,,,,,COMPLETE,0.0,,,,,,,,,,,,,,,,,,,,
77,77,0.5864991038707937,2023-08-23 18:30:48.600639,2023-08-23 18:30:49.561880,0 days 00:00:00.961241,0.0003597127771480191,,,dart,XGBoost,0.3802918389246298,,,0.033535748997538924,,0.0008403035680683301,lossguide,2.421297744956416e-07,,,7.0,,6.0,,,,,,,,forest,,0.006258076684829593,,,weighted,0.2512058247580753,0.3562552575416128,,,COMPLETE,0.0,,,,,,,,,,,,,,,,,,,,
78,78,0.582450345537421,2023-08-23 18:30:48.605157,2023-08-23 18:30:49.838051,0 days 00:00:01.232894,0.0003638256397073571,,,dart,XGBoost,0.3829082905996303,,,0.03850939981798402,,0.0009454999563077366,lossguide,1.8683676079919488e-07,,,7.0,,6.0,,,,,,,,forest,,0.0077359394586993405,,,weighted,0.18003361941735038,0.3462551331961896,,,COMPLETE,0.0,,,,,,,,,,,,,,,,,,,,
79,79,0.5992398004440853,2023-08-23 18:30:48.755390,2023-08-23 18:30:49.678577,0 days 00:00:00.923187,0.00036931488036090937,,,dart,XGBoost,0.3758836479698175,,,0.026112022213655252,,0.0008656980020831204,lossguide,1.489246963435098e-07,,,7.0,,6.0,,,,,,,,forest,,0.007746062202967644,,,weighted,0.23285977107433364,0.37473546824512294,,,COMPLETE,0.0,,,,,,,,,,,,,,,,,,,,
80,80,0.5787884707133056,2023-08-23 18:30:49.028906,2023-08-23 18:30:50.034015,0 days 00:00:01.005109,0.0003567980615115627,,,dart,XGBoost,0.37365722577433114,,,0.04074856039844153,,0.0008974297891468628,depthwise,1.8013265545530205e-07,,,5.0,,6.0,,,,,,,,forest,,0.0100387168028421,,,weighted,0.24541996141607628,0.3670338002084188,,,COMPLETE,0.0,,,,,,,,,,,,,,,,,,,,
81,81,0.5936328011967871,2023-08-23 18:30:49.669993,2023-08-23 18:30:50.986301,0 days 00:00:01.316308,4.7677088383589074e-05,,,dart,XGBoost,0.5179682176387898,,,0.04219084174821837,,0.0008520250400778508,depthwise,6.561373359828773e-08,,,5.0,,8.0,,,,,,,,forest,,0.24052119244581663,,,weighted,0.26979050365537005,0.4219391930427292,,,COMPLETE,0.0,,,,,,,,,,,,,,,,,,,,
82,82,0.5490888750272158,2023-08-23 18:30:49.759272,2023-08-23 18:30:50.559085,0 days 00:00:00.799813,3.618048414503032e-05,,,gbtree,XGBoost,0.37716745104260974,,,0.6162872694295826,,6.30370346451898e-06,lossguide,2.2158028717118308e-06,,,7.0,,6.0,,,,,,,,,,,,,,,0.4291822913031405,,,COMPLETE,0.0,,,,,,,,,,,,,,,,,,,,
83,83,0.5550864744390445,2023-08-23 18:30:49.942725,2023-08-23 18:30:50.993467,0 days 00:00:01.050742,5.258702742302071e-05,,,gbtree,XGBoost,0.37995415749265116,,,0.6130363610624676,,6.464196228915573e-06,lossguide,1.994547586744914e-06,,,7.0,,5.0,,,,,,,,,,,,,,,0.42816739103933776,,,COMPLETE,0.0,,,,,,,,,,,,,,,,,,,,
84,84,0.521120628049901,2023-08-23 18:30:50.140935,2023-08-23 18:31:24.527620,0 days 00:00:34.386685,,,,,MLPClassifier,,,,,,,,,,,,,,identity,lbfgs,4.0,60.0,10.0,100.0,100.0,,,,,,,,,,,COMPLETE,0.0,,,,,,,,,,,,,,,,,,,,
85,85,0.5217977244852945,2023-08-23 18:30:50.646309,2023-08-23 18:31:22.682265,0 days 00:00:32.035956,,,,,MLPClassifier,,,,,,,,,,,,,,identity,lbfgs,4.0,60.0,10.0,100.0,90.0,,,,,,,,,,,COMPLETE,0.0,,,,,,,,,,,,,,,,,,,,
86,86,0.5256435762762359,2023-08-23 18:30:51.143701,2023-08-23 18:31:36.107108,0 days 00:00:44.963407,,,,,MLPClassifier,,,,,,,,,,,,,,identity,lbfgs,4.0,60.0,10.0,100.0,100.0,,,,,,,,,,,COMPLETE,0.0,,,,,,,,,,,,,,,,,,,,
87,87,0.5233178106918973,2023-08-23 18:30:51.145034,2023-08-23 18:31:31.119440,0 days 00:00:39.974406,,,,,MLPClassifier,,,,,,,,,,,,,,identity,lbfgs,4.0,60.0,10.0,100.0,100.0,,,,,,,,,,,COMPLETE,0.0,,,,,,,,,,,,,,,,,,,,
88,88,0.6035909742742351,2023-08-23 18:31:11.290191,2023-08-23 18:31:11.731505,0 days 00:00:00.441314,0.0004202428490070651,,,dart,XGBoost,0.2865645551788439,,,0.08593469688000886,,4.802576138340431e-05,depthwise,5.222898571743402e-08,,,5.0,,5.0,,,,,,,,forest,,0.22156092914044453,,,uniform,0.46963468435267625,0.5228956174405093,,,COMPLETE,0.0,,,,,,,,,,,,,,,,,,,,
89,89,0.5960967869592467,2023-08-23 18:31:11.817661,2023-08-23 18:31:12.158032,0 days 00:00:00.340371,0.006562483755892968,,,dart,XGBoost,0.2767120244323289,,,0.08868172414479118,,3.4807689967811516e-05,depthwise,4.625856856740075e-08,,,5.0,,5.0,,,,,,,,forest,,0.25193329757068217,,,uniform,0.3128823702649843,0.5262211594045147,,,COMPLETE,0.0,,,,,,,,,,,,,,,,,,,,
90,90,0.5975976125589759,2023-08-23 18:31:12.251455,2023-08-23 18:31:12.786554,0 days 00:00:00.535099,0.0007399327919853951,,,dart,XGBoost,0.28207798640819587,,,0.30145064443679015,,9.355510751030075e-05,depthwise,5.224447639184886e-08,,,3.0,,4.0,,,,,,,,forest,,0.2425776270833399,,,uniform,0.021714260356013183,0.5171716520196034,,,COMPLETE,0.0,,,,,,,,,,,,,,,,,,,,
91,91,0.46880243345941064,2023-08-23 18:31:12.914828,2023-08-23 18:32:58.537570,0 days 00:01:45.622742,,,,,MLPClassifier,,,,,,,,,,,,,,identity,adam,4.0,60.0,10.0,100.0,100.0,,,,,,,,,,,COMPLETE,0.0,,,,,,,,,,,,,,,,,,,,
92,92,0.5274976723391863,2023-08-23 18:31:22.803412,2023-08-23 18:31:22.911640,0 days 00:00:00.108228,8.595061246096952e-05,,,gblinear,XGBoost,0.4141734231361738,,,,,,,1.0028237500453585e-08,,,,,,,,,,,,,,,,,,,,0.6221388977991278,,,COMPLETE,0.0,,,,,,,,,,,,,,,,,,,,
93,93,0.5924142009382669,2023-08-23 18:31:23.022329,2023-08-23 18:31:23.463997,0 days 00:00:00.441668,0.0006004795140169161,,,dart,XGBoost,0.3482016151224063,,,0.014825369840846904,,1.7203667037005625e-05,depthwise,2.040916647794823e-07,,,9.0,,5.0,,,,,,,,forest,,0.8341988633686643,,,uniform,0.33575681173381033,0.5173941716122975,,,COMPLETE,0.0,,,,,,,,,,,,,,,,,,,,
94,94,0.5882944169179977,2023-08-23 18:31:23.620023,2023-08-23 18:31:24.215449,0 days 00:00:00.595426,0.00013819046201319482,,,dart,XGBoost,0.4743268895521876,,,0.08389600717696206,,1.6317664320066147e-06,depthwise,1.531502038737676e-05,,,5.0,,9.0,,,,,,,,forest,,0.25121074428625595,,,uniform,0.03349061755704487,0.46499461977622775,,,COMPLETE,0.0,,,,,,,,,,,,,,,,,,,,
95,95,0.6043474366987747,2023-08-23 18:31:24.276695,2023-08-23 18:31:24.934455,0 days 00:00:00.657760,0.004966637078041531,,,dart,XGBoost,0.410652304680657,,,0.35245739341513405,,0.007263379809106624,depthwise,2.6991378544747817e-08,,,5.0,,7.0,,,,,,,,tree,,0.013504410790290735,,,uniform,0.35092320296032153,0.6072313938027566,,,COMPLETE,0.0,,,,,,,,,,,,,,,,,,,,
96,96,0.5886255465112769,2023-08-23 18:31:24.628501,2023-08-23 18:31:25.305709,0 days 00:00:00.677208,0.00451636049374499,,,dart,XGBoost,0.41791793756988055,,,0.3853228028749204,,0.00911441783538639,depthwise,3.0005000464618446e-08,,,5.0,,2.0,,,,,,,,tree,,0.016902842700063904,,,uniform,0.39349075817540785,0.6041007987950812,,,COMPLETE,0.0,,,,,,,,,,,,,,,,,,,,
97,97,0.5766036759300103,2023-08-23 18:31:25.034555,2023-08-23 18:31:25.567123,0 days 00:00:00.532568,0.004506316706722659,,,dart,XGBoost,0.4013034523343501,,,0.4021273443843446,,0.005367064884031648,depthwise,3.045763391519927e-08,,,3.0,,2.0,,,,,,,,tree,,0.015250911100355641,,,uniform,0.34992161629668755,0.648128077637191,,,COMPLETE,0.0,,,,,,,,,,,,,,,,,,,,
98,98,0.5948859889121312,2023-08-23 18:31:25.411589,2023-08-23 18:31:25.994762,0 days 00:00:00.583173,0.0009417597347459902,,,dart,XGBoost,0.4071476091801919,,,0.08773866095405816,,0.0002040242091575063,depthwise,5.6105882239142046e-08,,,5.0,,7.0,,,,,,,,tree,,0.006042037734035301,,,uniform,0.37136301205168804,0.6526275161809194,,,COMPLETE,0.0,,,,,,,,,,,,,,,,,,,,
99,99,0.6004871876826244,2023-08-23 18:31:25.681016,2023-08-23 18:31:26.405144,0 days 00:00:00.724128,0.0010455838027870843,,,dart,XGBoost,0.45707413817460757,,,0.06621274732604653,,0.0003597311821159765,depthwise,5.768313950293756e-08,,,5.0,,7.0,,,,,,,,tree,,0.002851226954618305,,,uniform,0.38750331230046026,0.5530611406133727,,,COMPLETE,0.0,,,,,,,,,,,,,,,,,,,,
100,100,0.588437981345074,2023-08-23 18:31:26.116747,2023-08-23 18:31:26.642582,0 days 00:00:00.525835,0.0003270601996556598,,,dart,XGBoost,0.4639620326488496,,,0.0780745764168968,,0.018699760181985495,depthwise,1.051778807542997e-08,,,5.0,,7.0,,,,,,,,tree,,0.002234783986056188,,,uniform,0.09537697706293387,0.5380480802905717,,,COMPLETE,0.0,,,,,,,,,,,,,,,,,,,,
101,101,0.5807929125555471,2023-08-23 18:31:26.490421,2023-08-23 18:31:27.267755,0 days 00:00:00.777334,0.0002484342830596183,,,dart,XGBoost,0.47342585752564237,,,0.06997887433475179,,0.01671742385034699,depthwise,1.3826577353274243e-08,,,5.0,,7.0,,,,,,,,tree,,0.004057119758595718,,,uniform,0.010849661354904087,0.5441189554712349,,,COMPLETE,0.0,,,,,,,,,,,,,,,,,,,,
102,102,0.5858566722448507,2023-08-23 18:31:26.746758,2023-08-23 18:31:27.527394,0 days 00:00:00.780636,0.0016122916460428853,,,dart,XGBoost,0.5004280387714859,,,0.23584257564231767,,8.428010416360596e-05,depthwise,3.4824982999670666e-07,,,7.0,,8.0,,,,,,,,tree,,0.003522495666816762,,,uniform,0.4969088311546323,0.5995869199323308,,,COMPLETE,0.0,,,,,,,,,,,,,,,,,,,,
103,103,0.6003661658948002,2023-08-23 18:31:27.394949,2023-08-23 18:31:28.098611,0 days 00:00:00.703662,0.0005285553894339202,,,dart,XGBoost,0.5070249961636738,,,0.018689556937074706,,6.567737337202853e-05,depthwise,2.660260986559454e-07,,,7.0,,8.0,,,,,,,,tree,,0.026322429603653687,,,uniform,0.3588142016518406,0.5955119024861341,,,COMPLETE,0.0,,,,,,,,,,,,,,,,,,,,
104,104,0.5155041210653538,2023-08-23 18:31:27.621713,2023-08-23 18:31:27.850805,0 days 00:00:00.229092,0.00048072872152512235,,,gblinear,XGBoost,0.3540555686598554,,,,,,,8.772733153629863e-08,,,,,,,,,,,,,,,,,,,,0.48799445674391273,,,COMPLETE,0.0,,,,,,,,,,,,,,,,,,,,
105,105,0.5968948589806187,2023-08-23 18:31:27.935784,2023-08-23 18:31:28.549489,0 days 00:00:00.613705,0.008293372680175605,,,dart,XGBoost,0.5253254549519825,,,0.01607649197605881,,0.0004739907553372778,lossguide,4.7110665965604834e-08,,,7.0,,5.0,,,,,,,,tree,,0.023073844054450787,,,uniform,0.45489296954638253,0.5889522230660993,,,COMPLETE,0.0,,,,,,,,,,,,,,,,,,,,
106,106,0.5496006802186577,2023-08-23 18:31:28.193070,2023-08-23 18:31:28.817338,0 days 00:00:00.624268,,,,,DecisionTreeClassifier,,log_loss,12.0,,,,,,,,,,,,,,,,,,,,,,,,,,,,COMPLETE,0.0,,,,,,,,,,,,,,,,,,,,
107,107,0.5407291590151492,2023-08-23 18:31:28.665165,2023-08-23 18:31:29.124839,0 days 00:00:00.459674,,,,,DecisionTreeClassifier,,log_loss,11.0,,,,,,,,,,,,,,,,,,,,,,,,,,,,COMPLETE,0.0,,,,,,,,,,,,,,,,,,,,
108,108,0.595632354818603,2023-08-23 18:31:28.909074,2023-08-23 18:31:29.524885,0 days 00:00:00.615811,0.0006569479243544134,,,dart,XGBoost,0.4727591840433758,,,0.01681145996209185,,6.307564617568687e-05,depthwise,1.4181384528358295e-07,,,7.0,,8.0,,,,,,,,tree,,0.07618569484856787,,,uniform,0.15939426515291155,0.5382047653046842,,,COMPLETE,0.0,,,,,,,,,,,,,,,,,,,,
109,109,0.5929401032605118,2023-08-23 18:31:29.235109,2023-08-23 18:31:30.122914,0 days 00:00:00.887805,0.000632781344539929,,,dart,XGBoost,0.4669932841488492,,,0.016394283601266938,,3.627874834751106e-05,depthwise,1.157010458975303e-07,,,7.0,,8.0,,,,,,,,tree,,0.08548105381154467,,,uniform,0.16087503816279466,0.5479815302763129,,,COMPLETE,0.0,,,,,,,,,,,,,,,,,,,,
110,110,0.5912069181648603,2023-08-23 18:31:29.721248,2023-08-23 18:31:30.396646,0 days 00:00:00.675398,9.935361207647747e-05,,,dart,XGBoost,0.43038229357302743,,,0.3885048490577413,,0.0004850532427277857,depthwise,2.902052751910591e-07,,,7.0,,9.0,,,,,,,,tree,,0.02894054047463125,,,uniform,0.4874264247172253,0.5734704543098026,,,COMPLETE,0.0,,,,,,,,,,,,,,,,,,,,
111,111,0.5782403825537925,2023-08-23 18:31:30.205936,2023-08-23 18:31:30.908000,0 days 00:00:00.702064,9.122001631435586e-05,,,dart,XGBoost,0.4391263173485211,,,0.38386607107176773,,0.00034338029726476544,depthwise,7.348293787708407e-08,,,5.0,,6.0,,,,,,,,tree,,0.0283473839611039,,,weighted,0.4880817036491022,0.5065506148464178,,,COMPLETE,0.0,,,,,,,,,,,,,,,,,,,,
112,112,0.5828212658609133,2023-08-23 18:31:30.499406,2023-08-23 18:31:31.492887,0 days 00:00:00.993481,0.0013694370402691479,,,dart,XGBoost,0.49326985219649494,,,0.06506901642572874,,0.001686891457700377,depthwise,5.951722380213952e-08,,,9.0,,6.0,,,,,,,,forest,,0.38778640104304474,,,weighted,0.981216313077812,0.5057383677724252,,,COMPLETE,0.0,,,,,,,,,,,,,,,,,,,,
113,113,0.5848744742376446,2023-08-23 18:31:31.012605,2023-08-23 18:31:31.773019,0 days 00:00:00.760414,0.001240114456050582,,,gbtree,XGBoost,0.494728003140154,,,0.07235298956628117,,0.00155477678888181,depthwise,2.1999260767672615e-08,,,5.0,,7.0,,,,,,,,,,,,,,,0.5879842836442379,,,COMPLETE,0.0,,,,,,,,,,,,,,,,,,,,
114,114,0.5845337055476126,2023-08-23 18:31:31.281082,2023-08-23 18:31:31.998843,0 days 00:00:00.717761,0.0012232463017619953,,,gbtree,XGBoost,0.3973520879547227,,,0.06793019609260971,,0.001886892545527458,depthwise,2.5001298358038066e-08,,,5.0,,7.0,,,,,,,,,,,,,,,0.5031537270155988,,,COMPLETE,0.0,,,,,,,,,,,,,,,,,,,,
115,115,0.5862339060339616,2023-08-23 18:31:31.596447,2023-08-23 18:31:33.309790,0 days 00:00:01.713343,,,,,RandomForestClassifier,,,,,,,,,,,,,,,,,,,,,,,,59.0,2.0,,,,,,COMPLETE,0.0,,,,,,,,,,,,,,,,,,,,
116,116,0.5851051257069394,2023-08-23 18:31:31.899998,2023-08-23 18:31:33.248486,0 days 00:00:01.348488,,,,,RandomForestClassifier,,,,,,,,,,,,,,,,,,,,,,,,56.0,2.0,,,,,,COMPLETE,0.0,,,,,,,,,,,,,,,,,,,,
117,117,0.33666143678980653,2023-08-23 18:31:32.098238,2023-08-23 18:31:39.157871,0 days 00:00:07.059633,,,,,SVC,,,,,,,,,,,,,,,,,,,,,,,,,,,,,0.16924020266836867,rbf,COMPLETE,0.0,,,,,,,,,,,,,,,,,,,,
118,118,0.5919655612434052,2023-08-23 18:31:33.382135,2023-08-23 18:31:33.785728,0 days 00:00:00.403593,0.0002460994598009921,,,dart,XGBoost,0.42598450983981434,,,0.18666059601411186,,0.000157532870592877,depthwise,1.4698786601026113e-07,,,5.0,,8.0,,,,,,,,forest,,0.4713737086969608,,,uniform,0.5318614823353561,0.5435475072730891,,,COMPLETE,0.0,,,,,,,,,,,,,,,,,,,,
119,119,0.5933743928086141,2023-08-23 18:31:33.392413,2023-08-23 18:31:33.683541,0 days 00:00:00.291128,0.0029399850845269076,,,dart,XGBoost,0.42302335941111235,,,0.15799975140103595,,0.00015715005376810363,depthwise,0.0002765748256707486,,,5.0,,8.0,,,,,,,,forest,,0.4847262979948145,,,uniform,0.47500458384806205,0.5560275768059646,,,COMPLETE,0.0,,,,,,,,,,,,,,,,,,,,
120,120,0.5910830899223147,2023-08-23 18:31:33.772678,2023-08-23 18:31:34.555810,0 days 00:00:00.783132,0.00023642742422939843,,,dart,XGBoost,0.35642105121887796,,,0.9218043946248272,,0.0005504297990206092,depthwise,1.3278716318328185e-07,,,5.0,,8.0,,,,,,,,forest,,0.5025518175927909,,,uniform,0.1966868410515778,0.5284379750285679,,,COMPLETE,0.0,,,,,,,,,,,,,,,,,,,,
121,121,0.5816882588576949,2023-08-23 18:31:33.951877,2023-08-23 18:31:34.439261,0 days 00:00:00.487384,0.00035399176924379746,,,dart,XGBoost,0.3598944748791334,,,0.9201092865163607,,0.0004474699158771355,depthwise,3.793326069670365e-07,,,5.0,,7.0,,,,,,,,forest,,0.8573538382196901,,,uniform,0.19668428210303313,0.4862901064852313,,,COMPLETE,0.0,,,,,,,,,,,,,,,,,,,,
122,122,0.3368755135097068,2023-08-23 18:31:34.532207,2023-08-23 18:31:41.377082,0 days 00:00:06.844875,,,,,SVC,,,,,,,,,,,,,,,,,,,,,,,,,,,,,0.15328514397637416,rbf,COMPLETE,0.0,,,,,,,,,,,,,,,,,,,,
123,123,0.33666143678980653,2023-08-23 18:31:34.715204,2023-08-23 18:31:41.451833,0 days 00:00:06.736629,,,,,SVC,,,,,,,,,,,,,,,,,,,,,,,,,,,,,0.16776878025983769,rbf,COMPLETE,0.0,,,,,,,,,,,,,,,,,,,,
124,124,0.33666143678980653,2023-08-23 18:31:36.227271,2023-08-23 18:31:42.129355,0 days 00:00:05.902084,,,,,SVC,,,,,,,,,,,,,,,,,,,,,,,,,,,,,0.1585892603065811,rbf,COMPLETE,0.0,,,,,,,,,,,,,,,,,,,,
125,125,0.5887551924730184,2023-08-23 18:31:39.255635,2023-08-23 18:31:39.755243,0 days 00:00:00.499608,0.0005997560709034418,,,dart,XGBoost,0.4517569330692567,,,0.02576648941601216,,0.0003121759630066681,depthwise,0.007316891725476192,,,7.0,,9.0,,,,,,,,forest,,0.04171631751412487,,,weighted,0.9880874384798257,0.576073935850746,,,COMPLETE,0.0,,,,,,,,,,,,,,,,,,,,
126,126,0.5870511471626392,2023-08-23 18:31:39.873018,2023-08-23 18:31:40.350289,0 days 00:00:00.477271,0.0017803231462565883,,,dart,XGBoost,0.3943968982249616,,,0.13726823782803366,,0.00086806967765017,depthwise,3.924083050039497e-08,,,5.0,,7.0,,,,,,,,forest,,0.10865476704572549,,,weighted,0.0644259978322689,0.45294051052141127,,,COMPLETE,0.0,,,,,,,,,,,,,,,,,,,,
127,127,0.5877910470181764,2023-08-23 18:31:40.461862,2023-08-23 18:31:40.730222,0 days 00:00:00.268360,0.0009417736926250913,,,dart,XGBoost,0.4486536484692731,,,0.03295396996583269,,0.00010452812323644298,depthwise,7.170124932502149e-08,,,5.0,,4.0,,,,,,,,forest,,0.053346014624780426,,,weighted,0.6567334724512188,0.3212309472173579,,,COMPLETE,0.0,,,,,,,,,,,,,,,,,,,,
128,128,0.588437981345074,2023-08-23 18:31:40.825132,2023-08-23 18:31:41.115679,0 days 00:00:00.290547,0.0005362791197960294,,,dart,XGBoost,0.3015070262538465,,,0.2937750559787027,,7.371993285600538e-05,depthwise,4.3607365600421504e-08,,,7.0,,4.0,,,,,,,,forest,,0.20300968435349107,,,uniform,0.2601332964988724,0.511424940113517,,,COMPLETE,0.0,,,,,,,,,,,,,,,,,,,,
129,129,0.601492177961796,2023-08-23 18:31:41.234907,2023-08-23 18:31:41.913955,0 days 00:00:00.679048,0.0027697788291355663,,,dart,XGBoost,0.3155981886456191,,,0.2428622707591544,,0.00025089189494842244,depthwise,9.153129902401373e-08,,,3.0,,4.0,,,,,,,,forest,,0.3606925929787381,,,uniform,0.06378384064998498,0.39991463560081225,,,COMPLETE,0.0,,,,,,,,,,,,,,,,,,,,
130,130,0.5973358090254186,2023-08-23 18:31:41.449202,2023-08-23 18:31:42.301823,0 days 00:00:00.852621,0.0026619918847488773,,,dart,XGBoost,0.28029259117231425,,,0.23791421318848743,,0.0002969479028807941,depthwise,9.419027031645356e-08,,,3.0,,4.0,,,,,,,,forest,,0.28820036208010685,,,uniform,0.053451505400499436,0.40650278049553457,,,COMPLETE,0.0,,,,,,,,,,,,,,,,,,,,
131,131,0.5920788178847143,2023-08-23 18:31:41.581549,2023-08-23 18:31:42.416850,0 days 00:00:00.835301,0.0031004971978059507,,,dart,XGBoost,0.260524359405145,,,0.12917910639061828,,0.00022256845094655516,depthwise,1.8463523540337983e-08,,,3.0,,4.0,,,,,,,,forest,,0.3247732620573359,,,uniform,0.10935672627040505,0.48879966104745337,,,COMPLETE,0.0,,,,,,,,,,,,,,,,,,,,
132,132,0.5827962299930325,2023-08-23 18:31:42.027265,2023-08-23 18:31:43.286710,0 days 00:00:01.259445,0.0026387208855135147,,,dart,XGBoost,0.3350910455806926,,,0.1258085513354207,,0.0002665388081677599,depthwise,2.1449343861271795e-07,,,7.0,,3.0,,,,,,,,forest,,0.014938251606155443,,,uniform,0.11363995877237303,0.39650893304911106,,,COMPLETE,0.0,,,,,,,,,,,,,,,,,,,,
133,133,0.5962790631492074,2023-08-23 18:31:42.243968,2023-08-23 18:31:43.158650,0 days 00:00:00.914682,0.003151387962618422,,,dart,XGBoost,0.38515092148327407,,,0.11068336971713748,,0.000722810594024148,depthwise,1.9932664187246812e-07,,,3.0,,8.0,,,,,,,,forest,,0.01411748171550211,,,uniform,0.09233743885794325,0.40171308123820193,,,COMPLETE,0.0,,,,,,,,,,,,,,,,,,,,
134,134,0.5908358662613982,2023-08-23 18:31:42.391145,2023-08-23 18:31:43.056751,0 days 00:00:00.665606,0.0035204549122955222,,,dart,XGBoost,0.32798474447401255,,,0.11272129534016942,,0.0006438043238569286,depthwise,2.2945167039537725e-07,,,3.0,,8.0,,,,,,,,forest,,0.015282536181539012,,,weighted,0.11564221430839106,0.44589995581378983,,,COMPLETE,0.0,,,,,,,,,,,,,,,,,,,,
135,135,0.5945261872681229,2023-08-23 18:31:42.501993,2023-08-23 18:31:43.583215,0 days 00:00:01.081222,0.009945418163538155,,,dart,XGBoost,0.32925941474365084,,,0.06146057372784815,,0.0006501899385840815,lossguide,2.403240361880516e-07,,,7.0,,8.0,,,,,,,,forest,,0.012771226764610313,,,weighted,0.5718734920166795,0.393516814589872,,,COMPLETE,0.0,,,,,,,,,,,,,,,,,,,,
