,number,value,datetime_start,datetime_complete,duration,params_alpha,params_bagging_fraction,params_bagging_freq,params_booster,params_classifier,params_colsample_bytree,params_dct_criterion,params_dct_max_depth,params_eta,params_feature_fraction,params_gamma,params_grow_policy,params_lambda,params_lambda_l1,params_lambda_l2,params_max_depth,params_min_child_samples,params_min_child_weight,params_mlp_activation,params_mlp_solver,params_n_layers,params_n_units_l_0,params_n_units_l_1,params_n_units_l_2,params_n_units_l_3,params_normalize_type,params_num_leaves,params_rate_drop,params_rf_estimator,params_rf_max_depth,params_sample_type,params_skip_drop,params_subsample,params_svc_c,params_svc_kernel,state,best_trial,dev_acc,dev_recall_macro,dev_precision_macro,dev_f1_macro,dev_recall_0,dev_precision_0,dev_f1_0,dev_recall_1,dev_precision_1,dev_f1_1,test_acc,test_recall_macro,test_precision_macro,test_f1_macro,test_recall_0,test_precision_0,test_f1_0,test_recall_1,test_precision_1,test_f1_1
0,0,0.7543713995255846,2023-08-23 18:44:19.152325,2023-08-23 18:44:19.285916,0 days 00:00:00.133591,,,,,DecisionTreeClassifier,,log_loss,2.0,,,,,,,,,,,,,,,,,,,,,,,,,,,,COMPLETE,0.0,,,,,,,,,,,,,,,,,,,,
1,1,0.5449868279933776,2023-08-23 18:44:19.156963,2023-08-23 18:44:28.801543,0 days 00:00:09.644580,,,,,SVC,,,,,,,,,,,,,,,,,,,,,,,,,,,,,290.9574680205676,rbf,COMPLETE,0.0,,,,,,,,,,,,,,,,,,,,
2,2,0.737802350143528,2023-08-23 18:44:19.157295,2023-08-23 18:44:21.200650,0 days 00:00:02.043355,,,,,RandomForestClassifier,,,,,,,,,,,,,,,,,,,,,,,,79.0,3.0,,,,,,COMPLETE,0.0,,,,,,,,,,,,,,,,,,,,
3,3,0.7570708613853389,2023-08-23 18:44:19.159970,2023-08-23 18:44:22.000350,0 days 00:00:02.840380,,,,,RandomForestClassifier,,,,,,,,,,,,,,,,,,,,,,,,79.0,5.0,,,,,,COMPLETE,0.0,,,,,,,,,,,,,,,,,,,,
4,4,0.7607251146905327,2023-08-23 18:44:19.160361,2023-08-23 18:44:19.453544,0 days 00:00:00.293183,,,,,DecisionTreeClassifier,,entropy,3.0,,,,,,,,,,,,,,,,,,,,,,,,,,,,COMPLETE,0.0,,,,,,,,,,,,,,,,,,,,
5,5,0.7155726486111501,2023-08-23 18:44:19.160700,2023-08-23 18:44:19.865940,0 days 00:00:00.705240,,,,,DecisionTreeClassifier,,entropy,12.0,,,,,,,,,,,,,,,,,,,,,,,,,,,,COMPLETE,0.0,,,,,,,,,,,,,,,,,,,,
6,6,0.7636078031360767,2023-08-23 18:44:19.164180,2023-08-23 18:44:20.117878,0 days 00:00:00.953698,,,,,RandomForestClassifier,,,,,,,,,,,,,,,,,,,,,,,,22.0,7.0,,,,,,COMPLETE,0.0,,,,,,,,,,,,,,,,,,,,
7,7,0.7470682290901155,2023-08-23 18:44:19.169454,2023-08-23 18:44:22.321704,0 days 00:00:03.152250,,,,,RandomForestClassifier,,,,,,,,,,,,,,,,,,,,,,,,100.0,4.0,,,,,,COMPLETE,0.0,,,,,,,,,,,,,,,,,,,,
8,8,0.48253265957949854,2023-08-23 18:44:19.328344,2023-08-23 18:44:25.846737,0 days 00:00:06.518393,,,,,SVC,,,,,,,,,,,,,,,,,,,,,,,,,,,,,0.11001458773458118,linear,COMPLETE,0.0,,,,,,,,,,,,,,,,,,,,
9,9,0.7823651652823993,2023-08-23 18:44:19.514084,2023-08-23 18:44:30.681259,0 days 00:00:11.167175,,,,,RandomForestClassifier,,,,,,,,,,,,,,,,,,,,,,,,97.0,17.0,,,,,,COMPLETE,0.0,,,,,,,,,,,,,,,,,,,,
10,10,0.7457855973813421,2023-08-23 18:44:19.915810,2023-08-23 18:44:20.517006,0 days 00:00:00.601196,,,,,RandomForestClassifier,,,,,,,,,,,,,,,,,,,,,,,,19.0,4.0,,,,,,COMPLETE,0.0,,,,,,,,,,,,,,,,,,,,
11,11,0.8274841991125322,2023-08-23 18:44:20.170247,2023-08-23 18:44:20.955071,0 days 00:00:00.784824,,0.8,1.0,,LightGBM,,,,,0.5,,,,0.6750993920022075,0.0006243634179635229,,70.0,,,,,,,,,,15.0,,,,,,,,,COMPLETE,0.0,,,,,,,,,,,,,,,,,,,,
12,12,0.7510391837547357,2023-08-23 18:44:20.572497,2023-08-23 18:44:20.832437,0 days 00:00:00.259940,,,,,DecisionTreeClassifier,,log_loss,4.0,,,,,,,,,,,,,,,,,,,,,,,,,,,,COMPLETE,0.0,,,,,,,,,,,,,,,,,,,,
13,13,0.7916890415162855,2023-08-23 18:44:20.882045,2023-08-23 18:44:21.395381,0 days 00:00:00.513336,0.3806953350329129,,,gbtree,XGBoost,0.5510466534650726,,,7.584855487900033e-05,,0.057736753007115414,lossguide,6.310997221952904e-05,,,7.0,,3.0,,,,,,,,,,,,,,,0.307351088252269,,,COMPLETE,0.0,,,,,,,,,,,,,,,,,,,,
14,14,0.819370440849984,2023-08-23 18:44:21.016087,2023-08-23 18:44:22.426940,0 days 00:00:01.410853,,0.4,1.0,,LightGBM,,,,,0.4,,,,0.19567681273771861,0.0006032028543224326,,60.0,,,,,,,,,,247.0,,,,,,,,,COMPLETE,0.0,,,,,,,,,,,,,,,,,,,,
15,15,0.746892164446658,2023-08-23 18:44:21.260508,2023-08-23 18:44:21.758292,0 days 00:00:00.497784,,,,,DecisionTreeClassifier,,entropy,7.0,,,,,,,,,,,,,,,,,,,,,,,,,,,,COMPLETE,0.0,,,,,,,,,,,,,,,,,,,,
16,16,0.7760504634397529,2023-08-23 18:44:21.443464,2023-08-23 18:44:23.121453,0 days 00:00:01.677989,,,,,RandomForestClassifier,,,,,,,,,,,,,,,,,,,,,,,,19.0,14.0,,,,,,COMPLETE,0.0,,,,,,,,,,,,,,,,,,,,
17,17,0.8168529732875343,2023-08-23 18:44:21.807628,2023-08-23 18:44:22.647287,0 days 00:00:00.839659,,0.8,1.0,,LightGBM,,,,,0.5,,,,0.972411050099427,0.0006430480689424808,,70.0,,,,,,,,,,7.0,,,,,,,,,COMPLETE,0.0,,,,,,,,,,,,,,,,,,,,
18,18,0.803211568744871,2023-08-23 18:44:22.051643,2023-08-23 18:44:22.749961,0 days 00:00:00.698318,,0.8,1.0,,LightGBM,,,,,0.5,,,,0.8469225129344535,0.0013427350138682645,,70.0,,,,,,,,,,3.0,,,,,,,,,COMPLETE,0.0,,,,,,,,,,,,,,,,,,,,
19,19,0.8050232480340852,2023-08-23 18:44:22.377893,2023-08-23 18:44:23.016051,0 days 00:00:00.638158,,0.8,1.0,,LightGBM,,,,,0.5,,,,0.3786048422261102,0.00011173648216115782,,80.0,,,,,,,,,,3.0,,,,,,,,,COMPLETE,0.0,,,,,,,,,,,,,,,,,,,,
20,20,0.8241489286260809,2023-08-23 18:44:22.485198,2023-08-23 18:44:24.472158,0 days 00:00:01.986960,,0.7000000000000001,1.0,,LightGBM,,,,,0.4,,,,0.7471485963284663,0.0006191558287623712,,70.0,,,,,,,,,,41.0,,,,,,,,,COMPLETE,0.0,,,,,,,,,,,,,,,,,,,,
21,21,0.8236841239789265,2023-08-23 18:44:22.700142,2023-08-23 18:44:24.353373,0 days 00:00:01.653231,,0.4,1.0,,LightGBM,,,,,0.4,,,,0.5719434634815136,0.0003263190896787269,,60.0,,,,,,,,,,255.0,,,,,,,,,COMPLETE,0.0,,,,,,,,,,,,,,,,,,,,
22,22,0.8115796987850625,2023-08-23 18:44:22.817048,2023-08-23 18:44:25.708791,0 days 00:00:02.891743,,0.4,2.0,,LightGBM,,,,,0.4,,,,0.0026304987110279286,2.7256184956984054e-06,,30.0,,,,,,,,,,251.0,,,,,,,,,COMPLETE,0.0,,,,,,,,,,,,,,,,,,,,
23,23,0.6447247163284857,2023-08-23 18:44:23.067493,2023-08-23 18:56:46.835205,0 days 00:12:23.767712,,,,,MLPClassifier,,,,,,,,,,,,,,logistic,adam,1.0,90.0,,,,,,,,,,,,,,COMPLETE,0.0,,,,,,,,,,,,,,,,,,,,
24,24,0.3357921744708146,2023-08-23 18:44:23.197246,2023-08-23 18:44:32.940545,0 days 00:00:09.743299,,,,,SVC,,,,,,,,,,,,,,,,,,,,,,,,,,,,,98.73316631251178,poly,COMPLETE,0.0,,,,,,,,,,,,,,,,,,,,
25,25,0.6786937315588453,2023-08-23 18:44:24.466513,2023-08-23 18:46:36.424003,0 days 00:02:11.957490,,,,,MLPClassifier,,,,,,,,,,,,,,logistic,lbfgs,1.0,80.0,,,,,,,,,,,,,,COMPLETE,0.0,,,,,,,,,,,,,,,,,,,,
26,26,0.6454058190531234,2023-08-23 18:44:24.593570,2023-08-23 18:48:51.134042,0 days 00:04:26.540472,,,,,MLPClassifier,,,,,,,,,,,,,,identity,lbfgs,3.0,100.0,80.0,10.0,,,,,,,,,,,,COMPLETE,0.0,,,,,,,,,,,,,,,,,,,,
27,27,0.7025982331930227,2023-08-23 18:44:25.834483,2023-08-23 18:57:50.898391,0 days 00:13:25.063908,,,,,MLPClassifier,,,,,,,,,,,,,,relu,adam,2.0,100.0,60.0,,,,,,,,,,,,,COMPLETE,0.0,,,,,,,,,,,,,,,,,,,,
28,28,0.6749768029294887,2023-08-23 18:44:26.005595,2023-08-23 18:50:40.814588,0 days 00:06:14.808993,,,,,MLPClassifier,,,,,,,,,,,,,,relu,lbfgs,4.0,30.0,90.0,70.0,80.0,,,,,,,,,,,COMPLETE,0.0,,,,,,,,,,,,,,,,,,,,
29,29,0.6720675730120211,2023-08-23 18:44:28.896240,2023-08-23 18:51:26.267848,0 days 00:06:57.371608,,,,,MLPClassifier,,,,,,,,,,,,,,tanh,lbfgs,4.0,100.0,60.0,30.0,80.0,,,,,,,,,,,COMPLETE,0.0,,,,,,,,,,,,,,,,,,,,
30,30,0.7093333333333334,2023-08-23 18:44:30.814956,2023-08-23 18:57:54.464870,0 days 00:13:23.649914,,,,,MLPClassifier,,,,,,,,,,,,,,tanh,adam,2.0,50.0,90.0,,,,,,,,,,,,,COMPLETE,0.0,,,,,,,,,,,,,,,,,,,,
31,31,0.7191213783983861,2023-08-23 18:44:33.056595,2023-08-23 18:45:31.236666,0 days 00:00:58.180071,,,,,MLPClassifier,,,,,,,,,,,,,,tanh,adam,3.0,10.0,50.0,20.0,,,,,,,,,,,,COMPLETE,0.0,,,,,,,,,,,,,,,,,,,,
32,32,0.813921765623596,2023-08-23 18:45:31.388075,2023-08-23 18:45:35.307565,0 days 00:00:03.919490,,0.6000000000000001,2.0,,LightGBM,,,,,0.8,,,,5.170810004619595e-07,0.27032300026685335,,40.0,,,,,,,,,,97.0,,,,,,,,,COMPLETE,0.0,,,,,,,,,,,,,,,,,,,,
33,33,0.8222241297909783,2023-08-23 18:45:35.396569,2023-08-23 18:45:37.476479,0 days 00:00:02.079910,,0.6000000000000001,1.0,,LightGBM,,,,,1.0,,,,0.007285954844246817,5.22359584581206e-06,,100.0,,,,,,,,,,89.0,,,,,,,,,COMPLETE,0.0,,,,,,,,,,,,,,,,,,,,
34,34,0.3357921744708146,2023-08-23 18:45:37.585877,2023-08-23 18:46:34.922287,0 days 00:00:57.336410,,,,,MLPClassifier,,,,,,,,,,,,,,logistic,sgd,1.0,100.0,,,,,,,,,,,,,,COMPLETE,0.0,,,,,,,,,,,,,,,,,,,,
35,35,0.3357921744708146,2023-08-23 18:46:35.008968,2023-08-23 18:46:35.299398,0 days 00:00:00.290430,1.6855062122975037e-08,,,gblinear,XGBoost,0.9478624387954522,,,,,,,0.7545782056328785,,,,,,,,,,,,,,,,,,,,0.9184829293404951,,,COMPLETE,0.0,,,,,,,,,,,,,,,,,,,,
36,36,0.8231747942444432,2023-08-23 18:46:35.386668,2023-08-23 18:46:39.744026,0 days 00:00:04.357358,,1.0,3.0,,LightGBM,,,,,0.6000000000000001,,,,0.013002339374467296,3.976815552928759e-08,,50.0,,,,,,,,,,181.0,,,,,,,,,COMPLETE,0.0,,,,,,,,,,,,,,,,,,,,
37,37,0.825569482924553,2023-08-23 18:46:36.499781,2023-08-23 18:46:40.577020,0 days 00:00:04.077239,,1.0,3.0,,LightGBM,,,,,0.6000000000000001,,,,0.011309532687650219,1.2602112263799844e-08,,50.0,,,,,,,,,,152.0,,,,,,,,,COMPLETE,0.0,,,,,,,,,,,,,,,,,,,,
38,38,0.8202102555102924,2023-08-23 18:46:39.817276,2023-08-23 18:46:44.201018,0 days 00:00:04.383742,,1.0,3.0,,LightGBM,,,,,0.6000000000000001,,,,0.016912072659900062,2.6410473767860124e-08,,50.0,,,,,,,,,,184.0,,,,,,,,,COMPLETE,0.0,,,,,,,,,,,,,,,,,,,,
39,39,0.8099940119970166,2023-08-23 18:46:40.688409,2023-08-23 18:46:44.525702,0 days 00:00:03.837293,,1.0,3.0,,LightGBM,,,,,0.4,,,,0.048678950186400456,2.5070257067325264e-08,,10.0,,,,,,,,,,64.0,,,,,,,,,COMPLETE,0.0,,,,,,,,,,,,,,,,,,,,
40,40,0.8130066201988977,2023-08-23 18:46:44.317212,2023-08-23 18:46:46.867459,0 days 00:00:02.550247,,0.7000000000000001,2.0,,LightGBM,,,,,0.4,,,,0.95019654186635,0.009012208429039317,,80.0,,,,,,,,,,81.0,,,,,,,,,COMPLETE,0.0,,,,,,,,,,,,,,,,,,,,
41,41,0.824650238368083,2023-08-23 18:46:44.676463,2023-08-23 18:46:47.325483,0 days 00:00:02.649020,,0.7000000000000001,2.0,,LightGBM,,,,,0.6000000000000001,,,,0.6908941015193337,0.010278009284046362,,80.0,,,,,,,,,,53.0,,,,,,,,,COMPLETE,0.0,,,,,,,,,,,,,,,,,,,,
42,42,0.8216214172222622,2023-08-23 18:46:47.008776,2023-08-23 18:46:49.686480,0 days 00:00:02.677704,,0.6000000000000001,1.0,,LightGBM,,,,,0.6000000000000001,,,,0.0705121203437552,2.739180264360624e-05,,60.0,,,,,,,,,,45.0,,,,,,,,,COMPLETE,0.0,,,,,,,,,,,,,,,,,,,,
43,43,0.8284412269355709,2023-08-23 18:46:47.416884,2023-08-23 18:46:49.983577,0 days 00:00:02.566693,,0.7000000000000001,2.0,,LightGBM,,,,,0.7000000000000001,,,,0.061699876900917335,0.009094989229391245,,90.0,,,,,,,,,,53.0,,,,,,,,,COMPLETE,0.0,,,,,,,,,,,,,,,,,,,,
44,44,0.7576700076722849,2023-08-23 18:46:49.781009,2023-08-23 18:46:50.575275,0 days 00:00:00.794266,0.00012095745475065005,,,dart,XGBoost,0.21127546671418124,,,0.45429021547522314,,1.3831440835655384e-08,depthwise,1.3770357614835172e-08,,,3.0,,10.0,,,,,,,,forest,,1.759487334308468e-08,,,uniform,0.005095433195018981,0.21739108458108147,,,COMPLETE,0.0,,,,,,,,,,,,,,,,,,,,
45,45,0.7622894523194073,2023-08-23 18:46:50.126057,2023-08-23 18:46:50.819421,0 days 00:00:00.693364,5.979635882495281e-05,,,dart,XGBoost,0.20828547903112804,,,0.7592649742287025,,2.617257085662948e-08,depthwise,1.2020275675918949e-08,,,3.0,,10.0,,,,,,,,tree,,0.013065146842762693,,,weighted,1.9434234861082387e-06,0.26202027352836443,,,COMPLETE,0.0,,,,,,,,,,,,,,,,,,,,
46,46,0.3357921744708146,2023-08-23 18:46:50.664319,2023-08-23 18:47:00.508022,0 days 00:00:09.843703,,,,,SVC,,,,,,,,,,,,,,,,,,,,,,,,,,,,,0.0011593727654686003,poly,COMPLETE,0.0,,,,,,,,,,,,,,,,,,,,
47,47,0.3357921744708146,2023-08-23 18:46:50.906393,2023-08-23 18:47:01.958041,0 days 00:00:11.051648,,,,,SVC,,,,,,,,,,,,,,,,,,,,,,,,,,,,,0.0013123016071337667,rbf,COMPLETE,0.0,,,,,,,,,,,,,,,,,,,,
48,48,0.8264880879451195,2023-08-23 18:47:00.637932,2023-08-23 18:47:03.289466,0 days 00:00:02.651534,,0.7000000000000001,2.0,,LightGBM,,,,,0.7000000000000001,,,,0.06905956830431555,0.011698703686748808,,90.0,,,,,,,,,,42.0,,,,,,,,,COMPLETE,0.0,,,,,,,,,,,,,,,,,,,,
49,49,0.8193401067323481,2023-08-23 18:47:02.084880,2023-08-23 18:47:04.287774,0 days 00:00:02.202894,,0.7000000000000001,2.0,,LightGBM,,,,,0.7000000000000001,,,,0.07373364750461862,0.01565409387202663,,90.0,,,,,,,,,,42.0,,,,,,,,,COMPLETE,0.0,,,,,,,,,,,,,,,,,,,,
50,50,0.8241564762062936,2023-08-23 18:47:03.378100,2023-08-23 18:47:05.783257,0 days 00:00:02.405157,,0.7000000000000001,2.0,,LightGBM,,,,,0.7000000000000001,,,,0.05004328474629703,0.011245908736453003,,100.0,,,,,,,,,,153.0,,,,,,,,,COMPLETE,0.0,,,,,,,,,,,,,,,,,,,,
51,51,0.8299604962875466,2023-08-23 18:47:04.384891,2023-08-23 18:47:07.770474,0 days 00:00:03.385583,,0.9,2.0,,LightGBM,,,,,0.7000000000000001,,,,0.001848015784242533,0.017119063771217784,,90.0,,,,,,,,,,138.0,,,,,,,,,COMPLETE,0.0,,,,,,,,,,,,,,,,,,,,
52,52,0.814996171375886,2023-08-23 18:47:05.867490,2023-08-23 18:47:09.000669,0 days 00:00:03.133179,,0.9,2.0,,LightGBM,,,,,0.8,,,,0.0007343955976227331,0.051738149559722904,,90.0,,,,,,,,,,126.0,,,,,,,,,COMPLETE,0.0,,,,,,,,,,,,,,,,,,,,
53,53,0.70188834895623,2023-08-23 18:47:07.911790,2023-08-23 18:47:09.763033,0 days 00:00:01.851243,,,,,DecisionTreeClassifier,,gini,23.0,,,,,,,,,,,,,,,,,,,,,,,,,,,,COMPLETE,0.0,,,,,,,,,,,,,,,,,,,,
54,54,0.6922538051669604,2023-08-23 18:47:09.072157,2023-08-23 18:47:10.738136,0 days 00:00:01.665979,,,,,DecisionTreeClassifier,,gini,26.0,,,,,,,,,,,,,,,,,,,,,,,,,,,,COMPLETE,0.0,,,,,,,,,,,,,,,,,,,,
55,55,0.8309196886598976,2023-08-23 18:47:09.897713,2023-08-23 18:47:13.381252,0 days 00:00:03.483539,,0.9,2.0,,LightGBM,,,,,0.8,,,,0.002325762112507603,0.0021797386693356976,,90.0,,,,,,,,,,138.0,,,,,,,,,COMPLETE,1.0,0.8309995171414776,0.8308606808142311,0.8311664790157758,0.8309196886598976,0.818359375,0.8363273453093812,0.8272458045409673,0.8433619866284623,0.8260056127221702,0.834593572778828,0.8070681572304363,0.8045620344583087,0.8078166029196957,0.8054871693814196,0.7634408602150538,0.814086814086814,0.7879508521601267,0.8456832087015635,0.8015463917525774,0.8230234866027125
56,56,0.8193330273055184,2023-08-23 18:47:10.889079,2023-08-23 18:47:14.306330,0 days 00:00:03.417251,,0.9,2.0,,LightGBM,,,,,0.8,,,,0.0016288435444112791,0.1304355336890509,,90.0,,,,,,,,,,153.0,,,,,,,,,COMPLETE,0.0,,,,,,,,,,,,,,,,,,,,
57,57,0.8221637312276575,2023-08-23 18:47:13.476695,2023-08-23 18:47:16.656768,0 days 00:00:03.180073,,0.9,2.0,,LightGBM,,,,,0.8,,,,0.0005891131763617514,0.003101137065968864,,90.0,,,,,,,,,,129.0,,,,,,,,,COMPLETE,0.0,,,,,,,,,,,,,,,,,,,,
58,58,0.8241705851619644,2023-08-23 18:47:14.407415,2023-08-23 18:47:17.527436,0 days 00:00:03.120021,,0.9,2.0,,LightGBM,,,,,0.7000000000000001,,,,0.0003257154420749161,0.003661683262158301,,90.0,,,,,,,,,,129.0,,,,,,,,,COMPLETE,0.0,,,,,,,,,,,,,,,,,,,,
59,59,0.8299306650740474,2023-08-23 18:47:16.764712,2023-08-23 18:47:19.571570,0 days 00:00:02.806858,,0.9,2.0,,LightGBM,,,,,0.7000000000000001,,,,0.007097573942714202,0.04315058417056601,,100.0,,,,,,,,,,129.0,,,,,,,,,COMPLETE,0.0,,,,,,,,,,,,,,,,,,,,
60,60,0.8241489286260809,2023-08-23 18:47:17.596141,2023-08-23 18:47:20.295611,0 days 00:00:02.699470,,0.8,3.0,,LightGBM,,,,,0.7000000000000001,,,,0.007821736114357129,0.04724407503561127,,100.0,,,,,,,,,,152.0,,,,,,,,,COMPLETE,0.0,,,,,,,,,,,,,,,,,,,,
61,61,0.7300034828118529,2023-08-23 18:47:19.629494,2023-08-23 18:47:21.678384,0 days 00:00:02.048890,,,,,RandomForestClassifier,,,,,,,,,,,,,,,,,,,,,,,,45.0,2.0,,,,,,COMPLETE,0.0,,,,,,,,,,,,,,,,,,,,
62,62,0.78511978762584,2023-08-23 18:47:20.407281,2023-08-23 18:47:27.857684,0 days 00:00:07.450403,,,,,RandomForestClassifier,,,,,,,,,,,,,,,,,,,,,,,,43.0,31.0,,,,,,COMPLETE,0.0,,,,,,,,,,,,,,,,,,,,
63,63,0.8231975614808015,2023-08-23 18:47:21.793061,2023-08-23 18:47:23.977991,0 days 00:00:02.184930,,0.9,2.0,,LightGBM,,,,,0.9,,,,0.09841632430547637,0.8775642912050143,,100.0,,,,,,,,,,21.0,,,,,,,,,COMPLETE,0.0,,,,,,,,,,,,,,,,,,,,
64,64,0.8235881674093833,2023-08-23 18:47:24.056412,2023-08-23 18:47:26.874257,0 days 00:00:02.817845,,0.8,2.0,,LightGBM,,,,,0.7000000000000001,,,,0.002711541510111181,0.02409019111728909,,80.0,,,,,,,,,,111.0,,,,,,,,,COMPLETE,0.0,,,,,,,,,,,,,,,,,,,,
65,65,0.6348490553633013,2023-08-23 18:47:26.970197,2023-08-23 18:54:34.417197,0 days 00:07:07.447000,,,,,MLPClassifier,,,,,,,,,,,,,,identity,adam,4.0,30.0,90.0,100.0,100.0,,,,,,,,,,,COMPLETE,0.0,,,,,,,,,,,,,,,,,,,,
66,66,0.8193330273055184,2023-08-23 18:47:27.957250,2023-08-23 18:47:29.951235,0 days 00:00:01.993985,,0.9,2.0,,LightGBM,,,,,0.8,,,,0.03005863032091742,0.002910427542469615,,90.0,,,,,,,,,,24.0,,,,,,,,,COMPLETE,0.0,,,,,,,,,,,,,,,,,,,,
67,67,0.6589024965127646,2023-08-23 18:47:30.020981,2023-08-23 18:55:50.063159,0 days 00:08:20.042178,,,,,MLPClassifier,,,,,,,,,,,,,,identity,adam,4.0,30.0,100.0,100.0,30.0,,,,,,,,,,,COMPLETE,0.0,,,,,,,,,,,,,,,,,,,,
68,68,0.8207857808114568,2023-08-23 18:48:51.219052,2023-08-23 18:48:53.882126,0 days 00:00:02.663074,,1.0,2.0,,LightGBM,,,,,0.6000000000000001,,,,0.006576228418421659,0.003380885523022467,,100.0,,,,,,,,,,172.0,,,,,,,,,COMPLETE,0.0,,,,,,,,,,,,,,,,,,,,
69,69,0.8232044894760413,2023-08-23 18:48:53.993154,2023-08-23 18:48:56.482423,0 days 00:00:02.489269,,0.8,3.0,,LightGBM,,,,,0.7000000000000001,,,,0.14741790980510466,0.04485326042105442,,80.0,,,,,,,,,,199.0,,,,,,,,,COMPLETE,0.0,,,,,,,,,,,,,,,,,,,,
70,70,0.8212422783345464,2023-08-23 18:48:56.564545,2023-08-23 18:48:59.112015,0 days 00:00:02.547470,,0.9,2.0,,LightGBM,,,,,0.7000000000000001,,,,0.02373812501996895,0.006900034754771355,,90.0,,,,,,,,,,146.0,,,,,,,,,COMPLETE,0.0,,,,,,,,,,,,,,,,,,,,
71,71,0.8207785906806575,2023-08-23 18:48:59.213583,2023-08-23 18:49:01.972804,0 days 00:00:02.759221,,1.0,2.0,,LightGBM,,,,,0.6000000000000001,,,,0.17107219748901567,0.001356389900848093,,100.0,,,,,,,,,,112.0,,,,,,,,,COMPLETE,0.0,,,,,,,,,,,,,,,,,,,,
72,72,0.8265081703376619,2023-08-23 18:49:02.039031,2023-08-23 18:49:03.714579,0 days 00:00:01.675548,,0.8,2.0,,LightGBM,,,,,0.5,,,,0.020124761732362238,0.024907552014988434,,40.0,,,,,,,,,,29.0,,,,,,,,,COMPLETE,0.0,,,,,,,,,,,,,,,,,,,,
73,73,0.5255111907044006,2023-08-23 18:49:03.806418,2023-08-23 18:49:09.915049,0 days 00:00:06.108631,,,,,SVC,,,,,,,,,,,,,,,,,,,,,,,,,,,,,3.5661679305254865,linear,COMPLETE,0.0,,,,,,,,,,,,,,,,,,,,
74,74,0.8192925627917481,2023-08-23 18:49:10.037405,2023-08-23 18:49:11.552693,0 days 00:00:01.515288,,0.8,2.0,,LightGBM,,,,,0.5,,,,0.21359556159546966,0.023627858553282133,,70.0,,,,,,,,,,21.0,,,,,,,,,COMPLETE,0.0,,,,,,,,,,,,,,,,,,,,
75,75,0.7192389907125525,2023-08-23 18:49:11.673761,2023-08-23 18:57:44.596479,0 days 00:08:32.922718,,,,,MLPClassifier,,,,,,,,,,,,,,relu,adam,4.0,20.0,10.0,100.0,50.0,,,,,,,,,,,COMPLETE,0.0,,,,,,,,,,,,,,,,,,,,
76,76,0.8274841991125322,2023-08-23 18:50:40.911284,2023-08-23 18:50:44.214900,0 days 00:00:03.303616,,0.8,2.0,,LightGBM,,,,,0.5,,,,0.02816948227596242,0.10008750010063625,,30.0,,,,,,,,,,68.0,,,,,,,,,COMPLETE,0.0,,,,,,,,,,,,,,,,,,,,
77,77,0.7543713995255846,2023-08-23 18:50:44.296586,2023-08-23 18:50:44.573333,0 days 00:00:00.276747,,,,,DecisionTreeClassifier,,gini,2.0,,,,,,,,,,,,,,,,,,,,,,,,,,,,COMPLETE,0.0,,,,,,,,,,,,,,,,,,,,
78,78,0.8250991498772875,2023-08-23 18:50:44.665135,2023-08-23 18:50:47.959550,0 days 00:00:03.294415,,0.8,2.0,,LightGBM,,,,,0.5,,,,0.028479204864220075,0.08805960001752741,,30.0,,,,,,,,,,70.0,,,,,,,,,COMPLETE,0.0,,,,,,,,,,,,,,,,,,,,
79,79,0.8216948345798611,2023-08-23 18:50:48.027336,2023-08-23 18:50:49.840589,0 days 00:00:01.813253,,0.8,2.0,,LightGBM,,,,,0.5,,,,0.2859149373725579,0.026823249856747434,,30.0,,,,,,,,,,29.0,,,,,,,,,COMPLETE,0.0,,,,,,,,,,,,,,,,,,,,
80,80,0.8216214172222622,2023-08-23 18:50:49.920648,2023-08-23 18:50:50.993137,0 days 00:00:01.072489,,0.8,2.0,,LightGBM,,,,,0.5,,,,0.006232705010675672,0.19447979299933155,,40.0,,,,,,,,,,10.0,,,,,,,,,COMPLETE,0.0,,,,,,,,,,,,,,,,,,,,
81,81,0.8187759439460256,2023-08-23 18:50:51.060683,2023-08-23 18:50:54.804910,0 days 00:00:03.744227,,0.6000000000000001,1.0,,LightGBM,,,,,0.9,,,,0.04145286447851595,0.000779682985617889,,20.0,,,,,,,,,,64.0,,,,,,,,,COMPLETE,0.0,,,,,,,,,,,,,,,,,,,,
82,82,0.8226518237375332,2023-08-23 18:50:54.874372,2023-08-23 18:50:57.813807,0 days 00:00:02.939435,,0.9,2.0,,LightGBM,,,,,0.7000000000000001,,,,0.2870037216030738,0.08616382999006209,,40.0,,,,,,,,,,38.0,,,,,,,,,COMPLETE,0.0,,,,,,,,,,,,,,,,,,,,
83,83,0.7981639611509959,2023-08-23 18:50:57.895984,2023-08-23 18:50:59.048695,0 days 00:00:01.152711,0.7836839921733351,,,gbtree,XGBoost,0.944830440692447,,,4.547031836638715e-08,,0.5463286276577625,lossguide,0.18974593210415375,,,9.0,,2.0,,,,,,,,,,,,,,,0.6837919484930911,,,COMPLETE,0.0,,,,,,,,,,,,,,,,,,,,
