,number,value,datetime_start,datetime_complete,duration,params_alpha,params_bagging_fraction,params_bagging_freq,params_booster,params_classifier,params_colsample_bytree,params_dct_criterion,params_dct_max_depth,params_eta,params_feature_fraction,params_gamma,params_grow_policy,params_lambda,params_lambda_l1,params_lambda_l2,params_max_depth,params_min_child_samples,params_min_child_weight,params_mlp_activation,params_mlp_solver,params_n_layers,params_n_units_l_0,params_n_units_l_1,params_n_units_l_2,params_n_units_l_3,params_normalize_type,params_num_leaves,params_rate_drop,params_rf_estimator,params_rf_max_depth,params_sample_type,params_skip_drop,params_subsample,params_svc_c,params_svc_kernel,state,best_trial,dev_acc,dev_recall_macro,dev_precision_macro,dev_f1_macro,dev_recall_0,dev_precision_0,dev_f1_0,dev_recall_1,dev_precision_1,dev_f1_1,test_acc,test_recall_macro,test_precision_macro,test_f1_macro,test_recall_0,test_precision_0,test_f1_0,test_recall_1,test_precision_1,test_f1_1
86,86,0.6482978572521619,2023-08-23 18:58:59.485677,2023-08-23 18:59:00.456617,0 days 00:00:00.970940,,0.4,3.0,,LightGBM,,,,,0.5,,,,0.26337198416382557,0.019037148507829036,,90.0,,,,,,,,,,141.0,,,,,,,,,COMPLETE,0.0,,,,,,,,,,,,,,,,,,,,
87,87,0.3357921744708146,2023-08-23 18:58:59.632882,2023-08-23 18:59:03.355256,0 days 00:00:03.722374,,,,,SVC,,,,,,,,,,,,,,,,,,,,,,,,,,,,,791.2182446928979,linear,COMPLETE,0.0,,,,,,,,,,,,,,,,,,,,
88,88,0.6528088564636867,2023-08-23 18:59:00.552655,2023-08-23 18:59:02.720822,0 days 00:00:02.168167,,0.9,2.0,,LightGBM,,,,,0.4,,,,1.2866671910923362e-07,0.00570774283355115,,60.0,,,,,,,,,,230.0,,,,,,,,,COMPLETE,0.0,,,,,,,,,,,,,,,,,,,,
89,89,0.6571204845798542,2023-08-23 18:59:02.047575,2023-08-23 18:59:08.477042,0 days 00:00:06.429467,,0.7000000000000001,2.0,,LightGBM,,,,,0.4,,,,1.3569841512253501e-07,0.005606765357595835,,10.0,,,,,,,,,,163.0,,,,,,,,,COMPLETE,0.0,,,,,,,,,,,,,,,,,,,,
90,90,0.6580595511277775,2023-08-23 18:59:02.817234,2023-08-23 18:59:08.069985,0 days 00:00:05.252751,,0.7000000000000001,2.0,,LightGBM,,,,,0.5,,,,1.8003098455264955e-06,0.003441097206123255,,10.0,,,,,,,,,,162.0,,,,,,,,,COMPLETE,0.0,,,,,,,,,,,,,,,,,,,,
91,91,0.64645779616936,2023-08-23 18:59:02.941309,2023-08-23 18:59:07.666172,0 days 00:00:04.724863,,0.7000000000000001,2.0,,LightGBM,,,,,0.5,,,,1.1267315901074598e-08,0.0026331018301565777,,10.0,,,,,,,,,,161.0,,,,,,,,,COMPLETE,0.0,,,,,,,,,,,,,,,,,,,,
92,92,0.645456114490428,2023-08-23 18:59:03.478917,2023-08-23 18:59:05.862337,0 days 00:00:02.383420,,0.7000000000000001,2.0,,LightGBM,,,,,0.5,,,,4.5721393172058127e-07,0.0023819264861049973,,70.0,,,,,,,,,,164.0,,,,,,,,,COMPLETE,0.0,,,,,,,,,,,,,,,,,,,,
93,93,0.6465468198884969,2023-08-23 18:59:05.931394,2023-08-23 18:59:09.701870,0 days 00:00:03.770476,,0.6000000000000001,2.0,,LightGBM,,,,,0.6000000000000001,,,,1.7081645312965939e-06,0.0822358386509762,,40.0,,,,,,,,,,178.0,,,,,,,,,COMPLETE,0.0,,,,,,,,,,,,,,,,,,,,
94,94,0.6301109676889846,2023-08-23 18:59:07.731205,2023-08-23 18:59:11.261093,0 days 00:00:03.529888,,0.6000000000000001,2.0,,LightGBM,,,,,0.6000000000000001,,,,7.501175103808396e-08,0.07397781764266512,,40.0,,,,,,,,,,183.0,,,,,,,,,COMPLETE,0.0,,,,,,,,,,,,,,,,,,,,
95,95,0.3357921744708146,2023-08-23 18:59:08.172473,2023-08-23 18:59:08.333257,0 days 00:00:00.160784,1.4535014798816927e-08,,,gblinear,XGBoost,0.7035572224046547,,,,,,,0.0031729280644502787,,,,,,,,,,,,,,,,,,,,0.21628480002419176,,,COMPLETE,0.0,,,,,,,,,,,,,,,,,,,,
96,96,0.6435486037647138,2023-08-23 18:59:08.405071,2023-08-23 18:59:13.823875,0 days 00:00:05.418804,,0.6000000000000001,2.0,,LightGBM,,,,,0.4,,,,1.6032015566327e-06,0.2228805662471115,,10.0,,,,,,,,,,184.0,,,,,,,,,COMPLETE,0.0,,,,,,,,,,,,,,,,,,,,
97,97,0.6441000773904835,2023-08-23 18:59:08.674203,2023-08-23 18:59:14.155758,0 days 00:00:05.481555,,0.6000000000000001,2.0,,LightGBM,,,,,0.4,,,,1.4184076487359332e-06,0.02067156468488561,,10.0,,,,,,,,,,178.0,,,,,,,,,COMPLETE,0.0,,,,,,,,,,,,,,,,,,,,
98,98,0.6523236249818132,2023-08-23 18:59:09.819731,2023-08-23 18:59:14.725693,0 days 00:00:04.905962,,0.6000000000000001,2.0,,LightGBM,,,,,0.4,,,,2.1490258025085585e-06,0.021431220172305948,,10.0,,,,,,,,,,150.0,,,,,,,,,COMPLETE,0.0,,,,,,,,,,,,,,,,,,,,
99,99,0.6497067309453269,2023-08-23 18:59:11.333618,2023-08-23 18:59:15.499174,0 days 00:00:04.165556,,0.7000000000000001,2.0,,LightGBM,,,,,0.4,,,,2.3146699388013487e-06,0.0176628424851606,,10.0,,,,,,,,,,153.0,,,,,,,,,COMPLETE,0.0,,,,,,,,,,,,,,,,,,,,
100,100,0.6581341734327875,2023-08-23 18:59:13.984745,2023-08-23 18:59:17.859486,0 days 00:00:03.874741,,0.7000000000000001,2.0,,LightGBM,,,,,0.4,,,,1.537854115303649e-05,0.01764699510852788,,20.0,,,,,,,,,,153.0,,,,,,,,,COMPLETE,0.0,,,,,,,,,,,,,,,,,,,,
101,101,0.659584424195921,2023-08-23 18:59:14.266551,2023-08-23 18:59:18.672181,0 days 00:00:04.405630,,0.7000000000000001,2.0,,LightGBM,,,,,0.4,,,,1.6999415647220138e-05,0.25776185371603944,,20.0,,,,,,,,,,150.0,,,,,,,,,COMPLETE,0.0,,,,,,,,,,,,,,,,,,,,
102,102,0.6560949624878022,2023-08-23 18:59:14.875920,2023-08-23 18:59:15.911128,0 days 00:00:01.035208,,0.5,2.0,,LightGBM,,,,,0.4,,,,1.5361375440716223e-05,0.20766419456499016,,20.0,,,,,,,,,,25.0,,,,,,,,,COMPLETE,0.0,,,,,,,,,,,,,,,,,,,,
103,103,0.6556958642876181,2023-08-23 18:59:15.558975,2023-08-23 18:59:17.158732,0 days 00:00:01.599757,,0.5,2.0,,LightGBM,,,,,0.5,,,,3.471087036306285e-05,0.4051447510579093,,20.0,,,,,,,,,,40.0,,,,,,,,,COMPLETE,0.0,,,,,,,,,,,,,,,,,,,,
104,104,0.6517537773351727,2023-08-23 18:59:16.030003,2023-08-23 18:59:18.421116,0 days 00:00:02.391113,,0.4,2.0,,LightGBM,,,,,0.5,,,,3.311777406813823e-07,0.008593144647971623,,30.0,,,,,,,,,,121.0,,,,,,,,,COMPLETE,0.0,,,,,,,,,,,,,,,,,,,,
105,105,0.5634273297767111,2023-08-23 18:59:17.239460,2023-08-23 18:59:17.285894,0 days 00:00:00.046434,,,,,DecisionTreeClassifier,,log_loss,2.0,,,,,,,,,,,,,,,,,,,,,,,,,,,,COMPLETE,0.0,,,,,,,,,,,,,,,,,,,,
106,106,0.656146287863383,2023-08-23 18:59:17.357892,2023-08-23 18:59:20.767765,0 days 00:00:03.409873,,1.0,2.0,,LightGBM,,,,,0.5,,,,2.7583607285046296e-07,0.13130768571488793,,20.0,,,,,,,,,,117.0,,,,,,,,,COMPLETE,0.0,,,,,,,,,,,,,,,,,,,,
107,107,0.3357921744708146,2023-08-23 18:59:17.965126,2023-08-23 18:59:22.925524,0 days 00:00:04.960398,,,,,SVC,,,,,,,,,,,,,,,,,,,,,,,,,,,,,0.0054690570049367926,poly,COMPLETE,0.0,,,,,,,,,,,,,,,,,,,,
108,108,0.6460485282168043,2023-08-23 18:59:18.578096,2023-08-23 18:59:23.326576,0 days 00:00:04.748480,,0.7000000000000001,2.0,,LightGBM,,,,,0.4,,,,8.838204734226921e-06,0.05631609891640086,,20.0,,,,,,,,,,167.0,,,,,,,,,COMPLETE,0.0,,,,,,,,,,,,,,,,,,,,
109,109,0.6522911956302746,2023-08-23 18:59:18.802028,2023-08-23 18:59:23.421683,0 days 00:00:04.619655,,0.7000000000000001,2.0,,LightGBM,,,,,0.4,,,,1.0658219472925516e-05,0.09504487157218612,,20.0,,,,,,,,,,159.0,,,,,,,,,COMPLETE,0.0,,,,,,,,,,,,,,,,,,,,
110,110,0.6464960488907794,2023-08-23 18:59:20.902043,2023-08-23 18:59:25.792382,0 days 00:00:04.890339,,0.7000000000000001,2.0,,LightGBM,,,,,0.4,,,,1.531250957457443e-05,0.050030681516217944,,20.0,,,,,,,,,,168.0,,,,,,,,,COMPLETE,0.0,,,,,,,,,,,,,,,,,,,,
111,111,0.6489065179852928,2023-08-23 18:59:23.052837,2023-08-23 18:59:27.986152,0 days 00:00:04.933315,,0.7000000000000001,2.0,,LightGBM,,,,,0.4,,,,1.4629686669162649e-05,0.044864824913722394,,20.0,,,,,,,,,,170.0,,,,,,,,,COMPLETE,0.0,,,,,,,,,,,,,,,,,,,,
112,112,0.6503810030125821,2023-08-23 18:59:23.424499,2023-08-23 18:59:26.374934,0 days 00:00:02.950435,,0.7000000000000001,2.0,,LightGBM,,,,,0.7000000000000001,,,,3.7415685461957395e-06,0.024615172533638676,,50.0,,,,,,,,,,143.0,,,,,,,,,COMPLETE,0.0,,,,,,,,,,,,,,,,,,,,
113,113,0.6576376623543168,2023-08-23 18:59:23.490132,2023-08-23 18:59:27.295556,0 days 00:00:03.805424,,0.7000000000000001,2.0,,LightGBM,,,,,0.4,,,,3.7601159141033725e-06,0.009910431282393163,,30.0,,,,,,,,,,143.0,,,,,,,,,COMPLETE,0.0,,,,,,,,,,,,,,,,,,,,
114,114,0.6469905844786487,2023-08-23 18:59:25.879452,2023-08-23 18:59:30.011407,0 days 00:00:04.131955,,0.7000000000000001,2.0,,LightGBM,,,,,0.7000000000000001,,,,5.894555202473451e-06,0.010103494007124122,,30.0,,,,,,,,,,141.0,,,,,,,,,COMPLETE,0.0,,,,,,,,,,,,,,,,,,,,
115,115,0.3357921744708146,2023-08-23 18:59:26.485218,2023-08-23 18:59:26.560613,0 days 00:00:00.075395,0.009155232941592262,,,gblinear,XGBoost,0.4281206096037071,,,,,,,1.6990107110022807e-08,,,,,,,,,,,,,,,,,,,,0.44080986674347733,,,COMPLETE,0.0,,,,,,,,,,,,,,,,,,,,
116,116,0.6468245608755405,2023-08-23 18:59:26.688813,2023-08-23 18:59:28.427740,0 days 00:00:01.738927,,0.4,2.0,,LightGBM,,,,,0.4,,,,2.2813242544694405e-05,0.008916778604536397,,60.0,,,,,,,,,,156.0,,,,,,,,,COMPLETE,0.0,,,,,,,,,,,,,,,,,,,,
117,117,0.6557013233351636,2023-08-23 18:59:27.446461,2023-08-23 18:59:29.706881,0 days 00:00:02.260420,,0.4,2.0,,LightGBM,,,,,0.5,,,,5.592171800039717e-06,0.0119604114871046,,30.0,,,,,,,,,,89.0,,,,,,,,,COMPLETE,0.0,,,,,,,,,,,,,,,,,,,,
118,118,0.655128937101532,2023-08-23 18:59:28.097440,2023-08-23 18:59:31.302970,0 days 00:00:03.205530,,0.7000000000000001,2.0,,LightGBM,,,,,0.5,,,,4.63325015328675e-06,0.009457479295037914,,30.0,,,,,,,,,,95.0,,,,,,,,,COMPLETE,0.0,,,,,,,,,,,,,,,,,,,,
119,119,0.6469352606238272,2023-08-23 18:59:28.522223,2023-08-23 18:59:32.315889,0 days 00:00:03.793666,,0.7000000000000001,2.0,,LightGBM,,,,,0.5,,,,3.6484318024154604e-06,0.004343335140635532,,30.0,,,,,,,,,,131.0,,,,,,,,,COMPLETE,0.0,,,,,,,,,,,,,,,,,,,,
120,120,0.6576453255010968,2023-08-23 18:59:29.801729,2023-08-23 18:59:33.123676,0 days 00:00:03.321947,,0.7000000000000001,2.0,,LightGBM,,,,,0.4,,,,7.852976989098776e-05,0.005168624630238505,,30.0,,,,,,,,,,130.0,,,,,,,,,COMPLETE,0.0,,,,,,,,,,,,,,,,,,,,
121,121,0.6547548685307267,2023-08-23 18:59:30.060037,2023-08-23 18:59:31.892620,0 days 00:00:01.832583,,0.7000000000000001,2.0,,LightGBM,,,,,0.4,,,,7.322994125226394e-05,0.004635132298278468,,80.0,,,,,,,,,,130.0,,,,,,,,,COMPLETE,0.0,,,,,,,,,,,,,,,,,,,,
122,122,0.6541745261457115,2023-08-23 18:59:31.466825,2023-08-23 18:59:33.884943,0 days 00:00:02.418118,,0.8,2.0,,LightGBM,,,,,0.4,,,,8.987353825911133e-05,0.004020653905171918,,80.0,,,,,,,,,,132.0,,,,,,,,,COMPLETE,0.0,,,,,,,,,,,,,,,,,,,,
123,123,0.6580595511277775,2023-08-23 18:59:31.470060,2023-08-23 18:59:33.357594,0 days 00:00:01.887534,,0.8,2.0,,LightGBM,,,,,0.4,,,,5.778238948880893e-05,0.0039538801882929575,,80.0,,,,,,,,,,148.0,,,,,,,,,COMPLETE,0.0,,,,,,,,,,,,,,,,,,,,
124,124,0.6513721639023808,2023-08-23 18:59:32.051962,2023-08-23 18:59:34.798668,0 days 00:00:02.746706,,0.8,2.0,,LightGBM,,,,,0.4,,,,8.107855668668968e-07,0.003070496245379268,,70.0,,,,,,,,,,149.0,,,,,,,,,COMPLETE,0.0,,,,,,,,,,,,,,,,,,,,
125,125,0.6397854426283325,2023-08-23 18:59:32.454004,2023-08-23 18:59:35.395710,0 days 00:00:02.941706,,1.0,2.0,,LightGBM,,,,,0.4,,,,7.150739407008888e-07,0.022622407666256943,,60.0,,,,,,,,,,194.0,,,,,,,,,COMPLETE,0.0,,,,,,,,,,,,,,,,,,,,
126,126,0.6620734538991382,2023-08-23 18:59:33.178893,2023-08-23 18:59:34.082219,0 days 00:00:00.903326,,1.0,2.0,,LightGBM,,,,,0.4,,,,7.967531702804016e-07,0.03636397968116518,,70.0,,,,,,,,,,4.0,,,,,,,,,COMPLETE,0.0,,,,,,,,,,,,,,,,,,,,
127,127,0.5952002390842495,2023-08-23 18:59:33.476994,2023-08-23 18:59:33.778186,0 days 00:00:00.301192,,,,,DecisionTreeClassifier,,gini,11.0,,,,,,,,,,,,,,,,,,,,,,,,,,,,COMPLETE,0.0,,,,,,,,,,,,,,,,,,,,
128,128,0.6508463984199475,2023-08-23 18:59:33.855684,2023-08-23 18:59:36.429239,0 days 00:00:02.573555,,0.8,2.0,,LightGBM,,,,,0.4,,,,4.580637480043184e-05,0.0289048089085921,,80.0,,,,,,,,,,148.0,,,,,,,,,COMPLETE,0.0,,,,,,,,,,,,,,,,,,,,
129,129,0.6508851485716405,2023-08-23 18:59:33.989400,2023-08-23 18:59:36.840227,0 days 00:00:02.850827,,1.0,2.0,,LightGBM,,,,,0.4,,,,5.0654110059329624e-05,0.03262750022158754,,70.0,,,,,,,,,,146.0,,,,,,,,,COMPLETE,0.0,,,,,,,,,,,,,,,,,,,,
130,130,0.6641850156026714,2023-08-23 18:59:34.226501,2023-08-23 18:59:34.980953,0 days 00:00:00.754452,,1.0,2.0,,LightGBM,,,,,0.4,,,,8.242943651571348e-07,0.0265968047783932,,80.0,,,,,,,,,,7.0,,,,,,,,,COMPLETE,0.0,,,,,,,,,,,,,,,,,,,,
131,131,0.6641677778672181,2023-08-23 18:59:34.915888,2023-08-23 18:59:35.947172,0 days 00:00:01.031284,,1.0,2.0,,LightGBM,,,,,0.4,,,,4.2165245129538995e-05,0.001615312560034517,,90.0,,,,,,,,,,6.0,,,,,,,,,COMPLETE,0.0,,,,,,,,,,,,,,,,,,,,
132,132,0.6553718651429452,2023-08-23 18:59:35.059083,2023-08-23 18:59:35.775472,0 days 00:00:00.716389,,1.0,2.0,,LightGBM,,,,,0.4,,,,2.414480206238791e-05,0.13728498142910667,,90.0,,,,,,,,,,3.0,,,,,,,,,COMPLETE,0.0,,,,,,,,,,,,,,,,,,,,
133,133,0.664545091295426,2023-08-23 18:59:35.478196,2023-08-23 18:59:36.760576,0 days 00:00:01.282380,,1.0,2.0,,LightGBM,,,,,0.4,,,,5.526688763900926e-05,0.0345726666599431,,80.0,,,,,,,,,,8.0,,,,,,,,,COMPLETE,0.0,,,,,,,,,,,,,,,,,,,,
134,134,0.6641499114375629,2023-08-23 18:59:35.854063,2023-08-23 18:59:37.247970,0 days 00:00:01.393907,,1.0,2.0,,LightGBM,,,,,0.4,,,,5.7580907574295015e-05,0.001435228144730196,,80.0,,,,,,,,,,8.0,,,,,,,,,COMPLETE,0.0,,,,,,,,,,,,,,,,,,,,
135,135,0.3357921744708146,2023-08-23 18:59:36.056128,2023-08-23 18:59:44.093762,0 days 00:00:08.037634,,,,,SVC,,,,,,,,,,,,,,,,,,,,,,,,,,,,,0.07069715137026829,rbf,COMPLETE,0.0,,,,,,,,,,,,,,,,,,,,
136,136,0.3357921744708146,2023-08-23 18:59:36.538759,2023-08-23 18:59:44.751413,0 days 00:00:08.212654,,,,,SVC,,,,,,,,,,,,,,,,,,,,,,,,,,,,,0.0010134413635875114,rbf,COMPLETE,0.0,,,,,,,,,,,,,,,,,,,,
137,137,0.6642176057571828,2023-08-23 18:59:36.939060,2023-08-23 18:59:38.063254,0 days 00:00:01.124194,,1.0,2.0,,LightGBM,,,,,0.4,,,,0.0001522295728797951,0.0017323347150378413,,90.0,,,,,,,,,,13.0,,,,,,,,,COMPLETE,0.0,,,,,,,,,,,,,,,,,,,,
138,138,0.6651679510967057,2023-08-23 18:59:36.961870,2023-08-23 18:59:37.954154,0 days 00:00:00.992284,,1.0,2.0,,LightGBM,,,,,0.4,,,,2.6728049705594413e-05,0.0015268367403044464,,90.0,,,,,,,,,,10.0,,,,,,,,,COMPLETE,0.0,,,,,,,,,,,,,,,,,,,,
139,139,0.3357921744708146,2023-08-23 18:59:37.316323,2023-08-23 18:59:45.873597,0 days 00:00:08.557274,,,,,SVC,,,,,,,,,,,,,,,,,,,,,,,,,,,,,0.05668516848942939,rbf,COMPLETE,0.0,,,,,,,,,,,,,,,,,,,,
140,140,0.3357921744708146,2023-08-23 18:59:37.642523,2023-08-23 18:59:45.422431,0 days 00:00:07.779908,,,,,SVC,,,,,,,,,,,,,,,,,,,,,,,,,,,,,0.14825637829041957,rbf,COMPLETE,0.0,,,,,,,,,,,,,,,,,,,,
141,141,0.66411229168694,2023-08-23 18:59:38.007775,2023-08-23 18:59:38.542119,0 days 00:00:00.534344,,1.0,2.0,,LightGBM,,,,,0.4,,,,0.0001429127068231573,0.001200853614940725,,90.0,,,,,,,,,,9.0,,,,,,,,,COMPLETE,0.0,,,,,,,,,,,,,,,,,,,,
142,142,0.3357921744708146,2023-08-23 18:59:38.160961,2023-08-23 18:59:46.197972,0 days 00:00:08.037011,,,,,SVC,,,,,,,,,,,,,,,,,,,,,,,,,,,,,0.06313032604374162,rbf,COMPLETE,0.0,,,,,,,,,,,,,,,,,,,,
143,143,0.3357921744708146,2023-08-23 18:59:38.636312,2023-08-23 18:59:45.805190,0 days 00:00:07.168878,,,,,SVC,,,,,,,,,,,,,,,,,,,,,,,,,,,,,0.058929629243482,rbf,COMPLETE,0.0,,,,,,,,,,,,,,,,,,,,
144,144,0.6640925379438942,2023-08-23 18:59:44.218728,2023-08-23 18:59:44.941149,0 days 00:00:00.722421,,1.0,2.0,,LightGBM,,,,,0.4,,,,0.00012698304489145034,0.0016333364532068002,,90.0,,,,,,,,,,11.0,,,,,,,,,COMPLETE,0.0,,,,,,,,,,,,,,,,,,,,
145,145,0.6651679510967057,2023-08-23 18:59:44.819907,2023-08-23 18:59:45.561704,0 days 00:00:00.741797,,1.0,2.0,,LightGBM,,,,,0.4,,,,3.042047441919075e-05,0.001717943480677604,,90.0,,,,,,,,,,10.0,,,,,,,,,COMPLETE,0.0,,,,,,,,,,,,,,,,,,,,
146,146,0.6640925379438942,2023-08-23 18:59:45.010800,2023-08-23 18:59:46.007166,0 days 00:00:00.996366,,1.0,2.0,,LightGBM,,,,,0.4,,,,0.00012960829422367835,0.0009979628852119925,,90.0,,,,,,,,,,11.0,,,,,,,,,COMPLETE,0.0,,,,,,,,,,,,,,,,,,,,
147,147,0.66411229168694,2023-08-23 18:59:45.534734,2023-08-23 18:59:46.616755,0 days 00:00:01.082021,,1.0,2.0,,LightGBM,,,,,0.4,,,,0.00014790074062222923,0.001362319669943364,,90.0,,,,,,,,,,9.0,,,,,,,,,COMPLETE,0.0,,,,,,,,,,,,,,,,,,,,
148,148,0.66411229168694,2023-08-23 18:59:45.629094,2023-08-23 18:59:46.912546,0 days 00:00:01.283452,,1.0,2.0,,LightGBM,,,,,0.4,,,,0.00013390137144834356,0.0011768760826645042,,90.0,,,,,,,,,,9.0,,,,,,,,,COMPLETE,0.0,,,,,,,,,,,,,,,,,,,,
149,149,0.66411229168694,2023-08-23 18:59:45.861886,2023-08-23 18:59:47.320297,0 days 00:00:01.458411,,1.0,2.0,,LightGBM,,,,,0.4,,,,0.00016145706230313693,0.0012621219646995541,,90.0,,,,,,,,,,9.0,,,,,,,,,COMPLETE,0.0,,,,,,,,,,,,,,,,,,,,
150,150,0.6651679510967057,2023-08-23 18:59:45.950826,2023-08-23 18:59:47.609573,0 days 00:00:01.658747,,1.0,2.0,,LightGBM,,,,,0.4,,,,0.00013370405753834971,0.001953165027744509,,90.0,,,,,,,,,,10.0,,,,,,,,,COMPLETE,0.0,,,,,,,,,,,,,,,,,,,,
151,151,0.663675698680664,2023-08-23 18:59:46.106569,2023-08-23 18:59:47.134837,0 days 00:00:01.028268,,1.0,2.0,,LightGBM,,,,,0.4,,,,0.00012053569556998081,0.00112234682980247,,90.0,,,,,,,,,,7.0,,,,,,,,,COMPLETE,0.0,,,,,,,,,,,,,,,,,,,,
152,152,0.66411229168694,2023-08-23 18:59:46.271936,2023-08-23 18:59:47.716069,0 days 00:00:01.444133,,1.0,2.0,,LightGBM,,,,,0.4,,,,0.00013897497381585365,0.0012741165790008423,,90.0,,,,,,,,,,9.0,,,,,,,,,COMPLETE,0.0,,,,,,,,,,,,,,,,,,,,
153,153,0.6651679510967057,2023-08-23 18:59:46.721335,2023-08-23 18:59:48.156420,0 days 00:00:01.435085,,1.0,2.0,,LightGBM,,,,,0.4,,,,0.00013668903171449415,0.0014338406047090678,,90.0,,,,,,,,,,10.0,,,,,,,,,COMPLETE,0.0,,,,,,,,,,,,,,,,,,,,
154,154,0.66411229168694,2023-08-23 18:59:47.004185,2023-08-23 18:59:48.404675,0 days 00:00:01.400490,,1.0,2.0,,LightGBM,,,,,0.4,,,,0.00014549442056027936,0.001210981635039105,,90.0,,,,,,,,,,9.0,,,,,,,,,COMPLETE,0.0,,,,,,,,,,,,,,,,,,,,
155,155,0.6580270132603427,2023-08-23 18:59:47.248812,2023-08-23 18:59:48.685378,0 days 00:00:01.436566,,1.0,2.0,,LightGBM,,,,,0.4,,,,0.00014892696358501453,0.001605716683911949,,90.0,,,,,,,,,,12.0,,,,,,,,,COMPLETE,0.0,,,,,,,,,,,,,,,,,,,,
156,156,0.6606344537815125,2023-08-23 18:59:47.430486,2023-08-23 18:59:48.896178,0 days 00:00:01.465692,,1.0,2.0,,LightGBM,,,,,0.4,,,,0.0001458541541634947,0.0011429602281536153,,90.0,,,,,,,,,,14.0,,,,,,,,,COMPLETE,0.0,,,,,,,,,,,,,,,,,,,,
157,157,0.6642176057571828,2023-08-23 18:59:47.795967,2023-08-23 18:59:49.139548,0 days 00:00:01.343581,,1.0,2.0,,LightGBM,,,,,0.4,,,,0.0001509155549045661,0.0013350103997308291,,90.0,,,,,,,,,,13.0,,,,,,,,,COMPLETE,0.0,,,,,,,,,,,,,,,,,,,,
158,158,0.6642176057571828,2023-08-23 18:59:47.799270,2023-08-23 18:59:49.370197,0 days 00:00:01.570927,,1.0,2.0,,LightGBM,,,,,0.4,,,,0.0001550871416764982,0.0014880441669608941,,90.0,,,,,,,,,,13.0,,,,,,,,,COMPLETE,0.0,,,,,,,,,,,,,,,,,,,,
159,159,0.6606344537815125,2023-08-23 18:59:48.242244,2023-08-23 18:59:49.597625,0 days 00:00:01.355381,,1.0,2.0,,LightGBM,,,,,0.4,,,,0.00015757553007878498,0.0015082195707840247,,90.0,,,,,,,,,,14.0,,,,,,,,,COMPLETE,0.0,,,,,,,,,,,,,,,,,,,,
160,160,0.6608871261189142,2023-08-23 18:59:48.529246,2023-08-23 18:59:50.113465,0 days 00:00:01.584219,,1.0,2.0,,LightGBM,,,,,0.4,,,,0.00017100242319566456,0.0015740182724233325,,90.0,,,,,,,,,,19.0,,,,,,,,,COMPLETE,0.0,,,,,,,,,,,,,,,,,,,,
161,161,0.6691897727921947,2023-08-23 18:59:48.760846,2023-08-23 18:59:50.538422,0 days 00:00:01.777576,,1.0,2.0,,LightGBM,,,,,0.4,,,,0.00015881351754848722,0.0004981495714239486,,90.0,,,,,,,,,,23.0,,,,,,,,,COMPLETE,0.0,,,,,,,,,,,,,,,,,,,,
162,162,0.6049129637000864,2023-08-23 18:59:49.004678,2023-08-23 18:59:52.563484,0 days 00:00:03.558806,,,,,RandomForestClassifier,,,,,,,,,,,,,,,,,,,,,,,,71.0,4.0,,,,,,COMPLETE,0.0,,,,,,,,,,,,,,,,,,,,
163,163,0.6062309865275968,2023-08-23 18:59:49.212354,2023-08-23 18:59:52.228559,0 days 00:00:03.016205,,,,,RandomForestClassifier,,,,,,,,,,,,,,,,,,,,,,,,67.0,4.0,,,,,,COMPLETE,0.0,,,,,,,,,,,,,,,,,,,,
164,164,0.639768644772823,2023-08-23 18:59:49.478892,2023-08-23 18:59:50.294152,0 days 00:00:00.815260,4.6462972244605935e-07,,,dart,XGBoost,0.7177147044628172,,,0.47369270624897675,,3.939907557059298e-08,depthwise,0.0032214772200382194,,,5.0,,2.0,,,,,,,,forest,,0.944860392467054,,,weighted,1.1677610747978973e-07,0.6704854504492671,,,COMPLETE,0.0,,,,,,,,,,,,,,,,,,,,
165,165,0.601676635524472,2023-08-23 18:59:49.690442,2023-08-23 18:59:52.699978,0 days 00:00:03.009536,,,,,RandomForestClassifier,,,,,,,,,,,,,,,,,,,,,,,,66.0,4.0,,,,,,COMPLETE,0.0,,,,,,,,,,,,,,,,,,,,
166,166,0.6517537773351727,2023-08-23 18:59:50.214702,2023-08-23 18:59:50.907276,0 days 00:00:00.692574,2.3960663654661433e-07,,,dart,XGBoost,0.7323519221648238,,,0.3510626451663122,,1.2503395360161671e-08,depthwise,0.003716729020371176,,,5.0,,2.0,,,,,,,,forest,,0.5257080060299918,,,weighted,2.1169886112440193e-08,0.6788511474381205,,,COMPLETE,0.0,,,,,,,,,,,,,,,,,,,,
167,167,0.6042752122290616,2023-08-23 18:59:50.364499,2023-08-23 18:59:53.052747,0 days 00:00:02.688248,,,,,RandomForestClassifier,,,,,,,,,,,,,,,,,,,,,,,,71.0,3.0,,,,,,COMPLETE,0.0,,,,,,,,,,,,,,,,,,,,
168,168,0.6025836471681028,2023-08-23 18:59:50.610526,2023-08-23 18:59:53.804870,0 days 00:00:03.194344,,,,,RandomForestClassifier,,,,,,,,,,,,,,,,,,,,,,,,74.0,4.0,,,,,,COMPLETE,0.0,,,,,,,,,,,,,,,,,,,,
169,169,0.5996742895712455,2023-08-23 18:59:50.980881,2023-08-23 18:59:53.733639,0 days 00:00:02.752758,,,,,RandomForestClassifier,,,,,,,,,,,,,,,,,,,,,,,,71.0,4.0,,,,,,COMPLETE,0.0,,,,,,,,,,,,,,,,,,,,
170,170,0.6619232850133393,2023-08-23 18:59:52.305188,2023-08-23 18:59:53.957396,0 days 00:00:01.652208,,1.0,2.0,,LightGBM,,,,,0.4,,,,0.0002651398166965731,0.0005692340445178384,,90.0,,,,,,,,,,20.0,,,,,,,,,COMPLETE,0.0,,,,,,,,,,,,,,,,,,,,
171,171,0.6657552163505044,2023-08-23 18:59:52.696644,2023-08-23 18:59:54.354773,0 days 00:00:01.658129,,1.0,2.0,,LightGBM,,,,,0.4,,,,0.00023094864252729664,0.0006433249499343865,,90.0,,,,,,,,,,21.0,,,,,,,,,COMPLETE,0.0,,,,,,,,,,,,,,,,,,,,
172,172,0.6657552163505044,2023-08-23 18:59:52.800226,2023-08-23 18:59:54.550518,0 days 00:00:01.750292,,1.0,2.0,,LightGBM,,,,,0.4,,,,0.0002547394941423336,0.0006627989874383776,,90.0,,,,,,,,,,21.0,,,,,,,,,COMPLETE,0.0,,,,,,,,,,,,,,,,,,,,
