,number,value,datetime_start,datetime_complete,duration,params_alpha,params_bagging_fraction,params_bagging_freq,params_booster,params_classifier,params_colsample_bytree,params_dct_criterion,params_dct_max_depth,params_eta,params_feature_fraction,params_gamma,params_grow_policy,params_lambda,params_lambda_l1,params_lambda_l2,params_max_depth,params_min_child_samples,params_min_child_weight,params_mlp_activation,params_mlp_solver,params_n_layers,params_n_units_l_0,params_n_units_l_1,params_n_units_l_2,params_n_units_l_3,params_normalize_type,params_num_leaves,params_rate_drop,params_rf_estimator,params_rf_max_depth,params_sample_type,params_skip_drop,params_subsample,params_svc_c,params_svc_kernel,state,best_trial,dev_acc,dev_recall_macro,dev_precision_macro,dev_f1_macro,dev_recall_0,dev_precision_0,dev_f1_0,dev_recall_1,dev_precision_1,dev_f1_1,test_acc,test_recall_macro,test_precision_macro,test_f1_macro,test_recall_0,test_precision_0,test_f1_0,test_recall_1,test_precision_1,test_f1_1
84,84,0.6836424295947405,2023-08-23 17:42:44.877813,2023-08-23 17:42:45.327258,0 days 00:00:00.449445,,0.4,3.0,,LightGBM,,,,,0.7000000000000001,,,,0.11299843357041293,7.297620101088097e-06,,90.0,,,,,,,,,,23.0,,,,,,,,,COMPLETE,1.0,0.7019230769230769,0.6807091117041555,0.6936274509803921,0.6836424295947405,0.5581395348837209,0.6666666666666666,0.6075949367088608,0.8032786885245902,0.7205882352941176,0.7596899224806202,0.5808118081180812,0.5741166848418757,0.5888305964648128,0.5593556483822505,0.37251908396946565,0.6084788029925187,0.4621212121212121,0.7757142857142857,0.5691823899371069,0.6565900846432889
85,85,0.5450568678915135,2023-08-23 17:42:45.046677,2023-08-23 17:42:45.765311,0 days 00:00:00.718634,,0.4,3.0,,LightGBM,,,,,0.7000000000000001,,,,0.09530607778624055,1.3602690039871036e-05,,40.0,,,,,,,,,,27.0,,,,,,,,,COMPLETE,0.0,,,,,,,,,,,,,,,,,,,,
86,86,0.3696969696969697,2023-08-23 17:42:45.203209,2023-08-23 17:42:45.434938,0 days 00:00:00.231729,,,,,SVC,,,,,,,,,,,,,,,,,,,,,,,,,,,,,0.8798691513496881,rbf,COMPLETE,0.0,,,,,,,,,,,,,,,,,,,,
87,87,0.3696969696969697,2023-08-23 17:42:45.247434,2023-08-23 17:42:45.391784,0 days 00:00:00.144350,,,,,SVC,,,,,,,,,,,,,,,,,,,,,,,,,,,,,0.7183989221837422,rbf,COMPLETE,0.0,,,,,,,,,,,,,,,,,,,,
88,88,0.6836424295947405,2023-08-23 17:42:45.299268,2023-08-23 17:42:46.227091,0 days 00:00:00.927823,,0.4,3.0,,LightGBM,,,,,0.7000000000000001,,,,0.06498188497327186,1.5880010210877594e-08,,90.0,,,,,,,,,,25.0,,,,,,,,,COMPLETE,0.0,,,,,,,,,,,,,,,,,,,,
89,89,0.3696969696969697,2023-08-23 17:42:45.375094,2023-08-23 17:42:45.592343,0 days 00:00:00.217249,,,,,SVC,,,,,,,,,,,,,,,,,,,,,,,,,,,,,0.6804145340613216,poly,COMPLETE,0.0,,,,,,,,,,,,,,,,,,,,
90,90,0.6836424295947405,2023-08-23 17:42:45.475812,2023-08-23 17:42:46.285659,0 days 00:00:00.809847,,0.4,3.0,,LightGBM,,,,,0.7000000000000001,,,,0.06325662817518427,1.1725593271376035e-07,,90.0,,,,,,,,,,222.0,,,,,,,,,COMPLETE,0.0,,,,,,,,,,,,,,,,,,,,
91,91,0.6836424295947405,2023-08-23 17:42:45.479013,2023-08-23 17:42:46.372182,0 days 00:00:00.893169,,0.4,3.0,,LightGBM,,,,,0.7000000000000001,,,,0.07433463491916653,4.841865163494535e-08,,90.0,,,,,,,,,,58.0,,,,,,,,,COMPLETE,0.0,,,,,,,,,,,,,,,,,,,,
92,92,0.6836424295947405,2023-08-23 17:42:45.541986,2023-08-23 17:42:46.414332,0 days 00:00:00.872346,,0.4,3.0,,LightGBM,,,,,0.8,,,,0.09136725300052752,6.393034485979674e-08,,90.0,,,,,,,,,,195.0,,,,,,,,,COMPLETE,0.0,,,,,,,,,,,,,,,,,,,,
93,93,0.6259356469330222,2023-08-23 17:42:45.587896,2023-08-23 17:42:45.880582,0 days 00:00:00.292686,,,,,DecisionTreeClassifier,,log_loss,7.0,,,,,,,,,,,,,,,,,,,,,,,,,,,,COMPLETE,0.0,,,,,,,,,,,,,,,,,,,,
94,94,0.5978982849211857,2023-08-23 17:42:45.642877,2023-08-23 17:42:45.815180,0 days 00:00:00.172303,,,,,DecisionTreeClassifier,,log_loss,6.0,,,,,,,,,,,,,,,,,,,,,,,,,,,,COMPLETE,0.0,,,,,,,,,,,,,,,,,,,,
95,95,0.6140625,2023-08-23 17:42:45.727707,2023-08-23 17:42:45.950731,0 days 00:00:00.223024,,,,,DecisionTreeClassifier,,log_loss,7.0,,,,,,,,,,,,,,,,,,,,,,,,,,,,COMPLETE,0.0,,,,,,,,,,,,,,,,,,,,
96,96,0.5978982849211857,2023-08-23 17:42:45.812536,2023-08-23 17:42:46.041131,0 days 00:00:00.228595,,,,,DecisionTreeClassifier,,log_loss,6.0,,,,,,,,,,,,,,,,,,,,,,,,,,,,COMPLETE,0.0,,,,,,,,,,,,,,,,,,,,
97,97,0.6836424295947405,2023-08-23 17:42:45.858464,2023-08-23 17:42:46.727706,0 days 00:00:00.869242,,0.4,3.0,,LightGBM,,,,,0.8,,,,0.056836566114211735,2.9366774168417394e-07,,90.0,,,,,,,,,,61.0,,,,,,,,,COMPLETE,0.0,,,,,,,,,,,,,,,,,,,,
98,98,0.6836424295947405,2023-08-23 17:42:45.927169,2023-08-23 17:42:46.666408,0 days 00:00:00.739239,,0.4,3.0,,LightGBM,,,,,0.8,,,,0.0548675472903207,6.440007318056991e-08,,90.0,,,,,,,,,,59.0,,,,,,,,,COMPLETE,0.0,,,,,,,,,,,,,,,,,,,,
99,99,0.6836424295947405,2023-08-23 17:42:46.002884,2023-08-23 17:42:46.557162,0 days 00:00:00.554278,,0.4,3.0,,LightGBM,,,,,0.8,,,,0.06623706680307409,1.1290994757631846e-05,,90.0,,,,,,,,,,3.0,,,,,,,,,COMPLETE,0.0,,,,,,,,,,,,,,,,,,,,
100,100,0.6836424295947405,2023-08-23 17:42:46.089655,2023-08-23 17:42:46.608520,0 days 00:00:00.518865,,0.4,3.0,,LightGBM,,,,,0.8,,,,0.21650390811712078,8.583727593031e-08,,90.0,,,,,,,,,,60.0,,,,,,,,,COMPLETE,0.0,,,,,,,,,,,,,,,,,,,,
101,101,0.6836424295947405,2023-08-23 17:42:46.268606,2023-08-23 17:42:46.986533,0 days 00:00:00.717927,,0.4,3.0,,LightGBM,,,,,0.8,,,,0.0489916492621418,1.4446925960023565e-08,,90.0,,,,,,,,,,3.0,,,,,,,,,COMPLETE,0.0,,,,,,,,,,,,,,,,,,,,
102,102,0.6836424295947405,2023-08-23 17:42:46.332647,2023-08-23 17:42:47.068785,0 days 00:00:00.736138,,0.4,3.0,,LightGBM,,,,,0.7000000000000001,,,,0.060316342255602805,2.895521609019239e-08,,90.0,,,,,,,,,,238.0,,,,,,,,,COMPLETE,0.0,,,,,,,,,,,,,,,,,,,,
103,103,0.6836424295947405,2023-08-23 17:42:46.462152,2023-08-23 17:42:47.119693,0 days 00:00:00.657541,,0.4,3.0,,LightGBM,,,,,0.8,,,,0.044594080794034,3.6778685993659396e-08,,90.0,,,,,,,,,,236.0,,,,,,,,,COMPLETE,0.0,,,,,,,,,,,,,,,,,,,,
104,104,0.6836424295947405,2023-08-23 17:42:46.463896,2023-08-23 17:42:47.216043,0 days 00:00:00.752147,,0.4,3.0,,LightGBM,,,,,0.8,,,,0.0550451766228728,3.984750301632244e-08,,90.0,,,,,,,,,,205.0,,,,,,,,,COMPLETE,0.0,,,,,,,,,,,,,,,,,,,,
105,105,0.6836424295947405,2023-08-23 17:42:46.655656,2023-08-23 17:42:47.429782,0 days 00:00:00.774126,,0.4,3.0,,LightGBM,,,,,0.8,,,,0.06100103660663296,3.3192284054297196e-08,,90.0,,,,,,,,,,249.0,,,,,,,,,COMPLETE,0.0,,,,,,,,,,,,,,,,,,,,
106,106,0.6836424295947405,2023-08-23 17:42:46.664485,2023-08-23 17:42:47.335523,0 days 00:00:00.671038,,0.4,3.0,,LightGBM,,,,,0.8,,,,0.053069009780658934,3.454772731234923e-08,,90.0,,,,,,,,,,240.0,,,,,,,,,COMPLETE,0.0,,,,,,,,,,,,,,,,,,,,
107,107,0.6836424295947405,2023-08-23 17:42:46.717241,2023-08-23 17:42:47.336050,0 days 00:00:00.618809,,0.4,3.0,,LightGBM,,,,,0.8,,,,0.06144430769153058,3.9643887764291296e-08,,90.0,,,,,,,,,,251.0,,,,,,,,,COMPLETE,0.0,,,,,,,,,,,,,,,,,,,,
108,108,0.6836424295947405,2023-08-23 17:42:46.776794,2023-08-23 17:42:47.492343,0 days 00:00:00.715549,,0.4,3.0,,LightGBM,,,,,0.8,,,,0.0524955783567297,5.087983720643717e-08,,90.0,,,,,,,,,,219.0,,,,,,,,,COMPLETE,0.0,,,,,,,,,,,,,,,,,,,,
109,109,0.6836424295947405,2023-08-23 17:42:47.038567,2023-08-23 17:42:47.745747,0 days 00:00:00.707180,,0.4,3.0,,LightGBM,,,,,0.8,,,,0.05008796128847689,2.9875162539449966e-08,,90.0,,,,,,,,,,233.0,,,,,,,,,COMPLETE,0.0,,,,,,,,,,,,,,,,,,,,
110,110,0.6428220979295456,2023-08-23 17:42:47.113944,2023-08-23 17:42:47.821963,0 days 00:00:00.708019,,0.5,3.0,,LightGBM,,,,,0.8,,,,0.04998840906302173,3.298566929038024e-08,,90.0,,,,,,,,,,238.0,,,,,,,,,COMPLETE,0.0,,,,,,,,,,,,,,,,,,,,
111,111,0.6428220979295456,2023-08-23 17:42:47.162920,2023-08-23 17:42:47.936125,0 days 00:00:00.773205,,0.5,3.0,,LightGBM,,,,,0.8,,,,0.05247013491994936,1.575998739420163e-08,,90.0,,,,,,,,,,231.0,,,,,,,,,COMPLETE,0.0,,,,,,,,,,,,,,,,,,,,
112,112,0.6428220979295456,2023-08-23 17:42:47.259121,2023-08-23 17:42:48.032165,0 days 00:00:00.773044,,0.5,3.0,,LightGBM,,,,,0.8,,,,0.05415306086712477,1.4525389447239831e-08,,90.0,,,,,,,,,,244.0,,,,,,,,,COMPLETE,0.0,,,,,,,,,,,,,,,,,,,,
113,113,0.6428220979295456,2023-08-23 17:42:47.385418,2023-08-23 17:42:48.102106,0 days 00:00:00.716688,,0.5,3.0,,LightGBM,,,,,0.9,,,,0.23646991823654884,1.2394353993815565e-08,,90.0,,,,,,,,,,61.0,,,,,,,,,COMPLETE,0.0,,,,,,,,,,,,,,,,,,,,
114,114,0.6546875,2023-08-23 17:42:47.474235,2023-08-23 17:42:48.156376,0 days 00:00:00.682141,,0.5,3.0,,LightGBM,,,,,0.9,,,,0.2801382747694043,9.69696271144463e-08,,90.0,,,,,,,,,,61.0,,,,,,,,,COMPLETE,0.0,,,,,,,,,,,,,,,,,,,,
115,115,0.6428220979295456,2023-08-23 17:42:47.482489,2023-08-23 17:42:48.200931,0 days 00:00:00.718442,,0.5,3.0,,LightGBM,,,,,0.9,,,,0.25167946197719876,8.733308345630341e-08,,90.0,,,,,,,,,,60.0,,,,,,,,,COMPLETE,0.0,,,,,,,,,,,,,,,,,,,,
116,116,0.6428220979295456,2023-08-23 17:42:47.544059,2023-08-23 17:42:48.276156,0 days 00:00:00.732097,,0.5,3.0,,LightGBM,,,,,0.9,,,,0.2420863055633504,1.194217038545154e-08,,90.0,,,,,,,,,,60.0,,,,,,,,,COMPLETE,0.0,,,,,,,,,,,,,,,,,,,,
117,117,0.6428220979295456,2023-08-23 17:42:47.787157,2023-08-23 17:42:48.422118,0 days 00:00:00.634961,,0.5,3.0,,LightGBM,,,,,0.9,,,,0.2423458070815665,1.5558185555392104e-08,,90.0,,,,,,,,,,60.0,,,,,,,,,COMPLETE,0.0,,,,,,,,,,,,,,,,,,,,
118,118,0.6428220979295456,2023-08-23 17:42:47.864862,2023-08-23 17:42:48.543034,0 days 00:00:00.678172,,0.5,3.0,,LightGBM,,,,,0.9,,,,0.22815417194178284,1.2571953534586873e-08,,90.0,,,,,,,,,,61.0,,,,,,,,,COMPLETE,0.0,,,,,,,,,,,,,,,,,,,,
119,119,0.6428220979295456,2023-08-23 17:42:47.979374,2023-08-23 17:42:48.911990,0 days 00:00:00.932616,,0.5,3.0,,LightGBM,,,,,0.9,,,,0.22312606294126108,1.0837651450825425e-07,,90.0,,,,,,,,,,62.0,,,,,,,,,COMPLETE,0.0,,,,,,,,,,,,,,,,,,,,
120,120,0.6577622919086333,2023-08-23 17:42:48.074863,2023-08-23 17:42:49.104448,0 days 00:00:01.029585,,0.4,3.0,,LightGBM,,,,,0.9,,,,0.28050726069914134,1.2588495836929834e-07,,90.0,,,,,,,,,,62.0,,,,,,,,,COMPLETE,0.0,,,,,,,,,,,,,,,,,,,,
121,121,0.6663750364537766,2023-08-23 17:42:48.145042,2023-08-23 17:42:49.262121,0 days 00:00:01.117079,,0.4,3.0,,LightGBM,,,,,0.9,,,,0.02617616395388101,1.5006490554092825e-07,,90.0,,,,,,,,,,61.0,,,,,,,,,COMPLETE,0.0,,,,,,,,,,,,,,,,,,,,
122,122,0.3696969696969697,2023-08-23 17:42:48.243669,2023-08-23 17:42:48.485617,0 days 00:00:00.241948,0.0012858299593590259,,,gblinear,XGBoost,0.7032988866125691,,,,,,,0.8438465179842116,,,,,,,,,,,,,,,,,,,,0.6967590819843746,,,COMPLETE,0.0,,,,,,,,,,,,,,,,,,,,
123,123,0.6142355889724311,2023-08-23 17:42:48.244466,2023-08-23 17:42:48.708236,0 days 00:00:00.463770,0.0013600602821399882,,,gbtree,XGBoost,0.7229756184470911,,,7.729277480889267e-06,,0.8975836647553485,depthwise,0.9426472658982908,,,9.0,,2.0,,,,,,,,,,,,,,,0.6152356314569084,,,COMPLETE,0.0,,,,,,,,,,,,,,,,,,,,
124,124,0.3696969696969697,2023-08-23 17:42:48.338111,2023-08-23 17:42:48.543641,0 days 00:00:00.205530,0.001374856435491414,,,gblinear,XGBoost,0.7074609586937326,,,,,,,0.3896189315195003,,,,,,,,,,,,,,,,,,,,0.6558276617479134,,,COMPLETE,0.0,,,,,,,,,,,,,,,,,,,,
125,125,0.3696969696969697,2023-08-23 17:42:48.466217,2023-08-23 17:42:48.805608,0 days 00:00:00.339391,0.0007267773140000923,,,gblinear,XGBoost,0.6980156387447838,,,,,,,0.4226641820924625,,,,,,,,,,,,,,,,,,,,0.682546000649085,,,COMPLETE,0.0,,,,,,,,,,,,,,,,,,,,
126,126,0.3696969696969697,2023-08-23 17:42:48.534981,2023-08-23 17:42:50.436235,0 days 00:00:01.901254,,,,,MLPClassifier,,,,,,,,,,,,,,logistic,lbfgs,4.0,60.0,10.0,10.0,100.0,,,,,,,,,,,COMPLETE,0.0,,,,,,,,,,,,,,,,,,,,
127,127,0.3696969696969697,2023-08-23 17:42:48.626994,2023-08-23 17:42:50.549804,0 days 00:00:01.922810,,,,,MLPClassifier,,,,,,,,,,,,,,logistic,lbfgs,4.0,70.0,10.0,10.0,100.0,,,,,,,,,,,COMPLETE,0.0,,,,,,,,,,,,,,,,,,,,
128,128,0.6428220979295456,2023-08-23 17:42:48.627859,2023-08-23 17:42:49.546421,0 days 00:00:00.918562,,0.4,3.0,,LightGBM,,,,,0.8,,,,0.02686934922575988,1.6135758320238675e-07,,80.0,,,,,,,,,,204.0,,,,,,,,,COMPLETE,0.0,,,,,,,,,,,,,,,,,,,,
129,129,0.6428220979295456,2023-08-23 17:42:48.781963,2023-08-23 17:42:49.658430,0 days 00:00:00.876467,,0.4,3.0,,LightGBM,,,,,0.8,,,,0.025243729696185005,1.307825323452138e-07,,80.0,,,,,,,,,,210.0,,,,,,,,,COMPLETE,0.0,,,,,,,,,,,,,,,,,,,,
130,130,0.3696969696969697,2023-08-23 17:42:48.886675,2023-08-23 17:42:51.646509,0 days 00:00:02.759834,,,,,MLPClassifier,,,,,,,,,,,,,,logistic,lbfgs,4.0,60.0,30.0,10.0,100.0,,,,,,,,,,,COMPLETE,0.0,,,,,,,,,,,,,,,,,,,,
131,131,0.3696969696969697,2023-08-23 17:42:49.040829,2023-08-23 17:42:50.861681,0 days 00:00:01.820852,,,,,MLPClassifier,,,,,,,,,,,,,,logistic,lbfgs,4.0,60.0,10.0,10.0,100.0,,,,,,,,,,,COMPLETE,0.0,,,,,,,,,,,,,,,,,,,,
132,132,0.3696969696969697,2023-08-23 17:42:49.210582,2023-08-23 17:42:51.580306,0 days 00:00:02.369724,,,,,MLPClassifier,,,,,,,,,,,,,,logistic,lbfgs,4.0,60.0,10.0,20.0,90.0,,,,,,,,,,,COMPLETE,0.0,,,,,,,,,,,,,,,,,,,,
133,133,0.3696969696969697,2023-08-23 17:42:49.408486,2023-08-23 17:42:51.857256,0 days 00:00:02.448770,,,,,MLPClassifier,,,,,,,,,,,,,,logistic,lbfgs,4.0,60.0,10.0,10.0,100.0,,,,,,,,,,,COMPLETE,0.0,,,,,,,,,,,,,,,,,,,,
134,134,0.3696969696969697,2023-08-23 17:42:49.643295,2023-08-23 17:42:52.074558,0 days 00:00:02.431263,,,,,MLPClassifier,,,,,,,,,,,,,,logistic,lbfgs,4.0,70.0,10.0,10.0,100.0,,,,,,,,,,,COMPLETE,0.0,,,,,,,,,,,,,,,,,,,,
135,135,0.3696969696969697,2023-08-23 17:42:49.765243,2023-08-23 17:42:51.936545,0 days 00:00:02.171302,,,,,MLPClassifier,,,,,,,,,,,,,,logistic,lbfgs,4.0,60.0,10.0,20.0,100.0,,,,,,,,,,,COMPLETE,0.0,,,,,,,,,,,,,,,,,,,,
136,136,0.663232263762143,2023-08-23 17:42:50.541673,2023-08-23 17:42:51.427182,0 days 00:00:00.885509,,0.4,3.0,,LightGBM,,,,,0.5,,,,0.09216941148273423,2.2149463649017626e-07,,70.0,,,,,,,,,,8.0,,,,,,,,,COMPLETE,0.0,,,,,,,,,,,,,,,,,,,,
137,137,0.6376306620209059,2023-08-23 17:42:50.684787,2023-08-23 17:42:51.294409,0 days 00:00:00.609622,,0.4,3.0,,LightGBM,,,,,0.8,,,,0.08900597302524907,2.7724961396348907e-07,,70.0,,,,,,,,,,10.0,,,,,,,,,COMPLETE,0.0,,,,,,,,,,,,,,,,,,,,
138,138,0.6836424295947405,2023-08-23 17:42:51.044983,2023-08-23 17:42:52.195406,0 days 00:00:01.150423,,0.4,3.0,,LightGBM,,,,,0.8,,,,0.07033302544372842,6.565008376599218e-08,,90.0,,,,,,,,,,193.0,,,,,,,,,COMPLETE,0.0,,,,,,,,,,,,,,,,,,,,
139,139,0.6836424295947405,2023-08-23 17:42:51.384209,2023-08-23 17:42:52.489575,0 days 00:00:01.105366,,0.4,3.0,,LightGBM,,,,,0.8,,,,0.08025005204620483,2.34912103418948e-08,,90.0,,,,,,,,,,177.0,,,,,,,,,COMPLETE,0.0,,,,,,,,,,,,,,,,,,,,
140,140,0.6836424295947405,2023-08-23 17:42:51.506932,2023-08-23 17:42:52.419924,0 days 00:00:00.912992,,0.4,3.0,,LightGBM,,,,,0.8,,,,0.034539496273942275,6.27378738724506e-08,,90.0,,,,,,,,,,191.0,,,,,,,,,COMPLETE,0.0,,,,,,,,,,,,,,,,,,,,
141,141,0.6836424295947405,2023-08-23 17:42:51.688925,2023-08-23 17:42:52.620601,0 days 00:00:00.931676,,0.4,3.0,,LightGBM,,,,,0.8,,,,0.033268487519057595,5.793070838268089e-08,,90.0,,,,,,,,,,181.0,,,,,,,,,COMPLETE,0.0,,,,,,,,,,,,,,,,,,,,
142,142,0.6836424295947405,2023-08-23 17:42:51.706342,2023-08-23 17:42:52.552771,0 days 00:00:00.846429,,0.4,3.0,,LightGBM,,,,,0.8,,,,0.07924179898005212,6.352554756469357e-08,,90.0,,,,,,,,,,190.0,,,,,,,,,COMPLETE,0.0,,,,,,,,,,,,,,,,,,,,
143,143,0.6836424295947405,2023-08-23 17:42:51.932790,2023-08-23 17:42:52.689227,0 days 00:00:00.756437,,0.4,3.0,,LightGBM,,,,,0.8,,,,0.035248267819014766,6.344382093543587e-08,,90.0,,,,,,,,,,190.0,,,,,,,,,COMPLETE,0.0,,,,,,,,,,,,,,,,,,,,
144,144,0.6836424295947405,2023-08-23 17:42:51.998521,2023-08-23 17:42:52.738758,0 days 00:00:00.740237,,0.4,3.0,,LightGBM,,,,,0.8,,,,0.031192559830945574,6.313301783940046e-08,,90.0,,,,,,,,,,185.0,,,,,,,,,COMPLETE,0.0,,,,,,,,,,,,,,,,,,,,
145,145,0.6836424295947405,2023-08-23 17:42:52.143074,2023-08-23 17:42:52.857146,0 days 00:00:00.714072,,0.4,3.0,,LightGBM,,,,,0.8,,,,0.03492504484503785,5.727958158877607e-08,,90.0,,,,,,,,,,189.0,,,,,,,,,COMPLETE,0.0,,,,,,,,,,,,,,,,,,,,
146,146,0.6836424295947405,2023-08-23 17:42:52.237665,2023-08-23 17:42:52.811364,0 days 00:00:00.573699,,0.4,3.0,,LightGBM,,,,,0.8,,,,0.03740590575174373,2.5062485928097017e-08,,90.0,,,,,,,,,,161.0,,,,,,,,,COMPLETE,0.0,,,,,,,,,,,,,,,,,,,,
147,147,0.6224283985478015,2023-08-23 17:42:52.462128,2023-08-23 17:42:53.301259,0 days 00:00:00.839131,,0.4,3.0,,LightGBM,,,,,0.8,,,,0.03390928684049472,2.4331874929141878e-08,,80.0,,,,,,,,,,2.0,,,,,,,,,COMPLETE,0.0,,,,,,,,,,,,,,,,,,,,
148,148,0.6836424295947405,2023-08-23 17:42:52.532126,2023-08-23 17:42:53.424719,0 days 00:00:00.892593,,0.4,3.0,,LightGBM,,,,,0.8,,,,0.0385253337374828,2.3548155017238983e-08,,90.0,,,,,,,,,,255.0,,,,,,,,,COMPLETE,0.0,,,,,,,,,,,,,,,,,,,,
149,149,0.6428220979295456,2023-08-23 17:42:52.594778,2023-08-23 17:42:53.557813,0 days 00:00:00.963035,,0.4,3.0,,LightGBM,,,,,0.8,,,,0.03642998975191889,2.496558656462544e-08,,80.0,,,,,,,,,,249.0,,,,,,,,,COMPLETE,0.0,,,,,,,,,,,,,,,,,,,,
150,150,0.6428220979295456,2023-08-23 17:42:52.662679,2023-08-23 17:42:53.518633,0 days 00:00:00.855954,,0.4,3.0,,LightGBM,,,,,0.8,,,,0.014733737557119772,2.71496164617244e-08,,80.0,,,,,,,,,,225.0,,,,,,,,,COMPLETE,0.0,,,,,,,,,,,,,,,,,,,,
151,151,0.6663750364537766,2023-08-23 17:42:52.738307,2023-08-23 17:42:53.625020,0 days 00:00:00.886713,,0.4,3.0,,LightGBM,,,,,0.7000000000000001,,,,0.143853499068287,2.5113683077350927e-08,,80.0,,,,,,,,,,249.0,,,,,,,,,COMPLETE,0.0,,,,,,,,,,,,,,,,,,,,
152,152,0.6512820512820513,2023-08-23 17:42:52.785748,2023-08-23 17:42:53.711648,0 days 00:00:00.925900,,0.4,3.0,,LightGBM,,,,,0.7000000000000001,,,,0.016367927555863807,2.1907991079969456e-08,,80.0,,,,,,,,,,222.0,,,,,,,,,COMPLETE,0.0,,,,,,,,,,,,,,,,,,,,
153,153,0.6512820512820513,2023-08-23 17:42:52.909914,2023-08-23 17:42:53.626294,0 days 00:00:00.716380,,0.4,3.0,,LightGBM,,,,,0.7000000000000001,,,,0.016296311819401395,2.605855736967369e-08,,80.0,,,,,,,,,,253.0,,,,,,,,,COMPLETE,0.0,,,,,,,,,,,,,,,,,,,,
154,154,0.6512820512820513,2023-08-23 17:42:52.950324,2023-08-23 17:42:53.789984,0 days 00:00:00.839660,,0.4,3.0,,LightGBM,,,,,0.7000000000000001,,,,0.01585014117568833,2.3033951247747043e-08,,80.0,,,,,,,,,,255.0,,,,,,,,,COMPLETE,0.0,,,,,,,,,,,,,,,,,,,,
155,155,0.6259356469330222,2023-08-23 17:42:53.344110,2023-08-23 17:42:53.975737,0 days 00:00:00.631627,,0.6000000000000001,3.0,,LightGBM,,,,,0.7000000000000001,,,,0.014945142797669465,3.34933459936639e-08,,80.0,,,,,,,,,,256.0,,,,,,,,,COMPLETE,0.0,,,,,,,,,,,,,,,,,,,,
156,156,0.6512820512820513,2023-08-23 17:42:53.466814,2023-08-23 17:42:54.172598,0 days 00:00:00.705784,,0.4,3.0,,LightGBM,,,,,0.7000000000000001,,,,0.01606523246460727,4.0583123549826956e-08,,80.0,,,,,,,,,,224.0,,,,,,,,,COMPLETE,0.0,,,,,,,,,,,,,,,,,,,,
157,157,0.6836424295947405,2023-08-23 17:42:53.598469,2023-08-23 17:42:54.318991,0 days 00:00:00.720522,,0.4,3.0,,LightGBM,,,,,0.7000000000000001,,,,0.10751403015623265,3.9809477374116955e-08,,90.0,,,,,,,,,,245.0,,,,,,,,,COMPLETE,0.0,,,,,,,,,,,,,,,,,,,,
158,158,0.6836424295947405,2023-08-23 17:42:53.603184,2023-08-23 17:42:54.435695,0 days 00:00:00.832511,,0.4,3.0,,LightGBM,,,,,0.7000000000000001,,,,0.15802059139795932,4.0066012240603276e-08,,90.0,,,,,,,,,,243.0,,,,,,,,,COMPLETE,0.0,,,,,,,,,,,,,,,,,,,,
159,159,0.6836424295947405,2023-08-23 17:42:53.710745,2023-08-23 17:42:54.517091,0 days 00:00:00.806346,,0.4,3.0,,LightGBM,,,,,0.7000000000000001,,,,0.05883543709917264,2.847666715968154e-07,,90.0,,,,,,,,,,245.0,,,,,,,,,COMPLETE,0.0,,,,,,,,,,,,,,,,,,,,
160,160,0.494795281054823,2023-08-23 17:42:53.712345,2023-08-23 17:42:54.750413,0 days 00:00:01.038068,,0.4,3.0,,LightGBM,,,,,0.7000000000000001,,,,0.06591299860729555,3.996318113747519e-08,,40.0,,,,,,,,,,241.0,,,,,,,,,COMPLETE,0.0,,,,,,,,,,,,,,,,,,,,
161,161,0.6836424295947405,2023-08-23 17:42:53.753916,2023-08-23 17:42:54.517708,0 days 00:00:00.763792,,0.4,3.0,,LightGBM,,,,,0.7000000000000001,,,,0.06665359383467269,3.835014420115986e-08,,90.0,,,,,,,,,,49.0,,,,,,,,,COMPLETE,0.0,,,,,,,,,,,,,,,,,,,,
162,162,0.6836424295947405,2023-08-23 17:42:53.848491,2023-08-23 17:42:54.657952,0 days 00:00:00.809461,,0.4,3.0,,LightGBM,,,,,0.7000000000000001,,,,0.06700074541010667,3.949282608243591e-08,,90.0,,,,,,,,,,241.0,,,,,,,,,COMPLETE,0.0,,,,,,,,,,,,,,,,,,,,
163,163,0.6836424295947405,2023-08-23 17:42:54.028389,2023-08-23 17:42:54.805054,0 days 00:00:00.776665,,0.4,3.0,,LightGBM,,,,,0.8,,,,0.07351037605682453,3.760515214125779e-08,,90.0,,,,,,,,,,72.0,,,,,,,,,COMPLETE,0.0,,,,,,,,,,,,,,,,,,,,
164,164,0.675,2023-08-23 17:42:54.215638,2023-08-23 17:42:54.884002,0 days 00:00:00.668364,,0.4,3.0,,LightGBM,,,,,0.8,,,,0.12515719189443245,4.439789725711004e-08,,90.0,,,,,,,,,,236.0,,,,,,,,,COMPLETE,0.0,,,,,,,,,,,,,,,,,,,,
165,165,0.5125,2023-08-23 17:42:54.361564,2023-08-23 17:42:55.050919,0 days 00:00:00.689355,,0.4,3.0,,LightGBM,,,,,0.8,,,,0.06313685754360036,4.202245966542767e-08,,40.0,,,,,,,,,,70.0,,,,,,,,,COMPLETE,0.0,,,,,,,,,,,,,,,,,,,,
166,166,0.5168408826945412,2023-08-23 17:42:54.479213,2023-08-23 17:42:55.541743,0 days 00:00:01.062530,,0.4,3.0,,LightGBM,,,,,0.8,,,,0.06949249693642724,1.022620926946911e-08,,30.0,,,,,,,,,,93.0,,,,,,,,,COMPLETE,0.0,,,,,,,,,,,,,,,,,,,,
167,167,0.6836424295947405,2023-08-23 17:42:54.626929,2023-08-23 17:42:55.347754,0 days 00:00:00.720825,,0.4,3.0,,LightGBM,,,,,0.8,,,,0.05715609172091234,8.291358234608071e-08,,90.0,,,,,,,,,,70.0,,,,,,,,,COMPLETE,0.0,,,,,,,,,,,,,,,,,,,,
168,168,0.6836424295947405,2023-08-23 17:42:54.631161,2023-08-23 17:42:55.428332,0 days 00:00:00.797171,,0.4,3.0,,LightGBM,,,,,0.8,,,,0.05853167042062915,1.0335987968000919e-08,,90.0,,,,,,,,,,71.0,,,,,,,,,COMPLETE,0.0,,,,,,,,,,,,,,,,,,,,
169,169,0.5815916004317536,2023-08-23 17:42:54.706089,2023-08-23 17:42:55.901051,0 days 00:00:01.194962,,0.4,3.0,,LightGBM,,,,,0.8,,,,0.05257658905101895,1.0419061692279204e-08,,40.0,,,,,,,,,,215.0,,,,,,,,,COMPLETE,0.0,,,,,,,,,,,,,,,,,,,,
170,170,0.675,2023-08-23 17:42:54.855410,2023-08-23 17:42:55.689600,0 days 00:00:00.834190,,0.4,3.0,,LightGBM,,,,,0.8,,,,0.11172426803928374,8.876874542925914e-08,,90.0,,,,,,,,,,212.0,,,,,,,,,COMPLETE,0.0,,,,,,,,,,,,,,,,,,,,
