,number,value,datetime_start,datetime_complete,duration,params_alpha,params_bagging_fraction,params_bagging_freq,params_booster,params_classifier,params_colsample_bytree,params_dct_criterion,params_dct_max_depth,params_eta,params_feature_fraction,params_gamma,params_grow_policy,params_lambda,params_lambda_l1,params_lambda_l2,params_max_depth,params_min_child_samples,params_min_child_weight,params_mlp_activation,params_mlp_solver,params_n_layers,params_n_units_l_0,params_n_units_l_1,params_n_units_l_2,params_n_units_l_3,params_normalize_type,params_num_leaves,params_rate_drop,params_rf_estimator,params_rf_max_depth,params_sample_type,params_skip_drop,params_subsample,params_svc_c,params_svc_kernel,state,best_trial,dev_acc,dev_recall_macro,dev_precision_macro,dev_f1_macro,dev_recall_0,dev_precision_0,dev_f1_0,dev_recall_1,dev_precision_1,dev_f1_1,test_acc,test_recall_macro,test_precision_macro,test_f1_macro,test_recall_0,test_precision_0,test_f1_0,test_recall_1,test_precision_1,test_f1_1
0,0,0.8670613605052832,2023-08-23 20:46:35.793383,2023-08-23 20:46:36.524268,0 days 00:00:00.730885,0.0012530834360738464,,,gbtree,XGBoost,0.8634370841728991,,,1.313560104929156e-07,,0.5532151106235977,lossguide,6.653496727228202e-07,,,5.0,,8.0,,,,,,,,,,,,,,,0.8881165648517815,,,COMPLETE,0.0,,,,,,,,,,,,,,,,,,,,
1,1,0.3358178053830228,2023-08-23 20:46:35.795413,2023-08-23 20:46:35.884938,0 days 00:00:00.089525,1.3223346556075964e-07,,,gblinear,XGBoost,0.7852660741634931,,,,,,,0.0010871224422839602,,,,,,,,,,,,,,,,,,,,0.7922614339172789,,,COMPLETE,0.0,,,,,,,,,,,,,,,,,,,,
2,2,0.8746447519017228,2023-08-23 20:46:35.798725,2023-08-23 20:46:36.352805,0 days 00:00:00.554080,1.5941211374859015e-07,,,dart,XGBoost,0.8079429589984628,,,4.5505830103740813e-07,,0.0146407128773694,lossguide,0.05221838501978215,,,5.0,,3.0,,,,,,,,tree,,9.609774421347919e-08,,,weighted,3.3421103230255025e-06,0.4755572262589769,,,COMPLETE,0.0,,,,,,,,,,,,,,,,,,,,
3,3,0.8121255844706716,2023-08-23 20:46:35.802464,2023-08-23 20:46:40.201713,0 days 00:00:04.399249,,,,,RandomForestClassifier,,,,,,,,,,,,,,,,,,,,,,,,93.0,2.0,,,,,,COMPLETE,0.0,,,,,,,,,,,,,,,,,,,,
4,4,0.8166527244645106,2023-08-23 20:46:35.805068,2023-08-23 20:46:36.061483,0 days 00:00:00.256415,,,,,DecisionTreeClassifier,,entropy,5.0,,,,,,,,,,,,,,,,,,,,,,,,,,,,COMPLETE,0.0,,,,,,,,,,,,,,,,,,,,
5,5,0.883587428828289,2023-08-23 20:46:35.809764,2023-08-23 20:46:36.232597,0 days 00:00:00.422833,2.3508581676811252e-07,,,gbtree,XGBoost,0.3774183535166648,,,0.00027516877189651606,,2.686252168465312e-06,lossguide,0.0003365358558367202,,,5.0,,10.0,,,,,,,,,,,,,,,0.560918960327381,,,COMPLETE,0.0,,,,,,,,,,,,,,,,,,,,
6,6,0.3358178053830228,2023-08-23 20:46:35.813400,2023-08-23 20:47:23.648734,0 days 00:00:47.835334,,,,,SVC,,,,,,,,,,,,,,,,,,,,,,,,,,,,,66.02363168021142,rbf,COMPLETE,0.0,,,,,,,,,,,,,,,,,,,,
7,7,0.8070048523919976,2023-08-23 20:46:35.816932,2023-08-23 20:46:35.961220,0 days 00:00:00.144288,,,,,DecisionTreeClassifier,,gini,3.0,,,,,,,,,,,,,,,,,,,,,,,,,,,,COMPLETE,0.0,,,,,,,,,,,,,,,,,,,,
8,8,0.8168925903586142,2023-08-23 20:46:35.932003,2023-08-23 20:46:36.110239,0 days 00:00:00.178236,,,,,DecisionTreeClassifier,,entropy,4.0,,,,,,,,,,,,,,,,,,,,,,,,,,,,COMPLETE,0.0,,,,,,,,,,,,,,,,,,,,
9,9,0.3952782241968621,2023-08-23 20:46:36.004257,2023-08-23 20:47:08.949190,0 days 00:00:32.944933,,,,,SVC,,,,,,,,,,,,,,,,,,,,,,,,,,,,,937.5441048662823,linear,COMPLETE,0.0,,,,,,,,,,,,,,,,,,,,
10,10,0.3358178053830228,2023-08-23 20:46:36.109717,2023-08-23 20:47:22.268433,0 days 00:00:46.158716,,,,,SVC,,,,,,,,,,,,,,,,,,,,,,,,,,,,,4.981129273831183,rbf,COMPLETE,0.0,,,,,,,,,,,,,,,,,,,,
11,11,0.3358178053830228,2023-08-23 20:46:36.164221,2023-08-23 20:47:08.342101,0 days 00:00:32.177880,,,,,SVC,,,,,,,,,,,,,,,,,,,,,,,,,,,,,14.028217015618083,poly,COMPLETE,0.0,,,,,,,,,,,,,,,,,,,,
12,12,0.3358178053830228,2023-08-23 20:46:36.290450,2023-08-23 20:46:50.955880,0 days 00:00:14.665430,,,,,MLPClassifier,,,,,,,,,,,,,,tanh,sgd,1.0,90.0,,,,,,,,,,,,,,COMPLETE,0.0,,,,,,,,,,,,,,,,,,,,
13,13,0.33651746699961627,2023-08-23 20:46:36.437780,2023-08-23 20:46:39.315111,0 days 00:00:02.877331,,,,,MLPClassifier,,,,,,,,,,,,,,relu,adam,1.0,30.0,,,,,,,,,,,,,,COMPLETE,0.0,,,,,,,,,,,,,,,,,,,,
14,14,0.7934251368615652,2023-08-23 20:46:36.610336,2023-08-23 20:46:36.766372,0 days 00:00:00.156036,,,,,DecisionTreeClassifier,,log_loss,2.0,,,,,,,,,,,,,,,,,,,,,,,,,,,,COMPLETE,0.0,,,,,,,,,,,,,,,,,,,,
15,15,0.8441652054412431,2023-08-23 20:46:36.848280,2023-08-23 20:46:37.447318,0 days 00:00:00.599038,,,,,DecisionTreeClassifier,,log_loss,14.0,,,,,,,,,,,,,,,,,,,,,,,,,,,,COMPLETE,0.0,,,,,,,,,,,,,,,,,,,,
16,16,0.892073776695226,2023-08-23 20:46:37.524933,2023-08-23 20:46:38.791539,0 days 00:00:01.266606,,1.0,1.0,,LightGBM,,,,,0.8,,,,0.00010637594108464745,0.05163716685693278,,60.0,,,,,,,,,,32.0,,,,,,,,,COMPLETE,0.0,,,,,,,,,,,,,,,,,,,,
17,17,0.8945685177952245,2023-08-23 20:46:38.864212,2023-08-23 20:46:39.823598,0 days 00:00:00.959386,,1.0,1.0,,LightGBM,,,,,0.8,,,,8.968421614142991e-05,0.1092865300034748,,60.0,,,,,,,,,,16.0,,,,,,,,,COMPLETE,0.0,,,,,,,,,,,,,,,,,,,,
18,18,0.8917321982118716,2023-08-23 20:46:39.385821,2023-08-23 20:46:40.606819,0 days 00:00:01.220998,,1.0,1.0,,LightGBM,,,,,0.8,,,,0.00010254273551405894,0.1006271420457121,,60.0,,,,,,,,,,15.0,,,,,,,,,COMPLETE,0.0,,,,,,,,,,,,,,,,,,,,
19,19,0.8917405193171692,2023-08-23 20:46:39.910026,2023-08-23 20:46:41.155806,0 days 00:00:01.245780,,1.0,1.0,,LightGBM,,,,,0.8,,,,0.00010784286863803146,0.17587130714754015,,60.0,,,,,,,,,,10.0,,,,,,,,,COMPLETE,0.0,,,,,,,,,,,,,,,,,,,,
20,20,0.8914399871660028,2023-08-23 20:46:40.276641,2023-08-23 20:46:41.528721,0 days 00:00:01.252080,,1.0,1.0,,LightGBM,,,,,0.8,,,,0.00011381941379661084,0.11812703070701512,,60.0,,,,,,,,,,9.0,,,,,,,,,COMPLETE,0.0,,,,,,,,,,,,,,,,,,,,
21,21,0.8936574723877189,2023-08-23 20:46:40.750084,2023-08-23 20:46:42.402595,0 days 00:00:01.652511,,1.0,1.0,,LightGBM,,,,,0.8,,,,7.74074661944642e-05,0.1140882643498415,,60.0,,,,,,,,,,19.0,,,,,,,,,COMPLETE,0.0,,,,,,,,,,,,,,,,,,,,
22,22,0.3358178053830228,2023-08-23 20:46:41.264693,2023-08-23 20:47:15.711447,0 days 00:00:34.446754,,,,,SVC,,,,,,,,,,,,,,,,,,,,,,,,,,,,,583.1406352343558,poly,COMPLETE,0.0,,,,,,,,,,,,,,,,,,,,
23,23,0.3358178053830228,2023-08-23 20:46:41.625278,2023-08-23 20:47:10.365666,0 days 00:00:28.740388,,,,,SVC,,,,,,,,,,,,,,,,,,,,,,,,,,,,,0.022105699952185812,poly,COMPLETE,0.0,,,,,,,,,,,,,,,,,,,,
24,24,0.3358178053830228,2023-08-23 20:46:42.496388,2023-08-23 20:47:10.285573,0 days 00:00:27.789185,,,,,SVC,,,,,,,,,,,,,,,,,,,,,,,,,,,,,0.5861562388603089,poly,COMPLETE,0.0,,,,,,,,,,,,,,,,,,,,
25,25,0.3358178053830228,2023-08-23 20:46:51.067106,2023-08-23 20:47:32.236863,0 days 00:00:41.169757,,,,,SVC,,,,,,,,,,,,,,,,,,,,,,,,,,,,,11.752001527330105,rbf,COMPLETE,0.0,,,,,,,,,,,,,,,,,,,,
26,26,0.8886284911842721,2023-08-23 20:47:08.417528,2023-08-23 20:47:11.685539,0 days 00:00:03.268011,,0.6000000000000001,3.0,,LightGBM,,,,,0.5,,,,5.757792639523333e-08,0.0001052670766795133,,10.0,,,,,,,,,,152.0,,,,,,,,,COMPLETE,0.0,,,,,,,,,,,,,,,,,,,,
27,27,0.8882944621556494,2023-08-23 20:47:09.008225,2023-08-23 20:47:11.963695,0 days 00:00:02.955470,,0.6000000000000001,3.0,,LightGBM,,,,,0.5,,,,8.277274353469698e-08,2.0744217330991135e-05,,10.0,,,,,,,,,,134.0,,,,,,,,,COMPLETE,0.0,,,,,,,,,,,,,,,,,,,,
28,28,0.8863630575131717,2023-08-23 20:47:10.346525,2023-08-23 20:47:12.689731,0 days 00:00:02.343206,,0.6000000000000001,1.0,,LightGBM,,,,,0.6000000000000001,,,,6.874541683529712e-07,0.0013463056553928519,,10.0,,,,,,,,,,83.0,,,,,,,,,COMPLETE,0.0,,,,,,,,,,,,,,,,,,,,
29,29,0.8958199300469134,2023-08-23 20:47:10.438758,2023-08-23 20:47:13.272052,0 days 00:00:02.833294,,0.9,1.0,,LightGBM,,,,,1.0,,,,8.263337820539285e-07,0.0010557303933356585,,60.0,,,,,,,,,,93.0,,,,,,,,,COMPLETE,0.0,,,,,,,,,,,,,,,,,,,,
30,30,0.8939740796539821,2023-08-23 20:47:11.746536,2023-08-23 20:47:13.936133,0 days 00:00:02.189597,,0.8,1.0,,LightGBM,,,,,1.0,,,,0.11194535632635423,0.8891029411566991,,100.0,,,,,,,,,,83.0,,,,,,,,,COMPLETE,0.0,,,,,,,,,,,,,,,,,,,,
31,31,0.8948931484664702,2023-08-23 20:47:12.032100,2023-08-23 20:47:14.131056,0 days 00:00:02.098956,,0.8,1.0,,LightGBM,,,,,1.0,,,,0.015711340565846697,0.8034292396049568,,90.0,,,,,,,,,,68.0,,,,,,,,,COMPLETE,0.0,,,,,,,,,,,,,,,,,,,,
32,32,0.895254697032681,2023-08-23 20:47:12.753175,2023-08-23 20:47:14.793503,0 days 00:00:02.040328,,0.8,2.0,,LightGBM,,,,,1.0,,,,0.018569961265007002,0.9354935171422595,,90.0,,,,,,,,,,61.0,,,,,,,,,COMPLETE,0.0,,,,,,,,,,,,,,,,,,,,
33,33,0.8746103011182258,2023-08-23 20:47:13.332035,2023-08-23 20:47:14.301354,0 days 00:00:00.969319,,,,,RandomForestClassifier,,,,,,,,,,,,,,,,,,,,,,,,10.0,32.0,,,,,,COMPLETE,0.0,,,,,,,,,,,,,,,,,,,,
34,34,0.8710508405028583,2023-08-23 20:47:14.001117,2023-08-23 20:47:15.315574,0 days 00:00:01.314457,,,,,RandomForestClassifier,,,,,,,,,,,,,,,,,,,,,,,,12.0,24.0,,,,,,COMPLETE,0.0,,,,,,,,,,,,,,,,,,,,
35,35,0.8772891414462167,2023-08-23 20:47:14.182930,2023-08-23 20:47:17.058568,0 days 00:00:02.875638,,,,,RandomForestClassifier,,,,,,,,,,,,,,,,,,,,,,,,27.0,31.0,,,,,,COMPLETE,0.0,,,,,,,,,,,,,,,,,,,,
36,36,0.8923412217598039,2023-08-23 20:47:14.363798,2023-08-23 20:47:17.740061,0 days 00:00:03.376263,,0.8,2.0,,LightGBM,,,,,1.0,,,,0.019824225935778476,1.2700532874103107e-08,,90.0,,,,,,,,,,241.0,,,,,,,,,COMPLETE,0.0,,,,,,,,,,,,,,,,,,,,
37,37,0.8917487546846834,2023-08-23 20:47:14.854857,2023-08-23 20:47:18.823774,0 days 00:00:03.968917,,0.8,2.0,,LightGBM,,,,,1.0,,,,0.033030438534430974,4.0221912282510126e-07,,90.0,,,,,,,,,,255.0,,,,,,,,,COMPLETE,0.0,,,,,,,,,,,,,,,,,,,,
38,38,0.8917237913295375,2023-08-23 20:47:15.385307,2023-08-23 20:47:17.858910,0 days 00:00:02.473603,,0.8,2.0,,LightGBM,,,,,1.0,,,,0.02420864747117877,0.9889938538054625,,90.0,,,,,,,,,,80.0,,,,,,,,,COMPLETE,0.0,,,,,,,,,,,,,,,,,,,,
39,39,0.8911230249429762,2023-08-23 20:47:15.760799,2023-08-23 20:47:18.260637,0 days 00:00:02.499838,,0.8,2.0,,LightGBM,,,,,1.0,,,,0.06085022600123749,0.9401308914139791,,90.0,,,,,,,,,,80.0,,,,,,,,,COMPLETE,0.0,,,,,,,,,,,,,,,,,,,,
40,40,0.8917405193171692,2023-08-23 20:47:17.122557,2023-08-23 20:47:19.661429,0 days 00:00:02.538872,,0.8,2.0,,LightGBM,,,,,1.0,,,,0.027757684801575536,0.0035952495838953665,,90.0,,,,,,,,,,81.0,,,,,,,,,COMPLETE,0.0,,,,,,,,,,,,,,,,,,,,
41,41,0.893665144254767,2023-08-23 20:47:17.795205,2023-08-23 20:47:21.432479,0 days 00:00:03.637274,,0.8,2.0,,LightGBM,,,,,1.0,,,,0.008100016525994675,0.6065690908678452,,80.0,,,,,,,,,,84.0,,,,,,,,,COMPLETE,0.0,,,,,,,,,,,,,,,,,,,,
42,42,0.8914399871660028,2023-08-23 20:47:17.916844,2023-08-23 20:47:20.659418,0 days 00:00:02.742574,,0.8,2.0,,LightGBM,,,,,0.9,,,,0.003414877987773219,0.010591005974494628,,80.0,,,,,,,,,,67.0,,,,,,,,,COMPLETE,0.0,,,,,,,,,,,,,,,,,,,,
43,43,0.8569970851723766,2023-08-23 20:47:18.322912,2023-08-23 20:47:18.681468,0 days 00:00:00.358556,0.15086340973313642,,,dart,XGBoost,0.20200749846109145,,,0.3131553422778668,,2.1140064075646008e-08,depthwise,1.4947279532203497e-08,,,9.0,,2.0,,,,,,,,forest,,0.23284942679709358,,,uniform,0.3581615621017691,0.21215902015805804,,,COMPLETE,0.0,,,,,,,,,,,,,,,,,,,,
44,44,0.8913980461568254,2023-08-23 20:47:18.743009,2023-08-23 20:47:20.878845,0 days 00:00:02.135836,,0.9,2.0,,LightGBM,,,,,0.9,,,,0.0020654910081630644,0.01007041051061463,,40.0,,,,,,,,,,44.0,,,,,,,,,COMPLETE,0.0,,,,,,,,,,,,,,,,,,,,
45,45,0.3358178053830228,2023-08-23 20:47:18.895625,2023-08-23 20:47:20.500309,0 days 00:00:01.604684,,,,,MLPClassifier,,,,,,,,,,,,,,identity,lbfgs,4.0,10.0,60.0,40.0,70.0,,,,,,,,,,,COMPLETE,0.0,,,,,,,,,,,,,,,,,,,,
46,46,0.3358178053830228,2023-08-23 20:47:19.730759,2023-08-23 20:47:19.958853,0 days 00:00:00.228094,0.8370988907035458,,,gblinear,XGBoost,0.5672213454788964,,,,,,,0.2210361443379395,,,,,,,,,,,,,,,,,,,,0.9704450359681396,,,COMPLETE,0.0,,,,,,,,,,,,,,,,,,,,
47,47,0.3358178053830228,2023-08-23 20:47:20.052687,2023-08-23 20:47:22.047384,0 days 00:00:01.994697,,,,,MLPClassifier,,,,,,,,,,,,,,identity,lbfgs,4.0,10.0,40.0,40.0,20.0,,,,,,,,,,,COMPLETE,0.0,,,,,,,,,,,,,,,,,,,,
48,48,0.8933171055435359,2023-08-23 20:47:20.562043,2023-08-23 20:47:22.618548,0 days 00:00:02.056505,,0.9,1.0,,LightGBM,,,,,0.9,,,,0.9865290157897072,0.8442027243063761,,100.0,,,,,,,,,,56.0,,,,,,,,,COMPLETE,0.0,,,,,,,,,,,,,,,,,,,,
49,49,0.8930162404033715,2023-08-23 20:47:20.733547,2023-08-23 20:47:23.099756,0 days 00:00:02.366209,,0.9,1.0,,LightGBM,,,,,0.9,,,,0.12348940738061093,0.7805106494574825,,40.0,,,,,,,,,,54.0,,,,,,,,,COMPLETE,0.0,,,,,,,,,,,,,,,,,,,,
50,50,0.8962103671133772,2023-08-23 20:47:21.016760,2023-08-23 20:47:24.615451,0 days 00:00:03.598691,,0.9,1.0,,LightGBM,,,,,0.9,,,,0.34684649726204586,0.9685270656314744,,100.0,,,,,,,,,,112.0,,,,,,,,,COMPLETE,0.0,,,,,,,,,,,,,,,,,,,,
51,51,0.8930162404033715,2023-08-23 20:47:21.517442,2023-08-23 20:47:24.511495,0 days 00:00:02.994053,,0.9,1.0,,LightGBM,,,,,0.9,,,,0.3732563916392423,0.97257876190131,,100.0,,,,,,,,,,110.0,,,,,,,,,COMPLETE,0.0,,,,,,,,,,,,,,,,,,,,
52,52,0.8942906434062095,2023-08-23 20:47:22.145985,2023-08-23 20:47:25.184764,0 days 00:00:03.038779,,0.9,1.0,,LightGBM,,,,,0.9,,,,0.7560270848762192,0.5613867023764952,,100.0,,,,,,,,,,112.0,,,,,,,,,COMPLETE,0.0,,,,,,,,,,,,,,,,,,,,
53,53,0.8958506446158584,2023-08-23 20:47:22.312645,2023-08-23 20:47:25.509017,0 days 00:00:03.196372,,0.9,1.0,,LightGBM,,,,,0.9,,,,0.28537811615096786,0.5618557392647106,,100.0,,,,,,,,,,122.0,,,,,,,,,COMPLETE,0.0,,,,,,,,,,,,,,,,,,,,
54,54,0.8933485580000231,2023-08-23 20:47:22.675535,2023-08-23 20:47:26.404791,0 days 00:00:03.729256,,0.9,1.0,,LightGBM,,,,,0.9,,,,0.3457826630306689,0.05611025950839167,,100.0,,,,,,,,,,110.0,,,,,,,,,COMPLETE,0.0,,,,,,,,,,,,,,,,,,,,
55,55,0.896159649508008,2023-08-23 20:47:23.143828,2023-08-23 20:47:25.296209,0 days 00:00:02.152381,,0.4,1.0,,LightGBM,,,,,0.9,,,,0.27261883903445666,0.059328763921954464,,100.0,,,,,,,,,,110.0,,,,,,,,,COMPLETE,0.0,,,,,,,,,,,,,,,,,,,,
56,56,0.3358178053830228,2023-08-23 20:47:23.708620,2023-08-23 20:47:23.797592,0 days 00:00:00.088972,6.409306765041504e-05,,,gblinear,XGBoost,0.9933730969513008,,,,,,,7.058934182271385e-06,,,,,,,,,,,,,,,,,,,,0.7252682730251305,,,COMPLETE,0.0,,,,,,,,,,,,,,,,,,,,
57,57,0.8914481174296911,2023-08-23 20:47:23.850091,2023-08-23 20:47:26.288264,0 days 00:00:02.438173,,0.4,1.0,,LightGBM,,,,,0.9,,,,0.001538374493801103,0.06059405993451247,,100.0,,,,,,,,,,110.0,,,,,,,,,COMPLETE,0.0,,,,,,,,,,,,,,,,,,,,
58,58,0.8949085609478633,2023-08-23 20:47:24.563760,2023-08-23 20:47:27.944512,0 days 00:00:03.380752,,0.7000000000000001,1.0,,LightGBM,,,,,1.0,,,,0.005343794638840913,0.19206159467461123,,80.0,,,,,,,,,,110.0,,,,,,,,,COMPLETE,0.0,,,,,,,,,,,,,,,,,,,,
59,59,0.8948774033932185,2023-08-23 20:47:24.678981,2023-08-23 20:47:27.675771,0 days 00:00:02.996790,,0.7000000000000001,1.0,,LightGBM,,,,,1.0,,,,0.30122627578457606,0.1605293159945425,,100.0,,,,,,,,,,113.0,,,,,,,,,COMPLETE,0.0,,,,,,,,,,,,,,,,,,,,
60,60,0.8237288452635368,2023-08-23 20:47:25.229804,2023-08-23 20:47:25.680563,0 days 00:00:00.450759,,,,,DecisionTreeClassifier,,gini,29.0,,,,,,,,,,,,,,,,,,,,,,,,,,,,COMPLETE,0.0,,,,,,,,,,,,,,,,,,,,
61,61,0.8210764996605369,2023-08-23 20:47:25.349052,2023-08-23 20:47:25.832864,0 days 00:00:00.483812,,,,,DecisionTreeClassifier,,gini,32.0,,,,,,,,,,,,,,,,,,,,,,,,,,,,COMPLETE,0.0,,,,,,,,,,,,,,,,,,,,
62,62,0.8200863675168405,2023-08-23 20:47:25.551631,2023-08-23 20:47:26.054648,0 days 00:00:00.503017,,,,,DecisionTreeClassifier,,gini,32.0,,,,,,,,,,,,,,,,,,,,,,,,,,,,COMPLETE,0.0,,,,,,,,,,,,,,,,,,,,
63,63,0.8961671408605371,2023-08-23 20:47:25.752568,2023-08-23 20:47:28.177643,0 days 00:00:02.425075,,0.4,1.0,,LightGBM,,,,,0.9,,,,0.23342818966185502,0.035032845446423405,,80.0,,,,,,,,,,111.0,,,,,,,,,COMPLETE,0.0,,,,,,,,,,,,,,,,,,,,
64,64,0.892073776695226,2023-08-23 20:47:25.882484,2023-08-23 20:47:28.178267,0 days 00:00:02.295783,,0.4,1.0,,LightGBM,,,,,0.9,,,,0.3334132866621906,0.0388937511555013,,80.0,,,,,,,,,,120.0,,,,,,,,,COMPLETE,0.0,,,,,,,,,,,,,,,,,,,,
65,65,0.894614643091687,2023-08-23 20:47:26.110171,2023-08-23 20:47:28.080189,0 days 00:00:01.970018,,0.4,1.0,,LightGBM,,,,,0.9,,,,0.26114030425857165,0.03740448455098528,,80.0,,,,,,,,,,110.0,,,,,,,,,COMPLETE,0.0,,,,,,,,,,,,,,,,,,,,
66,66,0.8930082696208457,2023-08-23 20:47:26.340479,2023-08-23 20:47:29.547173,0 days 00:00:03.206694,,0.7000000000000001,1.0,,LightGBM,,,,,1.0,,,,0.3440572429283787,0.24520482118404568,,80.0,,,,,,,,,,129.0,,,,,,,,,COMPLETE,0.0,,,,,,,,,,,,,,,,,,,,
67,67,0.8927152543876713,2023-08-23 20:47:26.457637,2023-08-23 20:47:30.337207,0 days 00:00:03.879570,,0.7000000000000001,1.0,,LightGBM,,,,,1.0,,,,0.20042225410798079,0.22472893291343998,,80.0,,,,,,,,,,169.0,,,,,,,,,COMPLETE,0.0,,,,,,,,,,,,,,,,,,,,
68,68,0.8964761662698172,2023-08-23 20:47:27.720915,2023-08-23 20:47:31.480589,0 days 00:00:03.759674,,0.7000000000000001,1.0,,LightGBM,,,,,1.0,,,,0.15963451994497993,0.24529242547960034,,80.0,,,,,,,,,,141.0,,,,,,,,,COMPLETE,0.0,,,,,,,,,,,,,,,,,,,,
69,69,0.8933485580000231,2023-08-23 20:47:27.998125,2023-08-23 20:47:31.907902,0 days 00:00:03.909777,,0.7000000000000001,1.0,,LightGBM,,,,,1.0,,,,0.12794361104509977,0.1929538054608595,,80.0,,,,,,,,,,142.0,,,,,,,,,COMPLETE,0.0,,,,,,,,,,,,,,,,,,,,
70,70,0.8952098392059787,2023-08-23 20:47:28.127660,2023-08-23 20:47:32.739196,0 days 00:00:04.611536,,0.7000000000000001,1.0,,LightGBM,,,,,1.0,,,,0.1302046923859489,0.2684648947977544,,80.0,,,,,,,,,,159.0,,,,,,,,,COMPLETE,0.0,,,,,,,,,,,,,,,,,,,,
71,71,0.8911785944330678,2023-08-23 20:47:28.266350,2023-08-23 20:47:32.355637,0 days 00:00:04.089287,,0.5,1.0,,LightGBM,,,,,1.0,,,,0.07935867829074794,0.2539536637530403,,70.0,,,,,,,,,,142.0,,,,,,,,,COMPLETE,0.0,,,,,,,,,,,,,,,,,,,,
72,72,0.8907807079267376,2023-08-23 20:47:28.268951,2023-08-23 20:47:31.553998,0 days 00:00:03.285047,,0.5,1.0,,LightGBM,,,,,1.0,,,,0.09150320480254773,0.2794170276855995,,70.0,,,,,,,,,,142.0,,,,,,,,,COMPLETE,0.0,,,,,,,,,,,,,,,,,,,,
73,73,0.3358178053830228,2023-08-23 20:47:29.596193,2023-08-23 20:52:11.195306,0 days 00:04:41.599113,,,,,MLPClassifier,,,,,,,,,,,,,,logistic,adam,2.0,100.0,100.0,,,,,,,,,,,,,COMPLETE,0.0,,,,,,,,,,,,,,,,,,,,
74,74,0.8343412786251221,2023-08-23 20:47:30.416974,2023-08-23 20:47:37.197439,0 days 00:00:06.780465,,,,,RandomForestClassifier,,,,,,,,,,,,,,,,,,,,,,,,81.0,5.0,,,,,,COMPLETE,0.0,,,,,,,,,,,,,,,,,,,,
75,75,0.8329863703501805,2023-08-23 20:47:31.633053,2023-08-23 20:47:38.325437,0 days 00:00:06.692384,,,,,RandomForestClassifier,,,,,,,,,,,,,,,,,,,,,,,,79.0,5.0,,,,,,COMPLETE,0.0,,,,,,,,,,,,,,,,,,,,
76,76,0.8334267971005461,2023-08-23 20:47:31.633841,2023-08-23 20:47:37.823672,0 days 00:00:06.189831,,,,,RandomForestClassifier,,,,,,,,,,,,,,,,,,,,,,,,79.0,5.0,,,,,,COMPLETE,0.0,,,,,,,,,,,,,,,,,,,,
77,77,0.8339398003541155,2023-08-23 20:47:31.991943,2023-08-23 20:47:40.032236,0 days 00:00:08.040293,,,,,RandomForestClassifier,,,,,,,,,,,,,,,,,,,,,,,,100.0,5.0,,,,,,COMPLETE,0.0,,,,,,,,,,,,,,,,,,,,
78,78,0.3358178053830228,2023-08-23 20:47:32.315805,2023-08-23 20:52:52.770570,0 days 00:05:20.454765,,,,,MLPClassifier,,,,,,,,,,,,,,logistic,adam,3.0,90.0,100.0,100.0,,,,,,,,,,,,COMPLETE,0.0,,,,,,,,,,,,,,,,,,,,
79,79,0.8316471861465491,2023-08-23 20:47:32.432185,2023-08-23 20:47:39.528100,0 days 00:00:07.095915,,,,,RandomForestClassifier,,,,,,,,,,,,,,,,,,,,,,,,97.0,5.0,,,,,,COMPLETE,0.0,,,,,,,,,,,,,,,,,,,,
80,80,0.8317679819852511,2023-08-23 20:47:32.811962,2023-08-23 20:47:40.199759,0 days 00:00:07.387797,,,,,RandomForestClassifier,,,,,,,,,,,,,,,,,,,,,,,,99.0,5.0,,,,,,COMPLETE,0.0,,,,,,,,,,,,,,,,,,,,
81,81,0.3358178053830228,2023-08-23 20:47:37.283328,2023-08-23 20:49:44.174367,0 days 00:02:06.891039,,,,,MLPClassifier,,,,,,,,,,,,,,logistic,adam,2.0,100.0,100.0,,,,,,,,,,,,,COMPLETE,0.0,,,,,,,,,,,,,,,,,,,,
82,82,0.8939347849006544,2023-08-23 20:47:37.940832,2023-08-23 20:47:40.848663,0 days 00:00:02.907831,,0.5,3.0,,LightGBM,,,,,0.8,,,,0.8424925784316344,0.07646759779635673,,70.0,,,,,,,,,,169.0,,,,,,,,,COMPLETE,0.0,,,,,,,,,,,,,,,,,,,,
83,83,0.3358178053830228,2023-08-23 20:47:38.404710,2023-08-23 20:50:51.646484,0 days 00:03:13.241774,,,,,MLPClassifier,,,,,,,,,,,,,,logistic,adam,3.0,100.0,100.0,100.0,,,,,,,,,,,,COMPLETE,0.0,,,,,,,,,,,,,,,,,,,,
84,84,0.3358178053830228,2023-08-23 20:47:39.617465,2023-08-23 20:48:52.481393,0 days 00:01:12.863928,,,,,MLPClassifier,,,,,,,,,,,,,,logistic,sgd,2.0,100.0,100.0,,,,,,,,,,,,,COMPLETE,0.0,,,,,,,,,,,,,,,,,,,,
85,85,0.3358178053830228,2023-08-23 20:47:40.122293,2023-08-23 20:51:07.525720,0 days 00:03:27.403427,,,,,MLPClassifier,,,,,,,,,,,,,,logistic,sgd,3.0,100.0,100.0,100.0,,,,,,,,,,,,COMPLETE,0.0,,,,,,,,,,,,,,,,,,,,
86,86,0.3358178053830228,2023-08-23 20:47:40.364640,2023-08-23 20:51:53.999580,0 days 00:04:13.634940,,,,,MLPClassifier,,,,,,,,,,,,,,logistic,adam,3.0,100.0,100.0,90.0,,,,,,,,,,,,COMPLETE,0.0,,,,,,,,,,,,,,,,,,,,
