,number,value,datetime_start,datetime_complete,duration,params_alpha,params_bagging_fraction,params_bagging_freq,params_booster,params_classifier,params_colsample_bytree,params_dct_criterion,params_dct_max_depth,params_eta,params_feature_fraction,params_gamma,params_grow_policy,params_lambda,params_lambda_l1,params_lambda_l2,params_max_depth,params_min_child_samples,params_min_child_weight,params_mlp_activation,params_mlp_solver,params_n_layers,params_n_units_l_0,params_n_units_l_1,params_n_units_l_2,params_n_units_l_3,params_normalize_type,params_num_leaves,params_rate_drop,params_rf_estimator,params_rf_max_depth,params_sample_type,params_skip_drop,params_subsample,params_svc_c,params_svc_kernel,state,best_trial,dev_acc,dev_recall_macro,dev_precision_macro,dev_f1_macro,dev_recall_0,dev_precision_0,dev_f1_0,dev_recall_1,dev_precision_1,dev_f1_1,test_acc,test_recall_macro,test_precision_macro,test_f1_macro,test_recall_0,test_precision_0,test_f1_0,test_recall_1,test_precision_1,test_f1_1
0,0,0.6016172818113557,2023-08-23 20:52:59.252521,2023-08-23 20:55:40.450788,0 days 00:02:41.198267,,,,,MLPClassifier,,,,,,,,,,,,,,tanh,adam,1.0,100.0,,,,,,,,,,,,,,COMPLETE,0.0,,,,,,,,,,,,,,,,,,,,
1,1,0.6240437957112295,2023-08-23 20:52:59.255812,2023-08-23 20:53:11.007172,0 days 00:00:11.751360,,,,,RandomForestClassifier,,,,,,,,,,,,,,,,,,,,,,,,40.0,31.0,,,,,,COMPLETE,0.0,,,,,,,,,,,,,,,,,,,,
2,2,0.6234408110658687,2023-08-23 20:52:59.258254,2023-08-23 20:53:06.837507,0 days 00:00:07.579253,,,,,RandomForestClassifier,,,,,,,,,,,,,,,,,,,,,,,,68.0,4.0,,,,,,COMPLETE,0.0,,,,,,,,,,,,,,,,,,,,
3,3,0.6024954974425474,2023-08-23 20:52:59.260838,2023-08-23 20:55:22.006537,0 days 00:02:22.745699,,,,,MLPClassifier,,,,,,,,,,,,,,tanh,adam,1.0,90.0,,,,,,,,,,,,,,COMPLETE,0.0,,,,,,,,,,,,,,,,,,,,
4,4,0.3358178053830228,2023-08-23 20:52:59.264863,2023-08-23 20:53:43.634656,0 days 00:00:44.369793,,,,,SVC,,,,,,,,,,,,,,,,,,,,,,,,,,,,,0.010292227460788854,poly,COMPLETE,0.0,,,,,,,,,,,,,,,,,,,,
5,5,0.5477602224844982,2023-08-23 20:52:59.268026,2023-08-23 20:53:05.816064,0 days 00:00:06.548038,,,,,MLPClassifier,,,,,,,,,,,,,,tanh,lbfgs,4.0,20.0,40.0,60.0,10.0,,,,,,,,,,,COMPLETE,0.0,,,,,,,,,,,,,,,,,,,,
6,6,0.6362213282699378,2023-08-23 20:52:59.273080,2023-08-23 20:53:03.800558,0 days 00:00:04.527478,,1.0,2.0,,LightGBM,,,,,1.0,,,,0.2845474355348604,0.004362753906709565,,10.0,,,,,,,,,,127.0,,,,,,,,,COMPLETE,0.0,,,,,,,,,,,,,,,,,,,,
7,7,0.6237736030893755,2023-08-23 20:52:59.273518,2023-08-23 20:52:59.689411,0 days 00:00:00.415893,0.05802161941613754,,,gbtree,XGBoost,0.5241274835916996,,,5.1614273244006706e-08,,1.247317343330071e-07,lossguide,6.929053539765733e-06,,,9.0,,9.0,,,,,,,,,,,,,,,0.6124656361291378,,,COMPLETE,0.0,,,,,,,,,,,,,,,,,,,,
8,8,0.6370617462502041,2023-08-23 20:52:59.865289,2023-08-23 20:53:00.310594,0 days 00:00:00.445305,8.710506633700619e-06,,,dart,XGBoost,0.8160584527597876,,,0.1056710558313379,,0.0336686441818841,depthwise,0.018409478068429623,,,3.0,,10.0,,,,,,,,tree,,0.019074988850002823,,,uniform,2.4295992406838423e-05,0.2864855152271874,,,COMPLETE,0.0,,,,,,,,,,,,,,,,,,,,
9,9,0.6361998511462699,2023-08-23 20:53:00.401900,2023-08-23 20:53:20.480175,0 days 00:00:20.078275,,,,,RandomForestClassifier,,,,,,,,,,,,,,,,,,,,,,,,81.0,21.0,,,,,,COMPLETE,0.0,,,,,,,,,,,,,,,,,,,,
10,10,0.6229810323455808,2023-08-23 20:53:03.891460,2023-08-23 20:53:04.044489,0 days 00:00:00.153029,,,,,DecisionTreeClassifier,,gini,2.0,,,,,,,,,,,,,,,,,,,,,,,,,,,,COMPLETE,0.0,,,,,,,,,,,,,,,,,,,,
11,11,0.3358178053830228,2023-08-23 20:53:04.116168,2023-08-23 20:53:48.081373,0 days 00:00:43.965205,,,,,SVC,,,,,,,,,,,,,,,,,,,,,,,,,,,,,8.57098039350621,poly,COMPLETE,0.0,,,,,,,,,,,,,,,,,,,,
12,12,0.635660422270728,2023-08-23 20:53:06.002258,2023-08-23 20:53:11.443754,0 days 00:00:05.441496,,0.7000000000000001,2.0,,LightGBM,,,,,0.6000000000000001,,,,0.10205879603900761,0.17664257799112487,,30.0,,,,,,,,,,220.0,,,,,,,,,COMPLETE,0.0,,,,,,,,,,,,,,,,,,,,
13,13,0.6224549841120395,2023-08-23 20:53:06.929488,2023-08-23 20:53:07.305469,0 days 00:00:00.375981,3.799240296735744e-08,,,dart,XGBoost,0.2589130886612185,,,1.3597588470882163e-07,,2.1714085795837446e-06,depthwise,0.0026892343927859166,,,5.0,,7.0,,,,,,,,forest,,0.034953148960239176,,,weighted,2.361688623121757e-07,0.7025042337733485,,,COMPLETE,0.0,,,,,,,,,,,,,,,,,,,,
14,14,0.3358178053830228,2023-08-23 20:53:07.405012,2023-08-23 20:53:51.736874,0 days 00:00:44.331862,,,,,SVC,,,,,,,,,,,,,,,,,,,,,,,,,,,,,2.492768210128429,poly,COMPLETE,0.0,,,,,,,,,,,,,,,,,,,,
15,15,0.6142368254526501,2023-08-23 20:53:11.116954,2023-08-23 20:53:11.822437,0 days 00:00:00.705483,,,,,DecisionTreeClassifier,,log_loss,8.0,,,,,,,,,,,,,,,,,,,,,,,,,,,,COMPLETE,0.0,,,,,,,,,,,,,,,,,,,,
16,16,0.6218598281408958,2023-08-23 20:53:11.565188,2023-08-23 20:53:14.814395,0 days 00:00:03.249207,,,,,RandomForestClassifier,,,,,,,,,,,,,,,,,,,,,,,,45.0,4.0,,,,,,COMPLETE,0.0,,,,,,,,,,,,,,,,,,,,
17,17,0.5178726780669193,2023-08-23 20:53:11.936484,2023-08-23 20:53:53.204728,0 days 00:00:41.268244,,,,,SVC,,,,,,,,,,,,,,,,,,,,,,,,,,,,,3.2255854370007397,linear,COMPLETE,0.0,,,,,,,,,,,,,,,,,,,,
18,18,0.3358178053830228,2023-08-23 20:53:14.937066,2023-08-23 20:53:55.107883,0 days 00:00:40.170817,,,,,SVC,,,,,,,,,,,,,,,,,,,,,,,,,,,,,2.1856109588952437,poly,COMPLETE,0.0,,,,,,,,,,,,,,,,,,,,
19,19,0.6379140906109947,2023-08-23 20:53:20.581069,2023-08-23 20:53:22.442489,0 days 00:00:01.861420,,1.0,3.0,,LightGBM,,,,,1.0,,,,0.925196167525831,2.215899646560745e-06,,10.0,,,,,,,,,,56.0,,,,,,,,,COMPLETE,0.0,,,,,,,,,,,,,,,,,,,,
20,20,0.3358178053830228,2023-08-23 20:53:22.547651,2023-08-23 20:54:02.867935,0 days 00:00:40.320284,,,,,SVC,,,,,,,,,,,,,,,,,,,,,,,,,,,,,0.44127964410347653,poly,COMPLETE,0.0,,,,,,,,,,,,,,,,,,,,
21,21,0.6486620618025128,2023-08-23 20:53:43.768964,2023-08-23 20:53:44.822442,0 days 00:00:01.053478,,1.0,3.0,,LightGBM,,,,,1.0,,,,1.6757794729209835e-07,1.9638591910429789e-07,,100.0,,,,,,,,,,3.0,,,,,,,,,COMPLETE,0.0,,,,,,,,,,,,,,,,,,,,
22,22,0.6514798683870416,2023-08-23 20:53:44.972559,2023-08-23 20:53:45.642343,0 days 00:00:00.669784,,1.0,3.0,,LightGBM,,,,,1.0,,,,5.631624167634894e-08,2.3225648351126468e-07,,100.0,,,,,,,,,,2.0,,,,,,,,,COMPLETE,0.0,,,,,,,,,,,,,,,,,,,,
23,23,0.6444879258179426,2023-08-23 20:53:45.753368,2023-08-23 20:53:46.660656,0 days 00:00:00.907288,,1.0,3.0,,LightGBM,,,,,0.9,,,,2.463114410692579e-08,1.7799299638759985e-08,,100.0,,,,,,,,,,6.0,,,,,,,,,COMPLETE,0.0,,,,,,,,,,,,,,,,,,,,
24,24,0.6398567334992897,2023-08-23 20:53:46.750169,2023-08-23 20:53:47.687570,0 days 00:00:00.937401,,0.7000000000000001,3.0,,LightGBM,,,,,0.8,,,,4.488552839690628e-08,5.98896556702119e-07,,100.0,,,,,,,,,,5.0,,,,,,,,,COMPLETE,0.0,,,,,,,,,,,,,,,,,,,,
25,25,0.5488880355314001,2023-08-23 20:53:47.773600,2023-08-23 20:54:31.143885,0 days 00:00:43.370285,,,,,MLPClassifier,,,,,,,,,,,,,,logistic,adam,1.0,100.0,,,,,,,,,,,,,,COMPLETE,0.0,,,,,,,,,,,,,,,,,,,,
26,26,0.6037940181535757,2023-08-23 20:53:48.165491,2023-08-23 20:55:39.677553,0 days 00:01:51.512062,,,,,MLPClassifier,,,,,,,,,,,,,,identity,adam,1.0,100.0,,,,,,,,,,,,,,COMPLETE,0.0,,,,,,,,,,,,,,,,,,,,
27,27,0.3358178053830228,2023-08-23 20:53:51.846708,2023-08-23 20:54:11.036963,0 days 00:00:19.190255,,,,,MLPClassifier,,,,,,,,,,,,,,logistic,sgd,1.0,100.0,,,,,,,,,,,,,,COMPLETE,0.0,,,,,,,,,,,,,,,,,,,,
28,28,0.6514798683870416,2023-08-23 20:53:53.345695,2023-08-23 20:53:54.252164,0 days 00:00:00.906469,,1.0,3.0,,LightGBM,,,,,1.0,,,,2.1097183269631438e-08,1.868761333768487e-08,,100.0,,,,,,,,,,2.0,,,,,,,,,COMPLETE,0.0,,,,,,,,,,,,,,,,,,,,
29,29,0.6501774490949104,2023-08-23 20:53:54.358750,2023-08-23 20:53:55.492265,0 days 00:00:01.133515,,0.9,3.0,,LightGBM,,,,,1.0,,,,1.2148621490529896e-07,1.0042504040739828e-08,,80.0,,,,,,,,,,2.0,,,,,,,,,COMPLETE,0.0,,,,,,,,,,,,,,,,,,,,
30,30,0.6594818804346643,2023-08-23 20:53:55.167339,2023-08-23 20:53:56.329928,0 days 00:00:01.162589,,0.9,3.0,,LightGBM,,,,,0.4,,,,1.3944446291527796e-07,1.2564645522759539e-08,,80.0,,,,,,,,,,3.0,,,,,,,,,COMPLETE,0.0,,,,,,,,,,,,,,,,,,,,
31,31,0.6408098783878893,2023-08-23 20:53:55.576923,2023-08-23 20:53:57.790949,0 days 00:00:02.214026,,0.8,1.0,,LightGBM,,,,,0.8,,,,8.181667742913765e-07,1.1291411196085916e-08,,70.0,,,,,,,,,,67.0,,,,,,,,,COMPLETE,0.0,,,,,,,,,,,,,,,,,,,,
32,32,0.5160511272573054,2023-08-23 20:53:56.437062,2023-08-23 20:55:41.503295,0 days 00:01:45.066233,,,,,MLPClassifier,,,,,,,,,,,,,,identity,adam,1.0,100.0,,,,,,,,,,,,,,COMPLETE,0.0,,,,,,,,,,,,,,,,,,,,
33,33,0.6295843999279804,2023-08-23 20:53:57.907827,2023-08-23 21:06:40.458725,0 days 00:12:42.550898,,,,,MLPClassifier,,,,,,,,,,,,,,relu,adam,1.0,100.0,,,,,,,,,,,,,,COMPLETE,0.0,,,,,,,,,,,,,,,,,,,,
34,34,0.4758482682584948,2023-08-23 20:54:02.923681,2023-08-23 20:54:51.180205,0 days 00:00:48.256524,,,,,MLPClassifier,,,,,,,,,,,,,,logistic,adam,1.0,100.0,,,,,,,,,,,,,,COMPLETE,0.0,,,,,,,,,,,,,,,,,,,,
35,35,0.6327827042339709,2023-08-23 20:54:11.122667,2023-08-23 20:54:13.000609,0 days 00:00:01.877942,,0.4,3.0,,LightGBM,,,,,0.4,,,,9.706349554868701e-06,7.019228884395062e-06,,80.0,,,,,,,,,,56.0,,,,,,,,,COMPLETE,0.0,,,,,,,,,,,,,,,,,,,,
36,36,0.6445849474827059,2023-08-23 20:54:13.088220,2023-08-23 20:54:14.542182,0 days 00:00:01.453962,,0.9,2.0,,LightGBM,,,,,0.4,,,,1.1450527958694726e-08,1.2943205130575702e-07,,80.0,,,,,,,,,,49.0,,,,,,,,,COMPLETE,0.0,,,,,,,,,,,,,,,,,,,,
37,37,0.6295754349664853,2023-08-23 20:54:14.614999,2023-08-23 20:54:17.257894,0 days 00:00:02.642895,,0.9,3.0,,LightGBM,,,,,0.6000000000000001,,,,1.7675814594017177e-06,1.533913605798459e-05,,60.0,,,,,,,,,,110.0,,,,,,,,,COMPLETE,0.0,,,,,,,,,,,,,,,,,,,,
38,38,0.6419469703228384,2023-08-23 20:54:17.334145,2023-08-23 20:54:18.212547,0 days 00:00:00.878402,,0.9,3.0,,LightGBM,,,,,0.9,,,,1.5007492400539043e-07,1.063420101846275e-08,,90.0,,,,,,,,,,23.0,,,,,,,,,COMPLETE,0.0,,,,,,,,,,,,,,,,,,,,
39,39,0.6490496151391949,2023-08-23 20:54:18.279044,2023-08-23 20:54:19.475760,0 days 00:00:01.196716,,0.9,3.0,,LightGBM,,,,,0.9,,,,1.2750697922088354e-08,8.249400005137743e-08,,80.0,,,,,,,,,,34.0,,,,,,,,,COMPLETE,0.0,,,,,,,,,,,,,,,,,,,,
40,40,0.6312811482994531,2023-08-23 20:54:19.546473,2023-08-23 20:54:22.860376,0 days 00:00:03.313903,,0.8,3.0,,LightGBM,,,,,1.0,,,,2.7745071399156046e-07,1.0606136717482146e-08,,90.0,,,,,,,,,,211.0,,,,,,,,,COMPLETE,0.0,,,,,,,,,,,,,,,,,,,,
41,41,0.5963383874402686,2023-08-23 20:54:22.920887,2023-08-23 20:56:22.197033,0 days 00:01:59.276146,,,,,MLPClassifier,,,,,,,,,,,,,,identity,adam,1.0,90.0,,,,,,,,,,,,,,COMPLETE,0.0,,,,,,,,,,,,,,,,,,,,
42,42,0.5931930647970673,2023-08-23 20:54:31.253863,2023-08-23 20:54:32.335228,0 days 00:00:01.081365,,,,,DecisionTreeClassifier,,entropy,29.0,,,,,,,,,,,,,,,,,,,,,,,,,,,,COMPLETE,0.0,,,,,,,,,,,,,,,,,,,,
43,43,0.6533276424309638,2023-08-23 20:54:32.412271,2023-08-23 20:54:33.148074,0 days 00:00:00.735803,,0.5,3.0,,LightGBM,,,,,0.5,,,,2.651182771397183e-06,4.506844761787186e-07,,50.0,,,,,,,,,,2.0,,,,,,,,,COMPLETE,0.0,,,,,,,,,,,,,,,,,,,,
44,44,0.5816328044264021,2023-08-23 20:54:33.222077,2023-08-23 20:54:35.530931,0 days 00:00:02.308854,,,,,RandomForestClassifier,,,,,,,,,,,,,,,,,,,,,,,,11.0,2.0,,,,,,COMPLETE,0.0,,,,,,,,,,,,,,,,,,,,
45,45,0.63158304525211,2023-08-23 20:54:35.615949,2023-08-23 20:54:38.517491,0 days 00:00:02.901542,,0.5,2.0,,LightGBM,,,,,0.5,,,,3.064109906001432e-06,5.739147955961579e-07,,40.0,,,,,,,,,,88.0,,,,,,,,,COMPLETE,0.0,,,,,,,,,,,,,,,,,,,,
46,46,0.3358178053830228,2023-08-23 20:54:38.606622,2023-08-23 20:54:38.968340,0 days 00:00:00.361718,0.34864205529537745,,,gblinear,XGBoost,0.9744646853819274,,,,,,,1.1861123965079428e-08,,,,,,,,,,,,,,,,,,,,0.9801971975746446,,,COMPLETE,0.0,,,,,,,,,,,,,,,,,,,,
47,47,0.612756398324432,2023-08-23 20:54:39.077634,2023-08-23 21:02:23.026178,0 days 00:07:43.948544,,,,,MLPClassifier,,,,,,,,,,,,,,relu,lbfgs,4.0,10.0,100.0,10.0,100.0,,,,,,,,,,,COMPLETE,0.0,,,,,,,,,,,,,,,,,,,,
48,48,0.64489212050673,2023-08-23 20:54:51.289279,2023-08-23 20:54:52.519658,0 days 00:00:01.230379,,0.5,3.0,,LightGBM,,,,,0.5,,,,3.5705977444522976e-07,9.608985528920833e-08,,50.0,,,,,,,,,,3.0,,,,,,,,,COMPLETE,0.0,,,,,,,,,,,,,,,,,,,,
49,49,0.6473268089336984,2023-08-23 20:54:52.591275,2023-08-23 20:54:54.031495,0 days 00:00:01.440220,,1.0,3.0,,LightGBM,,,,,0.4,,,,6.37424743186907e-08,8.081055212362512e-08,,60.0,,,,,,,,,,32.0,,,,,,,,,COMPLETE,0.0,,,,,,,,,,,,,,,,,,,,
50,50,0.6453554184319643,2023-08-23 20:54:54.117037,2023-08-23 20:54:55.572524,0 days 00:00:01.455487,,0.8,3.0,,LightGBM,,,,,0.5,,,,7.674352824207209e-08,4.1995918825674616e-08,,90.0,,,,,,,,,,30.0,,,,,,,,,COMPLETE,0.0,,,,,,,,,,,,,,,,,,,,
51,51,0.6241819533178072,2023-08-23 20:54:55.659649,2023-08-23 20:54:58.802070,0 days 00:00:03.142421,,0.6000000000000001,3.0,,LightGBM,,,,,0.9,,,,5.73324494275927e-07,5.246436043939181e-07,,70.0,,,,,,,,,,165.0,,,,,,,,,COMPLETE,0.0,,,,,,,,,,,,,,,,,,,,
52,52,0.6439853362076315,2023-08-23 20:54:58.904281,2023-08-23 20:55:00.197165,0 days 00:00:01.292884,,0.9,3.0,,LightGBM,,,,,1.0,,,,3.279038107522827e-08,4.314662682049938e-08,,50.0,,,,,,,,,,22.0,,,,,,,,,COMPLETE,0.0,,,,,,,,,,,,,,,,,,,,
53,53,0.6229810323455808,2023-08-23 20:55:00.313033,2023-08-23 20:55:00.523214,0 days 00:00:00.210181,,,,,DecisionTreeClassifier,,entropy,2.0,,,,,,,,,,,,,,,,,,,,,,,,,,,,COMPLETE,0.0,,,,,,,,,,,,,,,,,,,,
54,54,0.3358178053830228,2023-08-23 20:55:00.589877,2023-08-23 20:55:00.775293,0 days 00:00:00.185416,0.0005754642374049061,,,gblinear,XGBoost,0.2539529619440967,,,,,,,0.14878570547820008,,,,,,,,,,,,,,,,,,,,0.22529061129985667,,,COMPLETE,0.0,,,,,,,,,,,,,,,,,,,,
55,55,0.6340399002493765,2023-08-23 20:55:00.843777,2023-08-23 20:55:23.879232,0 days 00:00:23.035455,,,,,RandomForestClassifier,,,,,,,,,,,,,,,,,,,,,,,,99.0,12.0,,,,,,COMPLETE,0.0,,,,,,,,,,,,,,,,,,,,
56,56,0.628423728418287,2023-08-23 20:55:22.094451,2023-08-23 20:55:44.192627,0 days 00:00:22.098176,,,,,RandomForestClassifier,,,,,,,,,,,,,,,,,,,,,,,,93.0,12.0,,,,,,COMPLETE,0.0,,,,,,,,,,,,,,,,,,,,
57,57,0.6505488391057617,2023-08-23 20:55:23.978386,2023-08-23 20:55:24.897782,0 days 00:00:00.919396,,1.0,2.0,,LightGBM,,,,,0.7000000000000001,,,,1.0248589778267913e-05,3.5634120824574754e-08,,100.0,,,,,,,,,,2.0,,,,,,,,,COMPLETE,0.0,,,,,,,,,,,,,,,,,,,,
58,58,0.6488877224700862,2023-08-23 20:55:24.980604,2023-08-23 20:55:26.156479,0 days 00:00:01.175875,,1.0,2.0,,LightGBM,,,,,0.7000000000000001,,,,1.6858860051906744e-05,3.77867944607778e-08,,100.0,,,,,,,,,,4.0,,,,,,,,,COMPLETE,0.0,,,,,,,,,,,,,,,,,,,,
59,59,0.6506541345020004,2023-08-23 20:55:26.236534,2023-08-23 20:55:27.795788,0 days 00:00:01.559254,,1.0,2.0,,LightGBM,,,,,0.6000000000000001,,,,1.104740914556491e-07,1.0530023045468859e-08,,90.0,,,,,,,,,,23.0,,,,,,,,,COMPLETE,0.0,,,,,,,,,,,,,,,,,,,,
60,60,0.6444274038828801,2023-08-23 20:55:27.868574,2023-08-23 20:55:29.070078,0 days 00:00:01.201504,,1.0,2.0,,LightGBM,,,,,0.6000000000000001,,,,1.0035090949423225e-08,2.403369767930929e-07,,90.0,,,,,,,,,,28.0,,,,,,,,,COMPLETE,0.0,,,,,,,,,,,,,,,,,,,,
61,61,0.6448679097033683,2023-08-23 20:55:29.134770,2023-08-23 20:55:30.312079,0 days 00:00:01.177309,,1.0,2.0,,LightGBM,,,,,0.5,,,,1.5378171171579126e-06,3.601406668040012e-08,,100.0,,,,,,,,,,23.0,,,,,,,,,COMPLETE,0.0,,,,,,,,,,,,,,,,,,,,
62,62,0.6442629001372064,2023-08-23 20:55:30.388277,2023-08-23 20:55:31.834282,0 days 00:00:01.446005,,1.0,1.0,,LightGBM,,,,,0.7000000000000001,,,,3.365853204434758e-07,4.5721289088640005e-08,,90.0,,,,,,,,,,40.0,,,,,,,,,COMPLETE,0.0,,,,,,,,,,,,,,,,,,,,
63,63,0.647346863106107,2023-08-23 20:55:31.903968,2023-08-23 20:55:33.114477,0 days 00:00:01.210509,,0.9,2.0,,LightGBM,,,,,0.6000000000000001,,,,6.248140488708344e-08,1.962668135132022e-07,,100.0,,,,,,,,,,18.0,,,,,,,,,COMPLETE,0.0,,,,,,,,,,,,,,,,,,,,
64,64,0.6309400757068759,2023-08-23 20:55:33.275130,2023-08-23 20:55:36.460947,0 days 00:00:03.185817,,0.6000000000000001,2.0,,LightGBM,,,,,0.5,,,,5.415604327968497e-06,3.7556147846957806e-08,,90.0,,,,,,,,,,256.0,,,,,,,,,COMPLETE,0.0,,,,,,,,,,,,,,,,,,,,
65,65,0.5716942623368174,2023-08-23 20:55:36.534483,2023-08-23 20:55:37.229308,0 days 00:00:00.694825,,,,,DecisionTreeClassifier,,gini,32.0,,,,,,,,,,,,,,,,,,,,,,,,,,,,COMPLETE,0.0,,,,,,,,,,,,,,,,,,,,
66,66,0.560093513240776,2023-08-23 20:55:37.317605,2023-08-23 20:56:36.291810,0 days 00:00:58.974205,,,,,SVC,,,,,,,,,,,,,,,,,,,,,,,,,,,,,507.3348505503319,rbf,COMPLETE,0.0,,,,,,,,,,,,,,,,,,,,
67,67,0.5679745319874174,2023-08-23 20:55:39.749481,2023-08-23 20:56:40.643283,0 days 00:01:00.893802,,,,,SVC,,,,,,,,,,,,,,,,,,,,,,,,,,,,,795.7401811539089,rbf,COMPLETE,0.0,,,,,,,,,,,,,,,,,,,,
68,68,0.655841086621225,2023-08-23 20:55:40.537414,2023-08-23 20:55:41.721275,0 days 00:00:01.183861,,0.9,3.0,,LightGBM,,,,,0.4,,,,1.3342034268348625e-07,1.2465508505169858e-08,,80.0,,,,,,,,,,2.0,,,,,,,,,COMPLETE,0.0,,,,,,,,,,,,,,,,,,,,
69,69,0.6594818804346643,2023-08-23 20:55:41.578073,2023-08-23 20:55:42.753562,0 days 00:00:01.175489,,0.9,3.0,,LightGBM,,,,,0.4,,,,1.4099830754483386e-07,1.0918942307558905e-08,,80.0,,,,,,,,,,3.0,,,,,,,,,COMPLETE,0.0,,,,,,,,,,,,,,,,,,,,
70,70,0.6495234445198749,2023-08-23 20:55:41.826540,2023-08-23 20:55:43.488723,0 days 00:00:01.662183,,1.0,2.0,,LightGBM,,,,,0.4,,,,3.73692126494831e-05,2.1372452955622385e-08,,100.0,,,,,,,,,,17.0,,,,,,,,,COMPLETE,0.0,,,,,,,,,,,,,,,,,,,,
71,71,0.6479026674217259,2023-08-23 20:55:42.866126,2023-08-23 20:55:44.351490,0 days 00:00:01.485364,,0.8,3.0,,LightGBM,,,,,0.4,,,,1.1986851885756395e-07,1.2139986480486653e-08,,70.0,,,,,,,,,,18.0,,,,,,,,,COMPLETE,0.0,,,,,,,,,,,,,,,,,,,,
72,72,0.556325293021563,2023-08-23 20:55:43.622346,2023-08-23 20:56:44.011826,0 days 00:01:00.389480,,,,,SVC,,,,,,,,,,,,,,,,,,,,,,,,,,,,,988.7224833261639,rbf,COMPLETE,0.0,,,,,,,,,,,,,,,,,,,,
73,73,0.5581500632910155,2023-08-23 20:55:44.295501,2023-08-23 20:56:44.102220,0 days 00:00:59.806719,,,,,SVC,,,,,,,,,,,,,,,,,,,,,,,,,,,,,481.4659264239801,rbf,COMPLETE,0.0,,,,,,,,,,,,,,,,,,,,
74,74,0.6286964510047046,2023-08-23 20:55:44.479607,2023-08-23 20:55:45.468806,0 days 00:00:00.989199,5.295906187913422e-07,,,gbtree,XGBoost,0.6240038408264331,,,0.19414121600887344,,0.5695817318494713,lossguide,0.8540346688390998,,,9.0,,2.0,,,,,,,,,,,,,,,0.9438839396953305,,,COMPLETE,0.0,,,,,,,,,,,,,,,,,,,,
75,75,0.5679030689594772,2023-08-23 20:55:45.614052,2023-08-23 20:56:43.559601,0 days 00:00:57.945549,,,,,SVC,,,,,,,,,,,,,,,,,,,,,,,,,,,,,882.6187405552306,rbf,COMPLETE,0.0,,,,,,,,,,,,,,,,,,,,
76,76,0.6484428041981999,2023-08-23 20:56:22.286500,2023-08-23 20:56:23.748512,0 days 00:00:01.462012,,0.9,3.0,,LightGBM,,,,,0.4,,,,8.15622708064231e-07,8.658830897268684e-08,,80.0,,,,,,,,,,18.0,,,,,,,,,COMPLETE,0.0,,,,,,,,,,,,,,,,,,,,
77,77,0.5617511924291694,2023-08-23 20:56:23.848939,2023-08-23 20:57:17.598192,0 days 00:00:53.749253,,,,,SVC,,,,,,,,,,,,,,,,,,,,,,,,,,,,,269.83354478641616,rbf,COMPLETE,0.0,,,,,,,,,,,,,,,,,,,,
78,78,0.6514571081275338,2023-08-23 20:56:36.401993,2023-08-23 20:56:37.042529,0 days 00:00:00.640536,,1.0,3.0,,LightGBM,,,,,0.5,,,,3.4896286253396393e-08,0.000468095859407828,,90.0,,,,,,,,,,2.0,,,,,,,,,COMPLETE,0.0,,,,,,,,,,,,,,,,,,,,
79,79,0.65026260285392,2023-08-23 20:56:37.192856,2023-08-23 20:56:38.094756,0 days 00:00:00.901900,,1.0,3.0,,LightGBM,,,,,0.5,,,,3.065431639117395e-08,0.0008501156864311958,,90.0,,,,,,,,,,14.0,,,,,,,,,COMPLETE,0.0,,,,,,,,,,,,,,,,,,,,
80,80,0.6347236163039132,2023-08-23 20:56:38.232760,2023-08-23 20:56:40.171818,0 days 00:00:01.939058,,1.0,3.0,,LightGBM,,,,,0.4,,,,1.687793799266801e-07,0.0001451529391679097,,40.0,,,,,,,,,,42.0,,,,,,,,,COMPLETE,0.0,,,,,,,,,,,,,,,,,,,,
81,81,0.649909046498866,2023-08-23 20:56:40.283217,2023-08-23 20:56:41.215956,0 days 00:00:00.932739,,0.9,3.0,,LightGBM,,,,,0.6000000000000001,,,,3.000668139115836e-08,2.570257659763636e-08,,80.0,,,,,,,,,,2.0,,,,,,,,,COMPLETE,0.0,,,,,,,,,,,,,,,,,,,,
82,82,0.6419299668601084,2023-08-23 20:56:40.740706,2023-08-23 20:56:42.628728,0 days 00:00:01.888022,,0.9,3.0,,LightGBM,,,,,0.6000000000000001,,,,3.4654879725108106e-08,2.4134363267134742e-08,,80.0,,,,,,,,,,13.0,,,,,,,,,COMPLETE,0.0,,,,,,,,,,,,,,,,,,,,
83,83,0.65026260285392,2023-08-23 20:56:41.303586,2023-08-23 20:56:43.156192,0 days 00:00:01.852606,,1.0,3.0,,LightGBM,,,,,0.5,,,,9.544647897402253e-08,1.0313286567434212e-08,,90.0,,,,,,,,,,14.0,,,,,,,,,COMPLETE,0.0,,,,,,,,,,,,,,,,,,,,
84,84,0.6514571081275338,2023-08-23 20:56:42.792607,2023-08-23 20:56:43.810746,0 days 00:00:01.018139,,1.0,3.0,,LightGBM,,,,,0.5,,,,1.251544188102512e-07,1.0436323898222495e-08,,10.0,,,,,,,,,,2.0,,,,,,,,,COMPLETE,0.0,,,,,,,,,,,,,,,,,,,,
