,number,value,datetime_start,datetime_complete,duration,params_alpha,params_bagging_fraction,params_bagging_freq,params_booster,params_classifier,params_colsample_bytree,params_dct_criterion,params_dct_max_depth,params_eta,params_feature_fraction,params_gamma,params_grow_policy,params_lambda,params_lambda_l1,params_lambda_l2,params_max_depth,params_min_child_samples,params_min_child_weight,params_mlp_activation,params_mlp_solver,params_n_layers,params_n_units_l_0,params_n_units_l_1,params_n_units_l_2,params_n_units_l_3,params_normalize_type,params_num_leaves,params_rate_drop,params_rf_estimator,params_rf_max_depth,params_sample_type,params_skip_drop,params_subsample,params_svc_c,params_svc_kernel,state,best_trial,dev_acc,dev_recall_macro,dev_precision_macro,dev_f1_macro,dev_recall_0,dev_precision_0,dev_f1_0,dev_recall_1,dev_precision_1,dev_f1_1,test_acc,test_recall_macro,test_precision_macro,test_f1_macro,test_recall_0,test_precision_0,test_f1_0,test_recall_1,test_precision_1,test_f1_1
87,87,0.6889952153110048,2023-08-23 17:32:26.898390,2023-08-23 17:32:28.241330,0 days 00:00:01.342940,,,,,RandomForestClassifier,,,,,,,,,,,,,,,,,,,,,,,,42.0,15.0,,,,,,COMPLETE,0.0,,,,,,,,,,,,,,,,,,,,
88,88,0.7097288676236045,2023-08-23 17:32:27.430557,2023-08-23 17:32:28.063416,0 days 00:00:00.632859,,1.0,1.0,,LightGBM,,,,,1.0,,,,4.813457799283581e-05,0.2061432022663571,,100.0,,,,,,,,,,231.0,,,,,,,,,COMPLETE,0.0,,,,,,,,,,,,,,,,,,,,
89,89,0.7010012887875483,2023-08-23 17:32:28.133306,2023-08-23 17:32:28.976219,0 days 00:00:00.842913,,1.0,2.0,,LightGBM,,,,,0.9,,,,4.795247545052755e-05,0.17023752496137595,,90.0,,,,,,,,,,229.0,,,,,,,,,COMPLETE,0.0,,,,,,,,,,,,,,,,,,,,
90,90,0.7128205128205128,2023-08-23 17:32:28.320665,2023-08-23 17:32:29.470571,0 days 00:00:01.149906,,1.0,2.0,,LightGBM,,,,,0.9,,,,4.24827516190348e-05,0.09371377641135575,,90.0,,,,,,,,,,228.0,,,,,,,,,COMPLETE,0.0,,,,,,,,,,,,,,,,,,,,
91,91,0.7097288676236045,2023-08-23 17:32:29.075784,2023-08-23 17:32:29.960133,0 days 00:00:00.884349,,0.9,1.0,,LightGBM,,,,,1.0,,,,4.702563469337554e-06,0.14512037392238836,,100.0,,,,,,,,,,231.0,,,,,,,,,COMPLETE,0.0,,,,,,,,,,,,,,,,,,,,
92,92,0.7026143790849673,2023-08-23 17:32:29.558911,2023-08-23 17:32:30.481126,0 days 00:00:00.922215,,0.9,2.0,,LightGBM,,,,,1.0,,,,1.1399486737888103e-05,0.23785044648333672,,100.0,,,,,,,,,,229.0,,,,,,,,,COMPLETE,0.0,,,,,,,,,,,,,,,,,,,,
93,93,0.6976441102756892,2023-08-23 17:32:30.030740,2023-08-23 17:32:30.791633,0 days 00:00:00.760893,,0.9,2.0,,LightGBM,,,,,1.0,,,,8.913312678507183e-06,0.17167779393072996,,100.0,,,,,,,,,,231.0,,,,,,,,,COMPLETE,0.0,,,,,,,,,,,,,,,,,,,,
94,94,0.6767919799498747,2023-08-23 17:32:30.560497,2023-08-23 17:32:31.225436,0 days 00:00:00.664939,,1.0,1.0,,LightGBM,,,,,1.0,,,,4.316418652869901e-05,0.04799792260249878,,90.0,,,,,,,,,,233.0,,,,,,,,,COMPLETE,0.0,,,,,,,,,,,,,,,,,,,,
95,95,0.7010012887875483,2023-08-23 17:32:30.868544,2023-08-23 17:32:31.420044,0 days 00:00:00.551500,,1.0,1.0,,LightGBM,,,,,0.9,,,,4.9940443659664324e-05,0.03680117774165846,,90.0,,,,,,,,,,236.0,,,,,,,,,COMPLETE,0.0,,,,,,,,,,,,,,,,,,,,
96,96,0.6976441102756892,2023-08-23 17:32:31.335816,2023-08-23 17:32:32.151976,0 days 00:00:00.816160,,1.0,1.0,,LightGBM,,,,,0.9,,,,5.074571442511406e-06,0.20274196945616885,,90.0,,,,,,,,,,216.0,,,,,,,,,COMPLETE,0.0,,,,,,,,,,,,,,,,,,,,
97,97,0.7040525954273379,2023-08-23 17:32:31.492844,2023-08-23 17:32:32.236056,0 days 00:00:00.743212,,1.0,1.0,,LightGBM,,,,,0.9,,,,3.28069366453735e-06,0.24135436266992832,,100.0,,,,,,,,,,213.0,,,,,,,,,COMPLETE,0.0,,,,,,,,,,,,,,,,,,,,
98,98,0.6813725490196079,2023-08-23 17:32:32.237326,2023-08-23 17:32:33.354046,0 days 00:00:01.116720,,0.9,3.0,,LightGBM,,,,,0.7000000000000001,,,,0.00014342946367835497,0.03554620126327689,,80.0,,,,,,,,,,107.0,,,,,,,,,COMPLETE,0.0,,,,,,,,,,,,,,,,,,,,
99,99,0.6813725490196079,2023-08-23 17:32:32.324909,2023-08-23 17:32:33.428482,0 days 00:00:01.103573,,0.9,3.0,,LightGBM,,,,,0.7000000000000001,,,,0.0001538483554601621,0.03240097939169041,,80.0,,,,,,,,,,130.0,,,,,,,,,COMPLETE,0.0,,,,,,,,,,,,,,,,,,,,
100,100,0.6559398496240602,2023-08-23 17:32:33.423939,2023-08-23 17:32:34.506573,0 days 00:00:01.082634,,0.5,2.0,,LightGBM,,,,,1.0,,,,2.604718108572777e-05,0.36117971507186025,,40.0,,,,,,,,,,241.0,,,,,,,,,COMPLETE,0.0,,,,,,,,,,,,,,,,,,,,
101,101,0.46398837055636316,2023-08-23 17:32:33.477057,2023-08-23 17:32:33.656229,0 days 00:00:00.179172,0.0009216351599939511,,,gblinear,XGBoost,0.49748547661711356,,,,,,,1.1422673430399627e-05,,,,,,,,,,,,,,,,,,,,0.3796669309987122,,,COMPLETE,0.0,,,,,,,,,,,,,,,,,,,,
102,102,0.6176470588235294,2023-08-23 17:32:33.740384,2023-08-23 17:32:35.068568,0 days 00:00:01.328184,,0.7000000000000001,2.0,,LightGBM,,,,,1.0,,,,2.458674095931619e-05,0.3410236602784094,,30.0,,,,,,,,,,242.0,,,,,,,,,COMPLETE,0.0,,,,,,,,,,,,,,,,,,,,
103,103,0.706814425974531,2023-08-23 17:32:34.605053,2023-08-23 17:32:35.429254,0 days 00:00:00.824201,,0.7000000000000001,1.0,,LightGBM,,,,,0.6000000000000001,,,,6.515630367668186e-07,0.3642681541546948,,100.0,,,,,,,,,,184.0,,,,,,,,,COMPLETE,0.0,,,,,,,,,,,,,,,,,,,,
104,104,0.7063331988705123,2023-08-23 17:32:35.153948,2023-08-23 17:32:36.156315,0 days 00:00:01.002367,,1.0,1.0,,LightGBM,,,,,0.6000000000000001,,,,1.0344998200908366e-06,0.1285639058658681,,100.0,,,,,,,,,,187.0,,,,,,,,,COMPLETE,0.0,,,,,,,,,,,,,,,,,,,,
105,105,0.6889952153110048,2023-08-23 17:32:35.502103,2023-08-23 17:32:36.537543,0 days 00:00:01.035440,,0.6000000000000001,1.0,,LightGBM,,,,,0.6000000000000001,,,,8.154924397070435e-07,0.3869892245101017,,100.0,,,,,,,,,,186.0,,,,,,,,,COMPLETE,0.0,,,,,,,,,,,,,,,,,,,,
106,106,0.6939624556062911,2023-08-23 17:32:36.231801,2023-08-23 17:32:37.106445,0 days 00:00:00.874644,,0.6000000000000001,1.0,,LightGBM,,,,,1.0,,,,5.792432948621261e-07,0.5448420879910475,,100.0,,,,,,,,,,213.0,,,,,,,,,COMPLETE,0.0,,,,,,,,,,,,,,,,,,,,
107,107,0.6976441102756892,2023-08-23 17:32:36.654856,2023-08-23 17:32:37.596440,0 days 00:00:00.941584,,1.0,1.0,,LightGBM,,,,,0.5,,,,1.5300046948030446e-07,0.9189776160583601,,100.0,,,,,,,,,,213.0,,,,,,,,,COMPLETE,0.0,,,,,,,,,,,,,,,,,,,,
108,108,0.664380798709157,2023-08-23 17:32:37.209017,2023-08-23 17:32:38.000922,0 days 00:00:00.791905,,0.7000000000000001,1.0,,LightGBM,,,,,0.5,,,,1.75214684802967e-07,0.8683572415553854,,90.0,,,,,,,,,,242.0,,,,,,,,,COMPLETE,0.0,,,,,,,,,,,,,,,,,,,,
109,109,0.620583717357911,2023-08-23 17:32:37.675090,2023-08-23 17:32:37.747247,0 days 00:00:00.072157,,,,,DecisionTreeClassifier,,log_loss,9.0,,,,,,,,,,,,,,,,,,,,,,,,,,,,COMPLETE,0.0,,,,,,,,,,,,,,,,,,,,
110,110,0.655324790101635,2023-08-23 17:32:37.813416,2023-08-23 17:32:38.361012,0 days 00:00:00.547596,0.4194473475426607,,,gbtree,XGBoost,0.35873594425590827,,,1.2066049731983719e-06,,0.5551820812561836,lossguide,2.462612664231644e-05,,,5.0,,5.0,,,,,,,,,,,,,,,0.38604429853820305,,,COMPLETE,0.0,,,,,,,,,,,,,,,,,,,,
111,111,0.647071702244116,2023-08-23 17:32:38.074181,2023-08-23 17:32:38.724146,0 days 00:00:00.649965,0.0021103191197147306,,,gbtree,XGBoost,0.3551632932310195,,,1.4834344918831313e-06,,0.4457523073006621,lossguide,1.2166720985415594e-08,,,5.0,,5.0,,,,,,,,,,,,,,,0.3605961292245318,,,COMPLETE,0.0,,,,,,,,,,,,,,,,,,,,
112,112,0.48541666666666666,2023-08-23 17:32:38.476814,2023-08-23 17:32:38.639759,0 days 00:00:00.162945,,,,,SVC,,,,,,,,,,,,,,,,,,,,,,,,,,,,,459.39882158239965,rbf,COMPLETE,0.0,,,,,,,,,,,,,,,,,,,,
113,113,0.7273093989511901,2023-08-23 17:32:38.720889,2023-08-23 17:32:39.669749,0 days 00:00:00.948860,,1.0,1.0,,LightGBM,,,,,0.8,,,,8.731701329519642e-05,0.116089802118297,,100.0,,,,,,,,,,163.0,,,,,,,,,COMPLETE,0.0,,,,,,,,,,,,,,,,,,,,
114,114,0.6601307189542484,2023-08-23 17:32:38.818762,2023-08-23 17:32:39.993923,0 days 00:00:01.175161,,1.0,1.0,,LightGBM,,,,,0.8,,,,8.942445958414109e-05,0.11169775194763257,,60.0,,,,,,,,,,158.0,,,,,,,,,COMPLETE,0.0,,,,,,,,,,,,,,,,,,,,
115,115,0.6889952153110048,2023-08-23 17:32:39.741077,2023-08-23 17:32:40.512748,0 days 00:00:00.771671,,1.0,1.0,,LightGBM,,,,,0.8,,,,8.747197066449342e-05,0.0998444957810854,,100.0,,,,,,,,,,164.0,,,,,,,,,COMPLETE,0.0,,,,,,,,,,,,,,,,,,,,
116,116,0.7097288676236045,2023-08-23 17:32:40.080771,2023-08-23 17:32:40.956288,0 days 00:00:00.875517,,1.0,1.0,,LightGBM,,,,,0.8,,,,8.125379056233562e-05,0.2640559267514285,,100.0,,,,,,,,,,159.0,,,,,,,,,COMPLETE,0.0,,,,,,,,,,,,,,,,,,,,
117,117,0.6976441102756892,2023-08-23 17:32:40.578390,2023-08-23 17:32:41.302604,0 days 00:00:00.724214,,1.0,1.0,,LightGBM,,,,,1.0,,,,1.0011318000593526e-05,0.3026744078673065,,100.0,,,,,,,,,,256.0,,,,,,,,,COMPLETE,0.0,,,,,,,,,,,,,,,,,,,,
118,118,0.7097288676236045,2023-08-23 17:32:41.049238,2023-08-23 17:32:41.955296,0 days 00:00:00.906058,,1.0,1.0,,LightGBM,,,,,1.0,,,,6.996768983229741e-06,0.33317471989534186,,100.0,,,,,,,,,,172.0,,,,,,,,,COMPLETE,0.0,,,,,,,,,,,,,,,,,,,,
119,119,0.6976441102756892,2023-08-23 17:32:41.378684,2023-08-23 17:32:42.219518,0 days 00:00:00.840834,,1.0,1.0,,LightGBM,,,,,0.8,,,,6.282592456885749e-05,0.23122599924004933,,100.0,,,,,,,,,,162.0,,,,,,,,,COMPLETE,0.0,,,,,,,,,,,,,,,,,,,,
120,120,0.6976441102756892,2023-08-23 17:32:42.046663,2023-08-23 17:32:42.916636,0 days 00:00:00.869973,,1.0,1.0,,LightGBM,,,,,1.0,,,,4.3313739246522195e-05,0.18010971175480908,,100.0,,,,,,,,,,146.0,,,,,,,,,COMPLETE,0.0,,,,,,,,,,,,,,,,,,,,
121,121,0.6767919799498747,2023-08-23 17:32:42.297299,2023-08-23 17:32:43.272817,0 days 00:00:00.975518,,1.0,1.0,,LightGBM,,,,,1.0,,,,0.0002545005747521823,0.05774299930452945,,90.0,,,,,,,,,,132.0,,,,,,,,,COMPLETE,0.0,,,,,,,,,,,,,,,,,,,,
122,122,0.6767919799498747,2023-08-23 17:32:42.982998,2023-08-23 17:32:43.895002,0 days 00:00:00.912004,,1.0,1.0,,LightGBM,,,,,1.0,,,,0.00017163897694028897,0.05799999477649832,,90.0,,,,,,,,,,137.0,,,,,,,,,COMPLETE,0.0,,,,,,,,,,,,,,,,,,,,
123,123,0.6803806880142758,2023-08-23 17:32:43.124464,2023-08-23 17:32:44.045990,0 days 00:00:00.921526,,1.0,1.0,,LightGBM,,,,,1.0,,,,0.00023770369162141636,0.046239617519481316,,90.0,,,,,,,,,,136.0,,,,,,,,,COMPLETE,0.0,,,,,,,,,,,,,,,,,,,,
124,124,0.7184962406015037,2023-08-23 17:32:43.331803,2023-08-23 17:32:44.313306,0 days 00:00:00.981503,,1.0,1.0,,LightGBM,,,,,0.9,,,,5.368183373445071e-06,0.5229907331227279,,90.0,,,,,,,,,,144.0,,,,,,,,,COMPLETE,0.0,,,,,,,,,,,,,,,,,,,,
125,125,0.7150684931506849,2023-08-23 17:32:43.959867,2023-08-23 17:32:45.247408,0 days 00:00:01.287541,,0.9,2.0,,LightGBM,,,,,0.9,,,,5.3978186626666255e-06,0.5092141859460848,,100.0,,,,,,,,,,111.0,,,,,,,,,COMPLETE,0.0,,,,,,,,,,,,,,,,,,,,
126,126,0.6853569987898347,2023-08-23 17:32:44.142982,2023-08-23 17:32:45.355419,0 days 00:00:01.212437,,0.9,2.0,,LightGBM,,,,,0.9,,,,4.6156170595583434e-06,0.5325633846990973,,100.0,,,,,,,,,,171.0,,,,,,,,,COMPLETE,0.0,,,,,,,,,,,,,,,,,,,,
127,127,0.6682615629984051,2023-08-23 17:32:44.425656,2023-08-23 17:32:45.713717,0 days 00:00:01.288061,,0.9,2.0,,LightGBM,,,,,0.9,,,,2.0200748356745228e-05,0.9775868406460091,,80.0,,,,,,,,,,106.0,,,,,,,,,COMPLETE,0.0,,,,,,,,,,,,,,,,,,,,
128,128,0.664380798709157,2023-08-23 17:32:45.333322,2023-08-23 17:32:46.302472,0 days 00:00:00.969150,,0.9,2.0,,LightGBM,,,,,0.9,,,,4.471037561673272e-06,0.6121178210020284,,100.0,,,,,,,,,,112.0,,,,,,,,,COMPLETE,0.0,,,,,,,,,,,,,,,,,,,,
129,129,0.711319008944176,2023-08-23 17:32:45.441611,2023-08-23 17:32:46.160310,0 days 00:00:00.718699,,0.9,2.0,,LightGBM,,,,,0.9,,,,1.7301153184905034e-05,0.9384925290295569,,90.0,,,,,,,,,,115.0,,,,,,,,,COMPLETE,0.0,,,,,,,,,,,,,,,,,,,,
130,130,0.6853569987898347,2023-08-23 17:32:45.820166,2023-08-23 17:32:46.897401,0 days 00:00:01.077235,,0.8,2.0,,LightGBM,,,,,0.9,,,,1.510405472733192e-05,0.12166641139655492,,90.0,,,,,,,,,,114.0,,,,,,,,,COMPLETE,0.0,,,,,,,,,,,,,,,,,,,,
131,131,0.664380798709157,2023-08-23 17:32:46.272951,2023-08-23 17:32:47.222866,0 days 00:00:00.949915,,0.9,2.0,,LightGBM,,,,,0.9,,,,1.5621810350161758e-05,0.5553034861959989,,90.0,,,,,,,,,,117.0,,,,,,,,,COMPLETE,0.0,,,,,,,,,,,,,,,,,,,,
132,132,0.6853569987898347,2023-08-23 17:32:46.371137,2023-08-23 17:32:47.306920,0 days 00:00:00.935783,,0.8,2.0,,LightGBM,,,,,0.9,,,,1.3820903902767315e-05,0.145529333393463,,90.0,,,,,,,,,,96.0,,,,,,,,,COMPLETE,0.0,,,,,,,,,,,,,,,,,,,,
133,133,0.6939624556062911,2023-08-23 17:32:47.001958,2023-08-23 17:32:47.912966,0 days 00:00:00.911008,,0.9,2.0,,LightGBM,,,,,0.9,,,,8.833067068729107e-06,0.5617038539270129,,90.0,,,,,,,,,,95.0,,,,,,,,,COMPLETE,0.0,,,,,,,,,,,,,,,,,,,,
134,134,0.5806451612903225,2023-08-23 17:32:47.374046,2023-08-23 17:32:47.488850,0 days 00:00:00.114804,,,,,DecisionTreeClassifier,,gini,5.0,,,,,,,,,,,,,,,,,,,,,,,,,,,,COMPLETE,0.0,,,,,,,,,,,,,,,,,,,,
135,135,0.6868517898962863,2023-08-23 17:32:47.386698,2023-08-23 17:32:48.111159,0 days 00:00:00.724461,0.0001149107756919743,,,dart,XGBoost,0.5222563862806738,,,0.01801406164464666,,1.7014209366324028e-07,depthwise,0.05146451034543244,,,9.0,,8.0,,,,,,,,forest,,3.0483498685113053e-05,,,weighted,0.9761014043088895,0.21159444333411523,,,COMPLETE,0.0,,,,,,,,,,,,,,,,,,,,
136,136,0.6682615629984051,2023-08-23 17:32:47.587727,2023-08-23 17:32:48.114209,0 days 00:00:00.526482,0.0003392535141595707,,,dart,XGBoost,0.5860250747972684,,,0.032158516025266135,,2.9490999213952557e-08,depthwise,0.04074817304114599,,,9.0,,8.0,,,,,,,,forest,,1.954379258253762e-08,,,weighted,0.42932434254853197,0.2031564334765903,,,COMPLETE,0.0,,,,,,,,,,,,,,,,,,,,
137,137,0.6899352318289298,2023-08-23 17:32:47.884392,2023-08-23 17:32:48.596646,0 days 00:00:00.712254,2.6967175753213873e-07,,,dart,XGBoost,0.5740700525701907,,,0.009307843730086965,,9.454721186288339e-08,depthwise,0.033671870911667595,,,9.0,,8.0,,,,,,,,forest,,1.993474280960881e-08,,,weighted,0.30051300673546144,0.20552199509590002,,,COMPLETE,0.0,,,,,,,,,,,,,,,,,,,,
138,138,0.6889952153110048,2023-08-23 17:32:47.978369,2023-08-23 17:32:48.788066,0 days 00:00:00.809697,,1.0,2.0,,LightGBM,,,,,0.8,,,,3.783113792145314e-05,0.2039295648908086,,100.0,,,,,,,,,,250.0,,,,,,,,,COMPLETE,0.0,,,,,,,,,,,,,,,,,,,,
139,139,0.6682615629984051,2023-08-23 17:32:48.257639,2023-08-23 17:32:49.219603,0 days 00:00:00.961964,,1.0,2.0,,LightGBM,,,,,0.8,,,,3.172351486086986e-05,0.21332789244992342,,100.0,,,,,,,,,,248.0,,,,,,,,,COMPLETE,0.0,,,,,,,,,,,,,,,,,,,,
140,140,0.6803806880142758,2023-08-23 17:32:48.261293,2023-08-23 17:32:49.329578,0 days 00:00:01.068285,,1.0,2.0,,LightGBM,,,,,0.8,,,,8.292403719833264e-05,0.17575305779068062,,100.0,,,,,,,,,,249.0,,,,,,,,,COMPLETE,0.0,,,,,,,,,,,,,,,,,,,,
141,141,0.6889952153110048,2023-08-23 17:32:48.702969,2023-08-23 17:32:49.568161,0 days 00:00:00.865192,,1.0,2.0,,LightGBM,,,,,0.8,,,,3.176848395285291e-05,0.16849197358496026,,100.0,,,,,,,,,,148.0,,,,,,,,,COMPLETE,0.0,,,,,,,,,,,,,,,,,,,,
142,142,0.7040525954273379,2023-08-23 17:32:48.872751,2023-08-23 17:32:49.928655,0 days 00:00:01.055904,,1.0,2.0,,LightGBM,,,,,0.9,,,,6.830738980717071e-05,0.07891412831653769,,100.0,,,,,,,,,,150.0,,,,,,,,,COMPLETE,0.0,,,,,,,,,,,,,,,,,,,,
143,143,0.6512820512820513,2023-08-23 17:32:49.312034,2023-08-23 17:32:50.505726,0 days 00:00:01.193692,,1.0,2.0,,LightGBM,,,,,0.9,,,,2.025035745331861e-06,0.07842285470927784,,80.0,,,,,,,,,,144.0,,,,,,,,,COMPLETE,0.0,,,,,,,,,,,,,,,,,,,,
144,144,0.6953125,2023-08-23 17:32:49.423050,2023-08-23 17:32:50.390334,0 days 00:00:00.967284,,0.9,1.0,,LightGBM,,,,,0.9,,,,2.123351178290543e-06,0.96122278385348,,80.0,,,,,,,,,,145.0,,,,,,,,,COMPLETE,0.0,,,,,,,,,,,,,,,,,,,,
145,145,0.3696969696969697,2023-08-23 17:32:49.665379,2023-08-23 17:32:49.833255,0 days 00:00:00.167876,,,,,SVC,,,,,,,,,,,,,,,,,,,,,,,,,,,,,0.06370706851118962,poly,COMPLETE,0.0,,,,,,,,,,,,,,,,,,,,
146,146,0.6728564180618974,2023-08-23 17:32:49.919912,2023-08-23 17:32:50.983580,0 days 00:00:01.063668,,0.9,1.0,,LightGBM,,,,,0.9,,,,1.8504859569413086e-06,0.08646737342589915,,80.0,,,,,,,,,,222.0,,,,,,,,,COMPLETE,0.0,,,,,,,,,,,,,,,,,,,,
147,147,0.6803806880142758,2023-08-23 17:32:50.055188,2023-08-23 17:32:50.985517,0 days 00:00:00.930329,,0.9,1.0,,LightGBM,,,,,0.9,,,,6.687029009180904e-06,0.022754650385352168,,80.0,,,,,,,,,,224.0,,,,,,,,,COMPLETE,0.0,,,,,,,,,,,,,,,,,,,,
148,148,0.6976441102756892,2023-08-23 17:32:50.481462,2023-08-23 17:32:51.563057,0 days 00:00:01.081595,,1.0,1.0,,LightGBM,,,,,1.0,,,,6.8384877973537e-06,0.3494691908573952,,90.0,,,,,,,,,,225.0,,,,,,,,,COMPLETE,0.0,,,,,,,,,,,,,,,,,,,,
149,149,0.7040525954273379,2023-08-23 17:32:50.616915,2023-08-23 17:32:51.485124,0 days 00:00:00.868209,,1.0,1.0,,LightGBM,,,,,1.0,,,,7.271630251859652e-06,0.3425735754064507,,90.0,,,,,,,,,,221.0,,,,,,,,,COMPLETE,0.0,,,,,,,,,,,,,,,,,,,,
150,150,0.6923076923076923,2023-08-23 17:32:51.110826,2023-08-23 17:32:52.362507,0 days 00:00:01.251681,,1.0,1.0,,LightGBM,,,,,1.0,,,,2.1674108687895665e-05,0.2940687778920001,,90.0,,,,,,,,,,197.0,,,,,,,,,COMPLETE,0.0,,,,,,,,,,,,,,,,,,,,
151,151,0.6939624556062911,2023-08-23 17:32:51.115334,2023-08-23 17:32:52.196509,0 days 00:00:01.081175,,1.0,1.0,,LightGBM,,,,,1.0,,,,7.046156270921129e-06,0.33571177967150523,,90.0,,,,,,,,,,236.0,,,,,,,,,COMPLETE,0.0,,,,,,,,,,,,,,,,,,,,
152,152,0.6685514547136835,2023-08-23 17:32:51.631731,2023-08-23 17:32:52.831663,0 days 00:00:01.199932,,1.0,1.0,,LightGBM,,,,,1.0,,,,2.0660228746616882e-05,0.3408274750753812,,70.0,,,,,,,,,,122.0,,,,,,,,,COMPLETE,0.0,,,,,,,,,,,,,,,,,,,,
153,153,0.6813725490196079,2023-08-23 17:32:51.654478,2023-08-23 17:32:52.609526,0 days 00:00:00.955048,,1.0,1.0,,LightGBM,,,,,1.0,,,,2.3055939954251703e-05,0.3949377084348109,,70.0,,,,,,,,,,235.0,,,,,,,,,COMPLETE,0.0,,,,,,,,,,,,,,,,,,,,
154,154,0.6517503805175038,2023-08-23 17:32:52.276833,2023-08-23 17:32:53.175972,0 days 00:00:00.899139,,1.0,1.0,,LightGBM,,,,,1.0,,,,2.10062356310111e-05,0.31185317443388655,,70.0,,,,,,,,,,170.0,,,,,,,,,COMPLETE,0.0,,,,,,,,,,,,,,,,,,,,
155,155,0.6813725490196079,2023-08-23 17:32:52.451677,2023-08-23 17:32:53.278782,0 days 00:00:00.827105,,0.8,1.0,,LightGBM,,,,,1.0,,,,0.00010954073657533898,0.5916337819615656,,70.0,,,,,,,,,,120.0,,,,,,,,,COMPLETE,0.0,,,,,,,,,,,,,,,,,,,,
156,156,0.3696969696969697,2023-08-23 17:32:52.683997,2023-08-23 17:33:04.746236,0 days 00:00:12.062239,,,,,MLPClassifier,,,,,,,,,,,,,,tanh,sgd,3.0,40.0,50.0,40.0,,,,,,,,,,,,COMPLETE,0.0,,,,,,,,,,,,,,,,,,,,
157,157,0.3696969696969697,2023-08-23 17:32:52.896595,2023-08-23 17:33:07.210376,0 days 00:00:14.313781,,,,,MLPClassifier,,,,,,,,,,,,,,tanh,sgd,3.0,40.0,50.0,50.0,,,,,,,,,,,,COMPLETE,0.0,,,,,,,,,,,,,,,,,,,,
158,158,0.6388888888888888,2023-08-23 17:32:53.244797,2023-08-23 17:32:54.139168,0 days 00:00:00.894371,,0.8,1.0,,LightGBM,,,,,0.9,,,,3.796494410315655e-06,0.5601974259518778,,100.0,,,,,,,,,,204.0,,,,,,,,,COMPLETE,0.0,,,,,,,,,,,,,,,,,,,,
159,159,0.7040525954273379,2023-08-23 17:32:53.357825,2023-08-23 17:32:54.040157,0 days 00:00:00.682332,,0.7000000000000001,1.0,,LightGBM,,,,,0.7000000000000001,,,,4.07347187787248e-06,0.12877459587150364,,100.0,,,,,,,,,,191.0,,,,,,,,,COMPLETE,0.0,,,,,,,,,,,,,,,,,,,,
160,160,0.3696969696969697,2023-08-23 17:32:54.205370,2023-08-23 17:32:57.704005,0 days 00:00:03.498635,,,,,MLPClassifier,,,,,,,,,,,,,,tanh,sgd,3.0,40.0,60.0,50.0,,,,,,,,,,,,COMPLETE,0.0,,,,,,,,,,,,,,,,,,,,
161,161,0.7063331988705123,2023-08-23 17:32:54.238877,2023-08-23 17:32:54.720858,0 days 00:00:00.481981,,0.5,1.0,,LightGBM,,,,,0.9,,,,5.3235413946343004e-05,0.12398465486372984,,100.0,,,,,,,,,,174.0,,,,,,,,,COMPLETE,0.0,,,,,,,,,,,,,,,,,,,,
162,162,0.3696969696969697,2023-08-23 17:32:54.800575,2023-08-23 17:33:15.663752,0 days 00:00:20.863177,,,,,MLPClassifier,,,,,,,,,,,,,,tanh,sgd,3.0,50.0,50.0,50.0,,,,,,,,,,,,COMPLETE,0.0,,,,,,,,,,,,,,,,,,,,
163,163,0.6889952153110048,2023-08-23 17:32:57.800861,2023-08-23 17:32:58.344674,0 days 00:00:00.543813,,0.9,1.0,,LightGBM,,,,,0.5,,,,1.4400616436781888e-05,0.22085480440022737,,100.0,,,,,,,,,,179.0,,,,,,,,,COMPLETE,0.0,,,,,,,,,,,,,,,,,,,,
164,164,0.5815916004317536,2023-08-23 17:32:58.400644,2023-08-23 17:32:58.494437,0 days 00:00:00.093793,,,,,DecisionTreeClassifier,,entropy,13.0,,,,,,,,,,,,,,,,,,,,,,,,,,,,COMPLETE,0.0,,,,,,,,,,,,,,,,,,,,
165,165,0.6853569987898347,2023-08-23 17:32:58.600417,2023-08-23 17:32:59.200816,0 days 00:00:00.600399,,1.0,3.0,,LightGBM,,,,,0.6000000000000001,,,,1.0455841878025401e-05,0.7156407671222816,,100.0,,,,,,,,,,165.0,,,,,,,,,COMPLETE,0.0,,,,,,,,,,,,,,,,,,,,
166,166,0.7097288676236045,2023-08-23 17:32:59.262264,2023-08-23 17:32:59.869569,0 days 00:00:00.607305,,1.0,1.0,,LightGBM,,,,,0.7000000000000001,,,,4.36929346563751e-05,0.06994778991028448,,100.0,,,,,,,,,,154.0,,,,,,,,,COMPLETE,0.0,,,,,,,,,,,,,,,,,,,,
167,167,0.7097288676236045,2023-08-23 17:32:59.764934,2023-08-23 17:33:00.745870,0 days 00:00:00.980936,,1.0,1.0,,LightGBM,,,,,0.7000000000000001,,,,4.1159916461879466e-05,0.06082029310484978,,100.0,,,,,,,,,,241.0,,,,,,,,,COMPLETE,0.0,,,,,,,,,,,,,,,,,,,,
168,168,0.6853569987898347,2023-08-23 17:32:59.933938,2023-08-23 17:33:00.628045,0 days 00:00:00.694107,,1.0,1.0,,LightGBM,,,,,0.6000000000000001,,,,0.00011479513465209503,0.055085295582312135,,100.0,,,,,,,,,,159.0,,,,,,,,,COMPLETE,0.0,,,,,,,,,,,,,,,,,,,,
169,169,0.6889952153110048,2023-08-23 17:33:00.126176,2023-08-23 17:33:01.160207,0 days 00:00:01.034031,,1.0,1.0,,LightGBM,,,,,0.7000000000000001,,,,5.971815822732743e-05,0.02427101073421706,,100.0,,,,,,,,,,160.0,,,,,,,,,COMPLETE,0.0,,,,,,,,,,,,,,,,,,,,
170,170,0.6976441102756892,2023-08-23 17:33:00.731295,2023-08-23 17:33:01.732848,0 days 00:00:01.001553,,1.0,1.0,,LightGBM,,,,,0.7000000000000001,,,,5.687503521366027e-05,0.027335260431205755,,100.0,,,,,,,,,,240.0,,,,,,,,,COMPLETE,0.0,,,,,,,,,,,,,,,,,,,,
171,171,0.6976441102756892,2023-08-23 17:33:00.810476,2023-08-23 17:33:01.464654,0 days 00:00:00.654178,,1.0,1.0,,LightGBM,,,,,0.7000000000000001,,,,4.868937769330588e-05,0.038038831379319675,,100.0,,,,,,,,,,241.0,,,,,,,,,COMPLETE,0.0,,,,,,,,,,,,,,,,,,,,
172,172,0.6976441102756892,2023-08-23 17:33:01.228927,2023-08-23 17:33:02.269277,0 days 00:00:01.040350,,1.0,1.0,,LightGBM,,,,,0.7000000000000001,,,,3.824728194347337e-05,0.03877306643482088,,100.0,,,,,,,,,,241.0,,,,,,,,,COMPLETE,0.0,,,,,,,,,,,,,,,,,,,,
