,number,value,datetime_start,datetime_complete,duration,params_alpha,params_bagging_fraction,params_bagging_freq,params_booster,params_classifier,params_colsample_bytree,params_dct_criterion,params_dct_max_depth,params_eta,params_feature_fraction,params_gamma,params_grow_policy,params_lambda,params_lambda_l1,params_lambda_l2,params_max_depth,params_min_child_samples,params_min_child_weight,params_mlp_activation,params_mlp_solver,params_n_layers,params_n_units_l_0,params_n_units_l_1,params_n_units_l_2,params_n_units_l_3,params_normalize_type,params_num_leaves,params_rate_drop,params_rf_estimator,params_rf_max_depth,params_sample_type,params_skip_drop,params_subsample,params_svc_c,params_svc_kernel,state,best_trial,dev_acc,dev_recall_macro,dev_precision_macro,dev_f1_macro,dev_recall_0,dev_precision_0,dev_f1_0,dev_recall_1,dev_precision_1,dev_f1_1,test_acc,test_recall_macro,test_precision_macro,test_f1_macro,test_recall_0,test_precision_0,test_f1_0,test_recall_1,test_precision_1,test_f1_1
84,84,0.3696969696969697,2023-08-23 12:14:09.601420,2023-08-23 12:14:09.696344,0 days 00:00:00.094924,,,,,SVC,,,,,,,,,,,,,,,,,,,,,,,,,,,,,0.8907532193431287,linear,COMPLETE,0.0,,,,,,,,,,,,,,,,,,,,
85,85,0.7040525954273379,2023-08-23 12:14:09.807775,2023-08-23 12:14:10.708287,0 days 00:00:00.900512,,1.0,1.0,,LightGBM,,,,,1.0,,,,3.2223040278566485e-07,5.816947166548167e-08,,30.0,,,,,,,,,,248.0,,,,,,,,,COMPLETE,0.0,,,,,,,,,,,,,,,,,,,,
86,86,0.7216218895608209,2023-08-23 12:14:10.792956,2023-08-23 12:14:11.650971,0 days 00:00:00.858015,,0.7000000000000001,2.0,,LightGBM,,,,,1.0,,,,3.311751864787315e-06,0.00919438454073893,,20.0,,,,,,,,,,203.0,,,,,,,,,COMPLETE,0.0,,,,,,,,,,,,,,,,,,,,
87,87,0.5751633986928104,2023-08-23 12:14:11.714355,2023-08-23 12:15:33.257620,0 days 00:01:21.543265,,,,,MLPClassifier,,,,,,,,,,,,,,relu,lbfgs,1.0,70.0,,,,,,,,,,,,,,COMPLETE,0.0,,,,,,,,,,,,,,,,,,,,
88,88,0.7333333333333334,2023-08-23 12:14:38.406354,2023-08-23 12:14:38.990296,0 days 00:00:00.583942,,0.8,1.0,,LightGBM,,,,,0.6000000000000001,,,,1.2452563119006872e-06,4.34363883715692e-05,,70.0,,,,,,,,,,77.0,,,,,,,,,COMPLETE,0.0,,,,,,,,,,,,,,,,,,,,
89,89,0.7448729270925325,2023-08-23 12:14:39.057631,2023-08-23 12:14:39.627471,0 days 00:00:00.569840,,0.8,1.0,,LightGBM,,,,,0.9,,,,4.031105422896741e-08,2.2558108297668935e-05,,60.0,,,,,,,,,,68.0,,,,,,,,,COMPLETE,0.0,,,,,,,,,,,,,,,,,,,,
90,90,0.7834836918806385,2023-08-23 12:14:39.717893,2023-08-23 12:14:41.395377,0 days 00:00:01.677484,,0.8,1.0,,LightGBM,,,,,0.6000000000000001,,,,4.2926900510259027e-07,5.5538204230750405e-06,,10.0,,,,,,,,,,89.0,,,,,,,,,COMPLETE,0.0,,,,,,,,,,,,,,,,,,,,
91,91,0.706814425974531,2023-08-23 12:14:41.473030,2023-08-23 12:14:43.114911,0 days 00:00:01.641881,,0.8,1.0,,LightGBM,,,,,0.7000000000000001,,,,3.704317853784478e-07,5.016816714029046e-06,,10.0,,,,,,,,,,103.0,,,,,,,,,COMPLETE,0.0,,,,,,,,,,,,,,,,,,,,
92,92,0.7184962406015037,2023-08-23 12:14:43.185874,2023-08-23 12:14:44.845973,0 days 00:00:01.660099,,1.0,3.0,,LightGBM,,,,,1.0,,,,6.401155788670638e-08,2.509848799426198e-06,,10.0,,,,,,,,,,46.0,,,,,,,,,COMPLETE,0.0,,,,,,,,,,,,,,,,,,,,
93,93,0.7810526315789473,2023-08-23 12:14:44.988713,2023-08-23 12:14:46.015183,0 days 00:00:01.026470,,0.9,1.0,,LightGBM,,,,,0.4,,,,1.934215482511956e-07,1.601102745680438e-05,,20.0,,,,,,,,,,86.0,,,,,,,,,COMPLETE,0.0,,,,,,,,,,,,,,,,,,,,
94,94,0.7482855990318678,2023-08-23 12:14:46.163386,2023-08-23 12:14:47.170528,0 days 00:00:01.007142,,0.9,1.0,,LightGBM,,,,,0.4,,,,3.6968457886792655e-07,6.842786305840921e-06,,20.0,,,,,,,,,,87.0,,,,,,,,,COMPLETE,0.0,,,,,,,,,,,,,,,,,,,,
95,95,0.7493975903614458,2023-08-23 12:14:47.245032,2023-08-23 12:14:48.027625,0 days 00:00:00.782593,,1.0,2.0,,LightGBM,,,,,0.5,,,,1.953474172758753e-07,1.6470928506250994e-05,,30.0,,,,,,,,,,115.0,,,,,,,,,COMPLETE,0.0,,,,,,,,,,,,,,,,,,,,
96,96,0.7150684931506849,2023-08-23 12:14:48.115934,2023-08-23 12:14:49.105792,0 days 00:00:00.989858,,0.9,1.0,,LightGBM,,,,,0.8,,,,3.987461794514311e-08,4.341789116711546e-06,,20.0,,,,,,,,,,89.0,,,,,,,,,COMPLETE,0.0,,,,,,,,,,,,,,,,,,,,
97,97,0.6855385257011782,2023-08-23 12:14:49.189549,2023-08-23 12:14:50.030884,0 days 00:00:00.841335,,,,,RandomForestClassifier,,,,,,,,,,,,,,,,,,,,,,,,58.0,6.0,,,,,,COMPLETE,0.0,,,,,,,,,,,,,,,,,,,,
98,98,0.6976441102756892,2023-08-23 12:14:49.534526,2023-08-23 12:14:51.579814,0 days 00:00:02.045288,,0.8,1.0,,LightGBM,,,,,0.4,,,,1.4823305396234295e-06,1.2688822446247897e-06,,10.0,,,,,,,,,,250.0,,,,,,,,,COMPLETE,0.0,,,,,,,,,,,,,,,,,,,,
99,99,0.6889952153110048,2023-08-23 12:14:50.117798,2023-08-23 12:14:52.180331,0 days 00:00:02.062533,,0.8,1.0,,LightGBM,,,,,0.4,,,,1.0801144600242867e-06,0.00010859903334906583,,10.0,,,,,,,,,,253.0,,,,,,,,,COMPLETE,0.0,,,,,,,,,,,,,,,,,,,,
100,100,0.7393483709273183,2023-08-23 12:14:51.650819,2023-08-23 12:14:52.519161,0 days 00:00:00.868342,,0.8,1.0,,LightGBM,,,,,0.4,,,,5.041587868019621e-07,1.0288894567384892e-05,,40.0,,,,,,,,,,84.0,,,,,,,,,COMPLETE,0.0,,,,,,,,,,,,,,,,,,,,
101,101,0.7128205128205128,2023-08-23 12:14:52.251864,2023-08-23 12:14:53.661071,0 days 00:00:01.409207,,1.0,1.0,,LightGBM,,,,,0.6000000000000001,,,,2.357665607727302e-07,1.0873161617986457e-05,,30.0,,,,,,,,,,107.0,,,,,,,,,COMPLETE,0.0,,,,,,,,,,,,,,,,,,,,
102,102,0.7128205128205128,2023-08-23 12:14:52.633245,2023-08-23 12:14:53.801447,0 days 00:00:01.168202,,1.0,2.0,,LightGBM,,,,,0.6000000000000001,,,,3.3721477431857856e-06,2.9201644477974535e-07,,30.0,,,,,,,,,,180.0,,,,,,,,,COMPLETE,0.0,,,,,,,,,,,,,,,,,,,,
103,103,0.3696969696969697,2023-08-23 12:14:53.771874,2023-08-23 12:14:54.123785,0 days 00:00:00.351911,,,,,SVC,,,,,,,,,,,,,,,,,,,,,,,,,,,,,1.0760091801204032e-10,poly,COMPLETE,0.0,,,,,,,,,,,,,,,,,,,,
104,104,0.3696969696969697,2023-08-23 12:14:53.895953,2023-08-23 12:14:54.029146,0 days 00:00:00.133193,,,,,SVC,,,,,,,,,,,,,,,,,,,,,,,,,,,,,2.214127728300693e-10,poly,COMPLETE,0.0,,,,,,,,,,,,,,,,,,,,
105,105,0.7359375,2023-08-23 12:14:54.215478,2023-08-23 12:14:55.474771,0 days 00:00:01.259293,,0.7000000000000001,3.0,,LightGBM,,,,,1.0,,,,3.432409063297851e-05,2.559471947248837e-05,,20.0,,,,,,,,,,63.0,,,,,,,,,COMPLETE,0.0,,,,,,,,,,,,,,,,,,,,
106,106,0.7359375,2023-08-23 12:14:54.219444,2023-08-23 12:14:55.608781,0 days 00:00:01.389337,,0.7000000000000001,3.0,,LightGBM,,,,,1.0,,,,5.8908083129463775e-05,2.5759036804001377e-05,,20.0,,,,,,,,,,68.0,,,,,,,,,COMPLETE,0.0,,,,,,,,,,,,,,,,,,,,
107,107,0.5569080949482654,2023-08-23 12:14:55.580708,2023-08-23 12:14:55.695540,0 days 00:00:00.114832,,,,,DecisionTreeClassifier,,entropy,2.0,,,,,,,,,,,,,,,,,,,,,,,,,,,,COMPLETE,0.0,,,,,,,,,,,,,,,,,,,,
108,108,0.5569080949482654,2023-08-23 12:14:55.687525,2023-08-23 12:14:55.855020,0 days 00:00:00.167495,,,,,DecisionTreeClassifier,,entropy,2.0,,,,,,,,,,,,,,,,,,,,,,,,,,,,COMPLETE,0.0,,,,,,,,,,,,,,,,,,,,
109,109,0.7422424903340934,2023-08-23 12:14:55.800419,2023-08-23 12:14:57.063777,0 days 00:00:01.263358,,0.8,1.0,,LightGBM,,,,,0.6000000000000001,,,,5.497341763687547e-07,5.3723324746807855e-05,,20.0,,,,,,,,,,230.0,,,,,,,,,COMPLETE,0.0,,,,,,,,,,,,,,,,,,,,
110,110,0.75625,2023-08-23 12:14:55.949881,2023-08-23 12:14:56.421511,0 days 00:00:00.471630,,0.8,1.0,,LightGBM,,,,,0.6000000000000001,,,,0.2793313464475088,6.654524529309285e-05,,60.0,,,,,,,,,,80.0,,,,,,,,,COMPLETE,0.0,,,,,,,,,,,,,,,,,,,,
111,111,0.7063331988705123,2023-08-23 12:14:56.512233,2023-08-23 12:14:57.177852,0 days 00:00:00.665619,,0.9,1.0,,LightGBM,,,,,0.7000000000000001,,,,6.25491969843301e-07,2.7373443510388903e-06,,60.0,,,,,,,,,,33.0,,,,,,,,,COMPLETE,0.0,,,,,,,,,,,,,,,,,,,,
112,112,0.441760601180891,2023-08-23 12:14:57.131792,2023-08-23 12:14:57.402635,0 days 00:00:00.270843,9.953788674863141e-06,,,gblinear,XGBoost,0.47961015930161877,,,,,,,7.608455602191927e-06,,,,,,,,,,,,,,,,,,,,0.20270803128057974,,,COMPLETE,0.0,,,,,,,,,,,,,,,,,,,,
113,113,0.3946784922394678,2023-08-23 12:14:57.292836,2023-08-23 12:14:57.546824,0 days 00:00:00.253988,1.2781370002700164e-05,,,gblinear,XGBoost,0.47651142511973427,,,,,,,2.788901401566663e-05,,,,,,,,,,,,,,,,,,,,0.2510942360639418,,,COMPLETE,0.0,,,,,,,,,,,,,,,,,,,,
114,114,0.7602005012531328,2023-08-23 12:14:57.486973,2023-08-23 12:14:58.569872,0 days 00:00:01.082899,,0.9,2.0,,LightGBM,,,,,0.5,,,,0.0005088304251196338,0.00015249879301854934,,50.0,,,,,,,,,,73.0,,,,,,,,,COMPLETE,0.0,,,,,,,,,,,,,,,,,,,,
115,115,0.7216218895608209,2023-08-23 12:14:57.625525,2023-08-23 12:14:58.861881,0 days 00:00:01.236356,,0.9,2.0,,LightGBM,,,,,0.5,,,,2.5158375051522656e-07,2.0389319414254076e-08,,30.0,,,,,,,,,,48.0,,,,,,,,,COMPLETE,0.0,,,,,,,,,,,,,,,,,,,,
116,116,0.7238562091503268,2023-08-23 12:14:58.690045,2023-08-23 12:15:00.700486,0 days 00:00:02.010441,,0.8,1.0,,LightGBM,,,,,0.7000000000000001,,,,9.798904123685307e-06,2.1131879851818268e-08,,10.0,,,,,,,,,,55.0,,,,,,,,,COMPLETE,0.0,,,,,,,,,,,,,,,,,,,,
117,117,0.706814425974531,2023-08-23 12:14:58.964722,2023-08-23 12:15:00.922639,0 days 00:00:01.957917,,0.8,1.0,,LightGBM,,,,,0.7000000000000001,,,,2.1299981556346455e-06,6.730339978971177e-06,,10.0,,,,,,,,,,95.0,,,,,,,,,COMPLETE,0.0,,,,,,,,,,,,,,,,,,,,
118,118,0.7674735102556626,2023-08-23 12:15:00.781122,2023-08-23 12:15:01.459519,0 days 00:00:00.678397,,0.8,1.0,,LightGBM,,,,,0.6000000000000001,,,,3.5676704108055497e-06,1.7262940707463578e-05,,60.0,,,,,,,,,,95.0,,,,,,,,,COMPLETE,0.0,,,,,,,,,,,,,,,,,,,,
119,119,0.7674735102556626,2023-08-23 12:15:01.024940,2023-08-23 12:15:01.788799,0 days 00:00:00.763859,,0.8,1.0,,LightGBM,,,,,0.6000000000000001,,,,1.5123018895253937e-06,1.4409382276296808e-05,,60.0,,,,,,,,,,72.0,,,,,,,,,COMPLETE,0.0,,,,,,,,,,,,,,,,,,,,
120,120,0.7674735102556626,2023-08-23 12:15:01.580998,2023-08-23 12:15:02.384026,0 days 00:00:00.803028,,0.8,1.0,,LightGBM,,,,,0.6000000000000001,,,,2.02408155177493e-06,4.296932380557945e-05,,60.0,,,,,,,,,,66.0,,,,,,,,,COMPLETE,0.0,,,,,,,,,,,,,,,,,,,,
121,121,0.7128205128205128,2023-08-23 12:15:01.891943,2023-08-23 12:15:02.808693,0 days 00:00:00.916750,,1.0,1.0,,LightGBM,,,,,0.6000000000000001,,,,7.77517969077033e-07,8.925007090352983e-05,,70.0,,,,,,,,,,82.0,,,,,,,,,COMPLETE,0.0,,,,,,,,,,,,,,,,,,,,
122,122,0.42075949367088605,2023-08-23 12:15:02.457142,2023-08-23 12:15:59.434763,0 days 00:00:56.977621,,,,,MLPClassifier,,,,,,,,,,,,,,identity,lbfgs,2.0,80.0,10.0,,,,,,,,,,,,,COMPLETE,0.0,,,,,,,,,,,,,,,,,,,,
123,123,0.42075949367088605,2023-08-23 12:15:03.022495,2023-08-23 12:16:17.971504,0 days 00:01:14.949009,,,,,MLPClassifier,,,,,,,,,,,,,,identity,lbfgs,2.0,70.0,10.0,,,,,,,,,,,,,COMPLETE,0.0,,,,,,,,,,,,,,,,,,,,
124,124,0.7602005012531328,2023-08-23 12:15:05.866092,2023-08-23 12:15:07.051165,0 days 00:00:01.185073,,0.7000000000000001,2.0,,LightGBM,,,,,0.9,,,,0.029580204720083,3.284568356823697e-06,,20.0,,,,,,,,,,131.0,,,,,,,,,COMPLETE,0.0,,,,,,,,,,,,,,,,,,,,
125,125,0.7216218895608209,2023-08-23 12:15:07.134357,2023-08-23 12:15:07.794152,0 days 00:00:00.659795,,0.8,1.0,,LightGBM,,,,,0.5,,,,6.200845386776679e-06,7.038853936309989e-07,,40.0,,,,,,,,,,7.0,,,,,,,,,COMPLETE,0.0,,,,,,,,,,,,,,,,,,,,
126,126,0.6638515274736733,2023-08-23 12:15:07.865244,2023-08-23 12:15:08.341657,0 days 00:00:00.476413,,,,,RandomForestClassifier,,,,,,,,,,,,,,,,,,,,,,,,37.0,5.0,,,,,,COMPLETE,0.0,,,,,,,,,,,,,,,,,,,,
127,127,0.7097288676236045,2023-08-23 12:15:08.470512,2023-08-23 12:15:09.282450,0 days 00:00:00.811938,,0.9,1.0,,LightGBM,,,,,0.6000000000000001,,,,1.2837401422016273e-05,3.3937398267181784e-05,,50.0,,,,,,,,,,108.0,,,,,,,,,COMPLETE,0.0,,,,,,,,,,,,,,,,,,,,
128,128,0.7674735102556626,2023-08-23 12:15:09.373290,2023-08-23 12:15:10.106363,0 days 00:00:00.733073,,0.8,1.0,,LightGBM,,,,,0.6000000000000001,,,,2.8897498395630064e-06,1.669305987288712e-05,,60.0,,,,,,,,,,239.0,,,,,,,,,COMPLETE,0.0,,,,,,,,,,,,,,,,,,,,
129,129,0.7333333333333334,2023-08-23 12:15:10.166663,2023-08-23 12:15:10.815943,0 days 00:00:00.649280,,0.8,1.0,,LightGBM,,,,,0.6000000000000001,,,,4.0163089722584695e-06,6.373033366167143e-06,,70.0,,,,,,,,,,92.0,,,,,,,,,COMPLETE,0.0,,,,,,,,,,,,,,,,,,,,
130,130,0.7674735102556626,2023-08-23 12:15:10.907053,2023-08-23 12:15:11.461881,0 days 00:00:00.554828,,0.8,1.0,,LightGBM,,,,,0.6000000000000001,,,,5.292739941865031e-06,1.6231112754341614e-05,,60.0,,,,,,,,,,100.0,,,,,,,,,COMPLETE,0.0,,,,,,,,,,,,,,,,,,,,
131,131,0.7876932050160397,2023-08-23 12:15:11.581862,2023-08-23 12:15:13.050708,0 days 00:00:01.468846,,1.0,1.0,,LightGBM,,,,,0.8,,,,9.450714568335908e-07,7.555886757912789e-08,,20.0,,,,,,,,,,76.0,,,,,,,,,COMPLETE,0.0,,,,,,,,,,,,,,,,,,,,
132,132,0.7876932050160397,2023-08-23 12:15:13.136919,2023-08-23 12:15:14.506425,0 days 00:00:01.369506,,1.0,2.0,,LightGBM,,,,,0.8,,,,9.462707381240024e-07,1.0646674708682984e-07,,20.0,,,,,,,,,,58.0,,,,,,,,,COMPLETE,0.0,,,,,,,,,,,,,,,,,,,,
133,133,0.7876932050160397,2023-08-23 12:15:14.652439,2023-08-23 12:15:15.712802,0 days 00:00:01.060363,,1.0,2.0,,LightGBM,,,,,0.8,,,,7.719562385632903e-07,8.600741559487974e-08,,20.0,,,,,,,,,,59.0,,,,,,,,,COMPLETE,0.0,,,,,,,,,,,,,,,,,,,,
134,134,0.7876932050160397,2023-08-23 12:15:15.790003,2023-08-23 12:15:17.077365,0 days 00:00:01.287362,,1.0,2.0,,LightGBM,,,,,0.8,,,,4.4864354828222945e-07,1.2100069946633026e-07,,20.0,,,,,,,,,,59.0,,,,,,,,,COMPLETE,0.0,,,,,,,,,,,,,,,,,,,,
135,135,0.7393483709273183,2023-08-23 12:15:17.205745,2023-08-23 12:15:18.699641,0 days 00:00:01.493896,,1.0,2.0,,LightGBM,,,,,0.8,,,,8.793641279823538e-07,9.208643337145758e-08,,20.0,,,,,,,,,,39.0,,,,,,,,,COMPLETE,0.0,,,,,,,,,,,,,,,,,,,,
136,136,0.7876932050160397,2023-08-23 12:15:18.760490,2023-08-23 12:15:20.079500,0 days 00:00:01.319010,,1.0,2.0,,LightGBM,,,,,0.8,,,,4.4070487497182654e-07,1.1184939534870711e-07,,20.0,,,,,,,,,,57.0,,,,,,,,,COMPLETE,0.0,,,,,,,,,,,,,,,,,,,,
137,137,0.7876932050160397,2023-08-23 12:15:20.199836,2023-08-23 12:15:21.546003,0 days 00:00:01.346167,,1.0,2.0,,LightGBM,,,,,0.8,,,,3.6423987645133257e-07,9.406902753284745e-08,,20.0,,,,,,,,,,59.0,,,,,,,,,COMPLETE,0.0,,,,,,,,,,,,,,,,,,,,
138,138,0.7876932050160397,2023-08-23 12:15:21.612978,2023-08-23 12:15:22.849500,0 days 00:00:01.236522,,1.0,2.0,,LightGBM,,,,,0.8,,,,4.1860635726499985e-07,7.72178530808657e-08,,20.0,,,,,,,,,,60.0,,,,,,,,,COMPLETE,0.0,,,,,,,,,,,,,,,,,,,,
139,139,0.7876932050160397,2023-08-23 12:15:22.925632,2023-08-23 12:15:24.229060,0 days 00:00:01.303428,,1.0,2.0,,LightGBM,,,,,0.8,,,,4.608568808328152e-07,7.16277823731103e-08,,20.0,,,,,,,,,,50.0,,,,,,,,,COMPLETE,0.0,,,,,,,,,,,,,,,,,,,,
140,140,0.7876932050160397,2023-08-23 12:15:23.604716,2023-08-23 12:15:24.938083,0 days 00:00:01.333367,,1.0,2.0,,LightGBM,,,,,0.8,,,,3.987393073128043e-07,7.295770085964166e-08,,20.0,,,,,,,,,,60.0,,,,,,,,,COMPLETE,0.0,,,,,,,,,,,,,,,,,,,,
141,141,0.7876932050160397,2023-08-23 12:15:24.348685,2023-08-23 12:15:26.017253,0 days 00:00:01.668568,,1.0,2.0,,LightGBM,,,,,0.8,,,,4.481167653531174e-07,9.034941568503755e-08,,20.0,,,,,,,,,,50.0,,,,,,,,,COMPLETE,0.0,,,,,,,,,,,,,,,,,,,,
142,142,0.7876932050160397,2023-08-23 12:15:25.055321,2023-08-23 12:15:26.909157,0 days 00:00:01.853836,,1.0,2.0,,LightGBM,,,,,0.8,,,,3.2455494883294545e-07,8.176456948186986e-08,,20.0,,,,,,,,,,58.0,,,,,,,,,COMPLETE,0.0,,,,,,,,,,,,,,,,,,,,
143,143,0.7876932050160397,2023-08-23 12:15:26.128802,2023-08-23 12:15:27.767200,0 days 00:00:01.638398,,1.0,2.0,,LightGBM,,,,,0.8,,,,4.1613533808946965e-07,8.823393040029928e-08,,20.0,,,,,,,,,,51.0,,,,,,,,,COMPLETE,0.0,,,,,,,,,,,,,,,,,,,,
144,144,0.7010012887875483,2023-08-23 12:15:27.006031,2023-08-23 12:15:28.218402,0 days 00:00:01.212371,,1.0,2.0,,LightGBM,,,,,0.8,,,,3.367587626885779e-07,8.778982163310556e-08,,30.0,,,,,,,,,,54.0,,,,,,,,,COMPLETE,0.0,,,,,,,,,,,,,,,,,,,,
145,145,0.7010012887875483,2023-08-23 12:15:27.887544,2023-08-23 12:15:29.104407,0 days 00:00:01.216863,,1.0,2.0,,LightGBM,,,,,0.8,,,,3.13338259788677e-07,8.851196775569874e-08,,30.0,,,,,,,,,,51.0,,,,,,,,,COMPLETE,0.0,,,,,,,,,,,,,,,,,,,,
146,146,0.7876932050160397,2023-08-23 12:15:28.304877,2023-08-23 12:15:29.920048,0 days 00:00:01.615171,,1.0,2.0,,LightGBM,,,,,0.8,,,,6.943885460978521e-07,5.933081086165248e-08,,20.0,,,,,,,,,,49.0,,,,,,,,,COMPLETE,0.0,,,,,,,,,,,,,,,,,,,,
147,147,0.7472538154952852,2023-08-23 12:15:29.177676,2023-08-23 12:15:30.885844,0 days 00:00:01.708168,,1.0,2.0,,LightGBM,,,,,0.8,,,,5.539676543180818e-07,1.6230750259414188e-07,,20.0,,,,,,,,,,39.0,,,,,,,,,COMPLETE,0.0,,,,,,,,,,,,,,,,,,,,
148,148,0.7876932050160397,2023-08-23 12:15:30.025173,2023-08-23 12:15:31.485113,0 days 00:00:01.459940,,1.0,2.0,,LightGBM,,,,,0.8,,,,6.382869579304788e-07,4.7671434145583546e-08,,20.0,,,,,,,,,,59.0,,,,,,,,,COMPLETE,0.0,,,,,,,,,,,,,,,,,,,,
149,149,0.7876932050160397,2023-08-23 12:15:30.954234,2023-08-23 12:15:32.189391,0 days 00:00:01.235157,,1.0,2.0,,LightGBM,,,,,0.8,,,,6.248028313712423e-07,4.727700480089951e-08,,20.0,,,,,,,,,,59.0,,,,,,,,,COMPLETE,0.0,,,,,,,,,,,,,,,,,,,,
150,150,0.7876932050160397,2023-08-23 12:15:31.573686,2023-08-23 12:15:33.020947,0 days 00:00:01.447261,,1.0,2.0,,LightGBM,,,,,0.8,,,,3.82581200656742e-07,6.777643507730924e-08,,20.0,,,,,,,,,,46.0,,,,,,,,,COMPLETE,0.0,,,,,,,,,,,,,,,,,,,,
151,151,0.7876932050160397,2023-08-23 12:15:32.269359,2023-08-23 12:15:34.149252,0 days 00:00:01.879893,,1.0,2.0,,LightGBM,,,,,0.8,,,,3.825892168648864e-07,1.189610067286706e-07,,20.0,,,,,,,,,,45.0,,,,,,,,,COMPLETE,0.0,,,,,,,,,,,,,,,,,,,,
152,152,0.7876932050160397,2023-08-23 12:15:33.118717,2023-08-23 12:15:34.780404,0 days 00:00:01.661687,,1.0,2.0,,LightGBM,,,,,0.8,,,,2.7450390930945874e-07,1.2484101509731278e-07,,20.0,,,,,,,,,,51.0,,,,,,,,,COMPLETE,0.0,,,,,,,,,,,,,,,,,,,,
153,153,0.7628630911073659,2023-08-23 12:15:33.318670,2023-08-23 12:15:34.672835,0 days 00:00:01.354165,,1.0,2.0,,LightGBM,,,,,0.8,,,,2.324284743372654e-07,1.1016826557402424e-07,,20.0,,,,,,,,,,35.0,,,,,,,,,COMPLETE,0.0,,,,,,,,,,,,,,,,,,,,
154,154,0.7876932050160397,2023-08-23 12:15:34.271410,2023-08-23 12:15:35.898170,0 days 00:00:01.626760,,1.0,2.0,,LightGBM,,,,,0.8,,,,9.194124030772315e-07,3.0564104014063455e-08,,20.0,,,,,,,,,,52.0,,,,,,,,,COMPLETE,0.0,,,,,,,,,,,,,,,,,,,,
155,155,0.7482855990318678,2023-08-23 12:15:34.746498,2023-08-23 12:15:36.523117,0 days 00:00:01.776619,,1.0,2.0,,LightGBM,,,,,0.8,,,,1.00009167227644e-06,7.110203846395832e-08,,20.0,,,,,,,,,,50.0,,,,,,,,,COMPLETE,0.0,,,,,,,,,,,,,,,,,,,,
156,156,0.7128205128205128,2023-08-23 12:15:34.938479,2023-08-23 12:15:36.380586,0 days 00:00:01.442107,,1.0,2.0,,LightGBM,,,,,0.8,,,,9.348959413165534e-07,2.9685496080312835e-08,,20.0,,,,,,,,,,23.0,,,,,,,,,COMPLETE,0.0,,,,,,,,,,,,,,,,,,,,
157,157,0.7876932050160397,2023-08-23 12:15:35.996251,2023-08-23 12:15:37.602362,0 days 00:00:01.606111,,1.0,2.0,,LightGBM,,,,,0.8,,,,1.660129776816379e-07,6.583945230808958e-08,,20.0,,,,,,,,,,59.0,,,,,,,,,COMPLETE,0.0,,,,,,,,,,,,,,,,,,,,
158,158,0.7876932050160397,2023-08-23 12:15:36.470753,2023-08-23 12:15:38.265759,0 days 00:00:01.795006,,1.0,2.0,,LightGBM,,,,,0.8,,,,5.14215063470439e-07,6.475951993573913e-08,,20.0,,,,,,,,,,61.0,,,,,,,,,COMPLETE,0.0,,,,,,,,,,,,,,,,,,,,
159,159,0.7482855990318678,2023-08-23 12:15:36.651730,2023-08-23 12:15:38.188356,0 days 00:00:01.536626,,1.0,2.0,,LightGBM,,,,,0.8,,,,5.948414157336457e-07,4.586584415957001e-08,,20.0,,,,,,,,,,59.0,,,,,,,,,COMPLETE,0.0,,,,,,,,,,,,,,,,,,,,
160,160,0.7876932050160397,2023-08-23 12:15:37.721909,2023-08-23 12:15:39.298779,0 days 00:00:01.576870,,1.0,2.0,,LightGBM,,,,,0.8,,,,5.403384300246252e-07,5.5819227788906795e-08,,20.0,,,,,,,,,,60.0,,,,,,,,,COMPLETE,0.0,,,,,,,,,,,,,,,,,,,,
161,161,0.7010012887875483,2023-08-23 12:15:38.350087,2023-08-23 12:15:39.803167,0 days 00:00:01.453080,,1.0,2.0,,LightGBM,,,,,0.8,,,,1.7355874801664956e-06,2.009621007067478e-07,,30.0,,,,,,,,,,68.0,,,,,,,,,COMPLETE,0.0,,,,,,,,,,,,,,,,,,,,
162,162,0.7010012887875483,2023-08-23 12:15:38.384764,2023-08-23 12:15:40.053776,0 days 00:00:01.669012,,1.0,2.0,,LightGBM,,,,,0.8,,,,1.4690381662268547e-06,1.6967195583444178e-07,,30.0,,,,,,,,,,69.0,,,,,,,,,COMPLETE,0.0,,,,,,,,,,,,,,,,,,,,
163,163,0.7010012887875483,2023-08-23 12:15:39.420721,2023-08-23 12:15:41.192382,0 days 00:00:01.771661,,1.0,2.0,,LightGBM,,,,,0.8,,,,1.6251707784310436e-06,2.1740741146374656e-07,,30.0,,,,,,,,,,68.0,,,,,,,,,COMPLETE,0.0,,,,,,,,,,,,,,,,,,,,
164,164,0.3696969696969697,2023-08-23 12:15:39.920857,2023-08-23 12:15:40.146901,0 days 00:00:00.226044,,,,,SVC,,,,,,,,,,,,,,,,,,,,,,,,,,,,,0.002309298492558393,linear,COMPLETE,0.0,,,,,,,,,,,,,,,,,,,,
165,165,0.6057159521726451,2023-08-23 12:15:40.279418,2023-08-23 12:15:40.449028,0 days 00:00:00.169610,,,,,DecisionTreeClassifier,,log_loss,31.0,,,,,,,,,,,,,,,,,,,,,,,,,,,,COMPLETE,0.0,,,,,,,,,,,,,,,,,,,,
166,166,0.7150684931506849,2023-08-23 12:15:40.290916,2023-08-23 12:15:42.089193,0 days 00:00:01.798277,,,,,RandomForestClassifier,,,,,,,,,,,,,,,,,,,,,,,,75.0,12.0,,,,,,COMPLETE,0.0,,,,,,,,,,,,,,,,,,,,
167,167,0.7876932050160397,2023-08-23 12:15:40.595351,2023-08-23 12:15:42.339043,0 days 00:00:01.743692,,1.0,2.0,,LightGBM,,,,,0.8,,,,1.5835487603302e-07,4.012743140268024e-08,,20.0,,,,,,,,,,42.0,,,,,,,,,COMPLETE,0.0,,,,,,,,,,,,,,,,,,,,
168,168,0.7876932050160397,2023-08-23 12:15:41.292492,2023-08-23 12:15:43.115375,0 days 00:00:01.822883,,1.0,2.0,,LightGBM,,,,,0.8,,,,6.38866303657285e-07,4.644717128400746e-08,,20.0,,,,,,,,,,56.0,,,,,,,,,COMPLETE,0.0,,,,,,,,,,,,,,,,,,,,
169,169,0.7876932050160397,2023-08-23 12:15:42.194012,2023-08-23 12:15:43.733402,0 days 00:00:01.539390,,1.0,2.0,,LightGBM,,,,,0.8,,,,6.915976620314525e-07,4.175057776983348e-08,,20.0,,,,,,,,,,42.0,,,,,,,,,COMPLETE,0.0,,,,,,,,,,,,,,,,,,,,
170,170,0.7482855990318678,2023-08-23 12:15:42.461957,2023-08-23 12:15:44.354371,0 days 00:00:01.892414,,1.0,2.0,,LightGBM,,,,,0.8,,,,6.753470650634583e-07,4.279561228997457e-08,,20.0,,,,,,,,,,56.0,,,,,,,,,COMPLETE,0.0,,,,,,,,,,,,,,,,,,,,
171,171,0.7184962406015037,2023-08-23 12:15:43.207869,2023-08-23 12:15:44.092683,0 days 00:00:00.884814,,1.0,2.0,,LightGBM,,,,,0.8,,,,4.3905597790968557e-07,1.393270846292346e-07,,100.0,,,,,,,,,,76.0,,,,,,,,,COMPLETE,0.0,,,,,,,,,,,,,,,,,,,,
