,number,value,datetime_start,datetime_complete,duration,params_alpha,params_bagging_fraction,params_bagging_freq,params_booster,params_classifier,params_colsample_bytree,params_dct_criterion,params_dct_max_depth,params_eta,params_feature_fraction,params_gamma,params_grow_policy,params_lambda,params_lambda_l1,params_lambda_l2,params_max_depth,params_min_child_samples,params_min_child_weight,params_mlp_activation,params_mlp_solver,params_n_layers,params_n_units_l_0,params_n_units_l_1,params_n_units_l_2,params_n_units_l_3,params_normalize_type,params_num_leaves,params_rate_drop,params_rf_estimator,params_rf_max_depth,params_sample_type,params_skip_drop,params_subsample,params_svc_c,params_svc_kernel,state,best_trial,dev_acc,dev_recall_macro,dev_precision_macro,dev_f1_macro,dev_recall_0,dev_precision_0,dev_f1_0,dev_recall_1,dev_precision_1,dev_f1_1,test_acc,test_recall_macro,test_precision_macro,test_f1_macro,test_recall_0,test_precision_0,test_f1_0,test_recall_1,test_precision_1,test_f1_1
0,0,0.649156626506024,2023-08-23 12:55:43.128641,2023-08-23 12:55:43.336825,0 days 00:00:00.208184,,,,,DecisionTreeClassifier,,gini,23.0,,,,,,,,,,,,,,,,,,,,,,,,,,,,COMPLETE,0.0,,,,,,,,,,,,,,,,,,,,
1,1,0.6985507246376812,2023-08-23 12:55:43.129289,2023-08-23 12:55:43.485622,0 days 00:00:00.356333,1.7028748431836115e-07,,,dart,XGBoost,0.4338732769562692,,,0.0258754963306027,,0.36554945308236514,lossguide,3.9656207762800925e-07,,,7.0,,9.0,,,,,,,,tree,,2.901270322137417e-08,,,uniform,1.0506990561106692e-06,0.5252357361928797,,,COMPLETE,0.0,,,,,,,,,,,,,,,,,,,,
2,2,0.6146924949719488,2023-08-23 12:55:43.130519,2023-08-23 13:29:21.217675,0 days 00:33:38.087156,,,,,SVC,,,,,,,,,,,,,,,,,,,,,,,,,,,,,86539910.07436067,linear,COMPLETE,0.0,,,,,,,,,,,,,,,,,,,,
3,3,0.6015325670498085,2023-08-23 12:55:43.132896,2023-08-23 13:47:59.818186,0 days 00:52:16.685290,,,,,SVC,,,,,,,,,,,,,,,,,,,,,,,,,,,,,66273004.80585607,linear,COMPLETE,0.0,,,,,,,,,,,,,,,,,,,,
4,4,0.3696969696969697,2023-08-23 12:55:43.133535,2023-08-23 12:55:43.220389,0 days 00:00:00.086854,,,,,SVC,,,,,,,,,,,,,,,,,,,,,,,,,,,,,3.2971554225075606e-06,poly,COMPLETE,0.0,,,,,,,,,,,,,,,,,,,,
5,5,0.7159663865546219,2023-08-23 12:55:43.134203,2023-08-23 12:55:43.399462,0 days 00:00:00.265259,4.755384207185981e-05,,,gbtree,XGBoost,0.3903605600791668,,,0.00015176331865675175,,0.19598514222290087,lossguide,0.00028277367958366153,,,9.0,,4.0,,,,,,,,,,,,,,,0.34359469820263766,,,COMPLETE,0.0,,,,,,,,,,,,,,,,,,,,
6,6,0.7765625,2023-08-23 12:55:43.138517,2023-08-23 12:55:44.041549,0 days 00:00:00.903032,,0.6000000000000001,3.0,,LightGBM,,,,,0.8,,,,6.587249977685285e-07,0.0010885589112801647,,30.0,,,,,,,,,,46.0,,,,,,,,,COMPLETE,0.0,,,,,,,,,,,,,,,,,,,,
7,7,0.5978982849211857,2023-08-23 12:55:43.139072,2023-08-23 12:55:43.286195,0 days 00:00:00.147123,,,,,DecisionTreeClassifier,,gini,15.0,,,,,,,,,,,,,,,,,,,,,,,,,,,,COMPLETE,0.0,,,,,,,,,,,,,,,,,,,,
8,8,0.7128205128205128,2023-08-23 12:55:43.264362,2023-08-23 12:55:44.592414,0 days 00:00:01.328052,,,,,RandomForestClassifier,,,,,,,,,,,,,,,,,,,,,,,,42.0,16.0,,,,,,COMPLETE,0.0,,,,,,,,,,,,,,,,,,,,
9,9,0.7244627612599353,2023-08-23 12:55:43.389328,2023-08-23 12:55:45.383934,0 days 00:00:01.994606,,0.9,3.0,,LightGBM,,,,,0.9,,,,0.740070099266795,0.5942865518359928,,10.0,,,,,,,,,,39.0,,,,,,,,,COMPLETE,0.0,,,,,,,,,,,,,,,,,,,,
10,10,0.6559398496240602,2023-08-23 12:55:43.394960,2023-08-23 12:55:43.891077,0 days 00:00:00.496117,,,,,RandomForestClassifier,,,,,,,,,,,,,,,,,,,,,,,,20.0,12.0,,,,,,COMPLETE,0.0,,,,,,,,,,,,,,,,,,,,
11,11,0.655324790101635,2023-08-23 12:55:43.448789,2023-08-23 12:55:44.252937,0 days 00:00:00.804148,,,,,RandomForestClassifier,,,,,,,,,,,,,,,,,,,,,,,,63.0,2.0,,,,,,COMPLETE,0.0,,,,,,,,,,,,,,,,,,,,
12,12,0.3696969696969697,2023-08-23 12:55:43.537249,2023-08-23 12:55:43.582329,0 days 00:00:00.045080,0.15719285211544326,,,gblinear,XGBoost,0.5227677917901363,,,,,,,0.25929965930441,,,,,,,,,,,,,,,,,,,,0.5936114309787797,,,COMPLETE,0.0,,,,,,,,,,,,,,,,,,,,
13,13,0.3696969696969697,2023-08-23 12:55:43.625596,2023-08-23 12:55:43.685070,0 days 00:00:00.059474,,,,,SVC,,,,,,,,,,,,,,,,,,,,,,,,,,,,,0.054578400839727266,rbf,COMPLETE,0.0,,,,,,,,,,,,,,,,,,,,
14,14,0.7238562091503268,2023-08-23 12:55:43.731167,2023-08-23 12:55:44.479142,0 days 00:00:00.747975,,,,,RandomForestClassifier,,,,,,,,,,,,,,,,,,,,,,,,26.0,25.0,,,,,,COMPLETE,0.0,,,,,,,,,,,,,,,,,,,,
15,15,0.3696969696969697,2023-08-23 12:55:43.936539,2023-08-23 12:56:05.448439,0 days 00:00:21.511900,,,,,MLPClassifier,,,,,,,,,,,,,,logistic,adam,2.0,50.0,80.0,,,,,,,,,,,,,COMPLETE,0.0,,,,,,,,,,,,,,,,,,,,
16,16,0.7063331988705123,2023-08-23 12:55:44.144807,2023-08-23 12:55:46.689999,0 days 00:00:02.545192,,1.0,1.0,,LightGBM,,,,,0.5,,,,0.00697022587203514,1.9982602462771053e-07,,10.0,,,,,,,,,,66.0,,,,,,,,,COMPLETE,0.0,,,,,,,,,,,,,,,,,,,,
17,17,0.7765625,2023-08-23 12:55:44.366984,2023-08-23 12:55:45.191036,0 days 00:00:00.824052,,0.6000000000000001,3.0,,LightGBM,,,,,0.8,,,,6.119211245696042e-07,0.0014646373528512187,,30.0,,,,,,,,,,38.0,,,,,,,,,COMPLETE,0.0,,,,,,,,,,,,,,,,,,,,
18,18,0.7765625,2023-08-23 12:55:44.572090,2023-08-23 12:55:45.778140,0 days 00:00:01.206050,,0.6000000000000001,3.0,,LightGBM,,,,,0.8,,,,9.510086026360216e-07,0.0009713392448171885,,30.0,,,,,,,,,,34.0,,,,,,,,,COMPLETE,0.0,,,,,,,,,,,,,,,,,,,,
19,19,0.7765625,2023-08-23 12:55:44.687634,2023-08-23 12:55:45.869344,0 days 00:00:01.181710,,0.6000000000000001,3.0,,LightGBM,,,,,0.8,,,,4.682050765286651e-07,0.002313365522036224,,30.0,,,,,,,,,,35.0,,,,,,,,,COMPLETE,0.0,,,,,,,,,,,,,,,,,,,,
20,20,0.7765625,2023-08-23 12:55:45.288049,2023-08-23 12:55:46.367042,0 days 00:00:01.078993,,0.6000000000000001,3.0,,LightGBM,,,,,0.8,,,,4.148796447465358e-07,0.0005638032772672476,,30.0,,,,,,,,,,32.0,,,,,,,,,COMPLETE,0.0,,,,,,,,,,,,,,,,,,,,
21,21,0.7097288676236045,2023-08-23 12:55:45.508793,2023-08-23 12:55:46.473801,0 days 00:00:00.965008,,0.5,3.0,,LightGBM,,,,,0.7000000000000001,,,,1.1420857590166237e-07,0.0003880851682834545,,30.0,,,,,,,,,,37.0,,,,,,,,,COMPLETE,0.0,,,,,,,,,,,,,,,,,,,,
22,22,0.5636363636363636,2023-08-23 12:55:45.959824,2023-08-23 12:58:56.570754,0 days 00:03:10.610930,,,,,MLPClassifier,,,,,,,,,,,,,,identity,adam,4.0,80.0,40.0,100.0,50.0,,,,,,,,,,,COMPLETE,0.0,,,,,,,,,,,,,,,,,,,,
23,23,0.6095383054287165,2023-08-23 12:55:45.991049,2023-08-23 12:57:07.331665,0 days 00:01:21.340616,,,,,MLPClassifier,,,,,,,,,,,,,,relu,lbfgs,1.0,40.0,,,,,,,,,,,,,,COMPLETE,0.0,,,,,,,,,,,,,,,,,,,,
24,24,0.6475279106858054,2023-08-23 12:55:46.434271,2023-08-23 12:58:47.264858,0 days 00:03:00.830587,,,,,MLPClassifier,,,,,,,,,,,,,,relu,lbfgs,3.0,30.0,30.0,40.0,,,,,,,,,,,,COMPLETE,0.0,,,,,,,,,,,,,,,,,,,,
25,25,0.5594997983057685,2023-08-23 12:55:46.570134,2023-08-23 12:58:55.993825,0 days 00:03:09.423691,,,,,MLPClassifier,,,,,,,,,,,,,,relu,lbfgs,3.0,90.0,70.0,20.0,,,,,,,,,,,,COMPLETE,0.0,,,,,,,,,,,,,,,,,,,,
26,26,0.6559398496240602,2023-08-23 12:55:46.802779,2023-08-23 12:57:22.866700,0 days 00:01:36.063921,,,,,MLPClassifier,,,,,,,,,,,,,,logistic,lbfgs,1.0,90.0,,,,,,,,,,,,,,COMPLETE,0.0,,,,,,,,,,,,,,,,,,,,
27,27,0.3696969696969697,2023-08-23 12:56:05.566985,2023-08-23 12:56:22.161648,0 days 00:00:16.594663,,,,,MLPClassifier,,,,,,,,,,,,,,identity,sgd,4.0,10.0,10.0,60.0,80.0,,,,,,,,,,,COMPLETE,0.0,,,,,,,,,,,,,,,,,,,,
28,28,0.715625,2023-08-23 12:56:22.302274,2023-08-23 12:56:22.969975,0 days 00:00:00.667701,,0.7000000000000001,2.0,,LightGBM,,,,,1.0,,,,3.5667373779190244e-06,0.004335454167111164,,60.0,,,,,,,,,,151.0,,,,,,,,,COMPLETE,0.0,,,,,,,,,,,,,,,,,,,,
29,29,0.6638515274736733,2023-08-23 12:56:23.093839,2023-08-23 12:56:23.337441,0 days 00:00:00.243602,,0.4,2.0,,LightGBM,,,,,0.7000000000000001,,,,1.052545137767567e-05,2.5711744597772276e-05,,90.0,,,,,,,,,,104.0,,,,,,,,,COMPLETE,0.0,,,,,,,,,,,,,,,,,,,,
30,30,0.715625,2023-08-23 12:56:23.459227,2023-08-23 12:56:24.371798,0 days 00:00:00.912571,,0.7000000000000001,3.0,,LightGBM,,,,,0.8,,,,1.0077129845058639e-08,2.801991228939986e-05,,50.0,,,,,,,,,,87.0,,,,,,,,,COMPLETE,0.0,,,,,,,,,,,,,,,,,,,,
31,31,0.7948717948717948,2023-08-23 12:56:24.486454,2023-08-23 12:56:25.053538,0 days 00:00:00.567084,,0.6000000000000001,3.0,,LightGBM,,,,,0.5,,,,2.9485516179127093e-05,0.016964878899643276,,50.0,,,,,,,,,,238.0,,,,,,,,,COMPLETE,1.0,0.8076923076923077,0.7880289744567289,0.8128364389233955,0.7948717948717948,0.6744186046511628,0.8285714285714286,0.7435897435897435,0.9016393442622951,0.7971014492753623,0.8461538461538461,0.5933579335793358,0.5897437295528899,0.5943633128007082,0.5865399897770953,0.48091603053435117,0.5988593155893536,0.533446232006774,0.6985714285714286,0.5898673100120627,0.6396337475474165
32,32,0.7422424903340934,2023-08-23 12:56:25.187356,2023-08-23 12:56:25.743417,0 days 00:00:00.556061,,0.8,2.0,,LightGBM,,,,,0.4,,,,7.176461093507312e-05,0.05375826253013996,,60.0,,,,,,,,,,249.0,,,,,,,,,COMPLETE,0.0,,,,,,,,,,,,,,,,,,,,
33,33,0.7359375,2023-08-23 12:56:25.826833,2023-08-23 12:56:26.316340,0 days 00:00:00.489507,,0.5,3.0,,LightGBM,,,,,0.6000000000000001,,,,2.11405615682891e-05,0.02510238133950054,,50.0,,,,,,,,,,165.0,,,,,,,,,COMPLETE,0.0,,,,,,,,,,,,,,,,,,,,
34,34,0.6475279106858054,2023-08-23 12:56:26.412966,2023-08-23 12:57:48.306420,0 days 00:01:21.893454,,,,,MLPClassifier,,,,,,,,,,,,,,tanh,lbfgs,1.0,100.0,,,,,,,,,,,,,,COMPLETE,0.0,,,,,,,,,,,,,,,,,,,,
35,35,0.6005121638924455,2023-08-23 12:57:07.432341,2023-08-23 13:59:15.732938,0 days 01:02:08.300597,,,,,SVC,,,,,,,,,,,,,,,,,,,,,,,,,,,,,4978529393.418483,linear,COMPLETE,0.0,,,,,,,,,,,,,,,,,,,,
36,36,0.6254211688160799,2023-08-23 12:57:22.979098,2023-08-23 12:57:23.052546,0 days 00:00:00.073448,,,,,DecisionTreeClassifier,,log_loss,2.0,,,,,,,,,,,,,,,,,,,,,,,,,,,,COMPLETE,0.0,,,,,,,,,,,,,,,,,,,,
37,37,0.5848739495798319,2023-08-23 12:57:23.139272,2023-08-23 13:54:44.495153,0 days 00:57:21.355881,,,,,SVC,,,,,,,,,,,,,,,,,,,,,,,,,,,,,1117271879.4280167,linear,COMPLETE,0.0,,,,,,,,,,,,,,,,,,,,
38,38,0.706814425974531,2023-08-23 12:57:48.391852,2023-08-23 12:57:48.982484,0 days 00:00:00.590632,,0.6000000000000001,3.0,,LightGBM,,,,,0.9,,,,1.7598747864715321e-06,0.005823911600591319,,30.0,,,,,,,,,,9.0,,,,,,,,,COMPLETE,0.0,,,,,,,,,,,,,,,,,,,,
39,39,0.715625,2023-08-23 12:57:49.048590,2023-08-23 12:57:49.559795,0 days 00:00:00.511205,,0.6000000000000001,3.0,,LightGBM,,,,,0.8,,,,2.437790840933663e-06,0.00023039674997762642,,40.0,,,,,,,,,,218.0,,,,,,,,,COMPLETE,0.0,,,,,,,,,,,,,,,,,,,,
40,40,0.6044001233679449,2023-08-23 12:57:49.671310,2023-08-23 13:58:17.573489,0 days 01:00:27.902179,,,,,SVC,,,,,,,,,,,,,,,,,,,,,,,,,,,,,339838025.44348156,linear,COMPLETE,0.0,,,,,,,,,,,,,,,,,,,,
41,41,0.6252252252252252,2023-08-23 12:58:47.376869,2023-08-23 13:28:46.325227,0 days 00:29:58.948358,,,,,SVC,,,,,,,,,,,,,,,,,,,,,,,,,,,,,14778058.517929913,linear,COMPLETE,0.0,,,,,,,,,,,,,,,,,,,,
42,42,0.663232263762143,2023-08-23 12:58:56.104669,2023-08-23 12:58:56.320402,0 days 00:00:00.215733,1.8826908153096908e-08,,,dart,XGBoost,0.9752911952094421,,,6.762705127066647e-08,,1.3418816648105427e-08,depthwise,1.0613562615780796e-08,,,3.0,,10.0,,,,,,,,forest,,0.7391614760743968,,,weighted,0.9335895814459148,0.9837303119591352,,,COMPLETE,0.0,,,,,,,,,,,,,,,,,,,,
43,43,0.6146924949719488,2023-08-23 12:58:56.393588,2023-08-23 13:50:06.559421,0 days 00:51:10.165833,,,,,SVC,,,,,,,,,,,,,,,,,,,,,,,,,,,,,45724356.91223777,linear,COMPLETE,0.0,,,,,,,,,,,,,,,,,,,,
44,44,0.5848739495798319,2023-08-23 12:58:56.672605,2023-08-23 14:19:37.973562,0 days 01:20:41.300957,,,,,SVC,,,,,,,,,,,,,,,,,,,,,,,,,,,,,9537986649.199465,linear,COMPLETE,0.0,,,,,,,,,,,,,,,,,,,,
