,number,value,datetime_start,datetime_complete,duration,params_alpha,params_bagging_fraction,params_bagging_freq,params_booster,params_classifier,params_colsample_bytree,params_dct_criterion,params_dct_max_depth,params_eta,params_feature_fraction,params_gamma,params_grow_policy,params_lambda,params_lambda_l1,params_lambda_l2,params_max_depth,params_min_child_samples,params_min_child_weight,params_mlp_activation,params_mlp_solver,params_n_layers,params_n_units_l_0,params_n_units_l_1,params_n_units_l_2,params_n_units_l_3,params_normalize_type,params_num_leaves,params_rate_drop,params_rf_estimator,params_rf_max_depth,params_sample_type,params_skip_drop,params_subsample,params_svc_c,params_svc_kernel,state,best_trial,dev_acc,dev_recall_macro,dev_precision_macro,dev_f1_macro,dev_recall_0,dev_precision_0,dev_f1_0,dev_recall_1,dev_precision_1,dev_f1_1,test_acc,test_recall_macro,test_precision_macro,test_f1_macro,test_recall_0,test_precision_0,test_f1_0,test_recall_1,test_precision_1,test_f1_1
86,86,0.5848739495798319,2023-08-23 12:21:16.290978,2023-08-23 12:35:23.015643,0 days 00:14:06.724665,,,,,SVC,,,,,,,,,,,,,,,,,,,,,,,,,,,,,2559143037.529308,linear,COMPLETE,0.0,,,,,,,,,,,,,,,,,,,,
87,87,0.5848739495798319,2023-08-23 12:21:26.278263,2023-08-23 12:35:02.658341,0 days 00:13:36.380078,,,,,SVC,,,,,,,,,,,,,,,,,,,,,,,,,,,,,2901807957.413017,linear,COMPLETE,0.0,,,,,,,,,,,,,,,,,,,,
88,88,0.6976441102756892,2023-08-23 12:21:29.356740,2023-08-23 12:21:29.600840,0 days 00:00:00.244100,,0.5,3.0,,LightGBM,,,,,0.9,,,,0.0015316770789303787,7.946536174988206e-06,,40.0,,,,,,,,,,211.0,,,,,,,,,COMPLETE,0.0,,,,,,,,,,,,,,,,,,,,
89,89,0.6953125,2023-08-23 12:21:29.651714,2023-08-23 12:21:29.980931,0 days 00:00:00.329217,,0.6000000000000001,3.0,,LightGBM,,,,,0.9,,,,0.0006071745359015041,2.196815669249759e-06,,30.0,,,,,,,,,,238.0,,,,,,,,,COMPLETE,0.0,,,,,,,,,,,,,,,,,,,,
90,90,0.6853569987898347,2023-08-23 12:21:30.031709,2023-08-23 12:21:30.298298,0 days 00:00:00.266589,,0.5,3.0,,LightGBM,,,,,1.0,,,,0.0008028243396473963,6.160379729806269e-07,,40.0,,,,,,,,,,181.0,,,,,,,,,COMPLETE,0.0,,,,,,,,,,,,,,,,,,,,
91,91,0.6767919799498747,2023-08-23 12:21:30.364621,2023-08-23 12:21:30.685513,0 days 00:00:00.320892,,0.5,3.0,,LightGBM,,,,,0.9,,,,0.002307857410990546,3.2780116230914886e-06,,30.0,,,,,,,,,,150.0,,,,,,,,,COMPLETE,0.0,,,,,,,,,,,,,,,,,,,,
92,92,0.5848739495798319,2023-08-23 12:21:30.752597,2023-08-23 12:36:21.705763,0 days 00:14:50.953166,,,,,SVC,,,,,,,,,,,,,,,,,,,,,,,,,,,,,2783247646.575555,linear,COMPLETE,0.0,,,,,,,,,,,,,,,,,,,,
