,number,value,datetime_start,datetime_complete,duration,params_alpha,params_bagging_fraction,params_bagging_freq,params_booster,params_classifier,params_colsample_bytree,params_dct_criterion,params_dct_max_depth,params_eta,params_feature_fraction,params_gamma,params_grow_policy,params_lambda,params_lambda_l1,params_lambda_l2,params_max_depth,params_min_child_samples,params_min_child_weight,params_mlp_activation,params_mlp_solver,params_n_layers,params_n_units_l_0,params_n_units_l_1,params_n_units_l_2,params_n_units_l_3,params_normalize_type,params_num_leaves,params_rate_drop,params_rf_estimator,params_rf_max_depth,params_sample_type,params_skip_drop,params_subsample,params_svc_c,params_svc_kernel,state,best_trial,dev_acc,dev_recall_macro,dev_precision_macro,dev_f1_macro,dev_recall_0,dev_precision_0,dev_f1_0,dev_recall_1,dev_precision_1,dev_f1_1,test_acc,test_recall_macro,test_precision_macro,test_f1_macro,test_recall_0,test_precision_0,test_f1_0,test_recall_1,test_precision_1,test_f1_1
0,0,0.7762607438509888,2023-08-23 21:06:41.073882,2023-08-23 21:07:23.595169,0 days 00:00:42.521287,,,,,MLPClassifier,,,,,,,,,,,,,,tanh,adam,3.0,40.0,30.0,40.0,,,,,,,,,,,,COMPLETE,0.0,,,,,,,,,,,,,,,,,,,,
1,1,0.7932904676382282,2023-08-23 21:06:41.077246,2023-08-23 21:06:41.293470,0 days 00:00:00.216224,0.00044556459400312004,,,dart,XGBoost,0.7388839760783439,,,0.0772765369469461,,2.325468029587803e-06,depthwise,5.588857784266534e-08,,,5.0,,2.0,,,,,,,,forest,,1.94048326191869e-06,,,uniform,0.0006268319299542008,0.23362255693933137,,,COMPLETE,0.0,,,,,,,,,,,,,,,,,,,,
2,2,0.5374625724367301,2023-08-23 21:06:41.079478,2023-08-23 21:07:15.823698,0 days 00:00:34.744220,,,,,SVC,,,,,,,,,,,,,,,,,,,,,,,,,,,,,11.262538572927754,linear,COMPLETE,0.0,,,,,,,,,,,,,,,,,,,,
3,3,0.7423603204775214,2023-08-23 21:06:41.084330,2023-08-23 21:06:41.523279,0 days 00:00:00.438949,,,,,DecisionTreeClassifier,,log_loss,19.0,,,,,,,,,,,,,,,,,,,,,,,,,,,,COMPLETE,0.0,,,,,,,,,,,,,,,,,,,,
4,4,0.7131205455332945,2023-08-23 21:06:41.086713,2023-08-23 21:06:41.438973,0 days 00:00:00.352260,,,,,DecisionTreeClassifier,,gini,29.0,,,,,,,,,,,,,,,,,,,,,,,,,,,,COMPLETE,0.0,,,,,,,,,,,,,,,,,,,,
5,5,0.8056270583521455,2023-08-23 21:06:41.090713,2023-08-23 21:06:47.764126,0 days 00:00:06.673413,,0.4,3.0,,LightGBM,,,,,0.9,,,,3.84435189147044e-06,0.36404058439432174,,20.0,,,,,,,,,,244.0,,,,,,,,,COMPLETE,0.0,,,,,,,,,,,,,,,,,,,,
6,6,0.5297110183195666,2023-08-23 21:06:41.093086,2023-08-23 21:06:46.729031,0 days 00:00:05.635945,,,,,MLPClassifier,,,,,,,,,,,,,,tanh,sgd,1.0,10.0,,,,,,,,,,,,,,COMPLETE,0.0,,,,,,,,,,,,,,,,,,,,
7,7,0.8102334356582879,2023-08-23 21:06:41.096377,2023-08-23 21:06:42.861334,0 days 00:00:01.764957,,0.5,3.0,,LightGBM,,,,,0.4,,,,1.2022045227137708e-08,1.6907080906028854e-07,,40.0,,,,,,,,,,50.0,,,,,,,,,COMPLETE,0.0,,,,,,,,,,,,,,,,,,,,
8,8,0.8094052552013926,2023-08-23 21:06:41.336654,2023-08-23 21:06:43.264285,0 days 00:00:01.927631,,1.0,3.0,,LightGBM,,,,,0.6000000000000001,,,,8.434730024647149e-07,0.00044757695447874386,,20.0,,,,,,,,,,63.0,,,,,,,,,COMPLETE,0.0,,,,,,,,,,,,,,,,,,,,
9,9,0.7738202676467858,2023-08-23 21:06:41.491542,2023-08-23 21:06:42.118318,0 days 00:00:00.626776,,,,,RandomForestClassifier,,,,,,,,,,,,,,,,,,,,,,,,17.0,3.0,,,,,,COMPLETE,0.0,,,,,,,,,,,,,,,,,,,,
10,10,0.5884781887701058,2023-08-23 21:06:41.575439,2023-08-23 21:06:41.637511,0 days 00:00:00.062072,0.00050678198762597,,,gblinear,XGBoost,0.403956564045705,,,,,,,4.039858154084035e-08,,,,,,,,,,,,,,,,,,,,0.7783813782953559,,,COMPLETE,0.0,,,,,,,,,,,,,,,,,,,,
11,11,0.7851333118651495,2023-08-23 21:06:41.693279,2023-08-23 21:06:41.906969,0 days 00:00:00.213690,0.0005988541617807069,,,gbtree,XGBoost,0.31087286309678847,,,1.3545560565666934e-06,,0.3698657846715908,depthwise,7.914127210780748e-07,,,7.0,,5.0,,,,,,,,,,,,,,,0.503216224423543,,,COMPLETE,0.0,,,,,,,,,,,,,,,,,,,,
12,12,0.797840977587813,2023-08-23 21:06:41.953646,2023-08-23 21:06:42.320550,0 days 00:00:00.366904,0.16093127140624963,,,gbtree,XGBoost,0.44440603849643656,,,2.4887822980543435e-05,,0.0002847795862088027,depthwise,0.00029577715944850496,,,9.0,,8.0,,,,,,,,,,,,,,,0.9864090307614914,,,COMPLETE,0.0,,,,,,,,,,,,,,,,,,,,
13,13,0.788566545965572,2023-08-23 21:06:42.165509,2023-08-23 21:06:42.409593,0 days 00:00:00.244084,3.9980186133426983e-08,,,dart,XGBoost,0.49287490619597635,,,1.4952317635753132e-05,,0.004081194931538237,depthwise,0.6066008542496298,,,3.0,,8.0,,,,,,,,tree,,4.4047036684343743e-07,,,uniform,0.7849310423345476,0.8534323254142258,,,COMPLETE,0.0,,,,,,,,,,,,,,,,,,,,
14,14,0.7692895363971906,2023-08-23 21:06:42.366983,2023-08-23 21:06:42.539953,0 days 00:00:00.172970,,,,,DecisionTreeClassifier,,entropy,3.0,,,,,,,,,,,,,,,,,,,,,,,,,,,,COMPLETE,0.0,,,,,,,,,,,,,,,,,,,,
15,15,0.7745578825681756,2023-08-23 21:06:42.462152,2023-08-23 21:06:45.334823,0 days 00:00:02.872671,,,,,RandomForestClassifier,,,,,,,,,,,,,,,,,,,,,,,,95.0,2.0,,,,,,COMPLETE,0.0,,,,,,,,,,,,,,,,,,,,
16,16,0.7774250407639246,2023-08-23 21:06:42.583580,2023-08-23 21:06:42.766425,0 days 00:00:00.182845,,,,,DecisionTreeClassifier,,log_loss,6.0,,,,,,,,,,,,,,,,,,,,,,,,,,,,COMPLETE,0.0,,,,,,,,,,,,,,,,,,,,
17,17,0.8192981467920915,2023-08-23 21:06:42.818103,2023-08-23 21:06:44.079037,0 days 00:00:01.260934,,0.6000000000000001,2.0,,LightGBM,,,,,0.6000000000000001,,,,0.029178702519398327,9.968084855965765e-06,,90.0,,,,,,,,,,31.0,,,,,,,,,COMPLETE,0.0,,,,,,,,,,,,,,,,,,,,
18,18,0.8095623961631297,2023-08-23 21:06:42.908840,2023-08-23 21:06:44.204965,0 days 00:00:01.296125,,0.5,3.0,,LightGBM,,,,,0.4,,,,1.4814267321450508e-08,5.045929717455725e-08,,40.0,,,,,,,,,,44.0,,,,,,,,,COMPLETE,0.0,,,,,,,,,,,,,,,,,,,,
19,19,0.813860210029868,2023-08-23 21:06:43.307380,2023-08-23 21:06:44.771567,0 days 00:00:01.464187,,0.5,3.0,,LightGBM,,,,,0.4,,,,2.564714307506956e-08,1.0930541166216205e-05,,30.0,,,,,,,,,,48.0,,,,,,,,,COMPLETE,0.0,,,,,,,,,,,,,,,,,,,,
20,20,0.8161050689549254,2023-08-23 21:06:44.122846,2023-08-23 21:06:44.651446,0 days 00:00:00.528600,,0.5,2.0,,LightGBM,,,,,0.4,,,,0.10124989694811529,3.452166279116278e-08,,100.0,,,,,,,,,,10.0,,,,,,,,,COMPLETE,0.0,,,,,,,,,,,,,,,,,,,,
21,21,0.8176269511422485,2023-08-23 21:06:44.250181,2023-08-23 21:06:45.467259,0 days 00:00:01.217078,,0.5,1.0,,LightGBM,,,,,0.5,,,,0.04480449082885411,9.62861513129948e-07,,90.0,,,,,,,,,,22.0,,,,,,,,,COMPLETE,0.0,,,,,,,,,,,,,,,,,,,,
22,22,0.7751729350874788,2023-08-23 21:06:44.697535,2023-08-23 21:15:00.414794,0 days 00:08:15.717259,,,,,MLPClassifier,,,,,,,,,,,,,,tanh,lbfgs,4.0,40.0,40.0,80.0,60.0,,,,,,,,,,,COMPLETE,0.0,,,,,,,,,,,,,,,,,,,,
23,23,0.3956459512166078,2023-08-23 21:06:44.862645,2023-08-23 21:07:27.849366,0 days 00:00:42.986721,,,,,SVC,,,,,,,,,,,,,,,,,,,,,,,,,,,,,168.51316216194923,poly,COMPLETE,0.0,,,,,,,,,,,,,,,,,,,,
24,24,0.7252058759649326,2023-08-23 21:06:45.425645,2023-08-23 21:07:01.335530,0 days 00:00:15.909885,,,,,MLPClassifier,,,,,,,,,,,,,,identity,lbfgs,1.0,100.0,,,,,,,,,,,,,,COMPLETE,0.0,,,,,,,,,,,,,,,,,,,,
25,25,0.7793015027327633,2023-08-23 21:06:45.570490,2023-08-23 21:15:51.613531,0 days 00:09:06.043041,,,,,MLPClassifier,,,,,,,,,,,,,,relu,adam,3.0,50.0,30.0,10.0,,,,,,,,,,,,COMPLETE,0.0,,,,,,,,,,,,,,,,,,,,
26,26,0.3358178053830228,2023-08-23 21:06:46.841317,2023-08-23 21:07:29.630460,0 days 00:00:42.789143,,,,,SVC,,,,,,,,,,,,,,,,,,,,,,,,,,,,,0.13538249998079824,poly,COMPLETE,0.0,,,,,,,,,,,,,,,,,,,,
27,27,0.3358178053830228,2023-08-23 21:06:47.872368,2023-08-23 21:07:49.427401,0 days 00:01:01.555033,,,,,SVC,,,,,,,,,,,,,,,,,,,,,,,,,,,,,0.01367048674931923,rbf,COMPLETE,0.0,,,,,,,,,,,,,,,,,,,,
28,28,0.5398954495751147,2023-08-23 21:07:01.440425,2023-08-23 21:08:00.844278,0 days 00:00:59.403853,,,,,SVC,,,,,,,,,,,,,,,,,,,,,,,,,,,,,1.3642591730856586,rbf,COMPLETE,0.0,,,,,,,,,,,,,,,,,,,,
29,29,0.8201568353276022,2023-08-23 21:07:15.922276,2023-08-23 21:07:16.589986,0 days 00:00:00.667710,,0.7000000000000001,1.0,,LightGBM,,,,,0.6000000000000001,,,,0.10016896113243899,1.5902149510784895e-08,,100.0,,,,,,,,,,9.0,,,,,,,,,COMPLETE,0.0,,,,,,,,,,,,,,,,,,,,
30,30,0.8070265158862933,2023-08-23 21:07:16.700821,2023-08-23 21:07:17.221222,0 days 00:00:00.520401,,0.7000000000000001,1.0,,LightGBM,,,,,0.6000000000000001,,,,0.06379763854478425,2.321671819767797e-06,,100.0,,,,,,,,,,4.0,,,,,,,,,COMPLETE,0.0,,,,,,,,,,,,,,,,,,,,
31,31,0.3358178053830228,2023-08-23 21:07:17.318201,2023-08-23 21:08:00.132438,0 days 00:00:42.814237,,,,,SVC,,,,,,,,,,,,,,,,,,,,,,,,,,,,,0.0014240543598477177,poly,COMPLETE,0.0,,,,,,,,,,,,,,,,,,,,
32,32,0.8075006370135045,2023-08-23 21:07:23.655598,2023-08-23 21:07:26.720178,0 days 00:00:03.064580,,0.7000000000000001,1.0,,LightGBM,,,,,0.6000000000000001,,,,0.012193231738142556,1.224299386399826e-08,,80.0,,,,,,,,,,143.0,,,,,,,,,COMPLETE,0.0,,,,,,,,,,,,,,,,,,,,
33,33,0.3358178053830228,2023-08-23 21:07:26.847859,2023-08-23 21:08:07.181096,0 days 00:00:40.333237,,,,,SVC,,,,,,,,,,,,,,,,,,,,,,,,,,,,,0.0016374738494553183,poly,COMPLETE,0.0,,,,,,,,,,,,,,,,,,,,
34,34,0.8043544550832469,2023-08-23 21:07:27.944916,2023-08-23 21:07:30.631484,0 days 00:00:02.686568,,0.8,1.0,,LightGBM,,,,,0.7000000000000001,,,,0.0017960981542380471,1.4115492097208774e-06,,80.0,,,,,,,,,,110.0,,,,,,,,,COMPLETE,0.0,,,,,,,,,,,,,,,,,,,,
35,35,0.8115747176930899,2023-08-23 21:07:29.736148,2023-08-23 21:07:33.511260,0 days 00:00:03.775112,,0.8,1.0,,LightGBM,,,,,0.7000000000000001,,,,0.7164970430559537,1.712776646505184e-06,,80.0,,,,,,,,,,110.0,,,,,,,,,COMPLETE,0.0,,,,,,,,,,,,,,,,,,,,
36,36,0.7958925579678056,2023-08-23 21:07:30.719517,2023-08-23 21:07:31.109372,0 days 00:00:00.389855,,0.6000000000000001,2.0,,LightGBM,,,,,0.7000000000000001,,,,0.2684530387132821,4.169863652807578e-05,,80.0,,,,,,,,,,2.0,,,,,,,,,COMPLETE,0.0,,,,,,,,,,,,,,,,,,,,
37,37,0.8091216950188895,2023-08-23 21:07:31.222913,2023-08-23 21:07:34.298064,0 days 00:00:03.075151,,0.8,1.0,,LightGBM,,,,,0.6000000000000001,,,,0.6010121191647494,4.324649176939551e-07,,90.0,,,,,,,,,,97.0,,,,,,,,,COMPLETE,0.0,,,,,,,,,,,,,,,,,,,,
38,38,0.8022357389445998,2023-08-23 21:07:33.609040,2023-08-23 21:07:34.096691,0 days 00:00:00.487651,,0.6000000000000001,2.0,,LightGBM,,,,,0.5,,,,0.014070757137873834,1.2150942105318272e-08,,100.0,,,,,,,,,,3.0,,,,,,,,,COMPLETE,0.0,,,,,,,,,,,,,,,,,,,,
39,39,0.8170182111622899,2023-08-23 21:07:34.212265,2023-08-23 21:07:35.925282,0 days 00:00:01.713017,,0.6000000000000001,2.0,,LightGBM,,,,,0.5,,,,0.06509767010370673,2.2252118209686508e-07,,100.0,,,,,,,,,,30.0,,,,,,,,,COMPLETE,0.0,,,,,,,,,,,,,,,,,,,,
40,40,0.8161050689549254,2023-08-23 21:07:34.375895,2023-08-23 21:07:36.003560,0 days 00:00:01.627665,,0.6000000000000001,2.0,,LightGBM,,,,,0.5,,,,0.03503513909603915,1.0224965500106838e-07,,100.0,,,,,,,,,,30.0,,,,,,,,,COMPLETE,0.0,,,,,,,,,,,,,,,,,,,,
41,41,0.8178928247048138,2023-08-23 21:07:35.998605,2023-08-23 21:07:44.286745,0 days 00:00:08.288140,,,,,RandomForestClassifier,,,,,,,,,,,,,,,,,,,,,,,,53.0,28.0,,,,,,COMPLETE,0.0,,,,,,,,,,,,,,,,,,,,
42,42,0.8121600365969819,2023-08-23 21:07:36.172880,2023-08-23 21:07:45.150177,0 days 00:00:08.977297,,,,,RandomForestClassifier,,,,,,,,,,,,,,,,,,,,,,,,60.0,20.0,,,,,,COMPLETE,0.0,,,,,,,,,,,,,,,,,,,,
43,43,0.8115110647157096,2023-08-23 21:07:44.408834,2023-08-23 21:07:54.054525,0 days 00:00:09.645691,,,,,RandomForestClassifier,,,,,,,,,,,,,,,,,,,,,,,,55.0,27.0,,,,,,COMPLETE,0.0,,,,,,,,,,,,,,,,,,,,
44,44,0.8176081140170066,2023-08-23 21:07:45.264943,2023-08-23 21:07:53.024020,0 days 00:00:07.759077,,,,,RandomForestClassifier,,,,,,,,,,,,,,,,,,,,,,,,48.0,25.0,,,,,,COMPLETE,0.0,,,,,,,,,,,,,,,,,,,,
45,45,0.8139307073623427,2023-08-23 21:07:49.537009,2023-08-23 21:07:57.364542,0 days 00:00:07.827533,,,,,RandomForestClassifier,,,,,,,,,,,,,,,,,,,,,,,,48.0,32.0,,,,,,COMPLETE,0.0,,,,,,,,,,,,,,,,,,,,
46,46,0.804219977114243,2023-08-23 21:07:53.124644,2023-08-23 21:07:59.151242,0 days 00:00:06.026598,,,,,RandomForestClassifier,,,,,,,,,,,,,,,,,,,,,,,,59.0,9.0,,,,,,COMPLETE,0.0,,,,,,,,,,,,,,,,,,,,
47,47,0.3358178053830228,2023-08-23 21:07:54.157757,2023-08-23 21:07:58.740415,0 days 00:00:04.582658,,,,,MLPClassifier,,,,,,,,,,,,,,logistic,lbfgs,4.0,100.0,100.0,100.0,90.0,,,,,,,,,,,COMPLETE,0.0,,,,,,,,,,,,,,,,,,,,
48,48,0.8067666538785994,2023-08-23 21:07:57.477290,2023-08-23 21:08:01.845123,0 days 00:00:04.367833,,,,,RandomForestClassifier,,,,,,,,,,,,,,,,,,,,,,,,36.0,12.0,,,,,,COMPLETE,0.0,,,,,,,,,,,,,,,,,,,,
49,49,0.807521132228634,2023-08-23 21:07:58.840698,2023-08-23 21:08:03.430713,0 days 00:00:04.590015,,,,,RandomForestClassifier,,,,,,,,,,,,,,,,,,,,,,,,37.0,12.0,,,,,,COMPLETE,0.0,,,,,,,,,,,,,,,,,,,,
50,50,0.8111654617577857,2023-08-23 21:07:59.245042,2023-08-23 21:08:03.238886,0 days 00:00:03.993844,,,,,RandomForestClassifier,,,,,,,,,,,,,,,,,,,,,,,,31.0,14.0,,,,,,COMPLETE,0.0,,,,,,,,,,,,,,,,,,,,
51,51,0.8066568217384951,2023-08-23 21:08:00.198590,2023-08-23 21:08:04.539112,0 days 00:00:04.340522,,,,,RandomForestClassifier,,,,,,,,,,,,,,,,,,,,,,,,31.0,13.0,,,,,,COMPLETE,0.0,,,,,,,,,,,,,,,,,,,,
52,52,0.8063536200708136,2023-08-23 21:08:00.948775,2023-08-23 21:08:05.259612,0 days 00:00:04.310837,,,,,RandomForestClassifier,,,,,,,,,,,,,,,,,,,,,,,,31.0,12.0,,,,,,COMPLETE,0.0,,,,,,,,,,,,,,,,,,,,
53,53,0.8145270062366559,2023-08-23 21:08:01.939131,2023-08-23 21:08:16.458781,0 days 00:00:14.519650,,,,,RandomForestClassifier,,,,,,,,,,,,,,,,,,,,,,,,77.0,17.0,,,,,,COMPLETE,0.0,,,,,,,,,,,,,,,,,,,,
54,54,0.8128290231077795,2023-08-23 21:08:03.350518,2023-08-23 21:08:20.309027,0 days 00:00:16.958509,,,,,RandomForestClassifier,,,,,,,,,,,,,,,,,,,,,,,,80.0,17.0,,,,,,COMPLETE,0.0,,,,,,,,,,,,,,,,,,,,
55,55,0.764622478204765,2023-08-23 21:08:03.542731,2023-08-23 21:08:03.810103,0 days 00:00:00.267372,,,,,DecisionTreeClassifier,,entropy,2.0,,,,,,,,,,,,,,,,,,,,,,,,,,,,COMPLETE,0.0,,,,,,,,,,,,,,,,,,,,
56,56,0.3358178053830228,2023-08-23 21:08:03.884772,2023-08-23 21:08:09.614648,0 days 00:00:05.729876,,,,,MLPClassifier,,,,,,,,,,,,,,relu,sgd,4.0,60.0,10.0,10.0,10.0,,,,,,,,,,,COMPLETE,0.0,,,,,,,,,,,,,,,,,,,,
57,57,0.5343341881507352,2023-08-23 21:08:04.652263,2023-08-23 21:08:26.029659,0 days 00:00:21.377396,,,,,MLPClassifier,,,,,,,,,,,,,,relu,sgd,4.0,60.0,10.0,10.0,10.0,,,,,,,,,,,COMPLETE,0.0,,,,,,,,,,,,,,,,,,,,
58,58,0.8074713598653784,2023-08-23 21:08:05.347815,2023-08-23 21:08:07.844232,0 days 00:00:02.496417,,0.6000000000000001,2.0,,LightGBM,,,,,0.5,,,,0.0007870282896029007,3.3701387241784494e-07,,60.0,,,,,,,,,,74.0,,,,,,,,,COMPLETE,0.0,,,,,,,,,,,,,,,,,,,,
59,59,0.810338581846919,2023-08-23 21:08:07.288505,2023-08-23 21:08:10.560315,0 days 00:00:03.271810,,0.6000000000000001,2.0,,LightGBM,,,,,0.5,,,,0.003186433774015287,3.011048955631237e-07,,60.0,,,,,,,,,,77.0,,,,,,,,,COMPLETE,0.0,,,,,,,,,,,,,,,,,,,,
60,60,0.803835989667978,2023-08-23 21:08:07.914893,2023-08-23 21:08:11.155882,0 days 00:00:03.240989,,0.7000000000000001,1.0,,LightGBM,,,,,0.5,,,,0.00504289852917639,2.0828191265419587e-07,,90.0,,,,,,,,,,156.0,,,,,,,,,COMPLETE,0.0,,,,,,,,,,,,,,,,,,,,
61,61,0.8098674777744089,2023-08-23 21:08:09.687706,2023-08-23 21:08:13.445397,0 days 00:00:03.757691,,0.7000000000000001,1.0,,LightGBM,,,,,0.5,,,,0.0067656025953875005,2.55537602752396e-07,,90.0,,,,,,,,,,166.0,,,,,,,,,COMPLETE,0.0,,,,,,,,,,,,,,,,,,,,
62,62,0.3358178053830228,2023-08-23 21:08:10.664914,2023-08-23 21:08:10.849848,0 days 00:00:00.184934,9.23930905663963e-08,,,gblinear,XGBoost,0.9711730550766717,,,,,,,0.63607783555887,,,,,,,,,,,,,,,,,,,,0.5416254037404525,,,COMPLETE,0.0,,,,,,,,,,,,,,,,,,,,
63,63,0.8081899789047807,2023-08-23 21:08:10.918849,2023-08-23 21:08:13.713074,0 days 00:00:02.794225,,0.4,1.0,,LightGBM,,,,,0.8,,,,0.07849885307110205,6.969328995321269e-06,,90.0,,,,,,,,,,165.0,,,,,,,,,COMPLETE,0.0,,,,,,,,,,,,,,,,,,,,
64,64,0.8145830674465036,2023-08-23 21:08:11.253651,2023-08-23 21:08:12.654728,0 days 00:00:01.401077,,0.4,2.0,,LightGBM,,,,,0.8,,,,0.08114328734200259,7.854937368299822e-06,,90.0,,,,,,,,,,31.0,,,,,,,,,COMPLETE,0.0,,,,,,,,,,,,,,,,,,,,
65,65,0.7663181204650014,2023-08-23 21:08:12.735328,2023-08-23 21:08:13.311065,0 days 00:00:00.575737,,,,,DecisionTreeClassifier,,gini,11.0,,,,,,,,,,,,,,,,,,,,,,,,,,,,COMPLETE,0.0,,,,,,,,,,,,,,,,,,,,
66,66,0.8173225831827536,2023-08-23 21:08:13.397847,2023-08-23 21:08:15.015951,0 days 00:00:01.618104,,0.7000000000000001,1.0,,LightGBM,,,,,0.6000000000000001,,,,0.1891208266150301,4.078399708896373e-08,,70.0,,,,,,,,,,30.0,,,,,,,,,COMPLETE,0.0,,,,,,,,,,,,,,,,,,,,
67,67,0.3358178053830228,2023-08-23 21:08:13.537271,2023-08-23 21:08:13.818434,0 days 00:00:00.281163,0.17267886182797815,,,gblinear,XGBoost,0.22409731916610193,,,,,,,0.00021578920138709662,,,,,,,,,,,,,,,,,,,,0.24589890149919402,,,COMPLETE,0.0,,,,,,,,,,,,,,,,,,,,
68,68,0.8145904517099777,2023-08-23 21:08:13.780302,2023-08-23 21:08:15.256041,0 days 00:00:01.475739,,0.5,2.0,,LightGBM,,,,,0.4,,,,0.1245907700441507,3.257035544127586e-08,,100.0,,,,,,,,,,29.0,,,,,,,,,COMPLETE,0.0,,,,,,,,,,,,,,,,,,,,
69,69,0.8098006132549425,2023-08-23 21:08:13.984292,2023-08-23 21:08:15.340824,0 days 00:00:01.356532,,0.5,2.0,,LightGBM,,,,,0.4,,,,0.21786422748022374,2.3264607132753678e-08,,100.0,,,,,,,,,,23.0,,,,,,,,,COMPLETE,0.0,,,,,,,,,,,,,,,,,,,,
70,70,0.8168210718881681,2023-08-23 21:08:15.091248,2023-08-23 21:08:16.653185,0 days 00:00:01.561937,,0.6000000000000001,1.0,,LightGBM,,,,,0.6000000000000001,,,,0.23042718828693862,3.90273826069908e-08,,70.0,,,,,,,,,,27.0,,,,,,,,,COMPLETE,0.0,,,,,,,,,,,,,,,,,,,,
71,71,0.8150373168041667,2023-08-23 21:08:15.334125,2023-08-23 21:08:16.896170,0 days 00:00:01.562045,,0.6000000000000001,1.0,,LightGBM,,,,,0.6000000000000001,,,,0.8492376232880372,1.1445903432957952e-08,,70.0,,,,,,,,,,24.0,,,,,,,,,COMPLETE,0.0,,,,,,,,,,,,,,,,,,,,
72,72,0.8134571136342634,2023-08-23 21:08:15.441879,2023-08-23 21:08:17.159712,0 days 00:00:01.717833,,0.6000000000000001,1.0,,LightGBM,,,,,0.6000000000000001,,,,0.023217198609226195,3.969920428736119e-08,,70.0,,,,,,,,,,28.0,,,,,,,,,COMPLETE,0.0,,,,,,,,,,,,,,,,,,,,
73,73,0.8151980315002286,2023-08-23 21:08:16.541087,2023-08-23 21:08:18.195006,0 days 00:00:01.653919,,0.6000000000000001,1.0,,LightGBM,,,,,0.6000000000000001,,,,0.7760471921739588,4.0663205522548516e-08,,70.0,,,,,,,,,,24.0,,,,,,,,,COMPLETE,0.0,,,,,,,,,,,,,,,,,,,,
74,74,0.80938480696117,2023-08-23 21:08:16.767264,2023-08-23 21:08:19.066564,0 days 00:00:02.299300,,0.8,1.0,,LightGBM,,,,,0.6000000000000001,,,,0.02099975584035972,1.0139470252982347e-06,,70.0,,,,,,,,,,52.0,,,,,,,,,COMPLETE,0.0,,,,,,,,,,,,,,,,,,,,
75,75,0.8099798763492171,2023-08-23 21:08:16.975501,2023-08-23 21:08:19.269399,0 days 00:00:02.293898,,0.8,1.0,,LightGBM,,,,,0.6000000000000001,,,,0.023777997257880365,1.2899888112720378e-07,,70.0,,,,,,,,,,57.0,,,,,,,,,COMPLETE,0.0,,,,,,,,,,,,,,,,,,,,
76,76,0.7806177534167089,2023-08-23 21:08:17.240070,2023-08-23 21:19:15.522080,0 days 00:10:58.282010,,,,,MLPClassifier,,,,,,,,,,,,,,relu,adam,2.0,60.0,90.0,,,,,,,,,,,,,COMPLETE,0.0,,,,,,,,,,,,,,,,,,,,
77,77,0.6990355524386938,2023-08-23 21:08:18.312658,2023-08-23 21:15:41.113655,0 days 00:07:22.800997,,,,,MLPClassifier,,,,,,,,,,,,,,identity,adam,2.0,60.0,80.0,,,,,,,,,,,,,COMPLETE,0.0,,,,,,,,,,,,,,,,,,,,
78,78,0.813592832236381,2023-08-23 21:08:19.185451,2023-08-23 21:08:24.193811,0 days 00:00:05.008360,,0.7000000000000001,1.0,,LightGBM,,,,,1.0,,,,0.21544797623736325,1.0954134282618499e-07,,50.0,,,,,,,,,,204.0,,,,,,,,,COMPLETE,0.0,,,,,,,,,,,,,,,,,,,,
79,79,0.7244094231111415,2023-08-23 21:08:19.378522,2023-08-23 21:16:05.070976,0 days 00:07:45.692454,,,,,MLPClassifier,,,,,,,,,,,,,,identity,adam,2.0,60.0,80.0,,,,,,,,,,,,,COMPLETE,0.0,,,,,,,,,,,,,,,,,,,,
80,80,0.8075262193482218,2023-08-23 21:08:20.376897,2023-08-23 21:08:24.300500,0 days 00:00:03.923603,,0.7000000000000001,1.0,,LightGBM,,,,,1.0,,,,0.20070511724806003,8.355237688557438e-08,,90.0,,,,,,,,,,219.0,,,,,,,,,COMPLETE,0.0,,,,,,,,,,,,,,,,,,,,
81,81,0.7169093512562337,2023-08-23 21:08:24.283723,2023-08-23 21:20:57.619016,0 days 00:12:33.335293,,,,,MLPClassifier,,,,,,,,,,,,,,logistic,adam,2.0,60.0,80.0,,,,,,,,,,,,,COMPLETE,0.0,,,,,,,,,,,,,,,,,,,,
82,82,0.7210218988992456,2023-08-23 21:08:24.374814,2023-08-23 21:21:14.579241,0 days 00:12:50.204427,,,,,MLPClassifier,,,,,,,,,,,,,,logistic,adam,2.0,60.0,80.0,,,,,,,,,,,,,COMPLETE,0.0,,,,,,,,,,,,,,,,,,,,
83,83,0.772111212267935,2023-08-23 21:08:26.122491,2023-08-23 21:08:26.500732,0 days 00:00:00.378241,,,,,DecisionTreeClassifier,,gini,5.0,,,,,,,,,,,,,,,,,,,,,,,,,,,,COMPLETE,0.0,,,,,,,,,,,,,,,,,,,,
84,84,0.8149790415415417,2023-08-23 21:08:26.612598,2023-08-23 21:08:28.251728,0 days 00:00:01.639130,,0.7000000000000001,1.0,,LightGBM,,,,,0.5,,,,0.043615585093946745,5.852222688759561e-07,,80.0,,,,,,,,,,43.0,,,,,,,,,COMPLETE,0.0,,,,,,,,,,,,,,,,,,,,
85,85,0.8101328543708506,2023-08-23 21:08:28.306882,2023-08-23 21:08:31.005480,0 days 00:00:02.698598,,0.9,2.0,,LightGBM,,,,,0.7000000000000001,,,,0.2682155902455677,8.781605755795747e-08,,90.0,,,,,,,,,,74.0,,,,,,,,,COMPLETE,0.0,,,,,,,,,,,,,,,,,,,,
