,number,value,datetime_start,datetime_complete,duration,params_alpha,params_bagging_fraction,params_bagging_freq,params_booster,params_classifier,params_colsample_bytree,params_dct_criterion,params_dct_max_depth,params_eta,params_feature_fraction,params_gamma,params_grow_policy,params_lambda,params_lambda_l1,params_lambda_l2,params_max_depth,params_min_child_samples,params_min_child_weight,params_mlp_activation,params_mlp_solver,params_n_layers,params_n_units_l_0,params_n_units_l_1,params_n_units_l_2,params_n_units_l_3,params_normalize_type,params_num_leaves,params_rate_drop,params_rf_estimator,params_rf_max_depth,params_sample_type,params_skip_drop,params_subsample,params_svc_c,params_svc_kernel,state,best_trial,dev_acc,dev_recall_macro,dev_precision_macro,dev_f1_macro,dev_recall_0,dev_precision_0,dev_f1_0,dev_recall_1,dev_precision_1,dev_f1_1,test_acc,test_recall_macro,test_precision_macro,test_f1_macro,test_recall_0,test_precision_0,test_f1_0,test_recall_1,test_precision_1,test_f1_1
0,0,0.5882473187533254,2023-08-23 15:07:52.247310,2023-08-23 15:07:53.725025,0 days 00:00:01.477715,,0.5,3.0,,LightGBM,,,,,0.9,,,,7.863182012733257e-06,2.173573053489722e-05,,40.0,,,,,,,,,,214.0,,,,,,,,,COMPLETE,0.0,,,,,,,,,,,,,,,,,,,,
1,1,0.5918166705813503,2023-08-23 15:07:52.250037,2023-08-23 15:07:52.367752,0 days 00:00:00.117715,,,,,DecisionTreeClassifier,,entropy,3.0,,,,,,,,,,,,,,,,,,,,,,,,,,,,COMPLETE,0.0,,,,,,,,,,,,,,,,,,,,
2,2,0.4697223314116003,2023-08-23 15:07:52.253637,2023-08-23 15:07:56.980251,0 days 00:00:04.726614,,,,,SVC,,,,,,,,,,,,,,,,,,,,,,,,,,,,,296.8717521174563,linear,COMPLETE,0.0,,,,,,,,,,,,,,,,,,,,
3,3,0.586229450275819,2023-08-23 15:07:52.256557,2023-08-23 15:07:52.787745,0 days 00:00:00.531188,4.37824565499993e-06,,,dart,XGBoost,0.9042949646194358,,,1.3802230386507956e-06,,0.0012057635046754526,lossguide,0.0025120200741897657,,,7.0,,4.0,,,,,,,,forest,,4.1546870427814954e-05,,,uniform,4.221513365250123e-05,0.7494955480947314,,,COMPLETE,0.0,,,,,,,,,,,,,,,,,,,,
4,4,0.3357921744708146,2023-08-23 15:07:52.262114,2023-08-23 15:07:52.313401,0 days 00:00:00.051287,3.6000934796230552e-06,,,gblinear,XGBoost,0.2689862072462254,,,,,,,0.2564535024751496,,,,,,,,,,,,,,,,,,,,0.8144617588856602,,,COMPLETE,0.0,,,,,,,,,,,,,,,,,,,,
5,5,0.3357921744708146,2023-08-23 15:07:52.265286,2023-08-23 15:07:57.050594,0 days 00:00:04.785308,,,,,SVC,,,,,,,,,,,,,,,,,,,,,,,,,,,,,4.107999492268013,poly,COMPLETE,0.0,,,,,,,,,,,,,,,,,,,,
6,6,0.5418611301453012,2023-08-23 15:07:52.266012,2023-08-23 15:07:52.710101,0 days 00:00:00.444089,,,,,DecisionTreeClassifier,,entropy,12.0,,,,,,,,,,,,,,,,,,,,,,,,,,,,COMPLETE,0.0,,,,,,,,,,,,,,,,,,,,
7,7,0.5611582195282696,2023-08-23 15:07:52.271689,2023-08-23 15:07:52.471541,0 days 00:00:00.199852,,,,,DecisionTreeClassifier,,log_loss,4.0,,,,,,,,,,,,,,,,,,,,,,,,,,,,COMPLETE,0.0,,,,,,,,,,,,,,,,,,,,
8,8,0.5825331036005194,2023-08-23 15:07:52.359968,2023-08-23 15:07:54.053201,0 days 00:00:01.693233,,,,,RandomForestClassifier,,,,,,,,,,,,,,,,,,,,,,,,38.0,18.0,,,,,,COMPLETE,0.0,,,,,,,,,,,,,,,,,,,,
9,9,0.3357921744708146,2023-08-23 15:07:52.418141,2023-08-23 15:07:59.576915,0 days 00:00:07.158774,,,,,SVC,,,,,,,,,,,,,,,,,,,,,,,,,,,,,0.0010018271538084964,rbf,COMPLETE,0.0,,,,,,,,,,,,,,,,,,,,
10,10,0.5918471348869774,2023-08-23 15:07:52.515518,2023-08-23 15:07:52.568986,0 days 00:00:00.053468,,,,,DecisionTreeClassifier,,gini,3.0,,,,,,,,,,,,,,,,,,,,,,,,,,,,COMPLETE,0.0,,,,,,,,,,,,,,,,,,,,
11,11,0.3357921744708146,2023-08-23 15:07:52.617789,2023-08-23 15:07:57.356047,0 days 00:00:04.738258,,,,,SVC,,,,,,,,,,,,,,,,,,,,,,,,,,,,,133.36326900610942,poly,COMPLETE,0.0,,,,,,,,,,,,,,,,,,,,
12,12,0.3357921744708146,2023-08-23 15:07:52.770998,2023-08-23 15:07:59.118184,0 days 00:00:06.347186,,,,,SVC,,,,,,,,,,,,,,,,,,,,,,,,,,,,,0.5641471739421576,poly,COMPLETE,0.0,,,,,,,,,,,,,,,,,,,,
13,13,0.3357921744708146,2023-08-23 15:07:52.872777,2023-08-23 15:07:58.783937,0 days 00:00:05.911160,,,,,SVC,,,,,,,,,,,,,,,,,,,,,,,,,,,,,0.017830466426877526,linear,COMPLETE,0.0,,,,,,,,,,,,,,,,,,,,
14,14,0.5960453717391628,2023-08-23 15:07:53.785267,2023-08-23 15:07:57.882101,0 days 00:00:04.096834,,1.0,3.0,,LightGBM,,,,,0.9,,,,0.00011083719149776649,0.00012895533461431614,,20.0,,,,,,,,,,173.0,,,,,,,,,COMPLETE,0.0,,,,,,,,,,,,,,,,,,,,
15,15,0.34325302721906087,2023-08-23 15:07:54.118104,2023-08-23 15:07:54.445432,0 days 00:00:00.327328,,,,,MLPClassifier,,,,,,,,,,,,,,identity,sgd,1.0,10.0,,,,,,,,,,,,,,COMPLETE,0.0,,,,,,,,,,,,,,,,,,,,
16,16,0.5785525657991472,2023-08-23 15:07:54.525587,2023-08-23 15:07:54.707287,0 days 00:00:00.181700,0.0024841602745204845,,,dart,XGBoost,0.2567469528017048,,,3.1178125458885426e-05,,0.0001175622938408075,lossguide,0.03120957477562259,,,9.0,,3.0,,,,,,,,tree,,2.6177348449803676e-05,,,weighted,0.0309833841790775,0.2252448703121747,,,COMPLETE,0.0,,,,,,,,,,,,,,,,,,,,
17,17,0.4714253611513261,2023-08-23 15:07:54.771361,2023-08-23 15:07:59.377066,0 days 00:00:04.605705,,,,,SVC,,,,,,,,,,,,,,,,,,,,,,,,,,,,,85.73829886024905,linear,COMPLETE,0.0,,,,,,,,,,,,,,,,,,,,
18,18,0.5069978397197928,2023-08-23 15:07:57.112636,2023-08-23 15:07:57.254418,0 days 00:00:00.141782,,,,,DecisionTreeClassifier,,gini,2.0,,,,,,,,,,,,,,,,,,,,,,,,,,,,COMPLETE,0.0,,,,,,,,,,,,,,,,,,,,
19,19,0.5069978397197928,2023-08-23 15:07:57.123547,2023-08-23 15:07:57.169913,0 days 00:00:00.046366,,,,,DecisionTreeClassifier,,gini,2.0,,,,,,,,,,,,,,,,,,,,,,,,,,,,COMPLETE,0.0,,,,,,,,,,,,,,,,,,,,
20,20,0.5913567750121282,2023-08-23 15:07:57.240234,2023-08-23 15:07:57.429239,0 days 00:00:00.189005,,,,,DecisionTreeClassifier,,gini,3.0,,,,,,,,,,,,,,,,,,,,,,,,,,,,COMPLETE,0.0,,,,,,,,,,,,,,,,,,,,
21,21,0.580999111312799,2023-08-23 15:07:57.313378,2023-08-23 15:07:57.581378,0 days 00:00:00.268000,,,,,DecisionTreeClassifier,,entropy,5.0,,,,,,,,,,,,,,,,,,,,,,,,,,,,COMPLETE,0.0,,,,,,,,,,,,,,,,,,,,
22,22,0.5716849175010987,2023-08-23 15:07:57.411127,2023-08-23 15:07:57.745923,0 days 00:00:00.334796,,,,,DecisionTreeClassifier,,entropy,6.0,,,,,,,,,,,,,,,,,,,,,,,,,,,,COMPLETE,0.0,,,,,,,,,,,,,,,,,,,,
23,23,0.5773469387755104,2023-08-23 15:07:57.488149,2023-08-23 15:13:11.425319,0 days 00:05:13.937170,,,,,MLPClassifier,,,,,,,,,,,,,,tanh,adam,4.0,100.0,60.0,60.0,60.0,,,,,,,,,,,COMPLETE,0.0,,,,,,,,,,,,,,,,,,,,
24,24,0.5921402050818696,2023-08-23 15:07:57.722689,2023-08-23 15:07:58.200271,0 days 00:00:00.477582,,1.0,1.0,,LightGBM,,,,,0.4,,,,0.8287289679949255,0.9048101075211955,,100.0,,,,,,,,,,2.0,,,,,,,,,COMPLETE,0.0,,,,,,,,,,,,,,,,,,,,
25,25,0.3357921744708146,2023-08-23 15:07:57.881819,2023-08-23 15:08:02.382843,0 days 00:00:04.501024,,,,,MLPClassifier,,,,,,,,,,,,,,logistic,lbfgs,4.0,100.0,100.0,90.0,70.0,,,,,,,,,,,COMPLETE,0.0,,,,,,,,,,,,,,,,,,,,
26,26,0.5915441937607847,2023-08-23 15:07:57.969954,2023-08-23 15:08:01.208462,0 days 00:00:03.238508,,1.0,2.0,,LightGBM,,,,,0.8,,,,0.0684448048552486,0.11484300844320454,,10.0,,,,,,,,,,57.0,,,,,,,,,COMPLETE,0.0,,,,,,,,,,,,,,,,,,,,
27,27,0.5927143748692039,2023-08-23 15:07:58.308149,2023-08-23 15:07:59.024917,0 days 00:00:00.716768,,1.0,1.0,,LightGBM,,,,,0.4,,,,0.2768292608002531,0.8165857336177916,,100.0,,,,,,,,,,8.0,,,,,,,,,COMPLETE,0.0,,,,,,,,,,,,,,,,,,,,
28,28,0.6014532151778591,2023-08-23 15:07:58.883169,2023-08-23 15:08:00.689557,0 days 00:00:01.806388,,1.0,1.0,,LightGBM,,,,,0.4,,,,0.31022034341238847,0.9631466783711263,,100.0,,,,,,,,,,18.0,,,,,,,,,COMPLETE,0.0,,,,,,,,,,,,,,,,,,,,
29,29,0.5977619410455232,2023-08-23 15:07:59.225099,2023-08-23 15:08:00.502949,0 days 00:00:01.277850,,1.0,1.0,,LightGBM,,,,,0.4,,,,0.6935421086343487,0.4479640631815108,,100.0,,,,,,,,,,11.0,,,,,,,,,COMPLETE,0.0,,,,,,,,,,,,,,,,,,,,
30,30,0.5907967931161926,2023-08-23 15:07:59.238259,2023-08-23 15:08:00.020188,0 days 00:00:00.781929,,1.0,1.0,,LightGBM,,,,,0.4,,,,0.8707999931695678,0.32724282718053976,,100.0,,,,,,,,,,2.0,,,,,,,,,COMPLETE,0.0,,,,,,,,,,,,,,,,,,,,
31,31,0.6007839105570906,2023-08-23 15:07:59.477939,2023-08-23 15:08:00.408444,0 days 00:00:00.930505,,1.0,1.0,,LightGBM,,,,,0.4,,,,0.8216529109896251,0.3957975001398398,,100.0,,,,,,,,,,8.0,,,,,,,,,COMPLETE,0.0,,,,,,,,,,,,,,,,,,,,
32,32,0.599967915979152,2023-08-23 15:07:59.681250,2023-08-23 15:08:00.272813,0 days 00:00:00.591563,,1.0,1.0,,LightGBM,,,,,0.4,,,,0.8906013336115883,0.74056743893603,,100.0,,,,,,,,,,5.0,,,,,,,,,COMPLETE,0.0,,,,,,,,,,,,,,,,,,,,
33,33,0.594854327310985,2023-08-23 15:08:00.089708,2023-08-23 15:08:01.117886,0 days 00:00:01.028178,,1.0,1.0,,LightGBM,,,,,0.4,,,,0.5759713520866403,0.7277745720337014,,100.0,,,,,,,,,,4.0,,,,,,,,,COMPLETE,0.0,,,,,,,,,,,,,,,,,,,,
34,34,0.5962404011994518,2023-08-23 15:08:00.347558,2023-08-23 15:08:06.156053,0 days 00:00:05.808495,,1.0,2.0,,LightGBM,,,,,0.5,,,,0.006948138112397878,0.006365534415424693,,10.0,,,,,,,,,,161.0,,,,,,,,,COMPLETE,0.0,,,,,,,,,,,,,,,,,,,,
35,35,0.6054700267263324,2023-08-23 15:08:00.673912,2023-08-23 15:08:04.067438,0 days 00:00:03.393526,,0.8,1.0,,LightGBM,,,,,0.6000000000000001,,,,0.015052804656879491,0.014094412102154561,,70.0,,,,,,,,,,82.0,,,,,,,,,COMPLETE,0.0,,,,,,,,,,,,,,,,,,,,
36,36,0.6002942861576986,2023-08-23 15:08:00.675899,2023-08-23 15:08:03.473695,0 days 00:00:02.797796,,0.8,1.0,,LightGBM,,,,,0.6000000000000001,,,,0.017853771736362076,0.014115228387386441,,70.0,,,,,,,,,,81.0,,,,,,,,,COMPLETE,0.0,,,,,,,,,,,,,,,,,,,,
37,37,0.5982121537726839,2023-08-23 15:08:00.816921,2023-08-23 15:08:03.087362,0 days 00:00:02.270441,,0.8,2.0,,LightGBM,,,,,0.6000000000000001,,,,0.006686708126594069,0.0028830679013615245,,70.0,,,,,,,,,,82.0,,,,,,,,,COMPLETE,0.0,,,,,,,,,,,,,,,,,,,,
38,38,0.5912133785781482,2023-08-23 15:08:01.304222,2023-08-23 15:08:03.690795,0 days 00:00:02.386573,,0.8,1.0,,LightGBM,,,,,0.6000000000000001,,,,0.012512590025861511,0.02159772763931055,,80.0,,,,,,,,,,73.0,,,,,,,,,COMPLETE,0.0,,,,,,,,,,,,,,,,,,,,
39,39,0.6011596558895407,2023-08-23 15:08:01.333751,2023-08-23 15:08:04.551919,0 days 00:00:03.218168,,0.8,1.0,,LightGBM,,,,,0.6000000000000001,,,,0.016637101385002493,0.026616500632548133,,80.0,,,,,,,,,,64.0,,,,,,,,,COMPLETE,0.0,,,,,,,,,,,,,,,,,,,,
40,40,0.5916185416913154,2023-08-23 15:08:02.463108,2023-08-23 15:08:05.023700,0 days 00:00:02.560592,,0.8,1.0,,LightGBM,,,,,0.6000000000000001,,,,0.021391066231365607,0.009834891666120518,,80.0,,,,,,,,,,70.0,,,,,,,,,COMPLETE,0.0,,,,,,,,,,,,,,,,,,,,
41,41,0.5937644389742038,2023-08-23 15:08:03.166561,2023-08-23 15:08:05.726507,0 days 00:00:02.559946,,0.8,2.0,,LightGBM,,,,,0.6000000000000001,,,,0.008739553346224014,0.00652288298697336,,70.0,,,,,,,,,,86.0,,,,,,,,,COMPLETE,0.0,,,,,,,,,,,,,,,,,,,,
42,42,0.5930565460743717,2023-08-23 15:08:03.562491,2023-08-23 15:08:06.019191,0 days 00:00:02.456700,,0.8,1.0,,LightGBM,,,,,0.6000000000000001,,,,0.016638729374192966,0.0162733323779965,,70.0,,,,,,,,,,64.0,,,,,,,,,COMPLETE,0.0,,,,,,,,,,,,,,,,,,,,
43,43,0.5839918915933294,2023-08-23 15:08:03.826932,2023-08-23 15:08:07.463890,0 days 00:00:03.636958,,,,,RandomForestClassifier,,,,,,,,,,,,,,,,,,,,,,,,98.0,2.0,,,,,,COMPLETE,0.0,,,,,,,,,,,,,,,,,,,,
44,44,0.5824951192598251,2023-08-23 15:08:04.152261,2023-08-23 15:08:08.072857,0 days 00:00:03.920596,,,,,RandomForestClassifier,,,,,,,,,,,,,,,,,,,,,,,,100.0,2.0,,,,,,COMPLETE,0.0,,,,,,,,,,,,,,,,,,,,
45,45,0.5852368793015132,2023-08-23 15:08:04.698276,2023-08-23 15:08:08.675240,0 days 00:00:03.976964,,,,,RandomForestClassifier,,,,,,,,,,,,,,,,,,,,,,,,95.0,2.0,,,,,,COMPLETE,0.0,,,,,,,,,,,,,,,,,,,,
46,46,0.5886449079698088,2023-08-23 15:08:05.136383,2023-08-23 15:08:09.405978,0 days 00:00:04.269595,,,,,RandomForestClassifier,,,,,,,,,,,,,,,,,,,,,,,,94.0,2.0,,,,,,COMPLETE,0.0,,,,,,,,,,,,,,,,,,,,
47,47,0.5791909997393747,2023-08-23 15:08:05.802153,2023-08-23 15:08:10.237775,0 days 00:00:04.435622,,,,,RandomForestClassifier,,,,,,,,,,,,,,,,,,,,,,,,98.0,2.0,,,,,,COMPLETE,0.0,,,,,,,,,,,,,,,,,,,,
48,48,0.580497488251499,2023-08-23 15:08:06.101407,2023-08-23 15:08:10.022855,0 days 00:00:03.921448,,,,,RandomForestClassifier,,,,,,,,,,,,,,,,,,,,,,,,96.0,2.0,,,,,,COMPLETE,0.0,,,,,,,,,,,,,,,,,,,,
49,49,0.5799474011102054,2023-08-23 15:08:06.237537,2023-08-23 15:08:11.216248,0 days 00:00:04.978711,,,,,RandomForestClassifier,,,,,,,,,,,,,,,,,,,,,,,,100.0,2.0,,,,,,COMPLETE,0.0,,,,,,,,,,,,,,,,,,,,
50,50,0.605151481943654,2023-08-23 15:08:07.532599,2023-08-23 15:08:08.218747,0 days 00:00:00.686148,0.28698856541638246,,,gbtree,XGBoost,0.9810382561324119,,,0.22314285933021413,,1.628728370755634e-08,depthwise,1.6175610567474508e-08,,,3.0,,10.0,,,,,,,,,,,,,,,0.9945029989796946,,,COMPLETE,0.0,,,,,,,,,,,,,,,,,,,,
51,51,0.5927142514667367,2023-08-23 15:08:08.185658,2023-08-23 15:08:08.996904,0 days 00:00:00.811246,0.1676037336209198,,,gbtree,XGBoost,0.8322167320806513,,,0.206202332136162,,1.1400720937814693e-08,depthwise,1.5519156644333845e-08,,,3.0,,10.0,,,,,,,,,,,,,,,0.9799857436364109,,,COMPLETE,0.0,,,,,,,,,,,,,,,,,,,,
52,52,0.5763678989744261,2023-08-23 15:08:08.330213,2023-08-23 15:08:09.100249,0 days 00:00:00.770036,0.5503514265083058,,,gbtree,XGBoost,0.990616751060607,,,0.8429945450948491,,1.5582820045906893e-08,depthwise,3.3933911951984326e-08,,,3.0,,10.0,,,,,,,,,,,,,,,0.9970088708685624,,,COMPLETE,0.0,,,,,,,,,,,,,,,,,,,,
53,53,0.5675895786369476,2023-08-23 15:08:08.744828,2023-08-23 15:08:09.626272,0 days 00:00:00.881444,0.890197928361634,,,gbtree,XGBoost,0.9818851280797315,,,0.9022871318974865,,1.1082870551898925e-08,depthwise,3.0621090824851665e-08,,,3.0,,10.0,,,,,,,,,,,,,,,0.9968719054855618,,,COMPLETE,0.0,,,,,,,,,,,,,,,,,,,,
54,54,0.5737605000447369,2023-08-23 15:08:09.079548,2023-08-23 15:08:09.887520,0 days 00:00:00.807972,0.8368861369805788,,,gbtree,XGBoost,0.9854572176252265,,,0.9378040257675769,,4.488577419038809e-08,depthwise,2.174229771635584e-08,,,3.0,,10.0,,,,,,,,,,,,,,,0.9904065911268692,,,COMPLETE,0.0,,,,,,,,,,,,,,,,,,,,
55,55,0.5912953482436983,2023-08-23 15:08:09.167020,2023-08-23 15:08:10.138726,0 days 00:00:00.971706,3.088702913970531e-08,,,gbtree,XGBoost,0.6492173409007868,,,0.004104677675908247,,0.9998338430652002,depthwise,5.7915399456765065e-06,,,5.0,,7.0,,,,,,,,,,,,,,,0.5316109809340053,,,COMPLETE,0.0,,,,,,,,,,,,,,,,,,,,
56,56,0.5963913158092943,2023-08-23 15:08:09.564318,2023-08-23 15:08:10.409837,0 days 00:00:00.845519,0.0011534350555656822,,,gbtree,XGBoost,0.6684527580218071,,,0.004080466803363994,,0.60416515300388,depthwise,4.753761174305552e-06,,,5.0,,7.0,,,,,,,,,,,,,,,0.5385144150133604,,,COMPLETE,0.0,,,,,,,,,,,,,,,,,,,,
57,57,0.5924870285790551,2023-08-23 15:08:09.702828,2023-08-23 15:08:53.578630,0 days 00:00:43.875802,,,,,MLPClassifier,,,,,,,,,,,,,,relu,adam,4.0,50.0,10.0,10.0,10.0,,,,,,,,,,,COMPLETE,0.0,,,,,,,,,,,,,,,,,,,,
58,58,0.5591770591136476,2023-08-23 15:08:09.976963,2023-08-23 15:08:33.052243,0 days 00:00:23.075280,,,,,MLPClassifier,,,,,,,,,,,,,,tanh,adam,4.0,50.0,10.0,10.0,10.0,,,,,,,,,,,COMPLETE,0.0,,,,,,,,,,,,,,,,,,,,
59,59,0.5844485881527275,2023-08-23 15:08:10.118814,2023-08-23 15:08:11.857711,0 days 00:00:01.738897,,0.7000000000000001,1.0,,LightGBM,,,,,0.7000000000000001,,,,0.06127115179087554,0.06294115174022576,,80.0,,,,,,,,,,115.0,,,,,,,,,COMPLETE,0.0,,,,,,,,,,,,,,,,,,,,
60,60,0.5364779087961544,2023-08-23 15:08:10.218968,2023-08-23 15:08:39.747241,0 days 00:00:29.528273,,,,,MLPClassifier,,,,,,,,,,,,,,tanh,adam,1.0,50.0,,,,,,,,,,,,,,COMPLETE,0.0,,,,,,,,,,,,,,,,,,,,
61,61,0.5427154843630816,2023-08-23 15:08:10.320570,2023-08-23 15:08:51.150943,0 days 00:00:40.830373,,,,,MLPClassifier,,,,,,,,,,,,,,tanh,adam,1.0,50.0,,,,,,,,,,,,,,COMPLETE,0.0,,,,,,,,,,,,,,,,,,,,
62,62,0.5995399687980474,2023-08-23 15:08:10.493530,2023-08-23 15:08:51.388288,0 days 00:00:40.894758,,,,,MLPClassifier,,,,,,,,,,,,,,relu,adam,4.0,60.0,10.0,10.0,10.0,,,,,,,,,,,COMPLETE,0.0,,,,,,,,,,,,,,,,,,,,
63,63,0.582595259156412,2023-08-23 15:08:11.397863,2023-08-23 15:08:13.090209,0 days 00:00:01.692346,,0.7000000000000001,1.0,,LightGBM,,,,,0.7000000000000001,,,,0.07225607889257184,0.07268180455053048,,80.0,,,,,,,,,,109.0,,,,,,,,,COMPLETE,0.0,,,,,,,,,,,,,,,,,,,,
64,64,0.5977897698132562,2023-08-23 15:08:11.971700,2023-08-23 15:09:09.650581,0 days 00:00:57.678881,,,,,MLPClassifier,,,,,,,,,,,,,,relu,adam,4.0,50.0,10.0,10.0,10.0,,,,,,,,,,,COMPLETE,0.0,,,,,,,,,,,,,,,,,,,,
65,65,0.5706554354111883,2023-08-23 15:08:13.159262,2023-08-23 15:10:44.717337,0 days 00:02:31.558075,,,,,MLPClassifier,,,,,,,,,,,,,,relu,adam,1.0,50.0,,,,,,,,,,,,,,COMPLETE,0.0,,,,,,,,,,,,,,,,,,,,
66,66,0.5908758476396854,2023-08-23 15:08:33.147121,2023-08-23 15:08:34.521108,0 days 00:00:01.373987,,0.9,1.0,,LightGBM,,,,,0.5,,,,0.0010815336581652647,2.5322172910858314e-08,,50.0,,,,,,,,,,36.0,,,,,,,,,COMPLETE,0.0,,,,,,,,,,,,,,,,,,,,
67,67,0.6013070766812565,2023-08-23 15:08:34.589492,2023-08-23 15:08:36.226424,0 days 00:00:01.636932,,0.9,1.0,,LightGBM,,,,,0.5,,,,0.10115458292375626,0.1024771329659522,,60.0,,,,,,,,,,45.0,,,,,,,,,COMPLETE,0.0,,,,,,,,,,,,,,,,,,,,
68,68,0.5967671596688251,2023-08-23 15:08:36.305088,2023-08-23 15:08:37.769237,0 days 00:00:01.464149,,0.9,1.0,,LightGBM,,,,,0.5,,,,0.1468581689151023,0.09385247256862259,,60.0,,,,,,,,,,42.0,,,,,,,,,COMPLETE,0.0,,,,,,,,,,,,,,,,,,,,
69,69,0.5938077892967217,2023-08-23 15:08:37.865388,2023-08-23 15:08:39.179518,0 days 00:00:01.314130,,0.9,1.0,,LightGBM,,,,,0.5,,,,0.09170903381132943,0.10256984543149923,,60.0,,,,,,,,,,35.0,,,,,,,,,COMPLETE,0.0,,,,,,,,,,,,,,,,,,,,
70,70,0.5883441396380582,2023-08-23 15:08:39.280033,2023-08-23 15:08:40.697966,0 days 00:00:01.417933,,0.9,1.0,,LightGBM,,,,,0.5,,,,0.1166286715997113,0.0519638033960929,,90.0,,,,,,,,,,34.0,,,,,,,,,COMPLETE,0.0,,,,,,,,,,,,,,,,,,,,
71,71,0.5952434490773333,2023-08-23 15:08:39.877913,2023-08-23 15:08:41.897975,0 days 00:00:02.020062,,0.9,1.0,,LightGBM,,,,,0.5,,,,0.15083309267498618,0.05424862311347165,,90.0,,,,,,,,,,38.0,,,,,,,,,COMPLETE,0.0,,,,,,,,,,,,,,,,,,,,
72,72,0.5994768275866251,2023-08-23 15:08:40.788792,2023-08-23 15:08:43.355264,0 days 00:00:02.566472,,0.9,1.0,,LightGBM,,,,,0.5,,,,0.0013498072093956748,0.15388096076315386,,50.0,,,,,,,,,,95.0,,,,,,,,,COMPLETE,0.0,,,,,,,,,,,,,,,,,,,,
73,73,0.5937792194555598,2023-08-23 15:08:41.967690,2023-08-23 15:08:44.240254,0 days 00:00:02.272564,,0.7000000000000001,1.0,,LightGBM,,,,,0.7000000000000001,,,,0.0033978398457407736,0.22368908857040504,,50.0,,,,,,,,,,100.0,,,,,,,,,COMPLETE,0.0,,,,,,,,,,,,,,,,,,,,
74,74,0.5988794302409155,2023-08-23 15:08:43.435937,2023-08-23 15:08:45.437125,0 days 00:00:02.001188,,0.7000000000000001,1.0,,LightGBM,,,,,0.7000000000000001,,,,0.03600309459580566,0.2400090981764999,,60.0,,,,,,,,,,52.0,,,,,,,,,COMPLETE,0.0,,,,,,,,,,,,,,,,,,,,
75,75,0.5962694346485683,2023-08-23 15:08:44.324942,2023-08-23 15:08:45.747463,0 days 00:00:01.422521,,0.8,1.0,,LightGBM,,,,,0.6000000000000001,,,,0.044674584334792766,0.01779768169537172,,90.0,,,,,,,,,,51.0,,,,,,,,,COMPLETE,0.0,,,,,,,,,,,,,,,,,,,,
76,76,0.4720962864814373,2023-08-23 15:08:45.520186,2023-08-23 15:08:54.075109,0 days 00:00:08.554923,,,,,SVC,,,,,,,,,,,,,,,,,,,,,,,,,,,,,920.1707552740993,rbf,COMPLETE,0.0,,,,,,,,,,,,,,,,,,,,
77,77,0.33968041031272617,2023-08-23 15:08:45.838045,2023-08-23 15:08:54.290687,0 days 00:00:08.452642,,,,,SVC,,,,,,,,,,,,,,,,,,,,,,,,,,,,,0.4641029046333626,rbf,COMPLETE,0.0,,,,,,,,,,,,,,,,,,,,
78,78,0.34396603013624294,2023-08-23 15:08:51.246402,2023-08-23 15:08:59.702803,0 days 00:00:08.456401,,,,,SVC,,,,,,,,,,,,,,,,,,,,,,,,,,,,,0.6252487538625189,rbf,COMPLETE,0.0,,,,,,,,,,,,,,,,,,,,
79,79,0.4720962864814373,2023-08-23 15:08:51.461683,2023-08-23 15:08:59.586149,0 days 00:00:08.124466,,,,,SVC,,,,,,,,,,,,,,,,,,,,,,,,,,,,,995.6387535237262,rbf,COMPLETE,0.0,,,,,,,,,,,,,,,,,,,,
80,80,0.4720962864814373,2023-08-23 15:08:53.669024,2023-08-23 15:09:01.266006,0 days 00:00:07.596982,,,,,SVC,,,,,,,,,,,,,,,,,,,,,,,,,,,,,967.4438818625265,rbf,COMPLETE,0.0,,,,,,,,,,,,,,,,,,,,
81,81,0.5933391346212442,2023-08-23 15:08:54.165912,2023-08-23 15:08:55.642349,0 days 00:00:01.476437,,0.9,1.0,,LightGBM,,,,,0.4,,,,0.28185132240255045,0.7132515390735407,,90.0,,,,,,,,,,24.0,,,,,,,,,COMPLETE,0.0,,,,,,,,,,,,,,,,,,,,
82,82,0.5933391346212442,2023-08-23 15:08:54.404974,2023-08-23 15:08:55.775055,0 days 00:00:01.370081,,0.9,1.0,,LightGBM,,,,,0.4,,,,0.3232194764399009,0.894774054650852,,90.0,,,,,,,,,,25.0,,,,,,,,,COMPLETE,0.0,,,,,,,,,,,,,,,,,,,,
83,83,0.6092741703216196,2023-08-23 15:08:55.708513,2023-08-23 15:08:57.423748,0 days 00:00:01.715235,,0.5,3.0,,LightGBM,,,,,0.4,,,,0.29175867698823094,0.0016588201334197963,,70.0,,,,,,,,,,248.0,,,,,,,,,COMPLETE,0.0,,,,,,,,,,,,,,,,,,,,
84,84,0.5980179356295667,2023-08-23 15:08:55.844236,2023-08-23 15:08:57.021253,0 days 00:00:01.177017,,0.5,3.0,,LightGBM,,,,,0.5,,,,0.25343039392937605,0.23930209494418594,,70.0,,,,,,,,,,19.0,,,,,,,,,COMPLETE,0.0,,,,,,,,,,,,,,,,,,,,
85,85,0.5927143748692039,2023-08-23 15:08:57.113387,2023-08-23 15:08:58.663640,0 days 00:00:01.550253,,0.4,1.0,,LightGBM,,,,,0.4,,,,0.8479158644250038,0.002012435870613342,,70.0,,,,,,,,,,142.0,,,,,,,,,COMPLETE,0.0,,,,,,,,,,,,,,,,,,,,
