,number,value,datetime_start,datetime_complete,duration,params_alpha,params_bagging_fraction,params_bagging_freq,params_booster,params_classifier,params_colsample_bytree,params_dct_criterion,params_dct_max_depth,params_eta,params_feature_fraction,params_gamma,params_grow_policy,params_lambda,params_lambda_l1,params_lambda_l2,params_max_depth,params_min_child_samples,params_min_child_weight,params_mlp_activation,params_mlp_solver,params_n_layers,params_n_units_l_0,params_n_units_l_1,params_n_units_l_2,params_n_units_l_3,params_normalize_type,params_num_leaves,params_rate_drop,params_rf_estimator,params_rf_max_depth,params_sample_type,params_skip_drop,params_subsample,params_svc_c,params_svc_kernel,state,best_trial,dev_acc,dev_recall_macro,dev_precision_macro,dev_f1_macro,dev_recall_0,dev_precision_0,dev_f1_0,dev_recall_1,dev_precision_1,dev_f1_1,test_acc,test_recall_macro,test_precision_macro,test_f1_macro,test_recall_0,test_precision_0,test_f1_0,test_recall_1,test_precision_1,test_f1_1
0,0,0.6310578760003062,2023-08-23 19:38:23.011835,2023-08-23 19:38:23.095574,0 days 00:00:00.083739,,,,,DecisionTreeClassifier,,gini,2.0,,,,,,,,,,,,,,,,,,,,,,,,,,,,COMPLETE,0.0,,,,,,,,,,,,,,,,,,,,
1,1,0.6598604961978405,2023-08-23 19:38:23.014582,2023-08-23 19:38:23.489151,0 days 00:00:00.474569,0.00010613502172043544,,,gbtree,XGBoost,0.32534361396660066,,,0.0017020654820997043,,0.6370659673554918,lossguide,3.5531729566724974e-06,,,7.0,,3.0,,,,,,,,,,,,,,,0.5841712800445682,,,COMPLETE,0.0,,,,,,,,,,,,,,,,,,,,
2,2,0.5410707204809195,2023-08-23 19:38:23.016229,2023-08-23 19:38:35.240321,0 days 00:00:12.224092,,,,,MLPClassifier,,,,,,,,,,,,,,identity,lbfgs,2.0,90.0,20.0,,,,,,,,,,,,,COMPLETE,0.0,,,,,,,,,,,,,,,,,,,,
3,3,0.3405590333306099,2023-08-23 19:38:23.019651,2023-08-23 19:39:09.101121,0 days 00:00:46.081470,,,,,SVC,,,,,,,,,,,,,,,,,,,,,,,,,,,,,0.0801395919109018,rbf,COMPLETE,0.0,,,,,,,,,,,,,,,,,,,,
4,4,0.6253541420239317,2023-08-23 19:38:23.023544,2023-08-23 19:38:24.697877,0 days 00:00:01.674333,,,,,RandomForestClassifier,,,,,,,,,,,,,,,,,,,,,,,,35.0,2.0,,,,,,COMPLETE,0.0,,,,,,,,,,,,,,,,,,,,
5,5,0.6399623286749723,2023-08-23 19:38:23.027735,2023-08-23 19:38:27.455714,0 days 00:00:04.427979,,,,,RandomForestClassifier,,,,,,,,,,,,,,,,,,,,,,,,70.0,3.0,,,,,,COMPLETE,0.0,,,,,,,,,,,,,,,,,,,,
6,6,0.6771341582115353,2023-08-23 19:38:23.031298,2023-08-23 19:38:25.764141,0 days 00:00:02.732843,,,,,RandomForestClassifier,,,,,,,,,,,,,,,,,,,,,,,,12.0,16.0,,,,,,COMPLETE,0.0,,,,,,,,,,,,,,,,,,,,
7,7,0.6544091595869008,2023-08-23 19:38:23.033929,2023-08-23 19:38:23.226886,0 days 00:00:00.192957,,,,,DecisionTreeClassifier,,gini,3.0,,,,,,,,,,,,,,,,,,,,,,,,,,,,COMPLETE,0.0,,,,,,,,,,,,,,,,,,,,
8,8,0.694161040260065,2023-08-23 19:38:23.172644,2023-08-23 19:38:23.581712,0 days 00:00:00.409068,5.937161551624219e-07,,,dart,XGBoost,0.8296016423370316,,,0.09185361735151654,,0.0010479353672957074,depthwise,2.115621705424908e-08,,,5.0,,2.0,,,,,,,,forest,,0.06274456844139659,,,weighted,0.0006723229411715937,0.20492468034366304,,,COMPLETE,0.0,,,,,,,,,,,,,,,,,,,,
9,9,0.4639951443399508,2023-08-23 19:38:23.293803,2023-08-23 19:38:27.040420,0 days 00:00:03.746617,,,,,MLPClassifier,,,,,,,,,,,,,,tanh,sgd,1.0,40.0,,,,,,,,,,,,,,COMPLETE,0.0,,,,,,,,,,,,,,,,,,,,
10,10,0.33791449736724527,2023-08-23 19:38:23.563872,2023-08-23 19:39:01.339276,0 days 00:00:37.775404,,,,,SVC,,,,,,,,,,,,,,,,,,,,,,,,,,,,,578.2813855514871,poly,COMPLETE,0.0,,,,,,,,,,,,,,,,,,,,
11,11,0.640590118860369,2023-08-23 19:38:23.685780,2023-08-23 19:38:28.085784,0 days 00:00:04.400004,,,,,RandomForestClassifier,,,,,,,,,,,,,,,,,,,,,,,,76.0,3.0,,,,,,COMPLETE,0.0,,,,,,,,,,,,,,,,,,,,
12,12,0.6903431169864653,2023-08-23 19:38:24.779760,2023-08-23 19:38:25.107863,0 days 00:00:00.328103,8.822680521861484e-07,,,gbtree,XGBoost,0.6667751980799956,,,0.022327077919839247,,4.443255496760657e-07,depthwise,6.15576993799921e-07,,,7.0,,4.0,,,,,,,,,,,,,,,0.3248680711925531,,,COMPLETE,0.0,,,,,,,,,,,,,,,,,,,,
13,13,0.3358178053830228,2023-08-23 19:38:25.193260,2023-08-23 19:38:58.266871,0 days 00:00:33.073611,,,,,SVC,,,,,,,,,,,,,,,,,,,,,,,,,,,,,42.74275687313879,poly,COMPLETE,0.0,,,,,,,,,,,,,,,,,,,,
14,14,0.6914549889432132,2023-08-23 19:38:25.880783,2023-08-23 19:38:26.404667,0 days 00:00:00.523884,0.019399512076431966,,,dart,XGBoost,0.9153624548119985,,,0.0001719159229032396,,9.924133712700509e-06,lossguide,2.266308891250403e-08,,,7.0,,6.0,,,,,,,,forest,,2.138238977595285e-06,,,uniform,0.017491267585674007,0.8140616995784709,,,COMPLETE,0.0,,,,,,,,,,,,,,,,,,,,
15,15,0.6985013686874062,2023-08-23 19:38:26.472162,2023-08-23 19:38:29.243101,0 days 00:00:02.770939,,0.6000000000000001,2.0,,LightGBM,,,,,0.4,,,,0.003435576280812721,3.769203658882382e-08,,10.0,,,,,,,,,,96.0,,,,,,,,,COMPLETE,0.0,,,,,,,,,,,,,,,,,,,,
16,16,0.6394760377982058,2023-08-23 19:38:27.130665,2023-08-23 19:38:29.794064,0 days 00:00:02.663399,,,,,RandomForestClassifier,,,,,,,,,,,,,,,,,,,,,,,,53.0,3.0,,,,,,COMPLETE,0.0,,,,,,,,,,,,,,,,,,,,
17,17,0.3358178053830228,2023-08-23 19:38:27.590643,2023-08-23 19:39:13.761358,0 days 00:00:46.170715,,,,,SVC,,,,,,,,,,,,,,,,,,,,,,,,,,,,,0.0019080133390648093,rbf,COMPLETE,0.0,,,,,,,,,,,,,,,,,,,,
18,18,0.3358178053830228,2023-08-23 19:38:28.202398,2023-08-23 19:39:02.330287,0 days 00:00:34.127889,,,,,SVC,,,,,,,,,,,,,,,,,,,,,,,,,,,,,0.0011467621009238706,linear,COMPLETE,0.0,,,,,,,,,,,,,,,,,,,,
19,19,0.6916302924879549,2023-08-23 19:38:29.371279,2023-08-23 19:38:32.076526,0 days 00:00:02.705247,,0.6000000000000001,2.0,,LightGBM,,,,,0.4,,,,0.004863322424260643,1.3908744954990572e-08,,10.0,,,,,,,,,,89.0,,,,,,,,,COMPLETE,0.0,,,,,,,,,,,,,,,,,,,,
20,20,0.6940347605044276,2023-08-23 19:38:29.955465,2023-08-23 19:38:32.254655,0 days 00:00:02.299190,,0.6000000000000001,2.0,,LightGBM,,,,,0.4,,,,0.0052998090324435565,1.0557593219061567e-08,,10.0,,,,,,,,,,87.0,,,,,,,,,COMPLETE,0.0,,,,,,,,,,,,,,,,,,,,
21,21,0.6917082812138284,2023-08-23 19:38:32.165231,2023-08-23 19:38:37.053327,0 days 00:00:04.888096,,0.9,2.0,,LightGBM,,,,,0.8,,,,3.9900173552109314e-07,6.5901124883502085e-06,,50.0,,,,,,,,,,212.0,,,,,,,,,COMPLETE,0.0,,,,,,,,,,,,,,,,,,,,
22,22,0.3358178053830228,2023-08-23 19:38:32.369104,2023-08-23 19:39:04.475799,0 days 00:00:32.106695,,,,,SVC,,,,,,,,,,,,,,,,,,,,,,,,,,,,,0.4857556369079321,poly,COMPLETE,0.0,,,,,,,,,,,,,,,,,,,,
23,23,0.3358178053830228,2023-08-23 19:38:35.345160,2023-08-23 19:39:08.280516,0 days 00:00:32.935356,,,,,SVC,,,,,,,,,,,,,,,,,,,,,,,,,,,,,2.308197930978244,poly,COMPLETE,0.0,,,,,,,,,,,,,,,,,,,,
24,24,0.3358178053830228,2023-08-23 19:38:37.146659,2023-08-23 19:39:02.077468,0 days 00:00:24.930809,,,,,SVC,,,,,,,,,,,,,,,,,,,,,,,,,,,,,0.0021708220416226335,linear,COMPLETE,0.0,,,,,,,,,,,,,,,,,,,,
25,25,0.3358178053830228,2023-08-23 19:38:58.343157,2023-08-23 19:39:33.535808,0 days 00:00:35.192651,,,,,SVC,,,,,,,,,,,,,,,,,,,,,,,,,,,,,0.0014104510426144004,rbf,COMPLETE,0.0,,,,,,,,,,,,,,,,,,,,
26,26,0.6969431808839719,2023-08-23 19:39:01.421304,2023-08-23 19:39:01.894260,0 days 00:00:00.472956,,0.4,3.0,,LightGBM,,,,,1.0,,,,0.32690076052088807,0.4794828863607027,,100.0,,,,,,,,,,11.0,,,,,,,,,COMPLETE,0.0,,,,,,,,,,,,,,,,,,,,
27,27,0.6926002270758858,2023-08-23 19:39:01.976002,2023-08-23 19:39:02.720426,0 days 00:00:00.744424,,0.4,3.0,,LightGBM,,,,,1.0,,,,0.5280255196295055,0.7035500334828361,,100.0,,,,,,,,,,8.0,,,,,,,,,COMPLETE,0.0,,,,,,,,,,,,,,,,,,,,
28,28,0.6940265969042947,2023-08-23 19:39:02.150315,2023-08-23 19:39:02.721203,0 days 00:00:00.570888,,0.4,3.0,,LightGBM,,,,,1.0,,,,0.23293203537041077,0.9817902769175905,,100.0,,,,,,,,,,9.0,,,,,,,,,COMPLETE,0.0,,,,,,,,,,,,,,,,,,,,
29,29,0.6973820360213172,2023-08-23 19:39:02.398298,2023-08-23 19:39:03.107724,0 days 00:00:00.709426,,0.4,3.0,,LightGBM,,,,,1.0,,,,0.3114755924702675,0.9143685880510503,,100.0,,,,,,,,,,11.0,,,,,,,,,COMPLETE,0.0,,,,,,,,,,,,,,,,,,,,
30,30,0.6713512940797939,2023-08-23 19:39:02.854126,2023-08-23 19:39:03.391723,0 days 00:00:00.537597,1.4656849598949552e-08,,,dart,XGBoost,0.9982436102855533,,,0.5499027473094713,,0.0068569491307669496,depthwise,0.008712372447706873,,,3.0,,10.0,,,,,,,,tree,,0.10537848030812584,,,weighted,1.6435354711881932e-06,0.20161593591592772,,,COMPLETE,0.0,,,,,,,,,,,,,,,,,,,,
31,31,0.6739700032615328,2023-08-23 19:39:02.858785,2023-08-23 19:39:03.273524,0 days 00:00:00.414739,4.3549784182346765e-08,,,dart,XGBoost,0.98847267268663,,,0.5156677800700539,,0.003202906471579151,depthwise,0.01083983988560765,,,3.0,,9.0,,,,,,,,tree,,0.4799701984281694,,,weighted,2.38571348453118e-06,0.20330148503512163,,,COMPLETE,0.0,,,,,,,,,,,,,,,,,,,,
32,32,0.6974046135958538,2023-08-23 19:39:03.175261,2023-08-23 19:39:03.935886,0 days 00:00:00.760625,,0.4,3.0,,LightGBM,,,,,0.8,,,,0.7069931151007603,0.009020442580533031,,80.0,,,,,,,,,,5.0,,,,,,,,,COMPLETE,0.0,,,,,,,,,,,,,,,,,,,,
33,33,0.6940712585560285,2023-08-23 19:39:03.346151,2023-08-23 19:39:04.749036,0 days 00:00:01.402885,,0.4,3.0,,LightGBM,,,,,0.8,,,,0.8775433532351505,0.034687668349646025,,80.0,,,,,,,,,,33.0,,,,,,,,,COMPLETE,0.0,,,,,,,,,,,,,,,,,,,,
34,34,0.6965163518961688,2023-08-23 19:39:03.469635,2023-08-23 19:39:03.811541,0 days 00:00:00.341906,,0.4,3.0,,LightGBM,,,,,0.8,,,,0.9087535821832257,0.015952607148695456,,80.0,,,,,,,,,,5.0,,,,,,,,,COMPLETE,0.0,,,,,,,,,,,,,,,,,,,,
35,35,0.6985730765714153,2023-08-23 19:39:03.872027,2023-08-23 19:39:05.744739,0 days 00:00:01.872712,,0.6000000000000001,1.0,,LightGBM,,,,,0.6000000000000001,,,,0.012904325068377616,0.004351110569465293,,50.0,,,,,,,,,,72.0,,,,,,,,,COMPLETE,0.0,,,,,,,,,,,,,,,,,,,,
36,36,0.6222022345072435,2023-08-23 19:39:03.989662,2023-08-23 19:39:04.597027,0 days 00:00:00.607365,,,,,DecisionTreeClassifier,,entropy,31.0,,,,,,,,,,,,,,,,,,,,,,,,,,,,COMPLETE,0.0,,,,,,,,,,,,,,,,,,,,
37,37,0.6202742741961917,2023-08-23 19:39:04.539040,2023-08-23 19:39:05.303967,0 days 00:00:00.764927,,,,,DecisionTreeClassifier,,log_loss,23.0,,,,,,,,,,,,,,,,,,,,,,,,,,,,COMPLETE,0.0,,,,,,,,,,,,,,,,,,,,
38,38,0.6913386911475237,2023-08-23 19:39:04.658706,2023-08-23 19:39:06.528760,0 days 00:00:01.870054,,0.4,3.0,,LightGBM,,,,,1.0,,,,0.03232155856137579,0.02512954107928281,,80.0,,,,,,,,,,55.0,,,,,,,,,COMPLETE,0.0,,,,,,,,,,,,,,,,,,,,
39,39,0.682429362708489,2023-08-23 19:39:04.807328,2023-08-23 19:39:07.021976,0 days 00:00:02.214648,,0.5,1.0,,LightGBM,,,,,1.0,,,,0.018000324174751035,0.018038197803763947,,80.0,,,,,,,,,,55.0,,,,,,,,,COMPLETE,0.0,,,,,,,,,,,,,,,,,,,,
40,40,0.6974234671255191,2023-08-23 19:39:05.365575,2023-08-23 19:39:07.479581,0 days 00:00:02.114006,,0.5,1.0,,LightGBM,,,,,1.0,,,,0.010384372506460909,0.012871389183698326,,80.0,,,,,,,,,,65.0,,,,,,,,,COMPLETE,0.0,,,,,,,,,,,,,,,,,,,,
41,41,0.6915884067357514,2023-08-23 19:39:05.805549,2023-08-23 19:39:08.049878,0 days 00:00:02.244329,,0.6000000000000001,1.0,,LightGBM,,,,,0.6000000000000001,,,,0.012296829117079034,0.0004319195838502459,,40.0,,,,,,,,,,77.0,,,,,,,,,COMPLETE,0.0,,,,,,,,,,,,,,,,,,,,
42,42,0.6922127217018732,2023-08-23 19:39:06.588751,2023-08-23 19:39:10.463850,0 days 00:00:03.875099,,0.6000000000000001,1.0,,LightGBM,,,,,0.6000000000000001,,,,0.005010093927232804,0.0003618431965768395,,40.0,,,,,,,,,,140.0,,,,,,,,,COMPLETE,0.0,,,,,,,,,,,,,,,,,,,,
43,43,0.3358178053830228,2023-08-23 19:39:07.080412,2023-08-23 19:41:31.495714,0 days 00:02:24.415302,,,,,MLPClassifier,,,,,,,,,,,,,,logistic,adam,4.0,20.0,100.0,40.0,90.0,,,,,,,,,,,COMPLETE,0.0,,,,,,,,,,,,,,,,,,,,
44,44,0.5831018835392472,2023-08-23 19:39:07.605337,2023-08-23 19:52:32.542105,0 days 00:13:24.936768,,,,,MLPClassifier,,,,,,,,,,,,,,logistic,adam,4.0,10.0,100.0,90.0,80.0,,,,,,,,,,,COMPLETE,0.0,,,,,,,,,,,,,,,,,,,,
45,45,0.6437909780629815,2023-08-23 19:39:08.156409,2023-08-23 19:52:13.486414,0 days 00:13:05.330005,,,,,MLPClassifier,,,,,,,,,,,,,,relu,adam,4.0,10.0,100.0,90.0,20.0,,,,,,,,,,,COMPLETE,0.0,,,,,,,,,,,,,,,,,,,,
46,46,0.6573977674340431,2023-08-23 19:39:08.384693,2023-08-23 19:52:17.028695,0 days 00:13:08.644002,,,,,MLPClassifier,,,,,,,,,,,,,,relu,adam,4.0,10.0,100.0,60.0,30.0,,,,,,,,,,,COMPLETE,0.0,,,,,,,,,,,,,,,,,,,,
47,47,0.6341461308487242,2023-08-23 19:39:09.169759,2023-08-23 19:51:04.026687,0 days 00:11:54.856928,,,,,MLPClassifier,,,,,,,,,,,,,,relu,adam,4.0,10.0,100.0,60.0,60.0,,,,,,,,,,,COMPLETE,0.0,,,,,,,,,,,,,,,,,,,,
48,48,0.6206815805397836,2023-08-23 19:39:10.529070,2023-08-23 19:49:00.156759,0 days 00:09:49.627689,,,,,MLPClassifier,,,,,,,,,,,,,,relu,adam,4.0,10.0,100.0,60.0,40.0,,,,,,,,,,,COMPLETE,0.0,,,,,,,,,,,,,,,,,,,,
49,49,0.3358178053830228,2023-08-23 19:39:13.828253,2023-08-23 19:40:01.906711,0 days 00:00:48.078458,,,,,MLPClassifier,,,,,,,,,,,,,,logistic,adam,4.0,10.0,100.0,10.0,80.0,,,,,,,,,,,COMPLETE,0.0,,,,,,,,,,,,,,,,,,,,
50,50,0.3308302044221944,2023-08-23 19:39:33.665603,2023-08-23 19:41:34.558248,0 days 00:02:00.892645,,,,,MLPClassifier,,,,,,,,,,,,,,logistic,adam,4.0,20.0,100.0,20.0,90.0,,,,,,,,,,,COMPLETE,0.0,,,,,,,,,,,,,,,,,,,,
51,51,0.6867031475671099,2023-08-23 19:40:01.968056,2023-08-23 19:40:05.038157,0 days 00:00:03.070101,,0.5,1.0,,LightGBM,,,,,0.6000000000000001,,,,0.00014798754608558358,0.0019004180282207704,,60.0,,,,,,,,,,123.0,,,,,,,,,COMPLETE,0.0,,,,,,,,,,,,,,,,,,,,
52,52,0.6974234671255191,2023-08-23 19:40:05.118444,2023-08-23 19:40:08.114483,0 days 00:00:02.996039,,0.7000000000000001,2.0,,LightGBM,,,,,0.9,,,,0.06647939362078159,0.0028913305054610212,,60.0,,,,,,,,,,121.0,,,,,,,,,COMPLETE,0.0,,,,,,,,,,,,,,,,,,,,
53,53,0.6923074528590778,2023-08-23 19:40:08.187629,2023-08-23 19:40:11.376732,0 days 00:00:03.189103,,0.8,2.0,,LightGBM,,,,,0.9,,,,0.0492450423072338,0.0017735390448654685,,60.0,,,,,,,,,,124.0,,,,,,,,,COMPLETE,0.0,,,,,,,,,,,,,,,,,,,,
54,54,0.3597092954767236,2023-08-23 19:40:11.459047,2023-08-23 19:44:32.703101,0 days 00:04:21.244054,,,,,MLPClassifier,,,,,,,,,,,,,,relu,sgd,4.0,100.0,80.0,100.0,10.0,,,,,,,,,,,COMPLETE,0.0,,,,,,,,,,,,,,,,,,,,
55,55,0.690887719363408,2023-08-23 19:41:31.596366,2023-08-23 19:41:34.887574,0 days 00:00:03.291208,,0.7000000000000001,2.0,,LightGBM,,,,,0.5,,,,0.0007228996741754192,2.111074024798943e-05,,70.0,,,,,,,,,,149.0,,,,,,,,,COMPLETE,0.0,,,,,,,,,,,,,,,,,,,,
56,56,0.6927078455736044,2023-08-23 19:41:34.625517,2023-08-23 19:41:37.584918,0 days 00:00:02.959401,,0.7000000000000001,2.0,,LightGBM,,,,,0.5,,,,0.0008225085633904023,0.0035044637737822386,,70.0,,,,,,,,,,106.0,,,,,,,,,COMPLETE,0.0,,,,,,,,,,,,,,,,,,,,
57,57,0.6982902404284052,2023-08-23 19:41:34.950969,2023-08-23 19:41:38.189704,0 days 00:00:03.238735,,0.7000000000000001,1.0,,LightGBM,,,,,0.9,,,,0.06700546695021702,0.0037496717453338615,,30.0,,,,,,,,,,103.0,,,,,,,,,COMPLETE,0.0,,,,,,,,,,,,,,,,,,,,
58,58,0.6933830758165792,2023-08-23 19:41:37.639338,2023-08-23 19:41:39.347985,0 days 00:00:01.708647,,0.5,1.0,,LightGBM,,,,,0.9,,,,0.07876181590927611,0.12793743047100667,,30.0,,,,,,,,,,46.0,,,,,,,,,COMPLETE,0.0,,,,,,,,,,,,,,,,,,,,
59,59,0.6999360430784078,2023-08-23 19:41:38.247651,2023-08-23 19:41:40.476815,0 days 00:00:02.229164,,0.7000000000000001,1.0,,LightGBM,,,,,0.9,,,,0.07038197197256595,0.0036406737241263063,,30.0,,,,,,,,,,63.0,,,,,,,,,COMPLETE,0.0,,,,,,,,,,,,,,,,,,,,
60,60,0.6967580814564126,2023-08-23 19:41:39.433877,2023-08-23 19:41:52.603681,0 days 00:00:13.169804,,,,,RandomForestClassifier,,,,,,,,,,,,,,,,,,,,,,,,96.0,30.0,,,,,,COMPLETE,0.0,,,,,,,,,,,,,,,,,,,,
61,61,0.6998988673139159,2023-08-23 19:41:40.590934,2023-08-23 19:41:53.447303,0 days 00:00:12.856369,,,,,RandomForestClassifier,,,,,,,,,,,,,,,,,,,,,,,,99.0,30.0,,,,,,COMPLETE,0.0,,,,,,,,,,,,,,,,,,,,
62,62,0.6902325910991863,2023-08-23 19:41:52.705833,2023-08-23 19:41:54.847633,0 days 00:00:02.141800,,0.7000000000000001,1.0,,LightGBM,,,,,0.9,,,,0.05223956126724671,0.0030869408865484014,,20.0,,,,,,,,,,73.0,,,,,,,,,COMPLETE,0.0,,,,,,,,,,,,,,,,,,,,
63,63,0.6958055536347677,2023-08-23 19:41:53.513323,2023-08-23 19:42:02.074885,0 days 00:00:08.561562,,,,,RandomForestClassifier,,,,,,,,,,,,,,,,,,,,,,,,96.0,9.0,,,,,,COMPLETE,0.0,,,,,,,,,,,,,,,,,,,,
64,64,0.6558094069768574,2023-08-23 19:41:54.936311,2023-08-23 19:41:55.450671,0 days 00:00:00.514360,,,,,DecisionTreeClassifier,,log_loss,8.0,,,,,,,,,,,,,,,,,,,,,,,,,,,,COMPLETE,0.0,,,,,,,,,,,,,,,,,,,,
65,65,0.698483567702374,2023-08-23 19:41:55.533049,2023-08-23 19:42:05.679344,0 days 00:00:10.146295,,,,,RandomForestClassifier,,,,,,,,,,,,,,,,,,,,,,,,97.0,10.0,,,,,,COMPLETE,0.0,,,,,,,,,,,,,,,,,,,,
66,66,0.693542939413985,2023-08-23 19:42:02.148455,2023-08-23 19:42:13.386849,0 days 00:00:11.238394,,,,,RandomForestClassifier,,,,,,,,,,,,,,,,,,,,,,,,77.0,27.0,,,,,,COMPLETE,0.0,,,,,,,,,,,,,,,,,,,,
67,67,0.7033914956571975,2023-08-23 19:42:05.766316,2023-08-23 19:42:19.133236,0 days 00:00:13.366920,,,,,RandomForestClassifier,,,,,,,,,,,,,,,,,,,,,,,,98.0,32.0,,,,,,COMPLETE,0.0,,,,,,,,,,,,,,,,,,,,
68,68,0.7004085762091911,2023-08-23 19:42:13.468132,2023-08-23 19:42:24.578991,0 days 00:00:11.110859,,,,,RandomForestClassifier,,,,,,,,,,,,,,,,,,,,,,,,100.0,11.0,,,,,,COMPLETE,0.0,,,,,,,,,,,,,,,,,,,,
69,69,0.6959954855164369,2023-08-23 19:42:19.220780,2023-08-23 19:42:32.803606,0 days 00:00:13.582826,,,,,RandomForestClassifier,,,,,,,,,,,,,,,,,,,,,,,,98.0,32.0,,,,,,COMPLETE,0.0,,,,,,,,,,,,,,,,,,,,
70,70,0.7004909735327103,2023-08-23 19:42:24.651530,2023-08-23 19:42:36.243558,0 days 00:00:11.592028,,,,,RandomForestClassifier,,,,,,,,,,,,,,,,,,,,,,,,98.0,13.0,,,,,,COMPLETE,0.0,,,,,,,,,,,,,,,,,,,,
71,71,0.6965634030101757,2023-08-23 19:42:32.906259,2023-08-23 19:42:43.810657,0 days 00:00:10.904398,,,,,RandomForestClassifier,,,,,,,,,,,,,,,,,,,,,,,,100.0,13.0,,,,,,COMPLETE,0.0,,,,,,,,,,,,,,,,,,,,
72,72,0.6897154618373853,2023-08-23 19:42:36.345806,2023-08-23 19:42:47.361587,0 days 00:00:11.015781,,,,,RandomForestClassifier,,,,,,,,,,,,,,,,,,,,,,,,87.0,17.0,,,,,,COMPLETE,0.0,,,,,,,,,,,,,,,,,,,,
73,73,0.7005018088458397,2023-08-23 19:42:43.906911,2023-08-23 19:42:55.154955,0 days 00:00:11.248044,,,,,RandomForestClassifier,,,,,,,,,,,,,,,,,,,,,,,,83.0,19.0,,,,,,COMPLETE,0.0,,,,,,,,,,,,,,,,,,,,
74,74,0.7017905511051508,2023-08-23 19:42:47.437809,2023-08-23 19:42:59.725160,0 days 00:00:12.287351,,,,,RandomForestClassifier,,,,,,,,,,,,,,,,,,,,,,,,84.0,19.0,,,,,,COMPLETE,0.0,,,,,,,,,,,,,,,,,,,,
75,75,0.691470760043694,2023-08-23 19:42:55.279433,2023-08-23 19:43:08.040796,0 days 00:00:12.761363,,,,,RandomForestClassifier,,,,,,,,,,,,,,,,,,,,,,,,85.0,20.0,,,,,,COMPLETE,0.0,,,,,,,,,,,,,,,,,,,,
76,76,0.6930945814141243,2023-08-23 19:42:59.837752,2023-08-23 19:43:12.467592,0 days 00:00:12.629840,,,,,RandomForestClassifier,,,,,,,,,,,,,,,,,,,,,,,,85.0,19.0,,,,,,COMPLETE,0.0,,,,,,,,,,,,,,,,,,,,
77,77,0.6979839035958595,2023-08-23 19:43:08.170417,2023-08-23 19:43:21.327692,0 days 00:00:13.157275,,,,,RandomForestClassifier,,,,,,,,,,,,,,,,,,,,,,,,87.0,22.0,,,,,,COMPLETE,0.0,,,,,,,,,,,,,,,,,,,,
78,78,0.696520920320048,2023-08-23 19:43:12.558891,2023-08-23 19:43:25.779437,0 days 00:00:13.220546,,,,,RandomForestClassifier,,,,,,,,,,,,,,,,,,,,,,,,89.0,22.0,,,,,,COMPLETE,0.0,,,,,,,,,,,,,,,,,,,,
79,79,0.6856681267023219,2023-08-23 19:43:21.395458,2023-08-23 19:43:34.927546,0 days 00:00:13.532088,,,,,RandomForestClassifier,,,,,,,,,,,,,,,,,,,,,,,,100.0,25.0,,,,,,COMPLETE,0.0,,,,,,,,,,,,,,,,,,,,
80,80,0.6965969793740403,2023-08-23 19:43:25.893027,2023-08-23 19:43:37.504733,0 days 00:00:11.611706,,,,,RandomForestClassifier,,,,,,,,,,,,,,,,,,,,,,,,99.0,14.0,,,,,,COMPLETE,0.0,,,,,,,,,,,,,,,,,,,,
81,81,0.6955986259876249,2023-08-23 19:43:35.016527,2023-08-23 19:43:41.695571,0 days 00:00:06.679044,,,,,RandomForestClassifier,,,,,,,,,,,,,,,,,,,,,,,,63.0,13.0,,,,,,COMPLETE,0.0,,,,,,,,,,,,,,,,,,,,
82,82,0.6947705967734803,2023-08-23 19:43:37.596931,2023-08-23 19:43:44.756520,0 days 00:00:07.159589,,,,,RandomForestClassifier,,,,,,,,,,,,,,,,,,,,,,,,62.0,31.0,,,,,,COMPLETE,0.0,,,,,,,,,,,,,,,,,,,,
83,83,0.7002546323911965,2023-08-23 19:43:41.767857,2023-08-23 19:43:53.644407,0 days 00:00:11.876550,,,,,RandomForestClassifier,,,,,,,,,,,,,,,,,,,,,,,,89.0,30.0,,,,,,COMPLETE,0.0,,,,,,,,,,,,,,,,,,,,
84,84,0.6906172224987556,2023-08-23 19:43:44.830221,2023-08-23 19:43:56.755106,0 days 00:00:11.924885,,,,,RandomForestClassifier,,,,,,,,,,,,,,,,,,,,,,,,90.0,24.0,,,,,,COMPLETE,0.0,,,,,,,,,,,,,,,,,,,,
85,85,0.6876937017316949,2023-08-23 19:43:53.721965,2023-08-23 19:44:06.027963,0 days 00:00:12.305998,,,,,RandomForestClassifier,,,,,,,,,,,,,,,,,,,,,,,,92.0,25.0,,,,,,COMPLETE,0.0,,,,,,,,,,,,,,,,,,,,
86,86,0.6905185358073677,2023-08-23 19:43:56.821343,2023-08-23 19:44:09.812367,0 days 00:00:12.991024,,,,,RandomForestClassifier,,,,,,,,,,,,,,,,,,,,,,,,93.0,32.0,,,,,,COMPLETE,0.0,,,,,,,,,,,,,,,,,,,,
87,87,0.6938740432007464,2023-08-23 19:44:06.146188,2023-08-23 19:44:16.768934,0 days 00:00:10.622746,,,,,RandomForestClassifier,,,,,,,,,,,,,,,,,,,,,,,,79.0,31.0,,,,,,COMPLETE,0.0,,,,,,,,,,,,,,,,,,,,
88,88,0.6987343632793862,2023-08-23 19:44:09.924649,2023-08-23 19:44:20.306097,0 days 00:00:10.381448,,,,,RandomForestClassifier,,,,,,,,,,,,,,,,,,,,,,,,78.0,19.0,,,,,,COMPLETE,0.0,,,,,,,,,,,,,,,,,,,,
