,number,value,datetime_start,datetime_complete,duration,params_alpha,params_bagging_fraction,params_bagging_freq,params_booster,params_classifier,params_colsample_bytree,params_dct_criterion,params_dct_max_depth,params_eta,params_feature_fraction,params_gamma,params_grow_policy,params_lambda,params_lambda_l1,params_lambda_l2,params_max_depth,params_min_child_samples,params_min_child_weight,params_mlp_activation,params_mlp_solver,params_n_layers,params_n_units_l_0,params_n_units_l_1,params_n_units_l_2,params_n_units_l_3,params_normalize_type,params_num_leaves,params_rate_drop,params_rf_estimator,params_rf_max_depth,params_sample_type,params_skip_drop,params_subsample,params_svc_c,params_svc_kernel,state,best_trial,dev_acc,dev_recall_macro,dev_precision_macro,dev_f1_macro,dev_recall_0,dev_precision_0,dev_f1_0,dev_recall_1,dev_precision_1,dev_f1_1,test_acc,test_recall_macro,test_precision_macro,test_f1_macro,test_recall_0,test_precision_0,test_f1_0,test_recall_1,test_precision_1,test_f1_1
0,0,0.6426398005036529,2023-08-23 16:27:54.334883,2023-08-23 16:27:57.769084,0 days 00:00:03.434201,,0.5,1.0,,LightGBM,,,,,0.8,,,,1.8922324492352623e-07,5.1455144360049543e-05,,70.0,,,,,,,,,,91.0,,,,,,,,,COMPLETE,0.0,,,,,,,,,,,,,,,,,,,,
1,1,0.4602268082063299,2023-08-23 16:27:54.337731,2023-08-23 16:29:38.644888,0 days 00:01:44.307157,,,,,MLPClassifier,,,,,,,,,,,,,,tanh,sgd,1.0,90.0,,,,,,,,,,,,,,COMPLETE,0.0,,,,,,,,,,,,,,,,,,,,
2,2,0.6481805631416198,2023-08-23 16:27:54.341608,2023-08-23 16:28:13.185536,0 days 00:00:18.843928,,,,,RandomForestClassifier,,,,,,,,,,,,,,,,,,,,,,,,62.0,16.0,,,,,,COMPLETE,0.0,,,,,,,,,,,,,,,,,,,,
3,3,0.6482938364999346,2023-08-23 16:27:54.344633,2023-08-23 16:27:57.239486,0 days 00:00:02.894853,,0.5,2.0,,LightGBM,,,,,1.0,,,,0.18563839350906142,0.00022943471537253648,,60.0,,,,,,,,,,59.0,,,,,,,,,COMPLETE,0.0,,,,,,,,,,,,,,,,,,,,
4,4,0.6119464407782149,2023-08-23 16:27:54.367553,2023-08-23 16:27:55.431542,0 days 00:00:01.063989,,,,,DecisionTreeClassifier,,gini,10.0,,,,,,,,,,,,,,,,,,,,,,,,,,,,COMPLETE,0.0,,,,,,,,,,,,,,,,,,,,
5,5,0.3455732354141167,2023-08-23 16:27:54.371126,2023-08-23 16:28:43.231461,0 days 00:00:48.860335,,,,,MLPClassifier,,,,,,,,,,,,,,tanh,sgd,3.0,50.0,10.0,60.0,,,,,,,,,,,,COMPLETE,0.0,,,,,,,,,,,,,,,,,,,,
6,6,0.6499384898766948,2023-08-23 16:27:54.375612,2023-08-23 16:28:13.496176,0 days 00:00:19.120564,,,,,RandomForestClassifier,,,,,,,,,,,,,,,,,,,,,,,,61.0,15.0,,,,,,COMPLETE,0.0,,,,,,,,,,,,,,,,,,,,
7,7,0.6028375741462013,2023-08-23 16:27:54.383904,2023-08-23 16:27:55.760419,0 days 00:00:01.376515,,,,,DecisionTreeClassifier,,entropy,9.0,,,,,,,,,,,,,,,,,,,,,,,,,,,,COMPLETE,0.0,,,,,,,,,,,,,,,,,,,,
8,8,0.6443959186733776,2023-08-23 16:27:55.642318,2023-08-23 16:28:04.376578,0 days 00:00:08.734260,,,,,RandomForestClassifier,,,,,,,,,,,,,,,,,,,,,,,,54.0,6.0,,,,,,COMPLETE,0.0,,,,,,,,,,,,,,,,,,,,
9,9,0.594249657981091,2023-08-23 16:27:55.862920,2023-08-23 16:28:01.659930,0 days 00:00:05.797010,5.712055406770849e-07,,,dart,XGBoost,0.9273304160795992,,,0.0021293305385734064,,9.510139213140617e-07,lossguide,0.0003121663342730188,,,5.0,,9.0,,,,,,,,forest,,0.00025528947107729465,,,uniform,0.05911409011698942,0.9903700706180036,,,COMPLETE,0.0,,,,,,,,,,,,,,,,,,,,
10,10,0.6600289810733877,2023-08-23 16:27:57.344887,2023-08-23 16:28:09.385117,0 days 00:00:12.040230,,,,,RandomForestClassifier,,,,,,,,,,,,,,,,,,,,,,,,53.0,11.0,,,,,,COMPLETE,0.0,,,,,,,,,,,,,,,,,,,,
11,11,0.46769727621203616,2023-08-23 16:27:57.873880,2023-08-23 16:28:48.940375,0 days 00:00:51.066495,,,,,SVC,,,,,,,,,,,,,,,,,,,,,,,,,,,,,1.7911314750919816,rbf,COMPLETE,0.0,,,,,,,,,,,,,,,,,,,,
12,12,0.5698864971986245,2023-08-23 16:28:01.780776,2023-08-23 16:28:03.172273,0 days 00:00:01.391497,,,,,DecisionTreeClassifier,,gini,29.0,,,,,,,,,,,,,,,,,,,,,,,,,,,,COMPLETE,0.0,,,,,,,,,,,,,,,,,,,,
13,13,0.3358178053830228,2023-08-23 16:28:03.320918,2023-08-23 16:28:37.719008,0 days 00:00:34.398090,,,,,SVC,,,,,,,,,,,,,,,,,,,,,,,,,,,,,0.012809200975503289,linear,COMPLETE,0.0,,,,,,,,,,,,,,,,,,,,
14,14,0.6380747702797585,2023-08-23 16:28:04.475483,2023-08-23 16:28:06.873901,0 days 00:00:02.398418,,0.4,2.0,,LightGBM,,,,,0.8,,,,1.0679323772595428e-05,5.7589012094062325e-08,,90.0,,,,,,,,,,69.0,,,,,,,,,COMPLETE,0.0,,,,,,,,,,,,,,,,,,,,
15,15,0.5803009064573403,2023-08-23 16:28:07.005479,2023-08-23 16:32:43.716089,0 days 00:04:36.710610,,,,,MLPClassifier,,,,,,,,,,,,,,tanh,adam,1.0,100.0,,,,,,,,,,,,,,COMPLETE,0.0,,,,,,,,,,,,,,,,,,,,
16,16,0.6125663815165168,2023-08-23 16:28:09.461000,2023-08-23 16:28:10.200891,0 days 00:00:00.739891,,,,,DecisionTreeClassifier,,log_loss,4.0,,,,,,,,,,,,,,,,,,,,,,,,,,,,COMPLETE,0.0,,,,,,,,,,,,,,,,,,,,
17,17,0.6172624977210575,2023-08-23 16:28:10.338378,2023-08-23 16:28:15.091266,0 days 00:00:04.752888,,,,,RandomForestClassifier,,,,,,,,,,,,,,,,,,,,,,,,14.0,31.0,,,,,,COMPLETE,0.0,,,,,,,,,,,,,,,,,,,,
18,18,0.42398885103422296,2023-08-23 16:28:13.322289,2023-08-23 16:30:59.532339,0 days 00:02:46.210050,,,,,MLPClassifier,,,,,,,,,,,,,,tanh,sgd,1.0,80.0,,,,,,,,,,,,,,COMPLETE,0.0,,,,,,,,,,,,,,,,,,,,
19,19,0.6484422706596483,2023-08-23 16:28:13.612012,2023-08-23 16:28:20.899098,0 days 00:00:07.287086,,,,,RandomForestClassifier,,,,,,,,,,,,,,,,,,,,,,,,24.0,16.0,,,,,,COMPLETE,0.0,,,,,,,,,,,,,,,,,,,,
20,20,0.6340008130608579,2023-08-23 16:28:15.228671,2023-08-23 16:43:02.500707,0 days 00:14:47.272036,,,,,MLPClassifier,,,,,,,,,,,,,,tanh,adam,2.0,20.0,50.0,,,,,,,,,,,,,COMPLETE,0.0,,,,,,,,,,,,,,,,,,,,
21,21,0.6384118242295369,2023-08-23 16:28:21.004959,2023-08-23 16:29:49.180931,0 days 00:01:28.175972,,,,,MLPClassifier,,,,,,,,,,,,,,relu,lbfgs,2.0,10.0,10.0,,,,,,,,,,,,,COMPLETE,0.0,,,,,,,,,,,,,,,,,,,,
22,22,0.5669816113166382,2023-08-23 16:28:37.826131,2023-08-23 16:43:15.994771,0 days 00:14:38.168640,,,,,MLPClassifier,,,,,,,,,,,,,,identity,adam,4.0,80.0,90.0,80.0,40.0,,,,,,,,,,,COMPLETE,0.0,,,,,,,,,,,,,,,,,,,,
23,23,0.6070028975565945,2023-08-23 16:28:43.376543,2023-08-23 16:28:52.924560,0 days 00:00:09.548017,,,,,RandomForestClassifier,,,,,,,,,,,,,,,,,,,,,,,,98.0,3.0,,,,,,COMPLETE,0.0,,,,,,,,,,,,,,,,,,,,
24,24,0.5898031183947038,2023-08-23 16:28:49.017952,2023-08-23 16:28:56.659337,0 days 00:00:07.641385,,,,,RandomForestClassifier,,,,,,,,,,,,,,,,,,,,,,,,98.0,2.0,,,,,,COMPLETE,0.0,,,,,,,,,,,,,,,,,,,,
25,25,0.5610637535315038,2023-08-23 16:28:53.021428,2023-08-23 16:34:21.690924,0 days 00:05:28.669496,,,,,MLPClassifier,,,,,,,,,,,,,,logistic,adam,1.0,90.0,,,,,,,,,,,,,,COMPLETE,0.0,,,,,,,,,,,,,,,,,,,,
26,26,0.5775931144671661,2023-08-23 16:28:56.801980,2023-08-23 16:29:04.168989,0 days 00:00:07.367009,,,,,MLPClassifier,,,,,,,,,,,,,,identity,lbfgs,1.0,100.0,,,,,,,,,,,,,,COMPLETE,0.0,,,,,,,,,,,,,,,,,,,,
27,27,0.42261744668673296,2023-08-23 16:29:04.277428,2023-08-23 16:29:05.173587,0 days 00:00:00.896159,0.8273535278474017,,,gbtree,XGBoost,0.23552389613868996,,,1.6063132268674406e-08,,0.18861808721593643,depthwise,1.0086679520430762e-08,,,9.0,,3.0,,,,,,,,,,,,,,,0.20502097607138003,,,COMPLETE,0.0,,,,,,,,,,,,,,,,,,,,
28,28,0.6578876503417705,2023-08-23 16:29:05.293294,2023-08-23 16:29:19.627533,0 days 00:00:14.334239,,,,,RandomForestClassifier,,,,,,,,,,,,,,,,,,,,,,,,50.0,13.0,,,,,,COMPLETE,0.0,,,,,,,,,,,,,,,,,,,,
29,29,0.6539358447172753,2023-08-23 16:29:19.759831,2023-08-23 16:29:31.100113,0 days 00:00:11.340282,,,,,RandomForestClassifier,,,,,,,,,,,,,,,,,,,,,,,,52.0,12.0,,,,,,COMPLETE,0.0,,,,,,,,,,,,,,,,,,,,
30,30,0.6474410038710716,2023-08-23 16:29:31.140370,2023-08-23 16:29:39.433409,0 days 00:00:08.293039,,,,,RandomForestClassifier,,,,,,,,,,,,,,,,,,,,,,,,42.0,9.0,,,,,,COMPLETE,0.0,,,,,,,,,,,,,,,,,,,,
31,31,0.6569175968761253,2023-08-23 16:29:38.802630,2023-08-23 16:29:49.178609,0 days 00:00:10.375979,,,,,RandomForestClassifier,,,,,,,,,,,,,,,,,,,,,,,,46.0,9.0,,,,,,COMPLETE,0.0,,,,,,,,,,,,,,,,,,,,
32,32,0.661721659288536,2023-08-23 16:29:39.534738,2023-08-23 16:29:49.352714,0 days 00:00:09.817976,,,,,RandomForestClassifier,,,,,,,,,,,,,,,,,,,,,,,,44.0,9.0,,,,,,COMPLETE,0.0,,,,,,,,,,,,,,,,,,,,
33,33,0.6340476530802978,2023-08-23 16:29:49.293405,2023-08-23 16:29:54.569912,0 days 00:00:05.276507,,,,,RandomForestClassifier,,,,,,,,,,,,,,,,,,,,,,,,37.0,6.0,,,,,,COMPLETE,0.0,,,,,,,,,,,,,,,,,,,,
34,34,0.660490387008617,2023-08-23 16:29:49.311923,2023-08-23 16:29:55.786099,0 days 00:00:06.474176,,,,,RandomForestClassifier,,,,,,,,,,,,,,,,,,,,,,,,37.0,7.0,,,,,,COMPLETE,0.0,,,,,,,,,,,,,,,,,,,,
35,35,0.6509195703473183,2023-08-23 16:29:49.423836,2023-08-23 16:30:01.987882,0 days 00:00:12.564046,,,,,RandomForestClassifier,,,,,,,,,,,,,,,,,,,,,,,,77.0,6.0,,,,,,COMPLETE,0.0,,,,,,,,,,,,,,,,,,,,
36,36,0.33707800273347044,2023-08-23 16:29:54.647082,2023-08-23 16:30:35.910605,0 days 00:00:41.263523,,,,,SVC,,,,,,,,,,,,,,,,,,,,,,,,,,,,,966.4241066532848,poly,COMPLETE,0.0,,,,,,,,,,,,,,,,,,,,
37,37,0.3358178053830228,2023-08-23 16:29:55.903789,2023-08-23 16:29:56.412985,0 days 00:00:00.509196,4.12213573433071e-08,,,gblinear,XGBoost,0.9872224083614938,,,,,,,0.38309715022986085,,,,,,,,,,,,,,,,,,,,0.595629620066634,,,COMPLETE,0.0,,,,,,,,,,,,,,,,,,,,
38,38,0.6525236940280335,2023-08-23 16:29:56.549176,2023-08-23 16:30:04.010153,0 days 00:00:07.460977,,,,,RandomForestClassifier,,,,,,,,,,,,,,,,,,,,,,,,34.0,8.0,,,,,,COMPLETE,0.0,,,,,,,,,,,,,,,,,,,,
39,39,0.6526446354851778,2023-08-23 16:30:02.083294,2023-08-23 16:30:10.443152,0 days 00:00:08.359858,,,,,RandomForestClassifier,,,,,,,,,,,,,,,,,,,,,,,,32.0,9.0,,,,,,COMPLETE,0.0,,,,,,,,,,,,,,,,,,,,
40,40,0.3358178053830228,2023-08-23 16:30:04.158375,2023-08-23 16:30:46.290160,0 days 00:00:42.131785,,,,,SVC,,,,,,,,,,,,,,,,,,,,,,,,,,,,,644.7813048731371,poly,COMPLETE,0.0,,,,,,,,,,,,,,,,,,,,
41,41,0.6406117413744437,2023-08-23 16:30:10.527630,2023-08-23 16:30:17.167287,0 days 00:00:06.639657,,1.0,3.0,,LightGBM,,,,,0.4,,,,2.9273000726953854e-08,0.5770280365254145,,20.0,,,,,,,,,,253.0,,,,,,,,,COMPLETE,0.0,,,,,,,,,,,,,,,,,,,,
42,42,0.3358178053830228,2023-08-23 16:30:17.325126,2023-08-23 16:30:54.746938,0 days 00:00:37.421812,,,,,SVC,,,,,,,,,,,,,,,,,,,,,,,,,,,,,465.5290787337236,poly,COMPLETE,0.0,,,,,,,,,,,,,,,,,,,,
43,43,0.671189398607209,2023-08-23 16:30:35.988813,2023-08-23 16:30:53.199985,0 days 00:00:17.211172,,,,,RandomForestClassifier,,,,,,,,,,,,,,,,,,,,,,,,67.0,12.0,,,,,,COMPLETE,0.0,,,,,,,,,,,,,,,,,,,,
44,44,0.6588175740679812,2023-08-23 16:30:46.399025,2023-08-23 16:31:02.256858,0 days 00:00:15.857833,,,,,RandomForestClassifier,,,,,,,,,,,,,,,,,,,,,,,,71.0,12.0,,,,,,COMPLETE,0.0,,,,,,,,,,,,,,,,,,,,
45,45,0.6343965087146693,2023-08-23 16:30:53.288734,2023-08-23 16:31:03.572827,0 days 00:00:10.284093,,,,,RandomForestClassifier,,,,,,,,,,,,,,,,,,,,,,,,75.0,5.0,,,,,,COMPLETE,0.0,,,,,,,,,,,,,,,,,,,,
46,46,0.6265737853497694,2023-08-23 16:30:54.811528,2023-08-23 16:31:04.141266,0 days 00:00:09.329738,,,,,RandomForestClassifier,,,,,,,,,,,,,,,,,,,,,,,,72.0,5.0,,,,,,COMPLETE,0.0,,,,,,,,,,,,,,,,,,,,
47,47,0.6293406263805594,2023-08-23 16:30:59.617171,2023-08-23 16:31:09.986380,0 days 00:00:10.369209,,,,,RandomForestClassifier,,,,,,,,,,,,,,,,,,,,,,,,73.0,5.0,,,,,,COMPLETE,0.0,,,,,,,,,,,,,,,,,,,,
48,48,0.6632747726530482,2023-08-23 16:31:02.339308,2023-08-23 16:31:20.790644,0 days 00:00:18.451336,,,,,RandomForestClassifier,,,,,,,,,,,,,,,,,,,,,,,,74.0,11.0,,,,,,COMPLETE,0.0,,,,,,,,,,,,,,,,,,,,
49,49,0.659870118732995,2023-08-23 16:31:03.644864,2023-08-23 16:31:23.558000,0 days 00:00:19.913136,,,,,RandomForestClassifier,,,,,,,,,,,,,,,,,,,,,,,,78.0,11.0,,,,,,COMPLETE,0.0,,,,,,,,,,,,,,,,,,,,
50,50,0.6607267431461428,2023-08-23 16:31:04.207298,2023-08-23 16:31:21.017943,0 days 00:00:16.810645,,,,,RandomForestClassifier,,,,,,,,,,,,,,,,,,,,,,,,65.0,11.0,,,,,,COMPLETE,0.0,,,,,,,,,,,,,,,,,,,,
51,51,0.6576200482710044,2023-08-23 16:31:10.079594,2023-08-23 16:31:25.996943,0 days 00:00:15.917349,,,,,RandomForestClassifier,,,,,,,,,,,,,,,,,,,,,,,,63.0,11.0,,,,,,COMPLETE,0.0,,,,,,,,,,,,,,,,,,,,
52,52,0.6690325552024436,2023-08-23 16:31:20.891211,2023-08-23 16:31:38.785315,0 days 00:00:17.894104,,,,,RandomForestClassifier,,,,,,,,,,,,,,,,,,,,,,,,66.0,11.0,,,,,,COMPLETE,0.0,,,,,,,,,,,,,,,,,,,,
53,53,0.6487954332591015,2023-08-23 16:31:21.098092,2023-08-23 16:31:27.092449,0 days 00:00:05.994357,,0.9,1.0,,LightGBM,,,,,0.4,,,,0.9312318247731347,1.1567754340637085e-08,,10.0,,,,,,,,,,202.0,,,,,,,,,COMPLETE,0.0,,,,,,,,,,,,,,,,,,,,
54,54,0.6488786058722258,2023-08-23 16:31:23.664279,2023-08-23 16:31:30.238701,0 days 00:00:06.574422,,0.9,3.0,,LightGBM,,,,,0.4,,,,0.05391780117996269,1.0563306057489544e-08,,10.0,,,,,,,,,,200.0,,,,,,,,,COMPLETE,0.0,,,,,,,,,,,,,,,,,,,,
55,55,0.6512521742383153,2023-08-23 16:31:26.101248,2023-08-23 16:31:32.453045,0 days 00:00:06.351797,,0.9,1.0,,LightGBM,,,,,0.4,,,,0.022432407063131144,1.2137903882182973e-08,,10.0,,,,,,,,,,203.0,,,,,,,,,COMPLETE,0.0,,,,,,,,,,,,,,,,,,,,
56,56,0.46275740568146295,2023-08-23 16:31:27.187089,2023-08-23 16:31:27.709515,0 days 00:00:00.522426,,,,,DecisionTreeClassifier,,entropy,2.0,,,,,,,,,,,,,,,,,,,,,,,,,,,,COMPLETE,0.0,,,,,,,,,,,,,,,,,,,,
57,57,0.6083807205984446,2023-08-23 16:31:27.882456,2023-08-23 16:31:28.778483,0 days 00:00:00.896027,0.0017975725347409667,,,gbtree,XGBoost,0.5118298362245957,,,0.28632966263666015,,1.1242318984816347e-08,depthwise,1.4494010302334074e-08,,,3.0,,10.0,,,,,,,,,,,,,,,0.2075790666537609,,,COMPLETE,0.0,,,,,,,,,,,,,,,,,,,,
58,58,0.6588266338665592,2023-08-23 16:31:28.918992,2023-08-23 16:31:47.325400,0 days 00:00:18.406408,,,,,RandomForestClassifier,,,,,,,,,,,,,,,,,,,,,,,,86.0,8.0,,,,,,COMPLETE,0.0,,,,,,,,,,,,,,,,,,,,
59,59,0.6581483354196069,2023-08-23 16:31:30.338682,2023-08-23 16:31:48.471262,0 days 00:00:18.132580,,,,,RandomForestClassifier,,,,,,,,,,,,,,,,,,,,,,,,87.0,8.0,,,,,,COMPLETE,0.0,,,,,,,,,,,,,,,,,,,,
60,60,0.6490971951319884,2023-08-23 16:31:32.582040,2023-08-23 16:31:46.370409,0 days 00:00:13.788369,,,,,RandomForestClassifier,,,,,,,,,,,,,,,,,,,,,,,,63.0,8.0,,,,,,COMPLETE,0.0,,,,,,,,,,,,,,,,,,,,
61,61,0.6556253500898717,2023-08-23 16:31:38.884364,2023-08-23 16:31:52.443003,0 days 00:00:13.558639,,,,,RandomForestClassifier,,,,,,,,,,,,,,,,,,,,,,,,65.0,8.0,,,,,,COMPLETE,0.0,,,,,,,,,,,,,,,,,,,,
62,62,0.6667331902620391,2023-08-23 16:31:46.450039,2023-08-23 16:32:05.258947,0 days 00:00:18.808908,,,,,RandomForestClassifier,,,,,,,,,,,,,,,,,,,,,,,,84.0,10.0,,,,,,COMPLETE,0.0,,,,,,,,,,,,,,,,,,,,
63,63,0.6593935301008419,2023-08-23 16:31:47.421173,2023-08-23 16:32:05.533989,0 days 00:00:18.112816,,,,,RandomForestClassifier,,,,,,,,,,,,,,,,,,,,,,,,84.0,10.0,,,,,,COMPLETE,0.0,,,,,,,,,,,,,,,,,,,,
64,64,0.46275740568146295,2023-08-23 16:31:48.539124,2023-08-23 16:31:49.031208,0 days 00:00:00.492084,,,,,DecisionTreeClassifier,,log_loss,2.0,,,,,,,,,,,,,,,,,,,,,,,,,,,,COMPLETE,0.0,,,,,,,,,,,,,,,,,,,,
65,65,0.3308302044221944,2023-08-23 16:31:49.196890,2023-08-23 16:32:26.870436,0 days 00:00:37.673546,,,,,MLPClassifier,,,,,,,,,,,,,,logistic,adam,4.0,10.0,100.0,10.0,80.0,,,,,,,,,,,COMPLETE,0.0,,,,,,,,,,,,,,,,,,,,
66,66,0.3308302044221944,2023-08-23 16:31:52.551356,2023-08-23 16:32:51.051548,0 days 00:00:58.500192,,,,,MLPClassifier,,,,,,,,,,,,,,logistic,adam,4.0,10.0,100.0,10.0,100.0,,,,,,,,,,,COMPLETE,0.0,,,,,,,,,,,,,,,,,,,,
67,67,0.3437362292388649,2023-08-23 16:32:05.341677,2023-08-23 16:32:25.893342,0 days 00:00:20.551665,,,,,MLPClassifier,,,,,,,,,,,,,,logistic,adam,4.0,10.0,100.0,10.0,40.0,,,,,,,,,,,COMPLETE,0.0,,,,,,,,,,,,,,,,,,,,
68,68,0.3358178053830228,2023-08-23 16:32:05.617648,2023-08-23 16:32:52.110799,0 days 00:00:46.493151,,,,,MLPClassifier,,,,,,,,,,,,,,logistic,adam,4.0,10.0,100.0,10.0,70.0,,,,,,,,,,,COMPLETE,0.0,,,,,,,,,,,,,,,,,,,,
69,69,0.6532114809274494,2023-08-23 16:32:25.964240,2023-08-23 16:32:44.325773,0 days 00:00:18.361533,,,,,RandomForestClassifier,,,,,,,,,,,,,,,,,,,,,,,,68.0,14.0,,,,,,COMPLETE,0.0,,,,,,,,,,,,,,,,,,,,
70,70,0.6706270534472976,2023-08-23 16:32:26.945521,2023-08-23 16:32:46.059043,0 days 00:00:19.113522,,,,,RandomForestClassifier,,,,,,,,,,,,,,,,,,,,,,,,70.0,14.0,,,,,,COMPLETE,0.0,,,,,,,,,,,,,,,,,,,,
71,71,0.6504199976997109,2023-08-23 16:32:43.816998,2023-08-23 16:33:01.873342,0 days 00:00:18.056344,,,,,RandomForestClassifier,,,,,,,,,,,,,,,,,,,,,,,,67.0,14.0,,,,,,COMPLETE,0.0,,,,,,,,,,,,,,,,,,,,
72,72,0.6517420149527172,2023-08-23 16:32:44.397054,2023-08-23 16:33:01.390869,0 days 00:00:16.993815,,,,,RandomForestClassifier,,,,,,,,,,,,,,,,,,,,,,,,61.0,18.0,,,,,,COMPLETE,0.0,,,,,,,,,,,,,,,,,,,,
73,73,0.6542887877276129,2023-08-23 16:32:46.155926,2023-08-23 16:33:02.058538,0 days 00:00:15.902612,,,,,RandomForestClassifier,,,,,,,,,,,,,,,,,,,,,,,,58.0,15.0,,,,,,COMPLETE,0.0,,,,,,,,,,,,,,,,,,,,
74,74,0.6534231936286554,2023-08-23 16:32:51.189326,2023-08-23 16:33:06.075380,0 days 00:00:14.886054,,,,,RandomForestClassifier,,,,,,,,,,,,,,,,,,,,,,,,58.0,14.0,,,,,,COMPLETE,0.0,,,,,,,,,,,,,,,,,,,,
75,75,0.6618980548006584,2023-08-23 16:32:52.185051,2023-08-23 16:33:07.193459,0 days 00:00:15.008408,,,,,RandomForestClassifier,,,,,,,,,,,,,,,,,,,,,,,,59.0,15.0,,,,,,COMPLETE,0.0,,,,,,,,,,,,,,,,,,,,
76,76,0.6595143208513177,2023-08-23 16:33:01.492475,2023-08-23 16:33:16.802504,0 days 00:00:15.310029,,,,,RandomForestClassifier,,,,,,,,,,,,,,,,,,,,,,,,57.0,14.0,,,,,,COMPLETE,0.0,,,,,,,,,,,,,,,,,,,,
77,77,0.6508618266408468,2023-08-23 16:33:01.961860,2023-08-23 16:33:17.832503,0 days 00:00:15.870643,,,,,RandomForestClassifier,,,,,,,,,,,,,,,,,,,,,,,,58.0,16.0,,,,,,COMPLETE,0.0,,,,,,,,,,,,,,,,,,,,
78,78,0.6656477991097084,2023-08-23 16:33:02.173888,2023-08-23 16:33:20.837614,0 days 00:00:18.663726,,,,,RandomForestClassifier,,,,,,,,,,,,,,,,,,,,,,,,82.0,10.0,,,,,,COMPLETE,0.0,,,,,,,,,,,,,,,,,,,,
79,79,0.66491256505844,2023-08-23 16:33:06.153356,2023-08-23 16:33:24.321396,0 days 00:00:18.168040,,,,,RandomForestClassifier,,,,,,,,,,,,,,,,,,,,,,,,80.0,10.0,,,,,,COMPLETE,0.0,,,,,,,,,,,,,,,,,,,,
80,80,0.6567981908141337,2023-08-23 16:33:07.292326,2023-08-23 16:33:30.727574,0 days 00:00:23.435248,,,,,RandomForestClassifier,,,,,,,,,,,,,,,,,,,,,,,,82.0,18.0,,,,,,COMPLETE,0.0,,,,,,,,,,,,,,,,,,,,
81,81,0.6484184744030763,2023-08-23 16:33:16.888996,2023-08-23 16:33:35.851656,0 days 00:00:18.962660,,,,,RandomForestClassifier,,,,,,,,,,,,,,,,,,,,,,,,68.0,19.0,,,,,,COMPLETE,0.0,,,,,,,,,,,,,,,,,,,,
82,82,0.6633059112022365,2023-08-23 16:33:17.926268,2023-08-23 16:33:40.354388,0 days 00:00:22.428120,,,,,RandomForestClassifier,,,,,,,,,,,,,,,,,,,,,,,,80.0,19.0,,,,,,COMPLETE,0.0,,,,,,,,,,,,,,,,,,,,
83,83,0.6448131408693928,2023-08-23 16:33:20.926330,2023-08-23 16:33:22.375938,0 days 00:00:01.449608,5.8733709709750083e-05,,,dart,XGBoost,0.6667112672132461,,,2.9478767034320724e-07,,0.012468485777564353,lossguide,0.3911026953326358,,,9.0,,2.0,,,,,,,,tree,,1.6364918015350267e-08,,,weighted,3.607364193856072e-08,0.9606940162779051,,,COMPLETE,0.0,,,,,,,,,,,,,,,,,,,,
84,84,0.6546231861444842,2023-08-23 16:33:22.498884,2023-08-23 16:33:47.125514,0 days 00:00:24.626630,,,,,RandomForestClassifier,,,,,,,,,,,,,,,,,,,,,,,,91.0,17.0,,,,,,COMPLETE,0.0,,,,,,,,,,,,,,,,,,,,
85,85,0.6494272320698522,2023-08-23 16:33:24.480133,2023-08-23 16:33:46.255031,0 days 00:00:21.774898,,,,,RandomForestClassifier,,,,,,,,,,,,,,,,,,,,,,,,81.0,18.0,,,,,,COMPLETE,0.0,,,,,,,,,,,,,,,,,,,,
86,86,0.5808390236119199,2023-08-23 16:33:30.800380,2023-08-23 16:33:31.916364,0 days 00:00:01.115984,,,,,DecisionTreeClassifier,,gini,26.0,,,,,,,,,,,,,,,,,,,,,,,,,,,,COMPLETE,0.0,,,,,,,,,,,,,,,,,,,,
87,87,0.6624321196483338,2023-08-23 16:33:32.038902,2023-08-23 16:33:51.060078,0 days 00:00:19.021176,,,,,RandomForestClassifier,,,,,,,,,,,,,,,,,,,,,,,,80.0,12.0,,,,,,COMPLETE,0.0,,,,,,,,,,,,,,,,,,,,
88,88,0.668763868232559,2023-08-23 16:33:35.945896,2023-08-23 16:33:55.047520,0 days 00:00:19.101624,,,,,RandomForestClassifier,,,,,,,,,,,,,,,,,,,,,,,,89.0,10.0,,,,,,COMPLETE,0.0,,,,,,,,,,,,,,,,,,,,
89,89,0.6686886063654089,2023-08-23 16:33:40.432470,2023-08-23 16:34:01.904836,0 days 00:00:21.472366,,,,,RandomForestClassifier,,,,,,,,,,,,,,,,,,,,,,,,90.0,12.0,,,,,,COMPLETE,0.0,,,,,,,,,,,,,,,,,,,,
90,90,0.6625573076124083,2023-08-23 16:33:46.394684,2023-08-23 16:34:10.743041,0 days 00:00:24.348357,,,,,RandomForestClassifier,,,,,,,,,,,,,,,,,,,,,,,,93.0,13.0,,,,,,COMPLETE,0.0,,,,,,,,,,,,,,,,,,,,
91,91,0.3358178053830228,2023-08-23 16:33:47.229031,2023-08-23 16:34:27.094961,0 days 00:00:39.865930,,,,,SVC,,,,,,,,,,,,,,,,,,,,,,,,,,,,,0.001052195782768073,linear,COMPLETE,0.0,,,,,,,,,,,,,,,,,,,,
92,92,0.3358178053830228,2023-08-23 16:33:51.156789,2023-08-23 16:34:55.137213,0 days 00:01:03.980424,,,,,SVC,,,,,,,,,,,,,,,,,,,,,,,,,,,,,0.003254946758142324,rbf,COMPLETE,0.0,,,,,,,,,,,,,,,,,,,,
93,93,0.3358178053830228,2023-08-23 16:33:55.196997,2023-08-23 16:34:41.482820,0 days 00:00:46.285823,,,,,SVC,,,,,,,,,,,,,,,,,,,,,,,,,,,,,0.008511378531289238,linear,COMPLETE,0.0,,,,,,,,,,,,,,,,,,,,
94,94,0.3358178053830228,2023-08-23 16:34:02.031732,2023-08-23 16:34:48.065818,0 days 00:00:46.034086,,,,,SVC,,,,,,,,,,,,,,,,,,,,,,,,,,,,,0.006920368853463897,linear,COMPLETE,0.0,,,,,,,,,,,,,,,,,,,,
