,number,value,datetime_start,datetime_complete,duration,params_alpha,params_bagging_fraction,params_bagging_freq,params_booster,params_classifier,params_colsample_bytree,params_dct_criterion,params_dct_max_depth,params_eta,params_feature_fraction,params_gamma,params_grow_policy,params_lambda,params_lambda_l1,params_lambda_l2,params_max_depth,params_min_child_samples,params_min_child_weight,params_mlp_activation,params_mlp_solver,params_n_layers,params_n_units_l_0,params_n_units_l_1,params_n_units_l_2,params_n_units_l_3,params_normalize_type,params_num_leaves,params_rate_drop,params_rf_estimator,params_rf_max_depth,params_sample_type,params_skip_drop,params_subsample,params_svc_c,params_svc_kernel,state,best_trial,dev_acc,dev_recall_macro,dev_precision_macro,dev_f1_macro,dev_recall_0,dev_precision_0,dev_f1_0,dev_recall_1,dev_precision_1,dev_f1_1,test_acc,test_recall_macro,test_precision_macro,test_f1_macro,test_recall_0,test_precision_0,test_f1_0,test_recall_1,test_precision_1,test_f1_1
83,83,0.7961614173228346,2023-08-23 19:00:58.000793,2023-08-23 19:00:59.443912,0 days 00:00:01.443119,,0.8,3.0,,LightGBM,,,,,0.4,,,,0.0019256778028311043,0.0035549459309630552,,100.0,,,,,,,,,,29.0,,,,,,,,,COMPLETE,0.0,,,,,,,,,,,,,,,,,,,,
84,84,0.3357921744708146,2023-08-23 19:00:58.218924,2023-08-23 19:01:13.621781,0 days 00:00:15.402857,,,,,MLPClassifier,,,,,,,,,,,,,,relu,adam,3.0,60.0,10.0,60.0,,,,,,,,,,,,COMPLETE,0.0,,,,,,,,,,,,,,,,,,,,
85,85,0.3357921744708146,2023-08-23 19:00:59.544674,2023-08-23 19:01:15.209241,0 days 00:00:15.664567,,,,,MLPClassifier,,,,,,,,,,,,,,relu,adam,3.0,60.0,10.0,50.0,,,,,,,,,,,,COMPLETE,0.0,,,,,,,,,,,,,,,,,,,,
86,86,0.7979898817357862,2023-08-23 19:01:13.724203,2023-08-23 19:01:14.803052,0 days 00:00:01.078849,,0.8,3.0,,LightGBM,,,,,0.5,,,,0.001424807963073977,0.0033265457698664325,,90.0,,,,,,,,,,7.0,,,,,,,,,COMPLETE,0.0,,,,,,,,,,,,,,,,,,,,
87,87,0.7926167696161261,2023-08-23 19:01:14.871052,2023-08-23 19:01:15.539571,0 days 00:00:00.668519,,0.8,3.0,,LightGBM,,,,,0.5,,,,0.0018478825283512299,0.004268620477440596,,90.0,,,,,,,,,,6.0,,,,,,,,,COMPLETE,0.0,,,,,,,,,,,,,,,,,,,,
88,88,0.7974888825877577,2023-08-23 19:01:15.292154,2023-08-23 19:01:15.906574,0 days 00:00:00.614420,,0.8,3.0,,LightGBM,,,,,0.5,,,,0.0014773607234589393,0.0038938917377679895,,100.0,,,,,,,,,,4.0,,,,,,,,,COMPLETE,0.0,,,,,,,,,,,,,,,,,,,,
89,89,0.7907347083459642,2023-08-23 19:01:15.636388,2023-08-23 19:01:16.627543,0 days 00:00:00.991155,,0.9,3.0,,LightGBM,,,,,0.4,,,,0.0015598393329625745,0.005830669587399897,,100.0,,,,,,,,,,14.0,,,,,,,,,COMPLETE,0.0,,,,,,,,,,,,,,,,,,,,
90,90,0.7965222424091791,2023-08-23 19:01:15.977137,2023-08-23 19:01:17.123033,0 days 00:00:01.145896,,0.8,3.0,,LightGBM,,,,,0.5,,,,0.0012167364953539928,0.0033589512333340207,,100.0,,,,,,,,,,14.0,,,,,,,,,COMPLETE,0.0,,,,,,,,,,,,,,,,,,,,
91,91,0.7869542854143705,2023-08-23 19:01:16.705773,2023-08-23 19:01:18.179627,0 days 00:00:01.473854,,0.8,3.0,,LightGBM,,,,,0.5,,,,0.00146786161850328,0.0030653425864555937,,100.0,,,,,,,,,,34.0,,,,,,,,,COMPLETE,0.0,,,,,,,,,,,,,,,,,,,,
92,92,0.7903122404606153,2023-08-23 19:01:17.208893,2023-08-23 19:01:17.984636,0 days 00:00:00.775743,,0.8,3.0,,LightGBM,,,,,0.5,,,,0.0010166746696170508,0.0030068065629849944,,90.0,,,,,,,,,,24.0,,,,,,,,,COMPLETE,0.0,,,,,,,,,,,,,,,,,,,,
93,93,0.7928102177610299,2023-08-23 19:01:18.067499,2023-08-23 19:01:19.094687,0 days 00:00:01.027188,,0.7000000000000001,3.0,,LightGBM,,,,,0.7000000000000001,,,,0.004127763514928268,0.0024460431119325793,,100.0,,,,,,,,,,27.0,,,,,,,,,COMPLETE,0.0,,,,,,,,,,,,,,,,,,,,
94,94,0.7937263024815113,2023-08-23 19:01:18.287329,2023-08-23 19:01:19.597148,0 days 00:00:01.309819,,0.7000000000000001,3.0,,LightGBM,,,,,0.7000000000000001,,,,0.0004016826478507902,0.009854055239842799,,100.0,,,,,,,,,,36.0,,,,,,,,,COMPLETE,0.0,,,,,,,,,,,,,,,,,,,,
95,95,0.7898528665651953,2023-08-23 19:01:19.173041,2023-08-23 19:01:20.683906,0 days 00:00:01.510865,,0.9,3.0,,LightGBM,,,,,0.5,,,,0.00039743150762841826,0.0010632591446045343,,60.0,,,,,,,,,,41.0,,,,,,,,,COMPLETE,0.0,,,,,,,,,,,,,,,,,,,,
96,96,0.7873811888211094,2023-08-23 19:01:19.672955,2023-08-23 19:01:21.499281,0 days 00:00:01.826326,,0.9,3.0,,LightGBM,,,,,0.5,,,,0.004410521544443449,0.0012830505460869434,,60.0,,,,,,,,,,52.0,,,,,,,,,COMPLETE,0.0,,,,,,,,,,,,,,,,,,,,
97,97,0.7778499902197711,2023-08-23 19:01:20.811555,2023-08-23 19:01:21.077817,0 days 00:00:00.266262,,0.9,3.0,,LightGBM,,,,,0.6000000000000001,,,,0.006497343948712014,0.014508870710810393,,80.0,,,,,,,,,,2.0,,,,,,,,,COMPLETE,0.0,,,,,,,,,,,,,,,,,,,,
98,98,0.7947085452604479,2023-08-23 19:01:21.204654,2023-08-23 19:01:22.265492,0 days 00:00:01.060838,,0.8,3.0,,LightGBM,,,,,0.4,,,,0.007046898056236328,0.0005488135300815743,,100.0,,,,,,,,,,17.0,,,,,,,,,COMPLETE,0.0,,,,,,,,,,,,,,,,,,,,
99,99,0.7947085452604479,2023-08-23 19:01:21.572742,2023-08-23 19:01:22.732880,0 days 00:00:01.160138,,0.8,3.0,,LightGBM,,,,,0.4,,,,3.4106602988969935e-05,0.0004923406142285714,,100.0,,,,,,,,,,18.0,,,,,,,,,COMPLETE,0.0,,,,,,,,,,,,,,,,,,,,
100,100,0.7946455131383243,2023-08-23 19:01:22.330454,2023-08-23 19:01:23.162951,0 days 00:00:00.832497,,0.8,3.0,,LightGBM,,,,,0.4,,,,0.00046275600793214885,0.024027647401497258,,90.0,,,,,,,,,,12.0,,,,,,,,,COMPLETE,0.0,,,,,,,,,,,,,,,,,,,,
101,101,0.8009114768052206,2023-08-23 19:01:22.816744,2023-08-23 19:01:23.551385,0 days 00:00:00.734641,,0.7000000000000001,3.0,,LightGBM,,,,,0.5,,,,0.0006231340569511729,2.512557814661827e-05,,90.0,,,,,,,,,,11.0,,,,,,,,,COMPLETE,0.0,,,,,,,,,,,,,,,,,,,,
102,102,0.7932300589339634,2023-08-23 19:01:23.226606,2023-08-23 19:01:24.430211,0 days 00:00:01.203605,,0.7000000000000001,3.0,,LightGBM,,,,,0.5,,,,0.000666314053986677,5.186083596194558e-06,,100.0,,,,,,,,,,137.0,,,,,,,,,COMPLETE,0.0,,,,,,,,,,,,,,,,,,,,
103,103,0.7454114461463247,2023-08-23 19:01:23.640824,2023-08-23 19:01:23.703948,0 days 00:00:00.063124,,,,,DecisionTreeClassifier,,gini,4.0,,,,,,,,,,,,,,,,,,,,,,,,,,,,COMPLETE,0.0,,,,,,,,,,,,,,,,,,,,
104,104,0.7927763903923108,2023-08-23 19:01:23.784802,2023-08-23 19:01:25.551810,0 days 00:00:01.767008,,0.7000000000000001,3.0,,LightGBM,,,,,1.0,,,,0.0007365158846766639,5.097438600678497e-05,,90.0,,,,,,,,,,148.0,,,,,,,,,COMPLETE,0.0,,,,,,,,,,,,,,,,,,,,
105,105,0.3357921744708146,2023-08-23 19:01:24.533031,2023-08-23 19:01:24.624001,0 days 00:00:00.090970,0.0011032796832661064,,,gblinear,XGBoost,0.9967190284020863,,,,,,,0.24583081293324285,,,,,,,,,,,,,,,,,,,,0.738409974451794,,,COMPLETE,0.0,,,,,,,,,,,,,,,,,,,,
106,106,0.7888866728482538,2023-08-23 19:01:24.721286,2023-08-23 19:01:26.371696,0 days 00:00:01.650410,,0.8,3.0,,LightGBM,,,,,0.5,,,,0.00015740839826333328,0.03202093357964397,,90.0,,,,,,,,,,47.0,,,,,,,,,COMPLETE,0.0,,,,,,,,,,,,,,,,,,,,
107,107,0.7755391112606047,2023-08-23 19:01:25.648707,2023-08-23 19:01:25.987510,0 days 00:00:00.338803,,0.8,3.0,,LightGBM,,,,,0.5,,,,0.00017298708345683236,0.01871152438419899,,80.0,,,,,,,,,,2.0,,,,,,,,,COMPLETE,0.0,,,,,,,,,,,,,,,,,,,,
108,108,0.7922727603535886,2023-08-23 19:01:26.111415,2023-08-23 19:01:27.762021,0 days 00:00:01.650606,,0.8,3.0,,LightGBM,,,,,0.6000000000000001,,,,2.7154070797192968e-08,1.594652083708405e-07,,100.0,,,,,,,,,,50.0,,,,,,,,,COMPLETE,0.0,,,,,,,,,,,,,,,,,,,,
109,109,0.7975642831831073,2023-08-23 19:01:26.457038,2023-08-23 19:01:27.251365,0 days 00:00:00.794327,,0.7000000000000001,3.0,,LightGBM,,,,,0.6000000000000001,,,,0.003470646860246509,1.614055731982619e-07,,100.0,,,,,,,,,,14.0,,,,,,,,,COMPLETE,0.0,,,,,,,,,,,,,,,,,,,,
110,110,0.7903404139382731,2023-08-23 19:01:27.370005,2023-08-23 19:01:28.713759,0 days 00:00:01.343754,,0.7000000000000001,3.0,,LightGBM,,,,,0.6000000000000001,,,,0.0027971680659736684,1.540551151755246e-07,,100.0,,,,,,,,,,30.0,,,,,,,,,COMPLETE,0.0,,,,,,,,,,,,,,,,,,,,
111,111,0.7946924556314809,2023-08-23 19:01:27.859432,2023-08-23 19:01:28.904533,0 days 00:00:01.045101,,0.7000000000000001,3.0,,LightGBM,,,,,0.6000000000000001,,,,0.0020915810685988574,1.8402844924995405e-07,,100.0,,,,,,,,,,25.0,,,,,,,,,COMPLETE,0.0,,,,,,,,,,,,,,,,,,,,
112,112,0.7947160145881247,2023-08-23 19:01:28.797027,2023-08-23 19:01:30.005156,0 days 00:00:01.208129,,0.7000000000000001,3.0,,LightGBM,,,,,0.6000000000000001,,,,0.012278003170206572,2.4755197100040195e-08,,100.0,,,,,,,,,,21.0,,,,,,,,,COMPLETE,0.0,,,,,,,,,,,,,,,,,,,,
113,113,0.7975824163007283,2023-08-23 19:01:28.981570,2023-08-23 19:01:29.619630,0 days 00:00:00.638060,,0.6000000000000001,3.0,,LightGBM,,,,,0.5,,,,0.0009969238684759403,2.4028302552943282e-08,,70.0,,,,,,,,,,9.0,,,,,,,,,COMPLETE,0.0,,,,,,,,,,,,,,,,,,,,
114,114,0.7980780893414617,2023-08-23 19:01:29.684643,2023-08-23 19:01:30.519735,0 days 00:00:00.835092,,0.6000000000000001,3.0,,LightGBM,,,,,0.5,,,,0.0011328978608358177,0.007266531273780069,,70.0,,,,,,,,,,10.0,,,,,,,,,COMPLETE,0.0,,,,,,,,,,,,,,,,,,,,
115,115,0.7965980029119049,2023-08-23 19:01:30.108565,2023-08-23 19:01:30.959276,0 days 00:00:00.850711,,0.6000000000000001,3.0,,LightGBM,,,,,0.5,,,,0.0010536083770624695,2.3571766436351606e-08,,30.0,,,,,,,,,,10.0,,,,,,,,,COMPLETE,0.0,,,,,,,,,,,,,,,,,,,,
116,116,0.7990273470012355,2023-08-23 19:01:30.614805,2023-08-23 19:01:31.665443,0 days 00:00:01.050638,,0.6000000000000001,3.0,,LightGBM,,,,,0.5,,,,0.0010502638495049734,0.005955803651507422,,70.0,,,,,,,,,,8.0,,,,,,,,,COMPLETE,0.0,,,,,,,,,,,,,,,,,,,,
117,117,0.7931798836714428,2023-08-23 19:01:31.040966,2023-08-23 19:01:32.002417,0 days 00:00:00.961451,,0.6000000000000001,3.0,,LightGBM,,,,,0.5,,,,0.0009633746816265432,2.4807809390996574e-08,,40.0,,,,,,,,,,9.0,,,,,,,,,COMPLETE,0.0,,,,,,,,,,,,,,,,,,,,
118,118,0.7980011947096762,2023-08-23 19:01:31.777337,2023-08-23 19:01:32.534036,0 days 00:00:00.756699,,0.6000000000000001,3.0,,LightGBM,,,,,0.5,,,,0.0011720390060748506,1.9739865086724858e-08,,70.0,,,,,,,,,,12.0,,,,,,,,,COMPLETE,0.0,,,,,,,,,,,,,,,,,,,,
119,119,0.8009415738934873,2023-08-23 19:01:32.085218,2023-08-23 19:01:32.948387,0 days 00:00:00.863169,,0.6000000000000001,3.0,,LightGBM,,,,,0.5,,,,0.0008576224146061638,0.009308574385767281,,70.0,,,,,,,,,,11.0,,,,,,,,,COMPLETE,0.0,,,,,,,,,,,,,,,,,,,,
120,120,0.7980780893414617,2023-08-23 19:01:32.640427,2023-08-23 19:01:33.489937,0 days 00:00:00.849510,,0.6000000000000001,3.0,,LightGBM,,,,,0.5,,,,0.0005927170740422745,1.838766267005223e-08,,70.0,,,,,,,,,,10.0,,,,,,,,,COMPLETE,0.0,,,,,,,,,,,,,,,,,,,,
121,121,0.775500935428344,2023-08-23 19:01:33.006878,2023-08-23 19:01:33.409541,0 days 00:00:00.402663,,0.6000000000000001,3.0,,LightGBM,,,,,0.5,,,,0.003041680880485185,0.007169982170976743,,70.0,,,,,,,,,,2.0,,,,,,,,,COMPLETE,0.0,,,,,,,,,,,,,,,,,,,,
122,122,0.7941962736118421,2023-08-23 19:01:33.470572,2023-08-23 19:01:34.426993,0 days 00:00:00.956421,,0.6000000000000001,3.0,,LightGBM,,,,,0.5,,,,0.0005956892399430547,0.04181055155295714,,70.0,,,,,,,,,,19.0,,,,,,,,,COMPLETE,0.0,,,,,,,,,,,,,,,,,,,,
123,123,0.7975990354716991,2023-08-23 19:01:33.581018,2023-08-23 19:01:34.285512,0 days 00:00:00.704494,,0.6000000000000001,3.0,,LightGBM,,,,,0.5,,,,0.0003551646312178325,9.715556337761497e-08,,70.0,,,,,,,,,,19.0,,,,,,,,,COMPLETE,0.0,,,,,,,,,,,,,,,,,,,,
124,124,0.3357921744708146,2023-08-23 19:01:34.369802,2023-08-23 19:01:34.651463,0 days 00:00:00.281661,1.1765377467740067e-05,,,gblinear,XGBoost,0.4403255543696256,,,,,,,0.0012100551623646686,,,,,,,,,,,,,,,,,,,,0.771603802181678,,,COMPLETE,0.0,,,,,,,,,,,,,,,,,,,,
125,125,0.7980780893414617,2023-08-23 19:01:34.518558,2023-08-23 19:01:35.401772,0 days 00:00:00.883214,,0.6000000000000001,3.0,,LightGBM,,,,,0.5,,,,0.00026644686479639545,7.326782451609014e-08,,70.0,,,,,,,,,,10.0,,,,,,,,,COMPLETE,0.0,,,,,,,,,,,,,,,,,,,,
126,126,0.7587399053764087,2023-08-23 19:01:34.756303,2023-08-23 19:01:34.874269,0 days 00:00:00.117966,,,,,DecisionTreeClassifier,,entropy,4.0,,,,,,,,,,,,,,,,,,,,,,,,,,,,COMPLETE,0.0,,,,,,,,,,,,,,,,,,,,
127,127,0.7990359728071926,2023-08-23 19:01:34.946460,2023-08-23 19:01:35.859334,0 days 00:00:00.912874,,0.6000000000000001,3.0,,LightGBM,,,,,0.5,,,,0.00029940701290997145,1.7916336397729354e-08,,70.0,,,,,,,,,,15.0,,,,,,,,,COMPLETE,0.0,,,,,,,,,,,,,,,,,,,,
128,128,0.7985305634543097,2023-08-23 19:01:35.512858,2023-08-23 19:01:36.282989,0 days 00:00:00.770131,,0.6000000000000001,3.0,,LightGBM,,,,,0.5,,,,0.00033402678597220514,7.431507082662654e-08,,70.0,,,,,,,,,,11.0,,,,,,,,,COMPLETE,0.0,,,,,,,,,,,,,,,,,,,,
129,129,0.7975824163007283,2023-08-23 19:01:35.917881,2023-08-23 19:01:36.739397,0 days 00:00:00.821516,,0.6000000000000001,3.0,,LightGBM,,,,,0.5,,,,0.00025540384231485737,1.7508726464905392e-08,,70.0,,,,,,,,,,9.0,,,,,,,,,COMPLETE,0.0,,,,,,,,,,,,,,,,,,,,
130,130,0.7975824163007283,2023-08-23 19:01:36.353517,2023-08-23 19:01:37.048084,0 days 00:00:00.694567,,0.6000000000000001,3.0,,LightGBM,,,,,0.5,,,,0.00033209544898349326,8.76912798744735e-08,,70.0,,,,,,,,,,9.0,,,,,,,,,COMPLETE,0.0,,,,,,,,,,,,,,,,,,,,
131,131,0.7970858294608365,2023-08-23 19:01:36.836798,2023-08-23 19:01:37.981034,0 days 00:00:01.144236,,0.6000000000000001,3.0,,LightGBM,,,,,0.5,,,,0.0002950419549887127,8.01976748026545e-08,,70.0,,,,,,,,,,23.0,,,,,,,,,COMPLETE,0.0,,,,,,,,,,,,,,,,,,,,
132,132,0.7951712799765618,2023-08-23 19:01:37.138205,2023-08-23 19:01:38.293500,0 days 00:00:01.155295,,0.6000000000000001,2.0,,LightGBM,,,,,0.5,,,,0.0001910683555390347,7.67536087936801e-08,,60.0,,,,,,,,,,23.0,,,,,,,,,COMPLETE,0.0,,,,,,,,,,,,,,,,,,,,
133,133,0.7966793967805569,2023-08-23 19:01:37.275354,2023-08-23 19:01:39.024043,0 days 00:00:01.748689,,0.6000000000000001,3.0,,LightGBM,,,,,0.5,,,,0.0002613564382411706,4.522310965637282e-08,,60.0,,,,,,,,,,111.0,,,,,,,,,COMPLETE,0.0,,,,,,,,,,,,,,,,,,,,
134,134,0.7754404987801572,2023-08-23 19:01:38.056614,2023-08-23 19:01:42.095214,0 days 00:00:04.038600,,,,,RandomForestClassifier,,,,,,,,,,,,,,,,,,,,,,,,62.0,31.0,,,,,,COMPLETE,0.0,,,,,,,,,,,,,,,,,,,,
135,135,0.770392239048387,2023-08-23 19:01:38.357020,2023-08-23 19:01:42.395445,0 days 00:00:04.038425,,,,,RandomForestClassifier,,,,,,,,,,,,,,,,,,,,,,,,63.0,29.0,,,,,,COMPLETE,0.0,,,,,,,,,,,,,,,,,,,,
136,136,0.7667919199923745,2023-08-23 19:01:39.112834,2023-08-23 19:01:43.446934,0 days 00:00:04.334100,,,,,RandomForestClassifier,,,,,,,,,,,,,,,,,,,,,,,,64.0,31.0,,,,,,COMPLETE,0.0,,,,,,,,,,,,,,,,,,,,
137,137,0.3357921744708146,2023-08-23 19:01:42.164683,2023-08-23 19:01:43.691038,0 days 00:00:01.526355,,,,,MLPClassifier,,,,,,,,,,,,,,identity,lbfgs,2.0,80.0,100.0,,,,,,,,,,,,,COMPLETE,0.0,,,,,,,,,,,,,,,,,,,,
138,138,0.7985728549967218,2023-08-23 19:01:42.484676,2023-08-23 19:01:43.240500,0 days 00:00:00.755824,,0.6000000000000001,3.0,,LightGBM,,,,,0.5,,,,0.0005510642817264176,1.9748839504244886e-08,,70.0,,,,,,,,,,8.0,,,,,,,,,COMPLETE,0.0,,,,,,,,,,,,,,,,,,,,
139,139,0.7985728549967218,2023-08-23 19:01:43.328598,2023-08-23 19:01:44.085300,0 days 00:00:00.756702,,0.6000000000000001,3.0,,LightGBM,,,,,0.5,,,,0.0005239067061866363,1.8719857793456445e-08,,70.0,,,,,,,,,,8.0,,,,,,,,,COMPLETE,0.0,,,,,,,,,,,,,,,,,,,,
140,140,0.7980520874157848,2023-08-23 19:01:43.527047,2023-08-23 19:01:44.370234,0 days 00:00:00.843187,,0.6000000000000001,3.0,,LightGBM,,,,,0.5,,,,0.0005028108504973159,1.9704399717837424e-08,,70.0,,,,,,,,,,7.0,,,,,,,,,COMPLETE,0.0,,,,,,,,,,,,,,,,,,,,
141,141,0.7975824163007283,2023-08-23 19:01:43.778871,2023-08-23 19:01:44.704922,0 days 00:00:00.926051,,0.6000000000000001,3.0,,LightGBM,,,,,0.5,,,,0.0004906783691623331,1.6686306150993555e-08,,70.0,,,,,,,,,,9.0,,,,,,,,,COMPLETE,0.0,,,,,,,,,,,,,,,,,,,,
142,142,0.7908190602821369,2023-08-23 19:01:44.169415,2023-08-23 19:01:45.272046,0 days 00:00:01.102631,,0.6000000000000001,3.0,,LightGBM,,,,,0.5,,,,0.00010658339276493992,1.2943276480517749e-08,,80.0,,,,,,,,,,19.0,,,,,,,,,COMPLETE,0.0,,,,,,,,,,,,,,,,,,,,
143,143,0.7881511022426,2023-08-23 19:01:44.450824,2023-08-23 19:01:45.024745,0 days 00:00:00.573921,,0.6000000000000001,3.0,,LightGBM,,,,,0.5,,,,0.0005863477101990529,1.5375008635454615e-08,,80.0,,,,,,,,,,3.0,,,,,,,,,COMPLETE,0.0,,,,,,,,,,,,,,,,,,,,
144,144,0.7770177116505457,2023-08-23 19:01:44.808741,2023-08-23 19:01:45.537531,0 days 00:00:00.728790,,0.5,3.0,,LightGBM,,,,,0.5,,,,0.00010488158273584124,1.21818240730836e-08,,80.0,,,,,,,,,,2.0,,,,,,,,,COMPLETE,0.0,,,,,,,,,,,,,,,,,,,,
145,145,0.7995596896838418,2023-08-23 19:01:45.132306,2023-08-23 19:01:46.541730,0 days 00:00:01.409424,,0.5,3.0,,LightGBM,,,,,0.5,,,,9.809905415283708e-05,1.1205418677409667e-08,,80.0,,,,,,,,,,33.0,,,,,,,,,COMPLETE,0.0,,,,,,,,,,,,,,,,,,,,
146,146,0.3368755135097068,2023-08-23 19:01:45.341921,2023-08-23 19:01:48.985495,0 days 00:00:03.643574,,,,,SVC,,,,,,,,,,,,,,,,,,,,,,,,,,,,,507.0112890010464,linear,COMPLETE,0.0,,,,,,,,,,,,,,,,,,,,
147,147,0.7860545671586381,2023-08-23 19:01:45.613572,2023-08-23 19:01:47.347193,0 days 00:00:01.733621,,0.5,2.0,,LightGBM,,,,,0.5,,,,0.0005988707407473025,4.968131165098715e-08,,70.0,,,,,,,,,,36.0,,,,,,,,,COMPLETE,0.0,,,,,,,,,,,,,,,,,,,,
148,148,0.7942811173809635,2023-08-23 19:01:46.652183,2023-08-23 19:01:47.842651,0 days 00:00:01.190468,,0.5,3.0,,LightGBM,,,,,0.5,,,,0.0008175731781706529,4.180349855191608e-08,,70.0,,,,,,,,,,31.0,,,,,,,,,COMPLETE,0.0,,,,,,,,,,,,,,,,,,,,
149,149,0.79662476193142,2023-08-23 19:01:47.423740,2023-08-23 19:01:48.517210,0 days 00:00:01.093470,,0.6000000000000001,3.0,,LightGBM,,,,,0.5,,,,0.0007982274084260215,3.8696107828972487e-08,,70.0,,,,,,,,,,16.0,,,,,,,,,COMPLETE,0.0,,,,,,,,,,,,,,,,,,,,
150,150,0.8009006990918339,2023-08-23 19:01:47.900270,2023-08-23 19:01:48.902445,0 days 00:00:01.002175,,0.6000000000000001,3.0,,LightGBM,,,,,0.5,,,,4.053226451890384e-05,1.841525044326496e-08,,70.0,,,,,,,,,,15.0,,,,,,,,,COMPLETE,0.0,,,,,,,,,,,,,,,,,,,,
151,151,0.3454767207716286,2023-08-23 19:01:48.620062,2023-08-23 19:01:52.573449,0 days 00:00:03.953387,,,,,SVC,,,,,,,,,,,,,,,,,,,,,,,,,,,,,978.6471231795008,linear,COMPLETE,0.0,,,,,,,,,,,,,,,,,,,,
152,152,0.7961374531842196,2023-08-23 19:01:48.970285,2023-08-23 19:01:49.748127,0 days 00:00:00.777842,,0.6000000000000001,3.0,,LightGBM,,,,,0.5,,,,6.576154117843499e-05,1.0278962029215338e-08,,60.0,,,,,,,,,,13.0,,,,,,,,,COMPLETE,0.0,,,,,,,,,,,,,,,,,,,,
153,153,0.7961374531842196,2023-08-23 19:01:49.082353,2023-08-23 19:01:49.826740,0 days 00:00:00.744387,,0.6000000000000001,3.0,,LightGBM,,,,,0.5,,,,0.0004466071769044587,2.1748768612752578e-08,,60.0,,,,,,,,,,13.0,,,,,,,,,COMPLETE,0.0,,,,,,,,,,,,,,,,,,,,
154,154,0.7985728549967218,2023-08-23 19:01:49.812890,2023-08-23 19:01:50.434698,0 days 00:00:00.621808,,0.6000000000000001,3.0,,LightGBM,,,,,0.5,,,,0.00045690797076817293,1.8926576223622182e-08,,70.0,,,,,,,,,,8.0,,,,,,,,,COMPLETE,0.0,,,,,,,,,,,,,,,,,,,,
155,155,0.7913311191551293,2023-08-23 19:01:49.969278,2023-08-23 19:01:51.131608,0 days 00:00:01.162330,,0.6000000000000001,3.0,,LightGBM,,,,,0.5,,,,0.0013210992846017322,1.688903579136255e-08,,70.0,,,,,,,,,,25.0,,,,,,,,,COMPLETE,0.0,,,,,,,,,,,,,,,,,,,,
156,156,0.7970949176454781,2023-08-23 19:01:50.545112,2023-08-23 19:01:51.685097,0 days 00:00:01.139985,,0.6000000000000001,3.0,,LightGBM,,,,,0.5,,,,0.0002591123518108754,1.998447307726906e-08,,70.0,,,,,,,,,,24.0,,,,,,,,,COMPLETE,0.0,,,,,,,,,,,,,,,,,,,,
157,157,0.7975824163007283,2023-08-23 19:01:51.209746,2023-08-23 19:01:52.046310,0 days 00:00:00.836564,,0.6000000000000001,3.0,,LightGBM,,,,,0.5,,,,0.0002806550503971165,2.7201004817324935e-08,,70.0,,,,,,,,,,9.0,,,,,,,,,COMPLETE,0.0,,,,,,,,,,,,,,,,,,,,
158,158,0.7980520874157848,2023-08-23 19:01:51.752605,2023-08-23 19:01:52.500889,0 days 00:00:00.748284,,0.6000000000000001,3.0,,LightGBM,,,,,0.5,,,,0.0004874863905755914,3.1265196171146453e-08,,70.0,,,,,,,,,,7.0,,,,,,,,,COMPLETE,0.0,,,,,,,,,,,,,,,,,,,,
159,159,0.795611887194144,2023-08-23 19:01:52.116284,2023-08-23 19:01:52.825798,0 days 00:00:00.709514,,0.6000000000000001,3.0,,LightGBM,,,,,0.5,,,,0.0004959756302995316,5.4652909417671834e-08,,70.0,,,,,,,,,,6.0,,,,,,,,,COMPLETE,0.0,,,,,,,,,,,,,,,,,,,,
160,160,0.795611887194144,2023-08-23 19:01:52.556204,2023-08-23 19:01:53.517751,0 days 00:00:00.961547,,0.6000000000000001,3.0,,LightGBM,,,,,0.5,,,,0.00043618274108803037,6.193357527076498e-08,,70.0,,,,,,,,,,6.0,,,,,,,,,COMPLETE,0.0,,,,,,,,,,,,,,,,,,,,
161,161,0.795611887194144,2023-08-23 19:01:52.656172,2023-08-23 19:01:53.345066,0 days 00:00:00.688894,,0.6000000000000001,3.0,,LightGBM,,,,,0.5,,,,0.00045013213690804914,5.697832526498945e-08,,70.0,,,,,,,,,,6.0,,,,,,,,,COMPLETE,0.0,,,,,,,,,,,,,,,,,,,,
162,162,0.7913151545347165,2023-08-23 19:01:52.897380,2023-08-23 19:01:54.183206,0 days 00:00:01.285826,,0.6000000000000001,3.0,,LightGBM,,,,,0.5,,,,0.00040526327093900815,1.0357050048614553e-08,,80.0,,,,,,,,,,16.0,,,,,,,,,COMPLETE,0.0,,,,,,,,,,,,,,,,,,,,
163,163,0.794655669864502,2023-08-23 19:01:53.460184,2023-08-23 19:01:54.534861,0 days 00:00:01.074677,,0.6000000000000001,3.0,,LightGBM,,,,,0.5,,,,0.00018452884725909653,3.215332474227025e-08,,80.0,,,,,,,,,,17.0,,,,,,,,,COMPLETE,0.0,,,,,,,,,,,,,,,,,,,,
164,164,0.7913151545347165,2023-08-23 19:01:53.610541,2023-08-23 19:01:54.782144,0 days 00:00:01.171603,,0.6000000000000001,3.0,,LightGBM,,,,,0.5,,,,0.00018874017467850624,3.263324090347377e-08,,80.0,,,,,,,,,,16.0,,,,,,,,,COMPLETE,0.0,,,,,,,,,,,,,,,,,,,,
165,165,0.7724072278783594,2023-08-23 19:01:54.276266,2023-08-23 19:01:54.932240,0 days 00:00:00.655974,0.0074191901174212455,,,gbtree,XGBoost,0.6653961145888648,,,1.0860006192653701e-05,,0.17349247499532774,lossguide,0.29792024850940935,,,3.0,,3.0,,,,,,,,,,,,,,,0.9698877026993042,,,COMPLETE,0.0,,,,,,,,,,,,,,,,,,,,
166,166,0.7205138010354137,2023-08-23 19:01:54.601960,2023-08-23 19:01:55.027446,0 days 00:00:00.425486,,,,,DecisionTreeClassifier,,entropy,32.0,,,,,,,,,,,,,,,,,,,,,,,,,,,,COMPLETE,0.0,,,,,,,,,,,,,,,,,,,,
167,167,0.7214210503291387,2023-08-23 19:01:54.908840,2023-08-23 19:01:55.356343,0 days 00:00:00.447503,,,,,DecisionTreeClassifier,,entropy,32.0,,,,,,,,,,,,,,,,,,,,,,,,,,,,COMPLETE,0.0,,,,,,,,,,,,,,,,,,,,
