,number,value,datetime_start,datetime_complete,duration,params_alpha,params_bagging_fraction,params_bagging_freq,params_booster,params_classifier,params_colsample_bytree,params_dct_criterion,params_dct_max_depth,params_eta,params_feature_fraction,params_gamma,params_grow_policy,params_lambda,params_lambda_l1,params_lambda_l2,params_max_depth,params_min_child_samples,params_min_child_weight,params_mlp_activation,params_mlp_solver,params_n_layers,params_n_units_l_0,params_n_units_l_1,params_n_units_l_2,params_n_units_l_3,params_normalize_type,params_num_leaves,params_rate_drop,params_rf_estimator,params_rf_max_depth,params_sample_type,params_skip_drop,params_subsample,params_svc_c,params_svc_kernel,state,best_trial,dev_acc,dev_recall_macro,dev_precision_macro,dev_f1_macro,dev_recall_0,dev_precision_0,dev_f1_0,dev_recall_1,dev_precision_1,dev_f1_1,test_acc,test_recall_macro,test_precision_macro,test_f1_macro,test_recall_0,test_precision_0,test_f1_0,test_recall_1,test_precision_1,test_f1_1
0,0,0.3358178053830228,2023-08-23 16:07:31.987129,2023-08-23 16:07:33.445602,0 days 00:00:01.458473,,,,,MLPClassifier,,,,,,,,,,,,,,logistic,lbfgs,2.0,30.0,70.0,,,,,,,,,,,,,COMPLETE,0.0,,,,,,,,,,,,,,,,,,,,
1,1,0.4872855485966133,2023-08-23 16:07:31.990518,2023-08-23 16:08:35.890746,0 days 00:01:03.900228,,,,,SVC,,,,,,,,,,,,,,,,,,,,,,,,,,,,,29.00995469334823,linear,COMPLETE,0.0,,,,,,,,,,,,,,,,,,,,
2,2,0.4836189035909778,2023-08-23 16:07:31.993420,2023-08-23 16:08:43.484232,0 days 00:01:11.490812,,,,,SVC,,,,,,,,,,,,,,,,,,,,,,,,,,,,,182.98763614936365,rbf,COMPLETE,0.0,,,,,,,,,,,,,,,,,,,,
3,3,0.7119419586355791,2023-08-23 16:07:31.994685,2023-08-23 16:07:32.696611,0 days 00:00:00.701926,3.803756662603044e-06,,,dart,XGBoost,0.718340620038183,,,0.004231004671017308,,0.07438217313395873,lossguide,0.36130070373721196,,,7.0,,4.0,,,,,,,,tree,,0.06569517264240382,,,weighted,0.004297412397048292,0.32321725715752037,,,COMPLETE,0.0,,,,,,,,,,,,,,,,,,,,
4,4,0.36105537143186095,2023-08-23 16:07:32.001691,2023-08-23 16:08:41.818865,0 days 00:01:09.817174,,,,,SVC,,,,,,,,,,,,,,,,,,,,,,,,,,,,,0.07009668397185975,linear,COMPLETE,0.0,,,,,,,,,,,,,,,,,,,,
5,5,0.6310578760003062,2023-08-23 16:07:32.011768,2023-08-23 16:07:32.346794,0 days 00:00:00.335026,,,,,DecisionTreeClassifier,,gini,2.0,,,,,,,,,,,,,,,,,,,,,,,,,,,,COMPLETE,0.0,,,,,,,,,,,,,,,,,,,,
6,6,0.3358178053830228,2023-08-23 16:07:32.015599,2023-08-23 16:08:57.026275,0 days 00:01:25.010676,,,,,SVC,,,,,,,,,,,,,,,,,,,,,,,,,,,,,0.02662299377267238,rbf,COMPLETE,0.0,,,,,,,,,,,,,,,,,,,,
7,7,0.7022927278078426,2023-08-23 16:07:32.022150,2023-08-23 16:07:33.264655,0 days 00:00:01.242505,5.92386891036294e-06,,,gbtree,XGBoost,0.838958382340018,,,0.0002361747210690051,,6.141026555135384e-08,lossguide,1.6246874705021222e-07,,,9.0,,2.0,,,,,,,,,,,,,,,0.6339104223276517,,,COMPLETE,0.0,,,,,,,,,,,,,,,,,,,,
8,8,0.7213769917440889,2023-08-23 16:07:32.448506,2023-08-23 16:07:34.925667,0 days 00:00:02.477161,,0.7000000000000001,1.0,,LightGBM,,,,,1.0,,,,5.291982919747217e-05,1.849050340909236e-08,,70.0,,,,,,,,,,70.0,,,,,,,,,COMPLETE,0.0,,,,,,,,,,,,,,,,,,,,
9,9,0.3358178053830228,2023-08-23 16:07:32.800887,2023-08-23 16:07:32.868494,0 days 00:00:00.067607,0.0423314052765565,,,gblinear,XGBoost,0.8626998665781362,,,,,,,0.0003823454125902102,,,,,,,,,,,,,,,,,,,,0.4522224330590908,,,COMPLETE,0.0,,,,,,,,,,,,,,,,,,,,
10,10,0.7185911897551349,2023-08-23 16:07:32.948247,2023-08-23 16:07:46.985299,0 days 00:00:14.037052,,,,,RandomForestClassifier,,,,,,,,,,,,,,,,,,,,,,,,66.0,20.0,,,,,,COMPLETE,0.0,,,,,,,,,,,,,,,,,,,,
11,11,0.632408331254677,2023-08-23 16:07:33.346644,2023-08-23 16:07:34.284225,0 days 00:00:00.937581,,,,,DecisionTreeClassifier,,log_loss,22.0,,,,,,,,,,,,,,,,,,,,,,,,,,,,COMPLETE,0.0,,,,,,,,,,,,,,,,,,,,
12,12,0.7107028317763538,2023-08-23 16:07:33.539933,2023-08-23 16:07:39.742041,0 days 00:00:06.202108,,,,,RandomForestClassifier,,,,,,,,,,,,,,,,,,,,,,,,34.0,30.0,,,,,,COMPLETE,0.0,,,,,,,,,,,,,,,,,,,,
13,13,0.6386607674906295,2023-08-23 16:07:34.374291,2023-08-23 16:07:35.043971,0 days 00:00:00.669680,,,,,DecisionTreeClassifier,,gini,28.0,,,,,,,,,,,,,,,,,,,,,,,,,,,,COMPLETE,0.0,,,,,,,,,,,,,,,,,,,,
14,14,0.5836861989932078,2023-08-23 16:07:35.018279,2023-08-23 16:09:28.448964,0 days 00:01:53.430685,,,,,MLPClassifier,,,,,,,,,,,,,,logistic,lbfgs,1.0,70.0,,,,,,,,,,,,,,COMPLETE,0.0,,,,,,,,,,,,,,,,,,,,
15,15,0.6428399845263052,2023-08-23 16:07:35.143540,2023-08-23 16:07:35.995051,0 days 00:00:00.851511,,,,,DecisionTreeClassifier,,log_loss,17.0,,,,,,,,,,,,,,,,,,,,,,,,,,,,COMPLETE,0.0,,,,,,,,,,,,,,,,,,,,
16,16,0.40601592351327237,2023-08-23 16:07:36.093591,2023-08-23 16:07:36.198378,0 days 00:00:00.104787,7.332385197646982e-07,,,gblinear,XGBoost,0.7065977593603483,,,,,,,0.007612409559369775,,,,,,,,,,,,,,,,,,,,0.5857306673198003,,,COMPLETE,0.0,,,,,,,,,,,,,,,,,,,,
17,17,0.7218641476672203,2023-08-23 16:07:36.311781,2023-08-23 16:07:38.724348,0 days 00:00:02.412567,,0.7000000000000001,1.0,,LightGBM,,,,,1.0,,,,1.9689522266980355e-05,1.4791496468461581e-08,,70.0,,,,,,,,,,58.0,,,,,,,,,COMPLETE,0.0,,,,,,,,,,,,,,,,,,,,
18,18,0.7208847839908978,2023-08-23 16:07:38.873053,2023-08-23 16:07:41.205359,0 days 00:00:02.332306,,0.7000000000000001,1.0,,LightGBM,,,,,1.0,,,,2.225290496874415e-05,1.3881686344518378e-08,,70.0,,,,,,,,,,56.0,,,,,,,,,COMPLETE,0.0,,,,,,,,,,,,,,,,,,,,
19,19,0.7232368610850719,2023-08-23 16:07:39.860798,2023-08-23 16:07:41.869595,0 days 00:00:02.008797,,0.7000000000000001,1.0,,LightGBM,,,,,1.0,,,,3.685141891385274e-05,1.0152235060491828e-08,,70.0,,,,,,,,,,43.0,,,,,,,,,COMPLETE,0.0,,,,,,,,,,,,,,,,,,,,
20,20,0.7213769917440889,2023-08-23 16:07:41.277168,2023-08-23 16:07:43.986283,0 days 00:00:02.709115,,0.7000000000000001,1.0,,LightGBM,,,,,1.0,,,,2.605106371851945e-05,1.11079853934862e-08,,70.0,,,,,,,,,,70.0,,,,,,,,,COMPLETE,0.0,,,,,,,,,,,,,,,,,,,,
21,21,0.7167475814213006,2023-08-23 16:07:41.981999,2023-08-23 16:07:43.211695,0 days 00:00:01.229696,,0.8,1.0,,LightGBM,,,,,1.0,,,,1.411500881327053e-07,1.3722802137527657e-08,,20.0,,,,,,,,,,24.0,,,,,,,,,COMPLETE,0.0,,,,,,,,,,,,,,,,,,,,
22,22,0.4836189035909778,2023-08-23 16:07:43.314813,2023-08-23 16:08:46.828970,0 days 00:01:03.514157,,,,,SVC,,,,,,,,,,,,,,,,,,,,,,,,,,,,,17.42539521458097,linear,COMPLETE,0.0,,,,,,,,,,,,,,,,,,,,
23,23,0.3358178053830228,2023-08-23 16:07:44.142200,2023-08-23 16:08:57.577388,0 days 00:01:13.435188,,,,,SVC,,,,,,,,,,,,,,,,,,,,,,,,,,,,,0.20699244499668176,poly,COMPLETE,0.0,,,,,,,,,,,,,,,,,,,,
24,24,0.3358178053830228,2023-08-23 16:07:47.095828,2023-08-23 16:09:10.926676,0 days 00:01:23.830848,,,,,SVC,,,,,,,,,,,,,,,,,,,,,,,,,,,,,0.002580933940541755,rbf,COMPLETE,0.0,,,,,,,,,,,,,,,,,,,,
25,25,0.7230490812784462,2023-08-23 16:08:35.989132,2023-08-23 16:08:37.640626,0 days 00:00:01.651494,,0.4,3.0,,LightGBM,,,,,0.7000000000000001,,,,0.25955980546128665,0.0001606839201626008,,100.0,,,,,,,,,,217.0,,,,,,,,,COMPLETE,0.0,,,,,,,,,,,,,,,,,,,,
26,26,0.3358178053830228,2023-08-23 16:08:37.721138,2023-08-23 16:09:21.069805,0 days 00:00:43.348667,,,,,SVC,,,,,,,,,,,,,,,,,,,,,,,,,,,,,0.0012078039205946874,poly,COMPLETE,0.0,,,,,,,,,,,,,,,,,,,,
27,27,0.5224887206161274,2023-08-23 16:08:41.944722,2023-08-23 16:13:33.181385,0 days 00:04:51.236663,,,,,MLPClassifier,,,,,,,,,,,,,,identity,adam,4.0,100.0,10.0,80.0,20.0,,,,,,,,,,,COMPLETE,0.0,,,,,,,,,,,,,,,,,,,,
28,28,0.7228661708820545,2023-08-23 16:08:43.625458,2023-08-23 16:08:45.314803,0 days 00:00:01.689345,,0.4,3.0,,LightGBM,,,,,0.5,,,,0.9727411634210413,0.00019827452115470052,,100.0,,,,,,,,,,253.0,,,,,,,,,COMPLETE,0.0,,,,,,,,,,,,,,,,,,,,
29,29,0.7191947098345925,2023-08-23 16:08:45.462239,2023-08-23 16:08:47.213283,0 days 00:00:01.751044,,0.4,3.0,,LightGBM,,,,,0.4,,,,0.5659110698752964,0.0006671308908473482,,100.0,,,,,,,,,,251.0,,,,,,,,,COMPLETE,0.0,,,,,,,,,,,,,,,,,,,,
30,30,0.7086739575641627,2023-08-23 16:08:46.925069,2023-08-23 16:08:49.030810,0 days 00:00:02.105741,,0.4,3.0,,LightGBM,,,,,0.4,,,,0.25664993430990746,0.0004031126771831904,,100.0,,,,,,,,,,247.0,,,,,,,,,COMPLETE,0.0,,,,,,,,,,,,,,,,,,,,
31,31,0.7262418660365167,2023-08-23 16:08:47.344716,2023-08-23 16:08:49.487270,0 days 00:00:02.142554,,0.4,3.0,,LightGBM,,,,,0.6000000000000001,,,,0.2730422379976725,4.574914536223748e-05,,100.0,,,,,,,,,,250.0,,,,,,,,,COMPLETE,0.0,,,,,,,,,,,,,,,,,,,,
32,32,0.5398391073565088,2023-08-23 16:08:49.150892,2023-08-23 16:27:53.364610,0 days 00:19:04.213718,,,,,MLPClassifier,,,,,,,,,,,,,,tanh,sgd,4.0,100.0,20.0,50.0,90.0,,,,,,,,,,,COMPLETE,0.0,,,,,,,,,,,,,,,,,,,,
33,33,0.6602223258706468,2023-08-23 16:08:49.575459,2023-08-23 16:23:48.063065,0 days 00:14:58.487606,,,,,MLPClassifier,,,,,,,,,,,,,,relu,adam,4.0,100.0,10.0,60.0,100.0,,,,,,,,,,,COMPLETE,0.0,,,,,,,,,,,,,,,,,,,,
34,34,0.5229916301100734,2023-08-23 16:08:57.128266,2023-08-23 16:25:56.224400,0 days 00:16:59.096134,,,,,MLPClassifier,,,,,,,,,,,,,,identity,sgd,4.0,100.0,10.0,80.0,30.0,,,,,,,,,,,COMPLETE,0.0,,,,,,,,,,,,,,,,,,,,
35,35,0.727600107392459,2023-08-23 16:08:57.646405,2023-08-23 16:09:02.413653,0 days 00:00:04.767248,,0.5,2.0,,LightGBM,,,,,0.7000000000000001,,,,0.01181627853672865,4.119814019456123e-06,,40.0,,,,,,,,,,183.0,,,,,,,,,COMPLETE,0.0,,,,,,,,,,,,,,,,,,,,
36,36,0.6600993633123984,2023-08-23 16:09:02.476257,2023-08-23 16:27:37.549001,0 days 00:18:35.072744,,,,,MLPClassifier,,,,,,,,,,,,,,tanh,adam,4.0,90.0,10.0,30.0,70.0,,,,,,,,,,,COMPLETE,0.0,,,,,,,,,,,,,,,,,,,,
37,37,0.5278546742895677,2023-08-23 16:09:11.030964,2023-08-23 16:24:24.834000,0 days 00:15:13.803036,,,,,MLPClassifier,,,,,,,,,,,,,,tanh,sgd,4.0,100.0,10.0,50.0,20.0,,,,,,,,,,,COMPLETE,0.0,,,,,,,,,,,,,,,,,,,,
38,38,0.3358178053830228,2023-08-23 16:09:21.201543,2023-08-23 16:10:38.784805,0 days 00:01:17.583262,,,,,MLPClassifier,,,,,,,,,,,,,,relu,sgd,4.0,100.0,10.0,90.0,70.0,,,,,,,,,,,COMPLETE,0.0,,,,,,,,,,,,,,,,,,,,
39,39,0.7211093893993842,2023-08-23 16:09:28.512655,2023-08-23 16:09:33.016054,0 days 00:00:04.503399,,0.5,2.0,,LightGBM,,,,,0.7000000000000001,,,,0.03090443134307677,4.550458415007005e-06,,40.0,,,,,,,,,,178.0,,,,,,,,,COMPLETE,0.0,,,,,,,,,,,,,,,,,,,,
40,40,0.3358178053830228,2023-08-23 16:09:33.088161,2023-08-23 16:10:44.324232,0 days 00:01:11.236071,,,,,MLPClassifier,,,,,,,,,,,,,,relu,sgd,4.0,100.0,10.0,40.0,90.0,,,,,,,,,,,COMPLETE,0.0,,,,,,,,,,,,,,,,,,,,
41,41,0.7247578693743273,2023-08-23 16:10:38.904893,2023-08-23 16:10:43.273978,0 days 00:00:04.369085,,0.5,2.0,,LightGBM,,,,,0.7000000000000001,,,,0.005911048961588142,4.9654520889574284e-06,,40.0,,,,,,,,,,194.0,,,,,,,,,COMPLETE,0.0,,,,,,,,,,,,,,,,,,,,
42,42,0.7224549134377876,2023-08-23 16:10:43.342044,2023-08-23 16:10:47.257908,0 days 00:00:03.915864,,0.5,2.0,,LightGBM,,,,,0.6000000000000001,,,,0.0066792060459035145,3.922970322628095e-06,,40.0,,,,,,,,,,166.0,,,,,,,,,COMPLETE,0.0,,,,,,,,,,,,,,,,,,,,
43,43,0.7269597109276468,2023-08-23 16:10:44.413498,2023-08-23 16:10:48.581050,0 days 00:00:04.167552,,0.5,2.0,,LightGBM,,,,,0.6000000000000001,,,,0.0048714817639889585,2.745916731582382e-06,,40.0,,,,,,,,,,157.0,,,,,,,,,COMPLETE,0.0,,,,,,,,,,,,,,,,,,,,
44,44,0.7197880266602604,2023-08-23 16:10:47.372802,2023-08-23 16:10:52.427102,0 days 00:00:05.054300,,1.0,2.0,,LightGBM,,,,,0.8,,,,0.002474759424287707,5.361363664758462e-06,,40.0,,,,,,,,,,140.0,,,,,,,,,COMPLETE,0.0,,,,,,,,,,,,,,,,,,,,
45,45,0.7194255664953532,2023-08-23 16:10:48.651386,2023-08-23 16:10:53.337822,0 days 00:00:04.686436,,0.5,2.0,,LightGBM,,,,,0.8,,,,0.003899921827732273,8.619785670513177e-06,,40.0,,,,,,,,,,154.0,,,,,,,,,COMPLETE,0.0,,,,,,,,,,,,,,,,,,,,
46,46,0.6140014267380647,2023-08-23 16:10:52.528713,2023-08-23 16:10:56.265421,0 days 00:00:03.736708,,,,,RandomForestClassifier,,,,,,,,,,,,,,,,,,,,,,,,95.0,2.0,,,,,,COMPLETE,0.0,,,,,,,,,,,,,,,,,,,,
47,47,0.617271953948165,2023-08-23 16:10:53.413496,2023-08-23 16:10:57.179725,0 days 00:00:03.766229,,,,,RandomForestClassifier,,,,,,,,,,,,,,,,,,,,,,,,98.0,2.0,,,,,,COMPLETE,0.0,,,,,,,,,,,,,,,,,,,,
48,48,0.7192315607234507,2023-08-23 16:10:56.340133,2023-08-23 16:11:01.544357,0 days 00:00:05.204224,,0.6000000000000001,2.0,,LightGBM,,,,,0.6000000000000001,,,,0.0006323497869127853,4.23063935735237e-07,,20.0,,,,,,,,,,196.0,,,,,,,,,COMPLETE,0.0,,,,,,,,,,,,,,,,,,,,
49,49,0.7237562282953345,2023-08-23 16:10:57.264925,2023-08-23 16:11:00.529923,0 days 00:00:03.264998,,0.6000000000000001,2.0,,LightGBM,,,,,0.6000000000000001,,,,0.0006608804116394327,4.571166378424088e-07,,50.0,,,,,,,,,,113.0,,,,,,,,,COMPLETE,0.0,,,,,,,,,,,,,,,,,,,,
50,50,0.724748406877952,2023-08-23 16:11:00.595686,2023-08-23 16:11:04.026502,0 days 00:00:03.430816,,0.5,2.0,,LightGBM,,,,,0.6000000000000001,,,,0.0006774930518483969,9.256215599937911e-07,,50.0,,,,,,,,,,114.0,,,,,,,,,COMPLETE,0.0,,,,,,,,,,,,,,,,,,,,
51,51,0.7242894840075776,2023-08-23 16:11:01.657208,2023-08-23 16:11:04.983667,0 days 00:00:03.326459,,0.5,2.0,,LightGBM,,,,,0.6000000000000001,,,,0.027619174660721973,2.182493464836714e-05,,50.0,,,,,,,,,,107.0,,,,,,,,,COMPLETE,0.0,,,,,,,,,,,,,,,,,,,,
52,52,0.7206166882429093,2023-08-23 16:11:04.092382,2023-08-23 16:11:07.486896,0 days 00:00:03.394514,,0.5,2.0,,LightGBM,,,,,0.6000000000000001,,,,0.0244950976433089,2.9142220934183003e-05,,50.0,,,,,,,,,,104.0,,,,,,,,,COMPLETE,0.0,,,,,,,,,,,,,,,,,,,,
53,53,0.37340109058940185,2023-08-23 16:11:05.039369,2023-08-23 16:11:05.556640,0 days 00:00:00.517271,1.6623300066733043e-08,,,dart,XGBoost,0.2135279146660516,,,1.351244706965474e-08,,0.14182961147179268,depthwise,2.9982410832853975e-08,,,3.0,,10.0,,,,,,,,forest,,2.2122467173713128e-08,,,uniform,2.189620694932248e-08,0.9517621080613494,,,COMPLETE,0.0,,,,,,,,,,,,,,,,,,,,
54,54,0.7211456924911304,2023-08-23 16:11:05.659794,2023-08-23 16:11:11.357823,0 days 00:00:05.698029,,0.5,2.0,,LightGBM,,,,,0.7000000000000001,,,,0.020800121059470992,0.032900488382021496,,30.0,,,,,,,,,,209.0,,,,,,,,,COMPLETE,0.0,,,,,,,,,,,,,,,,,,,,
55,55,0.7164140402159307,2023-08-23 16:11:07.556891,2023-08-23 16:11:13.240572,0 days 00:00:05.683681,,0.6000000000000001,2.0,,LightGBM,,,,,0.7000000000000001,,,,0.05818442403028072,0.0035513822844457387,,30.0,,,,,,,,,,205.0,,,,,,,,,COMPLETE,0.0,,,,,,,,,,,,,,,,,,,,
56,56,0.6437917623206242,2023-08-23 16:11:11.457563,2023-08-23 16:11:12.137533,0 days 00:00:00.679970,,,,,DecisionTreeClassifier,,entropy,5.0,,,,,,,,,,,,,,,,,,,,,,,,,,,,COMPLETE,0.0,,,,,,,,,,,,,,,,,,,,
57,57,0.7217733374617912,2023-08-23 16:11:12.228331,2023-08-23 16:11:17.411884,0 days 00:00:05.183553,,0.6000000000000001,2.0,,LightGBM,,,,,0.8,,,,0.0006821306849627146,7.494373808141611e-07,,30.0,,,,,,,,,,178.0,,,,,,,,,COMPLETE,0.0,,,,,,,,,,,,,,,,,,,,
58,58,0.7210045957921312,2023-08-23 16:11:13.349011,2023-08-23 16:11:16.800134,0 days 00:00:03.451123,,0.5,2.0,,LightGBM,,,,,0.5,,,,0.07742854981941329,3.433908159341405e-05,,50.0,,,,,,,,,,119.0,,,,,,,,,COMPLETE,0.0,,,,,,,,,,,,,,,,,,,,
59,59,0.7227914129819403,2023-08-23 16:11:16.913303,2023-08-23 16:11:19.694322,0 days 00:00:02.781019,,0.6000000000000001,2.0,,LightGBM,,,,,0.6000000000000001,,,,0.007315302361454466,2.5568414479229933e-05,,60.0,,,,,,,,,,94.0,,,,,,,,,COMPLETE,0.0,,,,,,,,,,,,,,,,,,,,
60,60,0.721230694002112,2023-08-23 16:11:17.479967,2023-08-23 16:11:20.256901,0 days 00:00:02.776934,,0.4,2.0,,LightGBM,,,,,0.6000000000000001,,,,0.005807395602053081,1.8829363477105753e-05,,60.0,,,,,,,,,,94.0,,,,,,,,,COMPLETE,0.0,,,,,,,,,,,,,,,,,,,,
61,61,0.7215676040424176,2023-08-23 16:11:19.766945,2023-08-23 16:11:22.866697,0 days 00:00:03.099752,,0.4,2.0,,LightGBM,,,,,0.5,,,,0.10857972913272243,1.7865366885604604e-06,,60.0,,,,,,,,,,135.0,,,,,,,,,COMPLETE,0.0,,,,,,,,,,,,,,,,,,,,
62,62,0.7028065223052982,2023-08-23 16:11:20.367155,2023-08-23 16:11:20.816739,0 days 00:00:00.449584,0.9581047595109071,,,gbtree,XGBoost,0.9943728416879297,,,0.4254860004292812,,1.4199390945034364e-08,depthwise,1.5885991792117957e-05,,,3.0,,9.0,,,,,,,,,,,,,,,0.21426832498263343,,,COMPLETE,0.0,,,,,,,,,,,,,,,,,,,,
63,63,0.561629049313154,2023-08-23 16:11:20.884004,2023-08-23 16:11:31.041577,0 days 00:00:10.157573,,,,,MLPClassifier,,,,,,,,,,,,,,identity,adam,1.0,10.0,,,,,,,,,,,,,,COMPLETE,0.0,,,,,,,,,,,,,,,,,,,,
64,64,0.5521359447515686,2023-08-23 16:11:22.935198,2023-08-23 16:11:34.030554,0 days 00:00:11.095356,,,,,MLPClassifier,,,,,,,,,,,,,,tanh,adam,1.0,10.0,,,,,,,,,,,,,,COMPLETE,0.0,,,,,,,,,,,,,,,,,,,,
65,65,0.6471563938334262,2023-08-23 16:11:31.132870,2023-08-23 16:11:31.905787,0 days 00:00:00.772917,,,,,DecisionTreeClassifier,,entropy,8.0,,,,,,,,,,,,,,,,,,,,,,,,,,,,COMPLETE,0.0,,,,,,,,,,,,,,,,,,,,
66,66,0.7137421204159256,2023-08-23 16:11:31.964748,2023-08-23 16:11:35.652513,0 days 00:00:03.687765,,0.5,2.0,,LightGBM,,,,,0.7000000000000001,,,,0.1183220768879482,1.6038360427168256e-06,,50.0,,,,,,,,,,149.0,,,,,,,,,COMPLETE,0.0,,,,,,,,,,,,,,,,,,,,
67,67,0.7154786165898861,2023-08-23 16:11:34.099525,2023-08-23 16:11:38.442312,0 days 00:00:04.342787,,0.5,2.0,,LightGBM,,,,,0.7000000000000001,,,,0.016075731014748868,1.5584079032709709e-06,,50.0,,,,,,,,,,228.0,,,,,,,,,COMPLETE,0.0,,,,,,,,,,,,,,,,,,,,
68,68,0.7194255664953532,2023-08-23 16:11:35.707254,2023-08-23 16:11:39.369163,0 days 00:00:03.661909,,0.6000000000000001,2.0,,LightGBM,,,,,0.6000000000000001,,,,0.0010109533294016817,4.953559686632391e-07,,50.0,,,,,,,,,,119.0,,,,,,,,,COMPLETE,0.0,,,,,,,,,,,,,,,,,,,,
69,69,0.7211438653746006,2023-08-23 16:11:38.524976,2023-08-23 16:11:42.183494,0 days 00:00:03.658518,,0.6000000000000001,2.0,,LightGBM,,,,,0.6000000000000001,,,,0.0012258358029991817,3.658916904689809e-07,,40.0,,,,,,,,,,118.0,,,,,,,,,COMPLETE,0.0,,,,,,,,,,,,,,,,,,,,
70,70,0.7255696812213045,2023-08-23 16:11:39.478932,2023-08-23 16:11:43.012456,0 days 00:00:03.533524,,0.5,2.0,,LightGBM,,,,,0.6000000000000001,,,,0.0017075910139088542,2.845772546160168e-07,,40.0,,,,,,,,,,116.0,,,,,,,,,COMPLETE,0.0,,,,,,,,,,,,,,,,,,,,
71,71,0.7286136006237168,2023-08-23 16:11:42.300069,2023-08-23 16:11:44.963517,0 days 00:00:02.663448,,0.5,2.0,,LightGBM,,,,,0.5,,,,0.012206335212029244,1.2268455360192142e-07,,90.0,,,,,,,,,,191.0,,,,,,,,,COMPLETE,0.0,,,,,,,,,,,,,,,,,,,,
72,72,0.69220225612347,2023-08-23 16:11:43.105767,2023-08-23 16:11:43.965629,0 days 00:00:00.859862,,,,,RandomForestClassifier,,,,,,,,,,,,,,,,,,,,,,,,10.0,7.0,,,,,,COMPLETE,0.0,,,,,,,,,,,,,,,,,,,,
73,73,0.7127809463074282,2023-08-23 16:11:44.062159,2023-08-23 16:11:48.537924,0 days 00:00:04.475765,,0.5,2.0,,LightGBM,,,,,0.5,,,,0.008611802478910885,1.238834645194395e-07,,30.0,,,,,,,,,,181.0,,,,,,,,,COMPLETE,0.0,,,,,,,,,,,,,,,,,,,,
74,74,0.723718749594457,2023-08-23 16:11:45.030490,2023-08-23 16:11:47.351888,0 days 00:00:02.321398,,0.5,3.0,,LightGBM,,,,,0.5,,,,0.002349345136760661,1.107213905513569e-07,,90.0,,,,,,,,,,190.0,,,,,,,,,COMPLETE,0.0,,,,,,,,,,,,,,,,,,,,
75,75,0.7261641147796618,2023-08-23 16:11:47.448669,2023-08-23 16:11:49.850891,0 days 00:00:02.402222,,0.4,2.0,,LightGBM,,,,,0.5,,,,0.0002442372989317663,1.4214015634053582e-07,,90.0,,,,,,,,,,162.0,,,,,,,,,COMPLETE,0.0,,,,,,,,,,,,,,,,,,,,
76,76,0.7040917576046244,2023-08-23 16:11:48.621403,2023-08-23 16:11:49.448608,0 days 00:00:00.827205,0.0010641379301013399,,,dart,XGBoost,0.4559657737936693,,,1.1372750838396255e-07,,5.2321596415720673e-05,depthwise,0.34449234136793766,,,9.0,,7.0,,,,,,,,tree,,0.35519427904482687,,,weighted,0.7143752175377583,0.9609601748282551,,,COMPLETE,0.0,,,,,,,,,,,,,,,,,,,,
77,77,0.3358178053830228,2023-08-23 16:11:49.535661,2023-08-23 16:12:28.273933,0 days 00:00:38.738272,,,,,SVC,,,,,,,,,,,,,,,,,,,,,,,,,,,,,857.6119592427837,poly,COMPLETE,0.0,,,,,,,,,,,,,,,,,,,,
78,78,0.7261641147796618,2023-08-23 16:11:49.944526,2023-08-23 16:11:51.901496,0 days 00:00:01.956970,,0.4,2.0,,LightGBM,,,,,0.5,,,,0.0002500409415357331,1.7982891870656096e-07,,90.0,,,,,,,,,,163.0,,,,,,,,,COMPLETE,0.0,,,,,,,,,,,,,,,,,,,,
79,79,0.7274954598452739,2023-08-23 16:11:51.995800,2023-08-23 16:11:54.057284,0 days 00:00:02.061484,,0.4,2.0,,LightGBM,,,,,0.5,,,,0.00028446622988765436,6.231913316148895e-08,,90.0,,,,,,,,,,163.0,,,,,,,,,COMPLETE,0.0,,,,,,,,,,,,,,,,,,,,
80,80,0.7261641147796618,2023-08-23 16:11:54.183060,2023-08-23 16:11:56.324615,0 days 00:00:02.141555,,0.4,2.0,,LightGBM,,,,,0.5,,,,0.00020797470052960227,5.824591660972431e-08,,90.0,,,,,,,,,,158.0,,,,,,,,,COMPLETE,0.0,,,,,,,,,,,,,,,,,,,,
81,81,0.3358178053830228,2023-08-23 16:11:56.462898,2023-08-23 16:12:36.532339,0 days 00:00:40.069441,,,,,SVC,,,,,,,,,,,,,,,,,,,,,,,,,,,,,728.248150843208,poly,COMPLETE,0.0,,,,,,,,,,,,,,,,,,,,
82,82,0.7196377316734299,2023-08-23 16:12:28.350451,2023-08-23 16:12:30.677873,0 days 00:00:02.327422,,0.4,1.0,,LightGBM,,,,,0.5,,,,0.0001522917278851618,5.337245084713452e-08,,90.0,,,,,,,,,,163.0,,,,,,,,,COMPLETE,0.0,,,,,,,,,,,,,,,,,,,,
83,83,0.715337425242054,2023-08-23 16:12:30.783939,2023-08-23 16:12:33.039429,0 days 00:00:02.255490,,0.4,2.0,,LightGBM,,,,,0.4,,,,0.00015353132262301006,3.549628274515479e-08,,90.0,,,,,,,,,,164.0,,,,,,,,,COMPLETE,0.0,,,,,,,,,,,,,,,,,,,,
