,number,value,datetime_start,datetime_complete,duration,params_alpha,params_bagging_fraction,params_bagging_freq,params_booster,params_classifier,params_colsample_bytree,params_dct_criterion,params_dct_max_depth,params_eta,params_feature_fraction,params_gamma,params_grow_policy,params_lambda,params_lambda_l1,params_lambda_l2,params_max_depth,params_min_child_samples,params_min_child_weight,params_mlp_activation,params_mlp_solver,params_n_layers,params_n_units_l_0,params_n_units_l_1,params_n_units_l_2,params_n_units_l_3,params_normalize_type,params_num_leaves,params_rate_drop,params_rf_estimator,params_rf_max_depth,params_sample_type,params_skip_drop,params_subsample,params_svc_c,params_svc_kernel,state,best_trial,dev_acc,dev_recall_macro,dev_precision_macro,dev_f1_macro,dev_recall_0,dev_precision_0,dev_f1_0,dev_recall_1,dev_precision_1,dev_f1_1,test_acc,test_recall_macro,test_precision_macro,test_f1_macro,test_recall_0,test_precision_0,test_f1_0,test_recall_1,test_precision_1,test_f1_1
0,0,0.6471676775984373,2023-08-23 11:17:30.515345,2023-08-23 11:17:30.577202,0 days 00:00:00.061857,,,,,RandomForestClassifier,,,,,,,,,,,,,,,,,,,,,,,,19.0,13.0,,,,,,COMPLETE,0.0,,,,,,,,,,,,,,,,,,,,
1,1,0.3696969696969697,2023-08-23 11:17:30.619168,2023-08-23 11:17:30.645584,0 days 00:00:00.026416,,,,,SVC,,,,,,,,,,,,,,,,,,,,,,,,,,,,,0.20968129180888745,linear,COMPLETE,0.0,,,,,,,,,,,,,,,,,,,,
2,2,0.6939624556062911,2023-08-23 11:17:30.687474,2023-08-23 11:17:32.539918,0 days 00:00:01.852444,,1.0,2.0,,LightGBM,,,,,0.6000000000000001,,,,0.4124772854851205,0.00109381261448275,,10.0,,,,,,,,,,232.0,,,,,,,,,COMPLETE,0.0,,,,,,,,,,,,,,,,,,,,
3,3,0.6323464427750773,2023-08-23 11:17:32.577717,2023-08-23 11:17:32.615291,0 days 00:00:00.037574,0.5223196752385058,,,dart,XGBoost,0.7651647489940063,,,7.653400280022968e-05,,1.105805632005312e-08,depthwise,3.245166834591025e-07,,,5.0,,4.0,,,,,,,,forest,,4.130586355937543e-08,,,uniform,2.4155570829986806e-05,0.33587177582531136,,,COMPLETE,0.0,,,,,,,,,,,,,,,,,,,,
4,4,0.6249653259361997,2023-08-23 11:17:32.652959,2023-08-23 11:17:32.662391,0 days 00:00:00.009432,,,,,DecisionTreeClassifier,,log_loss,2.0,,,,,,,,,,,,,,,,,,,,,,,,,,,,COMPLETE,0.0,,,,,,,,,,,,,,,,,,,,
5,5,0.5987905327911583,2023-08-23 11:17:32.697981,2023-08-23 11:17:32.712477,0 days 00:00:00.014496,2.2139681633872877e-06,,,gbtree,XGBoost,0.5612491303394764,,,0.0044674950906576135,,0.0007249726254654493,lossguide,5.2551053866591996e-08,,,3.0,,6.0,,,,,,,,,,,,,,,0.48011090519305305,,,COMPLETE,0.0,,,,,,,,,,,,,,,,,,,,
6,6,0.6985507246376812,2023-08-23 11:17:32.748807,2023-08-23 11:17:32.959993,0 days 00:00:00.211186,,,,,RandomForestClassifier,,,,,,,,,,,,,,,,,,,,,,,,74.0,14.0,,,,,,COMPLETE,0.0,,,,,,,,,,,,,,,,,,,,
7,7,0.7327027860594222,2023-08-23 11:17:32.999676,2023-08-23 11:17:33.050448,0 days 00:00:00.050772,0.01405921622166347,,,dart,XGBoost,0.4698023429214055,,,2.3674913392186376e-07,,4.377362458057781e-08,lossguide,0.004096382378733372,,,7.0,,4.0,,,,,,,,tree,,2.0542052095548694e-08,,,weighted,0.00898359402846233,0.22014906386785374,,,COMPLETE,0.0,,,,,,,,,,,,,,,,,,,,
8,8,0.6899352318289298,2023-08-23 11:17:33.089579,2023-08-23 11:17:33.122554,0 days 00:00:00.032975,1.1811435447789176e-08,,,gbtree,XGBoost,0.4989894463728101,,,6.533076027239432e-07,,0.0003208898189942054,lossguide,8.784708709012751e-08,,,5.0,,8.0,,,,,,,,,,,,,,,0.8305041824860964,,,COMPLETE,0.0,,,,,,,,,,,,,,,,,,,,
9,9,0.6638515274736733,2023-08-23 11:17:33.161950,2023-08-23 11:17:33.334997,0 days 00:00:00.173047,,,,,RandomForestClassifier,,,,,,,,,,,,,,,,,,,,,,,,67.0,9.0,,,,,,COMPLETE,0.0,,,,,,,,,,,,,,,,,,,,
10,10,0.3696969696969697,2023-08-23 11:17:33.373327,2023-08-23 11:17:33.590399,0 days 00:00:00.217072,,,,,MLPClassifier,,,,,,,,,,,,,,logistic,adam,3.0,70.0,30.0,60.0,,,,,,,,,,,,COMPLETE,0.0,,,,,,,,,,,,,,,,,,,,
11,11,0.6813725490196079,2023-08-23 11:17:33.652305,2023-08-23 11:17:33.942392,0 days 00:00:00.290087,,,,,RandomForestClassifier,,,,,,,,,,,,,,,,,,,,,,,,99.0,32.0,,,,,,COMPLETE,0.0,,,,,,,,,,,,,,,,,,,,
12,12,0.6185188856944581,2023-08-23 11:17:33.980020,2023-08-23 11:17:34.004436,0 days 00:00:00.024416,,,,,DecisionTreeClassifier,,gini,31.0,,,,,,,,,,,,,,,,,,,,,,,,,,,,COMPLETE,0.0,,,,,,,,,,,,,,,,,,,,
13,13,0.6461553416933994,2023-08-23 11:17:34.041213,2023-08-23 11:17:34.074533,0 days 00:00:00.033320,,0.4,3.0,,LightGBM,,,,,1.0,,,,2.2153220685555182e-08,1.0090468490194298e-08,,100.0,,,,,,,,,,19.0,,,,,,,,,COMPLETE,0.0,,,,,,,,,,,,,,,,,,,,
14,14,0.3696969696969697,2023-08-23 11:17:34.112037,2023-08-23 11:17:34.207325,0 days 00:00:00.095288,,,,,MLPClassifier,,,,,,,,,,,,,,relu,sgd,1.0,10.0,,,,,,,,,,,,,,COMPLETE,0.0,,,,,,,,,,,,,,,,,,,,
15,15,0.3696969696969697,2023-08-23 11:17:34.244541,2023-08-23 11:17:34.279719,0 days 00:00:00.035178,,,,,SVC,,,,,,,,,,,,,,,,,,,,,,,,,,,,,1.104954625862398e-10,rbf,COMPLETE,0.0,,,,,,,,,,,,,,,,,,,,
16,16,0.3696969696969697,2023-08-23 11:17:34.320624,2023-08-23 11:17:34.352246,0 days 00:00:00.031622,0.02101779760891728,,,gblinear,XGBoost,0.2467539638954112,,,,,,,0.04834681741957705,,,,,,,,,,,,,,,,,,,,0.20580947392221843,,,COMPLETE,0.0,,,,,,,,,,,,,,,,,,,,
17,17,0.4527018354511616,2023-08-23 11:17:34.392628,2023-08-23 11:17:34.498550,0 days 00:00:00.105922,,,,,RandomForestClassifier,,,,,,,,,,,,,,,,,,,,,,,,69.0,2.0,,,,,,COMPLETE,0.0,,,,,,,,,,,,,,,,,,,,
18,18,0.6249653259361997,2023-08-23 11:17:34.537909,2023-08-23 11:17:35.102702,0 days 00:00:00.564793,0.0033205471346818187,,,dart,XGBoost,0.96253442131437,,,1.125082122767528e-08,,1.2730357401596264e-08,lossguide,0.0074735822181119654,,,9.0,,2.0,,,,,,,,tree,,1.07920737491314e-08,,,weighted,0.9719260007091135,0.6270224727965544,,,COMPLETE,0.0,,,,,,,,,,,,,,,,,,,,
19,19,0.6670934699103712,2023-08-23 11:17:35.140494,2023-08-23 11:17:35.226813,0 days 00:00:00.086319,,,,,RandomForestClassifier,,,,,,,,,,,,,,,,,,,,,,,,42.0,4.0,,,,,,COMPLETE,0.0,,,,,,,,,,,,,,,,,,,,
20,20,0.4674659672786311,2023-08-23 11:17:35.266711,2023-08-23 11:17:36.367127,0 days 00:00:01.100416,,,,,SVC,,,,,,,,,,,,,,,,,,,,,,,,,,,,,4377599941.803116,poly,COMPLETE,0.0,,,,,,,,,,,,,,,,,,,,
21,21,0.7159663865546219,2023-08-23 11:17:36.404566,2023-08-23 11:17:36.604698,0 days 00:00:00.200132,,1.0,1.0,,LightGBM,,,,,0.4,,,,0.6643848492642808,0.04838559202063896,,10.0,,,,,,,,,,243.0,,,,,,,,,COMPLETE,0.0,,,,,,,,,,,,,,,,,,,,
22,22,0.7063331988705123,2023-08-23 11:17:36.641849,2023-08-23 11:17:36.840654,0 days 00:00:00.198805,,1.0,1.0,,LightGBM,,,,,0.4,,,,0.30291076378895576,0.6705822379503061,,10.0,,,,,,,,,,252.0,,,,,,,,,COMPLETE,0.0,,,,,,,,,,,,,,,,,,,,
23,23,0.7063331988705123,2023-08-23 11:17:36.880254,2023-08-23 11:17:36.993943,0 days 00:00:00.113689,,1.0,1.0,,LightGBM,,,,,0.4,,,,0.7766589141909372,0.6365094707265574,,10.0,,,,,,,,,,249.0,,,,,,,,,COMPLETE,0.0,,,,,,,,,,,,,,,,,,,,
24,24,0.7040525954273379,2023-08-23 11:17:37.033513,2023-08-23 11:17:37.098456,0 days 00:00:00.064943,,0.8,1.0,,LightGBM,,,,,0.4,,,,0.0514888265600973,0.8082334667587814,,30.0,,,,,,,,,,172.0,,,,,,,,,COMPLETE,0.0,,,,,,,,,,,,,,,,,,,,
25,25,0.7204301075268817,2023-08-23 11:17:37.136572,2023-08-23 11:17:37.202625,0 days 00:00:00.066053,,0.8,1.0,,LightGBM,,,,,0.6000000000000001,,,,0.003619345718659189,0.024640106648335547,,50.0,,,,,,,,,,250.0,,,,,,,,,COMPLETE,0.0,,,,,,,,,,,,,,,,,,,,
26,26,0.7040525954273379,2023-08-23 11:17:37.243920,2023-08-23 11:17:37.301056,0 days 00:00:00.057136,,0.7000000000000001,2.0,,LightGBM,,,,,0.7000000000000001,,,,0.001270781747712719,0.0029149964817462752,,60.0,,,,,,,,,,167.0,,,,,,,,,COMPLETE,0.0,,,,,,,,,,,,,,,,,,,,
27,27,0.7097288676236045,2023-08-23 11:17:37.338780,2023-08-23 11:17:37.396209,0 days 00:00:00.057429,,0.8,1.0,,LightGBM,,,,,0.6000000000000001,,,,0.0007803196216459596,0.005875451067689506,,60.0,,,,,,,,,,74.0,,,,,,,,,COMPLETE,0.0,,,,,,,,,,,,,,,,,,,,
28,28,0.6517503805175038,2023-08-23 11:17:37.433793,2023-08-23 11:17:37.500201,0 days 00:00:00.066408,,0.5,2.0,,LightGBM,,,,,0.7000000000000001,,,,0.0035681726988451676,0.011109394038825297,,40.0,,,,,,,,,,187.0,,,,,,,,,COMPLETE,0.0,,,,,,,,,,,,,,,,,,,,
29,29,0.6670433145009416,2023-08-23 11:17:37.538148,2023-08-23 11:17:37.562793,0 days 00:00:00.024645,,,,,DecisionTreeClassifier,,entropy,7.0,,,,,,,,,,,,,,,,,,,,,,,,,,,,COMPLETE,0.0,,,,,,,,,,,,,,,,,,,,
30,30,0.46153846153846156,2023-08-23 11:17:37.599532,2023-08-23 11:17:40.706374,0 days 00:00:03.106842,,,,,MLPClassifier,,,,,,,,,,,,,,identity,lbfgs,4.0,100.0,100.0,10.0,70.0,,,,,,,,,,,COMPLETE,0.0,,,,,,,,,,,,,,,,,,,,
31,31,0.7150684931506849,2023-08-23 11:17:40.792196,2023-08-23 11:17:41.351957,0 days 00:00:00.559761,,0.8,1.0,,LightGBM,,,,,0.6000000000000001,,,,0.0001255121669070709,0.014230225477526766,,70.0,,,,,,,,,,65.0,,,,,,,,,COMPLETE,0.0,,,,,,,,,,,,,,,,,,,,
32,32,0.6853569987898347,2023-08-23 11:17:41.389792,2023-08-23 11:17:41.628623,0 days 00:00:00.238831,,0.8,1.0,,LightGBM,,,,,0.6000000000000001,,,,2.1877907745526815e-05,0.026386128187016772,,80.0,,,,,,,,,,89.0,,,,,,,,,COMPLETE,0.0,,,,,,,,,,,,,,,,,,,,
33,33,0.7097288676236045,2023-08-23 11:17:41.666492,2023-08-23 11:17:41.715897,0 days 00:00:00.049405,,0.9,1.0,,LightGBM,,,,,0.5,,,,4.353143182720127e-05,0.00011418415396552832,,80.0,,,,,,,,,,102.0,,,,,,,,,COMPLETE,0.0,,,,,,,,,,,,,,,,,,,,
34,34,0.6559398496240602,2023-08-23 11:17:41.765264,2023-08-23 11:17:42.643216,0 days 00:00:00.877952,,0.6000000000000001,1.0,,LightGBM,,,,,0.8,,,,0.012484823147463929,0.045617970844857185,,40.0,,,,,,,,,,33.0,,,,,,,,,COMPLETE,0.0,,,,,,,,,,,,,,,,,,,,
35,35,0.6124223602484473,2023-08-23 11:17:42.679866,2023-08-23 11:17:42.729743,0 days 00:00:00.049877,0.00017123124025385133,,,dart,XGBoost,0.30702822507019495,,,0.8609197265129132,,0.6922443255673184,depthwise,0.9874636334120855,,,9.0,,5.0,,,,,,,,tree,,0.4211304119351837,,,weighted,1.4192723500075041e-08,0.22978923697614895,,,COMPLETE,0.0,,,,,,,,,,,,,,,,,,,,
36,36,0.6836424295947405,2023-08-23 11:17:42.766578,2023-08-23 11:17:42.815319,0 days 00:00:00.048741,,0.7000000000000001,2.0,,LightGBM,,,,,0.5,,,,0.023377503340925917,0.052955003247455786,,80.0,,,,,,,,,,210.0,,,,,,,,,COMPLETE,0.0,,,,,,,,,,,,,,,,,,,,
37,37,0.5218390804597701,2023-08-23 11:17:42.852523,2023-08-23 11:17:45.637175,0 days 00:00:02.784652,,,,,SVC,,,,,,,,,,,,,,,,,,,,,,,,,,,,,2701005242.3499093,rbf,COMPLETE,0.0,,,,,,,,,,,,,,,,,,,,
38,38,0.3696969696969697,2023-08-23 11:17:45.677360,2023-08-23 11:17:45.707056,0 days 00:00:00.029696,0.4110262134685133,,,gblinear,XGBoost,0.40862179857942516,,,,,,,0.00020917047210376228,,,,,,,,,,,,,,,,,,,,0.5081762855428413,,,COMPLETE,0.0,,,,,,,,,,,,,,,,,,,,
39,39,0.7216218895608209,2023-08-23 11:17:45.747005,2023-08-23 11:17:46.111912,0 days 00:00:00.364907,,0.9,3.0,,LightGBM,,,,,0.8,,,,0.00023942492475062492,0.0005146057747505682,,70.0,,,,,,,,,,136.0,,,,,,,,,COMPLETE,0.0,,,,,,,,,,,,,,,,,,,,
40,40,0.6249653259361997,2023-08-23 11:17:46.149612,2023-08-23 11:17:46.161644,0 days 00:00:00.012032,,,,,DecisionTreeClassifier,,gini,2.0,,,,,,,,,,,,,,,,,,,,,,,,,,,,COMPLETE,0.0,,,,,,,,,,,,,,,,,,,,
41,41,0.6899352318289298,2023-08-23 11:17:46.198540,2023-08-23 11:17:46.303347,0 days 00:00:00.104807,,0.9,3.0,,LightGBM,,,,,0.9,,,,0.0002925328665560353,0.00047068337630624214,,70.0,,,,,,,,,,125.0,,,,,,,,,COMPLETE,0.0,,,,,,,,,,,,,,,,,,,,
42,42,0.7273093989511901,2023-08-23 11:17:46.340329,2023-08-23 11:17:46.417277,0 days 00:00:00.076948,,0.9,3.0,,LightGBM,,,,,0.8,,,,9.584568242121405e-05,0.049578000210712014,,50.0,,,,,,,,,,52.0,,,,,,,,,COMPLETE,0.0,,,,,,,,,,,,,,,,,,,,
43,43,0.7150684931506849,2023-08-23 11:17:46.455201,2023-08-23 11:17:46.695807,0 days 00:00:00.240606,,0.9,3.0,,LightGBM,,,,,0.8,,,,1.1601254307110809e-05,0.1068306971498159,,40.0,,,,,,,,,,211.0,,,,,,,,,COMPLETE,0.0,,,,,,,,,,,,,,,,,,,,
44,44,0.7184962406015037,2023-08-23 11:17:46.733572,2023-08-23 11:17:46.809238,0 days 00:00:00.075666,0.0006099037689506515,,,dart,XGBoost,0.6725898283291665,,,5.582744659503366e-07,,8.233218725558173e-07,lossguide,4.03852121277668e-05,,,7.0,,10.0,,,,,,,,tree,,1.1664696071045887e-05,,,weighted,0.053277793992423515,0.9650909086851395,,,COMPLETE,0.0,,,,,,,,,,,,,,,,,,,,
45,45,0.7026143790849673,2023-08-23 11:17:46.848473,2023-08-23 11:17:46.913647,0 days 00:00:00.065174,0.000831339302272887,,,dart,XGBoost,0.6751911299622604,,,3.4449839718602337e-07,,6.426088270638272e-07,lossguide,3.8362911326498345e-05,,,7.0,,10.0,,,,,,,,tree,,4.067015973119046e-06,,,weighted,0.03656478478441294,0.9873145879590759,,,COMPLETE,0.0,,,,,,,,,,,,,,,,,,,,
46,46,0.7097288676236045,2023-08-23 11:17:46.954294,2023-08-23 11:17:47.004589,0 days 00:00:00.050295,3.376479571165044e-05,,,dart,XGBoost,0.6702225758035762,,,1.6333941113750425e-06,,1.3080618619033933e-06,lossguide,6.000036674478237e-05,,,7.0,,10.0,,,,,,,,tree,,2.2982609947312477e-05,,,weighted,0.005922548593498345,0.7239271205477122,,,COMPLETE,0.0,,,,,,,,,,,,,,,,,,,,
47,47,0.6533333333333333,2023-08-23 11:17:47.041992,2023-08-23 11:17:47.105606,0 days 00:00:00.063614,0.011368746421063405,,,dart,XGBoost,0.4119072308003324,,,1.3993496687930877e-08,,8.593048349375051e-07,lossguide,0.0007331820702020385,,,7.0,,3.0,,,,,,,,tree,,9.710626037468477e-07,,,weighted,0.004119204564762051,0.9925821799625034,,,COMPLETE,0.0,,,,,,,,,,,,,,,,,,,,
48,48,0.6685514547136835,2023-08-23 11:17:47.143504,2023-08-23 11:17:47.191762,0 days 00:00:00.048258,0.014022259830379242,,,dart,XGBoost,0.5142673809431362,,,5.266492641420184e-06,,5.4195638571044496e-06,lossguide,5.609539224964348e-06,,,7.0,,8.0,,,,,,,,forest,,0.0007518864294452424,,,uniform,0.7503585865695136,0.39979121088434344,,,COMPLETE,0.0,,,,,,,,,,,,,,,,,,,,
49,49,0.6559398496240602,2023-08-23 11:17:47.244837,2023-08-23 11:17:47.826344,0 days 00:00:00.581507,,,,,MLPClassifier,,,,,,,,,,,,,,tanh,lbfgs,1.0,10.0,,,,,,,,,,,,,,COMPLETE,0.0,,,,,,,,,,,,,,,,,,,,
50,50,0.7327027860594222,2023-08-23 11:17:47.889785,2023-08-23 11:17:47.943715,0 days 00:00:00.053930,4.941052286100276e-05,,,dart,XGBoost,0.7895868406774892,,,4.624622049570444e-05,,6.886289334449792e-08,depthwise,0.0027113255291855032,,,5.0,,8.0,,,,,,,,tree,,3.427393466370689e-07,,,weighted,0.0009948016838946154,0.6170976834759356,,,COMPLETE,0.0,,,,,,,,,,,,,,,,,,,,
51,51,0.6813725490196079,2023-08-23 11:17:47.982877,2023-08-23 11:17:48.057623,0 days 00:00:00.074746,6.78516533084602e-05,,,dart,XGBoost,0.7917786821076238,,,3.7613153705396955e-05,,1.2212805600287868e-07,depthwise,0.002686971518487241,,,5.0,,8.0,,,,,,,,tree,,2.0722422502512167e-07,,,weighted,0.0005151600057861925,0.647307882485101,,,COMPLETE,0.0,,,,,,,,,,,,,,,,,,,,
52,52,0.6638515274736733,2023-08-23 11:17:48.096171,2023-08-23 11:17:48.209313,0 days 00:00:00.113142,0.000605842725761847,,,dart,XGBoost,0.8070522189284172,,,1.9174619555302916e-07,,8.862255107791773e-08,depthwise,0.010254151475797018,,,3.0,,9.0,,,,,,,,tree,,3.773287089718169e-07,,,weighted,0.017847668008808777,0.7772887276492121,,,COMPLETE,0.0,,,,,,,,,,,,,,,,,,,,
53,53,0.6531468531468532,2023-08-23 11:17:48.250472,2023-08-23 11:17:48.364814,0 days 00:00:00.114342,5.553963003728474e-06,,,dart,XGBoost,0.6186833422313517,,,1.3038722853508273e-05,,1.139060144436765e-05,depthwise,0.0009052315458478961,,,5.0,,7.0,,,,,,,,tree,,1.0644714315301326e-08,,,weighted,0.0004053203376056082,0.5561048426065043,,,COMPLETE,0.0,,,,,,,,,,,,,,,,,,,,
54,54,0.6559398496240602,2023-08-23 11:17:48.402339,2023-08-23 11:17:48.449585,0 days 00:00:00.047246,0.001240117980413875,,,gbtree,XGBoost,0.7002411995645306,,,0.0010330826819081635,,8.833233615403445e-08,lossguide,1.840677216723664e-05,,,7.0,,6.0,,,,,,,,,,,,,,,0.8597056408952398,,,COMPLETE,0.0,,,,,,,,,,,,,,,,,,,,
55,55,0.3696969696969697,2023-08-23 11:17:48.488858,2023-08-23 11:17:48.517022,0 days 00:00:00.028164,,,,,SVC,,,,,,,,,,,,,,,,,,,,,,,,,,,,,1.2973441183904924e-09,poly,COMPLETE,0.0,,,,,,,,,,,,,,,,,,,,
56,56,0.5384615384615385,2023-08-23 11:17:48.557603,2023-08-23 11:17:48.590975,0 days 00:00:00.033372,,,,,RandomForestClassifier,,,,,,,,,,,,,,,,,,,,,,,,16.0,2.0,,,,,,COMPLETE,0.0,,,,,,,,,,,,,,,,,,,,
57,57,0.6428220979295456,2023-08-23 11:17:48.631492,2023-08-23 11:17:48.662508,0 days 00:00:00.031016,,,,,DecisionTreeClassifier,,log_loss,29.0,,,,,,,,,,,,,,,,,,,,,,,,,,,,COMPLETE,0.0,,,,,,,,,,,,,,,,,,,,
58,58,0.3696969696969697,2023-08-23 11:17:48.701932,2023-08-23 11:17:48.732916,0 days 00:00:00.030984,0.06122734709881089,,,gblinear,XGBoost,0.9150439949827188,,,,,,,0.0002957055565656085,,,,,,,,,,,,,,,,,,,,0.6567017687136285,,,COMPLETE,0.0,,,,,,,,,,,,,,,,,,,,
59,59,0.7304625199362041,2023-08-23 11:17:48.778423,2023-08-23 11:17:48.830155,0 days 00:00:00.051732,0.0037962153393213236,,,dart,XGBoost,0.8764308147891713,,,1.2673582453741027e-07,,1.1927517246529278e-08,depthwise,2.125862371655398e-06,,,9.0,,9.0,,,,,,,,tree,,2.7668239008559647e-06,,,weighted,0.03151730239057737,0.5578714136959821,,,COMPLETE,0.0,,,,,,,,,,,,,,,,,,,,
60,60,0.6899352318289298,2023-08-23 11:17:48.872102,2023-08-23 11:17:52.139989,0 days 00:00:03.267887,,,,,MLPClassifier,,,,,,,,,,,,,,tanh,adam,4.0,50.0,10.0,100.0,10.0,,,,,,,,,,,COMPLETE,0.0,,,,,,,,,,,,,,,,,,,,
61,61,0.6953125,2023-08-23 11:17:52.201172,2023-08-23 11:17:52.266994,0 days 00:00:00.065822,0.002948390113873344,,,dart,XGBoost,0.8427041101070594,,,7.330547362090254e-08,,1.0870533181138188e-08,depthwise,5.724414681740578e-06,,,9.0,,9.0,,,,,,,,tree,,3.965579912657976e-06,,,weighted,0.04060523199963753,0.41267015496129905,,,COMPLETE,0.0,,,,,,,,,,,,,,,,,,,,
62,62,0.6807452101196148,2023-08-23 11:17:52.307619,2023-08-23 11:17:52.378373,0 days 00:00:00.070754,0.0001645678595379959,,,dart,XGBoost,0.8715113353456356,,,1.2605556163398686e-06,,9.316512760030613e-08,depthwise,1.4449379465088946e-06,,,9.0,,10.0,,,,,,,,tree,,1.9811171532110333e-07,,,weighted,0.09090909892762142,0.5948660984712846,,,COMPLETE,0.0,,,,,,,,,,,,,,,,,,,,
63,63,0.6767919799498747,2023-08-23 11:17:52.416551,2023-08-23 11:17:52.469159,0 days 00:00:00.052608,0.08191751376819467,,,dart,XGBoost,0.9803511868626786,,,1.9791724398183334e-07,,7.245176132753887e-08,depthwise,0.00021015702055418925,,,7.0,,9.0,,,,,,,,tree,,2.396725975865035e-05,,,weighted,0.00197559182722065,0.29694348216711824,,,COMPLETE,0.0,,,,,,,,,,,,,,,,,,,,
64,64,0.7450980392156863,2023-08-23 11:17:52.507147,2023-08-23 11:17:52.567686,0 days 00:00:00.060539,0.004472195501420099,,,dart,XGBoost,0.7328074677656784,,,3.4521962203351112e-06,,1.0702002023829136e-08,depthwise,1.1351975052514221e-06,,,5.0,,9.0,,,,,,,,tree,,1.0257703920131619e-07,,,weighted,0.04912638519899523,0.5282714333490606,,,COMPLETE,0.0,,,,,,,,,,,,,,,,,,,,
65,65,0.7304625199362041,2023-08-23 11:17:52.606340,2023-08-23 11:17:52.672201,0 days 00:00:00.065861,,0.9,3.0,,LightGBM,,,,,0.8,,,,0.00040317705508950046,4.775337516761094e-05,,50.0,,,,,,,,,,140.0,,,,,,,,,COMPLETE,0.0,,,,,,,,,,,,,,,,,,,,
66,66,0.6367100666878375,2023-08-23 11:17:52.710263,2023-08-23 11:17:52.909762,0 days 00:00:00.199499,,,,,RandomForestClassifier,,,,,,,,,,,,,,,,,,,,,,,,98.0,5.0,,,,,,COMPLETE,0.0,,,,,,,,,,,,,,,,,,,,
67,67,0.7304625199362041,2023-08-23 11:17:52.949900,2023-08-23 11:17:53.365430,0 days 00:00:00.415530,,0.9,3.0,,LightGBM,,,,,0.8,,,,6.336935331241162e-06,1.5043945226857715e-05,,50.0,,,,,,,,,,142.0,,,,,,,,,COMPLETE,0.0,,,,,,,,,,,,,,,,,,,,
68,68,0.3946784922394678,2023-08-23 11:17:53.422164,2023-08-23 11:17:53.453910,0 days 00:00:00.031746,,,,,SVC,,,,,,,,,,,,,,,,,,,,,,,,,,,,,3.4361583565226654,linear,COMPLETE,0.0,,,,,,,,,,,,,,,,,,,,
69,69,0.7026143790849673,2023-08-23 11:17:53.492524,2023-08-23 11:17:53.583337,0 days 00:00:00.090813,0.005807879129637062,,,dart,XGBoost,0.7564079788513726,,,6.8949130611730595e-06,,1.0654899365204425e-08,depthwise,4.955200808979164e-07,,,5.0,,7.0,,,,,,,,forest,,7.973199713874742e-08,,,uniform,0.00283556987667477,0.5250236912178792,,,COMPLETE,0.0,,,,,,,,,,,,,,,,,,,,
70,70,0.7184962406015037,2023-08-23 11:17:53.624929,2023-08-23 11:17:54.544985,0 days 00:00:00.920056,,0.9,3.0,,LightGBM,,,,,0.9,,,,5.39876042684827e-06,1.928335601794783e-05,,30.0,,,,,,,,,,135.0,,,,,,,,,COMPLETE,0.0,,,,,,,,,,,,,,,,,,,,
71,71,0.7304625199362041,2023-08-23 11:17:54.585365,2023-08-23 11:17:54.652785,0 days 00:00:00.067420,,0.9,3.0,,LightGBM,,,,,0.8,,,,0.000148799988493487,1.3571527478265669e-05,,50.0,,,,,,,,,,140.0,,,,,,,,,COMPLETE,0.0,,,,,,,,,,,,,,,,,,,,
72,72,0.7184962406015037,2023-08-23 11:17:54.690700,2023-08-23 11:17:54.757449,0 days 00:00:00.066749,,0.9,3.0,,LightGBM,,,,,0.9,,,,6.061302531026718e-06,7.185134740359569e-06,,50.0,,,,,,,,,,153.0,,,,,,,,,COMPLETE,0.0,,,,,,,,,,,,,,,,,,,,
73,73,0.6976441102756892,2023-08-23 11:17:54.795254,2023-08-23 11:17:54.882215,0 days 00:00:00.086961,,1.0,3.0,,LightGBM,,,,,0.8,,,,6.562272127126835e-05,9.127014736705353e-06,,50.0,,,,,,,,,,111.0,,,,,,,,,COMPLETE,0.0,,,,,,,,,,,,,,,,,,,,
74,74,0.7422424903340934,2023-08-23 11:17:54.919451,2023-08-23 11:17:55.004417,0 days 00:00:00.084966,,0.9,3.0,,LightGBM,,,,,0.8,,,,2.145734225102963e-06,7.687695891883494e-05,,30.0,,,,,,,,,,153.0,,,,,,,,,COMPLETE,0.0,,,,,,,,,,,,,,,,,,,,
