,number,value,datetime_start,datetime_complete,duration,params_alpha,params_bagging_fraction,params_bagging_freq,params_booster,params_classifier,params_colsample_bytree,params_dct_criterion,params_dct_max_depth,params_eta,params_feature_fraction,params_gamma,params_grow_policy,params_lambda,params_lambda_l1,params_lambda_l2,params_max_depth,params_min_child_samples,params_min_child_weight,params_mlp_activation,params_mlp_solver,params_n_layers,params_n_units_l_0,params_n_units_l_1,params_n_units_l_2,params_n_units_l_3,params_normalize_type,params_num_leaves,params_rate_drop,params_rf_estimator,params_rf_max_depth,params_sample_type,params_skip_drop,params_subsample,params_svc_c,params_svc_kernel,state,best_trial,dev_acc,dev_recall_macro,dev_precision_macro,dev_f1_macro,dev_recall_0,dev_precision_0,dev_f1_0,dev_recall_1,dev_precision_1,dev_f1_1,test_acc,test_recall_macro,test_precision_macro,test_f1_macro,test_recall_0,test_precision_0,test_f1_0,test_recall_1,test_precision_1,test_f1_1
0,0,0.6674743709226467,2023-08-23 18:12:01.256179,2023-08-23 18:12:01.511728,0 days 00:00:00.255549,0.003648913641552899,,,gbtree,XGBoost,0.850076171563044,,,1.5802592564758272e-07,,0.027608720941467997,lossguide,3.1131152069788893e-07,,,3.0,,2.0,,,,,,,,,,,,,,,0.5400817775697833,,,COMPLETE,0.0,,,,,,,,,,,,,,,,,,,,
1,1,0.3573487031700288,2023-08-23 18:12:01.258063,2023-08-23 18:12:06.327323,0 days 00:00:05.069260,,,,,SVC,,,,,,,,,,,,,,,,,,,,,,,,,,,,,21.00723804051838,poly,COMPLETE,0.0,,,,,,,,,,,,,,,,,,,,
2,2,0.6674743709226467,2023-08-23 18:12:01.261127,2023-08-23 18:12:01.624365,0 days 00:00:00.363238,4.3836309759074447e-07,,,gbtree,XGBoost,0.4762615810920971,,,0.011778028715188776,,1.6500135995107102e-06,depthwise,0.0008133133725315979,,,7.0,,2.0,,,,,,,,,,,,,,,0.8292227663107663,,,COMPLETE,0.0,,,,,,,,,,,,,,,,,,,,
3,3,0.6533151203903205,2023-08-23 18:12:01.263246,2023-08-23 18:12:01.326683,0 days 00:00:00.063437,,,,,DecisionTreeClassifier,,log_loss,4.0,,,,,,,,,,,,,,,,,,,,,,,,,,,,COMPLETE,0.0,,,,,,,,,,,,,,,,,,,,
4,4,0.6601512440108526,2023-08-23 18:12:01.265863,2023-08-23 18:12:06.093573,0 days 00:00:04.827710,,,,,RandomForestClassifier,,,,,,,,,,,,,,,,,,,,,,,,62.0,24.0,,,,,,COMPLETE,0.0,,,,,,,,,,,,,,,,,,,,
5,5,0.6451596345344421,2023-08-23 18:12:01.267963,2023-08-23 18:12:01.455238,0 days 00:00:00.187275,,,,,DecisionTreeClassifier,,entropy,6.0,,,,,,,,,,,,,,,,,,,,,,,,,,,,COMPLETE,0.0,,,,,,,,,,,,,,,,,,,,
6,6,0.3573487031700288,2023-08-23 18:12:01.276727,2023-08-23 18:12:06.706029,0 days 00:00:05.429302,,,,,SVC,,,,,,,,,,,,,,,,,,,,,,,,,,,,,0.007604679505877481,poly,COMPLETE,0.0,,,,,,,,,,,,,,,,,,,,
7,7,0.6882551020408163,2023-08-23 18:12:01.279956,2023-08-23 18:12:03.079358,0 days 00:00:01.799402,,0.9,3.0,,LightGBM,,,,,0.6000000000000001,,,,0.028879427633389618,1.4709960102509095e-06,,100.0,,,,,,,,,,167.0,,,,,,,,,COMPLETE,0.0,,,,,,,,,,,,,,,,,,,,
8,8,0.6658607185424825,2023-08-23 18:12:01.374444,2023-08-23 18:12:01.400565,0 days 00:00:00.026121,,,,,DecisionTreeClassifier,,entropy,2.0,,,,,,,,,,,,,,,,,,,,,,,,,,,,COMPLETE,0.0,,,,,,,,,,,,,,,,,,,,
9,9,0.6813633699829273,2023-08-23 18:12:01.443530,2023-08-23 18:12:04.443512,0 days 00:00:02.999982,,0.5,3.0,,LightGBM,,,,,0.6000000000000001,,,,4.55364319682024e-05,9.866902831802092e-07,,30.0,,,,,,,,,,178.0,,,,,,,,,COMPLETE,0.0,,,,,,,,,,,,,,,,,,,,
10,10,0.3573487031700288,2023-08-23 18:12:01.507755,2023-08-23 18:12:39.640234,0 days 00:00:38.132479,,,,,MLPClassifier,,,,,,,,,,,,,,relu,adam,3.0,90.0,50.0,10.0,,,,,,,,,,,,COMPLETE,0.0,,,,,,,,,,,,,,,,,,,,
11,11,0.3573487031700288,2023-08-23 18:12:01.553851,2023-08-23 18:12:03.658102,0 days 00:00:02.104251,,,,,MLPClassifier,,,,,,,,,,,,,,tanh,lbfgs,2.0,100.0,100.0,,,,,,,,,,,,,COMPLETE,0.0,,,,,,,,,,,,,,,,,,,,
12,12,0.6658607185424825,2023-08-23 18:12:01.728817,2023-08-23 18:12:01.756862,0 days 00:00:00.028045,,,,,DecisionTreeClassifier,,log_loss,2.0,,,,,,,,,,,,,,,,,,,,,,,,,,,,COMPLETE,0.0,,,,,,,,,,,,,,,,,,,,
13,13,0.6715737253812715,2023-08-23 18:12:01.857386,2023-08-23 18:12:02.087059,0 days 00:00:00.229673,7.204083133282669e-07,,,gbtree,XGBoost,0.8700351544780758,,,0.000653029948642392,,0.004968033876890648,lossguide,0.007751403302879024,,,9.0,,7.0,,,,,,,,,,,,,,,0.49165408390286924,,,COMPLETE,0.0,,,,,,,,,,,,,,,,,,,,
14,14,0.3573487031700288,2023-08-23 18:12:02.162682,2023-08-23 18:12:02.204238,0 days 00:00:00.041556,2.391754728532105e-07,,,gblinear,XGBoost,0.4609310634615608,,,,,,,0.012184273364711375,,,,,,,,,,,,,,,,,,,,0.731646471282845,,,COMPLETE,0.0,,,,,,,,,,,,,,,,,,,,
15,15,0.6850717629902525,2023-08-23 18:12:02.271694,2023-08-23 18:12:03.439294,0 days 00:00:01.167600,,1.0,2.0,,LightGBM,,,,,0.4,,,,0.004394376405800293,0.006676726802356785,,90.0,,,,,,,,,,24.0,,,,,,,,,COMPLETE,0.0,,,,,,,,,,,,,,,,,,,,
16,16,0.3573487031700288,2023-08-23 18:12:03.207909,2023-08-23 18:12:09.532601,0 days 00:00:06.324692,,,,,SVC,,,,,,,,,,,,,,,,,,,,,,,,,,,,,1.1777043876594087,poly,COMPLETE,0.0,,,,,,,,,,,,,,,,,,,,
17,17,0.3573487031700288,2023-08-23 18:12:03.517901,2023-08-23 18:12:10.089023,0 days 00:00:06.571122,,,,,SVC,,,,,,,,,,,,,,,,,,,,,,,,,,,,,227.76047029202022,poly,COMPLETE,0.0,,,,,,,,,,,,,,,,,,,,
18,18,0.6875409098347243,2023-08-23 18:12:03.725168,2023-08-23 18:12:05.182690,0 days 00:00:01.457522,,1.0,2.0,,LightGBM,,,,,0.4,,,,0.01163367926205005,0.0001030460259137163,,100.0,,,,,,,,,,140.0,,,,,,,,,COMPLETE,0.0,,,,,,,,,,,,,,,,,,,,
19,19,0.6794990247407864,2023-08-23 18:12:04.517837,2023-08-23 18:12:05.046980,0 days 00:00:00.529143,,1.0,2.0,,LightGBM,,,,,0.5,,,,0.09720144362611954,0.03231891828375013,,100.0,,,,,,,,,,17.0,,,,,,,,,COMPLETE,0.0,,,,,,,,,,,,,,,,,,,,
20,20,0.6761710506904757,2023-08-23 18:12:05.113030,2023-08-23 18:12:10.696576,0 days 00:00:05.583546,,,,,RandomForestClassifier,,,,,,,,,,,,,,,,,,,,,,,,79.0,17.0,,,,,,COMPLETE,0.0,,,,,,,,,,,,,,,,,,,,
21,21,0.6726186898558137,2023-08-23 18:12:05.266022,2023-08-23 18:12:09.402707,0 days 00:00:04.136685,,,,,RandomForestClassifier,,,,,,,,,,,,,,,,,,,,,,,,71.0,15.0,,,,,,COMPLETE,0.0,,,,,,,,,,,,,,,,,,,,
22,22,0.3573487031700288,2023-08-23 18:12:06.189739,2023-08-23 18:12:11.542085,0 days 00:00:05.352346,,,,,SVC,,,,,,,,,,,,,,,,,,,,,,,,,,,,,0.21876167266142754,poly,COMPLETE,0.0,,,,,,,,,,,,,,,,,,,,
23,23,0.6847545813063054,2023-08-23 18:12:06.445577,2023-08-23 18:12:08.226042,0 days 00:00:01.780465,,0.8,3.0,,LightGBM,,,,,1.0,,,,0.4709448597941514,4.79504460581876e-06,,80.0,,,,,,,,,,139.0,,,,,,,,,COMPLETE,0.0,,,,,,,,,,,,,,,,,,,,
24,24,0.6744209790138394,2023-08-23 18:12:06.812763,2023-08-23 18:12:08.376975,0 days 00:00:01.564212,,0.8,3.0,,LightGBM,,,,,1.0,,,,0.4223330583635364,2.6236424829598094e-06,,80.0,,,,,,,,,,148.0,,,,,,,,,COMPLETE,0.0,,,,,,,,,,,,,,,,,,,,
25,25,0.6731904159480585,2023-08-23 18:12:08.290748,2023-08-23 18:12:10.797568,0 days 00:00:02.506820,,0.8,1.0,,LightGBM,,,,,0.8,,,,1.0106975858772832e-07,1.4137270332364379e-08,,60.0,,,,,,,,,,254.0,,,,,,,,,COMPLETE,0.0,,,,,,,,,,,,,,,,,,,,
26,26,0.6654706156621866,2023-08-23 18:12:08.467893,2023-08-23 18:12:08.620999,0 days 00:00:00.153106,,,,,RandomForestClassifier,,,,,,,,,,,,,,,,,,,,,,,,11.0,2.0,,,,,,COMPLETE,0.0,,,,,,,,,,,,,,,,,,,,
27,27,0.3573487031700288,2023-08-23 18:12:08.722025,2023-08-23 18:13:12.603043,0 days 00:01:03.881018,,,,,MLPClassifier,,,,,,,,,,,,,,identity,adam,4.0,10.0,10.0,70.0,100.0,,,,,,,,,,,COMPLETE,0.0,,,,,,,,,,,,,,,,,,,,
28,28,0.6915830019278295,2023-08-23 18:12:09.524086,2023-08-23 18:12:11.101274,0 days 00:00:01.577188,,1.0,1.0,,LightGBM,,,,,0.4,,,,0.00440345063813957,0.0013635339077135496,,100.0,,,,,,,,,,33.0,,,,,,,,,COMPLETE,0.0,,,,,,,,,,,,,,,,,,,,
29,29,0.6794628984302566,2023-08-23 18:12:09.636605,2023-08-23 18:12:11.731380,0 days 00:00:02.094775,,1.0,1.0,,LightGBM,,,,,0.4,,,,0.0015894732405506036,0.002021198873166354,,100.0,,,,,,,,,,42.0,,,,,,,,,COMPLETE,0.0,,,,,,,,,,,,,,,,,,,,
30,30,0.6803784676396141,2023-08-23 18:12:10.185455,2023-08-23 18:12:11.477216,0 days 00:00:01.291761,,1.0,1.0,,LightGBM,,,,,0.4,,,,0.002013027477855484,0.0022479062471758293,,100.0,,,,,,,,,,22.0,,,,,,,,,COMPLETE,0.0,,,,,,,,,,,,,,,,,,,,
31,31,0.6782254969683015,2023-08-23 18:12:10.872601,2023-08-23 18:12:12.651545,0 days 00:00:01.778944,,1.0,2.0,,LightGBM,,,,,0.4,,,,0.002172153769649722,0.003682361658342112,,100.0,,,,,,,,,,34.0,,,,,,,,,COMPLETE,0.0,,,,,,,,,,,,,,,,,,,,
32,32,0.6842130824255948,2023-08-23 18:12:10.874449,2023-08-23 18:12:12.756984,0 days 00:00:01.882535,,1.0,2.0,,LightGBM,,,,,0.4,,,,0.0044191163778282486,0.002016016770913557,,100.0,,,,,,,,,,41.0,,,,,,,,,COMPLETE,0.0,,,,,,,,,,,,,,,,,,,,
33,33,0.6896985069760457,2023-08-23 18:12:11.174958,2023-08-23 18:12:13.466961,0 days 00:00:02.292003,,1.0,1.0,,LightGBM,,,,,0.4,,,,0.003703301456442967,0.0004931802827693836,,100.0,,,,,,,,,,80.0,,,,,,,,,COMPLETE,0.0,,,,,,,,,,,,,,,,,,,,
34,34,0.3573487031700288,2023-08-23 18:12:11.616759,2023-08-23 18:12:41.700482,0 days 00:00:30.083723,,,,,MLPClassifier,,,,,,,,,,,,,,identity,sgd,4.0,20.0,10.0,60.0,70.0,,,,,,,,,,,COMPLETE,0.0,,,,,,,,,,,,,,,,,,,,
35,35,0.3573487031700288,2023-08-23 18:12:11.635360,2023-08-23 18:12:15.895029,0 days 00:00:04.259669,,,,,MLPClassifier,,,,,,,,,,,,,,relu,sgd,4.0,10.0,10.0,20.0,40.0,,,,,,,,,,,COMPLETE,0.0,,,,,,,,,,,,,,,,,,,,
36,36,0.3573487031700288,2023-08-23 18:12:11.819000,2023-08-23 18:13:13.163990,0 days 00:01:01.344990,,,,,MLPClassifier,,,,,,,,,,,,,,relu,sgd,4.0,10.0,10.0,90.0,90.0,,,,,,,,,,,COMPLETE,0.0,,,,,,,,,,,,,,,,,,,,
37,37,0.3573487031700288,2023-08-23 18:12:12.746706,2023-08-23 18:12:19.163558,0 days 00:00:06.416852,,,,,MLPClassifier,,,,,,,,,,,,,,logistic,sgd,4.0,10.0,10.0,80.0,10.0,,,,,,,,,,,COMPLETE,0.0,,,,,,,,,,,,,,,,,,,,
38,38,0.3573487031700288,2023-08-23 18:12:12.897810,2023-08-23 18:13:01.360820,0 days 00:00:48.463010,,,,,MLPClassifier,,,,,,,,,,,,,,logistic,adam,4.0,10.0,10.0,100.0,60.0,,,,,,,,,,,COMPLETE,0.0,,,,,,,,,,,,,,,,,,,,
39,39,0.3573487031700288,2023-08-23 18:12:13.546963,2023-08-23 18:12:27.673647,0 days 00:00:14.126684,,,,,MLPClassifier,,,,,,,,,,,,,,relu,adam,4.0,10.0,10.0,10.0,60.0,,,,,,,,,,,COMPLETE,0.0,,,,,,,,,,,,,,,,,,,,
40,40,0.6803784676396141,2023-08-23 18:12:15.970195,2023-08-23 18:12:17.785103,0 days 00:00:01.814908,,0.9,1.0,,LightGBM,,,,,0.6000000000000001,,,,0.025805445574953914,9.271739432781415e-05,,80.0,,,,,,,,,,91.0,,,,,,,,,COMPLETE,0.0,,,,,,,,,,,,,,,,,,,,
41,41,0.680312928792316,2023-08-23 18:12:17.877159,2023-08-23 18:12:20.482050,0 days 00:00:02.604891,,0.9,1.0,,LightGBM,,,,,0.5,,,,0.026668673477918247,9.518418898206757e-05,,10.0,,,,,,,,,,99.0,,,,,,,,,COMPLETE,0.0,,,,,,,,,,,,,,,,,,,,
42,42,0.6791530612244898,2023-08-23 18:12:19.288864,2023-08-23 18:12:22.433317,0 days 00:00:03.144453,,0.9,1.0,,LightGBM,,,,,0.5,,,,0.028814458357223825,0.00011068980432075134,,10.0,,,,,,,,,,101.0,,,,,,,,,COMPLETE,0.0,,,,,,,,,,,,,,,,,,,,
43,43,0.6755449678526602,2023-08-23 18:12:20.541266,2023-08-23 18:12:22.962848,0 days 00:00:02.421582,,0.9,1.0,,LightGBM,,,,,0.5,,,,0.00011484979745285917,0.7061285775298881,,80.0,,,,,,,,,,184.0,,,,,,,,,COMPLETE,0.0,,,,,,,,,,,,,,,,,,,,
44,44,0.6662084555229717,2023-08-23 18:12:22.535613,2023-08-23 18:12:25.112823,0 days 00:00:02.577210,,0.6000000000000001,3.0,,LightGBM,,,,,0.8,,,,0.00031296880309690777,0.7933986332583384,,60.0,,,,,,,,,,185.0,,,,,,,,,COMPLETE,0.0,,,,,,,,,,,,,,,,,,,,
45,45,0.6632898402181437,2023-08-23 18:12:23.052277,2023-08-23 18:12:23.533165,0 days 00:00:00.480888,0.30846543752894867,,,dart,XGBoost,0.22569314229553317,,,0.6941913954632548,,1.1462701112241433e-08,depthwise,0.822888116243301,,,3.0,,9.0,,,,,,,,forest,,9.030303971689733e-08,,,weighted,0.12113934765575837,0.2088026535364097,,,COMPLETE,0.0,,,,,,,,,,,,,,,,,,,,
46,46,0.6651579219278678,2023-08-23 18:12:23.604673,2023-08-23 18:12:26.168150,0 days 00:00:02.563477,,0.6000000000000001,3.0,,LightGBM,,,,,0.8,,,,0.00027694220840877436,0.00022649472891940052,,60.0,,,,,,,,,,69.0,,,,,,,,,COMPLETE,0.0,,,,,,,,,,,,,,,,,,,,
47,47,0.59571989953006,2023-08-23 18:12:25.252750,2023-08-23 18:12:25.542407,0 days 00:00:00.289657,,,,,DecisionTreeClassifier,,gini,29.0,,,,,,,,,,,,,,,,,,,,,,,,,,,,COMPLETE,0.0,,,,,,,,,,,,,,,,,,,,
48,48,0.6904931096779481,2023-08-23 18:12:25.620323,2023-08-23 18:12:27.922624,0 days 00:00:02.302301,,1.0,2.0,,LightGBM,,,,,0.4,,,,0.009140921328905413,0.00037012316842830405,,90.0,,,,,,,,,,68.0,,,,,,,,,COMPLETE,0.0,,,,,,,,,,,,,,,,,,,,
49,49,0.6845775094690321,2023-08-23 18:12:26.249285,2023-08-23 18:12:28.594097,0 days 00:00:02.344812,,1.0,2.0,,LightGBM,,,,,0.4,,,,0.00825313405151152,0.0006791991913778639,,90.0,,,,,,,,,,66.0,,,,,,,,,COMPLETE,0.0,,,,,,,,,,,,,,,,,,,,
50,50,0.6665754659904971,2023-08-23 18:12:27.762517,2023-08-23 18:12:28.244899,0 days 00:00:00.482382,,1.0,2.0,,LightGBM,,,,,0.4,,,,0.009197223647419709,0.0004472935681528493,,90.0,,,,,,,,,,2.0,,,,,,,,,COMPLETE,0.0,,,,,,,,,,,,,,,,,,,,
51,51,0.6799130577427821,2023-08-23 18:12:27.989732,2023-08-23 18:12:29.743789,0 days 00:00:01.754057,,0.9,2.0,,LightGBM,,,,,0.4,,,,0.016671751957435775,0.0005362563028627616,,90.0,,,,,,,,,,64.0,,,,,,,,,COMPLETE,0.0,,,,,,,,,,,,,,,,,,,,
52,52,0.6769865246838463,2023-08-23 18:12:28.395926,2023-08-23 18:12:30.200808,0 days 00:00:01.804882,,0.9,2.0,,LightGBM,,,,,0.6000000000000001,,,,0.08232376810460224,2.2830823345530253e-05,,90.0,,,,,,,,,,67.0,,,,,,,,,COMPLETE,0.0,,,,,,,,,,,,,,,,,,,,
53,53,0.6765144550005108,2023-08-23 18:12:28.689445,2023-08-23 18:12:30.494675,0 days 00:00:01.805230,,0.9,2.0,,LightGBM,,,,,0.6000000000000001,,,,0.06168808819324787,2.599214234817458e-05,,90.0,,,,,,,,,,123.0,,,,,,,,,COMPLETE,0.0,,,,,,,,,,,,,,,,,,,,
54,54,0.49964148614965875,2023-08-23 18:12:29.801510,2023-08-23 18:12:30.593132,0 days 00:00:00.791622,0.0001899207983804671,,,dart,XGBoost,0.9992609518841823,,,1.923761713580762e-08,,0.4279299658785556,depthwise,1.0507064376259675e-08,,,9.0,,10.0,,,,,,,,tree,,0.9639785825138131,,,uniform,2.4514192770481536e-08,0.9892436171229552,,,COMPLETE,0.0,,,,,,,,,,,,,,,,,,,,
55,55,0.3573487031700288,2023-08-23 18:12:30.307384,2023-08-23 18:12:30.788378,0 days 00:00:00.480994,8.307340936051982e-05,,,gblinear,XGBoost,0.9534311935807093,,,,,,,1.3519918024770342e-08,,,,,,,,,,,,,,,,,,,,0.9690891588639566,,,COMPLETE,0.0,,,,,,,,,,,,,,,,,,,,
56,56,0.6027932395506528,2023-08-23 18:12:30.565767,2023-08-23 18:12:31.080621,0 days 00:00:00.514854,,,,,DecisionTreeClassifier,,gini,21.0,,,,,,,,,,,,,,,,,,,,,,,,,,,,COMPLETE,0.0,,,,,,,,,,,,,,,,,,,,
57,57,0.6084050273393709,2023-08-23 18:12:30.675453,2023-08-23 18:12:31.183572,0 days 00:00:00.508119,,,,,DecisionTreeClassifier,,gini,18.0,,,,,,,,,,,,,,,,,,,,,,,,,,,,COMPLETE,0.0,,,,,,,,,,,,,,,,,,,,
58,58,0.6931513155791424,2023-08-23 18:12:30.866856,2023-08-23 18:12:32.719511,0 days 00:00:01.852655,,1.0,2.0,,LightGBM,,,,,0.5,,,,0.0045722425260024185,0.009726337269279831,,100.0,,,,,,,,,,151.0,,,,,,,,,COMPLETE,1.0,0.6984304932735426,0.6924283154121864,0.6943968687476534,0.6931513155791424,0.7459677419354839,0.7212475633528265,0.7333994053518335,0.6388888888888888,0.6675461741424802,0.6529032258064515,0.6959219858156028,0.6963456079834018,0.6942171132151491,0.6943065278194775,0.6924920127795527,0.7422945205479452,0.7165289256198347,0.700199203187251,0.6461397058823529,0.6720841300191205
59,59,0.6782254969683015,2023-08-23 18:12:31.165751,2023-08-23 18:12:32.962611,0 days 00:00:01.796860,,1.0,2.0,,LightGBM,,,,,0.5,,,,0.0035753644552104064,0.010052014783071874,,100.0,,,,,,,,,,161.0,,,,,,,,,COMPLETE,0.0,,,,,,,,,,,,,,,,,,,,
60,60,0.6864931323719804,2023-08-23 18:12:31.329124,2023-08-23 18:12:33.287477,0 days 00:00:01.958353,,1.0,2.0,,LightGBM,,,,,0.5,,,,0.004105310412145818,0.009699382454144263,,100.0,,,,,,,,,,161.0,,,,,,,,,COMPLETE,0.0,,,,,,,,,,,,,,,,,,,,
61,61,0.6749000927139615,2023-08-23 18:12:32.788281,2023-08-23 18:12:34.453723,0 days 00:00:01.665442,,1.0,2.0,,LightGBM,,,,,0.5,,,,0.000907958244083382,0.013606407248059322,,100.0,,,,,,,,,,161.0,,,,,,,,,COMPLETE,0.0,,,,,,,,,,,,,,,,,,,,
62,62,0.3573487031700288,2023-08-23 18:12:33.053110,2023-08-23 18:12:40.751463,0 days 00:00:07.698353,,,,,SVC,,,,,,,,,,,,,,,,,,,,,,,,,,,,,0.0013893089644846106,rbf,COMPLETE,0.0,,,,,,,,,,,,,,,,,,,,
63,63,0.3573487031700288,2023-08-23 18:12:33.377275,2023-08-23 18:12:40.374255,0 days 00:00:06.996980,,,,,SVC,,,,,,,,,,,,,,,,,,,,,,,,,,,,,0.0013426148045454426,rbf,COMPLETE,0.0,,,,,,,,,,,,,,,,,,,,
64,64,0.3573487031700288,2023-08-23 18:12:34.529159,2023-08-23 18:12:42.810925,0 days 00:00:08.281766,,,,,SVC,,,,,,,,,,,,,,,,,,,,,,,,,,,,,744.1324751598224,rbf,COMPLETE,0.0,,,,,,,,,,,,,,,,,,,,
65,65,0.3573487031700288,2023-08-23 18:12:39.683796,2023-08-23 18:12:44.802436,0 days 00:00:05.118640,,,,,SVC,,,,,,,,,,,,,,,,,,,,,,,,,,,,,869.9862753977599,linear,COMPLETE,0.0,,,,,,,,,,,,,,,,,,,,
66,66,0.6578915071183111,2023-08-23 18:12:40.500347,2023-08-23 18:12:41.365949,0 days 00:00:00.865602,,,,,RandomForestClassifier,,,,,,,,,,,,,,,,,,,,,,,,25.0,4.0,,,,,,COMPLETE,0.0,,,,,,,,,,,,,,,,,,,,
67,67,0.6644349209738343,2023-08-23 18:12:40.837520,2023-08-23 18:12:41.605933,0 days 00:00:00.768413,,,,,RandomForestClassifier,,,,,,,,,,,,,,,,,,,,,,,,22.0,4.0,,,,,,COMPLETE,0.0,,,,,,,,,,,,,,,,,,,,
68,68,0.6786070211124001,2023-08-23 18:12:41.524017,2023-08-23 18:12:43.530046,0 days 00:00:02.006029,,1.0,2.0,,LightGBM,,,,,0.5,,,,0.007316485968568675,0.0008690550643997525,,100.0,,,,,,,,,,121.0,,,,,,,,,COMPLETE,0.0,,,,,,,,,,,,,,,,,,,,
69,69,0.672014707860634,2023-08-23 18:12:41.768916,2023-08-23 18:12:44.214289,0 days 00:00:02.445373,,1.0,2.0,,LightGBM,,,,,0.5,,,,0.012481759140255469,0.0010182452598224867,,100.0,,,,,,,,,,122.0,,,,,,,,,COMPLETE,0.0,,,,,,,,,,,,,,,,,,,,
70,70,0.677372932586438,2023-08-23 18:12:41.771295,2023-08-23 18:12:43.525509,0 days 00:00:01.754214,,1.0,2.0,,LightGBM,,,,,0.5,,,,0.009586668699193612,0.0009029185559772184,,100.0,,,,,,,,,,128.0,,,,,,,,,COMPLETE,0.0,,,,,,,,,,,,,,,,,,,,
71,71,0.677372932586438,2023-08-23 18:12:42.906389,2023-08-23 18:12:45.296188,0 days 00:00:02.389799,,1.0,2.0,,LightGBM,,,,,0.5,,,,0.009769264756074187,0.0008092034913560333,,100.0,,,,,,,,,,118.0,,,,,,,,,COMPLETE,0.0,,,,,,,,,,,,,,,,,,,,
72,72,0.6829794632629684,2023-08-23 18:12:43.656236,2023-08-23 18:12:46.479454,0 days 00:00:02.823218,,1.0,2.0,,LightGBM,,,,,0.4,,,,0.0007777849156048257,0.00023464430546410898,,90.0,,,,,,,,,,201.0,,,,,,,,,COMPLETE,0.0,,,,,,,,,,,,,,,,,,,,
73,73,0.6728128326936669,2023-08-23 18:12:43.657791,2023-08-23 18:12:46.306907,0 days 00:00:02.649116,,1.0,2.0,,LightGBM,,,,,0.4,,,,0.017995513881099597,0.022779583828734306,,90.0,,,,,,,,,,165.0,,,,,,,,,COMPLETE,0.0,,,,,,,,,,,,,,,,,,,,
74,74,0.671158621097157,2023-08-23 18:12:44.269756,2023-08-23 18:12:45.698648,0 days 00:00:01.428892,,0.4,3.0,,LightGBM,,,,,0.6000000000000001,,,,0.0013190820915949734,0.031083797881540087,,90.0,,,,,,,,,,199.0,,,,,,,,,COMPLETE,0.0,,,,,,,,,,,,,,,,,,,,
75,75,0.6833486566554297,2023-08-23 18:12:44.877190,2023-08-23 18:12:46.623095,0 days 00:00:01.745905,,0.4,3.0,,LightGBM,,,,,0.6000000000000001,,,,0.0007965081415228,0.00017479776840613844,,90.0,,,,,,,,,,206.0,,,,,,,,,COMPLETE,0.0,,,,,,,,,,,,,,,,,,,,
76,76,0.6710977400632573,2023-08-23 18:12:45.385847,2023-08-23 18:12:47.811635,0 days 00:00:02.425788,,0.9,3.0,,LightGBM,,,,,0.6000000000000001,,,,0.0008241408638111908,0.035144840468695385,,90.0,,,,,,,,,,198.0,,,,,,,,,COMPLETE,0.0,,,,,,,,,,,,,,,,,,,,
77,77,0.6641204948897256,2023-08-23 18:12:45.761939,2023-08-23 18:12:50.048446,0 days 00:00:04.286507,,0.9,1.0,,LightGBM,,,,,0.7000000000000001,,,,0.0007998215345839874,0.00021107714427703758,,40.0,,,,,,,,,,165.0,,,,,,,,,COMPLETE,0.0,,,,,,,,,,,,,,,,,,,,
78,78,0.6790721912158797,2023-08-23 18:12:46.389441,2023-08-23 18:12:49.101715,0 days 00:00:02.712274,,1.0,2.0,,LightGBM,,,,,0.4,,,,0.0035511284436148894,0.002964899666763274,,90.0,,,,,,,,,,159.0,,,,,,,,,COMPLETE,0.0,,,,,,,,,,,,,,,,,,,,
79,79,0.6680525613386716,2023-08-23 18:12:46.595059,2023-08-23 18:12:50.846345,0 days 00:00:04.251286,,0.9,2.0,,LightGBM,,,,,0.4,,,,0.003619863239201864,0.006817845847351987,,40.0,,,,,,,,,,145.0,,,,,,,,,COMPLETE,0.0,,,,,,,,,,,,,,,,,,,,
80,80,0.6688955333920416,2023-08-23 18:12:46.737590,2023-08-23 18:12:51.399726,0 days 00:00:04.662136,,0.9,2.0,,LightGBM,,,,,0.4,,,,0.003639950106676489,0.005736662966862663,,30.0,,,,,,,,,,154.0,,,,,,,,,COMPLETE,0.0,,,,,,,,,,,,,,,,,,,,
81,81,0.6644542631803778,2023-08-23 18:12:47.927112,2023-08-23 18:12:50.288323,0 days 00:00:02.361211,,1.0,2.0,,LightGBM,,,,,0.4,,,,0.0032951129539831657,0.004876864886182243,,80.0,,,,,,,,,,152.0,,,,,,,,,COMPLETE,0.0,,,,,,,,,,,,,,,,,,,,
82,82,0.6769865246838463,2023-08-23 18:12:49.185155,2023-08-23 18:12:51.893630,0 days 00:00:02.708475,,0.8,1.0,,LightGBM,,,,,0.4,,,,0.13307138734185409,0.00583066846587708,,70.0,,,,,,,,,,144.0,,,,,,,,,COMPLETE,0.0,,,,,,,,,,,,,,,,,,,,
83,83,0.6805075856422851,2023-08-23 18:12:50.190744,2023-08-23 18:12:52.652472,0 days 00:00:02.461728,,0.8,2.0,,LightGBM,,,,,0.4,,,,0.16624947351303765,0.007116032660613073,,80.0,,,,,,,,,,141.0,,,,,,,,,COMPLETE,0.0,,,,,,,,,,,,,,,,,,,,
