,number,value,datetime_start,datetime_complete,duration,params_alpha,params_bagging_fraction,params_bagging_freq,params_booster,params_classifier,params_colsample_bytree,params_dct_criterion,params_dct_max_depth,params_eta,params_feature_fraction,params_gamma,params_grow_policy,params_lambda,params_lambda_l1,params_lambda_l2,params_max_depth,params_min_child_samples,params_min_child_weight,params_mlp_activation,params_mlp_solver,params_n_layers,params_n_units_l_0,params_n_units_l_1,params_n_units_l_2,params_n_units_l_3,params_normalize_type,params_num_leaves,params_rate_drop,params_rf_estimator,params_rf_max_depth,params_sample_type,params_skip_drop,params_subsample,params_svc_c,params_svc_kernel,state,best_trial,dev_acc,dev_recall_macro,dev_precision_macro,dev_f1_macro,dev_recall_0,dev_precision_0,dev_f1_0,dev_recall_1,dev_precision_1,dev_f1_1,test_acc,test_recall_macro,test_precision_macro,test_f1_macro,test_recall_0,test_precision_0,test_f1_0,test_recall_1,test_precision_1,test_f1_1
86,86,0.3763582090909676,2023-08-23 15:55:06.152211,2023-08-23 15:56:17.769945,0 days 00:01:11.617734,,,,,SVC,,,,,,,,,,,,,,,,,,,,,,,,,,,,,0.13502628032019387,linear,COMPLETE,0.0,,,,,,,,,,,,,,,,,,,,
87,87,0.37147199924724145,2023-08-23 15:55:17.132139,2023-08-23 15:56:25.650451,0 days 00:01:08.518312,,,,,SVC,,,,,,,,,,,,,,,,,,,,,,,,,,,,,0.12099425734145501,linear,COMPLETE,0.0,,,,,,,,,,,,,,,,,,,,
88,88,0.39161630953783655,2023-08-23 15:55:19.919452,2023-08-23 15:56:28.489228,0 days 00:01:08.569776,,,,,SVC,,,,,,,,,,,,,,,,,,,,,,,,,,,,,0.20490116667908934,linear,COMPLETE,0.0,,,,,,,,,,,,,,,,,,,,
89,89,0.6535525246082317,2023-08-23 15:55:53.598608,2023-08-23 15:55:57.937984,0 days 00:00:04.339376,,0.7000000000000001,3.0,,LightGBM,,,,,0.8,,,,4.808064010719073e-07,1.634815482724088e-07,,60.0,,,,,,,,,,188.0,,,,,,,,,COMPLETE,0.0,,,,,,,,,,,,,,,,,,,,
90,90,0.6521000950934707,2023-08-23 15:55:58.025103,2023-08-23 15:55:59.882492,0 days 00:00:01.857389,,0.6000000000000001,3.0,,LightGBM,,,,,0.4,,,,4.936081847536171e-07,4.772132596466124e-08,,60.0,,,,,,,,,,56.0,,,,,,,,,COMPLETE,0.0,,,,,,,,,,,,,,,,,,,,
91,91,0.6597553123738942,2023-08-23 15:56:00.021448,2023-08-23 15:56:03.096688,0 days 00:00:03.075240,,0.7000000000000001,1.0,,LightGBM,,,,,0.7000000000000001,,,,1.1182381333270793e-06,4.570072671645645e-05,,100.0,,,,,,,,,,123.0,,,,,,,,,COMPLETE,0.0,,,,,,,,,,,,,,,,,,,,
92,92,0.6558172606706479,2023-08-23 15:56:03.205570,2023-08-23 15:56:07.778521,0 days 00:00:04.572951,,0.8,3.0,,LightGBM,,,,,0.8,,,,1.54346377591755e-05,5.133878291799403e-07,,40.0,,,,,,,,,,172.0,,,,,,,,,COMPLETE,0.0,,,,,,,,,,,,,,,,,,,,
93,93,0.6594441059897911,2023-08-23 15:56:07.892627,2023-08-23 15:56:11.088529,0 days 00:00:03.195902,,1.0,1.0,,LightGBM,,,,,0.5,,,,5.651869235494305e-06,8.728756176147955e-08,,70.0,,,,,,,,,,135.0,,,,,,,,,COMPLETE,0.0,,,,,,,,,,,,,,,,,,,,
94,94,0.6624031527982834,2023-08-23 15:56:11.216690,2023-08-23 15:56:14.099087,0 days 00:00:02.882397,,0.8,1.0,,LightGBM,,,,,0.7000000000000001,,,,2.128538645680891e-05,1.3780002233208083e-06,,60.0,,,,,,,,,,101.0,,,,,,,,,COMPLETE,0.0,,,,,,,,,,,,,,,,,,,,
95,95,0.6525768010693286,2023-08-23 15:56:13.852859,2023-08-23 15:56:16.367708,0 days 00:00:02.514849,,0.5,1.0,,LightGBM,,,,,0.7000000000000001,,,,2.9962378710016623e-05,1.5458707615676707e-06,,60.0,,,,,,,,,,42.0,,,,,,,,,COMPLETE,0.0,,,,,,,,,,,,,,,,,,,,
96,96,0.6564149379661883,2023-08-23 15:56:14.221657,2023-08-23 15:56:15.847599,0 days 00:00:01.625942,,0.5,2.0,,LightGBM,,,,,0.5,,,,1.0906543287140373e-06,3.8909637344397707e-07,,80.0,,,,,,,,,,39.0,,,,,,,,,COMPLETE,0.0,,,,,,,,,,,,,,,,,,,,
97,97,0.6429738392650843,2023-08-23 15:56:14.689320,2023-08-23 15:56:16.716647,0 days 00:00:02.027327,,0.5,2.0,,LightGBM,,,,,0.5,,,,1.3420104868405133e-06,3.2826938880039684e-08,,80.0,,,,,,,,,,44.0,,,,,,,,,COMPLETE,0.0,,,,,,,,,,,,,,,,,,,,
98,98,0.6559939373523165,2023-08-23 15:56:14.933275,2023-08-23 15:56:19.059824,0 days 00:00:04.126549,,0.8,1.0,,LightGBM,,,,,0.7000000000000001,,,,3.3114449213526276e-05,2.1433923765966623e-06,,60.0,,,,,,,,,,102.0,,,,,,,,,COMPLETE,0.0,,,,,,,,,,,,,,,,,,,,
99,99,0.6604038526502927,2023-08-23 15:56:15.950624,2023-08-23 15:56:19.241588,0 days 00:00:03.290964,,0.8,1.0,,LightGBM,,,,,0.7000000000000001,,,,2.6036731979086782e-05,1.4769407085418991e-06,,60.0,,,,,,,,,,70.0,,,,,,,,,COMPLETE,0.0,,,,,,,,,,,,,,,,,,,,
100,100,0.6654276018803899,2023-08-23 15:56:16.460125,2023-08-23 15:56:20.531568,0 days 00:00:04.071443,,0.8,1.0,,LightGBM,,,,,0.7000000000000001,,,,1.667461489366175e-05,1.0736783799357935e-06,,60.0,,,,,,,,,,98.0,,,,,,,,,COMPLETE,0.0,,,,,,,,,,,,,,,,,,,,
101,101,0.6624031527982834,2023-08-23 15:56:16.872130,2023-08-23 15:56:21.222023,0 days 00:00:04.349893,,0.8,1.0,,LightGBM,,,,,0.7000000000000001,,,,1.107574647304338e-05,9.148187150552282e-07,,60.0,,,,,,,,,,101.0,,,,,,,,,COMPLETE,0.0,,,,,,,,,,,,,,,,,,,,
102,102,0.6532480679321244,2023-08-23 15:56:17.853354,2023-08-23 15:56:21.463411,0 days 00:00:03.610057,,0.8,1.0,,LightGBM,,,,,0.7000000000000001,,,,1.1082144431494264e-05,9.061210177606687e-07,,60.0,,,,,,,,,,97.0,,,,,,,,,COMPLETE,0.0,,,,,,,,,,,,,,,,,,,,
103,103,0.6564942713352607,2023-08-23 15:56:19.143616,2023-08-23 15:56:24.124162,0 days 00:00:04.980546,,0.7000000000000001,1.0,,LightGBM,,,,,0.8,,,,1.2733247160716262e-05,1.0174907859607267e-06,,60.0,,,,,,,,,,125.0,,,,,,,,,COMPLETE,0.0,,,,,,,,,,,,,,,,,,,,
104,104,0.6327325236106752,2023-08-23 15:56:19.356745,2023-08-23 15:56:20.622513,0 days 00:00:01.265768,0.0010013876043052541,,,gbtree,XGBoost,0.7099165490717747,,,0.0009576225004333309,,1.7796301139145897e-08,depthwise,2.0663423959270815e-08,,,9.0,,8.0,,,,,,,,,,,,,,,0.7599815228781587,,,COMPLETE,0.0,,,,,,,,,,,,,,,,,,,,
105,105,0.6742637687923307,2023-08-23 15:56:20.605681,2023-08-23 15:56:25.061102,0 days 00:00:04.455421,,0.7000000000000001,1.0,,LightGBM,,,,,0.8,,,,8.75319456086308e-06,2.323213288365561e-07,,100.0,,,,,,,,,,123.0,,,,,,,,,COMPLETE,0.0,,,,,,,,,,,,,,,,,,,,
106,106,0.6742637687923307,2023-08-23 15:56:20.724415,2023-08-23 15:56:24.834331,0 days 00:00:04.109916,,0.7000000000000001,1.0,,LightGBM,,,,,0.8,,,,8.797593901238166e-06,6.927362503310666e-07,,100.0,,,,,,,,,,121.0,,,,,,,,,COMPLETE,0.0,,,,,,,,,,,,,,,,,,,,
107,107,0.6553288899057172,2023-08-23 15:56:21.320537,2023-08-23 15:56:26.441666,0 days 00:00:05.121129,,0.7000000000000001,2.0,,LightGBM,,,,,0.8,,,,5.089787601683491e-06,2.5635193455744807e-07,,70.0,,,,,,,,,,139.0,,,,,,,,,COMPLETE,0.0,,,,,,,,,,,,,,,,,,,,
108,108,0.6504304238858014,2023-08-23 15:56:21.545100,2023-08-23 15:56:27.724259,0 days 00:00:06.179159,,0.7000000000000001,1.0,,LightGBM,,,,,0.8,,,,5.8674398945223415e-06,2.3111260471547193e-07,,50.0,,,,,,,,,,144.0,,,,,,,,,COMPLETE,0.0,,,,,,,,,,,,,,,,,,,,
109,109,0.6572185294351203,2023-08-23 15:56:24.228042,2023-08-23 15:56:29.356304,0 days 00:00:05.128262,,0.9,1.0,,LightGBM,,,,,0.8,,,,5.588675796187277e-06,9.004464189490525e-06,,70.0,,,,,,,,,,145.0,,,,,,,,,COMPLETE,0.0,,,,,,,,,,,,,,,,,,,,
110,110,0.6606443647932747,2023-08-23 15:56:24.934798,2023-08-23 15:56:29.472503,0 days 00:00:04.537705,,0.7000000000000001,2.0,,LightGBM,,,,,0.8,,,,4.944694200477555e-06,3.1724429729811465e-07,,100.0,,,,,,,,,,144.0,,,,,,,,,COMPLETE,0.0,,,,,,,,,,,,,,,,,,,,
111,111,0.5116335170289555,2023-08-23 15:56:25.184234,2023-08-23 15:56:25.806146,0 days 00:00:00.621912,,,,,DecisionTreeClassifier,,entropy,2.0,,,,,,,,,,,,,,,,,,,,,,,,,,,,COMPLETE,0.0,,,,,,,,,,,,,,,,,,,,
112,112,0.6606443647932747,2023-08-23 15:56:25.745985,2023-08-23 15:56:30.716729,0 days 00:00:04.970744,,0.7000000000000001,2.0,,LightGBM,,,,,0.8,,,,5.5329177694964515e-06,2.9741513550236413e-07,,100.0,,,,,,,,,,142.0,,,,,,,,,COMPLETE,0.0,,,,,,,,,,,,,,,,,,,,
113,113,0.6606443647932747,2023-08-23 15:56:25.928275,2023-08-23 15:56:30.349091,0 days 00:00:04.420816,,0.7000000000000001,2.0,,LightGBM,,,,,0.8,,,,5.074628139011885e-06,2.820887572115423e-07,,100.0,,,,,,,,,,142.0,,,,,,,,,COMPLETE,0.0,,,,,,,,,,,,,,,,,,,,
114,114,0.6580850018535152,2023-08-23 15:56:26.529402,2023-08-23 15:56:31.309640,0 days 00:00:04.780238,,0.7000000000000001,2.0,,LightGBM,,,,,0.8,,,,5.9589782819191226e-06,4.0572242671168817e-07,,100.0,,,,,,,,,,119.0,,,,,,,,,COMPLETE,0.0,,,,,,,,,,,,,,,,,,,,
115,115,0.6606443647932747,2023-08-23 15:56:27.819741,2023-08-23 15:56:32.554631,0 days 00:00:04.734890,,0.7000000000000001,2.0,,LightGBM,,,,,0.8,,,,5.258916612868342e-06,5.902703040254238e-07,,100.0,,,,,,,,,,123.0,,,,,,,,,COMPLETE,0.0,,,,,,,,,,,,,,,,,,,,
116,116,0.6606443647932747,2023-08-23 15:56:28.539853,2023-08-23 15:56:33.249286,0 days 00:00:04.709433,,0.7000000000000001,2.0,,LightGBM,,,,,0.8,,,,6.677832628513407e-06,2.6544399820167852e-08,,100.0,,,,,,,,,,122.0,,,,,,,,,COMPLETE,0.0,,,,,,,,,,,,,,,,,,,,
117,117,0.6580850018535152,2023-08-23 15:56:29.427473,2023-08-23 15:56:34.079018,0 days 00:00:04.651545,,0.7000000000000001,2.0,,LightGBM,,,,,0.8,,,,1.7757118955949033e-06,1.2344489991385382e-07,,100.0,,,,,,,,,,119.0,,,,,,,,,COMPLETE,0.0,,,,,,,,,,,,,,,,,,,,
118,118,0.6742637687923307,2023-08-23 15:56:29.578451,2023-08-23 15:56:34.532180,0 days 00:00:04.953729,,0.7000000000000001,1.0,,LightGBM,,,,,0.8,,,,1.0436205362778943e-05,1.322406761954823e-07,,100.0,,,,,,,,,,119.0,,,,,,,,,COMPLETE,0.0,,,,,,,,,,,,,,,,,,,,
119,119,0.6608986007760318,2023-08-23 15:56:30.430992,2023-08-23 15:56:34.821667,0 days 00:00:04.390675,,0.6000000000000001,1.0,,LightGBM,,,,,0.9,,,,1.4679353419866289e-05,5.894995988259992e-07,,100.0,,,,,,,,,,123.0,,,,,,,,,COMPLETE,0.0,,,,,,,,,,,,,,,,,,,,
120,120,0.6618075722286267,2023-08-23 15:56:30.785653,2023-08-23 15:56:35.837423,0 days 00:00:05.051770,,0.9,1.0,,LightGBM,,,,,0.6000000000000001,,,,1.8717164219787739e-06,6.513494338989865e-07,,100.0,,,,,,,,,,126.0,,,,,,,,,COMPLETE,0.0,,,,,,,,,,,,,,,,,,,,
121,121,0.6575869307691746,2023-08-23 15:56:31.375646,2023-08-23 15:56:35.583717,0 days 00:00:04.208071,,1.0,1.0,,LightGBM,,,,,0.6000000000000001,,,,1.7230331365740448e-06,2.7421353720283277e-06,,90.0,,,,,,,,,,129.0,,,,,,,,,COMPLETE,0.0,,,,,,,,,,,,,,,,,,,,
122,122,0.6527239486693237,2023-08-23 15:56:32.667108,2023-08-23 15:56:36.213765,0 days 00:00:03.546657,,1.0,1.0,,LightGBM,,,,,0.6000000000000001,,,,1.952707078494804e-06,1.0498813946383769e-07,,90.0,,,,,,,,,,80.0,,,,,,,,,COMPLETE,0.0,,,,,,,,,,,,,,,,,,,,
123,123,0.6533994075454564,2023-08-23 15:56:33.328262,2023-08-23 15:56:38.172429,0 days 00:00:04.844167,,1.0,1.0,,LightGBM,,,,,0.6000000000000001,,,,1.411640031245753e-05,9.155853088811806e-08,,90.0,,,,,,,,,,111.0,,,,,,,,,COMPLETE,0.0,,,,,,,,,,,,,,,,,,,,
124,124,0.647426582866969,2023-08-23 15:56:34.146531,2023-08-23 15:56:37.398725,0 days 00:00:03.252194,,1.0,1.0,,LightGBM,,,,,0.6000000000000001,,,,4.43938818285418e-05,2.6559085481647584e-06,,90.0,,,,,,,,,,65.0,,,,,,,,,COMPLETE,0.0,,,,,,,,,,,,,,,,,,,,
125,125,0.6522726697764207,2023-08-23 15:56:34.636788,2023-08-23 15:56:39.380130,0 days 00:00:04.743342,,0.6000000000000001,1.0,,LightGBM,,,,,0.9,,,,1.5283638920237015e-05,1.1487560405176615e-07,,90.0,,,,,,,,,,111.0,,,,,,,,,COMPLETE,0.0,,,,,,,,,,,,,,,,,,,,
126,126,0.5967363200331326,2023-08-23 15:56:34.929455,2023-08-23 15:56:36.453573,0 days 00:00:01.524118,1.1611103161753632e-08,,,gbtree,XGBoost,0.9829336361865129,,,0.8171633309345,,0.5525238035535672,depthwise,0.00016809245240968554,,,7.0,,5.0,,,,,,,,,,,,,,,0.23192294021650928,,,COMPLETE,0.0,,,,,,,,,,,,,,,,,,,,
127,127,0.3358178053830228,2023-08-23 15:56:35.660001,2023-08-23 15:56:36.104190,0 days 00:00:00.444189,2.2310866336777495e-08,,,gblinear,XGBoost,0.9510931711218864,,,,,,,0.8228432149664637,,,,,,,,,,,,,,,,,,,,0.24116018905566639,,,COMPLETE,0.0,,,,,,,,,,,,,,,,,,,,
128,128,0.6678359020766722,2023-08-23 15:56:35.964324,2023-08-23 15:56:39.896596,0 days 00:00:03.932272,,0.6000000000000001,1.0,,LightGBM,,,,,0.9,,,,4.190368390217843e-05,1.6389924671442319e-07,,90.0,,,,,,,,,,81.0,,,,,,,,,COMPLETE,0.0,,,,,,,,,,,,,,,,,,,,
129,129,0.5535330388696293,2023-08-23 15:56:36.282960,2023-08-23 16:07:03.870722,0 days 00:10:27.587762,,,,,MLPClassifier,,,,,,,,,,,,,,relu,lbfgs,3.0,70.0,100.0,100.0,,,,,,,,,,,,COMPLETE,0.0,,,,,,,,,,,,,,,,,,,,
130,130,0.5254638061218432,2023-08-23 15:56:36.334556,2023-08-23 15:57:36.122300,0 days 00:00:59.787744,,,,,MLPClassifier,,,,,,,,,,,,,,identity,lbfgs,3.0,100.0,100.0,100.0,,,,,,,,,,,,COMPLETE,0.0,,,,,,,,,,,,,,,,,,,,
131,131,0.5242883552241634,2023-08-23 15:56:36.592670,2023-08-23 15:58:40.754739,0 days 00:02:04.162069,,,,,MLPClassifier,,,,,,,,,,,,,,identity,lbfgs,3.0,70.0,100.0,100.0,,,,,,,,,,,,COMPLETE,0.0,,,,,,,,,,,,,,,,,,,,
132,132,0.5273348881556759,2023-08-23 15:56:37.529461,2023-08-23 15:57:12.899562,0 days 00:00:35.370101,,,,,MLPClassifier,,,,,,,,,,,,,,identity,lbfgs,3.0,70.0,100.0,100.0,,,,,,,,,,,,COMPLETE,0.0,,,,,,,,,,,,,,,,,,,,
133,133,0.5392637419433,2023-08-23 15:56:38.264986,2023-08-23 16:02:51.192490,0 days 00:06:12.927504,,,,,MLPClassifier,,,,,,,,,,,,,,identity,lbfgs,3.0,70.0,100.0,100.0,,,,,,,,,,,,COMPLETE,0.0,,,,,,,,,,,,,,,,,,,,
134,134,0.6062258492730077,2023-08-23 15:56:39.493854,2023-08-23 15:56:40.699035,0 days 00:00:01.205181,,,,,DecisionTreeClassifier,,gini,14.0,,,,,,,,,,,,,,,,,,,,,,,,,,,,COMPLETE,0.0,,,,,,,,,,,,,,,,,,,,
135,135,0.5628804712614419,2023-08-23 15:56:40.004945,2023-08-23 16:06:55.962647,0 days 00:10:15.957702,,,,,MLPClassifier,,,,,,,,,,,,,,relu,lbfgs,3.0,70.0,100.0,100.0,,,,,,,,,,,,COMPLETE,0.0,,,,,,,,,,,,,,,,,,,,
136,136,0.5670546762011892,2023-08-23 15:56:40.814202,2023-08-23 16:07:03.038747,0 days 00:10:22.224545,,,,,MLPClassifier,,,,,,,,,,,,,,relu,lbfgs,3.0,70.0,100.0,100.0,,,,,,,,,,,,COMPLETE,0.0,,,,,,,,,,,,,,,,,,,,
137,137,0.6389339307460093,2023-08-23 15:57:13.018880,2023-08-23 15:57:18.850709,0 days 00:00:05.831829,,,,,RandomForestClassifier,,,,,,,,,,,,,,,,,,,,,,,,28.0,12.0,,,,,,COMPLETE,0.0,,,,,,,,,,,,,,,,,,,,
138,138,0.6607822222481631,2023-08-23 15:57:19.016041,2023-08-23 15:57:21.746977,0 days 00:00:02.730936,,0.6000000000000001,1.0,,LightGBM,,,,,0.9,,,,8.664475761063673e-05,5.799628649581441e-08,,50.0,,,,,,,,,,55.0,,,,,,,,,COMPLETE,0.0,,,,,,,,,,,,,,,,,,,,
139,139,0.6610581862333054,2023-08-23 15:57:21.863482,2023-08-23 15:57:24.827002,0 days 00:00:02.963520,,0.9,1.0,,LightGBM,,,,,0.7000000000000001,,,,4.4815248285523e-05,2.179464502813239e-07,,80.0,,,,,,,,,,82.0,,,,,,,,,COMPLETE,0.0,,,,,,,,,,,,,,,,,,,,
140,140,0.6558951813885134,2023-08-23 15:57:24.931508,2023-08-23 15:57:27.911559,0 days 00:00:02.980051,,0.8,1.0,,LightGBM,,,,,0.7000000000000001,,,,2.054346380085179e-05,1.7117604155327254e-07,,40.0,,,,,,,,,,73.0,,,,,,,,,COMPLETE,0.0,,,,,,,,,,,,,,,,,,,,
141,141,0.6414189450864902,2023-08-23 15:57:28.042396,2023-08-23 15:57:32.634457,0 days 00:00:04.592061,,0.6000000000000001,1.0,,LightGBM,,,,,0.4,,,,9.307187733349495e-06,1.0019293093137476e-06,,50.0,,,,,,,,,,163.0,,,,,,,,,COMPLETE,0.0,,,,,,,,,,,,,,,,,,,,
142,142,0.6611205962376532,2023-08-23 15:57:32.732144,2023-08-23 15:57:35.964424,0 days 00:00:03.232280,,0.8,1.0,,LightGBM,,,,,1.0,,,,2.2387988613095573e-05,1.7189055559442614e-06,,100.0,,,,,,,,,,93.0,,,,,,,,,COMPLETE,0.0,,,,,,,,,,,,,,,,,,,,
143,143,0.6602125592437573,2023-08-23 15:57:36.042969,2023-08-23 15:57:40.454012,0 days 00:00:04.411043,,0.8,1.0,,LightGBM,,,,,0.9,,,,3.44848275414186e-06,3.5968275062439655e-06,,70.0,,,,,,,,,,108.0,,,,,,,,,COMPLETE,0.0,,,,,,,,,,,,,,,,,,,,
144,144,0.6664267014115345,2023-08-23 15:57:36.206479,2023-08-23 15:57:40.314748,0 days 00:00:04.108269,,0.8,1.0,,LightGBM,,,,,0.9,,,,3.207607312993265e-06,2.126194279490763e-08,,70.0,,,,,,,,,,106.0,,,,,,,,,COMPLETE,0.0,,,,,,,,,,,,,,,,,,,,
145,145,0.669598032101763,2023-08-23 15:57:40.415846,2023-08-23 15:57:44.889129,0 days 00:00:04.473283,,0.8,3.0,,LightGBM,,,,,0.9,,,,3.3624353581496545e-06,1.9741155909639853e-08,,90.0,,,,,,,,,,106.0,,,,,,,,,COMPLETE,0.0,,,,,,,,,,,,,,,,,,,,
146,146,0.6650228417248668,2023-08-23 15:57:40.540184,2023-08-23 15:57:45.085578,0 days 00:00:04.545394,,0.8,3.0,,LightGBM,,,,,0.9,,,,2.907240481951711e-06,2.0865524024123618e-08,,90.0,,,,,,,,,,97.0,,,,,,,,,COMPLETE,0.0,,,,,,,,,,,,,,,,,,,,
147,147,0.6623354994357757,2023-08-23 15:57:44.986161,2023-08-23 15:57:49.083941,0 days 00:00:04.097780,,0.9,3.0,,LightGBM,,,,,0.9,,,,7.95341953374131e-06,1.940015150323411e-08,,80.0,,,,,,,,,,96.0,,,,,,,,,COMPLETE,0.0,,,,,,,,,,,,,,,,,,,,
148,148,0.6666613480014338,2023-08-23 15:57:45.178530,2023-08-23 15:57:49.317400,0 days 00:00:04.138870,,0.8,3.0,,LightGBM,,,,,0.9,,,,8.928398337744728e-06,2.0259897122751708e-08,,90.0,,,,,,,,,,93.0,,,,,,,,,COMPLETE,0.0,,,,,,,,,,,,,,,,,,,,
149,149,0.6609647750150645,2023-08-23 15:57:49.240412,2023-08-23 15:57:53.852306,0 days 00:00:04.611894,,0.8,3.0,,LightGBM,,,,,0.9,,,,2.7767110734862133e-06,1.1379953487798133e-08,,90.0,,,,,,,,,,105.0,,,,,,,,,COMPLETE,0.0,,,,,,,,,,,,,,,,,,,,
150,150,0.6655371455522733,2023-08-23 15:57:49.457424,2023-08-23 15:57:53.511160,0 days 00:00:04.053736,,0.8,3.0,,LightGBM,,,,,0.9,,,,9.538541862846731e-06,1.4445847095342852e-08,,90.0,,,,,,,,,,103.0,,,,,,,,,COMPLETE,0.0,,,,,,,,,,,,,,,,,,,,
151,151,0.661377633867607,2023-08-23 15:57:53.708148,2023-08-23 15:57:59.088566,0 days 00:00:05.380418,,0.8,3.0,,LightGBM,,,,,0.9,,,,2.819590907938775e-06,2.163744291815011e-08,,90.0,,,,,,,,,,104.0,,,,,,,,,COMPLETE,0.0,,,,,,,,,,,,,,,,,,,,
152,152,0.6705154615110789,2023-08-23 15:57:53.980698,2023-08-23 15:57:58.039422,0 days 00:00:04.058724,,0.8,3.0,,LightGBM,,,,,0.9,,,,3.751308259399271e-06,1.69631334566978e-08,,90.0,,,,,,,,,,94.0,,,,,,,,,COMPLETE,0.0,,,,,,,,,,,,,,,,,,,,
153,153,0.6693858162981396,2023-08-23 15:57:58.202247,2023-08-23 15:58:02.500876,0 days 00:00:04.298629,,0.8,3.0,,LightGBM,,,,,0.9,,,,3.2624918463934095e-06,1.9757806544359523e-08,,90.0,,,,,,,,,,84.0,,,,,,,,,COMPLETE,0.0,,,,,,,,,,,,,,,,,,,,
154,154,0.6693858162981396,2023-08-23 15:57:59.193370,2023-08-23 15:58:03.588229,0 days 00:00:04.394859,,0.8,3.0,,LightGBM,,,,,0.9,,,,8.780817502501209e-06,1.7742235557199187e-08,,90.0,,,,,,,,,,84.0,,,,,,,,,COMPLETE,0.0,,,,,,,,,,,,,,,,,,,,
155,155,0.6700872608091875,2023-08-23 15:58:02.584095,2023-08-23 15:58:06.490029,0 days 00:00:03.905934,,0.8,3.0,,LightGBM,,,,,0.9,,,,8.699007132175087e-06,3.5304285139465746e-08,,90.0,,,,,,,,,,88.0,,,,,,,,,COMPLETE,0.0,,,,,,,,,,,,,,,,,,,,
156,156,0.6650835203191224,2023-08-23 15:58:03.651985,2023-08-23 15:58:07.271783,0 days 00:00:03.619798,,0.8,3.0,,LightGBM,,,,,0.9,,,,1.1227650223248389e-05,3.7724155287313715e-08,,90.0,,,,,,,,,,85.0,,,,,,,,,COMPLETE,0.0,,,,,,,,,,,,,,,,,,,,
157,157,0.6650835203191224,2023-08-23 15:58:06.602251,2023-08-23 15:58:10.706309,0 days 00:00:04.104058,,0.8,3.0,,LightGBM,,,,,0.9,,,,9.963484508805344e-06,3.544948850864628e-08,,90.0,,,,,,,,,,85.0,,,,,,,,,COMPLETE,0.0,,,,,,,,,,,,,,,,,,,,
158,158,0.6681123317134261,2023-08-23 15:58:07.371023,2023-08-23 15:58:11.553173,0 days 00:00:04.182150,,0.8,3.0,,LightGBM,,,,,0.9,,,,9.330814133705285e-06,1.6917398058644313e-08,,90.0,,,,,,,,,,89.0,,,,,,,,,COMPLETE,0.0,,,,,,,,,,,,,,,,,,,,
159,159,0.664630389839213,2023-08-23 15:58:10.832733,2023-08-23 15:58:14.900856,0 days 00:00:04.068123,,0.8,3.0,,LightGBM,,,,,0.9,,,,8.395238155115142e-06,1.4462952020685297e-08,,90.0,,,,,,,,,,91.0,,,,,,,,,COMPLETE,0.0,,,,,,,,,,,,,,,,,,,,
160,160,0.664630389839213,2023-08-23 15:58:11.645598,2023-08-23 15:58:15.865156,0 days 00:00:04.219558,,0.8,3.0,,LightGBM,,,,,0.9,,,,8.730770326565873e-06,1.5401300119475178e-08,,90.0,,,,,,,,,,91.0,,,,,,,,,COMPLETE,0.0,,,,,,,,,,,,,,,,,,,,
161,161,0.6591971200590477,2023-08-23 15:58:14.968416,2023-08-23 15:58:19.778077,0 days 00:00:04.809661,,0.8,3.0,,LightGBM,,,,,0.9,,,,3.884266326595671e-06,1.5718394484813623e-08,,90.0,,,,,,,,,,197.0,,,,,,,,,COMPLETE,0.0,,,,,,,,,,,,,,,,,,,,
162,162,0.6666464288883388,2023-08-23 15:58:16.054527,2023-08-23 15:58:19.362773,0 days 00:00:03.308246,,0.8,3.0,,LightGBM,,,,,0.9,,,,4.0287712568365765e-06,5.140505498363157e-08,,90.0,,,,,,,,,,76.0,,,,,,,,,COMPLETE,0.0,,,,,,,,,,,,,,,,,,,,
163,163,0.6614606306514939,2023-08-23 15:58:19.475613,2023-08-23 15:58:22.692475,0 days 00:00:03.216862,,0.8,3.0,,LightGBM,,,,,0.9,,,,3.6231182764236976e-06,5.6213403432739856e-08,,80.0,,,,,,,,,,76.0,,,,,,,,,COMPLETE,0.0,,,,,,,,,,,,,,,,,,,,
164,164,0.6615041620479012,2023-08-23 15:58:19.877784,2023-08-23 15:58:24.363713,0 days 00:00:04.485929,,0.8,3.0,,LightGBM,,,,,0.9,,,,4.2181007955628304e-06,5.596781580612902e-08,,80.0,,,,,,,,,,78.0,,,,,,,,,COMPLETE,0.0,,,,,,,,,,,,,,,,,,,,
165,165,0.6560494433497939,2023-08-23 15:58:22.841355,2023-08-23 15:58:26.511054,0 days 00:00:03.669699,,0.8,3.0,,LightGBM,,,,,1.0,,,,9.18659497227423e-07,3.216760506766325e-08,,80.0,,,,,,,,,,79.0,,,,,,,,,COMPLETE,0.0,,,,,,,,,,,,,,,,,,,,
166,166,0.664727073152219,2023-08-23 15:58:24.460092,2023-08-23 15:58:27.999385,0 days 00:00:03.539293,,0.8,3.0,,LightGBM,,,,,1.0,,,,6.401965281131086e-07,3.4040118127085776e-08,,90.0,,,,,,,,,,83.0,,,,,,,,,COMPLETE,0.0,,,,,,,,,,,,,,,,,,,,
167,167,0.6597948214621374,2023-08-23 15:58:26.648747,2023-08-23 15:58:29.805654,0 days 00:00:03.156907,,0.6000000000000001,3.0,,LightGBM,,,,,0.9,,,,3.4410682626581845e-05,2.3878259608860385e-08,,90.0,,,,,,,,,,69.0,,,,,,,,,COMPLETE,0.0,,,,,,,,,,,,,,,,,,,,
168,168,0.6673953427753885,2023-08-23 15:58:28.089269,2023-08-23 15:58:31.250394,0 days 00:00:03.161125,,0.8,3.0,,LightGBM,,,,,0.9,,,,8.017928266315663e-06,1.1042732685443712e-08,,90.0,,,,,,,,,,71.0,,,,,,,,,COMPLETE,0.0,,,,,,,,,,,,,,,,,,,,
169,169,0.6738505237826091,2023-08-23 15:58:29.897004,2023-08-23 15:58:33.804803,0 days 00:00:03.907799,,0.8,3.0,,LightGBM,,,,,0.9,,,,8.978991265925294e-06,1.3320786929716562e-08,,90.0,,,,,,,,,,95.0,,,,,,,,,COMPLETE,0.0,,,,,,,,,,,,,,,,,,,,
170,170,0.6586324490363646,2023-08-23 15:58:31.342001,2023-08-23 15:58:33.602198,0 days 00:00:02.260197,,0.8,3.0,,LightGBM,,,,,0.9,,,,7.671598218086807e-06,1.0405577800687743e-08,,90.0,,,,,,,,,,54.0,,,,,,,,,COMPLETE,0.0,,,,,,,,,,,,,,,,,,,,
171,171,0.6637310010112012,2023-08-23 15:58:33.739608,2023-08-23 15:58:37.454693,0 days 00:00:03.715085,,0.8,3.0,,LightGBM,,,,,0.9,,,,1.6739079117030798e-05,2.2629128428216906e-08,,100.0,,,,,,,,,,89.0,,,,,,,,,COMPLETE,0.0,,,,,,,,,,,,,,,,,,,,
