,number,value,datetime_start,datetime_complete,duration,params_alpha,params_bagging_fraction,params_bagging_freq,params_booster,params_classifier,params_colsample_bytree,params_dct_criterion,params_dct_max_depth,params_eta,params_feature_fraction,params_gamma,params_grow_policy,params_lambda,params_lambda_l1,params_lambda_l2,params_max_depth,params_min_child_samples,params_min_child_weight,params_mlp_activation,params_mlp_solver,params_n_layers,params_n_units_l_0,params_n_units_l_1,params_n_units_l_2,params_n_units_l_3,params_normalize_type,params_num_leaves,params_rate_drop,params_rf_estimator,params_rf_max_depth,params_sample_type,params_skip_drop,params_subsample,params_svc_c,params_svc_kernel,state,best_trial,dev_acc,dev_recall_macro,dev_precision_macro,dev_f1_macro,dev_recall_0,dev_precision_0,dev_f1_0,dev_recall_1,dev_precision_1,dev_f1_1,test_acc,test_recall_macro,test_precision_macro,test_f1_macro,test_recall_0,test_precision_0,test_f1_0,test_recall_1,test_precision_1,test_f1_1
84,84,0.5856600717074048,2023-08-23 17:50:30.936553,2023-08-23 17:50:32.534171,0 days 00:00:01.597618,,0.8,2.0,,LightGBM,,,,,0.5,,,,0.001839740359057996,0.29337701555870416,,90.0,,,,,,,,,,75.0,,,,,,,,,COMPLETE,0.0,,,,,,,,,,,,,,,,,,,,
85,85,0.5658693175934555,2023-08-23 17:50:32.445851,2023-08-23 17:50:34.040397,0 days 00:00:01.594546,,0.8,2.0,,LightGBM,,,,,0.5,,,,0.0033395859552342077,0.3088726049602677,,90.0,,,,,,,,,,79.0,,,,,,,,,COMPLETE,0.0,,,,,,,,,,,,,,,,,,,,
86,86,0.3573487031700288,2023-08-23 17:50:32.651957,2023-08-23 17:50:33.042519,0 days 00:00:00.390562,2.678720040794486e-05,,,dart,XGBoost,0.2176421093940784,,,1.0990443368569089e-08,,0.00021661349624402015,lossguide,2.5642399265830175e-05,,,9.0,,5.0,,,,,,,,tree,,1.4165616461168796e-08,,,uniform,1.394094439403473e-08,0.4748096776312641,,,COMPLETE,0.0,,,,,,,,,,,,,,,,,,,,
87,87,0.5467708216165479,2023-08-23 17:50:33.140626,2023-08-23 17:50:38.003364,0 days 00:00:04.862738,,0.7000000000000001,2.0,,LightGBM,,,,,0.6000000000000001,,,,0.005069633935360682,0.9449324357404539,,20.0,,,,,,,,,,189.0,,,,,,,,,COMPLETE,0.0,,,,,,,,,,,,,,,,,,,,
88,88,0.5724582484830584,2023-08-23 17:50:34.096651,2023-08-23 17:50:36.182521,0 days 00:00:02.085870,,0.7000000000000001,2.0,,LightGBM,,,,,0.5,,,,0.008592115711844569,0.9936637101996635,,60.0,,,,,,,,,,214.0,,,,,,,,,COMPLETE,0.0,,,,,,,,,,,,,,,,,,,,
89,89,0.5846676772327735,2023-08-23 17:50:34.222613,2023-08-23 17:50:36.178129,0 days 00:00:01.955516,,0.7000000000000001,2.0,,LightGBM,,,,,0.5,,,,0.007544679618855676,0.7829732249328506,,60.0,,,,,,,,,,190.0,,,,,,,,,COMPLETE,0.0,,,,,,,,,,,,,,,,,,,,
90,90,0.5770245752927594,2023-08-23 17:50:35.245795,2023-08-23 17:50:37.122004,0 days 00:00:01.876209,,0.7000000000000001,2.0,,LightGBM,,,,,0.5,,,,0.011247472515454998,0.9230876248676914,,60.0,,,,,,,,,,212.0,,,,,,,,,COMPLETE,0.0,,,,,,,,,,,,,,,,,,,,
91,91,0.567829457364341,2023-08-23 17:50:36.329002,2023-08-23 17:50:42.050428,0 days 00:00:05.721426,,0.9,3.0,,LightGBM,,,,,0.6000000000000001,,,,0.03271923219700846,0.1520403373071786,,20.0,,,,,,,,,,211.0,,,,,,,,,COMPLETE,0.0,,,,,,,,,,,,,,,,,,,,
92,92,0.5622326822098918,2023-08-23 17:50:36.330092,2023-08-23 17:50:40.142110,0 days 00:00:03.812018,,0.4,3.0,,LightGBM,,,,,0.6000000000000001,,,,0.03607130406516139,0.1253332893823575,,20.0,,,,,,,,,,210.0,,,,,,,,,COMPLETE,0.0,,,,,,,,,,,,,,,,,,,,
93,93,0.5772886104558214,2023-08-23 17:50:37.199931,2023-08-23 17:50:38.622147,0 days 00:00:01.422216,,0.9,2.0,,LightGBM,,,,,0.6000000000000001,,,,0.000870464714553682,0.11906006661103685,,70.0,,,,,,,,,,34.0,,,,,,,,,COMPLETE,0.0,,,,,,,,,,,,,,,,,,,,
94,94,0.5644621745725031,2023-08-23 17:50:37.482136,2023-08-23 17:50:40.796453,0 days 00:00:03.314317,,0.4,3.0,,LightGBM,,,,,0.6000000000000001,,,,0.036439615155409805,0.14091604394889728,,20.0,,,,,,,,,,236.0,,,,,,,,,COMPLETE,0.0,,,,,,,,,,,,,,,,,,,,
95,95,0.5688190980497357,2023-08-23 17:50:38.062989,2023-08-23 17:50:40.394413,0 days 00:00:02.331424,,0.9,3.0,,LightGBM,,,,,0.4,,,,0.03288505085341289,0.12671661150528865,,70.0,,,,,,,,,,161.0,,,,,,,,,COMPLETE,0.0,,,,,,,,,,,,,,,,,,,,
96,96,0.5678243778852997,2023-08-23 17:50:38.695297,2023-08-23 17:50:40.595471,0 days 00:00:01.900174,,0.4,3.0,,LightGBM,,,,,0.4,,,,0.027220667556469257,0.11619634388386373,,70.0,,,,,,,,,,156.0,,,,,,,,,COMPLETE,0.0,,,,,,,,,,,,,,,,,,,,
97,97,0.5539699565255691,2023-08-23 17:50:40.246153,2023-08-23 17:50:42.490633,0 days 00:00:02.244480,,0.6000000000000001,3.0,,LightGBM,,,,,1.0,,,,0.037767273346715965,0.315125459292214,,70.0,,,,,,,,,,158.0,,,,,,,,,COMPLETE,0.0,,,,,,,,,,,,,,,,,,,,
98,98,0.575754983871992,2023-08-23 17:50:40.477599,2023-08-23 17:50:42.803619,0 days 00:00:02.326020,,0.6000000000000001,2.0,,LightGBM,,,,,0.7000000000000001,,,,0.01899693597295013,0.4273241921008702,,70.0,,,,,,,,,,202.0,,,,,,,,,COMPLETE,0.0,,,,,,,,,,,,,,,,,,,,
99,99,0.5770791481225495,2023-08-23 17:50:40.741681,2023-08-23 17:50:43.626729,0 days 00:00:02.885048,,0.6000000000000001,2.0,,LightGBM,,,,,0.7000000000000001,,,,0.0205433392034213,0.5733854498439204,,60.0,,,,,,,,,,200.0,,,,,,,,,COMPLETE,0.0,,,,,,,,,,,,,,,,,,,,
100,100,0.5308341673856773,2023-08-23 17:50:40.884100,2023-08-23 17:50:40.982241,0 days 00:00:00.098141,,,,,DecisionTreeClassifier,,entropy,2.0,,,,,,,,,,,,,,,,,,,,,,,,,,,,COMPLETE,0.0,,,,,,,,,,,,,,,,,,,,
101,101,0.5688190980497357,2023-08-23 17:50:41.094263,2023-08-23 17:50:44.035974,0 days 00:00:02.941711,,0.6000000000000001,2.0,,LightGBM,,,,,0.7000000000000001,,,,0.01976612564853058,0.39174843702191114,,60.0,,,,,,,,,,197.0,,,,,,,,,COMPLETE,0.0,,,,,,,,,,,,,,,,,,,,
102,102,0.5803207855805038,2023-08-23 17:50:41.198133,2023-08-23 17:50:43.351217,0 days 00:00:02.153084,,0.6000000000000001,2.0,,LightGBM,,,,,0.7000000000000001,,,,0.01734797585597883,0.3737501965881708,,60.0,,,,,,,,,,198.0,,,,,,,,,COMPLETE,0.0,,,,,,,,,,,,,,,,,,,,
103,103,0.5810250421694564,2023-08-23 17:50:42.128918,2023-08-23 17:50:44.418312,0 days 00:00:02.289394,,0.6000000000000001,2.0,,LightGBM,,,,,1.0,,,,0.36768126816850066,0.40182549789695354,,60.0,,,,,,,,,,201.0,,,,,,,,,COMPLETE,0.0,,,,,,,,,,,,,,,,,,,,
104,104,0.5903935871496027,2023-08-23 17:50:42.553176,2023-08-23 17:50:44.571772,0 days 00:00:02.018596,,0.6000000000000001,2.0,,LightGBM,,,,,0.7000000000000001,,,,0.019030300224043596,0.4206522694136522,,60.0,,,,,,,,,,198.0,,,,,,,,,COMPLETE,0.0,,,,,,,,,,,,,,,,,,,,
105,105,0.5792101288601819,2023-08-23 17:50:42.900784,2023-08-23 17:50:45.536193,0 days 00:00:02.635409,,0.7000000000000001,2.0,,LightGBM,,,,,0.7000000000000001,,,,0.3539399936962502,0.4321110890380695,,60.0,,,,,,,,,,197.0,,,,,,,,,COMPLETE,0.0,,,,,,,,,,,,,,,,,,,,
106,106,0.5899540954736454,2023-08-23 17:50:43.421357,2023-08-23 17:50:45.366438,0 days 00:00:01.945081,,0.7000000000000001,2.0,,LightGBM,,,,,0.6000000000000001,,,,0.4740826428968838,0.03914038130147817,,80.0,,,,,,,,,,175.0,,,,,,,,,COMPLETE,0.0,,,,,,,,,,,,,,,,,,,,
107,107,0.5727331255955292,2023-08-23 17:50:43.701371,2023-08-23 17:50:46.610039,0 days 00:00:02.908668,,0.7000000000000001,2.0,,LightGBM,,,,,0.6000000000000001,,,,0.559602127942539,0.029559259199590272,,60.0,,,,,,,,,,113.0,,,,,,,,,COMPLETE,0.0,,,,,,,,,,,,,,,,,,,,
108,108,0.5873147935757523,2023-08-23 17:50:44.169397,2023-08-23 17:50:46.207467,0 days 00:00:02.038070,,0.8,2.0,,LightGBM,,,,,0.5,,,,0.002001051672855905,0.047823723862835475,,90.0,,,,,,,,,,69.0,,,,,,,,,COMPLETE,0.0,,,,,,,,,,,,,,,,,,,,
109,109,0.5754106925175597,2023-08-23 17:50:44.524708,2023-08-23 17:50:47.013572,0 days 00:00:02.488864,,0.8,2.0,,LightGBM,,,,,0.5,,,,0.0016474579841122472,0.04428812323248262,,90.0,,,,,,,,,,67.0,,,,,,,,,COMPLETE,0.0,,,,,,,,,,,,,,,,,,,,
110,110,0.5846133033633034,2023-08-23 17:50:44.662109,2023-08-23 17:50:46.866281,0 days 00:00:02.204172,,0.7000000000000001,2.0,,LightGBM,,,,,0.6000000000000001,,,,0.11940377819760331,0.03805859918626044,,80.0,,,,,,,,,,128.0,,,,,,,,,COMPLETE,0.0,,,,,,,,,,,,,,,,,,,,
111,111,0.3573487031700288,2023-08-23 17:50:45.432260,2023-08-23 17:50:45.712159,0 days 00:00:00.279899,0.47141130306264056,,,gblinear,XGBoost,0.7246068922239085,,,,,,,1.0181622038473833e-08,,,,,,,,,,,,,,,,,,,,0.669721791121399,,,COMPLETE,0.0,,,,,,,,,,,,,,,,,,,,
112,112,0.559460372748304,2023-08-23 17:50:45.643070,2023-08-23 17:50:47.798315,0 days 00:00:02.155245,,0.5,2.0,,LightGBM,,,,,0.6000000000000001,,,,0.5429578536975891,0.041490186997350714,,80.0,,,,,,,,,,221.0,,,,,,,,,COMPLETE,0.0,,,,,,,,,,,,,,,,,,,,
113,113,0.5554155892660315,2023-08-23 17:50:45.786568,2023-08-23 17:50:47.645884,0 days 00:00:01.859316,,0.5,2.0,,LightGBM,,,,,0.6000000000000001,,,,0.1503522581028782,0.05439434564843156,,80.0,,,,,,,,,,120.0,,,,,,,,,COMPLETE,0.0,,,,,,,,,,,,,,,,,,,,
114,114,0.5588531938010055,2023-08-23 17:50:46.318235,2023-08-23 17:50:48.288237,0 days 00:00:01.970002,,0.5,2.0,,LightGBM,,,,,0.6000000000000001,,,,0.12970214140056144,0.0627596034416924,,80.0,,,,,,,,,,177.0,,,,,,,,,COMPLETE,0.0,,,,,,,,,,,,,,,,,,,,
115,115,0.5559243279123797,2023-08-23 17:50:46.729460,2023-08-23 17:50:48.498623,0 days 00:00:01.769163,,0.5,2.0,,LightGBM,,,,,0.6000000000000001,,,,0.0039900732372235405,0.06793457499937931,,80.0,,,,,,,,,,178.0,,,,,,,,,COMPLETE,0.0,,,,,,,,,,,,,,,,,,,,
116,116,0.39557620637916846,2023-08-23 17:50:46.942192,2023-08-23 17:52:45.455455,0 days 00:01:58.513263,,,,,MLPClassifier,,,,,,,,,,,,,,tanh,adam,2.0,60.0,50.0,,,,,,,,,,,,,COMPLETE,0.0,,,,,,,,,,,,,,,,,,,,
117,117,0.36564154067479165,2023-08-23 17:50:47.098084,2023-08-23 17:51:11.797811,0 days 00:00:24.699727,,,,,MLPClassifier,,,,,,,,,,,,,,tanh,sgd,2.0,60.0,50.0,,,,,,,,,,,,,COMPLETE,0.0,,,,,,,,,,,,,,,,,,,,
118,118,0.5846676772327735,2023-08-23 17:50:47.720616,2023-08-23 17:50:50.719066,0 days 00:00:02.998450,,0.8,2.0,,LightGBM,,,,,0.5,,,,0.004378038249027514,0.07590698864505309,,50.0,,,,,,,,,,176.0,,,,,,,,,COMPLETE,0.0,,,,,,,,,,,,,,,,,,,,
119,119,0.5780666116562515,2023-08-23 17:50:47.931137,2023-08-23 17:50:49.059798,0 days 00:00:01.128661,,0.7000000000000001,2.0,,LightGBM,,,,,0.5,,,,0.06101889732757202,0.0004005911444858899,,50.0,,,,,,,,,,16.0,,,,,,,,,COMPLETE,0.0,,,,,,,,,,,,,,,,,,,,
120,120,0.3573487031700288,2023-08-23 17:50:48.345136,2023-08-23 17:51:11.532169,0 days 00:00:23.187033,,,,,MLPClassifier,,,,,,,,,,,,,,tanh,sgd,2.0,60.0,50.0,,,,,,,,,,,,,COMPLETE,0.0,,,,,,,,,,,,,,,,,,,,
121,121,0.36012523631635246,2023-08-23 17:50:48.601464,2023-08-23 17:51:13.995810,0 days 00:00:25.394346,,,,,MLPClassifier,,,,,,,,,,,,,,tanh,sgd,2.0,70.0,50.0,,,,,,,,,,,,,COMPLETE,0.0,,,,,,,,,,,,,,,,,,,,
122,122,0.5299770472184265,2023-08-23 17:50:49.135604,2023-08-23 17:50:49.459237,0 days 00:00:00.323633,,,,,DecisionTreeClassifier,,gini,13.0,,,,,,,,,,,,,,,,,,,,,,,,,,,,COMPLETE,0.0,,,,,,,,,,,,,,,,,,,,
123,123,0.39018944460471905,2023-08-23 17:50:49.554115,2023-08-23 17:52:20.215886,0 days 00:01:30.661771,,,,,MLPClassifier,,,,,,,,,,,,,,tanh,adam,2.0,70.0,50.0,,,,,,,,,,,,,COMPLETE,0.0,,,,,,,,,,,,,,,,,,,,
124,124,0.4176636933482139,2023-08-23 17:50:50.809342,2023-08-23 17:52:45.681066,0 days 00:01:54.871724,,,,,MLPClassifier,,,,,,,,,,,,,,tanh,adam,2.0,60.0,50.0,,,,,,,,,,,,,COMPLETE,0.0,,,,,,,,,,,,,,,,,,,,
125,125,0.42386804014441387,2023-08-23 17:51:05.375457,2023-08-23 17:52:44.551235,0 days 00:01:39.175778,,,,,MLPClassifier,,,,,,,,,,,,,,tanh,adam,2.0,60.0,40.0,,,,,,,,,,,,,COMPLETE,0.0,,,,,,,,,,,,,,,,,,,,
126,126,0.5848745214136823,2023-08-23 17:51:11.591136,2023-08-23 17:51:13.117362,0 days 00:00:01.526226,,0.8,1.0,,LightGBM,,,,,0.4,,,,0.9556915907358289,0.020014876066753798,,100.0,,,,,,,,,,191.0,,,,,,,,,COMPLETE,0.0,,,,,,,,,,,,,,,,,,,,
127,127,0.4196386504877994,2023-08-23 17:51:11.895977,2023-08-23 17:51:12.798438,0 days 00:00:00.902461,,,,,RandomForestClassifier,,,,,,,,,,,,,,,,,,,,,,,,53.0,2.0,,,,,,COMPLETE,0.0,,,,,,,,,,,,,,,,,,,,
128,128,0.5754116327179108,2023-08-23 17:51:12.865506,2023-08-23 17:51:14.394009,0 days 00:00:01.528503,,0.7000000000000001,2.0,,LightGBM,,,,,0.4,,,,0.012942126231714292,0.019321438491860556,,100.0,,,,,,,,,,189.0,,,,,,,,,COMPLETE,0.0,,,,,,,,,,,,,,,,,,,,
129,129,0.5919044665012407,2023-08-23 17:51:13.188787,2023-08-23 17:51:15.283219,0 days 00:00:02.094432,,0.7000000000000001,2.0,,LightGBM,,,,,0.7000000000000001,,,,0.01144234700235375,0.0022168978924310026,,70.0,,,,,,,,,,221.0,,,,,,,,,COMPLETE,0.0,,,,,,,,,,,,,,,,,,,,
130,130,0.5668357929420371,2023-08-23 17:51:14.050930,2023-08-23 17:51:16.432693,0 days 00:00:02.381763,,0.7000000000000001,2.0,,LightGBM,,,,,0.7000000000000001,,,,0.011262648201569884,0.18136908113355996,,70.0,,,,,,,,,,222.0,,,,,,,,,COMPLETE,0.0,,,,,,,,,,,,,,,,,,,,
131,131,0.5919044665012407,2023-08-23 17:51:14.470251,2023-08-23 17:51:16.537433,0 days 00:00:02.067182,,0.7000000000000001,2.0,,LightGBM,,,,,0.8,,,,0.06438254115073447,0.5938372932353766,,70.0,,,,,,,,,,223.0,,,,,,,,,COMPLETE,0.0,,,,,,,,,,,,,,,,,,,,
132,132,0.5587372867454068,2023-08-23 17:51:15.356296,2023-08-23 17:51:18.745018,0 days 00:00:03.388722,,0.7000000000000001,2.0,,LightGBM,,,,,0.8,,,,0.007195314097892393,0.0035583182415743456,,40.0,,,,,,,,,,244.0,,,,,,,,,COMPLETE,0.0,,,,,,,,,,,,,,,,,,,,
133,133,0.5747692849777446,2023-08-23 17:51:16.499282,2023-08-23 17:51:18.352820,0 days 00:00:01.853538,,0.7000000000000001,2.0,,LightGBM,,,,,0.8,,,,0.07683264208632581,0.004201021649731875,,70.0,,,,,,,,,,243.0,,,,,,,,,COMPLETE,0.0,,,,,,,,,,,,,,,,,,,,
134,134,0.5711538461538461,2023-08-23 17:51:16.604525,2023-08-23 17:51:18.432865,0 days 00:00:01.828340,,0.7000000000000001,2.0,,LightGBM,,,,,0.8,,,,0.06604664081466204,0.003348533362921233,,70.0,,,,,,,,,,235.0,,,,,,,,,COMPLETE,0.0,,,,,,,,,,,,,,,,,,,,
135,135,0.5800132866366106,2023-08-23 17:51:18.535336,2023-08-23 17:51:20.768091,0 days 00:00:02.232755,,0.7000000000000001,1.0,,LightGBM,,,,,0.9,,,,0.009021313099855427,0.0021447929357170537,,70.0,,,,,,,,,,218.0,,,,,,,,,COMPLETE,0.0,,,,,,,,,,,,,,,,,,,,
136,136,0.5411469658193666,2023-08-23 17:51:18.558598,2023-08-23 17:51:22.126957,0 days 00:00:03.568359,,0.7000000000000001,1.0,,LightGBM,,,,,0.9,,,,0.006650908734668364,0.268596952428,,40.0,,,,,,,,,,220.0,,,,,,,,,COMPLETE,0.0,,,,,,,,,,,,,,,,,,,,
137,137,0.5574747580616985,2023-08-23 17:51:18.826404,2023-08-23 17:51:19.399262,0 days 00:00:00.572858,0.0001840421344465388,,,dart,XGBoost,0.7880088974830719,,,0.0015808385844376309,,3.446635843272202e-05,depthwise,3.078271893325461e-05,,,5.0,,6.0,,,,,,,,forest,,0.8502611994386001,,,uniform,0.00010081509229472445,0.47042573092033213,,,COMPLETE,0.0,,,,,,,,,,,,,,,,,,,,
138,138,0.5776515151515151,2023-08-23 17:51:19.487000,2023-08-23 17:51:21.464866,0 days 00:00:01.977866,,0.7000000000000001,1.0,,LightGBM,,,,,0.9,,,,0.2214502930472317,0.002267381526327457,,90.0,,,,,,,,,,218.0,,,,,,,,,COMPLETE,0.0,,,,,,,,,,,,,,,,,,,,
139,139,0.5681859550061383,2023-08-23 17:51:20.887698,2023-08-23 17:51:22.932840,0 days 00:00:02.045142,,0.8,2.0,,LightGBM,,,,,0.5,,,,0.26025875178127306,0.22670921168321684,,90.0,,,,,,,,,,207.0,,,,,,,,,COMPLETE,0.0,,,,,,,,,,,,,,,,,,,,
140,140,0.5864626796476589,2023-08-23 17:51:21.588827,2023-08-23 17:51:23.834254,0 days 00:00:02.245427,,0.8,2.0,,LightGBM,,,,,0.5,,,,0.0028173316131464106,0.24492227620773943,,70.0,,,,,,,,,,45.0,,,,,,,,,COMPLETE,0.0,,,,,,,,,,,,,,,,,,,,
141,141,0.5763954846243675,2023-08-23 17:51:21.810068,2023-08-23 17:51:23.515061,0 days 00:00:01.704993,,0.8,2.0,,LightGBM,,,,,0.5,,,,0.002458028517306032,0.2575729683181693,,70.0,,,,,,,,,,50.0,,,,,,,,,COMPLETE,0.0,,,,,,,,,,,,,,,,,,,,
142,142,0.5783911109733608,2023-08-23 17:51:22.212523,2023-08-23 17:51:24.285856,0 days 00:00:02.073333,,0.8,2.0,,LightGBM,,,,,0.5,,,,0.0035619432960588386,0.6100295918550768,,80.0,,,,,,,,,,207.0,,,,,,,,,COMPLETE,0.0,,,,,,,,,,,,,,,,,,,,
143,143,0.5760933888417685,2023-08-23 17:51:23.005273,2023-08-23 17:51:24.595880,0 days 00:00:01.590607,,0.4,2.0,,LightGBM,,,,,0.7000000000000001,,,,0.0025460394750755327,0.5620398555257586,,70.0,,,,,,,,,,50.0,,,,,,,,,COMPLETE,0.0,,,,,,,,,,,,,,,,,,,,
144,144,0.5731306682670171,2023-08-23 17:51:23.604171,2023-08-23 17:51:25.192511,0 days 00:00:01.588340,,0.4,2.0,,LightGBM,,,,,0.7000000000000001,,,,0.05222381798922258,0.6041134419484526,,80.0,,,,,,,,,,227.0,,,,,,,,,COMPLETE,0.0,,,,,,,,,,,,,,,,,,,,
145,145,0.5685068013389833,2023-08-23 17:51:23.935091,2023-08-23 17:51:26.073535,0 days 00:00:02.138444,,0.4,2.0,,LightGBM,,,,,0.7000000000000001,,,,0.048486162695345544,0.6304645678961437,,50.0,,,,,,,,,,207.0,,,,,,,,,COMPLETE,0.0,,,,,,,,,,,,,,,,,,,,
146,146,0.5787066669419609,2023-08-23 17:51:24.348586,2023-08-23 17:51:27.214813,0 days 00:00:02.866227,,0.7000000000000001,2.0,,LightGBM,,,,,0.7000000000000001,,,,0.04506466576287831,0.6087544136958332,,50.0,,,,,,,,,,226.0,,,,,,,,,COMPLETE,0.0,,,,,,,,,,,,,,,,,,,,
147,147,0.58665216941079,2023-08-23 17:51:24.678296,2023-08-23 17:51:27.576567,0 days 00:00:02.898271,,0.7000000000000001,2.0,,LightGBM,,,,,0.7000000000000001,,,,0.0490892461029779,0.006246494738728377,,50.0,,,,,,,,,,228.0,,,,,,,,,COMPLETE,0.0,,,,,,,,,,,,,,,,,,,,
148,148,0.5829142652469799,2023-08-23 17:51:25.299461,2023-08-23 17:51:26.767176,0 days 00:00:01.467715,,0.7000000000000001,2.0,,LightGBM,,,,,0.5,,,,0.000837278594440049,0.20477944588022626,,70.0,,,,,,,,,,27.0,,,,,,,,,COMPLETE,0.0,,,,,,,,,,,,,,,,,,,,
149,149,0.5864626796476589,2023-08-23 17:51:26.208937,2023-08-23 17:51:27.717608,0 days 00:00:01.508671,,0.7000000000000001,2.0,,LightGBM,,,,,0.5,,,,0.0008195133833745599,0.200688926841316,,30.0,,,,,,,,,,26.0,,,,,,,,,COMPLETE,0.0,,,,,,,,,,,,,,,,,,,,
150,150,0.5676688692505292,2023-08-23 17:51:26.906692,2023-08-23 17:51:28.052427,0 days 00:00:01.145735,,0.8,2.0,,LightGBM,,,,,0.5,,,,0.011497916099814577,0.9866498773422261,,70.0,,,,,,,,,,4.0,,,,,,,,,COMPLETE,0.0,,,,,,,,,,,,,,,,,,,,
151,151,0.5853338599296865,2023-08-23 17:51:27.289171,2023-08-23 17:51:29.423173,0 days 00:00:02.134002,,0.8,2.0,,LightGBM,,,,,0.5,,,,0.011604641948176222,0.31206901201226034,,70.0,,,,,,,,,,41.0,,,,,,,,,COMPLETE,0.0,,,,,,,,,,,,,,,,,,,,
152,152,0.5698156028368795,2023-08-23 17:51:27.644348,2023-08-23 17:51:30.706330,0 days 00:00:03.061982,,0.7000000000000001,2.0,,LightGBM,,,,,0.7000000000000001,,,,0.025622135963625545,0.006048902114041788,,60.0,,,,,,,,,,192.0,,,,,,,,,COMPLETE,0.0,,,,,,,,,,,,,,,,,,,,
153,153,0.5862196932211776,2023-08-23 17:51:27.860498,2023-08-23 17:51:30.515178,0 days 00:00:02.654680,,0.6000000000000001,2.0,,LightGBM,,,,,0.7000000000000001,,,,0.024089224834991242,0.0876418412509209,,60.0,,,,,,,,,,213.0,,,,,,,,,COMPLETE,0.0,,,,,,,,,,,,,,,,,,,,
154,154,0.5238443372962686,2023-08-23 17:51:28.127078,2023-08-23 17:51:28.429272,0 days 00:00:00.302194,,,,,DecisionTreeClassifier,,gini,4.0,,,,,,,,,,,,,,,,,,,,,,,,,,,,COMPLETE,0.0,,,,,,,,,,,,,,,,,,,,
155,155,0.5747744023357513,2023-08-23 17:51:28.518939,2023-08-23 17:51:31.237926,0 days 00:00:02.718987,,0.7000000000000001,2.0,,LightGBM,,,,,0.7000000000000001,,,,0.024416153214174993,0.005170668950122012,,60.0,,,,,,,,,,232.0,,,,,,,,,COMPLETE,0.0,,,,,,,,,,,,,,,,,,,,
156,156,0.5588713209839911,2023-08-23 17:51:29.505537,2023-08-23 17:51:35.367392,0 days 00:00:05.861855,,0.7000000000000001,2.0,,LightGBM,,,,,0.7000000000000001,,,,0.02474009548168202,0.005603084948589991,,10.0,,,,,,,,,,192.0,,,,,,,,,COMPLETE,0.0,,,,,,,,,,,,,,,,,,,,
157,157,0.5747416338582677,2023-08-23 17:51:30.593182,2023-08-23 17:51:38.083638,0 days 00:00:07.490456,,0.7000000000000001,2.0,,LightGBM,,,,,0.8,,,,0.026574912752846867,0.00550151389531168,,10.0,,,,,,,,,,237.0,,,,,,,,,COMPLETE,0.0,,,,,,,,,,,,,,,,,,,,
158,158,0.5760872372628327,2023-08-23 17:51:30.777740,2023-08-23 17:51:38.315261,0 days 00:00:07.537521,,0.7000000000000001,2.0,,LightGBM,,,,,0.6000000000000001,,,,0.647906303251486,0.014331116864177549,,10.0,,,,,,,,,,235.0,,,,,,,,,COMPLETE,0.0,,,,,,,,,,,,,,,,,,,,
159,159,0.5915898826122272,2023-08-23 17:51:31.336938,2023-08-23 17:51:34.026906,0 days 00:00:02.689968,,0.7000000000000001,2.0,,LightGBM,,,,,0.6000000000000001,,,,0.015489263744383008,0.001646567790080329,,10.0,,,,,,,,,,61.0,,,,,,,,,COMPLETE,0.0,,,,,,,,,,,,,,,,,,,,
160,160,0.5687348912167607,2023-08-23 17:51:34.125244,2023-08-23 17:51:40.394409,0 days 00:00:06.269165,,0.7000000000000001,2.0,,LightGBM,,,,,0.6000000000000001,,,,0.005503849555464147,0.0015210736428726635,,10.0,,,,,,,,,,203.0,,,,,,,,,COMPLETE,0.0,,,,,,,,,,,,,,,,,,,,
161,161,0.5589417003210106,2023-08-23 17:51:35.460173,2023-08-23 17:51:42.712946,0 days 00:00:07.252773,,0.7000000000000001,2.0,,LightGBM,,,,,0.6000000000000001,,,,0.005271360051562421,0.0012728682484191016,,10.0,,,,,,,,,,238.0,,,,,,,,,COMPLETE,0.0,,,,,,,,,,,,,,,,,,,,
162,162,0.5648215907616452,2023-08-23 17:51:38.256139,2023-08-23 17:51:41.978881,0 days 00:00:03.722742,,0.7000000000000001,2.0,,LightGBM,,,,,0.6000000000000001,,,,0.005738152093963623,0.014167791145744422,,10.0,,,,,,,,,,98.0,,,,,,,,,COMPLETE,0.0,,,,,,,,,,,,,,,,,,,,
163,163,0.5227985758068513,2023-08-23 17:51:38.493559,2023-08-23 17:51:40.737948,0 days 00:00:02.244389,,,,,RandomForestClassifier,,,,,,,,,,,,,,,,,,,,,,,,53.0,4.0,,,,,,COMPLETE,0.0,,,,,,,,,,,,,,,,,,,,
164,164,0.5813178594455191,2023-08-23 17:51:40.496984,2023-08-23 17:51:43.227608,0 days 00:00:02.730624,,0.6000000000000001,2.0,,LightGBM,,,,,0.6000000000000001,,,,0.013188597012629148,0.0008319622407995639,,60.0,,,,,,,,,,94.0,,,,,,,,,COMPLETE,0.0,,,,,,,,,,,,,,,,,,,,
165,165,0.5731306682670171,2023-08-23 17:51:40.815894,2023-08-23 17:51:44.289022,0 days 00:00:03.473128,,0.7000000000000001,2.0,,LightGBM,,,,,0.6000000000000001,,,,0.015229597665627544,0.0009139478571620121,,30.0,,,,,,,,,,95.0,,,,,,,,,COMPLETE,0.0,,,,,,,,,,,,,,,,,,,,
166,166,0.578066945812744,2023-08-23 17:51:42.096312,2023-08-23 17:51:45.805805,0 days 00:00:03.709493,,0.6000000000000001,2.0,,LightGBM,,,,,0.6000000000000001,,,,0.01514721082640097,0.0009847117046561675,,30.0,,,,,,,,,,148.0,,,,,,,,,COMPLETE,0.0,,,,,,,,,,,,,,,,,,,,
167,167,0.5698359197531103,2023-08-23 17:51:42.808959,2023-08-23 17:51:46.599082,0 days 00:00:03.790123,,0.6000000000000001,2.0,,LightGBM,,,,,0.4,,,,0.014709493028775044,0.007367078959452333,,30.0,,,,,,,,,,182.0,,,,,,,,,COMPLETE,0.0,,,,,,,,,,,,,,,,,,,,
