,number,value,datetime_start,datetime_complete,duration,params_alpha,params_bagging_fraction,params_bagging_freq,params_booster,params_classifier,params_colsample_bytree,params_dct_criterion,params_dct_max_depth,params_eta,params_feature_fraction,params_gamma,params_grow_policy,params_lambda,params_lambda_l1,params_lambda_l2,params_max_depth,params_min_child_samples,params_min_child_weight,params_mlp_activation,params_mlp_solver,params_n_layers,params_n_units_l_0,params_n_units_l_1,params_n_units_l_2,params_n_units_l_3,params_normalize_type,params_num_leaves,params_rate_drop,params_rf_estimator,params_rf_max_depth,params_sample_type,params_skip_drop,params_subsample,params_svc_c,params_svc_kernel,state,best_trial,dev_acc,dev_recall_macro,dev_precision_macro,dev_f1_macro,dev_recall_0,dev_precision_0,dev_f1_0,dev_recall_1,dev_precision_1,dev_f1_1,test_acc,test_recall_macro,test_precision_macro,test_f1_macro,test_recall_0,test_precision_0,test_f1_0,test_recall_1,test_precision_1,test_f1_1
84,84,0.5954140900006406,2023-08-23 18:10:02.141068,2023-08-23 18:10:03.727434,0 days 00:00:01.586366,,0.4,2.0,,LightGBM,,,,,0.9,,,,0.05936012980014049,0.18557684972935348,,60.0,,,,,,,,,,30.0,,,,,,,,,COMPLETE,0.0,,,,,,,,,,,,,,,,,,,,
85,85,0.587655164917767,2023-08-23 18:10:02.541499,2023-08-23 18:10:04.165854,0 days 00:00:01.624355,,0.4,3.0,,LightGBM,,,,,0.7000000000000001,,,,0.4117195315707827,0.18451265480427734,,60.0,,,,,,,,,,27.0,,,,,,,,,COMPLETE,0.0,,,,,,,,,,,,,,,,,,,,
86,86,0.5874429091750013,2023-08-23 18:10:02.686719,2023-08-23 18:10:04.491882,0 days 00:00:01.805163,,0.4,3.0,,LightGBM,,,,,0.7000000000000001,,,,0.5934309715258321,0.11573907785591833,,80.0,,,,,,,,,,31.0,,,,,,,,,COMPLETE,0.0,,,,,,,,,,,,,,,,,,,,
87,87,0.5802507002856194,2023-08-23 18:10:03.224913,2023-08-23 18:10:05.048297,0 days 00:00:01.823384,,0.4,3.0,,LightGBM,,,,,0.7000000000000001,,,,0.36871434064886033,0.07390318019093298,,80.0,,,,,,,,,,29.0,,,,,,,,,COMPLETE,0.0,,,,,,,,,,,,,,,,,,,,
88,88,0.6092952500852414,2023-08-23 18:10:03.358019,2023-08-23 18:10:05.593995,0 days 00:00:02.235976,,0.8,2.0,,LightGBM,,,,,0.9,,,,0.43781387255214993,0.06898243470161954,,80.0,,,,,,,,,,44.0,,,,,,,,,COMPLETE,0.0,,,,,,,,,,,,,,,,,,,,
89,89,0.5866802795884709,2023-08-23 18:10:03.639122,2023-08-23 18:10:05.770031,0 days 00:00:02.130909,,0.8,2.0,,LightGBM,,,,,0.7000000000000001,,,,0.3752512549847428,0.003318349556738122,,60.0,,,,,,,,,,48.0,,,,,,,,,COMPLETE,0.0,,,,,,,,,,,,,,,,,,,,
90,90,0.5966197537563753,2023-08-23 18:10:03.831586,2023-08-23 18:10:06.072490,0 days 00:00:02.240904,,1.0,2.0,,LightGBM,,,,,0.7000000000000001,,,,0.4599188453152933,0.06403128464658318,,80.0,,,,,,,,,,50.0,,,,,,,,,COMPLETE,0.0,,,,,,,,,,,,,,,,,,,,
91,91,0.5946431887963771,2023-08-23 18:10:04.241217,2023-08-23 18:10:06.532087,0 days 00:00:02.290870,,0.8,2.0,,LightGBM,,,,,0.7000000000000001,,,,0.4876303200931183,0.05952759782007337,,80.0,,,,,,,,,,48.0,,,,,,,,,COMPLETE,0.0,,,,,,,,,,,,,,,,,,,,
92,92,0.3573487031700288,2023-08-23 18:10:04.582023,2023-08-23 18:10:09.744172,0 days 00:00:05.162149,,,,,MLPClassifier,,,,,,,,,,,,,,logistic,adam,4.0,40.0,10.0,100.0,10.0,,,,,,,,,,,COMPLETE,0.0,,,,,,,,,,,,,,,,,,,,
93,93,0.3573487031700288,2023-08-23 18:10:05.124461,2023-08-23 18:10:58.522679,0 days 00:00:53.398218,,,,,MLPClassifier,,,,,,,,,,,,,,relu,adam,4.0,40.0,10.0,100.0,50.0,,,,,,,,,,,COMPLETE,0.0,,,,,,,,,,,,,,,,,,,,
94,94,0.3573487031700288,2023-08-23 18:10:05.695628,2023-08-23 18:10:05.950217,0 days 00:00:00.254589,1.682457761783824e-06,,,gblinear,XGBoost,0.6495046253163078,,,,,,,3.620574271767376e-05,,,,,,,,,,,,,,,,,,,,0.24070683689379246,,,COMPLETE,0.0,,,,,,,,,,,,,,,,,,,,
95,95,0.3573487031700288,2023-08-23 18:10:05.897935,2023-08-23 18:11:58.932882,0 days 00:01:53.034947,,,,,MLPClassifier,,,,,,,,,,,,,,logistic,adam,4.0,40.0,10.0,100.0,70.0,,,,,,,,,,,COMPLETE,0.0,,,,,,,,,,,,,,,,,,,,
96,96,0.3573487031700288,2023-08-23 18:10:06.073983,2023-08-23 18:12:00.642596,0 days 00:01:54.568613,,,,,MLPClassifier,,,,,,,,,,,,,,tanh,adam,4.0,40.0,10.0,100.0,70.0,,,,,,,,,,,COMPLETE,0.0,,,,,,,,,,,,,,,,,,,,
97,97,0.3573487031700288,2023-08-23 18:10:06.167809,2023-08-23 18:11:41.381370,0 days 00:01:35.213561,,,,,MLPClassifier,,,,,,,,,,,,,,logistic,adam,4.0,40.0,10.0,100.0,90.0,,,,,,,,,,,COMPLETE,0.0,,,,,,,,,,,,,,,,,,,,
98,98,0.3573487031700288,2023-08-23 18:10:06.615624,2023-08-23 18:10:13.730605,0 days 00:00:07.114981,,,,,MLPClassifier,,,,,,,,,,,,,,tanh,adam,4.0,40.0,10.0,90.0,10.0,,,,,,,,,,,COMPLETE,0.0,,,,,,,,,,,,,,,,,,,,
99,99,0.6001393462557267,2023-08-23 18:10:09.816073,2023-08-23 18:10:11.798109,0 days 00:00:01.982036,,0.8,2.0,,LightGBM,,,,,0.9,,,,0.7284579513632151,0.2736234863178698,,90.0,,,,,,,,,,106.0,,,,,,,,,COMPLETE,0.0,,,,,,,,,,,,,,,,,,,,
100,100,0.5922624613019177,2023-08-23 18:10:11.938881,2023-08-23 18:10:14.155080,0 days 00:00:02.216199,,1.0,2.0,,LightGBM,,,,,0.9,,,,0.7597592190149413,0.004787862244816987,,70.0,,,,,,,,,,88.0,,,,,,,,,COMPLETE,0.0,,,,,,,,,,,,,,,,,,,,
101,101,0.5929085483587854,2023-08-23 18:10:13.817547,2023-08-23 18:10:16.490226,0 days 00:00:02.672679,,1.0,2.0,,LightGBM,,,,,0.9,,,,0.8204298857180081,0.0009655757877915765,,70.0,,,,,,,,,,133.0,,,,,,,,,COMPLETE,0.0,,,,,,,,,,,,,,,,,,,,
102,102,0.5852378626550747,2023-08-23 18:10:14.255332,2023-08-23 18:10:16.348339,0 days 00:00:02.093007,,0.5,2.0,,LightGBM,,,,,0.8,,,,0.9474193833039196,0.000877008318074971,,50.0,,,,,,,,,,78.0,,,,,,,,,COMPLETE,0.0,,,,,,,,,,,,,,,,,,,,
103,103,0.5774153463808636,2023-08-23 18:10:16.465308,2023-08-23 18:10:19.075852,0 days 00:00:02.610544,,0.9,2.0,,LightGBM,,,,,1.0,,,,0.3188585641987574,0.013468668095433456,,70.0,,,,,,,,,,133.0,,,,,,,,,COMPLETE,0.0,,,,,,,,,,,,,,,,,,,,
104,104,0.5985499633599864,2023-08-23 18:10:16.602926,2023-08-23 18:10:18.572076,0 days 00:00:01.969150,,0.5,2.0,,LightGBM,,,,,1.0,,,,0.2690307570986849,0.017314896744029466,,60.0,,,,,,,,,,98.0,,,,,,,,,COMPLETE,0.0,,,,,,,,,,,,,,,,,,,,
105,105,0.5962162837162837,2023-08-23 18:10:18.699468,2023-08-23 18:10:21.012717,0 days 00:00:02.313249,,0.9,2.0,,LightGBM,,,,,0.5,,,,0.12044098499825355,0.009946201702265315,,70.0,,,,,,,,,,75.0,,,,,,,,,COMPLETE,0.0,,,,,,,,,,,,,,,,,,,,
106,106,0.5898413290772296,2023-08-23 18:10:19.186413,2023-08-23 18:10:19.952221,0 days 00:00:00.765808,,0.5,2.0,,LightGBM,,,,,0.8,,,,0.10991253969422042,0.03343462874572265,,80.0,,,,,,,,,,13.0,,,,,,,,,COMPLETE,0.0,,,,,,,,,,,,,,,,,,,,
107,107,0.5810250421694564,2023-08-23 18:10:20.023918,2023-08-23 18:10:20.095150,0 days 00:00:00.071232,,,,,DecisionTreeClassifier,,log_loss,2.0,,,,,,,,,,,,,,,,,,,,,,,,,,,,COMPLETE,0.0,,,,,,,,,,,,,,,,,,,,
108,108,0.592834301036564,2023-08-23 18:10:20.216527,2023-08-23 18:10:22.543549,0 days 00:00:02.327022,,0.9,2.0,,LightGBM,,,,,0.8,,,,0.09991727511482955,0.013050310338629923,,70.0,,,,,,,,,,57.0,,,,,,,,,COMPLETE,0.0,,,,,,,,,,,,,,,,,,,,
109,109,0.5966197537563753,2023-08-23 18:10:21.107737,2023-08-23 18:10:23.363438,0 days 00:00:02.255701,,0.9,2.0,,LightGBM,,,,,0.8,,,,0.10855414983821779,0.03917465202618213,,70.0,,,,,,,,,,54.0,,,,,,,,,COMPLETE,0.0,,,,,,,,,,,,,,,,,,,,
110,110,0.6005145109802268,2023-08-23 18:10:22.619401,2023-08-23 18:10:24.612340,0 days 00:00:01.992939,,0.8,1.0,,LightGBM,,,,,0.8,,,,0.25180975859383947,0.03364285832890066,,60.0,,,,,,,,,,53.0,,,,,,,,,COMPLETE,0.0,,,,,,,,,,,,,,,,,,,,
111,111,0.5985264750098662,2023-08-23 18:10:23.431645,2023-08-23 18:10:25.288722,0 days 00:00:01.857077,,0.8,1.0,,LightGBM,,,,,0.8,,,,0.03011845462985569,0.03594349546888221,,60.0,,,,,,,,,,41.0,,,,,,,,,COMPLETE,0.0,,,,,,,,,,,,,,,,,,,,
112,112,0.5948690483691428,2023-08-23 18:10:24.677911,2023-08-23 18:10:26.589028,0 days 00:00:01.911117,,0.7000000000000001,2.0,,LightGBM,,,,,0.6000000000000001,,,,0.28705564623650465,0.03101528458719921,,80.0,,,,,,,,,,68.0,,,,,,,,,COMPLETE,0.0,,,,,,,,,,,,,,,,,,,,
113,113,0.5813157695510637,2023-08-23 18:10:25.404115,2023-08-23 18:10:25.841184,0 days 00:00:00.437069,3.86650367845294e-06,,,dart,XGBoost,0.6557131507879765,,,1.8998970172550697e-06,,0.0008696420143091466,depthwise,2.9696240719893e-08,,,5.0,,6.0,,,,,,,,tree,,2.273879936345681e-08,,,uniform,1.4181815455151288e-08,0.7617678158432531,,,COMPLETE,0.0,,,,,,,,,,,,,,,,,,,,
114,114,0.5925989360321784,2023-08-23 18:10:25.960693,2023-08-23 18:10:27.880137,0 days 00:00:01.919444,,0.7000000000000001,2.0,,LightGBM,,,,,0.6000000000000001,,,,0.3594906710762283,0.005836281013919482,,80.0,,,,,,,,,,67.0,,,,,,,,,COMPLETE,0.0,,,,,,,,,,,,,,,,,,,,
115,115,0.5923276276382456,2023-08-23 18:10:26.674222,2023-08-23 18:10:28.941055,0 days 00:00:02.266833,,1.0,2.0,,LightGBM,,,,,0.7000000000000001,,,,0.16720977733779227,0.006209276030760272,,90.0,,,,,,,,,,65.0,,,,,,,,,COMPLETE,0.0,,,,,,,,,,,,,,,,,,,,
116,116,0.5978865673348117,2023-08-23 18:10:27.960268,2023-08-23 18:10:30.418006,0 days 00:00:02.457738,,1.0,2.0,,LightGBM,,,,,0.7000000000000001,,,,0.1780868623932188,0.013508343948043348,,70.0,,,,,,,,,,177.0,,,,,,,,,COMPLETE,0.0,,,,,,,,,,,,,,,,,,,,
117,117,0.6021409455842998,2023-08-23 18:10:29.025035,2023-08-23 18:10:30.287375,0 days 00:00:01.262340,,0.4,2.0,,LightGBM,,,,,0.7000000000000001,,,,0.10330091303053741,0.01556525895593006,,70.0,,,,,,,,,,80.0,,,,,,,,,COMPLETE,0.0,,,,,,,,,,,,,,,,,,,,
118,118,0.609901778080713,2023-08-23 18:10:30.392468,2023-08-23 18:10:31.797154,0 days 00:00:01.404686,,0.6000000000000001,2.0,,LightGBM,,,,,0.5,,,,0.02800373568165908,0.011735284411761757,,100.0,,,,,,,,,,166.0,,,,,,,,,COMPLETE,0.0,,,,,,,,,,,,,,,,,,,,
119,119,0.5896465113819633,2023-08-23 18:10:30.487292,2023-08-23 18:10:31.656400,0 days 00:00:01.169108,,0.5,2.0,,LightGBM,,,,,0.6000000000000001,,,,0.022688184709354197,0.08382939273584876,,100.0,,,,,,,,,,86.0,,,,,,,,,COMPLETE,0.0,,,,,,,,,,,,,,,,,,,,
120,120,0.5997095514401407,2023-08-23 18:10:31.768465,2023-08-23 18:10:33.874759,0 days 00:00:02.106294,,0.6000000000000001,2.0,,LightGBM,,,,,0.5,,,,0.029431314723068303,0.021941028192401024,,60.0,,,,,,,,,,72.0,,,,,,,,,COMPLETE,0.0,,,,,,,,,,,,,,,,,,,,
121,121,0.5763690005037059,2023-08-23 18:10:31.877935,2023-08-23 18:10:33.384400,0 days 00:00:01.506465,,0.4,2.0,,LightGBM,,,,,0.4,,,,0.03258095925196871,0.0572469722564381,,60.0,,,,,,,,,,160.0,,,,,,,,,COMPLETE,0.0,,,,,,,,,,,,,,,,,,,,
122,122,0.5901420217209692,2023-08-23 18:10:33.434536,2023-08-23 18:10:35.575015,0 days 00:00:02.140479,,0.6000000000000001,2.0,,LightGBM,,,,,0.5,,,,0.10041643849901911,0.02436854025820469,,50.0,,,,,,,,,,230.0,,,,,,,,,COMPLETE,0.0,,,,,,,,,,,,,,,,,,,,
123,123,0.589786983554689,2023-08-23 18:10:33.932529,2023-08-23 18:10:37.106299,0 days 00:00:03.173770,,0.9,2.0,,LightGBM,,,,,0.5,,,,0.08504162413751006,0.008833142339264721,,50.0,,,,,,,,,,234.0,,,,,,,,,COMPLETE,0.0,,,,,,,,,,,,,,,,,,,,
124,124,0.5558762978875761,2023-08-23 18:10:35.636422,2023-08-23 18:10:35.760969,0 days 00:00:00.124547,,,,,DecisionTreeClassifier,,entropy,4.0,,,,,,,,,,,,,,,,,,,,,,,,,,,,COMPLETE,0.0,,,,,,,,,,,,,,,,,,,,
125,125,0.5954140900006406,2023-08-23 18:10:35.876910,2023-08-23 18:10:38.735605,0 days 00:00:02.858695,,0.9,2.0,,LightGBM,,,,,0.7000000000000001,,,,0.006026236917153975,0.010108307910958307,,70.0,,,,,,,,,,189.0,,,,,,,,,COMPLETE,0.0,,,,,,,,,,,,,,,,,,,,
126,126,0.5954488987044741,2023-08-23 18:10:37.215234,2023-08-23 18:10:38.576156,0 days 00:00:01.360922,,0.4,2.0,,LightGBM,,,,,0.7000000000000001,,,,0.007805187820175856,0.27438204120982906,,70.0,,,,,,,,,,107.0,,,,,,,,,COMPLETE,0.0,,,,,,,,,,,,,,,,,,,,
127,127,0.5791565629942013,2023-08-23 18:10:38.673369,2023-08-23 18:10:40.109380,0 days 00:00:01.436011,,0.4,2.0,,LightGBM,,,,,0.4,,,,0.1847361296192249,0.08331281109464646,,90.0,,,,,,,,,,40.0,,,,,,,,,COMPLETE,0.0,,,,,,,,,,,,,,,,,,,,
128,128,0.5985751303834421,2023-08-23 18:10:38.809077,2023-08-23 18:10:40.724246,0 days 00:00:01.915169,,0.6000000000000001,2.0,,LightGBM,,,,,0.6000000000000001,,,,0.1858203782426662,0.04594754309952998,,100.0,,,,,,,,,,59.0,,,,,,,,,COMPLETE,0.0,,,,,,,,,,,,,,,,,,,,
129,129,0.3573487031700288,2023-08-23 18:10:40.180965,2023-08-23 18:10:44.457776,0 days 00:00:04.276811,,,,,SVC,,,,,,,,,,,,,,,,,,,,,,,,,,,,,6.834738695050369,poly,COMPLETE,0.0,,,,,,,,,,,,,,,,,,,,
130,130,0.3573487031700288,2023-08-23 18:10:40.801770,2023-08-23 18:10:44.954738,0 days 00:00:04.152968,,,,,SVC,,,,,,,,,,,,,,,,,,,,,,,,,,,,,6.378962432206457,poly,COMPLETE,0.0,,,,,,,,,,,,,,,,,,,,
131,131,0.6108716918277239,2023-08-23 18:10:44.580740,2023-08-23 18:10:46.013145,0 days 00:00:01.432405,,0.6000000000000001,2.0,,LightGBM,,,,,0.6000000000000001,,,,0.5279764366371783,0.01874359848336922,,100.0,,,,,,,,,,64.0,,,,,,,,,COMPLETE,0.0,,,,,,,,,,,,,,,,,,,,
132,132,0.5921310579343765,2023-08-23 18:10:45.035565,2023-08-23 18:10:46.545878,0 days 00:00:01.510313,,0.6000000000000001,2.0,,LightGBM,,,,,0.6000000000000001,,,,0.04130176256984172,0.01946860845865011,,100.0,,,,,,,,,,123.0,,,,,,,,,COMPLETE,0.0,,,,,,,,,,,,,,,,,,,,
133,133,0.5927010315247327,2023-08-23 18:10:46.097944,2023-08-23 18:10:47.202439,0 days 00:00:01.104495,,0.4,2.0,,LightGBM,,,,,0.8,,,,0.59192970259287,0.01989250782800441,,100.0,,,,,,,,,,125.0,,,,,,,,,COMPLETE,0.0,,,,,,,,,,,,,,,,,,,,
134,134,0.3573487031700288,2023-08-23 18:10:46.618398,2023-08-23 18:10:47.783012,0 days 00:00:01.164614,,,,,MLPClassifier,,,,,,,,,,,,,,relu,lbfgs,2.0,100.0,40.0,,,,,,,,,,,,,COMPLETE,0.0,,,,,,,,,,,,,,,,,,,,
135,135,0.5856583980640654,2023-08-23 18:10:47.277796,2023-08-23 18:10:48.703688,0 days 00:00:01.425892,,0.5,2.0,,LightGBM,,,,,0.9,,,,0.5185782597708637,0.041675709159252484,,90.0,,,,,,,,,,62.0,,,,,,,,,COMPLETE,0.0,,,,,,,,,,,,,,,,,,,,
136,136,0.6004414059694281,2023-08-23 18:10:47.874370,2023-08-23 18:10:49.479908,0 days 00:00:01.605538,,0.5,2.0,,LightGBM,,,,,0.9,,,,0.4480811602907151,0.04494915858660064,,70.0,,,,,,,,,,56.0,,,,,,,,,COMPLETE,0.0,,,,,,,,,,,,,,,,,,,,
137,137,0.3573487031700288,2023-08-23 18:10:48.785671,2023-08-23 18:10:48.959361,0 days 00:00:00.173690,0.008810563991170453,,,gblinear,XGBoost,0.4921681949282655,,,,,,,5.970366133113979e-06,,,,,,,,,,,,,,,,,,,,0.41142397971031164,,,COMPLETE,0.0,,,,,,,,,,,,,,,,,,,,
138,138,0.5983695909758757,2023-08-23 18:10:49.067108,2023-08-23 18:10:50.690645,0 days 00:00:01.623537,,0.6000000000000001,2.0,,LightGBM,,,,,0.6000000000000001,,,,0.34032739472105483,0.005012616055520925,,100.0,,,,,,,,,,72.0,,,,,,,,,COMPLETE,0.0,,,,,,,,,,,,,,,,,,,,
139,139,0.5971412271805274,2023-08-23 18:10:49.596981,2023-08-23 18:10:51.046280,0 days 00:00:01.449299,,0.6000000000000001,2.0,,LightGBM,,,,,0.6000000000000001,,,,0.017869518645116593,0.0052534385805675585,,100.0,,,,,,,,,,74.0,,,,,,,,,COMPLETE,0.0,,,,,,,,,,,,,,,,,,,,
140,140,0.60106082480698,2023-08-23 18:10:50.790061,2023-08-23 18:10:52.174671,0 days 00:00:01.384610,,0.6000000000000001,2.0,,LightGBM,,,,,0.7000000000000001,,,,0.06752763037240037,0.009636174689248381,,100.0,,,,,,,,,,46.0,,,,,,,,,COMPLETE,0.0,,,,,,,,,,,,,,,,,,,,
141,141,0.5999370524824927,2023-08-23 18:10:51.111519,2023-08-23 18:10:52.342925,0 days 00:00:01.231406,,0.4,2.0,,LightGBM,,,,,0.7000000000000001,,,,0.07525658087819208,0.010296930133411283,,70.0,,,,,,,,,,47.0,,,,,,,,,COMPLETE,0.0,,,,,,,,,,,,,,,,,,,,
142,142,0.5950414412528537,2023-08-23 18:10:52.249811,2023-08-23 18:10:54.346390,0 days 00:00:02.096579,,0.7000000000000001,2.0,,LightGBM,,,,,0.7000000000000001,,,,0.25788189811025547,0.08296669715872959,,70.0,,,,,,,,,,83.0,,,,,,,,,COMPLETE,0.0,,,,,,,,,,,,,,,,,,,,
143,143,0.5947994987468672,2023-08-23 18:10:52.411384,2023-08-23 18:10:54.480419,0 days 00:00:02.069035,,0.7000000000000001,2.0,,LightGBM,,,,,0.7000000000000001,,,,0.9352639405613622,0.027698599868241032,,80.0,,,,,,,,,,85.0,,,,,,,,,COMPLETE,0.0,,,,,,,,,,,,,,,,,,,,
144,144,0.5942398170050167,2023-08-23 18:10:54.456657,2023-08-23 18:10:57.429908,0 days 00:00:02.973251,,0.8,1.0,,LightGBM,,,,,0.6000000000000001,,,,0.14364909250224317,0.03205807724810248,,40.0,,,,,,,,,,95.0,,,,,,,,,COMPLETE,0.0,,,,,,,,,,,,,,,,,,,,
145,145,0.5918804348542684,2023-08-23 18:10:54.564465,2023-08-23 18:10:55.937968,0 days 00:00:01.373503,,0.4,2.0,,LightGBM,,,,,0.8,,,,0.15305174952209205,0.01575238551067654,,90.0,,,,,,,,,,65.0,,,,,,,,,COMPLETE,0.0,,,,,,,,,,,,,,,,,,,,
146,146,0.5883048456687687,2023-08-23 18:10:56.048983,2023-08-23 18:10:59.517580,0 days 00:00:03.468597,,0.8,2.0,,LightGBM,,,,,0.5,,,,0.039867391502681246,0.02791234746441969,,40.0,,,,,,,,,,156.0,,,,,,,,,COMPLETE,0.0,,,,,,,,,,,,,,,,,,,,
147,147,0.586219118106953,2023-08-23 18:10:57.503699,2023-08-23 18:11:00.030116,0 days 00:00:02.526417,,0.9,2.0,,LightGBM,,,,,0.5,,,,0.050494521788597146,0.10591170381699934,,60.0,,,,,,,,,,152.0,,,,,,,,,COMPLETE,0.0,,,,,,,,,,,,,,,,,,,,
148,148,0.5741185695265526,2023-08-23 18:10:58.624887,2023-08-23 18:11:02.406574,0 days 00:00:03.781687,,0.5,1.0,,LightGBM,,,,,0.7000000000000001,,,,0.49111955525583373,0.8646400579597576,,20.0,,,,,,,,,,141.0,,,,,,,,,COMPLETE,0.0,,,,,,,,,,,,,,,,,,,,
149,149,0.5994569757727652,2023-08-23 18:10:59.620721,2023-08-23 18:11:01.096865,0 days 00:00:01.476144,,0.4,1.0,,LightGBM,,,,,0.7000000000000001,,,,0.51464905678359,0.864413094749123,,70.0,,,,,,,,,,152.0,,,,,,,,,COMPLETE,0.0,,,,,,,,,,,,,,,,,,,,
150,150,0.5947853279242731,2023-08-23 18:11:00.132880,2023-08-23 18:11:01.878638,0 days 00:00:01.745758,,0.5,1.0,,LightGBM,,,,,0.7000000000000001,,,,0.5973922642967956,0.6247540272478983,,70.0,,,,,,,,,,62.0,,,,,,,,,COMPLETE,0.0,,,,,,,,,,,,,,,,,,,,
151,151,0.5946638589984847,2023-08-23 18:11:01.177593,2023-08-23 18:11:02.862827,0 days 00:00:01.685234,,0.5,1.0,,LightGBM,,,,,0.7000000000000001,,,,0.2477274134479012,0.20231083047112355,,80.0,,,,,,,,,,141.0,,,,,,,,,COMPLETE,0.0,,,,,,,,,,,,,,,,,,,,
152,152,0.586626011764644,2023-08-23 18:11:01.953461,2023-08-23 18:11:03.554467,0 days 00:00:01.601006,,0.4,1.0,,LightGBM,,,,,0.8,,,,0.23698287822695785,0.17055697095922576,,80.0,,,,,,,,,,142.0,,,,,,,,,COMPLETE,0.0,,,,,,,,,,,,,,,,,,,,
153,153,0.5853189335575277,2023-08-23 18:11:02.496303,2023-08-23 18:11:03.929220,0 days 00:00:01.432917,,0.4,2.0,,LightGBM,,,,,0.8,,,,0.26545807344824307,0.19239825504337713,,80.0,,,,,,,,,,169.0,,,,,,,,,COMPLETE,0.0,,,,,,,,,,,,,,,,,,,,
154,154,0.5467875874125874,2023-08-23 18:11:02.945980,2023-08-23 18:11:03.335232,0 days 00:00:00.389252,,,,,DecisionTreeClassifier,,log_loss,15.0,,,,,,,,,,,,,,,,,,,,,,,,,,,,COMPLETE,0.0,,,,,,,,,,,,,,,,,,,,
155,155,0.6006911175685227,2023-08-23 18:11:03.444587,2023-08-23 18:11:05.136144,0 days 00:00:01.691557,,0.6000000000000001,2.0,,LightGBM,,,,,0.8,,,,0.9131799939114242,0.0627230224604551,,80.0,,,,,,,,,,56.0,,,,,,,,,COMPLETE,0.0,,,,,,,,,,,,,,,,,,,,
156,156,0.6020436065337842,2023-08-23 18:11:03.623783,2023-08-23 18:11:05.922803,0 days 00:00:02.299020,,0.6000000000000001,2.0,,LightGBM,,,,,0.9,,,,0.8804366443114694,0.06124527704549217,,60.0,,,,,,,,,,165.0,,,,,,,,,COMPLETE,0.0,,,,,,,,,,,,,,,,,,,,
157,157,0.5626837658217279,2023-08-23 18:11:04.000045,2023-08-23 18:11:04.539960,0 days 00:00:00.539915,,,,,RandomForestClassifier,,,,,,,,,,,,,,,,,,,,,,,,12.0,5.0,,,,,,COMPLETE,0.0,,,,,,,,,,,,,,,,,,,,
158,158,0.6020912094722893,2023-08-23 18:11:04.621122,2023-08-23 18:11:06.386948,0 days 00:00:01.765826,,0.6000000000000001,1.0,,LightGBM,,,,,0.5,,,,0.9346307296262407,0.4230006510548826,,90.0,,,,,,,,,,53.0,,,,,,,,,COMPLETE,0.0,,,,,,,,,,,,,,,,,,,,
159,159,0.6151834677846238,2023-08-23 18:11:05.197467,2023-08-23 18:11:06.969366,0 days 00:00:01.771899,,0.5,1.0,,LightGBM,,,,,0.5,,,,0.34773253010481847,0.3596349698584242,,90.0,,,,,,,,,,195.0,,,,,,,,,COMPLETE,0.0,,,,,,,,,,,,,,,,,,,,
160,160,0.586626011764644,2023-08-23 18:11:06.097244,2023-08-23 18:11:07.730504,0 days 00:00:01.633260,,0.5,1.0,,LightGBM,,,,,0.5,,,,0.13098938027591212,0.5016435287676911,,90.0,,,,,,,,,,115.0,,,,,,,,,COMPLETE,0.0,,,,,,,,,,,,,,,,,,,,
161,161,0.6072610762179597,2023-08-23 18:11:06.492627,2023-08-23 18:11:08.213418,0 days 00:00:01.720791,,0.5,1.0,,LightGBM,,,,,0.6000000000000001,,,,0.3700920559858878,0.013583107921848005,,100.0,,,,,,,,,,78.0,,,,,,,,,COMPLETE,0.0,,,,,,,,,,,,,,,,,,,,
162,162,0.5940761784511785,2023-08-23 18:11:07.045423,2023-08-23 18:11:08.972637,0 days 00:00:01.927214,,0.9,1.0,,LightGBM,,,,,0.6000000000000001,,,,0.14070274571956637,0.0071617584834870185,,100.0,,,,,,,,,,78.0,,,,,,,,,COMPLETE,0.0,,,,,,,,,,,,,,,,,,,,
163,163,0.5977941224801004,2023-08-23 18:11:07.813299,2023-08-23 18:11:09.124486,0 days 00:00:01.311187,,0.5,2.0,,LightGBM,,,,,0.6000000000000001,,,,0.08089065154294517,0.012613347256740794,,100.0,,,,,,,,,,37.0,,,,,,,,,COMPLETE,0.0,,,,,,,,,,,,,,,,,,,,
164,164,0.6046161883202203,2023-08-23 18:11:08.316091,2023-08-23 18:11:09.780800,0 days 00:00:01.464709,,0.9,2.0,,LightGBM,,,,,0.6000000000000001,,,,0.08051391935051654,0.01601859346985207,,100.0,,,,,,,,,,36.0,,,,,,,,,COMPLETE,0.0,,,,,,,,,,,,,,,,,,,,
165,165,0.5768964993294621,2023-08-23 18:11:09.048058,2023-08-23 18:11:10.319557,0 days 00:00:01.271499,,0.4,2.0,,LightGBM,,,,,0.6000000000000001,,,,0.3427854471870149,0.015104535675875852,,100.0,,,,,,,,,,35.0,,,,,,,,,COMPLETE,0.0,,,,,,,,,,,,,,,,,,,,
166,166,0.5866802795884709,2023-08-23 18:11:09.208363,2023-08-23 18:11:10.642175,0 days 00:00:01.433812,,0.4,2.0,,LightGBM,,,,,0.6000000000000001,,,,0.3158022785594982,0.014227961244503531,,100.0,,,,,,,,,,205.0,,,,,,,,,COMPLETE,0.0,,,,,,,,,,,,,,,,,,,,
167,167,0.5934520428085435,2023-08-23 18:11:09.881526,2023-08-23 18:11:11.401116,0 days 00:00:01.519590,,0.4,2.0,,LightGBM,,,,,0.6000000000000001,,,,0.3571303611560778,0.025125223566378987,,70.0,,,,,,,,,,69.0,,,,,,,,,COMPLETE,0.0,,,,,,,,,,,,,,,,,,,,
168,168,0.6167499200114922,2023-08-23 18:11:10.419999,2023-08-23 18:11:12.086994,0 days 00:00:01.666995,,0.5,1.0,,LightGBM,,,,,1.0,,,,0.40681928926476635,0.02338134864463546,,70.0,,,,,,,,,,71.0,,,,,,,,,COMPLETE,0.0,,,,,,,,,,,,,,,,,,,,
169,169,0.5780666116562515,2023-08-23 18:11:10.744838,2023-08-23 18:11:12.622654,0 days 00:00:01.877816,,0.5,1.0,,LightGBM,,,,,0.7000000000000001,,,,0.4012916090431665,0.026285165095983373,,70.0,,,,,,,,,,73.0,,,,,,,,,COMPLETE,0.0,,,,,,,,,,,,,,,,,,,,
