,number,value,datetime_start,datetime_complete,duration,params_alpha,params_bagging_fraction,params_bagging_freq,params_booster,params_classifier,params_colsample_bytree,params_dct_criterion,params_dct_max_depth,params_eta,params_feature_fraction,params_gamma,params_grow_policy,params_lambda,params_lambda_l1,params_lambda_l2,params_max_depth,params_min_child_samples,params_min_child_weight,params_mlp_activation,params_mlp_solver,params_n_layers,params_n_units_l_0,params_n_units_l_1,params_n_units_l_2,params_n_units_l_3,params_normalize_type,params_num_leaves,params_rate_drop,params_rf_estimator,params_rf_max_depth,params_sample_type,params_skip_drop,params_subsample,params_svc_c,params_svc_kernel,state,best_trial,dev_acc,dev_recall_macro,dev_precision_macro,dev_f1_macro,dev_recall_0,dev_precision_0,dev_f1_0,dev_recall_1,dev_precision_1,dev_f1_1,test_acc,test_recall_macro,test_precision_macro,test_f1_macro,test_recall_0,test_precision_0,test_f1_0,test_recall_1,test_precision_1,test_f1_1
0,0,0.45671485700364256,2023-08-23 18:14:15.714337,2023-08-23 18:14:16.027449,0 days 00:00:00.313112,,,,,DecisionTreeClassifier,,entropy,9.0,,,,,,,,,,,,,,,,,,,,,,,,,,,,COMPLETE,0.0,,,,,,,,,,,,,,,,,,,,
1,1,0.37081053351573184,2023-08-23 18:14:15.716868,2023-08-23 18:14:15.800208,0 days 00:00:00.083340,,,,,DecisionTreeClassifier,,log_loss,2.0,,,,,,,,,,,,,,,,,,,,,,,,,,,,COMPLETE,0.0,,,,,,,,,,,,,,,,,,,,
2,2,0.3766508112913981,2023-08-23 18:14:15.719358,2023-08-23 18:14:15.851954,0 days 00:00:00.132596,,,,,DecisionTreeClassifier,,log_loss,3.0,,,,,,,,,,,,,,,,,,,,,,,,,,,,COMPLETE,0.0,,,,,,,,,,,,,,,,,,,,
3,3,0.4389272000368841,2023-08-23 18:14:15.721729,2023-08-23 18:14:19.197358,0 days 00:00:03.475629,,,,,RandomForestClassifier,,,,,,,,,,,,,,,,,,,,,,,,100.0,7.0,,,,,,COMPLETE,0.0,,,,,,,,,,,,,,,,,,,,
4,4,0.4708833299437326,2023-08-23 18:14:15.724584,2023-08-23 18:14:16.225654,0 days 00:00:00.501070,0.803815115041048,,,gbtree,XGBoost,0.28428915155670054,,,0.31143974478733116,,0.002302741814789625,depthwise,4.93058136965622e-06,,,5.0,,5.0,,,,,,,,,,,,,,,0.6151963841360488,,,COMPLETE,0.0,,,,,,,,,,,,,,,,,,,,
5,5,0.5006110510476965,2023-08-23 18:14:15.735246,2023-08-23 18:14:18.191103,0 days 00:00:02.455857,,,,,RandomForestClassifier,,,,,,,,,,,,,,,,,,,,,,,,39.0,24.0,,,,,,COMPLETE,0.0,,,,,,,,,,,,,,,,,,,,
6,6,0.3756191266039698,2023-08-23 18:14:15.747572,2023-08-23 18:14:15.976938,0 days 00:00:00.229366,,,,,DecisionTreeClassifier,,gini,4.0,,,,,,,,,,,,,,,,,,,,,,,,,,,,COMPLETE,0.0,,,,,,,,,,,,,,,,,,,,
7,7,0.4708101425187829,2023-08-23 18:14:15.761715,2023-08-23 18:14:19.311988,0 days 00:00:03.550273,,,,,RandomForestClassifier,,,,,,,,,,,,,,,,,,,,,,,,72.0,11.0,,,,,,COMPLETE,0.0,,,,,,,,,,,,,,,,,,,,
8,8,0.5329921805070005,2023-08-23 18:14:15.853334,2023-08-23 18:14:18.286905,0 days 00:00:02.433571,,0.8,3.0,,LightGBM,,,,,0.8,,,,0.0036838721208587834,2.6546749569710167e-08,,50.0,,,,,,,,,,190.0,,,,,,,,,COMPLETE,0.0,,,,,,,,,,,,,,,,,,,,
9,9,0.3573487031700288,2023-08-23 18:14:15.943720,2023-08-23 18:14:21.744674,0 days 00:00:05.800954,,,,,SVC,,,,,,,,,,,,,,,,,,,,,,,,,,,,,21.213863959106934,linear,COMPLETE,0.0,,,,,,,,,,,,,,,,,,,,
10,10,0.3573487031700288,2023-08-23 18:14:16.022716,2023-08-23 18:14:21.176239,0 days 00:00:05.153523,,,,,SVC,,,,,,,,,,,,,,,,,,,,,,,,,,,,,0.41235766740360646,poly,COMPLETE,0.0,,,,,,,,,,,,,,,,,,,,
11,11,0.3573487031700288,2023-08-23 18:14:16.096476,2023-08-23 18:14:16.137308,0 days 00:00:00.040832,1.973095908729052e-07,,,gblinear,XGBoost,0.5981438146075786,,,,,,,0.4845688300613452,,,,,,,,,,,,,,,,,,,,0.9768985950355242,,,COMPLETE,0.0,,,,,,,,,,,,,,,,,,,,
12,12,0.5331895415114369,2023-08-23 18:14:16.198740,2023-08-23 18:14:16.807143,0 days 00:00:00.608403,,0.8,3.0,,LightGBM,,,,,0.9,,,,6.801517402682273e-08,0.00550889669550024,,30.0,,,,,,,,,,16.0,,,,,,,,,COMPLETE,0.0,,,,,,,,,,,,,,,,,,,,
13,13,0.35642135642135636,2023-08-23 18:14:16.277588,2023-08-23 18:14:17.196689,0 days 00:00:00.919101,,,,,RandomForestClassifier,,,,,,,,,,,,,,,,,,,,,,,,80.0,2.0,,,,,,COMPLETE,0.0,,,,,,,,,,,,,,,,,,,,
14,14,0.3573487031700288,2023-08-23 18:14:16.849516,2023-08-23 18:14:25.192235,0 days 00:00:08.342719,,,,,SVC,,,,,,,,,,,,,,,,,,,,,,,,,,,,,10.71784077110261,rbf,COMPLETE,0.0,,,,,,,,,,,,,,,,,,,,
15,15,0.3573487031700288,2023-08-23 18:14:17.249117,2023-08-23 18:15:03.593493,0 days 00:00:46.344376,,,,,MLPClassifier,,,,,,,,,,,,,,logistic,adam,2.0,70.0,40.0,,,,,,,,,,,,,COMPLETE,0.0,,,,,,,,,,,,,,,,,,,,
16,16,0.4390704032809296,2023-08-23 18:14:18.343092,2023-08-23 18:14:18.689300,0 days 00:00:00.346208,,0.7000000000000001,3.0,,LightGBM,,,,,1.0,,,,1.3638035952914516e-08,0.25702520993218403,,10.0,,,,,,,,,,2.0,,,,,,,,,COMPLETE,0.0,,,,,,,,,,,,,,,,,,,,
17,17,0.3573487031700288,2023-08-23 18:14:18.344895,2023-08-23 18:17:00.098313,0 days 00:02:41.753418,,,,,MLPClassifier,,,,,,,,,,,,,,identity,adam,3.0,100.0,60.0,10.0,,,,,,,,,,,,COMPLETE,0.0,,,,,,,,,,,,,,,,,,,,
18,18,0.5257572316395845,2023-08-23 18:14:18.777246,2023-08-23 18:14:21.527896,0 days 00:00:02.750650,,0.9,3.0,,LightGBM,,,,,0.8,,,,0.013371202656865346,4.80692988611701e-08,,50.0,,,,,,,,,,201.0,,,,,,,,,COMPLETE,0.0,,,,,,,,,,,,,,,,,,,,
19,19,0.5257572316395845,2023-08-23 18:14:19.368990,2023-08-23 18:14:23.381109,0 days 00:00:04.012119,,0.9,3.0,,LightGBM,,,,,0.8,,,,0.013416578036300133,1.0486554710285768e-08,,50.0,,,,,,,,,,207.0,,,,,,,,,COMPLETE,0.0,,,,,,,,,,,,,,,,,,,,
20,20,0.5100602631265319,2023-08-23 18:14:19.406984,2023-08-23 18:14:22.865991,0 days 00:00:03.459007,,0.9,3.0,,LightGBM,,,,,0.8,,,,0.008569241842182215,1.2466054050623562e-08,,50.0,,,,,,,,,,213.0,,,,,,,,,COMPLETE,0.0,,,,,,,,,,,,,,,,,,,,
21,21,0.5122560889874861,2023-08-23 18:14:21.276216,2023-08-23 18:14:24.766109,0 days 00:00:03.489893,,0.9,3.0,,LightGBM,,,,,0.8,,,,0.01015367962521483,2.5012594169522226e-08,,50.0,,,,,,,,,,206.0,,,,,,,,,COMPLETE,0.0,,,,,,,,,,,,,,,,,,,,
22,22,0.5173759966863416,2023-08-23 18:14:21.629364,2023-08-23 18:14:24.933289,0 days 00:00:03.303925,,0.8,3.0,,LightGBM,,,,,0.7000000000000001,,,,2.2548614920061e-05,1.0936583857746918e-07,,50.0,,,,,,,,,,145.0,,,,,,,,,COMPLETE,0.0,,,,,,,,,,,,,,,,,,,,
23,23,0.35688536409516947,2023-08-23 18:14:21.828772,2023-08-23 18:17:54.429569,0 days 00:03:32.600797,,,,,MLPClassifier,,,,,,,,,,,,,,relu,adam,3.0,70.0,90.0,70.0,,,,,,,,,,,,COMPLETE,0.0,,,,,,,,,,,,,,,,,,,,
24,24,0.3573487031700288,2023-08-23 18:14:22.925835,2023-08-23 18:14:23.922452,0 days 00:00:00.996617,,,,,MLPClassifier,,,,,,,,,,,,,,logistic,adam,1.0,20.0,,,,,,,,,,,,,,COMPLETE,0.0,,,,,,,,,,,,,,,,,,,,
25,25,0.3573487031700288,2023-08-23 18:14:23.477648,2023-08-23 18:18:19.102551,0 days 00:03:55.624903,,,,,MLPClassifier,,,,,,,,,,,,,,tanh,adam,2.0,40.0,60.0,,,,,,,,,,,,,COMPLETE,0.0,,,,,,,,,,,,,,,,,,,,
26,26,0.48678879934608615,2023-08-23 18:14:24.082371,2023-08-23 18:14:26.254857,0 days 00:00:02.172486,,0.6000000000000001,1.0,,LightGBM,,,,,0.4,,,,1.8602142598427626e-06,0.0005140673749039026,,20.0,,,,,,,,,,47.0,,,,,,,,,COMPLETE,0.0,,,,,,,,,,,,,,,,,,,,
27,27,0.5086361737677527,2023-08-23 18:14:24.902176,2023-08-23 18:14:27.322469,0 days 00:00:02.420293,,0.6000000000000001,1.0,,LightGBM,,,,,0.4,,,,5.127276257602306e-06,0.0005449781195753339,,20.0,,,,,,,,,,63.0,,,,,,,,,COMPLETE,0.0,,,,,,,,,,,,,,,,,,,,
28,28,0.5067124332570556,2023-08-23 18:14:25.060449,2023-08-23 18:14:25.945718,0 days 00:00:00.885269,,0.6000000000000001,1.0,,LightGBM,,,,,0.4,,,,0.7606949520787338,5.7626856335365994e-05,,20.0,,,,,,,,,,12.0,,,,,,,,,COMPLETE,0.0,,,,,,,,,,,,,,,,,,,,
29,29,0.49018476077299605,2023-08-23 18:14:25.311711,2023-08-23 18:14:25.710233,0 days 00:00:00.398522,,0.4,1.0,,LightGBM,,,,,1.0,,,,0.4422652892497431,1.6730691524170596e-05,,20.0,,,,,,,,,,4.0,,,,,,,,,COMPLETE,0.0,,,,,,,,,,,,,,,,,,,,
30,30,0.5161645364972536,2023-08-23 18:14:25.812919,2023-08-23 18:14:28.026985,0 days 00:00:02.214066,,0.7000000000000001,2.0,,LightGBM,,,,,0.4,,,,5.387042917668594e-05,0.00455439165929864,,80.0,,,,,,,,,,117.0,,,,,,,,,COMPLETE,0.0,,,,,,,,,,,,,,,,,,,,
31,31,0.36012523631635246,2023-08-23 18:14:26.083932,2023-08-23 18:14:49.934141,0 days 00:00:23.850209,,,,,MLPClassifier,,,,,,,,,,,,,,identity,lbfgs,4.0,100.0,100.0,60.0,100.0,,,,,,,,,,,COMPLETE,0.0,,,,,,,,,,,,,,,,,,,,
32,32,0.3573487031700288,2023-08-23 18:14:26.361754,2023-08-23 18:17:31.586084,0 days 00:03:05.224330,,,,,MLPClassifier,,,,,,,,,,,,,,relu,sgd,4.0,100.0,100.0,100.0,60.0,,,,,,,,,,,COMPLETE,0.0,,,,,,,,,,,,,,,,,,,,
33,33,0.36012523631635246,2023-08-23 18:14:27.411902,2023-08-23 18:14:46.553583,0 days 00:00:19.141681,,,,,MLPClassifier,,,,,,,,,,,,,,identity,lbfgs,4.0,100.0,50.0,50.0,20.0,,,,,,,,,,,COMPLETE,0.0,,,,,,,,,,,,,,,,,,,,
34,34,0.3573487031700288,2023-08-23 18:14:28.147074,2023-08-23 18:16:13.001289,0 days 00:01:44.854215,,,,,MLPClassifier,,,,,,,,,,,,,,identity,sgd,4.0,100.0,40.0,60.0,20.0,,,,,,,,,,,COMPLETE,0.0,,,,,,,,,,,,,,,,,,,,
35,35,0.5362740765771621,2023-08-23 18:14:46.652371,2023-08-23 18:14:49.038399,0 days 00:00:02.386028,,1.0,2.0,,LightGBM,,,,,0.9,,,,0.0004113257398608909,2.7835828907738287e-07,,70.0,,,,,,,,,,157.0,,,,,,,,,COMPLETE,0.0,,,,,,,,,,,,,,,,,,,,
36,36,0.4402717536705392,2023-08-23 18:14:49.170034,2023-08-23 18:14:49.823147,0 days 00:00:00.653113,2.2052154915214173e-08,,,dart,XGBoost,0.9999118140096428,,,6.066273265445965e-08,,9.275506328190502e-08,lossguide,4.349307163566888e-08,,,9.0,,10.0,,,,,,,,forest,,4.406249304165499e-06,,,weighted,0.4402103464011438,0.3353601339557468,,,COMPLETE,0.0,,,,,,,,,,,,,,,,,,,,
37,37,0.3573487031700288,2023-08-23 18:14:49.922919,2023-08-23 18:15:03.750538,0 days 00:00:13.827619,,,,,MLPClassifier,,,,,,,,,,,,,,relu,sgd,1.0,80.0,,,,,,,,,,,,,,COMPLETE,0.0,,,,,,,,,,,,,,,,,,,,
38,38,0.5362740765771621,2023-08-23 18:14:50.023553,2023-08-23 18:14:53.317380,0 days 00:00:03.293827,,1.0,2.0,,LightGBM,,,,,0.9,,,,0.0009972808781102333,3.8613013907602783e-07,,70.0,,,,,,,,,,173.0,,,,,,,,,COMPLETE,0.0,,,,,,,,,,,,,,,,,,,,
39,39,0.530260861239314,2023-08-23 18:14:53.393876,2023-08-23 18:14:55.397913,0 days 00:00:02.004037,,1.0,2.0,,LightGBM,,,,,0.9,,,,0.0005562990902171653,4.592650563226398e-07,,80.0,,,,,,,,,,159.0,,,,,,,,,COMPLETE,0.0,,,,,,,,,,,,,,,,,,,,
40,40,0.5362740765771621,2023-08-23 18:14:55.480950,2023-08-23 18:14:58.442136,0 days 00:00:02.961186,,1.0,2.0,,LightGBM,,,,,0.9,,,,0.00025984618367550286,9.599549602057289e-07,,70.0,,,,,,,,,,255.0,,,,,,,,,COMPLETE,0.0,,,,,,,,,,,,,,,,,,,,
41,41,0.4992320726365933,2023-08-23 18:14:58.505860,2023-08-23 18:14:58.929916,0 days 00:00:00.424056,,,,,DecisionTreeClassifier,,gini,31.0,,,,,,,,,,,,,,,,,,,,,,,,,,,,COMPLETE,0.0,,,,,,,,,,,,,,,,,,,,
42,42,0.5362740765771621,2023-08-23 18:14:59.004862,2023-08-23 18:15:02.001019,0 days 00:00:02.996157,,1.0,2.0,,LightGBM,,,,,0.9,,,,0.00045838134311893035,1.210155764221735e-06,,70.0,,,,,,,,,,256.0,,,,,,,,,COMPLETE,0.0,,,,,,,,,,,,,,,,,,,,
43,43,0.5362740765771621,2023-08-23 18:15:02.088350,2023-08-23 18:15:04.941178,0 days 00:00:02.852828,,1.0,2.0,,LightGBM,,,,,0.9,,,,0.00040027284981410756,1.3651839397471565e-06,,70.0,,,,,,,,,,249.0,,,,,,,,,COMPLETE,0.0,,,,,,,,,,,,,,,,,,,,
44,44,0.5362740765771621,2023-08-23 18:15:03.643414,2023-08-23 18:15:06.238706,0 days 00:00:02.595292,,1.0,2.0,,LightGBM,,,,,0.9,,,,0.0002607204856295267,1.383023397074328e-06,,70.0,,,,,,,,,,252.0,,,,,,,,,COMPLETE,0.0,,,,,,,,,,,,,,,,,,,,
45,45,0.4619175091996489,2023-08-23 18:15:03.853015,2023-08-23 18:15:04.203348,0 days 00:00:00.350333,,,,,DecisionTreeClassifier,,entropy,11.0,,,,,,,,,,,,,,,,,,,,,,,,,,,,COMPLETE,0.0,,,,,,,,,,,,,,,,,,,,
46,46,0.5362740765771621,2023-08-23 18:15:04.309084,2023-08-23 18:15:07.140646,0 days 00:00:02.831562,,1.0,2.0,,LightGBM,,,,,0.9,,,,0.0003601265269449436,5.640903049859574e-07,,70.0,,,,,,,,,,256.0,,,,,,,,,COMPLETE,0.0,,,,,,,,,,,,,,,,,,,,
47,47,0.35642135642135636,2023-08-23 18:15:05.042674,2023-08-23 18:15:05.460366,0 days 00:00:00.417692,,,,,RandomForestClassifier,,,,,,,,,,,,,,,,,,,,,,,,17.0,2.0,,,,,,COMPLETE,0.0,,,,,,,,,,,,,,,,,,,,
48,48,0.5362740765771621,2023-08-23 18:15:05.532219,2023-08-23 18:15:07.889789,0 days 00:00:02.357570,,1.0,2.0,,LightGBM,,,,,0.9,,,,0.00045829313443079584,7.709905209172815e-07,,70.0,,,,,,,,,,256.0,,,,,,,,,COMPLETE,0.0,,,,,,,,,,,,,,,,,,,,
49,49,0.5362740765771621,2023-08-23 18:15:06.329085,2023-08-23 18:15:08.769081,0 days 00:00:02.439996,,1.0,2.0,,LightGBM,,,,,0.9,,,,0.00021886231600506574,1.6299650379405267e-06,,70.0,,,,,,,,,,255.0,,,,,,,,,COMPLETE,0.0,,,,,,,,,,,,,,,,,,,,
50,50,0.5387659144931785,2023-08-23 18:15:07.248998,2023-08-23 18:15:09.264935,0 days 00:00:02.015937,,1.0,2.0,,LightGBM,,,,,1.0,,,,0.0008874518813922083,2.838698438050904e-06,,100.0,,,,,,,,,,236.0,,,,,,,,,COMPLETE,0.0,,,,,,,,,,,,,,,,,,,,
51,51,0.3573487031700288,2023-08-23 18:15:07.942104,2023-08-23 18:15:08.247204,0 days 00:00:00.305100,0.0008849893242368232,,,dart,XGBoost,0.2094263157084449,,,1.3284534352270704e-08,,0.6933736185315242,depthwise,0.09488378136112019,,,3.0,,2.0,,,,,,,,tree,,0.8964986124084028,,,uniform,1.6536431319551264e-08,0.21486383461557146,,,COMPLETE,0.0,,,,,,,,,,,,,,,,,,,,
52,52,0.5358807858807859,2023-08-23 18:15:08.349872,2023-08-23 18:15:10.310931,0 days 00:00:01.961059,,1.0,2.0,,LightGBM,,,,,1.0,,,,0.0013061826284233872,4.978400437897547e-06,,90.0,,,,,,,,,,232.0,,,,,,,,,COMPLETE,0.0,,,,,,,,,,,,,,,,,,,,
53,53,0.3573487031700288,2023-08-23 18:15:08.840750,2023-08-23 18:15:14.325144,0 days 00:00:05.484394,,,,,SVC,,,,,,,,,,,,,,,,,,,,,,,,,,,,,0.0018276677968793037,poly,COMPLETE,0.0,,,,,,,,,,,,,,,,,,,,
54,54,0.3573487031700288,2023-08-23 18:15:09.332959,2023-08-23 18:15:14.415167,0 days 00:00:05.082208,,,,,SVC,,,,,,,,,,,,,,,,,,,,,,,,,,,,,0.0011552532247097863,linear,COMPLETE,0.0,,,,,,,,,,,,,,,,,,,,
55,55,0.3573487031700288,2023-08-23 18:15:10.397468,2023-08-23 18:15:15.823734,0 days 00:00:05.426266,,,,,SVC,,,,,,,,,,,,,,,,,,,,,,,,,,,,,0.0023863348700222625,poly,COMPLETE,0.0,,,,,,,,,,,,,,,,,,,,
56,56,0.48601528757260065,2023-08-23 18:15:14.394202,2023-08-23 18:15:14.790359,0 days 00:00:00.396157,,,,,DecisionTreeClassifier,,gini,29.0,,,,,,,,,,,,,,,,,,,,,,,,,,,,COMPLETE,0.0,,,,,,,,,,,,,,,,,,,,
57,57,0.5100976139823804,2023-08-23 18:15:14.533200,2023-08-23 18:15:15.588113,0 days 00:00:01.054913,,,,,RandomForestClassifier,,,,,,,,,,,,,,,,,,,,,,,,12.0,28.0,,,,,,COMPLETE,0.0,,,,,,,,,,,,,,,,,,,,
58,58,0.5399451505242658,2023-08-23 18:15:14.939906,2023-08-23 18:15:16.715928,0 days 00:00:01.776022,,1.0,2.0,,LightGBM,,,,,1.0,,,,7.833697943459852e-05,3.341533055382887e-07,,100.0,,,,,,,,,,230.0,,,,,,,,,COMPLETE,0.0,,,,,,,,,,,,,,,,,,,,
59,59,0.5483719755780151,2023-08-23 18:15:15.704859,2023-08-23 18:15:17.446787,0 days 00:00:01.741928,,1.0,2.0,,LightGBM,,,,,1.0,,,,0.0019140095243197184,3.766695250107582e-07,,100.0,,,,,,,,,,228.0,,,,,,,,,COMPLETE,0.0,,,,,,,,,,,,,,,,,,,,
60,60,0.5410895119012732,2023-08-23 18:15:15.887935,2023-08-23 18:15:17.909848,0 days 00:00:02.021913,,1.0,2.0,,LightGBM,,,,,1.0,,,,0.0015615472416447731,1.8478437317502596e-07,,100.0,,,,,,,,,,231.0,,,,,,,,,COMPLETE,0.0,,,,,,,,,,,,,,,,,,,,
61,61,0.5393210948870839,2023-08-23 18:15:16.808084,2023-08-23 18:15:18.787805,0 days 00:00:01.979721,,0.9,2.0,,LightGBM,,,,,1.0,,,,7.48195234324713e-05,1.8965382444417765e-07,,100.0,,,,,,,,,,228.0,,,,,,,,,COMPLETE,0.0,,,,,,,,,,,,,,,,,,,,
62,62,0.5432299654285045,2023-08-23 18:15:17.582814,2023-08-23 18:15:19.784519,0 days 00:00:02.201705,,0.9,2.0,,LightGBM,,,,,1.0,,,,0.0019741211180400015,2.0794276323773985e-07,,100.0,,,,,,,,,,176.0,,,,,,,,,COMPLETE,0.0,,,,,,,,,,,,,,,,,,,,
63,63,0.5432299654285045,2023-08-23 18:15:18.005370,2023-08-23 18:15:20.037351,0 days 00:00:02.031981,,0.9,2.0,,LightGBM,,,,,1.0,,,,0.0017868943412367492,1.5152284921392398e-07,,100.0,,,,,,,,,,176.0,,,,,,,,,COMPLETE,0.0,,,,,,,,,,,,,,,,,,,,
64,64,0.5393210948870839,2023-08-23 18:15:18.901178,2023-08-23 18:15:20.829778,0 days 00:00:01.928600,,0.9,2.0,,LightGBM,,,,,1.0,,,,5.1582072884277886e-05,1.4678031852102308e-07,,100.0,,,,,,,,,,229.0,,,,,,,,,COMPLETE,0.0,,,,,,,,,,,,,,,,,,,,
65,65,0.3573487031700288,2023-08-23 18:15:19.855660,2023-08-23 18:15:19.943149,0 days 00:00:00.087489,3.632249638825544e-05,,,gblinear,XGBoost,0.8657412744115403,,,,,,,0.0006636957894414937,,,,,,,,,,,,,,,,,,,,0.996489984870163,,,COMPLETE,0.0,,,,,,,,,,,,,,,,,,,,
66,66,0.536769218663939,2023-08-23 18:15:20.026781,2023-08-23 18:15:21.926979,0 days 00:00:01.900198,,0.9,2.0,,LightGBM,,,,,1.0,,,,0.0029268265979916124,8.652260516617538e-08,,100.0,,,,,,,,,,227.0,,,,,,,,,COMPLETE,0.0,,,,,,,,,,,,,,,,,,,,
67,67,0.5217395852949177,2023-08-23 18:15:20.116210,2023-08-23 18:15:22.648103,0 days 00:00:02.531893,,0.9,2.0,,LightGBM,,,,,1.0,,,,0.0030956874907563645,9.763518389071368e-08,,100.0,,,,,,,,,,231.0,,,,,,,,,COMPLETE,0.0,,,,,,,,,,,,,,,,,,,,
68,68,0.5393210948870839,2023-08-23 18:15:20.921304,2023-08-23 18:15:22.990268,0 days 00:00:02.068964,,0.9,2.0,,LightGBM,,,,,1.0,,,,4.7905340097895894e-05,1.217260207898938e-07,,100.0,,,,,,,,,,225.0,,,,,,,,,COMPLETE,0.0,,,,,,,,,,,,,,,,,,,,
69,69,0.5393210948870839,2023-08-23 18:15:22.088971,2023-08-23 18:15:23.835516,0 days 00:00:01.746545,,0.9,2.0,,LightGBM,,,,,1.0,,,,8.137154808895004e-05,1.5587054103858797e-07,,100.0,,,,,,,,,,184.0,,,,,,,,,COMPLETE,0.0,,,,,,,,,,,,,,,,,,,,
70,70,0.5472630649132398,2023-08-23 18:15:22.710542,2023-08-23 18:15:24.564831,0 days 00:00:01.854289,,0.9,2.0,,LightGBM,,,,,1.0,,,,5.0063556810209185e-05,1.4974776172904147e-07,,90.0,,,,,,,,,,180.0,,,,,,,,,COMPLETE,0.0,,,,,,,,,,,,,,,,,,,,
71,71,0.5361620511426884,2023-08-23 18:15:23.071435,2023-08-23 18:15:25.104308,0 days 00:00:02.032873,,0.8,2.0,,LightGBM,,,,,1.0,,,,9.018682885575787e-05,1.936151592044726e-07,,90.0,,,,,,,,,,183.0,,,,,,,,,COMPLETE,0.0,,,,,,,,,,,,,,,,,,,,
72,72,0.5222445608869329,2023-08-23 18:15:23.939535,2023-08-23 18:15:25.817238,0 days 00:00:01.877703,,0.8,2.0,,LightGBM,,,,,1.0,,,,0.002345944797368107,3.5050319682587746e-08,,90.0,,,,,,,,,,122.0,,,,,,,,,COMPLETE,0.0,,,,,,,,,,,,,,,,,,,,
73,73,0.5466978424464561,2023-08-23 18:15:24.644852,2023-08-23 18:15:26.634528,0 days 00:00:01.989676,,0.8,2.0,,LightGBM,,,,,1.0,,,,0.002830423512050007,4.493047291027258e-08,,90.0,,,,,,,,,,185.0,,,,,,,,,COMPLETE,0.0,,,,,,,,,,,,,,,,,,,,
74,74,0.37081053351573184,2023-08-23 18:15:25.171288,2023-08-23 18:15:26.369461,0 days 00:00:01.198173,,,,,RandomForestClassifier,,,,,,,,,,,,,,,,,,,,,,,,38.0,4.0,,,,,,COMPLETE,0.0,,,,,,,,,,,,,,,,,,,,
75,75,0.36593165561016655,2023-08-23 18:15:25.944615,2023-08-23 18:15:27.640395,0 days 00:00:01.695780,,,,,RandomForestClassifier,,,,,,,,,,,,,,,,,,,,,,,,46.0,4.0,,,,,,COMPLETE,0.0,,,,,,,,,,,,,,,,,,,,
76,76,0.5424558080808081,2023-08-23 18:15:26.504788,2023-08-23 18:15:28.361041,0 days 00:00:01.856253,,0.8,2.0,,LightGBM,,,,,0.5,,,,0.004791780600257315,4.116406676932859e-08,,90.0,,,,,,,,,,193.0,,,,,,,,,COMPLETE,0.0,,,,,,,,,,,,,,,,,,,,
77,77,0.5382173472015641,2023-08-23 18:15:26.714049,2023-08-23 18:15:28.548102,0 days 00:00:01.834053,,0.8,2.0,,LightGBM,,,,,1.0,,,,0.007311701753839051,3.537379686732084e-08,,90.0,,,,,,,,,,196.0,,,,,,,,,COMPLETE,0.0,,,,,,,,,,,,,,,,,,,,
78,78,0.5466978424464561,2023-08-23 18:15:27.749712,2023-08-23 18:15:29.690711,0 days 00:00:01.940999,,0.8,2.0,,LightGBM,,,,,1.0,,,,0.005026527688693671,5.777385207336136e-08,,90.0,,,,,,,,,,200.0,,,,,,,,,COMPLETE,0.0,,,,,,,,,,,,,,,,,,,,
79,79,0.5452495703406266,2023-08-23 18:15:28.452082,2023-08-23 18:15:30.177081,0 days 00:00:01.724999,,0.8,2.0,,LightGBM,,,,,0.5,,,,0.0042768043166415545,3.532823007475326e-08,,90.0,,,,,,,,,,197.0,,,,,,,,,COMPLETE,0.0,,,,,,,,,,,,,,,,,,,,
80,80,0.534473080538192,2023-08-23 18:15:28.632656,2023-08-23 18:15:30.361289,0 days 00:00:01.728633,,0.8,2.0,,LightGBM,,,,,0.5,,,,0.005366466937370314,4.975890742638929e-08,,90.0,,,,,,,,,,169.0,,,,,,,,,COMPLETE,0.0,,,,,,,,,,,,,,,,,,,,
81,81,0.534473080538192,2023-08-23 18:15:29.793214,2023-08-23 18:15:31.556583,0 days 00:00:01.763369,,0.8,2.0,,LightGBM,,,,,0.5,,,,0.005115879160057503,2.1733794616495853e-08,,90.0,,,,,,,,,,170.0,,,,,,,,,COMPLETE,0.0,,,,,,,,,,,,,,,,,,,,
82,82,0.5273538435371925,2023-08-23 18:15:30.246936,2023-08-23 18:15:32.105948,0 days 00:00:01.859012,,0.8,2.0,,LightGBM,,,,,0.5,,,,0.005885745315707854,1.7426745147342297e-08,,90.0,,,,,,,,,,169.0,,,,,,,,,COMPLETE,0.0,,,,,,,,,,,,,,,,,,,,
83,83,0.5278592990105652,2023-08-23 18:15:30.472374,2023-08-23 18:15:32.552693,0 days 00:00:02.080319,,0.7000000000000001,2.0,,LightGBM,,,,,0.5,,,,0.02185864043480483,1.4922822530070578e-08,,80.0,,,,,,,,,,211.0,,,,,,,,,COMPLETE,0.0,,,,,,,,,,,,,,,,,,,,
84,84,0.3573487031700288,2023-08-23 18:15:31.657647,2023-08-23 18:15:33.798558,0 days 00:00:02.140911,,,,,MLPClassifier,,,,,,,,,,,,,,tanh,sgd,3.0,10.0,10.0,10.0,,,,,,,,,,,,COMPLETE,0.0,,,,,,,,,,,,,,,,,,,,
85,85,0.35688536409516947,2023-08-23 18:15:32.244677,2023-08-23 18:15:35.102066,0 days 00:00:02.857389,,,,,MLPClassifier,,,,,,,,,,,,,,tanh,sgd,3.0,20.0,10.0,10.0,,,,,,,,,,,,COMPLETE,0.0,,,,,,,,,,,,,,,,,,,,
86,86,0.3573487031700288,2023-08-23 18:15:32.624519,2023-08-23 18:15:34.859216,0 days 00:00:02.234697,,,,,MLPClassifier,,,,,,,,,,,,,,tanh,sgd,3.0,10.0,10.0,10.0,,,,,,,,,,,,COMPLETE,0.0,,,,,,,,,,,,,,,,,,,,
