,number,value,datetime_start,datetime_complete,duration,params_alpha,params_bagging_fraction,params_bagging_freq,params_booster,params_classifier,params_colsample_bytree,params_dct_criterion,params_dct_max_depth,params_eta,params_feature_fraction,params_gamma,params_grow_policy,params_lambda,params_lambda_l1,params_lambda_l2,params_max_depth,params_min_child_samples,params_min_child_weight,params_mlp_activation,params_mlp_solver,params_n_layers,params_n_units_l_0,params_n_units_l_1,params_n_units_l_2,params_n_units_l_3,params_normalize_type,params_num_leaves,params_rate_drop,params_rf_estimator,params_rf_max_depth,params_sample_type,params_skip_drop,params_subsample,params_svc_c,params_svc_kernel,state,best_trial,dev_acc,dev_recall_macro,dev_precision_macro,dev_f1_macro,dev_recall_0,dev_precision_0,dev_f1_0,dev_recall_1,dev_precision_1,dev_f1_1,test_acc,test_recall_macro,test_precision_macro,test_f1_macro,test_recall_0,test_precision_0,test_f1_0,test_recall_1,test_precision_1,test_f1_1
0,0,0.6232935980243162,2023-08-23 15:34:48.714597,2023-08-23 15:34:49.252472,0 days 00:00:00.537875,,,,,RandomForestClassifier,,,,,,,,,,,,,,,,,,,,,,,,12.0,2.0,,,,,,COMPLETE,0.0,,,,,,,,,,,,,,,,,,,,
1,1,0.618345202237923,2023-08-23 15:34:48.717864,2023-08-23 15:34:51.698196,0 days 00:00:02.980332,,,,,RandomForestClassifier,,,,,,,,,,,,,,,,,,,,,,,,16.0,30.0,,,,,,COMPLETE,0.0,,,,,,,,,,,,,,,,,,,,
2,2,0.6281005956444438,2023-08-23 15:34:48.721622,2023-08-23 15:34:49.019534,0 days 00:00:00.297912,4.906277708185864e-07,,,gbtree,XGBoost,0.33067514661093445,,,6.941780567962442e-07,,6.842859652683717e-06,depthwise,1.6705629662560604e-05,,,5.0,,6.0,,,,,,,,,,,,,,,0.5005436319696354,,,COMPLETE,0.0,,,,,,,,,,,,,,,,,,,,
3,3,0.6275131941009242,2023-08-23 15:34:48.732990,2023-08-23 15:34:50.002904,0 days 00:00:01.269914,2.984640184975001e-05,,,gbtree,XGBoost,0.9594372117036352,,,0.10138045012548086,,0.47431622651594535,depthwise,3.0799211035829893e-07,,,9.0,,3.0,,,,,,,,,,,,,,,0.9615617912417944,,,COMPLETE,0.0,,,,,,,,,,,,,,,,,,,,
4,4,0.6440975932230246,2023-08-23 15:34:48.742541,2023-08-23 15:35:01.725422,0 days 00:00:12.982881,,,,,RandomForestClassifier,,,,,,,,,,,,,,,,,,,,,,,,96.0,11.0,,,,,,COMPLETE,0.0,,,,,,,,,,,,,,,,,,,,
5,5,0.6428654438033972,2023-08-23 15:34:48.748135,2023-08-23 15:35:00.576085,0 days 00:00:11.827950,,,,,RandomForestClassifier,,,,,,,,,,,,,,,,,,,,,,,,88.0,12.0,,,,,,COMPLETE,0.0,,,,,,,,,,,,,,,,,,,,
6,6,0.38489478091001506,2023-08-23 15:34:48.757302,2023-08-23 15:35:54.248699,0 days 00:01:05.491397,,,,,MLPClassifier,,,,,,,,,,,,,,identity,sgd,1.0,80.0,,,,,,,,,,,,,,COMPLETE,0.0,,,,,,,,,,,,,,,,,,,,
7,7,0.6412394566153752,2023-08-23 15:34:48.764516,2023-08-23 15:34:49.564592,0 days 00:00:00.800076,0.04528597415924651,,,gbtree,XGBoost,0.5550447817156767,,,0.0028656198015960047,,0.012254770930722015,lossguide,0.11884092276445755,,,5.0,,2.0,,,,,,,,,,,,,,,0.4957103703983293,,,COMPLETE,0.0,,,,,,,,,,,,,,,,,,,,
8,8,0.3357921744708146,2023-08-23 15:34:49.109942,2023-08-23 15:34:59.691816,0 days 00:00:10.581874,,,,,SVC,,,,,,,,,,,,,,,,,,,,,,,,,,,,,0.04326159280823899,rbf,COMPLETE,0.0,,,,,,,,,,,,,,,,,,,,
9,9,0.3357921744708146,2023-08-23 15:34:49.368409,2023-08-23 15:34:52.364639,0 days 00:00:02.996230,,,,,MLPClassifier,,,,,,,,,,,,,,relu,sgd,1.0,10.0,,,,,,,,,,,,,,COMPLETE,0.0,,,,,,,,,,,,,,,,,,,,
10,10,0.5555035465045156,2023-08-23 15:34:49.652826,2023-08-23 15:51:37.462869,0 days 00:16:47.810043,,,,,MLPClassifier,,,,,,,,,,,,,,identity,sgd,2.0,40.0,70.0,,,,,,,,,,,,,COMPLETE,0.0,,,,,,,,,,,,,,,,,,,,
11,11,0.6340504266816503,2023-08-23 15:34:50.125107,2023-08-23 15:34:50.979392,0 days 00:00:00.854285,,,,,DecisionTreeClassifier,,log_loss,7.0,,,,,,,,,,,,,,,,,,,,,,,,,,,,COMPLETE,0.0,,,,,,,,,,,,,,,,,,,,
12,12,0.6178727533708217,2023-08-23 15:34:51.087163,2023-08-23 15:34:53.056211,0 days 00:00:01.969048,,,,,RandomForestClassifier,,,,,,,,,,,,,,,,,,,,,,,,45.0,2.0,,,,,,COMPLETE,0.0,,,,,,,,,,,,,,,,,,,,
13,13,0.4412301203702478,2023-08-23 15:34:51.770972,2023-08-23 15:34:51.876724,0 days 00:00:00.105752,1.0152085007396298e-05,,,gblinear,XGBoost,0.6566953903999246,,,,,,,0.0130296693716858,,,,,,,,,,,,,,,,,,,,0.9991969812146364,,,COMPLETE,0.0,,,,,,,,,,,,,,,,,,,,
14,14,0.4353945923265497,2023-08-23 15:34:52.005850,2023-08-23 15:36:17.271162,0 days 00:01:25.265312,,,,,MLPClassifier,,,,,,,,,,,,,,identity,sgd,1.0,90.0,,,,,,,,,,,,,,COMPLETE,0.0,,,,,,,,,,,,,,,,,,,,
15,15,0.48765928652628154,2023-08-23 15:34:52.484726,2023-08-23 15:35:05.176566,0 days 00:00:12.691840,,,,,SVC,,,,,,,,,,,,,,,,,,,,,,,,,,,,,28.80878279598058,rbf,COMPLETE,0.0,,,,,,,,,,,,,,,,,,,,
16,16,0.6488033299860863,2023-08-23 15:34:53.156933,2023-08-23 15:34:55.352980,0 days 00:00:02.196047,,0.9,1.0,,LightGBM,,,,,1.0,,,,8.72437262376821e-07,0.5191189018595086,,100.0,,,,,,,,,,119.0,,,,,,,,,COMPLETE,0.0,,,,,,,,,,,,,,,,,,,,
17,17,0.6549776564051638,2023-08-23 15:34:55.493042,2023-08-23 15:34:57.523615,0 days 00:00:02.030573,,0.9,1.0,,LightGBM,,,,,1.0,,,,5.366107554667621e-07,0.7875477394468382,,100.0,,,,,,,,,,118.0,,,,,,,,,COMPLETE,0.0,,,,,,,,,,,,,,,,,,,,
18,18,0.6497067309453269,2023-08-23 15:34:57.632958,2023-08-23 15:34:59.951428,0 days 00:00:02.318470,,0.9,1.0,,LightGBM,,,,,1.0,,,,4.0307208964367027e-07,0.8588070891417118,,100.0,,,,,,,,,,116.0,,,,,,,,,COMPLETE,0.0,,,,,,,,,,,,,,,,,,,,
19,19,0.6538891015526529,2023-08-23 15:34:59.777613,2023-08-23 15:35:03.325179,0 days 00:00:03.547566,,0.9,1.0,,LightGBM,,,,,1.0,,,,4.4109274846515217e-07,0.5906497153169438,,100.0,,,,,,,,,,113.0,,,,,,,,,COMPLETE,0.0,,,,,,,,,,,,,,,,,,,,
20,20,0.655161750713606,2023-08-23 15:35:00.050247,2023-08-23 15:35:02.997287,0 days 00:00:02.947040,,0.9,1.0,,LightGBM,,,,,1.0,,,,3.091374498518598e-07,0.41453893290251637,,100.0,,,,,,,,,,117.0,,,,,,,,,COMPLETE,0.0,,,,,,,,,,,,,,,,,,,,
21,21,0.6488780245041006,2023-08-23 15:35:00.676518,2023-08-23 15:35:03.825767,0 days 00:00:03.149249,,0.9,1.0,,LightGBM,,,,,1.0,,,,1.8905457827989995e-07,0.733426120787066,,100.0,,,,,,,,,,120.0,,,,,,,,,COMPLETE,0.0,,,,,,,,,,,,,,,,,,,,
22,22,0.6584916270567922,2023-08-23 15:35:01.913151,2023-08-23 15:35:05.369941,0 days 00:00:03.456790,,0.9,1.0,,LightGBM,,,,,1.0,,,,2.2384372184487656e-07,0.27036460391235395,,100.0,,,,,,,,,,118.0,,,,,,,,,COMPLETE,0.0,,,,,,,,,,,,,,,,,,,,
23,23,0.6546002488859033,2023-08-23 15:35:03.056751,2023-08-23 15:35:06.223377,0 days 00:00:03.166626,,0.8,1.0,,LightGBM,,,,,1.0,,,,1.5214110870175408e-08,0.002888333004513781,,100.0,,,,,,,,,,120.0,,,,,,,,,COMPLETE,0.0,,,,,,,,,,,,,,,,,,,,
24,24,0.6469747794322545,2023-08-23 15:35:03.425254,2023-08-23 15:35:06.391495,0 days 00:00:02.966241,,0.5,3.0,,LightGBM,,,,,0.5,,,,0.016110767836369996,6.106167568478014e-05,,40.0,,,,,,,,,,239.0,,,,,,,,,COMPLETE,0.0,,,,,,,,,,,,,,,,,,,,
25,25,0.6397733483302835,2023-08-23 15:35:03.964927,2023-08-23 15:35:06.747304,0 days 00:00:02.782377,,0.5,3.0,,LightGBM,,,,,0.6000000000000001,,,,0.0017378858830503579,8.108029352018468e-05,,50.0,,,,,,,,,,229.0,,,,,,,,,COMPLETE,0.0,,,,,,,,,,,,,,,,,,,,
26,26,0.6468077521669434,2023-08-23 15:35:05.301340,2023-08-23 15:35:08.216850,0 days 00:00:02.915510,,0.5,3.0,,LightGBM,,,,,0.6000000000000001,,,,0.0010338297227531293,0.000127492278071094,,50.0,,,,,,,,,,228.0,,,,,,,,,COMPLETE,0.0,,,,,,,,,,,,,,,,,,,,
27,27,0.5856021709198238,2023-08-23 15:35:05.455007,2023-08-23 15:35:06.649965,0 days 00:00:01.194958,,,,,DecisionTreeClassifier,,gini,31.0,,,,,,,,,,,,,,,,,,,,,,,,,,,,COMPLETE,0.0,,,,,,,,,,,,,,,,,,,,
28,28,0.6497234016891476,2023-08-23 15:35:06.336214,2023-08-23 15:35:09.570449,0 days 00:00:03.234235,,0.6000000000000001,3.0,,LightGBM,,,,,0.7000000000000001,,,,0.00020098241352113573,3.3635720995531347e-07,,60.0,,,,,,,,,,208.0,,,,,,,,,COMPLETE,0.0,,,,,,,,,,,,,,,,,,,,
29,29,0.6429914215900674,2023-08-23 15:35:06.536951,2023-08-23 15:35:09.294829,0 days 00:00:02.757878,,0.7000000000000001,2.0,,LightGBM,,,,,0.8,,,,1.787638715471256e-05,4.3094323363177124e-08,,70.0,,,,,,,,,,38.0,,,,,,,,,COMPLETE,0.0,,,,,,,,,,,,,,,,,,,,
30,30,0.3357921744708146,2023-08-23 15:35:06.846563,2023-08-23 15:35:12.848654,0 days 00:00:06.002091,,,,,MLPClassifier,,,,,,,,,,,,,,logistic,lbfgs,4.0,100.0,80.0,60.0,90.0,,,,,,,,,,,COMPLETE,0.0,,,,,,,,,,,,,,,,,,,,
31,31,0.6217631478387268,2023-08-23 15:35:06.873306,2023-08-23 15:43:52.236465,0 days 00:08:45.363159,,,,,MLPClassifier,,,,,,,,,,,,,,tanh,lbfgs,4.0,100.0,70.0,100.0,80.0,,,,,,,,,,,COMPLETE,0.0,,,,,,,,,,,,,,,,,,,,
32,32,0.5689161340112695,2023-08-23 15:35:08.324902,2023-08-23 15:40:51.972885,0 days 00:05:43.647983,,,,,MLPClassifier,,,,,,,,,,,,,,identity,lbfgs,4.0,100.0,40.0,20.0,40.0,,,,,,,,,,,COMPLETE,0.0,,,,,,,,,,,,,,,,,,,,
33,33,0.3357921744708146,2023-08-23 15:35:09.408660,2023-08-23 15:35:15.826230,0 days 00:00:06.417570,,,,,MLPClassifier,,,,,,,,,,,,,,logistic,lbfgs,4.0,100.0,10.0,70.0,40.0,,,,,,,,,,,COMPLETE,0.0,,,,,,,,,,,,,,,,,,,,
34,34,0.6538891015526529,2023-08-23 15:35:09.712078,2023-08-23 15:35:13.945089,0 days 00:00:04.233011,,1.0,2.0,,LightGBM,,,,,0.8,,,,9.507228244456052e-06,0.02887402104151691,,80.0,,,,,,,,,,171.0,,,,,,,,,COMPLETE,0.0,,,,,,,,,,,,,,,,,,,,
35,35,0.6385851255834961,2023-08-23 15:35:12.938201,2023-08-23 15:35:17.188243,0 days 00:00:04.250042,,1.0,2.0,,LightGBM,,,,,0.8,,,,6.685619597452063e-06,0.04157465950293127,,80.0,,,,,,,,,,171.0,,,,,,,,,COMPLETE,0.0,,,,,,,,,,,,,,,,,,,,
36,36,0.5876302073037574,2023-08-23 15:35:14.138856,2023-08-23 15:40:39.200595,0 days 00:05:25.061739,,,,,MLPClassifier,,,,,,,,,,,,,,identity,adam,1.0,50.0,,,,,,,,,,,,,,COMPLETE,0.0,,,,,,,,,,,,,,,,,,,,
37,37,0.6178297884537531,2023-08-23 15:35:15.927854,2023-08-23 15:35:16.298760,0 days 00:00:00.370906,,,,,DecisionTreeClassifier,,entropy,2.0,,,,,,,,,,,,,,,,,,,,,,,,,,,,COMPLETE,0.0,,,,,,,,,,,,,,,,,,,,
38,38,0.6246001146378863,2023-08-23 15:35:16.361792,2023-08-23 15:35:21.501010,0 days 00:00:05.139218,,0.8,1.0,,LightGBM,,,,,0.9,,,,1.0355760132206275e-08,0.025150132785244042,,10.0,,,,,,,,,,66.0,,,,,,,,,COMPLETE,0.0,,,,,,,,,,,,,,,,,,,,
39,39,0.6450142338521512,2023-08-23 15:35:17.362453,2023-08-23 15:35:22.539280,0 days 00:00:05.176827,,0.8,1.0,,LightGBM,,,,,0.9,,,,2.1660217652366968e-08,0.027287033281688487,,10.0,,,,,,,,,,75.0,,,,,,,,,COMPLETE,0.0,,,,,,,,,,,,,,,,,,,,
40,40,0.6512765473145303,2023-08-23 15:35:21.688411,2023-08-23 15:35:24.658768,0 days 00:00:02.970357,,0.8,1.0,,LightGBM,,,,,0.9,,,,2.361218606688386e-08,0.050164137754458486,,90.0,,,,,,,,,,80.0,,,,,,,,,COMPLETE,0.0,,,,,,,,,,,,,,,,,,,,
41,41,0.3357921744708146,2023-08-23 15:35:22.687303,2023-08-23 15:35:29.766451,0 days 00:00:07.079148,,,,,SVC,,,,,,,,,,,,,,,,,,,,,,,,,,,,,0.0010116053506703851,linear,COMPLETE,0.0,,,,,,,,,,,,,,,,,,,,
42,42,0.3357921744708146,2023-08-23 15:35:24.763421,2023-08-23 15:35:32.202260,0 days 00:00:07.438839,,,,,SVC,,,,,,,,,,,,,,,,,,,,,,,,,,,,,0.0010698835197868787,poly,COMPLETE,0.0,,,,,,,,,,,,,,,,,,,,
43,43,0.6527518568069474,2023-08-23 15:35:29.862811,2023-08-23 15:35:33.155298,0 days 00:00:03.292487,,0.8,1.0,,LightGBM,,,,,1.0,,,,1.21235237808103e-07,0.00337530367239198,,90.0,,,,,,,,,,166.0,,,,,,,,,COMPLETE,0.0,,,,,,,,,,,,,,,,,,,,
44,44,0.6414279580731572,2023-08-23 15:35:32.277028,2023-08-23 15:35:35.588732,0 days 00:00:03.311704,,0.8,1.0,,LightGBM,,,,,1.0,,,,1.5190221406647474e-07,0.0023348591500515843,,90.0,,,,,,,,,,160.0,,,,,,,,,COMPLETE,0.0,,,,,,,,,,,,,,,,,,,,
45,45,0.46067708333333335,2023-08-23 15:35:33.271697,2023-08-23 15:35:34.346208,0 days 00:00:01.074511,2.2300817971532596e-08,,,dart,XGBoost,0.9936746423652785,,,1.5896143494798745e-08,,2.936397384528138e-08,lossguide,1.9156249846563744e-08,,,9.0,,10.0,,,,,,,,tree,,0.3861347327565588,,,weighted,1.1266020383033056e-05,0.22540792578092622,,,COMPLETE,0.0,,,,,,,,,,,,,,,,,,,,
46,46,0.6344773422720033,2023-08-23 15:35:34.474618,2023-08-23 15:35:39.387514,0 days 00:00:04.912896,,,,,RandomForestClassifier,,,,,,,,,,,,,,,,,,,,,,,,62.0,5.0,,,,,,COMPLETE,0.0,,,,,,,,,,,,,,,,,,,,
47,47,0.6407447433442599,2023-08-23 15:35:35.728794,2023-08-23 15:35:41.265796,0 days 00:00:05.537002,,,,,RandomForestClassifier,,,,,,,,,,,,,,,,,,,,,,,,64.0,5.0,,,,,,COMPLETE,0.0,,,,,,,,,,,,,,,,,,,,
48,48,0.640060598977124,2023-08-23 15:35:39.520642,2023-08-23 15:35:43.016549,0 days 00:00:03.495907,,0.9,1.0,,LightGBM,,,,,0.9,,,,8.910446731998824e-07,0.9388931594600863,,100.0,,,,,,,,,,99.0,,,,,,,,,COMPLETE,0.0,,,,,,,,,,,,,,,,,,,,
49,49,0.6449665429798335,2023-08-23 15:35:41.341420,2023-08-23 15:35:44.291574,0 days 00:00:02.950154,,0.9,1.0,,LightGBM,,,,,0.9,,,,1.4473756823037602e-06,0.26896946643701025,,100.0,,,,,,,,,,102.0,,,,,,,,,COMPLETE,0.0,,,,,,,,,,,,,,,,,,,,
50,50,0.6518197146499394,2023-08-23 15:35:43.093402,2023-08-23 15:35:45.932960,0 days 00:00:02.839558,,0.9,1.0,,LightGBM,,,,,1.0,,,,1.387238423410753e-06,0.21728028898654217,,100.0,,,,,,,,,,142.0,,,,,,,,,COMPLETE,0.0,,,,,,,,,,,,,,,,,,,,
51,51,0.6479012380229414,2023-08-23 15:35:44.404066,2023-08-23 15:35:48.081978,0 days 00:00:03.677912,,1.0,1.0,,LightGBM,,,,,1.0,,,,6.950679225206238e-08,0.10858164739503694,,90.0,,,,,,,,,,147.0,,,,,,,,,COMPLETE,0.0,,,,,,,,,,,,,,,,,,,,
52,52,0.5731106639052791,2023-08-23 15:35:46.089544,2023-08-23 15:41:36.335188,0 days 00:05:50.245644,,,,,MLPClassifier,,,,,,,,,,,,,,identity,adam,1.0,30.0,,,,,,,,,,,,,,COMPLETE,0.0,,,,,,,,,,,,,,,,,,,,
53,53,0.6240764922004338,2023-08-23 15:35:48.203845,2023-08-23 15:35:48.848277,0 days 00:00:00.644432,0.2377165005543322,,,dart,XGBoost,0.20273661039548113,,,5.1273899068504855e-05,,0.00020724666706806259,lossguide,0.0010121052327925451,,,3.0,,10.0,,,,,,,,forest,,1.1656000614051432e-08,,,uniform,0.3496866555984193,0.7384427128013311,,,COMPLETE,0.0,,,,,,,,,,,,,,,,,,,,
54,54,0.5775053062010518,2023-08-23 15:35:48.947538,2023-08-23 15:39:23.376314,0 days 00:03:34.428776,,,,,MLPClassifier,,,,,,,,,,,,,,identity,adam,1.0,30.0,,,,,,,,,,,,,,COMPLETE,0.0,,,,,,,,,,,,,,,,,,,,
55,55,0.6178297884537531,2023-08-23 15:35:54.348986,2023-08-23 15:35:54.531229,0 days 00:00:00.182243,,,,,DecisionTreeClassifier,,gini,2.0,,,,,,,,,,,,,,,,,,,,,,,,,,,,COMPLETE,0.0,,,,,,,,,,,,,,,,,,,,
56,56,0.6488033299860863,2023-08-23 15:35:54.605494,2023-08-23 15:35:57.649310,0 days 00:00:03.043816,,0.7000000000000001,2.0,,LightGBM,,,,,1.0,,,,4.483808883277095e-08,0.17687742688447922,,80.0,,,,,,,,,,96.0,,,,,,,,,COMPLETE,0.0,,,,,,,,,,,,,,,,,,,,
57,57,0.6242990962464543,2023-08-23 15:35:57.748913,2023-08-23 15:49:43.013834,0 days 00:13:45.264921,,,,,MLPClassifier,,,,,,,,,,,,,,tanh,adam,3.0,30.0,100.0,10.0,,,,,,,,,,,,COMPLETE,0.0,,,,,,,,,,,,,,,,,,,,
58,58,0.6503594800504429,2023-08-23 15:36:17.340994,2023-08-23 15:36:20.316286,0 days 00:00:02.975292,,1.0,2.0,,LightGBM,,,,,0.9,,,,3.7391397260679475e-06,0.16171209414623722,,80.0,,,,,,,,,,133.0,,,,,,,,,COMPLETE,0.0,,,,,,,,,,,,,,,,,,,,
59,59,0.6492483623537317,2023-08-23 15:36:20.383072,2023-08-23 15:36:23.089826,0 days 00:00:02.706754,,1.0,1.0,,LightGBM,,,,,0.8,,,,2.4760963142913883e-07,0.9496490704727103,,90.0,,,,,,,,,,181.0,,,,,,,,,COMPLETE,0.0,,,,,,,,,,,,,,,,,,,,
60,60,0.6491599697589113,2023-08-23 15:36:23.201444,2023-08-23 15:36:25.699223,0 days 00:00:02.497779,,0.9,1.0,,LightGBM,,,,,1.0,,,,3.754687431778831e-07,0.06126786125452305,,100.0,,,,,,,,,,129.0,,,,,,,,,COMPLETE,0.0,,,,,,,,,,,,,,,,,,,,
61,61,0.6449387173862081,2023-08-23 15:36:25.789409,2023-08-23 15:36:28.772872,0 days 00:00:02.983463,,1.0,2.0,,LightGBM,,,,,0.9,,,,4.3917894126809404e-08,0.19651902879295302,,90.0,,,,,,,,,,102.0,,,,,,,,,COMPLETE,0.0,,,,,,,,,,,,,,,,,,,,
62,62,0.6546141058765271,2023-08-23 15:36:28.893082,2023-08-23 15:36:31.569255,0 days 00:00:02.676173,,0.9,1.0,,LightGBM,,,,,1.0,,,,5.732238404465621e-06,0.013361235531834543,,100.0,,,,,,,,,,146.0,,,,,,,,,COMPLETE,0.0,,,,,,,,,,,,,,,,,,,,
63,63,0.6448750996480211,2023-08-23 15:36:31.672240,2023-08-23 15:36:34.007513,0 days 00:00:02.335273,,0.9,1.0,,LightGBM,,,,,1.0,,,,1.8178268735184601e-06,0.00848837549618526,,100.0,,,,,,,,,,138.0,,,,,,,,,COMPLETE,0.0,,,,,,,,,,,,,,,,,,,,
64,64,0.3357921744708146,2023-08-23 15:36:34.183466,2023-08-23 15:36:41.483617,0 days 00:00:07.300151,,,,,SVC,,,,,,,,,,,,,,,,,,,,,,,,,,,,,392.2282272332417,poly,COMPLETE,0.0,,,,,,,,,,,,,,,,,,,,
65,65,0.6303029256498923,2023-08-23 15:36:41.590120,2023-08-23 15:36:46.765045,0 days 00:00:05.174925,,,,,RandomForestClassifier,,,,,,,,,,,,,,,,,,,,,,,,42.0,32.0,,,,,,COMPLETE,0.0,,,,,,,,,,,,,,,,,,,,
66,66,0.615732531544728,2023-08-23 15:36:46.892194,2023-08-23 15:51:56.216132,0 days 00:15:09.323938,,,,,MLPClassifier,,,,,,,,,,,,,,tanh,adam,3.0,30.0,100.0,10.0,,,,,,,,,,,,COMPLETE,0.0,,,,,,,,,,,,,,,,,,,,
67,67,0.6411276790014332,2023-08-23 15:39:23.492252,2023-08-23 15:39:25.964398,0 days 00:00:02.472146,,0.8,1.0,,LightGBM,,,,,1.0,,,,3.5108958271646766e-07,0.2896817509383634,,90.0,,,,,,,,,,113.0,,,,,,,,,COMPLETE,0.0,,,,,,,,,,,,,,,,,,,,
68,68,0.6546141058765271,2023-08-23 15:39:26.032133,2023-08-23 15:39:28.562380,0 days 00:00:02.530247,,0.9,1.0,,LightGBM,,,,,1.0,,,,4.441458542851664e-06,0.01624125948059945,,100.0,,,,,,,,,,187.0,,,,,,,,,COMPLETE,0.0,,,,,,,,,,,,,,,,,,,,
69,69,0.6468407089121632,2023-08-23 15:39:28.642267,2023-08-23 15:39:31.241353,0 days 00:00:02.599086,,0.9,1.0,,LightGBM,,,,,1.0,,,,7.962358702552402e-07,0.3166366115943974,,100.0,,,,,,,,,,194.0,,,,,,,,,COMPLETE,0.0,,,,,,,,,,,,,,,,,,,,
70,70,0.6516559622315523,2023-08-23 15:39:31.307104,2023-08-23 15:39:33.909106,0 days 00:00:02.602002,,0.9,1.0,,LightGBM,,,,,1.0,,,,3.3509533690346207e-06,0.011928497532726874,,100.0,,,,,,,,,,148.0,,,,,,,,,COMPLETE,0.0,,,,,,,,,,,,,,,,,,,,
71,71,0.6502864126581334,2023-08-23 15:39:33.990445,2023-08-23 15:39:36.334724,0 days 00:00:02.344279,,0.9,1.0,,LightGBM,,,,,1.0,,,,7.105203619486761e-07,0.9965804405707978,,100.0,,,,,,,,,,112.0,,,,,,,,,COMPLETE,0.0,,,,,,,,,,,,,,,,,,,,
72,72,0.3357921744708146,2023-08-23 15:39:36.397744,2023-08-23 15:39:36.534140,0 days 00:00:00.136396,0.0012667313385489967,,,gblinear,XGBoost,0.7475823185514154,,,,,,,0.5518159024116128,,,,,,,,,,,,,,,,,,,,0.22489906635354057,,,COMPLETE,0.0,,,,,,,,,,,,,,,,,,,,
73,73,0.6473750746380056,2023-08-23 15:39:36.606540,2023-08-23 15:39:39.177626,0 days 00:00:02.571086,,0.8,1.0,,LightGBM,,,,,1.0,,,,9.471165832507197e-08,0.40035856320222857,,100.0,,,,,,,,,,124.0,,,,,,,,,COMPLETE,0.0,,,,,,,,,,,,,,,,,,,,
74,74,0.6461990433194797,2023-08-23 15:39:39.308990,2023-08-23 15:39:41.386426,0 days 00:00:02.077436,,0.9,1.0,,LightGBM,,,,,0.4,,,,2.8748671534456515e-07,0.12967591197234296,,90.0,,,,,,,,,,121.0,,,,,,,,,COMPLETE,0.0,,,,,,,,,,,,,,,,,,,,
75,75,0.599691991666754,2023-08-23 15:39:41.491397,2023-08-23 15:39:43.016447,0 days 00:00:01.525050,,,,,DecisionTreeClassifier,,log_loss,26.0,,,,,,,,,,,,,,,,,,,,,,,,,,,,COMPLETE,0.0,,,,,,,,,,,,,,,,,,,,
76,76,0.6448204099375665,2023-08-23 15:39:43.122638,2023-08-23 15:39:45.823601,0 days 00:00:02.700963,,0.9,1.0,,LightGBM,,,,,1.0,,,,2.1019776694817324e-05,0.08964245546761958,,100.0,,,,,,,,,,84.0,,,,,,,,,COMPLETE,0.0,,,,,,,,,,,,,,,,,,,,
77,77,0.6444628558739613,2023-08-23 15:39:45.938167,2023-08-23 15:39:48.469764,0 days 00:00:02.531597,,0.9,1.0,,LightGBM,,,,,0.9,,,,5.01938765669664e-07,0.49285044414357754,,100.0,,,,,,,,,,155.0,,,,,,,,,COMPLETE,0.0,,,,,,,,,,,,,,,,,,,,
78,78,0.6507496483199009,2023-08-23 15:39:48.617057,2023-08-23 15:39:51.549849,0 days 00:00:02.932792,,1.0,1.0,,LightGBM,,,,,1.0,,,,7.665365349987606e-06,0.017589257571467315,,90.0,,,,,,,,,,183.0,,,,,,,,,COMPLETE,0.0,,,,,,,,,,,,,,,,,,,,
79,79,0.6454428832661592,2023-08-23 15:39:51.674555,2023-08-23 15:39:54.480500,0 days 00:00:02.805945,,1.0,1.0,,LightGBM,,,,,1.0,,,,2.634923432429979e-06,0.08209872034285032,,80.0,,,,,,,,,,130.0,,,,,,,,,COMPLETE,0.0,,,,,,,,,,,,,,,,,,,,
80,80,0.6551038401253919,2023-08-23 15:39:54.569125,2023-08-23 15:39:56.971956,0 days 00:00:02.402831,,0.9,1.0,,LightGBM,,,,,0.7000000000000001,,,,1.5622296965908282e-07,0.008378108066640647,,100.0,,,,,,,,,,115.0,,,,,,,,,COMPLETE,0.0,,,,,,,,,,,,,,,,,,,,
81,81,0.6466267099985739,2023-08-23 15:39:57.044307,2023-08-23 15:40:01.283027,0 days 00:00:04.238720,,0.9,1.0,,LightGBM,,,,,0.6000000000000001,,,,1.580726284185669e-07,0.003786799018017939,,30.0,,,,,,,,,,113.0,,,,,,,,,COMPLETE,0.0,,,,,,,,,,,,,,,,,,,,
82,82,0.6117660247110823,2023-08-23 15:40:01.373835,2023-08-23 15:52:15.907019,0 days 00:12:14.533184,,,,,MLPClassifier,,,,,,,,,,,,,,tanh,adam,3.0,50.0,100.0,10.0,,,,,,,,,,,,COMPLETE,0.0,,,,,,,,,,,,,,,,,,,,
83,83,0.6411152913858276,2023-08-23 15:40:39.325174,2023-08-23 15:40:41.087598,0 days 00:00:01.762424,,0.8,1.0,,LightGBM,,,,,0.7000000000000001,,,,8.847417065426173e-08,0.001072479238527403,,100.0,,,,,,,,,,93.0,,,,,,,,,COMPLETE,0.0,,,,,,,,,,,,,,,,,,,,
84,84,0.4985669802980906,2023-08-23 15:40:41.169329,2023-08-23 15:40:47.688836,0 days 00:00:06.519507,,,,,SVC,,,,,,,,,,,,,,,,,,,,,,,,,,,,,1.4581399324266553,linear,COMPLETE,0.0,,,,,,,,,,,,,,,,,,,,
85,85,0.6430343881116964,2023-08-23 15:40:47.814781,2023-08-23 15:40:48.776328,0 days 00:00:00.961547,,0.4,1.0,,LightGBM,,,,,0.5,,,,5.555523447840769e-07,0.008712398023736433,,100.0,,,,,,,,,,212.0,,,,,,,,,COMPLETE,0.0,,,,,,,,,,,,,,,,,,,,
