,number,value,datetime_start,datetime_complete,duration,params_alpha,params_bagging_fraction,params_bagging_freq,params_booster,params_classifier,params_colsample_bytree,params_dct_criterion,params_dct_max_depth,params_eta,params_feature_fraction,params_gamma,params_grow_policy,params_lambda,params_lambda_l1,params_lambda_l2,params_max_depth,params_min_child_samples,params_min_child_weight,params_mlp_activation,params_mlp_solver,params_n_layers,params_n_units_l_0,params_n_units_l_1,params_n_units_l_2,params_n_units_l_3,params_normalize_type,params_num_leaves,params_rate_drop,params_rf_estimator,params_rf_max_depth,params_sample_type,params_skip_drop,params_subsample,params_svc_c,params_svc_kernel,state,best_trial,dev_acc,dev_recall_macro,dev_precision_macro,dev_f1_macro,dev_recall_0,dev_precision_0,dev_f1_0,dev_recall_1,dev_precision_1,dev_f1_1,test_acc,test_recall_macro,test_precision_macro,test_f1_macro,test_recall_0,test_precision_0,test_f1_0,test_recall_1,test_precision_1,test_f1_1
167,167,0.5886355039458617,2023-08-23 14:44:16.340699,2023-08-23 14:44:18.266005,0 days 00:00:01.925306,,0.5,2.0,,LightGBM,,,,,0.6000000000000001,,,,0.00032091970940415886,0.0014163604396464063,,90.0,,,,,,,,,,205.0,,,,,,,,,COMPLETE,0.0,,,,,,,,,,,,,,,,,,,,
168,168,0.6063324592736358,2023-08-23 14:44:16.476751,2023-08-23 14:44:17.956243,0 days 00:00:01.479492,,0.5,1.0,,LightGBM,,,,,0.6000000000000001,,,,0.000284997179134418,0.0022676359235527404,,80.0,,,,,,,,,,208.0,,,,,,,,,COMPLETE,0.0,,,,,,,,,,,,,,,,,,,,
169,169,0.6063324592736358,2023-08-23 14:44:18.080872,2023-08-23 14:44:19.813162,0 days 00:00:01.732290,,0.5,1.0,,LightGBM,,,,,0.6000000000000001,,,,0.00011276746891173371,0.001326244671486331,,80.0,,,,,,,,,,209.0,,,,,,,,,COMPLETE,0.0,,,,,,,,,,,,,,,,,,,,
170,170,0.5959895415148333,2023-08-23 14:44:18.358788,2023-08-23 14:44:20.150645,0 days 00:00:01.791857,,0.5,1.0,,LightGBM,,,,,0.4,,,,0.0001074690085664845,0.002714657423337729,,80.0,,,,,,,,,,211.0,,,,,,,,,COMPLETE,0.0,,,,,,,,,,,,,,,,,,,,
171,171,0.5959895415148333,2023-08-23 14:44:18.696263,2023-08-23 14:44:20.273176,0 days 00:00:01.576913,,0.5,1.0,,LightGBM,,,,,0.4,,,,0.00011091740720185502,0.0030646302195190818,,80.0,,,,,,,,,,210.0,,,,,,,,,COMPLETE,0.0,,,,,,,,,,,,,,,,,,,,
172,172,0.6063324592736358,2023-08-23 14:44:19.893014,2023-08-23 14:44:21.283994,0 days 00:00:01.390980,,0.5,1.0,,LightGBM,,,,,0.6000000000000001,,,,0.00013489359967654797,0.0032447254210280305,,80.0,,,,,,,,,,223.0,,,,,,,,,COMPLETE,0.0,,,,,,,,,,,,,,,,,,,,
173,173,0.5820040044459419,2023-08-23 14:44:20.270051,2023-08-23 14:44:21.862365,0 days 00:00:01.592314,,0.5,1.0,,LightGBM,,,,,0.6000000000000001,,,,0.00042672101844480094,0.012390951552122479,,70.0,,,,,,,,,,223.0,,,,,,,,,COMPLETE,0.0,,,,,,,,,,,,,,,,,,,,
174,174,0.5820040044459419,2023-08-23 14:44:20.358373,2023-08-23 14:44:22.159765,0 days 00:00:01.801392,,0.5,1.0,,LightGBM,,,,,0.6000000000000001,,,,0.0004110921126018745,0.01279993864021582,,70.0,,,,,,,,,,223.0,,,,,,,,,COMPLETE,0.0,,,,,,,,,,,,,,,,,,,,
175,175,0.5978218602037323,2023-08-23 14:44:21.374840,2023-08-23 14:44:23.095748,0 days 00:00:01.720908,,0.5,1.0,,LightGBM,,,,,0.6000000000000001,,,,0.0004608301946566757,0.0003519000381210478,,70.0,,,,,,,,,,225.0,,,,,,,,,COMPLETE,0.0,,,,,,,,,,,,,,,,,,,,
176,176,0.5820040044459419,2023-08-23 14:44:21.914925,2023-08-23 14:44:23.786174,0 days 00:00:01.871249,,0.5,1.0,,LightGBM,,,,,0.6000000000000001,,,,0.00024293653688454544,0.006688581850449479,,70.0,,,,,,,,,,200.0,,,,,,,,,COMPLETE,0.0,,,,,,,,,,,,,,,,,,,,
177,177,0.6063324592736358,2023-08-23 14:44:22.224843,2023-08-23 14:44:23.488278,0 days 00:00:01.263435,,0.5,1.0,,LightGBM,,,,,0.6000000000000001,,,,0.00019392486698394608,0.005625772187319396,,80.0,,,,,,,,,,203.0,,,,,,,,,COMPLETE,0.0,,,,,,,,,,,,,,,,,,,,
178,178,0.6063324592736358,2023-08-23 14:44:23.169097,2023-08-23 14:44:24.876200,0 days 00:00:01.707103,,0.5,1.0,,LightGBM,,,,,0.6000000000000001,,,,0.00024177935804131406,0.005160372936582352,,80.0,,,,,,,,,,203.0,,,,,,,,,COMPLETE,0.0,,,,,,,,,,,,,,,,,,,,
179,179,0.6063324592736358,2023-08-23 14:44:23.605634,2023-08-23 14:44:25.296391,0 days 00:00:01.690757,,0.5,1.0,,LightGBM,,,,,0.6000000000000001,,,,0.0003002225567906333,0.007208657867389006,,80.0,,,,,,,,,,201.0,,,,,,,,,COMPLETE,0.0,,,,,,,,,,,,,,,,,,,,
180,180,0.6063324592736358,2023-08-23 14:44:23.883236,2023-08-23 14:44:25.569283,0 days 00:00:01.686047,,0.5,1.0,,LightGBM,,,,,0.6000000000000001,,,,0.000315148653310514,0.0019691351977820567,,80.0,,,,,,,,,,218.0,,,,,,,,,COMPLETE,0.0,,,,,,,,,,,,,,,,,,,,
181,181,0.6063324592736358,2023-08-23 14:44:24.969222,2023-08-23 14:44:26.943535,0 days 00:00:01.974313,,0.5,1.0,,LightGBM,,,,,0.6000000000000001,,,,5.4240502405165026e-05,0.002039552198892418,,80.0,,,,,,,,,,218.0,,,,,,,,,COMPLETE,0.0,,,,,,,,,,,,,,,,,,,,
182,182,0.6063324592736358,2023-08-23 14:44:25.397917,2023-08-23 14:44:27.725303,0 days 00:00:02.327386,,0.5,1.0,,LightGBM,,,,,0.6000000000000001,,,,5.4454297201847934e-05,0.002118500370290955,,80.0,,,,,,,,,,218.0,,,,,,,,,COMPLETE,0.0,,,,,,,,,,,,,,,,,,,,
183,183,0.5908683414990097,2023-08-23 14:44:25.719596,2023-08-23 14:44:27.539559,0 days 00:00:01.819963,,0.5,1.0,,LightGBM,,,,,0.6000000000000001,,,,0.00015305331337131902,0.001727623728987581,,100.0,,,,,,,,,,158.0,,,,,,,,,COMPLETE,0.0,,,,,,,,,,,,,,,,,,,,
184,184,0.526152337365152,2023-08-23 14:44:27.026679,2023-08-23 14:44:27.827155,0 days 00:00:00.800476,0.018364528287749798,,,dart,XGBoost,0.40217461134370214,,,0.7683682606905277,,0.6351431195939331,lossguide,0.010173858239906769,,,5.0,,7.0,,,,,,,,tree,,0.4469317625710803,,,weighted,4.9362923295941316e-08,0.4222401238625966,,,COMPLETE,0.0,,,,,,,,,,,,,,,,,,,,
185,185,0.6063324592736358,2023-08-23 14:44:27.650023,2023-08-23 14:44:29.713366,0 days 00:00:02.063343,,0.5,1.0,,LightGBM,,,,,0.6000000000000001,,,,0.0006019805877129461,0.004306784067718336,,80.0,,,,,,,,,,191.0,,,,,,,,,COMPLETE,0.0,,,,,,,,,,,,,,,,,,,,
186,186,0.5062557226023687,2023-08-23 14:44:27.800849,2023-08-23 14:44:28.427254,0 days 00:00:00.626405,0.06943600474917025,,,dart,XGBoost,0.41917110524551604,,,0.870420763054198,,0.6259796387246803,lossguide,0.009498134901454078,,,5.0,,7.0,,,,,,,,tree,,0.9998666722729218,,,uniform,4.519890101106127e-08,0.41951277712088075,,,COMPLETE,0.0,,,,,,,,,,,,,,,,,,,,
187,187,0.39614422369389257,2023-08-23 14:44:27.933466,2023-08-23 14:46:00.080258,0 days 00:01:32.146792,,,,,MLPClassifier,,,,,,,,,,,,,,identity,adam,3.0,30.0,60.0,10.0,,,,,,,,,,,,COMPLETE,0.0,,,,,,,,,,,,,,,,,,,,
188,188,0.6063324592736358,2023-08-23 14:44:28.515415,2023-08-23 14:44:30.227653,0 days 00:00:01.712238,,0.5,1.0,,LightGBM,,,,,0.6000000000000001,,,,8.346673092720174e-05,0.0039879054008475235,,80.0,,,,,,,,,,210.0,,,,,,,,,COMPLETE,0.0,,,,,,,,,,,,,,,,,,,,
189,189,0.6063324592736358,2023-08-23 14:44:29.781488,2023-08-23 14:44:31.542386,0 days 00:00:01.760898,,0.5,1.0,,LightGBM,,,,,0.6000000000000001,,,,0.0001503188174843684,0.000927404935610745,,80.0,,,,,,,,,,209.0,,,,,,,,,COMPLETE,0.0,,,,,,,,,,,,,,,,,,,,
190,190,0.6063324592736358,2023-08-23 14:44:30.310648,2023-08-23 14:44:31.716232,0 days 00:00:01.405584,,0.5,1.0,,LightGBM,,,,,0.6000000000000001,,,,8.555723055776844e-05,0.0009794599848763003,,80.0,,,,,,,,,,211.0,,,,,,,,,COMPLETE,0.0,,,,,,,,,,,,,,,,,,,,
191,191,0.6063324592736358,2023-08-23 14:44:31.632897,2023-08-23 14:44:33.551806,0 days 00:00:01.918909,,0.5,1.0,,LightGBM,,,,,0.6000000000000001,,,,8.49781869679406e-05,0.002686692190401801,,80.0,,,,,,,,,,213.0,,,,,,,,,COMPLETE,0.0,,,,,,,,,,,,,,,,,,,,
192,192,0.4135180152537916,2023-08-23 14:44:31.788078,2023-08-23 14:46:31.600719,0 days 00:01:59.812641,,,,,MLPClassifier,,,,,,,,,,,,,,identity,adam,3.0,40.0,60.0,10.0,,,,,,,,,,,,COMPLETE,0.0,,,,,,,,,,,,,,,,,,,,
193,193,0.6063324592736358,2023-08-23 14:44:33.674626,2023-08-23 14:44:35.143975,0 days 00:00:01.469349,,0.5,1.0,,LightGBM,,,,,0.6000000000000001,,,,6.048064326426767e-05,0.0005075203606308532,,80.0,,,,,,,,,,197.0,,,,,,,,,COMPLETE,0.0,,,,,,,,,,,,,,,,,,,,
194,194,0.4288059897543675,2023-08-23 14:44:35.240315,2023-08-23 14:46:18.566105,0 days 00:01:43.325790,,,,,MLPClassifier,,,,,,,,,,,,,,identity,adam,3.0,40.0,60.0,10.0,,,,,,,,,,,,COMPLETE,0.0,,,,,,,,,,,,,,,,,,,,
195,195,0.5217284643396994,2023-08-23 14:44:54.396032,2023-08-23 14:44:54.627019,0 days 00:00:00.230987,,,,,DecisionTreeClassifier,,entropy,5.0,,,,,,,,,,,,,,,,,,,,,,,,,,,,COMPLETE,0.0,,,,,,,,,,,,,,,,,,,,
196,196,0.5945791518627024,2023-08-23 14:44:54.716984,2023-08-23 14:44:55.958850,0 days 00:00:01.241866,,0.5,1.0,,LightGBM,,,,,0.6000000000000001,,,,2.6669974888836577e-05,0.00023843705018308296,,90.0,,,,,,,,,,205.0,,,,,,,,,COMPLETE,0.0,,,,,,,,,,,,,,,,,,,,
197,197,0.5714122462548568,2023-08-23 14:44:56.018937,2023-08-23 14:44:57.147368,0 days 00:00:01.128431,,0.5,3.0,,LightGBM,,,,,0.6000000000000001,,,,0.00014957023615738747,0.0016586211762603087,,80.0,,,,,,,,,,215.0,,,,,,,,,COMPLETE,0.0,,,,,,,,,,,,,,,,,,,,
198,198,0.6063324592736358,2023-08-23 14:44:57.346645,2023-08-23 14:44:58.541613,0 days 00:00:01.194968,,0.5,1.0,,LightGBM,,,,,0.6000000000000001,,,,0.0001156647817739805,0.0006241004842854415,,80.0,,,,,,,,,,207.0,,,,,,,,,COMPLETE,0.0,,,,,,,,,,,,,,,,,,,,
199,199,0.6063324592736358,2023-08-23 14:44:58.624865,2023-08-23 14:44:59.783257,0 days 00:00:01.158392,,0.5,1.0,,LightGBM,,,,,0.6000000000000001,,,,0.0002324937528172327,0.00048032273634106986,,80.0,,,,,,,,,,206.0,,,,,,,,,COMPLETE,0.0,,,,,,,,,,,,,,,,,,,,
200,200,0.6063324592736358,2023-08-23 14:44:59.850769,2023-08-23 14:45:01.227337,0 days 00:00:01.376568,,0.5,1.0,,LightGBM,,,,,0.6000000000000001,,,,0.0002114496494737907,0.0029833948344420553,,80.0,,,,,,,,,,196.0,,,,,,,,,COMPLETE,0.0,,,,,,,,,,,,,,,,,,,,
201,201,0.6063324592736358,2023-08-23 14:45:01.363745,2023-08-23 14:45:02.810961,0 days 00:00:01.447216,,0.5,1.0,,LightGBM,,,,,0.6000000000000001,,,,0.00010033998153995371,0.0003250563513203996,,80.0,,,,,,,,,,211.0,,,,,,,,,COMPLETE,0.0,,,,,,,,,,,,,,,,,,,,
202,202,0.5849875930521091,2023-08-23 14:45:02.898817,2023-08-23 14:45:04.847889,0 days 00:00:01.949072,,1.0,1.0,,LightGBM,,,,,0.6000000000000001,,,,0.0001502505551122262,0.0012186083465261783,,80.0,,,,,,,,,,205.0,,,,,,,,,COMPLETE,0.0,,,,,,,,,,,,,,,,,,,,
203,203,0.5797245521383452,2023-08-23 14:45:04.931211,2023-08-23 14:45:06.102451,0 days 00:00:01.171240,,0.4,1.0,,LightGBM,,,,,0.6000000000000001,,,,0.0003692861779611769,0.008995678493527538,,80.0,,,,,,,,,,214.0,,,,,,,,,COMPLETE,0.0,,,,,,,,,,,,,,,,,,,,
204,204,0.6063324592736358,2023-08-23 14:45:06.214119,2023-08-23 14:45:07.630924,0 days 00:00:01.416805,,0.5,1.0,,LightGBM,,,,,0.6000000000000001,,,,6.162415973307425e-05,0.0004031328511247155,,80.0,,,,,,,,,,199.0,,,,,,,,,COMPLETE,0.0,,,,,,,,,,,,,,,,,,,,
205,205,0.531758530183727,2023-08-23 14:45:07.716921,2023-08-23 14:45:08.276854,0 days 00:00:00.559933,,,,,RandomForestClassifier,,,,,,,,,,,,,,,,,,,,,,,,11.0,9.0,,,,,,COMPLETE,0.0,,,,,,,,,,,,,,,,,,,,
206,206,0.5850028316350003,2023-08-23 14:45:08.455729,2023-08-23 14:45:09.534411,0 days 00:00:01.078682,,0.5,1.0,,LightGBM,,,,,0.5,,,,0.00020095686305903046,0.004917634791282587,,80.0,,,,,,,,,,192.0,,,,,,,,,COMPLETE,0.0,,,,,,,,,,,,,,,,,,,,
207,207,0.585514129966083,2023-08-23 14:45:09.665719,2023-08-23 14:45:11.805264,0 days 00:00:02.139545,,0.9,1.0,,LightGBM,,,,,0.6000000000000001,,,,3.257916410290212e-05,0.0025632396938993123,,80.0,,,,,,,,,,228.0,,,,,,,,,COMPLETE,0.0,,,,,,,,,,,,,,,,,,,,
208,208,0.6063324592736358,2023-08-23 14:45:11.865132,2023-08-23 14:45:13.156987,0 days 00:00:01.291855,,0.5,1.0,,LightGBM,,,,,0.6000000000000001,,,,0.00022339517675400652,0.0012953113963363979,,80.0,,,,,,,,,,221.0,,,,,,,,,COMPLETE,0.0,,,,,,,,,,,,,,,,,,,,
209,209,0.6063324592736358,2023-08-23 14:45:13.245029,2023-08-23 14:45:14.357282,0 days 00:00:01.112253,,0.5,1.0,,LightGBM,,,,,0.6000000000000001,,,,0.00012937999198421856,0.0015903718552968131,,80.0,,,,,,,,,,218.0,,,,,,,,,COMPLETE,0.0,,,,,,,,,,,,,,,,,,,,
210,210,0.6063324592736358,2023-08-23 14:45:14.427482,2023-08-23 14:45:15.845149,0 days 00:00:01.417667,,0.5,1.0,,LightGBM,,,,,0.6000000000000001,,,,0.0003325116742732617,0.0036409407557076658,,80.0,,,,,,,,,,206.0,,,,,,,,,COMPLETE,0.0,,,,,,,,,,,,,,,,,,,,
211,211,0.6063324592736358,2023-08-23 14:45:15.938531,2023-08-23 14:45:17.262864,0 days 00:00:01.324333,,0.5,1.0,,LightGBM,,,,,0.6000000000000001,,,,9.129652020603302e-05,0.0006673864880554104,,80.0,,,,,,,,,,214.0,,,,,,,,,COMPLETE,0.0,,,,,,,,,,,,,,,,,,,,
212,212,0.6063324592736358,2023-08-23 14:45:17.391361,2023-08-23 14:45:18.528228,0 days 00:00:01.136867,,0.5,1.0,,LightGBM,,,,,0.6000000000000001,,,,0.0005451403913476978,0.0010003825338595754,,80.0,,,,,,,,,,226.0,,,,,,,,,COMPLETE,0.0,,,,,,,,,,,,,,,,,,,,
213,213,0.5770803214724307,2023-08-23 14:45:18.599401,2023-08-23 14:45:23.466635,0 days 00:00:04.867234,,0.5,1.0,,LightGBM,,,,,0.6000000000000001,,,,0.00024157222738285688,0.0021530838777288645,,10.0,,,,,,,,,,201.0,,,,,,,,,COMPLETE,0.0,,,,,,,,,,,,,,,,,,,,
214,214,0.5945791518627024,2023-08-23 14:45:23.546269,2023-08-23 14:45:24.608587,0 days 00:00:01.062318,,0.5,1.0,,LightGBM,,,,,0.6000000000000001,,,,5.147238252820546e-05,0.00016115220587533736,,90.0,,,,,,,,,,208.0,,,,,,,,,COMPLETE,0.0,,,,,,,,,,,,,,,,,,,,
215,215,0.5865159279956735,2023-08-23 14:45:24.726099,2023-08-23 14:45:26.068686,0 days 00:00:01.342587,,0.5,1.0,,LightGBM,,,,,0.9,,,,0.0009842633012929261,0.003371908706550184,,80.0,,,,,,,,,,220.0,,,,,,,,,COMPLETE,0.0,,,,,,,,,,,,,,,,,,,,
216,216,0.37081053351573184,2023-08-23 14:45:26.149913,2023-08-23 14:46:32.493375,0 days 00:01:06.343462,,,,,MLPClassifier,,,,,,,,,,,,,,identity,adam,3.0,40.0,70.0,10.0,,,,,,,,,,,,COMPLETE,0.0,,,,,,,,,,,,,,,,,,,,
217,217,0.35688536409516947,2023-08-23 14:45:45.684669,2023-08-23 14:45:51.754557,0 days 00:00:06.069888,,,,,SVC,,,,,,,,,,,,,,,,,,,,,,,,,,,,,7.071328891461469,rbf,COMPLETE,0.0,,,,,,,,,,,,,,,,,,,,
218,218,0.6063324592736358,2023-08-23 14:45:51.817102,2023-08-23 14:45:53.274788,0 days 00:00:01.457686,,0.5,1.0,,LightGBM,,,,,0.6000000000000001,,,,0.0001635988277027123,0.0035534695878346114,,80.0,,,,,,,,,,213.0,,,,,,,,,COMPLETE,0.0,,,,,,,,,,,,,,,,,,,,
219,219,0.6063324592736358,2023-08-23 14:45:53.342275,2023-08-23 14:45:54.529602,0 days 00:00:01.187327,,0.5,1.0,,LightGBM,,,,,0.6000000000000001,,,,0.000262973366207823,0.005345826205841023,,80.0,,,,,,,,,,225.0,,,,,,,,,COMPLETE,0.0,,,,,,,,,,,,,,,,,,,,
220,220,0.6063324592736358,2023-08-23 14:45:54.610885,2023-08-23 14:45:55.681973,0 days 00:00:01.071088,,0.5,1.0,,LightGBM,,,,,0.6000000000000001,,,,0.00011395781918018212,0.0019331125942216784,,80.0,,,,,,,,,,221.0,,,,,,,,,COMPLETE,0.0,,,,,,,,,,,,,,,,,,,,
221,221,0.6063324592736358,2023-08-23 14:45:55.760777,2023-08-23 14:45:56.813913,0 days 00:00:01.053136,,0.5,1.0,,LightGBM,,,,,0.6000000000000001,,,,0.0003958935721516353,0.0002555388624956378,,80.0,,,,,,,,,,214.0,,,,,,,,,COMPLETE,0.0,,,,,,,,,,,,,,,,,,,,
222,222,0.6063324592736358,2023-08-23 14:45:56.884286,2023-08-23 14:45:58.024680,0 days 00:00:01.140394,,0.5,1.0,,LightGBM,,,,,0.6000000000000001,,,,0.00018005415504097772,0.002706705669293265,,80.0,,,,,,,,,,204.0,,,,,,,,,COMPLETE,0.0,,,,,,,,,,,,,,,,,,,,
223,223,0.6063324592736358,2023-08-23 14:45:58.125016,2023-08-23 14:45:59.151488,0 days 00:00:01.026472,,0.5,1.0,,LightGBM,,,,,0.6000000000000001,,,,8.555330886419674e-05,0.0008257324327854273,,80.0,,,,,,,,,,209.0,,,,,,,,,COMPLETE,0.0,,,,,,,,,,,,,,,,,,,,
224,224,0.6063324592736358,2023-08-23 14:45:59.205729,2023-08-23 14:46:00.453399,0 days 00:00:01.247670,,0.5,1.0,,LightGBM,,,,,0.6000000000000001,,,,0.0005446020805824951,0.0013060090046430684,,80.0,,,,,,,,,,197.0,,,,,,,,,COMPLETE,0.0,,,,,,,,,,,,,,,,,,,,
225,225,0.6063324592736358,2023-08-23 14:46:00.161266,2023-08-23 14:46:01.515848,0 days 00:00:01.354582,,0.5,1.0,,LightGBM,,,,,0.6000000000000001,,,,0.0005438660428082429,0.0014335602251152864,,80.0,,,,,,,,,,199.0,,,,,,,,,COMPLETE,0.0,,,,,,,,,,,,,,,,,,,,
226,226,0.5790174081237912,2023-08-23 14:46:00.517438,2023-08-23 14:46:02.555470,0 days 00:00:02.038032,,0.5,2.0,,LightGBM,,,,,0.6000000000000001,,,,0.0002672646867100764,0.006003933508119797,,40.0,,,,,,,,,,218.0,,,,,,,,,COMPLETE,0.0,,,,,,,,,,,,,,,,,,,,
227,227,0.6063324592736358,2023-08-23 14:46:01.636050,2023-08-23 14:46:02.980577,0 days 00:00:01.344527,,0.5,1.0,,LightGBM,,,,,0.6000000000000001,,,,0.0002762367621877653,0.007502662203626436,,80.0,,,,,,,,,,68.0,,,,,,,,,COMPLETE,0.0,,,,,,,,,,,,,,,,,,,,
228,228,0.6063324592736358,2023-08-23 14:46:02.637807,2023-08-23 14:46:03.915681,0 days 00:00:01.277874,,0.5,1.0,,LightGBM,,,,,0.6000000000000001,,,,0.00014029139914137383,0.0027868441752895833,,80.0,,,,,,,,,,211.0,,,,,,,,,COMPLETE,0.0,,,,,,,,,,,,,,,,,,,,
229,229,0.6063324592736358,2023-08-23 14:46:03.061372,2023-08-23 14:46:04.345256,0 days 00:00:01.283884,,0.5,1.0,,LightGBM,,,,,0.6000000000000001,,,,0.00012984424994231982,0.0027531000457707523,,80.0,,,,,,,,,,213.0,,,,,,,,,COMPLETE,0.0,,,,,,,,,,,,,,,,,,,,
230,230,0.6063324592736358,2023-08-23 14:46:04.029419,2023-08-23 14:46:05.363952,0 days 00:00:01.334533,,0.5,1.0,,LightGBM,,,,,0.6000000000000001,,,,0.00012240288982449843,0.0033150997537627937,,80.0,,,,,,,,,,211.0,,,,,,,,,COMPLETE,0.0,,,,,,,,,,,,,,,,,,,,
231,231,0.6063324592736358,2023-08-23 14:46:04.404713,2023-08-23 14:46:05.663474,0 days 00:00:01.258761,,0.5,1.0,,LightGBM,,,,,0.6000000000000001,,,,7.896066625161195e-05,0.004410052687817245,,80.0,,,,,,,,,,125.0,,,,,,,,,COMPLETE,0.0,,,,,,,,,,,,,,,,,,,,
232,232,0.6063324592736358,2023-08-23 14:46:05.425312,2023-08-23 14:46:06.819706,0 days 00:00:01.394394,,0.5,1.0,,LightGBM,,,,,0.6000000000000001,,,,7.19686928564479e-05,0.004346228498868713,,80.0,,,,,,,,,,205.0,,,,,,,,,COMPLETE,0.0,,,,,,,,,,,,,,,,,,,,
233,233,0.6063324592736358,2023-08-23 14:46:05.733367,2023-08-23 14:46:06.984330,0 days 00:00:01.250963,,0.5,1.0,,LightGBM,,,,,0.6000000000000001,,,,0.00018124382964335536,0.0003778042017633277,,80.0,,,,,,,,,,205.0,,,,,,,,,COMPLETE,0.0,,,,,,,,,,,,,,,,,,,,
234,234,0.5820337578958268,2023-08-23 14:46:06.892333,2023-08-23 14:46:08.506008,0 days 00:00:01.613675,,0.5,1.0,,LightGBM,,,,,0.6000000000000001,,,,0.00022066268995330065,0.002329599468217167,,70.0,,,,,,,,,,221.0,,,,,,,,,COMPLETE,0.0,,,,,,,,,,,,,,,,,,,,
235,235,0.5820337578958268,2023-08-23 14:46:07.076910,2023-08-23 14:46:08.586943,0 days 00:00:01.510033,,0.5,1.0,,LightGBM,,,,,0.6000000000000001,,,,0.00020052725831575782,0.001982274543201475,,70.0,,,,,,,,,,237.0,,,,,,,,,COMPLETE,0.0,,,,,,,,,,,,,,,,,,,,
236,236,0.6063324592736358,2023-08-23 14:46:08.577623,2023-08-23 14:46:10.250522,0 days 00:00:01.672899,,0.5,1.0,,LightGBM,,,,,0.6000000000000001,,,,4.040036338391096e-05,0.0016850126994005417,,80.0,,,,,,,,,,216.0,,,,,,,,,COMPLETE,0.0,,,,,,,,,,,,,,,,,,,,
237,237,0.5448127071073761,2023-08-23 14:46:08.722264,2023-08-23 14:46:09.203542,0 days 00:00:00.481278,,,,,DecisionTreeClassifier,,gini,12.0,,,,,,,,,,,,,,,,,,,,,,,,,,,,COMPLETE,0.0,,,,,,,,,,,,,,,,,,,,
238,238,0.6063324592736358,2023-08-23 14:46:09.341120,2023-08-23 14:46:11.209643,0 days 00:00:01.868523,,0.5,1.0,,LightGBM,,,,,0.6000000000000001,,,,0.0001152951224404992,0.001813637539588841,,80.0,,,,,,,,,,218.0,,,,,,,,,COMPLETE,0.0,,,,,,,,,,,,,,,,,,,,
239,239,0.6063324592736358,2023-08-23 14:46:09.545288,2023-08-23 14:46:11.092408,0 days 00:00:01.547120,,0.5,1.0,,LightGBM,,,,,0.6000000000000001,,,,0.00011512019488505319,0.002072395038634189,,80.0,,,,,,,,,,217.0,,,,,,,,,COMPLETE,0.0,,,,,,,,,,,,,,,,,,,,
240,240,0.6063324592736358,2023-08-23 14:46:10.320597,2023-08-23 14:46:11.889362,0 days 00:00:01.568765,,0.5,1.0,,LightGBM,,,,,0.6000000000000001,,,,0.00011297576218700438,0.0005392824086928638,,80.0,,,,,,,,,,215.0,,,,,,,,,COMPLETE,0.0,,,,,,,,,,,,,,,,,,,,
241,241,0.6063324592736358,2023-08-23 14:46:11.194637,2023-08-23 14:46:12.779974,0 days 00:00:01.585337,,0.5,1.0,,LightGBM,,,,,0.6000000000000001,,,,0.00035193509262705815,0.003725874537981653,,80.0,,,,,,,,,,209.0,,,,,,,,,COMPLETE,0.0,,,,,,,,,,,,,,,,,,,,
242,242,0.6063324592736358,2023-08-23 14:46:11.294625,2023-08-23 14:46:13.170881,0 days 00:00:01.876256,,0.5,1.0,,LightGBM,,,,,0.6000000000000001,,,,0.00035986664719171214,0.003837973763638492,,80.0,,,,,,,,,,209.0,,,,,,,,,COMPLETE,0.0,,,,,,,,,,,,,,,,,,,,
243,243,0.6063324592736358,2023-08-23 14:46:11.981766,2023-08-23 14:46:13.712012,0 days 00:00:01.730246,,0.5,1.0,,LightGBM,,,,,0.6000000000000001,,,,0.00016114584430822302,0.0035546919864230383,,80.0,,,,,,,,,,208.0,,,,,,,,,COMPLETE,0.0,,,,,,,,,,,,,,,,,,,,
244,244,0.6063324592736358,2023-08-23 14:46:12.864500,2023-08-23 14:46:14.582579,0 days 00:00:01.718079,,0.5,1.0,,LightGBM,,,,,0.6000000000000001,,,,6.03056434464702e-05,0.0009509985971150626,,80.0,,,,,,,,,,202.0,,,,,,,,,COMPLETE,0.0,,,,,,,,,,,,,,,,,,,,
245,245,0.6063324592736358,2023-08-23 14:46:13.265286,2023-08-23 14:46:15.099416,0 days 00:00:01.834130,,0.5,1.0,,LightGBM,,,,,0.6000000000000001,,,,6.021198864663057e-05,0.0008345113546297818,,80.0,,,,,,,,,,226.0,,,,,,,,,COMPLETE,0.0,,,,,,,,,,,,,,,,,,,,
246,246,0.5628570215798281,2023-08-23 14:46:13.835510,2023-08-23 14:46:17.932046,0 days 00:00:04.096536,,0.5,1.0,,LightGBM,,,,,0.6000000000000001,,,,5.790993504235316e-05,0.0009541023767688496,,20.0,,,,,,,,,,190.0,,,,,,,,,COMPLETE,0.0,,,,,,,,,,,,,,,,,,,,
247,247,0.5942398170050167,2023-08-23 14:46:14.663978,2023-08-23 14:46:16.025555,0 days 00:00:01.361577,,0.5,1.0,,LightGBM,,,,,0.6000000000000001,,,,9.203086461251e-05,0.0062416495934235665,,90.0,,,,,,,,,,190.0,,,,,,,,,COMPLETE,0.0,,,,,,,,,,,,,,,,,,,,
248,248,0.6063324592736358,2023-08-23 14:46:15.173618,2023-08-23 14:46:16.679760,0 days 00:00:01.506142,,0.5,1.0,,LightGBM,,,,,0.6000000000000001,,,,9.706549659609874e-05,0.0024763337503252714,,80.0,,,,,,,,,,182.0,,,,,,,,,COMPLETE,0.0,,,,,,,,,,,,,,,,,,,,
249,249,0.6063324592736358,2023-08-23 14:46:16.104735,2023-08-23 14:46:17.638193,0 days 00:00:01.533458,,0.5,1.0,,LightGBM,,,,,0.6000000000000001,,,,0.00015091945026697218,0.0025262598957717336,,80.0,,,,,,,,,,212.0,,,,,,,,,COMPLETE,0.0,,,,,,,,,,,,,,,,,,,,
