,number,value,datetime_start,datetime_complete,duration,params_alpha,params_bagging_fraction,params_bagging_freq,params_booster,params_classifier,params_colsample_bytree,params_dct_criterion,params_dct_max_depth,params_eta,params_feature_fraction,params_gamma,params_grow_policy,params_lambda,params_lambda_l1,params_lambda_l2,params_max_depth,params_min_child_samples,params_min_child_weight,params_mlp_activation,params_mlp_solver,params_n_layers,params_n_units_l_0,params_n_units_l_1,params_n_units_l_2,params_n_units_l_3,params_normalize_type,params_num_leaves,params_rate_drop,params_rf_estimator,params_rf_max_depth,params_sample_type,params_skip_drop,params_subsample,params_svc_c,params_svc_kernel,state,best_trial,dev_acc,dev_recall_macro,dev_precision_macro,dev_f1_macro,dev_recall_0,dev_precision_0,dev_f1_0,dev_recall_1,dev_precision_1,dev_f1_1,test_acc,test_recall_macro,test_precision_macro,test_f1_macro,test_recall_0,test_precision_0,test_f1_0,test_recall_1,test_precision_1,test_f1_1
0,0,0.6212064123285044,2023-08-23 18:34:33.576206,2023-08-23 18:34:35.138813,0 days 00:00:01.562607,,0.5,3.0,,LightGBM,,,,,0.5,,,,1.1386964203218787e-07,6.513943204882779e-06,,70.0,,,,,,,,,,207.0,,,,,,,,,COMPLETE,0.0,,,,,,,,,,,,,,,,,,,,
1,1,0.6195998176103468,2023-08-23 18:34:33.578675,2023-08-23 18:39:37.229503,0 days 00:05:03.650828,,,,,MLPClassifier,,,,,,,,,,,,,,tanh,adam,3.0,40.0,80.0,40.0,,,,,,,,,,,,COMPLETE,0.0,,,,,,,,,,,,,,,,,,,,
2,2,0.3357921744708146,2023-08-23 18:34:33.582152,2023-08-23 18:34:47.850586,0 days 00:00:14.268434,,,,,MLPClassifier,,,,,,,,,,,,,,logistic,sgd,1.0,100.0,,,,,,,,,,,,,,COMPLETE,0.0,,,,,,,,,,,,,,,,,,,,
3,3,0.5943612052265878,2023-08-23 18:34:33.585940,2023-08-23 18:34:34.032894,0 days 00:00:00.446954,,,,,DecisionTreeClassifier,,log_loss,16.0,,,,,,,,,,,,,,,,,,,,,,,,,,,,COMPLETE,0.0,,,,,,,,,,,,,,,,,,,,
4,4,0.6340580293692482,2023-08-23 18:34:33.587941,2023-08-23 18:34:36.479215,0 days 00:00:02.891274,,0.8,1.0,,LightGBM,,,,,0.8,,,,2.4637873069924775e-05,0.0007181566977591677,,40.0,,,,,,,,,,85.0,,,,,,,,,COMPLETE,0.0,,,,,,,,,,,,,,,,,,,,
5,5,0.3357921744708146,2023-08-23 18:34:33.591100,2023-08-23 18:34:38.059909,0 days 00:00:04.468809,,,,,SVC,,,,,,,,,,,,,,,,,,,,,,,,,,,,,82.62135549008853,poly,COMPLETE,0.0,,,,,,,,,,,,,,,,,,,,
6,6,0.4081821004413014,2023-08-23 18:34:33.592736,2023-08-23 18:34:39.675558,0 days 00:00:06.082822,,,,,SVC,,,,,,,,,,,,,,,,,,,,,,,,,,,,,2.731934702907945,rbf,COMPLETE,0.0,,,,,,,,,,,,,,,,,,,,
7,7,0.6324088926393998,2023-08-23 18:34:33.595462,2023-08-23 18:34:34.542039,0 days 00:00:00.946577,,,,,RandomForestClassifier,,,,,,,,,,,,,,,,,,,,,,,,31.0,2.0,,,,,,COMPLETE,0.0,,,,,,,,,,,,,,,,,,,,
8,8,0.6281543335597345,2023-08-23 18:34:34.132012,2023-08-23 18:34:36.365360,0 days 00:00:02.233348,,0.5,1.0,,LightGBM,,,,,0.6000000000000001,,,,1.0698297178126605e-08,0.46155549277279834,,50.0,,,,,,,,,,145.0,,,,,,,,,COMPLETE,0.0,,,,,,,,,,,,,,,,,,,,
9,9,0.3357921744708146,2023-08-23 18:34:34.664888,2023-08-23 18:34:34.760935,0 days 00:00:00.096047,0.0633935122518315,,,gblinear,XGBoost,0.7172290876451539,,,,,,,0.00507095093929828,,,,,,,,,,,,,,,,,,,,0.21893440330869166,,,COMPLETE,0.0,,,,,,,,,,,,,,,,,,,,
10,10,0.6178297884537531,2023-08-23 18:34:34.842017,2023-08-23 18:34:34.899593,0 days 00:00:00.057576,,,,,DecisionTreeClassifier,,gini,2.0,,,,,,,,,,,,,,,,,,,,,,,,,,,,COMPLETE,0.0,,,,,,,,,,,,,,,,,,,,
11,11,0.6349239555755521,2023-08-23 18:34:34.984969,2023-08-23 18:34:36.811960,0 days 00:00:01.826991,,0.5,1.0,,LightGBM,,,,,0.7000000000000001,,,,5.9601201616642566e-08,0.4813464834838855,,70.0,,,,,,,,,,23.0,,,,,,,,,COMPLETE,0.0,,,,,,,,,,,,,,,,,,,,
12,12,0.3357921744708146,2023-08-23 18:34:35.241262,2023-08-23 18:36:04.846522,0 days 00:01:29.605260,,,,,MLPClassifier,,,,,,,,,,,,,,logistic,adam,4.0,70.0,40.0,100.0,10.0,,,,,,,,,,,COMPLETE,0.0,,,,,,,,,,,,,,,,,,,,
13,13,0.6195045481975877,2023-08-23 18:34:36.487449,2023-08-23 18:34:40.352983,0 days 00:00:03.865534,,1.0,2.0,,LightGBM,,,,,0.7000000000000001,,,,0.1579972370076165,0.02677554004174307,,50.0,,,,,,,,,,227.0,,,,,,,,,COMPLETE,0.0,,,,,,,,,,,,,,,,,,,,
14,14,0.642461985849104,2023-08-23 18:34:36.636575,2023-08-23 18:34:38.869433,0 days 00:00:02.232858,,1.0,3.0,,LightGBM,,,,,0.9,,,,0.00032098712531813094,1.541840614254098e-06,,90.0,,,,,,,,,,34.0,,,,,,,,,COMPLETE,0.0,,,,,,,,,,,,,,,,,,,,
15,15,0.3357921744708146,2023-08-23 18:34:36.909499,2023-08-23 18:34:41.231820,0 days 00:00:04.322321,,,,,SVC,,,,,,,,,,,,,,,,,,,,,,,,,,,,,0.13070573136471952,poly,COMPLETE,0.0,,,,,,,,,,,,,,,,,,,,
16,16,0.3357921744708146,2023-08-23 18:34:38.180515,2023-08-23 18:34:43.885389,0 days 00:00:05.704874,,,,,SVC,,,,,,,,,,,,,,,,,,,,,,,,,,,,,0.001296852148335827,rbf,COMPLETE,0.0,,,,,,,,,,,,,,,,,,,,
17,17,0.5398194402152892,2023-08-23 18:34:38.962091,2023-08-23 18:35:02.821010,0 days 00:00:23.858919,,,,,MLPClassifier,,,,,,,,,,,,,,identity,lbfgs,2.0,90.0,60.0,,,,,,,,,,,,,COMPLETE,0.0,,,,,,,,,,,,,,,,,,,,
18,18,0.6187151637586925,2023-08-23 18:34:39.820938,2023-08-23 18:41:02.865596,0 days 00:06:23.044658,,,,,MLPClassifier,,,,,,,,,,,,,,tanh,adam,3.0,10.0,60.0,40.0,,,,,,,,,,,,COMPLETE,0.0,,,,,,,,,,,,,,,,,,,,
19,19,0.3357921744708146,2023-08-23 18:34:40.439970,2023-08-23 18:36:36.693131,0 days 00:01:56.253161,,,,,MLPClassifier,,,,,,,,,,,,,,logistic,adam,4.0,100.0,80.0,60.0,90.0,,,,,,,,,,,COMPLETE,0.0,,,,,,,,,,,,,,,,,,,,
20,20,0.6418328331977825,2023-08-23 18:34:41.302938,2023-08-23 18:34:42.256297,0 days 00:00:00.953359,,0.7000000000000001,3.0,,LightGBM,,,,,1.0,,,,7.270175967622853e-05,1.0689258587924343e-07,,100.0,,,,,,,,,,5.0,,,,,,,,,COMPLETE,0.0,,,,,,,,,,,,,,,,,,,,
21,21,0.6321398911570237,2023-08-23 18:34:42.350609,2023-08-23 18:36:12.574947,0 days 00:01:30.224338,,,,,MLPClassifier,,,,,,,,,,,,,,tanh,lbfgs,2.0,30.0,10.0,,,,,,,,,,,,,COMPLETE,0.0,,,,,,,,,,,,,,,,,,,,
22,22,0.363293800652872,2023-08-23 18:34:43.981607,2023-08-23 18:36:24.439608,0 days 00:01:40.458001,,,,,MLPClassifier,,,,,,,,,,,,,,tanh,sgd,4.0,90.0,40.0,50.0,60.0,,,,,,,,,,,COMPLETE,0.0,,,,,,,,,,,,,,,,,,,,
23,23,0.6161812557178832,2023-08-23 18:34:47.946481,2023-08-23 18:34:48.469893,0 days 00:00:00.523412,1.341451497808673e-08,,,dart,XGBoost,0.23626127742324676,,,3.595266676456389e-06,,0.04897034242735312,depthwise,6.525236682287017e-08,,,9.0,,4.0,,,,,,,,tree,,0.0009289710190915143,,,uniform,0.01813574129774872,0.9989890910269661,,,COMPLETE,0.0,,,,,,,,,,,,,,,,,,,,
24,24,0.5354059657157002,2023-08-23 18:34:48.651454,2023-08-23 18:39:02.410060,0 days 00:04:13.758606,,,,,MLPClassifier,,,,,,,,,,,,,,identity,adam,4.0,10.0,100.0,40.0,90.0,,,,,,,,,,,COMPLETE,0.0,,,,,,,,,,,,,,,,,,,,
25,25,0.6303968410106516,2023-08-23 18:35:02.892688,2023-08-23 18:35:07.509481,0 days 00:00:04.616793,,,,,RandomForestClassifier,,,,,,,,,,,,,,,,,,,,,,,,89.0,20.0,,,,,,COMPLETE,0.0,,,,,,,,,,,,,,,,,,,,
26,26,0.6409145312044815,2023-08-23 18:35:07.628810,2023-08-23 18:35:08.025890,0 days 00:00:00.397080,,1.0,3.0,,LightGBM,,,,,1.0,,,,0.0003219927377124887,3.5273699066910926e-08,,100.0,,,,,,,,,,5.0,,,,,,,,,COMPLETE,0.0,,,,,,,,,,,,,,,,,,,,
27,27,0.6294460328138431,2023-08-23 18:35:08.097905,2023-08-23 18:35:09.529902,0 days 00:00:01.431997,,0.8,3.0,,LightGBM,,,,,1.0,,,,0.00029711604395349107,1.6809416139410577e-07,,100.0,,,,,,,,,,68.0,,,,,,,,,COMPLETE,0.0,,,,,,,,,,,,,,,,,,,,
28,28,0.6501098158472716,2023-08-23 18:35:09.626314,2023-08-23 18:35:10.573403,0 days 00:00:00.947089,,1.0,3.0,,LightGBM,,,,,1.0,,,,0.000290262983427485,4.386903733177014e-08,,100.0,,,,,,,,,,21.0,,,,,,,,,COMPLETE,1.0,0.6508932882665379,0.6504479875537249,0.6514865070465392,0.6501098158472716,0.6103515625,0.6585879873551106,0.6335529650278764,0.6905444126074498,0.6443850267379679,0.6666666666666667,0.6487558600793365,0.6449315543414357,0.6474147362159981,0.6450590319392753,0.5821812596006144,0.6380471380471381,0.6088353413654617,0.707681849082257,0.656782334384858,0.681282722513089
29,29,0.6341044907618647,2023-08-23 18:35:10.638491,2023-08-23 18:35:11.951729,0 days 00:00:01.313238,,0.9,3.0,,LightGBM,,,,,0.9,,,,7.715307380438117e-05,1.2943598273428253e-08,,100.0,,,,,,,,,,42.0,,,,,,,,,COMPLETE,0.0,,,,,,,,,,,,,,,,,,,,
30,30,0.6438312164414866,2023-08-23 18:35:12.025612,2023-08-23 18:35:12.225839,0 days 00:00:00.200227,,0.7000000000000001,2.0,,LightGBM,,,,,1.0,,,,0.0024449134460112665,9.236085065725788e-07,,80.0,,,,,,,,,,2.0,,,,,,,,,COMPLETE,0.0,,,,,,,,,,,,,,,,,,,,
31,31,0.6262470335129859,2023-08-23 18:35:12.281867,2023-08-23 18:35:14.361407,0 days 00:00:02.079540,,1.0,2.0,,LightGBM,,,,,0.9,,,,0.004740215033113958,1.690297466202247e-06,,80.0,,,,,,,,,,97.0,,,,,,,,,COMPLETE,0.0,,,,,,,,,,,,,,,,,,,,
32,32,0.6337844880366256,2023-08-23 18:35:14.453868,2023-08-23 18:35:15.814561,0 days 00:00:01.360693,,0.9,2.0,,LightGBM,,,,,0.9,,,,0.006672945105851642,1.6963639291529762e-06,,20.0,,,,,,,,,,40.0,,,,,,,,,COMPLETE,0.0,,,,,,,,,,,,,,,,,,,,
33,33,0.6176331110286372,2023-08-23 18:35:15.891667,2023-08-23 18:35:16.171647,0 days 00:00:00.279980,0.789874284379539,,,gbtree,XGBoost,0.9705083078705352,,,0.6886210911826217,,6.485340313519616e-08,lossguide,0.7790504411226571,,,3.0,,10.0,,,,,,,,,,,,,,,0.6145576621246065,,,COMPLETE,0.0,,,,,,,,,,,,,,,,,,,,
34,34,0.6208740679141743,2023-08-23 18:35:16.267816,2023-08-23 18:35:25.798761,0 days 00:00:09.530945,,,,,MLPClassifier,,,,,,,,,,,,,,relu,adam,4.0,10.0,10.0,30.0,10.0,,,,,,,,,,,COMPLETE,0.0,,,,,,,,,,,,,,,,,,,,
35,35,0.6072572945684729,2023-08-23 18:35:25.876499,2023-08-23 18:35:26.616218,0 days 00:00:00.739719,,,,,RandomForestClassifier,,,,,,,,,,,,,,,,,,,,,,,,11.0,30.0,,,,,,COMPLETE,0.0,,,,,,,,,,,,,,,,,,,,
36,36,0.6348410842167826,2023-08-23 18:35:26.682122,2023-08-23 18:35:27.934350,0 days 00:00:01.252228,,0.7000000000000001,2.0,,LightGBM,,,,,1.0,,,,0.003222428114119722,1.679424563291414e-05,,80.0,,,,,,,,,,49.0,,,,,,,,,COMPLETE,0.0,,,,,,,,,,,,,,,,,,,,
37,37,0.587798380512577,2023-08-23 18:35:28.008817,2023-08-23 18:35:28.421405,0 days 00:00:00.412588,,,,,DecisionTreeClassifier,,entropy,22.0,,,,,,,,,,,,,,,,,,,,,,,,,,,,COMPLETE,0.0,,,,,,,,,,,,,,,,,,,,
38,38,0.6420603341712036,2023-08-23 18:35:28.579420,2023-08-23 18:35:28.964177,0 days 00:00:00.384757,,0.7000000000000001,3.0,,LightGBM,,,,,1.0,,,,1.2151473764471675e-05,1.5604106817895802e-07,,90.0,,,,,,,,,,2.0,,,,,,,,,COMPLETE,0.0,,,,,,,,,,,,,,,,,,,,
39,39,0.6414198514148162,2023-08-23 18:35:29.041025,2023-08-23 18:35:29.383646,0 days 00:00:00.342621,,0.6000000000000001,3.0,,LightGBM,,,,,0.9,,,,6.931221586138004e-06,3.4059676726385165e-07,,80.0,,,,,,,,,,3.0,,,,,,,,,COMPLETE,0.0,,,,,,,,,,,,,,,,,,,,
40,40,0.6298499787203858,2023-08-23 18:35:29.454400,2023-08-23 18:35:30.919155,0 days 00:00:01.464755,,0.8,3.0,,LightGBM,,,,,1.0,,,,0.0009793815658595464,1.0322114344031256e-08,,90.0,,,,,,,,,,31.0,,,,,,,,,COMPLETE,0.0,,,,,,,,,,,,,,,,,,,,
41,41,0.6254458327258045,2023-08-23 18:35:31.006904,2023-08-23 18:35:32.207758,0 days 00:00:01.200854,,0.6000000000000001,2.0,,LightGBM,,,,,0.8,,,,4.206910561508192e-06,2.585692494984675e-07,,90.0,,,,,,,,,,152.0,,,,,,,,,COMPLETE,0.0,,,,,,,,,,,,,,,,,,,,
42,42,0.5484343646887331,2023-08-23 18:35:32.316422,2023-08-23 18:42:56.202091,0 days 00:07:23.885669,,,,,MLPClassifier,,,,,,,,,,,,,,tanh,sgd,4.0,30.0,100.0,100.0,100.0,,,,,,,,,,,COMPLETE,0.0,,,,,,,,,,,,,,,,,,,,
43,43,0.6371555518179015,2023-08-23 18:36:04.921594,2023-08-23 18:36:06.669440,0 days 00:00:01.747846,,0.9,3.0,,LightGBM,,,,,0.9,,,,0.00040332140649665935,5.865557157408894e-07,,90.0,,,,,,,,,,62.0,,,,,,,,,COMPLETE,0.0,,,,,,,,,,,,,,,,,,,,
44,44,0.6441668098475737,2023-08-23 18:36:06.746026,2023-08-23 18:36:06.905399,0 days 00:00:00.159373,,,,,DecisionTreeClassifier,,entropy,4.0,,,,,,,,,,,,,,,,,,,,,,,,,,,,COMPLETE,0.0,,,,,,,,,,,,,,,,,,,,
45,45,0.6441668098475737,2023-08-23 18:36:07.002330,2023-08-23 18:36:07.224773,0 days 00:00:00.222443,,,,,DecisionTreeClassifier,,entropy,4.0,,,,,,,,,,,,,,,,,,,,,,,,,,,,COMPLETE,0.0,,,,,,,,,,,,,,,,,,,,
46,46,0.6441668098475737,2023-08-23 18:36:07.312791,2023-08-23 18:36:07.577419,0 days 00:00:00.264628,,,,,DecisionTreeClassifier,,entropy,4.0,,,,,,,,,,,,,,,,,,,,,,,,,,,,COMPLETE,0.0,,,,,,,,,,,,,,,,,,,,
47,47,0.6441668098475737,2023-08-23 18:36:07.653541,2023-08-23 18:36:07.782117,0 days 00:00:00.128576,,,,,DecisionTreeClassifier,,entropy,4.0,,,,,,,,,,,,,,,,,,,,,,,,,,,,COMPLETE,0.0,,,,,,,,,,,,,,,,,,,,
48,48,0.6441668098475737,2023-08-23 18:36:07.844623,2023-08-23 18:36:07.967077,0 days 00:00:00.122454,,,,,DecisionTreeClassifier,,entropy,4.0,,,,,,,,,,,,,,,,,,,,,,,,,,,,COMPLETE,0.0,,,,,,,,,,,,,,,,,,,,
49,49,0.6441668098475737,2023-08-23 18:36:08.090949,2023-08-23 18:36:08.303365,0 days 00:00:00.212416,,,,,DecisionTreeClassifier,,entropy,4.0,,,,,,,,,,,,,,,,,,,,,,,,,,,,COMPLETE,0.0,,,,,,,,,,,,,,,,,,,,
50,50,0.6441668098475737,2023-08-23 18:36:08.367255,2023-08-23 18:36:08.559579,0 days 00:00:00.192324,,,,,DecisionTreeClassifier,,entropy,4.0,,,,,,,,,,,,,,,,,,,,,,,,,,,,COMPLETE,0.0,,,,,,,,,,,,,,,,,,,,
51,51,0.6402352229458026,2023-08-23 18:36:08.646546,2023-08-23 18:36:08.777216,0 days 00:00:00.130670,,,,,DecisionTreeClassifier,,entropy,5.0,,,,,,,,,,,,,,,,,,,,,,,,,,,,COMPLETE,0.0,,,,,,,,,,,,,,,,,,,,
52,52,0.6320226303558132,2023-08-23 18:36:08.851886,2023-08-23 18:36:09.052466,0 days 00:00:00.200580,,,,,DecisionTreeClassifier,,entropy,3.0,,,,,,,,,,,,,,,,,,,,,,,,,,,,COMPLETE,0.0,,,,,,,,,,,,,,,,,,,,
53,53,0.6360920752064663,2023-08-23 18:36:09.177077,2023-08-23 18:36:09.456241,0 days 00:00:00.279164,,,,,DecisionTreeClassifier,,entropy,6.0,,,,,,,,,,,,,,,,,,,,,,,,,,,,COMPLETE,0.0,,,,,,,,,,,,,,,,,,,,
54,54,0.625776716527183,2023-08-23 18:36:09.528795,2023-08-23 18:36:09.785602,0 days 00:00:00.256807,,,,,DecisionTreeClassifier,,entropy,8.0,,,,,,,,,,,,,,,,,,,,,,,,,,,,COMPLETE,0.0,,,,,,,,,,,,,,,,,,,,
55,55,0.6320226303558132,2023-08-23 18:36:09.856910,2023-08-23 18:36:10.059122,0 days 00:00:00.202212,,,,,DecisionTreeClassifier,,log_loss,3.0,,,,,,,,,,,,,,,,,,,,,,,,,,,,COMPLETE,0.0,,,,,,,,,,,,,,,,,,,,
56,56,0.6215085741132254,2023-08-23 18:36:10.158884,2023-08-23 18:36:10.437216,0 days 00:00:00.278332,,,,,DecisionTreeClassifier,,gini,7.0,,,,,,,,,,,,,,,,,,,,,,,,,,,,COMPLETE,0.0,,,,,,,,,,,,,,,,,,,,
57,57,0.6178297884537531,2023-08-23 18:36:10.549227,2023-08-23 18:36:10.655121,0 days 00:00:00.105894,,,,,DecisionTreeClassifier,,entropy,2.0,,,,,,,,,,,,,,,,,,,,,,,,,,,,COMPLETE,0.0,,,,,,,,,,,,,,,,,,,,
58,58,0.6441668098475737,2023-08-23 18:36:10.786069,2023-08-23 18:36:10.989095,0 days 00:00:00.203026,,,,,DecisionTreeClassifier,,entropy,4.0,,,,,,,,,,,,,,,,,,,,,,,,,,,,COMPLETE,0.0,,,,,,,,,,,,,,,,,,,,
59,59,0.6320226303558132,2023-08-23 18:36:11.097006,2023-08-23 18:36:11.321197,0 days 00:00:00.224191,,,,,DecisionTreeClassifier,,entropy,3.0,,,,,,,,,,,,,,,,,,,,,,,,,,,,COMPLETE,0.0,,,,,,,,,,,,,,,,,,,,
60,60,0.6402352229458026,2023-08-23 18:36:11.390295,2023-08-23 18:36:11.538073,0 days 00:00:00.147778,,,,,DecisionTreeClassifier,,entropy,5.0,,,,,,,,,,,,,,,,,,,,,,,,,,,,COMPLETE,0.0,,,,,,,,,,,,,,,,,,,,
61,61,0.46640734566431163,2023-08-23 18:36:11.621031,2023-08-23 18:36:15.908229,0 days 00:00:04.287198,,,,,SVC,,,,,,,,,,,,,,,,,,,,,,,,,,,,,256.8159595688047,linear,COMPLETE,0.0,,,,,,,,,,,,,,,,,,,,
62,62,0.4737927698224077,2023-08-23 18:36:12.661448,2023-08-23 18:36:17.407502,0 days 00:00:04.746054,,,,,SVC,,,,,,,,,,,,,,,,,,,,,,,,,,,,,647.3976510482056,linear,COMPLETE,0.0,,,,,,,,,,,,,,,,,,,,
63,63,0.6320226303558132,2023-08-23 18:36:16.068606,2023-08-23 18:36:16.270661,0 days 00:00:00.202055,,,,,DecisionTreeClassifier,,entropy,3.0,,,,,,,,,,,,,,,,,,,,,,,,,,,,COMPLETE,0.0,,,,,,,,,,,,,,,,,,,,
64,64,0.6406976213304114,2023-08-23 18:36:16.437356,2023-08-23 18:36:16.595230,0 days 00:00:00.157874,,,,,DecisionTreeClassifier,,entropy,5.0,,,,,,,,,,,,,,,,,,,,,,,,,,,,COMPLETE,0.0,,,,,,,,,,,,,,,,,,,,
65,65,0.6316936939310508,2023-08-23 18:36:16.736578,2023-08-23 18:36:18.959442,0 days 00:00:02.222864,,,,,RandomForestClassifier,,,,,,,,,,,,,,,,,,,,,,,,99.0,3.0,,,,,,COMPLETE,0.0,,,,,,,,,,,,,,,,,,,,
66,66,0.6364306826311231,2023-08-23 18:36:17.477106,2023-08-23 18:36:20.784475,0 days 00:00:03.307369,,,,,RandomForestClassifier,,,,,,,,,,,,,,,,,,,,,,,,99.0,5.0,,,,,,COMPLETE,0.0,,,,,,,,,,,,,,,,,,,,
67,67,0.535712445113278,2023-08-23 18:36:19.115749,2023-08-23 18:36:19.234959,0 days 00:00:00.119210,8.738341704095915e-06,,,gblinear,XGBoost,0.20489034080612628,,,,,,,1.0972948202262506e-08,,,,,,,,,,,,,,,,,,,,0.22470030649472633,,,COMPLETE,0.0,,,,,,,,,,,,,,,,,,,,
68,68,0.6441668098475737,2023-08-23 18:36:19.317643,2023-08-23 18:36:19.499129,0 days 00:00:00.181486,,,,,DecisionTreeClassifier,,entropy,4.0,,,,,,,,,,,,,,,,,,,,,,,,,,,,COMPLETE,0.0,,,,,,,,,,,,,,,,,,,,
69,69,0.6441668098475737,2023-08-23 18:36:19.560804,2023-08-23 18:36:19.661886,0 days 00:00:00.101082,,,,,DecisionTreeClassifier,,entropy,4.0,,,,,,,,,,,,,,,,,,,,,,,,,,,,COMPLETE,0.0,,,,,,,,,,,,,,,,,,,,
70,70,0.6441668098475737,2023-08-23 18:36:19.787181,2023-08-23 18:36:19.960755,0 days 00:00:00.173574,,,,,DecisionTreeClassifier,,entropy,4.0,,,,,,,,,,,,,,,,,,,,,,,,,,,,COMPLETE,0.0,,,,,,,,,,,,,,,,,,,,
71,71,0.6320226303558132,2023-08-23 18:36:20.044590,2023-08-23 18:36:20.171107,0 days 00:00:00.126517,,,,,DecisionTreeClassifier,,entropy,3.0,,,,,,,,,,,,,,,,,,,,,,,,,,,,COMPLETE,0.0,,,,,,,,,,,,,,,,,,,,
72,72,0.6365594352715089,2023-08-23 18:36:20.253296,2023-08-23 18:36:20.438535,0 days 00:00:00.185239,,,,,DecisionTreeClassifier,,entropy,6.0,,,,,,,,,,,,,,,,,,,,,,,,,,,,COMPLETE,0.0,,,,,,,,,,,,,,,,,,,,
73,73,0.5048327658276133,2023-08-23 18:36:20.536831,2023-08-23 18:41:46.634362,0 days 00:05:26.097531,,,,,MLPClassifier,,,,,,,,,,,,,,identity,sgd,3.0,40.0,90.0,10.0,,,,,,,,,,,,COMPLETE,0.0,,,,,,,,,,,,,,,,,,,,
74,74,0.532024592537437,2023-08-23 18:36:20.896990,2023-08-23 18:42:44.151299,0 days 00:06:23.254309,,,,,MLPClassifier,,,,,,,,,,,,,,tanh,sgd,3.0,50.0,100.0,10.0,,,,,,,,,,,,COMPLETE,0.0,,,,,,,,,,,,,,,,,,,,
75,75,0.6441668098475737,2023-08-23 18:36:24.518165,2023-08-23 18:36:24.660080,0 days 00:00:00.141915,,,,,DecisionTreeClassifier,,log_loss,4.0,,,,,,,,,,,,,,,,,,,,,,,,,,,,COMPLETE,0.0,,,,,,,,,,,,,,,,,,,,
76,76,0.6407238130246584,2023-08-23 18:36:24.742362,2023-08-23 18:36:24.833354,0 days 00:00:00.090992,,,,,DecisionTreeClassifier,,gini,5.0,,,,,,,,,,,,,,,,,,,,,,,,,,,,COMPLETE,0.0,,,,,,,,,,,,,,,,,,,,
77,77,0.6323176258421402,2023-08-23 18:36:24.912418,2023-08-23 18:36:25.132443,0 days 00:00:00.220025,0.0003722668189105026,,,gbtree,XGBoost,0.5209903376645499,,,2.859554378913115e-08,,0.9961887116953893,lossguide,2.4576805678904197e-05,,,3.0,,2.0,,,,,,,,,,,,,,,0.960378642689967,,,COMPLETE,0.0,,,,,,,,,,,,,,,,,,,,
78,78,0.6441668098475737,2023-08-23 18:36:25.213897,2023-08-23 18:36:25.353665,0 days 00:00:00.139768,,,,,DecisionTreeClassifier,,entropy,4.0,,,,,,,,,,,,,,,,,,,,,,,,,,,,COMPLETE,0.0,,,,,,,,,,,,,,,,,,,,
79,79,0.6320226303558132,2023-08-23 18:36:25.449905,2023-08-23 18:36:25.612959,0 days 00:00:00.163054,,,,,DecisionTreeClassifier,,entropy,3.0,,,,,,,,,,,,,,,,,,,,,,,,,,,,COMPLETE,0.0,,,,,,,,,,,,,,,,,,,,
80,80,0.6441668098475737,2023-08-23 18:36:25.685676,2023-08-23 18:36:25.766344,0 days 00:00:00.080668,,,,,DecisionTreeClassifier,,entropy,4.0,,,,,,,,,,,,,,,,,,,,,,,,,,,,COMPLETE,0.0,,,,,,,,,,,,,,,,,,,,
81,81,0.3375267712776991,2023-08-23 18:36:25.897766,2023-08-23 18:36:33.268586,0 days 00:00:07.370820,,,,,MLPClassifier,,,,,,,,,,,,,,relu,sgd,1.0,50.0,,,,,,,,,,,,,,COMPLETE,0.0,,,,,,,,,,,,,,,,,,,,
82,82,0.6402352229458026,2023-08-23 18:36:33.376729,2023-08-23 18:36:33.523401,0 days 00:00:00.146672,,,,,DecisionTreeClassifier,,entropy,5.0,,,,,,,,,,,,,,,,,,,,,,,,,,,,COMPLETE,0.0,,,,,,,,,,,,,,,,,,,,
83,83,0.6163368658416017,2023-08-23 18:36:33.617315,2023-08-23 18:36:33.884452,0 days 00:00:00.267137,,,,,DecisionTreeClassifier,,log_loss,9.0,,,,,,,,,,,,,,,,,,,,,,,,,,,,COMPLETE,0.0,,,,,,,,,,,,,,,,,,,,
84,84,0.6441668098475737,2023-08-23 18:36:33.992034,2023-08-23 18:36:34.154529,0 days 00:00:00.162495,,,,,DecisionTreeClassifier,,entropy,4.0,,,,,,,,,,,,,,,,,,,,,,,,,,,,COMPLETE,0.0,,,,,,,,,,,,,,,,,,,,
85,85,0.3357921744708146,2023-08-23 18:36:34.248317,2023-08-23 18:36:38.772984,0 days 00:00:04.524667,,,,,SVC,,,,,,,,,,,,,,,,,,,,,,,,,,,,,0.0025363953290745344,poly,COMPLETE,0.0,,,,,,,,,,,,,,,,,,,,
86,86,0.3357921744708146,2023-08-23 18:36:36.754219,2023-08-23 18:36:41.821357,0 days 00:00:05.067138,,,,,SVC,,,,,,,,,,,,,,,,,,,,,,,,,,,,,0.003906135421693773,poly,COMPLETE,0.0,,,,,,,,,,,,,,,,,,,,
87,87,0.5976572767270442,2023-08-23 18:36:38.876664,2023-08-23 18:36:39.236912,0 days 00:00:00.360248,,,,,DecisionTreeClassifier,,entropy,11.0,,,,,,,,,,,,,,,,,,,,,,,,,,,,COMPLETE,0.0,,,,,,,,,,,,,,,,,,,,
88,88,0.6441668098475737,2023-08-23 18:36:39.318519,2023-08-23 18:36:39.473814,0 days 00:00:00.155295,,,,,DecisionTreeClassifier,,entropy,4.0,,,,,,,,,,,,,,,,,,,,,,,,,,,,COMPLETE,0.0,,,,,,,,,,,,,,,,,,,,
89,89,0.6402352229458026,2023-08-23 18:36:39.558638,2023-08-23 18:36:39.743815,0 days 00:00:00.185177,,,,,DecisionTreeClassifier,,entropy,5.0,,,,,,,,,,,,,,,,,,,,,,,,,,,,COMPLETE,0.0,,,,,,,,,,,,,,,,,,,,
