,number,value,datetime_start,datetime_complete,duration,params_alpha,params_bagging_fraction,params_bagging_freq,params_booster,params_classifier,params_colsample_bytree,params_dct_criterion,params_dct_max_depth,params_eta,params_feature_fraction,params_gamma,params_grow_policy,params_lambda,params_lambda_l1,params_lambda_l2,params_max_depth,params_min_child_samples,params_min_child_weight,params_mlp_activation,params_mlp_solver,params_n_layers,params_n_units_l_0,params_n_units_l_1,params_n_units_l_2,params_n_units_l_3,params_normalize_type,params_num_leaves,params_rate_drop,params_rf_estimator,params_rf_max_depth,params_sample_type,params_skip_drop,params_subsample,params_svc_c,params_svc_kernel,state,best_trial,dev_acc,dev_recall_macro,dev_precision_macro,dev_f1_macro,dev_recall_0,dev_precision_0,dev_f1_0,dev_recall_1,dev_precision_1,dev_f1_1,test_acc,test_recall_macro,test_precision_macro,test_f1_macro,test_recall_0,test_precision_0,test_f1_0,test_recall_1,test_precision_1,test_f1_1
149,149,0.5562062713805861,2023-08-23 18:43:44.223190,2023-08-23 18:44:12.888153,0 days 00:00:28.664963,,,,,MLPClassifier,,,,,,,,,,,,,,identity,lbfgs,3.0,90.0,10.0,100.0,,,,,,,,,,,,COMPLETE,0.0,,,,,,,,,,,,,,,,,,,,
150,150,0.5930120599745373,2023-08-23 18:43:44.224720,2023-08-23 18:43:45.317199,0 days 00:00:01.092479,0.3618591503142018,,,gbtree,XGBoost,0.9245013633619631,,,0.007728204745969395,,0.21012146325295994,lossguide,0.0003182371257404756,,,3.0,,9.0,,,,,,,,,,,,,,,0.2966824436675323,,,COMPLETE,0.0,,,,,,,,,,,,,,,,,,,,
151,151,0.3357921744708146,2023-08-23 18:43:44.888616,2023-08-23 18:43:46.942332,0 days 00:00:02.053716,,,,,MLPClassifier,,,,,,,,,,,,,,logistic,lbfgs,3.0,100.0,10.0,100.0,,,,,,,,,,,,COMPLETE,0.0,,,,,,,,,,,,,,,,,,,,
152,152,0.5879562158356615,2023-08-23 18:43:45.010118,2023-08-23 18:43:46.202422,0 days 00:00:01.192304,0.3296120706314499,,,gbtree,XGBoost,0.9263278982554812,,,0.0014097559114541732,,0.21214383879333684,lossguide,0.00016218185158135771,,,3.0,,9.0,,,,,,,,,,,,,,,0.3058477997696382,,,COMPLETE,0.0,,,,,,,,,,,,,,,,,,,,
153,153,0.3357921744708146,2023-08-23 18:43:45.433277,2023-08-23 18:43:47.464747,0 days 00:00:02.031470,,,,,MLPClassifier,,,,,,,,,,,,,,logistic,lbfgs,3.0,100.0,10.0,100.0,,,,,,,,,,,,COMPLETE,0.0,,,,,,,,,,,,,,,,,,,,
154,154,0.5940798868070755,2023-08-23 18:43:45.609965,2023-08-23 18:43:46.748290,0 days 00:00:01.138325,0.6205467258086517,,,gbtree,XGBoost,0.9520875506395351,,,0.0015192262159155236,,0.19780580934431408,lossguide,0.00020574895042592325,,,3.0,,9.0,,,,,,,,,,,,,,,0.33411074283567904,,,COMPLETE,0.0,,,,,,,,,,,,,,,,,,,,
155,155,0.5979608031787758,2023-08-23 18:43:46.289296,2023-08-23 18:43:47.219734,0 days 00:00:00.930438,0.6869360115098567,,,gbtree,XGBoost,0.95220258456994,,,0.001621906010118572,,0.030377282681943417,lossguide,0.00017658279498113528,,,3.0,,9.0,,,,,,,,,,,,,,,0.32907965424328944,,,COMPLETE,0.0,,,,,,,,,,,,,,,,,,,,
156,156,0.604824887026943,2023-08-23 18:43:46.821881,2023-08-23 18:43:48.039905,0 days 00:00:01.218024,0.11373469387762987,,,gbtree,XGBoost,0.964097721508179,,,0.003365048024098104,,0.07751565319406963,lossguide,0.0004842777177278752,,,3.0,,9.0,,,,,,,,,,,,,,,0.33044826658074233,,,COMPLETE,0.0,,,,,,,,,,,,,,,,,,,,
157,157,0.5867792199700306,2023-08-23 18:43:47.074136,2023-08-23 18:43:48.113155,0 days 00:00:01.039019,0.11760974641006812,,,gbtree,XGBoost,0.958470128328017,,,0.003029084015546709,,0.16192118532691696,lossguide,0.0006102015592854493,,,3.0,,9.0,,,,,,,,,,,,,,,0.3601367115514943,,,COMPLETE,0.0,,,,,,,,,,,,,,,,,,,,
158,158,0.598711695873268,2023-08-23 18:43:47.372499,2023-08-23 18:43:48.274195,0 days 00:00:00.901696,0.9358198155610127,,,gbtree,XGBoost,0.9580169995839904,,,0.00373786565218208,,0.10794356550898035,lossguide,0.00044351835905755073,,,3.0,,9.0,,,,,,,,,,,,,,,0.3528916156247331,,,COMPLETE,0.0,,,,,,,,,,,,,,,,,,,,
159,159,0.5983426804716709,2023-08-23 18:43:47.559682,2023-08-23 18:43:48.537170,0 days 00:00:00.977488,0.2500547231348224,,,gbtree,XGBoost,0.9526230412125506,,,0.0034572598274105744,,0.06946457341547108,lossguide,0.0005685809450844177,,,3.0,,9.0,,,,,,,,,,,,,,,0.3528416590970438,,,COMPLETE,0.0,,,,,,,,,,,,,,,,,,,,
160,160,0.596084063801144,2023-08-23 18:43:48.139178,2023-08-23 18:43:49.269443,0 days 00:00:01.130265,0.8639147944963447,,,gbtree,XGBoost,0.996755268689737,,,0.003774811347123404,,0.09368937960115593,lossguide,0.00046037260277496754,,,3.0,,9.0,,,,,,,,,,,,,,,0.32721940132070937,,,COMPLETE,0.0,,,,,,,,,,,,,,,,,,,,
161,161,0.5971581743998482,2023-08-23 18:43:48.223457,2023-08-23 18:43:49.163924,0 days 00:00:00.940467,0.9613195550397003,,,gbtree,XGBoost,0.997634107164807,,,0.0077605424294367896,,0.06765209540468484,lossguide,0.0003820098323244961,,,3.0,,9.0,,,,,,,,,,,,,,,0.33095914352060724,,,COMPLETE,0.0,,,,,,,,,,,,,,,,,,,,
162,162,0.5919539212806146,2023-08-23 18:43:48.347758,2023-08-23 18:43:49.366876,0 days 00:00:01.019118,0.7244178425836937,,,gbtree,XGBoost,0.9963883041693984,,,0.0030400341954009962,,0.034211630550254585,lossguide,0.0004831698198969264,,,3.0,,9.0,,,,,,,,,,,,,,,0.3487195823972132,,,COMPLETE,0.0,,,,,,,,,,,,,,,,,,,,
163,163,0.5919539212806146,2023-08-23 18:43:48.641332,2023-08-23 18:43:49.820770,0 days 00:00:01.179438,0.9314082828319961,,,gbtree,XGBoost,0.9979932203206114,,,0.0038273258567735726,,0.06421792281395279,lossguide,9.419466569613153e-05,,,3.0,,8.0,,,,,,,,,,,,,,,0.34848936736912245,,,COMPLETE,0.0,,,,,,,,,,,,,,,,,,,,
164,164,0.5912316743478336,2023-08-23 18:43:49.263181,2023-08-23 18:43:50.455435,0 days 00:00:01.192254,0.9739155625470354,,,gbtree,XGBoost,0.9976839181169179,,,0.009004914122778356,,0.03303587794586702,lossguide,0.0004485589305940153,,,3.0,,9.0,,,,,,,,,,,,,,,0.35047967990065454,,,COMPLETE,0.0,,,,,,,,,,,,,,,,,,,,
165,165,0.3357921744708146,2023-08-23 18:43:49.355530,2023-08-23 18:43:49.993916,0 days 00:00:00.638386,0.8948592379481305,,,gblinear,XGBoost,0.9731581312170619,,,,,,,0.0004456344588590476,,,,,,,,,,,,,,,,,,,,0.34830051131139617,,,COMPLETE,0.0,,,,,,,,,,,,,,,,,,,,
166,166,0.3357921744708146,2023-08-23 18:43:49.434451,2023-08-23 18:43:50.168113,0 days 00:00:00.733662,0.4880782042068541,,,gblinear,XGBoost,0.9719665072251019,,,,,,,0.00026617639476457045,,,,,,,,,,,,,,,,,,,,0.37200234756768025,,,COMPLETE,0.0,,,,,,,,,,,,,,,,,,,,
167,167,0.3357921744708146,2023-08-23 18:43:49.896171,2023-08-23 18:43:50.451829,0 days 00:00:00.555658,0.5147368045834845,,,gblinear,XGBoost,0.9699174784153524,,,,,,,0.00032706806100795137,,,,,,,,,,,,,,,,,,,,0.3861168865471034,,,COMPLETE,0.0,,,,,,,,,,,,,,,,,,,,
168,168,0.5944797034690382,2023-08-23 18:43:50.107640,2023-08-23 18:43:51.176990,0 days 00:00:01.069350,0.2881831568528011,,,gbtree,XGBoost,0.9485907791812153,,,0.009212571816408546,,0.08526408610707449,lossguide,0.0002519084351298989,,,3.0,,8.0,,,,,,,,,,,,,,,0.3825356867409146,,,COMPLETE,0.0,,,,,,,,,,,,,,,,,,,,
169,169,0.5873721024883816,2023-08-23 18:43:50.258556,2023-08-23 18:43:51.349999,0 days 00:00:01.091443,0.2776338693541264,,,gbtree,XGBoost,0.945842318176262,,,0.008002352699850243,,0.07713524521427056,lossguide,0.00014602398093795625,,,3.0,,8.0,,,,,,,,,,,,,,,0.3065129558873011,,,COMPLETE,0.0,,,,,,,,,,,,,,,,,,,,
170,170,0.6029807040671773,2023-08-23 18:43:50.591973,2023-08-23 18:43:51.640595,0 days 00:00:01.048622,0.3656939084779478,,,gbtree,XGBoost,0.9483548730764255,,,0.007546289993428764,,0.08466816966170469,lossguide,0.0001926692662206894,,,3.0,,8.0,,,,,,,,,,,,,,,0.31994696930724803,,,COMPLETE,0.0,,,,,,,,,,,,,,,,,,,,
171,171,0.5962369814476799,2023-08-23 18:43:50.599786,2023-08-23 18:43:51.417889,0 days 00:00:00.818103,0.2808265921048032,,,gbtree,XGBoost,0.9335127987560309,,,0.00647265135212643,,0.09634014911355623,lossguide,0.00017806602403827755,,,3.0,,8.0,,,,,,,,,,,,,,,0.3107705526438098,,,COMPLETE,0.0,,,,,,,,,,,,,,,,,,,,
172,172,0.6009308417888146,2023-08-23 18:43:51.250000,2023-08-23 18:43:52.206154,0 days 00:00:00.956154,0.2826042118998055,,,gbtree,XGBoost,0.9342742287104295,,,0.005841368073867119,,0.12626372592360852,lossguide,0.00014945548136288821,,,3.0,,9.0,,,,,,,,,,,,,,,0.3202811708874245,,,COMPLETE,0.0,,,,,,,,,,,,,,,,,,,,
173,173,0.5774701824743576,2023-08-23 18:43:51.463520,2023-08-23 18:43:52.612116,0 days 00:00:01.148596,0.4376870180538101,,,dart,XGBoost,0.9801641108361481,,,0.005887311593720256,,0.1305189890450055,lossguide,0.0007909154412383991,,,3.0,,9.0,,,,,,,,tree,,1.5365831778196804e-06,,,weighted,2.224379683187909e-07,0.32265953364582634,,,COMPLETE,0.0,,,,,,,,,,,,,,,,,,,,
174,174,0.5744943288396474,2023-08-23 18:43:51.465138,2023-08-23 18:43:53.498981,0 days 00:00:02.033843,,,,,RandomForestClassifier,,,,,,,,,,,,,,,,,,,,,,,,12.0,32.0,,,,,,COMPLETE,0.0,,,,,,,,,,,,,,,,,,,,
175,175,0.5826303090694329,2023-08-23 18:43:51.727731,2023-08-23 18:43:53.708164,0 days 00:00:01.980433,,,,,RandomForestClassifier,,,,,,,,,,,,,,,,,,,,,,,,11.0,32.0,,,,,,COMPLETE,0.0,,,,,,,,,,,,,,,,,,,,
176,176,0.5835981701099631,2023-08-23 18:43:52.274154,2023-08-23 18:44:00.617728,0 days 00:00:08.343574,,,,,RandomForestClassifier,,,,,,,,,,,,,,,,,,,,,,,,100.0,5.0,,,,,,COMPLETE,0.0,,,,,,,,,,,,,,,,,,,,
177,177,0.5849232673426219,2023-08-23 18:43:52.780858,2023-08-23 18:44:01.626791,0 days 00:00:08.845933,,,,,RandomForestClassifier,,,,,,,,,,,,,,,,,,,,,,,,98.0,5.0,,,,,,COMPLETE,0.0,,,,,,,,,,,,,,,,,,,,
178,178,0.5958462338709276,2023-08-23 18:43:53.580690,2023-08-23 18:43:54.384575,0 days 00:00:00.803885,0.16792679654956144,,,gbtree,XGBoost,0.909775819775578,,,0.014671286642059056,,0.02604541409474107,lossguide,9.493280016680935e-05,,,3.0,,9.0,,,,,,,,,,,,,,,0.3322802357181657,,,COMPLETE,0.0,,,,,,,,,,,,,,,,,,,,
179,179,0.6035537276233618,2023-08-23 18:43:53.795766,2023-08-23 18:43:54.568959,0 days 00:00:00.773193,0.592523455407246,,,gbtree,XGBoost,0.9090145661427387,,,0.01578979142387057,,0.030962116017153353,lossguide,0.000209034691766221,,,3.0,,9.0,,,,,,,,,,,,,,,0.3251229405182577,,,COMPLETE,0.0,,,,,,,,,,,,,,,,,,,,
180,180,0.5890359252397352,2023-08-23 18:43:54.453290,2023-08-23 18:43:55.402540,0 days 00:00:00.949250,0.5805283562088781,,,gbtree,XGBoost,0.9332554420637558,,,0.00347881727735154,,0.0567482650463827,lossguide,0.00018547256304029335,,,3.0,,9.0,,,,,,,,,,,,,,,0.30261886525282433,,,COMPLETE,0.0,,,,,,,,,,,,,,,,,,,,
181,181,0.5923436395051289,2023-08-23 18:43:54.658705,2023-08-23 18:43:55.805863,0 days 00:00:01.147158,0.5497555127855929,,,gbtree,XGBoost,0.9243492540407517,,,0.0034952873517887033,,0.0194158016464865,lossguide,0.0008558030081561455,,,3.0,,9.0,,,,,,,,,,,,,,,0.2987642032796823,,,COMPLETE,0.0,,,,,,,,,,,,,,,,,,,,
182,182,0.5904441096567987,2023-08-23 18:43:55.517257,2023-08-23 18:43:56.408703,0 days 00:00:00.891446,0.2383132182549918,,,gbtree,XGBoost,0.910283983277247,,,0.0021987041677677334,,0.017776551492355713,lossguide,0.00012140244697076144,,,3.0,,2.0,,,,,,,,,,,,,,,0.2699755394324825,,,COMPLETE,0.0,,,,,,,,,,,,,,,,,,,,
183,183,0.5853587665734559,2023-08-23 18:43:55.875623,2023-08-23 18:43:56.859086,0 days 00:00:00.983463,0.2457832410001838,,,gbtree,XGBoost,0.9546410753608766,,,0.0019272521637973003,,0.31238933943483377,lossguide,0.0006090817701809277,,,3.0,,2.0,,,,,,,,,,,,,,,0.3636691431139797,,,COMPLETE,0.0,,,,,,,,,,,,,,,,,,,,
184,184,0.596570395405003,2023-08-23 18:43:56.463660,2023-08-23 18:43:57.349178,0 days 00:00:00.885518,0.3802495733014522,,,gbtree,XGBoost,0.9495808684443119,,,0.01796642207714775,,0.3006123726152317,lossguide,0.00022543069455594264,,,3.0,,6.0,,,,,,,,,,,,,,,0.35886488566718694,,,COMPLETE,0.0,,,,,,,,,,,,,,,,,,,,
185,185,0.6009853572608169,2023-08-23 18:43:56.950735,2023-08-23 18:43:57.741788,0 days 00:00:00.791053,0.12001221531716114,,,gbtree,XGBoost,0.9514184971682651,,,0.0052986576195500085,,0.6800336524947798,lossguide,0.00021090923150294557,,,3.0,,6.0,,,,,,,,,,,,,,,0.3227526201837655,,,COMPLETE,0.0,,,,,,,,,,,,,,,,,,,,
186,186,0.6031120652876589,2023-08-23 18:43:57.428156,2023-08-23 18:43:58.296603,0 days 00:00:00.868447,0.11686884772060868,,,gbtree,XGBoost,0.9049067524873291,,,0.005795602850808573,,0.6544738381909019,lossguide,6.958950520959788e-05,,,3.0,,10.0,,,,,,,,,,,,,,,0.32454768876827117,,,COMPLETE,0.0,,,,,,,,,,,,,,,,,,,,
187,187,0.6015624245720994,2023-08-23 18:43:57.889184,2023-08-23 18:43:58.763346,0 days 00:00:00.874162,0.10567750638274395,,,gbtree,XGBoost,0.9679374536118022,,,0.00473764054561755,,0.6794257632709234,lossguide,0.0002600995865760044,,,3.0,,7.0,,,,,,,,,,,,,,,0.3153979535127406,,,COMPLETE,0.0,,,,,,,,,,,,,,,,,,,,
188,188,0.6024455838214351,2023-08-23 18:43:58.404005,2023-08-23 18:43:59.408799,0 days 00:00:01.004794,0.10603823899799095,,,gbtree,XGBoost,0.9022977591624993,,,0.010639088070628196,,0.6554095469474318,lossguide,6.112899077856934e-05,,,3.0,,10.0,,,,,,,,,,,,,,,0.32040303244340834,,,COMPLETE,0.0,,,,,,,,,,,,,,,,,,,,
189,189,0.5988103445328836,2023-08-23 18:43:58.836799,2023-08-23 18:43:59.760149,0 days 00:00:00.923350,0.16103273689916647,,,gbtree,XGBoost,0.9808935155527685,,,0.005866704287834625,,0.664725332380873,lossguide,7.141506949975688e-05,,,3.0,,7.0,,,,,,,,,,,,,,,0.32466593085466766,,,COMPLETE,0.0,,,,,,,,,,,,,,,,,,,,
190,190,0.6064524363265074,2023-08-23 18:43:59.511741,2023-08-23 18:44:00.343134,0 days 00:00:00.831393,0.10885395130992262,,,gbtree,XGBoost,0.9051891172160429,,,0.005518327151629702,,0.6358442025410096,lossguide,5.8179010368041786e-05,,,3.0,,10.0,,,,,,,,,,,,,,,0.3278164920051698,,,COMPLETE,1.0,0.6117817479478512,0.6105646900370105,0.6162619288145235,0.6064524363265074,0.5009765625,0.6364764267990074,0.5606557377049181,0.720152817574021,0.5960474308300395,0.6522491349480968,0.5961053011179228,0.5867462179714105,0.5961268082358699,0.5810898010009302,0.43317972350230416,0.5961945031712473,0.501779359430605,0.7403127124405167,0.5960591133004927,0.6604002425712554
191,191,0.5938800840287783,2023-08-23 18:43:59.833637,2023-08-23 18:44:00.939999,0 days 00:00:01.106362,0.10620650417669808,,,gbtree,XGBoost,0.9073656144393935,,,0.005575411863847306,,0.6545319907663462,lossguide,5.5744566272361495e-05,,,7.0,,7.0,,,,,,,,,,,,,,,0.32576969818083773,,,COMPLETE,0.0,,,,,,,,,,,,,,,,,,,,
192,192,0.594796688028129,2023-08-23 18:44:00.425070,2023-08-23 18:44:01.482005,0 days 00:00:01.056935,0.10599705050457958,,,gbtree,XGBoost,0.9029076566733799,,,0.00504520520832538,,0.7080961838740115,lossguide,7.318076747124804e-05,,,3.0,,10.0,,,,,,,,,,,,,,,0.30830226298359276,,,COMPLETE,0.0,,,,,,,,,,,,,,,,,,,,
193,193,0.5967314104450027,2023-08-23 18:44:00.686805,2023-08-23 18:44:01.704063,0 days 00:00:01.017258,0.09447548506538248,,,gbtree,XGBoost,0.901996037164785,,,0.005215419841852933,,0.675273113590623,lossguide,5.871015372595107e-05,,,3.0,,10.0,,,,,,,,,,,,,,,0.31788357973455156,,,COMPLETE,0.0,,,,,,,,,,,,,,,,,,,,
194,194,0.591471475800379,2023-08-23 18:44:01.007644,2023-08-23 18:44:02.017616,0 days 00:00:01.009972,0.09160750831294398,,,gbtree,XGBoost,0.900230351849923,,,0.012294867050620727,,0.6350158746792535,lossguide,6.558431528925156e-05,,,3.0,,10.0,,,,,,,,,,,,,,,0.31398492704168585,,,COMPLETE,0.0,,,,,,,,,,,,,,,,,,,,
195,195,0.5930720081422635,2023-08-23 18:44:01.577345,2023-08-23 18:44:02.419622,0 days 00:00:00.842277,0.1370412708010301,,,gbtree,XGBoost,0.927604644437855,,,0.012877367288948692,,0.5744932096233384,lossguide,3.868469371627747e-05,,,3.0,,10.0,,,,,,,,,,,,,,,0.3177122850149695,,,COMPLETE,0.0,,,,,,,,,,,,,,,,,,,,
196,196,0.5959564610271207,2023-08-23 18:44:01.798653,2023-08-23 18:44:02.697407,0 days 00:00:00.898754,0.15988887562549062,,,gbtree,XGBoost,0.9318969354559068,,,0.011852910997029804,,0.685494607632223,lossguide,2.7979643896715756e-05,,,3.0,,10.0,,,,,,,,,,,,,,,0.29894381949499294,,,COMPLETE,0.0,,,,,,,,,,,,,,,,,,,,
197,197,0.5928110007687137,2023-08-23 18:44:01.838032,2023-08-23 18:44:02.818208,0 days 00:00:00.980176,0.13616724835311156,,,gbtree,XGBoost,0.9275403025975067,,,0.015124820480692788,,0.6523831101323924,lossguide,3.3001867875067186e-05,,,3.0,,10.0,,,,,,,,,,,,,,,0.29594147743741445,,,COMPLETE,0.0,,,,,,,,,,,,,,,,,,,,
198,198,0.5934990014218049,2023-08-23 18:44:02.109537,2023-08-23 18:44:03.291569,0 days 00:00:01.182032,0.03058027588211538,,,gbtree,XGBoost,0.9331843202311111,,,0.005505350402484149,,0.644547305077265,lossguide,2.9680186618749022e-05,,,3.0,,10.0,,,,,,,,,,,,,,,0.2992041759001019,,,COMPLETE,0.0,,,,,,,,,,,,,,,,,,,,
199,199,0.5939400311437957,2023-08-23 18:44:02.507968,2023-08-23 18:44:03.587060,0 days 00:00:01.079092,0.14113253812065352,,,gbtree,XGBoost,0.9789446733238097,,,0.006003016763360171,,0.6610346411817231,lossguide,0.00013143269190868056,,,3.0,,7.0,,,,,,,,,,,,,,,0.2996671857799264,,,COMPLETE,0.0,,,,,,,,,,,,,,,,,,,,
200,200,0.5878328723560615,2023-08-23 18:44:02.891109,2023-08-23 18:44:04.098953,0 days 00:00:01.207844,0.3614529270511317,,,gbtree,XGBoost,0.9625918612990354,,,0.006064712920480744,,0.35558965228919776,lossguide,0.00012160073119171586,,,3.0,,8.0,,,,,,,,,,,,,,,0.2685201731424371,,,COMPLETE,0.0,,,,,,,,,,,,,,,,,,,,
201,201,0.5960866190685965,2023-08-23 18:44:02.948510,2023-08-23 18:44:04.028049,0 days 00:00:01.079539,0.02908915438382776,,,gbtree,XGBoost,0.978341266046628,,,0.005959694304906292,,0.3568063187985361,lossguide,9.852856163956445e-05,,,3.0,,7.0,,,,,,,,,,,,,,,0.2753640899681604,,,COMPLETE,0.0,,,,,,,,,,,,,,,,,,,,
202,202,0.591574508108436,2023-08-23 18:44:03.418798,2023-08-23 18:44:04.464635,0 days 00:00:01.045837,0.3477145796029914,,,gbtree,XGBoost,0.9767400698912363,,,0.0028462973511332082,,0.38680767629962887,lossguide,0.0002980021254272001,,,3.0,,7.0,,,,,,,,,,,,,,,0.37296669773192437,,,COMPLETE,0.0,,,,,,,,,,,,,,,,,,,,
203,203,0.5957575791700215,2023-08-23 18:44:03.675580,2023-08-23 18:44:04.915373,0 days 00:00:01.239793,0.21054618077055154,,,gbtree,XGBoost,0.9644214577383396,,,0.003416606217337282,,0.3560563309275534,lossguide,0.00011628384544745621,,,3.0,,8.0,,,,,,,,,,,,,,,0.2755423621222825,,,COMPLETE,0.0,,,,,,,,,,,,,,,,,,,,
204,204,0.593946836700311,2023-08-23 18:44:03.813796,2023-08-23 18:44:04.844430,0 days 00:00:01.030634,0.35184253858236825,,,gbtree,XGBoost,0.9659442008968556,,,0.002985834689851358,,0.29132511113817294,lossguide,0.00010553354033727325,,,3.0,,7.0,,,,,,,,,,,,,,,0.27572179772962013,,,COMPLETE,0.0,,,,,,,,,,,,,,,,,,,,
205,205,0.6023425499231951,2023-08-23 18:44:04.177945,2023-08-23 18:44:05.376363,0 days 00:00:01.198418,0.21053780449470735,,,gbtree,XGBoost,0.8633378499624071,,,0.023876093456159778,,0.3028666460090668,lossguide,0.00032800537505918133,,,3.0,,7.0,,,,,,,,,,,,,,,0.40671975296506246,,,COMPLETE,0.0,,,,,,,,,,,,,,,,,,,,
206,206,0.5925182993745715,2023-08-23 18:44:04.179747,2023-08-23 18:44:05.190989,0 days 00:00:01.011242,0.22950941969700134,,,gbtree,XGBoost,0.8569842715885344,,,0.002621272230089522,,0.03939781001365916,lossguide,0.00029982572123405965,,,3.0,,7.0,,,,,,,,,,,,,,,0.3728360424216009,,,COMPLETE,0.0,,,,,,,,,,,,,,,,,,,,
207,207,0.6004106365387825,2023-08-23 18:44:04.573861,2023-08-23 18:44:05.701742,0 days 00:00:01.127881,0.07778010823262427,,,gbtree,XGBoost,0.9478487962326582,,,0.02199749697664941,,0.12351787719638425,lossguide,0.00016745103751667224,,,3.0,,9.0,,,,,,,,,,,,,,,0.3260444095804346,,,COMPLETE,0.0,,,,,,,,,,,,,,,,,,,,
208,208,0.5943809759058486,2023-08-23 18:44:04.922977,2023-08-23 18:44:06.122880,0 days 00:00:01.199903,0.20572882544891127,,,gbtree,XGBoost,0.9437268590767947,,,0.0019867157683367475,,0.1397974039252095,lossguide,0.0001996079123027772,,,3.0,,9.0,,,,,,,,,,,,,,,0.333204583367102,,,COMPLETE,0.0,,,,,,,,,,,,,,,,,,,,
209,209,0.6034967863256195,2023-08-23 18:44:05.020259,2023-08-23 18:44:06.051909,0 days 00:00:01.031650,0.18503234825532505,,,gbtree,XGBoost,0.9506550550139771,,,0.0020114606395032655,,0.14798256259067485,lossguide,0.0001985563689383838,,,3.0,,9.0,,,,,,,,,,,,,,,0.3372874010348334,,,COMPLETE,0.0,,,,,,,,,,,,,,,,,,,,
210,210,0.5980065626299816,2023-08-23 18:44:05.288926,2023-08-23 18:44:06.425563,0 days 00:00:01.136637,0.17950653929548518,,,gbtree,XGBoost,0.9458099244239702,,,0.009925520239101347,,0.148618258578348,lossguide,0.0002068888681898267,,,3.0,,9.0,,,,,,,,,,,,,,,0.3380954130199215,,,COMPLETE,0.0,,,,,,,,,,,,,,,,,,,,
211,211,0.5912629281715533,2023-08-23 18:44:05.451387,2023-08-23 18:44:06.680468,0 days 00:00:01.229081,0.06511564830183342,,,gbtree,XGBoost,0.8769997647940155,,,0.010779129384126038,,0.997258462744682,lossguide,0.00018972045411440322,,,3.0,,2.0,,,,,,,,,,,,,,,0.4014416889499975,,,COMPLETE,0.0,,,,,,,,,,,,,,,,,,,,
212,212,0.5824899885158012,2023-08-23 18:44:05.813199,2023-08-23 18:44:07.167138,0 days 00:00:01.353939,0.07412888891162572,,,gbtree,XGBoost,0.8817852209245395,,,0.02809489350907286,,0.11898082589761376,lossguide,0.00022292202693436705,,,3.0,,2.0,,,,,,,,,,,,,,,0.43311798852611255,,,COMPLETE,0.0,,,,,,,,,,,,,,,,,,,,
213,213,0.5877505289259958,2023-08-23 18:44:06.216487,2023-08-23 18:44:07.574492,0 days 00:00:01.358005,0.11360583010089667,,,dart,XGBoost,0.8825052236054265,,,0.018594486597624253,,0.14426091648620396,lossguide,0.0003763763249550054,,,3.0,,2.0,,,,,,,,tree,,9.637346135610298e-06,,,weighted,5.982440331068794e-06,0.4089256660346193,,,COMPLETE,0.0,,,,,,,,,,,,,,,,,,,,
214,214,0.575638982044283,2023-08-23 18:44:06.220690,2023-08-23 18:44:07.681736,0 days 00:00:01.461046,0.07733880382898808,,,dart,XGBoost,0.8840105104816209,,,0.02591379566783749,,0.13768691218149784,lossguide,0.00021349640914869705,,,3.0,,2.0,,,,,,,,tree,,5.889707152911481e-06,,,weighted,4.824776855209567e-06,0.3943054740476299,,,COMPLETE,0.0,,,,,,,,,,,,,,,,,,,,
215,215,0.5843326157056326,2023-08-23 18:44:06.511667,2023-08-23 18:44:07.961718,0 days 00:00:01.450051,0.08676954387557965,,,dart,XGBoost,0.8837550134924719,,,0.02982109522853498,,0.9921542497845687,lossguide,0.09706187344688721,,,3.0,,2.0,,,,,,,,tree,,9.459645045876775e-06,,,weighted,1.0756781920354262e-05,0.4193520991830782,,,COMPLETE,0.0,,,,,,,,,,,,,,,,,,,,
