,number,value,datetime_start,datetime_complete,duration,params_alpha,params_bagging_fraction,params_bagging_freq,params_booster,params_classifier,params_colsample_bytree,params_dct_criterion,params_dct_max_depth,params_eta,params_feature_fraction,params_gamma,params_grow_policy,params_lambda,params_lambda_l1,params_lambda_l2,params_max_depth,params_min_child_samples,params_min_child_weight,params_mlp_activation,params_mlp_solver,params_n_layers,params_n_units_l_0,params_n_units_l_1,params_n_units_l_2,params_n_units_l_3,params_normalize_type,params_num_leaves,params_rate_drop,params_rf_estimator,params_rf_max_depth,params_sample_type,params_skip_drop,params_subsample,params_svc_c,params_svc_kernel,state,best_trial,dev_acc,dev_recall_macro,dev_precision_macro,dev_f1_macro,dev_recall_0,dev_precision_0,dev_f1_0,dev_recall_1,dev_precision_1,dev_f1_1,test_acc,test_recall_macro,test_precision_macro,test_f1_macro,test_recall_0,test_precision_0,test_f1_0,test_recall_1,test_precision_1,test_f1_1
168,168,0.5760933888417685,2023-08-23 17:51:43.342280,2023-08-23 17:51:45.715022,0 days 00:00:02.372742,,0.5,2.0,,LightGBM,,,,,0.4,,,,0.016823956671355028,0.0017787117625885954,,30.0,,,,,,,,,,62.0,,,,,,,,,COMPLETE,0.0,,,,,,,,,,,,,,,,,,,,
169,169,0.5589417003210106,2023-08-23 17:51:44.418198,2023-08-23 17:51:46.506400,0 days 00:00:02.088202,,0.8,2.0,,LightGBM,,,,,0.4,,,,0.0913090034980251,0.09014970358295644,,70.0,,,,,,,,,,57.0,,,,,,,,,COMPLETE,0.0,,,,,,,,,,,,,,,,,,,,
170,170,0.5820040044459419,2023-08-23 17:51:45.776067,2023-08-23 17:51:48.416930,0 days 00:00:02.640863,,0.8,2.0,,LightGBM,,,,,0.5,,,,0.09133155227427077,0.08717545156818703,,70.0,,,,,,,,,,58.0,,,,,,,,,COMPLETE,0.0,,,,,,,,,,,,,,,,,,,,
171,171,0.5836790574178561,2023-08-23 17:51:45.952537,2023-08-23 17:51:48.037792,0 days 00:00:02.085255,,0.8,2.0,,LightGBM,,,,,0.5,,,,0.008880177554703385,0.11327406791767866,,70.0,,,,,,,,,,63.0,,,,,,,,,COMPLETE,0.0,,,,,,,,,,,,,,,,,,,,
172,172,0.5750302593288867,2023-08-23 17:51:46.604744,2023-08-23 17:51:49.364156,0 days 00:00:02.759412,,0.9,2.0,,LightGBM,,,,,0.5,,,,0.403657079697964,0.028241557690545864,,70.0,,,,,,,,,,78.0,,,,,,,,,COMPLETE,0.0,,,,,,,,,,,,,,,,,,,,
173,173,0.5796947751962336,2023-08-23 17:51:46.686111,2023-08-23 17:51:48.970117,0 days 00:00:02.284006,,0.7000000000000001,2.0,,LightGBM,,,,,0.5,,,,0.39827234008092294,0.0026148313881651417,,70.0,,,,,,,,,,83.0,,,,,,,,,COMPLETE,0.0,,,,,,,,,,,,,,,,,,,,
174,174,0.465892479976987,2023-08-23 17:51:48.137587,2023-08-23 17:51:48.695678,0 days 00:00:00.558091,7.744994552919121e-06,,,gbtree,XGBoost,0.22757187186948608,,,0.0006905493570462233,,0.00039285945928931845,lossguide,0.0010568134211336633,,,9.0,,10.0,,,,,,,,,,,,,,,0.7693528480279634,,,COMPLETE,0.0,,,,,,,,,,,,,,,,,,,,
175,175,0.3573487031700288,2023-08-23 17:51:48.537094,2023-08-23 17:51:56.492208,0 days 00:00:07.955114,,,,,SVC,,,,,,,,,,,,,,,,,,,,,,,,,,,,,0.05476538621229726,rbf,COMPLETE,0.0,,,,,,,,,,,,,,,,,,,,
176,176,0.3573487031700288,2023-08-23 17:51:48.830963,2023-08-23 17:51:57.317835,0 days 00:00:08.486872,,,,,SVC,,,,,,,,,,,,,,,,,,,,,,,,,,,,,0.04950265257800046,rbf,COMPLETE,0.0,,,,,,,,,,,,,,,,,,,,
177,177,0.3573487031700288,2023-08-23 17:51:49.141413,2023-08-23 17:51:56.810273,0 days 00:00:07.668860,,,,,SVC,,,,,,,,,,,,,,,,,,,,,,,,,,,,,0.03909029720271586,rbf,COMPLETE,0.0,,,,,,,,,,,,,,,,,,,,
178,178,0.5561149815584568,2023-08-23 17:51:49.494389,2023-08-23 17:51:50.207600,0 days 00:00:00.713211,,1.0,2.0,,LightGBM,,,,,0.5,,,,0.7420937019974627,0.1779074380775939,,20.0,,,,,,,,,,12.0,,,,,,,,,COMPLETE,0.0,,,,,,,,,,,,,,,,,,,,
179,179,0.5825488884804257,2023-08-23 17:51:50.272934,2023-08-23 17:51:51.239173,0 days 00:00:00.966239,,0.7000000000000001,1.0,,LightGBM,,,,,0.5,,,,0.0011862718347485565,0.33365594726042774,,60.0,,,,,,,,,,20.0,,,,,,,,,COMPLETE,0.0,,,,,,,,,,,,,,,,,,,,
180,180,0.3573487031700288,2023-08-23 17:51:51.386087,2023-08-23 17:51:59.316537,0 days 00:00:07.930450,,,,,SVC,,,,,,,,,,,,,,,,,,,,,,,,,,,,,0.05058347300771406,rbf,COMPLETE,0.0,,,,,,,,,,,,,,,,,,,,
181,181,0.5726434303509402,2023-08-23 17:51:56.563125,2023-08-23 17:51:57.962847,0 days 00:00:01.399722,,0.7000000000000001,2.0,,LightGBM,,,,,0.5,,,,0.0016352329026357432,0.4502689057146611,,20.0,,,,,,,,,,29.0,,,,,,,,,COMPLETE,0.0,,,,,,,,,,,,,,,,,,,,
182,182,0.5841328919273641,2023-08-23 17:51:56.878149,2023-08-23 17:51:58.587243,0 days 00:00:01.709094,,0.7000000000000001,2.0,,LightGBM,,,,,0.5,,,,0.0017017322723513282,0.0005611362994522972,,20.0,,,,,,,,,,41.0,,,,,,,,,COMPLETE,0.0,,,,,,,,,,,,,,,,,,,,
183,183,0.5751954208054821,2023-08-23 17:51:57.384289,2023-08-23 17:51:58.990456,0 days 00:00:01.606167,,0.7000000000000001,2.0,,LightGBM,,,,,0.5,,,,0.0028537046227849003,0.0005661001707177884,,40.0,,,,,,,,,,35.0,,,,,,,,,COMPLETE,0.0,,,,,,,,,,,,,,,,,,,,
184,184,0.5998673765919685,2023-08-23 17:51:58.021391,2023-08-23 17:52:00.028170,0 days 00:00:02.006779,,0.7000000000000001,2.0,,LightGBM,,,,,0.5,,,,0.003096949041492355,0.16391303098244092,,80.0,,,,,,,,,,41.0,,,,,,,,,COMPLETE,0.0,,,,,,,,,,,,,,,,,,,,
185,185,0.5724582484830584,2023-08-23 17:51:58.693055,2023-08-23 17:52:00.787614,0 days 00:00:02.094559,,0.7000000000000001,2.0,,LightGBM,,,,,0.7000000000000001,,,,0.003233809793845419,0.05366732947917895,,90.0,,,,,,,,,,256.0,,,,,,,,,COMPLETE,0.0,,,,,,,,,,,,,,,,,,,,
186,186,0.5816886396961456,2023-08-23 17:51:59.068030,2023-08-23 17:52:01.409638,0 days 00:00:02.341608,,0.7000000000000001,2.0,,LightGBM,,,,,0.6000000000000001,,,,0.03515752968808889,0.15147015616151893,,80.0,,,,,,,,,,217.0,,,,,,,,,COMPLETE,0.0,,,,,,,,,,,,,,,,,,,,
187,187,0.5945791518627024,2023-08-23 17:51:59.419306,2023-08-23 17:52:01.644148,0 days 00:00:02.224842,,0.7000000000000001,2.0,,LightGBM,,,,,0.6000000000000001,,,,0.037524796755882314,0.2617127196822087,,80.0,,,,,,,,,,215.0,,,,,,,,,COMPLETE,0.0,,,,,,,,,,,,,,,,,,,,
188,188,0.5971412271805274,2023-08-23 17:52:00.104290,2023-08-23 17:52:01.299986,0 days 00:00:01.195696,,0.7000000000000001,2.0,,LightGBM,,,,,0.5,,,,0.0035353218516047326,0.1619458388034983,,80.0,,,,,,,,,,20.0,,,,,,,,,COMPLETE,0.0,,,,,,,,,,,,,,,,,,,,
189,189,0.5856600717074048,2023-08-23 17:52:00.875678,2023-08-23 17:52:03.140043,0 days 00:00:02.264365,,0.7000000000000001,2.0,,LightGBM,,,,,0.5,,,,0.0006217668703217415,0.1439146783459869,,80.0,,,,,,,,,,216.0,,,,,,,,,COMPLETE,0.0,,,,,,,,,,,,,,,,,,,,
190,190,0.5879683721435753,2023-08-23 17:52:01.378690,2023-08-23 17:52:03.946955,0 days 00:00:02.568265,,0.7000000000000001,2.0,,LightGBM,,,,,0.5,,,,0.004067443904107973,0.4547881611596812,,80.0,,,,,,,,,,215.0,,,,,,,,,COMPLETE,0.0,,,,,,,,,,,,,,,,,,,,
191,191,0.5833398209420008,2023-08-23 17:52:01.488647,2023-08-23 17:52:03.678690,0 days 00:00:02.190043,,0.7000000000000001,2.0,,LightGBM,,,,,0.5,,,,0.004062192698833637,0.2631787314592866,,80.0,,,,,,,,,,212.0,,,,,,,,,COMPLETE,0.0,,,,,,,,,,,,,,,,,,,,
192,192,0.5813775560507168,2023-08-23 17:52:01.737591,2023-08-23 17:52:02.841658,0 days 00:00:01.104067,,0.7000000000000001,2.0,,LightGBM,,,,,0.6000000000000001,,,,0.04749326859120264,0.435741733166996,,80.0,,,,,,,,,,12.0,,,,,,,,,COMPLETE,0.0,,,,,,,,,,,,,,,,,,,,
193,193,0.5648853677818708,2023-08-23 17:52:02.945406,2023-08-23 17:52:05.499286,0 days 00:00:02.553880,,0.7000000000000001,2.0,,LightGBM,,,,,0.6000000000000001,,,,0.007218933124954496,0.14472085161215725,,80.0,,,,,,,,,,214.0,,,,,,,,,COMPLETE,0.0,,,,,,,,,,,,,,,,,,,,
194,194,0.5671363695341897,2023-08-23 17:52:03.236669,2023-08-23 17:52:05.669500,0 days 00:00:02.432831,,0.7000000000000001,1.0,,LightGBM,,,,,0.6000000000000001,,,,0.009366520037977754,0.775393183196896,,80.0,,,,,,,,,,224.0,,,,,,,,,COMPLETE,0.0,,,,,,,,,,,,,,,,,,,,
195,195,0.5330702861952862,2023-08-23 17:52:03.793627,2023-08-23 17:52:04.624454,0 days 00:00:00.830827,,,,,DecisionTreeClassifier,,log_loss,18.0,,,,,,,,,,,,,,,,,,,,,,,,,,,,COMPLETE,0.0,,,,,,,,,,,,,,,,,,,,
196,196,0.529770542354435,2023-08-23 17:52:04.049791,2023-08-23 17:52:04.313172,0 days 00:00:00.263381,,,,,DecisionTreeClassifier,,log_loss,6.0,,,,,,,,,,,,,,,,,,,,,,,,,,,,COMPLETE,0.0,,,,,,,,,,,,,,,,,,,,
197,197,0.5685068013389833,2023-08-23 17:52:04.417139,2023-08-23 17:52:06.638270,0 days 00:00:02.221131,,0.7000000000000001,1.0,,LightGBM,,,,,0.6000000000000001,,,,0.007499087949856853,0.7185832432195373,,80.0,,,,,,,,,,202.0,,,,,,,,,COMPLETE,0.0,,,,,,,,,,,,,,,,,,,,
198,198,0.5681785233509371,2023-08-23 17:52:04.699827,2023-08-23 17:52:07.106978,0 days 00:00:02.407151,,0.7000000000000001,2.0,,LightGBM,,,,,0.6000000000000001,,,,0.0072529476371465266,0.7667103143152323,,80.0,,,,,,,,,,224.0,,,,,,,,,COMPLETE,0.0,,,,,,,,,,,,,,,,,,,,
199,199,0.5981981981981983,2023-08-23 17:52:05.632313,2023-08-23 17:52:07.921564,0 days 00:00:02.289251,,0.7000000000000001,2.0,,LightGBM,,,,,0.6000000000000001,,,,0.008719723725644925,0.7587582983578512,,80.0,,,,,,,,,,206.0,,,,,,,,,COMPLETE,0.0,,,,,,,,,,,,,,,,,,,,
200,200,0.5773790439300971,2023-08-23 17:52:05.747915,2023-08-23 17:52:08.214299,0 days 00:00:02.466384,,0.7000000000000001,2.0,,LightGBM,,,,,0.7000000000000001,,,,0.0020050568901629306,0.4175338401675814,,80.0,,,,,,,,,,208.0,,,,,,,,,COMPLETE,0.0,,,,,,,,,,,,,,,,,,,,
201,201,0.5701472119883723,2023-08-23 17:52:06.706214,2023-08-23 17:52:09.034997,0 days 00:00:02.328783,,0.7000000000000001,2.0,,LightGBM,,,,,0.7000000000000001,,,,0.036588256575631875,0.45046397800035504,,90.0,,,,,,,,,,208.0,,,,,,,,,COMPLETE,0.0,,,,,,,,,,,,,,,,,,,,
202,202,0.5727475813978242,2023-08-23 17:52:07.191566,2023-08-23 17:52:09.514740,0 days 00:00:02.323174,,0.7000000000000001,2.0,,LightGBM,,,,,0.7000000000000001,,,,0.17735147721982727,0.44912242379911893,,90.0,,,,,,,,,,207.0,,,,,,,,,COMPLETE,0.0,,,,,,,,,,,,,,,,,,,,
203,203,0.5761695906432749,2023-08-23 17:52:07.989849,2023-08-23 17:52:10.319379,0 days 00:00:02.329530,,0.7000000000000001,2.0,,LightGBM,,,,,0.6000000000000001,,,,0.00462491295278765,0.4677848702639393,,90.0,,,,,,,,,,207.0,,,,,,,,,COMPLETE,0.0,,,,,,,,,,,,,,,,,,,,
204,204,0.5462527818723084,2023-08-23 17:52:08.341442,2023-08-23 17:52:12.420688,0 days 00:00:04.079246,,,,,RandomForestClassifier,,,,,,,,,,,,,,,,,,,,,,,,74.0,5.0,,,,,,COMPLETE,0.0,,,,,,,,,,,,,,,,,,,,
205,205,0.5461851545253862,2023-08-23 17:52:09.137653,2023-08-23 17:52:12.626042,0 days 00:00:03.488389,,,,,RandomForestClassifier,,,,,,,,,,,,,,,,,,,,,,,,71.0,5.0,,,,,,COMPLETE,0.0,,,,,,,,,,,,,,,,,,,,
206,206,0.548854485036353,2023-08-23 17:52:09.600648,2023-08-23 17:52:11.329381,0 days 00:00:01.728733,,,,,RandomForestClassifier,,,,,,,,,,,,,,,,,,,,,,,,34.0,5.0,,,,,,COMPLETE,0.0,,,,,,,,,,,,,,,,,,,,
207,207,0.547075225264888,2023-08-23 17:52:10.388497,2023-08-23 17:52:13.709526,0 days 00:00:03.321029,,,,,RandomForestClassifier,,,,,,,,,,,,,,,,,,,,,,,,74.0,5.0,,,,,,COMPLETE,0.0,,,,,,,,,,,,,,,,,,,,
208,208,0.5662084628875633,2023-08-23 17:52:11.407795,2023-08-23 17:52:13.186182,0 days 00:00:01.778387,,0.5,2.0,,LightGBM,,,,,0.5,,,,0.02050091346728022,0.002967244596791245,,80.0,,,,,,,,,,196.0,,,,,,,,,COMPLETE,0.0,,,,,,,,,,,,,,,,,,,,
209,209,0.5905889389477241,2023-08-23 17:52:12.500671,2023-08-23 17:52:14.787558,0 days 00:00:02.286887,,0.7000000000000001,2.0,,LightGBM,,,,,0.5,,,,0.019337981156930438,0.9764296429973354,,80.0,,,,,,,,,,198.0,,,,,,,,,COMPLETE,0.0,,,,,,,,,,,,,,,,,,,,
210,210,0.5662084628875633,2023-08-23 17:52:12.704821,2023-08-23 17:52:14.547377,0 days 00:00:01.842556,,0.5,2.0,,LightGBM,,,,,0.5,,,,0.02152537269514585,0.001647366736973895,,80.0,,,,,,,,,,195.0,,,,,,,,,COMPLETE,0.0,,,,,,,,,,,,,,,,,,,,
211,211,0.5823531319105335,2023-08-23 17:52:13.272356,2023-08-23 17:52:15.596758,0 days 00:00:02.324402,,0.7000000000000001,2.0,,LightGBM,,,,,0.6000000000000001,,,,0.010589240312834678,0.26912606656084387,,80.0,,,,,,,,,,230.0,,,,,,,,,COMPLETE,0.0,,,,,,,,,,,,,,,,,,,,
212,212,0.5852194197667784,2023-08-23 17:52:13.886234,2023-08-23 17:52:16.328752,0 days 00:00:02.442518,,0.7000000000000001,2.0,,LightGBM,,,,,0.6000000000000001,,,,0.28368217876074187,0.0015312580087097774,,80.0,,,,,,,,,,201.0,,,,,,,,,COMPLETE,0.0,,,,,,,,,,,,,,,,,,,,
213,213,0.5823531319105335,2023-08-23 17:52:14.693178,2023-08-23 17:52:17.283431,0 days 00:00:02.590253,,0.7000000000000001,2.0,,LightGBM,,,,,0.6000000000000001,,,,0.00976791993450257,0.2697228232211376,,80.0,,,,,,,,,,186.0,,,,,,,,,COMPLETE,0.0,,,,,,,,,,,,,,,,,,,,
214,214,0.5806790084979949,2023-08-23 17:52:14.900484,2023-08-23 17:52:17.540625,0 days 00:00:02.640141,,0.7000000000000001,2.0,,LightGBM,,,,,0.5,,,,0.010067592096679448,0.3050473863197362,,80.0,,,,,,,,,,187.0,,,,,,,,,COMPLETE,0.0,,,,,,,,,,,,,,,,,,,,
215,215,0.5840786740706201,2023-08-23 17:52:15.727065,2023-08-23 17:52:18.580875,0 days 00:00:02.853810,,0.7000000000000001,2.0,,LightGBM,,,,,0.5,,,,0.003891996451057907,0.8997214083495645,,60.0,,,,,,,,,,200.0,,,,,,,,,COMPLETE,0.0,,,,,,,,,,,,,,,,,,,,
216,216,0.5898153264729635,2023-08-23 17:52:16.465767,2023-08-23 17:52:18.984842,0 days 00:00:02.519075,,0.7000000000000001,2.0,,LightGBM,,,,,0.5,,,,0.003955358740476622,0.8849992762523081,,60.0,,,,,,,,,,187.0,,,,,,,,,COMPLETE,0.0,,,,,,,,,,,,,,,,,,,,
217,217,0.5942100909842845,2023-08-23 17:52:17.421375,2023-08-23 17:52:20.470852,0 days 00:00:03.049477,,0.7000000000000001,2.0,,LightGBM,,,,,0.5,,,,0.004389432394988264,0.8381041838075817,,60.0,,,,,,,,,,202.0,,,,,,,,,COMPLETE,0.0,,,,,,,,,,,,,,,,,,,,
218,218,0.5760046500358154,2023-08-23 17:52:17.635151,2023-08-23 17:52:19.116014,0 days 00:00:01.480863,,0.7000000000000001,2.0,,LightGBM,,,,,0.5,,,,0.031567154640559196,0.9961271979309652,,70.0,,,,,,,,,,19.0,,,,,,,,,COMPLETE,0.0,,,,,,,,,,,,,,,,,,,,
219,219,0.5843429636533084,2023-08-23 17:52:18.696813,2023-08-23 17:52:21.181654,0 days 00:00:02.484841,,0.7000000000000001,2.0,,LightGBM,,,,,0.5,,,,0.5721226399751097,0.6102381238764114,,70.0,,,,,,,,,,220.0,,,,,,,,,COMPLETE,0.0,,,,,,,,,,,,,,,,,,,,
220,220,0.5727969348659003,2023-08-23 17:52:19.081114,2023-08-23 17:52:21.975522,0 days 00:00:02.894408,,0.7000000000000001,2.0,,LightGBM,,,,,0.5,,,,0.005794000014444881,0.9738932674761805,,60.0,,,,,,,,,,193.0,,,,,,,,,COMPLETE,0.0,,,,,,,,,,,,,,,,,,,,
221,221,0.5895988420181968,2023-08-23 17:52:19.308074,2023-08-23 17:52:22.602546,0 days 00:00:03.294472,,0.7000000000000001,2.0,,LightGBM,,,,,0.5,,,,0.0023008293545659112,0.6163701785010895,,60.0,,,,,,,,,,194.0,,,,,,,,,COMPLETE,0.0,,,,,,,,,,,,,,,,,,,,
222,222,0.577327393062244,2023-08-23 17:52:20.282592,2023-08-23 17:52:22.925696,0 days 00:00:02.643104,,0.7000000000000001,2.0,,LightGBM,,,,,0.5,,,,0.0026849290974599372,0.6688548788645468,,60.0,,,,,,,,,,194.0,,,,,,,,,COMPLETE,0.0,,,,,,,,,,,,,,,,,,,,
223,223,0.5820040044459419,2023-08-23 17:52:20.538088,2023-08-23 17:52:23.254715,0 days 00:00:02.716627,,0.7000000000000001,2.0,,LightGBM,,,,,0.5,,,,0.005062242943119164,0.6051633545559308,,60.0,,,,,,,,,,195.0,,,,,,,,,COMPLETE,0.0,,,,,,,,,,,,,,,,,,,,
224,224,0.49359464863130353,2023-08-23 17:52:21.234448,2023-08-23 17:52:21.831210,0 days 00:00:00.596762,0.0006221814231105741,,,dart,XGBoost,0.406819368356402,,,0.010311428700105665,,1.0088191399944338e-08,depthwise,1.7009590569175364e-06,,,5.0,,4.0,,,,,,,,tree,,4.289467999711859e-06,,,weighted,0.7241313452386042,0.9559749597263318,,,COMPLETE,0.0,,,,,,,,,,,,,,,,,,,,
225,225,0.5645678687101923,2023-08-23 17:52:21.889529,2023-08-23 17:52:24.402235,0 days 00:00:02.512706,,0.7000000000000001,2.0,,LightGBM,,,,,0.5,,,,0.005188520248316694,0.6421549463684595,,60.0,,,,,,,,,,195.0,,,,,,,,,COMPLETE,0.0,,,,,,,,,,,,,,,,,,,,
226,226,0.5704889632461057,2023-08-23 17:52:22.048552,2023-08-23 17:52:24.833963,0 days 00:00:02.785411,,0.7000000000000001,2.0,,LightGBM,,,,,0.5,,,,0.01659215966872739,0.5874209666183429,,60.0,,,,,,,,,,204.0,,,,,,,,,COMPLETE,0.0,,,,,,,,,,,,,,,,,,,,
227,227,0.5724582484830584,2023-08-23 17:52:22.732346,2023-08-23 17:52:25.560785,0 days 00:00:02.828439,,0.7000000000000001,2.0,,LightGBM,,,,,0.8,,,,0.016778417214456526,0.5853621828611145,,60.0,,,,,,,,,,183.0,,,,,,,,,COMPLETE,0.0,,,,,,,,,,,,,,,,,,,,
228,228,0.5853634734014413,2023-08-23 17:52:23.027536,2023-08-23 17:52:25.933880,0 days 00:00:02.906344,,0.7000000000000001,2.0,,LightGBM,,,,,0.5,,,,0.004762802138709632,0.3617265718856455,,60.0,,,,,,,,,,182.0,,,,,,,,,COMPLETE,0.0,,,,,,,,,,,,,,,,,,,,
229,229,0.5714794898417765,2023-08-23 17:52:23.349766,2023-08-23 17:52:26.126288,0 days 00:00:02.776522,,0.7000000000000001,2.0,,LightGBM,,,,,0.5,,,,0.016338557504766975,0.35928052263172294,,60.0,,,,,,,,,,202.0,,,,,,,,,COMPLETE,0.0,,,,,,,,,,,,,,,,,,,,
230,230,0.5793838939093474,2023-08-23 17:52:24.500726,2023-08-23 17:52:27.373909,0 days 00:00:02.873183,,0.7000000000000001,2.0,,LightGBM,,,,,0.5,,,,0.015750530788682156,0.3304626841376202,,60.0,,,,,,,,,,212.0,,,,,,,,,COMPLETE,0.0,,,,,,,,,,,,,,,,,,,,
231,231,0.5827919407894737,2023-08-23 17:52:24.960471,2023-08-23 17:52:27.724531,0 days 00:00:02.764060,,0.7000000000000001,2.0,,LightGBM,,,,,0.5,,,,0.003005405287524252,0.37030112947800586,,60.0,,,,,,,,,,212.0,,,,,,,,,COMPLETE,0.0,,,,,,,,,,,,,,,,,,,,
232,232,0.5961223660532884,2023-08-23 17:52:25.686198,2023-08-23 17:52:28.678100,0 days 00:00:02.991902,,0.7000000000000001,2.0,,LightGBM,,,,,0.5,,,,0.0034353902216040636,0.37583295703643643,,60.0,,,,,,,,,,199.0,,,,,,,,,COMPLETE,0.0,,,,,,,,,,,,,,,,,,,,
233,233,0.5688190980497357,2023-08-23 17:52:26.076766,2023-08-23 17:52:28.511750,0 days 00:00:02.434984,,0.7000000000000001,2.0,,LightGBM,,,,,0.5,,,,0.0022709473780568447,0.0002950271259085941,,70.0,,,,,,,,,,201.0,,,,,,,,,COMPLETE,0.0,,,,,,,,,,,,,,,,,,,,
234,234,0.5833109656639068,2023-08-23 17:52:26.236465,2023-08-23 17:52:27.806170,0 days 00:00:01.569705,,0.4,2.0,,LightGBM,,,,,0.6000000000000001,,,,0.0022378981394065747,0.00032852577273444086,,70.0,,,,,,,,,,211.0,,,,,,,,,COMPLETE,0.0,,,,,,,,,,,,,,,,,,,,
235,235,0.5830237421577069,2023-08-23 17:52:27.456596,2023-08-23 17:52:29.621152,0 days 00:00:02.164556,,0.4,2.0,,LightGBM,,,,,0.6000000000000001,,,,0.002900788331315639,0.20508419399099173,,70.0,,,,,,,,,,198.0,,,,,,,,,COMPLETE,0.0,,,,,,,,,,,,,,,,,,,,
236,236,0.5759434730226954,2023-08-23 17:52:27.879015,2023-08-23 17:52:30.115212,0 days 00:00:02.236197,,0.6000000000000001,2.0,,LightGBM,,,,,0.6000000000000001,,,,9.853699466339403e-05,0.9928345254437939,,80.0,,,,,,,,,,199.0,,,,,,,,,COMPLETE,0.0,,,,,,,,,,,,,,,,,,,,
237,237,0.575106140623382,2023-08-23 17:52:27.927593,2023-08-23 17:52:29.974905,0 days 00:00:02.047312,,0.6000000000000001,1.0,,LightGBM,,,,,0.6000000000000001,,,,0.14141895233645885,0.9522720166109443,,80.0,,,,,,,,,,171.0,,,,,,,,,COMPLETE,0.0,,,,,,,,,,,,,,,,,,,,
238,238,0.5780707196029777,2023-08-23 17:52:28.624709,2023-08-23 17:52:31.022251,0 days 00:00:02.397542,,0.7000000000000001,2.0,,LightGBM,,,,,0.5,,,,0.0011752360073409413,0.19177955856966108,,80.0,,,,,,,,,,247.0,,,,,,,,,COMPLETE,0.0,,,,,,,,,,,,,,,,,,,,
239,239,0.579345313955437,2023-08-23 17:52:28.889736,2023-08-23 17:52:31.429775,0 days 00:00:02.540039,,0.7000000000000001,2.0,,LightGBM,,,,,0.5,,,,0.0012116586116271632,0.9289935053498518,,80.0,,,,,,,,,,189.0,,,,,,,,,COMPLETE,0.0,,,,,,,,,,,,,,,,,,,,
240,240,0.593257576935234,2023-08-23 17:52:29.737074,2023-08-23 17:52:31.795661,0 days 00:00:02.058587,,0.7000000000000001,2.0,,LightGBM,,,,,0.4,,,,0.00026642097821870614,0.19544443836549744,,80.0,,,,,,,,,,189.0,,,,,,,,,COMPLETE,0.0,,,,,,,,,,,,,,,,,,,,
241,241,0.5598287934509338,2023-08-23 17:52:30.051425,2023-08-23 17:52:32.972029,0 days 00:00:02.920604,,0.7000000000000001,2.0,,LightGBM,,,,,0.4,,,,0.003625815037142809,0.1989918157098609,,60.0,,,,,,,,,,189.0,,,,,,,,,COMPLETE,0.0,,,,,,,,,,,,,,,,,,,,
242,242,0.5902174137468255,2023-08-23 17:52:30.196034,2023-08-23 17:52:32.855596,0 days 00:00:02.659562,,0.7000000000000001,2.0,,LightGBM,,,,,0.5,,,,0.001478078249912429,0.19501096524617748,,60.0,,,,,,,,,,205.0,,,,,,,,,COMPLETE,0.0,,,,,,,,,,,,,,,,,,,,
243,243,0.5716416629107377,2023-08-23 17:52:31.101666,2023-08-23 17:52:31.902553,0 days 00:00:00.800887,,0.7000000000000001,2.0,,LightGBM,,,,,0.5,,,,0.0037238094003757896,0.10200492460549182,,60.0,,,,,,,,,,4.0,,,,,,,,,COMPLETE,0.0,,,,,,,,,,,,,,,,,,,,
244,244,0.5783623179372105,2023-08-23 17:52:31.514451,2023-08-23 17:52:34.001023,0 days 00:00:02.486572,,0.7000000000000001,2.0,,LightGBM,,,,,0.4,,,,0.007443185941244845,0.009128263288646413,,60.0,,,,,,,,,,217.0,,,,,,,,,COMPLETE,0.0,,,,,,,,,,,,,,,,,,,,
245,245,0.5392871807858438,2023-08-23 17:52:31.870652,2023-08-23 17:52:32.542468,0 days 00:00:00.671816,,0.7000000000000001,2.0,,LightGBM,,,,,0.4,,,,0.4603287957521443,0.09910015342188538,,60.0,,,,,,,,,,2.0,,,,,,,,,COMPLETE,0.0,,,,,,,,,,,,,,,,,,,,
246,246,0.5951609621734979,2023-08-23 17:52:32.003277,2023-08-23 17:52:34.453641,0 days 00:00:02.450364,,0.7000000000000001,2.0,,LightGBM,,,,,0.4,,,,0.31491601862571245,0.07235003438295157,,60.0,,,,,,,,,,188.0,,,,,,,,,COMPLETE,0.0,,,,,,,,,,,,,,,,,,,,
247,247,0.5879273175238682,2023-08-23 17:52:32.609187,2023-08-23 17:52:35.426858,0 days 00:00:02.817671,,0.7000000000000001,2.0,,LightGBM,,,,,0.4,,,,0.2829599517927383,0.010020092555794268,,50.0,,,,,,,,,,189.0,,,,,,,,,COMPLETE,0.0,,,,,,,,,,,,,,,,,,,,
248,248,0.5797009962059747,2023-08-23 17:52:32.934412,2023-08-23 17:52:35.589483,0 days 00:00:02.655071,,0.7000000000000001,2.0,,LightGBM,,,,,0.4,,,,0.001546474816912444,0.17808624092441924,,60.0,,,,,,,,,,190.0,,,,,,,,,COMPLETE,0.0,,,,,,,,,,,,,,,,,,,,
249,249,0.5754106925175597,2023-08-23 17:52:33.061503,2023-08-23 17:52:35.771000,0 days 00:00:02.709497,,0.7000000000000001,2.0,,LightGBM,,,,,0.5,,,,0.8648017613680147,0.0022475870681771763,,60.0,,,,,,,,,,205.0,,,,,,,,,COMPLETE,0.0,,,,,,,,,,,,,,,,,,,,
