,number,value,datetime_start,datetime_complete,duration,params_alpha,params_bagging_fraction,params_bagging_freq,params_booster,params_classifier,params_colsample_bytree,params_dct_criterion,params_dct_max_depth,params_eta,params_feature_fraction,params_gamma,params_grow_policy,params_lambda,params_lambda_l1,params_lambda_l2,params_max_depth,params_min_child_samples,params_min_child_weight,params_mlp_activation,params_mlp_solver,params_n_layers,params_n_units_l_0,params_n_units_l_1,params_n_units_l_2,params_n_units_l_3,params_normalize_type,params_num_leaves,params_rate_drop,params_rf_estimator,params_rf_max_depth,params_sample_type,params_skip_drop,params_subsample,params_svc_c,params_svc_kernel,state,best_trial,dev_acc,dev_recall_macro,dev_precision_macro,dev_f1_macro,dev_recall_0,dev_precision_0,dev_f1_0,dev_recall_1,dev_precision_1,dev_f1_1,test_acc,test_recall_macro,test_precision_macro,test_f1_macro,test_recall_0,test_precision_0,test_f1_0,test_recall_1,test_precision_1,test_f1_1
167,167,0.7004608294930876,2023-08-23 17:41:46.050700,2023-08-23 17:41:47.314256,0 days 00:00:01.263556,,0.8,1.0,,LightGBM,,,,,1.0,,,,3.287929868086191e-08,5.308035959865854e-07,,40.0,,,,,,,,,,165.0,,,,,,,,,COMPLETE,0.0,,,,,,,,,,,,,,,,,,,,
168,168,0.7584204413472706,2023-08-23 17:41:46.101828,2023-08-23 17:41:46.909509,0 days 00:00:00.807681,,0.8,1.0,,LightGBM,,,,,0.4,,,,3.7719172241716975e-08,3.462982933726379e-08,,40.0,,,,,,,,,,165.0,,,,,,,,,COMPLETE,0.0,,,,,,,,,,,,,,,,,,,,
169,169,0.7004608294930876,2023-08-23 17:41:46.191809,2023-08-23 17:41:47.161620,0 days 00:00:00.969811,,0.8,1.0,,LightGBM,,,,,1.0,,,,5.179259142209775e-08,2.8602715152859936e-08,,40.0,,,,,,,,,,170.0,,,,,,,,,COMPLETE,0.0,,,,,,,,,,,,,,,,,,,,
170,170,0.7040525954273379,2023-08-23 17:41:46.237970,2023-08-23 17:41:47.227637,0 days 00:00:00.989667,,0.8,1.0,,LightGBM,,,,,0.9,,,,5.033727286157411e-08,3.36988480166067e-08,,40.0,,,,,,,,,,169.0,,,,,,,,,COMPLETE,0.0,,,,,,,,,,,,,,,,,,,,
171,171,0.7584204413472706,2023-08-23 17:41:46.445746,2023-08-23 17:41:47.097673,0 days 00:00:00.651927,,0.8,1.0,,LightGBM,,,,,0.4,,,,5.2763001123067744e-08,6.675860538285917e-07,,40.0,,,,,,,,,,170.0,,,,,,,,,COMPLETE,0.0,,,,,,,,,,,,,,,,,,,,
172,172,0.7004608294930876,2023-08-23 17:41:46.847667,2023-08-23 17:41:47.519654,0 days 00:00:00.671987,,0.8,1.0,,LightGBM,,,,,1.0,,,,5.079832604905938e-08,3.118653463421375e-08,,40.0,,,,,,,,,,172.0,,,,,,,,,COMPLETE,0.0,,,,,,,,,,,,,,,,,,,,
173,173,0.3696969696969697,2023-08-23 17:41:46.953868,2023-08-23 17:41:48.506131,0 days 00:00:01.552263,,,,,MLPClassifier,,,,,,,,,,,,,,logistic,sgd,1.0,10.0,,,,,,,,,,,,,,COMPLETE,0.0,,,,,,,,,,,,,,,,,,,,
174,174,0.3696969696969697,2023-08-23 17:41:46.997181,2023-08-23 17:41:48.182296,0 days 00:00:01.185115,,,,,MLPClassifier,,,,,,,,,,,,,,logistic,sgd,1.0,10.0,,,,,,,,,,,,,,COMPLETE,0.0,,,,,,,,,,,,,,,,,,,,
175,175,0.3696969696969697,2023-08-23 17:41:47.076396,2023-08-23 17:41:48.104154,0 days 00:00:01.027758,,,,,MLPClassifier,,,,,,,,,,,,,,tanh,sgd,1.0,10.0,,,,,,,,,,,,,,COMPLETE,0.0,,,,,,,,,,,,,,,,,,,,
176,176,0.3696969696969697,2023-08-23 17:41:47.149611,2023-08-23 17:41:48.261896,0 days 00:00:01.112285,,,,,MLPClassifier,,,,,,,,,,,,,,logistic,sgd,1.0,10.0,,,,,,,,,,,,,,COMPLETE,0.0,,,,,,,,,,,,,,,,,,,,
177,177,0.3696969696969697,2023-08-23 17:41:47.207161,2023-08-23 17:41:48.001383,0 days 00:00:00.794222,,,,,MLPClassifier,,,,,,,,,,,,,,tanh,sgd,1.0,10.0,,,,,,,,,,,,,,COMPLETE,0.0,,,,,,,,,,,,,,,,,,,,
178,178,0.3696969696969697,2023-08-23 17:41:47.270098,2023-08-23 17:41:48.671666,0 days 00:00:01.401568,,,,,MLPClassifier,,,,,,,,,,,,,,tanh,sgd,1.0,10.0,,,,,,,,,,,,,,COMPLETE,0.0,,,,,,,,,,,,,,,,,,,,
179,179,0.6163194444444444,2023-08-23 17:41:47.357999,2023-08-23 17:41:47.387347,0 days 00:00:00.029348,,,,,DecisionTreeClassifier,,gini,2.0,,,,,,,,,,,,,,,,,,,,,,,,,,,,COMPLETE,0.0,,,,,,,,,,,,,,,,,,,,
180,180,0.3696969696969697,2023-08-23 17:41:47.426666,2023-08-23 17:41:48.463140,0 days 00:00:01.036474,,,,,MLPClassifier,,,,,,,,,,,,,,tanh,sgd,1.0,20.0,,,,,,,,,,,,,,COMPLETE,0.0,,,,,,,,,,,,,,,,,,,,
181,181,0.6853569987898347,2023-08-23 17:41:47.561466,2023-08-23 17:41:48.718819,0 days 00:00:01.157353,,,,,RandomForestClassifier,,,,,,,,,,,,,,,,,,,,,,,,61.0,12.0,,,,,,COMPLETE,0.0,,,,,,,,,,,,,,,,,,,,
182,182,0.6728564180618974,2023-08-23 17:41:48.042945,2023-08-23 17:41:49.366983,0 days 00:00:01.324038,,,,,RandomForestClassifier,,,,,,,,,,,,,,,,,,,,,,,,56.0,10.0,,,,,,COMPLETE,0.0,,,,,,,,,,,,,,,,,,,,
183,183,0.6391394864677308,2023-08-23 17:41:48.144155,2023-08-23 17:41:49.789685,0 days 00:00:01.645530,,,,,RandomForestClassifier,,,,,,,,,,,,,,,,,,,,,,,,59.0,13.0,,,,,,COMPLETE,0.0,,,,,,,,,,,,,,,,,,,,
184,184,0.7010012887875483,2023-08-23 17:41:48.223153,2023-08-23 17:41:49.646718,0 days 00:00:01.423565,,,,,RandomForestClassifier,,,,,,,,,,,,,,,,,,,,,,,,58.0,13.0,,,,,,COMPLETE,0.0,,,,,,,,,,,,,,,,,,,,
185,185,0.7097288676236045,2023-08-23 17:41:48.303522,2023-08-23 17:41:49.575916,0 days 00:00:01.272394,,,,,RandomForestClassifier,,,,,,,,,,,,,,,,,,,,,,,,56.0,13.0,,,,,,COMPLETE,0.0,,,,,,,,,,,,,,,,,,,,
186,186,0.6889952153110048,2023-08-23 17:41:48.547077,2023-08-23 17:41:50.167013,0 days 00:00:01.619936,,,,,RandomForestClassifier,,,,,,,,,,,,,,,,,,,,,,,,59.0,13.0,,,,,,COMPLETE,0.0,,,,,,,,,,,,,,,,,,,,
187,187,0.7584204413472706,2023-08-23 17:41:48.550562,2023-08-23 17:41:49.142877,0 days 00:00:00.592315,,0.8,1.0,,LightGBM,,,,,0.4,,,,1.2578698013403573e-07,1.3997526432918702e-08,,40.0,,,,,,,,,,181.0,,,,,,,,,COMPLETE,0.0,,,,,,,,,,,,,,,,,,,,
188,188,0.7584204413472706,2023-08-23 17:41:48.716405,2023-08-23 17:41:49.279941,0 days 00:00:00.563536,,0.8,1.0,,LightGBM,,,,,0.4,,,,1.2528767918687689e-07,1.1535807381409021e-08,,40.0,,,,,,,,,,181.0,,,,,,,,,COMPLETE,0.0,,,,,,,,,,,,,,,,,,,,
189,189,0.7584204413472706,2023-08-23 17:41:48.766683,2023-08-23 17:41:49.227656,0 days 00:00:00.460973,,0.8,1.0,,LightGBM,,,,,0.4,,,,1.252120785427385e-07,1.6663546630181257e-08,,40.0,,,,,,,,,,182.0,,,,,,,,,COMPLETE,0.0,,,,,,,,,,,,,,,,,,,,
190,190,0.7584204413472706,2023-08-23 17:41:49.184986,2023-08-23 17:41:49.985743,0 days 00:00:00.800757,,0.8,1.0,,LightGBM,,,,,0.4,,,,1.1274491468639851e-07,1.2336706424913117e-08,,40.0,,,,,,,,,,159.0,,,,,,,,,COMPLETE,0.0,,,,,,,,,,,,,,,,,,,,
191,191,0.7584204413472706,2023-08-23 17:41:49.276562,2023-08-23 17:41:50.261515,0 days 00:00:00.984953,,0.8,1.0,,LightGBM,,,,,0.4,,,,1.4177604595544752e-07,1.260545928837007e-08,,40.0,,,,,,,,,,156.0,,,,,,,,,COMPLETE,0.0,,,,,,,,,,,,,,,,,,,,
192,192,0.7584204413472706,2023-08-23 17:41:49.324702,2023-08-23 17:41:50.049454,0 days 00:00:00.724752,,0.8,1.0,,LightGBM,,,,,0.4,,,,1.3057796326410457e-07,1.2731005686556705e-08,,40.0,,,,,,,,,,158.0,,,,,,,,,COMPLETE,0.0,,,,,,,,,,,,,,,,,,,,
193,193,0.7584204413472706,2023-08-23 17:41:49.411454,2023-08-23 17:41:50.215213,0 days 00:00:00.803759,,0.8,1.0,,LightGBM,,,,,0.4,,,,1.1958778632259715e-07,1.1578397555241094e-08,,40.0,,,,,,,,,,181.0,,,,,,,,,COMPLETE,0.0,,,,,,,,,,,,,,,,,,,,
194,194,0.7584204413472706,2023-08-23 17:41:49.620622,2023-08-23 17:41:50.497518,0 days 00:00:00.876896,,0.8,1.0,,LightGBM,,,,,0.4,,,,1.3165779965646614e-07,1.2995111284990838e-08,,40.0,,,,,,,,,,182.0,,,,,,,,,COMPLETE,0.0,,,,,,,,,,,,,,,,,,,,
195,195,0.7584204413472706,2023-08-23 17:41:49.691395,2023-08-23 17:41:50.550169,0 days 00:00:00.858774,,0.8,1.0,,LightGBM,,,,,0.4,,,,1.1468423948783889e-07,1.228018422163758e-08,,40.0,,,,,,,,,,180.0,,,,,,,,,COMPLETE,0.0,,,,,,,,,,,,,,,,,,,,
196,196,0.7584204413472706,2023-08-23 17:41:49.833701,2023-08-23 17:41:50.607014,0 days 00:00:00.773313,,0.8,1.0,,LightGBM,,,,,0.4,,,,1.0761345258671804e-07,1.2783041764005258e-08,,40.0,,,,,,,,,,182.0,,,,,,,,,COMPLETE,0.0,,,,,,,,,,,,,,,,,,,,
197,197,0.7584204413472706,2023-08-23 17:41:50.032802,2023-08-23 17:41:50.881158,0 days 00:00:00.848356,,0.8,1.0,,LightGBM,,,,,0.4,,,,1.4903026944904242e-07,1.5559440590611615e-08,,40.0,,,,,,,,,,182.0,,,,,,,,,COMPLETE,0.0,,,,,,,,,,,,,,,,,,,,
198,198,0.7584204413472706,2023-08-23 17:41:50.095669,2023-08-23 17:41:51.038626,0 days 00:00:00.942957,,0.8,1.0,,LightGBM,,,,,0.4,,,,1.1795987166069684e-07,1.3080944893100743e-08,,40.0,,,,,,,,,,199.0,,,,,,,,,COMPLETE,0.0,,,,,,,,,,,,,,,,,,,,
199,199,0.7584204413472706,2023-08-23 17:41:50.209860,2023-08-23 17:41:51.115988,0 days 00:00:00.906128,,0.8,1.0,,LightGBM,,,,,0.4,,,,1.1562212988480138e-07,1.25551895168584e-08,,40.0,,,,,,,,,,179.0,,,,,,,,,COMPLETE,0.0,,,,,,,,,,,,,,,,,,,,
200,200,0.7584204413472706,2023-08-23 17:41:50.258044,2023-08-23 17:41:51.243671,0 days 00:00:00.985627,,0.8,1.0,,LightGBM,,,,,0.4,,,,1.3218192481303392e-07,1.1978879472883212e-08,,40.0,,,,,,,,,,181.0,,,,,,,,,COMPLETE,0.0,,,,,,,,,,,,,,,,,,,,
201,201,0.7584204413472706,2023-08-23 17:41:50.306349,2023-08-23 17:41:51.354429,0 days 00:00:01.048080,,0.8,1.0,,LightGBM,,,,,0.4,,,,1.453114374717918e-07,1.1664057829439503e-08,,40.0,,,,,,,,,,182.0,,,,,,,,,COMPLETE,0.0,,,,,,,,,,,,,,,,,,,,
202,202,0.7584204413472706,2023-08-23 17:41:50.542048,2023-08-23 17:41:51.418607,0 days 00:00:00.876559,,0.8,1.0,,LightGBM,,,,,0.4,,,,1.3224387953955005e-07,1.1136251785879055e-08,,40.0,,,,,,,,,,181.0,,,,,,,,,COMPLETE,0.0,,,,,,,,,,,,,,,,,,,,
203,203,0.7584204413472706,2023-08-23 17:41:50.595205,2023-08-23 17:41:51.538522,0 days 00:00:00.943317,,0.8,1.0,,LightGBM,,,,,0.4,,,,1.3281275547223722e-07,1.2049235526046357e-08,,40.0,,,,,,,,,,196.0,,,,,,,,,COMPLETE,0.0,,,,,,,,,,,,,,,,,,,,
204,204,0.7584204413472706,2023-08-23 17:41:50.656158,2023-08-23 17:41:51.496446,0 days 00:00:00.840288,,0.8,1.0,,LightGBM,,,,,0.4,,,,1.8043720984936889e-07,1.1710561190093555e-08,,40.0,,,,,,,,,,179.0,,,,,,,,,COMPLETE,0.0,,,,,,,,,,,,,,,,,,,,
205,205,0.7584204413472706,2023-08-23 17:41:50.922283,2023-08-23 17:41:51.646324,0 days 00:00:00.724041,,0.8,1.0,,LightGBM,,,,,0.4,,,,2.7434177280901803e-07,1.1941400600777928e-08,,40.0,,,,,,,,,,197.0,,,,,,,,,COMPLETE,0.0,,,,,,,,,,,,,,,,,,,,
206,206,0.7584204413472706,2023-08-23 17:41:51.082741,2023-08-23 17:41:51.810678,0 days 00:00:00.727937,,0.8,1.0,,LightGBM,,,,,0.4,,,,2.1736148361555527e-07,1.1706099218206618e-08,,40.0,,,,,,,,,,184.0,,,,,,,,,COMPLETE,0.0,,,,,,,,,,,,,,,,,,,,
207,207,0.7584204413472706,2023-08-23 17:41:51.156307,2023-08-23 17:41:51.965563,0 days 00:00:00.809256,,0.8,1.0,,LightGBM,,,,,0.4,,,,2.57336026768589e-07,1.0050692833078306e-08,,40.0,,,,,,,,,,174.0,,,,,,,,,COMPLETE,0.0,,,,,,,,,,,,,,,,,,,,
208,208,0.7584204413472706,2023-08-23 17:41:51.287287,2023-08-23 17:41:52.138400,0 days 00:00:00.851113,,0.8,1.0,,LightGBM,,,,,0.4,,,,2.5094227457079426e-07,1.0274515282804186e-08,,40.0,,,,,,,,,,193.0,,,,,,,,,COMPLETE,0.0,,,,,,,,,,,,,,,,,,,,
209,209,0.7584204413472706,2023-08-23 17:41:51.397551,2023-08-23 17:41:52.394647,0 days 00:00:00.997096,,0.8,1.0,,LightGBM,,,,,0.4,,,,2.8849942903462476e-07,1.9047181224982565e-08,,40.0,,,,,,,,,,174.0,,,,,,,,,COMPLETE,0.0,,,,,,,,,,,,,,,,,,,,
210,210,0.7584204413472706,2023-08-23 17:41:51.462196,2023-08-23 17:41:52.486808,0 days 00:00:01.024612,,0.8,1.0,,LightGBM,,,,,0.4,,,,2.69162323623377e-07,1.828206406891005e-08,,40.0,,,,,,,,,,196.0,,,,,,,,,COMPLETE,0.0,,,,,,,,,,,,,,,,,,,,
211,211,0.7584204413472706,2023-08-23 17:41:51.539655,2023-08-23 17:41:52.604462,0 days 00:00:01.064807,,0.8,1.0,,LightGBM,,,,,0.4,,,,2.1909354157096915e-07,1.8751752464558266e-08,,40.0,,,,,,,,,,174.0,,,,,,,,,COMPLETE,0.0,,,,,,,,,,,,,,,,,,,,
212,212,0.7584204413472706,2023-08-23 17:41:51.587045,2023-08-23 17:41:52.605238,0 days 00:00:01.018193,,0.8,1.0,,LightGBM,,,,,0.4,,,,3.428193506110445e-07,1.998406393836363e-08,,40.0,,,,,,,,,,186.0,,,,,,,,,COMPLETE,0.0,,,,,,,,,,,,,,,,,,,,
213,213,0.7584204413472706,2023-08-23 17:41:51.691696,2023-08-23 17:41:52.722890,0 days 00:00:01.031194,,0.8,1.0,,LightGBM,,,,,0.4,,,,2.669834644012357e-07,1.9861250098648238e-08,,40.0,,,,,,,,,,173.0,,,,,,,,,COMPLETE,0.0,,,,,,,,,,,,,,,,,,,,
214,214,0.7584204413472706,2023-08-23 17:41:51.861643,2023-08-23 17:41:52.802058,0 days 00:00:00.940415,,0.8,1.0,,LightGBM,,,,,0.4,,,,6.933316560340144e-08,1.9444960815861037e-08,,40.0,,,,,,,,,,172.0,,,,,,,,,COMPLETE,0.0,,,,,,,,,,,,,,,,,,,,
215,215,0.715625,2023-08-23 17:41:52.016896,2023-08-23 17:41:52.802876,0 days 00:00:00.785980,,0.8,2.0,,LightGBM,,,,,0.4,,,,5.817629426600493e-08,1.847296870587306e-08,,40.0,,,,,,,,,,160.0,,,,,,,,,COMPLETE,0.0,,,,,,,,,,,,,,,,,,,,
216,216,0.715625,2023-08-23 17:41:52.181648,2023-08-23 17:41:52.890987,0 days 00:00:00.709339,,0.8,2.0,,LightGBM,,,,,0.4,,,,6.601482680958528e-08,1.861741775653311e-08,,40.0,,,,,,,,,,160.0,,,,,,,,,COMPLETE,0.0,,,,,,,,,,,,,,,,,,,,
217,217,0.7584204413472706,2023-08-23 17:41:52.433920,2023-08-23 17:41:53.160139,0 days 00:00:00.726219,,0.8,1.0,,LightGBM,,,,,0.4,,,,6.038950032311803e-08,1.8210272357467782e-08,,40.0,,,,,,,,,,159.0,,,,,,,,,COMPLETE,0.0,,,,,,,,,,,,,,,,,,,,
218,218,0.715625,2023-08-23 17:41:52.527119,2023-08-23 17:41:53.447879,0 days 00:00:00.920760,,0.8,2.0,,LightGBM,,,,,0.4,,,,6.02822505486116e-08,1.8483534749437052e-08,,40.0,,,,,,,,,,159.0,,,,,,,,,COMPLETE,0.0,,,,,,,,,,,,,,,,,,,,
219,219,0.7584204413472706,2023-08-23 17:41:52.687680,2023-08-23 17:41:53.794966,0 days 00:00:01.107286,,0.8,1.0,,LightGBM,,,,,0.4,,,,6.703706555005039e-08,1.7788887782775842e-08,,40.0,,,,,,,,,,159.0,,,,,,,,,COMPLETE,0.0,,,,,,,,,,,,,,,,,,,,
220,220,0.7584204413472706,2023-08-23 17:41:52.691120,2023-08-23 17:41:53.686995,0 days 00:00:00.995875,,0.8,1.0,,LightGBM,,,,,0.4,,,,6.50176883511361e-08,1.8340358278778735e-08,,40.0,,,,,,,,,,161.0,,,,,,,,,COMPLETE,0.0,,,,,,,,,,,,,,,,,,,,
221,221,0.7584204413472706,2023-08-23 17:41:52.768703,2023-08-23 17:41:53.744943,0 days 00:00:00.976240,,0.8,1.0,,LightGBM,,,,,0.4,,,,7.998342418221947e-08,1.7691618275145446e-08,,40.0,,,,,,,,,,161.0,,,,,,,,,COMPLETE,0.0,,,,,,,,,,,,,,,,,,,,
222,222,0.7584204413472706,2023-08-23 17:41:52.887584,2023-08-23 17:41:53.859095,0 days 00:00:00.971511,,0.8,1.0,,LightGBM,,,,,0.4,,,,9.077500456409822e-08,4.562541052146198e-08,,40.0,,,,,,,,,,158.0,,,,,,,,,COMPLETE,0.0,,,,,,,,,,,,,,,,,,,,
223,223,0.7584204413472706,2023-08-23 17:41:52.933100,2023-08-23 17:41:53.972719,0 days 00:00:01.039619,,0.8,1.0,,LightGBM,,,,,0.4,,,,9.221669373532232e-08,4.3778770900972e-08,,40.0,,,,,,,,,,155.0,,,,,,,,,COMPLETE,0.0,,,,,,,,,,,,,,,,,,,,
224,224,0.7584204413472706,2023-08-23 17:41:52.938494,2023-08-23 17:41:53.921819,0 days 00:00:00.983325,,0.8,1.0,,LightGBM,,,,,0.4,,,,9.53175966095782e-08,3.8687002360660887e-08,,40.0,,,,,,,,,,207.0,,,,,,,,,COMPLETE,0.0,,,,,,,,,,,,,,,,,,,,
225,225,0.7584204413472706,2023-08-23 17:41:53.200062,2023-08-23 17:41:54.049680,0 days 00:00:00.849618,,0.8,1.0,,LightGBM,,,,,0.4,,,,1.0412594029983676e-07,4.739205469559695e-08,,40.0,,,,,,,,,,153.0,,,,,,,,,COMPLETE,0.0,,,,,,,,,,,,,,,,,,,,
226,226,0.6889952153110048,2023-08-23 17:41:53.488568,2023-08-23 17:41:54.164836,0 days 00:00:00.676268,,0.8,1.0,,LightGBM,,,,,0.4,,,,9.771402058373118e-08,3.80730747402543e-08,,50.0,,,,,,,,,,189.0,,,,,,,,,COMPLETE,0.0,,,,,,,,,,,,,,,,,,,,
227,227,0.7304625199362041,2023-08-23 17:41:53.728538,2023-08-23 17:41:54.941623,0 days 00:00:01.213085,,0.8,1.0,,LightGBM,,,,,0.6000000000000001,,,,1.0169117849713461e-07,4.057359205983961e-08,,50.0,,,,,,,,,,191.0,,,,,,,,,COMPLETE,0.0,,,,,,,,,,,,,,,,,,,,
228,228,0.6980255516840882,2023-08-23 17:41:53.788619,2023-08-23 17:41:54.996512,0 days 00:00:01.207893,,0.8,1.0,,LightGBM,,,,,0.6000000000000001,,,,9.940516083010262e-08,3.453238981859831e-08,,40.0,,,,,,,,,,223.0,,,,,,,,,COMPLETE,0.0,,,,,,,,,,,,,,,,,,,,
229,229,0.7584204413472706,2023-08-23 17:41:53.834046,2023-08-23 17:41:55.210874,0 days 00:00:01.376828,,0.8,1.0,,LightGBM,,,,,0.4,,,,1.0572291797333121e-07,4.349203298318536e-08,,40.0,,,,,,,,,,191.0,,,,,,,,,COMPLETE,0.0,,,,,,,,,,,,,,,,,,,,
230,230,0.6889952153110048,2023-08-23 17:41:53.907488,2023-08-23 17:41:55.065783,0 days 00:00:01.158295,,0.8,1.0,,LightGBM,,,,,0.4,,,,1.1430260583917984e-07,3.0542215763377573e-08,,50.0,,,,,,,,,,227.0,,,,,,,,,COMPLETE,0.0,,,,,,,,,,,,,,,,,,,,
231,231,0.6889952153110048,2023-08-23 17:41:53.965734,2023-08-23 17:41:54.668919,0 days 00:00:00.703185,,0.8,1.0,,LightGBM,,,,,0.4,,,,1.527545145180825e-07,2.55425896974498e-08,,50.0,,,,,,,,,,188.0,,,,,,,,,COMPLETE,0.0,,,,,,,,,,,,,,,,,,,,
232,232,0.6889952153110048,2023-08-23 17:41:54.037520,2023-08-23 17:41:54.762270,0 days 00:00:00.724750,,0.8,1.0,,LightGBM,,,,,0.4,,,,1.5637421575269654e-07,2.8692384655750928e-08,,50.0,,,,,,,,,,189.0,,,,,,,,,COMPLETE,0.0,,,,,,,,,,,,,,,,,,,,
233,233,0.6889952153110048,2023-08-23 17:41:54.097274,2023-08-23 17:41:54.868826,0 days 00:00:00.771552,,0.8,1.0,,LightGBM,,,,,0.4,,,,1.6639122849978817e-07,2.8685590962141225e-08,,50.0,,,,,,,,,,213.0,,,,,,,,,COMPLETE,0.0,,,,,,,,,,,,,,,,,,,,
234,234,0.7584204413472706,2023-08-23 17:41:54.211942,2023-08-23 17:41:55.119672,0 days 00:00:00.907730,,0.8,1.0,,LightGBM,,,,,0.4,,,,1.5855471974774736e-07,2.8873140569225313e-08,,40.0,,,,,,,,,,214.0,,,,,,,,,COMPLETE,0.0,,,,,,,,,,,,,,,,,,,,
235,235,0.7584204413472706,2023-08-23 17:41:54.709615,2023-08-23 17:41:55.506335,0 days 00:00:00.796720,,0.8,1.0,,LightGBM,,,,,0.4,,,,3.7546862909601525e-08,3.035574816955549e-08,,40.0,,,,,,,,,,169.0,,,,,,,,,COMPLETE,0.0,,,,,,,,,,,,,,,,,,,,
236,236,0.7584204413472706,2023-08-23 17:41:54.803032,2023-08-23 17:41:56.026568,0 days 00:00:01.223536,,0.8,1.0,,LightGBM,,,,,0.4,,,,4.23203149798324e-08,1.4692889841997277e-08,,40.0,,,,,,,,,,168.0,,,,,,,,,COMPLETE,0.0,,,,,,,,,,,,,,,,,,,,
237,237,0.7584204413472706,2023-08-23 17:41:54.911990,2023-08-23 17:41:55.932685,0 days 00:00:01.020695,,0.8,1.0,,LightGBM,,,,,0.4,,,,4.335840700623094e-08,1.3979714042041789e-08,,40.0,,,,,,,,,,168.0,,,,,,,,,COMPLETE,0.0,,,,,,,,,,,,,,,,,,,,
238,238,0.7584204413472706,2023-08-23 17:41:54.989605,2023-08-23 17:41:56.237882,0 days 00:00:01.248277,,0.8,1.0,,LightGBM,,,,,0.4,,,,4.27233178206423e-08,1.263579517298267e-08,,40.0,,,,,,,,,,168.0,,,,,,,,,COMPLETE,0.0,,,,,,,,,,,,,,,,,,,,
239,239,0.7584204413472706,2023-08-23 17:41:55.044174,2023-08-23 17:41:56.192154,0 days 00:00:01.147980,,0.8,1.0,,LightGBM,,,,,0.4,,,,3.9203861783363284e-08,1.4207631918676402e-08,,40.0,,,,,,,,,,168.0,,,,,,,,,COMPLETE,0.0,,,,,,,,,,,,,,,,,,,,
240,240,0.7584204413472706,2023-08-23 17:41:55.112893,2023-08-23 17:41:56.419697,0 days 00:00:01.306804,,0.8,1.0,,LightGBM,,,,,0.4,,,,4.033890156625873e-08,1.3776654762351894e-08,,40.0,,,,,,,,,,167.0,,,,,,,,,COMPLETE,0.0,,,,,,,,,,,,,,,,,,,,
241,241,0.7181571815718157,2023-08-23 17:41:55.166584,2023-08-23 17:41:55.320761,0 days 00:00:00.154177,,,,,DecisionTreeClassifier,,log_loss,30.0,,,,,,,,,,,,,,,,,,,,,,,,,,,,COMPLETE,0.0,,,,,,,,,,,,,,,,,,,,
242,242,0.7584204413472706,2023-08-23 17:41:55.273552,2023-08-23 17:41:56.106727,0 days 00:00:00.833175,,0.8,1.0,,LightGBM,,,,,0.4,,,,4.070690864429946e-08,1.3979609302326098e-08,,40.0,,,,,,,,,,179.0,,,,,,,,,COMPLETE,0.0,,,,,,,,,,,,,,,,,,,,
243,243,0.7584204413472706,2023-08-23 17:41:55.365549,2023-08-23 17:41:56.295971,0 days 00:00:00.930422,,0.8,1.0,,LightGBM,,,,,0.4,,,,4.146402971028098e-08,1.4363825517732388e-08,,40.0,,,,,,,,,,178.0,,,,,,,,,COMPLETE,0.0,,,,,,,,,,,,,,,,,,,,
244,244,0.7584204413472706,2023-08-23 17:41:55.549383,2023-08-23 17:41:56.377337,0 days 00:00:00.827954,,0.8,1.0,,LightGBM,,,,,0.4,,,,4.306183990759425e-08,1.3774344539578316e-08,,40.0,,,,,,,,,,181.0,,,,,,,,,COMPLETE,0.0,,,,,,,,,,,,,,,,,,,,
245,245,0.7584204413472706,2023-08-23 17:41:55.975481,2023-08-23 17:41:56.742583,0 days 00:00:00.767102,,0.8,1.0,,LightGBM,,,,,0.4,,,,3.2976048708520785e-08,1.346725270856846e-08,,40.0,,,,,,,,,,178.0,,,,,,,,,COMPLETE,0.0,,,,,,,,,,,,,,,,,,,,
246,246,0.7584204413472706,2023-08-23 17:41:56.069148,2023-08-23 17:41:57.037463,0 days 00:00:00.968315,,0.8,1.0,,LightGBM,,,,,0.4,,,,4.0906398386301337e-07,1.0223125732987399e-08,,40.0,,,,,,,,,,178.0,,,,,,,,,COMPLETE,0.0,,,,,,,,,,,,,,,,,,,,
247,247,0.6865947312141538,2023-08-23 17:41:56.147594,2023-08-23 17:41:56.953752,0 days 00:00:00.806158,,0.8,1.0,,LightGBM,,,,,0.8,,,,4.33815401389843e-07,1.3111936008832017e-08,,40.0,,,,,,,,,,177.0,,,,,,,,,COMPLETE,0.0,,,,,,,,,,,,,,,,,,,,
248,248,0.7584204413472706,2023-08-23 17:41:56.236824,2023-08-23 17:41:56.910193,0 days 00:00:00.673369,,0.8,1.0,,LightGBM,,,,,0.4,,,,4.256769467116108e-07,1.0568004476947218e-08,,40.0,,,,,,,,,,181.0,,,,,,,,,COMPLETE,0.0,,,,,,,,,,,,,,,,,,,,
249,249,0.7584204413472706,2023-08-23 17:41:56.282720,2023-08-23 17:41:56.994904,0 days 00:00:00.712184,,0.8,1.0,,LightGBM,,,,,0.4,,,,1.4111176921697684e-07,1.0329410516551672e-08,,40.0,,,,,,,,,,180.0,,,,,,,,,COMPLETE,0.0,,,,,,,,,,,,,,,,,,,,
