,number,value,datetime_start,datetime_complete,duration,params_alpha,params_bagging_fraction,params_bagging_freq,params_booster,params_classifier,params_colsample_bytree,params_dct_criterion,params_dct_max_depth,params_eta,params_feature_fraction,params_gamma,params_grow_policy,params_lambda,params_lambda_l1,params_lambda_l2,params_max_depth,params_min_child_samples,params_min_child_weight,params_mlp_activation,params_mlp_solver,params_n_layers,params_n_units_l_0,params_n_units_l_1,params_n_units_l_2,params_n_units_l_3,params_normalize_type,params_num_leaves,params_rate_drop,params_rf_estimator,params_rf_max_depth,params_sample_type,params_skip_drop,params_subsample,params_svc_c,params_svc_kernel,state,best_trial,dev_acc,dev_recall_macro,dev_precision_macro,dev_f1_macro,dev_recall_0,dev_precision_0,dev_f1_0,dev_recall_1,dev_precision_1,dev_f1_1,test_acc,test_recall_macro,test_precision_macro,test_f1_macro,test_recall_0,test_precision_0,test_f1_0,test_recall_1,test_precision_1,test_f1_1
170,170,0.7135877011626944,2023-08-23 19:14:04.348938,2023-08-23 19:14:06.674015,0 days 00:00:02.325077,,0.9,1.0,,LightGBM,,,,,0.7000000000000001,,,,0.21419912758142043,3.923372648255328e-08,,90.0,,,,,,,,,,101.0,,,,,,,,,COMPLETE,0.0,,,,,,,,,,,,,,,,,,,,
171,171,0.711565339046098,2023-08-23 19:14:06.105838,2023-08-23 19:14:08.331447,0 days 00:00:02.225609,,0.9,1.0,,LightGBM,,,,,0.7000000000000001,,,,0.07084950204987996,3.209922045371688e-08,,90.0,,,,,,,,,,206.0,,,,,,,,,COMPLETE,0.0,,,,,,,,,,,,,,,,,,,,
172,172,0.7082156912873663,2023-08-23 19:14:06.792851,2023-08-23 19:14:10.077319,0 days 00:00:03.284468,,0.9,1.0,,LightGBM,,,,,0.7000000000000001,,,,0.0663715973141954,5.017407983249795e-07,,50.0,,,,,,,,,,180.0,,,,,,,,,COMPLETE,0.0,,,,,,,,,,,,,,,,,,,,
173,173,0.7201900574526636,2023-08-23 19:14:08.497026,2023-08-23 19:14:11.898232,0 days 00:00:03.401206,,0.9,1.0,,LightGBM,,,,,0.5,,,,0.02130676676277915,1.0491218748184468e-08,,50.0,,,,,,,,,,183.0,,,,,,,,,COMPLETE,0.0,,,,,,,,,,,,,,,,,,,,
174,174,0.7149539032902227,2023-08-23 19:14:10.153003,2023-08-23 19:14:13.309765,0 days 00:00:03.156762,,0.5,1.0,,LightGBM,,,,,0.5,,,,0.36168094170710957,1.0200672969160357e-08,,30.0,,,,,,,,,,194.0,,,,,,,,,COMPLETE,0.0,,,,,,,,,,,,,,,,,,,,
175,175,0.7052484171780974,2023-08-23 19:14:11.987137,2023-08-23 19:14:15.159381,0 days 00:00:03.172244,,0.9,1.0,,LightGBM,,,,,0.5,,,,0.019114570255906047,1.091330152325401e-08,,50.0,,,,,,,,,,195.0,,,,,,,,,COMPLETE,0.0,,,,,,,,,,,,,,,,,,,,
176,176,0.7124578310610272,2023-08-23 19:14:13.422096,2023-08-23 19:14:16.582922,0 days 00:00:03.160826,,0.9,1.0,,LightGBM,,,,,0.5,,,,0.01743674611136905,2.459552363753862e-08,,50.0,,,,,,,,,,184.0,,,,,,,,,COMPLETE,0.0,,,,,,,,,,,,,,,,,,,,
177,177,0.7062148158103002,2023-08-23 19:14:15.403327,2023-08-23 19:14:18.554033,0 days 00:00:03.150706,,1.0,3.0,,LightGBM,,,,,0.8,,,,0.003363280388898451,2.3806944230550256e-08,,50.0,,,,,,,,,,186.0,,,,,,,,,COMPLETE,0.0,,,,,,,,,,,,,,,,,,,,
178,178,0.7185668254413,2023-08-23 19:14:16.662811,2023-08-23 19:14:19.553739,0 days 00:00:02.890928,,0.9,1.0,,LightGBM,,,,,0.7000000000000001,,,,0.010793437212596275,1.7242015141209365e-07,,50.0,,,,,,,,,,170.0,,,,,,,,,COMPLETE,0.0,,,,,,,,,,,,,,,,,,,,
179,179,0.7119981557667754,2023-08-23 19:14:18.666130,2023-08-23 19:14:22.522134,0 days 00:00:03.856004,,0.9,1.0,,LightGBM,,,,,0.7000000000000001,,,,0.005548200420351491,7.616258474553812e-07,,40.0,,,,,,,,,,169.0,,,,,,,,,COMPLETE,0.0,,,,,,,,,,,,,,,,,,,,
180,180,0.7182725156375528,2023-08-23 19:14:19.642797,2023-08-23 19:14:22.523438,0 days 00:00:02.880641,,0.9,1.0,,LightGBM,,,,,0.7000000000000001,,,,0.005149017265826567,1.658151200654985e-07,,50.0,,,,,,,,,,170.0,,,,,,,,,COMPLETE,0.0,,,,,,,,,,,,,,,,,,,,
181,181,0.7182243879443027,2023-08-23 19:14:22.669129,2023-08-23 19:14:25.075252,0 days 00:00:02.406123,,0.9,1.0,,LightGBM,,,,,0.6000000000000001,,,,0.010602340808272432,1.3460364381716874e-07,,60.0,,,,,,,,,,178.0,,,,,,,,,COMPLETE,0.0,,,,,,,,,,,,,,,,,,,,
182,182,0.7182243879443027,2023-08-23 19:14:22.672761,2023-08-23 19:14:25.269050,0 days 00:00:02.596289,,0.9,1.0,,LightGBM,,,,,0.6000000000000001,,,,0.010717803810365413,1.675435029770349e-07,,60.0,,,,,,,,,,175.0,,,,,,,,,COMPLETE,0.0,,,,,,,,,,,,,,,,,,,,
183,183,0.7159450769486282,2023-08-23 19:14:25.194814,2023-08-23 19:14:27.988551,0 days 00:00:02.793737,,0.9,1.0,,LightGBM,,,,,0.5,,,,0.01204063438763324,1.6474932812397424e-07,,60.0,,,,,,,,,,173.0,,,,,,,,,COMPLETE,0.0,,,,,,,,,,,,,,,,,,,,
184,184,0.7154901956668325,2023-08-23 19:14:25.345575,2023-08-23 19:14:28.238926,0 days 00:00:02.893351,,0.9,1.0,,LightGBM,,,,,0.6000000000000001,,,,0.011474370867081736,1.864421315246006e-07,,60.0,,,,,,,,,,175.0,,,,,,,,,COMPLETE,0.0,,,,,,,,,,,,,,,,,,,,
185,185,0.7039189302834077,2023-08-23 19:14:28.099272,2023-08-23 19:14:29.697871,0 days 00:00:01.598599,,,,,RandomForestClassifier,,,,,,,,,,,,,,,,,,,,,,,,41.0,5.0,,,,,,COMPLETE,0.0,,,,,,,,,,,,,,,,,,,,
186,186,0.7072149911308426,2023-08-23 19:14:28.314391,2023-08-23 19:14:30.508328,0 days 00:00:02.193937,,,,,RandomForestClassifier,,,,,,,,,,,,,,,,,,,,,,,,40.0,5.0,,,,,,COMPLETE,0.0,,,,,,,,,,,,,,,,,,,,
187,187,0.6967627460850008,2023-08-23 19:14:29.797302,2023-08-23 19:14:30.077900,0 days 00:00:00.280598,,,,,DecisionTreeClassifier,,log_loss,2.0,,,,,,,,,,,,,,,,,,,,,,,,,,,,COMPLETE,0.0,,,,,,,,,,,,,,,,,,,,
188,188,0.7196486353765807,2023-08-23 19:14:30.153943,2023-08-23 19:14:32.642253,0 days 00:00:02.488310,,0.9,1.0,,LightGBM,,,,,0.6000000000000001,,,,0.006886064434865569,1.2487611618579192e-07,,60.0,,,,,,,,,,161.0,,,,,,,,,COMPLETE,0.0,,,,,,,,,,,,,,,,,,,,
189,189,0.7132988527079664,2023-08-23 19:14:30.595577,2023-08-23 19:14:32.901289,0 days 00:00:02.305712,,0.9,1.0,,LightGBM,,,,,0.6000000000000001,,,,0.006622083766434151,2.780331248075478e-07,,60.0,,,,,,,,,,169.0,,,,,,,,,COMPLETE,0.0,,,,,,,,,,,,,,,,,,,,
190,190,0.7106249817759815,2023-08-23 19:14:32.733447,2023-08-23 19:14:35.399795,0 days 00:00:02.666348,,0.9,1.0,,LightGBM,,,,,0.6000000000000001,,,,0.006234868803409952,1.1875662523039714e-07,,60.0,,,,,,,,,,161.0,,,,,,,,,COMPLETE,0.0,,,,,,,,,,,,,,,,,,,,
191,191,0.7076718481145556,2023-08-23 19:14:32.985820,2023-08-23 19:14:35.602609,0 days 00:00:02.616789,,0.9,1.0,,LightGBM,,,,,0.6000000000000001,,,,0.004722456025968095,9.648381960598878e-08,,60.0,,,,,,,,,,158.0,,,,,,,,,COMPLETE,0.0,,,,,,,,,,,,,,,,,,,,
192,192,0.7111142109103396,2023-08-23 19:14:35.473498,2023-08-23 19:14:38.602516,0 days 00:00:03.129018,,0.9,1.0,,LightGBM,,,,,0.6000000000000001,,,,0.004196325431577451,8.041319038148328e-08,,60.0,,,,,,,,,,151.0,,,,,,,,,COMPLETE,0.0,,,,,,,,,,,,,,,,,,,,
193,193,0.7182875028727889,2023-08-23 19:14:35.687736,2023-08-23 19:14:38.859702,0 days 00:00:03.171966,,0.9,1.0,,LightGBM,,,,,0.6000000000000001,,,,0.0040240966755021096,2.668366430006959e-07,,50.0,,,,,,,,,,150.0,,,,,,,,,COMPLETE,0.0,,,,,,,,,,,,,,,,,,,,
194,194,0.7164097074301503,2023-08-23 19:14:38.693772,2023-08-23 19:14:41.855275,0 days 00:00:03.161503,,0.9,1.0,,LightGBM,,,,,0.6000000000000001,,,,0.009790398229285761,3.040536880439536e-07,,50.0,,,,,,,,,,179.0,,,,,,,,,COMPLETE,0.0,,,,,,,,,,,,,,,,,,,,
195,195,0.7182570008547544,2023-08-23 19:14:38.953168,2023-08-23 19:14:42.328695,0 days 00:00:03.375527,,0.9,1.0,,LightGBM,,,,,0.6000000000000001,,,,0.0031514445417215715,2.8821609397090367e-07,,50.0,,,,,,,,,,146.0,,,,,,,,,COMPLETE,0.0,,,,,,,,,,,,,,,,,,,,
196,196,0.7182570008547544,2023-08-23 19:14:40.691351,2023-08-23 19:14:43.896291,0 days 00:00:03.204940,,0.9,1.0,,LightGBM,,,,,0.6000000000000001,,,,0.003077940331700204,2.837188332362929e-07,,50.0,,,,,,,,,,178.0,,,,,,,,,COMPLETE,0.0,,,,,,,,,,,,,,,,,,,,
197,197,0.7090499296161185,2023-08-23 19:14:41.918368,2023-08-23 19:14:45.111228,0 days 00:00:03.192860,,0.9,1.0,,LightGBM,,,,,0.6000000000000001,,,,0.01850057847199176,1.5528976378039972e-07,,50.0,,,,,,,,,,147.0,,,,,,,,,COMPLETE,0.0,,,,,,,,,,,,,,,,,,,,
198,198,0.7158485705485398,2023-08-23 19:14:42.392844,2023-08-23 19:14:45.812075,0 days 00:00:03.419231,,0.9,1.0,,LightGBM,,,,,0.6000000000000001,,,,0.002937379351421549,1.4045279283138196e-07,,50.0,,,,,,,,,,145.0,,,,,,,,,COMPLETE,0.0,,,,,,,,,,,,,,,,,,,,
199,199,0.7115785269775123,2023-08-23 19:14:43.961762,2023-08-23 19:14:47.108693,0 days 00:00:03.146931,,0.9,1.0,,LightGBM,,,,,0.6000000000000001,,,,0.0026132070713705386,1.5186509008174757e-07,,50.0,,,,,,,,,,148.0,,,,,,,,,COMPLETE,0.0,,,,,,,,,,,,,,,,,,,,
200,200,0.7071167065570894,2023-08-23 19:14:45.248589,2023-08-23 19:14:48.266274,0 days 00:00:03.017685,,0.9,1.0,,LightGBM,,,,,0.6000000000000001,,,,0.0033411768750647164,2.5296804592528653e-07,,50.0,,,,,,,,,,165.0,,,,,,,,,COMPLETE,0.0,,,,,,,,,,,,,,,,,,,,
201,201,0.7125694378840732,2023-08-23 19:14:45.959307,2023-08-23 19:14:49.245178,0 days 00:00:03.285871,,0.9,1.0,,LightGBM,,,,,0.6000000000000001,,,,0.002328582464352573,2.2811016457612355e-07,,50.0,,,,,,,,,,165.0,,,,,,,,,COMPLETE,0.0,,,,,,,,,,,,,,,,,,,,
202,202,0.713007997312455,2023-08-23 19:14:47.217672,2023-08-23 19:14:50.193192,0 days 00:00:02.975520,,0.9,1.0,,LightGBM,,,,,0.6000000000000001,,,,0.0018663829331846957,2.395026602052185e-07,,50.0,,,,,,,,,,164.0,,,,,,,,,COMPLETE,0.0,,,,,,,,,,,,,,,,,,,,
203,203,0.7147393575594806,2023-08-23 19:14:47.449322,2023-08-23 19:14:50.335763,0 days 00:00:02.886441,,0.9,1.0,,LightGBM,,,,,0.6000000000000001,,,,0.0036960252949066906,2.2959776061702787e-07,,50.0,,,,,,,,,,165.0,,,,,,,,,COMPLETE,0.0,,,,,,,,,,,,,,,,,,,,
204,204,0.7143908876589363,2023-08-23 19:14:48.341402,2023-08-23 19:14:51.313010,0 days 00:00:02.971608,,0.9,1.0,,LightGBM,,,,,0.6000000000000001,,,,0.001724846793462841,3.5513068158719327e-07,,50.0,,,,,,,,,,182.0,,,,,,,,,COMPLETE,0.0,,,,,,,,,,,,,,,,,,,,
205,205,0.7196486353765807,2023-08-23 19:14:49.309013,2023-08-23 19:14:51.708340,0 days 00:00:02.399327,,0.9,1.0,,LightGBM,,,,,0.6000000000000001,,,,0.007077061131052972,4.327729491137202e-07,,60.0,,,,,,,,,,138.0,,,,,,,,,COMPLETE,0.0,,,,,,,,,,,,,,,,,,,,
206,206,0.7221812004049144,2023-08-23 19:14:50.296795,2023-08-23 19:14:52.825526,0 days 00:00:02.528731,,0.9,1.0,,LightGBM,,,,,0.5,,,,0.0011926994030465599,4.090391464879327e-07,,60.0,,,,,,,,,,177.0,,,,,,,,,COMPLETE,0.0,,,,,,,,,,,,,,,,,,,,
207,207,0.7074971431506234,2023-08-23 19:14:50.465066,2023-08-23 19:14:53.181229,0 days 00:00:02.716163,,0.9,1.0,,LightGBM,,,,,0.5,,,,0.0065974420106256326,4.5395887725426343e-07,,60.0,,,,,,,,,,137.0,,,,,,,,,COMPLETE,0.0,,,,,,,,,,,,,,,,,,,,
208,208,0.7074971431506234,2023-08-23 19:14:51.461200,2023-08-23 19:14:54.522224,0 days 00:00:03.061024,,0.9,1.0,,LightGBM,,,,,0.5,,,,0.006577197050725717,4.1369341146746703e-07,,60.0,,,,,,,,,,137.0,,,,,,,,,COMPLETE,0.0,,,,,,,,,,,,,,,,,,,,
209,209,0.7196486353765807,2023-08-23 19:14:51.819435,2023-08-23 19:14:54.930595,0 days 00:00:03.111160,,0.9,1.0,,LightGBM,,,,,0.6000000000000001,,,,0.006841697543888551,3.9245096556192923e-07,,60.0,,,,,,,,,,176.0,,,,,,,,,COMPLETE,0.0,,,,,,,,,,,,,,,,,,,,
210,210,0.7128633049193797,2023-08-23 19:14:52.906110,2023-08-23 19:14:55.757856,0 days 00:00:02.851746,,0.9,1.0,,LightGBM,,,,,0.5,,,,0.0061722271026498,4.627871717366723e-07,,60.0,,,,,,,,,,139.0,,,,,,,,,COMPLETE,0.0,,,,,,,,,,,,,,,,,,,,
211,211,0.7126980701646217,2023-08-23 19:14:53.279356,2023-08-23 19:14:56.271081,0 days 00:00:02.991725,,0.9,1.0,,LightGBM,,,,,0.5,,,,0.00550892294308517,4.988588867476532e-07,,60.0,,,,,,,,,,176.0,,,,,,,,,COMPLETE,0.0,,,,,,,,,,,,,,,,,,,,
212,212,0.7053486016807164,2023-08-23 19:14:54.629738,2023-08-23 19:14:55.389018,0 days 00:00:00.759280,0.000228060697382628,,,dart,XGBoost,0.6979391630446827,,,0.0037792007303409252,,5.527159218651678e-06,lossguide,5.899654838604324e-07,,,5.0,,8.0,,,,,,,,forest,,1.0052858700494244e-08,,,weighted,0.9519785043198011,0.3905361578287124,,,COMPLETE,0.0,,,,,,,,,,,,,,,,,,,,
213,213,0.719223529153709,2023-08-23 19:14:55.044557,2023-08-23 19:14:57.589643,0 days 00:00:02.545086,,0.9,1.0,,LightGBM,,,,,0.5,,,,0.009316279819429493,6.124657301192285e-07,,60.0,,,,,,,,,,173.0,,,,,,,,,COMPLETE,0.0,,,,,,,,,,,,,,,,,,,,
214,214,0.7033156199136914,2023-08-23 19:14:55.483869,2023-08-23 19:14:58.216887,0 days 00:00:02.733018,,0.9,1.0,,LightGBM,,,,,0.5,,,,0.010545019321388524,5.382583731162681e-07,,60.0,,,,,,,,,,173.0,,,,,,,,,COMPLETE,0.0,,,,,,,,,,,,,,,,,,,,
215,215,0.713391187051409,2023-08-23 19:14:55.892156,2023-08-23 19:14:58.077258,0 days 00:00:02.185102,,0.9,1.0,,LightGBM,,,,,0.6000000000000001,,,,0.010007497357096867,6.181580382737906e-07,,60.0,,,,,,,,,,171.0,,,,,,,,,COMPLETE,0.0,,,,,,,,,,,,,,,,,,,,
216,216,0.7061500950275748,2023-08-23 19:14:56.372648,2023-08-23 19:14:58.773572,0 days 00:00:02.400924,,0.9,1.0,,LightGBM,,,,,0.6000000000000001,,,,0.01155937442409069,7.041678160726935e-07,,70.0,,,,,,,,,,170.0,,,,,,,,,COMPLETE,0.0,,,,,,,,,,,,,,,,,,,,
217,217,0.7124414583506896,2023-08-23 19:14:57.646550,2023-08-23 19:14:59.858875,0 days 00:00:02.212325,,0.9,1.0,,LightGBM,,,,,0.5,,,,0.010275712332966402,8.30492451945149e-07,,70.0,,,,,,,,,,171.0,,,,,,,,,COMPLETE,0.0,,,,,,,,,,,,,,,,,,,,
218,218,0.7221812004049144,2023-08-23 19:14:58.173678,2023-08-23 19:15:00.629518,0 days 00:00:02.455840,,0.9,1.0,,LightGBM,,,,,0.5,,,,0.0010893741131631264,1.1336024976061453e-06,,60.0,,,,,,,,,,183.0,,,,,,,,,COMPLETE,0.0,,,,,,,,,,,,,,,,,,,,
219,219,0.705048572159682,2023-08-23 19:14:58.332469,2023-08-23 19:15:00.700550,0 days 00:00:02.368081,,0.9,1.0,,LightGBM,,,,,0.5,,,,0.008376869763296255,1.0081498342826948e-06,,60.0,,,,,,,,,,184.0,,,,,,,,,COMPLETE,0.0,,,,,,,,,,,,,,,,,,,,
220,220,0.705048572159682,2023-08-23 19:14:58.859481,2023-08-23 19:15:01.424617,0 days 00:00:02.565136,,0.9,1.0,,LightGBM,,,,,0.5,,,,0.008161977723125506,9.487297568657487e-07,,60.0,,,,,,,,,,183.0,,,,,,,,,COMPLETE,0.0,,,,,,,,,,,,,,,,,,,,
221,221,0.7099044314164209,2023-08-23 19:14:59.998225,2023-08-23 19:15:02.526131,0 days 00:00:02.527906,,0.9,1.0,,LightGBM,,,,,0.4,,,,0.0012538597366288276,3.292377381085899e-07,,60.0,,,,,,,,,,183.0,,,,,,,,,COMPLETE,0.0,,,,,,,,,,,,,,,,,,,,
222,222,0.7143746250172396,2023-08-23 19:15:00.793562,2023-08-23 19:15:04.282811,0 days 00:00:03.489249,,0.9,1.0,,LightGBM,,,,,0.5,,,,0.0037695327994535835,1.313046626274783e-06,,60.0,,,,,,,,,,187.0,,,,,,,,,COMPLETE,0.0,,,,,,,,,,,,,,,,,,,,
223,223,0.7088738301171285,2023-08-23 19:15:00.822302,2023-08-23 19:15:03.424519,0 days 00:00:02.602217,,0.9,1.0,,LightGBM,,,,,0.4,,,,0.0010479600000996778,3.264824360458429e-07,,60.0,,,,,,,,,,154.0,,,,,,,,,COMPLETE,0.0,,,,,,,,,,,,,,,,,,,,
224,224,0.7095069999311501,2023-08-23 19:15:01.480123,2023-08-23 19:15:03.837287,0 days 00:00:02.357164,,0.9,1.0,,LightGBM,,,,,0.4,,,,0.0007017721566348372,1.3817198931297067e-06,,60.0,,,,,,,,,,190.0,,,,,,,,,COMPLETE,0.0,,,,,,,,,,,,,,,,,,,,
225,225,0.7153882318903475,2023-08-23 19:15:02.600949,2023-08-23 19:15:05.258482,0 days 00:00:02.657533,,0.9,1.0,,LightGBM,,,,,0.5,,,,0.003974978153013455,1.3702998366732695e-06,,60.0,,,,,,,,,,190.0,,,,,,,,,COMPLETE,0.0,,,,,,,,,,,,,,,,,,,,
226,226,0.7105407150375541,2023-08-23 19:15:03.556119,2023-08-23 19:15:06.166006,0 days 00:00:02.609887,,0.9,1.0,,LightGBM,,,,,0.5,,,,0.0043961712537475975,1.4391719036905192e-06,,60.0,,,,,,,,,,190.0,,,,,,,,,COMPLETE,0.0,,,,,,,,,,,,,,,,,,,,
227,227,0.7114748750174147,2023-08-23 19:15:03.918813,2023-08-23 19:15:06.653239,0 days 00:00:02.734426,,0.9,1.0,,LightGBM,,,,,0.5,,,,0.003942060103546397,9.906885464611803e-08,,50.0,,,,,,,,,,180.0,,,,,,,,,COMPLETE,0.0,,,,,,,,,,,,,,,,,,,,
228,228,0.7067054740587361,2023-08-23 19:15:04.400653,2023-08-23 19:15:07.082887,0 days 00:00:02.682234,,0.9,1.0,,LightGBM,,,,,0.5,,,,0.0027625753557884818,1.128045271880579e-07,,60.0,,,,,,,,,,175.0,,,,,,,,,COMPLETE,0.0,,,,,,,,,,,,,,,,,,,,
229,229,0.7150719519748084,2023-08-23 19:15:05.348848,2023-08-23 19:15:08.016416,0 days 00:00:02.667568,,0.9,1.0,,LightGBM,,,,,0.6000000000000001,,,,0.002475755831386717,9.821991860972928e-08,,70.0,,,,,,,,,,177.0,,,,,,,,,COMPLETE,0.0,,,,,,,,,,,,,,,,,,,,
230,230,0.7152893847634345,2023-08-23 19:15:06.279953,2023-08-23 19:15:09.169423,0 days 00:00:02.889470,,0.9,1.0,,LightGBM,,,,,0.6000000000000001,,,,0.0026486905720975746,9.424355896319328e-08,,50.0,,,,,,,,,,178.0,,,,,,,,,COMPLETE,0.0,,,,,,,,,,,,,,,,,,,,
231,231,0.7137921503593145,2023-08-23 19:15:06.777071,2023-08-23 19:15:09.863615,0 days 00:00:03.086544,,0.9,1.0,,LightGBM,,,,,0.6000000000000001,,,,0.0024437412219228023,1.7060796706806587e-07,,50.0,,,,,,,,,,179.0,,,,,,,,,COMPLETE,0.0,,,,,,,,,,,,,,,,,,,,
232,232,0.7086382221703753,2023-08-23 19:15:07.207055,2023-08-23 19:15:12.532492,0 days 00:00:05.325437,,0.9,1.0,,LightGBM,,,,,0.6000000000000001,,,,0.020232261416496696,6.426270010208071e-08,,20.0,,,,,,,,,,178.0,,,,,,,,,COMPLETE,0.0,,,,,,,,,,,,,,,,,,,,
233,233,0.7139155676271012,2023-08-23 19:15:08.136289,2023-08-23 19:15:11.339102,0 days 00:00:03.202813,,0.9,1.0,,LightGBM,,,,,0.6000000000000001,,,,0.014864395330254014,1.5605496788642082e-07,,50.0,,,,,,,,,,155.0,,,,,,,,,COMPLETE,0.0,,,,,,,,,,,,,,,,,,,,
234,234,0.7096189590319193,2023-08-23 19:15:09.279990,2023-08-23 19:15:13.964638,0 days 00:00:04.684648,,0.9,1.0,,LightGBM,,,,,0.6000000000000001,,,,0.01741439149101014,2.1576535038488902e-07,,10.0,,,,,,,,,,159.0,,,,,,,,,COMPLETE,0.0,,,,,,,,,,,,,,,,,,,,
235,235,0.6736822960207519,2023-08-23 19:15:09.961614,2023-08-23 19:15:10.345520,0 days 00:00:00.383906,,,,,DecisionTreeClassifier,,entropy,14.0,,,,,,,,,,,,,,,,,,,,,,,,,,,,COMPLETE,0.0,,,,,,,,,,,,,,,,,,,,
236,236,0.7111260703975937,2023-08-23 19:15:10.449448,2023-08-23 19:15:12.268311,0 days 00:00:01.818863,,0.9,1.0,,LightGBM,,,,,0.6000000000000001,,,,0.005785844293688795,2.040253885728044e-07,,90.0,,,,,,,,,,151.0,,,,,,,,,COMPLETE,0.0,,,,,,,,,,,,,,,,,,,,
237,237,0.7159201612451711,2023-08-23 19:15:11.490309,2023-08-23 19:15:13.476367,0 days 00:00:01.986058,,0.9,1.0,,LightGBM,,,,,0.6000000000000001,,,,0.019695248941317352,2.1801501297740222e-07,,90.0,,,,,,,,,,158.0,,,,,,,,,COMPLETE,0.0,,,,,,,,,,,,,,,,,,,,
238,238,0.7104369347320734,2023-08-23 19:15:12.400123,2023-08-23 19:15:17.186762,0 days 00:00:04.786639,,0.9,1.0,,LightGBM,,,,,0.7000000000000001,,,,0.007222736424723342,2.0010188141870302e-06,,20.0,,,,,,,,,,161.0,,,,,,,,,COMPLETE,0.0,,,,,,,,,,,,,,,,,,,,
239,239,0.7134978995885027,2023-08-23 19:15:12.728890,2023-08-23 19:15:15.809848,0 days 00:00:03.080958,,0.9,1.0,,LightGBM,,,,,0.7000000000000001,,,,0.007114686008144321,2.9523452438435425e-07,,50.0,,,,,,,,,,161.0,,,,,,,,,COMPLETE,0.0,,,,,,,,,,,,,,,,,,,,
240,240,0.7134978995885027,2023-08-23 19:15:13.550437,2023-08-23 19:15:16.315640,0 days 00:00:02.765203,,0.9,1.0,,LightGBM,,,,,0.7000000000000001,,,,0.007146891399287523,3.210854302295381e-07,,50.0,,,,,,,,,,168.0,,,,,,,,,COMPLETE,0.0,,,,,,,,,,,,,,,,,,,,
241,241,0.7134978995885027,2023-08-23 19:15:14.073182,2023-08-23 19:15:17.346934,0 days 00:00:03.273752,,0.9,1.0,,LightGBM,,,,,0.7000000000000001,,,,0.006562425691423242,3.128828158003354e-07,,50.0,,,,,,,,,,169.0,,,,,,,,,COMPLETE,0.0,,,,,,,,,,,,,,,,,,,,
242,242,0.7120680259921546,2023-08-23 19:15:15.976679,2023-08-23 19:15:19.462888,0 days 00:00:03.486209,,0.9,1.0,,LightGBM,,,,,1.0,,,,0.005064389775992771,6.588977165381051e-07,,50.0,,,,,,,,,,168.0,,,,,,,,,COMPLETE,0.0,,,,,,,,,,,,,,,,,,,,
243,243,0.7143226254587264,2023-08-23 19:15:16.426376,2023-08-23 19:15:19.582482,0 days 00:00:03.156106,,0.9,1.0,,LightGBM,,,,,0.7000000000000001,,,,0.0047861487765193545,5.186029267734738e-07,,50.0,,,,,,,,,,174.0,,,,,,,,,COMPLETE,0.0,,,,,,,,,,,,,,,,,,,,
244,244,0.47145996177571275,2023-08-23 19:15:17.286090,2023-08-23 19:15:23.347061,0 days 00:00:06.060971,,,,,SVC,,,,,,,,,,,,,,,,,,,,,,,,,,,,,25.572481669625333,linear,COMPLETE,0.0,,,,,,,,,,,,,,,,,,,,
245,245,0.4891258067786301,2023-08-23 19:15:17.450180,2023-08-23 19:15:23.490213,0 days 00:00:06.040033,,,,,SVC,,,,,,,,,,,,,,,,,,,,,,,,,,,,,36.45048863308984,linear,COMPLETE,0.0,,,,,,,,,,,,,,,,,,,,
246,246,0.5033180703483593,2023-08-23 19:15:19.674822,2023-08-23 19:15:25.002830,0 days 00:00:05.328008,,,,,SVC,,,,,,,,,,,,,,,,,,,,,,,,,,,,,58.96697816002398,linear,COMPLETE,0.0,,,,,,,,,,,,,,,,,,,,
247,247,0.3357921744708146,2023-08-23 19:15:19.686274,2023-08-23 19:15:21.376784,0 days 00:00:01.690510,,,,,MLPClassifier,,,,,,,,,,,,,,logistic,lbfgs,3.0,30.0,40.0,40.0,,,,,,,,,,,,COMPLETE,0.0,,,,,,,,,,,,,,,,,,,,
248,248,0.7110613704531159,2023-08-23 19:15:21.474223,2023-08-23 19:15:23.851584,0 days 00:00:02.377361,,0.9,1.0,,LightGBM,,,,,0.6000000000000001,,,,0.013077567271842295,9.15537318394531e-07,,60.0,,,,,,,,,,182.0,,,,,,,,,COMPLETE,0.0,,,,,,,,,,,,,,,,,,,,
249,249,0.7182243879443027,2023-08-23 19:15:23.468553,2023-08-23 19:15:25.877439,0 days 00:00:02.408886,,0.9,1.0,,LightGBM,,,,,0.6000000000000001,,,,0.010637225667107543,8.635711776493532e-07,,60.0,,,,,,,,,,183.0,,,,,,,,,COMPLETE,0.0,,,,,,,,,,,,,,,,,,,,
