,number,value,datetime_start,datetime_complete,duration,params_alpha,params_bagging_fraction,params_bagging_freq,params_booster,params_classifier,params_colsample_bytree,params_dct_criterion,params_dct_max_depth,params_eta,params_feature_fraction,params_gamma,params_grow_policy,params_lambda,params_lambda_l1,params_lambda_l2,params_max_depth,params_min_child_samples,params_min_child_weight,params_mlp_activation,params_mlp_solver,params_n_layers,params_n_units_l_0,params_n_units_l_1,params_n_units_l_2,params_n_units_l_3,params_normalize_type,params_num_leaves,params_rate_drop,params_rf_estimator,params_rf_max_depth,params_sample_type,params_skip_drop,params_subsample,params_svc_c,params_svc_kernel,state,best_trial,dev_acc,dev_recall_macro,dev_precision_macro,dev_f1_macro,dev_recall_0,dev_precision_0,dev_f1_0,dev_recall_1,dev_precision_1,dev_f1_1,test_acc,test_recall_macro,test_precision_macro,test_f1_macro,test_recall_0,test_precision_0,test_f1_0,test_recall_1,test_precision_1,test_f1_1
0,0,0.3573487031700288,2023-08-23 14:29:04.582236,2023-08-23 14:29:05.308948,0 days 00:00:00.726712,0.11625628413708505,,,gblinear,XGBoost,0.8272369032128652,,,,,,,6.000328593775014e-06,,,,,,,,,,,,,,,,,,,,0.43605555413619146,,,COMPLETE,0.0,,,,,,,,,,,,,,,,,,,,
1,1,0.49451193215020095,2023-08-23 14:29:04.585758,2023-08-23 14:33:21.441171,0 days 00:04:16.855413,,,,,MLPClassifier,,,,,,,,,,,,,,tanh,lbfgs,3.0,60.0,60.0,20.0,,,,,,,,,,,,COMPLETE,0.0,,,,,,,,,,,,,,,,,,,,
2,2,0.5194066076622099,2023-08-23 14:29:04.589676,2023-08-23 14:29:05.208272,0 days 00:00:00.618596,,,,,DecisionTreeClassifier,,entropy,11.0,,,,,,,,,,,,,,,,,,,,,,,,,,,,COMPLETE,0.0,,,,,,,,,,,,,,,,,,,,
3,3,0.4604242508991096,2023-08-23 14:29:04.593309,2023-08-23 14:32:55.465000,0 days 00:03:50.871691,,,,,MLPClassifier,,,,,,,,,,,,,,relu,adam,1.0,90.0,,,,,,,,,,,,,,COMPLETE,0.0,,,,,,,,,,,,,,,,,,,,
4,4,0.3573487031700288,2023-08-23 14:29:04.594220,2023-08-23 14:29:41.405255,0 days 00:00:36.811035,,,,,MLPClassifier,,,,,,,,,,,,,,logistic,sgd,1.0,70.0,,,,,,,,,,,,,,COMPLETE,0.0,,,,,,,,,,,,,,,,,,,,
5,5,0.5192000297386714,2023-08-23 14:29:04.638374,2023-08-23 14:29:09.211922,0 days 00:00:04.573548,,,,,RandomForestClassifier,,,,,,,,,,,,,,,,,,,,,,,,35.0,19.0,,,,,,COMPLETE,0.0,,,,,,,,,,,,,,,,,,,,
6,6,0.3573487031700288,2023-08-23 14:29:04.654070,2023-08-23 14:29:13.578957,0 days 00:00:08.924887,,,,,SVC,,,,,,,,,,,,,,,,,,,,,,,,,,,,,1.721123500977275,poly,COMPLETE,0.0,,,,,,,,,,,,,,,,,,,,
7,7,0.3573487031700288,2023-08-23 14:29:04.673268,2023-08-23 14:29:14.959879,0 days 00:00:10.286611,,,,,SVC,,,,,,,,,,,,,,,,,,,,,,,,,,,,,0.6749629774668156,rbf,COMPLETE,0.0,,,,,,,,,,,,,,,,,,,,
8,8,0.5368371112282552,2023-08-23 14:29:05.300837,2023-08-23 14:29:12.210508,0 days 00:00:06.909671,,0.9,2.0,,LightGBM,,,,,0.7000000000000001,,,,0.014659091463528458,0.09719607595423255,,90.0,,,,,,,,,,49.0,,,,,,,,,COMPLETE,0.0,,,,,,,,,,,,,,,,,,,,
9,9,0.3921625027394258,2023-08-23 14:29:05.421533,2023-08-23 14:32:41.169169,0 days 00:03:35.747636,,,,,MLPClassifier,,,,,,,,,,,,,,logistic,adam,1.0,70.0,,,,,,,,,,,,,,COMPLETE,0.0,,,,,,,,,,,,,,,,,,,,
10,10,0.3573487031700288,2023-08-23 14:29:09.353029,2023-08-23 14:29:09.463271,0 days 00:00:00.110242,,,,,DecisionTreeClassifier,,gini,2.0,,,,,,,,,,,,,,,,,,,,,,,,,,,,COMPLETE,0.0,,,,,,,,,,,,,,,,,,,,
11,11,0.5056594136275412,2023-08-23 14:29:09.665396,2023-08-23 14:29:10.411537,0 days 00:00:00.746141,,,,,DecisionTreeClassifier,,gini,23.0,,,,,,,,,,,,,,,,,,,,,,,,,,,,COMPLETE,0.0,,,,,,,,,,,,,,,,,,,,
12,12,0.5295948203842941,2023-08-23 14:29:10.521092,2023-08-23 14:29:12.705181,0 days 00:00:02.184089,,0.5,1.0,,LightGBM,,,,,0.8,,,,4.5718518541896205e-06,1.8571732879523754e-06,,20.0,,,,,,,,,,52.0,,,,,,,,,COMPLETE,0.0,,,,,,,,,,,,,,,,,,,,
13,13,0.38488421981473087,2023-08-23 14:29:12.282595,2023-08-23 14:33:36.203332,0 days 00:04:23.920737,,,,,MLPClassifier,,,,,,,,,,,,,,logistic,adam,1.0,70.0,,,,,,,,,,,,,,COMPLETE,0.0,,,,,,,,,,,,,,,,,,,,
14,14,0.41044677472521035,2023-08-23 14:29:12.824334,2023-08-23 14:31:09.542957,0 days 00:01:56.718623,,,,,MLPClassifier,,,,,,,,,,,,,,tanh,adam,3.0,60.0,70.0,10.0,,,,,,,,,,,,COMPLETE,0.0,,,,,,,,,,,,,,,,,,,,
15,15,0.5102381993006992,2023-08-23 14:29:13.704886,2023-08-23 14:29:14.584637,0 days 00:00:00.879751,,1.0,3.0,,LightGBM,,,,,0.5,,,,1.0189276254445438e-08,3.2880867857482484e-08,,100.0,,,,,,,,,,12.0,,,,,,,,,COMPLETE,0.0,,,,,,,,,,,,,,,,,,,,
16,16,0.5339806338889749,2023-08-23 14:29:14.740431,2023-08-23 14:29:16.281882,0 days 00:00:01.541451,,1.0,1.0,,LightGBM,,,,,1.0,,,,0.0011317831023530819,2.4347680104998993e-08,,20.0,,,,,,,,,,31.0,,,,,,,,,COMPLETE,0.0,,,,,,,,,,,,,,,,,,,,
17,17,0.3573487031700288,2023-08-23 14:29:15.065376,2023-08-23 14:30:54.923395,0 days 00:01:39.858019,,,,,MLPClassifier,,,,,,,,,,,,,,identity,sgd,4.0,60.0,40.0,80.0,40.0,,,,,,,,,,,COMPLETE,0.0,,,,,,,,,,,,,,,,,,,,
18,18,0.5007631367491109,2023-08-23 14:29:16.380943,2023-08-23 14:38:44.993929,0 days 00:09:28.612986,,,,,MLPClassifier,,,,,,,,,,,,,,relu,adam,3.0,40.0,60.0,30.0,,,,,,,,,,,,COMPLETE,0.0,,,,,,,,,,,,,,,,,,,,
19,19,0.5362740765771621,2023-08-23 14:29:41.498111,2023-08-23 14:29:43.668052,0 days 00:00:02.169941,,1.0,1.0,,LightGBM,,,,,1.0,,,,0.05628988594969807,0.3328759244218021,,80.0,,,,,,,,,,154.0,,,,,,,,,COMPLETE,0.0,,,,,,,,,,,,,,,,,,,,
20,20,0.5416477560240178,2023-08-23 14:29:43.753356,2023-08-23 14:29:45.602311,0 days 00:00:01.848955,,0.8,2.0,,LightGBM,,,,,1.0,,,,0.2779752593836565,0.795405853286978,,90.0,,,,,,,,,,197.0,,,,,,,,,COMPLETE,0.0,,,,,,,,,,,,,,,,,,,,
21,21,0.5281038257062441,2023-08-23 14:29:45.738841,2023-08-23 14:29:48.029705,0 days 00:00:02.290864,,0.7000000000000001,2.0,,LightGBM,,,,,0.7000000000000001,,,,0.7726843827042836,0.8741443615354451,,70.0,,,,,,,,,,255.0,,,,,,,,,COMPLETE,0.0,,,,,,,,,,,,,,,,,,,,
22,22,0.41605998294964536,2023-08-23 14:29:48.155163,2023-08-23 14:30:32.023897,0 days 00:00:43.868734,,,,,MLPClassifier,,,,,,,,,,,,,,identity,lbfgs,4.0,10.0,30.0,70.0,20.0,,,,,,,,,,,COMPLETE,0.0,,,,,,,,,,,,,,,,,,,,
23,23,0.3573487031700288,2023-08-23 14:30:32.104436,2023-08-23 14:30:34.286035,0 days 00:00:02.181599,,,,,RandomForestClassifier,,,,,,,,,,,,,,,,,,,,,,,,93.0,2.0,,,,,,COMPLETE,0.0,,,,,,,,,,,,,,,,,,,,
24,24,0.3807003419469333,2023-08-23 14:30:34.363451,2023-08-23 14:30:34.786055,0 days 00:00:00.422604,1.4916139494360613e-08,,,dart,XGBoost,0.21599270469859688,,,0.08835836535859475,,6.961699456556224e-05,lossguide,0.4255159298947389,,,3.0,,3.0,,,,,,,,tree,,3.7486127707236725e-07,,,weighted,1.825331686599815e-05,0.9771035602312456,,,COMPLETE,0.0,,,,,,,,,,,,,,,,,,,,
25,25,0.5441967507265032,2023-08-23 14:30:34.852975,2023-08-23 14:30:36.949795,0 days 00:00:02.096820,,0.8,2.0,,LightGBM,,,,,0.5,,,,0.028894141794885916,0.009502520102700593,,100.0,,,,,,,,,,156.0,,,,,,,,,COMPLETE,0.0,,,,,,,,,,,,,,,,,,,,
26,26,0.5077417194986714,2023-08-23 14:30:37.027440,2023-08-23 14:30:39.594814,0 days 00:00:02.567374,,0.7000000000000001,3.0,,LightGBM,,,,,0.4,,,,0.5034118669730886,0.004748626651740847,,60.0,,,,,,,,,,179.0,,,,,,,,,COMPLETE,0.0,,,,,,,,,,,,,,,,,,,,
27,27,0.5343451972823038,2023-08-23 14:30:39.791484,2023-08-23 14:30:41.382799,0 days 00:00:01.591315,,0.8,2.0,,LightGBM,,,,,0.5,,,,0.005543570868470963,0.002615232718017227,,100.0,,,,,,,,,,215.0,,,,,,,,,COMPLETE,0.0,,,,,,,,,,,,,,,,,,,,
28,28,0.5323411114762822,2023-08-23 14:30:41.472251,2023-08-23 14:30:43.723828,0 days 00:00:02.251577,,0.8,2.0,,LightGBM,,,,,0.8,,,,0.019396379883770857,0.061490393778462965,,90.0,,,,,,,,,,98.0,,,,,,,,,COMPLETE,0.0,,,,,,,,,,,,,,,,,,,,
29,29,0.5434131093093679,2023-08-23 14:30:43.794714,2023-08-23 14:30:45.724791,0 days 00:00:01.930077,,0.8,2.0,,LightGBM,,,,,0.6000000000000001,,,,0.05139241466517233,0.02700637314211012,,80.0,,,,,,,,,,105.0,,,,,,,,,COMPLETE,0.0,,,,,,,,,,,,,,,,,,,,
30,30,0.5460262842863404,2023-08-23 14:30:45.843242,2023-08-23 14:30:48.088024,0 days 00:00:02.244782,,0.8,2.0,,LightGBM,,,,,0.5,,,,0.36295734921760275,0.004908160815115821,,80.0,,,,,,,,,,116.0,,,,,,,,,COMPLETE,0.0,,,,,,,,,,,,,,,,,,,,
31,31,0.5210006566158928,2023-08-23 14:30:48.182674,2023-08-23 14:30:50.010098,0 days 00:00:01.827424,,0.6000000000000001,2.0,,LightGBM,,,,,0.5,,,,0.0011651504809842158,0.0027847850894884437,,70.0,,,,,,,,,,113.0,,,,,,,,,COMPLETE,0.0,,,,,,,,,,,,,,,,,,,,
32,32,0.5286794865997895,2023-08-23 14:30:50.077671,2023-08-23 14:30:51.073205,0 days 00:00:00.995534,,,,,RandomForestClassifier,,,,,,,,,,,,,,,,,,,,,,,,17.0,32.0,,,,,,COMPLETE,0.0,,,,,,,,,,,,,,,,,,,,
33,33,0.45762125999468944,2023-08-23 14:30:51.172571,2023-08-23 14:39:24.710569,0 days 00:08:33.537998,,,,,MLPClassifier,,,,,,,,,,,,,,tanh,adam,4.0,100.0,100.0,10.0,100.0,,,,,,,,,,,COMPLETE,0.0,,,,,,,,,,,,,,,,,,,,
34,34,0.3614589700730098,2023-08-23 14:30:55.009571,2023-08-23 14:31:07.155734,0 days 00:00:12.146163,,,,,SVC,,,,,,,,,,,,,,,,,,,,,,,,,,,,,842.7460227031378,linear,COMPLETE,0.0,,,,,,,,,,,,,,,,,,,,
35,35,0.5222406868310672,2023-08-23 14:31:07.229581,2023-08-23 14:31:09.692149,0 days 00:00:02.462568,,0.8,3.0,,LightGBM,,,,,0.6000000000000001,,,,0.10799217398006035,0.0002444377846753681,,40.0,,,,,,,,,,91.0,,,,,,,,,COMPLETE,0.0,,,,,,,,,,,,,,,,,,,,
36,36,0.4738542093808156,2023-08-23 14:31:09.617123,2023-08-23 14:31:10.104248,0 days 00:00:00.487125,0.2668493646725557,,,gbtree,XGBoost,0.8272582947536009,,,4.900768081964164e-08,,0.735652521795003,depthwise,1.4743851761299952e-08,,,9.0,,10.0,,,,,,,,,,,,,,,0.21185993903326322,,,COMPLETE,0.0,,,,,,,,,,,,,,,,,,,,
37,37,0.3573487031700288,2023-08-23 14:31:09.760546,2023-08-23 14:31:10.363341,0 days 00:00:00.602795,0.2749729442723387,,,gbtree,XGBoost,0.9613970953471671,,,1.0809763094081145e-08,,0.9111426129636693,depthwise,1.0666859935166954e-08,,,9.0,,10.0,,,,,,,,,,,,,,,0.21110778574929756,,,COMPLETE,0.0,,,,,,,,,,,,,,,,,,,,
38,38,0.5589417003210106,2023-08-23 14:31:10.193443,2023-08-23 14:31:12.510353,0 days 00:00:02.316910,,0.8,2.0,,LightGBM,,,,,0.6000000000000001,,,,0.42057133780702194,0.02603435242029468,,80.0,,,,,,,,,,151.0,,,,,,,,,COMPLETE,0.0,,,,,,,,,,,,,,,,,,,,
39,39,0.5421967129620561,2023-08-23 14:31:10.486599,2023-08-23 14:31:13.140433,0 days 00:00:02.653834,,0.8,2.0,,LightGBM,,,,,0.6000000000000001,,,,0.294044245335336,0.042386405391180285,,80.0,,,,,,,,,,157.0,,,,,,,,,COMPLETE,0.0,,,,,,,,,,,,,,,,,,,,
40,40,0.5184611503465837,2023-08-23 14:31:12.587936,2023-08-23 14:31:15.184827,0 days 00:00:02.596891,,0.9,2.0,,LightGBM,,,,,0.6000000000000001,,,,0.7294599710542529,0.011620643094314365,,80.0,,,,,,,,,,135.0,,,,,,,,,COMPLETE,0.0,,,,,,,,,,,,,,,,,,,,
41,41,0.5366900639117664,2023-08-23 14:31:13.277077,2023-08-23 14:31:16.313789,0 days 00:00:03.036712,,0.9,2.0,,LightGBM,,,,,0.6000000000000001,,,,0.7250109353115174,0.015199213647096444,,50.0,,,,,,,,,,134.0,,,,,,,,,COMPLETE,0.0,,,,,,,,,,,,,,,,,,,,
42,42,0.3573487031700288,2023-08-23 14:31:15.281112,2023-08-23 14:31:15.379343,0 days 00:00:00.098231,,,,,DecisionTreeClassifier,,log_loss,2.0,,,,,,,,,,,,,,,,,,,,,,,,,,,,COMPLETE,0.0,,,,,,,,,,,,,,,,,,,,
43,43,0.5345212827563411,2023-08-23 14:31:15.449536,2023-08-23 14:31:19.194153,0 days 00:00:03.744617,,0.9,2.0,,LightGBM,,,,,0.4,,,,0.06703613442913253,0.020862669877165455,,50.0,,,,,,,,,,131.0,,,,,,,,,COMPLETE,0.0,,,,,,,,,,,,,,,,,,,,
44,44,0.3573487031700288,2023-08-23 14:31:16.458343,2023-08-23 14:31:21.811605,0 days 00:00:05.353262,,,,,SVC,,,,,,,,,,,,,,,,,,,,,,,,,,,,,0.0010357035685289663,linear,COMPLETE,0.0,,,,,,,,,,,,,,,,,,,,
45,45,0.3573487031700288,2023-08-23 14:31:19.371634,2023-08-23 14:31:24.635148,0 days 00:00:05.263514,,,,,SVC,,,,,,,,,,,,,,,,,,,,,,,,,,,,,0.0015934063730990535,poly,COMPLETE,0.0,,,,,,,,,,,,,,,,,,,,
46,46,0.4448088134775441,2023-08-23 14:31:22.002971,2023-08-23 14:31:26.341602,0 days 00:00:04.338631,,,,,RandomForestClassifier,,,,,,,,,,,,,,,,,,,,,,,,79.0,5.0,,,,,,COMPLETE,0.0,,,,,,,,,,,,,,,,,,,,
47,47,0.4359896461103756,2023-08-23 14:31:24.728903,2023-08-23 14:31:28.714996,0 days 00:00:03.986093,,,,,RandomForestClassifier,,,,,,,,,,,,,,,,,,,,,,,,83.0,4.0,,,,,,COMPLETE,0.0,,,,,,,,,,,,,,,,,,,,
48,48,0.5384928951067955,2023-08-23 14:31:26.512589,2023-08-23 14:31:28.924827,0 days 00:00:02.412238,,0.8,2.0,,LightGBM,,,,,0.6000000000000001,,,,0.06615609151068909,0.058284293822084964,,80.0,,,,,,,,,,169.0,,,,,,,,,COMPLETE,0.0,,,,,,,,,,,,,,,,,,,,
49,49,0.5538456515635305,2023-08-23 14:31:28.872871,2023-08-23 14:31:31.067149,0 days 00:00:02.194278,,0.8,2.0,,LightGBM,,,,,0.6000000000000001,,,,0.08024754334560404,0.06612264586404357,,80.0,,,,,,,,,,165.0,,,,,,,,,COMPLETE,0.0,,,,,,,,,,,,,,,,,,,,
50,50,0.5525044838969614,2023-08-23 14:31:29.045918,2023-08-23 14:31:31.232545,0 days 00:00:02.186627,,0.7000000000000001,2.0,,LightGBM,,,,,0.5,,,,0.1323989866499151,0.0010932529255712183,,70.0,,,,,,,,,,155.0,,,,,,,,,COMPLETE,0.0,,,,,,,,,,,,,,,,,,,,
51,51,0.5192238591448077,2023-08-23 14:31:31.206771,2023-08-23 14:31:33.480097,0 days 00:00:02.273326,,0.7000000000000001,2.0,,LightGBM,,,,,0.5,,,,0.07325299760816258,0.000906503559737387,,70.0,,,,,,,,,,102.0,,,,,,,,,COMPLETE,0.0,,,,,,,,,,,,,,,,,,,,
52,52,0.5000507222853433,2023-08-23 14:31:31.330758,2023-08-23 14:31:32.390374,0 days 00:00:01.059616,,,,,DecisionTreeClassifier,,entropy,32.0,,,,,,,,,,,,,,,,,,,,,,,,,,,,COMPLETE,0.0,,,,,,,,,,,,,,,,,,,,
53,53,0.5327953866578161,2023-08-23 14:31:32.527206,2023-08-23 14:31:34.984097,0 days 00:00:02.456891,,0.7000000000000001,2.0,,LightGBM,,,,,0.5,,,,0.15474151550352894,0.000552245333886262,,70.0,,,,,,,,,,188.0,,,,,,,,,COMPLETE,0.0,,,,,,,,,,,,,,,,,,,,
54,54,0.5332968869671187,2023-08-23 14:31:33.637148,2023-08-23 14:31:36.011032,0 days 00:00:02.373884,,0.6000000000000001,2.0,,LightGBM,,,,,0.5,,,,0.1921869323542636,0.0007424450504211065,,60.0,,,,,,,,,,191.0,,,,,,,,,COMPLETE,0.0,,,,,,,,,,,,,,,,,,,,
55,55,0.4455970833039656,2023-08-23 14:31:35.075805,2023-08-23 14:35:57.807215,0 days 00:04:22.731410,,,,,MLPClassifier,,,,,,,,,,,,,,relu,adam,1.0,100.0,,,,,,,,,,,,,,COMPLETE,0.0,,,,,,,,,,,,,,,,,,,,
56,56,0.4441189319764603,2023-08-23 14:31:36.186721,2023-08-23 14:35:15.111909,0 days 00:03:38.925188,,,,,MLPClassifier,,,,,,,,,,,,,,relu,adam,1.0,100.0,,,,,,,,,,,,,,COMPLETE,0.0,,,,,,,,,,,,,,,,,,,,
57,57,0.5380704287238717,2023-08-23 14:32:41.294718,2023-08-23 14:32:42.892695,0 days 00:00:01.597977,,0.6000000000000001,1.0,,LightGBM,,,,,0.4,,,,0.015785882624600407,0.005175682507204145,,90.0,,,,,,,,,,157.0,,,,,,,,,COMPLETE,0.0,,,,,,,,,,,,,,,,,,,,
58,58,0.5332968869671187,2023-08-23 14:32:42.966413,2023-08-23 14:32:45.645521,0 days 00:00:02.679108,,0.8,2.0,,LightGBM,,,,,0.6000000000000001,,,,0.03782491396506198,0.022785435992303624,,80.0,,,,,,,,,,81.0,,,,,,,,,COMPLETE,0.0,,,,,,,,,,,,,,,,,,,,
59,59,0.5301206866578043,2023-08-23 14:32:45.793986,2023-08-23 14:32:48.169117,0 days 00:00:02.375131,,0.8,2.0,,LightGBM,,,,,0.5,,,,0.8586289601216087,0.1497709505635252,,100.0,,,,,,,,,,123.0,,,,,,,,,COMPLETE,0.0,,,,,,,,,,,,,,,,,,,,
60,60,0.5171129226127045,2023-08-23 14:32:48.288209,2023-08-23 14:32:50.689801,0 days 00:00:02.401592,,0.7000000000000001,2.0,,LightGBM,,,,,0.7000000000000001,,,,0.16681663281002754,0.007944336233116753,,70.0,,,,,,,,,,144.0,,,,,,,,,COMPLETE,0.0,,,,,,,,,,,,,,,,,,,,
61,61,0.4938172570131499,2023-08-23 14:32:50.882580,2023-08-23 14:37:19.893936,0 days 00:04:29.011356,,,,,MLPClassifier,,,,,,,,,,,,,,relu,lbfgs,2.0,100.0,100.0,,,,,,,,,,,,,COMPLETE,0.0,,,,,,,,,,,,,,,,,,,,
62,62,0.4959020516371082,2023-08-23 14:32:55.561054,2023-08-23 14:36:53.558907,0 days 00:03:57.997853,,,,,MLPClassifier,,,,,,,,,,,,,,tanh,lbfgs,2.0,10.0,100.0,,,,,,,,,,,,,COMPLETE,0.0,,,,,,,,,,,,,,,,,,,,
63,63,0.5166076620320009,2023-08-23 14:33:21.544957,2023-08-23 14:33:23.935062,0 days 00:00:02.390105,,0.9,2.0,,LightGBM,,,,,0.6000000000000001,,,,0.0063172372230818515,0.021803438851811522,,90.0,,,,,,,,,,166.0,,,,,,,,,COMPLETE,0.0,,,,,,,,,,,,,,,,,,,,
64,64,0.3573487031700288,2023-08-23 14:33:24.021218,2023-08-23 14:34:32.815565,0 days 00:01:08.794347,,,,,MLPClassifier,,,,,,,,,,,,,,relu,sgd,2.0,20.0,100.0,,,,,,,,,,,,,COMPLETE,0.0,,,,,,,,,,,,,,,,,,,,
65,65,0.5441967507265032,2023-08-23 14:33:36.363844,2023-08-23 14:33:38.779760,0 days 00:00:02.415916,,0.8,2.0,,LightGBM,,,,,0.5,,,,0.1934041292757059,0.004008831186477936,,80.0,,,,,,,,,,118.0,,,,,,,,,COMPLETE,0.0,,,,,,,,,,,,,,,,,,,,
66,66,0.4893911793391388,2023-08-23 14:33:38.867562,2023-08-23 14:33:39.306484,0 days 00:00:00.438922,2.5567982423862767e-06,,,dart,XGBoost,0.4735098659560898,,,0.8107067832503425,,2.6035087916642577e-08,lossguide,0.49947566539948973,,,3.0,,2.0,,,,,,,,forest,,0.47281524276131454,,,uniform,0.23328806918804926,0.8099405465268633,,,COMPLETE,0.0,,,,,,,,,,,,,,,,,,,,
67,67,0.43239363669996306,2023-08-23 14:33:39.409116,2023-08-23 14:33:39.720557,0 days 00:00:00.311441,,,,,DecisionTreeClassifier,,log_loss,5.0,,,,,,,,,,,,,,,,,,,,,,,,,,,,COMPLETE,0.0,,,,,,,,,,,,,,,,,,,,
68,68,0.5420469631596415,2023-08-23 14:33:39.862596,2023-08-23 14:33:42.733531,0 days 00:00:02.870935,,0.8,2.0,,LightGBM,,,,,0.5,,,,0.24999113690869323,0.0020958415448045936,,80.0,,,,,,,,,,117.0,,,,,,,,,COMPLETE,0.0,,,,,,,,,,,,,,,,,,,,
69,69,0.5104542675494685,2023-08-23 14:33:42.828632,2023-08-23 14:33:45.387446,0 days 00:00:02.558814,,0.9,2.0,,LightGBM,,,,,0.4,,,,0.03311073471748987,0.09268431377380831,,80.0,,,,,,,,,,74.0,,,,,,,,,COMPLETE,0.0,,,,,,,,,,,,,,,,,,,,
70,70,0.5384928951067955,2023-08-23 14:33:45.507695,2023-08-23 14:33:48.077197,0 days 00:00:02.569502,,0.8,2.0,,LightGBM,,,,,0.6000000000000001,,,,0.16064569877662024,0.008973892414172138,,90.0,,,,,,,,,,149.0,,,,,,,,,COMPLETE,0.0,,,,,,,,,,,,,,,,,,,,
71,71,0.5366618878430884,2023-08-23 14:33:48.164802,2023-08-23 14:33:50.155533,0 days 00:00:01.990731,,0.7000000000000001,2.0,,LightGBM,,,,,0.5,,,,0.02675382066706206,0.13988081411519765,,70.0,,,,,,,,,,112.0,,,,,,,,,COMPLETE,0.0,,,,,,,,,,,,,,,,,,,,
72,72,0.3573487031700288,2023-08-23 14:33:50.230284,2023-08-23 14:35:12.394853,0 days 00:01:22.164569,,,,,MLPClassifier,,,,,,,,,,,,,,relu,sgd,2.0,20.0,100.0,,,,,,,,,,,,,COMPLETE,0.0,,,,,,,,,,,,,,,,,,,,
73,73,0.5212286234794021,2023-08-23 14:34:32.947633,2023-08-23 14:34:35.768152,0 days 00:00:02.820519,,0.9,3.0,,LightGBM,,,,,0.5,,,,0.3071330368562984,7.978944572314485e-05,,80.0,,,,,,,,,,139.0,,,,,,,,,COMPLETE,0.0,,,,,,,,,,,,,,,,,,,,
74,74,0.5344860305745914,2023-08-23 14:34:35.851729,2023-08-23 14:34:37.022706,0 days 00:00:01.170977,,0.4,2.0,,LightGBM,,,,,0.8,,,,0.9993388535668196,0.03148518803262661,,100.0,,,,,,,,,,173.0,,,,,,,,,COMPLETE,0.0,,,,,,,,,,,,,,,,,,,,
75,75,0.548450820429468,2023-08-23 14:34:37.166495,2023-08-23 14:34:39.608892,0 days 00:00:02.442397,,0.8,1.0,,LightGBM,,,,,0.6000000000000001,,,,0.11489683477598968,0.005153166184913405,,90.0,,,,,,,,,,63.0,,,,,,,,,COMPLETE,0.0,,,,,,,,,,,,,,,,,,,,
76,76,0.5412952689646575,2023-08-23 14:34:39.676421,2023-08-23 14:34:41.651465,0 days 00:00:01.975044,,0.8,1.0,,LightGBM,,,,,0.7000000000000001,,,,0.10946617970627599,0.001892197164571211,,90.0,,,,,,,,,,59.0,,,,,,,,,COMPLETE,0.0,,,,,,,,,,,,,,,,,,,,
77,77,0.5347845011822927,2023-08-23 14:34:41.700569,2023-08-23 14:34:43.702395,0 days 00:00:02.001826,,0.7000000000000001,1.0,,LightGBM,,,,,0.5,,,,0.33238075015900265,0.006446154876271786,,90.0,,,,,,,,,,204.0,,,,,,,,,COMPLETE,0.0,,,,,,,,,,,,,,,,,,,,
78,78,0.5128633902452447,2023-08-23 14:34:43.813980,2023-08-23 14:34:44.683489,0 days 00:00:00.869509,,0.8,1.0,,LightGBM,,,,,0.6000000000000001,,,,0.05720488711137268,0.010639026210548673,,100.0,,,,,,,,,,3.0,,,,,,,,,COMPLETE,0.0,,,,,,,,,,,,,,,,,,,,
79,79,0.5453387615483187,2023-08-23 14:34:44.759231,2023-08-23 14:34:47.176574,0 days 00:00:02.417343,,0.8,2.0,,LightGBM,,,,,0.6000000000000001,,,,0.10160092160823184,0.039786566799409465,,80.0,,,,,,,,,,155.0,,,,,,,,,COMPLETE,0.0,,,,,,,,,,,,,,,,,,,,
80,80,0.5358958248538231,2023-08-23 14:34:47.236076,2023-08-23 14:34:49.221622,0 days 00:00:01.985546,,0.8,3.0,,LightGBM,,,,,0.7000000000000001,,,,0.3104111948407724,0.27017809389923225,,90.0,,,,,,,,,,27.0,,,,,,,,,COMPLETE,0.0,,,,,,,,,,,,,,,,,,,,
81,81,0.5421967129620561,2023-08-23 14:34:49.305099,2023-08-23 14:34:51.630884,0 days 00:00:02.325785,,0.8,1.0,,LightGBM,,,,,0.5,,,,0.014073383905301847,0.004462844875934859,,80.0,,,,,,,,,,155.0,,,,,,,,,COMPLETE,0.0,,,,,,,,,,,,,,,,,,,,
82,82,0.3614589700730098,2023-08-23 14:34:51.729029,2023-08-23 14:35:00.446126,0 days 00:00:08.717097,,,,,SVC,,,,,,,,,,,,,,,,,,,,,,,,,,,,,653.8190631301993,rbf,COMPLETE,0.0,,,,,,,,,,,,,,,,,,,,
83,83,0.4109547342489724,2023-08-23 14:35:00.533531,2023-08-23 14:35:11.575429,0 days 00:00:11.041898,,,,,MLPClassifier,,,,,,,,,,,,,,identity,lbfgs,2.0,30.0,10.0,,,,,,,,,,,,,COMPLETE,0.0,,,,,,,,,,,,,,,,,,,,
84,84,0.5109649122807017,2023-08-23 14:35:11.643632,2023-08-23 14:35:14.346154,0 days 00:00:02.702522,,0.7000000000000001,2.0,,LightGBM,,,,,0.6000000000000001,,,,0.12463155734444338,0.05181288775402438,,80.0,,,,,,,,,,181.0,,,,,,,,,COMPLETE,0.0,,,,,,,,,,,,,,,,,,,,
