,number,value,datetime_start,datetime_complete,duration,params_alpha,params_bagging_fraction,params_bagging_freq,params_booster,params_classifier,params_colsample_bytree,params_dct_criterion,params_dct_max_depth,params_eta,params_feature_fraction,params_gamma,params_grow_policy,params_lambda,params_lambda_l1,params_lambda_l2,params_max_depth,params_min_child_samples,params_min_child_weight,params_mlp_activation,params_mlp_solver,params_n_layers,params_n_units_l_0,params_n_units_l_1,params_n_units_l_2,params_n_units_l_3,params_normalize_type,params_num_leaves,params_rate_drop,params_rf_estimator,params_rf_max_depth,params_sample_type,params_skip_drop,params_subsample,params_svc_c,params_svc_kernel,state,best_trial,dev_acc,dev_recall_macro,dev_precision_macro,dev_f1_macro,dev_recall_0,dev_precision_0,dev_f1_0,dev_recall_1,dev_precision_1,dev_f1_1,test_acc,test_recall_macro,test_precision_macro,test_f1_macro,test_recall_0,test_precision_0,test_f1_0,test_recall_1,test_precision_1,test_f1_1
0,0,0.3696969696969697,2023-08-23 17:41:57.174760,2023-08-23 17:41:58.829648,0 days 00:00:01.654888,,,,,MLPClassifier,,,,,,,,,,,,,,logistic,lbfgs,4.0,10.0,10.0,100.0,10.0,,,,,,,,,,,COMPLETE,0.0,,,,,,,,,,,,,,,,,,,,
1,1,0.3696969696969697,2023-08-23 17:41:57.178461,2023-08-23 17:41:57.929240,0 days 00:00:00.750779,,,,,MLPClassifier,,,,,,,,,,,,,,relu,lbfgs,1.0,80.0,,,,,,,,,,,,,,COMPLETE,0.0,,,,,,,,,,,,,,,,,,,,
2,2,0.7765625,2023-08-23 17:41:57.181183,2023-08-23 17:41:58.022637,0 days 00:00:00.841454,,,,,RandomForestClassifier,,,,,,,,,,,,,,,,,,,,,,,,36.0,2.0,,,,,,COMPLETE,0.0,,,,,,,,,,,,,,,,,,,,
3,3,0.8320509166904151,2023-08-23 17:41:57.181648,2023-08-23 17:41:58.463268,0 days 00:00:01.281620,,1.0,1.0,,LightGBM,,,,,1.0,,,,1.135286682487978e-08,0.029486357118148326,,50.0,,,,,,,,,,181.0,,,,,,,,,COMPLETE,0.0,,,,,,,,,,,,,,,,,,,,
4,4,0.3696969696969697,2023-08-23 17:41:57.184101,2023-08-23 17:41:57.448589,0 days 00:00:00.264488,,,,,SVC,,,,,,,,,,,,,,,,,,,,,,,,,,,,,0.01488119467076659,linear,COMPLETE,0.0,,,,,,,,,,,,,,,,,,,,
5,5,0.8424242424242425,2023-08-23 17:41:57.185922,2023-08-23 17:41:57.812857,0 days 00:00:00.626935,,0.6000000000000001,2.0,,LightGBM,,,,,0.7000000000000001,,,,5.378864707971852e-07,2.9854790697422582e-05,,90.0,,,,,,,,,,149.0,,,,,,,,,COMPLETE,0.0,,,,,,,,,,,,,,,,,,,,
6,6,0.7314203730272597,2023-08-23 17:41:57.189842,2023-08-23 17:41:57.252191,0 days 00:00:00.062349,,,,,DecisionTreeClassifier,,entropy,15.0,,,,,,,,,,,,,,,,,,,,,,,,,,,,COMPLETE,0.0,,,,,,,,,,,,,,,,,,,,
7,7,0.3696969696969697,2023-08-23 17:41:57.203116,2023-08-23 17:41:57.386332,0 days 00:00:00.183216,,,,,SVC,,,,,,,,,,,,,,,,,,,,,,,,,,,,,2.3922386549106545,linear,COMPLETE,0.0,,,,,,,,,,,,,,,,,,,,
8,8,0.8518096323738957,2023-08-23 17:41:57.339583,2023-08-23 17:41:58.601435,0 days 00:00:01.261852,,0.4,2.0,,LightGBM,,,,,0.6000000000000001,,,,1.3027177824593874e-05,4.5253469712980366e-05,,20.0,,,,,,,,,,19.0,,,,,,,,,COMPLETE,0.0,,,,,,,,,,,,,,,,,,,,
9,9,0.7741478613917477,2023-08-23 17:41:57.512084,2023-08-23 17:41:57.546339,0 days 00:00:00.034255,,,,,DecisionTreeClassifier,,log_loss,2.0,,,,,,,,,,,,,,,,,,,,,,,,,,,,COMPLETE,0.0,,,,,,,,,,,,,,,,,,,,
10,10,0.3696969696969697,2023-08-23 17:41:57.516068,2023-08-23 17:41:57.636946,0 days 00:00:00.120878,,,,,SVC,,,,,,,,,,,,,,,,,,,,,,,,,,,,,0.4018228174102798,linear,COMPLETE,0.0,,,,,,,,,,,,,,,,,,,,
11,11,0.7894939759036144,2023-08-23 17:41:57.633013,2023-08-23 17:41:58.235732,0 days 00:00:00.602719,3.937078455771895e-08,,,gbtree,XGBoost,0.4023842083943199,,,0.0007260773129549072,,1.1403269730648436e-06,lossguide,1.1135517694463824e-06,,,5.0,,3.0,,,,,,,,,,,,,,,0.913805107385474,,,COMPLETE,0.0,,,,,,,,,,,,,,,,,,,,
12,12,0.3696969696969697,2023-08-23 17:41:57.748848,2023-08-23 17:42:14.027963,0 days 00:00:16.279115,,,,,MLPClassifier,,,,,,,,,,,,,,identity,sgd,4.0,70.0,40.0,20.0,80.0,,,,,,,,,,,COMPLETE,0.0,,,,,,,,,,,,,,,,,,,,
13,13,0.3696969696969697,2023-08-23 17:41:57.992604,2023-08-23 17:42:13.372068,0 days 00:00:15.379464,,,,,MLPClassifier,,,,,,,,,,,,,,tanh,sgd,4.0,50.0,10.0,30.0,90.0,,,,,,,,,,,COMPLETE,0.0,,,,,,,,,,,,,,,,,,,,
14,14,0.7743589743589745,2023-08-23 17:41:58.109509,2023-08-23 17:42:00.808842,0 days 00:00:02.699333,,,,,RandomForestClassifier,,,,,,,,,,,,,,,,,,,,,,,,92.0,2.0,,,,,,COMPLETE,0.0,,,,,,,,,,,,,,,,,,,,
15,15,0.796875,2023-08-23 17:41:58.132640,2023-08-23 17:41:58.334175,0 days 00:00:00.201535,0.9022296808992998,,,dart,XGBoost,0.6804290374252941,,,0.0026723064483279587,,4.9411209552328065e-08,lossguide,0.00281399028489987,,,3.0,,8.0,,,,,,,,forest,,0.001557422456501991,,,weighted,1.591725025367048e-07,0.480863178304914,,,COMPLETE,0.0,,,,,,,,,,,,,,,,,,,,
16,16,0.8109995217599235,2023-08-23 17:41:58.312302,2023-08-23 17:41:58.713455,0 days 00:00:00.401153,0.00015652775311904152,,,dart,XGBoost,0.96760510001038,,,0.005299949933255011,,0.2723855815361426,depthwise,0.01583708900529989,,,7.0,,10.0,,,,,,,,forest,,2.8112241512755576e-05,,,uniform,0.058806447746413006,0.7492672200978052,,,COMPLETE,0.0,,,,,,,,,,,,,,,,,,,,
17,17,0.8424242424242425,2023-08-23 17:41:58.455544,2023-08-23 17:41:59.294332,0 days 00:00:00.838788,,0.6000000000000001,2.0,,LightGBM,,,,,0.7000000000000001,,,,2.844090597206379e-07,1.4539679789184563e-05,,90.0,,,,,,,,,,158.0,,,,,,,,,COMPLETE,0.0,,,,,,,,,,,,,,,,,,,,
18,18,0.8320509166904151,2023-08-23 17:41:58.554916,2023-08-23 17:41:59.527684,0 days 00:00:00.972768,,0.7000000000000001,1.0,,LightGBM,,,,,0.9,,,,1.3274841737228536e-08,0.0006657182895882748,,60.0,,,,,,,,,,159.0,,,,,,,,,COMPLETE,0.0,,,,,,,,,,,,,,,,,,,,
19,19,0.8518096323738957,2023-08-23 17:41:58.674750,2023-08-23 17:41:59.221934,0 days 00:00:00.547184,,0.4,2.0,,LightGBM,,,,,0.6000000000000001,,,,9.548365670837068e-06,3.304035917835283e-06,,100.0,,,,,,,,,,3.0,,,,,,,,,COMPLETE,0.0,,,,,,,,,,,,,,,,,,,,
20,20,0.8424242424242425,2023-08-23 17:41:58.813117,2023-08-23 17:41:59.750168,0 days 00:00:00.937051,,0.4,2.0,,LightGBM,,,,,0.6000000000000001,,,,9.943414304934895e-06,1.0083024332801775e-05,,100.0,,,,,,,,,,7.0,,,,,,,,,COMPLETE,0.0,,,,,,,,,,,,,,,,,,,,
21,21,0.8424242424242425,2023-08-23 17:41:58.903014,2023-08-23 17:41:59.811602,0 days 00:00:00.908588,,0.4,2.0,,LightGBM,,,,,0.6000000000000001,,,,2.0495678316964222e-05,3.7295410638575967e-06,,100.0,,,,,,,,,,31.0,,,,,,,,,COMPLETE,0.0,,,,,,,,,,,,,,,,,,,,
22,22,0.833943833943834,2023-08-23 17:41:59.360114,2023-08-23 17:42:00.109360,0 days 00:00:00.749246,,0.4,3.0,,LightGBM,,,,,0.4,,,,0.0006889027257635041,8.442986484569898e-08,,20.0,,,,,,,,,,2.0,,,,,,,,,COMPLETE,0.0,,,,,,,,,,,,,,,,,,,,
23,23,0.873015873015873,2023-08-23 17:41:59.363047,2023-08-23 17:42:00.171996,0 days 00:00:00.808949,,0.4,3.0,,LightGBM,,,,,0.4,,,,0.0012713831855785081,3.813554950725117e-08,,10.0,,,,,,,,,,4.0,,,,,,,,,COMPLETE,1.0,0.875,0.8797178802897445,0.8705357142857143,0.873015873015873,0.9069767441860465,0.8125,0.8571428571428572,0.8524590163934426,0.9285714285714286,0.888888888888889,0.7638376383763837,0.7610250817884405,0.7701555742160342,0.7609470378603437,0.6763358778625954,0.8039927404718693,0.7346600331674958,0.8457142857142858,0.736318407960199,0.7872340425531915
24,24,0.873015873015873,2023-08-23 17:41:59.596137,2023-08-23 17:42:00.487976,0 days 00:00:00.891839,,0.4,3.0,,LightGBM,,,,,0.4,,,,0.0007242313463926529,3.440672940995572e-08,,10.0,,,,,,,,,,4.0,,,,,,,,,COMPLETE,0.0,,,,,,,,,,,,,,,,,,,,
25,25,0.8402457757296466,2023-08-23 17:41:59.884221,2023-08-23 17:42:02.465746,0 days 00:00:02.581525,,,,,RandomForestClassifier,,,,,,,,,,,,,,,,,,,,,,,,94.0,31.0,,,,,,COMPLETE,0.0,,,,,,,,,,,,,,,,,,,,
26,26,0.833943833943834,2023-08-23 17:41:59.886585,2023-08-23 17:42:01.429378,0 days 00:00:01.542793,,0.5,3.0,,LightGBM,,,,,0.4,,,,0.0013795538774403755,2.3252825948783525e-08,,10.0,,,,,,,,,,71.0,,,,,,,,,COMPLETE,0.0,,,,,,,,,,,,,,,,,,,,
27,27,0.8402457757296466,2023-08-23 17:42:00.212812,2023-08-23 17:42:02.964232,0 days 00:00:02.751420,,,,,RandomForestClassifier,,,,,,,,,,,,,,,,,,,,,,,,99.0,24.0,,,,,,COMPLETE,0.0,,,,,,,,,,,,,,,,,,,,
28,28,0.8496385542168674,2023-08-23 17:42:00.223433,2023-08-23 17:42:02.657060,0 days 00:00:02.433627,,,,,RandomForestClassifier,,,,,,,,,,,,,,,,,,,,,,,,93.0,26.0,,,,,,COMPLETE,0.0,,,,,,,,,,,,,,,,,,,,
29,29,0.8308943089430895,2023-08-23 17:42:00.556722,2023-08-23 17:42:03.458838,0 days 00:00:02.902116,,,,,RandomForestClassifier,,,,,,,,,,,,,,,,,,,,,,,,100.0,24.0,,,,,,COMPLETE,0.0,,,,,,,,,,,,,,,,,,,,
30,30,0.8424242424242425,2023-08-23 17:42:00.883196,2023-08-23 17:42:02.000624,0 days 00:00:01.117428,,0.5,3.0,,LightGBM,,,,,0.4,,,,0.012771871833608534,1.9844765007216907e-08,,10.0,,,,,,,,,,72.0,,,,,,,,,COMPLETE,0.0,,,,,,,,,,,,,,,,,,,,
31,31,0.8424242424242425,2023-08-23 17:42:01.500950,2023-08-23 17:42:02.164865,0 days 00:00:00.663915,,0.5,3.0,,LightGBM,,,,,0.4,,,,0.0299542741444829,1.411978958088245e-07,,30.0,,,,,,,,,,73.0,,,,,,,,,COMPLETE,0.0,,,,,,,,,,,,,,,,,,,,
32,32,0.8414029736942432,2023-08-23 17:42:02.075094,2023-08-23 17:42:03.274561,0 days 00:00:01.199467,,0.8,3.0,,LightGBM,,,,,0.5,,,,0.552027716164708,2.0868105083726368e-07,,30.0,,,,,,,,,,245.0,,,,,,,,,COMPLETE,0.0,,,,,,,,,,,,,,,,,,,,
33,33,0.7293493975903615,2023-08-23 17:42:02.259357,2023-08-23 17:42:02.403638,0 days 00:00:00.144281,,,,,DecisionTreeClassifier,,gini,28.0,,,,,,,,,,,,,,,,,,,,,,,,,,,,COMPLETE,0.0,,,,,,,,,,,,,,,,,,,,
34,34,0.3696969696969697,2023-08-23 17:42:02.505640,2023-08-23 17:42:04.824799,0 days 00:00:02.319159,,,,,MLPClassifier,,,,,,,,,,,,,,tanh,adam,1.0,100.0,,,,,,,,,,,,,,COMPLETE,0.0,,,,,,,,,,,,,,,,,,,,
35,35,0.3696969696969697,2023-08-23 17:42:02.508092,2023-08-23 17:42:05.009187,0 days 00:00:02.501095,,,,,MLPClassifier,,,,,,,,,,,,,,tanh,adam,1.0,100.0,,,,,,,,,,,,,,COMPLETE,0.0,,,,,,,,,,,,,,,,,,,,
36,36,0.3696969696969697,2023-08-23 17:42:02.724978,2023-08-23 17:42:16.052912,0 days 00:00:13.327934,,,,,MLPClassifier,,,,,,,,,,,,,,tanh,adam,4.0,100.0,100.0,10.0,100.0,,,,,,,,,,,COMPLETE,0.0,,,,,,,,,,,,,,,,,,,,
37,37,0.3696969696969697,2023-08-23 17:42:03.031336,2023-08-23 17:42:18.990115,0 days 00:00:15.958779,,,,,MLPClassifier,,,,,,,,,,,,,,identity,sgd,4.0,100.0,100.0,10.0,100.0,,,,,,,,,,,COMPLETE,0.0,,,,,,,,,,,,,,,,,,,,
38,38,0.3696969696969697,2023-08-23 17:42:03.368916,2023-08-23 17:42:09.572327,0 days 00:00:06.203411,,,,,MLPClassifier,,,,,,,,,,,,,,tanh,sgd,1.0,100.0,,,,,,,,,,,,,,COMPLETE,0.0,,,,,,,,,,,,,,,,,,,,
39,39,0.3696969696969697,2023-08-23 17:42:03.540036,2023-08-23 17:42:07.212560,0 days 00:00:03.672524,,,,,MLPClassifier,,,,,,,,,,,,,,identity,sgd,1.0,100.0,,,,,,,,,,,,,,COMPLETE,0.0,,,,,,,,,,,,,,,,,,,,
40,40,0.3696969696969697,2023-08-23 17:42:04.961687,2023-08-23 17:42:19.317310,0 days 00:00:14.355623,,,,,MLPClassifier,,,,,,,,,,,,,,identity,sgd,4.0,30.0,100.0,10.0,100.0,,,,,,,,,,,COMPLETE,0.0,,,,,,,,,,,,,,,,,,,,
41,41,0.8507890961262554,2023-08-23 17:42:05.130463,2023-08-23 17:42:06.477218,0 days 00:00:01.346755,,0.4,2.0,,LightGBM,,,,,0.6000000000000001,,,,0.00015783649808177058,5.619541532338441e-07,,10.0,,,,,,,,,,35.0,,,,,,,,,COMPLETE,0.0,,,,,,,,,,,,,,,,,,,,
42,42,0.8227272727272728,2023-08-23 17:42:06.533458,2023-08-23 17:42:07.295910,0 days 00:00:00.762452,,0.4,2.0,,LightGBM,,,,,0.5,,,,1.4037864876565239e-05,1.1219673971833752e-06,,30.0,,,,,,,,,,35.0,,,,,,,,,COMPLETE,0.0,,,,,,,,,,,,,,,,,,,,
43,43,0.8518096323738957,2023-08-23 17:42:07.360814,2023-08-23 17:42:08.157847,0 days 00:00:00.797033,,0.5,3.0,,LightGBM,,,,,0.5,,,,0.00010588645730572728,1.3801047720010863e-08,,60.0,,,,,,,,,,16.0,,,,,,,,,COMPLETE,0.0,,,,,,,,,,,,,,,,,,,,
44,44,0.8518096323738957,2023-08-23 17:42:07.363481,2023-08-23 17:42:08.029394,0 days 00:00:00.665913,,0.5,3.0,,LightGBM,,,,,0.5,,,,0.00010475480693648545,1.59942632351974e-08,,60.0,,,,,,,,,,7.0,,,,,,,,,COMPLETE,0.0,,,,,,,,,,,,,,,,,,,,
45,45,0.8424242424242425,2023-08-23 17:42:08.102407,2023-08-23 17:42:09.332140,0 days 00:00:01.229733,,0.4,2.0,,LightGBM,,,,,0.8,,,,0.0008335120515558093,0.00011680367849245757,,20.0,,,,,,,,,,34.0,,,,,,,,,COMPLETE,0.0,,,,,,,,,,,,,,,,,,,,
46,46,0.3696969696969697,2023-08-23 17:42:08.240738,2023-08-23 17:42:08.418916,0 days 00:00:00.178178,,,,,SVC,,,,,,,,,,,,,,,,,,,,,,,,,,,,,452.16291962083005,poly,COMPLETE,0.0,,,,,,,,,,,,,,,,,,,,
47,47,0.8424242424242425,2023-08-23 17:42:08.513017,2023-08-23 17:42:09.720438,0 days 00:00:01.207421,,0.4,2.0,,LightGBM,,,,,0.8,,,,0.0015356433982165558,0.00013948141324407026,,20.0,,,,,,,,,,52.0,,,,,,,,,COMPLETE,0.0,,,,,,,,,,,,,,,,,,,,
48,48,0.8424242424242425,2023-08-23 17:42:09.414632,2023-08-23 17:42:10.082410,0 days 00:00:00.667778,,0.5,3.0,,LightGBM,,,,,0.5,,,,4.880004830467434e-05,1.4757192286425378e-08,,70.0,,,,,,,,,,5.0,,,,,,,,,COMPLETE,0.0,,,,,,,,,,,,,,,,,,,,
49,49,0.8424242424242425,2023-08-23 17:42:09.677360,2023-08-23 17:42:10.439417,0 days 00:00:00.762057,,0.5,3.0,,LightGBM,,,,,0.5,,,,5.113913866855304e-05,1.1446161922106575e-08,,70.0,,,,,,,,,,5.0,,,,,,,,,COMPLETE,0.0,,,,,,,,,,,,,,,,,,,,
50,50,0.8424242424242425,2023-08-23 17:42:09.824613,2023-08-23 17:42:10.517981,0 days 00:00:00.693368,,0.5,3.0,,LightGBM,,,,,0.5,,,,3.145481896503838e-05,1.0654772290139572e-08,,70.0,,,,,,,,,,5.0,,,,,,,,,COMPLETE,0.0,,,,,,,,,,,,,,,,,,,,
51,51,0.7876932050160397,2023-08-23 17:42:10.155414,2023-08-23 17:42:10.236511,0 days 00:00:00.081097,,,,,DecisionTreeClassifier,,entropy,4.0,,,,,,,,,,,,,,,,,,,,,,,,,,,,COMPLETE,0.0,,,,,,,,,,,,,,,,,,,,
52,52,0.852705126994618,2023-08-23 17:42:10.307918,2023-08-23 17:42:11.313793,0 days 00:00:01.005875,,0.4,3.0,,LightGBM,,,,,0.6000000000000001,,,,4.4329749278181355e-06,1.445276979158291e-07,,80.0,,,,,,,,,,24.0,,,,,,,,,COMPLETE,0.0,,,,,,,,,,,,,,,,,,,,
53,53,0.3696969696969697,2023-08-23 17:42:10.583832,2023-08-23 17:42:10.723475,0 days 00:00:00.139643,1.3205334409026541e-08,,,gblinear,XGBoost,0.2568076754511929,,,,,,,5.289308434414379e-08,,,,,,,,,,,,,,,,,,,,0.2261643866084314,,,COMPLETE,0.0,,,,,,,,,,,,,,,,,,,,
54,54,0.441760601180891,2023-08-23 17:42:10.620797,2023-08-23 17:42:10.878980,0 days 00:00:00.258183,1.5613678245175854e-08,,,gblinear,XGBoost,0.20502171592881308,,,,,,,1.1763150933187157e-08,,,,,,,,,,,,,,,,,,,,0.20623426756487118,,,COMPLETE,0.0,,,,,,,,,,,,,,,,,,,,
55,55,0.3696969696969697,2023-08-23 17:42:10.820805,2023-08-23 17:42:11.101946,0 days 00:00:00.281141,,,,,SVC,,,,,,,,,,,,,,,,,,,,,,,,,,,,,0.001413002844815371,rbf,COMPLETE,0.0,,,,,,,,,,,,,,,,,,,,
56,56,0.3696969696969697,2023-08-23 17:42:10.979833,2023-08-23 17:42:11.221326,0 days 00:00:00.241493,,,,,SVC,,,,,,,,,,,,,,,,,,,,,,,,,,,,,0.0010571479138408283,rbf,COMPLETE,0.0,,,,,,,,,,,,,,,,,,,,
57,57,0.8424242424242425,2023-08-23 17:42:11.199252,2023-08-23 17:42:12.003555,0 days 00:00:00.804303,,0.4,2.0,,LightGBM,,,,,0.6000000000000001,,,,4.1558120993560825e-06,1.38668078188364e-07,,40.0,,,,,,,,,,29.0,,,,,,,,,COMPLETE,0.0,,,,,,,,,,,,,,,,,,,,
58,58,0.8424242424242425,2023-08-23 17:42:11.299158,2023-08-23 17:42:12.090976,0 days 00:00:00.791818,,0.4,3.0,,LightGBM,,,,,0.6000000000000001,,,,0.00022572859108817755,8.853954618559878e-08,,50.0,,,,,,,,,,26.0,,,,,,,,,COMPLETE,0.0,,,,,,,,,,,,,,,,,,,,
59,59,0.852705126994618,2023-08-23 17:42:11.404641,2023-08-23 17:42:11.878448,0 days 00:00:00.473807,,0.4,3.0,,LightGBM,,,,,0.6000000000000001,,,,3.4256869481331046e-06,1.0686940791755454e-07,,80.0,,,,,,,,,,30.0,,,,,,,,,COMPLETE,0.0,,,,,,,,,,,,,,,,,,,,
60,60,0.852705126994618,2023-08-23 17:42:11.993694,2023-08-23 17:42:12.592540,0 days 00:00:00.598846,,0.4,3.0,,LightGBM,,,,,0.6000000000000001,,,,3.915985176230459e-06,1.2110157032672882e-07,,80.0,,,,,,,,,,52.0,,,,,,,,,COMPLETE,0.0,,,,,,,,,,,,,,,,,,,,
61,61,0.852705126994618,2023-08-23 17:42:12.078313,2023-08-23 17:42:12.521969,0 days 00:00:00.443656,,0.4,3.0,,LightGBM,,,,,0.6000000000000001,,,,3.2883058081992563e-06,1.1411029845775443e-06,,80.0,,,,,,,,,,50.0,,,,,,,,,COMPLETE,0.0,,,,,,,,,,,,,,,,,,,,
62,62,0.8629001883239171,2023-08-23 17:42:12.164200,2023-08-23 17:42:12.778791,0 days 00:00:00.614591,,0.4,3.0,,LightGBM,,,,,0.7000000000000001,,,,3.1419849279391056e-06,1.044961320115269e-06,,80.0,,,,,,,,,,54.0,,,,,,,,,COMPLETE,0.0,,,,,,,,,,,,,,,,,,,,
63,63,0.8629001883239171,2023-08-23 17:42:12.656292,2023-08-23 17:42:13.295851,0 days 00:00:00.639559,,0.4,3.0,,LightGBM,,,,,0.7000000000000001,,,,2.0479999389435224e-06,5.151494967496303e-07,,80.0,,,,,,,,,,52.0,,,,,,,,,COMPLETE,0.0,,,,,,,,,,,,,,,,,,,,
64,64,0.8629001883239171,2023-08-23 17:42:12.657515,2023-08-23 17:42:13.222579,0 days 00:00:00.565064,,0.4,3.0,,LightGBM,,,,,0.7000000000000001,,,,2.160694340348716e-06,6.764026094386234e-07,,80.0,,,,,,,,,,96.0,,,,,,,,,COMPLETE,0.0,,,,,,,,,,,,,,,,,,,,
65,65,0.8320509166904151,2023-08-23 17:42:12.873584,2023-08-23 17:42:13.729815,0 days 00:00:00.856231,,0.6000000000000001,3.0,,LightGBM,,,,,0.7000000000000001,,,,1.9006295875394617e-06,4.1021052636838984e-07,,80.0,,,,,,,,,,95.0,,,,,,,,,COMPLETE,0.0,,,,,,,,,,,,,,,,,,,,
66,66,0.8202764976958525,2023-08-23 17:42:13.368946,2023-08-23 17:42:13.524031,0 days 00:00:00.155085,,,,,DecisionTreeClassifier,,log_loss,5.0,,,,,,,,,,,,,,,,,,,,,,,,,,,,COMPLETE,0.0,,,,,,,,,,,,,,,,,,,,
67,67,0.8414029736942432,2023-08-23 17:42:13.436477,2023-08-23 17:42:14.345908,0 days 00:00:00.909431,,0.8,3.0,,LightGBM,,,,,0.7000000000000001,,,,1.140716995858585e-06,4.459124435085445e-07,,80.0,,,,,,,,,,90.0,,,,,,,,,COMPLETE,0.0,,,,,,,,,,,,,,,,,,,,
68,68,0.8308943089430895,2023-08-23 17:42:13.451511,2023-08-23 17:42:14.573927,0 days 00:00:01.122416,,0.9,3.0,,LightGBM,,,,,0.7000000000000001,,,,1.238725684733815e-06,4.136769556403275e-07,,80.0,,,,,,,,,,111.0,,,,,,,,,COMPLETE,0.0,,,,,,,,,,,,,,,,,,,,
69,69,0.8414029736942432,2023-08-23 17:42:13.594740,2023-08-23 17:42:14.667178,0 days 00:00:01.072438,,0.8,3.0,,LightGBM,,,,,0.7000000000000001,,,,1.3342108589785942e-06,4.2987648401534563e-07,,80.0,,,,,,,,,,98.0,,,,,,,,,COMPLETE,0.0,,,,,,,,,,,,,,,,,,,,
70,70,0.8215783454060236,2023-08-23 17:42:13.813405,2023-08-23 17:42:14.854265,0 days 00:00:01.040860,,1.0,3.0,,LightGBM,,,,,0.8,,,,7.565169738113132e-07,4.808913815938342e-08,,90.0,,,,,,,,,,91.0,,,,,,,,,COMPLETE,0.0,,,,,,,,,,,,,,,,,,,,
71,71,0.833943833943834,2023-08-23 17:42:14.174877,2023-08-23 17:42:15.037080,0 days 00:00:00.862203,,0.4,3.0,,LightGBM,,,,,0.8,,,,1.2772221657326133e-06,5.436809286367375e-08,,90.0,,,,,,,,,,119.0,,,,,,,,,COMPLETE,0.0,,,,,,,,,,,,,,,,,,,,
72,72,0.833943833943834,2023-08-23 17:42:14.426261,2023-08-23 17:42:15.295035,0 days 00:00:00.868774,,0.4,3.0,,LightGBM,,,,,0.8,,,,5.602675393522264e-07,5.8448073672159735e-08,,90.0,,,,,,,,,,129.0,,,,,,,,,COMPLETE,0.0,,,,,,,,,,,,,,,,,,,,
73,73,0.833943833943834,2023-08-23 17:42:14.666183,2023-08-23 17:42:15.576429,0 days 00:00:00.910246,,0.4,3.0,,LightGBM,,,,,0.8,,,,4.355062747561979e-07,5.2683118644221424e-08,,90.0,,,,,,,,,,62.0,,,,,,,,,COMPLETE,0.0,,,,,,,,,,,,,,,,,,,,
74,74,0.833943833943834,2023-08-23 17:42:14.780403,2023-08-23 17:42:15.769527,0 days 00:00:00.989124,,0.4,3.0,,LightGBM,,,,,0.8,,,,4.610873063882943e-07,6.847757749754678e-08,,90.0,,,,,,,,,,52.0,,,,,,,,,COMPLETE,0.0,,,,,,,,,,,,,,,,,,,,
75,75,0.8629001883239171,2023-08-23 17:42:14.946137,2023-08-23 17:42:15.969291,0 days 00:00:01.023154,,0.4,3.0,,LightGBM,,,,,0.7000000000000001,,,,2.681221018195713e-07,4.487628636210192e-08,,90.0,,,,,,,,,,49.0,,,,,,,,,COMPLETE,0.0,,,,,,,,,,,,,,,,,,,,
76,76,0.852705126994618,2023-08-23 17:42:15.119399,2023-08-23 17:42:16.124414,0 days 00:00:01.005015,,0.4,1.0,,LightGBM,,,,,0.7000000000000001,,,,2.4225767459651505e-07,5.094837841128271e-08,,90.0,,,,,,,,,,57.0,,,,,,,,,COMPLETE,0.0,,,,,,,,,,,,,,,,,,,,
77,77,0.8227272727272728,2023-08-23 17:42:15.366347,2023-08-23 17:42:16.418871,0 days 00:00:01.052524,,0.6000000000000001,1.0,,LightGBM,,,,,0.7000000000000001,,,,2.1607079507799104e-07,4.4526456325727014e-08,,70.0,,,,,,,,,,45.0,,,,,,,,,COMPLETE,0.0,,,,,,,,,,,,,,,,,,,,
78,78,0.8424242424242425,2023-08-23 17:42:15.647093,2023-08-23 17:42:16.750320,0 days 00:00:01.103227,,0.4,1.0,,LightGBM,,,,,0.7000000000000001,,,,5.276649391863478e-06,1.8219874771988198e-07,,70.0,,,,,,,,,,49.0,,,,,,,,,COMPLETE,0.0,,,,,,,,,,,,,,,,,,,,
79,79,0.873015873015873,2023-08-23 17:42:15.866954,2023-08-23 17:42:17.138072,0 days 00:00:01.271118,,0.4,3.0,,LightGBM,,,,,0.7000000000000001,,,,4.67272921581433e-06,1.9729837080299633e-07,,70.0,,,,,,,,,,46.0,,,,,,,,,COMPLETE,0.0,,,,,,,,,,,,,,,,,,,,
80,80,0.8424242424242425,2023-08-23 17:42:16.121935,2023-08-23 17:42:17.370795,0 days 00:00:01.248860,,0.4,1.0,,LightGBM,,,,,0.7000000000000001,,,,5.880559469534699e-06,1.8462555940557697e-07,,70.0,,,,,,,,,,20.0,,,,,,,,,COMPLETE,0.0,,,,,,,,,,,,,,,,,,,,
81,81,0.8621212121212121,2023-08-23 17:42:16.201389,2023-08-23 17:42:16.683813,0 days 00:00:00.482424,,,,,RandomForestClassifier,,,,,,,,,,,,,,,,,,,,,,,,10.0,6.0,,,,,,COMPLETE,0.0,,,,,,,,,,,,,,,,,,,,
82,82,0.8507890961262554,2023-08-23 17:42:16.242885,2023-08-23 17:42:16.812246,0 days 00:00:00.569361,,,,,RandomForestClassifier,,,,,,,,,,,,,,,,,,,,,,,,12.0,7.0,,,,,,COMPLETE,0.0,,,,,,,,,,,,,,,,,,,,
