,number,value,datetime_start,datetime_complete,duration,params_alpha,params_bagging_fraction,params_bagging_freq,params_booster,params_classifier,params_colsample_bytree,params_dct_criterion,params_dct_max_depth,params_eta,params_feature_fraction,params_gamma,params_grow_policy,params_lambda,params_lambda_l1,params_lambda_l2,params_max_depth,params_min_child_samples,params_min_child_weight,params_mlp_activation,params_mlp_solver,params_n_layers,params_n_units_l_0,params_n_units_l_1,params_n_units_l_2,params_n_units_l_3,params_normalize_type,params_num_leaves,params_rate_drop,params_rf_estimator,params_rf_max_depth,params_sample_type,params_skip_drop,params_subsample,params_svc_c,params_svc_kernel,state,best_trial,dev_acc,dev_recall_macro,dev_precision_macro,dev_f1_macro,dev_recall_0,dev_precision_0,dev_f1_0,dev_recall_1,dev_precision_1,dev_f1_1,test_acc,test_recall_macro,test_precision_macro,test_f1_macro,test_recall_0,test_precision_0,test_f1_0,test_recall_1,test_precision_1,test_f1_1
91,91,0.6386008154240617,2023-08-23 19:57:45.727657,2023-08-23 19:58:01.439723,0 days 00:00:15.712066,,,,,RandomForestClassifier,,,,,,,,,,,,,,,,,,,,,,,,82.0,10.0,,,,,,COMPLETE,0.0,,,,,,,,,,,,,,,,,,,,
92,92,0.648654592417423,2023-08-23 19:57:51.646508,2023-08-23 19:58:08.788686,0 days 00:00:17.142178,,,,,RandomForestClassifier,,,,,,,,,,,,,,,,,,,,,,,,83.0,11.0,,,,,,COMPLETE,0.0,,,,,,,,,,,,,,,,,,,,
93,93,0.63948855426472,2023-08-23 19:57:52.463529,2023-08-23 19:58:05.756135,0 days 00:00:13.292606,,,,,RandomForestClassifier,,,,,,,,,,,,,,,,,,,,,,,,82.0,8.0,,,,,,COMPLETE,0.0,,,,,,,,,,,,,,,,,,,,
94,94,0.6452585575717318,2023-08-23 19:57:52.888184,2023-08-23 19:58:06.130029,0 days 00:00:13.241845,,,,,RandomForestClassifier,,,,,,,,,,,,,,,,,,,,,,,,82.0,8.0,,,,,,COMPLETE,0.0,,,,,,,,,,,,,,,,,,,,
95,95,0.6431398964164999,2023-08-23 19:58:01.530835,2023-08-23 19:58:16.285229,0 days 00:00:14.754394,,,,,RandomForestClassifier,,,,,,,,,,,,,,,,,,,,,,,,86.0,8.0,,,,,,COMPLETE,0.0,,,,,,,,,,,,,,,,,,,,
96,96,0.6301655891124105,2023-08-23 19:58:05.840678,2023-08-23 19:58:06.794121,0 days 00:00:00.953443,1.667798803294728e-08,,,dart,XGBoost,0.6263230203520663,,,0.0012363706825826576,,1.1283578613763318e-08,lossguide,0.002276543940321838,,,7.0,,7.0,,,,,,,,tree,,1.8231006260862204e-08,,,weighted,0.24524562676401768,0.20358240742909134,,,COMPLETE,0.0,,,,,,,,,,,,,,,,,,,,
97,97,0.4974271764692947,2023-08-23 19:58:06.240669,2023-08-23 19:58:06.539451,0 days 00:00:00.298782,1.5563177506215955e-08,,,gblinear,XGBoost,0.6145847004595302,,,,,,,0.002050633271323702,,,,,,,,,,,,,,,,,,,,0.5036275412537818,,,COMPLETE,0.0,,,,,,,,,,,,,,,,,,,,
98,98,0.636910733565515,2023-08-23 19:58:06.625728,2023-08-23 19:58:21.082729,0 days 00:00:14.457001,,,,,RandomForestClassifier,,,,,,,,,,,,,,,,,,,,,,,,86.0,8.0,,,,,,COMPLETE,0.0,,,,,,,,,,,,,,,,,,,,
99,99,0.6329053561908928,2023-08-23 19:58:06.913400,2023-08-23 19:58:21.424853,0 days 00:00:14.511453,,,,,RandomForestClassifier,,,,,,,,,,,,,,,,,,,,,,,,86.0,8.0,,,,,,COMPLETE,0.0,,,,,,,,,,,,,,,,,,,,
100,100,0.6415079872553096,2023-08-23 19:58:08.935427,2023-08-23 19:58:20.425924,0 days 00:00:11.490497,,,,,RandomForestClassifier,,,,,,,,,,,,,,,,,,,,,,,,53.0,14.0,,,,,,COMPLETE,0.0,,,,,,,,,,,,,,,,,,,,
101,101,0.6249175133223767,2023-08-23 19:58:16.384122,2023-08-23 19:58:18.828798,0 days 00:00:02.444676,,,,,RandomForestClassifier,,,,,,,,,,,,,,,,,,,,,,,,11.0,13.0,,,,,,COMPLETE,0.0,,,,,,,,,,,,,,,,,,,,
102,102,0.6286466973337477,2023-08-23 19:58:18.917156,2023-08-23 19:58:30.816934,0 days 00:00:11.899778,,,,,RandomForestClassifier,,,,,,,,,,,,,,,,,,,,,,,,57.0,11.0,,,,,,COMPLETE,0.0,,,,,,,,,,,,,,,,,,,,
103,103,0.6088891593828369,2023-08-23 19:58:20.507458,2023-08-23 19:58:20.623744,0 days 00:00:00.116286,,,,,DecisionTreeClassifier,,gini,2.0,,,,,,,,,,,,,,,,,,,,,,,,,,,,COMPLETE,0.0,,,,,,,,,,,,,,,,,,,,
104,104,0.6421099297258456,2023-08-23 19:58:20.677049,2023-08-23 19:58:40.633053,0 days 00:00:19.956004,,,,,RandomForestClassifier,,,,,,,,,,,,,,,,,,,,,,,,93.0,11.0,,,,,,COMPLETE,0.0,,,,,,,,,,,,,,,,,,,,
105,105,0.6482334193287527,2023-08-23 19:58:21.151143,2023-08-23 19:58:29.177722,0 days 00:00:08.026579,,,,,RandomForestClassifier,,,,,,,,,,,,,,,,,,,,,,,,39.0,11.0,,,,,,COMPLETE,0.0,,,,,,,,,,,,,,,,,,,,
106,106,0.5804371020478403,2023-08-23 19:58:21.550737,2023-08-23 20:07:20.374754,0 days 00:08:58.824017,,,,,MLPClassifier,,,,,,,,,,,,,,logistic,adam,4.0,10.0,100.0,100.0,10.0,,,,,,,,,,,COMPLETE,0.0,,,,,,,,,,,,,,,,,,,,
107,107,0.5981374801800463,2023-08-23 19:58:29.259490,2023-08-23 20:04:29.900783,0 days 00:06:00.641293,,,,,MLPClassifier,,,,,,,,,,,,,,relu,lbfgs,4.0,10.0,100.0,90.0,20.0,,,,,,,,,,,COMPLETE,0.0,,,,,,,,,,,,,,,,,,,,
108,108,0.6355261816956578,2023-08-23 19:58:30.903966,2023-08-23 19:58:39.624891,0 days 00:00:08.720925,,,,,RandomForestClassifier,,,,,,,,,,,,,,,,,,,,,,,,36.0,11.0,,,,,,COMPLETE,0.0,,,,,,,,,,,,,,,,,,,,
109,109,0.6424570903927062,2023-08-23 19:58:39.712574,2023-08-23 19:58:59.166712,0 days 00:00:19.454138,,,,,RandomForestClassifier,,,,,,,,,,,,,,,,,,,,,,,,80.0,11.0,,,,,,COMPLETE,0.0,,,,,,,,,,,,,,,,,,,,
110,110,0.6357036742517459,2023-08-23 19:58:40.724717,2023-08-23 19:58:58.816965,0 days 00:00:18.092248,,,,,RandomForestClassifier,,,,,,,,,,,,,,,,,,,,,,,,79.0,10.0,,,,,,COMPLETE,0.0,,,,,,,,,,,,,,,,,,,,
111,111,0.6217119270316286,2023-08-23 19:58:58.895402,2023-08-23 20:08:44.408967,0 days 00:09:45.513565,,,,,MLPClassifier,,,,,,,,,,,,,,relu,adam,4.0,10.0,100.0,100.0,10.0,,,,,,,,,,,COMPLETE,0.0,,,,,,,,,,,,,,,,,,,,
112,112,0.5686811687386765,2023-08-23 19:58:59.251463,2023-08-23 20:04:59.048274,0 days 00:05:59.796811,,,,,MLPClassifier,,,,,,,,,,,,,,relu,lbfgs,4.0,10.0,100.0,100.0,10.0,,,,,,,,,,,COMPLETE,0.0,,,,,,,,,,,,,,,,,,,,
