,number,value,datetime_start,datetime_complete,duration,params_alpha,params_bagging_fraction,params_bagging_freq,params_booster,params_classifier,params_colsample_bytree,params_dct_criterion,params_dct_max_depth,params_eta,params_feature_fraction,params_gamma,params_grow_policy,params_lambda,params_lambda_l1,params_lambda_l2,params_max_depth,params_min_child_samples,params_min_child_weight,params_mlp_activation,params_mlp_solver,params_n_layers,params_n_units_l_0,params_n_units_l_1,params_n_units_l_2,params_n_units_l_3,params_normalize_type,params_num_leaves,params_rate_drop,params_rf_estimator,params_rf_max_depth,params_sample_type,params_skip_drop,params_subsample,params_svc_c,params_svc_kernel,state,best_trial,dev_acc,dev_recall_macro,dev_precision_macro,dev_f1_macro,dev_recall_0,dev_precision_0,dev_f1_0,dev_recall_1,dev_precision_1,dev_f1_1,test_acc,test_recall_macro,test_precision_macro,test_f1_macro,test_recall_0,test_precision_0,test_f1_0,test_recall_1,test_precision_1,test_f1_1
0,0,0.5654034405974584,2023-08-23 19:52:39.143516,2023-08-23 19:52:39.478180,0 days 00:00:00.334664,,,,,DecisionTreeClassifier,,log_loss,3.0,,,,,,,,,,,,,,,,,,,,,,,,,,,,COMPLETE,0.0,,,,,,,,,,,,,,,,,,,,
1,1,0.61904977501399,2023-08-23 19:52:39.146793,2023-08-23 19:52:39.722681,0 days 00:00:00.575888,3.102950750331965e-08,,,gbtree,XGBoost,0.3738200549977946,,,9.28272470559704e-06,,0.009345478632989174,lossguide,1.3947403661359514e-06,,,9.0,,3.0,,,,,,,,,,,,,,,0.6863110791639757,,,COMPLETE,0.0,,,,,,,,,,,,,,,,,,,,
2,2,0.6088891593828369,2023-08-23 19:52:39.147612,2023-08-23 19:52:39.276466,0 days 00:00:00.128854,,,,,DecisionTreeClassifier,,gini,2.0,,,,,,,,,,,,,,,,,,,,,,,,,,,,COMPLETE,0.0,,,,,,,,,,,,,,,,,,,,
3,3,0.615235562605457,2023-08-23 19:52:39.149926,2023-08-23 19:52:41.035309,0 days 00:00:01.885383,,0.5,2.0,,LightGBM,,,,,0.8,,,,1.356002412333962e-08,2.9948051300230006e-05,,20.0,,,,,,,,,,45.0,,,,,,,,,COMPLETE,0.0,,,,,,,,,,,,,,,,,,,,
4,4,0.45206415358600777,2023-08-23 19:52:39.152300,2023-08-23 19:53:13.798792,0 days 00:00:34.646492,,,,,SVC,,,,,,,,,,,,,,,,,,,,,,,,,,,,,2.206140367795449,linear,COMPLETE,0.0,,,,,,,,,,,,,,,,,,,,
5,5,0.5785122069752051,2023-08-23 19:52:39.157417,2023-08-23 20:07:32.590893,0 days 00:14:53.433476,,,,,MLPClassifier,,,,,,,,,,,,,,logistic,adam,4.0,50.0,100.0,60.0,90.0,,,,,,,,,,,COMPLETE,0.0,,,,,,,,,,,,,,,,,,,,
6,6,0.3358178053830228,2023-08-23 19:52:39.162144,2023-08-23 19:52:47.739093,0 days 00:00:08.576949,,,,,MLPClassifier,,,,,,,,,,,,,,logistic,sgd,3.0,50.0,10.0,10.0,,,,,,,,,,,,COMPLETE,0.0,,,,,,,,,,,,,,,,,,,,
7,7,0.6168290147040714,2023-08-23 19:52:39.163270,2023-08-23 19:52:42.956920,0 days 00:00:03.793650,,,,,RandomForestClassifier,,,,,,,,,,,,,,,,,,,,,,,,17.0,12.0,,,,,,COMPLETE,0.0,,,,,,,,,,,,,,,,,,,,
8,8,0.5693556824149448,2023-08-23 19:52:39.369248,2023-08-23 19:53:37.238562,0 days 00:00:57.869314,,,,,MLPClassifier,,,,,,,,,,,,,,identity,lbfgs,3.0,10.0,50.0,50.0,,,,,,,,,,,,COMPLETE,0.0,,,,,,,,,,,,,,,,,,,,
9,9,0.6193758697961529,2023-08-23 19:52:39.578680,2023-08-23 19:52:40.009664,0 days 00:00:00.430984,0.3439360791339272,,,gbtree,XGBoost,0.38483598891765514,,,1.5225903618675903e-06,,5.3218859821833005e-06,depthwise,0.002242074946920416,,,3.0,,6.0,,,,,,,,,,,,,,,0.9335502885781821,,,COMPLETE,0.0,,,,,,,,,,,,,,,,,,,,
10,10,0.5070146359140233,2023-08-23 19:52:39.828553,2023-08-23 19:52:39.895973,0 days 00:00:00.067420,0.0016033903942897576,,,gblinear,XGBoost,0.26963982310031165,,,,,,,3.018675032768917e-05,,,,,,,,,,,,,,,,,,,,0.2999621545430851,,,COMPLETE,0.0,,,,,,,,,,,,,,,,,,,,
11,11,0.6336894173325527,2023-08-23 19:52:40.078952,2023-08-23 19:52:42.683045,0 days 00:00:02.604093,,0.6000000000000001,2.0,,LightGBM,,,,,0.9,,,,0.0007357288023584654,0.19482057924566923,,80.0,,,,,,,,,,75.0,,,,,,,,,COMPLETE,0.0,,,,,,,,,,,,,,,,,,,,
12,12,0.6159554484199885,2023-08-23 19:52:40.104770,2023-08-23 19:52:40.565280,0 days 00:00:00.460510,0.07403865974907295,,,gbtree,XGBoost,0.29904886266043457,,,0.03846379261115364,,0.5423796873619473,lossguide,1.4107590435287655e-06,,,9.0,,4.0,,,,,,,,,,,,,,,0.6558207084908916,,,COMPLETE,0.0,,,,,,,,,,,,,,,,,,,,
13,13,0.3358178053830228,2023-08-23 19:52:40.646015,2023-08-23 19:52:40.700675,0 days 00:00:00.054660,0.01943982650314593,,,gblinear,XGBoost,0.4730003934428984,,,,,,,1.915092648369485e-07,,,,,,,,,,,,,,,,,,,,0.29328298397216507,,,COMPLETE,0.0,,,,,,,,,,,,,,,,,,,,
14,14,0.6502555859375574,2023-08-23 19:52:40.790568,2023-08-23 19:52:42.071093,0 days 00:00:01.280525,,,,,RandomForestClassifier,,,,,,,,,,,,,,,,,,,,,,,,12.0,6.0,,,,,,COMPLETE,0.0,,,,,,,,,,,,,,,,,,,,
15,15,0.3358178053830228,2023-08-23 19:52:41.094158,2023-08-23 19:55:49.090916,0 days 00:03:07.996758,,,,,MLPClassifier,,,,,,,,,,,,,,relu,sgd,4.0,70.0,30.0,60.0,70.0,,,,,,,,,,,COMPLETE,0.0,,,,,,,,,,,,,,,,,,,,
16,16,0.5974230192768089,2023-08-23 19:52:42.164753,2023-08-23 19:52:42.399811,0 days 00:00:00.235058,,,,,DecisionTreeClassifier,,gini,5.0,,,,,,,,,,,,,,,,,,,,,,,,,,,,COMPLETE,0.0,,,,,,,,,,,,,,,,,,,,
17,17,0.6184838946347004,2023-08-23 19:52:42.501388,2023-08-23 19:52:43.862409,0 days 00:00:01.361021,,,,,RandomForestClassifier,,,,,,,,,,,,,,,,,,,,,,,,11.0,6.0,,,,,,COMPLETE,0.0,,,,,,,,,,,,,,,,,,,,
18,18,0.6215791129285939,2023-08-23 19:52:42.784125,2023-08-23 19:52:44.670885,0 days 00:00:01.886760,,,,,RandomForestClassifier,,,,,,,,,,,,,,,,,,,,,,,,14.0,6.0,,,,,,COMPLETE,0.0,,,,,,,,,,,,,,,,,,,,
19,19,0.6188745091771287,2023-08-23 19:52:43.078032,2023-08-23 19:52:47.856733,0 days 00:00:04.778701,,0.9,2.0,,LightGBM,,,,,1.0,,,,0.05067980215113633,0.839312692887584,,100.0,,,,,,,,,,180.0,,,,,,,,,COMPLETE,0.0,,,,,,,,,,,,,,,,,,,,
20,20,0.42596183355420314,2023-08-23 19:52:43.989683,2023-08-23 19:53:17.274954,0 days 00:00:33.285271,,,,,MLPClassifier,,,,,,,,,,,,,,identity,sgd,1.0,60.0,,,,,,,,,,,,,,COMPLETE,0.0,,,,,,,,,,,,,,,,,,,,
21,21,0.6129857997282919,2023-08-23 19:52:44.748639,2023-08-23 19:52:49.502197,0 days 00:00:04.753558,,0.9,2.0,,LightGBM,,,,,1.0,,,,0.117516938486396,0.7161855052710651,,100.0,,,,,,,,,,190.0,,,,,,,,,COMPLETE,0.0,,,,,,,,,,,,,,,,,,,,
22,22,0.3358178053830228,2023-08-23 19:52:47.981027,2023-08-23 19:53:29.433511,0 days 00:00:41.452484,,,,,SVC,,,,,,,,,,,,,,,,,,,,,,,,,,,,,0.0014722664857995825,poly,COMPLETE,0.0,,,,,,,,,,,,,,,,,,,,
23,23,0.366374535739884,2023-08-23 19:52:47.981891,2023-08-23 19:53:21.373920,0 days 00:00:33.392029,,,,,SVC,,,,,,,,,,,,,,,,,,,,,,,,,,,,,0.059823301657902256,linear,COMPLETE,0.0,,,,,,,,,,,,,,,,,,,,
24,24,0.3358178053830228,2023-08-23 19:52:49.565996,2023-08-23 19:53:28.914368,0 days 00:00:39.348372,,,,,SVC,,,,,,,,,,,,,,,,,,,,,,,,,,,,,3.7124663445101946,poly,COMPLETE,0.0,,,,,,,,,,,,,,,,,,,,
25,25,0.5958970146960806,2023-08-23 19:53:13.865856,2023-08-23 19:55:42.511575,0 days 00:02:28.645719,,,,,MLPClassifier,,,,,,,,,,,,,,tanh,lbfgs,1.0,100.0,,,,,,,,,,,,,,COMPLETE,0.0,,,,,,,,,,,,,,,,,,,,
26,26,0.3358178053830228,2023-08-23 19:53:17.383881,2023-08-23 19:54:06.621094,0 days 00:00:49.237213,,,,,SVC,,,,,,,,,,,,,,,,,,,,,,,,,,,,,0.0012708397169995556,rbf,COMPLETE,0.0,,,,,,,,,,,,,,,,,,,,
27,27,0.6152565601244925,2023-08-23 19:53:21.500819,2023-08-23 19:53:24.973811,0 days 00:00:03.472992,,,,,RandomForestClassifier,,,,,,,,,,,,,,,,,,,,,,,,80.0,2.0,,,,,,COMPLETE,0.0,,,,,,,,,,,,,,,,,,,,
28,28,0.631624999459276,2023-08-23 19:53:25.102635,2023-08-23 19:53:28.122596,0 days 00:00:03.019961,,,,,RandomForestClassifier,,,,,,,,,,,,,,,,,,,,,,,,35.0,6.0,,,,,,COMPLETE,0.0,,,,,,,,,,,,,,,,,,,,
29,29,0.6146276672060291,2023-08-23 19:53:28.187073,2023-08-23 19:53:37.422105,0 days 00:00:09.235032,,,,,RandomForestClassifier,,,,,,,,,,,,,,,,,,,,,,,,47.0,30.0,,,,,,COMPLETE,0.0,,,,,,,,,,,,,,,,,,,,
30,30,0.6332516740160052,2023-08-23 19:53:28.982680,2023-08-23 19:53:37.745636,0 days 00:00:08.762956,,,,,RandomForestClassifier,,,,,,,,,,,,,,,,,,,,,,,,46.0,24.0,,,,,,COMPLETE,0.0,,,,,,,,,,,,,,,,,,,,
31,31,0.6139361192507015,2023-08-23 19:53:29.516866,2023-08-23 19:53:39.279802,0 days 00:00:09.762936,,,,,RandomForestClassifier,,,,,,,,,,,,,,,,,,,,,,,,47.0,28.0,,,,,,COMPLETE,0.0,,,,,,,,,,,,,,,,,,,,
32,32,0.6141305959652623,2023-08-23 19:53:37.364552,2023-08-23 19:53:48.608211,0 days 00:00:11.243659,,,,,RandomForestClassifier,,,,,,,,,,,,,,,,,,,,,,,,47.0,32.0,,,,,,COMPLETE,0.0,,,,,,,,,,,,,,,,,,,,
33,33,0.6165781761363195,2023-08-23 19:53:37.532641,2023-08-23 19:53:39.689728,0 days 00:00:02.157087,,0.5,1.0,,LightGBM,,,,,0.4,,,,5.83153617980337e-05,2.8763349488223524e-08,,60.0,,,,,,,,,,48.0,,,,,,,,,COMPLETE,0.0,,,,,,,,,,,,,,,,,,,,
34,34,0.6267170757299549,2023-08-23 19:53:37.852926,2023-08-23 19:53:39.587215,0 days 00:00:01.734289,,0.5,3.0,,LightGBM,,,,,0.5,,,,0.00010417245160892574,3.4543727382054195e-08,,60.0,,,,,,,,,,53.0,,,,,,,,,COMPLETE,0.0,,,,,,,,,,,,,,,,,,,,
35,35,0.6349154285455494,2023-08-23 19:53:39.388880,2023-08-23 19:53:41.164145,0 days 00:00:01.775265,,0.5,1.0,,LightGBM,,,,,0.4,,,,0.00010151852085242683,1.7449795340899388e-07,,60.0,,,,,,,,,,43.0,,,,,,,,,COMPLETE,0.0,,,,,,,,,,,,,,,,,,,,
36,36,0.6453381614397431,2023-08-23 19:53:39.746763,2023-08-23 19:53:52.328265,0 days 00:00:12.581502,,,,,RandomForestClassifier,,,,,,,,,,,,,,,,,,,,,,,,74.0,13.0,,,,,,COMPLETE,0.0,,,,,,,,,,,,,,,,,,,,
37,37,0.6353476871141022,2023-08-23 19:53:39.752620,2023-08-23 19:53:53.072433,0 days 00:00:13.319813,,,,,RandomForestClassifier,,,,,,,,,,,,,,,,,,,,,,,,77.0,13.0,,,,,,COMPLETE,0.0,,,,,,,,,,,,,,,,,,,,
38,38,0.6230267809889823,2023-08-23 19:53:41.269274,2023-08-23 19:53:43.932175,0 days 00:00:02.662901,,0.7000000000000001,1.0,,LightGBM,,,,,0.7000000000000001,,,,0.00044791411104338114,0.0009812256352127375,,70.0,,,,,,,,,,111.0,,,,,,,,,COMPLETE,0.0,,,,,,,,,,,,,,,,,,,,
39,39,0.6274177144479872,2023-08-23 19:53:44.035907,2023-08-23 19:53:44.514426,0 days 00:00:00.478519,,0.7000000000000001,1.0,,LightGBM,,,,,0.8,,,,0.0005529015833351899,8.773306832333062e-06,,30.0,,,,,,,,,,3.0,,,,,,,,,COMPLETE,0.0,,,,,,,,,,,,,,,,,,,,
40,40,0.5623303604918501,2023-08-23 19:53:44.582790,2023-08-23 19:53:46.030773,0 days 00:00:01.447983,,,,,DecisionTreeClassifier,,entropy,31.0,,,,,,,,,,,,,,,,,,,,,,,,,,,,COMPLETE,0.0,,,,,,,,,,,,,,,,,,,,
41,41,0.6283867383464785,2023-08-23 19:53:46.122961,2023-08-23 19:53:48.041128,0 days 00:00:01.918167,,0.4,3.0,,LightGBM,,,,,0.5,,,,8.527032768442619e-06,0.0050189667902824815,,80.0,,,,,,,,,,107.0,,,,,,,,,COMPLETE,0.0,,,,,,,,,,,,,,,,,,,,
42,42,0.6293515348378729,2023-08-23 19:53:48.107802,2023-08-23 19:54:00.792465,0 days 00:00:12.684663,,,,,RandomForestClassifier,,,,,,,,,,,,,,,,,,,,,,,,75.0,13.0,,,,,,COMPLETE,0.0,,,,,,,,,,,,,,,,,,,,
43,43,0.6150063903388938,2023-08-23 19:53:48.729787,2023-08-23 19:53:53.919598,0 days 00:00:05.189811,,0.6000000000000001,1.0,,LightGBM,,,,,0.9,,,,0.0055487215409842075,5.972938881034883e-07,,40.0,,,,,,,,,,243.0,,,,,,,,,COMPLETE,0.0,,,,,,,,,,,,,,,,,,,,
44,44,0.6196928505054404,2023-08-23 19:53:52.432855,2023-08-23 19:53:55.568045,0 days 00:00:03.135190,,0.6000000000000001,1.0,,LightGBM,,,,,0.9,,,,0.004322775723306001,8.479934089020043e-07,,40.0,,,,,,,,,,88.0,,,,,,,,,COMPLETE,0.0,,,,,,,,,,,,,,,,,,,,
45,45,0.6301775332290609,2023-08-23 19:53:53.193178,2023-08-23 19:54:04.420879,0 days 00:00:11.227701,,,,,RandomForestClassifier,,,,,,,,,,,,,,,,,,,,,,,,78.0,12.0,,,,,,COMPLETE,0.0,,,,,,,,,,,,,,,,,,,,
46,46,0.6441108590617639,2023-08-23 19:53:54.068594,2023-08-23 19:54:04.714025,0 days 00:00:10.645431,,,,,RandomForestClassifier,,,,,,,,,,,,,,,,,,,,,,,,76.0,12.0,,,,,,COMPLETE,0.0,,,,,,,,,,,,,,,,,,,,
47,47,0.6377336155183593,2023-08-23 19:53:55.705047,2023-08-23 19:54:07.464433,0 days 00:00:11.759386,,,,,RandomForestClassifier,,,,,,,,,,,,,,,,,,,,,,,,76.0,12.0,,,,,,COMPLETE,0.0,,,,,,,,,,,,,,,,,,,,
48,48,0.6407974351464696,2023-08-23 19:54:00.870239,2023-08-23 19:54:19.415188,0 days 00:00:18.544949,,,,,RandomForestClassifier,,,,,,,,,,,,,,,,,,,,,,,,99.0,11.0,,,,,,COMPLETE,0.0,,,,,,,,,,,,,,,,,,,,
49,49,0.6317159158464973,2023-08-23 19:54:04.480983,2023-08-23 20:07:00.701157,0 days 00:12:56.220174,,,,,MLPClassifier,,,,,,,,,,,,,,relu,adam,1.0,100.0,,,,,,,,,,,,,,COMPLETE,0.0,,,,,,,,,,,,,,,,,,,,
50,50,0.6393317153087262,2023-08-23 19:54:04.824390,2023-08-23 19:54:23.134712,0 days 00:00:18.310322,,,,,RandomForestClassifier,,,,,,,,,,,,,,,,,,,,,,,,97.0,10.0,,,,,,COMPLETE,0.0,,,,,,,,,,,,,,,,,,,,
51,51,0.6438529516933713,2023-08-23 19:54:06.721358,2023-08-23 19:54:25.773178,0 days 00:00:19.051820,,,,,RandomForestClassifier,,,,,,,,,,,,,,,,,,,,,,,,96.0,10.0,,,,,,COMPLETE,0.0,,,,,,,,,,,,,,,,,,,,
52,52,0.6408946368589359,2023-08-23 19:54:07.566039,2023-08-23 19:54:26.557332,0 days 00:00:18.991293,,,,,RandomForestClassifier,,,,,,,,,,,,,,,,,,,,,,,,96.0,11.0,,,,,,COMPLETE,0.0,,,,,,,,,,,,,,,,,,,,
53,53,0.6385802638939673,2023-08-23 19:54:19.493711,2023-08-23 19:54:37.078873,0 days 00:00:17.585162,,,,,RandomForestClassifier,,,,,,,,,,,,,,,,,,,,,,,,96.0,9.0,,,,,,COMPLETE,0.0,,,,,,,,,,,,,,,,,,,,
54,54,0.6468990775644583,2023-08-23 19:54:23.272779,2023-08-23 19:54:42.301605,0 days 00:00:19.028826,,,,,RandomForestClassifier,,,,,,,,,,,,,,,,,,,,,,,,99.0,9.0,,,,,,COMPLETE,0.0,,,,,,,,,,,,,,,,,,,,
55,55,0.6356027902902903,2023-08-23 19:54:25.920761,2023-08-23 19:54:41.534531,0 days 00:00:15.613770,,,,,RandomForestClassifier,,,,,,,,,,,,,,,,,,,,,,,,91.0,8.0,,,,,,COMPLETE,0.0,,,,,,,,,,,,,,,,,,,,
56,56,0.633975659229209,2023-08-23 19:54:26.688698,2023-08-23 19:54:41.420091,0 days 00:00:14.731393,,,,,RandomForestClassifier,,,,,,,,,,,,,,,,,,,,,,,,88.0,8.0,,,,,,COMPLETE,0.0,,,,,,,,,,,,,,,,,,,,
57,57,0.6242137293948747,2023-08-23 19:54:37.160884,2023-08-23 20:07:39.256496,0 days 00:13:02.095612,,,,,MLPClassifier,,,,,,,,,,,,,,relu,adam,1.0,100.0,,,,,,,,,,,,,,COMPLETE,0.0,,,,,,,,,,,,,,,,,,,,
58,58,0.5745551973583507,2023-08-23 19:54:41.484938,2023-08-23 19:55:58.154618,0 days 00:01:16.669680,,,,,MLPClassifier,,,,,,,,,,,,,,tanh,adam,1.0,100.0,,,,,,,,,,,,,,COMPLETE,0.0,,,,,,,,,,,,,,,,,,,,
59,59,0.632822127979199,2023-08-23 19:54:41.702554,2023-08-23 20:07:44.240137,0 days 00:13:02.537583,,,,,MLPClassifier,,,,,,,,,,,,,,relu,adam,1.0,100.0,,,,,,,,,,,,,,COMPLETE,0.0,,,,,,,,,,,,,,,,,,,,
60,60,0.5672699770646392,2023-08-23 19:54:42.373643,2023-08-23 19:55:32.115483,0 days 00:00:49.741840,,,,,MLPClassifier,,,,,,,,,,,,,,tanh,adam,1.0,100.0,,,,,,,,,,,,,,COMPLETE,0.0,,,,,,,,,,,,,,,,,,,,
61,61,0.6026786530206398,2023-08-23 19:55:32.207162,2023-08-23 19:55:33.193982,0 days 00:00:00.986820,,,,,DecisionTreeClassifier,,log_loss,12.0,,,,,,,,,,,,,,,,,,,,,,,,,,,,COMPLETE,0.0,,,,,,,,,,,,,,,,,,,,
62,62,0.6225001832276744,2023-08-23 19:55:33.274616,2023-08-23 19:55:48.846181,0 days 00:00:15.571565,,,,,RandomForestClassifier,,,,,,,,,,,,,,,,,,,,,,,,65.0,16.0,,,,,,COMPLETE,0.0,,,,,,,,,,,,,,,,,,,,
63,63,0.5139209417403776,2023-08-23 19:55:42.605572,2023-08-23 19:55:43.550529,0 days 00:00:00.944957,1.591191540323733e-05,,,dart,XGBoost,0.9603239257925548,,,1.779417225683061e-08,,2.9259046195389046e-08,depthwise,0.9522971665306754,,,3.0,,10.0,,,,,,,,tree,,8.906792012684222e-08,,,weighted,0.05711269458502232,0.9423422729906383,,,COMPLETE,0.0,,,,,,,,,,,,,,,,,,,,
64,64,0.6350472117852585,2023-08-23 19:55:43.639666,2023-08-23 19:55:56.961148,0 days 00:00:13.321482,,,,,RandomForestClassifier,,,,,,,,,,,,,,,,,,,,,,,,64.0,16.0,,,,,,COMPLETE,0.0,,,,,,,,,,,,,,,,,,,,
65,65,0.637459350806508,2023-08-23 19:55:48.984423,2023-08-23 19:56:03.012044,0 days 00:00:14.027621,,,,,RandomForestClassifier,,,,,,,,,,,,,,,,,,,,,,,,88.0,8.0,,,,,,COMPLETE,0.0,,,,,,,,,,,,,,,,,,,,
66,66,0.6473741035988808,2023-08-23 19:55:49.241972,2023-08-23 19:56:03.468107,0 days 00:00:14.226135,,,,,RandomForestClassifier,,,,,,,,,,,,,,,,,,,,,,,,87.0,8.0,,,,,,COMPLETE,0.0,,,,,,,,,,,,,,,,,,,,
67,67,0.6365849930118798,2023-08-23 19:55:57.057581,2023-08-23 19:56:12.143100,0 days 00:00:15.085519,,,,,RandomForestClassifier,,,,,,,,,,,,,,,,,,,,,,,,87.0,9.0,,,,,,COMPLETE,0.0,,,,,,,,,,,,,,,,,,,,
68,68,0.6473337057607141,2023-08-23 19:55:58.283083,2023-08-23 19:56:15.836133,0 days 00:00:17.553050,,,,,RandomForestClassifier,,,,,,,,,,,,,,,,,,,,,,,,100.0,9.0,,,,,,COMPLETE,0.0,,,,,,,,,,,,,,,,,,,,
69,69,0.64281421607875,2023-08-23 19:56:03.077223,2023-08-23 19:56:21.957144,0 days 00:00:18.879921,,,,,RandomForestClassifier,,,,,,,,,,,,,,,,,,,,,,,,100.0,10.0,,,,,,COMPLETE,0.0,,,,,,,,,,,,,,,,,,,,
70,70,0.644979941588034,2023-08-23 19:56:03.584896,2023-08-23 19:56:18.609012,0 days 00:00:15.024116,,,,,RandomForestClassifier,,,,,,,,,,,,,,,,,,,,,,,,87.0,9.0,,,,,,COMPLETE,0.0,,,,,,,,,,,,,,,,,,,,
71,71,0.6354201936236246,2023-08-23 19:56:12.238252,2023-08-23 19:56:28.132636,0 days 00:00:15.894384,,,,,RandomForestClassifier,,,,,,,,,,,,,,,,,,,,,,,,99.0,7.0,,,,,,COMPLETE,0.0,,,,,,,,,,,,,,,,,,,,
72,72,0.6377670542322504,2023-08-23 19:56:15.913695,2023-08-23 19:56:31.910267,0 days 00:00:15.996572,,,,,RandomForestClassifier,,,,,,,,,,,,,,,,,,,,,,,,99.0,7.0,,,,,,COMPLETE,0.0,,,,,,,,,,,,,,,,,,,,
73,73,0.6358761565391349,2023-08-23 19:56:18.725557,2023-08-23 19:56:29.649140,0 days 00:00:10.923583,,,,,RandomForestClassifier,,,,,,,,,,,,,,,,,,,,,,,,68.0,7.0,,,,,,COMPLETE,0.0,,,,,,,,,,,,,,,,,,,,
74,74,0.6234985732200821,2023-08-23 19:56:22.033693,2023-08-23 19:56:22.963095,0 days 00:00:00.929402,1.8356285174570168e-05,,,dart,XGBoost,0.6776491826606121,,,0.46638761751860264,,9.711704924977141e-05,depthwise,2.058916668696149e-08,,,5.0,,10.0,,,,,,,,forest,,0.6655986087661445,,,uniform,2.3307764818268546e-08,0.48559384864500654,,,COMPLETE,0.0,,,,,,,,,,,,,,,,,,,,
75,75,0.6357074867825696,2023-08-23 19:56:23.076362,2023-08-23 19:56:36.530414,0 days 00:00:13.454052,,,,,RandomForestClassifier,,,,,,,,,,,,,,,,,,,,,,,,83.0,7.0,,,,,,COMPLETE,0.0,,,,,,,,,,,,,,,,,,,,
76,76,0.6259104024095262,2023-08-23 19:56:28.221699,2023-08-23 19:56:32.647697,0 days 00:00:04.425998,,,,,RandomForestClassifier,,,,,,,,,,,,,,,,,,,,,,,,26.0,7.0,,,,,,COMPLETE,0.0,,,,,,,,,,,,,,,,,,,,
77,77,0.6043575538710538,2023-08-23 19:56:29.697388,2023-08-23 19:56:30.606540,0 days 00:00:00.909152,,,,,DecisionTreeClassifier,,entropy,10.0,,,,,,,,,,,,,,,,,,,,,,,,,,,,COMPLETE,0.0,,,,,,,,,,,,,,,,,,,,
78,78,0.6301019849659968,2023-08-23 19:56:30.675449,2023-08-23 19:56:34.755390,0 days 00:00:04.079941,,,,,RandomForestClassifier,,,,,,,,,,,,,,,,,,,,,,,,23.0,9.0,,,,,,COMPLETE,0.0,,,,,,,,,,,,,,,,,,,,
79,79,0.6489864201590607,2023-08-23 19:56:32.002174,2023-08-23 19:56:48.602163,0 days 00:00:16.599989,,,,,RandomForestClassifier,,,,,,,,,,,,,,,,,,,,,,,,83.0,9.0,,,,,,COMPLETE,0.0,,,,,,,,,,,,,,,,,,,,
80,80,0.6402577971498353,2023-08-23 19:56:32.736580,2023-08-23 19:56:49.083900,0 days 00:00:16.347320,,,,,RandomForestClassifier,,,,,,,,,,,,,,,,,,,,,,,,84.0,9.0,,,,,,COMPLETE,0.0,,,,,,,,,,,,,,,,,,,,
81,81,0.4856180338638164,2023-08-23 19:56:34.842628,2023-08-23 19:57:20.265362,0 days 00:00:45.422734,,,,,SVC,,,,,,,,,,,,,,,,,,,,,,,,,,,,,148.92422287150967,rbf,COMPLETE,0.0,,,,,,,,,,,,,,,,,,,,
82,82,0.49085626326383763,2023-08-23 19:56:36.677188,2023-08-23 19:57:19.478420,0 days 00:00:42.801232,,,,,SVC,,,,,,,,,,,,,,,,,,,,,,,,,,,,,246.56511514767956,rbf,COMPLETE,0.0,,,,,,,,,,,,,,,,,,,,
83,83,0.4941143044357168,2023-08-23 19:56:48.726320,2023-08-23 19:57:35.072143,0 days 00:00:46.345823,,,,,SVC,,,,,,,,,,,,,,,,,,,,,,,,,,,,,866.0443721947926,rbf,COMPLETE,0.0,,,,,,,,,,,,,,,,,,,,
84,84,0.49227020779450803,2023-08-23 19:56:49.190955,2023-08-23 19:57:34.307822,0 days 00:00:45.116867,,,,,SVC,,,,,,,,,,,,,,,,,,,,,,,,,,,,,749.684198979054,rbf,COMPLETE,0.0,,,,,,,,,,,,,,,,,,,,
85,85,0.623731577906327,2023-08-23 19:57:19.550987,2023-08-23 19:57:30.885494,0 days 00:00:11.334507,,,,,RandomForestClassifier,,,,,,,,,,,,,,,,,,,,,,,,72.0,5.0,,,,,,COMPLETE,0.0,,,,,,,,,,,,,,,,,,,,
86,86,0.6207850526849006,2023-08-23 19:57:20.342738,2023-08-23 19:57:33.860411,0 days 00:00:13.517673,,,,,RandomForestClassifier,,,,,,,,,,,,,,,,,,,,,,,,92.0,5.0,,,,,,COMPLETE,0.0,,,,,,,,,,,,,,,,,,,,
87,87,0.6289033038433232,2023-08-23 19:57:30.977608,2023-08-23 19:57:45.645186,0 days 00:00:14.667578,,,,,RandomForestClassifier,,,,,,,,,,,,,,,,,,,,,,,,91.0,6.0,,,,,,COMPLETE,0.0,,,,,,,,,,,,,,,,,,,,
88,88,0.6510552131192495,2023-08-23 19:57:33.975347,2023-08-23 19:57:51.567702,0 days 00:00:17.592355,,,,,RandomForestClassifier,,,,,,,,,,,,,,,,,,,,,,,,92.0,10.0,,,,,,COMPLETE,1.0,0.6377805486284289,0.6372591246153535,0.638518692871994,0.63673628489682,0.5907944514501892,0.6462068965517241,0.6172595520421608,0.6837237977805178,0.6308304891922639,0.6562130177514792,0.5942992874109264,0.5942513410555073,0.5942714825424369,0.594247997651814,0.5868664328976729,0.5925329900225298,0.5896860986547084,0.6016362492133417,0.5960099750623441,0.5988098966489195
89,89,0.6393606073148246,2023-08-23 19:57:34.423833,2023-08-23 19:57:52.369151,0 days 00:00:17.945318,,,,,RandomForestClassifier,,,,,,,,,,,,,,,,,,,,,,,,93.0,10.0,,,,,,COMPLETE,0.0,,,,,,,,,,,,,,,,,,,,
90,90,0.6510079339378239,2023-08-23 19:57:35.153749,2023-08-23 19:57:52.737989,0 days 00:00:17.584240,,,,,RandomForestClassifier,,,,,,,,,,,,,,,,,,,,,,,,92.0,10.0,,,,,,COMPLETE,0.0,,,,,,,,,,,,,,,,,,,,
