,number,value,datetime_start,datetime_complete,duration,params_alpha,params_bagging_fraction,params_bagging_freq,params_booster,params_classifier,params_colsample_bytree,params_dct_criterion,params_dct_max_depth,params_eta,params_feature_fraction,params_gamma,params_grow_policy,params_lambda,params_lambda_l1,params_lambda_l2,params_max_depth,params_min_child_samples,params_min_child_weight,params_mlp_activation,params_mlp_solver,params_n_layers,params_n_units_l_0,params_n_units_l_1,params_n_units_l_2,params_n_units_l_3,params_normalize_type,params_num_leaves,params_rate_drop,params_rf_estimator,params_rf_max_depth,params_sample_type,params_skip_drop,params_subsample,params_svc_c,params_svc_kernel,state,best_trial,dev_acc,dev_recall_macro,dev_precision_macro,dev_f1_macro,dev_recall_0,dev_precision_0,dev_f1_0,dev_recall_1,dev_precision_1,dev_f1_1,test_acc,test_recall_macro,test_precision_macro,test_f1_macro,test_recall_0,test_precision_0,test_f1_0,test_recall_1,test_precision_1,test_f1_1
170,170,0.5841295231791385,2023-08-23 18:11:11.488243,2023-08-23 18:11:13.149974,0 days 00:00:01.661731,,0.5,1.0,,LightGBM,,,,,0.7000000000000001,,,,0.579737382723605,0.04484541869760674,,70.0,,,,,,,,,,91.0,,,,,,,,,COMPLETE,0.0,,,,,,,,,,,,,,,,,,,,
171,171,0.5981919209277862,2023-08-23 18:11:12.237857,2023-08-23 18:11:14.548246,0 days 00:00:02.310389,,0.5,1.0,,LightGBM,,,,,1.0,,,,0.2071593621275763,0.045900858527195276,,70.0,,,,,,,,,,76.0,,,,,,,,,COMPLETE,0.0,,,,,,,,,,,,,,,,,,,,
172,172,0.5836021049057885,2023-08-23 18:11:12.702708,2023-08-23 18:11:13.422274,0 days 00:00:00.719566,2.642303813677755e-06,,,gbtree,XGBoost,0.8000510188626664,,,0.3448165390915516,,4.589008629771834e-08,depthwise,0.0006982638525988201,,,7.0,,8.0,,,,,,,,,,,,,,,0.8261429200039362,,,COMPLETE,0.0,,,,,,,,,,,,,,,,,,,,
173,173,0.5954315905618741,2023-08-23 18:11:13.213879,2023-08-23 18:11:13.779927,0 days 00:00:00.566048,1.8859223662843592e-06,,,gbtree,XGBoost,0.7668425365956258,,,0.3918946286448776,,1.1716874745318724e-08,lossguide,0.0003987700947818058,,,5.0,,8.0,,,,,,,,,,,,,,,0.8067493614309607,,,COMPLETE,0.0,,,,,,,,,,,,,,,,,,,,
174,174,0.593304544692269,2023-08-23 18:11:13.530215,2023-08-23 18:11:16.279347,0 days 00:00:02.749132,,1.0,1.0,,LightGBM,,,,,1.0,,,,0.1981827794995044,0.007069781849242695,,60.0,,,,,,,,,,66.0,,,,,,,,,COMPLETE,0.0,,,,,,,,,,,,,,,,,,,,
175,175,0.5985368797868797,2023-08-23 18:11:13.900766,2023-08-23 18:11:16.507759,0 days 00:00:02.606993,,1.0,1.0,,LightGBM,,,,,1.0,,,,0.22551275191614517,0.09942309543313432,,60.0,,,,,,,,,,67.0,,,,,,,,,COMPLETE,0.0,,,,,,,,,,,,,,,,,,,,
176,176,0.5905076398996302,2023-08-23 18:11:14.648265,2023-08-23 18:11:17.533388,0 days 00:00:02.885123,,1.0,2.0,,LightGBM,,,,,1.0,,,,0.2034626241959381,0.10873035313511964,,60.0,,,,,,,,,,64.0,,,,,,,,,COMPLETE,0.0,,,,,,,,,,,,,,,,,,,,
177,177,0.5918514202134524,2023-08-23 18:11:16.378170,2023-08-23 18:11:18.256156,0 days 00:00:01.877986,,0.5,2.0,,LightGBM,,,,,1.0,,,,0.13689927466090537,0.020388021514351668,,70.0,,,,,,,,,,184.0,,,,,,,,,COMPLETE,0.0,,,,,,,,,,,,,,,,,,,,
178,178,0.5845311116213469,2023-08-23 18:11:16.698090,2023-08-23 18:11:18.497901,0 days 00:00:01.799811,,0.5,1.0,,LightGBM,,,,,0.7000000000000001,,,,0.6052245685908988,0.0218888692377694,,70.0,,,,,,,,,,60.0,,,,,,,,,COMPLETE,0.0,,,,,,,,,,,,,,,,,,,,
179,179,0.5905076398996302,2023-08-23 18:11:17.579289,2023-08-23 18:11:19.293034,0 days 00:00:01.713745,,0.5,1.0,,LightGBM,,,,,0.7000000000000001,,,,0.6217999526087262,0.019854224122895926,,70.0,,,,,,,,,,177.0,,,,,,,,,COMPLETE,0.0,,,,,,,,,,,,,,,,,,,,
180,180,0.5820436909926759,2023-08-23 18:11:18.318600,2023-08-23 18:11:19.989102,0 days 00:00:01.670502,,0.5,1.0,,LightGBM,,,,,0.7000000000000001,,,,0.6408068100291454,0.03732479961446914,,70.0,,,,,,,,,,58.0,,,,,,,,,COMPLETE,0.0,,,,,,,,,,,,,,,,,,,,
181,181,0.6020912094722893,2023-08-23 18:11:18.596898,2023-08-23 18:11:20.157281,0 days 00:00:01.560383,,0.5,1.0,,LightGBM,,,,,0.9,,,,0.3761357576213364,0.0374041822594677,,90.0,,,,,,,,,,51.0,,,,,,,,,COMPLETE,0.0,,,,,,,,,,,,,,,,,,,,
182,182,0.5892142539541383,2023-08-23 18:11:19.345739,2023-08-23 18:11:20.908823,0 days 00:00:01.563084,,0.4,2.0,,LightGBM,,,,,0.9,,,,0.32405758262908085,0.03579657967418068,,90.0,,,,,,,,,,51.0,,,,,,,,,COMPLETE,0.0,,,,,,,,,,,,,,,,,,,,
183,183,0.3573487031700288,2023-08-23 18:11:20.104984,2023-08-23 18:11:21.769014,0 days 00:00:01.664030,,,,,MLPClassifier,,,,,,,,,,,,,,identity,lbfgs,2.0,60.0,100.0,,,,,,,,,,,,,COMPLETE,0.0,,,,,,,,,,,,,,,,,,,,
184,184,0.3573487031700288,2023-08-23 18:11:20.235785,2023-08-23 18:11:28.553175,0 days 00:00:08.317390,,,,,SVC,,,,,,,,,,,,,,,,,,,,,,,,,,,,,862.4313491791061,rbf,COMPLETE,0.0,,,,,,,,,,,,,,,,,,,,
185,185,0.3573487031700288,2023-08-23 18:11:21.015216,2023-08-23 18:11:29.687235,0 days 00:00:08.672019,,,,,SVC,,,,,,,,,,,,,,,,,,,,,,,,,,,,,783.135394405417,rbf,COMPLETE,0.0,,,,,,,,,,,,,,,,,,,,
186,186,0.6103927353378109,2023-08-23 18:11:21.882803,2023-08-23 18:11:23.588357,0 days 00:00:01.705554,,0.8,2.0,,LightGBM,,,,,0.5,,,,0.1020700644654947,0.00952755083920475,,80.0,,,,,,,,,,206.0,,,,,,,,,COMPLETE,0.0,,,,,,,,,,,,,,,,,,,,
187,187,0.3573487031700288,2023-08-23 18:11:23.663288,2023-08-23 18:11:33.139186,0 days 00:00:09.475898,,,,,SVC,,,,,,,,,,,,,,,,,,,,,,,,,,,,,755.08631040186,rbf,COMPLETE,0.0,,,,,,,,,,,,,,,,,,,,
188,188,0.588629884286433,2023-08-23 18:11:28.330700,2023-08-23 18:11:30.538151,0 days 00:00:02.207451,,0.8,2.0,,LightGBM,,,,,0.5,,,,0.12691987258537982,0.010063485559308458,,80.0,,,,,,,,,,201.0,,,,,,,,,COMPLETE,0.0,,,,,,,,,,,,,,,,,,,,
189,189,0.5972108457774137,2023-08-23 18:11:28.640689,2023-08-23 18:11:30.808085,0 days 00:00:02.167396,,0.8,2.0,,LightGBM,,,,,0.5,,,,0.09877489275488673,0.009806476598411398,,80.0,,,,,,,,,,212.0,,,,,,,,,COMPLETE,0.0,,,,,,,,,,,,,,,,,,,,
190,190,0.61495981893922,2023-08-23 18:11:29.775710,2023-08-23 18:11:32.199916,0 days 00:00:02.424206,,0.8,2.0,,LightGBM,,,,,0.5,,,,0.10286775123869354,0.009929500980830333,,80.0,,,,,,,,,,198.0,,,,,,,,,COMPLETE,0.0,,,,,,,,,,,,,,,,,,,,
191,191,0.5991794471036436,2023-08-23 18:11:30.600592,2023-08-23 18:11:33.602993,0 days 00:00:03.002401,,0.9,2.0,,LightGBM,,,,,0.5,,,,0.09185013837134393,0.00782879570719643,,80.0,,,,,,,,,,216.0,,,,,,,,,COMPLETE,0.0,,,,,,,,,,,,,,,,,,,,
192,192,0.5905889389477241,2023-08-23 18:11:30.915751,2023-08-23 18:11:33.923531,0 days 00:00:03.007780,,0.9,2.0,,LightGBM,,,,,0.5,,,,0.045134674168102656,0.003119954847340307,,70.0,,,,,,,,,,209.0,,,,,,,,,COMPLETE,0.0,,,,,,,,,,,,,,,,,,,,
193,193,0.6016725530792028,2023-08-23 18:11:32.344197,2023-08-23 18:11:34.964079,0 days 00:00:02.619882,,0.8,2.0,,LightGBM,,,,,0.5,,,,0.045493344094392485,0.004417158245501485,,80.0,,,,,,,,,,206.0,,,,,,,,,COMPLETE,0.0,,,,,,,,,,,,,,,,,,,,
194,194,0.5985751303834421,2023-08-23 18:11:32.643831,2023-08-23 18:11:34.860169,0 days 00:00:02.216338,,0.8,2.0,,LightGBM,,,,,0.5,,,,0.0774185388689695,0.004152061810697504,,80.0,,,,,,,,,,191.0,,,,,,,,,COMPLETE,0.0,,,,,,,,,,,,,,,,,,,,
195,195,0.5965026860799658,2023-08-23 18:11:33.207070,2023-08-23 18:11:35.636499,0 days 00:00:02.429429,,0.8,2.0,,LightGBM,,,,,0.5,,,,0.04355484711154492,0.0039629918743904705,,80.0,,,,,,,,,,189.0,,,,,,,,,COMPLETE,0.0,,,,,,,,,,,,,,,,,,,,
196,196,0.608473836736023,2023-08-23 18:11:33.732856,2023-08-23 18:11:36.584841,0 days 00:00:02.851985,,0.8,2.0,,LightGBM,,,,,0.5,,,,0.041958453366536023,0.01496956759438144,,70.0,,,,,,,,,,213.0,,,,,,,,,COMPLETE,0.0,,,,,,,,,,,,,,,,,,,,
197,197,0.5747441720384798,2023-08-23 18:11:34.015231,2023-08-23 18:11:34.230764,0 days 00:00:00.215533,,,,,DecisionTreeClassifier,,gini,6.0,,,,,,,,,,,,,,,,,,,,,,,,,,,,COMPLETE,0.0,,,,,,,,,,,,,,,,,,,,
198,198,0.5905889389477241,2023-08-23 18:11:34.341003,2023-08-23 18:11:36.901148,0 days 00:00:02.560145,,0.8,2.0,,LightGBM,,,,,0.5,,,,0.022408182611485725,0.003811980480263683,,80.0,,,,,,,,,,70.0,,,,,,,,,COMPLETE,0.0,,,,,,,,,,,,,,,,,,,,
199,199,0.5896044451260514,2023-08-23 18:11:34.956613,2023-08-23 18:11:37.312057,0 days 00:00:02.355444,,0.8,2.0,,LightGBM,,,,,0.5,,,,0.16433044103078384,0.01210477294636109,,100.0,,,,,,,,,,81.0,,,,,,,,,COMPLETE,0.0,,,,,,,,,,,,,,,,,,,,
200,200,0.5991632810734389,2023-08-23 18:11:35.060509,2023-08-23 18:11:37.203915,0 days 00:00:02.143406,,0.7000000000000001,2.0,,LightGBM,,,,,0.4,,,,0.15023769284941518,0.01183989451905557,,100.0,,,,,,,,,,198.0,,,,,,,,,COMPLETE,0.0,,,,,,,,,,,,,,,,,,,,
201,201,0.6071750175826054,2023-08-23 18:11:35.710519,2023-08-23 18:11:37.911114,0 days 00:00:02.200595,,0.7000000000000001,2.0,,LightGBM,,,,,0.4,,,,0.02441505605256002,0.012357541461419045,,100.0,,,,,,,,,,80.0,,,,,,,,,COMPLETE,0.0,,,,,,,,,,,,,,,,,,,,
202,202,0.5895257872801958,2023-08-23 18:11:36.719455,2023-08-23 18:11:39.367214,0 days 00:00:02.647759,,0.7000000000000001,2.0,,LightGBM,,,,,0.5,,,,0.019107231562958127,0.0126201380611247,,70.0,,,,,,,,,,197.0,,,,,,,,,COMPLETE,0.0,,,,,,,,,,,,,,,,,,,,
203,203,0.5928488129726078,2023-08-23 18:11:36.998000,2023-08-23 18:11:39.184996,0 days 00:00:02.186996,,0.7000000000000001,2.0,,LightGBM,,,,,0.4,,,,0.15628719337150881,0.012583139112501618,,70.0,,,,,,,,,,224.0,,,,,,,,,COMPLETE,0.0,,,,,,,,,,,,,,,,,,,,
204,204,0.6088023874399897,2023-08-23 18:11:37.295377,2023-08-23 18:11:40.419848,0 days 00:00:03.124471,,0.8,2.0,,LightGBM,,,,,0.5,,,,0.015253379922798396,0.015934321003105895,,70.0,,,,,,,,,,221.0,,,,,,,,,COMPLETE,0.0,,,,,,,,,,,,,,,,,,,,
205,205,0.5917289142761493,2023-08-23 18:11:37.415473,2023-08-23 18:11:39.740522,0 days 00:00:02.325049,,0.6000000000000001,2.0,,LightGBM,,,,,0.5,,,,0.014561562697881518,0.01830673075702659,,70.0,,,,,,,,,,77.0,,,,,,,,,COMPLETE,0.0,,,,,,,,,,,,,,,,,,,,
206,206,0.5961446877246638,2023-08-23 18:11:37.989441,2023-08-23 18:11:40.582969,0 days 00:00:02.593528,,0.7000000000000001,2.0,,LightGBM,,,,,0.4,,,,0.062089684281721125,0.017571157861890247,,70.0,,,,,,,,,,219.0,,,,,,,,,COMPLETE,0.0,,,,,,,,,,,,,,,,,,,,
207,207,0.578476466511247,2023-08-23 18:11:39.285880,2023-08-23 18:11:41.966085,0 days 00:00:02.680205,,0.8,2.0,,LightGBM,,,,,0.4,,,,0.284989604823282,0.07419535887359739,,70.0,,,,,,,,,,214.0,,,,,,,,,COMPLETE,0.0,,,,,,,,,,,,,,,,,,,,
208,208,0.6071279774304523,2023-08-23 18:11:39.484660,2023-08-23 18:11:41.259122,0 days 00:00:01.774462,,0.6000000000000001,2.0,,LightGBM,,,,,0.4,,,,0.025921288021882188,0.02166776334221669,,100.0,,,,,,,,,,76.0,,,,,,,,,COMPLETE,0.0,,,,,,,,,,,,,,,,,,,,
209,209,0.6076965365585486,2023-08-23 18:11:39.821006,2023-08-23 18:11:42.057152,0 days 00:00:02.236146,,0.8,2.0,,LightGBM,,,,,0.4,,,,0.03171300689582744,0.007015195587807303,,100.0,,,,,,,,,,215.0,,,,,,,,,COMPLETE,0.0,,,,,,,,,,,,,,,,,,,,
210,210,0.5664162615996465,2023-08-23 18:11:40.560931,2023-08-23 18:11:43.095717,0 days 00:00:02.534786,,0.8,2.0,,LightGBM,,,,,0.4,,,,0.06619147683816437,0.06166084071391157,,70.0,,,,,,,,,,219.0,,,,,,,,,COMPLETE,0.0,,,,,,,,,,,,,,,,,,,,
211,211,0.5748743880963536,2023-08-23 18:11:40.683955,2023-08-23 18:11:44.918732,0 days 00:00:04.234777,,,,,RandomForestClassifier,,,,,,,,,,,,,,,,,,,,,,,,77.0,6.0,,,,,,COMPLETE,0.0,,,,,,,,,,,,,,,,,,,,
212,212,0.5703275529865126,2023-08-23 18:11:41.372937,2023-08-23 18:11:45.544850,0 days 00:00:04.171913,,,,,RandomForestClassifier,,,,,,,,,,,,,,,,,,,,,,,,75.0,6.0,,,,,,COMPLETE,0.0,,,,,,,,,,,,,,,,,,,,
213,213,0.5583602772626062,2023-08-23 18:11:41.487553,2023-08-23 18:11:43.191433,0 days 00:00:01.703880,,,,,RandomForestClassifier,,,,,,,,,,,,,,,,,,,,,,,,38.0,5.0,,,,,,COMPLETE,0.0,,,,,,,,,,,,,,,,,,,,
214,214,0.6089198328187679,2023-08-23 18:11:42.126965,2023-08-23 18:11:43.985623,0 days 00:00:01.858658,,0.8,2.0,,LightGBM,,,,,0.4,,,,0.02848795914084866,0.006782534831110457,,100.0,,,,,,,,,,227.0,,,,,,,,,COMPLETE,0.0,,,,,,,,,,,,,,,,,,,,
215,215,0.5687279408209641,2023-08-23 18:11:42.131320,2023-08-23 18:11:45.913124,0 days 00:00:03.781804,,,,,RandomForestClassifier,,,,,,,,,,,,,,,,,,,,,,,,77.0,5.0,,,,,,COMPLETE,0.0,,,,,,,,,,,,,,,,,,,,
216,216,0.5758120336304716,2023-08-23 18:11:43.155692,2023-08-23 18:11:46.998861,0 days 00:00:03.843169,,,,,RandomForestClassifier,,,,,,,,,,,,,,,,,,,,,,,,75.0,5.0,,,,,,COMPLETE,0.0,,,,,,,,,,,,,,,,,,,,
217,217,0.5935012522342564,2023-08-23 18:11:43.252436,2023-08-23 18:11:45.056572,0 days 00:00:01.804136,,0.8,2.0,,LightGBM,,,,,0.4,,,,0.03573382466040732,0.007819783126619167,,100.0,,,,,,,,,,92.0,,,,,,,,,COMPLETE,0.0,,,,,,,,,,,,,,,,,,,,
218,218,0.5935012522342564,2023-08-23 18:11:44.061190,2023-08-23 18:11:46.337778,0 days 00:00:02.276588,,0.8,2.0,,LightGBM,,,,,0.4,,,,0.03493705083662976,0.005922466624007045,,100.0,,,,,,,,,,241.0,,,,,,,,,COMPLETE,0.0,,,,,,,,,,,,,,,,,,,,
219,219,0.5981871167618155,2023-08-23 18:11:45.023680,2023-08-23 18:11:47.370204,0 days 00:00:02.346524,,0.8,2.0,,LightGBM,,,,,0.4,,,,0.038121963677011,0.007227528382896389,,100.0,,,,,,,,,,232.0,,,,,,,,,COMPLETE,0.0,,,,,,,,,,,,,,,,,,,,
220,220,0.6076965365585486,2023-08-23 18:11:45.139492,2023-08-23 18:11:47.483628,0 days 00:00:02.344136,,0.8,2.0,,LightGBM,,,,,0.4,,,,0.027324825932415246,0.02616458921250094,,100.0,,,,,,,,,,232.0,,,,,,,,,COMPLETE,0.0,,,,,,,,,,,,,,,,,,,,
221,221,0.6030262572318646,2023-08-23 18:11:45.628586,2023-08-23 18:11:47.897075,0 days 00:00:02.268489,,0.8,2.0,,LightGBM,,,,,0.4,,,,0.025710256567258945,0.006702383791760357,,100.0,,,,,,,,,,230.0,,,,,,,,,COMPLETE,0.0,,,,,,,,,,,,,,,,,,,,
222,222,0.6011153198653199,2023-08-23 18:11:46.005907,2023-08-23 18:11:48.300304,0 days 00:00:02.294397,,0.8,2.0,,LightGBM,,,,,0.4,,,,0.024692340103814957,0.006421818946327193,,100.0,,,,,,,,,,232.0,,,,,,,,,COMPLETE,0.0,,,,,,,,,,,,,,,,,,,,
223,223,0.6076965365585486,2023-08-23 18:11:46.438121,2023-08-23 18:11:48.661154,0 days 00:00:02.223033,,0.8,2.0,,LightGBM,,,,,0.4,,,,0.026387400818869883,0.027407626846701606,,100.0,,,,,,,,,,223.0,,,,,,,,,COMPLETE,0.0,,,,,,,,,,,,,,,,,,,,
224,224,0.6089198328187679,2023-08-23 18:11:47.098130,2023-08-23 18:11:49.371480,0 days 00:00:02.273350,,0.8,2.0,,LightGBM,,,,,0.4,,,,0.025006459181102236,0.02679441900049079,,100.0,,,,,,,,,,207.0,,,,,,,,,COMPLETE,0.0,,,,,,,,,,,,,,,,,,,,
225,225,0.6055971397644898,2023-08-23 18:11:47.432281,2023-08-23 18:11:49.728809,0 days 00:00:02.296528,,0.8,2.0,,LightGBM,,,,,0.4,,,,0.017963534093597435,0.03168402993021587,,100.0,,,,,,,,,,224.0,,,,,,,,,COMPLETE,0.0,,,,,,,,,,,,,,,,,,,,
226,226,0.5942327090049644,2023-08-23 18:11:47.578201,2023-08-23 18:11:50.381939,0 days 00:00:02.803738,,0.8,2.0,,LightGBM,,,,,0.4,,,,0.010055936610106422,0.029387236020621887,,100.0,,,,,,,,,,225.0,,,,,,,,,COMPLETE,0.0,,,,,,,,,,,,,,,,,,,,
227,227,0.6143405165185309,2023-08-23 18:11:47.997493,2023-08-23 18:11:49.955525,0 days 00:00:01.958032,,0.8,3.0,,LightGBM,,,,,0.4,,,,0.01183455606500909,0.0264167443345929,,100.0,,,,,,,,,,225.0,,,,,,,,,COMPLETE,0.0,,,,,,,,,,,,,,,,,,,,
228,228,0.6065780354104972,2023-08-23 18:11:48.383126,2023-08-23 18:11:50.658657,0 days 00:00:02.275531,,0.8,2.0,,LightGBM,,,,,0.4,,,,0.016148582744562306,0.02686246918746446,,100.0,,,,,,,,,,221.0,,,,,,,,,COMPLETE,0.0,,,,,,,,,,,,,,,,,,,,
229,229,0.6089198328187679,2023-08-23 18:11:48.762918,2023-08-23 18:11:51.267929,0 days 00:00:02.505011,,0.8,2.0,,LightGBM,,,,,0.4,,,,0.021058917444780736,0.024680796570558106,,100.0,,,,,,,,,,218.0,,,,,,,,,COMPLETE,0.0,,,,,,,,,,,,,,,,,,,,
230,230,0.6143405165185309,2023-08-23 18:11:49.427117,2023-08-23 18:11:51.804286,0 days 00:00:02.377169,,0.8,3.0,,LightGBM,,,,,0.4,,,,0.008461603809610179,0.028868571857973584,,100.0,,,,,,,,,,220.0,,,,,,,,,COMPLETE,0.0,,,,,,,,,,,,,,,,,,,,
231,231,0.6143405165185309,2023-08-23 18:11:49.805631,2023-08-23 18:11:52.082659,0 days 00:00:02.277028,,0.8,3.0,,LightGBM,,,,,0.4,,,,0.013342964094103574,0.02774902984527752,,100.0,,,,,,,,,,240.0,,,,,,,,,COMPLETE,0.0,,,,,,,,,,,,,,,,,,,,
232,232,0.6079378095581722,2023-08-23 18:11:50.040342,2023-08-23 18:11:52.618050,0 days 00:00:02.577708,,0.8,3.0,,LightGBM,,,,,0.4,,,,0.008182866467579717,0.0315169435723338,,100.0,,,,,,,,,,211.0,,,,,,,,,COMPLETE,0.0,,,,,,,,,,,,,,,,,,,,
233,233,0.600316535301023,2023-08-23 18:11:50.469216,2023-08-23 18:11:52.966981,0 days 00:00:02.497765,,0.8,3.0,,LightGBM,,,,,0.4,,,,0.012725144172912812,0.024125841107233852,,90.0,,,,,,,,,,236.0,,,,,,,,,COMPLETE,0.0,,,,,,,,,,,,,,,,,,,,
234,234,0.5867530578547303,2023-08-23 18:11:50.741585,2023-08-23 18:11:53.218642,0 days 00:00:02.477057,,0.8,2.0,,LightGBM,,,,,0.4,,,,0.009943126719168598,0.04272756423742906,,90.0,,,,,,,,,,208.0,,,,,,,,,COMPLETE,0.0,,,,,,,,,,,,,,,,,,,,
235,235,0.6034617003367002,2023-08-23 18:11:51.367617,2023-08-23 18:11:53.670169,0 days 00:00:02.302552,,0.8,3.0,,LightGBM,,,,,0.4,,,,0.012978740407619779,0.040603013732776354,,90.0,,,,,,,,,,211.0,,,,,,,,,COMPLETE,0.0,,,,,,,,,,,,,,,,,,,,
236,236,0.6156899412406384,2023-08-23 18:11:51.871847,2023-08-23 18:11:54.349818,0 days 00:00:02.477971,,0.8,3.0,,LightGBM,,,,,0.5,,,,0.010361912848859572,0.055915107680444186,,90.0,,,,,,,,,,209.0,,,,,,,,,COMPLETE,0.0,,,,,,,,,,,,,,,,,,,,
237,237,0.6073285259097769,2023-08-23 18:11:52.182089,2023-08-23 18:11:54.919984,0 days 00:00:02.737895,,0.8,3.0,,LightGBM,,,,,0.5,,,,0.010792893298013315,0.051619565195566236,,90.0,,,,,,,,,,209.0,,,,,,,,,COMPLETE,0.0,,,,,,,,,,,,,,,,,,,,
238,238,0.6032564699708073,2023-08-23 18:11:52.741541,2023-08-23 18:11:55.374799,0 days 00:00:02.633258,,0.8,3.0,,LightGBM,,,,,0.4,,,,0.006964237746777632,0.0540733662931176,,90.0,,,,,,,,,,211.0,,,,,,,,,COMPLETE,0.0,,,,,,,,,,,,,,,,,,,,
239,239,0.5981871167618155,2023-08-23 18:11:53.055839,2023-08-23 18:11:55.585243,0 days 00:00:02.529404,,0.8,3.0,,LightGBM,,,,,0.4,,,,0.009069199009583691,0.044207887763538366,,90.0,,,,,,,,,,209.0,,,,,,,,,COMPLETE,0.0,,,,,,,,,,,,,,,,,,,,
240,240,0.6059734985968073,2023-08-23 18:11:53.327995,2023-08-23 18:11:55.711006,0 days 00:00:02.383011,,0.8,3.0,,LightGBM,,,,,0.5,,,,0.006864988681523629,0.055589388742766234,,100.0,,,,,,,,,,211.0,,,,,,,,,COMPLETE,0.0,,,,,,,,,,,,,,,,,,,,
241,241,0.5905076398996302,2023-08-23 18:11:53.837000,2023-08-23 18:11:56.204967,0 days 00:00:02.367967,,0.8,3.0,,LightGBM,,,,,0.5,,,,0.005656545541672231,0.055157096808576604,,100.0,,,,,,,,,,203.0,,,,,,,,,COMPLETE,0.0,,,,,,,,,,,,,,,,,,,,
242,242,0.5829142652469799,2023-08-23 18:11:54.403216,2023-08-23 18:11:57.454599,0 days 00:00:03.051383,,0.8,3.0,,LightGBM,,,,,0.5,,,,0.017863829038623918,0.06996023949065559,,70.0,,,,,,,,,,241.0,,,,,,,,,COMPLETE,0.0,,,,,,,,,,,,,,,,,,,,
243,243,0.5901420217209692,2023-08-23 18:11:55.004842,2023-08-23 18:11:57.226584,0 days 00:00:02.221742,,0.4,3.0,,LightGBM,,,,,0.5,,,,0.005324173722368254,0.06838138927386558,,70.0,,,,,,,,,,203.0,,,,,,,,,COMPLETE,0.0,,,,,,,,,,,,,,,,,,,,
244,244,0.5738408521303258,2023-08-23 18:11:55.469811,2023-08-23 18:11:57.990036,0 days 00:00:02.520225,,0.4,3.0,,LightGBM,,,,,0.5,,,,0.0177900211742938,0.017397287922832527,,50.0,,,,,,,,,,202.0,,,,,,,,,COMPLETE,0.0,,,,,,,,,,,,,,,,,,,,
245,245,0.581617893677679,2023-08-23 18:11:55.680056,2023-08-23 18:11:58.173464,0 days 00:00:02.493408,,0.4,3.0,,LightGBM,,,,,0.5,,,,0.016199935090037643,0.07468410136514177,,50.0,,,,,,,,,,199.0,,,,,,,,,COMPLETE,0.0,,,,,,,,,,,,,,,,,,,,
246,246,0.6086812471599206,2023-08-23 18:11:55.775232,2023-08-23 18:11:57.824873,0 days 00:00:02.049641,,0.4,3.0,,LightGBM,,,,,0.5,,,,0.005321314105749158,0.01757548017339858,,70.0,,,,,,,,,,196.0,,,,,,,,,COMPLETE,0.0,,,,,,,,,,,,,,,,,,,,
247,247,0.6000779045251288,2023-08-23 18:11:56.398547,2023-08-23 18:11:58.563038,0 days 00:00:02.164491,,0.4,3.0,,LightGBM,,,,,0.5,,,,0.014844678209711382,0.09862675942778425,,50.0,,,,,,,,,,248.0,,,,,,,,,COMPLETE,0.0,,,,,,,,,,,,,,,,,,,,
248,248,0.5963948695415647,2023-08-23 18:11:57.340024,2023-08-23 18:11:59.466532,0 days 00:00:02.126508,,0.8,3.0,,LightGBM,,,,,0.5,,,,0.01649913625242419,0.019175977834477168,,100.0,,,,,,,,,,246.0,,,,,,,,,COMPLETE,0.0,,,,,,,,,,,,,,,,,,,,
249,249,0.580223255547169,2023-08-23 18:11:57.553719,2023-08-23 18:11:59.567002,0 days 00:00:02.013283,,0.4,3.0,,LightGBM,,,,,0.7000000000000001,,,,0.014312795605249324,0.016615616665042056,,50.0,,,,,,,,,,256.0,,,,,,,,,COMPLETE,0.0,,,,,,,,,,,,,,,,,,,,
