,number,value,datetime_start,datetime_complete,duration,params_alpha,params_bagging_fraction,params_bagging_freq,params_booster,params_classifier,params_colsample_bytree,params_dct_criterion,params_dct_max_depth,params_eta,params_feature_fraction,params_gamma,params_grow_policy,params_lambda,params_lambda_l1,params_lambda_l2,params_max_depth,params_min_child_samples,params_min_child_weight,params_mlp_activation,params_mlp_solver,params_n_layers,params_n_units_l_0,params_n_units_l_1,params_n_units_l_2,params_n_units_l_3,params_normalize_type,params_num_leaves,params_rate_drop,params_rf_estimator,params_rf_max_depth,params_sample_type,params_skip_drop,params_subsample,params_svc_c,params_svc_kernel,state,best_trial,dev_acc,dev_recall_macro,dev_precision_macro,dev_f1_macro,dev_recall_0,dev_precision_0,dev_f1_0,dev_recall_1,dev_precision_1,dev_f1_1,test_acc,test_recall_macro,test_precision_macro,test_f1_macro,test_recall_0,test_precision_0,test_f1_0,test_recall_1,test_precision_1,test_f1_1
0,0,0.3357921744708146,2023-08-23 18:42:56.981867,2023-08-23 18:42:59.278614,0 days 00:00:02.296747,,,,,MLPClassifier,,,,,,,,,,,,,,logistic,lbfgs,4.0,50.0,30.0,70.0,10.0,,,,,,,,,,,COMPLETE,0.0,,,,,,,,,,,,,,,,,,,,
1,1,0.538464779580482,2023-08-23 18:42:56.985310,2023-08-23 18:42:57.073843,0 days 00:00:00.088533,,,,,DecisionTreeClassifier,,entropy,3.0,,,,,,,,,,,,,,,,,,,,,,,,,,,,COMPLETE,0.0,,,,,,,,,,,,,,,,,,,,
2,2,0.5595511867702462,2023-08-23 18:42:56.987374,2023-08-23 18:42:58.957882,0 days 00:00:01.970508,,0.9,1.0,,LightGBM,,,,,0.9,,,,0.00011555448062251586,1.258998603583124e-08,,80.0,,,,,,,,,,79.0,,,,,,,,,COMPLETE,0.0,,,,,,,,,,,,,,,,,,,,
3,3,0.5596686804280828,2023-08-23 18:42:56.990681,2023-08-23 18:42:57.876997,0 days 00:00:00.886316,,0.4,1.0,,LightGBM,,,,,0.4,,,,0.008064577847212803,0.03798631367167572,,90.0,,,,,,,,,,125.0,,,,,,,,,COMPLETE,0.0,,,,,,,,,,,,,,,,,,,,
4,4,0.5928678147361799,2023-08-23 18:42:56.994783,2023-08-23 18:42:57.208973,0 days 00:00:00.214190,0.0006918075276164914,,,gbtree,XGBoost,0.538536074063027,,,4.626685307472462e-07,,0.041563924246894215,lossguide,0.04405442209308974,,,5.0,,7.0,,,,,,,,,,,,,,,0.21394905555139473,,,COMPLETE,0.0,,,,,,,,,,,,,,,,,,,,
5,5,0.5559387096641331,2023-08-23 18:42:56.996789,2023-08-23 18:43:02.138202,0 days 00:00:05.141413,,,,,MLPClassifier,,,,,,,,,,,,,,identity,lbfgs,1.0,80.0,,,,,,,,,,,,,,COMPLETE,0.0,,,,,,,,,,,,,,,,,,,,
6,6,0.48084325268469397,2023-08-23 18:42:57.001056,2023-08-23 18:43:02.583703,0 days 00:00:05.582647,,,,,SVC,,,,,,,,,,,,,,,,,,,,,,,,,,,,,12.5578052468835,linear,COMPLETE,0.0,,,,,,,,,,,,,,,,,,,,
7,7,0.569564555391775,2023-08-23 18:42:57.004612,2023-08-23 18:42:58.466536,0 days 00:00:01.461924,,0.8,2.0,,LightGBM,,,,,0.7000000000000001,,,,2.400724685541014e-05,0.014440410037202882,,100.0,,,,,,,,,,109.0,,,,,,,,,COMPLETE,0.0,,,,,,,,,,,,,,,,,,,,
8,8,0.537364475137297,2023-08-23 18:42:57.168400,2023-08-23 18:42:57.644926,0 days 00:00:00.476526,,,,,DecisionTreeClassifier,,log_loss,27.0,,,,,,,,,,,,,,,,,,,,,,,,,,,,COMPLETE,0.0,,,,,,,,,,,,,,,,,,,,
9,9,0.3357921744708146,2023-08-23 18:42:57.283702,2023-08-23 18:43:02.733298,0 days 00:00:05.449596,,,,,SVC,,,,,,,,,,,,,,,,,,,,,,,,,,,,,0.1896472818909707,poly,COMPLETE,0.0,,,,,,,,,,,,,,,,,,,,
10,10,0.5779170805386009,2023-08-23 18:42:57.766786,2023-08-23 18:43:05.319625,0 days 00:00:07.552839,,,,,RandomForestClassifier,,,,,,,,,,,,,,,,,,,,,,,,87.0,20.0,,,,,,COMPLETE,0.0,,,,,,,,,,,,,,,,,,,,
11,11,0.5218405296308979,2023-08-23 18:42:57.964443,2023-08-23 18:42:58.119661,0 days 00:00:00.155218,,,,,DecisionTreeClassifier,,entropy,2.0,,,,,,,,,,,,,,,,,,,,,,,,,,,,COMPLETE,0.0,,,,,,,,,,,,,,,,,,,,
12,12,0.5690298938842431,2023-08-23 18:42:58.192976,2023-08-23 18:42:59.669594,0 days 00:00:01.476618,,0.9,1.0,,LightGBM,,,,,0.8,,,,1.4341193990757578e-08,0.07508220598628092,,100.0,,,,,,,,,,221.0,,,,,,,,,COMPLETE,0.0,,,,,,,,,,,,,,,,,,,,
13,13,0.3357921744708146,2023-08-23 18:42:58.536155,2023-08-23 18:43:03.207428,0 days 00:00:04.671273,,,,,SVC,,,,,,,,,,,,,,,,,,,,,,,,,,,,,29.42379367267411,poly,COMPLETE,0.0,,,,,,,,,,,,,,,,,,,,
14,14,0.5893303929732805,2023-08-23 18:42:59.024826,2023-08-23 18:43:02.499435,0 days 00:00:03.474609,,,,,RandomForestClassifier,,,,,,,,,,,,,,,,,,,,,,,,88.0,8.0,,,,,,COMPLETE,0.0,,,,,,,,,,,,,,,,,,,,
15,15,0.575162458619031,2023-08-23 18:42:59.344556,2023-08-23 18:42:59.484486,0 days 00:00:00.139930,1.7913085657279335e-07,,,dart,XGBoost,0.2195567592384359,,,7.793926391158499e-08,,2.0139845105812863e-05,depthwise,0.0004987443114912285,,,9.0,,10.0,,,,,,,,tree,,0.0013324026088570484,,,weighted,0.0022591348391793687,0.9685991080493317,,,COMPLETE,0.0,,,,,,,,,,,,,,,,,,,,
16,16,0.5551867948385121,2023-08-23 18:42:59.576324,2023-08-23 18:43:00.250959,0 days 00:00:00.674635,,,,,RandomForestClassifier,,,,,,,,,,,,,,,,,,,,,,,,11.0,24.0,,,,,,COMPLETE,0.0,,,,,,,,,,,,,,,,,,,,
17,17,0.4700742375902001,2023-08-23 18:42:59.774089,2023-08-23 18:43:05.382196,0 days 00:00:05.608107,,,,,SVC,,,,,,,,,,,,,,,,,,,,,,,,,,,,,8.58528269963358,rbf,COMPLETE,0.0,,,,,,,,,,,,,,,,,,,,
18,18,0.5700102126779055,2023-08-23 18:43:00.334187,2023-08-23 18:43:00.567710,0 days 00:00:00.233523,2.0006321771930055e-05,,,gbtree,XGBoost,0.28410781914429584,,,6.937151158396825e-08,,0.0015891517976229326,lossguide,0.006890180416850694,,,7.0,,9.0,,,,,,,,,,,,,,,0.20750268738616595,,,COMPLETE,0.0,,,,,,,,,,,,,,,,,,,,
19,19,0.5818930225776422,2023-08-23 18:43:00.636190,2023-08-23 18:43:00.955865,0 days 00:00:00.319675,1.7854168877872215e-08,,,dart,XGBoost,0.6474722086052416,,,2.1284340828878465e-07,,1.2410788017269638e-05,depthwise,0.004564018407992548,,,5.0,,6.0,,,,,,,,tree,,0.0025221304794400667,,,weighted,0.004469667938518832,0.8735218193903852,,,COMPLETE,0.0,,,,,,,,,,,,,,,,,,,,
20,20,0.3357921744708146,2023-08-23 18:43:01.052810,2023-08-23 18:43:04.787829,0 days 00:00:03.735019,,,,,SVC,,,,,,,,,,,,,,,,,,,,,,,,,,,,,0.30919975232308783,poly,COMPLETE,0.0,,,,,,,,,,,,,,,,,,,,
21,21,0.5942060103461586,2023-08-23 18:43:02.196511,2023-08-23 18:43:02.305713,0 days 00:00:00.109202,0.014049997631340197,,,gbtree,XGBoost,0.7221208757203664,,,2.3961602783549017e-05,,0.2012222023133653,depthwise,0.9781578827009118,,,3.0,,4.0,,,,,,,,,,,,,,,0.23839023769646497,,,COMPLETE,0.0,,,,,,,,,,,,,,,,,,,,
22,22,0.3357921744708146,2023-08-23 18:43:02.359640,2023-08-23 18:43:05.201490,0 days 00:00:02.841850,,,,,SVC,,,,,,,,,,,,,,,,,,,,,,,,,,,,,0.0014500306626732372,linear,COMPLETE,0.0,,,,,,,,,,,,,,,,,,,,
23,23,0.3406363334039131,2023-08-23 18:43:02.556815,2023-08-23 18:43:05.931893,0 days 00:00:03.375078,,,,,SVC,,,,,,,,,,,,,,,,,,,,,,,,,,,,,665.3572455290029,poly,COMPLETE,0.0,,,,,,,,,,,,,,,,,,,,
24,24,0.5913400330185731,2023-08-23 18:43:02.640741,2023-08-23 18:43:02.799506,0 days 00:00:00.158765,0.06858995694510837,,,gbtree,XGBoost,0.9780871831736657,,,0.0005745298807928734,,0.7929738499758231,lossguide,0.9180698104817947,,,3.0,,2.0,,,,,,,,,,,,,,,0.20923891510647988,,,COMPLETE,0.0,,,,,,,,,,,,,,,,,,,,
25,25,0.5947086528647809,2023-08-23 18:43:02.786149,2023-08-23 18:43:02.993828,0 days 00:00:00.207679,0.06263534263085835,,,gbtree,XGBoost,0.9098867447907326,,,0.0002606963089432885,,0.6738840070047403,lossguide,0.5196750465412764,,,3.0,,3.0,,,,,,,,,,,,,,,0.22278202059869356,,,COMPLETE,0.0,,,,,,,,,,,,,,,,,,,,
26,26,0.5686303263529544,2023-08-23 18:43:02.853819,2023-08-23 18:43:02.995660,0 days 00:00:00.141841,0.009947136755779054,,,gbtree,XGBoost,0.6304894069659022,,,0.8201790976812956,,0.30424191903749953,lossguide,0.8107599102905757,,,3.0,,5.0,,,,,,,,,,,,,,,0.37855527818754653,,,COMPLETE,0.0,,,,,,,,,,,,,,,,,,,,
27,27,0.3357921744708146,2023-08-23 18:43:03.038188,2023-08-23 18:43:03.150203,0 days 00:00:00.112015,0.005414491258634564,,,gblinear,XGBoost,0.878019025318999,,,,,,,0.9710160594909998,,,,,,,,,,,,,,,,,,,,0.35654314173871027,,,COMPLETE,0.0,,,,,,,,,,,,,,,,,,,,
28,28,0.5911348799398959,2023-08-23 18:43:03.082448,2023-08-23 18:43:03.352079,0 days 00:00:00.269631,0.007298330553706306,,,gbtree,XGBoost,0.8704442472253388,,,3.992721212095879e-05,,0.07050039830196539,lossguide,0.7937497768548079,,,3.0,,3.0,,,,,,,,,,,,,,,0.3575196488007789,,,COMPLETE,0.0,,,,,,,,,,,,,,,,,,,,
29,29,0.5902819091021339,2023-08-23 18:43:03.192928,2023-08-23 18:43:03.406346,0 days 00:00:00.213418,0.38440915302462836,,,gbtree,XGBoost,0.8089998284664803,,,3.493867707948828e-05,,0.042482682439496045,lossguide,1.2891396699669064e-07,,,3.0,,3.0,,,,,,,,,,,,,,,0.20240625825718775,,,COMPLETE,0.0,,,,,,,,,,,,,,,,,,,,
30,30,0.5943921822771794,2023-08-23 18:43:03.289251,2023-08-23 18:43:03.579288,0 days 00:00:00.290037,0.9177691545510805,,,gbtree,XGBoost,0.7832566728795306,,,2.2253334330110233e-05,,0.020218067099762333,lossguide,2.8746544882220426e-08,,,3.0,,3.0,,,,,,,,,,,,,,,0.22710933609155268,,,COMPLETE,0.0,,,,,,,,,,,,,,,,,,,,
31,31,0.5845351186281419,2023-08-23 18:43:03.397280,2023-08-23 18:43:03.730892,0 days 00:00:00.333612,0.6052652179150966,,,gbtree,XGBoost,0.7366380923473648,,,4.6617930165601895e-05,,0.011565685094259669,depthwise,4.67066818705574e-07,,,5.0,,4.0,,,,,,,,,,,,,,,0.23653365838435353,,,COMPLETE,0.0,,,,,,,,,,,,,,,,,,,,
32,32,0.5680056668719364,2023-08-23 18:43:03.471818,2023-08-23 18:43:03.830164,0 days 00:00:00.358346,0.00033399384210904866,,,gbtree,XGBoost,0.4996463682414493,,,7.72196300783363e-06,,0.0033575240355582913,depthwise,0.020797024315163212,,,5.0,,5.0,,,,,,,,,,,,,,,0.5101726714453646,,,COMPLETE,0.0,,,,,,,,,,,,,,,,,,,,
33,33,0.5800449040766112,2023-08-23 18:43:03.625401,2023-08-23 18:43:03.936288,0 days 00:00:00.310887,0.4556546710553979,,,gbtree,XGBoost,0.7573672429090745,,,0.0003677315209705877,,0.002741567291910224,depthwise,2.5941271224193755e-06,,,5.0,,4.0,,,,,,,,,,,,,,,0.5197170968195316,,,COMPLETE,0.0,,,,,,,,,,,,,,,,,,,,
34,34,0.3357921744708146,2023-08-23 18:43:03.786087,2023-08-23 18:43:04.063107,0 days 00:00:00.277020,0.6318600997758903,,,gblinear,XGBoost,0.9770326000610895,,,,,,,1.0694360710011393e-05,,,,,,,,,,,,,,,,,,,,0.48484498237382956,,,COMPLETE,0.0,,,,,,,,,,,,,,,,,,,,
35,35,0.3357921744708146,2023-08-23 18:43:03.873507,2023-08-23 18:43:21.391419,0 days 00:00:17.517912,,,,,MLPClassifier,,,,,,,,,,,,,,relu,sgd,4.0,10.0,100.0,10.0,100.0,,,,,,,,,,,COMPLETE,0.0,,,,,,,,,,,,,,,,,,,,
36,36,0.5839523113627297,2023-08-23 18:43:04.013539,2023-08-23 18:43:05.084336,0 days 00:00:01.070797,,,,,RandomForestClassifier,,,,,,,,,,,,,,,,,,,,,,,,33.0,2.0,,,,,,COMPLETE,0.0,,,,,,,,,,,,,,,,,,,,
37,37,0.5861358099936014,2023-08-23 18:43:04.174772,2023-08-23 18:44:03.723160,0 days 00:00:59.548388,,,,,MLPClassifier,,,,,,,,,,,,,,tanh,adam,4.0,10.0,100.0,10.0,100.0,,,,,,,,,,,COMPLETE,0.0,,,,,,,,,,,,,,,,,,,,
38,38,0.4402857064063319,2023-08-23 18:43:04.884136,2023-08-23 18:43:08.730052,0 days 00:00:03.845916,,,,,MLPClassifier,,,,,,,,,,,,,,tanh,sgd,1.0,10.0,,,,,,,,,,,,,,COMPLETE,0.0,,,,,,,,,,,,,,,,,,,,
39,39,0.46656060606060606,2023-08-23 18:43:05.166838,2023-08-23 18:43:08.261341,0 days 00:00:03.094503,,,,,MLPClassifier,,,,,,,,,,,,,,tanh,sgd,1.0,10.0,,,,,,,,,,,,,,COMPLETE,0.0,,,,,,,,,,,,,,,,,,,,
40,40,0.5691317832443991,2023-08-23 18:43:05.281136,2023-08-23 18:43:19.253508,0 days 00:00:13.972372,,,,,MLPClassifier,,,,,,,,,,,,,,relu,adam,1.0,10.0,,,,,,,,,,,,,,COMPLETE,0.0,,,,,,,,,,,,,,,,,,,,
41,41,0.5581043792109537,2023-08-23 18:43:05.428563,2023-08-23 18:43:15.540207,0 days 00:00:10.111644,,,,,MLPClassifier,,,,,,,,,,,,,,tanh,adam,1.0,10.0,,,,,,,,,,,,,,COMPLETE,0.0,,,,,,,,,,,,,,,,,,,,
42,42,0.36114992818473096,2023-08-23 18:43:05.429230,2023-08-23 18:43:09.478738,0 days 00:00:04.049508,,,,,MLPClassifier,,,,,,,,,,,,,,relu,sgd,1.0,10.0,,,,,,,,,,,,,,COMPLETE,0.0,,,,,,,,,,,,,,,,,,,,
43,43,0.5753376850151044,2023-08-23 18:43:06.025686,2023-08-23 18:43:27.329072,0 days 00:00:21.303386,,,,,MLPClassifier,,,,,,,,,,,,,,relu,adam,1.0,10.0,,,,,,,,,,,,,,COMPLETE,0.0,,,,,,,,,,,,,,,,,,,,
44,44,0.5785426027864287,2023-08-23 18:43:08.325934,2023-08-23 18:44:18.547431,0 days 00:01:10.221497,,,,,MLPClassifier,,,,,,,,,,,,,,relu,adam,4.0,10.0,100.0,10.0,100.0,,,,,,,,,,,COMPLETE,0.0,,,,,,,,,,,,,,,,,,,,
45,45,0.5877709364309902,2023-08-23 18:43:08.806004,2023-08-23 18:43:09.648240,0 days 00:00:00.842236,0.022050205983683378,,,gbtree,XGBoost,0.5284933156024508,,,1.6327930201878793e-06,,0.8617265518411247,lossguide,1.5701151269157922e-08,,,3.0,,8.0,,,,,,,,,,,,,,,0.301769716027559,,,COMPLETE,0.0,,,,,,,,,,,,,,,,,,,,
46,46,0.5886470343251546,2023-08-23 18:43:09.547443,2023-08-23 18:43:10.345611,0 days 00:00:00.798168,0.0337589938917687,,,gbtree,XGBoost,0.5421809748977124,,,2.067780269833685e-06,,0.5328975298448757,lossguide,6.548517011581343e-08,,,3.0,,8.0,,,,,,,,,,,,,,,0.30351401293179986,,,COMPLETE,0.0,,,,,,,,,,,,,,,,,,,,
47,47,0.5346503136410449,2023-08-23 18:43:09.835181,2023-08-23 18:43:10.407804,0 days 00:00:00.572623,,,,,DecisionTreeClassifier,,gini,12.0,,,,,,,,,,,,,,,,,,,,,,,,,,,,COMPLETE,0.0,,,,,,,,,,,,,,,,,,,,
48,48,0.5881711446533633,2023-08-23 18:43:10.450294,2023-08-23 18:43:11.161059,0 days 00:00:00.710765,0.07791067082543114,,,gbtree,XGBoost,0.9962261845129833,,,0.000805500483266273,,0.10653403853136181,lossguide,0.0940050024595035,,,3.0,,2.0,,,,,,,,,,,,,,,0.20317690783875794,,,COMPLETE,0.0,,,,,,,,,,,,,,,,,,,,
49,49,0.5945754791449591,2023-08-23 18:43:10.466040,2023-08-23 18:43:11.304267,0 days 00:00:00.838227,0.06337739667004752,,,gbtree,XGBoost,0.9986632104867963,,,0.0005408741120252023,,0.7997168666600208,lossguide,0.10231675659673567,,,3.0,,2.0,,,,,,,,,,,,,,,0.2177160670233753,,,COMPLETE,0.0,,,,,,,,,,,,,,,,,,,,
50,50,0.5984851472134596,2023-08-23 18:43:11.245267,2023-08-23 18:43:11.876303,0 days 00:00:00.631036,0.061959791845310606,,,gbtree,XGBoost,0.9123259594634502,,,0.0008550931103783431,,0.8250805952891406,lossguide,0.11435336266420906,,,3.0,,2.0,,,,,,,,,,,,,,,0.277338114096725,,,COMPLETE,0.0,,,,,,,,,,,,,,,,,,,,
51,51,0.5521692121975541,2023-08-23 18:43:11.380213,2023-08-23 18:43:16.516301,0 days 00:00:05.136088,,0.5,3.0,,LightGBM,,,,,0.4,,,,0.41368925335805085,2.4860585756411243e-06,,10.0,,,,,,,,,,251.0,,,,,,,,,COMPLETE,0.0,,,,,,,,,,,,,,,,,,,,
52,52,0.589289086994296,2023-08-23 18:43:11.946522,2023-08-23 18:43:12.358706,0 days 00:00:00.412184,,0.5,3.0,,LightGBM,,,,,0.4,,,,0.844541537532422,5.9340476981109675e-06,,10.0,,,,,,,,,,2.0,,,,,,,,,COMPLETE,0.0,,,,,,,,,,,,,,,,,,,,
53,53,0.5938969563217735,2023-08-23 18:43:12.433207,2023-08-23 18:43:13.175850,0 days 00:00:00.742643,0.12196866849833662,,,gbtree,XGBoost,0.914703963554623,,,0.002682183478528914,,0.7976907754792864,lossguide,0.10410757786007813,,,3.0,,2.0,,,,,,,,,,,,,,,0.2954352822669207,,,COMPLETE,0.0,,,,,,,,,,,,,,,,,,,,
54,54,0.5895761932328718,2023-08-23 18:43:13.247572,2023-08-23 18:43:13.815688,0 days 00:00:00.568116,0.13469198738078525,,,gbtree,XGBoost,0.8971461761890894,,,9.703477072488446e-05,,0.12491793979928123,lossguide,0.12142038613061246,,,3.0,,3.0,,,,,,,,,,,,,,,0.2914466005183832,,,COMPLETE,0.0,,,,,,,,,,,,,,,,,,,,
55,55,0.5769246075341575,2023-08-23 18:43:13.905726,2023-08-23 18:43:14.260830,0 days 00:00:00.355104,,,,,DecisionTreeClassifier,,log_loss,6.0,,,,,,,,,,,,,,,,,,,,,,,,,,,,COMPLETE,0.0,,,,,,,,,,,,,,,,,,,,
56,56,0.5685287676761637,2023-08-23 18:43:14.335155,2023-08-23 18:43:18.044358,0 days 00:00:03.709203,,0.6000000000000001,3.0,,LightGBM,,,,,1.0,,,,2.289623035033561e-08,7.529673972995907e-05,,30.0,,,,,,,,,,256.0,,,,,,,,,COMPLETE,0.0,,,,,,,,,,,,,,,,,,,,
57,57,0.5685287676761637,2023-08-23 18:43:15.671067,2023-08-23 18:43:19.379033,0 days 00:00:03.707966,,0.6000000000000001,3.0,,LightGBM,,,,,1.0,,,,2.4713244096321506e-08,7.698703476686082e-05,,30.0,,,,,,,,,,254.0,,,,,,,,,COMPLETE,0.0,,,,,,,,,,,,,,,,,,,,
58,58,0.5961426409916641,2023-08-23 18:43:16.596620,2023-08-23 18:43:16.943281,0 days 00:00:00.346661,0.10700853520933,,,gbtree,XGBoost,0.9156178402849235,,,0.0019655356842348377,,0.9277106975190301,lossguide,0.16150198714225725,,,3.0,,2.0,,,,,,,,,,,,,,,0.2742950487748899,,,COMPLETE,0.0,,,,,,,,,,,,,,,,,,,,
59,59,0.5927796976687871,2023-08-23 18:43:17.007552,2023-08-23 18:43:17.342301,0 days 00:00:00.334749,0.9771708577166793,,,gbtree,XGBoost,0.8303779203867256,,,0.004522821391751862,,0.9228818124107004,lossguide,0.18055693460995773,,,3.0,,2.0,,,,,,,,,,,,,,,0.2768262284352484,,,COMPLETE,0.0,,,,,,,,,,,,,,,,,,,,
60,60,0.5969771665801764,2023-08-23 18:43:17.415432,2023-08-23 18:43:17.694131,0 days 00:00:00.278699,0.0823217511463829,,,gbtree,XGBoost,0.9380930846554926,,,0.00024961357479467115,,0.17153750304090165,lossguide,9.82835898934301e-05,,,3.0,,3.0,,,,,,,,,,,,,,,0.27638256576176745,,,COMPLETE,0.0,,,,,,,,,,,,,,,,,,,,
61,61,0.597268537794769,2023-08-23 18:43:17.816946,2023-08-23 18:43:18.358087,0 days 00:00:00.541141,0.1220515360396602,,,gbtree,XGBoost,0.9325768458719926,,,0.00040379334105917336,,0.1220620273823104,lossguide,7.678491832522656e-05,,,3.0,,3.0,,,,,,,,,,,,,,,0.33347716525427823,,,COMPLETE,0.0,,,,,,,,,,,,,,,,,,,,
62,62,0.5937407010793856,2023-08-23 18:43:18.114473,2023-08-23 18:43:18.770184,0 days 00:00:00.655711,0.12110816209903646,,,gbtree,XGBoost,0.914839717433376,,,0.00028227828078775086,,0.16320873831504507,lossguide,0.00013221026292956788,,,3.0,,3.0,,,,,,,,,,,,,,,0.34250618928353926,,,COMPLETE,0.0,,,,,,,,,,,,,,,,,,,,
63,63,0.5685331595049978,2023-08-23 18:43:18.421233,2023-08-23 18:43:19.076279,0 days 00:00:00.655046,0.0811170876151521,,,dart,XGBoost,0.9362424013478708,,,0.000282757735366037,,0.16269654693080168,lossguide,0.00011661625993428327,,,3.0,,2.0,,,,,,,,forest,,1.4838897974990719e-08,,,uniform,1.0816892925237248e-08,0.3584116042407624,,,COMPLETE,0.0,,,,,,,,,,,,,,,,,,,,
64,64,0.3357921744708146,2023-08-23 18:43:18.836757,2023-08-23 18:43:19.168340,0 days 00:00:00.331583,0.0429528557055068,,,gblinear,XGBoost,0.9432926837186381,,,,,,,5.420520868424379e-05,,,,,,,,,,,,,,,,,,,,0.28603655191758215,,,COMPLETE,0.0,,,,,,,,,,,,,,,,,,,,
65,65,0.5675587606490242,2023-08-23 18:43:19.151120,2023-08-23 18:43:21.809999,0 days 00:00:02.658879,,,,,RandomForestClassifier,,,,,,,,,,,,,,,,,,,,,,,,56.0,2.0,,,,,,COMPLETE,0.0,,,,,,,,,,,,,,,,,,,,
66,66,0.5606307022222867,2023-08-23 18:43:19.248910,2023-08-23 18:43:22.085266,0 days 00:00:02.836356,,,,,RandomForestClassifier,,,,,,,,,,,,,,,,,,,,,,,,58.0,2.0,,,,,,COMPLETE,0.0,,,,,,,,,,,,,,,,,,,,
67,67,0.5949598000135126,2023-08-23 18:43:19.341393,2023-08-23 18:43:19.831688,0 days 00:00:00.490295,0.17677769507606905,,,gbtree,XGBoost,0.9995444842745933,,,0.0031569069457723525,,0.8854184766164995,lossguide,0.0011275569947540116,,,3.0,,2.0,,,,,,,,,,,,,,,0.39413232556356564,,,COMPLETE,0.0,,,,,,,,,,,,,,,,,,,,
68,68,0.5914855258180943,2023-08-23 18:43:19.443565,2023-08-23 18:43:20.071251,0 days 00:00:00.627686,0.2129763497797573,,,gbtree,XGBoost,0.9524157172304778,,,0.0022698782859591616,,0.7871330874263075,lossguide,0.0018513558773917056,,,3.0,,3.0,,,,,,,,,,,,,,,0.2641931732354996,,,COMPLETE,0.0,,,,,,,,,,,,,,,,,,,,
69,69,0.5999820981023989,2023-08-23 18:43:19.924625,2023-08-23 18:43:20.641783,0 days 00:00:00.717158,0.1349775799399785,,,gbtree,XGBoost,0.9903153722161792,,,0.0023373442774823876,,0.8512193478468828,lossguide,0.000876366286204306,,,3.0,,2.0,,,,,,,,,,,,,,,0.40763982445552216,,,COMPLETE,0.0,,,,,,,,,,,,,,,,,,,,
70,70,0.5924190942899157,2023-08-23 18:43:20.140058,2023-08-23 18:43:20.800355,0 days 00:00:00.660297,0.18990485997660891,,,gbtree,XGBoost,0.9972798722450797,,,0.001610154264666567,,0.2188000421507684,lossguide,0.02394813963951633,,,3.0,,2.0,,,,,,,,,,,,,,,0.3133968510382206,,,COMPLETE,0.0,,,,,,,,,,,,,,,,,,,,
71,71,0.5645164401848893,2023-08-23 18:43:20.707369,2023-08-23 18:43:23.917707,0 days 00:00:03.210338,,,,,RandomForestClassifier,,,,,,,,,,,,,,,,,,,,,,,,55.0,2.0,,,,,,COMPLETE,0.0,,,,,,,,,,,,,,,,,,,,
72,72,0.5558071509519631,2023-08-23 18:43:20.882360,2023-08-23 18:43:23.848805,0 days 00:00:02.966445,,,,,RandomForestClassifier,,,,,,,,,,,,,,,,,,,,,,,,58.0,2.0,,,,,,COMPLETE,0.0,,,,,,,,,,,,,,,,,,,,
73,73,0.5599625423712835,2023-08-23 18:43:21.468412,2023-08-23 18:43:24.618278,0 days 00:00:03.149866,,,,,RandomForestClassifier,,,,,,,,,,,,,,,,,,,,,,,,57.0,2.0,,,,,,COMPLETE,0.0,,,,,,,,,,,,,,,,,,,,
74,74,0.5828563827765743,2023-08-23 18:43:21.897011,2023-08-23 18:43:22.601806,0 days 00:00:00.704795,0.031227471268278753,,,gbtree,XGBoost,0.8651897555782417,,,0.013851542990399954,,0.20469020298181123,lossguide,0.0006086362876369292,,,3.0,,3.0,,,,,,,,,,,,,,,0.4299613198647168,,,COMPLETE,0.0,,,,,,,,,,,,,,,,,,,,
75,75,0.6038063196780791,2023-08-23 18:43:22.151332,2023-08-23 18:43:23.204540,0 days 00:00:01.053208,0.024847498582076973,,,gbtree,XGBoost,0.8692063622605568,,,0.012636796465571124,,0.23138444391622123,lossguide,0.00047003435571187064,,,3.0,,3.0,,,,,,,,,,,,,,,0.3998063083284096,,,COMPLETE,0.0,,,,,,,,,,,,,,,,,,,,
76,76,0.5890359252397352,2023-08-23 18:43:22.672665,2023-08-23 18:43:23.556425,0 days 00:00:00.883760,0.21321526156428483,,,gbtree,XGBoost,0.9345128074564356,,,0.008351771562338798,,4.141400927052015e-07,lossguide,0.00047940150064504827,,,3.0,,2.0,,,,,,,,,,,,,,,0.39816638083206135,,,COMPLETE,0.0,,,,,,,,,,,,,,,,,,,,
