,number,value,datetime_start,datetime_complete,duration,params_alpha,params_bagging_fraction,params_bagging_freq,params_booster,params_classifier,params_colsample_bytree,params_dct_criterion,params_dct_max_depth,params_eta,params_feature_fraction,params_gamma,params_grow_policy,params_lambda,params_lambda_l1,params_lambda_l2,params_max_depth,params_min_child_samples,params_min_child_weight,params_mlp_activation,params_mlp_solver,params_n_layers,params_n_units_l_0,params_n_units_l_1,params_n_units_l_2,params_n_units_l_3,params_normalize_type,params_num_leaves,params_rate_drop,params_rf_estimator,params_rf_max_depth,params_sample_type,params_skip_drop,params_subsample,params_svc_c,params_svc_kernel,state,best_trial,dev_acc,dev_recall_macro,dev_precision_macro,dev_f1_macro,dev_recall_0,dev_precision_0,dev_f1_0,dev_recall_1,dev_precision_1,dev_f1_1,test_acc,test_recall_macro,test_precision_macro,test_f1_macro,test_recall_0,test_precision_0,test_f1_0,test_recall_1,test_precision_1,test_f1_1
0,0,0.5324725011956002,2023-08-23 17:33:24.137878,2023-08-23 17:33:24.208944,0 days 00:00:00.071066,,,,,DecisionTreeClassifier,,entropy,5.0,,,,,,,,,,,,,,,,,,,,,,,,,,,,COMPLETE,0.0,,,,,,,,,,,,,,,,,,,,
1,1,0.5248371731311363,2023-08-23 17:33:24.139847,2023-08-23 17:33:24.255588,0 days 00:00:00.115741,,,,,DecisionTreeClassifier,,log_loss,13.0,,,,,,,,,,,,,,,,,,,,,,,,,,,,COMPLETE,0.0,,,,,,,,,,,,,,,,,,,,
2,2,0.5616325691374524,2023-08-23 17:33:24.142082,2023-08-23 17:33:26.198395,0 days 00:00:02.056313,,0.9,3.0,,LightGBM,,,,,0.7000000000000001,,,,1.1918559380419838e-07,9.000775074744538e-07,,10.0,,,,,,,,,,183.0,,,,,,,,,COMPLETE,0.0,,,,,,,,,,,,,,,,,,,,
3,3,0.3696969696969697,2023-08-23 17:33:24.144268,2023-08-23 17:33:24.307650,0 days 00:00:00.163382,,,,,SVC,,,,,,,,,,,,,,,,,,,,,,,,,,,,,3.3845404064774307,rbf,COMPLETE,0.0,,,,,,,,,,,,,,,,,,,,
4,4,0.5404330534688466,2023-08-23 17:33:24.147281,2023-08-23 17:33:26.047234,0 days 00:00:01.899953,,,,,RandomForestClassifier,,,,,,,,,,,,,,,,,,,,,,,,65.0,5.0,,,,,,COMPLETE,0.0,,,,,,,,,,,,,,,,,,,,
5,5,0.31064958020326994,2023-08-23 17:33:24.151030,2023-08-23 17:33:24.547921,0 days 00:00:00.396891,2.2887941647642535e-07,,,gbtree,XGBoost,0.3323891832524385,,,1.0163581319092007e-08,,0.008875770526447963,depthwise,0.002545072095866123,,,7.0,,10.0,,,,,,,,,,,,,,,0.285240750339135,,,COMPLETE,0.0,,,,,,,,,,,,,,,,,,,,
6,6,0.5630252100840336,2023-08-23 17:33:24.152990,2023-08-23 17:33:25.502593,0 days 00:00:01.349603,,,,,RandomForestClassifier,,,,,,,,,,,,,,,,,,,,,,,,32.0,31.0,,,,,,COMPLETE,0.0,,,,,,,,,,,,,,,,,,,,
7,7,0.634375,2023-08-23 17:33:24.169969,2023-08-23 17:33:24.432574,0 days 00:00:00.262605,,,,,DecisionTreeClassifier,,gini,13.0,,,,,,,,,,,,,,,,,,,,,,,,,,,,COMPLETE,0.0,,,,,,,,,,,,,,,,,,,,
8,8,0.3903203817314247,2023-08-23 17:33:24.251039,2023-08-23 17:33:24.390241,0 days 00:00:00.139202,,,,,DecisionTreeClassifier,,entropy,2.0,,,,,,,,,,,,,,,,,,,,,,,,,,,,COMPLETE,0.0,,,,,,,,,,,,,,,,,,,,
9,9,0.45833333333333326,2023-08-23 17:33:24.354665,2023-08-23 17:33:24.656943,0 days 00:00:00.302278,2.0636878383779375e-05,,,dart,XGBoost,0.2583758568967227,,,0.0014058366490172058,,1.995180479284909e-05,lossguide,0.010520138509186577,,,9.0,,8.0,,,,,,,,tree,,2.2851052788330282e-05,,,uniform,9.078872398010112e-08,0.4721101697450619,,,COMPLETE,0.0,,,,,,,,,,,,,,,,,,,,
10,10,0.524478643916583,2023-08-23 17:33:24.355324,2023-08-23 17:33:26.478089,0 days 00:00:02.122765,,,,,RandomForestClassifier,,,,,,,,,,,,,,,,,,,,,,,,91.0,2.0,,,,,,COMPLETE,0.0,,,,,,,,,,,,,,,,,,,,
11,11,0.4685680332739156,2023-08-23 17:33:24.473313,2023-08-23 17:34:17.818864,0 days 00:00:53.345551,,,,,MLPClassifier,,,,,,,,,,,,,,identity,lbfgs,4.0,70.0,10.0,30.0,90.0,,,,,,,,,,,COMPLETE,0.0,,,,,,,,,,,,,,,,,,,,
12,12,0.5168408826945412,2023-08-23 17:33:24.477011,2023-08-23 17:33:25.015885,0 days 00:00:00.538874,,0.4,2.0,,LightGBM,,,,,1.0,,,,0.08260187877673832,4.1264750009844176e-08,,50.0,,,,,,,,,,207.0,,,,,,,,,COMPLETE,0.0,,,,,,,,,,,,,,,,,,,,
13,13,0.5188811188811189,2023-08-23 17:33:24.731926,2023-08-23 17:33:24.871070,0 days 00:00:00.139144,0.00010503580332448221,,,gbtree,XGBoost,0.8247366601525408,,,0.04719316847982506,,0.0003472811797603109,lossguide,0.0005993293936673798,,,7.0,,5.0,,,,,,,,,,,,,,,0.22399452428416078,,,COMPLETE,0.0,,,,,,,,,,,,,,,,,,,,
14,14,0.511737089201878,2023-08-23 17:33:24.735916,2023-08-23 17:33:27.457192,0 days 00:00:02.721276,,,,,RandomForestClassifier,,,,,,,,,,,,,,,,,,,,,,,,99.0,12.0,,,,,,COMPLETE,0.0,,,,,,,,,,,,,,,,,,,,
15,15,0.6307692307692307,2023-08-23 17:33:24.939668,2023-08-23 17:33:25.166019,0 days 00:00:00.226351,0.399869384797481,,,dart,XGBoost,0.5799816431160063,,,0.0001059292960370668,,1.1362417234591216e-07,lossguide,2.257200517423799e-07,,,9.0,,4.0,,,,,,,,tree,,1.29680619389577e-07,,,weighted,0.0694057444206128,0.43041268196471505,,,COMPLETE,0.0,,,,,,,,,,,,,,,,,,,,
16,16,0.6428220979295456,2023-08-23 17:33:25.129610,2023-08-23 17:33:25.287512,0 days 00:00:00.157902,,,,,DecisionTreeClassifier,,gini,6.0,,,,,,,,,,,,,,,,,,,,,,,,,,,,COMPLETE,0.0,,,,,,,,,,,,,,,,,,,,
17,17,0.508108108108108,2023-08-23 17:33:25.235975,2023-08-23 17:33:26.952348,0 days 00:00:01.716373,,,,,RandomForestClassifier,,,,,,,,,,,,,,,,,,,,,,,,97.0,3.0,,,,,,COMPLETE,0.0,,,,,,,,,,,,,,,,,,,,
18,18,0.5476748076279693,2023-08-23 17:33:25.364815,2023-08-23 17:34:32.697632,0 days 00:01:07.332817,,,,,MLPClassifier,,,,,,,,,,,,,,identity,adam,4.0,80.0,40.0,70.0,50.0,,,,,,,,,,,COMPLETE,0.0,,,,,,,,,,,,,,,,,,,,
19,19,0.3696969696969697,2023-08-23 17:33:25.590968,2023-08-23 17:33:28.306221,0 days 00:00:02.715253,,,,,MLPClassifier,,,,,,,,,,,,,,logistic,lbfgs,4.0,100.0,80.0,80.0,40.0,,,,,,,,,,,COMPLETE,0.0,,,,,,,,,,,,,,,,,,,,
20,20,0.3696969696969697,2023-08-23 17:33:26.130230,2023-08-23 17:33:27.135201,0 days 00:00:01.004971,,,,,MLPClassifier,,,,,,,,,,,,,,relu,sgd,1.0,30.0,,,,,,,,,,,,,,COMPLETE,0.0,,,,,,,,,,,,,,,,,,,,
21,21,0.4997594997594998,2023-08-23 17:33:26.267269,2023-08-23 17:34:05.123930,0 days 00:00:38.856661,,,,,MLPClassifier,,,,,,,,,,,,,,identity,adam,4.0,30.0,80.0,10.0,40.0,,,,,,,,,,,COMPLETE,0.0,,,,,,,,,,,,,,,,,,,,
22,22,0.48684210526315796,2023-08-23 17:33:26.550958,2023-08-23 17:33:33.930261,0 days 00:00:07.379303,,,,,MLPClassifier,,,,,,,,,,,,,,identity,lbfgs,1.0,50.0,,,,,,,,,,,,,,COMPLETE,0.0,,,,,,,,,,,,,,,,,,,,
23,23,0.5266222081083942,2023-08-23 17:33:27.032151,2023-08-23 17:34:21.682380,0 days 00:00:54.650229,,,,,MLPClassifier,,,,,,,,,,,,,,tanh,lbfgs,1.0,100.0,,,,,,,,,,,,,,COMPLETE,0.0,,,,,,,,,,,,,,,,,,,,
24,24,0.6307692307692307,2023-08-23 17:33:27.272560,2023-08-23 17:33:27.331078,0 days 00:00:00.058518,,,,,DecisionTreeClassifier,,gini,30.0,,,,,,,,,,,,,,,,,,,,,,,,,,,,COMPLETE,0.0,,,,,,,,,,,,,,,,,,,,
25,25,0.6233320625238277,2023-08-23 17:33:27.429665,2023-08-23 17:33:27.574514,0 days 00:00:00.144849,,,,,DecisionTreeClassifier,,gini,9.0,,,,,,,,,,,,,,,,,,,,,,,,,,,,COMPLETE,0.0,,,,,,,,,,,,,,,,,,,,
26,26,0.6147050441721288,2023-08-23 17:33:27.560389,2023-08-23 17:33:27.717351,0 days 00:00:00.156962,,,,,DecisionTreeClassifier,,gini,9.0,,,,,,,,,,,,,,,,,,,,,,,,,,,,COMPLETE,0.0,,,,,,,,,,,,,,,,,,,,
27,27,0.3696969696969697,2023-08-23 17:33:27.665418,2023-08-23 17:33:27.834043,0 days 00:00:00.168625,,,,,SVC,,,,,,,,,,,,,,,,,,,,,,,,,,,,,0.0019193893632486428,poly,COMPLETE,0.0,,,,,,,,,,,,,,,,,,,,
28,28,0.4932857991681522,2023-08-23 17:33:27.781818,2023-08-23 17:34:26.916698,0 days 00:00:59.134880,,,,,MLPClassifier,,,,,,,,,,,,,,tanh,adam,4.0,100.0,50.0,20.0,90.0,,,,,,,,,,,COMPLETE,0.0,,,,,,,,,,,,,,,,,,,,
29,29,0.3696969696969697,2023-08-23 17:33:27.935113,2023-08-23 17:33:44.563842,0 days 00:00:16.628729,,,,,MLPClassifier,,,,,,,,,,,,,,logistic,adam,4.0,100.0,60.0,60.0,50.0,,,,,,,,,,,COMPLETE,0.0,,,,,,,,,,,,,,,,,,,,
30,30,0.5412587412587413,2023-08-23 17:33:28.394151,2023-08-23 17:33:28.714336,0 days 00:00:00.320185,0.8411884476823747,,,dart,XGBoost,0.643610302166713,,,1.1045227581074893e-05,,1.3290666868481265e-08,lossguide,3.241821215601449e-08,,,3.0,,2.0,,,,,,,,tree,,1.0233437385036058e-08,,,weighted,0.7258318824532973,0.8272719313737598,,,COMPLETE,0.0,,,,,,,,,,,,,,,,,,,,
31,31,0.6174990321331785,2023-08-23 17:33:28.773235,2023-08-23 17:33:28.815331,0 days 00:00:00.042096,,,,,DecisionTreeClassifier,,gini,5.0,,,,,,,,,,,,,,,,,,,,,,,,,,,,COMPLETE,0.0,,,,,,,,,,,,,,,,,,,,
32,32,0.3696969696969697,2023-08-23 17:33:28.921713,2023-08-23 17:33:29.009355,0 days 00:00:00.087642,0.9990760576162447,,,gblinear,XGBoost,0.9971747742800927,,,,,,,3.7263415184718874e-07,,,,,,,,,,,,,,,,,,,,0.6204393151834968,,,COMPLETE,0.0,,,,,,,,,,,,,,,,,,,,
33,33,0.5897435897435898,2023-08-23 17:33:29.093687,2023-08-23 17:33:29.281312,0 days 00:00:00.187625,,,,,DecisionTreeClassifier,,gini,15.0,,,,,,,,,,,,,,,,,,,,,,,,,,,,COMPLETE,0.0,,,,,,,,,,,,,,,,,,,,
34,34,0.3696969696969697,2023-08-23 17:33:29.354189,2023-08-23 17:33:29.635224,0 days 00:00:00.281035,,,,,MLPClassifier,,,,,,,,,,,,,,identity,adam,1.0,10.0,,,,,,,,,,,,,,COMPLETE,0.0,,,,,,,,,,,,,,,,,,,,
35,35,0.43124999999999997,2023-08-23 17:33:29.706859,2023-08-23 17:33:29.835596,0 days 00:00:00.128737,,,,,SVC,,,,,,,,,,,,,,,,,,,,,,,,,,,,,842.6574699321383,linear,COMPLETE,0.0,,,,,,,,,,,,,,,,,,,,
36,36,0.5535647629712579,2023-08-23 17:33:29.912786,2023-08-23 17:33:29.953825,0 days 00:00:00.041039,,,,,DecisionTreeClassifier,,log_loss,4.0,,,,,,,,,,,,,,,,,,,,,,,,,,,,COMPLETE,0.0,,,,,,,,,,,,,,,,,,,,
37,37,0.5478260869565217,2023-08-23 17:33:30.068122,2023-08-23 17:33:30.309580,0 days 00:00:00.241458,,0.5,1.0,,LightGBM,,,,,0.4,,,,1.1840874840113344e-08,0.29004996247822273,,100.0,,,,,,,,,,4.0,,,,,,,,,COMPLETE,0.0,,,,,,,,,,,,,,,,,,,,
38,38,0.6428220979295456,2023-08-23 17:33:30.396801,2023-08-23 17:33:30.486116,0 days 00:00:00.089315,,,,,DecisionTreeClassifier,,gini,30.0,,,,,,,,,,,,,,,,,,,,,,,,,,,,COMPLETE,0.0,,,,,,,,,,,,,,,,,,,,
39,39,0.585496257412268,2023-08-23 17:33:30.572892,2023-08-23 17:33:30.681923,0 days 00:00:00.109031,,,,,DecisionTreeClassifier,,gini,22.0,,,,,,,,,,,,,,,,,,,,,,,,,,,,COMPLETE,0.0,,,,,,,,,,,,,,,,,,,,
40,40,0.59375,2023-08-23 17:33:30.770451,2023-08-23 17:33:30.971295,0 days 00:00:00.200844,,,,,DecisionTreeClassifier,,gini,28.0,,,,,,,,,,,,,,,,,,,,,,,,,,,,COMPLETE,0.0,,,,,,,,,,,,,,,,,,,,
41,41,0.6475279106858054,2023-08-23 17:33:31.041953,2023-08-23 17:33:31.115753,0 days 00:00:00.073800,,,,,DecisionTreeClassifier,,gini,14.0,,,,,,,,,,,,,,,,,,,,,,,,,,,,COMPLETE,0.0,,,,,,,,,,,,,,,,,,,,
42,42,0.5897435897435898,2023-08-23 17:33:31.191353,2023-08-23 17:33:31.228521,0 days 00:00:00.037168,,,,,DecisionTreeClassifier,,gini,18.0,,,,,,,,,,,,,,,,,,,,,,,,,,,,COMPLETE,0.0,,,,,,,,,,,,,,,,,,,,
43,43,0.6778939217963609,2023-08-23 17:33:31.325898,2023-08-23 17:33:31.421526,0 days 00:00:00.095628,,,,,DecisionTreeClassifier,,gini,13.0,,,,,,,,,,,,,,,,,,,,,,,,,,,,COMPLETE,0.0,,,,,,,,,,,,,,,,,,,,
44,44,0.6020017662643509,2023-08-23 17:33:31.512604,2023-08-23 17:33:31.621372,0 days 00:00:00.108768,,,,,DecisionTreeClassifier,,gini,21.0,,,,,,,,,,,,,,,,,,,,,,,,,,,,COMPLETE,0.0,,,,,,,,,,,,,,,,,,,,
45,45,0.6307692307692307,2023-08-23 17:33:31.712880,2023-08-23 17:33:31.857493,0 days 00:00:00.144613,,,,,DecisionTreeClassifier,,gini,31.0,,,,,,,,,,,,,,,,,,,,,,,,,,,,COMPLETE,0.0,,,,,,,,,,,,,,,,,,,,
46,46,0.6434045986284792,2023-08-23 17:33:31.968917,2023-08-23 17:33:32.078536,0 days 00:00:00.109619,,,,,DecisionTreeClassifier,,gini,10.0,,,,,,,,,,,,,,,,,,,,,,,,,,,,COMPLETE,0.0,,,,,,,,,,,,,,,,,,,,
47,47,0.5231259968102073,2023-08-23 17:33:32.203753,2023-08-23 17:33:32.545178,0 days 00:00:00.341425,,1.0,3.0,,LightGBM,,,,,0.4,,,,0.5864770422012034,0.00023673836038495146,,100.0,,,,,,,,,,51.0,,,,,,,,,COMPLETE,0.0,,,,,,,,,,,,,,,,,,,,
48,48,0.6185188856944581,2023-08-23 17:33:32.603256,2023-08-23 17:33:32.652624,0 days 00:00:00.049368,,,,,DecisionTreeClassifier,,gini,10.0,,,,,,,,,,,,,,,,,,,,,,,,,,,,COMPLETE,0.0,,,,,,,,,,,,,,,,,,,,
49,49,0.6140625,2023-08-23 17:33:32.764906,2023-08-23 17:33:32.818932,0 days 00:00:00.054026,,,,,DecisionTreeClassifier,,gini,12.0,,,,,,,,,,,,,,,,,,,,,,,,,,,,COMPLETE,0.0,,,,,,,,,,,,,,,,,,,,
50,50,0.6140625,2023-08-23 17:33:32.923508,2023-08-23 17:33:32.973528,0 days 00:00:00.050020,,,,,DecisionTreeClassifier,,gini,17.0,,,,,,,,,,,,,,,,,,,,,,,,,,,,COMPLETE,0.0,,,,,,,,,,,,,,,,,,,,
51,51,0.7010012887875483,2023-08-23 17:33:33.070126,2023-08-23 17:33:33.120646,0 days 00:00:00.050520,,,,,DecisionTreeClassifier,,gini,7.0,,,,,,,,,,,,,,,,,,,,,,,,,,,,COMPLETE,0.0,,,,,,,,,,,,,,,,,,,,
52,52,0.3696969696969697,2023-08-23 17:33:33.189088,2023-08-23 17:33:33.275757,0 days 00:00:00.086669,,,,,SVC,,,,,,,,,,,,,,,,,,,,,,,,,,,,,0.001479153099828808,poly,COMPLETE,0.0,,,,,,,,,,,,,,,,,,,,
53,53,0.6376306620209059,2023-08-23 17:33:33.349961,2023-08-23 17:33:33.451283,0 days 00:00:00.101322,,,,,DecisionTreeClassifier,,entropy,7.0,,,,,,,,,,,,,,,,,,,,,,,,,,,,COMPLETE,0.0,,,,,,,,,,,,,,,,,,,,
54,54,0.6376306620209059,2023-08-23 17:33:33.543854,2023-08-23 17:33:33.624994,0 days 00:00:00.081140,,,,,DecisionTreeClassifier,,log_loss,7.0,,,,,,,,,,,,,,,,,,,,,,,,,,,,COMPLETE,0.0,,,,,,,,,,,,,,,,,,,,
55,55,0.6350877192982456,2023-08-23 17:33:33.705206,2023-08-23 17:33:33.763356,0 days 00:00:00.058150,,,,,DecisionTreeClassifier,,gini,10.0,,,,,,,,,,,,,,,,,,,,,,,,,,,,COMPLETE,0.0,,,,,,,,,,,,,,,,,,,,
56,56,0.44741854636591477,2023-08-23 17:33:33.849158,2023-08-23 17:33:34.457346,0 days 00:00:00.608188,,,,,RandomForestClassifier,,,,,,,,,,,,,,,,,,,,,,,,16.0,11.0,,,,,,COMPLETE,0.0,,,,,,,,,,,,,,,,,,,,
57,57,0.5478260869565217,2023-08-23 17:33:34.019611,2023-08-23 17:33:34.349357,0 days 00:00:00.329746,,,,,RandomForestClassifier,,,,,,,,,,,,,,,,,,,,,,,,11.0,9.0,,,,,,COMPLETE,0.0,,,,,,,,,,,,,,,,,,,,
58,58,0.6546875,2023-08-23 17:33:34.454286,2023-08-23 17:33:34.790337,0 days 00:00:00.336051,,,,,DecisionTreeClassifier,,gini,15.0,,,,,,,,,,,,,,,,,,,,,,,,,,,,COMPLETE,0.0,,,,,,,,,,,,,,,,,,,,
59,59,0.6307692307692307,2023-08-23 17:33:34.556869,2023-08-23 17:33:34.654526,0 days 00:00:00.097657,,,,,DecisionTreeClassifier,,gini,22.0,,,,,,,,,,,,,,,,,,,,,,,,,,,,COMPLETE,0.0,,,,,,,,,,,,,,,,,,,,
60,60,0.6512820512820513,2023-08-23 17:33:34.887202,2023-08-23 17:33:35.097496,0 days 00:00:00.210294,,,,,DecisionTreeClassifier,,gini,12.0,,,,,,,,,,,,,,,,,,,,,,,,,,,,COMPLETE,0.0,,,,,,,,,,,,,,,,,,,,
61,61,0.59375,2023-08-23 17:33:34.903648,2023-08-23 17:33:35.004953,0 days 00:00:00.101305,,,,,DecisionTreeClassifier,,gini,12.0,,,,,,,,,,,,,,,,,,,,,,,,,,,,COMPLETE,0.0,,,,,,,,,,,,,,,,,,,,
62,62,0.6174990321331785,2023-08-23 17:33:35.080532,2023-08-23 17:33:35.234773,0 days 00:00:00.154241,,,,,DecisionTreeClassifier,,gini,15.0,,,,,,,,,,,,,,,,,,,,,,,,,,,,COMPLETE,0.0,,,,,,,,,,,,,,,,,,,,
63,63,0.6224119320969482,2023-08-23 17:33:35.227016,2023-08-23 17:33:35.446093,0 days 00:00:00.219077,,,,,DecisionTreeClassifier,,gini,16.0,,,,,,,,,,,,,,,,,,,,,,,,,,,,COMPLETE,0.0,,,,,,,,,,,,,,,,,,,,
64,64,0.543859649122807,2023-08-23 17:33:35.317835,2023-08-23 17:33:36.841105,0 days 00:00:01.523270,,0.7000000000000001,1.0,,LightGBM,,,,,1.0,,,,0.00014654639350777284,0.8997815230261622,,10.0,,,,,,,,,,114.0,,,,,,,,,COMPLETE,0.0,,,,,,,,,,,,,,,,,,,,
65,65,0.5531250000000001,2023-08-23 17:33:35.573885,2023-08-23 17:33:36.743018,0 days 00:00:01.169133,,0.7000000000000001,1.0,,LightGBM,,,,,1.0,,,,8.301526167183023e-05,0.9177110892685536,,10.0,,,,,,,,,,104.0,,,,,,,,,COMPLETE,0.0,,,,,,,,,,,,,,,,,,,,
66,66,0.5978982849211857,2023-08-23 17:33:36.807788,2023-08-23 17:33:36.983929,0 days 00:00:00.176141,,,,,DecisionTreeClassifier,,entropy,11.0,,,,,,,,,,,,,,,,,,,,,,,,,,,,COMPLETE,0.0,,,,,,,,,,,,,,,,,,,,
67,67,0.543859649122807,2023-08-23 17:33:36.913104,2023-08-23 17:33:37.084187,0 days 00:00:00.171083,,,,,DecisionTreeClassifier,,entropy,11.0,,,,,,,,,,,,,,,,,,,,,,,,,,,,COMPLETE,0.0,,,,,,,,,,,,,,,,,,,,
68,68,0.6267942583732058,2023-08-23 17:33:37.053685,2023-08-23 17:33:37.190674,0 days 00:00:00.136989,,,,,DecisionTreeClassifier,,gini,8.0,,,,,,,,,,,,,,,,,,,,,,,,,,,,COMPLETE,0.0,,,,,,,,,,,,,,,,,,,,
69,69,0.664380798709157,2023-08-23 17:33:37.165346,2023-08-23 17:33:37.275071,0 days 00:00:00.109725,,,,,DecisionTreeClassifier,,gini,8.0,,,,,,,,,,,,,,,,,,,,,,,,,,,,COMPLETE,0.0,,,,,,,,,,,,,,,,,,,,
70,70,0.5457471264367817,2023-08-23 17:33:37.352949,2023-08-23 17:34:12.397729,0 days 00:00:35.044780,,,,,MLPClassifier,,,,,,,,,,,,,,tanh,adam,4.0,100.0,10.0,10.0,100.0,,,,,,,,,,,COMPLETE,0.0,,,,,,,,,,,,,,,,,,,,
71,71,0.3696969696969697,2023-08-23 17:33:37.364685,2023-08-23 17:33:43.208788,0 days 00:00:05.844103,,,,,MLPClassifier,,,,,,,,,,,,,,tanh,sgd,4.0,100.0,10.0,10.0,100.0,,,,,,,,,,,COMPLETE,0.0,,,,,,,,,,,,,,,,,,,,
72,72,0.3696969696969697,2023-08-23 17:33:43.287880,2023-08-23 17:33:43.593680,0 days 00:00:00.305800,,,,,SVC,,,,,,,,,,,,,,,,,,,,,,,,,,,,,0.3743156969606398,rbf,COMPLETE,0.0,,,,,,,,,,,,,,,,,,,,
73,73,0.5890120481927712,2023-08-23 17:33:43.688316,2023-08-23 17:33:43.888066,0 days 00:00:00.199750,,,,,DecisionTreeClassifier,,log_loss,14.0,,,,,,,,,,,,,,,,,,,,,,,,,,,,COMPLETE,0.0,,,,,,,,,,,,,,,,,,,,
74,74,0.649156626506024,2023-08-23 17:33:43.983428,2023-08-23 17:33:44.150118,0 days 00:00:00.166690,,,,,DecisionTreeClassifier,,gini,13.0,,,,,,,,,,,,,,,,,,,,,,,,,,,,COMPLETE,0.0,,,,,,,,,,,,,,,,,,,,
75,75,0.3696969696969697,2023-08-23 17:33:44.272841,2023-08-23 17:33:44.470078,0 days 00:00:00.197237,2.7831537068962556e-08,,,gblinear,XGBoost,0.4287724924018721,,,,,,,0.24486446604744347,,,,,,,,,,,,,,,,,,,,0.9884078550979825,,,COMPLETE,0.0,,,,,,,,,,,,,,,,,,,,
76,76,0.6546875,2023-08-23 17:33:44.556051,2023-08-23 17:33:44.839262,0 days 00:00:00.283211,,,,,DecisionTreeClassifier,,gini,13.0,,,,,,,,,,,,,,,,,,,,,,,,,,,,COMPLETE,0.0,,,,,,,,,,,,,,,,,,,,
77,77,0.6259356469330222,2023-08-23 17:33:44.640688,2023-08-23 17:33:44.930085,0 days 00:00:00.289397,,,,,DecisionTreeClassifier,,gini,13.0,,,,,,,,,,,,,,,,,,,,,,,,,,,,COMPLETE,0.0,,,,,,,,,,,,,,,,,,,,
78,78,0.6020017662643509,2023-08-23 17:33:45.033275,2023-08-23 17:33:45.257879,0 days 00:00:00.224604,,,,,DecisionTreeClassifier,,gini,14.0,,,,,,,,,,,,,,,,,,,,,,,,,,,,COMPLETE,0.0,,,,,,,,,,,,,,,,,,,,
79,79,0.634375,2023-08-23 17:33:45.033897,2023-08-23 17:33:45.126912,0 days 00:00:00.093015,,,,,DecisionTreeClassifier,,gini,13.0,,,,,,,,,,,,,,,,,,,,,,,,,,,,COMPLETE,0.0,,,,,,,,,,,,,,,,,,,,
80,80,0.6663750364537766,2023-08-23 17:33:45.191607,2023-08-23 17:33:45.373370,0 days 00:00:00.181763,,,,,DecisionTreeClassifier,,gini,14.0,,,,,,,,,,,,,,,,,,,,,,,,,,,,COMPLETE,0.0,,,,,,,,,,,,,,,,,,,,
81,81,0.6546875,2023-08-23 17:33:45.445240,2023-08-23 17:33:45.607775,0 days 00:00:00.162535,,,,,DecisionTreeClassifier,,gini,12.0,,,,,,,,,,,,,,,,,,,,,,,,,,,,COMPLETE,0.0,,,,,,,,,,,,,,,,,,,,
82,82,0.6428220979295456,2023-08-23 17:33:45.451332,2023-08-23 17:33:45.720426,0 days 00:00:00.269094,,,,,DecisionTreeClassifier,,gini,12.0,,,,,,,,,,,,,,,,,,,,,,,,,,,,COMPLETE,0.0,,,,,,,,,,,,,,,,,,,,
83,83,0.6767919799498747,2023-08-23 17:33:45.785587,2023-08-23 17:33:45.934777,0 days 00:00:00.149190,,,,,DecisionTreeClassifier,,gini,8.0,,,,,,,,,,,,,,,,,,,,,,,,,,,,COMPLETE,0.0,,,,,,,,,,,,,,,,,,,,
84,84,0.6344637598556093,2023-08-23 17:33:45.790472,2023-08-23 17:33:46.030205,0 days 00:00:00.239733,,,,,DecisionTreeClassifier,,gini,9.0,,,,,,,,,,,,,,,,,,,,,,,,,,,,COMPLETE,0.0,,,,,,,,,,,,,,,,,,,,
85,85,0.49650349650349646,2023-08-23 17:33:46.097006,2023-08-23 17:33:46.693949,0 days 00:00:00.596943,0.0014533180695039862,,,gbtree,XGBoost,0.2104854957701789,,,0.290648106882692,,0.6215398486728452,depthwise,2.098752205350898e-05,,,3.0,,8.0,,,,,,,,,,,,,,,0.7036649534571379,,,COMPLETE,0.0,,,,,,,,,,,,,,,,,,,,
86,86,0.5149584802639062,2023-08-23 17:33:46.178018,2023-08-23 17:33:46.782965,0 days 00:00:00.604947,0.003019237408852227,,,gbtree,XGBoost,0.2177632704402247,,,0.21049724658316715,,0.6154177593953277,depthwise,6.275089969114064e-06,,,3.0,,8.0,,,,,,,,,,,,,,,0.6831501199477543,,,COMPLETE,0.0,,,,,,,,,,,,,,,,,,,,
87,87,0.6140625,2023-08-23 17:33:46.897946,2023-08-23 17:33:47.163963,0 days 00:00:00.266017,,,,,DecisionTreeClassifier,,gini,6.0,,,,,,,,,,,,,,,,,,,,,,,,,,,,COMPLETE,0.0,,,,,,,,,,,,,,,,,,,,
88,88,0.63194643711143,2023-08-23 17:33:46.899168,2023-08-23 17:33:47.070736,0 days 00:00:00.171568,,,,,DecisionTreeClassifier,,gini,9.0,,,,,,,,,,,,,,,,,,,,,,,,,,,,COMPLETE,0.0,,,,,,,,,,,,,,,,,,,,
89,89,0.6803806880142758,2023-08-23 17:33:47.140839,2023-08-23 17:33:47.321016,0 days 00:00:00.180177,,,,,DecisionTreeClassifier,,gini,8.0,,,,,,,,,,,,,,,,,,,,,,,,,,,,COMPLETE,0.0,,,,,,,,,,,,,,,,,,,,
90,90,0.664380798709157,2023-08-23 17:33:47.273082,2023-08-23 17:33:47.485821,0 days 00:00:00.212739,,,,,DecisionTreeClassifier,,gini,8.0,,,,,,,,,,,,,,,,,,,,,,,,,,,,COMPLETE,0.0,,,,,,,,,,,,,,,,,,,,
91,91,0.6597600872410033,2023-08-23 17:33:47.405876,2023-08-23 17:33:47.600547,0 days 00:00:00.194671,,,,,DecisionTreeClassifier,,gini,8.0,,,,,,,,,,,,,,,,,,,,,,,,,,,,COMPLETE,0.0,,,,,,,,,,,,,,,,,,,,
92,92,0.5770884164052517,2023-08-23 17:33:47.565061,2023-08-23 17:33:48.525552,0 days 00:00:00.960491,,,,,RandomForestClassifier,,,,,,,,,,,,,,,,,,,,,,,,59.0,2.0,,,,,,COMPLETE,0.0,,,,,,,,,,,,,,,,,,,,
