,number,value,datetime_start,datetime_complete,duration,params_alpha,params_bagging_fraction,params_bagging_freq,params_booster,params_classifier,params_colsample_bytree,params_dct_criterion,params_dct_max_depth,params_eta,params_feature_fraction,params_gamma,params_grow_policy,params_lambda,params_lambda_l1,params_lambda_l2,params_max_depth,params_min_child_samples,params_min_child_weight,params_mlp_activation,params_mlp_solver,params_n_layers,params_n_units_l_0,params_n_units_l_1,params_n_units_l_2,params_n_units_l_3,params_normalize_type,params_num_leaves,params_rate_drop,params_rf_estimator,params_rf_max_depth,params_sample_type,params_skip_drop,params_subsample,params_svc_c,params_svc_kernel,state,best_trial,dev_acc,dev_recall_macro,dev_precision_macro,dev_f1_macro,dev_recall_0,dev_precision_0,dev_f1_0,dev_recall_1,dev_precision_1,dev_f1_1,test_acc,test_recall_macro,test_precision_macro,test_f1_macro,test_recall_0,test_precision_0,test_f1_0,test_recall_1,test_precision_1,test_f1_1
0,0,0.46157738240994034,2023-08-23 15:13:12.034206,2023-08-23 15:13:20.651614,0 days 00:00:08.617408,,,,,SVC,,,,,,,,,,,,,,,,,,,,,,,,,,,,,89.43919133806642,rbf,COMPLETE,0.0,,,,,,,,,,,,,,,,,,,,
1,1,0.6409312763340399,2023-08-23 15:13:12.035254,2023-08-23 15:13:15.570042,0 days 00:00:03.534788,,,,,RandomForestClassifier,,,,,,,,,,,,,,,,,,,,,,,,40.0,17.0,,,,,,COMPLETE,0.0,,,,,,,,,,,,,,,,,,,,
2,2,0.6431443720864027,2023-08-23 15:13:12.036108,2023-08-23 15:13:17.322457,0 days 00:00:05.286349,,,,,RandomForestClassifier,,,,,,,,,,,,,,,,,,,,,,,,73.0,12.0,,,,,,COMPLETE,0.0,,,,,,,,,,,,,,,,,,,,
3,3,0.6178297884537531,2023-08-23 15:13:12.036461,2023-08-23 15:13:12.137108,0 days 00:00:00.100647,,,,,DecisionTreeClassifier,,gini,2.0,,,,,,,,,,,,,,,,,,,,,,,,,,,,COMPLETE,0.0,,,,,,,,,,,,,,,,,,,,
4,4,0.3357921744708146,2023-08-23 15:13:12.037048,2023-08-23 15:13:56.968888,0 days 00:00:44.931840,,,,,MLPClassifier,,,,,,,,,,,,,,logistic,sgd,1.0,70.0,,,,,,,,,,,,,,COMPLETE,0.0,,,,,,,,,,,,,,,,,,,,
5,5,0.6320226303558132,2023-08-23 15:13:12.038116,2023-08-23 15:13:12.349904,0 days 00:00:00.311788,,,,,DecisionTreeClassifier,,log_loss,3.0,,,,,,,,,,,,,,,,,,,,,,,,,,,,COMPLETE,0.0,,,,,,,,,,,,,,,,,,,,
6,6,0.54477686119793,2023-08-23 15:13:12.040648,2023-08-23 15:13:12.219522,0 days 00:00:00.178874,1.1117890246544424e-08,,,gblinear,XGBoost,0.5705176638779759,,,,,,,8.597379908174228e-08,,,,,,,,,,,,,,,,,,,,0.9697667476068055,,,COMPLETE,0.0,,,,,,,,,,,,,,,,,,,,
7,7,0.6314615286633748,2023-08-23 15:13:12.041154,2023-08-23 15:13:12.551421,0 days 00:00:00.510267,4.5992260859076885e-08,,,dart,XGBoost,0.5205832918416913,,,0.0008638869988119379,,0.0001274229831562003,lossguide,2.5835184300995628e-08,,,9.0,,10.0,,,,,,,,tree,,0.09593162776811763,,,uniform,0.10729080747484468,0.3848559290171582,,,COMPLETE,0.0,,,,,,,,,,,,,,,,,,,,
8,8,0.34716146694680095,2023-08-23 15:13:12.305240,2023-08-23 15:13:18.822393,0 days 00:00:06.517153,,,,,SVC,,,,,,,,,,,,,,,,,,,,,,,,,,,,,0.04959297213491551,linear,COMPLETE,0.0,,,,,,,,,,,,,,,,,,,,
9,9,0.6431628542445522,2023-08-23 15:13:12.308753,2023-08-23 15:13:18.627212,0 days 00:00:06.318459,,,,,RandomForestClassifier,,,,,,,,,,,,,,,,,,,,,,,,76.0,18.0,,,,,,COMPLETE,0.0,,,,,,,,,,,,,,,,,,,,
10,10,0.6291766271995199,2023-08-23 15:13:12.446614,2023-08-23 15:13:12.705158,0 days 00:00:00.258544,0.017279981991275877,,,gbtree,XGBoost,0.9972288062860202,,,0.00685741374729111,,0.09013669197264844,depthwise,2.4121787738154762e-06,,,3.0,,9.0,,,,,,,,,,,,,,,0.7322581546234519,,,COMPLETE,0.0,,,,,,,,,,,,,,,,,,,,
11,11,0.6321786609380594,2023-08-23 15:13:12.629402,2023-08-23 15:13:15.170360,0 days 00:00:02.540958,,,,,RandomForestClassifier,,,,,,,,,,,,,,,,,,,,,,,,78.0,4.0,,,,,,COMPLETE,0.0,,,,,,,,,,,,,,,,,,,,
12,12,0.6323370150735879,2023-08-23 15:13:12.788592,2023-08-23 15:21:24.610761,0 days 00:08:11.822169,,,,,MLPClassifier,,,,,,,,,,,,,,relu,adam,3.0,40.0,100.0,50.0,,,,,,,,,,,,COMPLETE,0.0,,,,,,,,,,,,,,,,,,,,
13,13,0.3357921744708146,2023-08-23 15:13:15.280868,2023-08-23 15:13:22.316379,0 days 00:00:07.035511,,,,,SVC,,,,,,,,,,,,,,,,,,,,,,,,,,,,,0.066444899822694,poly,COMPLETE,0.0,,,,,,,,,,,,,,,,,,,,
14,14,0.6364564743556032,2023-08-23 15:13:15.680675,2023-08-23 15:13:21.995617,0 days 00:00:06.314942,,,,,RandomForestClassifier,,,,,,,,,,,,,,,,,,,,,,,,78.0,21.0,,,,,,COMPLETE,0.0,,,,,,,,,,,,,,,,,,,,
15,15,0.6178297884537531,2023-08-23 15:13:17.405672,2023-08-23 15:13:17.539703,0 days 00:00:00.134031,,,,,DecisionTreeClassifier,,log_loss,2.0,,,,,,,,,,,,,,,,,,,,,,,,,,,,COMPLETE,0.0,,,,,,,,,,,,,,,,,,,,
16,16,0.3357921744708146,2023-08-23 15:13:17.621924,2023-08-23 15:13:23.342565,0 days 00:00:05.720641,,,,,SVC,,,,,,,,,,,,,,,,,,,,,,,,,,,,,0.013511002371194935,poly,COMPLETE,0.0,,,,,,,,,,,,,,,,,,,,
17,17,0.3357921744708146,2023-08-23 15:13:18.732888,2023-08-23 15:13:26.811346,0 days 00:00:08.078458,,,,,SVC,,,,,,,,,,,,,,,,,,,,,,,,,,,,,0.007196323181877799,rbf,COMPLETE,0.0,,,,,,,,,,,,,,,,,,,,
18,18,0.6353866410448027,2023-08-23 15:13:18.921313,2023-08-23 15:13:25.561230,0 days 00:00:06.639917,,,,,RandomForestClassifier,,,,,,,,,,,,,,,,,,,,,,,,83.0,16.0,,,,,,COMPLETE,0.0,,,,,,,,,,,,,,,,,,,,
19,19,0.642084157636797,2023-08-23 15:13:20.779297,2023-08-23 15:13:29.165907,0 days 00:00:08.386610,,,,,RandomForestClassifier,,,,,,,,,,,,,,,,,,,,,,,,83.0,18.0,,,,,,COMPLETE,0.0,,,,,,,,,,,,,,,,,,,,
20,20,0.6281268964641211,2023-08-23 15:13:22.067669,2023-08-23 15:13:25.794450,0 days 00:00:03.726781,,0.6000000000000001,3.0,,LightGBM,,,,,0.9,,,,0.45682334360887245,7.003885726354976e-08,,20.0,,,,,,,,,,245.0,,,,,,,,,COMPLETE,0.0,,,,,,,,,,,,,,,,,,,,
21,21,0.6208311578608541,2023-08-23 15:13:22.398973,2023-08-23 15:24:10.151540,0 days 00:10:47.752567,,,,,MLPClassifier,,,,,,,,,,,,,,tanh,adam,4.0,50.0,60.0,100.0,50.0,,,,,,,,,,,COMPLETE,0.0,,,,,,,,,,,,,,,,,,,,
22,22,0.6162799315465363,2023-08-23 15:13:23.439300,2023-08-23 15:15:48.839737,0 days 00:02:25.400437,,,,,MLPClassifier,,,,,,,,,,,,,,tanh,lbfgs,1.0,60.0,,,,,,,,,,,,,,COMPLETE,0.0,,,,,,,,,,,,,,,,,,,,
23,23,0.633137791926361,2023-08-23 15:13:25.698094,2023-08-23 15:13:30.352793,0 days 00:00:04.654699,,0.6000000000000001,3.0,,LightGBM,,,,,1.0,,,,0.0007386834498512554,2.725559157403621e-05,,20.0,,,,,,,,,,178.0,,,,,,,,,COMPLETE,0.0,,,,,,,,,,,,,,,,,,,,
24,24,0.3357921744708146,2023-08-23 15:13:25.898369,2023-08-23 15:15:01.916550,0 days 00:01:36.018181,,,,,MLPClassifier,,,,,,,,,,,,,,logistic,sgd,2.0,90.0,20.0,,,,,,,,,,,,,COMPLETE,0.0,,,,,,,,,,,,,,,,,,,,
25,25,0.5511091435893469,2023-08-23 15:13:26.932402,2023-08-23 15:19:14.683479,0 days 00:05:47.751077,,,,,MLPClassifier,,,,,,,,,,,,,,identity,lbfgs,4.0,80.0,70.0,70.0,60.0,,,,,,,,,,,COMPLETE,0.0,,,,,,,,,,,,,,,,,,,,
26,26,0.6171969197169962,2023-08-23 15:13:29.337043,2023-08-23 15:24:06.909832,0 days 00:10:37.572789,,,,,MLPClassifier,,,,,,,,,,,,,,relu,adam,4.0,30.0,70.0,90.0,20.0,,,,,,,,,,,COMPLETE,0.0,,,,,,,,,,,,,,,,,,,,
27,27,0.3357921744708146,2023-08-23 15:13:30.498227,2023-08-23 15:13:32.049845,0 days 00:00:01.551618,,,,,MLPClassifier,,,,,,,,,,,,,,logistic,sgd,2.0,20.0,30.0,,,,,,,,,,,,,COMPLETE,0.0,,,,,,,,,,,,,,,,,,,,
28,28,0.6363563574250026,2023-08-23 15:13:32.214252,2023-08-23 15:13:36.076217,0 days 00:00:03.861965,,,,,RandomForestClassifier,,,,,,,,,,,,,,,,,,,,,,,,64.0,11.0,,,,,,COMPLETE,0.0,,,,,,,,,,,,,,,,,,,,
29,29,0.6395277796273776,2023-08-23 15:13:36.283411,2023-08-23 15:13:45.167135,0 days 00:00:08.883724,,,,,RandomForestClassifier,,,,,,,,,,,,,,,,,,,,,,,,98.0,32.0,,,,,,COMPLETE,0.0,,,,,,,,,,,,,,,,,,,,
30,30,0.6320154639332132,2023-08-23 15:13:45.260056,2023-08-23 15:13:48.853258,0 days 00:00:03.593202,,,,,RandomForestClassifier,,,,,,,,,,,,,,,,,,,,,,,,59.0,9.0,,,,,,COMPLETE,0.0,,,,,,,,,,,,,,,,,,,,
31,31,0.5524449421425905,2023-08-23 15:13:48.954811,2023-08-23 15:19:31.992359,0 days 00:05:43.037548,,,,,MLPClassifier,,,,,,,,,,,,,,identity,lbfgs,4.0,100.0,100.0,50.0,40.0,,,,,,,,,,,COMPLETE,0.0,,,,,,,,,,,,,,,,,,,,
32,32,0.6463947314107736,2023-08-23 15:13:57.053786,2023-08-23 15:14:01.274424,0 days 00:00:04.220638,,,,,RandomForestClassifier,,,,,,,,,,,,,,,,,,,,,,,,87.0,8.0,,,,,,COMPLETE,0.0,,,,,,,,,,,,,,,,,,,,
33,33,0.6393550456678148,2023-08-23 15:14:01.385001,2023-08-23 15:14:05.445422,0 days 00:00:04.060421,,,,,RandomForestClassifier,,,,,,,,,,,,,,,,,,,,,,,,99.0,6.0,,,,,,COMPLETE,0.0,,,,,,,,,,,,,,,,,,,,
34,34,0.6306257087285316,2023-08-23 15:14:05.588099,2023-08-23 15:14:06.415545,0 days 00:00:00.827446,,,,,RandomForestClassifier,,,,,,,,,,,,,,,,,,,,,,,,16.0,7.0,,,,,,COMPLETE,0.0,,,,,,,,,,,,,,,,,,,,
35,35,0.6227517377995417,2023-08-23 15:14:06.493198,2023-08-23 15:14:07.699169,0 days 00:00:01.205971,,,,,RandomForestClassifier,,,,,,,,,,,,,,,,,,,,,,,,67.0,2.0,,,,,,COMPLETE,0.0,,,,,,,,,,,,,,,,,,,,
36,36,0.6146768821802168,2023-08-23 15:14:07.836811,2023-08-23 15:20:35.474048,0 days 00:06:27.637237,,,,,MLPClassifier,,,,,,,,,,,,,,identity,adam,4.0,100.0,100.0,90.0,70.0,,,,,,,,,,,COMPLETE,0.0,,,,,,,,,,,,,,,,,,,,
37,37,0.6440164640423596,2023-08-23 15:15:02.040316,2023-08-23 15:15:02.569028,0 days 00:00:00.528712,,1.0,1.0,,LightGBM,,,,,0.4,,,,1.4839097696599878e-08,0.5189855607417638,,100.0,,,,,,,,,,10.0,,,,,,,,,COMPLETE,0.0,,,,,,,,,,,,,,,,,,,,
38,38,0.6466036584466665,2023-08-23 15:15:02.699919,2023-08-23 15:15:03.019914,0 days 00:00:00.319995,,1.0,1.0,,LightGBM,,,,,0.4,,,,1.3077544837166185e-08,0.651326729356198,,100.0,,,,,,,,,,3.0,,,,,,,,,COMPLETE,0.0,,,,,,,,,,,,,,,,,,,,
39,39,0.6475730806055892,2023-08-23 15:15:03.209021,2023-08-23 15:15:03.504386,0 days 00:00:00.295365,,1.0,1.0,,LightGBM,,,,,0.4,,,,1.2416334157929307e-08,0.6430851404479547,,100.0,,,,,,,,,,5.0,,,,,,,,,COMPLETE,0.0,,,,,,,,,,,,,,,,,,,,
40,40,0.6492353717734782,2023-08-23 15:15:03.654232,2023-08-23 15:15:04.120340,0 days 00:00:00.466108,,1.0,1.0,,LightGBM,,,,,0.4,,,,1.0087632181616216e-08,0.6827708313650046,,100.0,,,,,,,,,,6.0,,,,,,,,,COMPLETE,0.0,,,,,,,,,,,,,,,,,,,,
41,41,0.6478570768678438,2023-08-23 15:15:04.219929,2023-08-23 15:15:04.515082,0 days 00:00:00.295153,,1.0,1.0,,LightGBM,,,,,0.4,,,,1.255164562408345e-08,0.9480499107643738,,100.0,,,,,,,,,,4.0,,,,,,,,,COMPLETE,0.0,,,,,,,,,,,,,,,,,,,,
42,42,0.6426914038760689,2023-08-23 15:15:04.628021,2023-08-23 15:15:04.829801,0 days 00:00:00.201780,,1.0,1.0,,LightGBM,,,,,0.4,,,,2.992969114921545e-08,0.8800636450926289,,100.0,,,,,,,,,,2.0,,,,,,,,,COMPLETE,0.0,,,,,,,,,,,,,,,,,,,,
43,43,0.6423991635171998,2023-08-23 15:15:04.932842,2023-08-23 15:15:05.657461,0 days 00:00:00.724619,,1.0,1.0,,LightGBM,,,,,0.4,,,,1.1847867806599881e-08,0.9028848702549414,,100.0,,,,,,,,,,13.0,,,,,,,,,COMPLETE,0.0,,,,,,,,,,,,,,,,,,,,
44,44,0.6486669633300284,2023-08-23 15:15:05.765483,2023-08-23 15:15:07.439614,0 days 00:00:01.674131,,0.9,1.0,,LightGBM,,,,,0.5,,,,1.249143603008578e-08,0.8128170879522343,,80.0,,,,,,,,,,52.0,,,,,,,,,COMPLETE,0.0,,,,,,,,,,,,,,,,,,,,
45,45,0.648824983557057,2023-08-23 15:15:07.504882,2023-08-23 15:15:09.338414,0 days 00:00:01.833532,,0.8,1.0,,LightGBM,,,,,0.6000000000000001,,,,4.4860177055853617e-07,0.028289880026441363,,70.0,,,,,,,,,,81.0,,,,,,,,,COMPLETE,0.0,,,,,,,,,,,,,,,,,,,,
46,46,0.6374299719887955,2023-08-23 15:15:09.477938,2023-08-23 15:15:11.378875,0 days 00:00:01.900937,,0.8,2.0,,LightGBM,,,,,0.6000000000000001,,,,4.381763962472694e-07,0.03172461520081861,,70.0,,,,,,,,,,93.0,,,,,,,,,COMPLETE,0.0,,,,,,,,,,,,,,,,,,,,
47,47,0.6347209733641048,2023-08-23 15:15:11.458307,2023-08-23 15:15:13.380904,0 days 00:00:01.922597,,0.8,2.0,,LightGBM,,,,,0.6000000000000001,,,,7.354841283477542e-07,0.028375127649166953,,60.0,,,,,,,,,,73.0,,,,,,,,,COMPLETE,0.0,,,,,,,,,,,,,,,,,,,,
48,48,0.6499990662931839,2023-08-23 15:15:13.459912,2023-08-23 15:15:15.576851,0 days 00:00:02.116939,,0.9,1.0,,LightGBM,,,,,0.5,,,,1.0039988543033486e-08,0.06445385299378463,,80.0,,,,,,,,,,54.0,,,,,,,,,COMPLETE,0.0,,,,,,,,,,,,,,,,,,,,
49,49,0.6339831880586422,2023-08-23 15:15:15.647745,2023-08-23 15:15:17.233878,0 days 00:00:01.586133,,0.8,1.0,,LightGBM,,,,,0.6000000000000001,,,,2.2438828294711905e-07,0.01900321077061342,,80.0,,,,,,,,,,65.0,,,,,,,,,COMPLETE,0.0,,,,,,,,,,,,,,,,,,,,
50,50,0.6427113864269598,2023-08-23 15:15:17.312203,2023-08-23 15:15:18.942237,0 days 00:00:01.630034,,0.9,1.0,,LightGBM,,,,,0.5,,,,1.5711758749815257e-07,0.05648026421513705,,80.0,,,,,,,,,,53.0,,,,,,,,,COMPLETE,0.0,,,,,,,,,,,,,,,,,,,,
51,51,0.63898112502179,2023-08-23 15:15:19.119703,2023-08-23 15:15:20.867779,0 days 00:00:01.748076,,0.9,1.0,,LightGBM,,,,,0.5,,,,1.2186127248368463e-07,0.06532618798683709,,80.0,,,,,,,,,,51.0,,,,,,,,,COMPLETE,0.0,,,,,,,,,,,,,,,,,,,,
52,52,0.640420511020585,2023-08-23 15:15:20.947023,2023-08-23 15:15:22.645131,0 days 00:00:01.698108,,0.9,1.0,,LightGBM,,,,,0.5,,,,1.2341251087773175e-08,0.0018955813859026878,,80.0,,,,,,,,,,113.0,,,,,,,,,COMPLETE,0.0,,,,,,,,,,,,,,,,,,,,
53,53,0.5817929389028176,2023-08-23 15:15:22.782549,2023-08-23 15:15:23.435614,0 days 00:00:00.653065,,,,,DecisionTreeClassifier,,entropy,31.0,,,,,,,,,,,,,,,,,,,,,,,,,,,,COMPLETE,0.0,,,,,,,,,,,,,,,,,,,,
54,54,0.5106114416437088,2023-08-23 15:15:23.529935,2023-08-23 15:15:24.186391,0 days 00:00:00.656456,0.14628289090997457,,,gbtree,XGBoost,0.25361525334824714,,,1.6293637390296206e-08,,1.6872613068651114e-08,depthwise,0.5871398390885277,,,9.0,,2.0,,,,,,,,,,,,,,,0.23400858155389404,,,COMPLETE,0.0,,,,,,,,,,,,,,,,,,,,
55,55,0.638937984939383,2023-08-23 15:15:24.290651,2023-08-23 15:15:25.574987,0 days 00:00:01.284336,,0.9,2.0,,LightGBM,,,,,0.5,,,,1.3685418999017322e-06,0.12637638426194195,,60.0,,,,,,,,,,36.0,,,,,,,,,COMPLETE,0.0,,,,,,,,,,,,,,,,,,,,
56,56,0.6433802667044972,2023-08-23 15:15:25.653680,2023-08-23 15:15:26.631790,0 days 00:00:00.978110,,0.4,1.0,,LightGBM,,,,,0.7000000000000001,,,,8.45272138939392e-08,0.15897188234257792,,90.0,,,,,,,,,,35.0,,,,,,,,,COMPLETE,0.0,,,,,,,,,,,,,,,,,,,,
57,57,0.6375923583099408,2023-08-23 15:15:26.699548,2023-08-23 15:15:29.599960,0 days 00:00:02.900412,,0.9,1.0,,LightGBM,,,,,0.5,,,,6.767584539864453e-08,0.14601787566204838,,40.0,,,,,,,,,,84.0,,,,,,,,,COMPLETE,0.0,,,,,,,,,,,,,,,,,,,,
58,58,0.6479667507238256,2023-08-23 15:15:29.737921,2023-08-23 15:15:31.024947,0 days 00:00:01.287026,,1.0,1.0,,LightGBM,,,,,0.4,,,,1.2723714919039734e-08,0.6679590284568694,,90.0,,,,,,,,,,31.0,,,,,,,,,COMPLETE,0.0,,,,,,,,,,,,,,,,,,,,
59,59,0.6496732722494496,2023-08-23 15:15:31.103345,2023-08-23 15:15:32.331475,0 days 00:00:01.228130,,1.0,1.0,,LightGBM,,,,,0.4,,,,1.1215999932109607e-08,0.8798509819397634,,90.0,,,,,,,,,,34.0,,,,,,,,,COMPLETE,0.0,,,,,,,,,,,,,,,,,,,,
60,60,0.6458935979369884,2023-08-23 15:15:32.505382,2023-08-23 15:15:34.000413,0 days 00:00:01.495031,,0.9,1.0,,LightGBM,,,,,0.5,,,,6.305746217400589e-08,0.19588953213972904,,90.0,,,,,,,,,,38.0,,,,,,,,,COMPLETE,0.0,,,,,,,,,,,,,,,,,,,,
61,61,0.59211407413243,2023-08-23 15:15:34.094822,2023-08-23 15:15:34.573639,0 days 00:00:00.478817,,,,,DecisionTreeClassifier,,entropy,10.0,,,,,,,,,,,,,,,,,,,,,,,,,,,,COMPLETE,0.0,,,,,,,,,,,,,,,,,,,,
62,62,0.4147855583299596,2023-08-23 15:15:34.686371,2023-08-23 15:15:34.855338,0 days 00:00:00.168967,9.25168580124089e-05,,,gblinear,XGBoost,0.962806202486729,,,,,,,0.0036815492592985857,,,,,,,,,,,,,,,,,,,,0.543662646131683,,,COMPLETE,0.0,,,,,,,,,,,,,,,,,,,,
63,63,0.6213104813877914,2023-08-23 15:15:34.950894,2023-08-23 15:23:36.641238,0 days 00:08:01.690344,,,,,MLPClassifier,,,,,,,,,,,,,,tanh,adam,4.0,10.0,100.0,30.0,50.0,,,,,,,,,,,COMPLETE,0.0,,,,,,,,,,,,,,,,,,,,
64,64,0.6414078761912763,2023-08-23 15:15:48.910315,2023-08-23 15:15:49.970264,0 days 00:00:01.059949,,0.8,2.0,,LightGBM,,,,,0.7000000000000001,,,,1.0072752792509531e-08,0.16841540023589455,,70.0,,,,,,,,,,31.0,,,,,,,,,COMPLETE,0.0,,,,,,,,,,,,,,,,,,,,
65,65,0.4794061418847255,2023-08-23 15:15:50.097245,2023-08-23 15:15:55.903776,0 days 00:00:05.806531,,,,,SVC,,,,,,,,,,,,,,,,,,,,,,,,,,,,,731.929933889885,linear,COMPLETE,0.0,,,,,,,,,,,,,,,,,,,,
66,66,0.6405178254466861,2023-08-23 15:15:55.983884,2023-08-23 15:15:57.618348,0 days 00:00:01.634464,,1.0,1.0,,LightGBM,,,,,0.6000000000000001,,,,7.075630422370274e-08,0.007429214743379507,,90.0,,,,,,,,,,57.0,,,,,,,,,COMPLETE,0.0,,,,,,,,,,,,,,,,,,,,
67,67,0.6492353717734782,2023-08-23 15:15:57.688075,2023-08-23 15:15:58.830954,0 days 00:00:01.142879,,0.9,1.0,,LightGBM,,,,,0.4,,,,6.304695370527948e-08,0.9959197589310912,,70.0,,,,,,,,,,28.0,,,,,,,,,COMPLETE,0.0,,,,,,,,,,,,,,,,,,,,
68,68,0.6475461443914123,2023-08-23 15:15:58.961235,2023-08-23 15:16:00.262262,0 days 00:00:01.301027,,0.9,1.0,,LightGBM,,,,,0.4,,,,5.998794917079118e-08,0.9140370252838883,,70.0,,,,,,,,,,28.0,,,,,,,,,COMPLETE,0.0,,,,,,,,,,,,,,,,,,,,
69,69,0.6424309116035329,2023-08-23 15:16:00.330226,2023-08-23 15:16:01.778962,0 days 00:00:01.448736,,0.9,1.0,,LightGBM,,,,,0.4,,,,4.418298226504088e-08,0.20509534915960692,,90.0,,,,,,,,,,46.0,,,,,,,,,COMPLETE,0.0,,,,,,,,,,,,,,,,,,,,
70,70,0.6399046837748865,2023-08-23 15:16:01.855495,2023-08-23 15:16:03.049102,0 days 00:00:01.193607,,0.7000000000000001,1.0,,LightGBM,,,,,0.5,,,,3.646486771444455e-08,0.2529028811085338,,80.0,,,,,,,,,,26.0,,,,,,,,,COMPLETE,0.0,,,,,,,,,,,,,,,,,,,,
71,71,0.6375923583099408,2023-08-23 15:16:03.118758,2023-08-23 15:16:04.741425,0 days 00:00:01.622667,,1.0,1.0,,LightGBM,,,,,0.4,,,,3.768338556373857e-08,0.2587317671252666,,70.0,,,,,,,,,,65.0,,,,,,,,,COMPLETE,0.0,,,,,,,,,,,,,,,,,,,,
72,72,0.6315072544715189,2023-08-23 15:16:04.824462,2023-08-23 15:22:24.628753,0 days 00:06:19.804291,,,,,MLPClassifier,,,,,,,,,,,,,,relu,adam,4.0,10.0,100.0,70.0,40.0,,,,,,,,,,,COMPLETE,0.0,,,,,,,,,,,,,,,,,,,,
73,73,0.6433802667044972,2023-08-23 15:19:14.771975,2023-08-23 15:19:15.902679,0 days 00:00:01.130704,,0.8,1.0,,LightGBM,,,,,0.5,,,,1.0598153550477144e-08,0.864662845218694,,90.0,,,,,,,,,,27.0,,,,,,,,,COMPLETE,0.0,,,,,,,,,,,,,,,,,,,,
74,74,0.3923991756590434,2023-08-23 15:19:15.970012,2023-08-23 15:19:23.237226,0 days 00:00:07.267214,,,,,SVC,,,,,,,,,,,,,,,,,,,,,,,,,,,,,3.384190609398637,rbf,COMPLETE,0.0,,,,,,,,,,,,,,,,,,,,
75,75,0.6198195917075486,2023-08-23 15:19:23.343470,2023-08-23 15:19:23.622455,0 days 00:00:00.278985,,,,,DecisionTreeClassifier,,gini,6.0,,,,,,,,,,,,,,,,,,,,,,,,,,,,COMPLETE,0.0,,,,,,,,,,,,,,,,,,,,
76,76,0.6413656704855131,2023-08-23 15:19:23.759975,2023-08-23 15:19:25.456463,0 days 00:00:01.696488,,0.9,1.0,,LightGBM,,,,,0.4,,,,1.900596441954987e-07,0.1059745160835162,,80.0,,,,,,,,,,93.0,,,,,,,,,COMPLETE,0.0,,,,,,,,,,,,,,,,,,,,
77,77,0.5294155989006951,2023-08-23 15:19:25.533633,2023-08-23 15:19:32.592723,0 days 00:00:07.059090,,,,,MLPClassifier,,,,,,,,,,,,,,identity,adam,4.0,10.0,100.0,10.0,10.0,,,,,,,,,,,COMPLETE,0.0,,,,,,,,,,,,,,,,,,,,
78,78,0.6439585902754419,2023-08-23 15:19:32.065607,2023-08-23 15:19:32.896542,0 days 00:00:00.830935,,1.0,1.0,,LightGBM,,,,,0.4,,,,2.988382503279704e-08,0.89299306118428,,90.0,,,,,,,,,,14.0,,,,,,,,,COMPLETE,0.0,,,,,,,,,,,,,,,,,,,,
79,79,0.6471439721119034,2023-08-23 15:19:32.686444,2023-08-23 15:19:33.620032,0 days 00:00:00.933588,,1.0,1.0,,LightGBM,,,,,0.4,,,,1.0455829900847574e-08,0.40414302452896284,,90.0,,,,,,,,,,20.0,,,,,,,,,COMPLETE,0.0,,,,,,,,,,,,,,,,,,,,
80,80,0.6430771257068877,2023-08-23 15:19:33.020674,2023-08-23 15:19:34.746881,0 days 00:00:01.726207,,1.0,1.0,,LightGBM,,,,,0.4,,,,1.1378838305980842e-08,0.33537161993308134,,90.0,,,,,,,,,,178.0,,,,,,,,,COMPLETE,0.0,,,,,,,,,,,,,,,,,,,,
81,81,0.6446452896127408,2023-08-23 15:19:33.711871,2023-08-23 15:19:35.343969,0 days 00:00:01.632098,,1.0,1.0,,LightGBM,,,,,0.8,,,,3.1535189841564306e-08,0.27726746242440925,,100.0,,,,,,,,,,177.0,,,,,,,,,COMPLETE,0.0,,,,,,,,,,,,,,,,,,,,
82,82,0.6355656812334531,2023-08-23 15:19:34.809937,2023-08-23 15:19:36.447179,0 days 00:00:01.637242,,0.7000000000000001,3.0,,LightGBM,,,,,0.8,,,,3.5587448194097246e-08,0.3167761847879301,,70.0,,,,,,,,,,45.0,,,,,,,,,COMPLETE,0.0,,,,,,,,,,,,,,,,,,,,
83,83,0.6358161376182411,2023-08-23 15:19:35.400778,2023-08-23 15:19:35.681772,0 days 00:00:00.280994,1.7345961776839394e-05,,,dart,XGBoost,0.21489070253226966,,,0.2847169410115398,,0.6333617830362587,lossguide,0.00019953020187907157,,,3.0,,2.0,,,,,,,,forest,,2.1695427697262223e-08,,,weighted,1.2003104301592485e-08,0.7226930913180616,,,COMPLETE,0.0,,,,,,,,,,,,,,,,,,,,
84,84,0.6340816031679456,2023-08-23 15:19:35.757016,2023-08-23 15:19:37.226926,0 days 00:00:01.469910,,0.9,3.0,,LightGBM,,,,,0.5,,,,3.2441008038295585e-08,0.06775904605576548,,70.0,,,,,,,,,,44.0,,,,,,,,,COMPLETE,0.0,,,,,,,,,,,,,,,,,,,,
85,85,0.639930454940597,2023-08-23 15:19:36.525189,2023-08-23 15:19:39.305068,0 days 00:00:02.779879,,0.9,1.0,,LightGBM,,,,,0.4,,,,4.0109265972165e-05,0.0515899758593996,,50.0,,,,,,,,,,141.0,,,,,,,,,COMPLETE,0.0,,,,,,,,,,,,,,,,,,,,
86,86,0.650893555900476,2023-08-23 15:19:37.289058,2023-08-23 15:19:38.028723,0 days 00:00:00.739665,,1.0,1.0,,LightGBM,,,,,0.4,,,,3.0649553101118543e-07,0.9610810188629909,,10.0,,,,,,,,,,17.0,,,,,,,,,COMPLETE,0.0,,,,,,,,,,,,,,,,,,,,
