,number,value,datetime_start,datetime_complete,duration,params_alpha,params_bagging_fraction,params_bagging_freq,params_booster,params_classifier,params_colsample_bytree,params_dct_criterion,params_dct_max_depth,params_eta,params_feature_fraction,params_gamma,params_grow_policy,params_lambda,params_lambda_l1,params_lambda_l2,params_max_depth,params_min_child_samples,params_min_child_weight,params_mlp_activation,params_mlp_solver,params_n_layers,params_n_units_l_0,params_n_units_l_1,params_n_units_l_2,params_n_units_l_3,params_normalize_type,params_num_leaves,params_rate_drop,params_rf_estimator,params_rf_max_depth,params_sample_type,params_skip_drop,params_subsample,params_svc_c,params_svc_kernel,state,best_trial,dev_acc,dev_recall_macro,dev_precision_macro,dev_f1_macro,dev_recall_0,dev_precision_0,dev_f1_0,dev_recall_1,dev_precision_1,dev_f1_1,test_acc,test_recall_macro,test_precision_macro,test_f1_macro,test_recall_0,test_precision_0,test_f1_0,test_recall_1,test_precision_1,test_f1_1
0,0,0.6601307189542484,2023-08-23 12:16:48.802306,2023-08-23 12:16:50.818839,0 days 00:00:02.016533,,0.4,2.0,,LightGBM,,,,,0.6000000000000001,,,,1.4914128012656304e-06,7.757883971483545e-05,,10.0,,,,,,,,,,200.0,,,,,,,,,COMPLETE,0.0,,,,,,,,,,,,,,,,,,,,
1,1,0.7289125221561881,2023-08-23 12:16:48.804856,2023-08-23 12:16:49.169037,0 days 00:00:00.364181,,0.4,3.0,,LightGBM,,,,,0.8,,,,0.0015298403280453701,0.8601014326103585,,100.0,,,,,,,,,,147.0,,,,,,,,,COMPLETE,0.0,,,,,,,,,,,,,,,,,,,,
2,2,0.6636556261849003,2023-08-23 12:16:48.807599,2023-08-23 12:16:50.403915,0 days 00:00:01.596316,,,,,RandomForestClassifier,,,,,,,,,,,,,,,,,,,,,,,,64.0,2.0,,,,,,COMPLETE,0.0,,,,,,,,,,,,,,,,,,,,
3,3,0.6685514547136835,2023-08-23 12:16:48.810322,2023-08-23 12:16:49.297772,0 days 00:00:00.487450,,0.6000000000000001,3.0,,LightGBM,,,,,0.7000000000000001,,,,0.0005089812747198257,0.0001772063106471368,,90.0,,,,,,,,,,63.0,,,,,,,,,COMPLETE,0.0,,,,,,,,,,,,,,,,,,,,
4,4,0.7026143790849673,2023-08-23 12:16:48.812776,2023-08-23 12:21:16.169505,0 days 00:04:27.356729,,,,,MLPClassifier,,,,,,,,,,,,,,relu,adam,2.0,60.0,100.0,,,,,,,,,,,,,COMPLETE,0.0,,,,,,,,,,,,,,,,,,,,
5,5,0.6254211688160799,2023-08-23 12:16:48.817506,2023-08-23 12:16:48.911096,0 days 00:00:00.093590,,,,,DecisionTreeClassifier,,entropy,2.0,,,,,,,,,,,,,,,,,,,,,,,,,,,,COMPLETE,0.0,,,,,,,,,,,,,,,,,,,,
6,6,0.3696969696969697,2023-08-23 12:16:48.822358,2023-08-23 12:16:58.613246,0 days 00:00:09.790888,,,,,MLPClassifier,,,,,,,,,,,,,,logistic,sgd,1.0,90.0,,,,,,,,,,,,,,COMPLETE,0.0,,,,,,,,,,,,,,,,,,,,
7,7,0.3696969696969697,2023-08-23 12:16:48.836176,2023-08-23 12:17:04.039562,0 days 00:00:15.203386,,,,,MLPClassifier,,,,,,,,,,,,,,logistic,adam,1.0,80.0,,,,,,,,,,,,,,COMPLETE,0.0,,,,,,,,,,,,,,,,,,,,
8,8,0.6840277777777779,2023-08-23 12:16:49.040367,2023-08-23 12:16:49.667879,0 days 00:00:00.627512,,,,,RandomForestClassifier,,,,,,,,,,,,,,,,,,,,,,,,24.0,6.0,,,,,,COMPLETE,0.0,,,,,,,,,,,,,,,,,,,,
9,9,0.6614583333333333,2023-08-23 12:16:49.243938,2023-08-23 12:16:51.277114,0 days 00:00:02.033176,0.04881067432874048,,,dart,XGBoost,0.7027956330455993,,,0.11195954531757257,,0.14263921507660954,depthwise,0.6232792278458984,,,3.0,,8.0,,,,,,,,tree,,0.0036419666983956247,,,weighted,0.091331720288542,0.6767369829372096,,,COMPLETE,0.0,,,,,,,,,,,,,,,,,,,,
10,10,0.5806451612903225,2023-08-23 12:16:49.484253,2023-08-23 12:16:49.615153,0 days 00:00:00.130900,,,,,DecisionTreeClassifier,,log_loss,24.0,,,,,,,,,,,,,,,,,,,,,,,,,,,,COMPLETE,0.0,,,,,,,,,,,,,,,,,,,,
11,11,0.3696969696969697,2023-08-23 12:16:49.714562,2023-08-23 12:16:49.951796,0 days 00:00:00.237234,,,,,SVC,,,,,,,,,,,,,,,,,,,,,,,,,,,,,0.04175603378921511,poly,COMPLETE,0.0,,,,,,,,,,,,,,,,,,,,
12,12,0.6101949025487257,2023-08-23 12:16:49.717690,2023-08-23 12:16:49.810943,0 days 00:00:00.093253,,,,,DecisionTreeClassifier,,gini,17.0,,,,,,,,,,,,,,,,,,,,,,,,,,,,COMPLETE,0.0,,,,,,,,,,,,,,,,,,,,
13,13,0.506096778333975,2023-08-23 12:16:49.940127,2023-08-23 12:16:50.219527,0 days 00:00:00.279400,,,,,SVC,,,,,,,,,,,,,,,,,,,,,,,,,,,,,388.4520131220123,linear,COMPLETE,0.0,,,,,,,,,,,,,,,,,,,,
14,14,0.6720720720720721,2023-08-23 12:16:50.074469,2023-08-23 12:16:51.002160,0 days 00:00:00.927691,,,,,RandomForestClassifier,,,,,,,,,,,,,,,,,,,,,,,,25.0,2.0,,,,,,COMPLETE,0.0,,,,,,,,,,,,,,,,,,,,
15,15,0.3696969696969697,2023-08-23 12:16:50.489338,2023-08-23 12:16:50.653089,0 days 00:00:00.163751,,,,,SVC,,,,,,,,,,,,,,,,,,,,,,,,,,,,,25854.800891988463,poly,COMPLETE,0.0,,,,,,,,,,,,,,,,,,,,
16,16,0.7010012887875483,2023-08-23 12:16:50.491754,2023-08-23 12:16:51.574278,0 days 00:00:01.082524,,0.8,3.0,,LightGBM,,,,,0.8,,,,7.826238247632364e-06,0.0008409281341140842,,80.0,,,,,,,,,,254.0,,,,,,,,,COMPLETE,0.0,,,,,,,,,,,,,,,,,,,,
17,17,0.7304625199362041,2023-08-23 12:16:50.774924,2023-08-23 12:16:52.518096,0 days 00:00:01.743172,,0.4,3.0,,LightGBM,,,,,1.0,,,,0.7371258971803287,0.48303798130562103,,10.0,,,,,,,,,,227.0,,,,,,,,,COMPLETE,0.0,,,,,,,,,,,,,,,,,,,,
18,18,0.6813725490196079,2023-08-23 12:16:50.952443,2023-08-23 12:16:51.918352,0 days 00:00:00.965909,,,,,RandomForestClassifier,,,,,,,,,,,,,,,,,,,,,,,,19.0,16.0,,,,,,COMPLETE,0.0,,,,,,,,,,,,,,,,,,,,
19,19,0.3696969696969697,2023-08-23 12:16:51.193254,2023-08-23 12:16:51.468103,0 days 00:00:00.274849,1.5014282851435227e-07,,,gblinear,XGBoost,0.511665146170381,,,,,,,0.004180486909748606,,,,,,,,,,,,,,,,,,,,0.32716116286884106,,,COMPLETE,0.0,,,,,,,,,,,,,,,,,,,,
20,20,0.6067226890756302,2023-08-23 12:16:51.409732,2023-08-23 12:18:40.382272,0 days 00:01:48.972540,,,,,MLPClassifier,,,,,,,,,,,,,,relu,lbfgs,2.0,20.0,50.0,,,,,,,,,,,,,COMPLETE,0.0,,,,,,,,,,,,,,,,,,,,
21,21,0.3696969696969697,2023-08-23 12:16:51.560706,2023-08-23 12:16:52.396073,0 days 00:00:00.835367,,,,,MLPClassifier,,,,,,,,,,,,,,identity,sgd,2.0,10.0,40.0,,,,,,,,,,,,,COMPLETE,0.0,,,,,,,,,,,,,,,,,,,,
22,22,0.6770186335403726,2023-08-23 12:16:51.691209,2023-08-23 12:16:52.638928,0 days 00:00:00.947719,,0.9,3.0,,LightGBM,,,,,1.0,,,,0.034772149349281946,0.27033101978170093,,100.0,,,,,,,,,,241.0,,,,,,,,,COMPLETE,0.0,,,,,,,,,,,,,,,,,,,,
23,23,0.6855385257011782,2023-08-23 12:16:52.018935,2023-08-23 12:19:19.400869,0 days 00:02:27.381934,,,,,MLPClassifier,,,,,,,,,,,,,,tanh,lbfgs,2.0,30.0,70.0,,,,,,,,,,,,,COMPLETE,0.0,,,,,,,,,,,,,,,,,,,,
24,24,0.7304625199362041,2023-08-23 12:16:52.615133,2023-08-23 12:16:53.772067,0 days 00:00:01.156934,,0.4,3.0,,LightGBM,,,,,1.0,,,,0.9649553827362832,0.3992928782826658,,20.0,,,,,,,,,,142.0,,,,,,,,,COMPLETE,0.0,,,,,,,,,,,,,,,,,,,,
25,25,0.7244627612599353,2023-08-23 12:16:52.638656,2023-08-23 12:16:54.028461,0 days 00:00:01.389805,,0.4,3.0,,LightGBM,,,,,1.0,,,,0.6931971716399954,0.6201786098911588,,20.0,,,,,,,,,,137.0,,,,,,,,,COMPLETE,0.0,,,,,,,,,,,,,,,,,,,,
26,26,0.664380798709157,2023-08-23 12:16:52.785119,2023-08-23 12:16:54.214518,0 days 00:00:01.429399,,0.4,1.0,,LightGBM,,,,,1.0,,,,0.8155113404719265,0.28176483563705657,,20.0,,,,,,,,,,132.0,,,,,,,,,COMPLETE,0.0,,,,,,,,,,,,,,,,,,,,
27,27,0.6339544513457558,2023-08-23 12:16:53.931052,2023-08-23 12:21:29.255387,0 days 00:04:35.324335,,,,,MLPClassifier,,,,,,,,,,,,,,tanh,lbfgs,4.0,100.0,100.0,70.0,100.0,,,,,,,,,,,COMPLETE,0.0,,,,,,,,,,,,,,,,,,,,
28,28,0.6601307189542484,2023-08-23 12:16:54.130690,2023-08-23 12:16:54.959410,0 days 00:00:00.828720,,0.4,1.0,,LightGBM,,,,,0.9,,,,0.931675702192911,0.740947455330641,,40.0,,,,,,,,,,139.0,,,,,,,,,COMPLETE,0.0,,,,,,,,,,,,,,,,,,,,
29,29,0.6601307189542484,2023-08-23 12:16:54.305783,2023-08-23 12:16:55.306584,0 days 00:00:01.000801,,0.6000000000000001,2.0,,LightGBM,,,,,0.8,,,,0.002785224407998662,0.8365010999296651,,50.0,,,,,,,,,,167.0,,,,,,,,,COMPLETE,0.0,,,,,,,,,,,,,,,,,,,,
30,30,0.6067226890756302,2023-08-23 12:16:55.063024,2023-08-23 12:21:26.170926,0 days 00:04:31.107902,,,,,MLPClassifier,,,,,,,,,,,,,,relu,lbfgs,4.0,100.0,100.0,40.0,80.0,,,,,,,,,,,COMPLETE,0.0,,,,,,,,,,,,,,,,,,,,
31,31,0.3696969696969697,2023-08-23 12:16:55.417356,2023-08-23 12:16:56.366919,0 days 00:00:00.949563,,,,,MLPClassifier,,,,,,,,,,,,,,logistic,lbfgs,4.0,100.0,100.0,70.0,80.0,,,,,,,,,,,COMPLETE,0.0,,,,,,,,,,,,,,,,,,,,
32,32,0.6767919799498747,2023-08-23 12:16:56.518073,2023-08-23 12:16:57.501663,0 days 00:00:00.983590,,0.6000000000000001,3.0,,LightGBM,,,,,0.5,,,,0.020179087308688448,0.009215192123542873,,70.0,,,,,,,,,,59.0,,,,,,,,,COMPLETE,0.0,,,,,,,,,,,,,,,,,,,,
33,33,0.7273093989511901,2023-08-23 12:16:57.581026,2023-08-23 12:16:58.427429,0 days 00:00:00.846403,,0.5,3.0,,LightGBM,,,,,0.9,,,,4.733196329875726e-05,9.484158521300106e-07,,30.0,,,,,,,,,,187.0,,,,,,,,,COMPLETE,0.0,,,,,,,,,,,,,,,,,,,,
34,34,0.6770186335403726,2023-08-23 12:16:58.528124,2023-08-23 12:17:00.621020,0 days 00:00:02.092896,,0.5,2.0,,LightGBM,,,,,0.9,,,,0.04126172357060868,0.039584399657641184,,10.0,,,,,,,,,,91.0,,,,,,,,,COMPLETE,0.0,,,,,,,,,,,,,,,,,,,,
35,35,0.6554865424430643,2023-08-23 12:16:58.701793,2023-08-23 12:17:00.794368,0 days 00:00:02.092575,,0.5,2.0,,LightGBM,,,,,0.9,,,,2.4517088238846515e-08,0.011800294054147752,,10.0,,,,,,,,,,89.0,,,,,,,,,COMPLETE,0.0,,,,,,,,,,,,,,,,,,,,
36,36,0.6803806880142758,2023-08-23 12:17:00.732202,2023-08-23 12:17:01.333722,0 days 00:00:00.601520,,0.5,3.0,,LightGBM,,,,,0.4,,,,3.309548264633311e-08,0.022942265461739976,,70.0,,,,,,,,,,95.0,,,,,,,,,COMPLETE,0.0,,,,,,,,,,,,,,,,,,,,
37,37,0.6152423233444322,2023-08-23 12:17:00.930322,2023-08-23 12:17:01.548767,0 days 00:00:00.618445,0.9197418889261944,,,gbtree,XGBoost,0.979742661963497,,,1.2339742961971997e-08,,2.3079285634712508e-08,lossguide,2.945483060778579e-08,,,9.0,,2.0,,,,,,,,,,,,,,,0.9833761471740565,,,COMPLETE,0.0,,,,,,,,,,,,,,,,,,,,
38,38,0.6517503805175038,2023-08-23 12:17:01.440612,2023-08-23 12:17:02.123194,0 days 00:00:00.682582,,0.4,3.0,,LightGBM,,,,,0.8,,,,0.00011644084037947407,2.8915448610656827e-07,,30.0,,,,,,,,,,194.0,,,,,,,,,COMPLETE,0.0,,,,,,,,,,,,,,,,,,,,
39,39,0.6517503805175038,2023-08-23 12:17:01.664625,2023-08-23 12:17:02.518149,0 days 00:00:00.853524,,0.4,3.0,,LightGBM,,,,,0.8,,,,7.267576676418705e-05,1.1930258860632631e-06,,30.0,,,,,,,,,,192.0,,,,,,,,,COMPLETE,0.0,,,,,,,,,,,,,,,,,,,,
40,40,0.7273093989511901,2023-08-23 12:17:02.249343,2023-08-23 12:17:03.572649,0 days 00:00:01.323306,,0.5,3.0,,LightGBM,,,,,0.9,,,,0.0011840964482954426,2.8415444226525136e-07,,30.0,,,,,,,,,,205.0,,,,,,,,,COMPLETE,0.0,,,,,,,,,,,,,,,,,,,,
41,41,0.6670934699103712,2023-08-23 12:17:02.696181,2023-08-23 12:17:03.246052,0 days 00:00:00.549871,,0.5,3.0,,LightGBM,,,,,1.0,,,,0.17294702089414377,6.748971864646605e-08,,30.0,,,,,,,,,,2.0,,,,,,,,,COMPLETE,0.0,,,,,,,,,,,,,,,,,,,,
42,42,0.7150684931506849,2023-08-23 12:17:03.320779,2023-08-23 12:17:03.906278,0 days 00:00:00.585499,,0.5,3.0,,LightGBM,,,,,0.9,,,,0.010689065433599577,0.11772236039167958,,50.0,,,,,,,,,,223.0,,,,,,,,,COMPLETE,0.0,,,,,,,,,,,,,,,,,,,,
43,43,0.7327027860594222,2023-08-23 12:17:03.645265,2023-08-23 12:17:04.600619,0 days 00:00:00.955354,,0.4,3.0,,LightGBM,,,,,0.9,,,,0.005524258782653887,0.08875321086197618,,50.0,,,,,,,,,,166.0,,,,,,,,,COMPLETE,1.0,0.7596153846153846,0.7264582539077392,0.7791353383458646,0.7327027860594222,0.5348837209302325,0.8214285714285714,0.647887323943662,0.9180327868852459,0.7368421052631579,0.8175182481751824,0.6059040590405904,0.6009541984732825,0.6111707544360223,0.5943168362129285,0.45190839694656487,0.6284501061571125,0.5257548845470693,0.75,0.5938914027149321,0.6628787878787877
44,44,0.5412587412587413,2023-08-23 12:17:04.004519,2023-08-23 12:17:04.136818,0 days 00:00:00.132299,,,,,DecisionTreeClassifier,,gini,4.0,,,,,,,,,,,,,,,,,,,,,,,,,,,,COMPLETE,0.0,,,,,,,,,,,,,,,,,,,,
45,45,0.6953125,2023-08-23 12:17:04.266134,2023-08-23 12:17:06.020441,0 days 00:00:01.754307,,0.7000000000000001,3.0,,LightGBM,,,,,1.0,,,,0.12326240350200171,0.06399452860807808,,20.0,,,,,,,,,,164.0,,,,,,,,,COMPLETE,0.0,,,,,,,,,,,,,,,,,,,,
46,46,0.6512820512820513,2023-08-23 12:17:04.267031,2023-08-23 12:17:06.386451,0 days 00:00:02.119420,,0.7000000000000001,3.0,,LightGBM,,,,,1.0,,,,0.13226337528229343,0.08379305906535697,,20.0,,,,,,,,,,167.0,,,,,,,,,COMPLETE,0.0,,,,,,,,,,,,,,,,,,,,
47,47,0.5569080949482654,2023-08-23 12:17:04.756268,2023-08-23 12:17:05.043655,0 days 00:00:00.287387,1.2940167499947933e-08,,,gblinear,XGBoost,0.251929816914282,,,,,,,7.956745414381177e-07,,,,,,,,,,,,,,,,,,,,0.21422677270141466,,,COMPLETE,0.0,,,,,,,,,,,,,,,,,,,,
48,48,0.6755244755244756,2023-08-23 12:17:05.260497,2023-08-23 12:17:05.882975,0 days 00:00:00.622478,,0.4,3.0,,LightGBM,,,,,1.0,,,,0.1973725742722568,0.08516226331077452,,60.0,,,,,,,,,,164.0,,,,,,,,,COMPLETE,0.0,,,,,,,,,,,,,,,,,,,,
49,49,0.6836424295947405,2023-08-23 12:17:06.180730,2023-08-23 12:17:07.020424,0 days 00:00:00.839694,,0.4,3.0,,LightGBM,,,,,0.9,,,,0.005203613442478096,0.8399141845379332,,40.0,,,,,,,,,,172.0,,,,,,,,,COMPLETE,0.0,,,,,,,,,,,,,,,,,,,,
50,50,0.7150684931506849,2023-08-23 12:17:06.196573,2023-08-23 12:17:07.147909,0 days 00:00:00.951336,,0.4,3.0,,LightGBM,,,,,0.9,,,,0.0041957572406016875,0.594921884953809,,40.0,,,,,,,,,,170.0,,,,,,,,,COMPLETE,0.0,,,,,,,,,,,,,,,,,,,,
51,51,0.6985507246376812,2023-08-23 12:17:06.496449,2023-08-23 12:17:09.041696,0 days 00:00:02.545247,,,,,RandomForestClassifier,,,,,,,,,,,,,,,,,,,,,,,,95.0,26.0,,,,,,COMPLETE,0.0,,,,,,,,,,,,,,,,,,,,
52,52,0.3696969696969697,2023-08-23 12:17:07.138245,2023-08-23 12:17:07.601768,0 days 00:00:00.463523,,,,,SVC,,,,,,,,,,,,,,,,,,,,,,,,,,,,,1.1820543601493432e-09,rbf,COMPLETE,0.0,,,,,,,,,,,,,,,,,,,,
53,53,0.3696969696969697,2023-08-23 12:17:07.300619,2023-08-23 12:17:07.742430,0 days 00:00:00.441811,,,,,SVC,,,,,,,,,,,,,,,,,,,,,,,,,,,,,2.434967567990123e-10,rbf,COMPLETE,0.0,,,,,,,,,,,,,,,,,,,,
54,54,0.6554865424430643,2023-08-23 12:17:07.865875,2023-08-23 12:17:10.344888,0 days 00:00:02.479013,,,,,RandomForestClassifier,,,,,,,,,,,,,,,,,,,,,,,,99.0,26.0,,,,,,COMPLETE,0.0,,,,,,,,,,,,,,,,,,,,
55,55,0.6985507246376812,2023-08-23 12:17:07.885796,2023-08-23 12:17:10.822217,0 days 00:00:02.936421,,,,,RandomForestClassifier,,,,,,,,,,,,,,,,,,,,,,,,98.0,29.0,,,,,,COMPLETE,0.0,,,,,,,,,,,,,,,,,,,,
56,56,0.6770186335403726,2023-08-23 12:17:09.155321,2023-08-23 12:17:18.247996,0 days 00:00:09.092675,,,,,MLPClassifier,,,,,,,,,,,,,,relu,adam,4.0,30.0,10.0,10.0,10.0,,,,,,,,,,,COMPLETE,0.0,,,,,,,,,,,,,,,,,,,,
57,57,0.5933834586466165,2023-08-23 12:17:10.472618,2023-08-23 12:17:10.579104,0 days 00:00:00.106486,,,,,DecisionTreeClassifier,,log_loss,8.0,,,,,,,,,,,,,,,,,,,,,,,,,,,,COMPLETE,0.0,,,,,,,,,,,,,,,,,,,,
58,58,0.7273093989511901,2023-08-23 12:17:10.707643,2023-08-23 12:17:11.533075,0 days 00:00:00.825432,,0.5,3.0,,LightGBM,,,,,0.9,,,,0.0010696693554238326,4.139735445124246e-06,,30.0,,,,,,,,,,214.0,,,,,,,,,COMPLETE,0.0,,,,,,,,,,,,,,,,,,,,
59,59,0.7273093989511901,2023-08-23 12:17:10.973718,2023-08-23 12:17:11.779761,0 days 00:00:00.806043,,0.5,3.0,,LightGBM,,,,,0.9,,,,0.0013263424602030967,1.5260526849060893e-06,,30.0,,,,,,,,,,210.0,,,,,,,,,COMPLETE,0.0,,,,,,,,,,,,,,,,,,,,
60,60,0.6163194444444444,2023-08-23 12:17:11.605539,2023-08-23 12:19:18.385513,0 days 00:02:06.779974,,,,,MLPClassifier,,,,,,,,,,,,,,relu,lbfgs,4.0,30.0,10.0,10.0,10.0,,,,,,,,,,,COMPLETE,0.0,,,,,,,,,,,,,,,,,,,,
61,61,0.6124223602484473,2023-08-23 12:17:11.864641,2023-08-23 12:19:23.753073,0 days 00:02:11.888432,,,,,MLPClassifier,,,,,,,,,,,,,,relu,lbfgs,4.0,30.0,10.0,10.0,10.0,,,,,,,,,,,COMPLETE,0.0,,,,,,,,,,,,,,,,,,,,
62,62,0.6717948717948719,2023-08-23 12:17:18.323869,2023-08-23 12:17:19.657187,0 days 00:00:01.333318,,0.4,3.0,,LightGBM,,,,,0.7000000000000001,,,,0.0002901695215689629,3.763968028218484e-08,,10.0,,,,,,,,,,234.0,,,,,,,,,COMPLETE,0.0,,,,,,,,,,,,,,,,,,,,
63,63,0.7238562091503268,2023-08-23 12:17:19.779671,2023-08-23 12:17:21.319332,0 days 00:00:01.539661,,1.0,3.0,,LightGBM,,,,,0.8,,,,0.00637411171098535,1.0847042431717886e-08,,20.0,,,,,,,,,,150.0,,,,,,,,,COMPLETE,0.0,,,,,,,,,,,,,,,,,,,,
64,64,0.7184962406015037,2023-08-23 12:17:21.430372,2023-08-23 12:17:22.006063,0 days 00:00:00.575691,,0.5,3.0,,LightGBM,,,,,0.9,,,,0.025466514824887238,0.22555301726891344,,60.0,,,,,,,,,,118.0,,,,,,,,,COMPLETE,0.0,,,,,,,,,,,,,,,,,,,,
65,65,0.6254211688160799,2023-08-23 12:17:22.112596,2023-08-23 12:17:22.167662,0 days 00:00:00.055066,,,,,DecisionTreeClassifier,,entropy,2.0,,,,,,,,,,,,,,,,,,,,,,,,,,,,COMPLETE,0.0,,,,,,,,,,,,,,,,,,,,
66,66,0.6770186335403726,2023-08-23 12:17:22.283354,2023-08-23 12:17:24.064527,0 days 00:00:01.781173,,0.4,2.0,,LightGBM,,,,,0.8,,,,0.0014742921609079828,1.502864973863342e-05,,10.0,,,,,,,,,,188.0,,,,,,,,,COMPLETE,0.0,,,,,,,,,,,,,,,,,,,,
67,67,0.6367100666878375,2023-08-23 12:17:24.178839,2023-08-23 12:21:11.343725,0 days 00:03:47.164886,,,,,MLPClassifier,,,,,,,,,,,,,,tanh,lbfgs,3.0,50.0,100.0,100.0,,,,,,,,,,,,COMPLETE,0.0,,,,,,,,,,,,,,,,,,,,
68,68,0.7273093989511901,2023-08-23 12:18:40.478979,2023-08-23 12:18:41.317916,0 days 00:00:00.838937,,0.5,3.0,,LightGBM,,,,,0.9,,,,0.0008126184900130546,3.852090024995614e-06,,30.0,,,,,,,,,,212.0,,,,,,,,,COMPLETE,0.0,,,,,,,,,,,,,,,,,,,,
69,69,0.7040525954273379,2023-08-23 12:18:41.398730,2023-08-23 12:18:42.033079,0 days 00:00:00.634349,,0.6000000000000001,3.0,,LightGBM,,,,,1.0,,,,0.00023188927474787884,5.003721564637331e-07,,40.0,,,,,,,,,,206.0,,,,,,,,,COMPLETE,0.0,,,,,,,,,,,,,,,,,,,,
70,70,0.6717948717948719,2023-08-23 12:18:42.100987,2023-08-23 12:18:43.109480,0 days 00:00:01.008493,,0.5,3.0,,LightGBM,,,,,0.9,,,,0.001283065614843721,3.115605653554704e-05,,20.0,,,,,,,,,,226.0,,,,,,,,,COMPLETE,0.0,,,,,,,,,,,,,,,,,,,,
71,71,0.711319008944176,2023-08-23 12:18:43.279044,2023-08-23 12:18:43.869788,0 days 00:00:00.590744,3.493286129646505e-05,,,dart,XGBoost,0.22348724133295794,,,0.5595684291153161,,0.776491003146151,lossguide,2.557813241853692e-05,,,3.0,,10.0,,,,,,,,forest,,1.4443131226919724e-08,,,uniform,2.3672380101788013e-08,0.5652547899096988,,,COMPLETE,0.0,,,,,,,,,,,,,,,,,,,,
72,72,0.6685514547136835,2023-08-23 12:18:43.998233,2023-08-23 12:18:44.972649,0 days 00:00:00.974416,,0.6000000000000001,3.0,,LightGBM,,,,,0.8,,,,6.303704750184825e-05,0.0005553657054729381,,90.0,,,,,,,,,,192.0,,,,,,,,,COMPLETE,0.0,,,,,,,,,,,,,,,,,,,,
73,73,0.7128205128205128,2023-08-23 12:18:45.072910,2023-08-23 12:18:45.493166,0 days 00:00:00.420256,,0.4,3.0,,LightGBM,,,,,1.0,,,,0.0005677516557985498,0.28823205019540704,,30.0,,,,,,,,,,251.0,,,,,,,,,COMPLETE,0.0,,,,,,,,,,,,,,,,,,,,
74,74,0.711319008944176,2023-08-23 12:18:45.613213,2023-08-23 12:18:46.349844,0 days 00:00:00.736631,,0.4,3.0,,LightGBM,,,,,0.9,,,,2.1167363078559476e-05,0.2506108439118743,,50.0,,,,,,,,,,146.0,,,,,,,,,COMPLETE,0.0,,,,,,,,,,,,,,,,,,,,
75,75,0.6005121638924455,2023-08-23 12:18:46.438567,2023-08-23 12:31:33.039363,0 days 00:12:46.600796,,,,,SVC,,,,,,,,,,,,,,,,,,,,,,,,,,,,,951631523.1091421,linear,COMPLETE,0.0,,,,,,,,,,,,,,,,,,,,
76,76,0.6722689075630253,2023-08-23 12:19:18.506300,2023-08-23 12:19:18.833466,0 days 00:00:00.327166,,0.5,3.0,,LightGBM,,,,,0.7000000000000001,,,,0.00047337767998499076,0.0001584641727610248,,100.0,,,,,,,,,,117.0,,,,,,,,,COMPLETE,0.0,,,,,,,,,,,,,,,,,,,,
77,77,0.7063331988705123,2023-08-23 12:19:18.940605,2023-08-23 12:19:19.534896,0 days 00:00:00.594291,,0.8,3.0,,LightGBM,,,,,1.0,,,,0.01113925469896087,0.0021753968929066974,,90.0,,,,,,,,,,182.0,,,,,,,,,COMPLETE,0.0,,,,,,,,,,,,,,,,,,,,
78,78,0.6767919799498747,2023-08-23 12:19:19.481037,2023-08-23 12:19:20.346700,0 days 00:00:00.865663,,0.5,3.0,,LightGBM,,,,,0.9,,,,0.002299428329301756,1.4929363682039676e-06,,30.0,,,,,,,,,,216.0,,,,,,,,,COMPLETE,0.0,,,,,,,,,,,,,,,,,,,,
79,79,0.7273093989511901,2023-08-23 12:19:19.602096,2023-08-23 12:19:20.211541,0 days 00:00:00.609445,,0.5,3.0,,LightGBM,,,,,0.9,,,,0.00139292500717631,3.886086523433379e-06,,30.0,,,,,,,,,,220.0,,,,,,,,,COMPLETE,0.0,,,,,,,,,,,,,,,,,,,,
80,80,0.7128205128205128,2023-08-23 12:19:20.443796,2023-08-23 12:19:21.541739,0 days 00:00:01.097943,,0.4,1.0,,LightGBM,,,,,0.8,,,,0.558552021868216,0.9505516318786809,,20.0,,,,,,,,,,200.0,,,,,,,,,COMPLETE,0.0,,,,,,,,,,,,,,,,,,,,
81,81,0.7184962406015037,2023-08-23 12:19:20.446138,2023-08-23 12:19:21.434618,0 days 00:00:00.988480,,0.4,1.0,,LightGBM,,,,,0.8,,,,0.44784217254554204,0.33155314821194976,,20.0,,,,,,,,,,202.0,,,,,,,,,COMPLETE,0.0,,,,,,,,,,,,,,,,,,,,
82,82,0.5926749232560601,2023-08-23 12:19:21.638788,2023-08-23 12:33:28.334904,0 days 00:14:06.696116,,,,,SVC,,,,,,,,,,,,,,,,,,,,,,,,,,,,,2072971942.6979158,linear,COMPLETE,0.0,,,,,,,,,,,,,,,,,,,,
83,83,0.586013986013986,2023-08-23 12:19:21.642197,2023-08-23 12:30:08.074399,0 days 00:10:46.432202,,,,,SVC,,,,,,,,,,,,,,,,,,,,,,,,,,,,,648266401.301038,linear,COMPLETE,0.0,,,,,,,,,,,,,,,,,,,,
84,84,0.6124223602484473,2023-08-23 12:19:23.901819,2023-08-23 12:32:52.637521,0 days 00:13:28.735702,,,,,SVC,,,,,,,,,,,,,,,,,,,,,,,,,,,,,8838491083.622917,linear,COMPLETE,0.0,,,,,,,,,,,,,,,,,,,,
85,85,0.5987905327911583,2023-08-23 12:21:11.422831,2023-08-23 12:34:21.616472,0 days 00:13:10.193641,,,,,SVC,,,,,,,,,,,,,,,,,,,,,,,,,,,,,8331128902.250369,linear,COMPLETE,0.0,,,,,,,,,,,,,,,,,,,,
