,number,value,datetime_start,datetime_complete,duration,params_alpha,params_bagging_fraction,params_bagging_freq,params_booster,params_classifier,params_colsample_bytree,params_dct_criterion,params_dct_max_depth,params_eta,params_feature_fraction,params_gamma,params_grow_policy,params_lambda,params_lambda_l1,params_lambda_l2,params_max_depth,params_min_child_samples,params_min_child_weight,params_mlp_activation,params_mlp_solver,params_n_layers,params_n_units_l_0,params_n_units_l_1,params_n_units_l_2,params_n_units_l_3,params_normalize_type,params_num_leaves,params_rate_drop,params_rf_estimator,params_rf_max_depth,params_sample_type,params_skip_drop,params_subsample,params_svc_c,params_svc_kernel,state,best_trial,dev_acc,dev_recall_macro,dev_precision_macro,dev_f1_macro,dev_recall_0,dev_precision_0,dev_f1_0,dev_recall_1,dev_precision_1,dev_f1_1,test_acc,test_recall_macro,test_precision_macro,test_f1_macro,test_recall_0,test_precision_0,test_f1_0,test_recall_1,test_precision_1,test_f1_1
84,84,0.3573487031700288,2023-08-23 14:48:27.211848,2023-08-23 14:48:27.329143,0 days 00:00:00.117295,0.0004471316100098447,,,gblinear,XGBoost,0.9756712419861997,,,,,,,0.16603812550915079,,,,,,,,,,,,,,,,,,,,0.28705036158616404,,,COMPLETE,0.0,,,,,,,,,,,,,,,,,,,,
85,85,0.5464765758883405,2023-08-23 14:48:27.478618,2023-08-23 14:48:31.017598,0 days 00:00:03.538980,,0.8,1.0,,LightGBM,,,,,0.4,,,,5.7753056790810154e-05,0.31393970746021194,,40.0,,,,,,,,,,231.0,,,,,,,,,COMPLETE,0.0,,,,,,,,,,,,,,,,,,,,
86,86,0.3573487031700288,2023-08-23 14:48:28.991721,2023-08-23 14:48:35.329555,0 days 00:00:06.337834,,,,,SVC,,,,,,,,,,,,,,,,,,,,,,,,,,,,,377.7668529321618,poly,COMPLETE,0.0,,,,,,,,,,,,,,,,,,,,
87,87,0.3573487031700288,2023-08-23 14:48:29.836305,2023-08-23 14:48:37.163839,0 days 00:00:07.327534,,,,,SVC,,,,,,,,,,,,,,,,,,,,,,,,,,,,,903.16415507762,poly,COMPLETE,0.0,,,,,,,,,,,,,,,,,,,,
88,88,0.5201795630889494,2023-08-23 14:48:30.117161,2023-08-23 14:48:31.825321,0 days 00:00:01.708160,,0.4,3.0,,LightGBM,,,,,0.9,,,,6.507061870913769e-07,0.2849269258651729,,50.0,,,,,,,,,,214.0,,,,,,,,,COMPLETE,0.0,,,,,,,,,,,,,,,,,,,,
89,89,0.3573487031700288,2023-08-23 14:48:31.124899,2023-08-23 14:48:39.477074,0 days 00:00:08.352175,,,,,SVC,,,,,,,,,,,,,,,,,,,,,,,,,,,,,664.2089101258593,poly,COMPLETE,0.0,,,,,,,,,,,,,,,,,,,,
90,90,0.3573487031700288,2023-08-23 14:48:31.913948,2023-08-23 14:48:37.049500,0 days 00:00:05.135552,,,,,SVC,,,,,,,,,,,,,,,,,,,,,,,,,,,,,388.3826828827809,poly,COMPLETE,0.0,,,,,,,,,,,,,,,,,,,,
91,91,0.3573487031700288,2023-08-23 14:48:34.552373,2023-08-23 14:48:43.004803,0 days 00:00:08.452430,,,,,SVC,,,,,,,,,,,,,,,,,,,,,,,,,,,,,920.191169973484,poly,COMPLETE,0.0,,,,,,,,,,,,,,,,,,,,
92,92,0.5277887793955602,2023-08-23 14:48:35.441257,2023-08-23 14:48:39.179610,0 days 00:00:03.738353,,0.8,1.0,,LightGBM,,,,,0.4,,,,0.00019936078914720303,0.6432900719204694,,30.0,,,,,,,,,,222.0,,,,,,,,,COMPLETE,0.0,,,,,,,,,,,,,,,,,,,,
93,93,0.5326987559451406,2023-08-23 14:48:37.154001,2023-08-23 14:48:41.423433,0 days 00:00:04.269432,,0.8,1.0,,LightGBM,,,,,0.4,,,,0.00025955294865835334,0.5267146931495387,,30.0,,,,,,,,,,225.0,,,,,,,,,COMPLETE,0.0,,,,,,,,,,,,,,,,,,,,
94,94,0.530240655510078,2023-08-23 14:48:37.255242,2023-08-23 14:48:38.572130,0 days 00:00:01.316888,,0.8,1.0,,LightGBM,,,,,0.4,,,,0.00018364649384296694,0.5163950741355452,,30.0,,,,,,,,,,33.0,,,,,,,,,COMPLETE,0.0,,,,,,,,,,,,,,,,,,,,
95,95,0.5360764706263821,2023-08-23 14:48:38.672695,2023-08-23 14:48:42.854243,0 days 00:00:04.181548,,0.9,3.0,,LightGBM,,,,,0.7000000000000001,,,,3.283490981679561e-05,0.0736335285576582,,50.0,,,,,,,,,,223.0,,,,,,,,,COMPLETE,0.0,,,,,,,,,,,,,,,,,,,,
96,96,0.5441106638563368,2023-08-23 14:48:39.269494,2023-08-23 14:48:43.104289,0 days 00:00:03.834795,,1.0,2.0,,LightGBM,,,,,0.7000000000000001,,,,2.764853760582906e-05,0.06798455120062268,,50.0,,,,,,,,,,215.0,,,,,,,,,COMPLETE,0.0,,,,,,,,,,,,,,,,,,,,
97,97,0.5443598572850978,2023-08-23 14:48:39.606659,2023-08-23 14:48:43.226181,0 days 00:00:03.619522,,1.0,2.0,,LightGBM,,,,,0.7000000000000001,,,,7.840873324577857e-07,0.07225288715191189,,50.0,,,,,,,,,,217.0,,,,,,,,,COMPLETE,0.0,,,,,,,,,,,,,,,,,,,,
98,98,0.5395701278054219,2023-08-23 14:48:41.543883,2023-08-23 14:48:44.123899,0 days 00:00:02.580016,,0.4,3.0,,LightGBM,,,,,0.9,,,,3.1171077466932666e-05,0.009253616602461868,,50.0,,,,,,,,,,211.0,,,,,,,,,COMPLETE,0.0,,,,,,,,,,,,,,,,,,,,
99,99,0.5235134735067158,2023-08-23 14:48:42.981670,2023-08-23 14:48:45.584588,0 days 00:00:02.602918,,0.4,3.0,,LightGBM,,,,,0.9,,,,2.738555156791085e-07,0.2451278755595644,,50.0,,,,,,,,,,209.0,,,,,,,,,COMPLETE,0.0,,,,,,,,,,,,,,,,,,,,
100,100,0.5395701278054219,2023-08-23 14:48:43.184940,2023-08-23 14:48:45.707162,0 days 00:00:02.522222,,0.4,3.0,,LightGBM,,,,,0.9,,,,9.005885007984708e-07,0.00988351899572013,,50.0,,,,,,,,,,246.0,,,,,,,,,COMPLETE,0.0,,,,,,,,,,,,,,,,,,,,
101,101,0.533987345446102,2023-08-23 14:48:43.216835,2023-08-23 14:48:45.853833,0 days 00:00:02.636998,,0.4,3.0,,LightGBM,,,,,0.9,,,,8.89658901059308e-07,0.007485911383062573,,50.0,,,,,,,,,,200.0,,,,,,,,,COMPLETE,0.0,,,,,,,,,,,,,,,,,,,,
102,102,0.5441803589931715,2023-08-23 14:48:43.326239,2023-08-23 14:48:45.704078,0 days 00:00:02.377839,,0.4,3.0,,LightGBM,,,,,0.9,,,,2.630318815994299e-07,0.2235919130245065,,50.0,,,,,,,,,,170.0,,,,,,,,,COMPLETE,0.0,,,,,,,,,,,,,,,,,,,,
103,103,0.5280211649701807,2023-08-23 14:48:44.223194,2023-08-23 14:48:46.870376,0 days 00:00:02.647182,,0.4,3.0,,LightGBM,,,,,1.0,,,,2.2653476594038866e-07,0.22128226132374657,,40.0,,,,,,,,,,247.0,,,,,,,,,COMPLETE,0.0,,,,,,,,,,,,,,,,,,,,
104,104,0.5445106382978724,2023-08-23 14:48:45.689423,2023-08-23 14:48:48.544650,0 days 00:00:02.855227,,0.4,3.0,,LightGBM,,,,,1.0,,,,5.403283901565688e-06,0.009342025029038553,,40.0,,,,,,,,,,165.0,,,,,,,,,COMPLETE,0.0,,,,,,,,,,,,,,,,,,,,
105,105,0.530984067670286,2023-08-23 14:48:45.879670,2023-08-23 14:48:47.413805,0 days 00:00:01.534135,,,,,DecisionTreeClassifier,,log_loss,31.0,,,,,,,,,,,,,,,,,,,,,,,,,,,,COMPLETE,0.0,,,,,,,,,,,,,,,,,,,,
106,106,0.3573487031700288,2023-08-23 14:48:45.957826,2023-08-23 14:48:46.213451,0 days 00:00:00.255625,,,,,DecisionTreeClassifier,,log_loss,2.0,,,,,,,,,,,,,,,,,,,,,,,,,,,,COMPLETE,0.0,,,,,,,,,,,,,,,,,,,,
107,107,0.5327953866578161,2023-08-23 14:48:45.993888,2023-08-23 14:48:49.938461,0 days 00:00:03.944573,,0.7000000000000001,2.0,,LightGBM,,,,,0.7000000000000001,,,,4.845132200560072e-06,0.002583996161966562,,40.0,,,,,,,,,,164.0,,,,,,,,,COMPLETE,0.0,,,,,,,,,,,,,,,,,,,,
108,108,0.5316860483865766,2023-08-23 14:48:46.316871,2023-08-23 14:48:51.079958,0 days 00:00:04.763087,,1.0,2.0,,LightGBM,,,,,0.7000000000000001,,,,5.666435229355368e-06,0.040940061133681364,,40.0,,,,,,,,,,150.0,,,,,,,,,COMPLETE,0.0,,,,,,,,,,,,,,,,,,,,
109,109,0.5397340690341852,2023-08-23 14:48:46.942885,2023-08-23 14:48:50.066646,0 days 00:00:03.123761,,1.0,2.0,,LightGBM,,,,,0.7000000000000001,,,,4.6584937212891185e-06,0.031100668755963724,,60.0,,,,,,,,,,192.0,,,,,,,,,COMPLETE,0.0,,,,,,,,,,,,,,,,,,,,
110,110,0.5152167654868913,2023-08-23 14:48:47.522453,2023-08-23 14:48:51.142139,0 days 00:00:03.619686,,1.0,2.0,,LightGBM,,,,,0.7000000000000001,,,,5.267009257365336e-06,0.04050037836324338,,60.0,,,,,,,,,,188.0,,,,,,,,,COMPLETE,0.0,,,,,,,,,,,,,,,,,,,,
111,111,0.5310543397924098,2023-08-23 14:48:48.612776,2023-08-23 14:48:52.268916,0 days 00:00:03.656140,,0.7000000000000001,3.0,,LightGBM,,,,,1.0,,,,7.374751920395201e-06,0.035895303026812486,,40.0,,,,,,,,,,161.0,,,,,,,,,COMPLETE,0.0,,,,,,,,,,,,,,,,,,,,
112,112,0.4247243777893932,2023-08-23 14:48:50.024923,2023-08-23 14:48:50.928962,0 days 00:00:00.904039,5.787843615167241e-06,,,dart,XGBoost,0.7118318190695172,,,0.00010499365873502232,,1.554701682073598e-08,depthwise,3.5541053452627975e-05,,,5.0,,6.0,,,,,,,,forest,,1.6154919521293062e-08,,,weighted,0.8967808029892869,0.7026164080904929,,,COMPLETE,0.0,,,,,,,,,,,,,,,,,,,,
113,113,0.44987227008615505,2023-08-23 14:48:50.231905,2023-08-23 14:48:50.829482,0 days 00:00:00.597577,4.135320624577836e-06,,,dart,XGBoost,0.7162292526861004,,,0.00011035446344537978,,0.00019261524531422684,lossguide,1.5648231825108677e-05,,,5.0,,6.0,,,,,,,,tree,,9.028469230538686e-08,,,weighted,0.4856380220676794,0.6972248383721715,,,COMPLETE,0.0,,,,,,,,,,,,,,,,,,,,
114,114,0.5358496427461945,2023-08-23 14:48:50.900882,2023-08-23 14:48:55.715093,0 days 00:00:04.814211,,0.9,3.0,,LightGBM,,,,,1.0,,,,9.327011931978461e-05,0.003544631814638501,,30.0,,,,,,,,,,145.0,,,,,,,,,COMPLETE,0.0,,,,,,,,,,,,,,,,,,,,
115,115,0.5125385684782764,2023-08-23 14:48:51.031130,2023-08-23 14:48:56.271830,0 days 00:00:05.240700,,0.9,3.0,,LightGBM,,,,,1.0,,,,8.033229226508979e-05,0.039158665814876356,,30.0,,,,,,,,,,150.0,,,,,,,,,COMPLETE,0.0,,,,,,,,,,,,,,,,,,,,
116,116,0.5520140830485658,2023-08-23 14:48:51.221892,2023-08-23 14:48:56.999365,0 days 00:00:05.777473,,0.9,3.0,,LightGBM,,,,,1.0,,,,1.677901381985736e-05,0.9604801676524892,,30.0,,,,,,,,,,148.0,,,,,,,,,COMPLETE,0.0,,,,,,,,,,,,,,,,,,,,
117,117,0.5421578019892354,2023-08-23 14:48:51.252699,2023-08-23 14:48:56.351771,0 days 00:00:05.099072,,0.9,3.0,,LightGBM,,,,,1.0,,,,1.1875813996690036e-05,0.014737656677797053,,30.0,,,,,,,,,,148.0,,,,,,,,,COMPLETE,0.0,,,,,,,,,,,,,,,,,,,,
118,118,0.5202349609703436,2023-08-23 14:48:52.393150,2023-08-23 14:48:59.121111,0 days 00:00:06.727961,,1.0,2.0,,LightGBM,,,,,1.0,,,,8.89009691272154e-05,0.09579740562703123,,30.0,,,,,,,,,,233.0,,,,,,,,,COMPLETE,0.0,,,,,,,,,,,,,,,,,,,,
119,119,0.5589739220462693,2023-08-23 14:48:55.823465,2023-08-23 14:49:02.297651,0 days 00:00:06.474186,,1.0,2.0,,LightGBM,,,,,0.7000000000000001,,,,5.622669525807872e-07,0.10139094738725558,,30.0,,,,,,,,,,233.0,,,,,,,,,COMPLETE,0.0,,,,,,,,,,,,,,,,,,,,
120,120,0.5349658290834761,2023-08-23 14:48:56.357984,2023-08-23 14:49:00.379572,0 days 00:00:04.021588,,1.0,2.0,,LightGBM,,,,,0.7000000000000001,,,,1.8396733415460008e-05,0.10708866584178146,,70.0,,,,,,,,,,119.0,,,,,,,,,COMPLETE,0.0,,,,,,,,,,,,,,,,,,,,
121,121,0.5335601898101898,2023-08-23 14:48:56.515336,2023-08-23 14:49:04.656922,0 days 00:00:08.141586,,1.0,2.0,,LightGBM,,,,,0.7000000000000001,,,,4.394425238241748e-07,0.08820416095187406,,10.0,,,,,,,,,,232.0,,,,,,,,,COMPLETE,0.0,,,,,,,,,,,,,,,,,,,,
122,122,0.5516925351071693,2023-08-23 14:48:57.078732,2023-08-23 14:49:03.184042,0 days 00:00:06.105310,,0.4,3.0,,LightGBM,,,,,1.0,,,,2.1667638700190533e-05,0.38501188120723145,,10.0,,,,,,,,,,125.0,,,,,,,,,COMPLETE,0.0,,,,,,,,,,,,,,,,,,,,
123,123,0.5270834542675258,2023-08-23 14:48:59.217105,2023-08-23 14:49:05.603950,0 days 00:00:06.386845,,0.4,3.0,,LightGBM,,,,,0.6000000000000001,,,,2.821216991557476e-06,0.9354794131864782,,10.0,,,,,,,,,,181.0,,,,,,,,,COMPLETE,0.0,,,,,,,,,,,,,,,,,,,,
124,124,0.5238065764023211,2023-08-23 14:49:00.457200,2023-08-23 14:49:07.009214,0 days 00:00:06.552014,,0.4,3.0,,LightGBM,,,,,0.6000000000000001,,,,1.819923297692583e-05,0.5124666051238105,,10.0,,,,,,,,,,181.0,,,,,,,,,COMPLETE,0.0,,,,,,,,,,,,,,,,,,,,
125,125,0.551035565164848,2023-08-23 14:49:02.403265,2023-08-23 14:49:10.297148,0 days 00:00:07.893883,,1.0,3.0,,LightGBM,,,,,0.6000000000000001,,,,3.979703456326816e-07,0.8666188711123316,,20.0,,,,,,,,,,230.0,,,,,,,,,COMPLETE,0.0,,,,,,,,,,,,,,,,,,,,
126,126,0.5260392104897349,2023-08-23 14:49:03.372886,2023-08-23 14:49:07.490291,0 days 00:00:04.117405,,1.0,3.0,,LightGBM,,,,,0.6000000000000001,,,,3.847559170030802e-05,0.9274176262190823,,10.0,,,,,,,,,,104.0,,,,,,,,,COMPLETE,0.0,,,,,,,,,,,,,,,,,,,,
127,127,0.5622639949996642,2023-08-23 14:49:04.788796,2023-08-23 14:49:08.807380,0 days 00:00:04.018584,,0.9,3.0,,LightGBM,,,,,0.6000000000000001,,,,3.952412280000636e-05,0.995615182754232,,20.0,,,,,,,,,,107.0,,,,,,,,,COMPLETE,0.0,,,,,,,,,,,,,,,,,,,,
128,128,0.529059331015522,2023-08-23 14:49:05.759425,2023-08-23 14:49:11.236703,0 days 00:00:05.477278,,0.5,3.0,,LightGBM,,,,,0.8,,,,1.9307703260395726e-05,0.39320541754036087,,20.0,,,,,,,,,,121.0,,,,,,,,,COMPLETE,0.0,,,,,,,,,,,,,,,,,,,,
129,129,0.5545856797552833,2023-08-23 14:49:05.833772,2023-08-23 14:49:10.411014,0 days 00:00:04.577242,,0.5,3.0,,LightGBM,,,,,0.8,,,,4.201104698946235e-05,0.5682321292696244,,10.0,,,,,,,,,,86.0,,,,,,,,,COMPLETE,0.0,,,,,,,,,,,,,,,,,,,,
130,130,0.5343285429043947,2023-08-23 14:49:06.890281,2023-08-23 14:49:11.604065,0 days 00:00:04.713784,,0.5,3.0,,LightGBM,,,,,0.8,,,,4.371539118536492e-05,0.40631590091420705,,20.0,,,,,,,,,,124.0,,,,,,,,,COMPLETE,0.0,,,,,,,,,,,,,,,,,,,,
131,131,0.5140418283827095,2023-08-23 14:49:07.132778,2023-08-23 14:49:11.980982,0 days 00:00:04.848204,,1.0,3.0,,LightGBM,,,,,0.8,,,,3.7638330760528275e-05,0.3808329539211305,,20.0,,,,,,,,,,128.0,,,,,,,,,COMPLETE,0.0,,,,,,,,,,,,,,,,,,,,
132,132,0.5325691616754845,2023-08-23 14:49:07.586346,2023-08-23 14:49:11.885954,0 days 00:00:04.299608,,0.5,3.0,,LightGBM,,,,,0.8,,,,4.836979659046309e-05,0.3905696837487836,,20.0,,,,,,,,,,124.0,,,,,,,,,COMPLETE,0.0,,,,,,,,,,,,,,,,,,,,
133,133,0.5540627099314159,2023-08-23 14:49:08.937411,2023-08-23 14:49:12.326982,0 days 00:00:03.389571,,0.9,3.0,,LightGBM,,,,,0.5,,,,3.8552821106625373e-05,0.3736318366502716,,20.0,,,,,,,,,,100.0,,,,,,,,,COMPLETE,0.0,,,,,,,,,,,,,,,,,,,,
134,134,0.5223622988744769,2023-08-23 14:49:09.493088,2023-08-23 14:49:13.884360,0 days 00:00:04.391272,,0.9,3.0,,LightGBM,,,,,0.5,,,,4.0638154438153224e-05,0.39997225914895435,,20.0,,,,,,,,,,102.0,,,,,,,,,COMPLETE,0.0,,,,,,,,,,,,,,,,,,,,
135,135,0.5464440374935133,2023-08-23 14:49:10.352315,2023-08-23 14:49:13.715296,0 days 00:00:03.362981,,0.9,3.0,,LightGBM,,,,,0.5,,,,4.43393393596273e-05,0.4061960756796132,,20.0,,,,,,,,,,122.0,,,,,,,,,COMPLETE,0.0,,,,,,,,,,,,,,,,,,,,
136,136,0.5341187196769887,2023-08-23 14:49:10.477648,2023-08-23 14:49:14.418642,0 days 00:00:03.940994,,1.0,3.0,,LightGBM,,,,,0.5,,,,1.8381423647000495e-05,0.45755128149083163,,20.0,,,,,,,,,,107.0,,,,,,,,,COMPLETE,0.0,,,,,,,,,,,,,,,,,,,,
137,137,0.549995192200036,2023-08-23 14:49:11.283049,2023-08-23 14:49:13.789462,0 days 00:00:02.506413,,1.0,3.0,,LightGBM,,,,,0.5,,,,4.0246421790757276e-05,0.16934135862492186,,20.0,,,,,,,,,,90.0,,,,,,,,,COMPLETE,0.0,,,,,,,,,,,,,,,,,,,,
138,138,0.5132756719103733,2023-08-23 14:49:11.661099,2023-08-23 14:49:15.037407,0 days 00:00:03.376308,,0.9,3.0,,LightGBM,,,,,0.7000000000000001,,,,4.17092667002948e-05,0.16312049404199522,,20.0,,,,,,,,,,97.0,,,,,,,,,COMPLETE,0.0,,,,,,,,,,,,,,,,,,,,
139,139,0.5520140830485658,2023-08-23 14:49:11.937018,2023-08-23 14:49:14.771592,0 days 00:00:02.834574,,0.9,3.0,,LightGBM,,,,,0.5,,,,2.6858863409103798e-05,0.15423399553406675,,20.0,,,,,,,,,,90.0,,,,,,,,,COMPLETE,0.0,,,,,,,,,,,,,,,,,,,,
140,140,0.5422101869761444,2023-08-23 14:49:12.037069,2023-08-23 14:49:14.831391,0 days 00:00:02.794322,,0.9,3.0,,LightGBM,,,,,0.5,,,,1.5346181532627907e-05,0.18385656140985107,,30.0,,,,,,,,,,92.0,,,,,,,,,COMPLETE,0.0,,,,,,,,,,,,,,,,,,,,
141,141,0.5196852024438232,2023-08-23 14:49:12.374279,2023-08-23 14:49:15.275657,0 days 00:00:02.901378,,0.9,3.0,,LightGBM,,,,,0.5,,,,1.5050938324826113e-05,0.17696681790245875,,20.0,,,,,,,,,,101.0,,,,,,,,,COMPLETE,0.0,,,,,,,,,,,,,,,,,,,,
142,142,0.5163614377937705,2023-08-23 14:49:13.770097,2023-08-23 14:49:17.409933,0 days 00:00:03.639836,,0.9,3.0,,LightGBM,,,,,0.5,,,,1.5655641302365716e-05,0.15308443371488265,,30.0,,,,,,,,,,95.0,,,,,,,,,COMPLETE,0.0,,,,,,,,,,,,,,,,,,,,
143,143,0.5159485658588385,2023-08-23 14:49:13.852882,2023-08-23 14:49:17.264668,0 days 00:00:03.411786,,0.9,3.0,,LightGBM,,,,,0.5,,,,0.00011616225511589647,0.17707375985043222,,20.0,,,,,,,,,,94.0,,,,,,,,,COMPLETE,0.0,,,,,,,,,,,,,,,,,,,,
144,144,0.3669132483923075,2023-08-23 14:49:13.929998,2023-08-23 14:49:14.304268,0 days 00:00:00.374270,,,,,RandomForestClassifier,,,,,,,,,,,,,,,,,,,,,,,,14.0,2.0,,,,,,COMPLETE,0.0,,,,,,,,,,,,,,,,,,,,
145,145,0.5256442603669732,2023-08-23 14:49:14.384797,2023-08-23 14:49:17.003160,0 days 00:00:02.618363,,0.9,3.0,,LightGBM,,,,,0.5,,,,2.3180622917720005e-05,0.1760618780378553,,20.0,,,,,,,,,,87.0,,,,,,,,,COMPLETE,0.0,,,,,,,,,,,,,,,,,,,,
146,146,0.5353098371794223,2023-08-23 14:49:14.475018,2023-08-23 14:49:17.202300,0 days 00:00:02.727282,,0.9,3.0,,LightGBM,,,,,0.5,,,,0.00011423801304115393,0.16867651081623006,,10.0,,,,,,,,,,89.0,,,,,,,,,COMPLETE,0.0,,,,,,,,,,,,,,,,,,,,
147,147,0.5344860305745914,2023-08-23 14:49:14.819847,2023-08-23 14:49:17.711771,0 days 00:00:02.891924,,0.9,3.0,,LightGBM,,,,,0.5,,,,0.000102782322266073,0.15095313803576002,,10.0,,,,,,,,,,86.0,,,,,,,,,COMPLETE,0.0,,,,,,,,,,,,,,,,,,,,
148,148,0.5423126259849734,2023-08-23 14:49:14.889616,2023-08-23 14:49:18.483345,0 days 00:00:03.593729,,0.9,3.0,,LightGBM,,,,,0.6000000000000001,,,,2.7677715218062546e-05,0.13351308263973524,,10.0,,,,,,,,,,92.0,,,,,,,,,COMPLETE,0.0,,,,,,,,,,,,,,,,,,,,
149,149,0.5354166666666667,2023-08-23 14:49:15.082770,2023-08-23 14:49:17.611188,0 days 00:00:02.528418,,0.9,3.0,,LightGBM,,,,,0.5,,,,2.5750391579905006e-05,0.6753575444774413,,10.0,,,,,,,,,,85.0,,,,,,,,,COMPLETE,0.0,,,,,,,,,,,,,,,,,,,,
150,150,0.5110154578816879,2023-08-23 14:49:15.324044,2023-08-23 14:49:18.185098,0 days 00:00:02.861054,,0.9,3.0,,LightGBM,,,,,0.6000000000000001,,,,0.00012773248520711434,0.7490378625612468,,10.0,,,,,,,,,,81.0,,,,,,,,,COMPLETE,0.0,,,,,,,,,,,,,,,,,,,,
151,151,0.5264055405603331,2023-08-23 14:49:17.050991,2023-08-23 14:49:19.445926,0 days 00:00:02.394935,,1.0,3.0,,LightGBM,,,,,0.6000000000000001,,,,0.00012298162425500785,0.6181745846768412,,10.0,,,,,,,,,,77.0,,,,,,,,,COMPLETE,0.0,,,,,,,,,,,,,,,,,,,,
152,152,0.5203923728591286,2023-08-23 14:49:17.251572,2023-08-23 14:49:20.479885,0 days 00:00:03.228313,,1.0,3.0,,LightGBM,,,,,0.6000000000000001,,,,7.686245133235931e-05,0.7446737228289997,,10.0,,,,,,,,,,71.0,,,,,,,,,COMPLETE,0.0,,,,,,,,,,,,,,,,,,,,
153,153,0.5356958811396408,2023-08-23 14:49:17.314698,2023-08-23 14:49:19.848670,0 days 00:00:02.533972,,1.0,3.0,,LightGBM,,,,,0.6000000000000001,,,,2.7804913017470045e-05,0.6721594605860587,,30.0,,,,,,,,,,79.0,,,,,,,,,COMPLETE,0.0,,,,,,,,,,,,,,,,,,,,
154,154,0.518895909896095,2023-08-23 14:49:17.456106,2023-08-23 14:49:20.616593,0 days 00:00:03.160487,,1.0,3.0,,LightGBM,,,,,0.6000000000000001,,,,2.6116992110775967e-05,0.6792709199140876,,10.0,,,,,,,,,,86.0,,,,,,,,,COMPLETE,0.0,,,,,,,,,,,,,,,,,,,,
155,155,0.534356008818123,2023-08-23 14:49:17.658291,2023-08-23 14:49:19.843883,0 days 00:00:02.185592,,1.0,3.0,,LightGBM,,,,,0.6000000000000001,,,,1.0005363939180848e-05,0.7762608179631736,,30.0,,,,,,,,,,72.0,,,,,,,,,COMPLETE,0.0,,,,,,,,,,,,,,,,,,,,
156,156,0.5368428723685289,2023-08-23 14:49:17.760862,2023-08-23 14:49:21.334882,0 days 00:00:03.574020,,1.0,3.0,,LightGBM,,,,,0.6000000000000001,,,,6.592500889738251e-05,0.7583373679580763,,30.0,,,,,,,,,,113.0,,,,,,,,,COMPLETE,0.0,,,,,,,,,,,,,,,,,,,,
157,157,0.5281695984069035,2023-08-23 14:49:18.238124,2023-08-23 14:49:20.817099,0 days 00:00:02.578975,,1.0,2.0,,LightGBM,,,,,0.6000000000000001,,,,7.053293012198588e-05,0.6572321413712128,,30.0,,,,,,,,,,78.0,,,,,,,,,COMPLETE,0.0,,,,,,,,,,,,,,,,,,,,
158,158,0.5181244830438378,2023-08-23 14:49:18.534359,2023-08-23 14:49:21.041304,0 days 00:00:02.506945,,1.0,3.0,,LightGBM,,,,,0.7000000000000001,,,,1.0170654109372385e-05,0.6546216574944991,,30.0,,,,,,,,,,77.0,,,,,,,,,COMPLETE,0.0,,,,,,,,,,,,,,,,,,,,
159,159,0.5394940629839958,2023-08-23 14:49:19.491395,2023-08-23 14:49:23.306175,0 days 00:00:03.814780,,1.0,3.0,,LightGBM,,,,,0.7000000000000001,,,,8.020996005119547e-06,0.9627253381702687,,30.0,,,,,,,,,,109.0,,,,,,,,,COMPLETE,0.0,,,,,,,,,,,,,,,,,,,,
160,160,0.5279525608031436,2023-08-23 14:49:19.944595,2023-08-23 14:49:23.614761,0 days 00:00:03.670166,,0.6000000000000001,3.0,,LightGBM,,,,,0.7000000000000001,,,,6.488839297169077e-05,0.2757755732611869,,30.0,,,,,,,,,,204.0,,,,,,,,,COMPLETE,0.0,,,,,,,,,,,,,,,,,,,,
161,161,0.5238065764023211,2023-08-23 14:49:19.973976,2023-08-23 14:49:23.524063,0 days 00:00:03.550087,,0.6000000000000001,3.0,,LightGBM,,,,,0.7000000000000001,,,,6.547032355072498e-05,0.27268538971661854,,30.0,,,,,,,,,,111.0,,,,,,,,,COMPLETE,0.0,,,,,,,,,,,,,,,,,,,,
162,162,0.5244231546774669,2023-08-23 14:49:20.524287,2023-08-23 14:49:20.670133,0 days 00:00:00.145846,,,,,DecisionTreeClassifier,,gini,5.0,,,,,,,,,,,,,,,,,,,,,,,,,,,,COMPLETE,0.0,,,,,,,,,,,,,,,,,,,,
163,163,0.5354819895118915,2023-08-23 14:49:20.668484,2023-08-23 14:49:24.208659,0 days 00:00:03.540175,,0.6000000000000001,3.0,,LightGBM,,,,,0.7000000000000001,,,,5.8671212444348274e-05,0.24987763738661667,,30.0,,,,,,,,,,141.0,,,,,,,,,COMPLETE,0.0,,,,,,,,,,,,,,,,,,,,
164,164,0.5182312579677564,2023-08-23 14:49:20.738014,2023-08-23 14:49:24.427616,0 days 00:00:03.689602,,0.6000000000000001,3.0,,LightGBM,,,,,0.7000000000000001,,,,6.509591816637175e-05,0.27259183933917175,,30.0,,,,,,,,,,140.0,,,,,,,,,COMPLETE,0.0,,,,,,,,,,,,,,,,,,,,
165,165,0.5487272647286776,2023-08-23 14:49:20.881570,2023-08-23 14:49:24.143599,0 days 00:00:03.262029,,0.6000000000000001,3.0,,LightGBM,,,,,0.7000000000000001,,,,1.2889697831406026e-06,0.23854406758236985,,30.0,,,,,,,,,,112.0,,,,,,,,,COMPLETE,0.0,,,,,,,,,,,,,,,,,,,,
166,166,0.4996080842234688,2023-08-23 14:49:21.090724,2023-08-23 14:49:21.384369,0 days 00:00:00.293645,0.0026563698758981396,,,gbtree,XGBoost,0.8000051027108428,,,0.8617513348088269,,0.39161583690551083,lossguide,0.0011983137901511412,,,7.0,,10.0,,,,,,,,,,,,,,,0.22141352061802083,,,COMPLETE,0.0,,,,,,,,,,,,,,,,,,,,
167,167,0.4999332603646654,2023-08-23 14:49:21.380092,2023-08-23 14:49:21.838150,0 days 00:00:00.458058,0.0057374291243311925,,,gbtree,XGBoost,0.8316706462849223,,,0.8089555296577812,,0.7865114595497287,lossguide,0.009389262328219116,,,7.0,,10.0,,,,,,,,,,,,,,,0.420221239946224,,,COMPLETE,0.0,,,,,,,,,,,,,,,,,,,,
168,168,0.5356406054179119,2023-08-23 14:49:21.438246,2023-08-23 14:49:25.047147,0 days 00:00:03.608901,,0.8,1.0,,LightGBM,,,,,0.4,,,,5.51266123298334e-05,0.2672786525464158,,40.0,,,,,,,,,,140.0,,,,,,,,,COMPLETE,0.0,,,,,,,,,,,,,,,,,,,,
