,number,value,datetime_start,datetime_complete,duration,params_alpha,params_bagging_fraction,params_bagging_freq,params_booster,params_classifier,params_colsample_bytree,params_dct_criterion,params_dct_max_depth,params_eta,params_feature_fraction,params_gamma,params_grow_policy,params_lambda,params_lambda_l1,params_lambda_l2,params_max_depth,params_min_child_samples,params_min_child_weight,params_mlp_activation,params_mlp_solver,params_n_layers,params_n_units_l_0,params_n_units_l_1,params_n_units_l_2,params_n_units_l_3,params_normalize_type,params_num_leaves,params_rate_drop,params_rf_estimator,params_rf_max_depth,params_sample_type,params_skip_drop,params_subsample,params_svc_c,params_svc_kernel,state,best_trial,dev_acc,dev_recall_macro,dev_precision_macro,dev_f1_macro,dev_recall_0,dev_precision_0,dev_f1_0,dev_recall_1,dev_precision_1,dev_f1_1,test_acc,test_recall_macro,test_precision_macro,test_f1_macro,test_recall_0,test_precision_0,test_f1_0,test_recall_1,test_precision_1,test_f1_1
86,86,0.3696969696969697,2023-08-23 17:41:34.865483,2023-08-23 17:41:35.345448,0 days 00:00:00.479965,,,,,SVC,,,,,,,,,,,,,,,,,,,,,,,,,,,,,0.050804948584201357,linear,COMPLETE,0.0,,,,,,,,,,,,,,,,,,,,
87,87,0.6682615629984051,2023-08-23 17:41:34.963234,2023-08-23 17:41:36.014438,0 days 00:00:01.051204,0.00014239545789740925,,,dart,XGBoost,0.4878176589377156,,,1.7189720298223374e-05,,0.06267837259832675,depthwise,0.011502209045296774,,,7.0,,7.0,,,,,,,,tree,,0.0005381848505109994,,,weighted,0.33696467367148436,0.7091203892126907,,,COMPLETE,0.0,,,,,,,,,,,,,,,,,,,,
88,88,0.6941176470588236,2023-08-23 17:41:35.133626,2023-08-23 17:41:35.826506,0 days 00:00:00.692880,0.00017824177091254134,,,dart,XGBoost,0.4432073360439664,,,2.5199984130297627e-05,,7.231988243722075e-08,depthwise,0.006686045386255381,,,7.0,,7.0,,,,,,,,forest,,0.9874190590622807,,,weighted,0.0010457051463849151,0.7026983345230214,,,COMPLETE,0.0,,,,,,,,,,,,,,,,,,,,
89,89,0.6770186335403726,2023-08-23 17:41:35.153221,2023-08-23 17:41:36.102117,0 days 00:00:00.948896,0.00013656275879496006,,,dart,XGBoost,0.4742769217987953,,,2.787839875330495e-05,,0.08420142083257724,depthwise,0.0067143149486383336,,,7.0,,7.0,,,,,,,,tree,,1.3879677455227298e-08,,,uniform,2.346929755072301e-08,0.6924692820547099,,,COMPLETE,0.0,,,,,,,,,,,,,,,,,,,,
90,90,0.6899352318289298,2023-08-23 17:41:35.344054,2023-08-23 17:41:36.223218,0 days 00:00:00.879164,0.00010818862513062192,,,dart,XGBoost,0.49009284759407623,,,2.1556776269434588e-05,,0.031227006319227403,depthwise,0.01106156052432228,,,7.0,,7.0,,,,,,,,forest,,0.038824635372173615,,,weighted,4.026970780902118e-07,0.7097225937405853,,,COMPLETE,0.0,,,,,,,,,,,,,,,,,,,,
91,91,0.7150684931506849,2023-08-23 17:41:35.410391,2023-08-23 17:41:36.422793,0 days 00:00:01.012402,0.00014412226923262743,,,dart,XGBoost,0.48717069600172513,,,2.6566379939365667e-05,,0.041608381803497026,depthwise,0.012486783273105494,,,7.0,,7.0,,,,,,,,forest,,0.02809515485504788,,,weighted,4.949777975344768e-08,0.720924682404376,,,COMPLETE,0.0,,,,,,,,,,,,,,,,,,,,
92,92,0.6813725490196079,2023-08-23 17:41:35.462546,2023-08-23 17:41:36.328627,0 days 00:00:00.866081,0.00011097016904973653,,,dart,XGBoost,0.47912044245156876,,,2.5031984085867514e-05,,0.033382001093318625,depthwise,0.005287843847436186,,,7.0,,7.0,,,,,,,,forest,,0.36344250116908966,,,uniform,6.145001795107004e-05,0.7000566078291025,,,COMPLETE,0.0,,,,,,,,,,,,,,,,,,,,
93,93,0.7010012887875483,2023-08-23 17:41:35.922290,2023-08-23 17:41:36.757113,0 days 00:00:00.834823,0.3076150269300706,,,dart,XGBoost,0.5085143433242301,,,5.870105915069422e-06,,0.31366180394934484,depthwise,0.013676763261766636,,,9.0,,10.0,,,,,,,,tree,,1.192267025238658e-08,,,uniform,1.2140576644296766e-08,0.44639065914133746,,,COMPLETE,0.0,,,,,,,,,,,,,,,,,,,,
94,94,0.7063331988705123,2023-08-23 17:41:36.166126,2023-08-23 17:41:36.898607,0 days 00:00:00.732481,0.6179148162741251,,,gbtree,XGBoost,0.7453199687962732,,,9.498237399271848e-07,,0.004017485228460847,lossguide,0.08875687121300156,,,5.0,,10.0,,,,,,,,,,,,,,,0.44120914422031887,,,COMPLETE,0.0,,,,,,,,,,,,,,,,,,,,
95,95,0.7244627612599353,2023-08-23 17:41:36.196769,2023-08-23 17:41:37.076288,0 days 00:00:00.879519,0.9201430050586622,,,gbtree,XGBoost,0.7184223560021602,,,0.20707592100263553,,0.003525531688925888,lossguide,0.04439139823482134,,,5.0,,10.0,,,,,,,,,,,,,,,0.4291216577104652,,,COMPLETE,0.0,,,,,,,,,,,,,,,,,,,,
96,96,0.6889952153110048,2023-08-23 17:41:36.322593,2023-08-23 17:41:37.509808,0 days 00:00:01.187215,,0.6000000000000001,1.0,,LightGBM,,,,,0.9,,,,0.0006611851258433376,1.3251249432819375e-07,,70.0,,,,,,,,,,135.0,,,,,,,,,COMPLETE,0.0,,,,,,,,,,,,,,,,,,,,
97,97,0.7333333333333334,2023-08-23 17:41:36.407798,2023-08-23 17:41:37.462038,0 days 00:00:01.054240,,0.6000000000000001,1.0,,LightGBM,,,,,0.4,,,,0.00021319071921454443,1.4323396992564056e-07,,80.0,,,,,,,,,,137.0,,,,,,,,,COMPLETE,0.0,,,,,,,,,,,,,,,,,,,,
98,98,0.7448729270925325,2023-08-23 17:41:36.521416,2023-08-23 17:41:37.395942,0 days 00:00:00.874526,,0.6000000000000001,1.0,,LightGBM,,,,,0.4,,,,0.001866711266352322,1.501670238264823e-07,,80.0,,,,,,,,,,4.0,,,,,,,,,COMPLETE,0.0,,,,,,,,,,,,,,,,,,,,
99,99,0.7333333333333334,2023-08-23 17:41:36.831689,2023-08-23 17:41:37.628780,0 days 00:00:00.797091,,0.6000000000000001,1.0,,LightGBM,,,,,0.4,,,,5.144029657415528e-05,1.5049068100162493e-07,,80.0,,,,,,,,,,170.0,,,,,,,,,COMPLETE,0.0,,,,,,,,,,,,,,,,,,,,
100,100,0.7333333333333334,2023-08-23 17:41:36.970032,2023-08-23 17:41:38.059526,0 days 00:00:01.089494,,0.6000000000000001,1.0,,LightGBM,,,,,0.4,,,,0.0007885720940696569,1.3138302464573997e-07,,80.0,,,,,,,,,,135.0,,,,,,,,,COMPLETE,0.0,,,,,,,,,,,,,,,,,,,,
101,101,0.7270341207349081,2023-08-23 17:41:37.144206,2023-08-23 17:41:38.368818,0 days 00:00:01.224612,,0.6000000000000001,1.0,,LightGBM,,,,,0.4,,,,0.0016358765650209231,1.3163641865245279e-07,,10.0,,,,,,,,,,16.0,,,,,,,,,COMPLETE,0.0,,,,,,,,,,,,,,,,,,,,
102,102,0.7181571815718157,2023-08-23 17:41:37.506789,2023-08-23 17:41:38.612999,0 days 00:00:01.106210,,0.6000000000000001,1.0,,LightGBM,,,,,0.4,,,,0.0005298087692779992,1.7946110031234865e-07,,70.0,,,,,,,,,,48.0,,,,,,,,,COMPLETE,0.0,,,,,,,,,,,,,,,,,,,,
103,103,0.7181571815718157,2023-08-23 17:41:37.507723,2023-08-23 17:41:38.465750,0 days 00:00:00.958027,,0.6000000000000001,1.0,,LightGBM,,,,,0.4,,,,0.0001573940227429144,1.3400373108418138e-07,,70.0,,,,,,,,,,58.0,,,,,,,,,COMPLETE,0.0,,,,,,,,,,,,,,,,,,,,
104,104,0.6892530120481927,2023-08-23 17:41:37.555312,2023-08-23 17:41:39.199804,0 days 00:00:01.644492,,0.6000000000000001,1.0,,LightGBM,,,,,0.4,,,,0.0002818557381571788,1.6664541657352116e-07,,10.0,,,,,,,,,,25.0,,,,,,,,,COMPLETE,0.0,,,,,,,,,,,,,,,,,,,,
105,105,0.7382888114595432,2023-08-23 17:41:37.695407,2023-08-23 17:41:38.811500,0 days 00:00:01.116093,,0.5,1.0,,LightGBM,,,,,0.4,,,,0.0009409395126557053,1.3779859555332322e-06,,70.0,,,,,,,,,,39.0,,,,,,,,,COMPLETE,0.0,,,,,,,,,,,,,,,,,,,,
106,106,0.6865947312141538,2023-08-23 17:41:38.195172,2023-08-23 17:41:39.671759,0 days 00:00:01.476587,,0.5,1.0,,LightGBM,,,,,0.4,,,,0.030451185763893312,1.104454841413558e-06,,20.0,,,,,,,,,,45.0,,,,,,,,,COMPLETE,0.0,,,,,,,,,,,,,,,,,,,,
107,107,0.7382888114595432,2023-08-23 17:41:38.449481,2023-08-23 17:41:39.743762,0 days 00:00:01.294281,,0.5,1.0,,LightGBM,,,,,0.4,,,,6.208369808708068e-05,1.1005703270692315e-06,,70.0,,,,,,,,,,144.0,,,,,,,,,COMPLETE,0.0,,,,,,,,,,,,,,,,,,,,
108,108,0.7382888114595432,2023-08-23 17:41:38.563503,2023-08-23 17:41:39.899481,0 days 00:00:01.335978,,0.5,1.0,,LightGBM,,,,,0.4,,,,3.297163589885671e-05,1.0237689278260224e-06,,70.0,,,,,,,,,,169.0,,,,,,,,,COMPLETE,0.0,,,,,,,,,,,,,,,,,,,,
109,109,0.7359375,2023-08-23 17:41:38.702779,2023-08-23 17:41:39.812279,0 days 00:00:01.109500,,0.5,1.0,,LightGBM,,,,,0.4,,,,3.605682486960389e-05,8.446834182015907e-07,,80.0,,,,,,,,,,163.0,,,,,,,,,COMPLETE,0.0,,,,,,,,,,,,,,,,,,,,
110,110,0.7382888114595432,2023-08-23 17:41:38.878101,2023-08-23 17:41:40.139264,0 days 00:00:01.261163,,0.5,1.0,,LightGBM,,,,,0.4,,,,0.003347845657159388,1.1812555662937245e-06,,70.0,,,,,,,,,,12.0,,,,,,,,,COMPLETE,0.0,,,,,,,,,,,,,,,,,,,,
111,111,0.7472538154952852,2023-08-23 17:41:39.022037,2023-08-23 17:41:39.997533,0 days 00:00:00.975496,,0.5,1.0,,LightGBM,,,,,0.4,,,,0.0032301690732933755,2.6411280034145447e-06,,70.0,,,,,,,,,,4.0,,,,,,,,,COMPLETE,0.0,,,,,,,,,,,,,,,,,,,,
112,112,0.7448729270925325,2023-08-23 17:41:39.338439,2023-08-23 17:41:40.583500,0 days 00:00:01.245061,,0.5,1.0,,LightGBM,,,,,0.4,,,,0.002383521993745725,1.2401680147398988e-06,,50.0,,,,,,,,,,142.0,,,,,,,,,COMPLETE,0.0,,,,,,,,,,,,,,,,,,,,
113,113,0.7448729270925325,2023-08-23 17:41:39.740380,2023-08-23 17:41:40.846773,0 days 00:00:01.106393,,0.5,1.0,,LightGBM,,,,,0.4,,,,0.0028089133002310936,1.1417114862586345e-06,,50.0,,,,,,,,,,143.0,,,,,,,,,COMPLETE,0.0,,,,,,,,,,,,,,,,,,,,
114,114,0.6865947312141538,2023-08-23 17:41:39.851229,2023-08-23 17:41:40.757278,0 days 00:00:00.906049,,0.5,3.0,,LightGBM,,,,,0.5,,,,3.9978306648228336e-06,2.06503257035677e-06,,60.0,,,,,,,,,,146.0,,,,,,,,,COMPLETE,0.0,,,,,,,,,,,,,,,,,,,,
115,115,0.6836424295947405,2023-08-23 17:41:39.854353,2023-08-23 17:41:40.978563,0 days 00:00:01.124210,,0.5,3.0,,LightGBM,,,,,0.5,,,,5.499995405344074e-07,1.2985676748432503e-06,,50.0,,,,,,,,,,142.0,,,,,,,,,COMPLETE,0.0,,,,,,,,,,,,,,,,,,,,
116,116,0.6865947312141538,2023-08-23 17:41:39.977308,2023-08-23 17:41:41.052306,0 days 00:00:01.074998,,0.5,3.0,,LightGBM,,,,,0.5,,,,2.1393866930244006e-06,3.2966918785610137e-06,,60.0,,,,,,,,,,147.0,,,,,,,,,COMPLETE,0.0,,,,,,,,,,,,,,,,,,,,
117,117,0.709301204819277,2023-08-23 17:41:40.043426,2023-08-23 17:41:40.891978,0 days 00:00:00.848552,,0.5,3.0,,LightGBM,,,,,0.5,,,,0.0034357309526886126,2.369402016325255e-06,,50.0,,,,,,,,,,2.0,,,,,,,,,COMPLETE,0.0,,,,,,,,,,,,,,,,,,,,
118,118,0.715625,2023-08-23 17:41:40.214407,2023-08-23 17:41:41.208191,0 days 00:00:00.993784,,0.5,3.0,,LightGBM,,,,,0.4,,,,0.0060386143418648675,3.5790473578873578e-06,,60.0,,,,,,,,,,149.0,,,,,,,,,COMPLETE,0.0,,,,,,,,,,,,,,,,,,,,
119,119,0.7584204413472706,2023-08-23 17:41:40.580397,2023-08-23 17:41:41.250172,0 days 00:00:00.669775,,0.5,3.0,,LightGBM,,,,,0.4,,,,5.730813850907999e-07,3.306576706303934e-06,,100.0,,,,,,,,,,147.0,,,,,,,,,COMPLETE,1.0,0.7692307692307693,0.7552420892108274,0.764102564102564,0.7584204413472706,0.6744186046511628,0.7435897435897436,0.7073170731707318,0.8360655737704918,0.7846153846153846,0.8095238095238095,0.6317343173431734,0.6259051254089422,0.644422011738393,0.6169733904577717,0.45038167938931295,0.6797235023041475,0.54178145087236,0.8014285714285714,0.6091205211726385,0.6921653300431833
120,120,0.709301204819277,2023-08-23 17:41:40.630949,2023-08-23 17:41:41.309444,0 days 00:00:00.678495,,0.5,3.0,,LightGBM,,,,,0.5,,,,0.007780958128334694,4.319024845987569e-06,,50.0,,,,,,,,,,31.0,,,,,,,,,COMPLETE,0.0,,,,,,,,,,,,,,,,,,,,
121,121,0.7333333333333334,2023-08-23 17:41:40.798864,2023-08-23 17:41:41.460307,0 days 00:00:00.661443,,0.7000000000000001,1.0,,LightGBM,,,,,0.4,,,,0.0032915300346676073,5.884142446084939e-06,,40.0,,,,,,,,,,5.0,,,,,,,,,COMPLETE,0.0,,,,,,,,,,,,,,,,,,,,
122,122,0.7244627612599353,2023-08-23 17:41:40.887731,2023-08-23 17:41:41.762859,0 days 00:00:00.875128,,0.7000000000000001,1.0,,LightGBM,,,,,0.4,,,,0.005142537335175385,4.501519552113421e-06,,50.0,,,,,,,,,,148.0,,,,,,,,,COMPLETE,0.0,,,,,,,,,,,,,,,,,,,,
123,123,0.7244627612599353,2023-08-23 17:41:40.932099,2023-08-23 17:41:41.664510,0 days 00:00:00.732411,,0.7000000000000001,1.0,,LightGBM,,,,,0.4,,,,2.6191149599911205e-08,1.0406791534892259e-05,,50.0,,,,,,,,,,149.0,,,,,,,,,COMPLETE,0.0,,,,,,,,,,,,,,,,,,,,
124,124,0.7511961722488039,2023-08-23 17:41:41.020876,2023-08-23 17:41:41.923718,0 days 00:00:00.902842,,1.0,1.0,,LightGBM,,,,,0.4,,,,2.3971118413882607e-08,5.151285757397917e-06,,40.0,,,,,,,,,,154.0,,,,,,,,,COMPLETE,0.0,,,,,,,,,,,,,,,,,,,,
125,125,0.7097288676236045,2023-08-23 17:41:41.094529,2023-08-23 17:41:42.052759,0 days 00:00:00.958230,,1.0,1.0,,LightGBM,,,,,0.4,,,,7.929732203072939e-08,4.598802278221093e-06,,50.0,,,,,,,,,,154.0,,,,,,,,,COMPLETE,0.0,,,,,,,,,,,,,,,,,,,,
126,126,0.7097288676236045,2023-08-23 17:41:41.296081,2023-08-23 17:41:42.179669,0 days 00:00:00.883588,,1.0,1.0,,LightGBM,,,,,0.4,,,,8.929812584809387e-08,8.174464821102122e-06,,50.0,,,,,,,,,,120.0,,,,,,,,,COMPLETE,0.0,,,,,,,,,,,,,,,,,,,,
127,127,0.6865947312141538,2023-08-23 17:41:41.298100,2023-08-23 17:41:42.181248,0 days 00:00:00.883148,,1.0,1.0,,LightGBM,,,,,0.7000000000000001,,,,2.427008105526194e-08,2.2849161905790696e-08,,50.0,,,,,,,,,,120.0,,,,,,,,,COMPLETE,0.0,,,,,,,,,,,,,,,,,,,,
128,128,0.7511961722488039,2023-08-23 17:41:41.355388,2023-08-23 17:41:42.405941,0 days 00:00:01.050553,,1.0,1.0,,LightGBM,,,,,0.4,,,,8.921818480063726e-08,2.726118449750841e-08,,40.0,,,,,,,,,,125.0,,,,,,,,,COMPLETE,0.0,,,,,,,,,,,,,,,,,,,,
129,129,0.7448729270925325,2023-08-23 17:41:41.503606,2023-08-23 17:41:41.978032,0 days 00:00:00.474426,,1.0,1.0,,LightGBM,,,,,0.4,,,,7.064835296795716e-08,2.500077524878699e-08,,100.0,,,,,,,,,,125.0,,,,,,,,,COMPLETE,0.0,,,,,,,,,,,,,,,,,,,,
130,130,0.7448729270925325,2023-08-23 17:41:41.704483,2023-08-23 17:41:42.291941,0 days 00:00:00.587458,,1.0,1.0,,LightGBM,,,,,0.4,,,,8.66793354293728e-08,1.76477556132074e-08,,100.0,,,,,,,,,,127.0,,,,,,,,,COMPLETE,0.0,,,,,,,,,,,,,,,,,,,,
131,131,0.7448729270925325,2023-08-23 17:41:41.805423,2023-08-23 17:41:42.357491,0 days 00:00:00.552068,,1.0,1.0,,LightGBM,,,,,0.4,,,,8.403675176251414e-08,2.4863325468111346e-08,,100.0,,,,,,,,,,125.0,,,,,,,,,COMPLETE,0.0,,,,,,,,,,,,,,,,,,,,
132,132,0.7511961722488039,2023-08-23 17:41:41.965432,2023-08-23 17:41:42.940980,0 days 00:00:00.975548,,1.0,1.0,,LightGBM,,,,,0.4,,,,7.628690058232674e-08,2.5554178925672822e-08,,40.0,,,,,,,,,,160.0,,,,,,,,,COMPLETE,0.0,,,,,,,,,,,,,,,,,,,,
133,133,0.7511961722488039,2023-08-23 17:41:42.021717,2023-08-23 17:41:43.125368,0 days 00:00:01.103651,,1.0,1.0,,LightGBM,,,,,0.4,,,,2.340832100951472e-08,2.723092624480033e-07,,40.0,,,,,,,,,,156.0,,,,,,,,,COMPLETE,0.0,,,,,,,,,,,,,,,,,,,,
134,134,0.663232263762143,2023-08-23 17:41:42.094489,2023-08-23 17:41:43.284881,0 days 00:00:01.190392,,1.0,1.0,,LightGBM,,,,,0.7000000000000001,,,,2.3559111249170003e-08,2.874734968460189e-07,,40.0,,,,,,,,,,179.0,,,,,,,,,COMPLETE,0.0,,,,,,,,,,,,,,,,,,,,
135,135,0.7511961722488039,2023-08-23 17:41:42.270906,2023-08-23 17:41:43.367173,0 days 00:00:01.096267,,1.0,1.0,,LightGBM,,,,,0.4,,,,2.2716006402250555e-08,2.726380364514609e-07,,40.0,,,,,,,,,,165.0,,,,,,,,,COMPLETE,0.0,,,,,,,,,,,,,,,,,,,,
136,136,0.7511961722488039,2023-08-23 17:41:42.273568,2023-08-23 17:41:43.471703,0 days 00:00:01.198135,,1.0,1.0,,LightGBM,,,,,0.4,,,,2.0609421374580943e-08,6.132802663850701e-07,,40.0,,,,,,,,,,166.0,,,,,,,,,COMPLETE,0.0,,,,,,,,,,,,,,,,,,,,
137,137,0.6448997012377294,2023-08-23 17:41:42.346118,2023-08-23 17:41:42.797188,0 days 00:00:00.451070,,,,,RandomForestClassifier,,,,,,,,,,,,,,,,,,,,,,,,43.0,2.0,,,,,,COMPLETE,0.0,,,,,,,,,,,,,,,,,,,,
138,138,0.7448729270925325,2023-08-23 17:41:42.398935,2023-08-23 17:41:43.057091,0 days 00:00:00.658156,,1.0,1.0,,LightGBM,,,,,0.4,,,,2.2567454344311887e-08,2.5152078586215583e-07,,100.0,,,,,,,,,,176.0,,,,,,,,,COMPLETE,0.0,,,,,,,,,,,,,,,,,,,,
139,139,0.7511961722488039,2023-08-23 17:41:42.452191,2023-08-23 17:41:43.472486,0 days 00:00:01.020295,,1.0,1.0,,LightGBM,,,,,0.4,,,,2.1325677566856023e-08,2.6584429017106355e-07,,40.0,,,,,,,,,,84.0,,,,,,,,,COMPLETE,0.0,,,,,,,,,,,,,,,,,,,,
140,140,0.7511961722488039,2023-08-23 17:41:42.837381,2023-08-23 17:41:43.629519,0 days 00:00:00.792138,,1.0,1.0,,LightGBM,,,,,0.4,,,,2.2974996072170302e-08,8.144438067928118e-08,,40.0,,,,,,,,,,75.0,,,,,,,,,COMPLETE,0.0,,,,,,,,,,,,,,,,,,,,
141,141,0.7511961722488039,2023-08-23 17:41:42.980976,2023-08-23 17:41:43.774809,0 days 00:00:00.793833,,1.0,1.0,,LightGBM,,,,,0.4,,,,2.1532484795113923e-08,7.391280203787745e-08,,40.0,,,,,,,,,,88.0,,,,,,,,,COMPLETE,0.0,,,,,,,,,,,,,,,,,,,,
142,142,0.7584204413472706,2023-08-23 17:41:43.097494,2023-08-23 17:41:43.906280,0 days 00:00:00.808786,,0.8,1.0,,LightGBM,,,,,0.4,,,,1.9830120953129248e-08,7.594744318698372e-08,,40.0,,,,,,,,,,165.0,,,,,,,,,COMPLETE,0.0,,,,,,,,,,,,,,,,,,,,
143,143,0.7511961722488039,2023-08-23 17:41:43.168796,2023-08-23 17:41:43.995746,0 days 00:00:00.826950,,1.0,1.0,,LightGBM,,,,,0.4,,,,1.8106935749227456e-08,8.282209823665298e-08,,40.0,,,,,,,,,,164.0,,,,,,,,,COMPLETE,0.0,,,,,,,,,,,,,,,,,,,,
144,144,0.7511961722488039,2023-08-23 17:41:43.324520,2023-08-23 17:41:44.151578,0 days 00:00:00.827058,,1.0,1.0,,LightGBM,,,,,0.4,,,,3.74802703902713e-08,7.240755528496188e-08,,40.0,,,,,,,,,,86.0,,,,,,,,,COMPLETE,0.0,,,,,,,,,,,,,,,,,,,,
145,145,0.7010012887875483,2023-08-23 17:41:43.407509,2023-08-23 17:41:44.500394,0 days 00:00:01.092885,,1.0,1.0,,LightGBM,,,,,0.4,,,,4.991410358153952e-08,5.4223045022091215e-08,,30.0,,,,,,,,,,202.0,,,,,,,,,COMPLETE,0.0,,,,,,,,,,,,,,,,,,,,
146,146,0.7010012887875483,2023-08-23 17:41:43.549045,2023-08-23 17:41:44.634642,0 days 00:00:01.085597,,1.0,1.0,,LightGBM,,,,,0.4,,,,1.805297045322709e-08,7.928053233107539e-08,,30.0,,,,,,,,,,86.0,,,,,,,,,COMPLETE,0.0,,,,,,,,,,,,,,,,,,,,
147,147,0.7010012887875483,2023-08-23 17:41:43.552106,2023-08-23 17:41:44.562141,0 days 00:00:01.010035,,1.0,1.0,,LightGBM,,,,,0.4,,,,1.7574527652154964e-08,7.360510219012367e-08,,30.0,,,,,,,,,,72.0,,,,,,,,,COMPLETE,0.0,,,,,,,,,,,,,,,,,,,,
148,148,0.7010012887875483,2023-08-23 17:41:43.672795,2023-08-23 17:41:44.829641,0 days 00:00:01.156846,,1.0,1.0,,LightGBM,,,,,0.4,,,,1.8279051530878403e-08,7.665441730800643e-08,,30.0,,,,,,,,,,97.0,,,,,,,,,COMPLETE,0.0,,,,,,,,,,,,,,,,,,,,
149,149,0.7010012887875483,2023-08-23 17:41:43.819535,2023-08-23 17:41:44.705756,0 days 00:00:00.886221,,1.0,1.0,,LightGBM,,,,,0.4,,,,1.5744356980961445e-08,7.843497367224171e-08,,30.0,,,,,,,,,,84.0,,,,,,,,,COMPLETE,0.0,,,,,,,,,,,,,,,,,,,,
150,150,0.7097288676236045,2023-08-23 17:41:43.946270,2023-08-23 17:41:44.913137,0 days 00:00:00.966867,,0.8,1.0,,LightGBM,,,,,0.4,,,,1.7912330105580802e-08,8.3442746593834e-08,,30.0,,,,,,,,,,80.0,,,,,,,,,COMPLETE,0.0,,,,,,,,,,,,,,,,,,,,
151,151,0.7010012887875483,2023-08-23 17:41:44.040242,2023-08-23 17:41:45.023537,0 days 00:00:00.983295,,1.0,1.0,,LightGBM,,,,,0.4,,,,1.7901000624110058e-08,7.989510696725343e-08,,30.0,,,,,,,,,,64.0,,,,,,,,,COMPLETE,0.0,,,,,,,,,,,,,,,,,,,,
152,152,0.7010012887875483,2023-08-23 17:41:44.194916,2023-08-23 17:41:45.213190,0 days 00:00:01.018274,,1.0,1.0,,LightGBM,,,,,0.4,,,,1.9529236272549707e-08,7.202148528231533e-08,,30.0,,,,,,,,,,80.0,,,,,,,,,COMPLETE,0.0,,,,,,,,,,,,,,,,,,,,
153,153,0.7097288676236045,2023-08-23 17:41:44.544964,2023-08-23 17:41:45.663586,0 days 00:00:01.118622,,0.8,1.0,,LightGBM,,,,,0.4,,,,1.768087909091144e-08,6.515443709155341e-08,,30.0,,,,,,,,,,83.0,,,,,,,,,COMPLETE,0.0,,,,,,,,,,,,,,,,,,,,
154,154,0.7511961722488039,2023-08-23 17:41:44.619917,2023-08-23 17:41:46.000353,0 days 00:00:01.380436,,1.0,1.0,,LightGBM,,,,,0.4,,,,1.5993291140433195e-08,9.872328466081074e-08,,40.0,,,,,,,,,,83.0,,,,,,,,,COMPLETE,0.0,,,,,,,,,,,,,,,,,,,,
155,155,0.7584204413472706,2023-08-23 17:41:44.687785,2023-08-23 17:41:45.805177,0 days 00:00:01.117392,,0.8,1.0,,LightGBM,,,,,0.4,,,,3.5230512805690854e-08,3.5024081410122294e-08,,40.0,,,,,,,,,,83.0,,,,,,,,,COMPLETE,0.0,,,,,,,,,,,,,,,,,,,,
156,156,0.3696969696969697,2023-08-23 17:41:44.757089,2023-08-23 17:41:44.909571,0 days 00:00:00.152482,,,,,SVC,,,,,,,,,,,,,,,,,,,,,,,,,,,,,538.0185633865232,rbf,COMPLETE,0.0,,,,,,,,,,,,,,,,,,,,
157,157,0.3696969696969697,2023-08-23 17:41:44.881443,2023-08-23 17:41:45.096685,0 days 00:00:00.215242,,,,,SVC,,,,,,,,,,,,,,,,,,,,,,,,,,,,,393.5785427214774,rbf,COMPLETE,0.0,,,,,,,,,,,,,,,,,,,,
158,158,0.7584204413472706,2023-08-23 17:41:45.004274,2023-08-23 17:41:46.059200,0 days 00:00:01.054926,,0.8,1.0,,LightGBM,,,,,0.4,,,,3.551192754378911e-08,3.216869506304785e-08,,40.0,,,,,,,,,,163.0,,,,,,,,,COMPLETE,0.0,,,,,,,,,,,,,,,,,,,,
159,159,0.7584204413472706,2023-08-23 17:41:45.008361,2023-08-23 17:41:45.877359,0 days 00:00:00.868998,,0.8,1.0,,LightGBM,,,,,0.4,,,,3.503659714150563e-08,3.103422963117253e-08,,40.0,,,,,,,,,,163.0,,,,,,,,,COMPLETE,0.0,,,,,,,,,,,,,,,,,,,,
160,160,0.7511961722488039,2023-08-23 17:41:45.088214,2023-08-23 17:41:46.148773,0 days 00:00:01.060559,,1.0,1.0,,LightGBM,,,,,0.4,,,,3.489162519624688e-08,3.91564228950955e-08,,40.0,,,,,,,,,,165.0,,,,,,,,,COMPLETE,0.0,,,,,,,,,,,,,,,,,,,,
161,161,0.7584204413472706,2023-08-23 17:41:45.142543,2023-08-23 17:41:46.192306,0 days 00:00:01.049763,,0.8,1.0,,LightGBM,,,,,0.4,,,,3.484874516419827e-08,3.4590430108762106e-08,,40.0,,,,,,,,,,166.0,,,,,,,,,COMPLETE,0.0,,,,,,,,,,,,,,,,,,,,
162,162,0.7584204413472706,2023-08-23 17:41:45.257956,2023-08-23 17:41:45.938225,0 days 00:00:00.680269,,0.8,1.0,,LightGBM,,,,,0.4,,,,3.282148898717317e-08,6.254236199545408e-07,,40.0,,,,,,,,,,165.0,,,,,,,,,COMPLETE,0.0,,,,,,,,,,,,,,,,,,,,
163,163,0.7511961722488039,2023-08-23 17:41:45.703253,2023-08-23 17:41:46.404741,0 days 00:00:00.701488,,1.0,1.0,,LightGBM,,,,,0.4,,,,3.620509457391351e-08,4.091514194626642e-08,,40.0,,,,,,,,,,94.0,,,,,,,,,COMPLETE,0.0,,,,,,,,,,,,,,,,,,,,
164,164,0.7304625199362041,2023-08-23 17:41:45.847644,2023-08-23 17:41:46.954666,0 days 00:00:01.107022,,0.9,1.0,,LightGBM,,,,,0.4,,,,3.176370909143125e-08,3.270919772677454e-08,,40.0,,,,,,,,,,92.0,,,,,,,,,COMPLETE,0.0,,,,,,,,,,,,,,,,,,,,
165,165,0.7584204413472706,2023-08-23 17:41:45.917076,2023-08-23 17:41:47.034283,0 days 00:00:01.117207,,0.8,1.0,,LightGBM,,,,,0.4,,,,3.2504806978273996e-08,3.571803272401417e-08,,40.0,,,,,,,,,,93.0,,,,,,,,,COMPLETE,0.0,,,,,,,,,,,,,,,,,,,,
166,166,0.7584204413472706,2023-08-23 17:41:45.987629,2023-08-23 17:41:46.801111,0 days 00:00:00.813482,,0.8,1.0,,LightGBM,,,,,0.4,,,,3.2599814848311075e-08,3.1641595971545255e-08,,40.0,,,,,,,,,,165.0,,,,,,,,,COMPLETE,0.0,,,,,,,,,,,,,,,,,,,,
