,number,value,datetime_start,datetime_complete,duration,params_alpha,params_bagging_fraction,params_bagging_freq,params_booster,params_classifier,params_colsample_bytree,params_dct_criterion,params_dct_max_depth,params_eta,params_feature_fraction,params_gamma,params_grow_policy,params_lambda,params_lambda_l1,params_lambda_l2,params_max_depth,params_min_child_samples,params_min_child_weight,params_mlp_activation,params_mlp_solver,params_n_layers,params_n_units_l_0,params_n_units_l_1,params_n_units_l_2,params_n_units_l_3,params_normalize_type,params_num_leaves,params_rate_drop,params_rf_estimator,params_rf_max_depth,params_sample_type,params_skip_drop,params_subsample,params_svc_c,params_svc_kernel,state,best_trial,dev_acc,dev_recall_macro,dev_precision_macro,dev_f1_macro,dev_recall_0,dev_precision_0,dev_f1_0,dev_recall_1,dev_precision_1,dev_f1_1,test_acc,test_recall_macro,test_precision_macro,test_f1_macro,test_recall_0,test_precision_0,test_f1_0,test_recall_1,test_precision_1,test_f1_1
85,85,0.3358178053830228,2023-08-23 20:41:17.829129,2023-08-23 20:42:03.312636,0 days 00:00:45.483507,,,,,SVC,,,,,,,,,,,,,,,,,,,,,,,,,,,,,625.6372848270425,rbf,COMPLETE,0.0,,,,,,,,,,,,,,,,,,,,
86,86,0.3358178053830228,2023-08-23 20:41:22.548622,2023-08-23 20:42:04.721161,0 days 00:00:42.172539,,,,,SVC,,,,,,,,,,,,,,,,,,,,,,,,,,,,,881.2042422328747,rbf,COMPLETE,0.0,,,,,,,,,,,,,,,,,,,,
87,87,0.7245879120879122,2023-08-23 20:42:00.367677,2023-08-23 20:42:03.523672,0 days 00:00:03.155995,,0.6000000000000001,3.0,,LightGBM,,,,,0.5,,,,2.2335836065846792e-07,2.518136989948809e-06,,80.0,,,,,,,,,,131.0,,,,,,,,,COMPLETE,0.0,,,,,,,,,,,,,,,,,,,,
88,88,0.7315057824576612,2023-08-23 20:42:00.574688,2023-08-23 20:42:02.087084,0 days 00:00:01.512396,,0.6000000000000001,3.0,,LightGBM,,,,,0.7000000000000001,,,,1.6415159014571176e-07,1.2412386839478631e-05,,60.0,,,,,,,,,,44.0,,,,,,,,,COMPLETE,0.0,,,,,,,,,,,,,,,,,,,,
89,89,0.7293195504338933,2023-08-23 20:42:00.777801,2023-08-23 20:42:02.360577,0 days 00:00:01.582776,,0.8,3.0,,LightGBM,,,,,0.7000000000000001,,,,1.892767846633507e-07,1.963148880596358e-06,,70.0,,,,,,,,,,43.0,,,,,,,,,COMPLETE,0.0,,,,,,,,,,,,,,,,,,,,
90,90,0.7323457118963075,2023-08-23 20:42:01.301909,2023-08-23 20:42:03.147367,0 days 00:00:01.845458,,0.6000000000000001,3.0,,LightGBM,,,,,0.7000000000000001,,,,1.8505217095265885e-07,2.4590145040659536e-06,,60.0,,,,,,,,,,43.0,,,,,,,,,COMPLETE,0.0,,,,,,,,,,,,,,,,,,,,
91,91,0.7327622434642983,2023-08-23 20:42:02.145284,2023-08-23 20:42:03.641825,0 days 00:00:01.496541,,0.8,3.0,,LightGBM,,,,,0.7000000000000001,,,,3.379612002819771e-07,2.508139308951315e-06,,60.0,,,,,,,,,,20.0,,,,,,,,,COMPLETE,0.0,,,,,,,,,,,,,,,,,,,,
92,92,0.7322738075799633,2023-08-23 20:42:02.409021,2023-08-23 20:42:03.069125,0 days 00:00:00.660104,,1.0,3.0,,LightGBM,,,,,0.8,,,,3.8101252171933504e-07,3.1858608758780398e-06,,60.0,,,,,,,,,,17.0,,,,,,,,,COMPLETE,0.0,,,,,,,,,,,,,,,,,,,,
93,93,0.731579532304685,2023-08-23 20:42:03.124779,2023-08-23 20:42:04.193672,0 days 00:00:01.068893,,1.0,3.0,,LightGBM,,,,,0.8,,,,3.868056474973749e-07,3.4063761750433645e-06,,80.0,,,,,,,,,,14.0,,,,,,,,,COMPLETE,0.0,,,,,,,,,,,,,,,,,,,,
94,94,0.7346282299432574,2023-08-23 20:42:03.205006,2023-08-23 20:42:04.277148,0 days 00:00:01.072142,,1.0,2.0,,LightGBM,,,,,0.8,,,,5.266901661943267e-07,2.422477969270863e-06,,50.0,,,,,,,,,,17.0,,,,,,,,,COMPLETE,0.0,,,,,,,,,,,,,,,,,,,,
95,95,0.7346282299432574,2023-08-23 20:42:03.389614,2023-08-23 20:42:04.622166,0 days 00:00:01.232552,,1.0,2.0,,LightGBM,,,,,0.8,,,,6.868332933979157e-07,1.7910304458164526e-06,,50.0,,,,,,,,,,17.0,,,,,,,,,COMPLETE,0.0,,,,,,,,,,,,,,,,,,,,
96,96,0.7315046540217773,2023-08-23 20:42:03.583757,2023-08-23 20:42:04.797146,0 days 00:00:01.213389,,1.0,3.0,,LightGBM,,,,,0.8,,,,1.3629973088230883e-06,1.1364715008941396e-06,,60.0,,,,,,,,,,21.0,,,,,,,,,COMPLETE,0.0,,,,,,,,,,,,,,,,,,,,
97,97,0.5959427399725403,2023-08-23 20:42:03.713537,2023-08-23 20:42:04.358677,0 days 00:00:00.645140,,,,,DecisionTreeClassifier,,entropy,6.0,,,,,,,,,,,,,,,,,,,,,,,,,,,,COMPLETE,0.0,,,,,,,,,,,,,,,,,,,,
98,98,0.7322738075799633,2023-08-23 20:42:04.252753,2023-08-23 20:42:05.583707,0 days 00:00:01.330954,,1.0,3.0,,LightGBM,,,,,0.8,,,,8.74839138956232e-07,1.6901833383335235e-06,,60.0,,,,,,,,,,17.0,,,,,,,,,COMPLETE,0.0,,,,,,,,,,,,,,,,,,,,
99,99,0.7381977877457082,2023-08-23 20:42:04.323330,2023-08-23 20:42:07.407980,0 days 00:00:03.084650,,0.5,2.0,,LightGBM,,,,,0.8,,,,8.236952569805892e-07,1.3201115786242145e-06,,40.0,,,,,,,,,,58.0,,,,,,,,,COMPLETE,1.0,0.7400249376558603,0.7391805300074792,0.7451046003770043,0.7381977877457082,0.6639344262295082,0.7776957163958641,0.7163265306122448,0.8144266337854501,0.7125134843581445,0.7600690448791715,0.7494853523357087,0.7492156989407373,0.751075230785555,0.748944899774274,0.7076824992030603,0.7694974003466204,0.737296579209565,0.7907488986784141,0.7326530612244898,0.760593220338983
100,100,0.7329580540935405,2023-08-23 20:42:04.414556,2023-08-23 20:42:07.193732,0 days 00:00:02.779176,,0.5,2.0,,LightGBM,,,,,0.8,,,,6.646339821822532e-07,1.3235244810277487e-06,,50.0,,,,,,,,,,59.0,,,,,,,,,COMPLETE,0.0,,,,,,,,,,,,,,,,,,,,
101,101,0.737133201208336,2023-08-23 20:42:04.679883,2023-08-23 20:42:05.803646,0 days 00:00:01.123763,,1.0,2.0,,LightGBM,,,,,0.8,,,,1.627567277970141e-06,1.253036245836462e-06,,40.0,,,,,,,,,,12.0,,,,,,,,,COMPLETE,0.0,,,,,,,,,,,,,,,,,,,,
102,102,0.737133201208336,2023-08-23 20:42:04.776798,2023-08-23 20:42:06.028225,0 days 00:00:01.251427,,1.0,2.0,,LightGBM,,,,,0.8,,,,4.6086486220217006e-07,1.006748015667775e-06,,40.0,,,,,,,,,,12.0,,,,,,,,,COMPLETE,0.0,,,,,,,,,,,,,,,,,,,,
103,103,0.7248866888657582,2023-08-23 20:42:04.864980,2023-08-23 20:42:05.689449,0 days 00:00:00.824469,,1.0,2.0,,LightGBM,,,,,0.8,,,,8.982017262559872e-07,9.403757346441465e-07,,50.0,,,,,,,,,,5.0,,,,,,,,,COMPLETE,0.0,,,,,,,,,,,,,,,,,,,,
104,104,0.7124615117453437,2023-08-23 20:42:05.013576,2023-08-23 20:42:05.379132,0 days 00:00:00.365556,,1.0,2.0,,LightGBM,,,,,0.9,,,,1.289912224011455e-06,7.739919979000002e-07,,40.0,,,,,,,,,,2.0,,,,,,,,,COMPLETE,0.0,,,,,,,,,,,,,,,,,,,,
105,105,0.7302496691592176,2023-08-23 20:42:05.424926,2023-08-23 20:42:08.093953,0 days 00:00:02.669027,,1.0,2.0,,LightGBM,,,,,0.8,,,,7.495944250784625e-07,1.3295836879494258e-05,,50.0,,,,,,,,,,62.0,,,,,,,,,COMPLETE,0.0,,,,,,,,,,,,,,,,,,,,
106,106,0.6083811780209215,2023-08-23 20:42:05.634916,2023-08-23 20:42:06.143256,0 days 00:00:00.508340,,,,,RandomForestClassifier,,,,,,,,,,,,,,,,,,,,,,,,10.0,2.0,,,,,,COMPLETE,0.0,,,,,,,,,,,,,,,,,,,,
107,107,0.3358178053830228,2023-08-23 20:42:05.733850,2023-08-23 20:45:59.680026,0 days 00:03:53.946176,,,,,MLPClassifier,,,,,,,,,,,,,,tanh,adam,3.0,70.0,100.0,30.0,,,,,,,,,,,,COMPLETE,0.0,,,,,,,,,,,,,,,,,,,,
108,108,0.7248218081510975,2023-08-23 20:42:05.894296,2023-08-23 20:42:08.317154,0 days 00:00:02.422858,,1.0,2.0,,LightGBM,,,,,0.8,,,,4.970035827513006e-06,4.238114198930164e-06,,40.0,,,,,,,,,,29.0,,,,,,,,,COMPLETE,0.0,,,,,,,,,,,,,,,,,,,,
109,109,0.7314475274352193,2023-08-23 20:42:06.127779,2023-08-23 20:42:08.732044,0 days 00:00:02.604265,,0.9,2.0,,LightGBM,,,,,0.8,,,,4.2717234285362414e-07,5.133635486753766e-07,,40.0,,,,,,,,,,27.0,,,,,,,,,COMPLETE,0.0,,,,,,,,,,,,,,,,,,,,
110,110,0.7273697951050706,2023-08-23 20:42:06.247812,2023-08-23 20:42:08.506346,0 days 00:00:02.258534,,0.9,2.0,,LightGBM,,,,,0.8,,,,6.106727344736986e-07,3.8038091913364784e-07,,40.0,,,,,,,,,,30.0,,,,,,,,,COMPLETE,0.0,,,,,,,,,,,,,,,,,,,,
111,111,0.737133201208336,2023-08-23 20:42:07.289222,2023-08-23 20:42:08.859991,0 days 00:00:01.570769,,1.0,2.0,,LightGBM,,,,,0.8,,,,5.221474895696515e-07,5.320611837539632e-07,,40.0,,,,,,,,,,12.0,,,,,,,,,COMPLETE,0.0,,,,,,,,,,,,,,,,,,,,
112,112,0.3308302044221944,2023-08-23 20:42:07.493569,2023-08-23 20:45:53.906584,0 days 00:03:46.413015,,,,,MLPClassifier,,,,,,,,,,,,,,tanh,adam,3.0,70.0,100.0,30.0,,,,,,,,,,,,COMPLETE,0.0,,,,,,,,,,,,,,,,,,,,
113,113,0.3358178053830228,2023-08-23 20:42:08.159359,2023-08-23 20:44:53.868974,0 days 00:02:45.709615,,,,,MLPClassifier,,,,,,,,,,,,,,relu,adam,3.0,70.0,100.0,20.0,,,,,,,,,,,,COMPLETE,0.0,,,,,,,,,,,,,,,,,,,,
114,114,0.3358178053830228,2023-08-23 20:42:08.447151,2023-08-23 20:44:17.602971,0 days 00:02:09.155820,,,,,MLPClassifier,,,,,,,,,,,,,,relu,adam,3.0,70.0,100.0,30.0,,,,,,,,,,,,COMPLETE,0.0,,,,,,,,,,,,,,,,,,,,
115,115,0.3358178053830228,2023-08-23 20:42:08.621623,2023-08-23 20:46:34.399271,0 days 00:04:25.777648,,,,,MLPClassifier,,,,,,,,,,,,,,tanh,adam,3.0,70.0,100.0,30.0,,,,,,,,,,,,COMPLETE,0.0,,,,,,,,,,,,,,,,,,,,
116,116,0.3358178053830228,2023-08-23 20:42:08.801086,2023-08-23 20:44:10.491242,0 days 00:02:01.690156,,,,,MLPClassifier,,,,,,,,,,,,,,relu,adam,3.0,70.0,100.0,30.0,,,,,,,,,,,,COMPLETE,0.0,,,,,,,,,,,,,,,,,,,,
117,117,0.3358178053830228,2023-08-23 20:42:08.932226,2023-08-23 20:46:34.870817,0 days 00:04:25.938591,,,,,MLPClassifier,,,,,,,,,,,,,,tanh,adam,3.0,70.0,100.0,30.0,,,,,,,,,,,,COMPLETE,0.0,,,,,,,,,,,,,,,,,,,,
118,118,0.3358178053830228,2023-08-23 20:42:10.685570,2023-08-23 20:45:10.597296,0 days 00:02:59.911726,,,,,MLPClassifier,,,,,,,,,,,,,,relu,adam,3.0,70.0,100.0,30.0,,,,,,,,,,,,COMPLETE,0.0,,,,,,,,,,,,,,,,,,,,
119,119,0.731834583647051,2023-08-23 20:44:10.547227,2023-08-23 20:44:11.248798,0 days 00:00:00.701571,,0.5,2.0,,LightGBM,,,,,0.9,,,,1.9340593075953974e-06,1.3034827318277803e-06,,50.0,,,,,,,,,,12.0,,,,,,,,,COMPLETE,0.0,,,,,,,,,,,,,,,,,,,,
120,120,0.732638718122772,2023-08-23 20:44:11.350022,2023-08-23 20:44:12.014044,0 days 00:00:00.664022,,0.5,2.0,,LightGBM,,,,,0.9,,,,5.03933531629149e-07,1.417425603621905e-06,,30.0,,,,,,,,,,11.0,,,,,,,,,COMPLETE,0.0,,,,,,,,,,,,,,,,,,,,
121,121,0.7305022926168299,2023-08-23 20:44:12.078024,2023-08-23 20:44:13.665223,0 days 00:00:01.587199,,0.5,2.0,,LightGBM,,,,,0.8,,,,3.180333685003698e-07,5.143174429727475e-07,,30.0,,,,,,,,,,59.0,,,,,,,,,COMPLETE,0.0,,,,,,,,,,,,,,,,,,,,
122,122,0.731975318181836,2023-08-23 20:44:13.725257,2023-08-23 20:44:15.119522,0 days 00:00:01.394265,,1.0,2.0,,LightGBM,,,,,0.8,,,,1.2084929094422886e-07,1.7770686845296419e-06,,30.0,,,,,,,,,,51.0,,,,,,,,,COMPLETE,0.0,,,,,,,,,,,,,,,,,,,,
123,123,0.3358178053830228,2023-08-23 20:44:15.185874,2023-08-23 20:44:15.307745,0 days 00:00:00.121871,2.8155987192741583e-08,,,gblinear,XGBoost,0.6853669614781798,,,,,,,7.92643347714614e-06,,,,,,,,,,,,,,,,,,,,0.5055175308665485,,,COMPLETE,0.0,,,,,,,,,,,,,,,,,,,,
124,124,0.7318448908568395,2023-08-23 20:44:15.391000,2023-08-23 20:44:15.963032,0 days 00:00:00.572032,,1.0,2.0,,LightGBM,,,,,0.8,,,,3.1174018629936156e-07,4.010090496630933e-06,,40.0,,,,,,,,,,11.0,,,,,,,,,COMPLETE,0.0,,,,,,,,,,,,,,,,,,,,
125,125,0.7273709684067147,2023-08-23 20:44:16.021270,2023-08-23 20:44:18.540501,0 days 00:00:02.519231,,0.8,2.0,,LightGBM,,,,,0.9,,,,1.1901143754515197e-07,9.360975097255317e-07,,50.0,,,,,,,,,,93.0,,,,,,,,,COMPLETE,0.0,,,,,,,,,,,,,,,,,,,,
126,126,0.7330611272800156,2023-08-23 20:44:17.659626,2023-08-23 20:44:18.815093,0 days 00:00:01.155467,,0.8,2.0,,LightGBM,,,,,0.9,,,,3.217434210815569e-06,7.966006878222718e-07,,50.0,,,,,,,,,,22.0,,,,,,,,,COMPLETE,0.0,,,,,,,,,,,,,,,,,,,,
127,127,0.5962943360255513,2023-08-23 20:44:18.645133,2023-08-23 20:44:18.880549,0 days 00:00:00.235416,,,,,DecisionTreeClassifier,,entropy,2.0,,,,,,,,,,,,,,,,,,,,,,,,,,,,COMPLETE,0.0,,,,,,,,,,,,,,,,,,,,
128,128,0.7286907921306037,2023-08-23 20:44:18.989988,2023-08-23 20:44:20.339229,0 days 00:00:01.349241,,0.8,2.0,,LightGBM,,,,,0.9,,,,1.5519116215791533e-06,3.4857014851206277e-07,,50.0,,,,,,,,,,20.0,,,,,,,,,COMPLETE,0.0,,,,,,,,,,,,,,,,,,,,
129,129,0.7289894751367354,2023-08-23 20:44:19.002495,2023-08-23 20:44:20.086814,0 days 00:00:01.084319,,0.8,2.0,,LightGBM,,,,,0.9,,,,1.3295080991948942e-06,3.1854857501408814e-07,,50.0,,,,,,,,,,19.0,,,,,,,,,COMPLETE,0.0,,,,,,,,,,,,,,,,,,,,
130,130,0.7328238291201254,2023-08-23 20:44:20.176191,2023-08-23 20:44:21.366483,0 days 00:00:01.190292,,0.8,2.0,,LightGBM,,,,,0.8,,,,6.867809890885303e-07,6.982273216249811e-07,,40.0,,,,,,,,,,35.0,,,,,,,,,COMPLETE,0.0,,,,,,,,,,,,,,,,,,,,
131,131,0.7336899585467294,2023-08-23 20:44:20.435036,2023-08-23 20:44:21.749776,0 days 00:00:01.314740,,1.0,2.0,,LightGBM,,,,,0.8,,,,3.609301521560359e-06,6.995328069091754e-07,,40.0,,,,,,,,,,36.0,,,,,,,,,COMPLETE,0.0,,,,,,,,,,,,,,,,,,,,
132,132,0.7365350117918612,2023-08-23 20:44:21.448809,2023-08-23 20:44:22.812699,0 days 00:00:01.363890,,1.0,2.0,,LightGBM,,,,,0.8,,,,3.2292374236854464e-06,5.469263372281242e-07,,40.0,,,,,,,,,,34.0,,,,,,,,,COMPLETE,0.0,,,,,,,,,,,,,,,,,,,,
133,133,0.7333599935701782,2023-08-23 20:44:21.829005,2023-08-23 20:44:23.321886,0 days 00:00:01.492881,,1.0,2.0,,LightGBM,,,,,0.8,,,,4.380910829201747e-06,1.216702781665864e-06,,30.0,,,,,,,,,,37.0,,,,,,,,,COMPLETE,0.0,,,,,,,,,,,,,,,,,,,,
134,134,0.7301201076827502,2023-08-23 20:44:22.913834,2023-08-23 20:44:24.122366,0 days 00:00:01.208532,,1.0,2.0,,LightGBM,,,,,0.8,,,,3.0887066002706304e-06,7.405723610542915e-07,,30.0,,,,,,,,,,39.0,,,,,,,,,COMPLETE,0.0,,,,,,,,,,,,,,,,,,,,
135,135,0.6310681151706793,2023-08-23 20:44:23.416680,2023-08-23 20:44:25.317410,0 days 00:00:01.900730,,,,,RandomForestClassifier,,,,,,,,,,,,,,,,,,,,,,,,39.0,5.0,,,,,,COMPLETE,0.0,,,,,,,,,,,,,,,,,,,,
136,136,0.7244995531934539,2023-08-23 20:44:24.220676,2023-08-23 20:44:28.146094,0 days 00:00:03.925418,,1.0,2.0,,LightGBM,,,,,0.8,,,,6.128465303401879e-06,4.981743561603393e-06,,40.0,,,,,,,,,,174.0,,,,,,,,,COMPLETE,0.0,,,,,,,,,,,,,,,,,,,,
137,137,0.7365350117918612,2023-08-23 20:44:25.401106,2023-08-23 20:44:26.491528,0 days 00:00:01.090422,,1.0,2.0,,LightGBM,,,,,0.8,,,,3.0650883960390753e-06,4.416848240110575e-06,,40.0,,,,,,,,,,34.0,,,,,,,,,COMPLETE,0.0,,,,,,,,,,,,,,,,,,,,
138,138,0.7282467492722433,2023-08-23 20:44:26.574309,2023-08-23 20:44:28.003254,0 days 00:00:01.428945,,1.0,2.0,,LightGBM,,,,,0.8,,,,4.258215664669733e-06,5.221260704515227e-06,,40.0,,,,,,,,,,47.0,,,,,,,,,COMPLETE,0.0,,,,,,,,,,,,,,,,,,,,
139,139,0.7322560421303408,2023-08-23 20:44:28.083500,2023-08-23 20:44:29.335558,0 days 00:00:01.252058,,1.0,2.0,,LightGBM,,,,,0.8,,,,8.175151538727835e-06,1.7861117883223082e-06,,40.0,,,,,,,,,,33.0,,,,,,,,,COMPLETE,0.0,,,,,,,,,,,,,,,,,,,,
140,140,0.7312367992874371,2023-08-23 20:44:28.223642,2023-08-23 20:44:29.652179,0 days 00:00:01.428537,,1.0,2.0,,LightGBM,,,,,0.8,,,,2.3921921965087545e-06,1.644451563926411e-06,,30.0,,,,,,,,,,34.0,,,,,,,,,COMPLETE,0.0,,,,,,,,,,,,,,,,,,,,
141,141,0.7290950582216197,2023-08-23 20:44:29.421218,2023-08-23 20:44:30.153458,0 days 00:00:00.732240,,1.0,2.0,,LightGBM,,,,,0.8,,,,2.624475180058207e-06,2.258071600464744e-06,,30.0,,,,,,,,,,8.0,,,,,,,,,COMPLETE,0.0,,,,,,,,,,,,,,,,,,,,
142,142,0.728596239973367,2023-08-23 20:44:29.733277,2023-08-23 20:44:30.505389,0 days 00:00:00.772112,,1.0,2.0,,LightGBM,,,,,0.8,,,,2.4846948038263446e-06,2.9654771219764788e-06,,30.0,,,,,,,,,,10.0,,,,,,,,,COMPLETE,0.0,,,,,,,,,,,,,,,,,,,,
143,143,0.7272891095221754,2023-08-23 20:44:30.206480,2023-08-23 20:44:31.725828,0 days 00:00:01.519348,,1.0,2.0,,LightGBM,,,,,0.8,,,,1.1427507411340335e-06,5.457766286161955e-07,,20.0,,,,,,,,,,50.0,,,,,,,,,COMPLETE,0.0,,,,,,,,,,,,,,,,,,,,
144,144,0.7323457118963075,2023-08-23 20:44:30.566932,2023-08-23 20:44:32.302137,0 days 00:00:01.735205,,1.0,2.0,,LightGBM,,,,,0.8,,,,9.93494105662111e-06,5.357650214345907e-07,,40.0,,,,,,,,,,54.0,,,,,,,,,COMPLETE,0.0,,,,,,,,,,,,,,,,,,,,
145,145,0.7245548056943658,2023-08-23 20:44:31.816236,2023-08-23 20:44:33.097006,0 days 00:00:01.280770,,1.0,2.0,,LightGBM,,,,,0.5,,,,1.867841595570821e-06,1.131432461233479e-05,,40.0,,,,,,,,,,26.0,,,,,,,,,COMPLETE,0.0,,,,,,,,,,,,,,,,,,,,
146,146,0.685910951983512,2023-08-23 20:44:32.369016,2023-08-23 20:44:32.739866,0 days 00:00:00.370850,0.002805770844874882,,,dart,XGBoost,0.2006270508952484,,,6.206773283143901e-06,,0.00017200909326420806,depthwise,0.0003407207855269237,,,9.0,,5.0,,,,,,,,forest,,0.8814023064105235,,,uniform,0.4532666802838561,0.5399884431517011,,,COMPLETE,0.0,,,,,,,,,,,,,,,,,,,,
147,147,0.7293270025080774,2023-08-23 20:44:32.853370,2023-08-23 20:44:33.949489,0 days 00:00:01.096119,,1.0,2.0,,LightGBM,,,,,0.5,,,,1.8586668811726417e-06,1.0117542416692774e-05,,40.0,,,,,,,,,,27.0,,,,,,,,,COMPLETE,0.0,,,,,,,,,,,,,,,,,,,,
148,148,0.7308129659226543,2023-08-23 20:44:33.194032,2023-08-23 20:44:34.604190,0 days 00:00:01.410158,,1.0,2.0,,LightGBM,,,,,0.8,,,,3.283979242414173e-06,1.3238497016890618e-06,,40.0,,,,,,,,,,38.0,,,,,,,,,COMPLETE,0.0,,,,,,,,,,,,,,,,,,,,
149,149,0.7326364703150787,2023-08-23 20:44:34.026694,2023-08-23 20:44:35.328625,0 days 00:00:01.301931,,1.0,2.0,,LightGBM,,,,,0.7000000000000001,,,,3.735714711652546e-06,1.0364894584494084e-06,,50.0,,,,,,,,,,38.0,,,,,,,,,COMPLETE,0.0,,,,,,,,,,,,,,,,,,,,
150,150,0.7314767632594141,2023-08-23 20:44:34.672546,2023-08-23 20:44:36.468293,0 days 00:00:01.795747,,1.0,2.0,,LightGBM,,,,,0.7000000000000001,,,,4.369825007317289e-06,9.235336900682512e-07,,50.0,,,,,,,,,,66.0,,,,,,,,,COMPLETE,0.0,,,,,,,,,,,,,,,,,,,,
151,151,0.7324334357178323,2023-08-23 20:44:35.388544,2023-08-23 20:44:37.472857,0 days 00:00:02.084313,,0.9,2.0,,LightGBM,,,,,0.8,,,,6.893686028645601e-06,2.601127289645327e-07,,70.0,,,,,,,,,,65.0,,,,,,,,,COMPLETE,0.0,,,,,,,,,,,,,,,,,,,,
152,152,0.7311746334798743,2023-08-23 20:44:36.533493,2023-08-23 20:44:37.551188,0 days 00:00:01.017695,,0.9,2.0,,LightGBM,,,,,1.0,,,,8.654264698788844e-07,2.4452890034478843e-07,,40.0,,,,,,,,,,15.0,,,,,,,,,COMPLETE,0.0,,,,,,,,,,,,,,,,,,,,
153,153,0.7241535281195337,2023-08-23 20:44:37.618682,2023-08-23 20:44:38.174193,0 days 00:00:00.555511,,1.0,2.0,,LightGBM,,,,,0.8,,,,1.0717486977505512e-06,2.556972095331558e-06,,20.0,,,,,,,,,,5.0,,,,,,,,,COMPLETE,0.0,,,,,,,,,,,,,,,,,,,,
154,154,0.7371941986675328,2023-08-23 20:44:37.650145,2023-08-23 20:44:38.775643,0 days 00:00:01.125498,,1.0,2.0,,LightGBM,,,,,0.8,,,,1.0652764575863776e-06,4.653414692413497e-06,,20.0,,,,,,,,,,21.0,,,,,,,,,COMPLETE,0.0,,,,,,,,,,,,,,,,,,,,
155,155,0.7253855297958794,2023-08-23 20:44:38.230722,2023-08-23 20:44:39.321830,0 days 00:00:01.091108,,1.0,2.0,,LightGBM,,,,,0.8,,,,3.023117918165191e-08,3.866109420173405e-06,,50.0,,,,,,,,,,25.0,,,,,,,,,COMPLETE,0.0,,,,,,,,,,,,,,,,,,,,
156,156,0.7305143188062807,2023-08-23 20:44:38.849114,2023-08-23 20:44:40.114867,0 days 00:00:01.265753,,1.0,2.0,,LightGBM,,,,,0.8,,,,5.629094143642983e-07,4.934557746820055e-06,,20.0,,,,,,,,,,32.0,,,,,,,,,COMPLETE,0.0,,,,,,,,,,,,,,,,,,,,
157,157,0.6117743130387931,2023-08-23 20:44:39.412367,2023-08-23 20:44:39.829789,0 days 00:00:00.417422,,,,,DecisionTreeClassifier,,entropy,9.0,,,,,,,,,,,,,,,,,,,,,,,,,,,,COMPLETE,0.0,,,,,,,,,,,,,,,,,,,,
158,158,0.7315357005527188,2023-08-23 20:44:39.895809,2023-08-23 20:44:40.957404,0 days 00:00:01.061595,,1.0,1.0,,LightGBM,,,,,0.8,,,,5.084576472528882e-07,5.85350805840296e-06,,10.0,,,,,,,,,,22.0,,,,,,,,,COMPLETE,0.0,,,,,,,,,,,,,,,,,,,,
159,159,0.7321951793062904,2023-08-23 20:44:40.241714,2023-08-23 20:44:41.191060,0 days 00:00:00.949346,,1.0,1.0,,LightGBM,,,,,0.8,,,,1.7281131085724087e-06,1.6265046588225608e-05,,40.0,,,,,,,,,,22.0,,,,,,,,,COMPLETE,0.0,,,,,,,,,,,,,,,,,,,,
160,160,0.7316768120456876,2023-08-23 20:44:41.016577,2023-08-23 20:44:41.813665,0 days 00:00:00.797088,,1.0,2.0,,LightGBM,,,,,0.8,,,,1.2459560354099083e-05,7.265876569360111e-07,,40.0,,,,,,,,,,16.0,,,,,,,,,COMPLETE,0.0,,,,,,,,,,,,,,,,,,,,
161,161,0.7337820110804958,2023-08-23 20:44:41.276796,2023-08-23 20:44:42.265336,0 days 00:00:00.988540,,0.9,2.0,,LightGBM,,,,,0.6000000000000001,,,,1.4383021856666812e-05,7.534682003251669e-07,,40.0,,,,,,,,,,15.0,,,,,,,,,COMPLETE,0.0,,,,,,,,,,,,,,,,,,,,
162,162,0.727869381382689,2023-08-23 20:44:41.885390,2023-08-23 20:44:44.898196,0 days 00:00:03.012806,,0.9,2.0,,LightGBM,,,,,0.6000000000000001,,,,2.508111068969302e-07,2.116848850181554e-06,,30.0,,,,,,,,,,98.0,,,,,,,,,COMPLETE,0.0,,,,,,,,,,,,,,,,,,,,
163,163,0.7125816391971608,2023-08-23 20:44:42.328623,2023-08-23 20:44:42.690812,0 days 00:00:00.362189,,0.9,2.0,,LightGBM,,,,,0.6000000000000001,,,,2.3538032102305742e-05,2.116396491038394e-06,,30.0,,,,,,,,,,2.0,,,,,,,,,COMPLETE,0.0,,,,,,,,,,,,,,,,,,,,
164,164,0.7326153210580293,2023-08-23 20:44:42.761231,2023-08-23 20:44:45.356094,0 days 00:00:02.594863,,0.9,2.0,,LightGBM,,,,,0.6000000000000001,,,,2.5799103588991197e-07,8.00160524080933e-06,,40.0,,,,,,,,,,96.0,,,,,,,,,COMPLETE,0.0,,,,,,,,,,,,,,,,,,,,
165,165,0.6449205946437419,2023-08-23 20:44:44.963989,2023-08-23 20:44:48.670079,0 days 00:00:03.706090,,,,,RandomForestClassifier,,,,,,,,,,,,,,,,,,,,,,,,45.0,12.0,,,,,,COMPLETE,0.0,,,,,,,,,,,,,,,,,,,,
166,166,0.6505977618651486,2023-08-23 20:44:45.420522,2023-08-23 20:44:49.071751,0 days 00:00:03.651229,,,,,RandomForestClassifier,,,,,,,,,,,,,,,,,,,,,,,,43.0,12.0,,,,,,COMPLETE,0.0,,,,,,,,,,,,,,,,,,,,
167,167,0.3358178053830228,2023-08-23 20:44:48.733844,2023-08-23 20:46:23.854002,0 days 00:01:35.120158,,,,,MLPClassifier,,,,,,,,,,,,,,tanh,sgd,2.0,50.0,50.0,,,,,,,,,,,,,COMPLETE,0.0,,,,,,,,,,,,,,,,,,,,
168,168,0.7302156538717133,2023-08-23 20:44:49.162065,2023-08-23 20:44:50.035882,0 days 00:00:00.873817,,1.0,2.0,,LightGBM,,,,,0.9,,,,6.198205353661174e-06,1.1482267080185216e-06,,40.0,,,,,,,,,,16.0,,,,,,,,,COMPLETE,0.0,,,,,,,,,,,,,,,,,,,,
169,169,0.7275053152651592,2023-08-23 20:44:50.116923,2023-08-23 20:44:53.018126,0 days 00:00:02.901203,,0.9,2.0,,LightGBM,,,,,0.6000000000000001,,,,1.2175608643473001e-06,4.151077854837505e-07,,50.0,,,,,,,,,,118.0,,,,,,,,,COMPLETE,0.0,,,,,,,,,,,,,,,,,,,,
170,170,0.7270390911117058,2023-08-23 20:44:53.088771,2023-08-23 20:44:53.554926,0 days 00:00:00.466155,,1.0,2.0,,LightGBM,,,,,0.7000000000000001,,,,3.775369494779451e-05,6.954216269758962e-07,,50.0,,,,,,,,,,7.0,,,,,,,,,COMPLETE,0.0,,,,,,,,,,,,,,,,,,,,
171,171,0.7332733989966874,2023-08-23 20:44:53.629687,2023-08-23 20:44:55.346039,0 days 00:00:01.716352,,0.6000000000000001,2.0,,LightGBM,,,,,0.8,,,,8.55061634514626e-07,3.242740312044148e-06,,70.0,,,,,,,,,,47.0,,,,,,,,,COMPLETE,0.0,,,,,,,,,,,,,,,,,,,,
