,number,value,datetime_start,datetime_complete,duration,params_alpha,params_bagging_fraction,params_bagging_freq,params_booster,params_classifier,params_colsample_bytree,params_dct_criterion,params_dct_max_depth,params_eta,params_feature_fraction,params_gamma,params_grow_policy,params_lambda,params_lambda_l1,params_lambda_l2,params_max_depth,params_min_child_samples,params_min_child_weight,params_mlp_activation,params_mlp_solver,params_n_layers,params_n_units_l_0,params_n_units_l_1,params_n_units_l_2,params_n_units_l_3,params_normalize_type,params_num_leaves,params_rate_drop,params_rf_estimator,params_rf_max_depth,params_sample_type,params_skip_drop,params_subsample,params_svc_c,params_svc_kernel,state,best_trial,dev_acc,dev_recall_macro,dev_precision_macro,dev_f1_macro,dev_recall_0,dev_precision_0,dev_f1_0,dev_recall_1,dev_precision_1,dev_f1_1,test_acc,test_recall_macro,test_precision_macro,test_f1_macro,test_recall_0,test_precision_0,test_f1_0,test_recall_1,test_precision_1,test_f1_1
0,0,0.5612999759737469,2023-08-23 19:16:22.174173,2023-08-23 19:26:41.223209,0 days 00:10:19.049036,,,,,MLPClassifier,,,,,,,,,,,,,,relu,lbfgs,3.0,60.0,100.0,40.0,,,,,,,,,,,,COMPLETE,0.0,,,,,,,,,,,,,,,,,,,,
1,1,0.5654037331336549,2023-08-23 19:16:22.177187,2023-08-23 19:38:21.901626,0 days 00:21:59.724439,,,,,MLPClassifier,,,,,,,,,,,,,,tanh,adam,2.0,80.0,90.0,,,,,,,,,,,,,COMPLETE,0.0,,,,,,,,,,,,,,,,,,,,
2,2,0.437766237244044,2023-08-23 19:16:22.180420,2023-08-23 19:17:17.345678,0 days 00:00:55.165258,,,,,SVC,,,,,,,,,,,,,,,,,,,,,,,,,,,,,14.66436761552832,rbf,COMPLETE,0.0,,,,,,,,,,,,,,,,,,,,
3,3,0.6358591306747834,2023-08-23 19:16:22.183829,2023-08-23 19:16:23.805674,0 days 00:00:01.621845,,1.0,2.0,,LightGBM,,,,,1.0,,,,0.6419845158450871,0.00014647846865096741,,30.0,,,,,,,,,,43.0,,,,,,,,,COMPLETE,0.0,,,,,,,,,,,,,,,,,,,,
4,4,0.6067891305106394,2023-08-23 19:16:22.184153,2023-08-23 19:16:22.536152,0 days 00:00:00.351999,,,,,DecisionTreeClassifier,,gini,6.0,,,,,,,,,,,,,,,,,,,,,,,,,,,,COMPLETE,0.0,,,,,,,,,,,,,,,,,,,,
5,5,0.6272025057402416,2023-08-23 19:16:22.186809,2023-08-23 19:16:31.496597,0 days 00:00:09.309788,,,,,RandomForestClassifier,,,,,,,,,,,,,,,,,,,,,,,,50.0,14.0,,,,,,COMPLETE,0.0,,,,,,,,,,,,,,,,,,,,
6,6,0.5484176032376141,2023-08-23 19:16:22.187880,2023-08-23 19:16:26.820777,0 days 00:00:04.632897,,,,,MLPClassifier,,,,,,,,,,,,,,identity,sgd,2.0,20.0,20.0,,,,,,,,,,,,,COMPLETE,0.0,,,,,,,,,,,,,,,,,,,,
7,7,0.3358178053830228,2023-08-23 19:16:22.189760,2023-08-23 19:17:00.058080,0 days 00:00:37.868320,,,,,SVC,,,,,,,,,,,,,,,,,,,,,,,,,,,,,0.004405899083955255,linear,COMPLETE,0.0,,,,,,,,,,,,,,,,,,,,
8,8,0.5773536947026183,2023-08-23 19:16:22.677112,2023-08-23 19:37:51.656828,0 days 00:21:28.979716,,,,,MLPClassifier,,,,,,,,,,,,,,relu,adam,2.0,80.0,80.0,,,,,,,,,,,,,COMPLETE,0.0,,,,,,,,,,,,,,,,,,,,
9,9,0.3358178053830228,2023-08-23 19:16:23.915987,2023-08-23 19:16:24.050236,0 days 00:00:00.134249,0.06270260839066318,,,gblinear,XGBoost,0.38507679628582975,,,,,,,0.006313627089599242,,,,,,,,,,,,,,,,,,,,0.6198139953418371,,,COMPLETE,0.0,,,,,,,,,,,,,,,,,,,,
10,10,0.3358178053830228,2023-08-23 19:16:24.169113,2023-08-23 19:17:21.296189,0 days 00:00:57.127076,,,,,SVC,,,,,,,,,,,,,,,,,,,,,,,,,,,,,0.0010310250234479817,rbf,COMPLETE,0.0,,,,,,,,,,,,,,,,,,,,
11,11,0.3358178053830228,2023-08-23 19:16:26.932295,2023-08-23 19:17:08.122218,0 days 00:00:41.189923,,,,,SVC,,,,,,,,,,,,,,,,,,,,,,,,,,,,,13.942386042905364,poly,COMPLETE,0.0,,,,,,,,,,,,,,,,,,,,
12,12,0.5994426286926549,2023-08-23 19:16:31.595253,2023-08-23 19:16:31.909887,0 days 00:00:00.314634,0.000923046589935013,,,dart,XGBoost,0.5299674631618669,,,0.00010506045469142846,,0.010424901529179414,depthwise,0.0008699131728203375,,,5.0,,9.0,,,,,,,,tree,,0.07990126531120169,,,weighted,0.007288086331055936,0.8058987590811533,,,COMPLETE,0.0,,,,,,,,,,,,,,,,,,,,
13,13,0.6139547325806909,2023-08-23 19:16:32.015312,2023-08-23 19:16:32.445999,0 days 00:00:00.430687,7.905340563533717e-08,,,gbtree,XGBoost,0.7957520646735678,,,7.396626405162702e-08,,0.07991724821368916,lossguide,0.0005811302030071347,,,9.0,,7.0,,,,,,,,,,,,,,,0.42443820443410285,,,COMPLETE,0.0,,,,,,,,,,,,,,,,,,,,
14,14,0.3358178053830228,2023-08-23 19:16:32.616486,2023-08-23 19:17:05.814413,0 days 00:00:33.197927,,,,,MLPClassifier,,,,,,,,,,,,,,logistic,sgd,1.0,60.0,,,,,,,,,,,,,,COMPLETE,0.0,,,,,,,,,,,,,,,,,,,,
15,15,0.5116335170289555,2023-08-23 19:17:00.203367,2023-08-23 19:17:00.573815,0 days 00:00:00.370448,,,,,DecisionTreeClassifier,,entropy,2.0,,,,,,,,,,,,,,,,,,,,,,,,,,,,COMPLETE,0.0,,,,,,,,,,,,,,,,,,,,
16,16,0.3358178053830228,2023-08-23 19:17:00.670752,2023-08-23 19:17:52.205879,0 days 00:00:51.535127,,,,,SVC,,,,,,,,,,,,,,,,,,,,,,,,,,,,,0.011182149470600825,rbf,COMPLETE,0.0,,,,,,,,,,,,,,,,,,,,
17,17,0.6324752613788912,2023-08-23 19:17:05.921030,2023-08-23 19:17:07.372608,0 days 00:00:01.451578,,1.0,2.0,,LightGBM,,,,,1.0,,,,0.8331357108158463,0.00020998433170890348,,30.0,,,,,,,,,,36.0,,,,,,,,,COMPLETE,0.0,,,,,,,,,,,,,,,,,,,,
18,18,0.6314566064495211,2023-08-23 19:17:07.484898,2023-08-23 19:17:08.901526,0 days 00:00:01.416628,,1.0,2.0,,LightGBM,,,,,1.0,,,,0.9135090634218016,0.00016173483429805362,,30.0,,,,,,,,,,29.0,,,,,,,,,COMPLETE,0.0,,,,,,,,,,,,,,,,,,,,
19,19,0.6294678482926624,2023-08-23 19:17:08.209928,2023-08-23 19:17:10.071757,0 days 00:00:01.861829,,1.0,2.0,,LightGBM,,,,,1.0,,,,0.46407244467202924,0.00019441486206504057,,30.0,,,,,,,,,,31.0,,,,,,,,,COMPLETE,0.0,,,,,,,,,,,,,,,,,,,,
20,20,0.6330747530980991,2023-08-23 19:17:09.054092,2023-08-23 19:17:11.094408,0 days 00:00:02.040316,,1.0,2.0,,LightGBM,,,,,1.0,,,,0.43359554454763455,0.00011548077513961292,,30.0,,,,,,,,,,42.0,,,,,,,,,COMPLETE,0.0,,,,,,,,,,,,,,,,,,,,
21,21,0.6395410321489001,2023-08-23 19:17:10.173737,2023-08-23 19:17:14.012418,0 days 00:00:03.838681,,0.9,2.0,,LightGBM,,,,,0.8,,,,1.388902266348487e-06,1.351839797253177e-07,,80.0,,,,,,,,,,104.0,,,,,,,,,COMPLETE,1.0,0.6396508728179551,0.6395355165341622,0.6395962933406757,0.6395410321489001,0.6292559899117276,0.6372924648786717,0.633248730964467,0.6498150431565968,0.6419001218026796,0.6458333333333333,0.6297703879651623,0.6295943902663614,0.6299951180511969,0.6294097431111161,0.602486452024227,0.6340154310634015,0.6178489702517163,0.6567023285084959,0.6259748050389922,0.6409705159705159
22,22,0.628109625469782,2023-08-23 19:17:11.233058,2023-08-23 19:17:14.181875,0 days 00:00:02.948817,,0.5,1.0,,LightGBM,,,,,0.6000000000000001,,,,7.226326250912946e-05,1.693265005079994e-07,,90.0,,,,,,,,,,175.0,,,,,,,,,COMPLETE,0.0,,,,,,,,,,,,,,,,,,,,
23,23,0.6253478929509285,2023-08-23 19:17:14.136903,2023-08-23 19:17:17.517199,0 days 00:00:03.380296,,0.7000000000000001,1.0,,LightGBM,,,,,0.6000000000000001,,,,1.479458670334646e-06,7.41454115101656e-08,,90.0,,,,,,,,,,144.0,,,,,,,,,COMPLETE,0.0,,,,,,,,,,,,,,,,,,,,
24,24,0.5863207057086541,2023-08-23 19:17:14.255690,2023-08-23 19:17:18.873701,0 days 00:00:04.618011,,,,,RandomForestClassifier,,,,,,,,,,,,,,,,,,,,,,,,100.0,2.0,,,,,,COMPLETE,0.0,,,,,,,,,,,,,,,,,,,,
25,25,0.5792047669753063,2023-08-23 19:17:17.433304,2023-08-23 19:17:22.266072,0 days 00:00:04.832768,,,,,RandomForestClassifier,,,,,,,,,,,,,,,,,,,,,,,,97.0,2.0,,,,,,COMPLETE,0.0,,,,,,,,,,,,,,,,,,,,
26,26,0.6238069086117277,2023-08-23 19:17:17.653920,2023-08-23 19:17:20.857000,0 days 00:00:03.203080,,0.8,3.0,,LightGBM,,,,,0.8,,,,3.8942751508091354e-08,0.034649906491090024,,60.0,,,,,,,,,,105.0,,,,,,,,,COMPLETE,0.0,,,,,,,,,,,,,,,,,,,,
27,27,0.6273407731806986,2023-08-23 19:17:18.978640,2023-08-23 19:17:22.619964,0 days 00:00:03.641324,,0.8,3.0,,LightGBM,,,,,0.8,,,,1.5467739651404345e-07,0.5151076471583497,,60.0,,,,,,,,,,99.0,,,,,,,,,COMPLETE,0.0,,,,,,,,,,,,,,,,,,,,
28,28,0.6367386099798031,2023-08-23 19:17:20.983834,2023-08-23 19:17:24.438616,0 days 00:00:03.454782,,0.9,2.0,,LightGBM,,,,,0.8,,,,0.005824161717980679,4.167424652648862e-06,,10.0,,,,,,,,,,84.0,,,,,,,,,COMPLETE,0.0,,,,,,,,,,,,,,,,,,,,
29,29,0.620862749976674,2023-08-23 19:17:21.380865,2023-08-23 19:17:24.713796,0 days 00:00:03.332931,,0.9,2.0,,LightGBM,,,,,0.8,,,,0.005698791481094727,3.000787678576292e-06,,10.0,,,,,,,,,,88.0,,,,,,,,,COMPLETE,0.0,,,,,,,,,,,,,,,,,,,,
30,30,0.6233182670904656,2023-08-23 19:17:22.379964,2023-08-23 19:17:25.963906,0 days 00:00:03.583942,,0.9,2.0,,LightGBM,,,,,0.8,,,,0.0055021607895518005,4.467950700211727e-06,,10.0,,,,,,,,,,89.0,,,,,,,,,COMPLETE,0.0,,,,,,,,,,,,,,,,,,,,
31,31,0.626542818154684,2023-08-23 19:17:22.753071,2023-08-23 19:17:25.635127,0 days 00:00:02.882056,,0.9,2.0,,LightGBM,,,,,0.4,,,,0.014375405371949028,4.068006294493207e-06,,10.0,,,,,,,,,,73.0,,,,,,,,,COMPLETE,0.0,,,,,,,,,,,,,,,,,,,,
32,32,0.6236975014827872,2023-08-23 19:17:24.596048,2023-08-23 19:17:28.214372,0 days 00:00:03.618324,,0.8,2.0,,LightGBM,,,,,0.8,,,,0.006385452507081889,1.3266665142324561e-06,,10.0,,,,,,,,,,86.0,,,,,,,,,COMPLETE,0.0,,,,,,,,,,,,,,,,,,,,
33,33,0.630531666902354,2023-08-23 19:17:24.816161,2023-08-23 19:17:32.436021,0 days 00:00:07.619860,,0.8,2.0,,LightGBM,,,,,0.8,,,,0.009378543298886988,1.9896310323481037e-06,,10.0,,,,,,,,,,250.0,,,,,,,,,COMPLETE,0.0,,,,,,,,,,,,,,,,,,,,
34,34,0.6335683438200992,2023-08-23 19:17:25.754248,2023-08-23 19:17:30.676900,0 days 00:00:04.922652,,0.8,1.0,,LightGBM,,,,,0.7000000000000001,,,,3.426224815699829e-05,1.0390744817768071e-08,,70.0,,,,,,,,,,235.0,,,,,,,,,COMPLETE,0.0,,,,,,,,,,,,,,,,,,,,
35,35,0.5600626208861496,2023-08-23 19:17:26.156473,2023-08-23 19:31:48.590816,0 days 00:14:22.434343,,,,,MLPClassifier,,,,,,,,,,,,,,relu,lbfgs,4.0,100.0,100.0,80.0,100.0,,,,,,,,,,,COMPLETE,0.0,,,,,,,,,,,,,,,,,,,,
36,36,0.5763645133183968,2023-08-23 19:17:28.369888,2023-08-23 19:17:30.046050,0 days 00:00:01.676162,,,,,DecisionTreeClassifier,,log_loss,25.0,,,,,,,,,,,,,,,,,,,,,,,,,,,,COMPLETE,0.0,,,,,,,,,,,,,,,,,,,,
37,37,0.5619198092290162,2023-08-23 19:17:30.166391,2023-08-23 19:32:26.307143,0 days 00:14:56.140752,,,,,MLPClassifier,,,,,,,,,,,,,,tanh,lbfgs,4.0,100.0,100.0,30.0,60.0,,,,,,,,,,,COMPLETE,0.0,,,,,,,,,,,,,,,,,,,,
38,38,0.6108364347824734,2023-08-23 19:17:30.801659,2023-08-23 19:17:36.719487,0 days 00:00:05.917828,,0.9,1.0,,LightGBM,,,,,0.7000000000000001,,,,1.593819008347524e-05,2.0786763189435398e-08,,70.0,,,,,,,,,,251.0,,,,,,,,,COMPLETE,0.0,,,,,,,,,,,,,,,,,,,,
39,39,0.563823742760881,2023-08-23 19:17:32.540967,2023-08-23 19:33:09.723011,0 days 00:15:37.182044,,,,,MLPClassifier,,,,,,,,,,,,,,tanh,lbfgs,4.0,100.0,100.0,60.0,100.0,,,,,,,,,,,COMPLETE,0.0,,,,,,,,,,,,,,,,,,,,
40,40,0.5640838315493282,2023-08-23 19:17:36.841885,2023-08-23 19:38:19.609016,0 days 00:20:42.767131,,,,,MLPClassifier,,,,,,,,,,,,,,tanh,adam,4.0,100.0,90.0,20.0,70.0,,,,,,,,,,,COMPLETE,0.0,,,,,,,,,,,,,,,,,,,,
41,41,0.5653912016770702,2023-08-23 19:17:52.282055,2023-08-23 19:33:08.382542,0 days 00:15:16.100487,,,,,MLPClassifier,,,,,,,,,,,,,,tanh,lbfgs,4.0,100.0,100.0,70.0,70.0,,,,,,,,,,,COMPLETE,0.0,,,,,,,,,,,,,,,,,,,,
