,number,value,datetime_start,datetime_complete,duration,params_alpha,params_bagging_fraction,params_bagging_freq,params_booster,params_classifier,params_colsample_bytree,params_dct_criterion,params_dct_max_depth,params_eta,params_feature_fraction,params_gamma,params_grow_policy,params_lambda,params_lambda_l1,params_lambda_l2,params_max_depth,params_min_child_samples,params_min_child_weight,params_mlp_activation,params_mlp_solver,params_n_layers,params_n_units_l_0,params_n_units_l_1,params_n_units_l_2,params_n_units_l_3,params_normalize_type,params_num_leaves,params_rate_drop,params_rf_estimator,params_rf_max_depth,params_sample_type,params_skip_drop,params_subsample,params_svc_c,params_svc_kernel,state,best_trial,dev_acc,dev_recall_macro,dev_precision_macro,dev_f1_macro,dev_recall_0,dev_precision_0,dev_f1_0,dev_recall_1,dev_precision_1,dev_f1_1,test_acc,test_recall_macro,test_precision_macro,test_f1_macro,test_recall_0,test_precision_0,test_f1_0,test_recall_1,test_precision_1,test_f1_1
173,173,0.6840277777777779,2023-08-23 17:33:01.602798,2023-08-23 17:33:03.210880,0 days 00:00:01.608082,,,,,RandomForestClassifier,,,,,,,,,,,,,,,,,,,,,,,,79.0,5.0,,,,,,COMPLETE,0.0,,,,,,,,,,,,,,,,,,,,
174,174,0.6670934699103712,2023-08-23 17:33:01.845596,2023-08-23 17:33:03.481904,0 days 00:00:01.636308,,,,,RandomForestClassifier,,,,,,,,,,,,,,,,,,,,,,,,84.0,5.0,,,,,,COMPLETE,0.0,,,,,,,,,,,,,,,,,,,,
175,175,0.6755244755244756,2023-08-23 17:33:02.353098,2023-08-23 17:33:03.999776,0 days 00:00:01.646678,,,,,RandomForestClassifier,,,,,,,,,,,,,,,,,,,,,,,,83.0,5.0,,,,,,COMPLETE,0.0,,,,,,,,,,,,,,,,,,,,
176,176,0.3696969696969697,2023-08-23 17:33:03.316381,2023-08-23 17:33:03.406189,0 days 00:00:00.089808,,,,,SVC,,,,,,,,,,,,,,,,,,,,,,,,,,,,,55.42967509261884,poly,COMPLETE,0.0,,,,,,,,,,,,,,,,,,,,
177,177,0.6767919799498747,2023-08-23 17:33:03.467845,2023-08-23 17:33:04.317772,0 days 00:00:00.849927,,0.9,2.0,,LightGBM,,,,,0.9,,,,1.1601418412058488e-05,0.08632282304842287,,90.0,,,,,,,,,,230.0,,,,,,,,,COMPLETE,0.0,,,,,,,,,,,,,,,,,,,,
178,178,0.6767919799498747,2023-08-23 17:33:03.561746,2023-08-23 17:33:04.555306,0 days 00:00:00.993560,,0.9,1.0,,LightGBM,,,,,0.9,,,,1.2560646275377686e-05,0.08415647334639906,,100.0,,,,,,,,,,155.0,,,,,,,,,COMPLETE,0.0,,,,,,,,,,,,,,,,,,,,
179,179,0.6889952153110048,2023-08-23 17:33:04.082004,2023-08-23 17:33:04.813065,0 days 00:00:00.731061,,0.9,1.0,,LightGBM,,,,,0.6000000000000001,,,,3.200064835463807e-05,0.10704987507309358,,100.0,,,,,,,,,,231.0,,,,,,,,,COMPLETE,0.0,,,,,,,,,,,,,,,,,,,,
180,180,0.7063331988705123,2023-08-23 17:33:04.452889,2023-08-23 17:33:05.406106,0 days 00:00:00.953217,,1.0,1.0,,LightGBM,,,,,0.6000000000000001,,,,3.163821966406895e-05,0.13862976133830074,,100.0,,,,,,,,,,210.0,,,,,,,,,COMPLETE,0.0,,,,,,,,,,,,,,,,,,,,
181,181,0.6767919799498747,2023-08-23 17:33:04.657362,2023-08-23 17:33:05.646582,0 days 00:00:00.989220,,1.0,1.0,,LightGBM,,,,,0.8,,,,3.222121181777761e-05,0.45838546147830705,,100.0,,,,,,,,,,253.0,,,,,,,,,COMPLETE,0.0,,,,,,,,,,,,,,,,,,,,
182,182,0.6682615629984051,2023-08-23 17:33:04.882746,2023-08-23 17:33:05.578323,0 days 00:00:00.695577,,1.0,1.0,,LightGBM,,,,,0.8,,,,8.91516545427015e-05,0.21412791804253822,,100.0,,,,,,,,,,209.0,,,,,,,,,COMPLETE,0.0,,,,,,,,,,,,,,,,,,,,
183,183,0.6767919799498747,2023-08-23 17:33:04.888789,2023-08-23 17:33:05.739296,0 days 00:00:00.850507,,1.0,1.0,,LightGBM,,,,,0.8,,,,0.00015137380298890305,0.46259547165046033,,100.0,,,,,,,,,,207.0,,,,,,,,,COMPLETE,0.0,,,,,,,,,,,,,,,,,,,,
184,184,0.7128205128205128,2023-08-23 17:33:05.503429,2023-08-23 17:33:06.453810,0 days 00:00:00.950381,,1.0,2.0,,LightGBM,,,,,0.8,,,,0.0001281923615658953,0.4742427170521266,,90.0,,,,,,,,,,185.0,,,,,,,,,COMPLETE,0.0,,,,,,,,,,,,,,,,,,,,
185,185,0.6728564180618974,2023-08-23 17:33:05.709943,2023-08-23 17:33:06.935061,0 days 00:00:01.225118,,1.0,2.0,,LightGBM,,,,,1.0,,,,0.0001402237511078942,0.24559441971982215,,60.0,,,,,,,,,,98.0,,,,,,,,,COMPLETE,0.0,,,,,,,,,,,,,,,,,,,,
186,186,0.6717948717948719,2023-08-23 17:33:05.821741,2023-08-23 17:33:06.600196,0 days 00:00:00.778455,,1.0,2.0,,LightGBM,,,,,1.0,,,,5.427993960450133e-06,0.9713208610368523,,90.0,,,,,,,,,,101.0,,,,,,,,,COMPLETE,0.0,,,,,,,,,,,,,,,,,,,,
187,187,0.7244627612599353,2023-08-23 17:33:05.837545,2023-08-23 17:33:06.860932,0 days 00:00:01.023387,,1.0,2.0,,LightGBM,,,,,1.0,,,,2.8911730169757137e-06,0.2603055478836849,,90.0,,,,,,,,,,168.0,,,,,,,,,COMPLETE,0.0,,,,,,,,,,,,,,,,,,,,
188,188,0.6767919799498747,2023-08-23 17:33:06.541215,2023-08-23 17:33:07.564777,0 days 00:00:01.023562,,1.0,2.0,,LightGBM,,,,,0.8,,,,7.226440229943794e-05,0.993197180084163,,90.0,,,,,,,,,,182.0,,,,,,,,,COMPLETE,0.0,,,,,,,,,,,,,,,,,,,,
189,189,0.6471676775984373,2023-08-23 17:33:06.708584,2023-08-23 17:33:08.019111,0 days 00:00:01.310527,,1.0,2.0,,LightGBM,,,,,0.8,,,,7.578248839262876e-05,0.2175292051702544,,60.0,,,,,,,,,,185.0,,,,,,,,,COMPLETE,0.0,,,,,,,,,,,,,,,,,,,,
190,190,0.6682615629984051,2023-08-23 17:33:07.015053,2023-08-23 17:33:07.929296,0 days 00:00:00.914243,,1.0,2.0,,LightGBM,,,,,1.0,,,,2.927438235858972e-06,0.06112489394959953,,90.0,,,,,,,,,,165.0,,,,,,,,,COMPLETE,0.0,,,,,,,,,,,,,,,,,,,,
191,191,0.7010012887875483,2023-08-23 17:33:07.062230,2023-08-23 17:33:08.099277,0 days 00:00:01.037047,,1.0,2.0,,LightGBM,,,,,1.0,,,,3.3265002786887464e-06,0.6754854016460572,,90.0,,,,,,,,,,168.0,,,,,,,,,COMPLETE,0.0,,,,,,,,,,,,,,,,,,,,
192,192,0.6803806880142758,2023-08-23 17:33:07.307797,2023-08-23 17:33:08.611451,0 days 00:00:01.303654,,1.0,2.0,,LightGBM,,,,,1.0,,,,2.8739095494937126e-06,0.6687244458508559,,90.0,,,,,,,,,,166.0,,,,,,,,,COMPLETE,0.0,,,,,,,,,,,,,,,,,,,,
193,193,0.6559398496240602,2023-08-23 17:33:07.653046,2023-08-23 17:33:09.013902,0 days 00:00:01.360856,,1.0,2.0,,LightGBM,,,,,1.0,,,,2.664276319479e-06,0.16050888321643883,,90.0,,,,,,,,,,165.0,,,,,,,,,COMPLETE,0.0,,,,,,,,,,,,,,,,,,,,
194,194,0.3946784922394678,2023-08-23 17:33:08.016187,2023-08-23 17:33:08.353604,0 days 00:00:00.337417,2.1067149814502255e-05,,,gblinear,XGBoost,0.7840385264784389,,,,,,,0.0010839575053657087,,,,,,,,,,,,,,,,,,,,0.4977293291939713,,,COMPLETE,0.0,,,,,,,,,,,,,,,,,,,,
195,195,0.3946784922394678,2023-08-23 17:33:08.170554,2023-08-23 17:33:08.482090,0 days 00:00:00.311536,1.1643585339804262e-05,,,gblinear,XGBoost,0.4319614152923017,,,,,,,0.0011632373772764324,,,,,,,,,,,,,,,,,,,,0.5313311839062614,,,COMPLETE,0.0,,,,,,,,,,,,,,,,,,,,
196,196,0.3946784922394678,2023-08-23 17:33:08.190839,2023-08-23 17:33:08.697456,0 days 00:00:00.506617,1.8292002621726512e-05,,,gblinear,XGBoost,0.4359045524931098,,,,,,,0.0008686627171767692,,,,,,,,,,,,,,,,,,,,0.5504862903696166,,,COMPLETE,0.0,,,,,,,,,,,,,,,,,,,,
197,197,0.7010012887875483,2023-08-23 17:33:08.429351,2023-08-23 17:33:09.427446,0 days 00:00:00.998095,,1.0,2.0,,LightGBM,,,,,0.9,,,,9.54163503006202e-06,0.14218384354087252,,90.0,,,,,,,,,,246.0,,,,,,,,,COMPLETE,0.0,,,,,,,,,,,,,,,,,,,,
198,198,0.6976441102756892,2023-08-23 17:33:08.571121,2023-08-23 17:33:09.757186,0 days 00:00:01.186065,,1.0,2.0,,LightGBM,,,,,0.9,,,,8.918383407714863e-06,0.4338399819140309,,100.0,,,,,,,,,,153.0,,,,,,,,,COMPLETE,0.0,,,,,,,,,,,,,,,,,,,,
199,199,0.6597600872410033,2023-08-23 17:33:08.790269,2023-08-23 17:33:09.624359,0 days 00:00:00.834090,,0.6000000000000001,2.0,,LightGBM,,,,,0.9,,,,5.747685454197186e-06,0.42728040365460934,,100.0,,,,,,,,,,191.0,,,,,,,,,COMPLETE,0.0,,,,,,,,,,,,,,,,,,,,
200,200,0.6813725490196079,2023-08-23 17:33:08.791956,2023-08-23 17:33:09.850913,0 days 00:00:01.058957,,0.5,2.0,,LightGBM,,,,,0.9,,,,9.75396838675933e-06,0.4527454490710886,,100.0,,,,,,,,,,175.0,,,,,,,,,COMPLETE,0.0,,,,,,,,,,,,,,,,,,,,
201,201,0.7026143790849673,2023-08-23 17:33:09.065295,2023-08-23 17:33:10.142994,0 days 00:00:01.077699,,0.5,2.0,,LightGBM,,,,,0.9,,,,9.463140641524369e-06,0.2806493683717109,,100.0,,,,,,,,,,176.0,,,,,,,,,COMPLETE,0.0,,,,,,,,,,,,,,,,,,,,
202,202,0.6889952153110048,2023-08-23 17:33:09.513569,2023-08-23 17:33:10.568054,0 days 00:00:01.054485,,1.0,2.0,,LightGBM,,,,,0.7000000000000001,,,,6.103966243728304e-06,0.4212263581198888,,100.0,,,,,,,,,,176.0,,,,,,,,,COMPLETE,0.0,,,,,,,,,,,,,,,,,,,,
203,203,0.6899352318289298,2023-08-23 17:33:09.708449,2023-08-23 17:33:10.730798,0 days 00:00:01.022349,,0.5,1.0,,LightGBM,,,,,0.7000000000000001,,,,1.6951038436355902e-05,0.273070750412977,,100.0,,,,,,,,,,176.0,,,,,,,,,COMPLETE,0.0,,,,,,,,,,,,,,,,,,,,
204,204,0.7063331988705123,2023-08-23 17:33:09.834967,2023-08-23 17:33:10.961763,0 days 00:00:01.126796,,0.9,1.0,,LightGBM,,,,,0.7000000000000001,,,,4.32678463830904e-05,0.26566507343834617,,100.0,,,,,,,,,,172.0,,,,,,,,,COMPLETE,0.0,,,,,,,,,,,,,,,,,,,,
205,205,0.7063331988705123,2023-08-23 17:33:09.957011,2023-08-23 17:33:11.142832,0 days 00:00:01.185821,,0.9,1.0,,LightGBM,,,,,0.7000000000000001,,,,1.680847621564249e-05,0.2647795005946515,,100.0,,,,,,,,,,89.0,,,,,,,,,COMPLETE,0.0,,,,,,,,,,,,,,,,,,,,
206,206,0.7150684931506849,2023-08-23 17:33:10.224631,2023-08-23 17:33:11.315120,0 days 00:00:01.090489,,0.9,1.0,,LightGBM,,,,,0.7000000000000001,,,,1.6969172771292247e-05,0.283827586059781,,100.0,,,,,,,,,,217.0,,,,,,,,,COMPLETE,0.0,,,,,,,,,,,,,,,,,,,,
207,207,0.6682615629984051,2023-08-23 17:33:10.635783,2023-08-23 17:33:11.962262,0 days 00:00:01.326479,,0.9,1.0,,LightGBM,,,,,1.0,,,,1.5822653043531322e-05,0.24500731779509805,,40.0,,,,,,,,,,89.0,,,,,,,,,COMPLETE,0.0,,,,,,,,,,,,,,,,,,,,
208,208,0.7072255239286831,2023-08-23 17:33:10.804159,2023-08-23 17:33:12.214272,0 days 00:00:01.410113,,,,,RandomForestClassifier,,,,,,,,,,,,,,,,,,,,,,,,54.0,8.0,,,,,,COMPLETE,0.0,,,,,,,,,,,,,,,,,,,,
209,209,0.6670934699103712,2023-08-23 17:33:11.050065,2023-08-23 17:33:12.397949,0 days 00:00:01.347884,,,,,RandomForestClassifier,,,,,,,,,,,,,,,,,,,,,,,,54.0,8.0,,,,,,COMPLETE,0.0,,,,,,,,,,,,,,,,,,,,
210,210,0.6728564180618974,2023-08-23 17:33:11.241162,2023-08-23 17:33:13.092932,0 days 00:00:01.851770,,,,,RandomForestClassifier,,,,,,,,,,,,,,,,,,,,,,,,58.0,9.0,,,,,,COMPLETE,0.0,,,,,,,,,,,,,,,,,,,,
211,211,0.7097288676236045,2023-08-23 17:33:11.404475,2023-08-23 17:33:12.689623,0 days 00:00:01.285148,,0.9,1.0,,LightGBM,,,,,1.0,,,,2.763250706871139e-05,0.15273659011363866,,90.0,,,,,,,,,,217.0,,,,,,,,,COMPLETE,0.0,,,,,,,,,,,,,,,,,,,,
212,212,0.640459462473514,2023-08-23 17:33:12.104630,2023-08-23 17:33:12.413037,0 days 00:00:00.308407,,,,,DecisionTreeClassifier,,log_loss,4.0,,,,,,,,,,,,,,,,,,,,,,,,,,,,COMPLETE,0.0,,,,,,,,,,,,,,,,,,,,
213,213,0.6638515274736733,2023-08-23 17:33:12.339592,2023-08-23 17:33:14.073467,0 days 00:00:01.733875,,,,,RandomForestClassifier,,,,,,,,,,,,,,,,,,,,,,,,59.0,8.0,,,,,,COMPLETE,0.0,,,,,,,,,,,,,,,,,,,,
214,214,0.6855385257011782,2023-08-23 17:33:12.542712,2023-08-23 17:33:14.508876,0 days 00:00:01.966164,,,,,RandomForestClassifier,,,,,,,,,,,,,,,,,,,,,,,,63.0,7.0,,,,,,COMPLETE,0.0,,,,,,,,,,,,,,,,,,,,
215,215,0.6892872385830133,2023-08-23 17:33:12.547014,2023-08-23 17:33:14.151789,0 days 00:00:01.604775,,,,,RandomForestClassifier,,,,,,,,,,,,,,,,,,,,,,,,63.0,6.0,,,,,,COMPLETE,0.0,,,,,,,,,,,,,,,,,,,,
216,216,0.7097288676236045,2023-08-23 17:33:12.801078,2023-08-23 17:33:13.700933,0 days 00:00:00.899855,,0.9,1.0,,LightGBM,,,,,1.0,,,,2.631288268767707e-05,0.10751861738382064,,90.0,,,,,,,,,,216.0,,,,,,,,,COMPLETE,0.0,,,,,,,,,,,,,,,,,,,,
217,217,0.7097288676236045,2023-08-23 17:33:13.182840,2023-08-23 17:33:13.999985,0 days 00:00:00.817145,,0.9,1.0,,LightGBM,,,,,1.0,,,,2.5016824196379215e-05,0.07129510403340067,,90.0,,,,,,,,,,218.0,,,,,,,,,COMPLETE,0.0,,,,,,,,,,,,,,,,,,,,
218,218,0.7063331988705123,2023-08-23 17:33:13.812680,2023-08-23 17:33:14.985231,0 days 00:00:01.172551,,0.9,1.0,,LightGBM,,,,,1.0,,,,2.6112896408512448e-05,0.11625448550214301,,90.0,,,,,,,,,,216.0,,,,,,,,,COMPLETE,0.0,,,,,,,,,,,,,,,,,,,,
219,219,0.7063331988705123,2023-08-23 17:33:14.061858,2023-08-23 17:33:15.238732,0 days 00:00:01.176874,,0.9,1.0,,LightGBM,,,,,1.0,,,,2.6436129178372926e-05,0.10917632953076567,,90.0,,,,,,,,,,226.0,,,,,,,,,COMPLETE,0.0,,,,,,,,,,,,,,,,,,,,
220,220,0.7063331988705123,2023-08-23 17:33:14.215512,2023-08-23 17:33:15.385733,0 days 00:00:01.170221,,0.9,1.0,,LightGBM,,,,,1.0,,,,2.686231611770302e-05,0.11207626883850486,,90.0,,,,,,,,,,217.0,,,,,,,,,COMPLETE,0.0,,,,,,,,,,,,,,,,,,,,
221,221,0.7063331988705123,2023-08-23 17:33:14.236714,2023-08-23 17:33:15.477542,0 days 00:00:01.240828,,0.9,1.0,,LightGBM,,,,,1.0,,,,2.7032696910574827e-05,0.11469494292040576,,90.0,,,,,,,,,,214.0,,,,,,,,,COMPLETE,0.0,,,,,,,,,,,,,,,,,,,,
222,222,0.7063331988705123,2023-08-23 17:33:14.624766,2023-08-23 17:33:16.027433,0 days 00:00:01.402667,,0.9,1.0,,LightGBM,,,,,1.0,,,,4.5308832070989835e-05,0.1148418778271491,,90.0,,,,,,,,,,215.0,,,,,,,,,COMPLETE,0.0,,,,,,,,,,,,,,,,,,,,
223,223,0.6976441102756892,2023-08-23 17:33:15.117482,2023-08-23 17:33:16.404906,0 days 00:00:01.287424,,0.9,1.0,,LightGBM,,,,,1.0,,,,0.00010604840642514424,0.16345178653255896,,90.0,,,,,,,,,,226.0,,,,,,,,,COMPLETE,0.0,,,,,,,,,,,,,,,,,,,,
224,224,0.7097288676236045,2023-08-23 17:33:15.332628,2023-08-23 17:33:16.691966,0 days 00:00:01.359338,,0.9,1.0,,LightGBM,,,,,1.0,,,,4.6107861367247004e-05,0.15482716673691982,,90.0,,,,,,,,,,235.0,,,,,,,,,COMPLETE,0.0,,,,,,,,,,,,,,,,,,,,
225,225,0.6559398496240602,2023-08-23 17:33:15.459078,2023-08-23 17:33:16.816818,0 days 00:00:01.357740,,0.9,1.0,,LightGBM,,,,,1.0,,,,5.0580552010782706e-05,0.15458559938788569,,80.0,,,,,,,,,,235.0,,,,,,,,,COMPLETE,0.0,,,,,,,,,,,,,,,,,,,,
226,226,0.6685514547136835,2023-08-23 17:33:15.579927,2023-08-23 17:33:16.998472,0 days 00:00:01.418545,,1.0,1.0,,LightGBM,,,,,1.0,,,,5.633835140574049e-05,0.05900491479632431,,80.0,,,,,,,,,,234.0,,,,,,,,,COMPLETE,0.0,,,,,,,,,,,,,,,,,,,,
227,227,0.6517503805175038,2023-08-23 17:33:15.785913,2023-08-23 17:33:17.258136,0 days 00:00:01.472223,,1.0,1.0,,LightGBM,,,,,1.0,,,,4.5715768035427295e-05,0.17934546405974264,,80.0,,,,,,,,,,226.0,,,,,,,,,COMPLETE,0.0,,,,,,,,,,,,,,,,,,,,
228,228,0.6836424295947405,2023-08-23 17:33:16.110111,2023-08-23 17:33:17.558246,0 days 00:00:01.448135,,0.9,1.0,,LightGBM,,,,,1.0,,,,5.9125559078912865e-05,0.07044059956006042,,80.0,,,,,,,,,,233.0,,,,,,,,,COMPLETE,0.0,,,,,,,,,,,,,,,,,,,,
229,229,0.6767919799498747,2023-08-23 17:33:16.500267,2023-08-23 17:33:17.926799,0 days 00:00:01.426532,,0.9,1.0,,LightGBM,,,,,1.0,,,,5.678080713781388e-05,0.06315837210475653,,80.0,,,,,,,,,,235.0,,,,,,,,,COMPLETE,0.0,,,,,,,,,,,,,,,,,,,,
230,230,0.6853569987898347,2023-08-23 17:33:16.763695,2023-08-23 17:33:18.074831,0 days 00:00:01.311136,,1.0,1.0,,LightGBM,,,,,1.0,,,,6.170525680933731e-05,0.06916196840943807,,80.0,,,,,,,,,,140.0,,,,,,,,,COMPLETE,0.0,,,,,,,,,,,,,,,,,,,,
231,231,0.6889952153110048,2023-08-23 17:33:16.911490,2023-08-23 17:33:18.151753,0 days 00:00:01.240263,,1.0,1.0,,LightGBM,,,,,1.0,,,,1.8529065748344118e-05,0.07141278632929521,,90.0,,,,,,,,,,218.0,,,,,,,,,COMPLETE,0.0,,,,,,,,,,,,,,,,,,,,
232,232,0.7097288676236045,2023-08-23 17:33:17.100696,2023-08-23 17:33:18.651568,0 days 00:00:01.550872,,1.0,1.0,,LightGBM,,,,,0.9,,,,1.824343859555706e-05,0.06959959295243809,,90.0,,,,,,,,,,224.0,,,,,,,,,COMPLETE,0.0,,,,,,,,,,,,,,,,,,,,
233,233,0.6767919799498747,2023-08-23 17:33:17.352175,2023-08-23 17:33:18.789033,0 days 00:00:01.436858,,0.9,1.0,,LightGBM,,,,,0.9,,,,2.0075472814931064e-05,0.04650882328286036,,100.0,,,,,,,,,,140.0,,,,,,,,,COMPLETE,0.0,,,,,,,,,,,,,,,,,,,,
234,234,0.7216218895608209,2023-08-23 17:33:17.633828,2023-08-23 17:33:19.213196,0 days 00:00:01.579368,,1.0,1.0,,LightGBM,,,,,0.9,,,,1.9768411801991088e-05,0.047342349117469755,,100.0,,,,,,,,,,244.0,,,,,,,,,COMPLETE,0.0,,,,,,,,,,,,,,,,,,,,
235,235,0.3696969696969697,2023-08-23 17:33:17.998073,2023-08-23 17:33:18.497813,0 days 00:00:00.499740,,,,,SVC,,,,,,,,,,,,,,,,,,,,,,,,,,,,,0.03495347503265526,rbf,COMPLETE,0.0,,,,,,,,,,,,,,,,,,,,
236,236,0.3696969696969697,2023-08-23 17:33:18.231681,2023-08-23 17:33:18.426187,0 days 00:00:00.194506,,,,,SVC,,,,,,,,,,,,,,,,,,,,,,,,,,,,,0.019144080876776767,rbf,COMPLETE,0.0,,,,,,,,,,,,,,,,,,,,
237,237,0.7097288676236045,2023-08-23 17:33:18.269718,2023-08-23 17:33:19.559744,0 days 00:00:01.290026,,1.0,1.0,,LightGBM,,,,,0.9,,,,0.0001990858469633972,0.7443126754101299,,100.0,,,,,,,,,,126.0,,,,,,,,,COMPLETE,0.0,,,,,,,,,,,,,,,,,,,,
238,238,0.7327027860594222,2023-08-23 17:33:18.546522,2023-08-23 17:33:19.772070,0 days 00:00:01.225548,,0.8,1.0,,LightGBM,,,,,0.9,,,,0.00019867175621906432,0.04033294114016188,,90.0,,,,,,,,,,36.0,,,,,,,,,COMPLETE,1.0,0.7596153846153846,0.7264582539077392,0.7791353383458646,0.7327027860594222,0.5348837209302325,0.8214285714285714,0.647887323943662,0.9180327868852459,0.7368421052631579,0.8175182481751824,0.5911439114391144,0.5854907306434024,0.5970196724882183,0.5758869046811934,0.4152671755725191,0.6139954853273137,0.49544626593806923,0.7557142857142857,0.5800438596491229,0.6563275434243175
239,239,0.6976441102756892,2023-08-23 17:33:18.549370,2023-08-23 17:33:20.123218,0 days 00:00:01.573848,,0.9,1.0,,LightGBM,,,,,0.9,,,,9.38568561504329e-05,0.04804927866330652,,90.0,,,,,,,,,,221.0,,,,,,,,,COMPLETE,0.0,,,,,,,,,,,,,,,,,,,,
240,240,0.7216218895608209,2023-08-23 17:33:18.717091,2023-08-23 17:33:20.035053,0 days 00:00:01.317962,,0.9,1.0,,LightGBM,,,,,1.0,,,,0.00010444240204685139,0.04462611233450411,,90.0,,,,,,,,,,245.0,,,,,,,,,COMPLETE,0.0,,,,,,,,,,,,,,,,,,,,
241,241,0.6923076923076923,2023-08-23 17:33:18.858752,2023-08-23 17:33:19.920042,0 days 00:00:01.061290,,0.9,1.0,,LightGBM,,,,,0.8,,,,0.00023182744395149011,0.681167211215696,,90.0,,,,,,,,,,126.0,,,,,,,,,COMPLETE,0.0,,,,,,,,,,,,,,,,,,,,
242,242,0.664380798709157,2023-08-23 17:33:19.315127,2023-08-23 17:33:22.094844,0 days 00:00:02.779717,,1.0,1.0,,LightGBM,,,,,0.9,,,,0.0002004955922042266,0.6986298985213596,,10.0,,,,,,,,,,246.0,,,,,,,,,COMPLETE,0.0,,,,,,,,,,,,,,,,,,,,
243,243,0.6682615629984051,2023-08-23 17:33:19.645785,2023-08-23 17:33:21.063887,0 days 00:00:01.418102,,1.0,1.0,,LightGBM,,,,,0.8,,,,1.2400929064800002e-05,0.04196842151882582,,100.0,,,,,,,,,,245.0,,,,,,,,,COMPLETE,0.0,,,,,,,,,,,,,,,,,,,,
244,244,0.6853569987898347,2023-08-23 17:33:19.885869,2023-08-23 17:33:20.905000,0 days 00:00:01.019131,,0.8,2.0,,LightGBM,,,,,0.9,,,,0.00019210089412181547,0.037797902063752595,,100.0,,,,,,,,,,51.0,,,,,,,,,COMPLETE,0.0,,,,,,,,,,,,,,,,,,,,
245,245,0.6976441102756892,2023-08-23 17:33:20.005565,2023-08-23 17:33:21.130956,0 days 00:00:01.125391,,1.0,2.0,,LightGBM,,,,,0.9,,,,0.00010556322008578592,0.3523456185225664,,100.0,,,,,,,,,,72.0,,,,,,,,,COMPLETE,0.0,,,,,,,,,,,,,,,,,,,,
246,246,0.6853569987898347,2023-08-23 17:33:20.105507,2023-08-23 17:33:21.187069,0 days 00:00:01.081562,,0.8,2.0,,LightGBM,,,,,0.9,,,,0.0001379512450873178,0.032144418718481706,,100.0,,,,,,,,,,245.0,,,,,,,,,COMPLETE,0.0,,,,,,,,,,,,,,,,,,,,
247,247,0.6853569987898347,2023-08-23 17:33:20.209717,2023-08-23 17:33:21.397255,0 days 00:00:01.187538,,0.8,2.0,,LightGBM,,,,,0.9,,,,0.0001360720397888297,0.023688771895716335,,100.0,,,,,,,,,,36.0,,,,,,,,,COMPLETE,0.0,,,,,,,,,,,,,,,,,,,,
248,248,0.6853569987898347,2023-08-23 17:33:21.046163,2023-08-23 17:33:22.387272,0 days 00:00:01.341109,,1.0,1.0,,LightGBM,,,,,0.9,,,,0.00013207337786386958,0.024773237474820315,,10.0,,,,,,,,,,26.0,,,,,,,,,COMPLETE,0.0,,,,,,,,,,,,,,,,,,,,
249,249,0.6889952153110048,2023-08-23 17:33:21.172613,2023-08-23 17:33:21.827270,0 days 00:00:00.654657,,1.0,1.0,,LightGBM,,,,,0.9,,,,0.00034170538065735317,0.19134933341627874,,100.0,,,,,,,,,,256.0,,,,,,,,,COMPLETE,0.0,,,,,,,,,,,,,,,,,,,,
