,number,value,datetime_start,datetime_complete,duration,params_alpha,params_bagging_fraction,params_bagging_freq,params_booster,params_classifier,params_colsample_bytree,params_dct_criterion,params_dct_max_depth,params_eta,params_feature_fraction,params_gamma,params_grow_policy,params_lambda,params_lambda_l1,params_lambda_l2,params_max_depth,params_min_child_samples,params_min_child_weight,params_mlp_activation,params_mlp_solver,params_n_layers,params_n_units_l_0,params_n_units_l_1,params_n_units_l_2,params_n_units_l_3,params_normalize_type,params_num_leaves,params_rate_drop,params_rf_estimator,params_rf_max_depth,params_sample_type,params_skip_drop,params_subsample,params_svc_c,params_svc_kernel,state,best_trial,dev_acc,dev_recall_macro,dev_precision_macro,dev_f1_macro,dev_recall_0,dev_precision_0,dev_f1_0,dev_recall_1,dev_precision_1,dev_f1_1,test_acc,test_recall_macro,test_precision_macro,test_f1_macro,test_recall_0,test_precision_0,test_f1_0,test_recall_1,test_precision_1,test_f1_1
0,0,0.396711986681465,2023-08-23 18:19:47.483599,2023-08-23 18:19:54.408055,0 days 00:00:06.924456,,,,,SVC,,,,,,,,,,,,,,,,,,,,,,,,,,,,,10.606080553008233,linear,COMPLETE,0.0,,,,,,,,,,,,,,,,,,,,
1,1,0.5741036213576782,2023-08-23 18:19:47.485970,2023-08-23 18:19:50.687685,0 days 00:00:03.201715,9.172884533555552e-05,,,dart,XGBoost,0.6474693342757545,,,1.3626600038334982e-06,,3.536653604202269e-07,lossguide,0.10141434974173341,,,5.0,,6.0,,,,,,,,tree,,0.08199023079382367,,,uniform,0.2549392716495923,0.20015737690109134,,,COMPLETE,0.0,,,,,,,,,,,,,,,,,,,,
2,2,0.5506975126820487,2023-08-23 18:19:47.486977,2023-08-23 18:19:47.956527,0 days 00:00:00.469550,,,,,DecisionTreeClassifier,,entropy,32.0,,,,,,,,,,,,,,,,,,,,,,,,,,,,COMPLETE,0.0,,,,,,,,,,,,,,,,,,,,
3,3,0.551947468851723,2023-08-23 18:19:47.490509,2023-08-23 18:24:28.527896,0 days 00:04:41.037387,,,,,MLPClassifier,,,,,,,,,,,,,,relu,lbfgs,4.0,20.0,10.0,100.0,10.0,,,,,,,,,,,COMPLETE,0.0,,,,,,,,,,,,,,,,,,,,
4,4,0.3573487031700288,2023-08-23 18:19:47.497869,2023-08-23 18:19:55.310803,0 days 00:00:07.812934,,,,,SVC,,,,,,,,,,,,,,,,,,,,,,,,,,,,,0.0013299388585529884,rbf,COMPLETE,0.0,,,,,,,,,,,,,,,,,,,,
5,5,0.5440204475135644,2023-08-23 18:19:47.528359,2023-08-23 18:19:47.809661,0 days 00:00:00.281302,,,,,DecisionTreeClassifier,,log_loss,11.0,,,,,,,,,,,,,,,,,,,,,,,,,,,,COMPLETE,0.0,,,,,,,,,,,,,,,,,,,,
6,6,0.5421578019892354,2023-08-23 18:19:47.530217,2023-08-23 18:19:48.051627,0 days 00:00:00.521410,,,,,DecisionTreeClassifier,,entropy,19.0,,,,,,,,,,,,,,,,,,,,,,,,,,,,COMPLETE,0.0,,,,,,,,,,,,,,,,,,,,
7,7,0.5858997560783696,2023-08-23 18:19:47.534540,2023-08-23 18:19:53.827371,0 days 00:00:06.292831,,,,,RandomForestClassifier,,,,,,,,,,,,,,,,,,,,,,,,81.0,20.0,,,,,,COMPLETE,0.0,,,,,,,,,,,,,,,,,,,,
8,8,0.3573487031700288,2023-08-23 18:19:47.900855,2023-08-23 18:22:13.459114,0 days 00:02:25.558259,,,,,MLPClassifier,,,,,,,,,,,,,,logistic,adam,3.0,80.0,50.0,30.0,,,,,,,,,,,,COMPLETE,0.0,,,,,,,,,,,,,,,,,,,,
9,9,0.5718624596742465,2023-08-23 18:19:48.124050,2023-08-23 18:19:53.114689,0 days 00:00:04.990639,,,,,RandomForestClassifier,,,,,,,,,,,,,,,,,,,,,,,,59.0,26.0,,,,,,COMPLETE,0.0,,,,,,,,,,,,,,,,,,,,
10,10,0.5764268699627231,2023-08-23 18:19:48.124533,2023-08-23 18:19:49.462241,0 days 00:00:01.337708,,0.4,3.0,,LightGBM,,,,,0.6000000000000001,,,,0.4322006864458859,3.470075744561185e-08,,50.0,,,,,,,,,,129.0,,,,,,,,,COMPLETE,0.0,,,,,,,,,,,,,,,,,,,,
11,11,0.5839806273002808,2023-08-23 18:19:49.528774,2023-08-23 18:19:50.578056,0 days 00:00:01.049282,,0.6000000000000001,2.0,,LightGBM,,,,,0.4,,,,0.00027415228881070224,1.3997763686456335e-08,,90.0,,,,,,,,,,231.0,,,,,,,,,COMPLETE,0.0,,,,,,,,,,,,,,,,,,,,
12,12,0.5716416629107377,2023-08-23 18:19:50.657720,2023-08-23 18:19:50.901792,0 days 00:00:00.244072,0.17798297221199186,,,dart,XGBoost,0.502015532828549,,,0.00029662560369728304,,0.0004656984858733224,lossguide,2.264220606927925e-07,,,7.0,,6.0,,,,,,,,forest,,0.5443575666457967,,,uniform,0.00026372533839277997,0.4335668719270886,,,COMPLETE,0.0,,,,,,,,,,,,,,,,,,,,
13,13,0.5418023634201663,2023-08-23 18:19:50.808130,2023-08-23 18:19:51.308615,0 days 00:00:00.500485,,,,,DecisionTreeClassifier,,log_loss,21.0,,,,,,,,,,,,,,,,,,,,,,,,,,,,COMPLETE,0.0,,,,,,,,,,,,,,,,,,,,
14,14,0.5521249583749583,2023-08-23 18:19:50.961831,2023-08-23 18:19:51.094415,0 days 00:00:00.132584,,,,,DecisionTreeClassifier,,gini,10.0,,,,,,,,,,,,,,,,,,,,,,,,,,,,COMPLETE,0.0,,,,,,,,,,,,,,,,,,,,
15,15,0.3573487031700288,2023-08-23 18:19:51.213353,2023-08-23 18:19:56.888872,0 days 00:00:05.675519,,,,,SVC,,,,,,,,,,,,,,,,,,,,,,,,,,,,,0.2991456252688317,poly,COMPLETE,0.0,,,,,,,,,,,,,,,,,,,,
16,16,0.5843983744237031,2023-08-23 18:19:51.418959,2023-08-23 18:19:54.298218,0 days 00:00:02.879259,,,,,RandomForestClassifier,,,,,,,,,,,,,,,,,,,,,,,,90.0,6.0,,,,,,COMPLETE,0.0,,,,,,,,,,,,,,,,,,,,
17,17,0.5856545997145453,2023-08-23 18:19:53.206854,2023-08-23 18:19:54.715790,0 days 00:00:01.508936,,0.8,1.0,,LightGBM,,,,,0.4,,,,9.182169130064109e-07,1.6280234261918253e-08,,100.0,,,,,,,,,,256.0,,,,,,,,,COMPLETE,0.0,,,,,,,,,,,,,,,,,,,,
18,18,0.5843451399251289,2023-08-23 18:19:53.916725,2023-08-23 18:19:59.278044,0 days 00:00:05.361319,,,,,RandomForestClassifier,,,,,,,,,,,,,,,,,,,,,,,,97.0,10.0,,,,,,COMPLETE,0.0,,,,,,,,,,,,,,,,,,,,
19,19,0.5736749032165559,2023-08-23 18:19:54.390180,2023-08-23 18:19:57.500963,0 days 00:00:03.110783,,,,,RandomForestClassifier,,,,,,,,,,,,,,,,,,,,,,,,99.0,5.0,,,,,,COMPLETE,0.0,,,,,,,,,,,,,,,,,,,,
20,20,0.5854530143804211,2023-08-23 18:19:54.515560,2023-08-23 18:19:58.523663,0 days 00:00:04.008103,,,,,RandomForestClassifier,,,,,,,,,,,,,,,,,,,,,,,,100.0,7.0,,,,,,COMPLETE,0.0,,,,,,,,,,,,,,,,,,,,
21,21,0.5734087023762533,2023-08-23 18:19:54.830197,2023-08-23 18:25:22.532195,0 days 00:05:27.701998,,,,,MLPClassifier,,,,,,,,,,,,,,relu,lbfgs,3.0,60.0,70.0,40.0,,,,,,,,,,,,COMPLETE,0.0,,,,,,,,,,,,,,,,,,,,
22,22,0.3573487031700288,2023-08-23 18:19:55.404520,2023-08-23 18:19:58.453930,0 days 00:00:03.049410,,,,,MLPClassifier,,,,,,,,,,,,,,logistic,lbfgs,4.0,60.0,40.0,10.0,70.0,,,,,,,,,,,COMPLETE,0.0,,,,,,,,,,,,,,,,,,,,
23,23,0.46128307151715586,2023-08-23 18:19:56.969932,2023-08-23 18:23:06.180375,0 days 00:03:09.210443,,,,,MLPClassifier,,,,,,,,,,,,,,identity,adam,3.0,60.0,20.0,70.0,,,,,,,,,,,,COMPLETE,0.0,,,,,,,,,,,,,,,,,,,,
24,24,0.3573487031700288,2023-08-23 18:19:57.630876,2023-08-23 18:21:30.697222,0 days 00:01:33.066346,,,,,MLPClassifier,,,,,,,,,,,,,,identity,sgd,2.0,90.0,100.0,,,,,,,,,,,,,COMPLETE,0.0,,,,,,,,,,,,,,,,,,,,
25,25,0.5747257958106547,2023-08-23 18:19:58.606835,2023-08-23 18:20:00.566835,0 days 00:00:01.960000,,1.0,1.0,,LightGBM,,,,,1.0,,,,1.2355663873904105e-08,0.10725378485067139,,100.0,,,,,,,,,,251.0,,,,,,,,,COMPLETE,0.0,,,,,,,,,,,,,,,,,,,,
26,26,0.5823145836961359,2023-08-23 18:19:58.612940,2023-08-23 18:20:00.282943,0 days 00:00:01.670003,,1.0,1.0,,LightGBM,,,,,1.0,,,,2.637911358720277e-08,0.3097380792639305,,100.0,,,,,,,,,,255.0,,,,,,,,,COMPLETE,0.0,,,,,,,,,,,,,,,,,,,,
27,27,0.5734219491790875,2023-08-23 18:19:59.358341,2023-08-23 18:20:01.271135,0 days 00:00:01.912794,,1.0,1.0,,LightGBM,,,,,1.0,,,,1.8535655188834253e-08,0.32247191000622544,,100.0,,,,,,,,,,256.0,,,,,,,,,COMPLETE,0.0,,,,,,,,,,,,,,,,,,,,
28,28,0.5057715393849848,2023-08-23 18:20:00.442832,2023-08-23 18:20:02.055300,0 days 00:00:01.612468,,,,,RandomForestClassifier,,,,,,,,,,,,,,,,,,,,,,,,64.0,2.0,,,,,,COMPLETE,0.0,,,,,,,,,,,,,,,,,,,,
29,29,0.5092805204745503,2023-08-23 18:20:00.636723,2023-08-23 18:20:02.463119,0 days 00:00:01.826396,,,,,RandomForestClassifier,,,,,,,,,,,,,,,,,,,,,,,,74.0,2.0,,,,,,COMPLETE,0.0,,,,,,,,,,,,,,,,,,,,
30,30,0.5262254568439906,2023-08-23 18:20:01.364771,2023-08-23 18:20:02.952680,0 days 00:00:01.587909,,,,,RandomForestClassifier,,,,,,,,,,,,,,,,,,,,,,,,62.0,2.0,,,,,,COMPLETE,0.0,,,,,,,,,,,,,,,,,,,,
31,31,0.5111336107962648,2023-08-23 18:20:02.122406,2023-08-23 18:20:11.081174,0 days 00:00:08.958768,,,,,MLPClassifier,,,,,,,,,,,,,,identity,adam,1.0,10.0,,,,,,,,,,,,,,COMPLETE,0.0,,,,,,,,,,,,,,,,,,,,
32,32,0.3573487031700288,2023-08-23 18:20:02.556705,2023-08-23 18:20:04.828794,0 days 00:00:02.272089,,,,,MLPClassifier,,,,,,,,,,,,,,tanh,sgd,1.0,10.0,,,,,,,,,,,,,,COMPLETE,0.0,,,,,,,,,,,,,,,,,,,,
33,33,0.5143907388160767,2023-08-23 18:20:03.027840,2023-08-23 18:20:11.476499,0 days 00:00:08.448659,,,,,MLPClassifier,,,,,,,,,,,,,,identity,adam,1.0,10.0,,,,,,,,,,,,,,COMPLETE,0.0,,,,,,,,,,,,,,,,,,,,
34,34,0.5513499426665276,2023-08-23 18:20:04.937443,2023-08-23 18:20:07.613086,0 days 00:00:02.675643,,,,,RandomForestClassifier,,,,,,,,,,,,,,,,,,,,,,,,26.0,25.0,,,,,,COMPLETE,0.0,,,,,,,,,,,,,,,,,,,,
35,35,0.45392615941698633,2023-08-23 18:20:07.694514,2023-08-23 18:25:09.482985,0 days 00:05:01.788471,,,,,MLPClassifier,,,,,,,,,,,,,,identity,adam,4.0,100.0,100.0,90.0,10.0,,,,,,,,,,,COMPLETE,0.0,,,,,,,,,,,,,,,,,,,,
36,36,0.5140050017863523,2023-08-23 18:20:11.197974,2023-08-23 18:20:11.326313,0 days 00:00:00.128339,2.937117177273574e-08,,,gblinear,XGBoost,0.9810311239699067,,,,,,,1.6633319196425524e-08,,,,,,,,,,,,,,,,,,,,0.9535121548494737,,,COMPLETE,0.0,,,,,,,,,,,,,,,,,,,,
37,37,0.37930202009443675,2023-08-23 18:20:11.449424,2023-08-23 18:20:17.310696,0 days 00:00:05.861272,,,,,SVC,,,,,,,,,,,,,,,,,,,,,,,,,,,,,621.5791780403,poly,COMPLETE,0.0,,,,,,,,,,,,,,,,,,,,
38,38,0.5899913962780062,2023-08-23 18:20:11.621850,2023-08-23 18:20:15.072539,0 days 00:00:03.450689,,,,,RandomForestClassifier,,,,,,,,,,,,,,,,,,,,,,,,86.0,8.0,,,,,,COMPLETE,0.0,,,,,,,,,,,,,,,,,,,,
39,39,0.5899913962780062,2023-08-23 18:20:15.162695,2023-08-23 18:20:19.693621,0 days 00:00:04.530926,,,,,RandomForestClassifier,,,,,,,,,,,,,,,,,,,,,,,,82.0,11.0,,,,,,COMPLETE,0.0,,,,,,,,,,,,,,,,,,,,
40,40,0.5793233182311952,2023-08-23 18:20:17.416000,2023-08-23 18:20:22.030277,0 days 00:00:04.614277,,,,,RandomForestClassifier,,,,,,,,,,,,,,,,,,,,,,,,81.0,12.0,,,,,,COMPLETE,0.0,,,,,,,,,,,,,,,,,,,,
41,41,0.5640021653781265,2023-08-23 18:20:19.801707,2023-08-23 18:20:24.969203,0 days 00:00:05.167496,,,,,RandomForestClassifier,,,,,,,,,,,,,,,,,,,,,,,,74.0,14.0,,,,,,COMPLETE,0.0,,,,,,,,,,,,,,,,,,,,
42,42,0.564843811472185,2023-08-23 18:20:22.131461,2023-08-23 18:20:27.367707,0 days 00:00:05.236246,,,,,RandomForestClassifier,,,,,,,,,,,,,,,,,,,,,,,,79.0,14.0,,,,,,COMPLETE,0.0,,,,,,,,,,,,,,,,,,,,
43,43,0.5601920332165564,2023-08-23 18:20:25.057616,2023-08-23 18:20:25.321960,0 days 00:00:00.264344,0.5400723477175349,,,gbtree,XGBoost,0.36775871895893936,,,0.3061688550078739,,0.8159202960125685,depthwise,0.23665317683184742,,,9.0,,10.0,,,,,,,,,,,,,,,0.8455145781684157,,,COMPLETE,0.0,,,,,,,,,,,,,,,,,,,,
44,44,0.5831558061821219,2023-08-23 18:20:25.404666,2023-08-23 18:20:26.321060,0 days 00:00:00.916394,,0.7000000000000001,2.0,,LightGBM,,,,,0.4,,,,1.3613967111167088e-05,2.285089306750772e-06,,10.0,,,,,,,,,,17.0,,,,,,,,,COMPLETE,0.0,,,,,,,,,,,,,,,,,,,,
45,45,0.5728277626529341,2023-08-23 18:20:26.410702,2023-08-23 18:20:28.821664,0 days 00:00:02.410962,,,,,RandomForestClassifier,,,,,,,,,,,,,,,,,,,,,,,,40.0,17.0,,,,,,COMPLETE,0.0,,,,,,,,,,,,,,,,,,,,
46,46,0.3573487031700288,2023-08-23 18:20:27.492126,2023-08-23 18:20:31.892315,0 days 00:00:04.400189,,,,,SVC,,,,,,,,,,,,,,,,,,,,,,,,,,,,,0.00139079093808464,linear,COMPLETE,0.0,,,,,,,,,,,,,,,,,,,,
47,47,0.3573487031700288,2023-08-23 18:20:28.978798,2023-08-23 18:20:34.928590,0 days 00:00:05.949792,,,,,SVC,,,,,,,,,,,,,,,,,,,,,,,,,,,,,0.0015269575436253078,rbf,COMPLETE,0.0,,,,,,,,,,,,,,,,,,,,
48,48,0.5788703106433543,2023-08-23 18:20:31.951091,2023-08-23 18:20:36.355469,0 days 00:00:04.404378,,,,,RandomForestClassifier,,,,,,,,,,,,,,,,,,,,,,,,88.0,8.0,,,,,,COMPLETE,0.0,,,,,,,,,,,,,,,,,,,,
49,49,0.580410686035939,2023-08-23 18:20:35.038483,2023-08-23 18:20:39.299521,0 days 00:00:04.261038,,,,,RandomForestClassifier,,,,,,,,,,,,,,,,,,,,,,,,89.0,9.0,,,,,,COMPLETE,0.0,,,,,,,,,,,,,,,,,,,,
50,50,0.5839678670286911,2023-08-23 18:20:36.444832,2023-08-23 18:20:40.877111,0 days 00:00:04.432279,,,,,RandomForestClassifier,,,,,,,,,,,,,,,,,,,,,,,,88.0,8.0,,,,,,COMPLETE,0.0,,,,,,,,,,,,,,,,,,,,
51,51,0.5789000549214545,2023-08-23 18:20:39.387239,2023-08-23 18:20:44.207116,0 days 00:00:04.819877,,,,,RandomForestClassifier,,,,,,,,,,,,,,,,,,,,,,,,100.0,7.0,,,,,,COMPLETE,0.0,,,,,,,,,,,,,,,,,,,,
52,52,0.5909465404405478,2023-08-23 18:20:40.981122,2023-08-23 18:20:43.491105,0 days 00:00:02.509983,,0.8,3.0,,LightGBM,,,,,0.7000000000000001,,,,4.942812409087565e-06,2.400272458992623e-05,,60.0,,,,,,,,,,157.0,,,,,,,,,COMPLETE,0.0,,,,,,,,,,,,,,,,,,,,
53,53,0.5909465404405478,2023-08-23 18:20:43.581825,2023-08-23 18:20:46.153533,0 days 00:00:02.571708,,0.8,3.0,,LightGBM,,,,,0.7000000000000001,,,,3.848873022880029e-06,4.8317852732547956e-05,,60.0,,,,,,,,,,161.0,,,,,,,,,COMPLETE,0.0,,,,,,,,,,,,,,,,,,,,
54,54,0.5909465404405478,2023-08-23 18:20:44.274552,2023-08-23 18:20:47.185234,0 days 00:00:02.910682,,0.8,3.0,,LightGBM,,,,,0.7000000000000001,,,,7.000111860617003e-06,4.8157364132499225e-05,,60.0,,,,,,,,,,144.0,,,,,,,,,COMPLETE,0.0,,,,,,,,,,,,,,,,,,,,
55,55,0.5909465404405478,2023-08-23 18:20:46.212715,2023-08-23 18:20:48.968251,0 days 00:00:02.755536,,0.8,3.0,,LightGBM,,,,,0.7000000000000001,,,,1.933041307792545e-05,0.0001338910771383657,,60.0,,,,,,,,,,155.0,,,,,,,,,COMPLETE,0.0,,,,,,,,,,,,,,,,,,,,
56,56,0.5909465404405478,2023-08-23 18:20:47.288635,2023-08-23 18:20:50.161642,0 days 00:00:02.873007,,0.8,3.0,,LightGBM,,,,,0.7000000000000001,,,,9.634668089656762e-06,7.904729141402935e-05,,60.0,,,,,,,,,,152.0,,,,,,,,,COMPLETE,0.0,,,,,,,,,,,,,,,,,,,,
57,57,0.5909465404405478,2023-08-23 18:20:49.065406,2023-08-23 18:20:51.436758,0 days 00:00:02.371352,,0.8,3.0,,LightGBM,,,,,0.7000000000000001,,,,9.271077126240542e-06,9.269995965461448e-05,,60.0,,,,,,,,,,151.0,,,,,,,,,COMPLETE,0.0,,,,,,,,,,,,,,,,,,,,
58,58,0.5909465404405478,2023-08-23 18:20:50.267254,2023-08-23 18:20:52.823974,0 days 00:00:02.556720,,0.8,3.0,,LightGBM,,,,,0.7000000000000001,,,,8.880014521845282e-06,6.684430561891181e-05,,60.0,,,,,,,,,,154.0,,,,,,,,,COMPLETE,0.0,,,,,,,,,,,,,,,,,,,,
59,59,0.5909465404405478,2023-08-23 18:20:51.569260,2023-08-23 18:20:54.093302,0 days 00:00:02.524042,,0.8,3.0,,LightGBM,,,,,0.7000000000000001,,,,7.172868869778985e-06,6.545943536250898e-05,,60.0,,,,,,,,,,153.0,,,,,,,,,COMPLETE,0.0,,,,,,,,,,,,,,,,,,,,
60,60,0.5909465404405478,2023-08-23 18:20:52.925803,2023-08-23 18:20:55.419268,0 days 00:00:02.493465,,0.8,3.0,,LightGBM,,,,,0.7000000000000001,,,,1.1058385102650835e-05,8.1091967399491e-05,,60.0,,,,,,,,,,153.0,,,,,,,,,COMPLETE,0.0,,,,,,,,,,,,,,,,,,,,
61,61,0.5909465404405478,2023-08-23 18:20:54.224756,2023-08-23 18:20:56.438802,0 days 00:00:02.214046,,0.8,3.0,,LightGBM,,,,,0.7000000000000001,,,,6.457353807882496e-06,7.380926364807222e-05,,60.0,,,,,,,,,,149.0,,,,,,,,,COMPLETE,0.0,,,,,,,,,,,,,,,,,,,,
62,62,0.5635445906620999,2023-08-23 18:20:55.574984,2023-08-23 18:20:58.312850,0 days 00:00:02.737866,,0.8,3.0,,LightGBM,,,,,0.8,,,,3.007641715696948e-06,5.066080809834776e-05,,50.0,,,,,,,,,,128.0,,,,,,,,,COMPLETE,0.0,,,,,,,,,,,,,,,,,,,,
63,63,0.5984236631128139,2023-08-23 18:20:56.601544,2023-08-23 18:20:59.136693,0 days 00:00:02.535149,,0.7000000000000001,3.0,,LightGBM,,,,,0.8,,,,8.55952128945369e-05,0.0005102000198762027,,50.0,,,,,,,,,,189.0,,,,,,,,,COMPLETE,0.0,,,,,,,,,,,,,,,,,,,,
64,64,0.5882192134107027,2023-08-23 18:20:58.381540,2023-08-23 18:21:00.347727,0 days 00:00:01.966187,,0.7000000000000001,3.0,,LightGBM,,,,,0.8,,,,7.294158148797118e-05,0.0006462379227356484,,70.0,,,,,,,,,,185.0,,,,,,,,,COMPLETE,0.0,,,,,,,,,,,,,,,,,,,,
65,65,0.562550923870021,2023-08-23 18:20:59.214247,2023-08-23 18:21:02.137820,0 days 00:00:02.923573,,0.7000000000000001,3.0,,LightGBM,,,,,0.8,,,,0.00010906478374622551,0.0005860990560059924,,40.0,,,,,,,,,,189.0,,,,,,,,,COMPLETE,0.0,,,,,,,,,,,,,,,,,,,,
66,66,0.5734623525233995,2023-08-23 18:21:00.425397,2023-08-23 18:21:04.304734,0 days 00:00:03.879337,,0.9,3.0,,LightGBM,,,,,0.8,,,,8.264352627755006e-05,0.0004370919100744392,,40.0,,,,,,,,,,190.0,,,,,,,,,COMPLETE,0.0,,,,,,,,,,,,,,,,,,,,
67,67,0.5701282368464456,2023-08-23 18:21:02.220811,2023-08-23 18:21:04.858428,0 days 00:00:02.637617,,0.9,3.0,,LightGBM,,,,,0.6000000000000001,,,,7.298716486118865e-07,7.366245830686646e-06,,70.0,,,,,,,,,,182.0,,,,,,,,,COMPLETE,0.0,,,,,,,,,,,,,,,,,,,,
68,68,0.5701282368464456,2023-08-23 18:21:04.399220,2023-08-23 18:21:06.756510,0 days 00:00:02.357290,,0.9,3.0,,LightGBM,,,,,0.6000000000000001,,,,1.6987468096793086e-06,2.35705511057536e-05,,70.0,,,,,,,,,,171.0,,,,,,,,,COMPLETE,0.0,,,,,,,,,,,,,,,,,,,,
69,69,0.5701282368464456,2023-08-23 18:21:04.956467,2023-08-23 18:21:07.386833,0 days 00:00:02.430366,,0.9,3.0,,LightGBM,,,,,0.6000000000000001,,,,2.885195115165056e-05,1.942644262876292e-05,,70.0,,,,,,,,,,121.0,,,,,,,,,COMPLETE,0.0,,,,,,,,,,,,,,,,,,,,
70,70,0.5603966769255527,2023-08-23 18:21:06.838351,2023-08-23 18:21:06.937214,0 days 00:00:00.098863,,,,,DecisionTreeClassifier,,gini,2.0,,,,,,,,,,,,,,,,,,,,,,,,,,,,COMPLETE,0.0,,,,,,,,,,,,,,,,,,,,
71,71,0.5747257958106547,2023-08-23 18:21:07.026846,2023-08-23 18:21:09.849476,0 days 00:00:02.822630,,0.8,3.0,,LightGBM,,,,,0.7000000000000001,,,,2.6961867992066604e-05,0.0003574441164097087,,50.0,,,,,,,,,,117.0,,,,,,,,,COMPLETE,0.0,,,,,,,,,,,,,,,,,,,,
72,72,0.5747257958106547,2023-08-23 18:21:07.477879,2023-08-23 18:21:10.278405,0 days 00:00:02.800526,,0.8,3.0,,LightGBM,,,,,0.7000000000000001,,,,3.0126550453845e-05,0.00032508972594101913,,50.0,,,,,,,,,,108.0,,,,,,,,,COMPLETE,0.0,,,,,,,,,,,,,,,,,,,,
73,73,0.577711989577085,2023-08-23 18:21:09.946819,2023-08-23 18:21:12.124503,0 days 00:00:02.177684,,0.7000000000000001,3.0,,LightGBM,,,,,0.7000000000000001,,,,2.2701805228660714e-06,0.00026008775457919925,,60.0,,,,,,,,,,163.0,,,,,,,,,COMPLETE,0.0,,,,,,,,,,,,,,,,,,,,
74,74,0.5693278066269114,2023-08-23 18:21:10.349715,2023-08-23 18:21:12.733127,0 days 00:00:02.383412,,0.6000000000000001,3.0,,LightGBM,,,,,0.8,,,,3.3373235207821307e-06,8.75525233419909e-06,,60.0,,,,,,,,,,165.0,,,,,,,,,COMPLETE,0.0,,,,,,,,,,,,,,,,,,,,
75,75,0.5782072368421053,2023-08-23 18:21:12.233850,2023-08-23 18:21:15.165593,0 days 00:00:02.931743,,0.6000000000000001,2.0,,LightGBM,,,,,0.8,,,,3.956433062483237e-06,1.2611958199121538e-05,,40.0,,,,,,,,,,90.0,,,,,,,,,COMPLETE,0.0,,,,,,,,,,,,,,,,,,,,
76,76,0.5556619620412024,2023-08-23 18:21:12.809937,2023-08-23 18:21:15.743596,0 days 00:00:02.933659,,0.7000000000000001,2.0,,LightGBM,,,,,0.9,,,,0.0003764429212192924,0.002171155005626773,,40.0,,,,,,,,,,89.0,,,,,,,,,COMPLETE,0.0,,,,,,,,,,,,,,,,,,,,
77,77,0.5638744870320443,2023-08-23 18:21:15.261626,2023-08-23 18:21:15.384830,0 days 00:00:00.123204,,,,,DecisionTreeClassifier,,entropy,4.0,,,,,,,,,,,,,,,,,,,,,,,,,,,,COMPLETE,0.0,,,,,,,,,,,,,,,,,,,,
78,78,0.5909465404405478,2023-08-23 18:21:15.545777,2023-08-23 18:21:18.348013,0 days 00:00:02.802236,,0.8,3.0,,LightGBM,,,,,0.7000000000000001,,,,1.194905728650448e-05,0.00011178248928378026,,60.0,,,,,,,,,,142.0,,,,,,,,,COMPLETE,0.0,,,,,,,,,,,,,,,,,,,,
79,79,0.5909465404405478,2023-08-23 18:21:15.886978,2023-08-23 18:21:18.249000,0 days 00:00:02.362022,,0.8,3.0,,LightGBM,,,,,0.7000000000000001,,,,1.611956088926599e-05,9.017540356113537e-05,,60.0,,,,,,,,,,139.0,,,,,,,,,COMPLETE,0.0,,,,,,,,,,,,,,,,,,,,
80,80,0.5629163903121417,2023-08-23 18:21:18.335757,2023-08-23 18:21:20.352474,0 days 00:00:02.016717,,0.8,3.0,,LightGBM,,,,,0.7000000000000001,,,,1.0825346116382312e-05,0.00011101268829508401,,70.0,,,,,,,,,,143.0,,,,,,,,,COMPLETE,0.0,,,,,,,,,,,,,,,,,,,,
81,81,0.5882192134107027,2023-08-23 18:21:18.455941,2023-08-23 18:21:20.822847,0 days 00:00:02.366906,,0.8,3.0,,LightGBM,,,,,0.6000000000000001,,,,6.1924691326878185e-06,2.9617919401102788e-05,,70.0,,,,,,,,,,170.0,,,,,,,,,COMPLETE,0.0,,,,,,,,,,,,,,,,,,,,
82,82,0.36012523631635246,2023-08-23 18:21:20.451352,2023-08-23 18:21:20.695681,0 days 00:00:00.244329,1.3033920418943313e-08,,,gbtree,XGBoost,0.25835128523013473,,,2.319344267605407e-08,,1.8730550464230323e-08,depthwise,6.922627069439185e-05,,,3.0,,2.0,,,,,,,,,,,,,,,0.6694598405049409,,,COMPLETE,0.0,,,,,,,,,,,,,,,,,,,,
83,83,0.5882192134107027,2023-08-23 18:21:20.789771,2023-08-23 18:21:23.917819,0 days 00:00:03.128048,,0.9,3.0,,LightGBM,,,,,0.6000000000000001,,,,3.9966233254042414e-05,2.621080715586698e-05,,50.0,,,,,,,,,,166.0,,,,,,,,,COMPLETE,0.0,,,,,,,,,,,,,,,,,,,,
84,84,0.5882192134107027,2023-08-23 18:21:20.911098,2023-08-23 18:21:24.054131,0 days 00:00:03.143033,,0.9,3.0,,LightGBM,,,,,0.6000000000000001,,,,3.120476428832808e-05,3.098785145204877e-06,,50.0,,,,,,,,,,202.0,,,,,,,,,COMPLETE,0.0,,,,,,,,,,,,,,,,,,,,
85,85,0.3573487031700288,2023-08-23 18:21:24.020904,2023-08-23 18:23:50.515479,0 days 00:02:26.494575,,,,,MLPClassifier,,,,,,,,,,,,,,relu,sgd,4.0,100.0,100.0,90.0,10.0,,,,,,,,,,,COMPLETE,0.0,,,,,,,,,,,,,,,,,,,,
86,86,0.3573487031700288,2023-08-23 18:21:24.167289,2023-08-23 18:23:51.759289,0 days 00:02:27.592000,,,,,MLPClassifier,,,,,,,,,,,,,,relu,sgd,4.0,100.0,100.0,100.0,10.0,,,,,,,,,,,COMPLETE,0.0,,,,,,,,,,,,,,,,,,,,
