,number,value,datetime_start,datetime_complete,duration,params_alpha,params_bagging_fraction,params_bagging_freq,params_booster,params_classifier,params_colsample_bytree,params_dct_criterion,params_dct_max_depth,params_eta,params_feature_fraction,params_gamma,params_grow_policy,params_lambda,params_lambda_l1,params_lambda_l2,params_max_depth,params_min_child_samples,params_min_child_weight,params_mlp_activation,params_mlp_solver,params_n_layers,params_n_units_l_0,params_n_units_l_1,params_n_units_l_2,params_n_units_l_3,params_normalize_type,params_num_leaves,params_rate_drop,params_rf_estimator,params_rf_max_depth,params_sample_type,params_skip_drop,params_subsample,params_svc_c,params_svc_kernel,state,best_trial,dev_acc,dev_recall_macro,dev_precision_macro,dev_f1_macro,dev_recall_0,dev_precision_0,dev_f1_0,dev_recall_1,dev_precision_1,dev_f1_1,test_acc,test_recall_macro,test_precision_macro,test_f1_macro,test_recall_0,test_precision_0,test_f1_0,test_recall_1,test_precision_1,test_f1_1
85,85,0.3573487031700288,2023-08-23 14:55:52.784420,2023-08-23 14:56:00.050409,0 days 00:00:07.265989,,,,,SVC,,,,,,,,,,,,,,,,,,,,,,,,,,,,,660.7523630463941,poly,COMPLETE,0.0,,,,,,,,,,,,,,,,,,,,
86,86,0.3573487031700288,2023-08-23 14:55:57.443838,2023-08-23 14:56:04.515375,0 days 00:00:07.071537,,,,,SVC,,,,,,,,,,,,,,,,,,,,,,,,,,,,,950.0485593058515,poly,COMPLETE,0.0,,,,,,,,,,,,,,,,,,,,
87,87,0.4808665570976949,2023-08-23 14:56:00.170622,2023-08-23 14:56:00.844115,0 days 00:00:00.673493,1.3051697266227347e-05,,,dart,XGBoost,0.6087535667919286,,,0.0009868932799740144,,0.340233927827121,lossguide,0.000586296234888679,,,3.0,,10.0,,,,,,,,tree,,1.044229767216944e-08,,,uniform,1.0390132636366126e-07,0.56149338874592,,,COMPLETE,0.0,,,,,,,,,,,,,,,,,,,,
88,88,0.5764808541217534,2023-08-23 14:56:00.994963,2023-08-23 14:56:03.611102,0 days 00:00:02.616139,,0.7000000000000001,1.0,,LightGBM,,,,,0.8,,,,1.1434881248170119e-05,3.464110498272845e-05,,80.0,,,,,,,,,,229.0,,,,,,,,,COMPLETE,0.0,,,,,,,,,,,,,,,,,,,,
89,89,0.6046099290780143,2023-08-23 14:56:03.672599,2023-08-23 14:56:05.841362,0 days 00:00:02.168763,,0.8,3.0,,LightGBM,,,,,0.7000000000000001,,,,0.0001097062021511515,0.0006860834763730021,,100.0,,,,,,,,,,220.0,,,,,,,,,COMPLETE,0.0,,,,,,,,,,,,,,,,,,,,
90,90,0.607483550389871,2023-08-23 14:56:04.580622,2023-08-23 14:56:07.099216,0 days 00:00:02.518594,,0.8,3.0,,LightGBM,,,,,0.7000000000000001,,,,3.4948585661709277e-07,1.3645958809323873e-05,,100.0,,,,,,,,,,232.0,,,,,,,,,COMPLETE,0.0,,,,,,,,,,,,,,,,,,,,
91,91,0.6046099290780143,2023-08-23 14:56:05.911183,2023-08-23 14:56:08.831582,0 days 00:00:02.920399,,0.8,3.0,,LightGBM,,,,,0.7000000000000001,,,,0.0001321100124674169,0.0007052998398772157,,100.0,,,,,,,,,,144.0,,,,,,,,,COMPLETE,0.0,,,,,,,,,,,,,,,,,,,,
92,92,0.5962361302957789,2023-08-23 14:56:07.199722,2023-08-23 14:56:11.940847,0 days 00:00:04.741125,,0.8,3.0,,LightGBM,,,,,0.7000000000000001,,,,1.235273635229909e-06,0.0008810610652516271,,40.0,,,,,,,,,,142.0,,,,,,,,,COMPLETE,0.0,,,,,,,,,,,,,,,,,,,,
93,93,0.6046099290780143,2023-08-23 14:56:08.893452,2023-08-23 14:56:11.222171,0 days 00:00:02.328719,,0.8,3.0,,LightGBM,,,,,0.7000000000000001,,,,3.7266870515562714e-07,0.0020588466730216623,,100.0,,,,,,,,,,148.0,,,,,,,,,COMPLETE,0.0,,,,,,,,,,,,,,,,,,,,
94,94,0.6046099290780143,2023-08-23 14:56:11.297149,2023-08-23 14:56:13.737435,0 days 00:00:02.440286,,0.8,3.0,,LightGBM,,,,,0.7000000000000001,,,,2.055775160191802e-07,0.0023928658981845733,,100.0,,,,,,,,,,141.0,,,,,,,,,COMPLETE,0.0,,,,,,,,,,,,,,,,,,,,
95,95,0.5959048940591887,2023-08-23 14:56:12.090141,2023-08-23 14:56:14.466870,0 days 00:00:02.376729,,0.8,3.0,,LightGBM,,,,,0.6000000000000001,,,,2.0904919790514024e-07,0.0021780270207927338,,100.0,,,,,,,,,,166.0,,,,,,,,,COMPLETE,0.0,,,,,,,,,,,,,,,,,,,,
96,96,0.6046099290780143,2023-08-23 14:56:13.837452,2023-08-23 14:56:16.500016,0 days 00:00:02.662564,,0.8,3.0,,LightGBM,,,,,0.7000000000000001,,,,1.783504666726659e-07,0.0016127495171645793,,100.0,,,,,,,,,,150.0,,,,,,,,,COMPLETE,0.0,,,,,,,,,,,,,,,,,,,,
97,97,0.5955171144169342,2023-08-23 14:56:14.603946,2023-08-23 14:56:16.776878,0 days 00:00:02.172932,,0.8,3.0,,LightGBM,,,,,0.7000000000000001,,,,2.5705457219885533e-07,0.0005117047282338632,,100.0,,,,,,,,,,120.0,,,,,,,,,COMPLETE,0.0,,,,,,,,,,,,,,,,,,,,
98,98,0.5955171144169342,2023-08-23 14:56:16.608466,2023-08-23 14:56:19.851456,0 days 00:00:03.242990,,0.8,3.0,,LightGBM,,,,,0.7000000000000001,,,,1.411721828764681e-07,0.0004503488412067254,,100.0,,,,,,,,,,137.0,,,,,,,,,COMPLETE,0.0,,,,,,,,,,,,,,,,,,,,
99,99,0.6046099290780143,2023-08-23 14:56:16.901360,2023-08-23 14:56:20.160694,0 days 00:00:03.259334,,0.8,3.0,,LightGBM,,,,,0.7000000000000001,,,,9.907980383963524e-08,0.002616036970221974,,100.0,,,,,,,,,,140.0,,,,,,,,,COMPLETE,0.0,,,,,,,,,,,,,,,,,,,,
100,100,0.6046099290780143,2023-08-23 14:56:19.951551,2023-08-23 14:56:22.560911,0 days 00:00:02.609360,,0.8,3.0,,LightGBM,,,,,0.7000000000000001,,,,1.2138257005165657e-07,0.001689903573518882,,100.0,,,,,,,,,,158.0,,,,,,,,,COMPLETE,0.0,,,,,,,,,,,,,,,,,,,,
101,101,0.5921132798260562,2023-08-23 14:56:20.249087,2023-08-23 14:56:23.347301,0 days 00:00:03.098214,,0.8,3.0,,LightGBM,,,,,0.7000000000000001,,,,8.962406764783456e-08,0.002938491210077059,,90.0,,,,,,,,,,151.0,,,,,,,,,COMPLETE,0.0,,,,,,,,,,,,,,,,,,,,
102,102,0.5766253043647155,2023-08-23 14:56:22.629382,2023-08-23 14:56:25.540838,0 days 00:00:02.911456,,0.8,3.0,,LightGBM,,,,,0.7000000000000001,,,,8.6617025266309e-08,0.003604293456294968,,90.0,,,,,,,,,,150.0,,,,,,,,,COMPLETE,0.0,,,,,,,,,,,,,,,,,,,,
103,103,0.3819419708915246,2023-08-23 14:56:23.465097,2023-08-23 14:56:24.240126,0 days 00:00:00.775029,,,,,RandomForestClassifier,,,,,,,,,,,,,,,,,,,,,,,,13.0,2.0,,,,,,COMPLETE,0.0,,,,,,,,,,,,,,,,,,,,
104,104,0.5998205473306415,2023-08-23 14:56:24.334661,2023-08-23 14:56:26.635478,0 days 00:00:02.300817,,0.8,3.0,,LightGBM,,,,,0.7000000000000001,,,,6.351068993623063e-08,0.005507327409296495,,100.0,,,,,,,,,,119.0,,,,,,,,,COMPLETE,0.0,,,,,,,,,,,,,,,,,,,,
105,105,0.5833109656639068,2023-08-23 14:56:25.643010,2023-08-23 14:56:27.612958,0 days 00:00:01.969948,,0.7000000000000001,3.0,,LightGBM,,,,,0.7000000000000001,,,,4.87197185866702e-07,0.006237644176595803,,100.0,,,,,,,,,,120.0,,,,,,,,,COMPLETE,0.0,,,,,,,,,,,,,,,,,,,,
106,106,0.5378966026887974,2023-08-23 14:56:26.720774,2023-08-23 14:56:28.971088,0 days 00:00:02.250314,,,,,DecisionTreeClassifier,,log_loss,31.0,,,,,,,,,,,,,,,,,,,,,,,,,,,,COMPLETE,0.0,,,,,,,,,,,,,,,,,,,,
107,107,0.519325697611168,2023-08-23 14:56:27.706013,2023-08-23 14:56:29.815055,0 days 00:00:02.109042,,,,,DecisionTreeClassifier,,log_loss,28.0,,,,,,,,,,,,,,,,,,,,,,,,,,,,COMPLETE,0.0,,,,,,,,,,,,,,,,,,,,
108,108,0.6046099290780143,2023-08-23 14:56:29.053347,2023-08-23 14:56:31.675391,0 days 00:00:02.622044,,0.8,3.0,,LightGBM,,,,,0.7000000000000001,,,,3.403632229472182e-07,0.0015777005458416356,,100.0,,,,,,,,,,167.0,,,,,,,,,COMPLETE,0.0,,,,,,,,,,,,,,,,,,,,
109,109,0.6046099290780143,2023-08-23 14:56:29.922669,2023-08-23 14:56:32.542896,0 days 00:00:02.620227,,0.8,3.0,,LightGBM,,,,,0.7000000000000001,,,,4.640419287284902e-07,0.0014323366261850094,,100.0,,,,,,,,,,171.0,,,,,,,,,COMPLETE,0.0,,,,,,,,,,,,,,,,,,,,
110,110,0.6046099290780143,2023-08-23 14:56:31.844210,2023-08-23 14:56:35.023443,0 days 00:00:03.179233,,0.8,3.0,,LightGBM,,,,,0.7000000000000001,,,,3.999756652918113e-07,0.001851298699503779,,100.0,,,,,,,,,,162.0,,,,,,,,,COMPLETE,0.0,,,,,,,,,,,,,,,,,,,,
111,111,0.6087430760691093,2023-08-23 14:56:32.696720,2023-08-23 14:56:36.033941,0 days 00:00:03.337221,,0.8,3.0,,LightGBM,,,,,0.8,,,,4.0591779703564104e-08,0.0015202045114941541,,100.0,,,,,,,,,,136.0,,,,,,,,,COMPLETE,0.0,,,,,,,,,,,,,,,,,,,,
112,112,0.6087430760691093,2023-08-23 14:56:35.165118,2023-08-23 14:56:38.419672,0 days 00:00:03.254554,,0.8,3.0,,LightGBM,,,,,0.8,,,,5.569897952324274e-08,0.001843075459283797,,100.0,,,,,,,,,,136.0,,,,,,,,,COMPLETE,0.0,,,,,,,,,,,,,,,,,,,,
113,113,0.5993737809259829,2023-08-23 14:56:36.148679,2023-08-23 14:56:39.115121,0 days 00:00:02.966442,,0.7000000000000001,3.0,,LightGBM,,,,,0.8,,,,4.470050898746004e-08,0.009506212141420596,,100.0,,,,,,,,,,134.0,,,,,,,,,COMPLETE,0.0,,,,,,,,,,,,,,,,,,,,
114,114,0.5945182269470575,2023-08-23 14:56:38.500639,2023-08-23 14:56:41.369493,0 days 00:00:02.868854,,0.7000000000000001,3.0,,LightGBM,,,,,0.9,,,,4.034329152233306e-08,0.009127952343666012,,90.0,,,,,,,,,,142.0,,,,,,,,,COMPLETE,0.0,,,,,,,,,,,,,,,,,,,,
115,115,0.5643254859822213,2023-08-23 14:56:39.170442,2023-08-23 14:56:41.077144,0 days 00:00:01.906702,,0.4,3.0,,LightGBM,,,,,0.8,,,,2.7963969992991585e-08,0.0038786954117394075,,90.0,,,,,,,,,,141.0,,,,,,,,,COMPLETE,0.0,,,,,,,,,,,,,,,,,,,,
116,116,0.3573487031700288,2023-08-23 14:56:41.163544,2023-08-23 14:56:41.543878,0 days 00:00:00.380334,0.706739832022109,,,gblinear,XGBoost,0.6428564496048791,,,,,,,1.140542473282005e-07,,,,,,,,,,,,,,,,,,,,0.977146781298747,,,COMPLETE,0.0,,,,,,,,,,,,,,,,,,,,
117,117,0.5747520976353928,2023-08-23 14:56:41.449964,2023-08-23 14:56:43.031683,0 days 00:00:01.581719,0.9210896936205021,,,dart,XGBoost,0.6671537429627817,,,6.408926063593555e-06,,6.72500451879613e-05,depthwise,1.2173403662446949e-08,,,7.0,,2.0,,,,,,,,tree,,0.8066642669567209,,,uniform,0.5500228716729343,0.9669309453341862,,,COMPLETE,0.0,,,,,,,,,,,,,,,,,,,,
118,118,0.6087430760691093,2023-08-23 14:56:41.618216,2023-08-23 14:56:44.661287,0 days 00:00:03.043071,,0.8,3.0,,LightGBM,,,,,0.8,,,,1.4712029853092057e-07,0.001302543211526508,,100.0,,,,,,,,,,155.0,,,,,,,,,COMPLETE,0.0,,,,,,,,,,,,,,,,,,,,
119,119,0.6087430760691093,2023-08-23 14:56:43.202401,2023-08-23 14:56:46.515537,0 days 00:00:03.313136,,0.8,3.0,,LightGBM,,,,,0.8,,,,1.2526854576594677e-07,0.001372916183704244,,100.0,,,,,,,,,,129.0,,,,,,,,,COMPLETE,0.0,,,,,,,,,,,,,,,,,,,,
120,120,0.6087430760691093,2023-08-23 14:56:44.725844,2023-08-23 14:56:48.029097,0 days 00:00:03.303253,,0.8,3.0,,LightGBM,,,,,0.8,,,,1.2008128371752082e-08,0.0035048659836679256,,100.0,,,,,,,,,,127.0,,,,,,,,,COMPLETE,0.0,,,,,,,,,,,,,,,,,,,,
121,121,0.6087430760691093,2023-08-23 14:56:46.597292,2023-08-23 14:56:49.585001,0 days 00:00:02.987709,,0.8,3.0,,LightGBM,,,,,0.8,,,,1.7787530712215573e-08,0.0011239116827508908,,100.0,,,,,,,,,,93.0,,,,,,,,,COMPLETE,0.0,,,,,,,,,,,,,,,,,,,,
122,122,0.5772039414106305,2023-08-23 14:56:48.194424,2023-08-23 14:56:50.910884,0 days 00:00:02.716460,,0.8,3.0,,LightGBM,,,,,0.8,,,,1.3854263835144864e-08,0.018800971417183027,,100.0,,,,,,,,,,129.0,,,,,,,,,COMPLETE,0.0,,,,,,,,,,,,,,,,,,,,
123,123,0.5944112331791489,2023-08-23 14:56:49.688654,2023-08-23 14:56:52.480664,0 days 00:00:02.792010,,0.8,3.0,,LightGBM,,,,,0.8,,,,1.3232761465250141e-08,0.0003267589071671995,,90.0,,,,,,,,,,90.0,,,,,,,,,COMPLETE,0.0,,,,,,,,,,,,,,,,,,,,
124,124,0.5944112331791489,2023-08-23 14:56:51.012131,2023-08-23 14:56:53.866509,0 days 00:00:02.854378,,0.8,3.0,,LightGBM,,,,,0.8,,,,1.0308473382310293e-08,0.0008514959857429476,,90.0,,,,,,,,,,109.0,,,,,,,,,COMPLETE,0.0,,,,,,,,,,,,,,,,,,,,
125,125,0.5641086480012655,2023-08-23 14:56:52.573559,2023-08-23 14:57:03.816663,0 days 00:00:11.243104,,,,,RandomForestClassifier,,,,,,,,,,,,,,,,,,,,,,,,99.0,10.0,,,,,,COMPLETE,0.0,,,,,,,,,,,,,,,,,,,,
126,126,0.5694858473156744,2023-08-23 14:56:53.961890,2023-08-23 14:57:02.906558,0 days 00:00:08.944668,,,,,RandomForestClassifier,,,,,,,,,,,,,,,,,,,,,,,,99.0,8.0,,,,,,COMPLETE,0.0,,,,,,,,,,,,,,,,,,,,
127,127,0.6115679192602269,2023-08-23 14:57:03.034015,2023-08-23 14:57:05.565080,0 days 00:00:02.531065,,0.7000000000000001,3.0,,LightGBM,,,,,0.9,,,,1.992643021384387e-08,0.0005900057424455437,,100.0,,,,,,,,,,125.0,,,,,,,,,COMPLETE,1.0,0.6188340807174888,0.6111823884001304,0.6127227303697892,0.6115679192602269,0.6794354838709677,0.6505791505791506,0.6646942800788954,0.5429292929292929,0.5748663101604278,0.5584415584415584,0.5957446808510638,0.584091748023879,0.5877368889361081,0.5836829836829838,0.6900958466453674,0.622478386167147,0.6545454545454545,0.47808764940239046,0.5529953917050692,0.5128205128205129
128,128,0.6087430760691093,2023-08-23 14:57:03.910089,2023-08-23 14:57:06.439302,0 days 00:00:02.529213,,0.8,3.0,,LightGBM,,,,,0.8,,,,2.7316973840608507e-08,0.0011309797425205735,,100.0,,,,,,,,,,112.0,,,,,,,,,COMPLETE,0.0,,,,,,,,,,,,,,,,,,,,
129,129,0.6115679192602269,2023-08-23 14:57:05.653167,2023-08-23 14:57:08.465134,0 days 00:00:02.811967,,0.7000000000000001,3.0,,LightGBM,,,,,0.9,,,,3.1709437545735076e-08,0.0011252443504103404,,100.0,,,,,,,,,,110.0,,,,,,,,,COMPLETE,0.0,,,,,,,,,,,,,,,,,,,,
130,130,0.6020219213410702,2023-08-23 14:57:06.521294,2023-08-23 14:57:08.960881,0 days 00:00:02.439587,,0.7000000000000001,3.0,,LightGBM,,,,,1.0,,,,2.2444873855711726e-08,0.0010823150604304002,,100.0,,,,,,,,,,114.0,,,,,,,,,COMPLETE,0.0,,,,,,,,,,,,,,,,,,,,
131,131,0.6020219213410702,2023-08-23 14:57:08.559064,2023-08-23 14:57:11.355670,0 days 00:00:02.796606,,0.7000000000000001,3.0,,LightGBM,,,,,1.0,,,,2.1886907188739547e-08,0.0012352603377727336,,100.0,,,,,,,,,,112.0,,,,,,,,,COMPLETE,0.0,,,,,,,,,,,,,,,,,,,,
132,132,0.6115679192602269,2023-08-23 14:57:09.022054,2023-08-23 14:57:11.733712,0 days 00:00:02.711658,,0.7000000000000001,3.0,,LightGBM,,,,,0.9,,,,3.469584767536492e-08,0.00029538044056463727,,100.0,,,,,,,,,,99.0,,,,,,,,,COMPLETE,0.0,,,,,,,,,,,,,,,,,,,,
133,133,0.5213145580651927,2023-08-23 14:57:11.510670,2023-08-23 15:01:07.160442,0 days 00:03:55.649772,,,,,MLPClassifier,,,,,,,,,,,,,,tanh,adam,2.0,40.0,10.0,,,,,,,,,,,,,COMPLETE,0.0,,,,,,,,,,,,,,,,,,,,
134,134,0.4030776111956923,2023-08-23 14:57:11.822139,2023-08-23 14:57:22.541976,0 days 00:00:10.719837,,,,,MLPClassifier,,,,,,,,,,,,,,identity,sgd,2.0,50.0,10.0,,,,,,,,,,,,,COMPLETE,0.0,,,,,,,,,,,,,,,,,,,,
135,135,0.5973323955369418,2023-08-23 14:57:22.637738,2023-08-23 14:57:25.861190,0 days 00:00:03.223452,,0.7000000000000001,3.0,,LightGBM,,,,,0.9,,,,5.349415503628586e-08,0.00023946040328806976,,60.0,,,,,,,,,,89.0,,,,,,,,,COMPLETE,0.0,,,,,,,,,,,,,,,,,,,,
136,136,0.5831364761345057,2023-08-23 14:57:25.946085,2023-08-23 14:57:29.896039,0 days 00:00:03.949954,,0.7000000000000001,3.0,,LightGBM,,,,,0.9,,,,3.59229647731926e-08,0.00040817310087002653,,50.0,,,,,,,,,,100.0,,,,,,,,,COMPLETE,0.0,,,,,,,,,,,,,,,,,,,,
137,137,0.3573487031700288,2023-08-23 14:57:30.030874,2023-08-23 14:57:36.597230,0 days 00:00:06.566356,,,,,SVC,,,,,,,,,,,,,,,,,,,,,,,,,,,,,0.05678332885812784,linear,COMPLETE,0.0,,,,,,,,,,,,,,,,,,,,
138,138,0.6115679192602269,2023-08-23 14:57:36.693314,2023-08-23 14:57:38.877541,0 days 00:00:02.184227,,0.7000000000000001,3.0,,LightGBM,,,,,0.9,,,,2.212205411789871e-08,0.0005830800105253932,,100.0,,,,,,,,,,127.0,,,,,,,,,COMPLETE,0.0,,,,,,,,,,,,,,,,,,,,
139,139,0.6115679192602269,2023-08-23 14:57:38.958544,2023-08-23 14:57:41.328101,0 days 00:00:02.369557,,0.7000000000000001,3.0,,LightGBM,,,,,0.9,,,,1.936409842781878e-08,0.000653363881398105,,100.0,,,,,,,,,,126.0,,,,,,,,,COMPLETE,0.0,,,,,,,,,,,,,,,,,,,,
140,140,0.6115679192602269,2023-08-23 14:57:41.399997,2023-08-23 14:57:43.113106,0 days 00:00:01.713109,,0.7000000000000001,3.0,,LightGBM,,,,,0.9,,,,1.8524566041062082e-08,0.0005615440517547943,,100.0,,,,,,,,,,124.0,,,,,,,,,COMPLETE,0.0,,,,,,,,,,,,,,,,,,,,
141,141,0.6115679192602269,2023-08-23 14:57:43.182763,2023-08-23 14:57:45.566452,0 days 00:00:02.383689,,0.7000000000000001,3.0,,LightGBM,,,,,0.9,,,,1.826833811271164e-08,0.0005473722494045495,,100.0,,,,,,,,,,126.0,,,,,,,,,COMPLETE,0.0,,,,,,,,,,,,,,,,,,,,
142,142,0.6115679192602269,2023-08-23 14:57:45.641737,2023-08-23 14:57:47.609823,0 days 00:00:01.968086,,0.7000000000000001,3.0,,LightGBM,,,,,0.9,,,,1.9280617775339717e-08,0.0005414167313970761,,100.0,,,,,,,,,,125.0,,,,,,,,,COMPLETE,0.0,,,,,,,,,,,,,,,,,,,,
143,143,0.6115679192602269,2023-08-23 14:57:47.656987,2023-08-23 14:57:50.503420,0 days 00:00:02.846433,,0.7000000000000001,3.0,,LightGBM,,,,,0.9,,,,1.717244408924865e-08,0.0005311936424645093,,100.0,,,,,,,,,,125.0,,,,,,,,,COMPLETE,0.0,,,,,,,,,,,,,,,,,,,,
144,144,0.6115679192602269,2023-08-23 14:57:50.596924,2023-08-23 14:57:52.775054,0 days 00:00:02.178130,,0.7000000000000001,3.0,,LightGBM,,,,,0.9,,,,1.892157558151173e-08,0.0002848129794970184,,100.0,,,,,,,,,,127.0,,,,,,,,,COMPLETE,0.0,,,,,,,,,,,,,,,,,,,,
145,145,0.6115679192602269,2023-08-23 14:57:52.838379,2023-08-23 14:57:54.974372,0 days 00:00:02.135993,,0.7000000000000001,3.0,,LightGBM,,,,,0.9,,,,1.8786687798686107e-08,0.0002995663194432067,,100.0,,,,,,,,,,125.0,,,,,,,,,COMPLETE,0.0,,,,,,,,,,,,,,,,,,,,
146,146,0.5886159406451245,2023-08-23 14:57:55.093014,2023-08-23 14:57:58.070537,0 days 00:00:02.977523,,0.7000000000000001,3.0,,LightGBM,,,,,0.9,,,,3.083547384521133e-08,0.00024482078346159695,,90.0,,,,,,,,,,126.0,,,,,,,,,COMPLETE,0.0,,,,,,,,,,,,,,,,,,,,
147,147,0.6115679192602269,2023-08-23 14:57:58.200441,2023-08-23 14:58:00.779102,0 days 00:00:02.578661,,0.7000000000000001,3.0,,LightGBM,,,,,0.9,,,,1.843880266294755e-08,0.000334221156032537,,100.0,,,,,,,,,,133.0,,,,,,,,,COMPLETE,0.0,,,,,,,,,,,,,,,,,,,,
148,148,0.6115679192602269,2023-08-23 14:58:00.921614,2023-08-23 14:58:03.615226,0 days 00:00:02.693612,,0.7000000000000001,3.0,,LightGBM,,,,,0.9,,,,1.8338340197602497e-08,0.0005297565274189627,,100.0,,,,,,,,,,122.0,,,,,,,,,COMPLETE,0.0,,,,,,,,,,,,,,,,,,,,
149,149,0.6115679192602269,2023-08-23 14:58:03.745550,2023-08-23 14:58:06.117100,0 days 00:00:02.371550,,0.7000000000000001,3.0,,LightGBM,,,,,0.9,,,,1.808010267579097e-08,0.0006149481242778056,,100.0,,,,,,,,,,134.0,,,,,,,,,COMPLETE,0.0,,,,,,,,,,,,,,,,,,,,
150,150,0.6115679192602269,2023-08-23 14:58:06.194070,2023-08-23 14:58:08.621970,0 days 00:00:02.427900,,0.7000000000000001,3.0,,LightGBM,,,,,0.9,,,,1.9169136952509548e-08,0.0005698281547504825,,100.0,,,,,,,,,,124.0,,,,,,,,,COMPLETE,0.0,,,,,,,,,,,,,,,,,,,,
151,151,0.5957044629291031,2023-08-23 14:58:08.698786,2023-08-23 14:58:11.336301,0 days 00:00:02.637515,,0.7000000000000001,3.0,,LightGBM,,,,,0.9,,,,1.7753423683530964e-08,0.0005358592813262024,,90.0,,,,,,,,,,121.0,,,,,,,,,COMPLETE,0.0,,,,,,,,,,,,,,,,,,,,
152,152,0.6115679192602269,2023-08-23 14:58:11.441225,2023-08-23 14:58:13.825890,0 days 00:00:02.384665,,0.7000000000000001,3.0,,LightGBM,,,,,0.9,,,,1.9804732183222542e-08,0.0003106048202309374,,100.0,,,,,,,,,,107.0,,,,,,,,,COMPLETE,0.0,,,,,,,,,,,,,,,,,,,,
153,153,0.6115679192602269,2023-08-23 14:58:14.046927,2023-08-23 14:58:16.772379,0 days 00:00:02.725452,,0.7000000000000001,3.0,,LightGBM,,,,,0.9,,,,1.531942155395423e-08,0.00015798403899169034,,100.0,,,,,,,,,,124.0,,,,,,,,,COMPLETE,0.0,,,,,,,,,,,,,,,,,,,,
154,154,0.6115679192602269,2023-08-23 14:58:16.866272,2023-08-23 14:58:18.826671,0 days 00:00:01.960399,,0.7000000000000001,3.0,,LightGBM,,,,,0.9,,,,1.0262996354584454e-08,0.0004197858769099053,,100.0,,,,,,,,,,116.0,,,,,,,,,COMPLETE,0.0,,,,,,,,,,,,,,,,,,,,
155,155,0.6115679192602269,2023-08-23 14:58:18.888715,2023-08-23 14:58:21.178423,0 days 00:00:02.289708,,0.7000000000000001,3.0,,LightGBM,,,,,0.9,,,,2.7060370253261767e-08,0.0006065017470406052,,100.0,,,,,,,,,,131.0,,,,,,,,,COMPLETE,0.0,,,,,,,,,,,,,,,,,,,,
156,156,0.6115679192602269,2023-08-23 14:58:21.234343,2023-08-23 14:58:23.368615,0 days 00:00:02.134272,,0.7000000000000001,3.0,,LightGBM,,,,,0.9,,,,1.889288868745864e-08,0.0002821639701773894,,100.0,,,,,,,,,,102.0,,,,,,,,,COMPLETE,0.0,,,,,,,,,,,,,,,,,,,,
157,157,0.5957044629291031,2023-08-23 14:58:23.447444,2023-08-23 14:58:25.859859,0 days 00:00:02.412415,,0.7000000000000001,3.0,,LightGBM,,,,,0.9,,,,1.0061195749809165e-08,0.0005508283372031585,,90.0,,,,,,,,,,117.0,,,,,,,,,COMPLETE,0.0,,,,,,,,,,,,,,,,,,,,
158,158,0.6115679192602269,2023-08-23 14:58:25.954181,2023-08-23 14:58:28.269027,0 days 00:00:02.314846,,0.7000000000000001,3.0,,LightGBM,,,,,0.9,,,,2.3148465767372462e-08,0.0003229061516697639,,100.0,,,,,,,,,,108.0,,,,,,,,,COMPLETE,0.0,,,,,,,,,,,,,,,,,,,,
159,159,0.6115679192602269,2023-08-23 14:58:28.333626,2023-08-23 14:58:30.569141,0 days 00:00:02.235515,,0.7000000000000001,3.0,,LightGBM,,,,,0.9,,,,1.695754245729375e-08,0.0003506913741742467,,100.0,,,,,,,,,,105.0,,,,,,,,,COMPLETE,0.0,,,,,,,,,,,,,,,,,,,,
160,160,0.6115679192602269,2023-08-23 14:58:30.634915,2023-08-23 14:58:32.756179,0 days 00:00:02.121264,,0.7000000000000001,3.0,,LightGBM,,,,,0.9,,,,3.359583556781404e-08,0.00016850694291121787,,100.0,,,,,,,,,,123.0,,,,,,,,,COMPLETE,0.0,,,,,,,,,,,,,,,,,,,,
161,161,0.6115679192602269,2023-08-23 14:58:32.866497,2023-08-23 14:58:35.272250,0 days 00:00:02.405753,,0.7000000000000001,3.0,,LightGBM,,,,,0.9,,,,1.911282258561198e-08,0.0007139060927670915,,100.0,,,,,,,,,,132.0,,,,,,,,,COMPLETE,0.0,,,,,,,,,,,,,,,,,,,,
162,162,0.5488570965674153,2023-08-23 14:58:35.347690,2023-08-23 15:06:50.790774,0 days 00:08:15.443084,,,,,MLPClassifier,,,,,,,,,,,,,,tanh,adam,3.0,40.0,50.0,100.0,,,,,,,,,,,,COMPLETE,0.0,,,,,,,,,,,,,,,,,,,,
163,163,0.594913714804723,2023-08-23 14:59:15.529842,2023-08-23 14:59:21.614943,0 days 00:00:06.085101,,0.7000000000000001,3.0,,LightGBM,,,,,1.0,,,,6.76839277300585e-08,0.0004860745986601191,,10.0,,,,,,,,,,125.0,,,,,,,,,COMPLETE,0.0,,,,,,,,,,,,,,,,,,,,
164,164,0.6115679192602269,2023-08-23 14:59:21.702488,2023-08-23 14:59:23.749149,0 days 00:00:02.046661,,0.7000000000000001,3.0,,LightGBM,,,,,0.9,,,,3.877578818703901e-08,0.00026281557860753494,,100.0,,,,,,,,,,113.0,,,,,,,,,COMPLETE,0.0,,,,,,,,,,,,,,,,,,,,
165,165,0.5802126247897669,2023-08-23 14:59:23.878644,2023-08-23 14:59:24.222530,0 days 00:00:00.343886,,,,,DecisionTreeClassifier,,gini,4.0,,,,,,,,,,,,,,,,,,,,,,,,,,,,COMPLETE,0.0,,,,,,,,,,,,,,,,,,,,
166,166,0.6115679192602269,2023-08-23 14:59:24.279342,2023-08-23 14:59:26.777648,0 days 00:00:02.498306,,0.7000000000000001,3.0,,LightGBM,,,,,0.9,,,,2.6813384819182428e-08,0.0007225514529212092,,100.0,,,,,,,,,,133.0,,,,,,,,,COMPLETE,0.0,,,,,,,,,,,,,,,,,,,,
167,167,0.5326755086374512,2023-08-23 14:59:26.878660,2023-08-23 15:02:32.531266,0 days 00:03:05.652606,,,,,MLPClassifier,,,,,,,,,,,,,,relu,lbfgs,2.0,100.0,100.0,,,,,,,,,,,,,COMPLETE,0.0,,,,,,,,,,,,,,,,,,,,
