,number,value,datetime_start,datetime_complete,duration,params_alpha,params_bagging_fraction,params_bagging_freq,params_booster,params_classifier,params_colsample_bytree,params_dct_criterion,params_dct_max_depth,params_eta,params_feature_fraction,params_gamma,params_grow_policy,params_lambda,params_lambda_l1,params_lambda_l2,params_max_depth,params_min_child_samples,params_min_child_weight,params_mlp_activation,params_mlp_solver,params_n_layers,params_n_units_l_0,params_n_units_l_1,params_n_units_l_2,params_n_units_l_3,params_normalize_type,params_num_leaves,params_rate_drop,params_rf_estimator,params_rf_max_depth,params_sample_type,params_skip_drop,params_subsample,params_svc_c,params_svc_kernel,state,best_trial,dev_acc,dev_recall_macro,dev_precision_macro,dev_f1_macro,dev_recall_0,dev_precision_0,dev_f1_0,dev_recall_1,dev_precision_1,dev_f1_1,test_acc,test_recall_macro,test_precision_macro,test_f1_macro,test_recall_0,test_precision_0,test_f1_0,test_recall_1,test_precision_1,test_f1_1
0,0,0.5308341673856773,2023-08-23 17:49:22.835678,2023-08-23 17:49:22.930242,0 days 00:00:00.094564,,,,,DecisionTreeClassifier,,entropy,3.0,,,,,,,,,,,,,,,,,,,,,,,,,,,,COMPLETE,0.0,,,,,,,,,,,,,,,,,,,,
1,1,0.5145762945498458,2023-08-23 17:49:22.838658,2023-08-23 17:49:23.266169,0 days 00:00:00.427511,0.014242701954749182,,,gbtree,XGBoost,0.6209968753570267,,,8.991751507364914e-07,,3.091103558653655e-08,lossguide,1.5821677113899386e-08,,,7.0,,8.0,,,,,,,,,,,,,,,0.8917451692466023,,,COMPLETE,0.0,,,,,,,,,,,,,,,,,,,,
2,2,0.5464820681293754,2023-08-23 17:49:22.840152,2023-08-23 17:49:23.055769,0 days 00:00:00.215617,,,,,DecisionTreeClassifier,,log_loss,11.0,,,,,,,,,,,,,,,,,,,,,,,,,,,,COMPLETE,0.0,,,,,,,,,,,,,,,,,,,,
3,3,0.49830821167532524,2023-08-23 17:49:22.844543,2023-08-23 17:49:23.106133,0 days 00:00:00.261590,,,,,DecisionTreeClassifier,,gini,31.0,,,,,,,,,,,,,,,,,,,,,,,,,,,,COMPLETE,0.0,,,,,,,,,,,,,,,,,,,,
4,4,0.4135180152537916,2023-08-23 17:49:22.849833,2023-08-23 17:49:25.764982,0 days 00:00:02.915149,,,,,MLPClassifier,,,,,,,,,,,,,,tanh,adam,1.0,40.0,,,,,,,,,,,,,,COMPLETE,0.0,,,,,,,,,,,,,,,,,,,,
5,5,0.5638439685314686,2023-08-23 17:49:22.853992,2023-08-23 17:49:27.331599,0 days 00:00:04.477607,,,,,RandomForestClassifier,,,,,,,,,,,,,,,,,,,,,,,,77.0,10.0,,,,,,COMPLETE,0.0,,,,,,,,,,,,,,,,,,,,
6,6,0.5575102538521228,2023-08-23 17:49:22.867745,2023-08-23 17:49:24.614729,0 days 00:00:01.746984,,,,,RandomForestClassifier,,,,,,,,,,,,,,,,,,,,,,,,29.0,9.0,,,,,,COMPLETE,0.0,,,,,,,,,,,,,,,,,,,,
7,7,0.3573487031700288,2023-08-23 17:49:22.871004,2023-08-23 17:49:29.646530,0 days 00:00:06.775526,,,,,SVC,,,,,,,,,,,,,,,,,,,,,,,,,,,,,1.2659895601954345,rbf,COMPLETE,0.0,,,,,,,,,,,,,,,,,,,,
8,8,0.5489194411435688,2023-08-23 17:49:23.016546,2023-08-23 17:49:23.395408,0 days 00:00:00.378862,0.013220223459212544,,,dart,XGBoost,0.55385086640237,,,4.5630746954506094e-06,,1.9265049417398807e-07,depthwise,0.01135059429544335,,,7.0,,9.0,,,,,,,,forest,,0.010146837768462577,,,weighted,0.49094798294908315,0.6472735975006034,,,COMPLETE,0.0,,,,,,,,,,,,,,,,,,,,
9,9,0.5025633333717929,2023-08-23 17:49:23.100138,2023-08-23 17:49:23.317812,0 days 00:00:00.217674,,,,,DecisionTreeClassifier,,gini,25.0,,,,,,,,,,,,,,,,,,,,,,,,,,,,COMPLETE,0.0,,,,,,,,,,,,,,,,,,,,
10,10,0.5935891627930523,2023-08-23 17:49:23.152707,2023-08-23 17:49:24.390193,0 days 00:00:01.237486,,0.5,1.0,,LightGBM,,,,,0.5,,,,0.5082245978186322,0.0017771870435821847,,60.0,,,,,,,,,,204.0,,,,,,,,,COMPLETE,0.0,,,,,,,,,,,,,,,,,,,,
11,11,0.3573487031700288,2023-08-23 17:49:23.308187,2023-08-23 17:49:29.716655,0 days 00:00:06.408468,,,,,SVC,,,,,,,,,,,,,,,,,,,,,,,,,,,,,49.40577259489719,poly,COMPLETE,0.0,,,,,,,,,,,,,,,,,,,,
12,12,0.3573487031700288,2023-08-23 17:49:23.371121,2023-08-23 17:49:30.202922,0 days 00:00:06.831801,,,,,SVC,,,,,,,,,,,,,,,,,,,,,,,,,,,,,0.09335348414220908,poly,COMPLETE,0.0,,,,,,,,,,,,,,,,,,,,
13,13,0.3573487031700288,2023-08-23 17:49:23.438592,2023-08-23 17:49:23.465466,0 days 00:00:00.026874,0.057630163937757176,,,gblinear,XGBoost,0.49802183623236973,,,,,,,0.007179843739528532,,,,,,,,,,,,,,,,,,,,0.33646404860359813,,,COMPLETE,0.0,,,,,,,,,,,,,,,,,,,,
14,14,0.3573487031700288,2023-08-23 17:49:23.509267,2023-08-23 17:51:05.207704,0 days 00:01:41.698437,,,,,MLPClassifier,,,,,,,,,,,,,,relu,sgd,4.0,100.0,70.0,50.0,60.0,,,,,,,,,,,COMPLETE,0.0,,,,,,,,,,,,,,,,,,,,
15,15,0.4074942367053491,2023-08-23 17:49:24.452996,2023-08-23 17:49:24.523002,0 days 00:00:00.070006,4.6382436936067224e-07,,,gblinear,XGBoost,0.38738732463502745,,,,,,,8.508172228937777e-07,,,,,,,,,,,,,,,,,,,,0.9056696146087548,,,COMPLETE,0.0,,,,,,,,,,,,,,,,,,,,
16,16,0.42488527287987743,2023-08-23 17:49:24.595424,2023-08-23 17:51:21.721861,0 days 00:01:57.126437,,,,,MLPClassifier,,,,,,,,,,,,,,identity,adam,4.0,90.0,50.0,70.0,30.0,,,,,,,,,,,COMPLETE,0.0,,,,,,,,,,,,,,,,,,,,
17,17,0.5716667165513464,2023-08-23 17:49:24.715804,2023-08-23 17:49:26.140344,0 days 00:00:01.424540,,0.5,1.0,,LightGBM,,,,,0.5,,,,0.7883401188232154,0.0031963172925889116,,60.0,,,,,,,,,,213.0,,,,,,,,,COMPLETE,0.0,,,,,,,,,,,,,,,,,,,,
18,18,0.5879693784870896,2023-08-23 17:49:25.883642,2023-08-23 17:49:27.469863,0 days 00:00:01.586221,,0.5,1.0,,LightGBM,,,,,0.5,,,,0.43796819050987423,0.0017530568027299103,,60.0,,,,,,,,,,216.0,,,,,,,,,COMPLETE,0.0,,,,,,,,,,,,,,,,,,,,
19,19,0.5832746646122854,2023-08-23 17:49:26.265944,2023-08-23 17:49:27.830808,0 days 00:00:01.564864,,0.5,1.0,,LightGBM,,,,,0.5,,,,0.9394162587725244,0.002971310811520738,,60.0,,,,,,,,,,212.0,,,,,,,,,COMPLETE,0.0,,,,,,,,,,,,,,,,,,,,
20,20,0.5841328919273641,2023-08-23 17:49:27.400270,2023-08-23 17:49:29.163932,0 days 00:00:01.763662,,0.5,1.0,,LightGBM,,,,,0.5,,,,0.8381266486626842,0.0027831802169762656,,60.0,,,,,,,,,,211.0,,,,,,,,,COMPLETE,0.0,,,,,,,,,,,,,,,,,,,,
21,21,0.5806790084979949,2023-08-23 17:49:27.569457,2023-08-23 17:49:28.999063,0 days 00:00:01.429606,,0.5,1.0,,LightGBM,,,,,0.5,,,,0.4881988917129318,0.002232325577105064,,60.0,,,,,,,,,,215.0,,,,,,,,,COMPLETE,0.0,,,,,,,,,,,,,,,,,,,,
22,22,0.5704318501316877,2023-08-23 17:49:27.919607,2023-08-23 17:49:29.527685,0 days 00:00:01.608078,,0.5,2.0,,LightGBM,,,,,0.6000000000000001,,,,0.0015217881173369364,1.0700426955944521e-05,,60.0,,,,,,,,,,196.0,,,,,,,,,COMPLETE,0.0,,,,,,,,,,,,,,,,,,,,
23,23,0.3573487031700288,2023-08-23 17:49:29.086296,2023-08-23 17:49:37.853271,0 days 00:00:08.766975,,,,,SVC,,,,,,,,,,,,,,,,,,,,,,,,,,,,,1.9337392859582845,rbf,COMPLETE,0.0,,,,,,,,,,,,,,,,,,,,
24,24,0.3573487031700288,2023-08-23 17:49:29.297261,2023-08-23 17:49:36.715880,0 days 00:00:07.418619,,,,,SVC,,,,,,,,,,,,,,,,,,,,,,,,,,,,,20.964188382589743,poly,COMPLETE,0.0,,,,,,,,,,,,,,,,,,,,
25,25,0.3573487031700288,2023-08-23 17:49:29.617804,2023-08-23 17:49:36.333962,0 days 00:00:06.716158,,,,,SVC,,,,,,,,,,,,,,,,,,,,,,,,,,,,,0.0012800290517221472,linear,COMPLETE,0.0,,,,,,,,,,,,,,,,,,,,
26,26,0.3573487031700288,2023-08-23 17:49:29.780918,2023-08-23 17:49:33.021421,0 days 00:00:03.240503,,,,,MLPClassifier,,,,,,,,,,,,,,logistic,lbfgs,4.0,100.0,70.0,90.0,60.0,,,,,,,,,,,COMPLETE,0.0,,,,,,,,,,,,,,,,,,,,
27,27,0.3573487031700288,2023-08-23 17:49:29.804416,2023-08-23 17:50:35.078899,0 days 00:01:05.274483,,,,,MLPClassifier,,,,,,,,,,,,,,logistic,sgd,4.0,100.0,90.0,10.0,20.0,,,,,,,,,,,COMPLETE,0.0,,,,,,,,,,,,,,,,,,,,
28,28,0.5747744023357513,2023-08-23 17:49:30.288254,2023-08-23 17:49:31.418059,0 days 00:00:01.129805,,0.8,1.0,,LightGBM,,,,,0.9,,,,1.568266396658723e-07,0.4485198892231374,,100.0,,,,,,,,,,119.0,,,,,,,,,COMPLETE,0.0,,,,,,,,,,,,,,,,,,,,
29,29,0.5930821827383963,2023-08-23 17:49:31.477762,2023-08-23 17:49:32.031398,0 days 00:00:00.553636,,0.4,2.0,,LightGBM,,,,,0.4,,,,0.02530524317767844,0.0003105160422657882,,20.0,,,,,,,,,,14.0,,,,,,,,,COMPLETE,0.0,,,,,,,,,,,,,,,,,,,,
30,30,0.5360362298152921,2023-08-23 17:49:32.131575,2023-08-23 17:49:33.412066,0 days 00:00:01.280491,,0.4,3.0,,LightGBM,,,,,0.4,,,,0.006137048447268977,1.6150150356050965e-08,,10.0,,,,,,,,,,47.0,,,,,,,,,COMPLETE,0.0,,,,,,,,,,,,,,,,,,,,
31,31,0.5556457564575645,2023-08-23 17:49:33.092966,2023-08-23 17:49:34.072227,0 days 00:00:00.979261,,0.4,3.0,,LightGBM,,,,,0.4,,,,0.003723375374250855,6.451153500776487e-08,,10.0,,,,,,,,,,12.0,,,,,,,,,COMPLETE,0.0,,,,,,,,,,,,,,,,,,,,
32,32,0.5513635006808303,2023-08-23 17:49:33.538448,2023-08-23 17:49:33.754033,0 days 00:00:00.215585,,1.0,2.0,,LightGBM,,,,,0.7000000000000001,,,,0.01899947707100837,7.665165769775061e-05,,30.0,,,,,,,,,,4.0,,,,,,,,,COMPLETE,0.0,,,,,,,,,,,,,,,,,,,,
33,33,0.5700375976091778,2023-08-23 17:49:33.867753,2023-08-23 17:49:35.980595,0 days 00:00:02.112842,,0.7000000000000001,3.0,,LightGBM,,,,,0.4,,,,0.027046524053833843,8.894422690387355e-05,,40.0,,,,,,,,,,146.0,,,,,,,,,COMPLETE,0.0,,,,,,,,,,,,,,,,,,,,
34,34,0.574032526918052,2023-08-23 17:49:34.153397,2023-08-23 17:49:36.559245,0 days 00:00:02.405848,,0.7000000000000001,2.0,,LightGBM,,,,,0.7000000000000001,,,,0.04694229124288758,0.0001384478385459549,,40.0,,,,,,,,,,144.0,,,,,,,,,COMPLETE,0.0,,,,,,,,,,,,,,,,,,,,
35,35,0.5846158807556613,2023-08-23 17:49:36.098683,2023-08-23 17:49:37.644398,0 days 00:00:01.545715,,0.6000000000000001,2.0,,LightGBM,,,,,0.7000000000000001,,,,0.07132730146895831,0.05082854395142017,,80.0,,,,,,,,,,251.0,,,,,,,,,COMPLETE,0.0,,,,,,,,,,,,,,,,,,,,
36,36,0.5952075277033291,2023-08-23 17:49:36.436866,2023-08-23 17:49:38.690247,0 days 00:00:02.253381,,0.7000000000000001,2.0,,LightGBM,,,,,0.7000000000000001,,,,0.00012445374692001275,0.03505836458617018,,80.0,,,,,,,,,,255.0,,,,,,,,,COMPLETE,0.0,,,,,,,,,,,,,,,,,,,,
37,37,0.3573487031700288,2023-08-23 17:49:36.660774,2023-08-23 17:49:38.343412,0 days 00:00:01.682638,,,,,MLPClassifier,,,,,,,,,,,,,,relu,sgd,1.0,10.0,,,,,,,,,,,,,,COMPLETE,0.0,,,,,,,,,,,,,,,,,,,,
38,38,0.5718943508041587,2023-08-23 17:49:36.815541,2023-08-23 17:49:38.432025,0 days 00:00:01.616484,,0.6000000000000001,1.0,,LightGBM,,,,,0.6000000000000001,,,,0.8186176724335058,0.007501207400499374,,80.0,,,,,,,,,,173.0,,,,,,,,,COMPLETE,0.0,,,,,,,,,,,,,,,,,,,,
39,39,0.5734430219312399,2023-08-23 17:49:37.769473,2023-08-23 17:49:39.815004,0 days 00:00:02.045531,,0.6000000000000001,2.0,,LightGBM,,,,,0.8,,,,0.09155014842590216,0.061065705531624104,,80.0,,,,,,,,,,252.0,,,,,,,,,COMPLETE,0.0,,,,,,,,,,,,,,,,,,,,
40,40,0.5754106925175597,2023-08-23 17:49:37.922759,2023-08-23 17:49:39.558876,0 days 00:00:01.636117,,0.6000000000000001,2.0,,LightGBM,,,,,0.8,,,,0.07552924090446624,0.05806808305568631,,80.0,,,,,,,,,,241.0,,,,,,,,,COMPLETE,0.0,,,,,,,,,,,,,,,,,,,,
41,41,0.5810250421694564,2023-08-23 17:49:38.508661,2023-08-23 17:49:40.417267,0 days 00:00:01.908606,,0.6000000000000001,2.0,,LightGBM,,,,,0.6000000000000001,,,,0.0865961747233811,0.06248019418698544,,80.0,,,,,,,,,,249.0,,,,,,,,,COMPLETE,0.0,,,,,,,,,,,,,,,,,,,,
42,42,0.5823531319105335,2023-08-23 17:49:38.520587,2023-08-23 17:49:40.318339,0 days 00:00:01.797752,,0.6000000000000001,2.0,,LightGBM,,,,,0.8,,,,0.06818376229212804,0.10857337922329754,,80.0,,,,,,,,,,252.0,,,,,,,,,COMPLETE,0.0,,,,,,,,,,,,,,,,,,,,
43,43,0.3691259545743471,2023-08-23 17:49:38.764667,2023-08-23 17:49:39.089966,0 days 00:00:00.325299,,,,,RandomForestClassifier,,,,,,,,,,,,,,,,,,,,,,,,10.0,2.0,,,,,,COMPLETE,0.0,,,,,,,,,,,,,,,,,,,,
44,44,0.5308341673856773,2023-08-23 17:49:39.202303,2023-08-23 17:49:39.327056,0 days 00:00:00.124753,,,,,DecisionTreeClassifier,,entropy,2.0,,,,,,,,,,,,,,,,,,,,,,,,,,,,COMPLETE,0.0,,,,,,,,,,,,,,,,,,,,
45,45,0.574080705851823,2023-08-23 17:49:39.435934,2023-08-23 17:49:40.826410,0 days 00:00:01.390476,,0.4,2.0,,LightGBM,,,,,0.8,,,,0.00016537439029169792,0.032601086776119295,,80.0,,,,,,,,,,255.0,,,,,,,,,COMPLETE,0.0,,,,,,,,,,,,,,,,,,,,
46,46,0.5594704907837593,2023-08-23 17:49:39.620700,2023-08-23 17:49:47.711431,0 days 00:00:08.090731,,,,,RandomForestClassifier,,,,,,,,,,,,,,,,,,,,,,,,95.0,29.0,,,,,,COMPLETE,0.0,,,,,,,,,,,,,,,,,,,,
47,47,0.5623646699418449,2023-08-23 17:49:39.909222,2023-08-23 17:49:47.523066,0 days 00:00:07.613844,,,,,RandomForestClassifier,,,,,,,,,,,,,,,,,,,,,,,,98.0,30.0,,,,,,COMPLETE,0.0,,,,,,,,,,,,,,,,,,,,
48,48,0.5803789077534961,2023-08-23 17:49:40.399310,2023-08-23 17:49:41.444133,0 days 00:00:01.044823,,0.4,2.0,,LightGBM,,,,,0.6000000000000001,,,,0.0003391987253625393,0.021171272603861785,,100.0,,,,,,,,,,92.0,,,,,,,,,COMPLETE,0.0,,,,,,,,,,,,,,,,,,,,
49,49,0.5556077228456213,2023-08-23 17:49:40.518897,2023-08-23 17:49:48.419739,0 days 00:00:07.900842,,,,,RandomForestClassifier,,,,,,,,,,,,,,,,,,,,,,,,100.0,32.0,,,,,,COMPLETE,0.0,,,,,,,,,,,,,,,,,,,,
50,50,0.5539883243016832,2023-08-23 17:49:40.895509,2023-08-23 17:49:48.011537,0 days 00:00:07.116028,,,,,RandomForestClassifier,,,,,,,,,,,,,,,,,,,,,,,,97.0,28.0,,,,,,COMPLETE,0.0,,,,,,,,,,,,,,,,,,,,
51,51,0.5192276146509504,2023-08-23 17:49:41.556673,2023-08-23 17:49:41.762461,0 days 00:00:00.205788,,,,,DecisionTreeClassifier,,log_loss,5.0,,,,,,,,,,,,,,,,,,,,,,,,,,,,COMPLETE,0.0,,,,,,,,,,,,,,,,,,,,
52,52,0.5530939996538436,2023-08-23 17:49:41.850606,2023-08-23 17:49:49.743156,0 days 00:00:07.892550,,,,,RandomForestClassifier,,,,,,,,,,,,,,,,,,,,,,,,99.0,32.0,,,,,,COMPLETE,0.0,,,,,,,,,,,,,,,,,,,,
53,53,0.41590706709557734,2023-08-23 17:49:47.612970,2023-08-23 17:49:52.525615,0 days 00:00:04.912645,,,,,MLPClassifier,,,,,,,,,,,,,,identity,adam,4.0,100.0,10.0,10.0,10.0,,,,,,,,,,,COMPLETE,0.0,,,,,,,,,,,,,,,,,,,,
54,54,0.5592885375494072,2023-08-23 17:49:47.805102,2023-08-23 17:49:48.241986,0 days 00:00:00.436884,4.226870836451672e-08,,,gbtree,XGBoost,0.9580975519399128,,,0.7800638978664804,,0.28979894345278817,lossguide,0.44280931281862335,,,3.0,,2.0,,,,,,,,,,,,,,,0.2447338608244808,,,COMPLETE,0.0,,,,,,,,,,,,,,,,,,,,
55,55,0.5599419328827593,2023-08-23 17:49:48.087220,2023-08-23 17:49:48.574174,0 days 00:00:00.486954,2.025411646581622e-08,,,gbtree,XGBoost,0.9822401965037583,,,0.6658465630992363,,0.2525475776914819,depthwise,0.8449612586265687,,,3.0,,2.0,,,,,,,,,,,,,,,0.21115172530323167,,,COMPLETE,0.0,,,,,,,,,,,,,,,,,,,,
56,56,0.40074156001114564,2023-08-23 17:49:48.317136,2023-08-23 17:50:02.762869,0 days 00:00:14.445733,,,,,MLPClassifier,,,,,,,,,,,,,,identity,lbfgs,4.0,100.0,10.0,10.0,10.0,,,,,,,,,,,COMPLETE,0.0,,,,,,,,,,,,,,,,,,,,
57,57,0.4044635166884967,2023-08-23 17:49:48.492442,2023-08-23 17:50:04.059039,0 days 00:00:15.566597,,,,,MLPClassifier,,,,,,,,,,,,,,identity,lbfgs,4.0,100.0,10.0,10.0,10.0,,,,,,,,,,,COMPLETE,0.0,,,,,,,,,,,,,,,,,,,,
58,58,0.5726434303509402,2023-08-23 17:49:48.679756,2023-08-23 17:49:50.314405,0 days 00:00:01.634649,,0.5,1.0,,LightGBM,,,,,0.5,,,,0.2093961143748987,0.0008568711640771501,,70.0,,,,,,,,,,183.0,,,,,,,,,COMPLETE,0.0,,,,,,,,,,,,,,,,,,,,
59,59,0.5825488884804257,2023-08-23 17:49:49.827583,2023-08-23 17:49:51.249673,0 days 00:00:01.422090,,0.5,1.0,,LightGBM,,,,,0.5,,,,0.20198549912067884,0.0011185986407887122,,70.0,,,,,,,,,,184.0,,,,,,,,,COMPLETE,0.0,,,,,,,,,,,,,,,,,,,,
60,60,0.5773790439300971,2023-08-23 17:49:50.375693,2023-08-23 17:49:52.079603,0 days 00:00:01.703910,,0.5,1.0,,LightGBM,,,,,0.7000000000000001,,,,0.22958667671890604,0.0007494324906219884,,50.0,,,,,,,,,,226.0,,,,,,,,,COMPLETE,0.0,,,,,,,,,,,,,,,,,,,,
61,61,0.5698156028368795,2023-08-23 17:49:51.331348,2023-08-23 17:49:53.716116,0 days 00:00:02.384768,,0.8,1.0,,LightGBM,,,,,0.7000000000000001,,,,0.2529375282078711,0.008076005738549925,,50.0,,,,,,,,,,220.0,,,,,,,,,COMPLETE,0.0,,,,,,,,,,,,,,,,,,,,
62,62,0.5731093954580342,2023-08-23 17:49:52.171995,2023-08-23 17:49:54.608743,0 days 00:00:02.436748,,0.8,1.0,,LightGBM,,,,,0.4,,,,1.023325698229551e-05,0.01169639123911444,,50.0,,,,,,,,,,230.0,,,,,,,,,COMPLETE,0.0,,,,,,,,,,,,,,,,,,,,
63,63,0.5533830239712593,2023-08-23 17:49:52.607386,2023-08-23 17:49:55.211907,0 days 00:00:02.604521,,0.8,1.0,,LightGBM,,,,,0.4,,,,2.806046709389297e-05,0.009497267029935834,,50.0,,,,,,,,,,228.0,,,,,,,,,COMPLETE,0.0,,,,,,,,,,,,,,,,,,,,
64,64,0.5800528736464708,2023-08-23 17:49:53.804636,2023-08-23 17:49:55.665608,0 days 00:00:01.860972,,0.7000000000000001,1.0,,LightGBM,,,,,0.4,,,,1.639786727629653e-05,0.010653034921826421,,70.0,,,,,,,,,,231.0,,,,,,,,,COMPLETE,0.0,,,,,,,,,,,,,,,,,,,,
65,65,0.591398513577502,2023-08-23 17:49:54.695304,2023-08-23 17:49:56.914516,0 days 00:00:02.219212,,0.7000000000000001,2.0,,LightGBM,,,,,0.6000000000000001,,,,0.01532776706356787,0.9632314980368257,,70.0,,,,,,,,,,202.0,,,,,,,,,COMPLETE,0.0,,,,,,,,,,,,,,,,,,,,
66,66,0.5471174528941742,2023-08-23 17:49:55.311355,2023-08-23 17:49:55.573919,0 days 00:00:00.262564,,,,,DecisionTreeClassifier,,log_loss,8.0,,,,,,,,,,,,,,,,,,,,,,,,,,,,COMPLETE,0.0,,,,,,,,,,,,,,,,,,,,
67,67,0.5922642132456248,2023-08-23 17:49:55.659704,2023-08-23 17:49:57.826146,0 days 00:00:02.166442,,0.7000000000000001,2.0,,LightGBM,,,,,0.6000000000000001,,,,0.011960897140254117,0.3610392466854971,,70.0,,,,,,,,,,195.0,,,,,,,,,COMPLETE,0.0,,,,,,,,,,,,,,,,,,,,
68,68,0.575004581271761,2023-08-23 17:49:55.765403,2023-08-23 17:49:57.207802,0 days 00:00:01.442399,,0.5,1.0,,LightGBM,,,,,0.5,,,,0.9725439252850284,0.003567257422880435,,70.0,,,,,,,,,,203.0,,,,,,,,,COMPLETE,0.0,,,,,,,,,,,,,,,,,,,,
69,69,0.5859814884487041,2023-08-23 17:49:57.004791,2023-08-23 17:49:59.380644,0 days 00:00:02.375853,,0.7000000000000001,2.0,,LightGBM,,,,,0.6000000000000001,,,,0.02040853403343616,0.8843750429240684,,70.0,,,,,,,,,,199.0,,,,,,,,,COMPLETE,0.0,,,,,,,,,,,,,,,,,,,,
70,70,0.5714316996482225,2023-08-23 17:49:57.278193,2023-08-23 17:49:59.175613,0 days 00:00:01.897420,,0.7000000000000001,2.0,,LightGBM,,,,,0.6000000000000001,,,,0.013572428867147397,0.3806280993669618,,90.0,,,,,,,,,,168.0,,,,,,,,,COMPLETE,0.0,,,,,,,,,,,,,,,,,,,,
71,71,0.5767403750414868,2023-08-23 17:49:57.927061,2023-08-23 17:49:59.767611,0 days 00:00:01.840550,,0.7000000000000001,2.0,,LightGBM,,,,,0.6000000000000001,,,,0.01657438945458819,0.5728844824639193,,70.0,,,,,,,,,,167.0,,,,,,,,,COMPLETE,0.0,,,,,,,,,,,,,,,,,,,,
72,72,0.5945791518627024,2023-08-23 17:49:59.252656,2023-08-23 17:50:01.482244,0 days 00:00:02.229588,,0.7000000000000001,2.0,,LightGBM,,,,,0.6000000000000001,,,,0.01401865883929988,0.83206019449824,,70.0,,,,,,,,,,195.0,,,,,,,,,COMPLETE,0.0,,,,,,,,,,,,,,,,,,,,
73,73,0.5836790574178561,2023-08-23 17:49:59.453744,2023-08-23 17:50:01.364259,0 days 00:00:01.910515,,0.7000000000000001,2.0,,LightGBM,,,,,0.6000000000000001,,,,0.008871256887402838,0.7635736911022174,,70.0,,,,,,,,,,197.0,,,,,,,,,COMPLETE,0.0,,,,,,,,,,,,,,,,,,,,
74,74,0.35918496602517125,2023-08-23 17:49:59.856493,2023-08-23 17:50:23.523220,0 days 00:00:23.666727,,,,,SVC,,,,,,,,,,,,,,,,,,,,,,,,,,,,,301.66341730525806,linear,COMPLETE,0.0,,,,,,,,,,,,,,,,,,,,
75,75,0.35918496602517125,2023-08-23 17:50:01.438958,2023-08-23 17:50:41.096612,0 days 00:00:39.657654,,,,,SVC,,,,,,,,,,,,,,,,,,,,,,,,,,,,,792.6730768440849,linear,COMPLETE,0.0,,,,,,,,,,,,,,,,,,,,
76,76,0.35918496602517125,2023-08-23 17:50:01.612847,2023-08-23 17:50:37.410965,0 days 00:00:35.798118,,,,,SVC,,,,,,,,,,,,,,,,,,,,,,,,,,,,,604.3058547908163,linear,COMPLETE,0.0,,,,,,,,,,,,,,,,,,,,
77,77,0.35918496602517125,2023-08-23 17:50:02.856480,2023-08-23 17:50:34.109393,0 days 00:00:31.252913,,,,,SVC,,,,,,,,,,,,,,,,,,,,,,,,,,,,,420.28635500725784,linear,COMPLETE,0.0,,,,,,,,,,,,,,,,,,,,
78,78,0.6063324592736358,2023-08-23 17:50:04.156899,2023-08-23 17:50:05.740507,0 days 00:00:01.583608,,0.7000000000000001,2.0,,LightGBM,,,,,0.5,,,,0.002387737383486613,0.18749036004839395,,70.0,,,,,,,,,,204.0,,,,,,,,,COMPLETE,1.0,0.6165919282511211,0.6061115184099055,0.609648569023569,0.6063324592736358,0.6995967741935484,0.6425925925925926,0.6698841698841699,0.5126262626262627,0.5767045454545454,0.5427807486631017,0.5833333333333334,0.5730082863434441,0.5752547798905111,0.572815064602294,0.6669329073482428,0.6148748159057438,0.6398467432950192,0.47908366533864544,0.5356347438752784,0.5057833859095688
79,79,0.35918496602517125,2023-08-23 17:50:05.873579,2023-08-23 17:50:32.314219,0 days 00:00:26.440640,,,,,SVC,,,,,,,,,,,,,,,,,,,,,,,,,,,,,350.0244537976763,linear,COMPLETE,0.0,,,,,,,,,,,,,,,,,,,,
80,80,0.5975477671809074,2023-08-23 17:50:23.623899,2023-08-23 17:50:25.384437,0 days 00:00:01.760538,,0.8,2.0,,LightGBM,,,,,0.5,,,,0.0016539391141389354,0.198729596626892,,60.0,,,,,,,,,,213.0,,,,,,,,,COMPLETE,0.0,,,,,,,,,,,,,,,,,,,,
81,81,0.5827919407894737,2023-08-23 17:50:25.509492,2023-08-23 17:50:27.290040,0 days 00:00:01.780548,,0.9,2.0,,LightGBM,,,,,0.5,,,,0.0024500426324658713,0.1870319099428093,,60.0,,,,,,,,,,184.0,,,,,,,,,COMPLETE,0.0,,,,,,,,,,,,,,,,,,,,
82,82,0.5810434708350639,2023-08-23 17:50:27.346457,2023-08-23 17:50:29.132355,0 days 00:00:01.785898,,0.8,2.0,,LightGBM,,,,,0.5,,,,0.0008820918635037224,0.2137323297792543,,60.0,,,,,,,,,,206.0,,,,,,,,,COMPLETE,0.0,,,,,,,,,,,,,,,,,,,,
83,83,0.5830237421577069,2023-08-23 17:50:29.256636,2023-08-23 17:50:30.831546,0 days 00:00:01.574910,,0.7000000000000001,2.0,,LightGBM,,,,,0.5,,,,0.00589987532441665,0.19646965323466967,,60.0,,,,,,,,,,212.0,,,,,,,,,COMPLETE,0.0,,,,,,,,,,,,,,,,,,,,
