,number,value,datetime_start,datetime_complete,duration,params_alpha,params_bagging_fraction,params_bagging_freq,params_booster,params_classifier,params_colsample_bytree,params_dct_criterion,params_dct_max_depth,params_eta,params_feature_fraction,params_gamma,params_grow_policy,params_lambda,params_lambda_l1,params_lambda_l2,params_max_depth,params_min_child_samples,params_min_child_weight,params_mlp_activation,params_mlp_solver,params_n_layers,params_n_units_l_0,params_n_units_l_1,params_n_units_l_2,params_n_units_l_3,params_normalize_type,params_num_leaves,params_rate_drop,params_rf_estimator,params_rf_max_depth,params_sample_type,params_skip_drop,params_subsample,params_svc_c,params_svc_kernel,state,best_trial,dev_acc,dev_recall_macro,dev_precision_macro,dev_f1_macro,dev_recall_0,dev_precision_0,dev_f1_0,dev_recall_1,dev_precision_1,dev_f1_1,test_acc,test_recall_macro,test_precision_macro,test_f1_macro,test_recall_0,test_precision_0,test_f1_0,test_recall_1,test_precision_1,test_f1_1
169,169,0.5320289307705892,2023-08-23 14:49:21.885337,2023-08-23 14:49:25.349483,0 days 00:00:03.464146,,0.8,1.0,,LightGBM,,,,,0.4,,,,5.157451617272873e-07,0.29337351169392567,,40.0,,,,,,,,,,229.0,,,,,,,,,COMPLETE,0.0,,,,,,,,,,,,,,,,,,,,
170,170,0.5355937239601837,2023-08-23 14:49:23.376335,2023-08-23 14:49:27.392749,0 days 00:00:04.016414,,0.8,1.0,,LightGBM,,,,,0.4,,,,5.223941614791459e-07,0.30921034241113504,,40.0,,,,,,,,,,142.0,,,,,,,,,COMPLETE,0.0,,,,,,,,,,,,,,,,,,,,
171,171,0.538201381951382,2023-08-23 14:49:23.588645,2023-08-23 14:49:26.825346,0 days 00:00:03.236701,,0.8,2.0,,LightGBM,,,,,0.4,,,,5.097151014311329e-07,0.2561634832597212,,40.0,,,,,,,,,,236.0,,,,,,,,,COMPLETE,0.0,,,,,,,,,,,,,,,,,,,,
172,172,0.5039816009545045,2023-08-23 14:49:23.661270,2023-08-23 14:49:29.060221,0 days 00:00:05.398951,,,,,RandomForestClassifier,,,,,,,,,,,,,,,,,,,,,,,,42.0,32.0,,,,,,COMPLETE,0.0,,,,,,,,,,,,,,,,,,,,
173,173,0.4866394148020654,2023-08-23 14:49:24.192351,2023-08-23 14:49:29.843106,0 days 00:00:05.650755,,,,,RandomForestClassifier,,,,,,,,,,,,,,,,,,,,,,,,42.0,31.0,,,,,,COMPLETE,0.0,,,,,,,,,,,,,,,,,,,,
174,174,0.4710341623260705,2023-08-23 14:49:24.257359,2023-08-23 14:51:09.553697,0 days 00:01:45.296338,,,,,MLPClassifier,,,,,,,,,,,,,,relu,lbfgs,1.0,60.0,,,,,,,,,,,,,,COMPLETE,0.0,,,,,,,,,,,,,,,,,,,,
175,175,0.48349739432541977,2023-08-23 14:49:24.501111,2023-08-23 14:51:09.134312,0 days 00:01:44.633201,,,,,MLPClassifier,,,,,,,,,,,,,,relu,lbfgs,1.0,60.0,,,,,,,,,,,,,,COMPLETE,0.0,,,,,,,,,,,,,,,,,,,,
176,176,0.5245526500350667,2023-08-23 14:49:25.196501,2023-08-23 14:49:30.223033,0 days 00:00:05.026532,,,,,RandomForestClassifier,,,,,,,,,,,,,,,,,,,,,,,,39.0,30.0,,,,,,COMPLETE,0.0,,,,,,,,,,,,,,,,,,,,
177,177,0.520223752151463,2023-08-23 14:49:25.443661,2023-08-23 14:49:31.548916,0 days 00:00:06.105255,,,,,RandomForestClassifier,,,,,,,,,,,,,,,,,,,,,,,,42.0,32.0,,,,,,COMPLETE,0.0,,,,,,,,,,,,,,,,,,,,
178,178,0.48150411985018726,2023-08-23 14:49:26.892396,2023-08-23 14:51:07.682494,0 days 00:01:40.790098,,,,,MLPClassifier,,,,,,,,,,,,,,relu,lbfgs,1.0,60.0,,,,,,,,,,,,,,COMPLETE,0.0,,,,,,,,,,,,,,,,,,,,
179,179,0.520223752151463,2023-08-23 14:49:27.508705,2023-08-23 14:49:32.812121,0 days 00:00:05.303416,,,,,RandomForestClassifier,,,,,,,,,,,,,,,,,,,,,,,,39.0,28.0,,,,,,COMPLETE,0.0,,,,,,,,,,,,,,,,,,,,
180,180,0.47496447022513366,2023-08-23 14:49:29.162110,2023-08-23 14:51:10.292269,0 days 00:01:41.130159,,,,,MLPClassifier,,,,,,,,,,,,,,relu,lbfgs,1.0,60.0,,,,,,,,,,,,,,COMPLETE,0.0,,,,,,,,,,,,,,,,,,,,
181,181,0.48718888506278824,2023-08-23 14:49:29.958631,2023-08-23 14:51:11.777691,0 days 00:01:41.819060,,,,,MLPClassifier,,,,,,,,,,,,,,relu,lbfgs,1.0,60.0,,,,,,,,,,,,,,COMPLETE,0.0,,,,,,,,,,,,,,,,,,,,
182,182,0.5370442454911121,2023-08-23 14:49:30.308291,2023-08-23 14:49:35.242053,0 days 00:00:04.933762,,0.7000000000000001,1.0,,LightGBM,,,,,0.7000000000000001,,,,9.750834126682403e-07,0.056099977482819696,,20.0,,,,,,,,,,157.0,,,,,,,,,COMPLETE,0.0,,,,,,,,,,,,,,,,,,,,
183,183,0.5273295710462866,2023-08-23 14:49:31.670635,2023-08-23 14:49:33.776836,0 days 00:00:02.106201,,0.5,1.0,,LightGBM,,,,,0.7000000000000001,,,,9.01062479502706e-07,0.05145826647982345,,100.0,,,,,,,,,,195.0,,,,,,,,,COMPLETE,0.0,,,,,,,,,,,,,,,,,,,,
184,184,0.46882482166218253,2023-08-23 14:49:32.916413,2023-08-23 14:51:15.926606,0 days 00:01:43.010193,,,,,MLPClassifier,,,,,,,,,,,,,,relu,lbfgs,1.0,60.0,,,,,,,,,,,,,,COMPLETE,0.0,,,,,,,,,,,,,,,,,,,,
185,185,0.5146753163722906,2023-08-23 14:49:33.921135,2023-08-23 14:49:38.630166,0 days 00:00:04.709031,,0.7000000000000001,3.0,,LightGBM,,,,,0.7000000000000001,,,,3.718714363569906e-05,0.06400958115853275,,20.0,,,,,,,,,,132.0,,,,,,,,,COMPLETE,0.0,,,,,,,,,,,,,,,,,,,,
186,186,0.4951488787242081,2023-08-23 14:49:35.397724,2023-08-23 14:51:14.330795,0 days 00:01:38.933071,,,,,MLPClassifier,,,,,,,,,,,,,,relu,lbfgs,1.0,60.0,,,,,,,,,,,,,,COMPLETE,0.0,,,,,,,,,,,,,,,,,,,,
187,187,0.4665963744266789,2023-08-23 14:49:38.713403,2023-08-23 14:51:18.840388,0 days 00:01:40.126985,,,,,MLPClassifier,,,,,,,,,,,,,,relu,lbfgs,1.0,60.0,,,,,,,,,,,,,,COMPLETE,0.0,,,,,,,,,,,,,,,,,,,,
188,188,0.5575121028901494,2023-08-23 14:51:07.805904,2023-08-23 14:51:14.826055,0 days 00:00:07.020151,,1.0,3.0,,LightGBM,,,,,0.7000000000000001,,,,3.203828807349956e-05,0.42522701903080723,,20.0,,,,,,,,,,245.0,,,,,,,,,COMPLETE,0.0,,,,,,,,,,,,,,,,,,,,
189,189,0.5387635928199586,2023-08-23 14:51:09.266175,2023-08-23 14:51:16.669854,0 days 00:00:07.403679,,1.0,3.0,,LightGBM,,,,,0.7000000000000001,,,,3.651898231529964e-05,0.10083618001065621,,20.0,,,,,,,,,,252.0,,,,,,,,,COMPLETE,0.0,,,,,,,,,,,,,,,,,,,,
190,190,0.5281695984069035,2023-08-23 14:51:09.657418,2023-08-23 14:51:16.580740,0 days 00:00:06.923322,,1.0,3.0,,LightGBM,,,,,0.7000000000000001,,,,3.5848776956012764e-05,0.4749002505180142,,20.0,,,,,,,,,,248.0,,,,,,,,,COMPLETE,0.0,,,,,,,,,,,,,,,,,,,,
191,191,0.5293181877258195,2023-08-23 14:51:10.388349,2023-08-23 14:51:14.456054,0 days 00:00:04.067705,,1.0,3.0,,LightGBM,,,,,0.7000000000000001,,,,1.371452697201791e-06,0.10385568240617182,,20.0,,,,,,,,,,117.0,,,,,,,,,COMPLETE,0.0,,,,,,,,,,,,,,,,,,,,
192,192,0.5211643295944448,2023-08-23 14:51:11.903241,2023-08-23 14:51:19.705868,0 days 00:00:07.802627,,1.0,3.0,,LightGBM,,,,,0.7000000000000001,,,,3.9740814663577885e-05,0.47310803740650975,,20.0,,,,,,,,,,244.0,,,,,,,,,COMPLETE,0.0,,,,,,,,,,,,,,,,,,,,
193,193,0.5559243279123797,2023-08-23 14:51:14.403794,2023-08-23 14:51:22.959846,0 days 00:00:08.556052,,1.0,3.0,,LightGBM,,,,,0.7000000000000001,,,,3.4888869288937503e-07,0.09480928067097814,,20.0,,,,,,,,,,251.0,,,,,,,,,COMPLETE,0.0,,,,,,,,,,,,,,,,,,,,
194,194,0.5114100912263437,2023-08-23 14:51:14.579869,2023-08-23 14:51:19.809369,0 days 00:00:05.229500,,0.9,3.0,,LightGBM,,,,,0.5,,,,3.3731437292429866e-05,0.4794309264241723,,50.0,,,,,,,,,,244.0,,,,,,,,,COMPLETE,0.0,,,,,,,,,,,,,,,,,,,,
195,195,0.5437517400340561,2023-08-23 14:51:14.958102,2023-08-23 14:51:19.553042,0 days 00:00:04.594940,,1.0,3.0,,LightGBM,,,,,0.7000000000000001,,,,2.9330890646170566e-05,0.4463532794110905,,50.0,,,,,,,,,,250.0,,,,,,,,,COMPLETE,0.0,,,,,,,,,,,,,,,,,,,,
196,196,0.5131382216450844,2023-08-23 14:51:16.057258,2023-08-23 14:51:20.069089,0 days 00:00:04.011831,,1.0,3.0,,LightGBM,,,,,0.7000000000000001,,,,3.220828096150053e-07,0.5146000022295385,,50.0,,,,,,,,,,252.0,,,,,,,,,COMPLETE,0.0,,,,,,,,,,,,,,,,,,,,
197,197,0.5307310284150911,2023-08-23 14:51:16.655197,2023-08-23 14:51:21.053262,0 days 00:00:04.398065,,1.0,3.0,,LightGBM,,,,,0.7000000000000001,,,,3.543871342559535e-07,0.10171149176385973,,50.0,,,,,,,,,,252.0,,,,,,,,,COMPLETE,0.0,,,,,,,,,,,,,,,,,,,,
198,198,0.523926482094649,2023-08-23 14:51:16.797869,2023-08-23 14:51:20.324463,0 days 00:00:03.526594,,0.9,2.0,,LightGBM,,,,,0.5,,,,3.2932887502674633e-07,0.4532809351886492,,50.0,,,,,,,,,,243.0,,,,,,,,,COMPLETE,0.0,,,,,,,,,,,,,,,,,,,,
199,199,0.530260861239314,2023-08-23 14:51:18.901320,2023-08-23 14:51:21.977311,0 days 00:00:03.075991,,0.9,2.0,,LightGBM,,,,,0.7000000000000001,,,,2.2404218938886326e-05,0.4864892316549845,,50.0,,,,,,,,,,238.0,,,,,,,,,COMPLETE,0.0,,,,,,,,,,,,,,,,,,,,
200,200,0.5308595915787073,2023-08-23 14:51:19.622805,2023-08-23 14:51:26.066158,0 days 00:00:06.443353,,0.9,2.0,,LightGBM,,,,,0.5,,,,3.1838419500984215e-07,0.46619706637192604,,20.0,,,,,,,,,,239.0,,,,,,,,,COMPLETE,0.0,,,,,,,,,,,,,,,,,,,,
201,201,0.49737480975928294,2023-08-23 14:51:19.751943,2023-08-23 14:51:26.546622,0 days 00:00:06.794679,,0.9,2.0,,LightGBM,,,,,0.5,,,,2.0339370541294604e-05,0.9964742299010073,,20.0,,,,,,,,,,240.0,,,,,,,,,COMPLETE,0.0,,,,,,,,,,,,,,,,,,,,
202,202,0.538201381951382,2023-08-23 14:51:19.857296,2023-08-23 14:51:26.932497,0 days 00:00:07.075201,,0.9,2.0,,LightGBM,,,,,0.5,,,,1.9421129874374153e-05,0.36824387826555405,,20.0,,,,,,,,,,227.0,,,,,,,,,COMPLETE,0.0,,,,,,,,,,,,,,,,,,,,
203,203,0.5312395937395937,2023-08-23 14:51:20.129434,2023-08-23 14:51:24.635103,0 days 00:00:04.505669,,0.9,2.0,,LightGBM,,,,,0.5,,,,2.2350295668674126e-05,0.37095170935794336,,20.0,,,,,,,,,,171.0,,,,,,,,,COMPLETE,0.0,,,,,,,,,,,,,,,,,,,,
204,204,0.5457367067174628,2023-08-23 14:51:20.383592,2023-08-23 14:51:25.934072,0 days 00:00:05.550480,,0.9,2.0,,LightGBM,,,,,0.4,,,,1.4924552494693494e-05,0.025004294048289962,,20.0,,,,,,,,,,226.0,,,,,,,,,COMPLETE,0.0,,,,,,,,,,,,,,,,,,,,
205,205,0.5400583855413783,2023-08-23 14:51:21.101745,2023-08-23 14:51:26.757469,0 days 00:00:05.655724,,0.9,2.0,,LightGBM,,,,,0.4,,,,1.5722033998751547e-05,0.9749425395994624,,20.0,,,,,,,,,,226.0,,,,,,,,,COMPLETE,0.0,,,,,,,,,,,,,,,,,,,,
206,206,0.46520773578675434,2023-08-23 14:51:22.037853,2023-08-23 14:51:25.213895,0 days 00:00:03.176042,,0.4,3.0,,LightGBM,,,,,0.4,,,,2.1277199176749258e-05,0.9512863031937453,,20.0,,,,,,,,,,226.0,,,,,,,,,COMPLETE,0.0,,,,,,,,,,,,,,,,,,,,
207,207,0.5295948203842941,2023-08-23 14:51:23.025836,2023-08-23 14:51:28.849879,0 days 00:00:05.824043,,1.0,3.0,,LightGBM,,,,,0.4,,,,2.01424101761918e-07,0.9827546397129995,,20.0,,,,,,,,,,223.0,,,,,,,,,COMPLETE,0.0,,,,,,,,,,,,,,,,,,,,
208,208,0.5180176231626185,2023-08-23 14:51:24.688059,2023-08-23 14:51:30.526044,0 days 00:00:05.837985,,1.0,3.0,,LightGBM,,,,,0.4,,,,1.6478203571189466e-07,0.028393689800362203,,20.0,,,,,,,,,,227.0,,,,,,,,,COMPLETE,0.0,,,,,,,,,,,,,,,,,,,,
209,209,0.5233202660269538,2023-08-23 14:51:25.261362,2023-08-23 14:51:31.600685,0 days 00:00:06.339323,,1.0,3.0,,LightGBM,,,,,0.7000000000000001,,,,1.530067345965582e-05,0.20504773713783647,,20.0,,,,,,,,,,220.0,,,,,,,,,COMPLETE,0.0,,,,,,,,,,,,,,,,,,,,
210,210,0.5277851304009342,2023-08-23 14:51:26.001683,2023-08-23 14:51:32.124130,0 days 00:00:06.122447,,1.0,3.0,,LightGBM,,,,,0.7000000000000001,,,,4.684675611818871e-05,0.1988904554307438,,20.0,,,,,,,,,,219.0,,,,,,,,,COMPLETE,0.0,,,,,,,,,,,,,,,,,,,,
211,211,0.5262375185893351,2023-08-23 14:51:26.123752,2023-08-23 14:51:31.110111,0 days 00:00:04.986359,,1.0,3.0,,LightGBM,,,,,0.7000000000000001,,,,6.625146462656363e-07,0.2083237402583194,,30.0,,,,,,,,,,220.0,,,,,,,,,COMPLETE,0.0,,,,,,,,,,,,,,,,,,,,
212,212,0.524891821175446,2023-08-23 14:51:26.595076,2023-08-23 14:51:31.965874,0 days 00:00:05.370798,,1.0,3.0,,LightGBM,,,,,0.7000000000000001,,,,1.8086171858647418e-07,0.07618327635181552,,30.0,,,,,,,,,,218.0,,,,,,,,,COMPLETE,0.0,,,,,,,,,,,,,,,,,,,,
213,213,0.5331706280733935,2023-08-23 14:51:26.820145,2023-08-23 14:51:29.597905,0 days 00:00:02.777760,,1.0,3.0,,LightGBM,,,,,0.7000000000000001,,,,4.881797135510329e-05,0.20050229376112325,,30.0,,,,,,,,,,100.0,,,,,,,,,COMPLETE,0.0,,,,,,,,,,,,,,,,,,,,
214,214,0.535646544614877,2023-08-23 14:51:26.978531,2023-08-23 14:51:29.492181,0 days 00:00:02.513650,,1.0,3.0,,LightGBM,,,,,0.7000000000000001,,,,1.6797230360477952e-07,0.0766042164221128,,30.0,,,,,,,,,,103.0,,,,,,,,,COMPLETE,0.0,,,,,,,,,,,,,,,,,,,,
215,215,0.3596554199569275,2023-08-23 14:51:28.897475,2023-08-23 14:51:35.925572,0 days 00:00:07.028097,,,,,SVC,,,,,,,,,,,,,,,,,,,,,,,,,,,,,9.467313137760366,linear,COMPLETE,0.0,,,,,,,,,,,,,,,,,,,,
216,216,0.3596554199569275,2023-08-23 14:51:29.538149,2023-08-23 14:51:35.618300,0 days 00:00:06.080151,,,,,SVC,,,,,,,,,,,,,,,,,,,,,,,,,,,,,11.293332309284434,linear,COMPLETE,0.0,,,,,,,,,,,,,,,,,,,,
217,217,0.4509704837214632,2023-08-23 14:51:29.654518,2023-08-23 14:51:29.972752,0 days 00:00:00.318234,,,,,DecisionTreeClassifier,,entropy,12.0,,,,,,,,,,,,,,,,,,,,,,,,,,,,COMPLETE,0.0,,,,,,,,,,,,,,,,,,,,
218,218,0.5296526054590571,2023-08-23 14:51:30.041909,2023-08-23 14:51:33.793484,0 days 00:00:03.751575,,0.5,3.0,,LightGBM,,,,,0.4,,,,6.533060948799911e-07,0.027369764832754995,,20.0,,,,,,,,,,220.0,,,,,,,,,COMPLETE,0.0,,,,,,,,,,,,,,,,,,,,
219,219,0.5287502061685634,2023-08-23 14:51:30.588872,2023-08-23 14:51:36.341211,0 days 00:00:05.752339,,1.0,3.0,,LightGBM,,,,,0.7000000000000001,,,,1.4004417746399281e-05,0.013740400245730356,,20.0,,,,,,,,,,235.0,,,,,,,,,COMPLETE,0.0,,,,,,,,,,,,,,,,,,,,
220,220,0.5300097630522711,2023-08-23 14:51:31.164396,2023-08-23 14:51:34.935359,0 days 00:00:03.770963,,0.5,3.0,,LightGBM,,,,,0.4,,,,1.161800166167146e-05,0.021236699272189942,,20.0,,,,,,,,,,211.0,,,,,,,,,COMPLETE,0.0,,,,,,,,,,,,,,,,,,,,
221,221,0.5355937239601837,2023-08-23 14:51:31.662829,2023-08-23 14:51:35.511170,0 days 00:00:03.848341,,0.5,3.0,,LightGBM,,,,,0.4,,,,4.301209325076276e-05,0.02281478745885651,,20.0,,,,,,,,,,213.0,,,,,,,,,COMPLETE,0.0,,,,,,,,,,,,,,,,,,,,
222,222,0.3573487031700288,2023-08-23 14:51:32.016232,2023-08-23 14:51:37.993357,0 days 00:00:05.977125,,,,,SVC,,,,,,,,,,,,,,,,,,,,,,,,,,,,,8.891816142020142,rbf,COMPLETE,0.0,,,,,,,,,,,,,,,,,,,,
223,223,0.5592613180161818,2023-08-23 14:51:32.178782,2023-08-23 14:51:36.170822,0 days 00:00:03.992040,,0.5,3.0,,LightGBM,,,,,0.8,,,,8.578180302995907e-05,0.0464304377024147,,20.0,,,,,,,,,,233.0,,,,,,,,,COMPLETE,0.0,,,,,,,,,,,,,,,,,,,,
224,224,0.5467940249974595,2023-08-23 14:51:33.857916,2023-08-23 14:51:36.523135,0 days 00:00:02.665219,,0.4,3.0,,LightGBM,,,,,0.8,,,,1.1984927650511908e-05,0.015019214344623619,,30.0,,,,,,,,,,211.0,,,,,,,,,COMPLETE,0.0,,,,,,,,,,,,,,,,,,,,
225,225,0.3596554199569275,2023-08-23 14:51:34.999599,2023-08-23 14:51:41.166663,0 days 00:00:06.167064,,,,,SVC,,,,,,,,,,,,,,,,,,,,,,,,,,,,,10.77754874692937,linear,COMPLETE,0.0,,,,,,,,,,,,,,,,,,,,
226,226,0.5376092843326885,2023-08-23 14:51:35.569714,2023-08-23 14:51:40.664350,0 days 00:00:05.094636,,0.9,2.0,,LightGBM,,,,,1.0,,,,3.1878119485920662e-06,0.1277741461840064,,30.0,,,,,,,,,,234.0,,,,,,,,,COMPLETE,0.0,,,,,,,,,,,,,,,,,,,,
227,227,0.5244933171950246,2023-08-23 14:51:35.680001,2023-08-23 14:51:41.076608,0 days 00:00:05.396607,,0.9,2.0,,LightGBM,,,,,0.8,,,,1.525245057072629e-06,0.11741897349042678,,30.0,,,,,,,,,,186.0,,,,,,,,,COMPLETE,0.0,,,,,,,,,,,,,,,,,,,,
228,228,0.5287612069796587,2023-08-23 14:51:35.976606,2023-08-23 14:51:42.194914,0 days 00:00:06.218308,,0.4,3.0,,LightGBM,,,,,0.9,,,,3.3540849723805976e-06,0.12571616845373285,,10.0,,,,,,,,,,232.0,,,,,,,,,COMPLETE,0.0,,,,,,,,,,,,,,,,,,,,
229,229,0.5428302781106816,2023-08-23 14:51:36.231221,2023-08-23 14:51:39.160345,0 days 00:00:02.929124,,0.5,3.0,,LightGBM,,,,,0.8,,,,8.894242323413046e-05,0.012820518892153143,,30.0,,,,,,,,,,231.0,,,,,,,,,COMPLETE,0.0,,,,,,,,,,,,,,,,,,,,
230,230,0.5394492239297406,2023-08-23 14:51:36.394421,2023-08-23 14:51:39.396461,0 days 00:00:03.002040,,0.5,3.0,,LightGBM,,,,,0.8,,,,8.754733705490004e-05,0.04376455570018137,,30.0,,,,,,,,,,199.0,,,,,,,,,COMPLETE,0.0,,,,,,,,,,,,,,,,,,,,
231,231,0.5379453240969817,2023-08-23 14:51:36.589064,2023-08-23 14:51:40.599723,0 days 00:00:04.010659,,0.4,3.0,,LightGBM,,,,,0.8,,,,8.824375080498213e-05,0.04597827747365305,,30.0,,,,,,,,,,187.0,,,,,,,,,COMPLETE,0.0,,,,,,,,,,,,,,,,,,,,
232,232,0.5179420665801988,2023-08-23 14:51:38.056761,2023-08-23 14:51:41.322655,0 days 00:00:03.265894,,0.4,3.0,,LightGBM,,,,,0.8,,,,9.26955283486283e-05,0.05737466688863978,,30.0,,,,,,,,,,124.0,,,,,,,,,COMPLETE,0.0,,,,,,,,,,,,,,,,,,,,
233,233,0.5339752484843194,2023-08-23 14:51:39.212897,2023-08-23 14:51:41.926373,0 days 00:00:02.713476,,0.4,3.0,,LightGBM,,,,,0.8,,,,3.6349611822476944e-06,0.045489287329713385,,30.0,,,,,,,,,,202.0,,,,,,,,,COMPLETE,0.0,,,,,,,,,,,,,,,,,,,,
234,234,0.5290875846617393,2023-08-23 14:51:39.462838,2023-08-23 14:51:41.550888,0 days 00:00:02.088050,,0.4,3.0,,LightGBM,,,,,0.8,,,,3.221967251599531e-06,0.005932568491083652,,30.0,,,,,,,,,,126.0,,,,,,,,,COMPLETE,0.0,,,,,,,,,,,,,,,,,,,,
235,235,0.533987345446102,2023-08-23 14:51:40.658586,2023-08-23 14:51:42.443742,0 days 00:00:01.785156,,0.4,3.0,,LightGBM,,,,,0.8,,,,2.7824972309908887e-06,0.12156150404142074,,60.0,,,,,,,,,,127.0,,,,,,,,,COMPLETE,0.0,,,,,,,,,,,,,,,,,,,,
236,236,0.5330257422125724,2023-08-23 14:51:40.738111,2023-08-23 14:51:46.122429,0 days 00:00:05.384318,,0.4,3.0,,LightGBM,,,,,0.9,,,,0.00017486844246823282,0.005879424345798915,,10.0,,,,,,,,,,128.0,,,,,,,,,COMPLETE,0.0,,,,,,,,,,,,,,,,,,,,
237,237,0.5427772600186394,2023-08-23 14:51:41.138209,2023-08-23 14:51:45.398661,0 days 00:00:04.260452,,0.4,3.0,,LightGBM,,,,,0.8,,,,0.00017455299109036496,0.004111948743601558,,10.0,,,,,,,,,,123.0,,,,,,,,,COMPLETE,0.0,,,,,,,,,,,,,,,,,,,,
238,238,0.5152167654868913,2023-08-23 14:51:41.217523,2023-08-23 14:51:47.245889,0 days 00:00:06.028366,,0.4,3.0,,LightGBM,,,,,0.8,,,,2.722199606713536e-05,0.034387440811799994,,10.0,,,,,,,,,,204.0,,,,,,,,,COMPLETE,0.0,,,,,,,,,,,,,,,,,,,,
239,239,0.5186060855263158,2023-08-23 14:51:41.379459,2023-08-23 14:51:43.609646,0 days 00:00:02.230187,,0.4,3.0,,LightGBM,,,,,0.8,,,,7.343892133428296e-06,0.005961393683850628,,40.0,,,,,,,,,,203.0,,,,,,,,,COMPLETE,0.0,,,,,,,,,,,,,,,,,,,,
240,240,0.5438330053154395,2023-08-23 14:51:41.598008,2023-08-23 14:51:43.261197,0 days 00:00:01.663189,,0.4,3.0,,LightGBM,,,,,0.9,,,,3.113471036690448e-05,0.0297191104960484,,60.0,,,,,,,,,,132.0,,,,,,,,,COMPLETE,0.0,,,,,,,,,,,,,,,,,,,,
241,241,0.5375628785545632,2023-08-23 14:51:41.984668,2023-08-23 14:51:43.526869,0 days 00:00:01.542201,,0.4,3.0,,LightGBM,,,,,0.7000000000000001,,,,2.8377309100136938e-05,0.32433230027145654,,60.0,,,,,,,,,,256.0,,,,,,,,,COMPLETE,0.0,,,,,,,,,,,,,,,,,,,,
242,242,0.5414416222620767,2023-08-23 14:51:42.245399,2023-08-23 14:51:45.330887,0 days 00:00:03.085488,,0.9,3.0,,LightGBM,,,,,0.7000000000000001,,,,3.1557041801875746e-05,0.3499600713417332,,60.0,,,,,,,,,,155.0,,,,,,,,,COMPLETE,0.0,,,,,,,,,,,,,,,,,,,,
243,243,0.5451631701631702,2023-08-23 14:51:42.489899,2023-08-23 14:51:47.101933,0 days 00:00:04.612034,,0.9,1.0,,LightGBM,,,,,0.7000000000000001,,,,2.9848778738560205e-05,0.33004064699800145,,20.0,,,,,,,,,,153.0,,,,,,,,,COMPLETE,0.0,,,,,,,,,,,,,,,,,,,,
244,244,0.5298781035319655,2023-08-23 14:51:43.310077,2023-08-23 14:51:48.671051,0 days 00:00:05.360974,,0.8,1.0,,LightGBM,,,,,0.7000000000000001,,,,7.4001942898236115e-06,0.3030949806547301,,20.0,,,,,,,,,,256.0,,,,,,,,,COMPLETE,0.0,,,,,,,,,,,,,,,,,,,,
245,245,0.52739512559995,2023-08-23 14:51:43.589384,2023-08-23 14:51:47.161889,0 days 00:00:03.572505,,0.9,1.0,,LightGBM,,,,,0.7000000000000001,,,,7.73533722575392e-06,0.015877022058569824,,20.0,,,,,,,,,,108.0,,,,,,,,,COMPLETE,0.0,,,,,,,,,,,,,,,,,,,,
246,246,0.5451631701631702,2023-08-23 14:51:43.662637,2023-08-23 14:51:47.469958,0 days 00:00:03.807321,,0.9,1.0,,LightGBM,,,,,0.7000000000000001,,,,5.2734333947221323e-05,0.643853579082753,,20.0,,,,,,,,,,112.0,,,,,,,,,COMPLETE,0.0,,,,,,,,,,,,,,,,,,,,
247,247,0.5233202660269538,2023-08-23 14:51:45.381431,2023-08-23 14:51:48.581494,0 days 00:00:03.200063,,1.0,1.0,,LightGBM,,,,,0.7000000000000001,,,,5.101810645920403e-05,0.018905521681566364,,20.0,,,,,,,,,,112.0,,,,,,,,,COMPLETE,0.0,,,,,,,,,,,,,,,,,,,,
248,248,0.5447258105468245,2023-08-23 14:51:45.468925,2023-08-23 14:51:48.425251,0 days 00:00:02.956326,,1.0,1.0,,LightGBM,,,,,1.0,,,,4.899128759642335e-07,0.5992805821947143,,10.0,,,,,,,,,,108.0,,,,,,,,,COMPLETE,0.0,,,,,,,,,,,,,,,,,,,,
249,249,0.5161865207891025,2023-08-23 14:51:46.180006,2023-08-23 14:51:49.509674,0 days 00:00:03.329668,,1.0,1.0,,LightGBM,,,,,1.0,,,,4.994748561073551e-05,0.6200500862918967,,20.0,,,,,,,,,,208.0,,,,,,,,,COMPLETE,0.0,,,,,,,,,,,,,,,,,,,,
