,number,value,datetime_start,datetime_complete,duration,params_alpha,params_bagging_fraction,params_bagging_freq,params_booster,params_classifier,params_colsample_bytree,params_dct_criterion,params_dct_max_depth,params_eta,params_feature_fraction,params_gamma,params_grow_policy,params_lambda,params_lambda_l1,params_lambda_l2,params_max_depth,params_min_child_samples,params_min_child_weight,params_mlp_activation,params_mlp_solver,params_n_layers,params_n_units_l_0,params_n_units_l_1,params_n_units_l_2,params_n_units_l_3,params_normalize_type,params_num_leaves,params_rate_drop,params_rf_estimator,params_rf_max_depth,params_sample_type,params_skip_drop,params_subsample,params_svc_c,params_svc_kernel,state,best_trial,dev_acc,dev_recall_macro,dev_precision_macro,dev_f1_macro,dev_recall_0,dev_precision_0,dev_f1_0,dev_recall_1,dev_precision_1,dev_f1_1,test_acc,test_recall_macro,test_precision_macro,test_f1_macro,test_recall_0,test_precision_0,test_f1_0,test_recall_1,test_precision_1,test_f1_1
85,85,0.522082432215752,2023-08-23 17:47:06.830026,2023-08-23 17:47:09.197261,0 days 00:00:02.367235,,0.5,2.0,,LightGBM,,,,,0.5,,,,0.021695996297988133,0.0001848401900526431,,50.0,,,,,,,,,,75.0,,,,,,,,,COMPLETE,0.0,,,,,,,,,,,,,,,,,,,,
86,86,0.5234550822786118,2023-08-23 17:47:07.709742,2023-08-23 17:47:10.310455,0 days 00:00:02.600713,,0.5,2.0,,LightGBM,,,,,0.5,,,,0.030697658032127928,0.0004347553878134879,,50.0,,,,,,,,,,71.0,,,,,,,,,COMPLETE,0.0,,,,,,,,,,,,,,,,,,,,
87,87,0.5385927061942761,2023-08-23 17:47:08.465806,2023-08-23 17:47:12.218457,0 days 00:00:03.752651,,0.5,2.0,,LightGBM,,,,,0.5,,,,0.03596432240526051,0.00023041122593295412,,30.0,,,,,,,,,,172.0,,,,,,,,,COMPLETE,0.0,,,,,,,,,,,,,,,,,,,,
88,88,0.5364423170850835,2023-08-23 17:47:09.262113,2023-08-23 17:47:13.222703,0 days 00:00:03.960590,,0.5,1.0,,LightGBM,,,,,0.8,,,,0.26510503056897383,0.0005743623101384766,,30.0,,,,,,,,,,168.0,,,,,,,,,COMPLETE,0.0,,,,,,,,,,,,,,,,,,,,
89,89,0.5254703516283897,2023-08-23 17:47:09.704190,2023-08-23 17:47:12.064470,0 days 00:00:02.360280,,0.5,1.0,,LightGBM,,,,,0.6000000000000001,,,,0.4457287333234691,0.00039292659040686173,,30.0,,,,,,,,,,55.0,,,,,,,,,COMPLETE,0.0,,,,,,,,,,,,,,,,,,,,
90,90,0.530068539292555,2023-08-23 17:47:10.437338,2023-08-23 17:47:14.552675,0 days 00:00:04.115337,,0.4,1.0,,LightGBM,,,,,0.6000000000000001,,,,0.328529871496254,0.0011857164755802781,,20.0,,,,,,,,,,175.0,,,,,,,,,COMPLETE,0.0,,,,,,,,,,,,,,,,,,,,
91,91,0.5242778055278055,2023-08-23 17:47:12.136236,2023-08-23 17:47:15.489764,0 days 00:00:03.353528,,0.4,1.0,,LightGBM,,,,,0.8,,,,0.28006399047039365,0.001862300795219246,,30.0,,,,,,,,,,174.0,,,,,,,,,COMPLETE,0.0,,,,,,,,,,,,,,,,,,,,
92,92,0.5403273436719138,2023-08-23 17:47:12.324707,2023-08-23 17:47:14.822521,0 days 00:00:02.497814,,0.4,1.0,,LightGBM,,,,,0.8,,,,0.297672059242057,0.00239604100077555,,60.0,,,,,,,,,,171.0,,,,,,,,,COMPLETE,0.0,,,,,,,,,,,,,,,,,,,,
93,93,0.4020831961476573,2023-08-23 17:47:13.357831,2023-08-23 17:47:13.544919,0 days 00:00:00.187088,2.1473424972235143e-06,,,gblinear,XGBoost,0.5556009026496532,,,,,,,8.427974940532669e-05,,,,,,,,,,,,,,,,,,,,0.8175540136500807,,,COMPLETE,0.0,,,,,,,,,,,,,,,,,,,,
94,94,0.5166456228956229,2023-08-23 17:47:13.697229,2023-08-23 17:47:15.670831,0 days 00:00:01.973602,,0.4,1.0,,LightGBM,,,,,0.6000000000000001,,,,0.3705498493211256,0.0026550502827286993,,60.0,,,,,,,,,,44.0,,,,,,,,,COMPLETE,0.0,,,,,,,,,,,,,,,,,,,,
95,95,0.5323136367627992,2023-08-23 17:47:14.729077,2023-08-23 17:47:17.189567,0 days 00:00:02.460490,,0.4,1.0,,LightGBM,,,,,0.9,,,,0.005669958446763568,1.1269840127001594e-05,,60.0,,,,,,,,,,106.0,,,,,,,,,COMPLETE,0.0,,,,,,,,,,,,,,,,,,,,
96,96,0.5364423170850835,2023-08-23 17:47:14.949553,2023-08-23 17:47:17.191096,0 days 00:00:02.241543,,0.4,1.0,,LightGBM,,,,,0.9,,,,0.007189824019757513,1.0926680565197766e-05,,70.0,,,,,,,,,,108.0,,,,,,,,,COMPLETE,0.0,,,,,,,,,,,,,,,,,,,,
97,97,0.5293049860955005,2023-08-23 17:47:15.561020,2023-08-23 17:47:15.944716,0 days 00:00:00.383696,,,,,DecisionTreeClassifier,,log_loss,4.0,,,,,,,,,,,,,,,,,,,,,,,,,,,,COMPLETE,0.0,,,,,,,,,,,,,,,,,,,,
98,98,0.5193307090209975,2023-08-23 17:47:15.793966,2023-08-23 17:47:17.618002,0 days 00:00:01.824036,,0.4,1.0,,LightGBM,,,,,0.9,,,,0.06863189052862004,7.003096274131489e-06,,90.0,,,,,,,,,,113.0,,,,,,,,,COMPLETE,0.0,,,,,,,,,,,,,,,,,,,,
99,99,0.5402799759401792,2023-08-23 17:47:16.067234,2023-08-23 17:47:17.937336,0 days 00:00:01.870102,,0.4,1.0,,LightGBM,,,,,0.9,,,,0.08050303663569007,6.835950773869894e-06,,90.0,,,,,,,,,,111.0,,,,,,,,,COMPLETE,0.0,,,,,,,,,,,,,,,,,,,,
100,100,0.5487759447557575,2023-08-23 17:47:17.388429,2023-08-23 17:47:19.073795,0 days 00:00:01.685366,,0.4,1.0,,LightGBM,,,,,0.9,,,,0.05693960243231915,3.1436344047248754e-05,,90.0,,,,,,,,,,94.0,,,,,,,,,COMPLETE,0.0,,,,,,,,,,,,,,,,,,,,
101,101,0.5487759447557575,2023-08-23 17:47:17.391572,2023-08-23 17:47:19.220997,0 days 00:00:01.829425,,0.4,1.0,,LightGBM,,,,,0.9,,,,0.05600414508377675,1.9071653791578457e-06,,90.0,,,,,,,,,,88.0,,,,,,,,,COMPLETE,0.0,,,,,,,,,,,,,,,,,,,,
102,102,0.5592047743946478,2023-08-23 17:47:17.746242,2023-08-23 17:47:19.453001,0 days 00:00:01.706759,,0.4,1.0,,LightGBM,,,,,0.7000000000000001,,,,0.06245925834926185,1.7320182334893062e-06,,100.0,,,,,,,,,,90.0,,,,,,,,,COMPLETE,0.0,,,,,,,,,,,,,,,,,,,,
103,103,0.47007726167390035,2023-08-23 17:47:18.011092,2023-08-23 17:47:18.707090,0 days 00:00:00.695998,0.0014599258826942779,,,dart,XGBoost,0.8567066722904191,,,5.5260565613711645e-06,,0.007918510662636498,depthwise,2.8149564479795554e-07,,,3.0,,9.0,,,,,,,,forest,,1.2064102716110136e-08,,,uniform,4.2084884184852214e-08,0.5442180295905968,,,COMPLETE,0.0,,,,,,,,,,,,,,,,,,,,
104,104,0.5294757033248082,2023-08-23 17:47:18.775162,2023-08-23 17:47:20.131387,0 days 00:00:01.356225,,0.4,3.0,,LightGBM,,,,,0.7000000000000001,,,,0.14730881482485236,1.6122237657761148e-06,,100.0,,,,,,,,,,89.0,,,,,,,,,COMPLETE,0.0,,,,,,,,,,,,,,,,,,,,
105,105,0.5412350131917311,2023-08-23 17:47:19.215562,2023-08-23 17:47:20.692742,0 days 00:00:01.477180,,0.4,3.0,,LightGBM,,,,,0.7000000000000001,,,,0.738063096636358,2.9944137015463953e-05,,100.0,,,,,,,,,,133.0,,,,,,,,,COMPLETE,0.0,,,,,,,,,,,,,,,,,,,,
106,106,0.5353770459540131,2023-08-23 17:47:19.310689,2023-08-23 17:47:21.256776,0 days 00:00:01.946087,,0.7000000000000001,3.0,,LightGBM,,,,,0.7000000000000001,,,,0.011615705807900932,2.6076171965848742e-05,,100.0,,,,,,,,,,128.0,,,,,,,,,COMPLETE,0.0,,,,,,,,,,,,,,,,,,,,
107,107,0.5329720673316054,2023-08-23 17:47:19.554874,2023-08-23 17:47:21.265064,0 days 00:00:01.710190,,0.4,1.0,,LightGBM,,,,,0.7000000000000001,,,,0.05404298370585313,1.547475093822827e-06,,80.0,,,,,,,,,,87.0,,,,,,,,,COMPLETE,0.0,,,,,,,,,,,,,,,,,,,,
108,108,0.5395459500251552,2023-08-23 17:47:20.230040,2023-08-23 17:47:21.793495,0 days 00:00:01.563455,,0.4,1.0,,LightGBM,,,,,0.7000000000000001,,,,0.04972673529751985,2.5834860088427674e-05,,100.0,,,,,,,,,,86.0,,,,,,,,,COMPLETE,0.0,,,,,,,,,,,,,,,,,,,,
109,109,0.5428357209238921,2023-08-23 17:47:20.814032,2023-08-23 17:47:22.613031,0 days 00:00:01.798999,,0.5,1.0,,LightGBM,,,,,0.7000000000000001,,,,0.05748088356398446,0.00015491164682439811,,100.0,,,,,,,,,,123.0,,,,,,,,,COMPLETE,0.0,,,,,,,,,,,,,,,,,,,,
110,110,0.5447397251287434,2023-08-23 17:47:21.469327,2023-08-23 17:47:23.706387,0 days 00:00:02.237060,,0.5,1.0,,LightGBM,,,,,0.9,,,,0.052742540857979026,4.724088906324937e-07,,90.0,,,,,,,,,,82.0,,,,,,,,,COMPLETE,0.0,,,,,,,,,,,,,,,,,,,,
111,111,0.547080394922426,2023-08-23 17:47:21.502272,2023-08-23 17:47:23.614670,0 days 00:00:02.112398,,0.5,1.0,,LightGBM,,,,,0.9,,,,0.06087421762524576,0.00013345629806319015,,90.0,,,,,,,,,,97.0,,,,,,,,,COMPLETE,0.0,,,,,,,,,,,,,,,,,,,,
112,112,0.547080394922426,2023-08-23 17:47:21.884335,2023-08-23 17:47:23.988295,0 days 00:00:02.103960,,0.5,1.0,,LightGBM,,,,,0.9,,,,0.06128159245181741,3.831676568602015e-07,,90.0,,,,,,,,,,120.0,,,,,,,,,COMPLETE,0.0,,,,,,,,,,,,,,,,,,,,
113,113,0.35688536409516947,2023-08-23 17:47:22.681326,2023-08-23 17:47:26.346879,0 days 00:00:03.665553,,,,,MLPClassifier,,,,,,,,,,,,,,relu,sgd,1.0,10.0,,,,,,,,,,,,,,COMPLETE,0.0,,,,,,,,,,,,,,,,,,,,
114,114,0.48065366214872196,2023-08-23 17:47:23.699826,2023-08-23 17:47:24.681057,0 days 00:00:00.981231,3.792636862272403e-05,,,gbtree,XGBoost,0.7003288140169586,,,0.03698193386055309,,0.9320364275845058,lossguide,6.597637027817725e-05,,,7.0,,5.0,,,,,,,,,,,,,,,0.8365832494515533,,,COMPLETE,0.0,,,,,,,,,,,,,,,,,,,,
115,115,0.41963908264637495,2023-08-23 17:47:23.802694,2023-08-23 17:47:30.539228,0 days 00:00:06.736534,,,,,MLPClassifier,,,,,,,,,,,,,,relu,adam,1.0,20.0,,,,,,,,,,,,,,COMPLETE,0.0,,,,,,,,,,,,,,,,,,,,
116,116,0.36494783553607085,2023-08-23 17:47:24.105867,2023-08-23 17:47:30.766342,0 days 00:00:06.660475,,,,,MLPClassifier,,,,,,,,,,,,,,relu,adam,1.0,10.0,,,,,,,,,,,,,,COMPLETE,0.0,,,,,,,,,,,,,,,,,,,,
117,117,0.35688536409516947,2023-08-23 17:47:24.760146,2023-08-23 17:47:27.282001,0 days 00:00:02.521855,,,,,MLPClassifier,,,,,,,,,,,,,,relu,sgd,1.0,10.0,,,,,,,,,,,,,,COMPLETE,0.0,,,,,,,,,,,,,,,,,,,,
118,118,0.5298781035319655,2023-08-23 17:47:26.449080,2023-08-23 17:47:28.564850,0 days 00:00:02.115770,,0.6000000000000001,1.0,,LightGBM,,,,,0.9,,,,0.1601734806830906,2.849119785765976e-07,,90.0,,,,,,,,,,69.0,,,,,,,,,COMPLETE,0.0,,,,,,,,,,,,,,,,,,,,
119,119,0.5234546023141875,2023-08-23 17:47:27.109122,2023-08-23 17:47:29.278318,0 days 00:00:02.169196,,0.6000000000000001,1.0,,LightGBM,,,,,0.9,,,,0.16203595201272158,2.7104142024253797e-07,,90.0,,,,,,,,,,72.0,,,,,,,,,COMPLETE,0.0,,,,,,,,,,,,,,,,,,,,
120,120,0.5365810359231412,2023-08-23 17:47:27.392763,2023-08-23 17:47:29.391890,0 days 00:00:01.999127,,0.6000000000000001,1.0,,LightGBM,,,,,0.9,,,,0.15767784935901755,3.1755212220368157e-07,,90.0,,,,,,,,,,75.0,,,,,,,,,COMPLETE,0.0,,,,,,,,,,,,,,,,,,,,
121,121,0.5182701554710264,2023-08-23 17:47:28.637505,2023-08-23 17:47:30.169914,0 days 00:00:01.532409,,0.5,1.0,,LightGBM,,,,,0.9,,,,0.05053901661876529,4.112467757594103e-07,,80.0,,,,,,,,,,100.0,,,,,,,,,COMPLETE,0.0,,,,,,,,,,,,,,,,,,,,
122,122,0.528318743107298,2023-08-23 17:47:29.385481,2023-08-23 17:47:31.110756,0 days 00:00:01.725275,,,,,RandomForestClassifier,,,,,,,,,,,,,,,,,,,,,,,,11.0,27.0,,,,,,COMPLETE,0.0,,,,,,,,,,,,,,,,,,,,
123,123,0.5110154578816879,2023-08-23 17:47:29.493864,2023-08-23 17:47:31.480266,0 days 00:00:01.986402,,0.5,1.0,,LightGBM,,,,,0.8,,,,0.049808385052566795,0.00011494373848204177,,80.0,,,,,,,,,,99.0,,,,,,,,,COMPLETE,0.0,,,,,,,,,,,,,,,,,,,,
124,124,0.5293049860955005,2023-08-23 17:47:30.254338,2023-08-23 17:47:43.000290,0 days 00:00:12.745952,,,,,RandomForestClassifier,,,,,,,,,,,,,,,,,,,,,,,,94.0,29.0,,,,,,COMPLETE,0.0,,,,,,,,,,,,,,,,,,,,
125,125,0.5494949494949495,2023-08-23 17:47:30.613367,2023-08-23 17:47:31.908999,0 days 00:00:01.295632,,,,,RandomForestClassifier,,,,,,,,,,,,,,,,,,,,,,,,10.0,31.0,,,,,,COMPLETE,0.0,,,,,,,,,,,,,,,,,,,,
126,126,0.5035207621414518,2023-08-23 17:47:30.837778,2023-08-23 17:47:32.703049,0 days 00:00:01.865271,,,,,RandomForestClassifier,,,,,,,,,,,,,,,,,,,,,,,,15.0,31.0,,,,,,COMPLETE,0.0,,,,,,,,,,,,,,,,,,,,
127,127,0.529687898630836,2023-08-23 17:47:31.188538,2023-08-23 17:47:32.994031,0 days 00:00:01.805493,,0.5,1.0,,LightGBM,,,,,1.0,,,,0.013176602080361925,0.00011696815887687212,,80.0,,,,,,,,,,95.0,,,,,,,,,COMPLETE,0.0,,,,,,,,,,,,,,,,,,,,
128,128,0.5439744171609517,2023-08-23 17:47:31.588335,2023-08-23 17:47:33.318765,0 days 00:00:01.730430,,0.4,1.0,,LightGBM,,,,,1.0,,,,0.09812613926372779,2.35207106363129e-06,,90.0,,,,,,,,,,115.0,,,,,,,,,COMPLETE,0.0,,,,,,,,,,,,,,,,,,,,
129,129,0.5397759777581737,2023-08-23 17:47:32.042710,2023-08-23 17:47:33.191289,0 days 00:00:01.148579,,,,,RandomForestClassifier,,,,,,,,,,,,,,,,,,,,,,,,10.0,13.0,,,,,,COMPLETE,0.0,,,,,,,,,,,,,,,,,,,,
130,130,0.5422558888185611,2023-08-23 17:47:32.818814,2023-08-23 17:47:37.313914,0 days 00:00:04.495100,,,,,RandomForestClassifier,,,,,,,,,,,,,,,,,,,,,,,,49.0,14.0,,,,,,COMPLETE,0.0,,,,,,,,,,,,,,,,,,,,
131,131,0.5013452914798207,2023-08-23 17:47:33.120052,2023-08-23 17:47:37.030372,0 days 00:00:03.910320,,,,,RandomForestClassifier,,,,,,,,,,,,,,,,,,,,,,,,43.0,17.0,,,,,,COMPLETE,0.0,,,,,,,,,,,,,,,,,,,,
132,132,0.5380179680522648,2023-08-23 17:47:33.308915,2023-08-23 17:47:37.739422,0 days 00:00:04.430507,,,,,RandomForestClassifier,,,,,,,,,,,,,,,,,,,,,,,,45.0,16.0,,,,,,COMPLETE,0.0,,,,,,,,,,,,,,,,,,,,
133,133,0.5046047665264747,2023-08-23 17:47:33.425853,2023-08-23 17:47:38.253600,0 days 00:00:04.827747,,,,,RandomForestClassifier,,,,,,,,,,,,,,,,,,,,,,,,48.0,17.0,,,,,,COMPLETE,0.0,,,,,,,,,,,,,,,,,,,,
134,134,0.5293049860955005,2023-08-23 17:47:37.108811,2023-08-23 17:47:37.423725,0 days 00:00:00.314914,,,,,DecisionTreeClassifier,,entropy,4.0,,,,,,,,,,,,,,,,,,,,,,,,,,,,COMPLETE,0.0,,,,,,,,,,,,,,,,,,,,
135,135,0.5293049860955005,2023-08-23 17:47:37.386687,2023-08-23 17:47:37.908332,0 days 00:00:00.521645,,,,,DecisionTreeClassifier,,entropy,4.0,,,,,,,,,,,,,,,,,,,,,,,,,,,,COMPLETE,0.0,,,,,,,,,,,,,,,,,,,,
136,136,0.4387282757678782,2023-08-23 17:47:37.524839,2023-08-23 17:47:38.416748,0 days 00:00:00.891909,0.026532368429589084,,,gbtree,XGBoost,0.4589213378016904,,,3.246085459034076e-06,,0.0007684718448145236,depthwise,0.0004923140367301413,,,5.0,,8.0,,,,,,,,,,,,,,,0.5789244360327251,,,COMPLETE,0.0,,,,,,,,,,,,,,,,,,,,
137,137,0.4326766652006219,2023-08-23 17:47:37.869051,2023-08-23 17:47:38.745889,0 days 00:00:00.876838,0.013152039065073695,,,gbtree,XGBoost,0.47529103290183555,,,2.491095875827159e-06,,1.9119744242282743e-08,depthwise,0.00037458019099863787,,,5.0,,8.0,,,,,,,,,,,,,,,0.5839959515134499,,,COMPLETE,0.0,,,,,,,,,,,,,,,,,,,,
138,138,0.5288461411807167,2023-08-23 17:47:38.010456,2023-08-23 17:47:40.013244,0 days 00:00:02.002788,,0.4,1.0,,LightGBM,,,,,0.9,,,,0.021987055857071936,1.2807166813803643e-06,,90.0,,,,,,,,,,85.0,,,,,,,,,COMPLETE,0.0,,,,,,,,,,,,,,,,,,,,
139,139,0.5151844554657246,2023-08-23 17:47:38.333977,2023-08-23 17:47:42.386901,0 days 00:00:04.052924,,0.4,1.0,,LightGBM,,,,,0.9,,,,0.021015658131901368,1.155419212622636e-06,,10.0,,,,,,,,,,82.0,,,,,,,,,COMPLETE,0.0,,,,,,,,,,,,,,,,,,,,
140,140,0.5288461411807167,2023-08-23 17:47:38.561529,2023-08-23 17:47:40.380175,0 days 00:00:01.818646,,0.4,1.0,,LightGBM,,,,,0.9,,,,0.02281746262376202,1.3187240735624e-06,,90.0,,,,,,,,,,80.0,,,,,,,,,COMPLETE,0.0,,,,,,,,,,,,,,,,,,,,
141,141,0.5281695984069035,2023-08-23 17:47:38.830011,2023-08-23 17:47:42.150171,0 days 00:00:03.320160,,0.4,1.0,,LightGBM,,,,,0.9,,,,0.020842824068044954,1.8872220755799699e-06,,10.0,,,,,,,,,,85.0,,,,,,,,,COMPLETE,0.0,,,,,,,,,,,,,,,,,,,,
142,142,0.5373029790774707,2023-08-23 17:47:40.132939,2023-08-23 17:47:41.607887,0 days 00:00:01.474948,,0.4,1.0,,LightGBM,,,,,0.9,,,,0.13093702731297222,6.738030315825e-07,,100.0,,,,,,,,,,80.0,,,,,,,,,COMPLETE,0.0,,,,,,,,,,,,,,,,,,,,
143,143,0.5383618627485488,2023-08-23 17:47:40.537498,2023-08-23 17:47:42.130148,0 days 00:00:01.592650,,0.4,1.0,,LightGBM,,,,,0.9,,,,0.09922221186243102,6.474581179506841e-07,,100.0,,,,,,,,,,120.0,,,,,,,,,COMPLETE,0.0,,,,,,,,,,,,,,,,,,,,
144,144,0.5273969254348587,2023-08-23 17:47:41.768030,2023-08-23 17:47:43.901847,0 days 00:00:02.133817,,0.4,1.0,,LightGBM,,,,,0.8,,,,0.5442096516386369,4.2678189620033556e-05,,90.0,,,,,,,,,,161.0,,,,,,,,,COMPLETE,0.0,,,,,,,,,,,,,,,,,,,,
145,145,0.5138353177930571,2023-08-23 17:47:42.322735,2023-08-23 17:47:44.732919,0 days 00:00:02.410184,,0.5,1.0,,LightGBM,,,,,0.8,,,,0.47425778309729516,6.854097239058953e-05,,90.0,,,,,,,,,,161.0,,,,,,,,,COMPLETE,0.0,,,,,,,,,,,,,,,,,,,,
146,146,0.5147406523967945,2023-08-23 17:47:42.330781,2023-08-23 17:47:44.208289,0 days 00:00:01.877508,,0.5,1.0,,LightGBM,,,,,0.8,,,,0.6374191372632741,4.860026756574069e-05,,90.0,,,,,,,,,,234.0,,,,,,,,,COMPLETE,0.0,,,,,,,,,,,,,,,,,,,,
147,147,0.51103417525638,2023-08-23 17:47:42.468540,2023-08-23 17:47:44.628266,0 days 00:00:02.159726,,0.7000000000000001,1.0,,LightGBM,,,,,0.8,,,,0.4218518817266692,4.646429689944432e-05,,90.0,,,,,,,,,,92.0,,,,,,,,,COMPLETE,0.0,,,,,,,,,,,,,,,,,,,,
148,148,0.5423126259849734,2023-08-23 17:47:43.130331,2023-08-23 17:47:45.081408,0 days 00:00:01.951077,,0.4,1.0,,LightGBM,,,,,1.0,,,,0.512079482146977,3.3939376446037147e-06,,90.0,,,,,,,,,,115.0,,,,,,,,,COMPLETE,0.0,,,,,,,,,,,,,,,,,,,,
149,149,0.5484669656673749,2023-08-23 17:47:44.022204,2023-08-23 17:47:45.813557,0 days 00:00:01.791353,,0.4,1.0,,LightGBM,,,,,1.0,,,,0.08497390366296836,2.4455927715736633e-06,,90.0,,,,,,,,,,118.0,,,,,,,,,COMPLETE,0.0,,,,,,,,,,,,,,,,,,,,
150,150,0.5426076722645328,2023-08-23 17:47:44.329118,2023-08-23 17:47:46.337402,0 days 00:00:02.008284,,0.4,1.0,,LightGBM,,,,,1.0,,,,0.10046879261855708,2.4322665223893763e-06,,80.0,,,,,,,,,,117.0,,,,,,,,,COMPLETE,0.0,,,,,,,,,,,,,,,,,,,,
151,151,0.5458959899749373,2023-08-23 17:47:44.733987,2023-08-23 17:47:46.699502,0 days 00:00:01.965515,,0.4,1.0,,LightGBM,,,,,1.0,,,,0.09023542093750944,2.469354771180706e-06,,80.0,,,,,,,,,,118.0,,,,,,,,,COMPLETE,0.0,,,,,,,,,,,,,,,,,,,,
152,152,0.5367829796253609,2023-08-23 17:47:44.837417,2023-08-23 17:47:46.861592,0 days 00:00:02.024175,,0.4,1.0,,LightGBM,,,,,1.0,,,,0.08318159594371205,2.636364645275772e-06,,80.0,,,,,,,,,,116.0,,,,,,,,,COMPLETE,0.0,,,,,,,,,,,,,,,,,,,,
153,153,0.5351082807832725,2023-08-23 17:47:45.166124,2023-08-23 17:47:47.573226,0 days 00:00:02.407102,,0.4,1.0,,LightGBM,,,,,0.4,,,,0.10417810769680509,2.8329318833887527e-06,,50.0,,,,,,,,,,103.0,,,,,,,,,COMPLETE,0.0,,,,,,,,,,,,,,,,,,,,
154,154,0.5181244830438378,2023-08-23 17:47:45.901828,2023-08-23 17:47:49.957358,0 days 00:00:04.055530,,0.4,1.0,,LightGBM,,,,,1.0,,,,0.20153883341773018,6.05179283777555e-06,,20.0,,,,,,,,,,104.0,,,,,,,,,COMPLETE,0.0,,,,,,,,,,,,,,,,,,,,
155,155,0.5164110586222914,2023-08-23 17:47:46.456329,2023-08-23 17:47:49.818642,0 days 00:00:03.362313,,0.4,1.0,,LightGBM,,,,,0.4,,,,0.03528034419388581,5.6363562842955435e-06,,20.0,,,,,,,,,,103.0,,,,,,,,,COMPLETE,0.0,,,,,,,,,,,,,,,,,,,,
156,156,0.5311435398733522,2023-08-23 17:47:46.768610,2023-08-23 17:47:48.397150,0 days 00:00:01.628540,,0.4,1.0,,LightGBM,,,,,1.0,,,,0.03694791169442799,1.6096486688854565e-05,,80.0,,,,,,,,,,206.0,,,,,,,,,COMPLETE,0.0,,,,,,,,,,,,,,,,,,,,
157,157,0.534877462111655,2023-08-23 17:47:46.980950,2023-08-23 17:47:51.648849,0 days 00:00:04.667899,,0.9,1.0,,LightGBM,,,,,1.0,,,,0.038700277981888846,5.89002249602084e-06,,20.0,,,,,,,,,,137.0,,,,,,,,,COMPLETE,0.0,,,,,,,,,,,,,,,,,,,,
158,158,0.5534751883707474,2023-08-23 17:47:47.637328,2023-08-23 17:47:49.169953,0 days 00:00:01.532625,,0.4,1.0,,LightGBM,,,,,1.0,,,,0.20694639232507628,1.4965164665183883e-05,,70.0,,,,,,,,,,138.0,,,,,,,,,COMPLETE,0.0,,,,,,,,,,,,,,,,,,,,
159,159,0.5360362298152921,2023-08-23 17:47:48.493041,2023-08-23 17:47:50.569806,0 days 00:00:02.076765,,0.4,1.0,,LightGBM,,,,,1.0,,,,0.22676826261548608,6.196054336906289e-06,,70.0,,,,,,,,,,106.0,,,,,,,,,COMPLETE,0.0,,,,,,,,,,,,,,,,,,,,
160,160,0.5241463520653123,2023-08-23 17:47:49.301768,2023-08-23 17:47:53.857073,0 days 00:00:04.555305,,0.9,1.0,,LightGBM,,,,,1.0,,,,0.22956006924153513,6.063129921795122e-06,,20.0,,,,,,,,,,135.0,,,,,,,,,COMPLETE,0.0,,,,,,,,,,,,,,,,,,,,
161,161,0.5487759447557575,2023-08-23 17:47:49.907472,2023-08-23 17:47:52.304807,0 days 00:00:02.397335,,0.4,1.0,,LightGBM,,,,,1.0,,,,0.1970855100961091,5.155069261609915e-06,,70.0,,,,,,,,,,137.0,,,,,,,,,COMPLETE,0.0,,,,,,,,,,,,,,,,,,,,
162,162,0.5297505704618775,2023-08-23 17:47:50.072641,2023-08-23 17:47:52.047515,0 days 00:00:01.974874,,0.4,1.0,,LightGBM,,,,,1.0,,,,0.18697455233462967,1.2177848376385787e-05,,70.0,,,,,,,,,,136.0,,,,,,,,,COMPLETE,0.0,,,,,,,,,,,,,,,,,,,,
163,163,0.3573487031700288,2023-08-23 17:47:50.653062,2023-08-23 17:47:55.653914,0 days 00:00:05.000852,,,,,SVC,,,,,,,,,,,,,,,,,,,,,,,,,,,,,13.785794187574428,poly,COMPLETE,0.0,,,,,,,,,,,,,,,,,,,,
164,164,0.3573487031700288,2023-08-23 17:47:51.732274,2023-08-23 17:47:59.149095,0 days 00:00:07.416821,,,,,SVC,,,,,,,,,,,,,,,,,,,,,,,,,,,,,12.819498439901993,poly,COMPLETE,0.0,,,,,,,,,,,,,,,,,,,,
165,165,0.3573487031700288,2023-08-23 17:47:52.116679,2023-08-23 17:48:00.240357,0 days 00:00:08.123678,,,,,SVC,,,,,,,,,,,,,,,,,,,,,,,,,,,,,14.969279060998419,poly,COMPLETE,0.0,,,,,,,,,,,,,,,,,,,,
166,166,0.3573487031700288,2023-08-23 17:47:52.398982,2023-08-23 17:48:00.491989,0 days 00:00:08.093007,,,,,SVC,,,,,,,,,,,,,,,,,,,,,,,,,,,,,9.77714649214342,poly,COMPLETE,0.0,,,,,,,,,,,,,,,,,,,,
167,167,0.3573487031700288,2023-08-23 17:47:53.969695,2023-08-23 17:48:01.625115,0 days 00:00:07.655420,,,,,SVC,,,,,,,,,,,,,,,,,,,,,,,,,,,,,17.24115734448674,poly,COMPLETE,0.0,,,,,,,,,,,,,,,,,,,,
168,168,0.5499594690116274,2023-08-23 17:47:55.763895,2023-08-23 17:47:57.396892,0 days 00:00:01.632997,,0.4,1.0,,LightGBM,,,,,1.0,,,,0.05081834508283044,1.2532649021579121e-05,,70.0,,,,,,,,,,130.0,,,,,,,,,COMPLETE,0.0,,,,,,,,,,,,,,,,,,,,
169,169,0.5443761075784426,2023-08-23 17:47:57.466742,2023-08-23 17:47:58.748038,0 days 00:00:01.281296,,0.4,1.0,,LightGBM,,,,,1.0,,,,0.06956535824698536,1.4821680260889637e-05,,70.0,,,,,,,,,,124.0,,,,,,,,,COMPLETE,0.0,,,,,,,,,,,,,,,,,,,,
170,170,0.5362740765771621,2023-08-23 17:47:58.800553,2023-08-23 17:48:00.349145,0 days 00:00:01.548592,,0.4,1.0,,LightGBM,,,,,1.0,,,,0.0808229930049176,9.558887473148808e-06,,70.0,,,,,,,,,,145.0,,,,,,,,,COMPLETE,0.0,,,,,,,,,,,,,,,,,,,,
171,171,0.5443761075784426,2023-08-23 17:47:59.295796,2023-08-23 17:48:01.064159,0 days 00:00:01.768363,,0.4,1.0,,LightGBM,,,,,1.0,,,,0.0695401264718471,9.111377994701714e-06,,70.0,,,,,,,,,,145.0,,,,,,,,,COMPLETE,0.0,,,,,,,,,,,,,,,,,,,,
172,172,0.5283550365729655,2023-08-23 17:48:00.440021,2023-08-23 17:48:02.327244,0 days 00:00:01.887223,,0.4,1.0,,LightGBM,,,,,1.0,,,,0.14768951708284486,8.933353451237495e-06,,70.0,,,,,,,,,,128.0,,,,,,,,,COMPLETE,0.0,,,,,,,,,,,,,,,,,,,,
173,173,0.5423990553350608,2023-08-23 17:48:00.457210,2023-08-23 17:48:02.541583,0 days 00:00:02.084373,,0.4,1.0,,LightGBM,,,,,1.0,,,,0.14161085919281544,4.519847033729189e-06,,70.0,,,,,,,,,,127.0,,,,,,,,,COMPLETE,0.0,,,,,,,,,,,,,,,,,,,,
