,number,value,datetime_start,datetime_complete,duration,params_alpha,params_bagging_fraction,params_bagging_freq,params_booster,params_classifier,params_colsample_bytree,params_dct_criterion,params_dct_max_depth,params_eta,params_feature_fraction,params_gamma,params_grow_policy,params_lambda,params_lambda_l1,params_lambda_l2,params_max_depth,params_min_child_samples,params_min_child_weight,params_mlp_activation,params_mlp_solver,params_n_layers,params_n_units_l_0,params_n_units_l_1,params_n_units_l_2,params_n_units_l_3,params_normalize_type,params_num_leaves,params_rate_drop,params_rf_estimator,params_rf_max_depth,params_sample_type,params_skip_drop,params_subsample,params_svc_c,params_svc_kernel,state,best_trial,dev_acc,dev_recall_macro,dev_precision_macro,dev_f1_macro,dev_recall_0,dev_precision_0,dev_f1_0,dev_recall_1,dev_precision_1,dev_f1_1,test_acc,test_recall_macro,test_precision_macro,test_f1_macro,test_recall_0,test_precision_0,test_f1_0,test_recall_1,test_precision_1,test_f1_1
94,94,0.5823719204966968,2023-08-23 15:27:06.374303,2023-08-23 15:33:59.620751,0 days 00:06:53.246448,,,,,MLPClassifier,,,,,,,,,,,,,,relu,adam,1.0,100.0,,,,,,,,,,,,,,COMPLETE,0.0,,,,,,,,,,,,,,,,,,,,
95,95,0.5828978058533296,2023-08-23 15:27:07.040057,2023-08-23 15:34:45.704615,0 days 00:07:38.664558,,,,,MLPClassifier,,,,,,,,,,,,,,relu,adam,1.0,100.0,,,,,,,,,,,,,,COMPLETE,0.0,,,,,,,,,,,,,,,,,,,,
96,96,0.5946076815297123,2023-08-23 15:27:08.154484,2023-08-23 15:27:15.050584,0 days 00:00:06.896100,,,,,RandomForestClassifier,,,,,,,,,,,,,,,,,,,,,,,,79.0,12.0,,,,,,COMPLETE,0.0,,,,,,,,,,,,,,,,,,,,
97,97,0.579173291385644,2023-08-23 15:27:08.468123,2023-08-23 15:33:34.579879,0 days 00:06:26.111756,,,,,MLPClassifier,,,,,,,,,,,,,,relu,adam,1.0,100.0,,,,,,,,,,,,,,COMPLETE,0.0,,,,,,,,,,,,,,,,,,,,
98,98,0.5841587280138729,2023-08-23 15:27:09.014807,2023-08-23 15:33:31.899174,0 days 00:06:22.884367,,,,,MLPClassifier,,,,,,,,,,,,,,relu,adam,1.0,100.0,,,,,,,,,,,,,,COMPLETE,0.0,,,,,,,,,,,,,,,,,,,,
99,99,0.5864810899694621,2023-08-23 15:27:10.364178,2023-08-23 15:27:17.474341,0 days 00:00:07.110163,,,,,RandomForestClassifier,,,,,,,,,,,,,,,,,,,,,,,,78.0,13.0,,,,,,COMPLETE,0.0,,,,,,,,,,,,,,,,,,,,
100,100,0.5872873157578604,2023-08-23 15:27:15.146442,2023-08-23 15:27:22.700505,0 days 00:00:07.554063,,,,,RandomForestClassifier,,,,,,,,,,,,,,,,,,,,,,,,79.0,20.0,,,,,,COMPLETE,0.0,,,,,,,,,,,,,,,,,,,,
101,101,0.5897438772554406,2023-08-23 15:27:17.583426,2023-08-23 15:27:26.405738,0 days 00:00:08.822312,,,,,RandomForestClassifier,,,,,,,,,,,,,,,,,,,,,,,,88.0,20.0,,,,,,COMPLETE,0.0,,,,,,,,,,,,,,,,,,,,
102,102,0.5876237484925821,2023-08-23 15:27:22.790241,2023-08-23 15:27:30.787774,0 days 00:00:07.997533,,,,,RandomForestClassifier,,,,,,,,,,,,,,,,,,,,,,,,87.0,21.0,,,,,,COMPLETE,0.0,,,,,,,,,,,,,,,,,,,,
103,103,0.575868157355002,2023-08-23 15:27:26.478492,2023-08-23 15:34:08.315448,0 days 00:06:41.836956,,,,,MLPClassifier,,,,,,,,,,,,,,relu,adam,1.0,100.0,,,,,,,,,,,,,,COMPLETE,0.0,,,,,,,,,,,,,,,,,,,,
104,104,0.5806398361361043,2023-08-23 15:27:30.909048,2023-08-23 15:28:33.924390,0 days 00:01:03.015342,,,,,MLPClassifier,,,,,,,,,,,,,,relu,lbfgs,1.0,100.0,,,,,,,,,,,,,,COMPLETE,0.0,,,,,,,,,,,,,,,,,,,,
105,105,0.5974487065120428,2023-08-23 15:27:46.769834,2023-08-23 15:27:53.099336,0 days 00:00:06.329502,,,,,RandomForestClassifier,,,,,,,,,,,,,,,,,,,,,,,,72.0,10.0,,,,,,COMPLETE,0.0,,,,,,,,,,,,,,,,,,,,
106,106,0.571186199726088,2023-08-23 15:27:53.175068,2023-08-23 15:27:55.720556,0 days 00:00:02.545488,,0.4,2.0,,LightGBM,,,,,0.6000000000000001,,,,1.1172983370194736e-06,0.0018076847933990244,,10.0,,,,,,,,,,68.0,,,,,,,,,COMPLETE,0.0,,,,,,,,,,,,,,,,,,,,
107,107,0.5429799581155932,2023-08-23 15:27:55.786350,2023-08-23 15:27:56.447132,0 days 00:00:00.660782,0.652710920596794,,,dart,XGBoost,0.5772079482147091,,,4.9816276496380414e-08,,0.1668198518075942,depthwise,1.1334089847783529e-08,,,9.0,,6.0,,,,,,,,tree,,0.535623303119645,,,uniform,1.0703270186135182e-08,0.23578214926394286,,,COMPLETE,0.0,,,,,,,,,,,,,,,,,,,,
108,108,0.5942815490584422,2023-08-23 15:27:56.528324,2023-08-23 15:28:03.247927,0 days 00:00:06.719603,,,,,RandomForestClassifier,,,,,,,,,,,,,,,,,,,,,,,,72.0,16.0,,,,,,COMPLETE,0.0,,,,,,,,,,,,,,,,,,,,
109,109,0.6001645729538034,2023-08-23 15:28:03.321332,2023-08-23 15:28:12.047804,0 days 00:00:08.726472,,,,,RandomForestClassifier,,,,,,,,,,,,,,,,,,,,,,,,100.0,10.0,,,,,,COMPLETE,0.0,,,,,,,,,,,,,,,,,,,,
110,110,0.6032344041295448,2023-08-23 15:28:12.140271,2023-08-23 15:28:19.734648,0 days 00:00:07.594377,,,,,RandomForestClassifier,,,,,,,,,,,,,,,,,,,,,,,,82.0,12.0,,,,,,COMPLETE,0.0,,,,,,,,,,,,,,,,,,,,
111,111,0.5931702769680087,2023-08-23 15:28:19.845827,2023-08-23 15:28:27.534719,0 days 00:00:07.688892,,,,,RandomForestClassifier,,,,,,,,,,,,,,,,,,,,,,,,98.0,10.0,,,,,,COMPLETE,0.0,,,,,,,,,,,,,,,,,,,,
112,112,0.5963954215648545,2023-08-23 15:28:27.675213,2023-08-23 15:28:33.799941,0 days 00:00:06.124728,,,,,RandomForestClassifier,,,,,,,,,,,,,,,,,,,,,,,,83.0,12.0,,,,,,COMPLETE,0.0,,,,,,,,,,,,,,,,,,,,
113,113,0.5934813090851783,2023-08-23 15:28:33.889629,2023-08-23 15:28:42.112420,0 days 00:00:08.222791,,,,,RandomForestClassifier,,,,,,,,,,,,,,,,,,,,,,,,100.0,10.0,,,,,,COMPLETE,0.0,,,,,,,,,,,,,,,,,,,,
114,114,0.592745270700551,2023-08-23 15:28:34.005219,2023-08-23 15:28:42.207801,0 days 00:00:08.202582,,,,,RandomForestClassifier,,,,,,,,,,,,,,,,,,,,,,,,100.0,10.0,,,,,,COMPLETE,0.0,,,,,,,,,,,,,,,,,,,,
115,115,0.5995829008103588,2023-08-23 15:28:42.291566,2023-08-23 15:28:49.600038,0 days 00:00:07.308472,,,,,RandomForestClassifier,,,,,,,,,,,,,,,,,,,,,,,,89.0,12.0,,,,,,COMPLETE,0.0,,,,,,,,,,,,,,,,,,,,
116,116,0.6007960806605022,2023-08-23 15:28:42.295619,2023-08-23 15:28:49.987541,0 days 00:00:07.691922,,,,,RandomForestClassifier,,,,,,,,,,,,,,,,,,,,,,,,90.0,12.0,,,,,,COMPLETE,0.0,,,,,,,,,,,,,,,,,,,,
117,117,0.5982175552811921,2023-08-23 15:28:49.693980,2023-08-23 15:28:56.965172,0 days 00:00:07.271192,,,,,RandomForestClassifier,,,,,,,,,,,,,,,,,,,,,,,,90.0,12.0,,,,,,COMPLETE,0.0,,,,,,,,,,,,,,,,,,,,
118,118,0.582918300481206,2023-08-23 15:28:50.080815,2023-08-23 15:28:57.331038,0 days 00:00:07.250223,,,,,RandomForestClassifier,,,,,,,,,,,,,,,,,,,,,,,,89.0,12.0,,,,,,COMPLETE,0.0,,,,,,,,,,,,,,,,,,,,
119,119,0.5940970063539899,2023-08-23 15:28:57.024807,2023-08-23 15:29:04.881878,0 days 00:00:07.857071,,,,,RandomForestClassifier,,,,,,,,,,,,,,,,,,,,,,,,89.0,12.0,,,,,,COMPLETE,0.0,,,,,,,,,,,,,,,,,,,,
120,120,0.6034350215830033,2023-08-23 15:28:57.499539,2023-08-23 15:29:05.742389,0 days 00:00:08.242850,,,,,RandomForestClassifier,,,,,,,,,,,,,,,,,,,,,,,,90.0,12.0,,,,,,COMPLETE,0.0,,,,,,,,,,,,,,,,,,,,
121,121,0.5874112777432996,2023-08-23 15:29:04.970023,2023-08-23 15:29:14.018358,0 days 00:00:09.048335,,,,,RandomForestClassifier,,,,,,,,,,,,,,,,,,,,,,,,85.0,14.0,,,,,,COMPLETE,0.0,,,,,,,,,,,,,,,,,,,,
122,122,0.5664464805739043,2023-08-23 15:29:05.817375,2023-08-23 15:29:06.288161,0 days 00:00:00.470786,,,,,DecisionTreeClassifier,,log_loss,6.0,,,,,,,,,,,,,,,,,,,,,,,,,,,,COMPLETE,0.0,,,,,,,,,,,,,,,,,,,,
123,123,0.3357921744708146,2023-08-23 15:29:06.355741,2023-08-23 15:29:12.975614,0 days 00:00:06.619873,,,,,SVC,,,,,,,,,,,,,,,,,,,,,,,,,,,,,0.0691723734851949,rbf,COMPLETE,0.0,,,,,,,,,,,,,,,,,,,,
124,124,0.5959323480521221,2023-08-23 15:29:13.075660,2023-08-23 15:29:20.678003,0 days 00:00:07.602343,,,,,RandomForestClassifier,,,,,,,,,,,,,,,,,,,,,,,,85.0,11.0,,,,,,COMPLETE,0.0,,,,,,,,,,,,,,,,,,,,
125,125,0.6048356453703597,2023-08-23 15:29:14.174112,2023-08-23 15:29:22.440308,0 days 00:00:08.266196,,,,,RandomForestClassifier,,,,,,,,,,,,,,,,,,,,,,,,91.0,11.0,,,,,,COMPLETE,0.0,,,,,,,,,,,,,,,,,,,,
126,126,0.5965135130382795,2023-08-23 15:29:20.786460,2023-08-23 15:29:28.923676,0 days 00:00:08.137216,,,,,RandomForestClassifier,,,,,,,,,,,,,,,,,,,,,,,,91.0,12.0,,,,,,COMPLETE,0.0,,,,,,,,,,,,,,,,,,,,
127,127,0.6030151484757088,2023-08-23 15:29:22.592716,2023-08-23 15:29:31.207904,0 days 00:00:08.615188,,,,,RandomForestClassifier,,,,,,,,,,,,,,,,,,,,,,,,97.0,11.0,,,,,,COMPLETE,0.0,,,,,,,,,,,,,,,,,,,,
128,128,0.5905092409947736,2023-08-23 15:29:29.010281,2023-08-23 15:29:37.364494,0 days 00:00:08.354213,,,,,RandomForestClassifier,,,,,,,,,,,,,,,,,,,,,,,,97.0,11.0,,,,,,COMPLETE,0.0,,,,,,,,,,,,,,,,,,,,
129,129,0.6004877444743401,2023-08-23 15:29:31.316957,2023-08-23 15:29:38.095725,0 days 00:00:06.778768,,,,,RandomForestClassifier,,,,,,,,,,,,,,,,,,,,,,,,97.0,10.0,,,,,,COMPLETE,0.0,,,,,,,,,,,,,,,,,,,,
130,130,0.5997053800972058,2023-08-23 15:29:37.451181,2023-08-23 15:29:45.945668,0 days 00:00:08.494487,,,,,RandomForestClassifier,,,,,,,,,,,,,,,,,,,,,,,,97.0,10.0,,,,,,COMPLETE,0.0,,,,,,,,,,,,,,,,,,,,
131,131,0.5948153582783077,2023-08-23 15:29:38.169861,2023-08-23 15:29:46.554292,0 days 00:00:08.384431,,,,,RandomForestClassifier,,,,,,,,,,,,,,,,,,,,,,,,98.0,10.0,,,,,,COMPLETE,0.0,,,,,,,,,,,,,,,,,,,,
132,132,0.6020433373336664,2023-08-23 15:29:46.042342,2023-08-23 15:29:53.991890,0 days 00:00:07.949548,,,,,RandomForestClassifier,,,,,,,,,,,,,,,,,,,,,,,,97.0,9.0,,,,,,COMPLETE,0.0,,,,,,,,,,,,,,,,,,,,
133,133,0.6027000785438972,2023-08-23 15:29:46.635732,2023-08-23 15:29:54.471201,0 days 00:00:07.835469,,,,,RandomForestClassifier,,,,,,,,,,,,,,,,,,,,,,,,97.0,9.0,,,,,,COMPLETE,0.0,,,,,,,,,,,,,,,,,,,,
134,134,0.6017045507979648,2023-08-23 15:29:54.093787,2023-08-23 15:29:59.330447,0 days 00:00:05.236660,,,,,RandomForestClassifier,,,,,,,,,,,,,,,,,,,,,,,,92.0,9.0,,,,,,COMPLETE,0.0,,,,,,,,,,,,,,,,,,,,
135,135,0.590936216470641,2023-08-23 15:29:54.592780,2023-08-23 15:29:56.763135,0 days 00:00:02.170355,,0.7000000000000001,3.0,,LightGBM,,,,,1.0,,,,7.204660600347209e-05,0.022615002477025258,,50.0,,,,,,,,,,225.0,,,,,,,,,COMPLETE,0.0,,,,,,,,,,,,,,,,,,,,
136,136,0.6031401430188388,2023-08-23 15:29:56.837346,2023-08-23 15:30:02.379604,0 days 00:00:05.542258,,,,,RandomForestClassifier,,,,,,,,,,,,,,,,,,,,,,,,92.0,9.0,,,,,,COMPLETE,0.0,,,,,,,,,,,,,,,,,,,,
137,137,0.5650586420520398,2023-08-23 15:29:59.412946,2023-08-23 15:29:59.881111,0 days 00:00:00.468165,7.630277459732315e-07,,,gbtree,XGBoost,0.23898824907618377,,,0.0003186210193838742,,4.331081177036709e-05,lossguide,0.001008068661424064,,,5.0,,2.0,,,,,,,,,,,,,,,0.7330988931112422,,,COMPLETE,0.0,,,,,,,,,,,,,,,,,,,,
138,138,0.6097386322950233,2023-08-23 15:29:59.961666,2023-08-23 15:30:05.905962,0 days 00:00:05.944296,,,,,RandomForestClassifier,,,,,,,,,,,,,,,,,,,,,,,,92.0,9.0,,,,,,COMPLETE,1.0,0.5934331240946402,0.5925141401026743,0.59517462803145,0.5901627708460249,0.509765625,0.605568445475638,0.5535524920466596,0.6752626552053486,0.5847808105872622,0.62677304964539,0.5928597187161918,0.5862901398361147,0.5906016665752973,0.5842962372819467,0.478494623655914,0.5806150978564771,0.5246315789473684,0.6940856560163154,0.6005882352941176,0.6439608956165248
139,139,0.5954105334724122,2023-08-23 15:30:02.486154,2023-08-23 15:30:08.316828,0 days 00:00:05.830674,,,,,RandomForestClassifier,,,,,,,,,,,,,,,,,,,,,,,,92.0,9.0,,,,,,COMPLETE,0.0,,,,,,,,,,,,,,,,,,,,
140,140,0.5933892865819552,2023-08-23 15:30:05.967096,2023-08-23 15:30:12.845604,0 days 00:00:06.878508,,,,,RandomForestClassifier,,,,,,,,,,,,,,,,,,,,,,,,92.0,9.0,,,,,,COMPLETE,0.0,,,,,,,,,,,,,,,,,,,,
141,141,0.6006228747084166,2023-08-23 15:30:08.387867,2023-08-23 15:30:13.952294,0 days 00:00:05.564427,,,,,RandomForestClassifier,,,,,,,,,,,,,,,,,,,,,,,,82.0,8.0,,,,,,COMPLETE,0.0,,,,,,,,,,,,,,,,,,,,
142,142,0.5956425475698045,2023-08-23 15:30:12.976479,2023-08-23 15:30:19.425208,0 days 00:00:06.448729,,,,,RandomForestClassifier,,,,,,,,,,,,,,,,,,,,,,,,95.0,8.0,,,,,,COMPLETE,0.0,,,,,,,,,,,,,,,,,,,,
143,143,0.5801128073734032,2023-08-23 15:30:14.095794,2023-08-23 15:30:53.644204,0 days 00:00:39.548410,,,,,MLPClassifier,,,,,,,,,,,,,,relu,lbfgs,1.0,40.0,,,,,,,,,,,,,,COMPLETE,0.0,,,,,,,,,,,,,,,,,,,,
144,144,0.5874102126635907,2023-08-23 15:30:19.517176,2023-08-23 15:30:56.190645,0 days 00:00:36.673469,,,,,MLPClassifier,,,,,,,,,,,,,,relu,lbfgs,1.0,40.0,,,,,,,,,,,,,,COMPLETE,0.0,,,,,,,,,,,,,,,,,,,,
145,145,0.5956953561580322,2023-08-23 15:30:53.720953,2023-08-23 15:31:00.143361,0 days 00:00:06.422408,,,,,RandomForestClassifier,,,,,,,,,,,,,,,,,,,,,,,,93.0,9.0,,,,,,COMPLETE,0.0,,,,,,,,,,,,,,,,,,,,
146,146,0.5941281775868241,2023-08-23 15:30:56.256799,2023-08-23 15:31:02.183209,0 days 00:00:05.926410,,,,,RandomForestClassifier,,,,,,,,,,,,,,,,,,,,,,,,95.0,7.0,,,,,,COMPLETE,0.0,,,,,,,,,,,,,,,,,,,,
147,147,0.5916891625623906,2023-08-23 15:31:00.260359,2023-08-23 15:31:07.783583,0 days 00:00:07.523224,,,,,RandomForestClassifier,,,,,,,,,,,,,,,,,,,,,,,,96.0,7.0,,,,,,COMPLETE,0.0,,,,,,,,,,,,,,,,,,,,
148,148,0.5952379610054028,2023-08-23 15:31:02.392804,2023-08-23 15:31:10.295296,0 days 00:00:07.902492,,,,,RandomForestClassifier,,,,,,,,,,,,,,,,,,,,,,,,87.0,11.0,,,,,,COMPLETE,0.0,,,,,,,,,,,,,,,,,,,,
149,149,0.5895447491819317,2023-08-23 15:31:07.869033,2023-08-23 15:31:14.897547,0 days 00:00:07.028514,,,,,RandomForestClassifier,,,,,,,,,,,,,,,,,,,,,,,,86.0,11.0,,,,,,COMPLETE,0.0,,,,,,,,,,,,,,,,,,,,
150,150,0.589189285741146,2023-08-23 15:31:10.426419,2023-08-23 15:31:16.827600,0 days 00:00:06.401181,,,,,RandomForestClassifier,,,,,,,,,,,,,,,,,,,,,,,,92.0,9.0,,,,,,COMPLETE,0.0,,,,,,,,,,,,,,,,,,,,
151,151,0.5857454158665613,2023-08-23 15:31:14.971352,2023-08-23 15:31:20.608654,0 days 00:00:05.637302,,,,,RandomForestClassifier,,,,,,,,,,,,,,,,,,,,,,,,91.0,8.0,,,,,,COMPLETE,0.0,,,,,,,,,,,,,,,,,,,,
152,152,0.5832653412126889,2023-08-23 15:31:16.897527,2023-08-23 15:31:23.672454,0 days 00:00:06.774927,,,,,RandomForestClassifier,,,,,,,,,,,,,,,,,,,,,,,,81.0,13.0,,,,,,COMPLETE,0.0,,,,,,,,,,,,,,,,,,,,
153,153,0.5748310324992809,2023-08-23 15:31:20.702307,2023-08-23 15:31:20.981529,0 days 00:00:00.279222,,,,,DecisionTreeClassifier,,gini,5.0,,,,,,,,,,,,,,,,,,,,,,,,,,,,COMPLETE,0.0,,,,,,,,,,,,,,,,,,,,
154,154,0.5029149769144854,2023-08-23 15:31:21.073319,2023-08-23 15:31:29.077047,0 days 00:00:08.003728,,,,,SVC,,,,,,,,,,,,,,,,,,,,,,,,,,,,,733.8093446104226,rbf,COMPLETE,0.0,,,,,,,,,,,,,,,,,,,,
155,155,0.5889554230502863,2023-08-23 15:31:23.754526,2023-08-23 15:31:32.154901,0 days 00:00:08.400375,,,,,RandomForestClassifier,,,,,,,,,,,,,,,,,,,,,,,,93.0,13.0,,,,,,COMPLETE,0.0,,,,,,,,,,,,,,,,,,,,
156,156,0.5869204116402491,2023-08-23 15:31:29.203985,2023-08-23 15:31:38.004367,0 days 00:00:08.800382,,,,,RandomForestClassifier,,,,,,,,,,,,,,,,,,,,,,,,98.0,13.0,,,,,,COMPLETE,0.0,,,,,,,,,,,,,,,,,,,,
157,157,0.5986095609190439,2023-08-23 15:31:32.271512,2023-08-23 15:31:39.870999,0 days 00:00:07.599487,,,,,RandomForestClassifier,,,,,,,,,,,,,,,,,,,,,,,,98.0,9.0,,,,,,COMPLETE,0.0,,,,,,,,,,,,,,,,,,,,
158,158,0.5935431492149554,2023-08-23 15:31:38.152821,2023-08-23 15:31:43.529945,0 days 00:00:05.377124,,,,,RandomForestClassifier,,,,,,,,,,,,,,,,,,,,,,,,75.0,8.0,,,,,,COMPLETE,0.0,,,,,,,,,,,,,,,,,,,,
159,159,0.5943309052718203,2023-08-23 15:31:39.964691,2023-08-23 15:31:47.774128,0 days 00:00:07.809437,,,,,RandomForestClassifier,,,,,,,,,,,,,,,,,,,,,,,,88.0,11.0,,,,,,COMPLETE,0.0,,,,,,,,,,,,,,,,,,,,
160,160,0.6022267218374981,2023-08-23 15:31:43.628798,2023-08-23 15:31:50.072301,0 days 00:00:06.443503,,,,,RandomForestClassifier,,,,,,,,,,,,,,,,,,,,,,,,82.0,8.0,,,,,,COMPLETE,0.0,,,,,,,,,,,,,,,,,,,,
161,161,0.5945123988646344,2023-08-23 15:31:47.858241,2023-08-23 15:31:54.448275,0 days 00:00:06.590034,,,,,RandomForestClassifier,,,,,,,,,,,,,,,,,,,,,,,,83.0,8.0,,,,,,COMPLETE,0.0,,,,,,,,,,,,,,,,,,,,
162,162,0.5927162419927756,2023-08-23 15:31:50.171224,2023-08-23 15:31:58.182670,0 days 00:00:08.011446,,,,,RandomForestClassifier,,,,,,,,,,,,,,,,,,,,,,,,95.0,9.0,,,,,,COMPLETE,0.0,,,,,,,,,,,,,,,,,,,,
163,163,0.5937442222635172,2023-08-23 15:31:54.618423,2023-08-23 15:32:02.809845,0 days 00:00:08.191422,,,,,RandomForestClassifier,,,,,,,,,,,,,,,,,,,,,,,,95.0,9.0,,,,,,COMPLETE,0.0,,,,,,,,,,,,,,,,,,,,
164,164,0.5927018783496013,2023-08-23 15:31:58.305339,2023-08-23 15:32:06.775167,0 days 00:00:08.469828,,,,,RandomForestClassifier,,,,,,,,,,,,,,,,,,,,,,,,90.0,11.0,,,,,,COMPLETE,0.0,,,,,,,,,,,,,,,,,,,,
165,165,0.591538567432061,2023-08-23 15:32:02.988867,2023-08-23 15:32:11.618054,0 days 00:00:08.629187,,,,,RandomForestClassifier,,,,,,,,,,,,,,,,,,,,,,,,90.0,11.0,,,,,,COMPLETE,0.0,,,,,,,,,,,,,,,,,,,,
166,166,0.5946603172099939,2023-08-23 15:32:06.900772,2023-08-23 15:32:14.670832,0 days 00:00:07.770060,,,,,RandomForestClassifier,,,,,,,,,,,,,,,,,,,,,,,,81.0,10.0,,,,,,COMPLETE,0.0,,,,,,,,,,,,,,,,,,,,
167,167,0.5810768468021814,2023-08-23 15:32:11.800405,2023-08-23 15:32:13.931007,0 days 00:00:02.130602,,0.8,1.0,,LightGBM,,,,,0.8,,,,0.47033520169126986,3.429338350866337e-05,,80.0,,,,,,,,,,71.0,,,,,,,,,COMPLETE,0.0,,,,,,,,,,,,,,,,,,,,
168,168,0.593317728777518,2023-08-23 15:32:14.058952,2023-08-23 15:32:19.188543,0 days 00:00:05.129591,,,,,RandomForestClassifier,,,,,,,,,,,,,,,,,,,,,,,,76.0,8.0,,,,,,COMPLETE,0.0,,,,,,,,,,,,,,,,,,,,
169,169,0.6017154880954146,2023-08-23 15:32:14.753379,2023-08-23 15:32:21.064361,0 days 00:00:06.310982,,,,,RandomForestClassifier,,,,,,,,,,,,,,,,,,,,,,,,77.0,8.0,,,,,,COMPLETE,0.0,,,,,,,,,,,,,,,,,,,,
170,170,0.5918933536505069,2023-08-23 15:32:19.285200,2023-08-23 15:32:25.862929,0 days 00:00:06.577729,,,,,RandomForestClassifier,,,,,,,,,,,,,,,,,,,,,,,,93.0,8.0,,,,,,COMPLETE,0.0,,,,,,,,,,,,,,,,,,,,
171,171,0.5842356198128922,2023-08-23 15:32:21.145318,2023-08-23 15:32:28.452927,0 days 00:00:07.307609,,,,,RandomForestClassifier,,,,,,,,,,,,,,,,,,,,,,,,77.0,14.0,,,,,,COMPLETE,0.0,,,,,,,,,,,,,,,,,,,,
172,172,0.6012419304968659,2023-08-23 15:32:26.002318,2023-08-23 15:32:34.754861,0 days 00:00:08.752543,,,,,RandomForestClassifier,,,,,,,,,,,,,,,,,,,,,,,,86.0,12.0,,,,,,COMPLETE,0.0,,,,,,,,,,,,,,,,,,,,
173,173,0.5957759017737787,2023-08-23 15:32:28.621163,2023-08-23 15:32:37.968421,0 days 00:00:09.347258,,,,,RandomForestClassifier,,,,,,,,,,,,,,,,,,,,,,,,85.0,12.0,,,,,,COMPLETE,0.0,,,,,,,,,,,,,,,,,,,,
174,174,0.5917562902534481,2023-08-23 15:32:34.835804,2023-08-23 15:32:45.089463,0 days 00:00:10.253659,,,,,RandomForestClassifier,,,,,,,,,,,,,,,,,,,,,,,,87.0,15.0,,,,,,COMPLETE,0.0,,,,,,,,,,,,,,,,,,,,
175,175,0.5958663526796937,2023-08-23 15:32:38.085594,2023-08-23 15:32:44.251749,0 days 00:00:06.166155,,,,,RandomForestClassifier,,,,,,,,,,,,,,,,,,,,,,,,88.0,7.0,,,,,,COMPLETE,0.0,,,,,,,,,,,,,,,,,,,,
176,176,0.49014608540772897,2023-08-23 15:32:44.392583,2023-08-23 15:32:44.642326,0 days 00:00:00.249743,0.0023781634039729644,,,gblinear,XGBoost,0.4887330716116677,,,,,,,2.412702761491566e-06,,,,,,,,,,,,,,,,,,,,0.4199063166038841,,,COMPLETE,0.0,,,,,,,,,,,,,,,,,,,,
177,177,0.5973667923914132,2023-08-23 15:32:44.777936,2023-08-23 15:32:50.909430,0 days 00:00:06.131494,,,,,RandomForestClassifier,,,,,,,,,,,,,,,,,,,,,,,,81.0,10.0,,,,,,COMPLETE,0.0,,,,,,,,,,,,,,,,,,,,
178,178,0.6060689862351805,2023-08-23 15:32:45.165861,2023-08-23 15:32:53.110139,0 days 00:00:07.944278,,,,,RandomForestClassifier,,,,,,,,,,,,,,,,,,,,,,,,81.0,13.0,,,,,,COMPLETE,0.0,,,,,,,,,,,,,,,,,,,,
179,179,0.5893505901863393,2023-08-23 15:32:51.017076,2023-08-23 15:32:59.290152,0 days 00:00:08.273076,,,,,RandomForestClassifier,,,,,,,,,,,,,,,,,,,,,,,,83.0,13.0,,,,,,COMPLETE,0.0,,,,,,,,,,,,,,,,,,,,
180,180,0.5890795917218605,2023-08-23 15:32:53.173972,2023-08-23 15:33:01.187381,0 days 00:00:08.013409,,,,,RandomForestClassifier,,,,,,,,,,,,,,,,,,,,,,,,84.0,13.0,,,,,,COMPLETE,0.0,,,,,,,,,,,,,,,,,,,,
181,181,0.5931536026348638,2023-08-23 15:32:59.418420,2023-08-23 15:33:06.772130,0 days 00:00:07.353710,,,,,RandomForestClassifier,,,,,,,,,,,,,,,,,,,,,,,,84.0,10.0,,,,,,COMPLETE,0.0,,,,,,,,,,,,,,,,,,,,
182,182,0.5942976466400183,2023-08-23 15:33:01.350289,2023-08-23 15:33:09.752706,0 days 00:00:08.402417,,,,,RandomForestClassifier,,,,,,,,,,,,,,,,,,,,,,,,80.0,14.0,,,,,,COMPLETE,0.0,,,,,,,,,,,,,,,,,,,,
183,183,0.5941728547854785,2023-08-23 15:33:06.851835,2023-08-23 15:33:14.383857,0 days 00:00:07.532022,,,,,RandomForestClassifier,,,,,,,,,,,,,,,,,,,,,,,,80.0,14.0,,,,,,COMPLETE,0.0,,,,,,,,,,,,,,,,,,,,
184,184,0.5942649753347428,2023-08-23 15:33:09.814168,2023-08-23 15:33:17.917674,0 days 00:00:08.103506,,,,,RandomForestClassifier,,,,,,,,,,,,,,,,,,,,,,,,99.0,12.0,,,,,,COMPLETE,0.0,,,,,,,,,,,,,,,,,,,,
185,185,0.5972458927788492,2023-08-23 15:33:14.473735,2023-08-23 15:33:22.558386,0 days 00:00:08.084651,,,,,RandomForestClassifier,,,,,,,,,,,,,,,,,,,,,,,,96.0,12.0,,,,,,COMPLETE,0.0,,,,,,,,,,,,,,,,,,,,
186,186,0.5614868609444161,2023-08-23 15:33:18.029434,2023-08-23 15:33:18.633876,0 days 00:00:00.604442,,,,,DecisionTreeClassifier,,entropy,11.0,,,,,,,,,,,,,,,,,,,,,,,,,,,,COMPLETE,0.0,,,,,,,,,,,,,,,,,,,,
187,187,0.5961183698407858,2023-08-23 15:33:18.718491,2023-08-23 15:33:25.820975,0 days 00:00:07.102484,,,,,RandomForestClassifier,,,,,,,,,,,,,,,,,,,,,,,,96.0,9.0,,,,,,COMPLETE,0.0,,,,,,,,,,,,,,,,,,,,
188,188,0.5928396420596158,2023-08-23 15:33:22.633923,2023-08-23 15:33:28.779684,0 days 00:00:06.145761,,,,,RandomForestClassifier,,,,,,,,,,,,,,,,,,,,,,,,92.0,9.0,,,,,,COMPLETE,0.0,,,,,,,,,,,,,,,,,,,,
189,189,0.5860402132846855,2023-08-23 15:33:25.897627,2023-08-23 15:33:33.458279,0 days 00:00:07.560652,,,,,RandomForestClassifier,,,,,,,,,,,,,,,,,,,,,,,,93.0,11.0,,,,,,COMPLETE,0.0,,,,,,,,,,,,,,,,,,,,
190,190,0.5930218967775875,2023-08-23 15:33:28.877181,2023-08-23 15:33:37.175218,0 days 00:00:08.298037,,,,,RandomForestClassifier,,,,,,,,,,,,,,,,,,,,,,,,89.0,12.0,,,,,,COMPLETE,0.0,,,,,,,,,,,,,,,,,,,,
191,191,0.5901889162823484,2023-08-23 15:33:31.986137,2023-08-23 15:33:39.555926,0 days 00:00:07.569789,,,,,RandomForestClassifier,,,,,,,,,,,,,,,,,,,,,,,,86.0,12.0,,,,,,COMPLETE,0.0,,,,,,,,,,,,,,,,,,,,
192,192,0.49371959844379065,2023-08-23 15:33:33.622779,2023-08-23 15:33:40.771915,0 days 00:00:07.149136,,,,,SVC,,,,,,,,,,,,,,,,,,,,,,,,,,,,,5.278666093502717,rbf,COMPLETE,0.0,,,,,,,,,,,,,,,,,,,,
193,193,0.6032004630325103,2023-08-23 15:33:34.664837,2023-08-23 15:33:42.283924,0 days 00:00:07.619087,,,,,RandomForestClassifier,,,,,,,,,,,,,,,,,,,,,,,,89.0,12.0,,,,,,COMPLETE,0.0,,,,,,,,,,,,,,,,,,,,
