,number,value,datetime_start,datetime_complete,duration,params_alpha,params_bagging_fraction,params_bagging_freq,params_booster,params_classifier,params_colsample_bytree,params_dct_criterion,params_dct_max_depth,params_eta,params_feature_fraction,params_gamma,params_grow_policy,params_lambda,params_lambda_l1,params_lambda_l2,params_max_depth,params_min_child_samples,params_min_child_weight,params_mlp_activation,params_mlp_solver,params_n_layers,params_n_units_l_0,params_n_units_l_1,params_n_units_l_2,params_n_units_l_3,params_normalize_type,params_num_leaves,params_rate_drop,params_rf_estimator,params_rf_max_depth,params_sample_type,params_skip_drop,params_subsample,params_svc_c,params_svc_kernel,state,best_trial,dev_acc,dev_recall_macro,dev_precision_macro,dev_f1_macro,dev_recall_0,dev_precision_0,dev_f1_0,dev_recall_1,dev_precision_1,dev_f1_1,test_acc,test_recall_macro,test_precision_macro,test_f1_macro,test_recall_0,test_precision_0,test_f1_0,test_recall_1,test_precision_1,test_f1_1
0,0,0.5813032651484644,2023-08-23 19:03:05.669598,2023-08-23 19:03:06.138260,0 days 00:00:00.468662,,,,,RandomForestClassifier,,,,,,,,,,,,,,,,,,,,,,,,11.0,17.0,,,,,,COMPLETE,0.0,,,,,,,,,,,,,,,,,,,,
1,1,0.41721855997092283,2023-08-23 19:03:05.672067,2023-08-23 19:03:11.469568,0 days 00:00:05.797501,,,,,SVC,,,,,,,,,,,,,,,,,,,,,,,,,,,,,867.7069274766467,rbf,COMPLETE,0.0,,,,,,,,,,,,,,,,,,,,
2,2,0.3357921744708146,2023-08-23 19:03:05.675191,2023-08-23 19:03:08.084897,0 days 00:00:02.409706,,,,,SVC,,,,,,,,,,,,,,,,,,,,,,,,,,,,,0.015229094441907514,linear,COMPLETE,0.0,,,,,,,,,,,,,,,,,,,,
3,3,0.40466065671625173,2023-08-23 19:03:05.677189,2023-08-23 19:03:05.733978,0 days 00:00:00.056789,0.0002890593257949681,,,gblinear,XGBoost,0.8005391043448664,,,,,,,7.424956414897035e-05,,,,,,,,,,,,,,,,,,,,0.5235475958933639,,,COMPLETE,0.0,,,,,,,,,,,,,,,,,,,,
4,4,0.5638023992071597,2023-08-23 19:03:05.678883,2023-08-23 19:03:06.856555,0 days 00:00:01.177672,,,,,RandomForestClassifier,,,,,,,,,,,,,,,,,,,,,,,,23.0,21.0,,,,,,COMPLETE,0.0,,,,,,,,,,,,,,,,,,,,
5,5,0.5697027909541001,2023-08-23 19:03:05.680972,2023-08-23 19:03:06.646049,0 days 00:00:00.965077,,0.6000000000000001,3.0,,LightGBM,,,,,1.0,,,,0.0008310982012495131,1.0084091750691472e-06,,100.0,,,,,,,,,,225.0,,,,,,,,,COMPLETE,0.0,,,,,,,,,,,,,,,,,,,,
6,6,0.5669986462412668,2023-08-23 19:03:05.683991,2023-08-23 19:03:05.834076,0 days 00:00:00.150085,0.0023512385729191404,,,gbtree,XGBoost,0.5183988947256377,,,0.05172503114984461,,0.0010300176150864076,lossguide,0.008982662280422164,,,3.0,,10.0,,,,,,,,,,,,,,,0.2429919552957042,,,COMPLETE,0.0,,,,,,,,,,,,,,,,,,,,
7,7,0.41411354926673627,2023-08-23 19:03:05.687399,2023-08-23 19:03:05.782109,0 days 00:00:00.094710,5.905769725833337e-07,,,gblinear,XGBoost,0.9545517508044559,,,,,,,0.0009697257763050521,,,,,,,,,,,,,,,,,,,,0.8476480941308069,,,COMPLETE,0.0,,,,,,,,,,,,,,,,,,,,
8,8,0.5828252568783943,2023-08-23 19:03:05.776723,2023-08-23 19:03:06.782782,0 days 00:00:01.006059,,0.5,1.0,,LightGBM,,,,,0.6000000000000001,,,,4.1939058336738444e-07,0.006927894043174122,,80.0,,,,,,,,,,162.0,,,,,,,,,COMPLETE,0.0,,,,,,,,,,,,,,,,,,,,
9,9,0.5834281104636527,2023-08-23 19:03:05.829970,2023-08-23 19:03:06.025804,0 days 00:00:00.195834,,,,,DecisionTreeClassifier,,log_loss,14.0,,,,,,,,,,,,,,,,,,,,,,,,,,,,COMPLETE,0.0,,,,,,,,,,,,,,,,,,,,
10,10,0.5718863049095607,2023-08-23 19:03:05.877873,2023-08-23 19:03:08.461552,0 days 00:00:02.583679,,1.0,1.0,,LightGBM,,,,,0.8,,,,0.00027541444495067074,0.01609966805104176,,50.0,,,,,,,,,,222.0,,,,,,,,,COMPLETE,0.0,,,,,,,,,,,,,,,,,,,,
11,11,0.5615432219399388,2023-08-23 19:03:06.067419,2023-08-23 19:03:06.213933,0 days 00:00:00.146514,0.007591308333185772,,,dart,XGBoost,0.6766039836473993,,,5.500783149058734e-07,,0.00014273285003092438,depthwise,7.582130726084607e-05,,,3.0,,9.0,,,,,,,,tree,,0.21415032330384318,,,uniform,0.0003596365917886703,0.3755811727226919,,,COMPLETE,0.0,,,,,,,,,,,,,,,,,,,,
12,12,0.3375267712776991,2023-08-23 19:03:06.191312,2023-08-23 19:03:07.030662,0 days 00:00:00.839350,,,,,MLPClassifier,,,,,,,,,,,,,,tanh,sgd,1.0,20.0,,,,,,,,,,,,,,COMPLETE,0.0,,,,,,,,,,,,,,,,,,,,
13,13,0.3357921744708146,2023-08-23 19:03:06.266908,2023-08-23 19:03:09.202838,0 days 00:00:02.935930,,,,,SVC,,,,,,,,,,,,,,,,,,,,,,,,,,,,,0.95995134041097,poly,COMPLETE,0.0,,,,,,,,,,,,,,,,,,,,
14,14,0.3357921744708146,2023-08-23 19:03:06.702114,2023-08-23 19:03:12.492457,0 days 00:00:05.790343,,,,,SVC,,,,,,,,,,,,,,,,,,,,,,,,,,,,,0.00226468631055945,rbf,COMPLETE,0.0,,,,,,,,,,,,,,,,,,,,
15,15,0.5640068559621312,2023-08-23 19:03:06.836775,2023-08-23 19:03:09.757601,0 days 00:00:02.920826,,0.5,1.0,,LightGBM,,,,,0.4,,,,0.001765090543681056,9.01343385876768e-06,,20.0,,,,,,,,,,241.0,,,,,,,,,COMPLETE,0.0,,,,,,,,,,,,,,,,,,,,
16,16,0.5658095995305298,2023-08-23 19:03:06.934865,2023-08-23 19:03:07.131257,0 days 00:00:00.196392,,,,,DecisionTreeClassifier,,entropy,8.0,,,,,,,,,,,,,,,,,,,,,,,,,,,,COMPLETE,0.0,,,,,,,,,,,,,,,,,,,,
17,17,0.5296825308002947,2023-08-23 19:03:07.132299,2023-08-23 19:03:07.447870,0 days 00:00:00.315571,,,,,DecisionTreeClassifier,,log_loss,32.0,,,,,,,,,,,,,,,,,,,,,,,,,,,,COMPLETE,0.0,,,,,,,,,,,,,,,,,,,,
18,18,0.5628764265554055,2023-08-23 19:03:07.196821,2023-08-23 19:03:07.341477,0 days 00:00:00.144656,,,,,DecisionTreeClassifier,,log_loss,24.0,,,,,,,,,,,,,,,,,,,,,,,,,,,,COMPLETE,0.0,,,,,,,,,,,,,,,,,,,,
19,19,0.5757070897738512,2023-08-23 19:03:07.392578,2023-08-23 19:03:08.223897,0 days 00:00:00.831319,,0.4,1.0,,LightGBM,,,,,0.4,,,,4.0237921070696934e-08,0.21291790835723076,,60.0,,,,,,,,,,71.0,,,,,,,,,COMPLETE,0.0,,,,,,,,,,,,,,,,,,,,
20,20,0.3357921744708146,2023-08-23 19:03:07.495524,2023-08-23 19:03:11.568596,0 days 00:00:04.073072,,,,,SVC,,,,,,,,,,,,,,,,,,,,,,,,,,,,,0.0021381529970894188,linear,COMPLETE,0.0,,,,,,,,,,,,,,,,,,,,
21,21,0.5757070897738512,2023-08-23 19:03:08.129744,2023-08-23 19:03:09.089658,0 days 00:00:00.959914,,0.4,1.0,,LightGBM,,,,,0.4,,,,8.082117420382734e-08,0.21030789326013008,,60.0,,,,,,,,,,86.0,,,,,,,,,COMPLETE,0.0,,,,,,,,,,,,,,,,,,,,
22,22,0.5627334063518575,2023-08-23 19:03:08.281610,2023-08-23 19:03:10.253100,0 days 00:00:01.971490,,1.0,1.0,,LightGBM,,,,,0.6000000000000001,,,,2.5317150868660575e-07,0.005207431936311264,,80.0,,,,,,,,,,183.0,,,,,,,,,COMPLETE,0.0,,,,,,,,,,,,,,,,,,,,
23,23,0.42808427722214165,2023-08-23 19:03:08.517374,2023-08-23 19:03:13.372146,0 days 00:00:04.854772,,,,,MLPClassifier,,,,,,,,,,,,,,identity,lbfgs,4.0,100.0,20.0,80.0,90.0,,,,,,,,,,,COMPLETE,0.0,,,,,,,,,,,,,,,,,,,,
24,24,0.3357921744708146,2023-08-23 19:03:09.155341,2023-08-23 19:03:13.467909,0 days 00:00:04.312568,,,,,SVC,,,,,,,,,,,,,,,,,,,,,,,,,,,,,41.33823437760383,poly,COMPLETE,0.0,,,,,,,,,,,,,,,,,,,,
25,25,0.3357921744708146,2023-08-23 19:03:09.286822,2023-08-23 19:03:58.394036,0 days 00:00:49.107214,,,,,MLPClassifier,,,,,,,,,,,,,,logistic,adam,4.0,100.0,50.0,60.0,10.0,,,,,,,,,,,COMPLETE,0.0,,,,,,,,,,,,,,,,,,,,
26,26,0.5238668101875628,2023-08-23 19:03:09.811636,2023-08-23 19:07:48.871103,0 days 00:04:39.059467,,,,,MLPClassifier,,,,,,,,,,,,,,identity,adam,4.0,100.0,70.0,20.0,100.0,,,,,,,,,,,COMPLETE,0.0,,,,,,,,,,,,,,,,,,,,
27,27,0.5504390491805262,2023-08-23 19:03:10.344851,2023-08-23 19:07:59.904750,0 days 00:04:49.559899,,,,,MLPClassifier,,,,,,,,,,,,,,relu,adam,4.0,100.0,100.0,10.0,80.0,,,,,,,,,,,COMPLETE,0.0,,,,,,,,,,,,,,,,,,,,
28,28,0.5785970083269287,2023-08-23 19:03:11.558787,2023-08-23 19:03:14.989247,0 days 00:00:03.430460,,,,,RandomForestClassifier,,,,,,,,,,,,,,,,,,,,,,,,92.0,5.0,,,,,,COMPLETE,0.0,,,,,,,,,,,,,,,,,,,,
29,29,0.5810001899696049,2023-08-23 19:03:11.713095,2023-08-23 19:03:14.855884,0 days 00:00:03.142789,,,,,RandomForestClassifier,,,,,,,,,,,,,,,,,,,,,,,,81.0,5.0,,,,,,COMPLETE,0.0,,,,,,,,,,,,,,,,,,,,
30,30,0.5784898946769143,2023-08-23 19:03:12.637761,2023-08-23 19:03:16.269358,0 days 00:00:03.631597,,,,,RandomForestClassifier,,,,,,,,,,,,,,,,,,,,,,,,94.0,5.0,,,,,,COMPLETE,0.0,,,,,,,,,,,,,,,,,,,,
31,31,0.579014701753193,2023-08-23 19:03:13.441671,2023-08-23 19:03:17.219905,0 days 00:00:03.778234,,,,,RandomForestClassifier,,,,,,,,,,,,,,,,,,,,,,,,87.0,5.0,,,,,,COMPLETE,0.0,,,,,,,,,,,,,,,,,,,,
32,32,0.5771775689929901,2023-08-23 19:03:13.540528,2023-08-23 19:03:16.638198,0 days 00:00:03.097670,,,,,RandomForestClassifier,,,,,,,,,,,,,,,,,,,,,,,,88.0,4.0,,,,,,COMPLETE,0.0,,,,,,,,,,,,,,,,,,,,
33,33,0.5664712265603293,2023-08-23 19:03:14.952667,2023-08-23 19:03:16.530157,0 days 00:00:01.577490,,,,,RandomForestClassifier,,,,,,,,,,,,,,,,,,,,,,,,13.0,23.0,,,,,,COMPLETE,0.0,,,,,,,,,,,,,,,,,,,,
34,34,0.5613596564663474,2023-08-23 19:03:15.081216,2023-08-23 19:03:16.007577,0 days 00:00:00.926361,,,,,RandomForestClassifier,,,,,,,,,,,,,,,,,,,,,,,,12.0,26.0,,,,,,COMPLETE,0.0,,,,,,,,,,,,,,,,,,,,
35,35,0.5757261663666366,2023-08-23 19:03:16.089871,2023-08-23 19:03:16.365933,0 days 00:00:00.276062,,,,,DecisionTreeClassifier,,gini,2.0,,,,,,,,,,,,,,,,,,,,,,,,,,,,COMPLETE,0.0,,,,,,,,,,,,,,,,,,,,
36,36,0.5757261663666366,2023-08-23 19:03:16.341255,2023-08-23 19:03:16.463724,0 days 00:00:00.122469,,,,,DecisionTreeClassifier,,gini,2.0,,,,,,,,,,,,,,,,,,,,,,,,,,,,COMPLETE,0.0,,,,,,,,,,,,,,,,,,,,
37,37,0.5733601205044707,2023-08-23 19:03:16.455783,2023-08-23 19:03:17.040987,0 days 00:00:00.585204,,,,,DecisionTreeClassifier,,log_loss,10.0,,,,,,,,,,,,,,,,,,,,,,,,,,,,COMPLETE,0.0,,,,,,,,,,,,,,,,,,,,
38,38,0.5766201635886893,2023-08-23 19:03:16.605569,2023-08-23 19:03:18.586673,0 days 00:00:01.981104,,,,,RandomForestClassifier,,,,,,,,,,,,,,,,,,,,,,,,60.0,2.0,,,,,,COMPLETE,0.0,,,,,,,,,,,,,,,,,,,,
39,39,0.5729204591999272,2023-08-23 19:03:16.718018,2023-08-23 19:03:18.505070,0 days 00:00:01.787052,,,,,RandomForestClassifier,,,,,,,,,,,,,,,,,,,,,,,,57.0,2.0,,,,,,COMPLETE,0.0,,,,,,,,,,,,,,,,,,,,
40,40,0.543308954894015,2023-08-23 19:03:16.726394,2023-08-23 19:03:18.734803,0 days 00:00:02.008409,,,,,RandomForestClassifier,,,,,,,,,,,,,,,,,,,,,,,,58.0,2.0,,,,,,COMPLETE,0.0,,,,,,,,,,,,,,,,,,,,
41,41,0.5716823331613838,2023-08-23 19:03:17.140003,2023-08-23 19:03:19.103461,0 days 00:00:01.963458,,,,,RandomForestClassifier,,,,,,,,,,,,,,,,,,,,,,,,58.0,2.0,,,,,,COMPLETE,0.0,,,,,,,,,,,,,,,,,,,,
42,42,0.5760772533002283,2023-08-23 19:03:17.289342,2023-08-23 19:03:18.837168,0 days 00:00:01.547826,,,,,RandomForestClassifier,,,,,,,,,,,,,,,,,,,,,,,,55.0,2.0,,,,,,COMPLETE,0.0,,,,,,,,,,,,,,,,,,,,
43,43,0.43402540643858856,2023-08-23 19:03:18.573558,2023-08-23 19:03:29.162842,0 days 00:00:10.589284,,,,,MLPClassifier,,,,,,,,,,,,,,logistic,adam,1.0,80.0,,,,,,,,,,,,,,COMPLETE,0.0,,,,,,,,,,,,,,,,,,,,
44,44,0.5597699565479995,2023-08-23 19:03:18.676435,2023-08-23 19:08:01.384500,0 days 00:04:42.708065,,,,,MLPClassifier,,,,,,,,,,,,,,relu,adam,4.0,80.0,100.0,10.0,10.0,,,,,,,,,,,COMPLETE,0.0,,,,,,,,,,,,,,,,,,,,
45,45,0.5159119735445478,2023-08-23 19:03:18.805218,2023-08-23 19:04:53.788268,0 days 00:01:34.983050,,,,,MLPClassifier,,,,,,,,,,,,,,relu,adam,1.0,80.0,,,,,,,,,,,,,,COMPLETE,0.0,,,,,,,,,,,,,,,,,,,,
46,46,0.5609406493772426,2023-08-23 19:03:18.927392,2023-08-23 19:08:00.143960,0 days 00:04:41.216568,,,,,MLPClassifier,,,,,,,,,,,,,,relu,adam,4.0,80.0,100.0,10.0,10.0,,,,,,,,,,,COMPLETE,0.0,,,,,,,,,,,,,,,,,,,,
47,47,0.3357921744708146,2023-08-23 19:03:19.184788,2023-08-23 19:03:54.331292,0 days 00:00:35.146504,,,,,MLPClassifier,,,,,,,,,,,,,,logistic,adam,4.0,80.0,100.0,10.0,10.0,,,,,,,,,,,COMPLETE,0.0,,,,,,,,,,,,,,,,,,,,
48,48,0.3417685594827167,2023-08-23 19:03:29.244705,2023-08-23 19:03:29.885146,0 days 00:00:00.640441,0.9238532053172103,,,gbtree,XGBoost,0.21821066773662873,,,1.538318292501491e-08,,2.1995182146644033e-08,lossguide,2.7934496885277504e-08,,,9.0,,2.0,,,,,,,,,,,,,,,0.922730212033821,,,COMPLETE,0.0,,,,,,,,,,,,,,,,,,,,
49,49,0.5733752063864106,2023-08-23 19:03:29.957664,2023-08-23 19:03:34.009168,0 days 00:00:04.051504,,,,,RandomForestClassifier,,,,,,,,,,,,,,,,,,,,,,,,80.0,10.0,,,,,,COMPLETE,0.0,,,,,,,,,,,,,,,,,,,,
50,50,0.5822690743866576,2023-08-23 19:03:34.087790,2023-08-23 19:03:36.291119,0 days 00:00:02.203329,,0.8,2.0,,LightGBM,,,,,0.7000000000000001,,,,0.11777121432293951,1.6082760760074922e-08,,100.0,,,,,,,,,,141.0,,,,,,,,,COMPLETE,0.0,,,,,,,,,,,,,,,,,,,,
51,51,0.5705157221689845,2023-08-23 19:03:36.369592,2023-08-23 19:03:38.185974,0 days 00:00:01.816382,,0.8,2.0,,LightGBM,,,,,0.7000000000000001,,,,0.7311913520722286,3.058725860842692e-08,,100.0,,,,,,,,,,143.0,,,,,,,,,COMPLETE,0.0,,,,,,,,,,,,,,,,,,,,
52,52,0.5922570933974185,2023-08-23 19:03:38.258104,2023-08-23 19:03:38.980309,0 days 00:00:00.722205,,0.8,2.0,,LightGBM,,,,,0.6000000000000001,,,,2.6629196996555996e-06,0.00010213595236646364,,80.0,,,,,,,,,,5.0,,,,,,,,,COMPLETE,0.0,,,,,,,,,,,,,,,,,,,,
53,53,0.5842631972498101,2023-08-23 19:03:39.045370,2023-08-23 19:03:39.756183,0 days 00:00:00.710813,,0.8,2.0,,LightGBM,,,,,0.6000000000000001,,,,3.175057176288115e-06,0.0003793218525201894,,80.0,,,,,,,,,,3.0,,,,,,,,,COMPLETE,0.0,,,,,,,,,,,,,,,,,,,,
54,54,0.5838921774912869,2023-08-23 19:03:39.834889,2023-08-23 19:03:40.576222,0 days 00:00:00.741333,,0.8,2.0,,LightGBM,,,,,0.6000000000000001,,,,2.586849474810784e-06,0.00027015770429920493,,80.0,,,,,,,,,,2.0,,,,,,,,,COMPLETE,0.0,,,,,,,,,,,,,,,,,,,,
55,55,0.5842631972498101,2023-08-23 19:03:40.649394,2023-08-23 19:03:41.319495,0 days 00:00:00.670101,,0.8,2.0,,LightGBM,,,,,0.6000000000000001,,,,2.8751835505167014e-06,0.0005143683266844315,,80.0,,,,,,,,,,3.0,,,,,,,,,COMPLETE,0.0,,,,,,,,,,,,,,,,,,,,
56,56,0.5976416699756083,2023-08-23 19:03:41.386223,2023-08-23 19:03:42.208435,0 days 00:00:00.822212,,0.8,2.0,,LightGBM,,,,,0.6000000000000001,,,,2.477545329133871e-06,0.00020521220686675246,,80.0,,,,,,,,,,8.0,,,,,,,,,COMPLETE,0.0,,,,,,,,,,,,,,,,,,,,
57,57,0.5842631972498101,2023-08-23 19:03:42.278249,2023-08-23 19:03:42.952239,0 days 00:00:00.673990,,0.8,2.0,,LightGBM,,,,,0.6000000000000001,,,,3.5531424410334472e-06,0.00019923107327614846,,80.0,,,,,,,,,,3.0,,,,,,,,,COMPLETE,0.0,,,,,,,,,,,,,,,,,,,,
58,58,0.5838921774912869,2023-08-23 19:03:43.029429,2023-08-23 19:03:43.441527,0 days 00:00:00.412098,,0.8,2.0,,LightGBM,,,,,0.6000000000000001,,,,4.478892167197738e-06,0.00021206111476510233,,80.0,,,,,,,,,,2.0,,,,,,,,,COMPLETE,0.0,,,,,,,,,,,,,,,,,,,,
59,59,0.5842631972498101,2023-08-23 19:03:43.517712,2023-08-23 19:03:44.157981,0 days 00:00:00.640269,,0.8,2.0,,LightGBM,,,,,0.6000000000000001,,,,4.717833806065256e-06,0.00027229999141174593,,80.0,,,,,,,,,,3.0,,,,,,,,,COMPLETE,0.0,,,,,,,,,,,,,,,,,,,,
60,60,0.5889620181639463,2023-08-23 19:03:44.225505,2023-08-23 19:03:45.726958,0 days 00:00:01.501453,,0.8,2.0,,LightGBM,,,,,0.6000000000000001,,,,5.366024199159968e-06,0.00018113793725281236,,80.0,,,,,,,,,,30.0,,,,,,,,,COMPLETE,0.0,,,,,,,,,,,,,,,,,,,,
61,61,0.5829782341994754,2023-08-23 19:03:45.803983,2023-08-23 19:03:47.477219,0 days 00:00:01.673236,,0.9,2.0,,LightGBM,,,,,0.5,,,,8.071741367267662e-06,8.356854078714697e-05,,70.0,,,,,,,,,,38.0,,,,,,,,,COMPLETE,0.0,,,,,,,,,,,,,,,,,,,,
62,62,0.582602746781237,2023-08-23 19:03:47.544763,2023-08-23 19:03:49.605477,0 days 00:00:02.060714,,0.7000000000000001,2.0,,LightGBM,,,,,0.5,,,,1.5258037372936804e-05,0.0005160906189357401,,90.0,,,,,,,,,,38.0,,,,,,,,,COMPLETE,0.0,,,,,,,,,,,,,,,,,,,,
63,63,0.5831273397671048,2023-08-23 19:03:49.688961,2023-08-23 19:03:51.304368,0 days 00:00:01.615407,,0.7000000000000001,2.0,,LightGBM,,,,,0.6000000000000001,,,,8.182429041443546e-07,3.5389577519502174e-05,,70.0,,,,,,,,,,37.0,,,,,,,,,COMPLETE,0.0,,,,,,,,,,,,,,,,,,,,
64,64,0.5838652423240651,2023-08-23 19:03:51.402787,2023-08-23 19:03:52.890521,0 days 00:00:01.487734,,0.9,3.0,,LightGBM,,,,,0.5,,,,2.4142182558312973e-05,0.001050789173365024,,70.0,,,,,,,,,,27.0,,,,,,,,,COMPLETE,0.0,,,,,,,,,,,,,,,,,,,,
65,65,0.5908004478604465,2023-08-23 19:03:52.966053,2023-08-23 19:03:54.520719,0 days 00:00:01.554666,,0.9,2.0,,LightGBM,,,,,0.7000000000000001,,,,1.1789843234723537e-06,3.8193145868104696e-05,,90.0,,,,,,,,,,19.0,,,,,,,,,COMPLETE,0.0,,,,,,,,,,,,,,,,,,,,
66,66,0.5860749087398558,2023-08-23 19:03:54.454061,2023-08-23 19:03:55.782496,0 days 00:00:01.328435,,0.9,2.0,,LightGBM,,,,,0.7000000000000001,,,,1.4190579165126888e-06,4.731017002248778e-05,,90.0,,,,,,,,,,20.0,,,,,,,,,COMPLETE,0.0,,,,,,,,,,,,,,,,,,,,
67,67,0.5884006042581316,2023-08-23 19:03:54.608101,2023-08-23 19:03:56.130715,0 days 00:00:01.522614,,0.9,2.0,,LightGBM,,,,,0.7000000000000001,,,,8.1545656434205e-07,3.354212610523767e-05,,90.0,,,,,,,,,,26.0,,,,,,,,,COMPLETE,0.0,,,,,,,,,,,,,,,,,,,,
68,68,0.5915086060786446,2023-08-23 19:03:55.844440,2023-08-23 19:03:57.147477,0 days 00:00:01.303037,,0.9,2.0,,LightGBM,,,,,0.7000000000000001,,,,7.059430672724765e-07,3.0032970191870198e-05,,90.0,,,,,,,,,,24.0,,,,,,,,,COMPLETE,0.0,,,,,,,,,,,,,,,,,,,,
69,69,0.5842233711146734,2023-08-23 19:03:56.246838,2023-08-23 19:03:57.725544,0 days 00:00:01.478706,,0.9,2.0,,LightGBM,,,,,0.8,,,,3.8683606666055045e-07,2.4231836408947086e-05,,90.0,,,,,,,,,,29.0,,,,,,,,,COMPLETE,0.0,,,,,,,,,,,,,,,,,,,,
70,70,0.5842893896129597,2023-08-23 19:03:57.218889,2023-08-23 19:03:59.155403,0 days 00:00:01.936514,,0.9,2.0,,LightGBM,,,,,0.8,,,,5.973118051330149e-07,1.9015360625574877e-05,,90.0,,,,,,,,,,61.0,,,,,,,,,COMPLETE,0.0,,,,,,,,,,,,,,,,,,,,
71,71,0.5784744214895772,2023-08-23 19:03:57.787575,2023-08-23 19:03:59.998243,0 days 00:00:02.210668,,0.9,2.0,,LightGBM,,,,,0.7000000000000001,,,,8.475063323815848e-07,1.9006844129989335e-05,,90.0,,,,,,,,,,62.0,,,,,,,,,COMPLETE,0.0,,,,,,,,,,,,,,,,,,,,
72,72,0.5760413220857397,2023-08-23 19:03:58.443968,2023-08-23 19:04:00.614777,0 days 00:00:02.170809,,0.9,2.0,,LightGBM,,,,,0.7000000000000001,,,,7.98327449166398e-07,2.1467606326349158e-05,,90.0,,,,,,,,,,54.0,,,,,,,,,COMPLETE,0.0,,,,,,,,,,,,,,,,,,,,
73,73,0.5869786505114281,2023-08-23 19:03:59.292411,2023-08-23 19:04:01.146882,0 days 00:00:01.854471,,0.9,2.0,,LightGBM,,,,,0.7000000000000001,,,,9.89978527717163e-07,7.235437956871353e-05,,90.0,,,,,,,,,,27.0,,,,,,,,,COMPLETE,0.0,,,,,,,,,,,,,,,,,,,,
74,74,0.5869786505114281,2023-08-23 19:04:00.113522,2023-08-23 19:04:01.886667,0 days 00:00:01.773145,,0.9,2.0,,LightGBM,,,,,0.7000000000000001,,,,1.8965710479500646e-07,6.0847144405914474e-05,,90.0,,,,,,,,,,27.0,,,,,,,,,COMPLETE,0.0,,,,,,,,,,,,,,,,,,,,
75,75,0.5457379580797773,2023-08-23 19:04:00.707085,2023-08-23 19:04:01.283710,0 days 00:00:00.576625,1.2043453876553104e-08,,,dart,XGBoost,0.4222639522151317,,,0.8253311640996058,,0.6352112092932006,depthwise,0.1887114548249803,,,9.0,,3.0,,,,,,,,forest,,1.195422643228293e-08,,,weighted,4.2483357678613835e-08,0.7053011136326568,,,COMPLETE,0.0,,,,,,,,,,,,,,,,,,,,
76,76,0.579190199872881,2023-08-23 19:04:01.225678,2023-08-23 19:04:02.225085,0 days 00:00:00.999407,2.707521294394695e-08,,,dart,XGBoost,0.9925470519150323,,,0.0630339478002878,,0.5495613453110959,depthwise,0.5340662963108439,,,9.0,,2.0,,,,,,,,forest,,1.0341898623922649e-08,,,weighted,1.1946619617445786e-08,0.6372697491813546,,,COMPLETE,0.0,,,,,,,,,,,,,,,,,,,,
77,77,0.3357921744708146,2023-08-23 19:04:01.375677,2023-08-23 19:04:05.034269,0 days 00:00:03.658592,,,,,SVC,,,,,,,,,,,,,,,,,,,,,,,,,,,,,0.31878211341292867,linear,COMPLETE,0.0,,,,,,,,,,,,,,,,,,,,
78,78,0.5794826446284899,2023-08-23 19:04:02.038910,2023-08-23 19:04:04.964701,0 days 00:00:02.925791,,1.0,2.0,,LightGBM,,,,,0.7000000000000001,,,,1.4129474768242862e-07,7.884110565839883e-05,,90.0,,,,,,,,,,23.0,,,,,,,,,COMPLETE,0.0,,,,,,,,,,,,,,,,,,,,
79,79,0.5964472536796402,2023-08-23 19:04:02.340273,2023-08-23 19:04:05.374504,0 days 00:00:03.034231,,1.0,2.0,,LightGBM,,,,,0.7000000000000001,,,,1.584499749862125e-07,8.642887370059509e-05,,90.0,,,,,,,,,,24.0,,,,,,,,,COMPLETE,0.0,,,,,,,,,,,,,,,,,,,,
80,80,0.5964007185806969,2023-08-23 19:04:05.039544,2023-08-23 19:04:06.976870,0 days 00:00:01.937326,,0.9,2.0,,LightGBM,,,,,0.8,,,,1.2353665143948392e-08,7.86078842156468e-05,,100.0,,,,,,,,,,24.0,,,,,,,,,COMPLETE,0.0,,,,,,,,,,,,,,,,,,,,
81,81,0.5865239012313825,2023-08-23 19:04:05.109965,2023-08-23 19:04:07.248547,0 days 00:00:02.138582,,0.9,2.0,,LightGBM,,,,,0.8,,,,1.5539989953427371e-07,8.598391581086312e-05,,100.0,,,,,,,,,,22.0,,,,,,,,,COMPLETE,0.0,,,,,,,,,,,,,,,,,,,,
82,82,0.5748047439157694,2023-08-23 19:04:05.457456,2023-08-23 19:04:08.028671,0 days 00:00:02.571215,,1.0,3.0,,LightGBM,,,,,0.8,,,,5.743729963915028e-08,7.061279526563358e-06,,100.0,,,,,,,,,,49.0,,,,,,,,,COMPLETE,0.0,,,,,,,,,,,,,,,,,,,,
83,83,0.5786241101945366,2023-08-23 19:04:07.064244,2023-08-23 19:04:09.300105,0 days 00:00:02.235861,,1.0,2.0,,LightGBM,,,,,0.9,,,,1.4561751575243864e-08,6.853652467483474e-06,,100.0,,,,,,,,,,49.0,,,,,,,,,COMPLETE,0.0,,,,,,,,,,,,,,,,,,,,
84,84,0.5729409288753157,2023-08-23 19:04:07.365820,2023-08-23 19:04:09.670672,0 days 00:00:02.304852,,1.0,2.0,,LightGBM,,,,,0.8,,,,7.735177427619536e-08,5.5410673169475484e-06,,100.0,,,,,,,,,,51.0,,,,,,,,,COMPLETE,0.0,,,,,,,,,,,,,,,,,,,,
