,number,value,datetime_start,datetime_complete,duration,params_alpha,params_bagging_fraction,params_bagging_freq,params_booster,params_classifier,params_colsample_bytree,params_dct_criterion,params_dct_max_depth,params_eta,params_feature_fraction,params_gamma,params_grow_policy,params_lambda,params_lambda_l1,params_lambda_l2,params_max_depth,params_min_child_samples,params_min_child_weight,params_mlp_activation,params_mlp_solver,params_n_layers,params_n_units_l_0,params_n_units_l_1,params_n_units_l_2,params_n_units_l_3,params_normalize_type,params_num_leaves,params_rate_drop,params_rf_estimator,params_rf_max_depth,params_sample_type,params_skip_drop,params_subsample,params_svc_c,params_svc_kernel,state,best_trial,dev_acc,dev_recall_macro,dev_precision_macro,dev_f1_macro,dev_recall_0,dev_precision_0,dev_f1_0,dev_recall_1,dev_precision_1,dev_f1_1,test_acc,test_recall_macro,test_precision_macro,test_f1_macro,test_recall_0,test_precision_0,test_f1_0,test_recall_1,test_precision_1,test_f1_1
172,172,0.7876932050160397,2023-08-23 12:15:43.886754,2023-08-23 12:15:45.678280,0 days 00:00:01.791526,,1.0,2.0,,LightGBM,,,,,0.8,,,,4.210136115248251e-07,1.2557493771019906e-07,,20.0,,,,,,,,,,63.0,,,,,,,,,COMPLETE,0.0,,,,,,,,,,,,,,,,,,,,
173,173,0.7876932050160397,2023-08-23 12:15:44.225763,2023-08-23 12:15:46.070365,0 days 00:00:01.844602,,1.0,2.0,,LightGBM,,,,,0.8,,,,2.3550245673038823e-07,9.865804589300955e-08,,20.0,,,,,,,,,,63.0,,,,,,,,,COMPLETE,0.0,,,,,,,,,,,,,,,,,,,,
174,174,0.7482855990318678,2023-08-23 12:15:44.429136,2023-08-23 12:15:45.422924,0 days 00:00:00.993788,,0.5,2.0,,LightGBM,,,,,0.9,,,,2.326164466005463e-07,9.668202893783465e-08,,20.0,,,,,,,,,,63.0,,,,,,,,,COMPLETE,0.0,,,,,,,,,,,,,,,,,,,,
175,175,0.7628630911073659,2023-08-23 12:15:45.526642,2023-08-23 12:15:47.638457,0 days 00:00:02.111815,,1.0,2.0,,LightGBM,,,,,0.8,,,,2.936372691458813e-07,2.577148334757563e-07,,10.0,,,,,,,,,,49.0,,,,,,,,,COMPLETE,0.0,,,,,,,,,,,,,,,,,,,,
176,176,0.7307692307692308,2023-08-23 12:15:45.768086,2023-08-23 12:15:46.250072,0 days 00:00:00.481986,0.0008920391431748451,,,gbtree,XGBoost,0.7495705929837383,,,1.728533309431135e-08,,9.244620627301077e-05,depthwise,2.125353130102318e-08,,,5.0,,6.0,,,,,,,,,,,,,,,0.4826483512249111,,,COMPLETE,0.0,,,,,,,,,,,,,,,,,,,,
177,177,0.5722620755619321,2023-08-23 12:15:46.181516,2023-08-23 12:15:46.669376,0 days 00:00:00.487860,0.0006348650847884587,,,gbtree,XGBoost,0.8301077955292497,,,1.0198800322920344e-08,,7.38850132841394e-05,depthwise,1.195975625091965e-08,,,5.0,,6.0,,,,,,,,,,,,,,,0.4756015382117491,,,COMPLETE,0.0,,,,,,,,,,,,,,,,,,,,
178,178,0.7876932050160397,2023-08-23 12:15:46.380955,2023-08-23 12:15:47.914372,0 days 00:00:01.533417,,1.0,2.0,,LightGBM,,,,,0.8,,,,3.7470123260581475e-07,6.179067142232362e-08,,20.0,,,,,,,,,,45.0,,,,,,,,,COMPLETE,0.0,,,,,,,,,,,,,,,,,,,,
179,179,0.7876932050160397,2023-08-23 12:15:46.773733,2023-08-23 12:15:48.397613,0 days 00:00:01.623880,,1.0,2.0,,LightGBM,,,,,0.8,,,,3.4240837173795906e-07,6.959631438792683e-08,,20.0,,,,,,,,,,48.0,,,,,,,,,COMPLETE,0.0,,,,,,,,,,,,,,,,,,,,
180,180,0.7876932050160397,2023-08-23 12:15:47.733153,2023-08-23 12:15:49.319093,0 days 00:00:01.585940,,1.0,2.0,,LightGBM,,,,,0.8,,,,1.0772588505691576e-07,6.819531366216842e-08,,20.0,,,,,,,,,,46.0,,,,,,,,,COMPLETE,0.0,,,,,,,,,,,,,,,,,,,,
181,181,0.7876932050160397,2023-08-23 12:15:48.001260,2023-08-23 12:15:49.651772,0 days 00:00:01.650512,,1.0,2.0,,LightGBM,,,,,0.8,,,,1.3182212608110736e-07,3.5256183150042897e-07,,20.0,,,,,,,,,,56.0,,,,,,,,,COMPLETE,0.0,,,,,,,,,,,,,,,,,,,,
182,182,0.7876932050160397,2023-08-23 12:15:48.542406,2023-08-23 12:15:50.328944,0 days 00:00:01.786538,,1.0,2.0,,LightGBM,,,,,0.8,,,,1.2226722983839732e-07,2.6758558936198037e-08,,20.0,,,,,,,,,,57.0,,,,,,,,,COMPLETE,0.0,,,,,,,,,,,,,,,,,,,,
183,183,0.4155114275009367,2023-08-23 12:15:49.427888,2023-08-23 12:16:26.511716,0 days 00:00:37.083828,,,,,MLPClassifier,,,,,,,,,,,,,,identity,lbfgs,2.0,30.0,10.0,,,,,,,,,,,,,COMPLETE,0.0,,,,,,,,,,,,,,,,,,,,
184,184,0.7010012887875483,2023-08-23 12:15:49.764573,2023-08-23 12:15:51.272583,0 days 00:00:01.508010,,1.0,2.0,,LightGBM,,,,,0.8,,,,1.150223492661343e-06,2.635206070868724e-08,,20.0,,,,,,,,,,34.0,,,,,,,,,COMPLETE,0.0,,,,,,,,,,,,,,,,,,,,
185,185,0.441760601180891,2023-08-23 12:15:50.410760,2023-08-23 12:15:57.280990,0 days 00:00:06.870230,,,,,MLPClassifier,,,,,,,,,,,,,,identity,lbfgs,2.0,80.0,10.0,,,,,,,,,,,,,COMPLETE,0.0,,,,,,,,,,,,,,,,,,,,
186,186,0.42075949367088605,2023-08-23 12:15:51.453440,2023-08-23 12:16:35.327248,0 days 00:00:43.873808,,,,,MLPClassifier,,,,,,,,,,,,,,identity,lbfgs,2.0,80.0,10.0,,,,,,,,,,,,,COMPLETE,0.0,,,,,,,,,,,,,,,,,,,,
187,187,0.7200828157349897,2023-08-23 12:15:51.973462,2023-08-23 12:15:53.864847,0 days 00:00:01.891385,,1.0,2.0,,LightGBM,,,,,0.8,,,,7.293295702902706e-07,1.5773054952866583e-08,,10.0,,,,,,,,,,53.0,,,,,,,,,COMPLETE,0.0,,,,,,,,,,,,,,,,,,,,
188,188,0.7333333333333334,2023-08-23 12:15:53.988781,2023-08-23 12:15:55.330118,0 days 00:00:01.341337,,1.0,2.0,,LightGBM,,,,,0.8,,,,4.037222563489303e-07,1.2882811053059107e-07,,20.0,,,,,,,,,,29.0,,,,,,,,,COMPLETE,0.0,,,,,,,,,,,,,,,,,,,,
189,189,0.7393483709273183,2023-08-23 12:15:55.417065,2023-08-23 12:15:57.017251,0 days 00:00:01.600186,,1.0,2.0,,LightGBM,,,,,0.8,,,,4.044536209035876e-07,9.743907115713734e-08,,20.0,,,,,,,,,,39.0,,,,,,,,,COMPLETE,0.0,,,,,,,,,,,,,,,,,,,,
190,190,0.7876932050160397,2023-08-23 12:15:57.108289,2023-08-23 12:15:58.675884,0 days 00:00:01.567595,,1.0,2.0,,LightGBM,,,,,0.8,,,,8.452945129496275e-07,2.2509476609555534e-07,,20.0,,,,,,,,,,45.0,,,,,,,,,COMPLETE,0.0,,,,,,,,,,,,,,,,,,,,
191,191,0.7538461538461538,2023-08-23 12:15:57.376730,2023-08-23 12:15:58.850774,0 days 00:00:01.474044,,1.0,2.0,,LightGBM,,,,,0.8,,,,0.0026421081867584882,2.1433167874328545e-07,,20.0,,,,,,,,,,72.0,,,,,,,,,COMPLETE,0.0,,,,,,,,,,,,,,,,,,,,
192,192,0.7393483709273183,2023-08-23 12:15:58.766623,2023-08-23 12:16:00.400004,0 days 00:00:01.633381,,1.0,2.0,,LightGBM,,,,,0.8,,,,0.002106233307687438,3.760067122981068e-08,,20.0,,,,,,,,,,49.0,,,,,,,,,COMPLETE,0.0,,,,,,,,,,,,,,,,,,,,
193,193,0.7393483709273183,2023-08-23 12:15:58.940396,2023-08-23 12:16:00.664668,0 days 00:00:01.724272,,1.0,2.0,,LightGBM,,,,,0.9,,,,2.0625009005134472e-07,4.250577404954669e-08,,20.0,,,,,,,,,,50.0,,,,,,,,,COMPLETE,0.0,,,,,,,,,,,,,,,,,,,,
194,194,0.7393483709273183,2023-08-23 12:15:59.530129,2023-08-23 12:16:00.984869,0 days 00:00:01.454740,,1.0,2.0,,LightGBM,,,,,0.9,,,,2.992010799235609e-07,4.015999263367089e-08,,20.0,,,,,,,,,,51.0,,,,,,,,,COMPLETE,0.0,,,,,,,,,,,,,,,,,,,,
195,195,0.7040525954273379,2023-08-23 12:16:00.477368,2023-08-23 12:16:02.029728,0 days 00:00:01.552360,,1.0,2.0,,LightGBM,,,,,0.9,,,,1.896269751330604e-07,1.5050517124197142e-07,,30.0,,,,,,,,,,58.0,,,,,,,,,COMPLETE,0.0,,,,,,,,,,,,,,,,,,,,
196,196,0.7010012887875483,2023-08-23 12:16:00.772492,2023-08-23 12:16:02.264530,0 days 00:00:01.492038,,1.0,2.0,,LightGBM,,,,,0.8,,,,4.946895313505383e-07,8.523272090592092e-08,,30.0,,,,,,,,,,57.0,,,,,,,,,COMPLETE,0.0,,,,,,,,,,,,,,,,,,,,
197,197,0.7628630911073659,2023-08-23 12:16:01.106450,2023-08-23 12:16:02.780181,0 days 00:00:01.673731,,1.0,2.0,,LightGBM,,,,,0.7000000000000001,,,,4.931578971800969e-07,1.424024903481835e-07,,30.0,,,,,,,,,,152.0,,,,,,,,,COMPLETE,0.0,,,,,,,,,,,,,,,,,,,,
198,198,0.7876932050160397,2023-08-23 12:16:02.153354,2023-08-23 12:16:03.864307,0 days 00:00:01.710953,,1.0,2.0,,LightGBM,,,,,0.8,,,,5.289718510660255e-07,1.2748223295971715e-07,,20.0,,,,,,,,,,43.0,,,,,,,,,COMPLETE,0.0,,,,,,,,,,,,,,,,,,,,
199,199,0.7876932050160397,2023-08-23 12:16:02.383595,2023-08-23 12:16:04.089742,0 days 00:00:01.706147,,1.0,2.0,,LightGBM,,,,,0.8,,,,2.8753426309877176e-07,1.3229784471881548e-07,,20.0,,,,,,,,,,65.0,,,,,,,,,COMPLETE,0.0,,,,,,,,,,,,,,,,,,,,
200,200,0.7876932050160397,2023-08-23 12:16:02.905423,2023-08-23 12:16:04.418151,0 days 00:00:01.512728,,1.0,2.0,,LightGBM,,,,,0.8,,,,2.92426761567393e-07,1.1690776067038699e-07,,20.0,,,,,,,,,,66.0,,,,,,,,,COMPLETE,0.0,,,,,,,,,,,,,,,,,,,,
201,201,0.7876932050160397,2023-08-23 12:16:03.955933,2023-08-23 12:16:05.780231,0 days 00:00:01.824298,,1.0,2.0,,LightGBM,,,,,0.8,,,,2.950122502833814e-07,6.432270002429953e-08,,20.0,,,,,,,,,,63.0,,,,,,,,,COMPLETE,0.0,,,,,,,,,,,,,,,,,,,,
202,202,0.7628630911073659,2023-08-23 12:16:04.170022,2023-08-23 12:16:05.626821,0 days 00:00:01.456799,,1.0,2.0,,LightGBM,,,,,0.8,,,,1.2411555769138663e-06,5.7015872111771534e-08,,20.0,,,,,,,,,,38.0,,,,,,,,,COMPLETE,0.0,,,,,,,,,,,,,,,,,,,,
203,203,0.7482855990318678,2023-08-23 12:16:04.543252,2023-08-23 12:16:05.999410,0 days 00:00:01.456158,,1.0,3.0,,LightGBM,,,,,0.8,,,,1.2277098599175e-06,6.089851610579475e-08,,20.0,,,,,,,,,,52.0,,,,,,,,,COMPLETE,0.0,,,,,,,,,,,,,,,,,,,,
204,204,0.7200828157349897,2023-08-23 12:16:05.737912,2023-08-23 12:16:08.254502,0 days 00:00:02.516590,,1.0,2.0,,LightGBM,,,,,0.8,,,,8.691423472754527e-07,7.691736848107588e-08,,10.0,,,,,,,,,,53.0,,,,,,,,,COMPLETE,0.0,,,,,,,,,,,,,,,,,,,,
205,205,0.7393483709273183,2023-08-23 12:16:05.863974,2023-08-23 12:16:08.730385,0 days 00:00:02.866411,,1.0,3.0,,LightGBM,,,,,0.8,,,,0.006486336916563947,3.8524976308576587e-07,,10.0,,,,,,,,,,55.0,,,,,,,,,COMPLETE,0.0,,,,,,,,,,,,,,,,,,,,
206,206,0.4365005946874587,2023-08-23 12:16:06.149095,2023-08-23 12:16:07.231487,0 days 00:00:01.082392,,,,,SVC,,,,,,,,,,,,,,,,,,,,,,,,,,,,,17440.397901754302,linear,COMPLETE,0.0,,,,,,,,,,,,,,,,,,,,
207,207,0.6853569987898347,2023-08-23 12:16:07.353001,2023-08-23 12:16:07.457953,0 days 00:00:00.104952,,,,,DecisionTreeClassifier,,log_loss,7.0,,,,,,,,,,,,,,,,,,,,,,,,,,,,COMPLETE,0.0,,,,,,,,,,,,,,,,,,,,
208,208,0.7876932050160397,2023-08-23 12:16:07.624728,2023-08-23 12:16:09.493877,0 days 00:00:01.869149,,1.0,2.0,,LightGBM,,,,,0.8,,,,8.617754598409388e-07,2.7623190810179103e-08,,20.0,,,,,,,,,,54.0,,,,,,,,,COMPLETE,0.0,,,,,,,,,,,,,,,,,,,,
209,209,0.7482855990318678,2023-08-23 12:16:08.424965,2023-08-23 12:16:10.021870,0 days 00:00:01.596905,,1.0,2.0,,LightGBM,,,,,0.8,,,,7.596263283255045e-07,3.08220773779912e-08,,20.0,,,,,,,,,,59.0,,,,,,,,,COMPLETE,0.0,,,,,,,,,,,,,,,,,,,,
210,210,0.7876932050160397,2023-08-23 12:16:08.852683,2023-08-23 12:16:10.471023,0 days 00:00:01.618340,,1.0,2.0,,LightGBM,,,,,0.8,,,,7.514787578042879e-07,3.505583246197805e-08,,20.0,,,,,,,,,,47.0,,,,,,,,,COMPLETE,0.0,,,,,,,,,,,,,,,,,,,,
211,211,0.7097288676236045,2023-08-23 12:16:09.584235,2023-08-23 12:16:11.574429,0 days 00:00:01.990194,,1.0,2.0,,LightGBM,,,,,0.8,,,,0.00017714475080540576,3.260275567264829e-08,,20.0,,,,,,,,,,45.0,,,,,,,,,COMPLETE,0.0,,,,,,,,,,,,,,,,,,,,
212,212,0.4934432371674784,2023-08-23 12:16:10.091435,2023-08-23 12:16:11.440833,0 days 00:00:01.349398,,,,,RandomForestClassifier,,,,,,,,,,,,,,,,,,,,,,,,79.0,2.0,,,,,,COMPLETE,0.0,,,,,,,,,,,,,,,,,,,,
213,213,0.5128205128205128,2023-08-23 12:16:10.620209,2023-08-23 12:16:11.008499,0 days 00:00:00.388290,,,,,RandomForestClassifier,,,,,,,,,,,,,,,,,,,,,,,,37.0,2.0,,,,,,COMPLETE,0.0,,,,,,,,,,,,,,,,,,,,
214,214,0.7876932050160397,2023-08-23 12:16:11.099511,2023-08-23 12:16:13.425417,0 days 00:00:02.325906,,1.0,2.0,,LightGBM,,,,,0.8,,,,2.481770239638571e-06,9.678849246759257e-08,,20.0,,,,,,,,,,44.0,,,,,,,,,COMPLETE,0.0,,,,,,,,,,,,,,,,,,,,
215,215,0.7244627612599353,2023-08-23 12:16:11.653806,2023-08-23 12:16:13.160069,0 days 00:00:01.506263,,0.6000000000000001,2.0,,LightGBM,,,,,0.8,,,,2.4467289937251164e-06,8.963960999001453e-08,,20.0,,,,,,,,,,71.0,,,,,,,,,COMPLETE,0.0,,,,,,,,,,,,,,,,,,,,
216,216,0.7876932050160397,2023-08-23 12:16:11.685484,2023-08-23 12:16:13.869329,0 days 00:00:02.183845,,1.0,2.0,,LightGBM,,,,,0.8,,,,2.512383366178546e-06,8.722583229802472e-08,,20.0,,,,,,,,,,77.0,,,,,,,,,COMPLETE,0.0,,,,,,,,,,,,,,,,,,,,
217,217,0.7876932050160397,2023-08-23 12:16:13.222601,2023-08-23 12:16:15.170091,0 days 00:00:01.947490,,1.0,2.0,,LightGBM,,,,,0.8,,,,4.5855584530646866e-07,1.825028610392393e-07,,20.0,,,,,,,,,,178.0,,,,,,,,,COMPLETE,0.0,,,,,,,,,,,,,,,,,,,,
218,218,0.7876932050160397,2023-08-23 12:16:13.529637,2023-08-23 12:16:15.311546,0 days 00:00:01.781909,,1.0,2.0,,LightGBM,,,,,0.8,,,,1.9720635625111331e-07,5.504827235175588e-08,,20.0,,,,,,,,,,121.0,,,,,,,,,COMPLETE,0.0,,,,,,,,,,,,,,,,,,,,
219,219,0.7876932050160397,2023-08-23 12:16:13.965092,2023-08-23 12:16:15.700813,0 days 00:00:01.735721,,1.0,2.0,,LightGBM,,,,,0.8,,,,1.6511024142703672e-07,5.7082883506945475e-08,,20.0,,,,,,,,,,60.0,,,,,,,,,COMPLETE,0.0,,,,,,,,,,,,,,,,,,,,
220,220,0.7482855990318678,2023-08-23 12:16:15.274453,2023-08-23 12:16:17.037622,0 days 00:00:01.763169,,1.0,2.0,,LightGBM,,,,,0.8,,,,1.7891544860001958e-07,5.2678868281965247e-08,,20.0,,,,,,,,,,60.0,,,,,,,,,COMPLETE,0.0,,,,,,,,,,,,,,,,,,,,
221,221,0.7876932050160397,2023-08-23 12:16:15.417867,2023-08-23 12:16:17.274432,0 days 00:00:01.856565,,1.0,2.0,,LightGBM,,,,,0.8,,,,1.5278558339805522e-07,1.3669635745246977e-08,,20.0,,,,,,,,,,60.0,,,,,,,,,COMPLETE,0.0,,,,,,,,,,,,,,,,,,,,
222,222,0.7538461538461538,2023-08-23 12:16:15.767191,2023-08-23 12:16:17.505579,0 days 00:00:01.738388,,1.0,2.0,,LightGBM,,,,,0.8,,,,0.8970110610099784,1.7335137440558942e-08,,20.0,,,,,,,,,,60.0,,,,,,,,,COMPLETE,0.0,,,,,,,,,,,,,,,,,,,,
223,223,0.7876932050160397,2023-08-23 12:16:17.141023,2023-08-23 12:16:19.282557,0 days 00:00:02.141534,,1.0,2.0,,LightGBM,,,,,0.8,,,,8.219351616517355e-08,1.937139056524061e-08,,20.0,,,,,,,,,,51.0,,,,,,,,,COMPLETE,0.0,,,,,,,,,,,,,,,,,,,,
224,224,0.7876932050160397,2023-08-23 12:16:17.337206,2023-08-23 12:16:19.035097,0 days 00:00:01.697891,,1.0,2.0,,LightGBM,,,,,0.8,,,,4.3418372660205234e-07,2.0628110612632514e-08,,20.0,,,,,,,,,,51.0,,,,,,,,,COMPLETE,0.0,,,,,,,,,,,,,,,,,,,,
225,225,0.7304625199362041,2023-08-23 12:16:17.605140,2023-08-23 12:16:19.580815,0 days 00:00:01.975675,,1.0,2.0,,LightGBM,,,,,0.8,,,,0.00044219357896677303,2.423018431391858e-07,,20.0,,,,,,,,,,52.0,,,,,,,,,COMPLETE,0.0,,,,,,,,,,,,,,,,,,,,
226,226,0.7876932050160397,2023-08-23 12:16:18.081370,2023-08-23 12:16:19.772170,0 days 00:00:01.690800,,1.0,2.0,,LightGBM,,,,,0.8,,,,8.896826006427316e-08,3.133000948907186e-07,,20.0,,,,,,,,,,52.0,,,,,,,,,COMPLETE,0.0,,,,,,,,,,,,,,,,,,,,
227,227,0.7128205128205128,2023-08-23 12:16:19.157183,2023-08-23 12:16:21.354021,0 days 00:00:02.196838,,1.0,2.0,,LightGBM,,,,,0.8,,,,0.0008288408864236191,2.696705666048163e-07,,20.0,,,,,,,,,,67.0,,,,,,,,,COMPLETE,0.0,,,,,,,,,,,,,,,,,,,,
228,228,0.7876932050160397,2023-08-23 12:16:19.416373,2023-08-23 12:16:21.115251,0 days 00:00:01.698878,,1.0,2.0,,LightGBM,,,,,0.8,,,,5.547043985939476e-07,7.442142962799598e-08,,20.0,,,,,,,,,,66.0,,,,,,,,,COMPLETE,0.0,,,,,,,,,,,,,,,,,,,,
229,229,0.7876932050160397,2023-08-23 12:16:19.674378,2023-08-23 12:16:21.677090,0 days 00:00:02.002712,,1.0,2.0,,LightGBM,,,,,0.8,,,,5.553280403790868e-07,7.40743133063216e-08,,20.0,,,,,,,,,,66.0,,,,,,,,,COMPLETE,0.0,,,,,,,,,,,,,,,,,,,,
230,230,0.7876932050160397,2023-08-23 12:16:19.910232,2023-08-23 12:16:22.117815,0 days 00:00:02.207583,,1.0,2.0,,LightGBM,,,,,0.8,,,,5.627170754490056e-07,8.169444283665836e-08,,20.0,,,,,,,,,,65.0,,,,,,,,,COMPLETE,0.0,,,,,,,,,,,,,,,,,,,,
231,231,0.7876932050160397,2023-08-23 12:16:21.305699,2023-08-23 12:16:23.816823,0 days 00:00:02.511124,,1.0,2.0,,LightGBM,,,,,0.8,,,,3.5487617274429716e-07,1.1799546183408264e-07,,20.0,,,,,,,,,,62.0,,,,,,,,,COMPLETE,0.0,,,,,,,,,,,,,,,,,,,,
232,232,0.7876932050160397,2023-08-23 12:16:21.495452,2023-08-23 12:16:23.399216,0 days 00:00:01.903764,,1.0,2.0,,LightGBM,,,,,0.8,,,,3.5517819288871357e-07,1.2059041184021214e-07,,20.0,,,,,,,,,,57.0,,,,,,,,,COMPLETE,0.0,,,,,,,,,,,,,,,,,,,,
233,233,0.7273093989511901,2023-08-23 12:16:21.776917,2023-08-23 12:16:22.598012,0 days 00:00:00.821095,,1.0,2.0,,LightGBM,,,,,0.8,,,,3.67863138781532e-07,1.1000093641915003e-07,,90.0,,,,,,,,,,61.0,,,,,,,,,COMPLETE,0.0,,,,,,,,,,,,,,,,,,,,
234,234,0.7876932050160397,2023-08-23 12:16:22.229180,2023-08-23 12:16:24.207289,0 days 00:00:01.978109,,1.0,2.0,,LightGBM,,,,,0.8,,,,3.8798425347301494e-07,1.3648938237498194e-07,,20.0,,,,,,,,,,57.0,,,,,,,,,COMPLETE,0.0,,,,,,,,,,,,,,,,,,,,
235,235,0.7876932050160397,2023-08-23 12:16:22.688945,2023-08-23 12:16:24.568550,0 days 00:00:01.879605,,1.0,2.0,,LightGBM,,,,,0.8,,,,1.0736414094780753e-06,4.849872803358287e-08,,20.0,,,,,,,,,,56.0,,,,,,,,,COMPLETE,0.0,,,,,,,,,,,,,,,,,,,,
236,236,0.7244627612599353,2023-08-23 12:16:23.468983,2023-08-23 12:16:25.298837,0 days 00:00:01.829854,,1.0,2.0,,LightGBM,,,,,0.8,,,,1.0564387744645086e-06,4.3666230470523695e-08,,20.0,,,,,,,,,,40.0,,,,,,,,,COMPLETE,0.0,,,,,,,,,,,,,,,,,,,,
237,237,0.7834836918806385,2023-08-23 12:16:23.888055,2023-08-23 12:16:25.715317,0 days 00:00:01.827262,,1.0,2.0,,LightGBM,,,,,0.8,,,,1.1315080995901903e-06,4.7468666741663954e-08,,10.0,,,,,,,,,,37.0,,,,,,,,,COMPLETE,0.0,,,,,,,,,,,,,,,,,,,,
238,238,0.7876932050160397,2023-08-23 12:16:24.281972,2023-08-23 12:16:25.989006,0 days 00:00:01.707034,,1.0,2.0,,LightGBM,,,,,0.8,,,,6.594255787893492e-07,5.7486191906517776e-08,,20.0,,,,,,,,,,47.0,,,,,,,,,COMPLETE,0.0,,,,,,,,,,,,,,,,,,,,
239,239,0.7876932050160397,2023-08-23 12:16:24.672999,2023-08-23 12:16:26.723826,0 days 00:00:02.050827,,1.0,2.0,,LightGBM,,,,,0.8,,,,6.685081185648551e-07,5.4606373844143376e-08,,20.0,,,,,,,,,,47.0,,,,,,,,,COMPLETE,0.0,,,,,,,,,,,,,,,,,,,,
240,240,0.6976441102756892,2023-08-23 12:16:25.389116,2023-08-23 12:16:27.472463,0 days 00:00:02.083347,,1.0,2.0,,LightGBM,,,,,0.8,,,,8.382884272234686e-05,5.923299009898855e-08,,20.0,,,,,,,,,,47.0,,,,,,,,,COMPLETE,0.0,,,,,,,,,,,,,,,,,,,,
241,241,0.7876932050160397,2023-08-23 12:16:25.864326,2023-08-23 12:16:27.790646,0 days 00:00:01.926320,,1.0,2.0,,LightGBM,,,,,0.8,,,,2.467495587015645e-07,6.964307267156557e-08,,20.0,,,,,,,,,,46.0,,,,,,,,,COMPLETE,0.0,,,,,,,,,,,,,,,,,,,,
242,242,0.7876932050160397,2023-08-23 12:16:26.104735,2023-08-23 12:16:28.103300,0 days 00:00:01.998565,,1.0,2.0,,LightGBM,,,,,0.8,,,,2.3664284261210105e-07,6.729576196360357e-08,,20.0,,,,,,,,,,73.0,,,,,,,,,COMPLETE,0.0,,,,,,,,,,,,,,,,,,,,
243,243,0.7876932050160397,2023-08-23 12:16:26.599039,2023-08-23 12:16:28.384593,0 days 00:00:01.785554,,1.0,2.0,,LightGBM,,,,,0.8,,,,2.311122405719125e-07,7.02716453536797e-08,,20.0,,,,,,,,,,71.0,,,,,,,,,COMPLETE,0.0,,,,,,,,,,,,,,,,,,,,
244,244,0.7876932050160397,2023-08-23 12:16:26.849109,2023-08-23 12:16:28.914990,0 days 00:00:02.065881,,1.0,2.0,,LightGBM,,,,,0.8,,,,2.4206001772650333e-07,5.114363702492435e-07,,20.0,,,,,,,,,,73.0,,,,,,,,,COMPLETE,0.0,,,,,,,,,,,,,,,,,,,,
245,245,0.7304625199362041,2023-08-23 12:16:27.571012,2023-08-23 12:16:29.670808,0 days 00:00:02.099796,,1.0,2.0,,LightGBM,,,,,0.8,,,,2.7590712701803396e-07,0.000517431329458429,,20.0,,,,,,,,,,73.0,,,,,,,,,COMPLETE,0.0,,,,,,,,,,,,,,,,,,,,
246,246,0.7304625199362041,2023-08-23 12:16:27.875402,2023-08-23 12:16:29.563991,0 days 00:00:01.688589,,1.0,2.0,,LightGBM,,,,,0.8,,,,0.023547394505463504,5.326022210120092e-07,,30.0,,,,,,,,,,55.0,,,,,,,,,COMPLETE,0.0,,,,,,,,,,,,,,,,,,,,
247,247,0.7628630911073659,2023-08-23 12:16:28.182551,2023-08-23 12:16:29.768430,0 days 00:00:01.585879,,1.0,2.0,,LightGBM,,,,,0.7000000000000001,,,,1.5730190218023108e-06,1.8123099534778334e-07,,30.0,,,,,,,,,,60.0,,,,,,,,,COMPLETE,0.0,,,,,,,,,,,,,,,,,,,,
248,248,0.7876932050160397,2023-08-23 12:16:28.487750,2023-08-23 12:16:30.346119,0 days 00:00:01.858369,,1.0,2.0,,LightGBM,,,,,0.8,,,,5.535081819716661e-07,2.8653778161130547e-08,,20.0,,,,,,,,,,43.0,,,,,,,,,COMPLETE,0.0,,,,,,,,,,,,,,,,,,,,
249,249,0.7876932050160397,2023-08-23 12:16:29.054863,2023-08-23 12:16:30.758272,0 days 00:00:01.703409,,1.0,2.0,,LightGBM,,,,,0.8,,,,5.002588424873904e-07,2.7061074309630892e-08,,20.0,,,,,,,,,,54.0,,,,,,,,,COMPLETE,0.0,,,,,,,,,,,,,,,,,,,,
