,number,value,datetime_start,datetime_complete,duration,params_alpha,params_bagging_fraction,params_bagging_freq,params_booster,params_classifier,params_colsample_bytree,params_dct_criterion,params_dct_max_depth,params_eta,params_feature_fraction,params_gamma,params_grow_policy,params_lambda,params_lambda_l1,params_lambda_l2,params_max_depth,params_min_child_samples,params_min_child_weight,params_mlp_activation,params_mlp_solver,params_n_layers,params_n_units_l_0,params_n_units_l_1,params_n_units_l_2,params_n_units_l_3,params_normalize_type,params_num_leaves,params_rate_drop,params_rf_estimator,params_rf_max_depth,params_sample_type,params_skip_drop,params_subsample,params_svc_c,params_svc_kernel,state,best_trial,dev_acc,dev_recall_macro,dev_precision_macro,dev_f1_macro,dev_recall_0,dev_precision_0,dev_f1_0,dev_recall_1,dev_precision_1,dev_f1_1,test_acc,test_recall_macro,test_precision_macro,test_f1_macro,test_recall_0,test_precision_0,test_f1_0,test_recall_1,test_precision_1,test_f1_1
0,0,0.664380798709157,2023-08-23 17:29:02.575062,2023-08-23 17:29:03.377610,0 days 00:00:00.802548,,0.7000000000000001,2.0,,LightGBM,,,,,0.9,,,,4.4715762101013066e-07,0.0006561050386339436,,80.0,,,,,,,,,,76.0,,,,,,,,,COMPLETE,0.0,,,,,,,,,,,,,,,,,,,,
1,1,0.6367100666878375,2023-08-23 17:29:02.577672,2023-08-23 17:29:03.222434,0 days 00:00:00.644762,,,,,RandomForestClassifier,,,,,,,,,,,,,,,,,,,,,,,,21.0,4.0,,,,,,COMPLETE,0.0,,,,,,,,,,,,,,,,,,,,
2,2,0.3696969696969697,2023-08-23 17:29:02.579903,2023-08-23 17:29:02.724283,0 days 00:00:00.144380,,,,,SVC,,,,,,,,,,,,,,,,,,,,,,,,,,,,,0.004630497281116436,rbf,COMPLETE,0.0,,,,,,,,,,,,,,,,,,,,
3,3,0.3696969696969697,2023-08-23 17:29:02.590500,2023-08-23 17:29:02.794858,0 days 00:00:00.204358,,,,,SVC,,,,,,,,,,,,,,,,,,,,,,,,,,,,,367.8953322685555,poly,COMPLETE,0.0,,,,,,,,,,,,,,,,,,,,
4,4,0.7216218895608209,2023-08-23 17:29:02.596165,2023-08-23 17:29:03.294338,0 days 00:00:00.698173,,,,,RandomForestClassifier,,,,,,,,,,,,,,,,,,,,,,,,17.0,8.0,,,,,,COMPLETE,0.0,,,,,,,,,,,,,,,,,,,,
5,5,0.6376306620209059,2023-08-23 17:29:02.598673,2023-08-23 17:29:02.674910,0 days 00:00:00.076237,,,,,DecisionTreeClassifier,,gini,14.0,,,,,,,,,,,,,,,,,,,,,,,,,,,,COMPLETE,0.0,,,,,,,,,,,,,,,,,,,,
6,6,0.3946784922394678,2023-08-23 17:29:02.620208,2023-08-23 17:29:02.841611,0 days 00:00:00.221403,,,,,SVC,,,,,,,,,,,,,,,,,,,,,,,,,,,,,34.56077460138659,rbf,COMPLETE,0.0,,,,,,,,,,,,,,,,,,,,
7,7,0.5529220401998374,2023-08-23 17:29:02.623373,2023-08-23 17:29:03.109070,0 days 00:00:00.485697,,,,,RandomForestClassifier,,,,,,,,,,,,,,,,,,,,,,,,17.0,2.0,,,,,,COMPLETE,0.0,,,,,,,,,,,,,,,,,,,,
8,8,0.6504201680672269,2023-08-23 17:29:02.777796,2023-08-23 17:29:03.056658,0 days 00:00:00.278862,,,,,RandomForestClassifier,,,,,,,,,,,,,,,,,,,,,,,,15.0,3.0,,,,,,COMPLETE,0.0,,,,,,,,,,,,,,,,,,,,
9,9,0.6848484848484848,2023-08-23 17:29:02.787198,2023-08-23 17:29:02.932066,0 days 00:00:00.144868,,,,,DecisionTreeClassifier,,log_loss,4.0,,,,,,,,,,,,,,,,,,,,,,,,,,,,COMPLETE,0.0,,,,,,,,,,,,,,,,,,,,
10,10,0.6953125,2023-08-23 17:29:02.891473,2023-08-23 17:29:03.752604,0 days 00:00:00.861131,3.881759984661771e-06,,,gbtree,XGBoost,0.32996616724309524,,,4.2398901316002806e-08,,1.4587292756257995e-08,lossguide,4.981724653507756e-06,,,3.0,,7.0,,,,,,,,,,,,,,,0.7849410245939812,,,COMPLETE,0.0,,,,,,,,,,,,,,,,,,,,
11,11,0.6224283985478015,2023-08-23 17:29:02.901357,2023-08-23 17:29:03.835677,0 days 00:00:00.934320,,0.6000000000000001,2.0,,LightGBM,,,,,0.9,,,,0.0014701234484239118,2.1160740807539897e-06,,60.0,,,,,,,,,,68.0,,,,,,,,,COMPLETE,0.0,,,,,,,,,,,,,,,,,,,,
12,12,0.3696969696969697,2023-08-23 17:29:02.977202,2023-08-23 17:29:04.726852,0 days 00:00:01.749650,,,,,MLPClassifier,,,,,,,,,,,,,,identity,adam,1.0,20.0,,,,,,,,,,,,,,COMPLETE,0.0,,,,,,,,,,,,,,,,,,,,
13,13,0.42075949367088605,2023-08-23 17:29:03.099275,2023-08-23 17:29:26.341790,0 days 00:00:23.242515,,,,,MLPClassifier,,,,,,,,,,,,,,identity,lbfgs,2.0,60.0,30.0,,,,,,,,,,,,,COMPLETE,0.0,,,,,,,,,,,,,,,,,,,,
14,14,0.6475279106858054,2023-08-23 17:29:03.154608,2023-08-23 17:29:03.378549,0 days 00:00:00.223941,,,,,DecisionTreeClassifier,,log_loss,8.0,,,,,,,,,,,,,,,,,,,,,,,,,,,,COMPLETE,0.0,,,,,,,,,,,,,,,,,,,,
15,15,0.6670433145009416,2023-08-23 17:29:03.359144,2023-08-23 17:29:03.526929,0 days 00:00:00.167785,,,,,DecisionTreeClassifier,,entropy,2.0,,,,,,,,,,,,,,,,,,,,,,,,,,,,COMPLETE,0.0,,,,,,,,,,,,,,,,,,,,
16,16,0.3696969696969697,2023-08-23 17:29:03.369444,2023-08-23 17:29:03.594946,0 days 00:00:00.225502,,,,,SVC,,,,,,,,,,,,,,,,,,,,,,,,,,,,,446.7204987483781,poly,COMPLETE,0.0,,,,,,,,,,,,,,,,,,,,
17,17,0.6306443429731101,2023-08-23 17:29:03.473878,2023-08-23 17:29:04.036190,0 days 00:00:00.562312,7.25330474037025e-06,,,dart,XGBoost,0.5594522458286745,,,0.006493645570436527,,1.368474341005998e-07,depthwise,0.24412371460825597,,,5.0,,10.0,,,,,,,,tree,,2.8620687948287103e-05,,,uniform,1.5319897697874444e-05,0.27814783747465355,,,COMPLETE,0.0,,,,,,,,,,,,,,,,,,,,
18,18,0.3696969696969697,2023-08-23 17:29:03.656234,2023-08-23 17:29:21.257452,0 days 00:00:17.601218,,,,,MLPClassifier,,,,,,,,,,,,,,tanh,sgd,3.0,40.0,90.0,50.0,,,,,,,,,,,,COMPLETE,0.0,,,,,,,,,,,,,,,,,,,,
19,19,0.5497835497835498,2023-08-23 17:29:03.666281,2023-08-23 17:29:10.965322,0 days 00:00:07.299041,,,,,MLPClassifier,,,,,,,,,,,,,,relu,adam,2.0,70.0,10.0,,,,,,,,,,,,,COMPLETE,0.0,,,,,,,,,,,,,,,,,,,,
20,20,0.5601503759398496,2023-08-23 17:29:03.668305,2023-08-23 17:30:39.965816,0 days 00:01:36.297511,,,,,MLPClassifier,,,,,,,,,,,,,,relu,adam,2.0,50.0,30.0,,,,,,,,,,,,,COMPLETE,0.0,,,,,,,,,,,,,,,,,,,,
21,21,0.6955905957888773,2023-08-23 17:29:03.821013,2023-08-23 17:29:04.284063,0 days 00:00:00.463050,1.8163480528014034e-06,,,gbtree,XGBoost,0.2999212645667118,,,3.051463483627681e-08,,1.7797389340826155e-08,lossguide,3.097789282945143e-06,,,3.0,,7.0,,,,,,,,,,,,,,,0.8111066385244287,,,COMPLETE,0.0,,,,,,,,,,,,,,,,,,,,
22,22,0.5328125,2023-08-23 17:29:03.892801,2023-08-23 17:29:04.386634,0 days 00:00:00.493833,2.6854774895083065e-06,,,gbtree,XGBoost,0.30252767580464857,,,1.146161502926285e-08,,1.010047388862307e-08,lossguide,3.2654672766385885e-06,,,3.0,,7.0,,,,,,,,,,,,,,,0.8326395476055315,,,COMPLETE,0.0,,,,,,,,,,,,,,,,,,,,
23,23,0.3696969696969697,2023-08-23 17:29:04.119850,2023-08-23 17:29:12.341502,0 days 00:00:08.221652,,,,,MLPClassifier,,,,,,,,,,,,,,logistic,adam,3.0,20.0,40.0,80.0,,,,,,,,,,,,COMPLETE,0.0,,,,,,,,,,,,,,,,,,,,
24,24,0.5622796041405984,2023-08-23 17:29:04.360199,2023-08-23 17:30:43.555961,0 days 00:01:39.195762,,,,,MLPClassifier,,,,,,,,,,,,,,relu,lbfgs,4.0,30.0,70.0,90.0,90.0,,,,,,,,,,,COMPLETE,0.0,,,,,,,,,,,,,,,,,,,,
25,25,0.44708860759493674,2023-08-23 17:29:04.451298,2023-08-23 17:29:13.248595,0 days 00:00:08.797297,,,,,MLPClassifier,,,,,,,,,,,,,,identity,lbfgs,1.0,30.0,,,,,,,,,,,,,,COMPLETE,0.0,,,,,,,,,,,,,,,,,,,,
26,26,0.3696969696969697,2023-08-23 17:29:04.817056,2023-08-23 17:29:07.509613,0 days 00:00:02.692557,,,,,MLPClassifier,,,,,,,,,,,,,,logistic,lbfgs,4.0,90.0,90.0,60.0,70.0,,,,,,,,,,,COMPLETE,0.0,,,,,,,,,,,,,,,,,,,,
27,27,0.7304625199362041,2023-08-23 17:29:07.624639,2023-08-23 17:29:09.652048,0 days 00:00:02.027409,,,,,RandomForestClassifier,,,,,,,,,,,,,,,,,,,,,,,,90.0,17.0,,,,,,COMPLETE,0.0,,,,,,,,,,,,,,,,,,,,
28,28,0.6682615629984051,2023-08-23 17:29:09.748549,2023-08-23 17:29:11.516069,0 days 00:00:01.767520,,,,,RandomForestClassifier,,,,,,,,,,,,,,,,,,,,,,,,93.0,16.0,,,,,,COMPLETE,0.0,,,,,,,,,,,,,,,,,,,,
29,29,0.7273093989511901,2023-08-23 17:29:11.032583,2023-08-23 17:29:12.906756,0 days 00:00:01.874173,,,,,RandomForestClassifier,,,,,,,,,,,,,,,,,,,,,,,,100.0,17.0,,,,,,COMPLETE,0.0,,,,,,,,,,,,,,,,,,,,
30,30,0.7150684931506849,2023-08-23 17:29:11.621485,2023-08-23 17:29:13.475464,0 days 00:00:01.853979,,,,,RandomForestClassifier,,,,,,,,,,,,,,,,,,,,,,,,81.0,13.0,,,,,,COMPLETE,0.0,,,,,,,,,,,,,,,,,,,,
31,31,0.7244627612599353,2023-08-23 17:29:12.437342,2023-08-23 17:29:14.752358,0 days 00:00:02.315016,,,,,RandomForestClassifier,,,,,,,,,,,,,,,,,,,,,,,,80.0,13.0,,,,,,COMPLETE,0.0,,,,,,,,,,,,,,,,,,,,
32,32,0.7359375,2023-08-23 17:29:13.009664,2023-08-23 17:29:15.265029,0 days 00:00:02.255365,,,,,RandomForestClassifier,,,,,,,,,,,,,,,,,,,,,,,,98.0,15.0,,,,,,COMPLETE,0.0,,,,,,,,,,,,,,,,,,,,
33,33,0.6939624556062911,2023-08-23 17:29:13.309530,2023-08-23 17:29:15.750846,0 days 00:00:02.441316,,,,,RandomForestClassifier,,,,,,,,,,,,,,,,,,,,,,,,99.0,16.0,,,,,,COMPLETE,0.0,,,,,,,,,,,,,,,,,,,,
34,34,0.7184962406015037,2023-08-23 17:29:13.552780,2023-08-23 17:29:15.972904,0 days 00:00:02.420124,,,,,RandomForestClassifier,,,,,,,,,,,,,,,,,,,,,,,,100.0,24.0,,,,,,COMPLETE,0.0,,,,,,,,,,,,,,,,,,,,
35,35,0.6976441102756892,2023-08-23 17:29:14.880632,2023-08-23 17:29:17.071114,0 days 00:00:02.190482,,,,,RandomForestClassifier,,,,,,,,,,,,,,,,,,,,,,,,98.0,30.0,,,,,,COMPLETE,0.0,,,,,,,,,,,,,,,,,,,,
36,36,0.6471676775984373,2023-08-23 17:29:15.375243,2023-08-23 17:29:17.252567,0 days 00:00:01.877324,,1.0,1.0,,LightGBM,,,,,0.4,,,,0.933332752277315,0.6588546359165748,,10.0,,,,,,,,,,252.0,,,,,,,,,COMPLETE,0.0,,,,,,,,,,,,,,,,,,,,
37,37,0.6204775310186633,2023-08-23 17:29:15.854613,2023-08-23 17:29:17.537448,0 days 00:00:01.682835,,0.9,3.0,,LightGBM,,,,,0.4,,,,0.37310598993117117,0.7261244972081269,,10.0,,,,,,,,,,230.0,,,,,,,,,COMPLETE,0.0,,,,,,,,,,,,,,,,,,,,
38,38,0.7184962406015037,2023-08-23 17:29:16.057150,2023-08-23 17:29:17.742741,0 days 00:00:01.685591,,,,,RandomForestClassifier,,,,,,,,,,,,,,,,,,,,,,,,75.0,31.0,,,,,,COMPLETE,0.0,,,,,,,,,,,,,,,,,,,,
39,39,0.6421645292461683,2023-08-23 17:29:17.169117,2023-08-23 17:29:19.356167,0 days 00:00:02.187050,,1.0,3.0,,LightGBM,,,,,0.4,,,,0.6060485222841141,0.6064207410187593,,10.0,,,,,,,,,,254.0,,,,,,,,,COMPLETE,0.0,,,,,,,,,,,,,,,,,,,,
40,40,0.7097288676236045,2023-08-23 17:29:17.328092,2023-08-23 17:29:18.948695,0 days 00:00:01.620603,,,,,RandomForestClassifier,,,,,,,,,,,,,,,,,,,,,,,,76.0,12.0,,,,,,COMPLETE,0.0,,,,,,,,,,,,,,,,,,,,
41,41,0.6853569987898347,2023-08-23 17:29:17.619130,2023-08-23 17:29:19.090663,0 days 00:00:01.471533,,,,,RandomForestClassifier,,,,,,,,,,,,,,,,,,,,,,,,74.0,12.0,,,,,,COMPLETE,0.0,,,,,,,,,,,,,,,,,,,,
42,42,0.7063331988705123,2023-08-23 17:29:17.831883,2023-08-23 17:29:18.857778,0 days 00:00:01.025895,,,,,RandomForestClassifier,,,,,,,,,,,,,,,,,,,,,,,,80.0,11.0,,,,,,COMPLETE,0.0,,,,,,,,,,,,,,,,,,,,
43,43,0.7184962406015037,2023-08-23 17:29:18.937543,2023-08-23 17:29:20.832645,0 days 00:00:01.895102,,,,,RandomForestClassifier,,,,,,,,,,,,,,,,,,,,,,,,67.0,18.0,,,,,,COMPLETE,0.0,,,,,,,,,,,,,,,,,,,,
44,44,0.6813725490196079,2023-08-23 17:29:19.152827,2023-08-23 17:29:21.344789,0 days 00:00:02.191962,,,,,RandomForestClassifier,,,,,,,,,,,,,,,,,,,,,,,,88.0,19.0,,,,,,COMPLETE,0.0,,,,,,,,,,,,,,,,,,,,
45,45,0.6889952153110048,2023-08-23 17:29:19.174705,2023-08-23 17:29:21.554101,0 days 00:00:02.379396,,,,,RandomForestClassifier,,,,,,,,,,,,,,,,,,,,,,,,88.0,21.0,,,,,,COMPLETE,0.0,,,,,,,,,,,,,,,,,,,,
46,46,0.7097288676236045,2023-08-23 17:29:19.451036,2023-08-23 17:29:20.662036,0 days 00:00:01.211000,,,,,RandomForestClassifier,,,,,,,,,,,,,,,,,,,,,,,,59.0,22.0,,,,,,COMPLETE,0.0,,,,,,,,,,,,,,,,,,,,
47,47,0.7393483709273183,2023-08-23 17:29:20.795594,2023-08-23 17:29:23.514933,0 days 00:00:02.719339,,,,,RandomForestClassifier,,,,,,,,,,,,,,,,,,,,,,,,87.0,20.0,,,,,,COMPLETE,0.0,,,,,,,,,,,,,,,,,,,,
48,48,0.6601307189542484,2023-08-23 17:29:20.936842,2023-08-23 17:29:22.224464,0 days 00:00:01.287622,,,,,RandomForestClassifier,,,,,,,,,,,,,,,,,,,,,,,,42.0,8.0,,,,,,COMPLETE,0.0,,,,,,,,,,,,,,,,,,,,
49,49,0.7422424903340934,2023-08-23 17:29:21.326743,2023-08-23 17:29:22.563803,0 days 00:00:01.237060,,,,,RandomForestClassifier,,,,,,,,,,,,,,,,,,,,,,,,41.0,9.0,,,,,,COMPLETE,0.0,,,,,,,,,,,,,,,,,,,,
50,50,0.7270341207349081,2023-08-23 17:29:21.435029,2023-08-23 17:29:22.933541,0 days 00:00:01.498512,,,,,RandomForestClassifier,,,,,,,,,,,,,,,,,,,,,,,,42.0,9.0,,,,,,COMPLETE,0.0,,,,,,,,,,,,,,,,,,,,
51,51,0.3696969696969697,2023-08-23 17:29:21.637448,2023-08-23 17:29:21.806218,0 days 00:00:00.168770,,,,,SVC,,,,,,,,,,,,,,,,,,,,,,,,,,,,,0.16421136602212796,linear,COMPLETE,0.0,,,,,,,,,,,,,,,,,,,,
52,52,0.7128205128205128,2023-08-23 17:29:21.882690,2023-08-23 17:29:22.851210,0 days 00:00:00.968520,,,,,RandomForestClassifier,,,,,,,,,,,,,,,,,,,,,,,,40.0,8.0,,,,,,COMPLETE,0.0,,,,,,,,,,,,,,,,,,,,
53,53,0.6939624556062911,2023-08-23 17:29:22.342629,2023-08-23 17:29:23.655729,0 days 00:00:01.313100,,,,,RandomForestClassifier,,,,,,,,,,,,,,,,,,,,,,,,39.0,9.0,,,,,,COMPLETE,0.0,,,,,,,,,,,,,,,,,,,,
54,54,0.7572805682394723,2023-08-23 17:29:22.662279,2023-08-23 17:29:24.157158,0 days 00:00:01.494879,,,,,RandomForestClassifier,,,,,,,,,,,,,,,,,,,,,,,,42.0,10.0,,,,,,COMPLETE,0.0,,,,,,,,,,,,,,,,,,,,
55,55,0.7448729270925325,2023-08-23 17:29:22.932727,2023-08-23 17:29:24.038122,0 days 00:00:01.105395,,,,,RandomForestClassifier,,,,,,,,,,,,,,,,,,,,,,,,35.0,14.0,,,,,,COMPLETE,0.0,,,,,,,,,,,,,,,,,,,,
56,56,0.6518412242945959,2023-08-23 17:29:23.018193,2023-08-23 17:29:23.192033,0 days 00:00:00.173840,,,,,DecisionTreeClassifier,,gini,32.0,,,,,,,,,,,,,,,,,,,,,,,,,,,,COMPLETE,0.0,,,,,,,,,,,,,,,,,,,,
57,57,0.3696969696969697,2023-08-23 17:29:23.281574,2023-08-23 17:29:23.584286,0 days 00:00:00.302712,,,,,SVC,,,,,,,,,,,,,,,,,,,,,,,,,,,,,0.001620136873497393,linear,COMPLETE,0.0,,,,,,,,,,,,,,,,,,,,
58,58,0.6853569987898347,2023-08-23 17:29:23.583669,2023-08-23 17:29:25.091747,0 days 00:00:01.508078,,,,,RandomForestClassifier,,,,,,,,,,,,,,,,,,,,,,,,42.0,16.0,,,,,,COMPLETE,0.0,,,,,,,,,,,,,,,,,,,,
59,59,0.6601307189542484,2023-08-23 17:29:23.650656,2023-08-23 17:29:24.892045,0 days 00:00:01.241389,,,,,RandomForestClassifier,,,,,,,,,,,,,,,,,,,,,,,,43.0,10.0,,,,,,COMPLETE,0.0,,,,,,,,,,,,,,,,,,,,
60,60,0.7238562091503268,2023-08-23 17:29:23.760522,2023-08-23 17:29:25.314277,0 days 00:00:01.553755,,,,,RandomForestClassifier,,,,,,,,,,,,,,,,,,,,,,,,52.0,6.0,,,,,,COMPLETE,0.0,,,,,,,,,,,,,,,,,,,,
61,61,0.7216218895608209,2023-08-23 17:29:24.132820,2023-08-23 17:29:25.200547,0 days 00:00:01.067727,,,,,RandomForestClassifier,,,,,,,,,,,,,,,,,,,,,,,,30.0,16.0,,,,,,COMPLETE,0.0,,,,,,,,,,,,,,,,,,,,
62,62,0.7511961722488039,2023-08-23 17:29:24.251077,2023-08-23 17:29:25.010887,0 days 00:00:00.759810,,,,,RandomForestClassifier,,,,,,,,,,,,,,,,,,,,,,,,30.0,15.0,,,,,,COMPLETE,0.0,,,,,,,,,,,,,,,,,,,,
63,63,0.7159663865546219,2023-08-23 17:29:24.965403,2023-08-23 17:29:26.453417,0 days 00:00:01.488014,,,,,RandomForestClassifier,,,,,,,,,,,,,,,,,,,,,,,,31.0,14.0,,,,,,COMPLETE,0.0,,,,,,,,,,,,,,,,,,,,
64,64,0.3696969696969697,2023-08-23 17:29:25.073733,2023-08-23 17:29:25.523619,0 days 00:00:00.449886,0.7102955053757355,,,gblinear,XGBoost,0.9931781151206833,,,,,,,5.3996002403809686e-08,,,,,,,,,,,,,,,,,,,,0.4902716332708495,,,COMPLETE,0.0,,,,,,,,,,,,,,,,,,,,
65,65,0.3696969696969697,2023-08-23 17:29:25.265173,2023-08-23 17:29:25.751890,0 days 00:00:00.486717,0.38139604443747893,,,gblinear,XGBoost,0.9828620266156308,,,,,,,1.0522393809669789e-08,,,,,,,,,,,,,,,,,,,,0.4357305938586561,,,COMPLETE,0.0,,,,,,,,,,,,,,,,,,,,
66,66,0.6670433145009416,2023-08-23 17:29:25.266404,2023-08-23 17:29:25.406084,0 days 00:00:00.139680,,,,,DecisionTreeClassifier,,entropy,2.0,,,,,,,,,,,,,,,,,,,,,,,,,,,,COMPLETE,0.0,,,,,,,,,,,,,,,,,,,,
67,67,0.3696969696969697,2023-08-23 17:29:25.483434,2023-08-23 17:29:25.880180,0 days 00:00:00.396746,0.8191146542122237,,,gblinear,XGBoost,0.9838408672587686,,,,,,,2.0079954409361068e-08,,,,,,,,,,,,,,,,,,,,0.4252591488290506,,,COMPLETE,0.0,,,,,,,,,,,,,,,,,,,,
68,68,0.3696969696969697,2023-08-23 17:29:25.512937,2023-08-23 17:29:25.984084,0 days 00:00:00.471147,0.14565905287073114,,,gblinear,XGBoost,0.9977593075849511,,,,,,,1.9832424884616585e-08,,,,,,,,,,,,,,,,,,,,0.333087552973358,,,COMPLETE,0.0,,,,,,,,,,,,,,,,,,,,
69,69,0.7333333333333334,2023-08-23 17:29:25.622340,2023-08-23 17:29:26.852606,0 days 00:00:01.230266,,,,,RandomForestClassifier,,,,,,,,,,,,,,,,,,,,,,,,29.0,14.0,,,,,,COMPLETE,0.0,,,,,,,,,,,,,,,,,,,,
70,70,0.6980255516840882,2023-08-23 17:29:25.840575,2023-08-23 17:29:27.135620,0 days 00:00:01.295045,,,,,RandomForestClassifier,,,,,,,,,,,,,,,,,,,,,,,,29.0,14.0,,,,,,COMPLETE,0.0,,,,,,,,,,,,,,,,,,,,
71,71,0.6728564180618974,2023-08-23 17:29:26.049133,2023-08-23 17:29:27.061018,0 days 00:00:01.011885,,,,,RandomForestClassifier,,,,,,,,,,,,,,,,,,,,,,,,30.0,14.0,,,,,,COMPLETE,0.0,,,,,,,,,,,,,,,,,,,,
72,72,0.7743589743589745,2023-08-23 17:29:26.059676,2023-08-23 17:29:27.198543,0 days 00:00:01.138867,,,,,RandomForestClassifier,,,,,,,,,,,,,,,,,,,,,,,,30.0,14.0,,,,,,COMPLETE,0.0,,,,,,,,,,,,,,,,,,,,
73,73,0.6638515274736733,2023-08-23 17:29:26.409596,2023-08-23 17:29:27.681617,0 days 00:00:01.272021,,,,,RandomForestClassifier,,,,,,,,,,,,,,,,,,,,,,,,29.0,14.0,,,,,,COMPLETE,0.0,,,,,,,,,,,,,,,,,,,,
74,74,0.7327027860594222,2023-08-23 17:29:26.525924,2023-08-23 17:29:27.948068,0 days 00:00:01.422144,,,,,RandomForestClassifier,,,,,,,,,,,,,,,,,,,,,,,,28.0,13.0,,,,,,COMPLETE,0.0,,,,,,,,,,,,,,,,,,,,
75,75,0.711319008944176,2023-08-23 17:29:26.918126,2023-08-23 17:29:28.183950,0 days 00:00:01.265824,,,,,RandomForestClassifier,,,,,,,,,,,,,,,,,,,,,,,,27.0,11.0,,,,,,COMPLETE,0.0,,,,,,,,,,,,,,,,,,,,
76,76,0.3696969696969697,2023-08-23 17:29:27.122547,2023-08-23 17:29:27.484185,0 days 00:00:00.361638,,,,,SVC,,,,,,,,,,,,,,,,,,,,,,,,,,,,,1.454098784194223,rbf,COMPLETE,0.0,,,,,,,,,,,,,,,,,,,,
77,77,0.3696969696969697,2023-08-23 17:29:27.192705,2023-08-23 17:29:27.374756,0 days 00:00:00.182051,,,,,SVC,,,,,,,,,,,,,,,,,,,,,,,,,,,,,1.655683724915076,poly,COMPLETE,0.0,,,,,,,,,,,,,,,,,,,,
78,78,0.6976441102756892,2023-08-23 17:29:27.280486,2023-08-23 17:29:28.427241,0 days 00:00:01.146755,,,,,RandomForestClassifier,,,,,,,,,,,,,,,,,,,,,,,,24.0,11.0,,,,,,COMPLETE,0.0,,,,,,,,,,,,,,,,,,,,
79,79,0.7150684931506849,2023-08-23 17:29:27.473451,2023-08-23 17:29:28.498262,0 days 00:00:01.024811,,,,,RandomForestClassifier,,,,,,,,,,,,,,,,,,,,,,,,22.0,11.0,,,,,,COMPLETE,0.0,,,,,,,,,,,,,,,,,,,,
80,80,0.6836424295947405,2023-08-23 17:29:27.571645,2023-08-23 17:29:29.466409,0 days 00:00:01.894764,,,,,RandomForestClassifier,,,,,,,,,,,,,,,,,,,,,,,,36.0,11.0,,,,,,COMPLETE,0.0,,,,,,,,,,,,,,,,,,,,
81,81,0.7393483709273183,2023-08-23 17:29:27.758765,2023-08-23 17:29:28.788602,0 days 00:00:01.029837,,,,,RandomForestClassifier,,,,,,,,,,,,,,,,,,,,,,,,23.0,11.0,,,,,,COMPLETE,0.0,,,,,,,,,,,,,,,,,,,,
82,82,0.7063331988705123,2023-08-23 17:29:28.044021,2023-08-23 17:29:28.974517,0 days 00:00:00.930496,,,,,RandomForestClassifier,,,,,,,,,,,,,,,,,,,,,,,,22.0,11.0,,,,,,COMPLETE,0.0,,,,,,,,,,,,,,,,,,,,
83,83,0.6813725490196079,2023-08-23 17:29:28.285088,2023-08-23 17:29:29.154391,0 days 00:00:00.869303,,,,,RandomForestClassifier,,,,,,,,,,,,,,,,,,,,,,,,22.0,11.0,,,,,,COMPLETE,0.0,,,,,,,,,,,,,,,,,,,,
84,84,0.6475279106858054,2023-08-23 17:29:28.570549,2023-08-23 17:29:29.229876,0 days 00:00:00.659327,,0.4,1.0,,LightGBM,,,,,0.7000000000000001,,,,1.641411657966635e-08,1.7990917385877048e-08,,100.0,,,,,,,,,,7.0,,,,,,,,,COMPLETE,0.0,,,,,,,,,,,,,,,,,,,,
85,85,0.6475279106858054,2023-08-23 17:29:28.591264,2023-08-23 17:29:29.638485,0 days 00:00:01.047221,,0.4,1.0,,LightGBM,,,,,0.7000000000000001,,,,4.4421119003497504e-08,2.13696657850329e-08,,100.0,,,,,,,,,,4.0,,,,,,,,,COMPLETE,0.0,,,,,,,,,,,,,,,,,,,,
86,86,0.6475279106858054,2023-08-23 17:29:28.849339,2023-08-23 17:29:29.966737,0 days 00:00:01.117398,,0.4,1.0,,LightGBM,,,,,0.7000000000000001,,,,6.247866846133198e-08,3.0480607364898387e-07,,100.0,,,,,,,,,,5.0,,,,,,,,,COMPLETE,0.0,,,,,,,,,,,,,,,,,,,,
87,87,0.5611814345991561,2023-08-23 17:29:29.047244,2023-08-23 17:29:29.331664,0 days 00:00:00.284420,,,,,DecisionTreeClassifier,,entropy,32.0,,,,,,,,,,,,,,,,,,,,,,,,,,,,COMPLETE,0.0,,,,,,,,,,,,,,,,,,,,
88,88,0.6475279106858054,2023-08-23 17:29:29.225867,2023-08-23 17:29:29.889221,0 days 00:00:00.663354,,0.4,1.0,,LightGBM,,,,,0.7000000000000001,,,,2.3390271253008497e-08,2.1811093416217146e-08,,100.0,,,,,,,,,,6.0,,,,,,,,,COMPLETE,0.0,,,,,,,,,,,,,,,,,,,,
89,89,0.7393483709273183,2023-08-23 17:29:29.329007,2023-08-23 17:29:30.794536,0 days 00:00:01.465529,,,,,RandomForestClassifier,,,,,,,,,,,,,,,,,,,,,,,,35.0,15.0,,,,,,COMPLETE,0.0,,,,,,,,,,,,,,,,,,,,
90,90,0.7204301075268817,2023-08-23 17:29:29.420512,2023-08-23 17:29:30.155693,0 days 00:00:00.735181,,,,,RandomForestClassifier,,,,,,,,,,,,,,,,,,,,,,,,11.0,15.0,,,,,,COMPLETE,0.0,,,,,,,,,,,,,,,,,,,,
91,91,0.3696969696969697,2023-08-23 17:29:29.556163,2023-08-23 17:29:44.937043,0 days 00:00:15.380880,,,,,MLPClassifier,,,,,,,,,,,,,,tanh,sgd,4.0,100.0,70.0,10.0,10.0,,,,,,,,,,,COMPLETE,0.0,,,,,,,,,,,,,,,,,,,,
92,92,0.6770186335403726,2023-08-23 17:29:29.751106,2023-08-23 17:29:30.525759,0 days 00:00:00.774653,,,,,RandomForestClassifier,,,,,,,,,,,,,,,,,,,,,,,,15.0,15.0,,,,,,COMPLETE,0.0,,,,,,,,,,,,,,,,,,,,
93,93,0.3696969696969697,2023-08-23 17:29:30.021034,2023-08-23 17:29:42.171146,0 days 00:00:12.150112,,,,,MLPClassifier,,,,,,,,,,,,,,tanh,sgd,4.0,90.0,70.0,10.0,10.0,,,,,,,,,,,COMPLETE,0.0,,,,,,,,,,,,,,,,,,,,
