,number,value,datetime_start,datetime_complete,duration,params_alpha,params_bagging_fraction,params_bagging_freq,params_booster,params_classifier,params_colsample_bytree,params_dct_criterion,params_dct_max_depth,params_eta,params_feature_fraction,params_gamma,params_grow_policy,params_lambda,params_lambda_l1,params_lambda_l2,params_max_depth,params_min_child_samples,params_min_child_weight,params_mlp_activation,params_mlp_solver,params_n_layers,params_n_units_l_0,params_n_units_l_1,params_n_units_l_2,params_n_units_l_3,params_normalize_type,params_num_leaves,params_rate_drop,params_rf_estimator,params_rf_max_depth,params_sample_type,params_skip_drop,params_subsample,params_svc_c,params_svc_kernel,state,best_trial,dev_acc,dev_recall_macro,dev_precision_macro,dev_f1_macro,dev_recall_0,dev_precision_0,dev_f1_0,dev_recall_1,dev_precision_1,dev_f1_1,test_acc,test_recall_macro,test_precision_macro,test_f1_macro,test_recall_0,test_precision_0,test_f1_0,test_recall_1,test_precision_1,test_f1_1
0,0,0.8867764853069242,2023-08-23 20:08:50.730295,2023-08-23 20:08:53.055049,0 days 00:00:02.324754,0.00019496619981241694,,,dart,XGBoost,0.719000689194315,,,1.2330075966849243e-07,,3.790547313479871e-06,lossguide,0.0004861576942542355,,,7.0,,10.0,,,,,,,,tree,,7.764702063812193e-08,,,uniform,0.0001098459579153344,0.6133449454737111,,,COMPLETE,0.0,,,,,,,,,,,,,,,,,,,,
1,1,0.5263757714998529,2023-08-23 20:08:50.734872,2023-08-23 20:10:42.606808,0 days 00:01:51.871936,,,,,SVC,,,,,,,,,,,,,,,,,,,,,,,,,,,,,0.7715204352032943,rbf,COMPLETE,0.0,,,,,,,,,,,,,,,,,,,,
2,2,0.9128469262112504,2023-08-23 20:08:50.738859,2023-08-23 20:08:53.901448,0 days 00:00:03.162589,,0.4,2.0,,LightGBM,,,,,0.4,,,,2.9142797069994604e-06,3.8416077244688084e-06,,70.0,,,,,,,,,,68.0,,,,,,,,,COMPLETE,0.0,,,,,,,,,,,,,,,,,,,,
3,3,0.8871846756606185,2023-08-23 20:08:50.743848,2023-08-23 20:08:51.936966,0 days 00:00:01.193118,0.002888694221957212,,,dart,XGBoost,0.20349499491874312,,,0.0036789297856738715,,2.4932889570106113e-08,lossguide,2.6904624367322525e-07,,,7.0,,7.0,,,,,,,,tree,,1.550244559811419e-05,,,weighted,0.4756626399071938,0.6955051744920239,,,COMPLETE,0.0,,,,,,,,,,,,,,,,,,,,
4,4,0.8254144230574866,2023-08-23 20:08:50.753248,2023-08-23 20:08:52.302412,0 days 00:00:01.549164,,,,,DecisionTreeClassifier,,log_loss,2.0,,,,,,,,,,,,,,,,,,,,,,,,,,,,COMPLETE,0.0,,,,,,,,,,,,,,,,,,,,
5,5,0.8405767404497786,2023-08-23 20:08:50.766378,2023-08-23 20:08:56.373450,0 days 00:00:05.607072,,,,,DecisionTreeClassifier,,entropy,24.0,,,,,,,,,,,,,,,,,,,,,,,,,,,,COMPLETE,0.0,,,,,,,,,,,,,,,,,,,,
6,6,0.5236967756652796,2023-08-23 20:08:50.767145,2023-08-23 20:17:40.052615,0 days 00:08:49.285470,,,,,MLPClassifier,,,,,,,,,,,,,,relu,sgd,1.0,100.0,,,,,,,,,,,,,,COMPLETE,0.0,,,,,,,,,,,,,,,,,,,,
7,7,0.8852648315253328,2023-08-23 20:08:50.768055,2023-08-23 20:09:00.149055,0 days 00:00:09.381000,,,,,RandomForestClassifier,,,,,,,,,,,,,,,,,,,,,,,,20.0,12.0,,,,,,COMPLETE,0.0,,,,,,,,,,,,,,,,,,,,
8,8,0.9122320867428728,2023-08-23 20:08:52.100584,2023-08-23 20:08:55.647889,0 days 00:00:03.547305,,0.8,3.0,,LightGBM,,,,,1.0,,,,0.07157367828122853,1.2390926377048333e-07,,50.0,,,,,,,,,,33.0,,,,,,,,,COMPLETE,0.0,,,,,,,,,,,,,,,,,,,,
9,9,0.893132287192075,2023-08-23 20:08:52.480614,2023-08-23 20:09:30.583702,0 days 00:00:38.103088,,,,,RandomForestClassifier,,,,,,,,,,,,,,,,,,,,,,,,96.0,15.0,,,,,,COMPLETE,0.0,,,,,,,,,,,,,,,,,,,,
10,10,0.9162658893827427,2023-08-23 20:08:53.147470,2023-08-23 20:09:02.779661,0 days 00:00:09.632191,,0.8,1.0,,LightGBM,,,,,0.9,,,,0.30644825923470637,0.14540428554756518,,40.0,,,,,,,,,,240.0,,,,,,,,,COMPLETE,1.0,0.9164588528678305,0.9160355017624933,0.9189952707569922,0.9162658893827427,0.8783102143757882,0.9489100817438693,0.9122462344466274,0.9537607891491985,0.889080459770115,0.9202855443188578,0.9254156769596199,0.9252449448742379,0.9266680582206319,0.9253377631172593,0.8989480395282117,0.9482178883658372,0.9229258713794796,0.9515418502202643,0.9051182280754265,0.9277496548550391
11,11,0.8254144230574866,2023-08-23 20:08:53.980870,2023-08-23 20:08:55.556408,0 days 00:00:01.575538,,,,,DecisionTreeClassifier,,log_loss,2.0,,,,,,,,,,,,,,,,,,,,,,,,,,,,COMPLETE,0.0,,,,,,,,,,,,,,,,,,,,
12,12,0.9068638224974008,2023-08-23 20:08:55.732527,2023-08-23 20:08:57.292714,0 days 00:00:01.560187,,0.6000000000000001,1.0,,LightGBM,,,,,0.4,,,,0.00014840116059584244,0.021119690588006522,,30.0,,,,,,,,,,14.0,,,,,,,,,COMPLETE,0.0,,,,,,,,,,,,,,,,,,,,
13,13,0.8363899487271607,2023-08-23 20:08:55.733070,2023-08-23 20:09:03.728169,0 days 00:00:07.995099,,,,,RandomForestClassifier,,,,,,,,,,,,,,,,,,,,,,,,44.0,4.0,,,,,,COMPLETE,0.0,,,,,,,,,,,,,,,,,,,,
14,14,0.9100061365828,2023-08-23 20:08:56.452534,2023-08-23 20:09:01.816326,0 days 00:00:05.363792,,0.9,2.0,,LightGBM,,,,,0.4,,,,0.026385549879275626,0.008786376852353736,,90.0,,,,,,,,,,167.0,,,,,,,,,COMPLETE,0.0,,,,,,,,,,,,,,,,,,,,
15,15,0.9153208725563392,2023-08-23 20:08:57.376048,2023-08-23 20:09:05.750334,0 days 00:00:08.374286,,0.8,2.0,,LightGBM,,,,,0.9,,,,0.4714905882305414,1.0985133742683196e-07,,50.0,,,,,,,,,,209.0,,,,,,,,,COMPLETE,0.0,,,,,,,,,,,,,,,,,,,,
16,16,0.8442512234094461,2023-08-23 20:09:00.266526,2023-08-23 20:09:05.924601,0 days 00:00:05.658075,,,,,DecisionTreeClassifier,,entropy,17.0,,,,,,,,,,,,,,,,,,,,,,,,,,,,COMPLETE,0.0,,,,,,,,,,,,,,,,,,,,
17,17,0.830488905152779,2023-08-23 20:09:01.892733,2023-08-23 20:27:05.728528,0 days 00:18:03.835795,,,,,MLPClassifier,,,,,,,,,,,,,,identity,adam,3.0,40.0,30.0,70.0,,,,,,,,,,,,COMPLETE,0.0,,,,,,,,,,,,,,,,,,,,
18,18,0.3358178053830228,2023-08-23 20:09:02.913205,2023-08-23 20:11:17.129928,0 days 00:02:14.216723,,,,,MLPClassifier,,,,,,,,,,,,,,logistic,sgd,2.0,20.0,10.0,,,,,,,,,,,,,COMPLETE,0.0,,,,,,,,,,,,,,,,,,,,
19,19,0.3358178053830228,2023-08-23 20:09:03.864844,2023-08-23 20:10:39.327594,0 days 00:01:35.462750,,,,,SVC,,,,,,,,,,,,,,,,,,,,,,,,,,,,,0.002624337312302309,poly,COMPLETE,0.0,,,,,,,,,,,,,,,,,,,,
20,20,0.7483203491032056,2023-08-23 20:09:05.883439,2023-08-23 20:11:57.551142,0 days 00:02:51.667703,,,,,MLPClassifier,,,,,,,,,,,,,,logistic,lbfgs,1.0,90.0,,,,,,,,,,,,,,COMPLETE,0.0,,,,,,,,,,,,,,,,,,,,
21,21,0.6639332375537074,2023-08-23 20:09:06.063332,2023-08-23 20:10:53.885037,0 days 00:01:47.821705,,,,,SVC,,,,,,,,,,,,,,,,,,,,,,,,,,,,,100.93686499504719,linear,COMPLETE,0.0,,,,,,,,,,,,,,,,,,,,
22,22,0.653386783855848,2023-08-23 20:09:30.662947,2023-08-23 20:38:47.162329,0 days 00:29:16.499382,,,,,MLPClassifier,,,,,,,,,,,,,,tanh,sgd,4.0,100.0,60.0,50.0,10.0,,,,,,,,,,,COMPLETE,0.0,,,,,,,,,,,,,,,,,,,,
23,23,0.7790499031175564,2023-08-23 20:10:39.472729,2023-08-23 20:31:29.470961,0 days 00:20:49.998232,,,,,MLPClassifier,,,,,,,,,,,,,,logistic,adam,3.0,60.0,10.0,70.0,,,,,,,,,,,,COMPLETE,0.0,,,,,,,,,,,,,,,,,,,,
24,24,0.7034382918223298,2023-08-23 20:10:42.697203,2023-08-23 20:40:09.231708,0 days 00:29:26.534505,,,,,MLPClassifier,,,,,,,,,,,,,,tanh,sgd,3.0,100.0,100.0,90.0,,,,,,,,,,,,COMPLETE,0.0,,,,,,,,,,,,,,,,,,,,
25,25,0.7382358939540121,2023-08-23 20:10:53.944325,2023-08-23 20:30:03.169666,0 days 00:19:09.225341,,,,,MLPClassifier,,,,,,,,,,,,,,identity,sgd,4.0,60.0,20.0,10.0,20.0,,,,,,,,,,,COMPLETE,0.0,,,,,,,,,,,,,,,,,,,,
26,26,0.910940822715175,2023-08-23 20:11:17.206179,2023-08-23 20:11:28.318521,0 days 00:00:11.112342,,1.0,1.0,,LightGBM,,,,,0.9,,,,0.5175244418357737,0.6095974057856245,,20.0,,,,,,,,,,255.0,,,,,,,,,COMPLETE,0.0,,,,,,,,,,,,,,,,,,,,
27,27,0.7424251267700777,2023-08-23 20:11:28.397756,2023-08-23 20:19:32.407340,0 days 00:08:04.009584,,,,,MLPClassifier,,,,,,,,,,,,,,relu,lbfgs,4.0,100.0,100.0,40.0,90.0,,,,,,,,,,,COMPLETE,0.0,,,,,,,,,,,,,,,,,,,,
28,28,0.9119021529757623,2023-08-23 20:11:57.651282,2023-08-23 20:12:02.876543,0 days 00:00:05.225261,,0.4,2.0,,LightGBM,,,,,0.8,,,,5.627880510900559e-07,1.0888842244712116e-06,,70.0,,,,,,,,,,245.0,,,,,,,,,COMPLETE,0.0,,,,,,,,,,,,,,,,,,,,
29,29,0.9140709961365066,2023-08-23 20:12:02.979086,2023-08-23 20:12:08.940213,0 days 00:00:05.961127,,0.7000000000000001,2.0,,LightGBM,,,,,0.6000000000000001,,,,0.6391364693811421,1.3351311772877476e-05,,50.0,,,,,,,,,,167.0,,,,,,,,,COMPLETE,0.0,,,,,,,,,,,,,,,,,,,,
30,30,0.9115433276090954,2023-08-23 20:12:09.030771,2023-08-23 20:12:15.585611,0 days 00:00:06.554840,,0.7000000000000001,3.0,,LightGBM,,,,,0.6000000000000001,,,,0.28216208789388286,1.5343943283114496e-08,,40.0,,,,,,,,,,182.0,,,,,,,,,COMPLETE,0.0,,,,,,,,,,,,,,,,,,,,
31,31,0.9131466591872351,2023-08-23 20:12:15.651275,2023-08-23 20:12:21.775790,0 days 00:00:06.124515,,0.7000000000000001,1.0,,LightGBM,,,,,0.7000000000000001,,,,0.9860504324853232,5.0737908548429516e-05,,50.0,,,,,,,,,,189.0,,,,,,,,,COMPLETE,0.0,,,,,,,,,,,,,,,,,,,,
32,32,0.9122067851561988,2023-08-23 20:12:21.844399,2023-08-23 20:12:29.472892,0 days 00:00:07.628493,,0.8,2.0,,LightGBM,,,,,0.6000000000000001,,,,0.00528094624642427,8.224237188179217e-05,,60.0,,,,,,,,,,210.0,,,,,,,,,COMPLETE,0.0,,,,,,,,,,,,,,,,,,,,
33,33,0.9150057956615334,2023-08-23 20:12:29.550802,2023-08-23 20:12:37.604848,0 days 00:00:08.054046,,0.6000000000000001,1.0,,LightGBM,,,,,1.0,,,,0.005049718893545302,2.4016098321535392e-06,,10.0,,,,,,,,,,126.0,,,,,,,,,COMPLETE,0.0,,,,,,,,,,,,,,,,,,,,
34,34,0.9159706922968688,2023-08-23 20:12:37.720293,2023-08-23 20:12:46.312989,0 days 00:00:08.592696,,0.6000000000000001,1.0,,LightGBM,,,,,1.0,,,,0.006112662287627718,7.290609451756605e-07,,10.0,,,,,,,,,,121.0,,,,,,,,,COMPLETE,0.0,,,,,,,,,,,,,,,,,,,,
35,35,0.8300622434114686,2023-08-23 20:12:46.411462,2023-08-23 20:36:21.101525,0 days 00:23:34.690063,,,,,MLPClassifier,,,,,,,,,,,,,,tanh,adam,4.0,100.0,90.0,40.0,100.0,,,,,,,,,,,COMPLETE,0.0,,,,,,,,,,,,,,,,,,,,
36,36,0.3358178053830228,2023-08-23 20:17:40.121883,2023-08-23 20:17:40.529752,0 days 00:00:00.407869,1.852282508983501e-08,,,gblinear,XGBoost,0.8720157617819251,,,,,,,0.7937247169725699,,,,,,,,,,,,,,,,,,,,0.23569511645265567,,,COMPLETE,0.0,,,,,,,,,,,,,,,,,,,,
37,37,0.8816527299557304,2023-08-23 20:17:40.613832,2023-08-23 20:17:42.019187,0 days 00:00:01.405355,0.13180557592927383,,,gbtree,XGBoost,0.9682179706163032,,,0.3576384741013493,,0.7336498962992722,depthwise,1.2855460150424195e-08,,,3.0,,2.0,,,,,,,,,,,,,,,0.9819639365455083,,,COMPLETE,0.0,,,,,,,,,,,,,,,,,,,,
38,38,0.9159559615908095,2023-08-23 20:17:42.156729,2023-08-23 20:17:49.822189,0 days 00:00:07.665460,,0.6000000000000001,1.0,,LightGBM,,,,,1.0,,,,0.004205494053773727,2.5129601332697105e-07,,20.0,,,,,,,,,,110.0,,,,,,,,,COMPLETE,0.0,,,,,,,,,,,,,,,,,,,,
39,39,0.9084465522472597,2023-08-23 20:17:49.901535,2023-08-23 20:17:57.208633,0 days 00:00:07.307098,,0.6000000000000001,1.0,,LightGBM,,,,,0.9,,,,0.0058825558767045556,1.387245003643556e-07,,10.0,,,,,,,,,,110.0,,,,,,,,,COMPLETE,0.0,,,,,,,,,,,,,,,,,,,,
40,40,0.9118755494043054,2023-08-23 20:17:57.345442,2023-08-23 20:18:03.503061,0 days 00:00:06.157619,,0.5,1.0,,LightGBM,,,,,0.9,,,,0.053269755685560624,2.0923898321152674e-07,,30.0,,,,,,,,,,93.0,,,,,,,,,COMPLETE,0.0,,,,,,,,,,,,,,,,,,,,
41,41,0.9128316478953005,2023-08-23 20:18:03.592368,2023-08-23 20:18:14.959035,0 days 00:00:11.366667,,0.8,1.0,,LightGBM,,,,,1.0,,,,0.00034962048360327323,1.0990711790389087e-08,,30.0,,,,,,,,,,224.0,,,,,,,,,COMPLETE,0.0,,,,,,,,,,,,,,,,,,,,
42,42,0.9159559615908095,2023-08-23 20:18:15.030678,2023-08-23 20:18:24.099392,0 days 00:00:09.068714,,0.9,1.0,,LightGBM,,,,,0.9,,,,0.029642240588499014,0.0008237313252019208,,20.0,,,,,,,,,,142.0,,,,,,,,,COMPLETE,0.0,,,,,,,,,,,,,,,,,,,,
43,43,0.5839052587057663,2023-08-23 20:18:24.219858,2023-08-23 20:19:40.358690,0 days 00:01:16.138832,,,,,SVC,,,,,,,,,,,,,,,,,,,,,,,,,,,,,461.12409478982426,rbf,COMPLETE,0.0,,,,,,,,,,,,,,,,,,,,
