,number,value,datetime_start,datetime_complete,duration,params_alpha,params_bagging_fraction,params_bagging_freq,params_booster,params_classifier,params_colsample_bytree,params_dct_criterion,params_dct_max_depth,params_eta,params_feature_fraction,params_gamma,params_grow_policy,params_lambda,params_lambda_l1,params_lambda_l2,params_max_depth,params_min_child_samples,params_min_child_weight,params_mlp_activation,params_mlp_solver,params_n_layers,params_n_units_l_0,params_n_units_l_1,params_n_units_l_2,params_n_units_l_3,params_normalize_type,params_num_leaves,params_rate_drop,params_rf_estimator,params_rf_max_depth,params_sample_type,params_skip_drop,params_subsample,params_svc_c,params_svc_kernel,state,best_trial,dev_acc,dev_recall_macro,dev_precision_macro,dev_f1_macro,dev_recall_0,dev_precision_0,dev_f1_0,dev_recall_1,dev_precision_1,dev_f1_1,test_acc,test_recall_macro,test_precision_macro,test_f1_macro,test_recall_0,test_precision_0,test_f1_0,test_recall_1,test_precision_1,test_f1_1
0,0,0.5885757525899207,2023-08-23 16:43:50.777029,2023-08-23 17:20:49.873527,0 days 00:36:59.096498,,,,,MLPClassifier,,,,,,,,,,,,,,identity,sgd,3.0,100.0,90.0,40.0,,,,,,,,,,,,COMPLETE,0.0,,,,,,,,,,,,,,,,,,,,
1,1,0.4353292058018675,2023-08-23 16:43:50.782256,2023-08-23 16:45:08.914541,0 days 00:01:18.132285,,,,,SVC,,,,,,,,,,,,,,,,,,,,,,,,,,,,,0.09122861038680416,linear,COMPLETE,0.0,,,,,,,,,,,,,,,,,,,,
2,2,0.7043701630811341,2023-08-23 16:43:50.786630,2023-08-23 16:43:52.444765,0 days 00:00:01.658135,0.00015638362375925753,,,gbtree,XGBoost,0.608697869371017,,,1.63352024675768e-05,,0.0013843651249498446,depthwise,0.11555791212615683,,,7.0,,9.0,,,,,,,,,,,,,,,0.5400921039749044,,,COMPLETE,0.0,,,,,,,,,,,,,,,,,,,,
3,3,0.6174288686064291,2023-08-23 16:43:50.792598,2023-08-23 16:43:51.444676,0 days 00:00:00.652078,,,,,DecisionTreeClassifier,,entropy,2.0,,,,,,,,,,,,,,,,,,,,,,,,,,,,COMPLETE,0.0,,,,,,,,,,,,,,,,,,,,
4,4,0.5884942601466621,2023-08-23 16:43:50.800352,2023-08-23 16:47:51.271532,0 days 00:04:00.471180,,,,,MLPClassifier,,,,,,,,,,,,,,identity,lbfgs,2.0,20.0,70.0,,,,,,,,,,,,,COMPLETE,0.0,,,,,,,,,,,,,,,,,,,,
5,5,0.6967493174929991,2023-08-23 16:43:50.809781,2023-08-23 16:43:52.565411,0 days 00:00:01.755630,5.874116283356129e-07,,,dart,XGBoost,0.7520313951801136,,,0.00012718312528532045,,1.568247817883854e-07,lossguide,4.942888284468634e-08,,,5.0,,8.0,,,,,,,,forest,,6.211015526252063e-07,,,weighted,0.0009641594337463174,0.9785946302280324,,,COMPLETE,0.0,,,,,,,,,,,,,,,,,,,,
6,6,0.7324911732874404,2023-08-23 16:43:50.821202,2023-08-23 16:43:59.691911,0 days 00:00:08.870709,,0.7000000000000001,2.0,,LightGBM,,,,,0.9,,,,3.4898912033270426e-06,0.0004855119294447998,,40.0,,,,,,,,,,228.0,,,,,,,,,COMPLETE,0.0,,,,,,,,,,,,,,,,,,,,
7,7,0.6942179785335499,2023-08-23 16:43:50.859965,2023-08-23 17:11:09.319932,0 days 00:27:18.459967,,,,,MLPClassifier,,,,,,,,,,,,,,relu,adam,3.0,10.0,30.0,100.0,,,,,,,,,,,,COMPLETE,0.0,,,,,,,,,,,,,,,,,,,,
8,8,0.3358178053830228,2023-08-23 16:43:51.560683,2023-08-23 16:52:35.687229,0 days 00:08:44.126546,,,,,MLPClassifier,,,,,,,,,,,,,,logistic,sgd,3.0,90.0,40.0,60.0,,,,,,,,,,,,COMPLETE,0.0,,,,,,,,,,,,,,,,,,,,
9,9,0.6255552221114652,2023-08-23 16:43:52.520814,2023-08-23 16:43:53.846870,0 days 00:00:01.326056,,,,,DecisionTreeClassifier,,entropy,3.0,,,,,,,,,,,,,,,,,,,,,,,,,,,,COMPLETE,0.0,,,,,,,,,,,,,,,,,,,,
10,10,0.5225705336233042,2023-08-23 16:43:52.741959,2023-08-23 16:46:24.357423,0 days 00:02:31.615464,,,,,SVC,,,,,,,,,,,,,,,,,,,,,,,,,,,,,906.1758141642247,linear,COMPLETE,0.0,,,,,,,,,,,,,,,,,,,,
11,11,0.33791449736724527,2023-08-23 16:43:54.004801,2023-08-23 16:47:32.470879,0 days 00:03:38.466078,,,,,MLPClassifier,,,,,,,,,,,,,,logistic,sgd,1.0,80.0,,,,,,,,,,,,,,COMPLETE,0.0,,,,,,,,,,,,,,,,,,,,
12,12,0.7391348413786818,2023-08-23 16:43:59.811103,2023-08-23 16:44:01.518409,0 days 00:00:01.707306,,0.4,2.0,,LightGBM,,,,,0.8,,,,0.9660111500767449,0.03125611164869209,,90.0,,,,,,,,,,29.0,,,,,,,,,COMPLETE,0.0,,,,,,,,,,,,,,,,,,,,
13,13,0.6174288686064291,2023-08-23 16:44:01.603206,2023-08-23 16:44:02.142819,0 days 00:00:00.539613,,,,,DecisionTreeClassifier,,log_loss,2.0,,,,,,,,,,,,,,,,,,,,,,,,,,,,COMPLETE,0.0,,,,,,,,,,,,,,,,,,,,
14,14,0.6564068671663609,2023-08-23 16:44:02.268830,2023-08-23 16:44:03.516445,0 days 00:00:01.247615,,,,,DecisionTreeClassifier,,gini,4.0,,,,,,,,,,,,,,,,,,,,,,,,,,,,COMPLETE,0.0,,,,,,,,,,,,,,,,,,,,
15,15,0.7337346497219781,2023-08-23 16:44:03.640629,2023-08-23 16:44:08.353640,0 days 00:00:04.713011,,0.5,3.0,,LightGBM,,,,,0.4,,,,0.0015724805237001132,4.5790663503427955e-08,,50.0,,,,,,,,,,221.0,,,,,,,,,COMPLETE,0.0,,,,,,,,,,,,,,,,,,,,
16,16,0.7275394766256712,2023-08-23 16:44:08.498948,2023-08-23 16:44:12.133311,0 days 00:00:03.634363,,0.5,1.0,,LightGBM,,,,,0.7000000000000001,,,,0.024380729606339156,1.826927727658468e-07,,40.0,,,,,,,,,,63.0,,,,,,,,,COMPLETE,0.0,,,,,,,,,,,,,,,,,,,,
17,17,0.6557148814742251,2023-08-23 16:44:12.275638,2023-08-23 16:49:09.930521,0 days 00:04:57.654883,,,,,MLPClassifier,,,,,,,,,,,,,,relu,lbfgs,2.0,30.0,80.0,,,,,,,,,,,,,COMPLETE,0.0,,,,,,,,,,,,,,,,,,,,
18,18,0.6572574192920899,2023-08-23 16:45:08.978833,2023-08-23 16:50:22.493943,0 days 00:05:13.515110,,,,,MLPClassifier,,,,,,,,,,,,,,relu,lbfgs,2.0,50.0,100.0,,,,,,,,,,,,,COMPLETE,0.0,,,,,,,,,,,,,,,,,,,,
19,19,0.733204250056985,2023-08-23 16:46:24.490814,2023-08-23 16:46:26.093672,0 days 00:00:01.602858,,0.4,3.0,,LightGBM,,,,,0.4,,,,0.9893085320199605,0.847498258853572,,90.0,,,,,,,,,,12.0,,,,,,,,,COMPLETE,0.0,,,,,,,,,,,,,,,,,,,,
20,20,0.7199539037235472,2023-08-23 16:46:26.202714,2023-08-23 16:46:55.593447,0 days 00:00:29.390733,,,,,RandomForestClassifier,,,,,,,,,,,,,,,,,,,,,,,,74.0,31.0,,,,,,COMPLETE,0.0,,,,,,,,,,,,,,,,,,,,
21,21,0.561339398378288,2023-08-23 16:46:55.722461,2023-08-23 17:20:28.549586,0 days 00:33:32.827125,,,,,MLPClassifier,,,,,,,,,,,,,,identity,sgd,3.0,100.0,80.0,20.0,,,,,,,,,,,,COMPLETE,0.0,,,,,,,,,,,,,,,,,,,,
22,22,0.7257272760968136,2023-08-23 16:47:32.569052,2023-08-23 16:47:35.119236,0 days 00:00:02.550184,,0.4,3.0,,LightGBM,,,,,0.4,,,,0.0012775646849644297,1.1546619621392602e-08,,90.0,,,,,,,,,,207.0,,,,,,,,,COMPLETE,0.0,,,,,,,,,,,,,,,,,,,,
23,23,0.7313167893465551,2023-08-23 16:47:35.243226,2023-08-23 16:47:40.681456,0 days 00:00:05.438230,,0.6000000000000001,2.0,,LightGBM,,,,,0.8,,,,0.00011706225947000109,3.580846193281169e-05,,70.0,,,,,,,,,,134.0,,,,,,,,,COMPLETE,0.0,,,,,,,,,,,,,,,,,,,,
24,24,0.6209708146607453,2023-08-23 16:47:40.768262,2023-08-23 16:47:41.401774,0 days 00:00:00.633512,,,,,RandomForestClassifier,,,,,,,,,,,,,,,,,,,,,,,,10.0,2.0,,,,,,COMPLETE,0.0,,,,,,,,,,,,,,,,,,,,
25,25,0.6804340856184357,2023-08-23 16:47:41.511389,2023-08-23 16:53:33.406784,0 days 00:05:51.895395,,,,,MLPClassifier,,,,,,,,,,,,,,relu,lbfgs,4.0,20.0,10.0,30.0,40.0,,,,,,,,,,,COMPLETE,0.0,,,,,,,,,,,,,,,,,,,,
26,26,0.7402731047742119,2023-08-23 16:47:51.456834,2023-08-23 16:47:57.285144,0 days 00:00:05.828310,,0.9,2.0,,LightGBM,,,,,0.6000000000000001,,,,1.21308134391436e-08,0.024910153734683815,,60.0,,,,,,,,,,139.0,,,,,,,,,COMPLETE,0.0,,,,,,,,,,,,,,,,,,,,
27,27,0.7284412666437705,2023-08-23 16:47:57.375467,2023-08-23 16:48:03.556741,0 days 00:00:06.181274,,1.0,1.0,,LightGBM,,,,,0.6000000000000001,,,,1.9957348768835692e-08,0.143179659816092,,10.0,,,,,,,,,,126.0,,,,,,,,,COMPLETE,0.0,,,,,,,,,,,,,,,,,,,,
28,28,0.7288982042533745,2023-08-23 16:48:03.637406,2023-08-23 16:48:09.691522,0 days 00:00:06.054116,,0.8,2.0,,LightGBM,,,,,0.6000000000000001,,,,0.7758604360693504,0.010678147633523356,,60.0,,,,,,,,,,156.0,,,,,,,,,COMPLETE,0.0,,,,,,,,,,,,,,,,,,,,
29,29,0.7300037814264394,2023-08-23 16:48:09.768814,2023-08-23 16:48:14.712401,0 days 00:00:04.943587,,0.9,2.0,,LightGBM,,,,,1.0,,,,6.899325629638823e-07,0.0061582342051945144,,70.0,,,,,,,,,,79.0,,,,,,,,,COMPLETE,0.0,,,,,,,,,,,,,,,,,,,,
30,30,0.7360403613307585,2023-08-23 16:48:14.797043,2023-08-23 16:48:20.705689,0 days 00:00:05.908646,,0.5,3.0,,LightGBM,,,,,0.5,,,,0.0077451553563322485,2.0411447142339134e-05,,40.0,,,,,,,,,,251.0,,,,,,,,,COMPLETE,0.0,,,,,,,,,,,,,,,,,,,,
31,31,0.7103568732048409,2023-08-23 16:48:20.811471,2023-08-23 16:48:21.679667,0 days 00:00:00.868196,,0.6000000000000001,2.0,,LightGBM,,,,,0.6000000000000001,,,,0.03396646082800236,5.2079965551809934e-05,,20.0,,,,,,,,,,3.0,,,,,,,,,COMPLETE,0.0,,,,,,,,,,,,,,,,,,,,
32,32,0.7295766920159119,2023-08-23 16:48:21.764101,2023-08-23 16:48:25.031968,0 days 00:00:03.267867,,0.4,3.0,,LightGBM,,,,,0.7000000000000001,,,,5.237253790564297e-06,0.027139965807350806,,100.0,,,,,,,,,,256.0,,,,,,,,,COMPLETE,0.0,,,,,,,,,,,,,,,,,,,,
33,33,0.3358178053830228,2023-08-23 16:48:25.114817,2023-08-23 16:49:36.601310,0 days 00:01:11.486493,,,,,SVC,,,,,,,,,,,,,,,,,,,,,,,,,,,,,0.0013971684563163775,poly,COMPLETE,0.0,,,,,,,,,,,,,,,,,,,,
34,34,0.688309808350356,2023-08-23 16:49:10.036286,2023-08-23 16:49:27.998382,0 days 00:00:17.962096,,,,,RandomForestClassifier,,,,,,,,,,,,,,,,,,,,,,,,97.0,7.0,,,,,,COMPLETE,0.0,,,,,,,,,,,,,,,,,,,,
35,35,0.3358178053830228,2023-08-23 16:49:28.087873,2023-08-23 16:49:28.319011,0 days 00:00:00.231138,0.8231770411138798,,,gblinear,XGBoost,0.40745800614522293,,,,,,,0.6884528144784324,,,,,,,,,,,,,,,,,,,,0.2014130028923795,,,COMPLETE,0.0,,,,,,,,,,,,,,,,,,,,
36,36,0.3358178053830228,2023-08-23 16:49:28.396850,2023-08-23 16:50:38.471230,0 days 00:01:10.074380,,,,,SVC,,,,,,,,,,,,,,,,,,,,,,,,,,,,,0.001042080332667728,poly,COMPLETE,0.0,,,,,,,,,,,,,,,,,,,,
37,37,0.48617319268132786,2023-08-23 16:49:36.728047,2023-08-23 16:51:09.483597,0 days 00:01:32.755550,,,,,SVC,,,,,,,,,,,,,,,,,,,,,,,,,,,,,79.06842395957459,rbf,COMPLETE,0.0,,,,,,,,,,,,,,,,,,,,
38,38,0.738903764407908,2023-08-23 16:50:22.636883,2023-08-23 16:50:28.367673,0 days 00:00:05.730790,,0.5,3.0,,LightGBM,,,,,0.5,,,,0.0016695139362365647,1.5533001156591258e-06,,40.0,,,,,,,,,,188.0,,,,,,,,,COMPLETE,0.0,,,,,,,,,,,,,,,,,,,,
39,39,0.7304334307445562,2023-08-23 16:50:28.443159,2023-08-23 16:50:34.313615,0 days 00:00:05.870456,,0.5,3.0,,LightGBM,,,,,0.5,,,,0.009663516108640923,1.746815359368367e-05,,30.0,,,,,,,,,,176.0,,,,,,,,,COMPLETE,0.0,,,,,,,,,,,,,,,,,,,,
40,40,0.7317615593960896,2023-08-23 16:50:34.393210,2023-08-23 16:50:38.933416,0 days 00:00:04.540206,,0.6000000000000001,2.0,,LightGBM,,,,,0.5,,,,0.0001231687258534076,2.5288854330302374e-06,,50.0,,,,,,,,,,109.0,,,,,,,,,COMPLETE,0.0,,,,,,,,,,,,,,,,,,,,
41,41,0.7290382268476783,2023-08-23 16:50:38.565036,2023-08-23 16:50:42.904156,0 days 00:00:04.339120,,0.6000000000000001,2.0,,LightGBM,,,,,0.5,,,,0.00019532679609742003,2.5459085427706237e-06,,50.0,,,,,,,,,,93.0,,,,,,,,,COMPLETE,0.0,,,,,,,,,,,,,,,,,,,,
42,42,0.7384535400321391,2023-08-23 16:50:39.026876,2023-08-23 16:50:46.728650,0 days 00:00:07.701774,,0.8,3.0,,LightGBM,,,,,0.5,,,,1.2425901400014191e-08,0.0008489999846928878,,30.0,,,,,,,,,,188.0,,,,,,,,,COMPLETE,0.0,,,,,,,,,,,,,,,,,,,,
43,43,0.6899199809657384,2023-08-23 16:50:42.994605,2023-08-23 16:50:46.557813,0 days 00:00:03.563208,1.040440392264857e-08,,,gbtree,XGBoost,0.9802747790018819,,,0.6735100909192138,,0.7586573803986985,lossguide,4.755872045174622e-06,,,9.0,,2.0,,,,,,,,,,,,,,,0.9484047527407194,,,COMPLETE,0.0,,,,,,,,,,,,,,,,,,,,
44,44,0.7428008604455091,2023-08-23 16:50:46.688683,2023-08-23 16:50:55.886321,0 days 00:00:09.197638,,0.8,3.0,,LightGBM,,,,,0.8,,,,0.08705050425776538,0.0008395559841993852,,30.0,,,,,,,,,,183.0,,,,,,,,,COMPLETE,1.0,0.7462593516209476,0.7450518796559912,0.7575664964249234,0.7428008604455091,0.637452711223203,0.8088,0.7129760225669958,0.8526510480887793,0.7063329928498467,0.7726256983240224,0.7404592240696753,0.740426692275733,0.7404580960593832,0.7404342042524936,0.7354160025502072,0.7403722721437741,0.7378858148088918,0.7454373820012586,0.7405439199749921,0.7429825936960953
45,45,0.7372683741630526,2023-08-23 16:50:46.872743,2023-08-23 16:50:56.223339,0 days 00:00:09.350596,,0.8,3.0,,LightGBM,,,,,0.8,,,,3.204009972367862e-08,0.001803053061248673,,30.0,,,,,,,,,,179.0,,,,,,,,,COMPLETE,0.0,,,,,,,,,,,,,,,,,,,,
46,46,0.6617164787405561,2023-08-23 16:50:56.060426,2023-08-23 16:50:57.173226,0 days 00:00:01.112800,0.7124499159612973,,,dart,XGBoost,0.22450714318689202,,,9.416276030199427e-08,,1.6866741583645013e-08,depthwise,0.00043885798811405376,,,3.0,,3.0,,,,,,,,tree,,0.7501757070815502,,,uniform,1.1565801966313638e-08,0.5953541561436548,,,COMPLETE,0.0,,,,,,,,,,,,,,,,,,,,
47,47,0.3358178053830228,2023-08-23 16:50:56.372315,2023-08-23 16:50:56.801388,0 days 00:00:00.429073,0.22820702969793927,,,gblinear,XGBoost,0.2007296384387034,,,,,,,0.0011253029562639382,,,,,,,,,,,,,,,,,,,,0.20150226492694834,,,COMPLETE,0.0,,,,,,,,,,,,,,,,,,,,
48,48,0.7361731409917508,2023-08-23 16:50:56.907939,2023-08-23 16:51:06.069901,0 days 00:00:09.161962,,0.8,3.0,,LightGBM,,,,,0.8,,,,1.3251683626712898e-08,0.0017381084787152976,,30.0,,,,,,,,,,182.0,,,,,,,,,COMPLETE,0.0,,,,,,,,,,,,,,,,,,,,
49,49,0.7353710607427986,2023-08-23 16:50:57.284877,2023-08-23 16:51:06.402073,0 days 00:00:09.117196,,0.8,3.0,,LightGBM,,,,,0.8,,,,1.223375923620127e-08,0.0006035254376840268,,30.0,,,,,,,,,,186.0,,,,,,,,,COMPLETE,0.0,,,,,,,,,,,,,,,,,,,,
50,50,0.7329193212049012,2023-08-23 16:51:06.189506,2023-08-23 16:51:14.291391,0 days 00:00:08.101885,,0.9,3.0,,LightGBM,,,,,0.9,,,,0.13332906078194662,0.03428831265620324,,20.0,,,,,,,,,,154.0,,,,,,,,,COMPLETE,0.0,,,,,,,,,,,,,,,,,,,,
51,51,0.6347236163039132,2023-08-23 16:51:06.623631,2023-08-23 16:51:11.661210,0 days 00:00:05.037579,,,,,DecisionTreeClassifier,,log_loss,32.0,,,,,,,,,,,,,,,,,,,,,,,,,,,,COMPLETE,0.0,,,,,,,,,,,,,,,,,,,,
52,52,0.6313601912895814,2023-08-23 16:51:09.584589,2023-08-23 16:51:12.824859,0 days 00:00:03.240270,,,,,DecisionTreeClassifier,,gini,24.0,,,,,,,,,,,,,,,,,,,,,,,,,,,,COMPLETE,0.0,,,,,,,,,,,,,,,,,,,,
53,53,0.7396652071514112,2023-08-23 16:51:11.726232,2023-08-23 16:51:18.638251,0 days 00:00:06.912019,,0.9,2.0,,LightGBM,,,,,0.6000000000000001,,,,0.15293760096006254,0.025694913163081413,,20.0,,,,,,,,,,147.0,,,,,,,,,COMPLETE,0.0,,,,,,,,,,,,,,,,,,,,
54,54,0.734644419685264,2023-08-23 16:51:12.935108,2023-08-23 16:51:19.891431,0 days 00:00:06.956323,,0.9,2.0,,LightGBM,,,,,0.6000000000000001,,,,0.14749433861215966,0.02936456124005739,,20.0,,,,,,,,,,148.0,,,,,,,,,COMPLETE,0.0,,,,,,,,,,,,,,,,,,,,
55,55,0.7082003918275959,2023-08-23 16:51:14.426036,2023-08-23 17:20:14.973307,0 days 00:29:00.547271,,,,,MLPClassifier,,,,,,,,,,,,,,tanh,adam,4.0,100.0,10.0,30.0,70.0,,,,,,,,,,,COMPLETE,0.0,,,,,,,,,,,,,,,,,,,,
56,56,0.6919699391280196,2023-08-23 16:51:18.729128,2023-08-23 17:20:54.289162,0 days 00:29:35.560034,,,,,MLPClassifier,,,,,,,,,,,,,,tanh,adam,4.0,100.0,20.0,30.0,60.0,,,,,,,,,,,COMPLETE,0.0,,,,,,,,,,,,,,,,,,,,
57,57,0.6173703197137037,2023-08-23 16:51:19.952924,2023-08-23 16:51:21.293176,0 days 00:00:01.340252,,,,,RandomForestClassifier,,,,,,,,,,,,,,,,,,,,,,,,21.0,2.0,,,,,,COMPLETE,0.0,,,,,,,,,,,,,,,,,,,,
58,58,0.7388714760451135,2023-08-23 16:51:21.360459,2023-08-23 16:51:30.436730,0 days 00:00:09.076271,,1.0,2.0,,LightGBM,,,,,0.7000000000000001,,,,0.26445372642131765,0.004584501029191998,,10.0,,,,,,,,,,200.0,,,,,,,,,COMPLETE,0.0,,,,,,,,,,,,,,,,,,,,
59,59,0.6771614693872436,2023-08-23 16:51:30.503222,2023-08-23 17:06:18.706172,0 days 00:14:48.202950,,,,,MLPClassifier,,,,,,,,,,,,,,tanh,adam,4.0,100.0,10.0,20.0,80.0,,,,,,,,,,,COMPLETE,0.0,,,,,,,,,,,,,,,,,,,,
60,60,0.736621636898423,2023-08-23 16:52:35.775002,2023-08-23 16:52:44.982255,0 days 00:00:09.207253,,1.0,2.0,,LightGBM,,,,,0.7000000000000001,,,,0.20727699143098535,0.004445686116198845,,10.0,,,,,,,,,,209.0,,,,,,,,,COMPLETE,0.0,,,,,,,,,,,,,,,,,,,,
61,61,0.6845134009133584,2023-08-23 16:52:45.055793,2023-08-23 17:02:23.238750,0 days 00:09:38.182957,,,,,MLPClassifier,,,,,,,,,,,,,,tanh,adam,4.0,60.0,10.0,10.0,80.0,,,,,,,,,,,COMPLETE,0.0,,,,,,,,,,,,,,,,,,,,
62,62,0.738749881975262,2023-08-23 16:53:33.521227,2023-08-23 16:53:41.509245,0 days 00:00:07.988018,,1.0,2.0,,LightGBM,,,,,0.7000000000000001,,,,0.2451365971387871,0.12008746039818852,,10.0,,,,,,,,,,166.0,,,,,,,,,COMPLETE,0.0,,,,,,,,,,,,,,,,,,,,
63,63,0.7372271994283944,2023-08-23 16:53:41.561496,2023-08-23 16:53:44.817307,0 days 00:00:03.255811,,0.9,2.0,,LightGBM,,,,,0.6000000000000001,,,,0.07162424498007723,0.010180562886020286,,20.0,,,,,,,,,,39.0,,,,,,,,,COMPLETE,0.0,,,,,,,,,,,,,,,,,,,,
64,64,0.7319915768916739,2023-08-23 16:53:44.889924,2023-08-23 16:53:51.157850,0 days 00:00:06.267926,,0.9,2.0,,LightGBM,,,,,0.9,,,,0.44946558191385855,0.0002912231119704266,,70.0,,,,,,,,,,131.0,,,,,,,,,COMPLETE,0.0,,,,,,,,,,,,,,,,,,,,
