,number,value,datetime_start,datetime_complete,duration,params_alpha,params_bagging_fraction,params_bagging_freq,params_booster,params_classifier,params_colsample_bytree,params_dct_criterion,params_dct_max_depth,params_eta,params_feature_fraction,params_gamma,params_grow_policy,params_lambda,params_lambda_l1,params_lambda_l2,params_max_depth,params_min_child_samples,params_min_child_weight,params_mlp_activation,params_mlp_solver,params_n_layers,params_n_units_l_0,params_n_units_l_1,params_n_units_l_2,params_n_units_l_3,params_normalize_type,params_num_leaves,params_rate_drop,params_rf_estimator,params_rf_max_depth,params_sample_type,params_skip_drop,params_subsample,params_svc_c,params_svc_kernel,state,best_trial,dev_acc,dev_recall_macro,dev_precision_macro,dev_f1_macro,dev_recall_0,dev_precision_0,dev_f1_0,dev_recall_1,dev_precision_1,dev_f1_1,test_acc,test_recall_macro,test_precision_macro,test_f1_macro,test_recall_0,test_precision_0,test_f1_0,test_recall_1,test_precision_1,test_f1_1
84,84,0.5566347354707606,2023-08-23 18:50:59.112847,2023-08-23 18:54:45.015428,0 days 00:03:45.902581,,,,,MLPClassifier,,,,,,,,,,,,,,identity,sgd,2.0,50.0,10.0,,,,,,,,,,,,,COMPLETE,0.0,,,,,,,,,,,,,,,,,,,,
85,85,0.8231100900988362,2023-08-23 18:51:26.350011,2023-08-23 18:51:28.612839,0 days 00:00:02.262828,,0.7000000000000001,2.0,,LightGBM,,,,,0.8,,,,0.11422862453922979,0.006914914814930758,,80.0,,,,,,,,,,52.0,,,,,,,,,COMPLETE,0.0,,,,,,,,,,,,,,,,,,,,
86,86,0.8226703607570941,2023-08-23 18:51:28.724679,2023-08-23 18:51:29.711076,0 days 00:00:00.986397,,0.9,1.0,,LightGBM,,,,,0.5,,,,0.01717823302395443,0.02228267339410247,,20.0,,,,,,,,,,9.0,,,,,,,,,COMPLETE,0.0,,,,,,,,,,,,,,,,,,,,
87,87,0.7299737046182659,2023-08-23 18:51:29.774276,2023-08-23 18:51:31.595026,0 days 00:00:01.820750,,,,,RandomForestClassifier,,,,,,,,,,,,,,,,,,,,,,,,65.0,2.0,,,,,,COMPLETE,0.0,,,,,,,,,,,,,,,,,,,,
88,88,0.823618298812533,2023-08-23 18:51:31.691126,2023-08-23 18:51:35.236511,0 days 00:00:03.545385,,0.8,2.0,,LightGBM,,,,,0.6000000000000001,,,,0.003777173033326636,0.00026985801167693794,,50.0,,,,,,,,,,141.0,,,,,,,,,COMPLETE,0.0,,,,,,,,,,,,,,,,,,,,
89,89,0.8235664268907532,2023-08-23 18:51:35.307626,2023-08-23 18:51:39.232463,0 days 00:00:03.924837,,1.0,2.0,,LightGBM,,,,,0.5,,,,0.01064478901120921,0.0011732505727498333,,40.0,,,,,,,,,,166.0,,,,,,,,,COMPLETE,0.0,,,,,,,,,,,,,,,,,,,,
90,90,0.8207284109190474,2023-08-23 18:51:39.421199,2023-08-23 18:51:41.648077,0 days 00:00:02.226878,,0.7000000000000001,2.0,,LightGBM,,,,,0.6000000000000001,,,,0.014862327485347193,3.222073587524985e-07,,60.0,,,,,,,,,,211.0,,,,,,,,,COMPLETE,0.0,,,,,,,,,,,,,,,,,,,,
91,91,0.8197969691166032,2023-08-23 18:51:41.732137,2023-08-23 18:51:44.310596,0 days 00:00:02.578459,,0.8,3.0,,LightGBM,,,,,0.7000000000000001,,,,0.0034348207793302543,0.0004045879173212138,,70.0,,,,,,,,,,111.0,,,,,,,,,COMPLETE,0.0,,,,,,,,,,,,,,,,,,,,
92,92,0.8207284109190474,2023-08-23 18:51:44.372110,2023-08-23 18:51:46.260868,0 days 00:00:01.888758,,0.5,1.0,,LightGBM,,,,,0.6000000000000001,,,,0.023238124291659033,1.0835965328288145e-08,,50.0,,,,,,,,,,31.0,,,,,,,,,COMPLETE,0.0,,,,,,,,,,,,,,,,,,,,
93,93,0.5568465066247188,2023-08-23 18:51:46.340233,2023-08-23 18:55:15.045312,0 days 00:03:28.705079,,,,,MLPClassifier,,,,,,,,,,,,,,identity,sgd,2.0,50.0,10.0,,,,,,,,,,,,,COMPLETE,0.0,,,,,,,,,,,,,,,,,,,,
