,number,value,datetime_start,datetime_complete,duration,params_alpha,params_bagging_fraction,params_bagging_freq,params_booster,params_classifier,params_colsample_bytree,params_dct_criterion,params_dct_max_depth,params_eta,params_feature_fraction,params_gamma,params_grow_policy,params_lambda,params_lambda_l1,params_lambda_l2,params_max_depth,params_min_child_samples,params_min_child_weight,params_mlp_activation,params_mlp_solver,params_n_layers,params_n_units_l_0,params_n_units_l_1,params_n_units_l_2,params_n_units_l_3,params_normalize_type,params_num_leaves,params_rate_drop,params_rf_estimator,params_rf_max_depth,params_sample_type,params_skip_drop,params_subsample,params_svc_c,params_svc_kernel,state,best_trial,dev_acc,dev_recall_macro,dev_precision_macro,dev_f1_macro,dev_recall_0,dev_precision_0,dev_f1_0,dev_recall_1,dev_precision_1,dev_f1_1,test_acc,test_recall_macro,test_precision_macro,test_f1_macro,test_recall_0,test_precision_0,test_f1_0,test_recall_1,test_precision_1,test_f1_1
85,85,0.6628647852569403,2023-08-23 20:56:43.221783,2023-08-23 20:56:44.453550,0 days 00:00:01.231767,,0.7000000000000001,3.0,,LightGBM,,,,,0.4,,,,2.891833444103545e-07,1.0955411948659795e-06,,70.0,,,,,,,,,,4.0,,,,,,,,,COMPLETE,1.0,0.6630299251870324,0.6633618296966521,0.6638456934884274,0.6628647852569403,0.692938209331652,0.6491435321913762,0.670326318999695,0.6337854500616523,0.6785478547854785,0.6554032515141855,0.6343626286619161,0.6340994320011283,0.6350198718891343,0.6336320466327121,0.5935607268090533,0.6429558011049724,0.6172716724680921,0.6746381371932033,0.6270839426732963,0.6499924207973321
86,86,0.6545484797452272,2023-08-23 20:56:43.708871,2023-08-23 20:56:44.875206,0 days 00:00:01.166335,,1.0,3.0,,LightGBM,,,,,0.4,,,,2.4658607739856113e-07,1.658355821235841e-06,,70.0,,,,,,,,,,2.0,,,,,,,,,COMPLETE,0.0,,,,,,,,,,,,,,,,,,,,
87,87,0.6576187560143469,2023-08-23 20:56:43.909829,2023-08-23 20:56:45.088367,0 days 00:00:01.178538,,0.8,3.0,,LightGBM,,,,,0.4,,,,2.950853205866464e-07,3.315974125761228e-07,,10.0,,,,,,,,,,2.0,,,,,,,,,COMPLETE,0.0,,,,,,,,,,,,,,,,,,,,
88,88,0.6563554321686098,2023-08-23 20:56:44.167262,2023-08-23 20:56:45.688866,0 days 00:00:01.521604,,1.0,3.0,,LightGBM,,,,,0.4,,,,2.195677869445365e-07,1.082200990350951e-08,,10.0,,,,,,,,,,4.0,,,,,,,,,COMPLETE,0.0,,,,,,,,,,,,,,,,,,,,
89,89,0.6607517552866602,2023-08-23 20:56:44.177053,2023-08-23 20:56:45.334717,0 days 00:00:01.157664,,1.0,3.0,,LightGBM,,,,,0.4,,,,2.3663881118043822e-07,1.0688461551806809e-08,,10.0,,,,,,,,,,3.0,,,,,,,,,COMPLETE,0.0,,,,,,,,,,,,,,,,,,,,
90,90,0.6563935089069801,2023-08-23 20:56:44.546140,2023-08-23 20:56:45.986180,0 days 00:00:01.440040,,0.7000000000000001,3.0,,LightGBM,,,,,0.4,,,,3.1813269803612426e-07,1.4061331701304302e-06,,10.0,,,,,,,,,,2.0,,,,,,,,,COMPLETE,0.0,,,,,,,,,,,,,,,,,,,,
91,91,0.6494713976789273,2023-08-23 20:56:44.987875,2023-08-23 20:56:46.694919,0 days 00:00:01.707044,,0.7000000000000001,3.0,,LightGBM,,,,,0.4,,,,4.518428151759617e-07,1.6569575458935196e-06,,70.0,,,,,,,,,,11.0,,,,,,,,,COMPLETE,0.0,,,,,,,,,,,,,,,,,,,,
92,92,0.6470059089390032,2023-08-23 20:56:45.174706,2023-08-23 20:56:47.189672,0 days 00:00:02.014966,,0.7000000000000001,3.0,,LightGBM,,,,,0.4,,,,5.288793365297391e-07,1.7122462798492015e-06,,70.0,,,,,,,,,,10.0,,,,,,,,,COMPLETE,0.0,,,,,,,,,,,,,,,,,,,,
93,93,0.64948722222206,2023-08-23 20:56:45.426867,2023-08-23 20:56:47.533761,0 days 00:00:02.106894,,0.7000000000000001,3.0,,LightGBM,,,,,0.4,,,,3.33470848807045e-07,1.841194985109931e-06,,10.0,,,,,,,,,,13.0,,,,,,,,,COMPLETE,0.0,,,,,,,,,,,,,,,,,,,,
94,94,0.64948722222206,2023-08-23 20:56:45.792805,2023-08-23 20:56:47.930307,0 days 00:00:02.137502,,0.7000000000000001,3.0,,LightGBM,,,,,0.4,,,,4.417515349099036e-07,1.593573788150563e-06,,10.0,,,,,,,,,,13.0,,,,,,,,,COMPLETE,0.0,,,,,,,,,,,,,,,,,,,,
95,95,0.645692947965494,2023-08-23 20:56:46.137159,2023-08-23 20:56:48.486012,0 days 00:00:02.348853,,0.7000000000000001,3.0,,LightGBM,,,,,0.4,,,,3.343748467820409e-07,1.359843619631112e-06,,10.0,,,,,,,,,,15.0,,,,,,,,,COMPLETE,0.0,,,,,,,,,,,,,,,,,,,,
96,96,0.6428228845495032,2023-08-23 20:56:46.769139,2023-08-23 20:56:49.510146,0 days 00:00:02.741007,,0.7000000000000001,3.0,,LightGBM,,,,,0.4,,,,2.2179367871057274e-07,2.098104241858557e-06,,10.0,,,,,,,,,,31.0,,,,,,,,,COMPLETE,0.0,,,,,,,,,,,,,,,,,,,,
97,97,0.6158591678524498,2023-08-23 20:56:47.320424,2023-08-23 20:56:48.107319,0 days 00:00:00.786895,,,,,DecisionTreeClassifier,,log_loss,9.0,,,,,,,,,,,,,,,,,,,,,,,,,,,,COMPLETE,0.0,,,,,,,,,,,,,,,,,,,,
98,98,0.6415444817909355,2023-08-23 20:56:47.622613,2023-08-23 20:56:50.376818,0 days 00:00:02.754205,,0.8,3.0,,LightGBM,,,,,0.4,,,,1.17209408009064e-06,5.191479739598003e-07,,20.0,,,,,,,,,,32.0,,,,,,,,,COMPLETE,0.0,,,,,,,,,,,,,,,,,,,,
99,99,0.6315992189450078,2023-08-23 20:56:48.024461,2023-08-23 20:56:53.851852,0 days 00:00:05.827391,,0.8,3.0,,LightGBM,,,,,0.4,,,,2.0701212433873597e-07,7.5166717591913e-06,,20.0,,,,,,,,,,161.0,,,,,,,,,COMPLETE,0.0,,,,,,,,,,,,,,,,,,,,
100,100,0.6397185196315701,2023-08-23 20:56:48.197643,2023-08-23 20:56:50.841289,0 days 00:00:02.643646,,0.8,3.0,,LightGBM,,,,,0.4,,,,2.1438268202587133e-07,3.127781600345377e-07,,20.0,,,,,,,,,,31.0,,,,,,,,,COMPLETE,0.0,,,,,,,,,,,,,,,,,,,,
101,101,0.6402511961722488,2023-08-23 20:56:48.615677,2023-08-23 20:56:51.217079,0 days 00:00:02.601402,,0.8,3.0,,LightGBM,,,,,0.4,,,,1.2238933880285357e-06,4.236522820789198e-06,,20.0,,,,,,,,,,37.0,,,,,,,,,COMPLETE,0.0,,,,,,,,,,,,,,,,,,,,
102,102,0.6361818623421087,2023-08-23 20:56:49.647400,2023-08-23 20:56:55.543705,0 days 00:00:05.896305,,0.8,3.0,,LightGBM,,,,,0.4,,,,8.394576396260568e-07,5.4674238977925265e-06,,20.0,,,,,,,,,,146.0,,,,,,,,,COMPLETE,0.0,,,,,,,,,,,,,,,,,,,,
103,103,0.619362064265852,2023-08-23 20:56:50.457738,2023-08-23 20:56:52.730725,0 days 00:00:02.272987,,,,,RandomForestClassifier,,,,,,,,,,,,,,,,,,,,,,,,12.0,7.0,,,,,,COMPLETE,0.0,,,,,,,,,,,,,,,,,,,,
104,104,0.6270914562721042,2023-08-23 20:56:50.936657,2023-08-23 20:56:52.188378,0 days 00:00:01.251721,,,,,RandomForestClassifier,,,,,,,,,,,,,,,,,,,,,,,,11.0,2.0,,,,,,COMPLETE,0.0,,,,,,,,,,,,,,,,,,,,
105,105,0.6167885924046121,2023-08-23 20:56:51.285724,2023-08-23 20:56:52.843482,0 days 00:00:01.557758,,,,,RandomForestClassifier,,,,,,,,,,,,,,,,,,,,,,,,12.0,2.0,,,,,,COMPLETE,0.0,,,,,,,,,,,,,,,,,,,,
106,106,0.6402730558491173,2023-08-23 20:56:52.277758,2023-08-23 20:56:53.326476,0 days 00:00:01.048718,0.0005623074565725151,,,gbtree,XGBoost,0.9711618859659272,,,6.74432389028124e-05,,1.1891671602932585e-08,depthwise,0.00014662964357788866,,,3.0,,2.0,,,,,,,,,,,,,,,0.4205156514621552,,,COMPLETE,0.0,,,,,,,,,,,,,,,,,,,,
107,107,0.6527995044582711,2023-08-23 20:56:52.931861,2023-08-23 20:56:54.584883,0 days 00:00:01.653022,,0.6000000000000001,3.0,,LightGBM,,,,,0.4,,,,7.507538205368917e-08,1.7421207509758855e-07,,60.0,,,,,,,,,,7.0,,,,,,,,,COMPLETE,0.0,,,,,,,,,,,,,,,,,,,,
108,108,0.6483140129329679,2023-08-23 20:56:52.946285,2023-08-23 20:56:54.703590,0 days 00:00:01.757305,,0.6000000000000001,3.0,,LightGBM,,,,,0.4,,,,7.537994810590314e-08,1.2170963242747088e-07,,60.0,,,,,,,,,,8.0,,,,,,,,,COMPLETE,0.0,,,,,,,,,,,,,,,,,,,,
109,109,0.6224211240599631,2023-08-23 20:56:53.442861,2023-08-23 20:56:59.303235,0 days 00:00:05.860374,,0.6000000000000001,3.0,,LightGBM,,,,,0.4,,,,6.699433294838758e-08,1.3412226595852543e-07,,60.0,,,,,,,,,,145.0,,,,,,,,,COMPLETE,0.0,,,,,,,,,,,,,,,,,,,,
110,110,0.652683609504835,2023-08-23 20:56:53.917640,2023-08-23 20:56:55.007521,0 days 00:00:01.089881,,0.6000000000000001,3.0,,LightGBM,,,,,0.4,,,,5.881440742493428e-08,1.4610098779468806e-07,,60.0,,,,,,,,,,2.0,,,,,,,,,COMPLETE,0.0,,,,,,,,,,,,,,,,,,,,
111,111,0.6483140129329679,2023-08-23 20:56:54.661013,2023-08-23 20:56:56.742251,0 days 00:00:02.081238,,0.6000000000000001,3.0,,LightGBM,,,,,0.4,,,,8.363192310643403e-08,2.2069624211974373e-07,,60.0,,,,,,,,,,8.0,,,,,,,,,COMPLETE,0.0,,,,,,,,,,,,,,,,,,,,
112,112,0.6024650350311174,2023-08-23 20:56:54.813548,2023-08-23 21:06:38.313431,0 days 00:09:43.499883,,,,,MLPClassifier,,,,,,,,,,,,,,relu,lbfgs,4.0,10.0,100.0,10.0,100.0,,,,,,,,,,,COMPLETE,0.0,,,,,,,,,,,,,,,,,,,,
113,113,0.5990979659962321,2023-08-23 20:56:55.089565,2023-08-23 21:06:36.254921,0 days 00:09:41.165356,,,,,MLPClassifier,,,,,,,,,,,,,,relu,lbfgs,4.0,10.0,100.0,10.0,100.0,,,,,,,,,,,COMPLETE,0.0,,,,,,,,,,,,,,,,,,,,
114,114,0.6230619525016728,2023-08-23 20:56:55.638513,2023-08-23 21:06:39.477404,0 days 00:09:43.838891,,,,,MLPClassifier,,,,,,,,,,,,,,relu,lbfgs,4.0,10.0,100.0,10.0,90.0,,,,,,,,,,,COMPLETE,0.0,,,,,,,,,,,,,,,,,,,,
115,115,0.6303483604977892,2023-08-23 20:56:56.844062,2023-08-23 21:06:22.943286,0 days 00:09:26.099224,,,,,MLPClassifier,,,,,,,,,,,,,,relu,lbfgs,4.0,10.0,100.0,10.0,100.0,,,,,,,,,,,COMPLETE,0.0,,,,,,,,,,,,,,,,,,,,
116,116,0.6355572818482755,2023-08-23 20:56:59.439260,2023-08-23 21:06:35.436255,0 days 00:09:35.996995,,,,,MLPClassifier,,,,,,,,,,,,,,relu,lbfgs,4.0,20.0,100.0,10.0,100.0,,,,,,,,,,,COMPLETE,0.0,,,,,,,,,,,,,,,,,,,,
117,117,0.6364245343569483,2023-08-23 20:57:17.777882,2023-08-23 20:57:20.037620,0 days 00:00:02.259738,,0.5,3.0,,LightGBM,,,,,0.4,,,,1.8757705579018102e-07,9.041743670052901e-07,,70.0,,,,,,,,,,24.0,,,,,,,,,COMPLETE,0.0,,,,,,,,,,,,,,,,,,,,
118,118,0.5934884802188799,2023-08-23 20:57:20.138707,2023-08-23 21:06:20.648485,0 days 00:09:00.509778,,,,,MLPClassifier,,,,,,,,,,,,,,relu,lbfgs,4.0,10.0,100.0,100.0,100.0,,,,,,,,,,,COMPLETE,0.0,,,,,,,,,,,,,,,,,,,,
119,119,0.6536322285115641,2023-08-23 21:02:23.120882,2023-08-23 21:02:24.538756,0 days 00:00:01.417874,,0.4,3.0,,LightGBM,,,,,0.4,,,,1.6197545405456525e-07,1.872916144096362e-08,,50.0,,,,,,,,,,2.0,,,,,,,,,COMPLETE,0.0,,,,,,,,,,,,,,,,,,,,
120,120,0.640779406987664,2023-08-23 21:02:24.701073,2023-08-23 21:02:26.737110,0 days 00:00:02.036037,,0.4,3.0,,LightGBM,,,,,0.4,,,,1.5244003576778733e-07,1.8066668361566025e-08,,50.0,,,,,,,,,,10.0,,,,,,,,,COMPLETE,0.0,,,,,,,,,,,,,,,,,,,,
121,121,0.6539464457032325,2023-08-23 21:02:26.837434,2023-08-23 21:02:28.314982,0 days 00:00:01.477548,,0.4,3.0,,LightGBM,,,,,0.4,,,,6.478848307814404e-07,1.9859010024527453e-08,,80.0,,,,,,,,,,2.0,,,,,,,,,COMPLETE,0.0,,,,,,,,,,,,,,,,,,,,
122,122,0.6330599039184287,2023-08-23 21:02:28.460837,2023-08-23 21:02:32.397721,0 days 00:00:03.936884,,0.4,3.0,,LightGBM,,,,,0.4,,,,5.857854082342435e-07,2.1297075915421484e-08,,80.0,,,,,,,,,,70.0,,,,,,,,,COMPLETE,0.0,,,,,,,,,,,,,,,,,,,,
123,123,0.3358178053830228,2023-08-23 21:02:32.501539,2023-08-23 21:03:36.851098,0 days 00:01:04.349559,,,,,MLPClassifier,,,,,,,,,,,,,,relu,sgd,3.0,50.0,10.0,100.0,,,,,,,,,,,,COMPLETE,0.0,,,,,,,,,,,,,,,,,,,,
