,number,value,datetime_start,datetime_complete,duration,params_alpha,params_bagging_fraction,params_bagging_freq,params_booster,params_classifier,params_colsample_bytree,params_dct_criterion,params_dct_max_depth,params_eta,params_feature_fraction,params_gamma,params_grow_policy,params_lambda,params_lambda_l1,params_lambda_l2,params_max_depth,params_min_child_samples,params_min_child_weight,params_mlp_activation,params_mlp_solver,params_n_layers,params_n_units_l_0,params_n_units_l_1,params_n_units_l_2,params_n_units_l_3,params_normalize_type,params_num_leaves,params_rate_drop,params_rf_estimator,params_rf_max_depth,params_sample_type,params_skip_drop,params_subsample,params_svc_c,params_svc_kernel,state,best_trial,dev_acc,dev_recall_macro,dev_precision_macro,dev_f1_macro,dev_recall_0,dev_precision_0,dev_f1_0,dev_recall_1,dev_precision_1,dev_f1_1,test_acc,test_recall_macro,test_precision_macro,test_f1_macro,test_recall_0,test_precision_0,test_f1_0,test_recall_1,test_precision_1,test_f1_1
0,0,0.6828289537950571,2023-08-23 17:57:39.196243,2023-08-23 17:57:54.357684,0 days 00:00:15.161441,,,,,RandomForestClassifier,,,,,,,,,,,,,,,,,,,,,,,,91.0,23.0,,,,,,COMPLETE,0.0,,,,,,,,,,,,,,,,,,,,
1,1,0.6921908573700988,2023-08-23 17:57:39.200502,2023-08-23 17:57:40.537465,0 days 00:00:01.336963,,0.5,1.0,,LightGBM,,,,,0.4,,,,2.226528551125249e-08,0.00012277140560593863,,90.0,,,,,,,,,,53.0,,,,,,,,,COMPLETE,0.0,,,,,,,,,,,,,,,,,,,,
2,2,0.5681202711352558,2023-08-23 17:57:39.204392,2023-08-23 17:59:12.248804,0 days 00:01:33.044412,,,,,MLPClassifier,,,,,,,,,,,,,,logistic,lbfgs,1.0,10.0,,,,,,,,,,,,,,COMPLETE,0.0,,,,,,,,,,,,,,,,,,,,
3,3,0.3573487031700288,2023-08-23 17:57:39.208337,2023-08-23 17:57:52.418180,0 days 00:00:13.209843,,,,,SVC,,,,,,,,,,,,,,,,,,,,,,,,,,,,,0.0015257871692024687,poly,COMPLETE,0.0,,,,,,,,,,,,,,,,,,,,
4,4,0.64662604463393,2023-08-23 17:57:39.211357,2023-08-23 17:57:39.671057,0 days 00:00:00.459700,,,,,DecisionTreeClassifier,,gini,4.0,,,,,,,,,,,,,,,,,,,,,,,,,,,,COMPLETE,0.0,,,,,,,,,,,,,,,,,,,,
5,5,0.6482351944779692,2023-08-23 17:57:39.216085,2023-08-23 17:57:44.184206,0 days 00:00:04.968121,,,,,RandomForestClassifier,,,,,,,,,,,,,,,,,,,,,,,,90.0,3.0,,,,,,COMPLETE,0.0,,,,,,,,,,,,,,,,,,,,
6,6,0.5763653459505994,2023-08-23 17:57:39.221799,2023-08-23 18:07:43.012237,0 days 00:10:03.790438,,,,,MLPClassifier,,,,,,,,,,,,,,tanh,adam,3.0,100.0,30.0,80.0,,,,,,,,,,,,COMPLETE,0.0,,,,,,,,,,,,,,,,,,,,
7,7,0.3573487031700288,2023-08-23 17:57:39.230558,2023-08-23 17:57:52.938424,0 days 00:00:13.707866,,,,,SVC,,,,,,,,,,,,,,,,,,,,,,,,,,,,,0.28877053987587686,rbf,COMPLETE,0.0,,,,,,,,,,,,,,,,,,,,
8,8,0.3573487031700288,2023-08-23 17:57:39.767470,2023-08-23 17:57:40.679623,0 days 00:00:00.912153,3.3134369122710666e-06,,,gblinear,XGBoost,0.3235371541602861,,,,,,,0.011526135092527557,,,,,,,,,,,,,,,,,,,,0.8652971709173014,,,COMPLETE,0.0,,,,,,,,,,,,,,,,,,,,
9,9,0.6473055064082338,2023-08-23 17:57:40.644044,2023-08-23 17:57:41.223764,0 days 00:00:00.579720,4.48457644238922e-05,,,dart,XGBoost,0.2562709594868485,,,4.2262849486968024e-07,,2.535268636014062e-06,lossguide,0.005957513496811968,,,9.0,,5.0,,,,,,,,tree,,0.5467348879769416,,,weighted,1.2054123401947598e-07,0.581254453830504,,,COMPLETE,0.0,,,,,,,,,,,,,,,,,,,,
10,10,0.6782482673810657,2023-08-23 17:57:40.778590,2023-08-23 17:57:42.455744,0 days 00:00:01.677154,,0.9,1.0,,LightGBM,,,,,0.7000000000000001,,,,0.016968500718673896,2.1316240338496757e-08,,60.0,,,,,,,,,,25.0,,,,,,,,,COMPLETE,0.0,,,,,,,,,,,,,,,,,,,,
11,11,0.6486741683229782,2023-08-23 17:57:41.334051,2023-08-23 17:57:42.130736,0 days 00:00:00.796685,,,,,RandomForestClassifier,,,,,,,,,,,,,,,,,,,,,,,,17.0,3.0,,,,,,COMPLETE,0.0,,,,,,,,,,,,,,,,,,,,
12,12,0.669763871958102,2023-08-23 17:57:42.214157,2023-08-23 17:57:43.301950,0 days 00:00:01.087793,4.488848041671419e-08,,,gbtree,XGBoost,0.9809167001008825,,,9.813202233487485e-07,,0.00034197606358361344,depthwise,0.9057463499195683,,,7.0,,3.0,,,,,,,,,,,,,,,0.3924939474481283,,,COMPLETE,0.0,,,,,,,,,,,,,,,,,,,,
13,13,0.3573487031700288,2023-08-23 17:57:42.565840,2023-08-23 17:57:42.679277,0 days 00:00:00.113437,0.965550496045929,,,gblinear,XGBoost,0.740888378175973,,,,,,,1.1595650127207222e-07,,,,,,,,,,,,,,,,,,,,0.5012439818470997,,,COMPLETE,0.0,,,,,,,,,,,,,,,,,,,,
14,14,0.6653713078679648,2023-08-23 17:57:42.793036,2023-08-23 17:57:43.022601,0 days 00:00:00.229565,6.256824865755725e-05,,,dart,XGBoost,0.4022168151083995,,,0.0001754427872961014,,3.311863446168535e-08,lossguide,0.22011981608968736,,,3.0,,6.0,,,,,,,,forest,,1.0349593034417324e-08,,,uniform,0.00013288879958618348,0.20930909792145017,,,COMPLETE,0.0,,,,,,,,,,,,,,,,,,,,
15,15,0.361936416184971,2023-08-23 17:57:43.137723,2023-08-23 17:57:57.474873,0 days 00:00:14.337150,,,,,SVC,,,,,,,,,,,,,,,,,,,,,,,,,,,,,28.417330537314797,rbf,COMPLETE,0.0,,,,,,,,,,,,,,,,,,,,
16,16,0.6748373926583242,2023-08-23 17:57:43.417901,2023-08-23 17:57:50.742308,0 days 00:00:07.324407,,,,,RandomForestClassifier,,,,,,,,,,,,,,,,,,,,,,,,87.0,8.0,,,,,,COMPLETE,0.0,,,,,,,,,,,,,,,,,,,,
17,17,0.5633605358220029,2023-08-23 17:57:44.262749,2023-08-23 18:04:21.421935,0 days 00:06:37.159186,,,,,MLPClassifier,,,,,,,,,,,,,,tanh,adam,3.0,90.0,10.0,30.0,,,,,,,,,,,,COMPLETE,0.0,,,,,,,,,,,,,,,,,,,,
18,18,0.7041982118324301,2023-08-23 17:57:50.831826,2023-08-23 17:57:52.706100,0 days 00:00:01.874274,,0.6000000000000001,1.0,,LightGBM,,,,,0.6000000000000001,,,,1.106527591762147e-08,1.8191684036524144e-06,,80.0,,,,,,,,,,34.0,,,,,,,,,COMPLETE,0.0,,,,,,,,,,,,,,,,,,,,
19,19,0.6917303241925904,2023-08-23 17:57:52.506332,2023-08-23 17:57:53.971463,0 days 00:00:01.465131,,0.6000000000000001,1.0,,LightGBM,,,,,0.6000000000000001,,,,1.055609705816336e-08,2.839467910913475e-06,,80.0,,,,,,,,,,21.0,,,,,,,,,COMPLETE,0.0,,,,,,,,,,,,,,,,,,,,
20,20,0.6761372934053346,2023-08-23 17:57:52.820568,2023-08-23 17:57:54.508735,0 days 00:00:01.688167,,0.5,1.0,,LightGBM,,,,,0.4,,,,1.0531156294368618e-08,0.0001428804417415097,,100.0,,,,,,,,,,51.0,,,,,,,,,COMPLETE,0.0,,,,,,,,,,,,,,,,,,,,
21,21,0.6761372934053346,2023-08-23 17:57:53.093384,2023-08-23 17:57:54.834032,0 days 00:00:01.740648,,0.5,1.0,,LightGBM,,,,,0.4,,,,1.498079628498908e-08,0.00013559833580560453,,100.0,,,,,,,,,,50.0,,,,,,,,,COMPLETE,0.0,,,,,,,,,,,,,,,,,,,,
22,22,0.677829862445247,2023-08-23 17:57:54.040217,2023-08-23 17:57:55.684909,0 days 00:00:01.644692,,0.4,2.0,,LightGBM,,,,,0.4,,,,2.0029272690335052e-08,0.0008810609391207367,,100.0,,,,,,,,,,105.0,,,,,,,,,COMPLETE,0.0,,,,,,,,,,,,,,,,,,,,
23,23,0.593065693430657,2023-08-23 17:57:54.467952,2023-08-23 18:03:06.993478,0 days 00:05:12.525526,,,,,MLPClassifier,,,,,,,,,,,,,,relu,lbfgs,4.0,30.0,40.0,100.0,60.0,,,,,,,,,,,COMPLETE,0.0,,,,,,,,,,,,,,,,,,,,
24,24,0.3573487031700288,2023-08-23 17:57:54.577353,2023-08-23 17:57:59.218052,0 days 00:00:04.640699,,,,,MLPClassifier,,,,,,,,,,,,,,logistic,lbfgs,4.0,40.0,60.0,90.0,50.0,,,,,,,,,,,COMPLETE,0.0,,,,,,,,,,,,,,,,,,,,
25,25,0.5525705421270954,2023-08-23 17:57:54.949736,2023-08-23 18:01:46.926758,0 days 00:03:51.977022,,,,,MLPClassifier,,,,,,,,,,,,,,identity,lbfgs,3.0,100.0,30.0,40.0,,,,,,,,,,,,COMPLETE,0.0,,,,,,,,,,,,,,,,,,,,
26,26,0.6081515947077019,2023-08-23 17:57:55.769936,2023-08-23 18:09:18.970029,0 days 00:11:23.200093,,,,,MLPClassifier,,,,,,,,,,,,,,relu,adam,2.0,20.0,10.0,,,,,,,,,,,,,COMPLETE,0.0,,,,,,,,,,,,,,,,,,,,
27,27,0.3573487031700288,2023-08-23 17:57:57.560072,2023-08-23 17:58:00.167733,0 days 00:00:02.607661,,,,,MLPClassifier,,,,,,,,,,,,,,logistic,lbfgs,2.0,10.0,100.0,,,,,,,,,,,,,COMPLETE,0.0,,,,,,,,,,,,,,,,,,,,
28,28,0.6797078180223343,2023-08-23 17:57:59.336014,2023-08-23 17:57:59.992225,0 days 00:00:00.656211,,0.7000000000000001,1.0,,LightGBM,,,,,0.6000000000000001,,,,7.912612563284678e-07,1.2462212286967157e-06,,70.0,,,,,,,,,,8.0,,,,,,,,,COMPLETE,0.0,,,,,,,,,,,,,,,,,,,,
29,29,0.6794990247407864,2023-08-23 17:58:00.059422,2023-08-23 17:58:03.144470,0 days 00:00:03.085048,,0.6000000000000001,2.0,,LightGBM,,,,,1.0,,,,3.1097956935147836e-06,1.4678428955166389e-06,,70.0,,,,,,,,,,195.0,,,,,,,,,COMPLETE,0.0,,,,,,,,,,,,,,,,,,,,
30,30,0.6794990247407864,2023-08-23 17:58:00.267214,2023-08-23 17:58:03.292190,0 days 00:00:03.024976,,0.6000000000000001,2.0,,LightGBM,,,,,1.0,,,,1.501481521426951e-06,2.693222166587403e-06,,70.0,,,,,,,,,,240.0,,,,,,,,,COMPLETE,0.0,,,,,,,,,,,,,,,,,,,,
31,31,0.676585931444458,2023-08-23 17:58:03.220874,2023-08-23 17:58:07.440578,0 days 00:00:04.219704,,0.7000000000000001,1.0,,LightGBM,,,,,0.6000000000000001,,,,5.402539849804346e-07,0.030933846439649044,,20.0,,,,,,,,,,95.0,,,,,,,,,COMPLETE,0.0,,,,,,,,,,,,,,,,,,,,
32,32,0.6005597537083683,2023-08-23 17:58:03.371334,2023-08-23 17:58:04.994001,0 days 00:00:01.622667,,,,,DecisionTreeClassifier,,entropy,31.0,,,,,,,,,,,,,,,,,,,,,,,,,,,,COMPLETE,0.0,,,,,,,,,,,,,,,,,,,,
33,33,0.7038250651569986,2023-08-23 17:58:05.072750,2023-08-23 17:58:09.916528,0 days 00:00:04.843778,,0.7000000000000001,1.0,,LightGBM,,,,,0.6000000000000001,,,,1.0621113384067968e-08,0.3364995377039446,,20.0,,,,,,,,,,96.0,,,,,,,,,COMPLETE,0.0,,,,,,,,,,,,,,,,,,,,
34,34,0.6852601865488464,2023-08-23 17:58:07.524948,2023-08-23 17:58:09.807417,0 days 00:00:02.282469,,0.6000000000000001,3.0,,LightGBM,,,,,0.6000000000000001,,,,1.173654656101005e-08,5.5274621603672514e-06,,80.0,,,,,,,,,,67.0,,,,,,,,,COMPLETE,0.0,,,,,,,,,,,,,,,,,,,,
35,35,0.677592711453889,2023-08-23 17:58:09.897082,2023-08-23 17:58:10.621947,0 days 00:00:00.724865,,0.8,1.0,,LightGBM,,,,,0.8,,,,0.00020887001938127536,2.3422000861246387e-05,,80.0,,,,,,,,,,2.0,,,,,,,,,COMPLETE,0.0,,,,,,,,,,,,,,,,,,,,
36,36,0.6913447342519685,2023-08-23 17:58:10.009003,2023-08-23 17:58:16.298074,0 days 00:00:06.289071,,0.8,1.0,,LightGBM,,,,,0.8,,,,0.00021379791986455248,0.18743874249644035,,30.0,,,,,,,,,,153.0,,,,,,,,,COMPLETE,0.0,,,,,,,,,,,,,,,,,,,,
37,37,0.3596554199569275,2023-08-23 17:58:10.816585,2023-08-23 17:59:17.163404,0 days 00:01:06.346819,,,,,MLPClassifier,,,,,,,,,,,,,,identity,sgd,1.0,100.0,,,,,,,,,,,,,,COMPLETE,0.0,,,,,,,,,,,,,,,,,,,,
38,38,0.6908649827737345,2023-08-23 17:58:16.389457,2023-08-23 17:58:19.721937,0 days 00:00:03.332480,,0.5,1.0,,LightGBM,,,,,0.5,,,,5.216804734233318e-08,0.6704221558753687,,40.0,,,,,,,,,,73.0,,,,,,,,,COMPLETE,0.0,,,,,,,,,,,,,,,,,,,,
39,39,0.6761372934053346,2023-08-23 17:58:19.793681,2023-08-23 17:58:21.680729,0 days 00:00:01.887048,,0.6000000000000001,1.0,,LightGBM,,,,,0.5,,,,1.4736088013109802e-07,0.0027212569900259345,,90.0,,,,,,,,,,37.0,,,,,,,,,COMPLETE,0.0,,,,,,,,,,,,,,,,,,,,
40,40,0.6658607185424825,2023-08-23 17:58:21.777396,2023-08-23 17:58:22.145504,0 days 00:00:00.368108,,,,,DecisionTreeClassifier,,log_loss,2.0,,,,,,,,,,,,,,,,,,,,,,,,,,,,COMPLETE,0.0,,,,,,,,,,,,,,,,,,,,
41,41,0.5653608821518215,2023-08-23 17:58:22.226003,2023-08-23 18:03:28.121413,0 days 00:05:05.895410,,,,,MLPClassifier,,,,,,,,,,,,,,tanh,adam,1.0,100.0,,,,,,,,,,,,,,COMPLETE,0.0,,,,,,,,,,,,,,,,,,,,
42,42,0.6731904159480585,2023-08-23 17:59:12.387556,2023-08-23 17:59:14.806163,0 days 00:00:02.418607,,0.4,1.0,,LightGBM,,,,,0.7000000000000001,,,,1.2186020850367757e-07,0.008868495913143183,,50.0,,,,,,,,,,129.0,,,,,,,,,COMPLETE,0.0,,,,,,,,,,,,,,,,,,,,
43,43,0.48194067444305866,2023-08-23 17:59:14.896705,2023-08-23 17:59:38.325645,0 days 00:00:23.428940,,,,,SVC,,,,,,,,,,,,,,,,,,,,,,,,,,,,,838.8123889648379,linear,COMPLETE,0.0,,,,,,,,,,,,,,,,,,,,
44,44,0.48584603560906875,2023-08-23 17:59:17.372464,2023-08-23 17:59:36.922064,0 days 00:00:19.549600,,,,,SVC,,,,,,,,,,,,,,,,,,,,,,,,,,,,,490.012817991525,linear,COMPLETE,0.0,,,,,,,,,,,,,,,,,,,,
45,45,0.6620450961518769,2023-08-23 17:59:36.993879,2023-08-23 17:59:41.524916,0 days 00:00:04.531037,,0.7000000000000001,2.0,,LightGBM,,,,,0.5,,,,1.1283298710510616e-07,1.9117064114939592e-07,,10.0,,,,,,,,,,86.0,,,,,,,,,COMPLETE,0.0,,,,,,,,,,,,,,,,,,,,
46,46,0.6826165088638065,2023-08-23 17:59:38.415876,2023-08-23 17:59:43.160666,0 days 00:00:04.744790,,0.7000000000000001,2.0,,LightGBM,,,,,0.5,,,,1.0187474516556392e-08,0.057463990064597306,,10.0,,,,,,,,,,94.0,,,,,,,,,COMPLETE,0.0,,,,,,,,,,,,,,,,,,,,
47,47,0.6039375408667658,2023-08-23 17:59:41.632766,2023-08-23 17:59:43.490755,0 days 00:00:01.857989,,,,,DecisionTreeClassifier,,entropy,12.0,,,,,,,,,,,,,,,,,,,,,,,,,,,,COMPLETE,0.0,,,,,,,,,,,,,,,,,,,,
48,48,0.6827896743162689,2023-08-23 17:59:43.333222,2023-08-23 17:59:49.998302,0 days 00:00:06.665080,,0.8,1.0,,LightGBM,,,,,0.8,,,,8.62638466804134e-05,0.9241523122154857,,30.0,,,,,,,,,,173.0,,,,,,,,,COMPLETE,0.0,,,,,,,,,,,,,,,,,,,,
49,49,0.7078926497300893,2023-08-23 17:59:43.639073,2023-08-23 17:59:50.222592,0 days 00:00:06.583519,,0.8,1.0,,LightGBM,,,,,0.8,,,,4.520558554468282e-05,0.556479568183873,,30.0,,,,,,,,,,165.0,,,,,,,,,COMPLETE,0.0,,,,,,,,,,,,,,,,,,,,
50,50,0.6528702730447352,2023-08-23 17:59:50.167254,2023-08-23 17:59:52.138764,0 days 00:00:01.971510,,,,,RandomForestClassifier,,,,,,,,,,,,,,,,,,,,,,,,11.0,32.0,,,,,,COMPLETE,0.0,,,,,,,,,,,,,,,,,,,,
51,51,0.647337901950448,2023-08-23 17:59:50.306084,2023-08-23 17:59:52.753039,0 days 00:00:02.446955,,,,,RandomForestClassifier,,,,,,,,,,,,,,,,,,,,,,,,16.0,31.0,,,,,,COMPLETE,0.0,,,,,,,,,,,,,,,,,,,,
52,52,0.6869873710594814,2023-08-23 17:59:52.273259,2023-08-23 17:59:54.095506,0 days 00:00:01.822247,,1.0,1.0,,LightGBM,,,,,0.6000000000000001,,,,8.20226579167995e-08,0.11250720211130057,,90.0,,,,,,,,,,29.0,,,,,,,,,COMPLETE,0.0,,,,,,,,,,,,,,,,,,,,
53,53,0.6788715432363699,2023-08-23 17:59:52.837731,2023-08-23 17:59:54.659156,0 days 00:00:01.821425,,0.6000000000000001,1.0,,LightGBM,,,,,0.6000000000000001,,,,8.041827827498624e-08,0.09139972165240669,,90.0,,,,,,,,,,33.0,,,,,,,,,COMPLETE,0.0,,,,,,,,,,,,,,,,,,,,
54,54,0.6811571550282818,2023-08-23 17:59:54.197668,2023-08-23 17:59:56.783173,0 days 00:00:02.585505,,0.6000000000000001,1.0,,LightGBM,,,,,0.9,,,,5.6069325622378076e-08,2.5262057002803505e-05,,80.0,,,,,,,,,,123.0,,,,,,,,,COMPLETE,0.0,,,,,,,,,,,,,,,,,,,,
55,55,0.6915392300007686,2023-08-23 17:59:54.746605,2023-08-23 17:59:59.793031,0 days 00:00:05.046426,,0.5,3.0,,LightGBM,,,,,0.9,,,,1.0117681696104235e-08,1.3657901584132583e-05,,30.0,,,,,,,,,,123.0,,,,,,,,,COMPLETE,0.0,,,,,,,,,,,,,,,,,,,,
56,56,0.6797078180223343,2023-08-23 17:59:56.849567,2023-08-23 17:59:57.584223,0 days 00:00:00.734656,0.07353686909800117,,,gbtree,XGBoost,0.5750271886102015,,,0.5948956535056855,,0.3396199242556539,depthwise,2.7719130983879317e-06,,,3.0,,10.0,,,,,,,,,,,,,,,0.9185992420787723,,,COMPLETE,0.0,,,,,,,,,,,,,,,,,,,,
57,57,0.6831657867703802,2023-08-23 17:59:57.731712,2023-08-23 18:00:01.079203,0 days 00:00:03.347491,,0.5,3.0,,LightGBM,,,,,0.7000000000000001,,,,3.341483956357197e-07,0.0006484849190151953,,20.0,,,,,,,,,,59.0,,,,,,,,,COMPLETE,0.0,,,,,,,,,,,,,,,,,,,,
58,58,0.6915392300007686,2023-08-23 17:59:59.883957,2023-08-23 18:00:05.079863,0 days 00:00:05.195906,,0.5,3.0,,LightGBM,,,,,0.9,,,,1.1273466898618025e-08,1.0760393944296913e-05,,30.0,,,,,,,,,,142.0,,,,,,,,,COMPLETE,0.0,,,,,,,,,,,,,,,,,,,,
59,59,0.6915392300007686,2023-08-23 18:00:01.158227,2023-08-23 18:00:06.142999,0 days 00:00:04.984772,,0.5,3.0,,LightGBM,,,,,0.9,,,,3.3010483817929703e-08,1.4159293741838285e-05,,30.0,,,,,,,,,,141.0,,,,,,,,,COMPLETE,0.0,,,,,,,,,,,,,,,,,,,,
60,60,0.6913609942387763,2023-08-23 18:00:05.184568,2023-08-23 18:00:11.301629,0 days 00:00:06.117061,,0.8,1.0,,LightGBM,,,,,0.9,,,,4.384858344601855e-08,4.635041611775679e-05,,40.0,,,,,,,,,,174.0,,,,,,,,,COMPLETE,0.0,,,,,,,,,,,,,,,,,,,,
61,61,0.6828248404680368,2023-08-23 18:00:06.216145,2023-08-23 18:00:13.808529,0 days 00:00:07.592384,,0.8,1.0,,LightGBM,,,,,0.8,,,,3.0044834524091606e-08,0.009477066982690213,,20.0,,,,,,,,,,179.0,,,,,,,,,COMPLETE,0.0,,,,,,,,,,,,,,,,,,,,
62,62,0.6121519178781405,2023-08-23 18:00:11.380980,2023-08-23 18:04:50.805957,0 days 00:04:39.424977,,,,,MLPClassifier,,,,,,,,,,,,,,tanh,adam,4.0,100.0,10.0,10.0,100.0,,,,,,,,,,,COMPLETE,0.0,,,,,,,,,,,,,,,,,,,,
63,63,0.6684459601862318,2023-08-23 18:00:13.889079,2023-08-23 18:00:16.751175,0 days 00:00:02.862096,,0.4,1.0,,LightGBM,,,,,0.7000000000000001,,,,2.2654069800589313e-07,0.43978283877959123,,40.0,,,,,,,,,,111.0,,,,,,,,,COMPLETE,0.0,,,,,,,,,,,,,,,,,,,,
64,64,0.5807063033556232,2023-08-23 18:00:16.932398,2023-08-23 18:07:28.506713,0 days 00:07:11.574315,,,,,MLPClassifier,,,,,,,,,,,,,,tanh,adam,4.0,80.0,10.0,10.0,100.0,,,,,,,,,,,COMPLETE,0.0,,,,,,,,,,,,,,,,,,,,
65,65,0.3573487031700288,2023-08-23 18:01:47.044302,2023-08-23 18:01:53.792417,0 days 00:00:06.748115,,,,,SVC,,,,,,,,,,,,,,,,,,,,,,,,,,,,,0.18858402834266338,poly,COMPLETE,0.0,,,,,,,,,,,,,,,,,,,,
66,66,0.644522286526551,2023-08-23 18:01:53.873488,2023-08-23 18:01:54.924994,0 days 00:00:01.051506,0.005171201460162807,,,dart,XGBoost,0.9571559655761538,,,0.8487406137455867,,0.959449155424388,depthwise,1.564177661513732e-08,,,9.0,,10.0,,,,,,,,tree,,8.291614434933965e-05,,,weighted,0.18124986496652104,0.7527718685143602,,,COMPLETE,0.0,,,,,,,,,,,,,,,,,,,,
67,67,0.697345660755189,2023-08-23 18:01:54.994190,2023-08-23 18:01:57.065074,0 days 00:00:02.070884,,0.9,1.0,,LightGBM,,,,,0.7000000000000001,,,,0.13185251851798557,3.6774310428486027e-07,,50.0,,,,,,,,,,16.0,,,,,,,,,COMPLETE,0.0,,,,,,,,,,,,,,,,,,,,
68,68,0.7017903891949164,2023-08-23 18:01:57.225273,2023-08-23 18:01:58.880067,0 days 00:00:01.654794,,0.9,1.0,,LightGBM,,,,,0.7000000000000001,,,,0.017053600913647726,1.8755103459757796e-07,,50.0,,,,,,,,,,19.0,,,,,,,,,COMPLETE,0.0,,,,,,,,,,,,,,,,,,,,
69,69,0.6927772933703616,2023-08-23 18:01:58.975041,2023-08-23 18:02:00.699365,0 days 00:00:01.724324,,0.9,1.0,,LightGBM,,,,,0.7000000000000001,,,,0.21252326638179314,1.291222997170805e-07,,60.0,,,,,,,,,,17.0,,,,,,,,,COMPLETE,0.0,,,,,,,,,,,,,,,,,,,,
70,70,0.6915392300007686,2023-08-23 18:02:00.774637,2023-08-23 18:02:02.524414,0 days 00:00:01.749777,,0.9,1.0,,LightGBM,,,,,0.7000000000000001,,,,0.20431138945111424,1.1939140095642406e-07,,60.0,,,,,,,,,,16.0,,,,,,,,,COMPLETE,0.0,,,,,,,,,,,,,,,,,,,,
71,71,0.6806987399770905,2023-08-23 18:02:02.597098,2023-08-23 18:02:05.131648,0 days 00:00:02.534550,,0.9,1.0,,LightGBM,,,,,0.7000000000000001,,,,0.1391516804508104,2.1564390253116797e-08,,50.0,,,,,,,,,,42.0,,,,,,,,,COMPLETE,0.0,,,,,,,,,,,,,,,,,,,,
72,72,0.6371556269645442,2023-08-23 18:02:05.208255,2023-08-23 18:09:18.867159,0 days 00:07:13.658904,,,,,MLPClassifier,,,,,,,,,,,,,,relu,adam,4.0,60.0,10.0,10.0,100.0,,,,,,,,,,,COMPLETE,0.0,,,,,,,,,,,,,,,,,,,,
73,73,0.6123229570625022,2023-08-23 18:03:07.086460,2023-08-23 18:03:08.718131,0 days 00:00:01.631671,,,,,RandomForestClassifier,,,,,,,,,,,,,,,,,,,,,,,,48.0,2.0,,,,,,COMPLETE,0.0,,,,,,,,,,,,,,,,,,,,
74,74,0.6927772933703616,2023-08-23 18:03:08.780694,2023-08-23 18:03:11.345029,0 days 00:00:02.564335,,1.0,1.0,,LightGBM,,,,,0.8,,,,0.622541617732307,4.3946172734550385e-07,,50.0,,,,,,,,,,25.0,,,,,,,,,COMPLETE,0.0,,,,,,,,,,,,,,,,,,,,
75,75,0.683655427631579,2023-08-23 18:03:11.417390,2023-08-23 18:03:13.379167,0 days 00:00:01.961777,,1.0,1.0,,LightGBM,,,,,0.8,,,,0.9716025365531444,7.352512201666761e-07,,60.0,,,,,,,,,,22.0,,,,,,,,,COMPLETE,0.0,,,,,,,,,,,,,,,,,,,,
76,76,0.6658607185424825,2023-08-23 18:03:13.433737,2023-08-23 18:03:13.674533,0 days 00:00:00.240796,,,,,DecisionTreeClassifier,,log_loss,2.0,,,,,,,,,,,,,,,,,,,,,,,,,,,,COMPLETE,0.0,,,,,,,,,,,,,,,,,,,,
77,77,0.6892805038722324,2023-08-23 18:03:13.742553,2023-08-23 18:03:15.388351,0 days 00:00:01.645798,,0.9,1.0,,LightGBM,,,,,0.8,,,,0.023629142187640246,3.187878283671945e-07,,50.0,,,,,,,,,,12.0,,,,,,,,,COMPLETE,0.0,,,,,,,,,,,,,,,,,,,,
78,78,0.6747037439395626,2023-08-23 18:03:15.456759,2023-08-23 18:03:18.221037,0 days 00:00:02.764278,,1.0,1.0,,LightGBM,,,,,0.7000000000000001,,,,0.07805552421055408,8.13001908636167e-08,,50.0,,,,,,,,,,50.0,,,,,,,,,COMPLETE,0.0,,,,,,,,,,,,,,,,,,,,
79,79,0.6834427668201939,2023-08-23 18:03:18.320808,2023-08-23 18:03:19.923655,0 days 00:00:01.602847,,0.9,1.0,,LightGBM,,,,,0.7000000000000001,,,,0.5358805086131119,4.769729443607118e-07,,60.0,,,,,,,,,,23.0,,,,,,,,,COMPLETE,0.0,,,,,,,,,,,,,,,,,,,,
80,80,0.6882401315789474,2023-08-23 18:03:19.990064,2023-08-23 18:03:21.917132,0 days 00:00:01.927068,,1.0,1.0,,LightGBM,,,,,0.4,,,,0.030667789539292736,8.530424744295382e-07,,40.0,,,,,,,,,,43.0,,,,,,,,,COMPLETE,0.0,,,,,,,,,,,,,,,,,,,,
81,81,0.6157922398156966,2023-08-23 18:03:21.973832,2023-08-23 18:08:20.918143,0 days 00:04:58.944311,,,,,MLPClassifier,,,,,,,,,,,,,,tanh,adam,2.0,70.0,10.0,,,,,,,,,,,,,COMPLETE,0.0,,,,,,,,,,,,,,,,,,,,
82,82,0.6846055375467139,2023-08-23 18:03:28.208290,2023-08-23 18:03:28.947451,0 days 00:00:00.739161,,0.9,1.0,,LightGBM,,,,,0.7000000000000001,,,,0.00791096820838814,3.00926097735456e-06,,70.0,,,,,,,,,,3.0,,,,,,,,,COMPLETE,0.0,,,,,,,,,,,,,,,,,,,,
83,83,0.6840776101016321,2023-08-23 18:03:29.004422,2023-08-23 18:03:30.653345,0 days 00:00:01.648923,,0.9,1.0,,LightGBM,,,,,0.6000000000000001,,,,0.35334639406131685,2.815375221282192e-07,,50.0,,,,,,,,,,26.0,,,,,,,,,COMPLETE,0.0,,,,,,,,,,,,,,,,,,,,
