,number,value,datetime_start,datetime_complete,duration,params_alpha,params_bagging_fraction,params_bagging_freq,params_booster,params_classifier,params_colsample_bytree,params_dct_criterion,params_dct_max_depth,params_eta,params_feature_fraction,params_gamma,params_grow_policy,params_lambda,params_lambda_l1,params_lambda_l2,params_max_depth,params_min_child_samples,params_min_child_weight,params_mlp_activation,params_mlp_solver,params_n_layers,params_n_units_l_0,params_n_units_l_1,params_n_units_l_2,params_n_units_l_3,params_normalize_type,params_num_leaves,params_rate_drop,params_rf_estimator,params_rf_max_depth,params_sample_type,params_skip_drop,params_subsample,params_svc_c,params_svc_kernel,state,best_trial,dev_acc,dev_recall_macro,dev_precision_macro,dev_f1_macro,dev_recall_0,dev_precision_0,dev_f1_0,dev_recall_1,dev_precision_1,dev_f1_1,test_acc,test_recall_macro,test_precision_macro,test_f1_macro,test_recall_0,test_precision_0,test_f1_0,test_recall_1,test_precision_1,test_f1_1
0,0,0.5168408826945412,2023-08-23 12:36:30.449328,2023-08-23 12:36:30.708626,0 days 00:00:00.259298,,,,,DecisionTreeClassifier,,entropy,22.0,,,,,,,,,,,,,,,,,,,,,,,,,,,,COMPLETE,0.0,,,,,,,,,,,,,,,,,,,,
1,1,0.4871794871794872,2023-08-23 12:36:30.450799,2023-08-23 12:36:30.564927,0 days 00:00:00.114128,,,,,SVC,,,,,,,,,,,,,,,,,,,,,,,,,,,,,214274163.59717795,poly,COMPLETE,0.0,,,,,,,,,,,,,,,,,,,,
2,2,0.6142355889724311,2023-08-23 12:36:30.452949,2023-08-23 12:36:31.283981,0 days 00:00:00.831032,,1.0,2.0,,LightGBM,,,,,1.0,,,,3.094602848532168e-05,7.83632616462209e-08,,90.0,,,,,,,,,,105.0,,,,,,,,,COMPLETE,0.0,,,,,,,,,,,,,,,,,,,,
3,3,0.6285714285714286,2023-08-23 12:36:30.457567,2023-08-23 12:36:30.783328,0 days 00:00:00.325761,0.00020321935856596295,,,dart,XGBoost,0.6055240278588712,,,0.0028948667635242432,,0.4027564346105389,lossguide,0.02700905783504084,,,5.0,,6.0,,,,,,,,forest,,1.1865661465432969e-05,,,weighted,0.021211603546675787,0.8252351280383279,,,COMPLETE,0.0,,,,,,,,,,,,,,,,,,,,
4,4,0.3696969696969697,2023-08-23 12:36:30.462139,2023-08-23 12:36:30.493575,0 days 00:00:00.031436,2.4480742998382237e-05,,,gblinear,XGBoost,0.4346469036561156,,,,,,,0.07613170508112976,,,,,,,,,,,,,,,,,,,,0.5967080892340801,,,COMPLETE,0.0,,,,,,,,,,,,,,,,,,,,
5,5,0.3696969696969697,2023-08-23 12:36:30.465043,2023-08-23 12:36:30.609398,0 days 00:00:00.144355,,,,,SVC,,,,,,,,,,,,,,,,,,,,,,,,,,,,,0.00208984630942547,poly,COMPLETE,0.0,,,,,,,,,,,,,,,,,,,,
6,6,0.3696969696969697,2023-08-23 12:36:30.465920,2023-08-23 12:36:30.608745,0 days 00:00:00.142825,5.1176223620290693e-05,,,gblinear,XGBoost,0.44741723029924246,,,,,,,0.45798499148253013,,,,,,,,,,,,,,,,,,,,0.8207849904452684,,,COMPLETE,0.0,,,,,,,,,,,,,,,,,,,,
7,7,0.5933834586466165,2023-08-23 12:36:30.470683,2023-08-23 12:36:31.386520,0 days 00:00:00.915837,,0.7000000000000001,2.0,,LightGBM,,,,,0.6000000000000001,,,,0.06117622125506227,0.1250438527462437,,70.0,,,,,,,,,,105.0,,,,,,,,,COMPLETE,0.0,,,,,,,,,,,,,,,,,,,,
8,8,0.6257575757575758,2023-08-23 12:36:30.556645,2023-08-23 12:36:30.834359,0 days 00:00:00.277714,,,,,DecisionTreeClassifier,,gini,10.0,,,,,,,,,,,,,,,,,,,,,,,,,,,,COMPLETE,0.0,,,,,,,,,,,,,,,,,,,,
9,9,0.5360364826013682,2023-08-23 12:36:30.694238,2023-08-23 12:36:30.885964,0 days 00:00:00.191726,,,,,DecisionTreeClassifier,,entropy,12.0,,,,,,,,,,,,,,,,,,,,,,,,,,,,COMPLETE,0.0,,,,,,,,,,,,,,,,,,,,
10,10,0.6102564102564102,2023-08-23 12:36:30.699626,2023-08-23 12:36:31.709550,0 days 00:00:01.009924,,0.7000000000000001,3.0,,LightGBM,,,,,0.7000000000000001,,,,0.0027195232532208147,3.334094653813454e-07,,30.0,,,,,,,,,,51.0,,,,,,,,,COMPLETE,0.0,,,,,,,,,,,,,,,,,,,,
11,11,0.5772776841479133,2023-08-23 12:36:30.703641,2023-08-23 12:36:33.871126,0 days 00:00:03.167485,,,,,RandomForestClassifier,,,,,,,,,,,,,,,,,,,,,,,,82.0,21.0,,,,,,COMPLETE,0.0,,,,,,,,,,,,,,,,,,,,
12,12,0.3696969696969697,2023-08-23 12:36:30.752197,2023-08-23 12:36:32.182818,0 days 00:00:01.430621,,,,,MLPClassifier,,,,,,,,,,,,,,logistic,lbfgs,3.0,80.0,50.0,70.0,,,,,,,,,,,,COMPLETE,0.0,,,,,,,,,,,,,,,,,,,,
13,13,0.3696969696969697,2023-08-23 12:36:30.830966,2023-08-23 12:36:32.240164,0 days 00:00:01.409198,,,,,MLPClassifier,,,,,,,,,,,,,,identity,adam,1.0,10.0,,,,,,,,,,,,,,COMPLETE,0.0,,,,,,,,,,,,,,,,,,,,
14,14,0.3696969696969697,2023-08-23 12:36:30.952675,2023-08-23 12:36:38.149091,0 days 00:00:07.196416,,,,,MLPClassifier,,,,,,,,,,,,,,logistic,adam,2.0,40.0,50.0,,,,,,,,,,,,,COMPLETE,0.0,,,,,,,,,,,,,,,,,,,,
15,15,0.5516791979949874,2023-08-23 12:36:30.965034,2023-08-23 12:36:31.065806,0 days 00:00:00.100772,,,,,DecisionTreeClassifier,,log_loss,3.0,,,,,,,,,,,,,,,,,,,,,,,,,,,,COMPLETE,0.0,,,,,,,,,,,,,,,,,,,,
16,16,0.4674659672786311,2023-08-23 12:36:31.132900,2023-08-23 12:36:35.982044,0 days 00:00:04.849144,,,,,SVC,,,,,,,,,,,,,,,,,,,,,,,,,,,,,110319.52639395541,linear,COMPLETE,0.0,,,,,,,,,,,,,,,,,,,,
17,17,0.3696969696969697,2023-08-23 12:36:31.384449,2023-08-23 12:36:32.097671,0 days 00:00:00.713222,,,,,MLPClassifier,,,,,,,,,,,,,,identity,sgd,1.0,10.0,,,,,,,,,,,,,,COMPLETE,0.0,,,,,,,,,,,,,,,,,,,,
18,18,0.5634114007954043,2023-08-23 12:36:31.478704,2023-08-23 12:36:32.817811,0 days 00:00:01.339107,,,,,RandomForestClassifier,,,,,,,,,,,,,,,,,,,,,,,,62.0,3.0,,,,,,COMPLETE,0.0,,,,,,,,,,,,,,,,,,,,
19,19,0.5734375,2023-08-23 12:36:31.796119,2023-08-23 12:36:33.574572,0 days 00:00:01.778453,,,,,RandomForestClassifier,,,,,,,,,,,,,,,,,,,,,,,,52.0,16.0,,,,,,COMPLETE,0.0,,,,,,,,,,,,,,,,,,,,
20,20,0.5529220401998374,2023-08-23 12:36:32.155894,2023-08-23 12:36:33.983039,0 days 00:00:01.827145,,,,,RandomForestClassifier,,,,,,,,,,,,,,,,,,,,,,,,79.0,2.0,,,,,,COMPLETE,0.0,,,,,,,,,,,,,,,,,,,,
21,21,0.6339544513457558,2023-08-23 12:36:32.300244,2023-08-23 12:36:36.425829,0 days 00:00:04.125585,,,,,RandomForestClassifier,,,,,,,,,,,,,,,,,,,,,,,,88.0,8.0,,,,,,COMPLETE,0.0,,,,,,,,,,,,,,,,,,,,
22,22,0.663232263762143,2023-08-23 12:36:32.302277,2023-08-23 12:36:32.679005,0 days 00:00:00.376728,,,,,RandomForestClassifier,,,,,,,,,,,,,,,,,,,,,,,,15.0,21.0,,,,,,COMPLETE,0.0,,,,,,,,,,,,,,,,,,,,
23,23,0.617033330186007,2023-08-23 12:36:32.753697,2023-08-23 12:36:33.089852,0 days 00:00:00.336155,,,,,RandomForestClassifier,,,,,,,,,,,,,,,,,,,,,,,,10.0,23.0,,,,,,COMPLETE,0.0,,,,,,,,,,,,,,,,,,,,
24,24,0.5836828059473884,2023-08-23 12:36:32.896927,2023-08-23 12:36:33.470796,0 days 00:00:00.573869,,,,,RandomForestClassifier,,,,,,,,,,,,,,,,,,,,,,,,18.0,31.0,,,,,,COMPLETE,0.0,,,,,,,,,,,,,,,,,,,,
25,25,0.6020017662643509,2023-08-23 12:36:33.204515,2023-08-23 12:36:34.077916,0 days 00:00:00.873401,,,,,RandomForestClassifier,,,,,,,,,,,,,,,,,,,,,,,,11.0,27.0,,,,,,COMPLETE,0.0,,,,,,,,,,,,,,,,,,,,
26,26,0.5987905327911583,2023-08-23 12:36:33.659874,2023-08-23 12:36:34.461555,0 days 00:00:00.801681,0.6312542020739904,,,dart,XGBoost,0.8778076065210627,,,0.00403288927694878,,0.9342790922910088,lossguide,4.0261403945144825e-08,,,5.0,,6.0,,,,,,,,forest,,8.61419087894723e-06,,,weighted,0.02703544826260304,0.9524307041566333,,,COMPLETE,0.0,,,,,,,,,,,,,,,,,,,,
27,27,0.5771035345636535,2023-08-23 12:36:33.660941,2023-08-23 12:36:34.344001,0 days 00:00:00.683060,0.8974866009061931,,,dart,XGBoost,0.8577707805439247,,,0.0033587196279781318,,0.7347110875437645,lossguide,1.0822158172671937e-07,,,5.0,,6.0,,,,,,,,forest,,1.0264237768267037e-05,,,weighted,0.022745745779486456,0.9626290517740457,,,COMPLETE,0.0,,,,,,,,,,,,,,,,,,,,
28,28,0.5486397798242829,2023-08-23 12:36:33.973129,2023-08-23 12:36:34.861271,0 days 00:00:00.888142,0.1644271085734867,,,dart,XGBoost,0.843989047828104,,,0.004636639656395064,,0.4691314487343108,lossguide,2.93164892359578e-08,,,5.0,,6.0,,,,,,,,forest,,7.178427256503416e-06,,,weighted,0.046412837439318344,0.9750418324126522,,,COMPLETE,0.0,,,,,,,,,,,,,,,,,,,,
29,29,0.5630252100840336,2023-08-23 12:36:34.071582,2023-08-23 12:36:35.165151,0 days 00:00:01.093569,0.20720491309902545,,,dart,XGBoost,0.9041984729316617,,,0.00330734458333681,,0.8556177071703871,lossguide,3.4068347598069806e-08,,,5.0,,6.0,,,,,,,,forest,,8.063705356966487e-06,,,weighted,0.04213432027903713,0.9648128568753007,,,COMPLETE,0.0,,,,,,,,,,,,,,,,,,,,
30,30,0.5771035345636535,2023-08-23 12:36:34.164754,2023-08-23 12:36:34.999898,0 days 00:00:00.835144,0.5095799046985927,,,dart,XGBoost,0.8829855351848261,,,0.003874375659365508,,0.6733645750444535,lossguide,4.2453209985683235e-08,,,5.0,,6.0,,,,,,,,forest,,1.0322736502498773e-05,,,weighted,0.038703842847001374,0.20538478466936821,,,COMPLETE,0.0,,,,,,,,,,,,,,,,,,,,
31,31,0.5751876128051677,2023-08-23 12:36:34.445632,2023-08-23 12:36:34.657890,0 days 00:00:00.212258,,,,,DecisionTreeClassifier,,gini,6.0,,,,,,,,,,,,,,,,,,,,,,,,,,,,COMPLETE,0.0,,,,,,,,,,,,,,,,,,,,
32,32,0.5863636363636363,2023-08-23 12:36:34.543648,2023-08-23 12:36:34.756592,0 days 00:00:00.212944,,,,,DecisionTreeClassifier,,gini,6.0,,,,,,,,,,,,,,,,,,,,,,,,,,,,COMPLETE,0.0,,,,,,,,,,,,,,,,,,,,
33,33,0.5203611029339613,2023-08-23 12:36:34.732108,2023-08-23 12:36:35.741689,0 days 00:00:01.009581,1.0538851680385945e-08,,,gbtree,XGBoost,0.21395168839041878,,,7.168757514243287e-08,,1.170784714959325e-08,depthwise,0.0008241986840151559,,,9.0,,2.0,,,,,,,,,,,,,,,0.2507329473826747,,,COMPLETE,0.0,,,,,,,,,,,,,,,,,,,,
34,34,0.5339308578745199,2023-08-23 12:36:34.849753,2023-08-23 12:36:35.807623,0 days 00:00:00.957870,1.786002150237654e-08,,,gbtree,XGBoost,0.2045218301027757,,,1.2624794543531222e-07,,1.789230879442568e-08,depthwise,0.0009846350105889897,,,9.0,,2.0,,,,,,,,,,,,,,,0.22521686544340863,,,COMPLETE,0.0,,,,,,,,,,,,,,,,,,,,
35,35,0.3696969696969697,2023-08-23 12:36:34.957486,2023-08-23 12:36:35.306025,0 days 00:00:00.348539,,,,,SVC,,,,,,,,,,,,,,,,,,,,,,,,,,,,,5.771340089743588e-10,rbf,COMPLETE,0.0,,,,,,,,,,,,,,,,,,,,
36,36,0.5691148775894539,2023-08-23 12:36:35.085811,2023-08-23 12:36:35.411553,0 days 00:00:00.325742,,,,,DecisionTreeClassifier,,gini,30.0,,,,,,,,,,,,,,,,,,,,,,,,,,,,COMPLETE,0.0,,,,,,,,,,,,,,,,,,,,
37,37,0.5594997983057685,2023-08-23 12:36:35.287892,2023-08-23 12:36:35.539873,0 days 00:00:00.251981,,,,,DecisionTreeClassifier,,gini,2.0,,,,,,,,,,,,,,,,,,,,,,,,,,,,COMPLETE,0.0,,,,,,,,,,,,,,,,,,,,
38,38,0.5908902691511387,2023-08-23 12:36:35.391310,2023-08-23 12:36:36.886853,0 days 00:00:01.495543,,,,,RandomForestClassifier,,,,,,,,,,,,,,,,,,,,,,,,29.0,11.0,,,,,,COMPLETE,0.0,,,,,,,,,,,,,,,,,,,,
39,39,0.6388888888888888,2023-08-23 12:36:35.513694,2023-08-23 12:36:37.061024,0 days 00:00:01.547330,,,,,RandomForestClassifier,,,,,,,,,,,,,,,,,,,,,,,,33.0,12.0,,,,,,COMPLETE,0.0,,,,,,,,,,,,,,,,,,,,
40,40,0.5830163462526987,2023-08-23 12:36:35.618181,2023-08-23 12:36:37.566844,0 days 00:00:01.948663,,,,,RandomForestClassifier,,,,,,,,,,,,,,,,,,,,,,,,37.0,10.0,,,,,,COMPLETE,0.0,,,,,,,,,,,,,,,,,,,,
41,41,0.6306443429731101,2023-08-23 12:36:35.805574,2023-08-23 12:36:37.361139,0 days 00:00:01.555565,,,,,RandomForestClassifier,,,,,,,,,,,,,,,,,,,,,,,,33.0,11.0,,,,,,COMPLETE,0.0,,,,,,,,,,,,,,,,,,,,
42,42,0.6224283985478015,2023-08-23 12:36:35.875868,2023-08-23 12:36:37.156766,0 days 00:00:01.280898,,,,,RandomForestClassifier,,,,,,,,,,,,,,,,,,,,,,,,30.0,11.0,,,,,,COMPLETE,0.0,,,,,,,,,,,,,,,,,,,,
43,43,0.6185188856944581,2023-08-23 12:36:36.085091,2023-08-23 12:36:37.664393,0 days 00:00:01.579302,,,,,RandomForestClassifier,,,,,,,,,,,,,,,,,,,,,,,,32.0,11.0,,,,,,COMPLETE,0.0,,,,,,,,,,,,,,,,,,,,
44,44,0.6124223602484473,2023-08-23 12:36:36.504169,2023-08-23 12:36:39.488208,0 days 00:00:02.984039,,,,,RandomForestClassifier,,,,,,,,,,,,,,,,,,,,,,,,98.0,9.0,,,,,,COMPLETE,0.0,,,,,,,,,,,,,,,,,,,,
45,45,0.5450568678915135,2023-08-23 12:36:36.993533,2023-08-23 12:36:38.395801,0 days 00:00:01.402268,,0.4,1.0,,LightGBM,,,,,0.4,,,,1.1493193955958371e-08,0.6224267800027913,,10.0,,,,,,,,,,235.0,,,,,,,,,COMPLETE,0.0,,,,,,,,,,,,,,,,,,,,
46,46,0.59375,2023-08-23 12:36:37.224485,2023-08-23 12:36:38.668412,0 days 00:00:01.443927,,0.4,1.0,,LightGBM,,,,,0.4,,,,1.4037645014688086e-08,0.7219130545210725,,10.0,,,,,,,,,,247.0,,,,,,,,,COMPLETE,0.0,,,,,,,,,,,,,,,,,,,,
47,47,0.6020017662643509,2023-08-23 12:36:37.228619,2023-08-23 12:36:38.534144,0 days 00:00:01.305525,,0.4,1.0,,LightGBM,,,,,0.4,,,,2.3298442705424682e-08,0.4175302713113803,,10.0,,,,,,,,,,232.0,,,,,,,,,COMPLETE,0.0,,,,,,,,,,,,,,,,,,,,
48,48,0.5486397798242829,2023-08-23 12:36:37.450292,2023-08-23 12:36:38.351039,0 days 00:00:00.900747,,,,,RandomForestClassifier,,,,,,,,,,,,,,,,,,,,,,,,39.0,8.0,,,,,,COMPLETE,0.0,,,,,,,,,,,,,,,,,,,,
49,49,0.59375,2023-08-23 12:36:37.706607,2023-08-23 12:36:38.907250,0 days 00:00:01.200643,,0.4,1.0,,LightGBM,,,,,0.4,,,,1.808768573717252e-08,0.8911419962981618,,10.0,,,,,,,,,,234.0,,,,,,,,,COMPLETE,0.0,,,,,,,,,,,,,,,,,,,,
50,50,0.572531328320802,2023-08-23 12:36:37.721356,2023-08-23 12:36:38.962783,0 days 00:00:01.241427,,0.5,1.0,,LightGBM,,,,,0.4,,,,2.6280548530983448e-08,0.909296576049013,,10.0,,,,,,,,,,243.0,,,,,,,,,COMPLETE,0.0,,,,,,,,,,,,,,,,,,,,
51,51,0.6307692307692307,2023-08-23 12:36:38.215515,2023-08-23 12:36:39.121006,0 days 00:00:00.905491,,0.4,1.0,,LightGBM,,,,,0.4,,,,4.609731545407608e-08,0.9098398876293762,,10.0,,,,,,,,,,250.0,,,,,,,,,COMPLETE,0.0,,,,,,,,,,,,,,,,,,,,
52,52,0.59375,2023-08-23 12:36:38.439743,2023-08-23 12:36:39.442359,0 days 00:00:01.002616,,,,,RandomForestClassifier,,,,,,,,,,,,,,,,,,,,,,,,53.0,6.0,,,,,,COMPLETE,0.0,,,,,,,,,,,,,,,,,,,,
53,53,0.5706573515401715,2023-08-23 12:36:38.440672,2023-08-23 12:36:40.344443,0 days 00:00:01.903771,,,,,RandomForestClassifier,,,,,,,,,,,,,,,,,,,,,,,,100.0,6.0,,,,,,COMPLETE,0.0,,,,,,,,,,,,,,,,,,,,
54,54,0.5848739495798319,2023-08-23 12:36:38.578629,2023-08-23 12:36:40.176176,0 days 00:00:01.597547,,,,,RandomForestClassifier,,,,,,,,,,,,,,,,,,,,,,,,97.0,6.0,,,,,,COMPLETE,0.0,,,,,,,,,,,,,,,,,,,,
55,55,0.586013986013986,2023-08-23 12:36:38.714047,2023-08-23 12:36:39.532606,0 days 00:00:00.818559,,,,,RandomForestClassifier,,,,,,,,,,,,,,,,,,,,,,,,51.0,5.0,,,,,,COMPLETE,0.0,,,,,,,,,,,,,,,,,,,,
56,56,0.59375,2023-08-23 12:36:38.952174,2023-08-23 12:36:40.719202,0 days 00:00:01.767028,,,,,RandomForestClassifier,,,,,,,,,,,,,,,,,,,,,,,,95.0,6.0,,,,,,COMPLETE,0.0,,,,,,,,,,,,,,,,,,,,
57,57,0.5636363636363636,2023-08-23 12:36:39.012115,2023-08-23 12:36:39.867779,0 days 00:00:00.855664,,,,,RandomForestClassifier,,,,,,,,,,,,,,,,,,,,,,,,57.0,6.0,,,,,,COMPLETE,0.0,,,,,,,,,,,,,,,,,,,,
58,58,0.586013986013986,2023-08-23 12:36:39.174872,2023-08-23 12:36:40.946644,0 days 00:00:01.771772,,,,,RandomForestClassifier,,,,,,,,,,,,,,,,,,,,,,,,99.0,6.0,,,,,,COMPLETE,0.0,,,,,,,,,,,,,,,,,,,,
59,59,0.5385235982250909,2023-08-23 12:36:39.485516,2023-08-23 12:36:41.123865,0 days 00:00:01.638349,,,,,RandomForestClassifier,,,,,,,,,,,,,,,,,,,,,,,,66.0,16.0,,,,,,COMPLETE,0.0,,,,,,,,,,,,,,,,,,,,
60,60,0.5783183952198037,2023-08-23 12:36:39.575660,2023-08-23 12:49:01.652537,0 days 00:12:22.076877,,,,,SVC,,,,,,,,,,,,,,,,,,,,,,,,,,,,,8298096849.691183,linear,COMPLETE,0.0,,,,,,,,,,,,,,,,,,,,
61,61,0.5636363636363636,2023-08-23 12:36:39.581907,2023-08-23 12:55:42.670829,0 days 00:19:03.088922,,,,,SVC,,,,,,,,,,,,,,,,,,,,,,,,,,,,,8268360472.13024,linear,COMPLETE,0.0,,,,,,,,,,,,,,,,,,,,
62,62,0.3696969696969697,2023-08-23 12:36:39.923308,2023-08-23 12:36:39.987318,0 days 00:00:00.064010,,,,,SVC,,,,,,,,,,,,,,,,,,,,,,,,,,,,,3.1533509336135794,linear,COMPLETE,0.0,,,,,,,,,,,,,,,,,,,,
63,63,0.5402487920222063,2023-08-23 12:36:40.031345,2023-08-23 12:40:51.446999,0 days 00:04:11.415654,,,,,MLPClassifier,,,,,,,,,,,,,,tanh,lbfgs,4.0,100.0,100.0,10.0,10.0,,,,,,,,,,,COMPLETE,0.0,,,,,,,,,,,,,,,,,,,,
64,64,0.3696969696969697,2023-08-23 12:36:40.300706,2023-08-23 12:38:15.890820,0 days 00:01:35.590114,,,,,MLPClassifier,,,,,,,,,,,,,,relu,sgd,4.0,100.0,100.0,20.0,70.0,,,,,,,,,,,COMPLETE,0.0,,,,,,,,,,,,,,,,,,,,
65,65,0.3696969696969697,2023-08-23 12:36:40.439000,2023-08-23 12:37:00.516875,0 days 00:00:20.077875,,,,,MLPClassifier,,,,,,,,,,,,,,tanh,sgd,4.0,100.0,100.0,10.0,30.0,,,,,,,,,,,COMPLETE,0.0,,,,,,,,,,,,,,,,,,,,
66,66,0.3696969696969697,2023-08-23 12:36:40.831448,2023-08-23 12:37:24.203134,0 days 00:00:43.371686,,,,,MLPClassifier,,,,,,,,,,,,,,relu,sgd,4.0,100.0,100.0,10.0,40.0,,,,,,,,,,,COMPLETE,0.0,,,,,,,,,,,,,,,,,,,,
67,67,0.5339308578745199,2023-08-23 12:36:41.055175,2023-08-23 12:41:42.278322,0 days 00:05:01.223147,,,,,MLPClassifier,,,,,,,,,,,,,,relu,lbfgs,4.0,100.0,100.0,10.0,60.0,,,,,,,,,,,COMPLETE,0.0,,,,,,,,,,,,,,,,,,,,
68,68,0.5630252100840336,2023-08-23 12:36:41.250688,2023-08-23 12:41:07.980133,0 days 00:04:26.729445,,,,,MLPClassifier,,,,,,,,,,,,,,relu,lbfgs,4.0,100.0,100.0,10.0,20.0,,,,,,,,,,,COMPLETE,0.0,,,,,,,,,,,,,,,,,,,,
69,69,0.5272727272727273,2023-08-23 12:37:00.608921,2023-08-23 12:37:00.710796,0 days 00:00:00.101875,,,,,DecisionTreeClassifier,,log_loss,13.0,,,,,,,,,,,,,,,,,,,,,,,,,,,,COMPLETE,0.0,,,,,,,,,,,,,,,,,,,,
70,70,0.5692307692307692,2023-08-23 12:37:00.799270,2023-08-23 12:37:00.839911,0 days 00:00:00.040641,,,,,DecisionTreeClassifier,,gini,4.0,,,,,,,,,,,,,,,,,,,,,,,,,,,,COMPLETE,0.0,,,,,,,,,,,,,,,,,,,,
71,71,0.603507434235608,2023-08-23 12:37:00.919087,2023-08-23 12:37:01.463622,0 days 00:00:00.544535,,0.9,3.0,,LightGBM,,,,,0.7000000000000001,,,,5.11051386789638e-06,0.001808853040934216,,50.0,,,,,,,,,,168.0,,,,,,,,,COMPLETE,0.0,,,,,,,,,,,,,,,,,,,,
72,72,0.5711805555555556,2023-08-23 12:37:01.537411,2023-08-23 12:41:40.644173,0 days 00:04:39.106762,,,,,MLPClassifier,,,,,,,,,,,,,,relu,lbfgs,4.0,50.0,10.0,90.0,100.0,,,,,,,,,,,COMPLETE,0.0,,,,,,,,,,,,,,,,,,,,
73,73,0.51886501490696,2023-08-23 12:37:24.260818,2023-08-23 12:37:39.141537,0 days 00:00:14.880719,,,,,SVC,,,,,,,,,,,,,,,,,,,,,,,,,,,,,5425612125.192782,rbf,COMPLETE,0.0,,,,,,,,,,,,,,,,,,,,
74,74,0.3696969696969697,2023-08-23 12:37:39.287203,2023-08-23 12:37:39.479459,0 days 00:00:00.192256,0.0018391606178347875,,,gblinear,XGBoost,0.6459330885110357,,,,,,,0.039539729384917226,,,,,,,,,,,,,,,,,,,,0.6950976104214469,,,COMPLETE,0.0,,,,,,,,,,,,,,,,,,,,
75,75,0.5047619047619047,2023-08-23 12:37:39.556922,2023-08-23 12:37:39.626403,0 days 00:00:00.069481,,,,,DecisionTreeClassifier,,entropy,10.0,,,,,,,,,,,,,,,,,,,,,,,,,,,,COMPLETE,0.0,,,,,,,,,,,,,,,,,,,,
76,76,0.5673262303399289,2023-08-23 12:37:39.776073,2023-08-23 12:37:39.982604,0 days 00:00:00.206531,2.3786675719546163e-06,,,gbtree,XGBoost,0.6815354429659667,,,0.3685478062894498,,0.0030849041420134417,depthwise,2.439833321145958e-05,,,3.0,,10.0,,,,,,,,,,,,,,,0.5675281250572984,,,COMPLETE,0.0,,,,,,,,,,,,,,,,,,,,
77,77,0.5487179487179487,2023-08-23 12:37:40.058506,2023-08-23 12:37:40.585091,0 days 00:00:00.526585,,0.6000000000000001,2.0,,LightGBM,,,,,0.9,,,,1.8266451818053703e-06,0.0021494576736860527,,40.0,,,,,,,,,,172.0,,,,,,,,,COMPLETE,0.0,,,,,,,,,,,,,,,,,,,,
78,78,0.6517503805175038,2023-08-23 12:37:40.673001,2023-08-23 12:37:41.028411,0 days 00:00:00.355410,,,,,RandomForestClassifier,,,,,,,,,,,,,,,,,,,,,,,,23.0,13.0,,,,,,COMPLETE,0.0,,,,,,,,,,,,,,,,,,,,
79,79,0.6233320625238277,2023-08-23 12:37:41.133715,2023-08-23 12:37:41.582059,0 days 00:00:00.448344,,,,,RandomForestClassifier,,,,,,,,,,,,,,,,,,,,,,,,21.0,14.0,,,,,,COMPLETE,0.0,,,,,,,,,,,,,,,,,,,,
80,80,0.511437908496732,2023-08-23 12:37:41.699276,2023-08-23 12:37:42.055521,0 days 00:00:00.356245,,,,,RandomForestClassifier,,,,,,,,,,,,,,,,,,,,,,,,21.0,15.0,,,,,,COMPLETE,0.0,,,,,,,,,,,,,,,,,,,,
81,81,0.5734375,2023-08-23 12:37:42.156996,2023-08-23 12:37:42.769081,0 days 00:00:00.612085,,,,,RandomForestClassifier,,,,,,,,,,,,,,,,,,,,,,,,41.0,13.0,,,,,,COMPLETE,0.0,,,,,,,,,,,,,,,,,,,,
82,82,0.585496257412268,2023-08-23 12:37:42.865987,2023-08-23 12:37:43.214545,0 days 00:00:00.348558,,,,,RandomForestClassifier,,,,,,,,,,,,,,,,,,,,,,,,22.0,20.0,,,,,,COMPLETE,0.0,,,,,,,,,,,,,,,,,,,,
83,83,0.5890120481927712,2023-08-23 12:37:43.283537,2023-08-23 12:37:43.407297,0 days 00:00:00.123760,,,,,DecisionTreeClassifier,,log_loss,19.0,,,,,,,,,,,,,,,,,,,,,,,,,,,,COMPLETE,0.0,,,,,,,,,,,,,,,,,,,,
84,84,0.5554165363361485,2023-08-23 12:37:43.529073,2023-08-23 12:37:43.853128,0 days 00:00:00.324055,0.0030418882585419287,,,dart,XGBoost,0.9941161716223403,,,3.2084449760581486e-05,,0.0012926946303919247,lossguide,0.016902872467246928,,,7.0,,9.0,,,,,,,,tree,,0.015125357630713819,,,uniform,1.8632760399621217e-06,0.7937597818335047,,,COMPLETE,0.0,,,,,,,,,,,,,,,,,,,,
85,85,0.5594997983057685,2023-08-23 12:37:43.961916,2023-08-23 12:37:44.451771,0 days 00:00:00.489855,,,,,RandomForestClassifier,,,,,,,,,,,,,,,,,,,,,,,,44.0,9.0,,,,,,COMPLETE,0.0,,,,,,,,,,,,,,,,,,,,
86,86,0.5561246265471618,2023-08-23 12:37:44.537149,2023-08-23 12:40:10.497738,0 days 00:02:25.960589,,,,,MLPClassifier,,,,,,,,,,,,,,tanh,lbfgs,2.0,50.0,20.0,,,,,,,,,,,,,COMPLETE,0.0,,,,,,,,,,,,,,,,,,,,
87,87,0.3696969696969697,2023-08-23 12:38:16.024665,2023-08-23 12:38:16.169907,0 days 00:00:00.145242,,,,,SVC,,,,,,,,,,,,,,,,,,,,,,,,,,,,,1.953308181966253e-08,poly,COMPLETE,0.0,,,,,,,,,,,,,,,,,,,,
88,88,0.5248371731311363,2023-08-23 12:38:16.281466,2023-08-23 12:38:16.576119,0 days 00:00:00.294653,,,,,RandomForestClassifier,,,,,,,,,,,,,,,,,,,,,,,,17.0,13.0,,,,,,COMPLETE,0.0,,,,,,,,,,,,,,,,,,,,
