,number,value,datetime_start,datetime_complete,duration,params_alpha,params_bagging_fraction,params_bagging_freq,params_booster,params_classifier,params_colsample_bytree,params_dct_criterion,params_dct_max_depth,params_eta,params_feature_fraction,params_gamma,params_grow_policy,params_lambda,params_lambda_l1,params_lambda_l2,params_max_depth,params_min_child_samples,params_min_child_weight,params_mlp_activation,params_mlp_solver,params_n_layers,params_n_units_l_0,params_n_units_l_1,params_n_units_l_2,params_n_units_l_3,params_normalize_type,params_num_leaves,params_rate_drop,params_rf_estimator,params_rf_max_depth,params_sample_type,params_skip_drop,params_subsample,params_svc_c,params_svc_kernel,state,best_trial,dev_acc,dev_recall_macro,dev_precision_macro,dev_f1_macro,dev_recall_0,dev_precision_0,dev_f1_0,dev_recall_1,dev_precision_1,dev_f1_1,test_acc,test_recall_macro,test_precision_macro,test_f1_macro,test_recall_0,test_precision_0,test_f1_0,test_recall_1,test_precision_1,test_f1_1
86,86,0.4748084268741358,2023-08-23 17:55:06.048865,2023-08-23 17:55:09.859740,0 days 00:00:03.810875,,,,,RandomForestClassifier,,,,,,,,,,,,,,,,,,,,,,,,67.0,11.0,,,,,,COMPLETE,0.0,,,,,,,,,,,,,,,,,,,,
87,87,0.3724577044601925,2023-08-23 17:55:08.786194,2023-08-23 17:55:20.602759,0 days 00:00:11.816565,,,,,MLPClassifier,,,,,,,,,,,,,,identity,lbfgs,2.0,60.0,90.0,,,,,,,,,,,,,COMPLETE,0.0,,,,,,,,,,,,,,,,,,,,
88,88,0.5374211749087289,2023-08-23 17:55:09.964693,2023-08-23 17:55:12.449779,0 days 00:00:02.485086,,1.0,3.0,,LightGBM,,,,,1.0,,,,0.00279317973510616,7.897633590145426e-07,,20.0,,,,,,,,,,103.0,,,,,,,,,COMPLETE,0.0,,,,,,,,,,,,,,,,,,,,
89,89,0.5404680542611577,2023-08-23 17:55:12.521013,2023-08-23 17:55:15.195146,0 days 00:00:02.674133,,1.0,3.0,,LightGBM,,,,,1.0,,,,0.007085335231187657,5.633104849083544e-06,,30.0,,,,,,,,,,125.0,,,,,,,,,COMPLETE,0.0,,,,,,,,,,,,,,,,,,,,
90,90,0.522579859234694,2023-08-23 17:55:15.264956,2023-08-23 17:55:17.015698,0 days 00:00:01.750742,,1.0,3.0,,LightGBM,,,,,1.0,,,,0.007940801188009196,1.0415255411802784e-07,,90.0,,,,,,,,,,103.0,,,,,,,,,COMPLETE,0.0,,,,,,,,,,,,,,,,,,,,
91,91,0.5227357320099255,2023-08-23 17:55:17.084908,2023-08-23 17:55:19.282284,0 days 00:00:02.197376,,0.7000000000000001,3.0,,LightGBM,,,,,0.4,,,,2.213785579632942e-06,1.029475676174253e-08,,20.0,,,,,,,,,,93.0,,,,,,,,,COMPLETE,0.0,,,,,,,,,,,,,,,,,,,,
92,92,0.522480860148475,2023-08-23 17:55:17.269882,2023-08-23 17:55:21.761098,0 days 00:00:04.491216,,0.7000000000000001,3.0,,LightGBM,,,,,1.0,,,,0.06754690785541531,0.8321609303333736,,20.0,,,,,,,,,,193.0,,,,,,,,,COMPLETE,0.0,,,,,,,,,,,,,,,,,,,,
93,93,0.3573487031700288,2023-08-23 17:55:19.344882,2023-08-23 17:55:21.622361,0 days 00:00:02.277479,,,,,MLPClassifier,,,,,,,,,,,,,,logistic,lbfgs,2.0,60.0,100.0,,,,,,,,,,,,,COMPLETE,0.0,,,,,,,,,,,,,,,,,,,,
94,94,0.5480977436261425,2023-08-23 17:55:20.677561,2023-08-23 17:55:24.777616,0 days 00:00:04.100055,,1.0,2.0,,LightGBM,,,,,1.0,,,,0.06749274728770084,3.5808383215472096e-06,,30.0,,,,,,,,,,192.0,,,,,,,,,COMPLETE,0.0,,,,,,,,,,,,,,,,,,,,
95,95,0.5251585427949822,2023-08-23 17:55:21.673058,2023-08-23 17:55:26.799652,0 days 00:00:05.126594,,1.0,1.0,,LightGBM,,,,,1.0,,,,0.08528394328977727,8.17274431811981e-07,,30.0,,,,,,,,,,194.0,,,,,,,,,COMPLETE,0.0,,,,,,,,,,,,,,,,,,,,
96,96,0.5503916637092585,2023-08-23 17:55:21.833164,2023-08-23 17:55:25.925495,0 days 00:00:04.092331,,1.0,2.0,,LightGBM,,,,,1.0,,,,0.002660222816832026,0.1518233886330497,,30.0,,,,,,,,,,175.0,,,,,,,,,COMPLETE,0.0,,,,,,,,,,,,,,,,,,,,
97,97,0.5201795630889494,2023-08-23 17:55:24.876911,2023-08-23 17:55:28.229861,0 days 00:00:03.352950,,0.6000000000000001,2.0,,LightGBM,,,,,1.0,,,,0.001989172303040145,6.340228804599102e-07,,30.0,,,,,,,,,,118.0,,,,,,,,,COMPLETE,0.0,,,,,,,,,,,,,,,,,,,,
98,98,0.5330257422125724,2023-08-23 17:55:26.018449,2023-08-23 17:55:30.429271,0 days 00:00:04.410822,,1.0,2.0,,LightGBM,,,,,1.0,,,,0.0019758761407782156,0.19362929522942027,,30.0,,,,,,,,,,181.0,,,,,,,,,COMPLETE,0.0,,,,,,,,,,,,,,,,,,,,
99,99,0.524828608486196,2023-08-23 17:55:26.883915,2023-08-23 17:55:30.890825,0 days 00:00:04.006910,,1.0,2.0,,LightGBM,,,,,1.0,,,,0.0025424738804792433,0.40197745695183307,,30.0,,,,,,,,,,182.0,,,,,,,,,COMPLETE,0.0,,,,,,,,,,,,,,,,,,,,
100,100,0.520530870101562,2023-08-23 17:55:28.314436,2023-08-23 17:55:32.818053,0 days 00:00:04.503617,,1.0,2.0,,LightGBM,,,,,1.0,,,,0.003464350725921838,0.18474889319226173,,30.0,,,,,,,,,,180.0,,,,,,,,,COMPLETE,0.0,,,,,,,,,,,,,,,,,,,,
101,101,0.535646544614877,2023-08-23 17:55:30.508842,2023-08-23 17:55:35.532947,0 days 00:00:05.024105,,1.0,2.0,,LightGBM,,,,,1.0,,,,0.005182120408080082,0.22569507776403544,,30.0,,,,,,,,,,213.0,,,,,,,,,COMPLETE,0.0,,,,,,,,,,,,,,,,,,,,
102,102,0.5283568671621567,2023-08-23 17:55:30.976717,2023-08-23 17:55:33.101256,0 days 00:00:02.124539,,1.0,2.0,,LightGBM,,,,,1.0,,,,0.009928686609171379,2.978090854537992e-06,,100.0,,,,,,,,,,221.0,,,,,,,,,COMPLETE,0.0,,,,,,,,,,,,,,,,,,,,
103,103,0.5283568671621567,2023-08-23 17:55:32.921013,2023-08-23 17:55:34.787981,0 days 00:00:01.866968,,1.0,2.0,,LightGBM,,,,,1.0,,,,0.012161402938722388,3.104884727092773e-06,,100.0,,,,,,,,,,217.0,,,,,,,,,COMPLETE,0.0,,,,,,,,,,,,,,,,,,,,
104,104,0.49623123884248344,2023-08-23 17:55:33.196643,2023-08-23 17:55:33.446575,0 days 00:00:00.249932,0.0005316890494196907,,,gbtree,XGBoost,0.4553617367830927,,,0.3160489077865522,,0.9529092695170722,lossguide,0.00021704722227892654,,,5.0,,10.0,,,,,,,,,,,,,,,0.5153685501947807,,,COMPLETE,0.0,,,,,,,,,,,,,,,,,,,,
105,105,0.5225330945175303,2023-08-23 17:55:33.544653,2023-08-23 17:55:36.110772,0 days 00:00:02.566119,,1.0,2.0,,LightGBM,,,,,0.6000000000000001,,,,0.03037127420798121,2.1156552603890977e-08,,60.0,,,,,,,,,,202.0,,,,,,,,,COMPLETE,0.0,,,,,,,,,,,,,,,,,,,,
106,106,0.5383903036905897,2023-08-23 17:55:34.895818,2023-08-23 17:55:36.925263,0 days 00:00:02.029445,,1.0,2.0,,LightGBM,,,,,0.6000000000000001,,,,0.03349975469361348,2.0721008449864224e-08,,90.0,,,,,,,,,,202.0,,,,,,,,,COMPLETE,0.0,,,,,,,,,,,,,,,,,,,,
107,107,0.5127799004827253,2023-08-23 17:55:35.600927,2023-08-23 17:55:37.103577,0 days 00:00:01.502650,,0.4,2.0,,LightGBM,,,,,1.0,,,,0.033585236855757206,0.06751241039372224,,60.0,,,,,,,,,,143.0,,,,,,,,,COMPLETE,0.0,,,,,,,,,,,,,,,,,,,,
108,108,0.514102758186121,2023-08-23 17:55:36.197452,2023-08-23 17:55:38.505276,0 days 00:00:02.307824,,0.9,3.0,,LightGBM,,,,,0.9,,,,0.01736494662963011,0.05300489266875033,,90.0,,,,,,,,,,166.0,,,,,,,,,COMPLETE,0.0,,,,,,,,,,,,,,,,,,,,
109,109,0.5363061783295245,2023-08-23 17:55:37.007544,2023-08-23 17:55:39.903106,0 days 00:00:02.895562,,0.9,3.0,,LightGBM,,,,,0.9,,,,0.014445528615939061,2.8237078883365396e-05,,50.0,,,,,,,,,,166.0,,,,,,,,,COMPLETE,0.0,,,,,,,,,,,,,,,,,,,,
110,110,0.5150667909288599,2023-08-23 17:55:37.233294,2023-08-23 17:55:40.510834,0 days 00:00:03.277540,,0.9,3.0,,LightGBM,,,,,0.9,,,,0.013431195021593728,3.360371853673317e-05,,50.0,,,,,,,,,,170.0,,,,,,,,,COMPLETE,0.0,,,,,,,,,,,,,,,,,,,,
111,111,0.5318277069977023,2023-08-23 17:55:38.600764,2023-08-23 17:55:41.974595,0 days 00:00:03.373831,,0.9,3.0,,LightGBM,,,,,0.9,,,,0.015415634670788776,1.3228139705600795e-06,,50.0,,,,,,,,,,155.0,,,,,,,,,COMPLETE,0.0,,,,,,,,,,,,,,,,,,,,
112,112,0.37707343718669406,2023-08-23 17:55:40.024864,2023-08-23 17:55:40.206171,0 days 00:00:00.181307,,,,,DecisionTreeClassifier,,log_loss,4.0,,,,,,,,,,,,,,,,,,,,,,,,,,,,COMPLETE,0.0,,,,,,,,,,,,,,,,,,,,
113,113,0.5353098371794223,2023-08-23 17:55:40.273655,2023-08-23 17:55:42.681861,0 days 00:00:02.408206,,0.9,3.0,,LightGBM,,,,,0.8,,,,0.12092446578501026,0.9549296459051869,,70.0,,,,,,,,,,174.0,,,,,,,,,COMPLETE,0.0,,,,,,,,,,,,,,,,,,,,
114,114,0.5256442603669732,2023-08-23 17:55:40.574574,2023-08-23 17:55:43.167419,0 days 00:00:02.592845,,1.0,1.0,,LightGBM,,,,,0.8,,,,0.11167340158619901,1.2861858644125498e-06,,70.0,,,,,,,,,,153.0,,,,,,,,,COMPLETE,0.0,,,,,,,,,,,,,,,,,,,,
115,115,0.5342638544251448,2023-08-23 17:55:42.044155,2023-08-23 17:55:44.567482,0 days 00:00:02.523327,,1.0,1.0,,LightGBM,,,,,0.8,,,,0.1183656267339378,8.723877426849665e-06,,70.0,,,,,,,,,,174.0,,,,,,,,,COMPLETE,0.0,,,,,,,,,,,,,,,,,,,,
116,116,0.5326636797225033,2023-08-23 17:55:42.788631,2023-08-23 17:55:46.047778,0 days 00:00:03.259147,,1.0,1.0,,LightGBM,,,,,0.7000000000000001,,,,0.06590525326329358,1.2060924404436546e-05,,40.0,,,,,,,,,,125.0,,,,,,,,,COMPLETE,0.0,,,,,,,,,,,,,,,,,,,,
117,117,0.5550250521086438,2023-08-23 17:55:43.233332,2023-08-23 17:55:45.344257,0 days 00:00:02.110925,,1.0,3.0,,LightGBM,,,,,0.7000000000000001,,,,0.05425357121375212,1.2940636992020788e-05,,40.0,,,,,,,,,,89.0,,,,,,,,,COMPLETE,0.0,,,,,,,,,,,,,,,,,,,,
118,118,0.5556851733322322,2023-08-23 17:55:44.668529,2023-08-23 17:55:48.605515,0 days 00:00:03.936986,,1.0,3.0,,LightGBM,,,,,0.9,,,,0.005377759453634436,0.0009736129571390113,,40.0,,,,,,,,,,158.0,,,,,,,,,COMPLETE,0.0,,,,,,,,,,,,,,,,,,,,
119,119,0.5264064262331161,2023-08-23 17:55:45.414306,2023-08-23 17:55:45.932276,0 days 00:00:00.517970,,1.0,3.0,,LightGBM,,,,,0.7000000000000001,,,,0.05459297457863308,1.5560348370254055e-05,,40.0,,,,,,,,,,12.0,,,,,,,,,COMPLETE,0.0,,,,,,,,,,,,,,,,,,,,
120,120,0.5497353168874102,2023-08-23 17:55:46.018883,2023-08-23 17:55:47.950633,0 days 00:00:01.931750,,1.0,3.0,,LightGBM,,,,,0.7000000000000001,,,,0.0043950851714982175,5.568535217756011e-05,,40.0,,,,,,,,,,68.0,,,,,,,,,COMPLETE,0.0,,,,,,,,,,,,,,,,,,,,
121,121,0.5269995581087052,2023-08-23 17:55:46.125726,2023-08-23 17:55:48.136479,0 days 00:00:02.010753,,1.0,3.0,,LightGBM,,,,,0.6000000000000001,,,,0.0049450656643116484,5.847559241608897e-06,,40.0,,,,,,,,,,69.0,,,,,,,,,COMPLETE,0.0,,,,,,,,,,,,,,,,,,,,
122,122,0.5412952689646575,2023-08-23 17:55:48.028779,2023-08-23 17:55:49.619502,0 days 00:00:01.590723,,1.0,3.0,,LightGBM,,,,,0.7000000000000001,,,,0.00526528338050499,4.034426630836089e-06,,40.0,,,,,,,,,,56.0,,,,,,,,,COMPLETE,0.0,,,,,,,,,,,,,,,,,,,,
123,123,0.3573487031700288,2023-08-23 17:55:48.215071,2023-08-23 17:55:55.559388,0 days 00:00:07.344317,,,,,SVC,,,,,,,,,,,,,,,,,,,,,,,,,,,,,6.844192094231542,rbf,COMPLETE,0.0,,,,,,,,,,,,,,,,,,,,
124,124,0.3573487031700288,2023-08-23 17:55:48.676906,2023-08-23 17:55:54.146584,0 days 00:00:05.469678,,,,,SVC,,,,,,,,,,,,,,,,,,,,,,,,,,,,,13.720603062507257,poly,COMPLETE,0.0,,,,,,,,,,,,,,,,,,,,
125,125,0.3573487031700288,2023-08-23 17:55:49.681126,2023-08-23 17:55:54.311485,0 days 00:00:04.630359,,,,,SVC,,,,,,,,,,,,,,,,,,,,,,,,,,,,,12.797053865551291,poly,COMPLETE,0.0,,,,,,,,,,,,,,,,,,,,
126,126,0.36879051204392993,2023-08-23 17:55:54.228390,2023-08-23 17:55:54.527088,0 days 00:00:00.298698,2.7649358846774406e-06,,,gblinear,XGBoost,0.7533916561001786,,,,,,,1.521274342403988e-08,,,,,,,,,,,,,,,,,,,,0.7598648720216655,,,COMPLETE,0.0,,,,,,,,,,,,,,,,,,,,
127,127,0.4603601611635221,2023-08-23 17:55:54.427562,2023-08-23 17:55:55.067233,0 days 00:00:00.639671,2.206518111368108e-06,,,dart,XGBoost,0.8164129218294195,,,3.342879462437878e-05,,8.05833309260784e-08,depthwise,1.0151098986122541e-08,,,7.0,,6.0,,,,,,,,forest,,0.6958966659907063,,,uniform,7.744883142426961e-05,0.800608861535117,,,COMPLETE,0.0,,,,,,,,,,,,,,,,,,,,
128,128,0.5338312071785813,2023-08-23 17:55:54.653672,2023-08-23 17:55:56.357414,0 days 00:00:01.703742,,1.0,3.0,,LightGBM,,,,,0.7000000000000001,,,,0.0011814808873462353,0.018919813177118033,,30.0,,,,,,,,,,45.0,,,,,,,,,COMPLETE,0.0,,,,,,,,,,,,,,,,,,,,
129,129,0.533987345446102,2023-08-23 17:55:55.128923,2023-08-23 17:55:57.459276,0 days 00:00:02.330353,,0.5,3.0,,LightGBM,,,,,0.7000000000000001,,,,0.0013838015562372694,0.0036235361499195188,,30.0,,,,,,,,,,83.0,,,,,,,,,COMPLETE,0.0,,,,,,,,,,,,,,,,,,,,
130,130,0.5464189642925072,2023-08-23 17:55:55.648609,2023-08-23 17:55:57.898120,0 days 00:00:02.249511,,1.0,3.0,,LightGBM,,,,,0.7000000000000001,,,,0.0009012818065721129,0.00033207421031021783,,80.0,,,,,,,,,,94.0,,,,,,,,,COMPLETE,0.0,,,,,,,,,,,,,,,,,,,,
131,131,0.5356958811396408,2023-08-23 17:55:56.471745,2023-08-23 17:55:59.383569,0 days 00:00:02.911824,,1.0,3.0,,LightGBM,,,,,1.0,,,,0.004508764674423945,0.003803603708514244,,40.0,,,,,,,,,,91.0,,,,,,,,,COMPLETE,0.0,,,,,,,,,,,,,,,,,,,,
132,132,0.5422101869761444,2023-08-23 17:55:57.560724,2023-08-23 17:55:59.861550,0 days 00:00:02.300826,,1.0,3.0,,LightGBM,,,,,1.0,,,,0.006727771999366241,0.0009819595115988125,,40.0,,,,,,,,,,94.0,,,,,,,,,COMPLETE,0.0,,,,,,,,,,,,,,,,,,,,
133,133,0.5464189642925072,2023-08-23 17:55:57.973044,2023-08-23 17:55:59.746414,0 days 00:00:01.773370,,1.0,3.0,,LightGBM,,,,,0.7000000000000001,,,,0.0006269459514046078,0.0009306620435308771,,80.0,,,,,,,,,,90.0,,,,,,,,,COMPLETE,0.0,,,,,,,,,,,,,,,,,,,,
134,134,0.5397340690341852,2023-08-23 17:55:59.445862,2023-08-23 17:56:01.862289,0 days 00:00:02.416427,,1.0,3.0,,LightGBM,,,,,0.7000000000000001,,,,0.0006812443194058948,0.0003708154964385309,,80.0,,,,,,,,,,188.0,,,,,,,,,COMPLETE,0.0,,,,,,,,,,,,,,,,,,,,
135,135,0.42262548199597283,2023-08-23 17:55:59.831316,2023-08-23 17:56:01.250270,0 days 00:00:01.418954,,,,,RandomForestClassifier,,,,,,,,,,,,,,,,,,,,,,,,36.0,5.0,,,,,,COMPLETE,0.0,,,,,,,,,,,,,,,,,,,,
136,136,0.42845060134429447,2023-08-23 17:55:59.957028,2023-08-23 17:56:00.441597,0 days 00:00:00.484569,,,,,RandomForestClassifier,,,,,,,,,,,,,,,,,,,,,,,,10.0,5.0,,,,,,COMPLETE,0.0,,,,,,,,,,,,,,,,,,,,
137,137,0.5261916293021294,2023-08-23 17:56:00.522474,2023-08-23 17:56:02.524884,0 days 00:00:02.002410,,1.0,2.0,,LightGBM,,,,,0.7000000000000001,,,,0.00032881516378984436,0.00040374212806555573,,80.0,,,,,,,,,,68.0,,,,,,,,,COMPLETE,0.0,,,,,,,,,,,,,,,,,,,,
138,138,0.5397340690341852,2023-08-23 17:56:01.304954,2023-08-23 17:56:03.635051,0 days 00:00:02.330097,,1.0,3.0,,LightGBM,,,,,0.7000000000000001,,,,0.0005549943155849441,0.0004529635893968096,,80.0,,,,,,,,,,109.0,,,,,,,,,COMPLETE,0.0,,,,,,,,,,,,,,,,,,,,
139,139,0.5263747408129913,2023-08-23 17:56:01.939258,2023-08-23 17:56:04.060360,0 days 00:00:02.121102,,1.0,3.0,,LightGBM,,,,,0.7000000000000001,,,,0.0031440709191254902,0.0009885271099818458,,80.0,,,,,,,,,,70.0,,,,,,,,,COMPLETE,0.0,,,,,,,,,,,,,,,,,,,,
140,140,0.5156439734124377,2023-08-23 17:56:02.600615,2023-08-23 17:56:04.685271,0 days 00:00:02.084656,,1.0,3.0,,LightGBM,,,,,0.7000000000000001,,,,0.002932398580241492,0.00011131119344246827,,90.0,,,,,,,,,,110.0,,,,,,,,,COMPLETE,0.0,,,,,,,,,,,,,,,,,,,,
141,141,0.5156439734124377,2023-08-23 17:56:03.713781,2023-08-23 17:56:05.816637,0 days 00:00:02.102856,,1.0,3.0,,LightGBM,,,,,0.7000000000000001,,,,0.00331428722030891,0.00010773670464239596,,90.0,,,,,,,,,,111.0,,,,,,,,,COMPLETE,0.0,,,,,,,,,,,,,,,,,,,,
142,142,0.528318743107298,2023-08-23 17:56:04.128987,2023-08-23 17:56:06.351978,0 days 00:00:02.222991,,1.0,3.0,,LightGBM,,,,,0.8,,,,0.0015857454204490093,6.437862541299628e-05,,90.0,,,,,,,,,,89.0,,,,,,,,,COMPLETE,0.0,,,,,,,,,,,,,,,,,,,,
143,143,0.45481826909026923,2023-08-23 17:56:04.756338,2023-08-23 17:56:16.975318,0 days 00:00:12.218980,,,,,MLPClassifier,,,,,,,,,,,,,,relu,adam,3.0,10.0,60.0,10.0,,,,,,,,,,,,COMPLETE,0.0,,,,,,,,,,,,,,,,,,,,
144,144,0.3897951267675165,2023-08-23 17:56:05.931097,2023-08-23 17:56:12.158763,0 days 00:00:06.227666,,,,,MLPClassifier,,,,,,,,,,,,,,relu,adam,3.0,10.0,60.0,10.0,,,,,,,,,,,,COMPLETE,0.0,,,,,,,,,,,,,,,,,,,,
145,145,0.5115816789931231,2023-08-23 17:56:06.461354,2023-08-23 17:56:07.895823,0 days 00:00:01.434469,,0.7000000000000001,3.0,,LightGBM,,,,,0.8,,,,0.0019029991700185885,0.0014848075927311039,,100.0,,,,,,,,,,77.0,,,,,,,,,COMPLETE,0.0,,,,,,,,,,,,,,,,,,,,
146,146,0.3573487031700288,2023-08-23 17:56:07.979360,2023-08-23 17:56:10.221138,0 days 00:00:02.241778,,,,,MLPClassifier,,,,,,,,,,,,,,relu,sgd,3.0,10.0,60.0,10.0,,,,,,,,,,,,COMPLETE,0.0,,,,,,,,,,,,,,,,,,,,
147,147,0.5100158379620335,2023-08-23 17:56:10.289186,2023-08-23 17:56:10.621088,0 days 00:00:00.331902,,,,,DecisionTreeClassifier,,entropy,15.0,,,,,,,,,,,,,,,,,,,,,,,,,,,,COMPLETE,0.0,,,,,,,,,,,,,,,,,,,,
148,148,0.538246847886564,2023-08-23 17:56:10.705318,2023-08-23 17:56:13.473402,0 days 00:00:02.768084,,1.0,3.0,,LightGBM,,,,,1.0,,,,0.007142251346213709,0.0008439189951555478,,40.0,,,,,,,,,,96.0,,,,,,,,,COMPLETE,0.0,,,,,,,,,,,,,,,,,,,,
149,149,0.5484407527364957,2023-08-23 17:56:12.254526,2023-08-23 17:56:14.797171,0 days 00:00:02.542645,,1.0,3.0,,LightGBM,,,,,1.0,,,,0.005573433888547153,0.0013349058363284832,,40.0,,,,,,,,,,95.0,,,,,,,,,COMPLETE,0.0,,,,,,,,,,,,,,,,,,,,
150,150,0.5401037375574521,2023-08-23 17:56:13.576729,2023-08-23 17:56:16.057992,0 days 00:00:02.481263,,1.0,3.0,,LightGBM,,,,,0.6000000000000001,,,,0.007267252338295267,0.00022284713532209557,,40.0,,,,,,,,,,98.0,,,,,,,,,COMPLETE,0.0,,,,,,,,,,,,,,,,,,,,
151,151,0.508139173656415,2023-08-23 17:56:14.939101,2023-08-23 17:56:18.264769,0 days 00:00:03.325668,,1.0,3.0,,LightGBM,,,,,0.6000000000000001,,,,0.0011512472870868057,0.0016883374376041056,,40.0,,,,,,,,,,158.0,,,,,,,,,COMPLETE,0.0,,,,,,,,,,,,,,,,,,,,
152,152,0.5241749413541565,2023-08-23 17:56:16.165690,2023-08-23 17:56:19.363133,0 days 00:00:03.197443,,1.0,3.0,,LightGBM,,,,,1.0,,,,0.0011120981435567801,0.0017554478102335665,,50.0,,,,,,,,,,159.0,,,,,,,,,COMPLETE,0.0,,,,,,,,,,,,,,,,,,,,
153,153,0.5434355096307413,2023-08-23 17:56:17.076406,2023-08-23 17:56:20.011391,0 days 00:00:02.934985,,1.0,3.0,,LightGBM,,,,,1.0,,,,0.00111581037982381,0.0015365121184705626,,50.0,,,,,,,,,,139.0,,,,,,,,,COMPLETE,0.0,,,,,,,,,,,,,,,,,,,,
154,154,0.5434863523573201,2023-08-23 17:56:18.332215,2023-08-23 17:56:21.707806,0 days 00:00:03.375591,,1.0,2.0,,LightGBM,,,,,1.0,,,,0.024866687674021722,0.0006013012516908494,,50.0,,,,,,,,,,140.0,,,,,,,,,COMPLETE,0.0,,,,,,,,,,,,,,,,,,,,
155,155,0.5454938307437291,2023-08-23 17:56:19.475995,2023-08-23 17:56:22.148173,0 days 00:00:02.672178,,1.0,2.0,,LightGBM,,,,,1.0,,,,0.022724878253057437,0.0007638518588626634,,40.0,,,,,,,,,,87.0,,,,,,,,,COMPLETE,0.0,,,,,,,,,,,,,,,,,,,,
156,156,0.5361663977048593,2023-08-23 17:56:20.101565,2023-08-23 17:56:23.674349,0 days 00:00:03.572784,,1.0,2.0,,LightGBM,,,,,1.0,,,,0.0478964658616804,0.00079571015783914,,50.0,,,,,,,,,,139.0,,,,,,,,,COMPLETE,0.0,,,,,,,,,,,,,,,,,,,,
157,157,0.5326987559451406,2023-08-23 17:56:21.776701,2023-08-23 17:56:24.842205,0 days 00:00:03.065504,,1.0,2.0,,LightGBM,,,,,1.0,,,,0.041821594838955416,1.560686087998727e-05,,50.0,,,,,,,,,,134.0,,,,,,,,,COMPLETE,0.0,,,,,,,,,,,,,,,,,,,,
158,158,0.5242778055278055,2023-08-23 17:56:22.218418,2023-08-23 17:56:24.437829,0 days 00:00:02.219411,,1.0,2.0,,LightGBM,,,,,1.0,,,,0.026966932657327254,0.0005289317482831423,,50.0,,,,,,,,,,85.0,,,,,,,,,COMPLETE,0.0,,,,,,,,,,,,,,,,,,,,
159,159,0.5250413564929693,2023-08-23 17:56:23.757215,2023-08-23 17:56:26.089159,0 days 00:00:02.331944,,1.0,3.0,,LightGBM,,,,,1.0,,,,0.0238249660504754,0.0006393291584561028,,50.0,,,,,,,,,,87.0,,,,,,,,,COMPLETE,0.0,,,,,,,,,,,,,,,,,,,,
160,160,0.5477837481728532,2023-08-23 17:56:24.512436,2023-08-23 17:56:27.198630,0 days 00:00:02.686194,,1.0,3.0,,LightGBM,,,,,1.0,,,,0.02545945491899086,0.0006458932578052373,,60.0,,,,,,,,,,147.0,,,,,,,,,COMPLETE,0.0,,,,,,,,,,,,,,,,,,,,
161,161,0.5395472826170702,2023-08-23 17:56:24.912755,2023-08-23 17:56:27.554318,0 days 00:00:02.641563,,1.0,3.0,,LightGBM,,,,,1.0,,,,0.024572398400797037,0.0006161143227739741,,60.0,,,,,,,,,,145.0,,,,,,,,,COMPLETE,0.0,,,,,,,,,,,,,,,,,,,,
162,162,0.515251973048514,2023-08-23 17:56:26.220632,2023-08-23 17:56:29.243407,0 days 00:00:03.022775,,1.0,3.0,,LightGBM,,,,,1.0,,,,0.022209818367295193,0.0011814142867006823,,60.0,,,,,,,,,,125.0,,,,,,,,,COMPLETE,0.0,,,,,,,,,,,,,,,,,,,,
163,163,0.5480114405829669,2023-08-23 17:56:27.301875,2023-08-23 17:56:29.674159,0 days 00:00:02.372284,,1.0,3.0,,LightGBM,,,,,1.0,,,,0.02154893871185305,0.00027410789549310154,,40.0,,,,,,,,,,76.0,,,,,,,,,COMPLETE,0.0,,,,,,,,,,,,,,,,,,,,
164,164,0.5074392292394725,2023-08-23 17:56:27.651518,2023-08-23 17:56:29.945019,0 days 00:00:02.293501,,0.6000000000000001,3.0,,LightGBM,,,,,1.0,,,,0.017329594046255455,0.0002899766488390651,,60.0,,,,,,,,,,75.0,,,,,,,,,COMPLETE,0.0,,,,,,,,,,,,,,,,,,,,
165,165,0.5235134735067158,2023-08-23 17:56:29.353005,2023-08-23 17:56:32.968305,0 days 00:00:03.615300,,1.0,2.0,,LightGBM,,,,,1.0,,,,0.011295525572374322,0.00027779177565660773,,40.0,,,,,,,,,,150.0,,,,,,,,,COMPLETE,0.0,,,,,,,,,,,,,,,,,,,,
166,166,0.5045132620469379,2023-08-23 17:56:29.733110,2023-08-23 17:56:32.147540,0 days 00:00:02.414430,,0.6000000000000001,3.0,,LightGBM,,,,,1.0,,,,0.00884109786508589,0.00029137611270472103,,40.0,,,,,,,,,,78.0,,,,,,,,,COMPLETE,0.0,,,,,,,,,,,,,,,,,,,,
167,167,0.4955992389961654,2023-08-23 17:56:30.028585,2023-08-23 17:56:33.323298,0 days 00:00:03.294713,,0.7000000000000001,3.0,,LightGBM,,,,,1.0,,,,0.012041245720862268,0.00017507125095092297,,40.0,,,,,,,,,,106.0,,,,,,,,,COMPLETE,0.0,,,,,,,,,,,,,,,,,,,,
168,168,0.5300097630522711,2023-08-23 17:56:31.652861,2023-08-23 17:56:35.842747,0 days 00:00:04.189886,,1.0,3.0,,LightGBM,,,,,1.0,,,,0.00939852693917239,0.0001633949933119768,,40.0,,,,,,,,,,151.0,,,,,,,,,COMPLETE,0.0,,,,,,,,,,,,,,,,,,,,
169,169,0.5480976013234078,2023-08-23 17:56:32.241048,2023-08-23 17:56:35.434664,0 days 00:00:03.193616,,1.0,3.0,,LightGBM,,,,,1.0,,,,0.04889508490134636,0.00018757375723108967,,40.0,,,,,,,,,,106.0,,,,,,,,,COMPLETE,0.0,,,,,,,,,,,,,,,,,,,,
170,170,0.5342638544251448,2023-08-23 17:56:33.031196,2023-08-23 17:56:36.592402,0 days 00:00:03.561206,,1.0,3.0,,LightGBM,,,,,1.0,,,,0.042374020486004756,0.5071782574948324,,40.0,,,,,,,,,,119.0,,,,,,,,,COMPLETE,0.0,,,,,,,,,,,,,,,,,,,,
171,171,0.5119094725982226,2023-08-23 17:56:33.420705,2023-08-23 17:56:35.236069,0 days 00:00:01.815364,,1.0,3.0,,LightGBM,,,,,1.0,,,,0.04870560355863897,0.00015276339959204393,,30.0,,,,,,,,,,60.0,,,,,,,,,COMPLETE,0.0,,,,,,,,,,,,,,,,,,,,
172,172,0.5523640521286558,2023-08-23 17:56:35.355809,2023-08-23 17:56:38.629906,0 days 00:00:03.274097,,1.0,2.0,,LightGBM,,,,,0.9,,,,0.06159176724042047,0.00045038814955076725,,40.0,,,,,,,,,,99.0,,,,,,,,,COMPLETE,0.0,,,,,,,,,,,,,,,,,,,,
