,number,value,datetime_start,datetime_complete,duration,params_alpha,params_bagging_fraction,params_bagging_freq,params_booster,params_classifier,params_colsample_bytree,params_dct_criterion,params_dct_max_depth,params_eta,params_feature_fraction,params_gamma,params_grow_policy,params_lambda,params_lambda_l1,params_lambda_l2,params_max_depth,params_min_child_samples,params_min_child_weight,params_mlp_activation,params_mlp_solver,params_n_layers,params_n_units_l_0,params_n_units_l_1,params_n_units_l_2,params_n_units_l_3,params_normalize_type,params_num_leaves,params_rate_drop,params_rf_estimator,params_rf_max_depth,params_sample_type,params_skip_drop,params_subsample,params_svc_c,params_svc_kernel,state,best_trial,dev_acc,dev_recall_macro,dev_precision_macro,dev_f1_macro,dev_recall_0,dev_precision_0,dev_f1_0,dev_recall_1,dev_precision_1,dev_f1_1,test_acc,test_recall_macro,test_precision_macro,test_f1_macro,test_recall_0,test_precision_0,test_f1_0,test_recall_1,test_precision_1,test_f1_1
0,0,0.3357921744708146,2023-08-23 15:25:11.919312,2023-08-23 15:25:13.890602,0 days 00:00:01.971290,,,,,MLPClassifier,,,,,,,,,,,,,,logistic,lbfgs,2.0,80.0,60.0,,,,,,,,,,,,,COMPLETE,0.0,,,,,,,,,,,,,,,,,,,,
1,1,0.5494366836268596,2023-08-23 15:25:11.922227,2023-08-23 15:25:12.401072,0 days 00:00:00.478845,,,,,DecisionTreeClassifier,,log_loss,9.0,,,,,,,,,,,,,,,,,,,,,,,,,,,,COMPLETE,0.0,,,,,,,,,,,,,,,,,,,,
2,2,0.3357921744708146,2023-08-23 15:25:11.924641,2023-08-23 15:25:19.529102,0 days 00:00:07.604461,,,,,SVC,,,,,,,,,,,,,,,,,,,,,,,,,,,,,0.7773902249262516,poly,COMPLETE,0.0,,,,,,,,,,,,,,,,,,,,
3,3,0.5855287097008951,2023-08-23 15:25:11.927686,2023-08-23 15:25:13.226649,0 days 00:00:01.298963,,0.6000000000000001,3.0,,LightGBM,,,,,0.4,,,,0.000601133549254756,3.6714633300516737e-07,,60.0,,,,,,,,,,158.0,,,,,,,,,COMPLETE,0.0,,,,,,,,,,,,,,,,,,,,
4,4,0.5886439158466601,2023-08-23 15:25:11.930408,2023-08-23 15:25:14.895902,0 days 00:00:02.965494,,0.9,3.0,,LightGBM,,,,,0.4,,,,0.7694640101198138,3.497433299490293e-06,,40.0,,,,,,,,,,137.0,,,,,,,,,COMPLETE,0.0,,,,,,,,,,,,,,,,,,,,
5,5,0.48954177293606704,2023-08-23 15:25:11.933831,2023-08-23 15:25:22.694351,0 days 00:00:10.760520,,,,,SVC,,,,,,,,,,,,,,,,,,,,,,,,,,,,,320.1530119567433,linear,COMPLETE,0.0,,,,,,,,,,,,,,,,,,,,
6,6,0.5608833933388615,2023-08-23 15:25:11.936395,2023-08-23 15:25:15.605556,0 days 00:00:03.669161,,0.5,1.0,,LightGBM,,,,,0.9,,,,0.01518089885579134,3.167606972428204e-05,,20.0,,,,,,,,,,113.0,,,,,,,,,COMPLETE,0.0,,,,,,,,,,,,,,,,,,,,
7,7,0.3357921744708146,2023-08-23 15:25:11.955181,2023-08-23 15:25:49.531978,0 days 00:00:37.576797,,,,,MLPClassifier,,,,,,,,,,,,,,logistic,sgd,2.0,70.0,30.0,,,,,,,,,,,,,COMPLETE,0.0,,,,,,,,,,,,,,,,,,,,
8,8,0.5824328507629892,2023-08-23 15:25:12.464383,2023-08-23 15:25:14.788432,0 days 00:00:02.324049,1.0919374993757103e-08,,,gbtree,XGBoost,0.9363055293213793,,,3.0221475387117865e-05,,0.00022079957993407302,lossguide,1.582274315930778e-06,,,3.0,,5.0,,,,,,,,,,,,,,,0.9320563061905027,,,COMPLETE,0.0,,,,,,,,,,,,,,,,,,,,
9,9,0.5797319084379705,2023-08-23 15:25:13.340795,2023-08-23 15:25:17.369662,0 days 00:00:04.028867,,0.8,1.0,,LightGBM,,,,,0.5,,,,2.7996318423856226e-05,0.0011050450640045484,,30.0,,,,,,,,,,155.0,,,,,,,,,COMPLETE,0.0,,,,,,,,,,,,,,,,,,,,
10,10,0.40030782742533655,2023-08-23 15:25:13.972705,2023-08-23 15:25:20.685841,0 days 00:00:06.713136,,,,,SVC,,,,,,,,,,,,,,,,,,,,,,,,,,,,,0.09540832113873385,linear,COMPLETE,0.0,,,,,,,,,,,,,,,,,,,,
11,11,0.5905068092331033,2023-08-23 15:25:14.893034,2023-08-23 15:25:18.350460,0 days 00:00:03.457426,,,,,RandomForestClassifier,,,,,,,,,,,,,,,,,,,,,,,,87.0,4.0,,,,,,COMPLETE,0.0,,,,,,,,,,,,,,,,,,,,
12,12,0.5876771565419519,2023-08-23 15:25:15.014728,2023-08-23 15:25:16.707064,0 days 00:00:01.692336,,1.0,2.0,,LightGBM,,,,,1.0,,,,0.012460974148771432,9.83684367103136e-08,,100.0,,,,,,,,,,186.0,,,,,,,,,COMPLETE,0.0,,,,,,,,,,,,,,,,,,,,
13,13,0.5813036942602441,2023-08-23 15:25:15.690055,2023-08-23 15:25:16.799995,0 days 00:00:01.109940,,,,,RandomForestClassifier,,,,,,,,,,,,,,,,,,,,,,,,30.0,3.0,,,,,,COMPLETE,0.0,,,,,,,,,,,,,,,,,,,,
14,14,0.3357921744708146,2023-08-23 15:25:16.879190,2023-08-23 15:25:16.919593,0 days 00:00:00.040403,0.6090957176697664,,,gblinear,XGBoost,0.38703521956687487,,,,,,,3.093429868792436e-05,,,,,,,,,,,,,,,,,,,,0.9651478639519948,,,COMPLETE,0.0,,,,,,,,,,,,,,,,,,,,
15,15,0.5768220114465235,2023-08-23 15:25:16.888975,2023-08-23 15:25:17.515282,0 days 00:00:00.626307,2.2577053795777314e-08,,,gbtree,XGBoost,0.7832413100735043,,,0.05838990803558974,,2.717235358413343e-08,depthwise,4.202219983401535e-08,,,7.0,,2.0,,,,,,,,,,,,,,,0.8963730008386819,,,COMPLETE,0.0,,,,,,,,,,,,,,,,,,,,
16,16,0.3357921744708146,2023-08-23 15:25:16.984835,2023-08-23 15:25:59.196900,0 days 00:00:42.212065,,,,,MLPClassifier,,,,,,,,,,,,,,logistic,sgd,2.0,70.0,30.0,,,,,,,,,,,,,COMPLETE,0.0,,,,,,,,,,,,,,,,,,,,
17,17,0.4914860296079575,2023-08-23 15:25:17.466714,2023-08-23 15:25:25.466120,0 days 00:00:07.999406,,,,,SVC,,,,,,,,,,,,,,,,,,,,,,,,,,,,,38.94226044281022,linear,COMPLETE,0.0,,,,,,,,,,,,,,,,,,,,
18,18,0.49262531699923684,2023-08-23 15:25:17.588840,2023-08-23 15:25:26.018341,0 days 00:00:08.429501,,,,,SVC,,,,,,,,,,,,,,,,,,,,,,,,,,,,,49.10632989203674,linear,COMPLETE,0.0,,,,,,,,,,,,,,,,,,,,
19,19,0.476448329995128,2023-08-23 15:25:18.466151,2023-08-23 15:25:29.096949,0 days 00:00:10.630798,,,,,SVC,,,,,,,,,,,,,,,,,,,,,,,,,,,,,24.256889204119783,rbf,COMPLETE,0.0,,,,,,,,,,,,,,,,,,,,
20,20,0.5906761911185048,2023-08-23 15:25:19.600855,2023-08-23 15:25:27.085633,0 days 00:00:07.484778,,,,,RandomForestClassifier,,,,,,,,,,,,,,,,,,,,,,,,100.0,15.0,,,,,,COMPLETE,0.0,,,,,,,,,,,,,,,,,,,,
21,21,0.603135823856833,2023-08-23 15:25:20.824723,2023-08-23 15:25:27.374675,0 days 00:00:06.549952,,,,,RandomForestClassifier,,,,,,,,,,,,,,,,,,,,,,,,95.0,13.0,,,,,,COMPLETE,0.0,,,,,,,,,,,,,,,,,,,,
22,22,0.5841799027951377,2023-08-23 15:25:22.778815,2023-08-23 15:25:30.367043,0 days 00:00:07.588228,,,,,RandomForestClassifier,,,,,,,,,,,,,,,,,,,,,,,,99.0,14.0,,,,,,COMPLETE,0.0,,,,,,,,,,,,,,,,,,,,
23,23,0.6019398814881488,2023-08-23 15:25:25.565312,2023-08-23 15:25:33.357479,0 days 00:00:07.792167,,,,,RandomForestClassifier,,,,,,,,,,,,,,,,,,,,,,,,98.0,13.0,,,,,,COMPLETE,0.0,,,,,,,,,,,,,,,,,,,,
24,24,0.5865779322289326,2023-08-23 15:25:26.091453,2023-08-23 15:25:34.050109,0 days 00:00:07.958656,,,,,RandomForestClassifier,,,,,,,,,,,,,,,,,,,,,,,,97.0,13.0,,,,,,COMPLETE,0.0,,,,,,,,,,,,,,,,,,,,
25,25,0.5959166198764739,2023-08-23 15:25:27.165946,2023-08-23 15:25:36.550836,0 days 00:00:09.384890,,,,,RandomForestClassifier,,,,,,,,,,,,,,,,,,,,,,,,99.0,18.0,,,,,,COMPLETE,0.0,,,,,,,,,,,,,,,,,,,,
26,26,0.5927790512807578,2023-08-23 15:25:27.462615,2023-08-23 15:25:36.136060,0 days 00:00:08.673445,,,,,RandomForestClassifier,,,,,,,,,,,,,,,,,,,,,,,,96.0,19.0,,,,,,COMPLETE,0.0,,,,,,,,,,,,,,,,,,,,
27,27,0.5857643834797011,2023-08-23 15:25:29.183333,2023-08-23 15:25:38.934681,0 days 00:00:09.751348,,,,,RandomForestClassifier,,,,,,,,,,,,,,,,,,,,,,,,99.0,20.0,,,,,,COMPLETE,0.0,,,,,,,,,,,,,,,,,,,,
28,28,0.5967223844939169,2023-08-23 15:25:30.464654,2023-08-23 15:25:39.184229,0 days 00:00:08.719575,,,,,RandomForestClassifier,,,,,,,,,,,,,,,,,,,,,,,,98.0,15.0,,,,,,COMPLETE,0.0,,,,,,,,,,,,,,,,,,,,
29,29,0.5820522401338031,2023-08-23 15:25:33.422034,2023-08-23 15:25:44.230363,0 days 00:00:10.808329,,,,,RandomForestClassifier,,,,,,,,,,,,,,,,,,,,,,,,100.0,16.0,,,,,,COMPLETE,0.0,,,,,,,,,,,,,,,,,,,,
30,30,0.5960242587601078,2023-08-23 15:25:34.132432,2023-08-23 15:25:41.933629,0 days 00:00:07.801197,,,,,RandomForestClassifier,,,,,,,,,,,,,,,,,,,,,,,,74.0,22.0,,,,,,COMPLETE,0.0,,,,,,,,,,,,,,,,,,,,
31,31,0.5908758476396854,2023-08-23 15:25:36.261907,2023-08-23 15:25:45.050017,0 days 00:00:08.788110,,,,,RandomForestClassifier,,,,,,,,,,,,,,,,,,,,,,,,75.0,28.0,,,,,,COMPLETE,0.0,,,,,,,,,,,,,,,,,,,,
32,32,0.6070255853537587,2023-08-23 15:25:36.655437,2023-08-23 15:25:41.711060,0 days 00:00:05.055623,,,,,RandomForestClassifier,,,,,,,,,,,,,,,,,,,,,,,,71.0,8.0,,,,,,COMPLETE,0.0,,,,,,,,,,,,,,,,,,,,
33,33,0.5218405296308979,2023-08-23 15:25:39.040589,2023-08-23 15:25:39.286858,0 days 00:00:00.246269,,,,,DecisionTreeClassifier,,entropy,2.0,,,,,,,,,,,,,,,,,,,,,,,,,,,,COMPLETE,0.0,,,,,,,,,,,,,,,,,,,,
34,34,0.43371005794926987,2023-08-23 15:25:39.382551,2023-08-23 15:26:36.655940,0 days 00:00:57.273389,,,,,MLPClassifier,,,,,,,,,,,,,,tanh,sgd,4.0,10.0,10.0,50.0,60.0,,,,,,,,,,,COMPLETE,0.0,,,,,,,,,,,,,,,,,,,,
35,35,0.43522904935334883,2023-08-23 15:25:39.388066,2023-08-23 15:26:25.369461,0 days 00:00:45.981395,,,,,MLPClassifier,,,,,,,,,,,,,,identity,sgd,4.0,10.0,10.0,10.0,90.0,,,,,,,,,,,COMPLETE,0.0,,,,,,,,,,,,,,,,,,,,
36,36,0.33557908245107476,2023-08-23 15:25:41.797951,2023-08-23 15:25:55.732056,0 days 00:00:13.934105,,,,,MLPClassifier,,,,,,,,,,,,,,identity,sgd,4.0,10.0,10.0,10.0,90.0,,,,,,,,,,,COMPLETE,0.0,,,,,,,,,,,,,,,,,,,,
37,37,0.34009942520580816,2023-08-23 15:25:42.019601,2023-08-23 15:26:19.343490,0 days 00:00:37.323889,,,,,MLPClassifier,,,,,,,,,,,,,,tanh,sgd,4.0,10.0,10.0,50.0,50.0,,,,,,,,,,,COMPLETE,0.0,,,,,,,,,,,,,,,,,,,,
38,38,0.5894213716879613,2023-08-23 15:25:44.318190,2023-08-23 15:25:50.538069,0 days 00:00:06.219879,,,,,RandomForestClassifier,,,,,,,,,,,,,,,,,,,,,,,,73.0,8.0,,,,,,COMPLETE,0.0,,,,,,,,,,,,,,,,,,,,
39,39,0.5249322049375517,2023-08-23 15:25:45.132481,2023-08-23 15:27:10.297448,0 days 00:01:25.164967,,,,,MLPClassifier,,,,,,,,,,,,,,identity,adam,4.0,10.0,10.0,50.0,50.0,,,,,,,,,,,COMPLETE,0.0,,,,,,,,,,,,,,,,,,,,
40,40,0.5746605845728122,2023-08-23 15:25:49.653589,2023-08-23 15:27:46.648690,0 days 00:01:56.995101,,,,,MLPClassifier,,,,,,,,,,,,,,identity,adam,4.0,10.0,100.0,80.0,80.0,,,,,,,,,,,COMPLETE,0.0,,,,,,,,,,,,,,,,,,,,
41,41,0.5832509334484117,2023-08-23 15:25:50.676656,2023-08-23 15:33:55.386139,0 days 00:08:04.709483,,,,,MLPClassifier,,,,,,,,,,,,,,relu,adam,4.0,10.0,100.0,50.0,30.0,,,,,,,,,,,COMPLETE,0.0,,,,,,,,,,,,,,,,,,,,
42,42,0.5535463316031424,2023-08-23 15:25:55.808305,2023-08-23 15:25:56.608709,0 days 00:00:00.800404,,,,,DecisionTreeClassifier,,gini,29.0,,,,,,,,,,,,,,,,,,,,,,,,,,,,COMPLETE,0.0,,,,,,,,,,,,,,,,,,,,
43,43,0.5911362559509037,2023-08-23 15:25:56.683439,2023-08-23 15:26:00.332849,0 days 00:00:03.649410,,,,,RandomForestClassifier,,,,,,,,,,,,,,,,,,,,,,,,53.0,9.0,,,,,,COMPLETE,0.0,,,,,,,,,,,,,,,,,,,,
44,44,0.5945963835060838,2023-08-23 15:25:59.270777,2023-08-23 15:26:02.452788,0 days 00:00:03.182011,,,,,RandomForestClassifier,,,,,,,,,,,,,,,,,,,,,,,,49.0,9.0,,,,,,COMPLETE,0.0,,,,,,,,,,,,,,,,,,,,
45,45,0.6012736927321939,2023-08-23 15:26:00.410157,2023-08-23 15:26:09.804849,0 days 00:00:09.394692,,,,,RandomForestClassifier,,,,,,,,,,,,,,,,,,,,,,,,83.0,10.0,,,,,,COMPLETE,0.0,,,,,,,,,,,,,,,,,,,,
46,46,0.5218405296308979,2023-08-23 15:26:02.542613,2023-08-23 15:26:02.849550,0 days 00:00:00.306937,,,,,DecisionTreeClassifier,,gini,2.0,,,,,,,,,,,,,,,,,,,,,,,,,,,,COMPLETE,0.0,,,,,,,,,,,,,,,,,,,,
47,47,0.5902174078484128,2023-08-23 15:26:02.942074,2023-08-23 15:26:15.546237,0 days 00:00:12.604163,,,,,RandomForestClassifier,,,,,,,,,,,,,,,,,,,,,,,,83.0,11.0,,,,,,COMPLETE,0.0,,,,,,,,,,,,,,,,,,,,
48,48,0.5920543889961336,2023-08-23 15:26:09.929265,2023-08-23 15:26:22.360386,0 days 00:00:12.431121,,,,,RandomForestClassifier,,,,,,,,,,,,,,,,,,,,,,,,87.0,11.0,,,,,,COMPLETE,0.0,,,,,,,,,,,,,,,,,,,,
49,49,0.5943530344625043,2023-08-23 15:26:15.616377,2023-08-23 15:26:22.909348,0 days 00:00:07.292971,,,,,RandomForestClassifier,,,,,,,,,,,,,,,,,,,,,,,,79.0,6.0,,,,,,COMPLETE,0.0,,,,,,,,,,,,,,,,,,,,
50,50,0.5903853268448163,2023-08-23 15:26:19.482190,2023-08-23 15:26:26.382077,0 days 00:00:06.899887,,,,,RandomForestClassifier,,,,,,,,,,,,,,,,,,,,,,,,85.0,6.0,,,,,,COMPLETE,0.0,,,,,,,,,,,,,,,,,,,,
51,51,0.5913190964459178,2023-08-23 15:26:22.438227,2023-08-23 15:26:28.676518,0 days 00:00:06.238291,,,,,RandomForestClassifier,,,,,,,,,,,,,,,,,,,,,,,,84.0,6.0,,,,,,COMPLETE,0.0,,,,,,,,,,,,,,,,,,,,
52,52,0.5971061892075055,2023-08-23 15:26:22.977158,2023-08-23 15:26:27.674060,0 days 00:00:04.696902,,,,,RandomForestClassifier,,,,,,,,,,,,,,,,,,,,,,,,65.0,6.0,,,,,,COMPLETE,0.0,,,,,,,,,,,,,,,,,,,,
53,53,0.5844268690594411,2023-08-23 15:26:25.457063,2023-08-23 15:26:25.911703,0 days 00:00:00.454640,,0.4,2.0,,LightGBM,,,,,0.7000000000000001,,,,7.421416037717532e-08,0.26677208350822884,,100.0,,,,,,,,,,5.0,,,,,,,,,COMPLETE,0.0,,,,,,,,,,,,,,,,,,,,
54,54,0.5959491514827673,2023-08-23 15:26:25.985305,2023-08-23 15:26:30.074702,0 days 00:00:04.089397,,,,,RandomForestClassifier,,,,,,,,,,,,,,,,,,,,,,,,66.0,6.0,,,,,,COMPLETE,0.0,,,,,,,,,,,,,,,,,,,,
55,55,0.36351670972101735,2023-08-23 15:26:26.500730,2023-08-23 15:26:27.107707,0 days 00:00:00.606977,0.0033163427893714804,,,dart,XGBoost,0.21199806169352553,,,1.513244268601494e-08,,0.2344921209626179,depthwise,0.806465780934549,,,9.0,,10.0,,,,,,,,forest,,7.300272283042379e-05,,,uniform,5.1977631626232834e-08,0.2130751821248133,,,COMPLETE,0.0,,,,,,,,,,,,,,,,,,,,
56,56,0.5863481252756948,2023-08-23 15:26:27.246482,2023-08-23 15:26:32.110799,0 days 00:00:04.864317,,,,,RandomForestClassifier,,,,,,,,,,,,,,,,,,,,,,,,62.0,11.0,,,,,,COMPLETE,0.0,,,,,,,,,,,,,,,,,,,,
57,57,0.5935557006672909,2023-08-23 15:26:27.756818,2023-08-23 15:26:31.530975,0 days 00:00:03.774157,,,,,RandomForestClassifier,,,,,,,,,,,,,,,,,,,,,,,,63.0,7.0,,,,,,COMPLETE,0.0,,,,,,,,,,,,,,,,,,,,
58,58,0.5889760938204781,2023-08-23 15:26:28.766112,2023-08-23 15:26:34.096840,0 days 00:00:05.330728,,,,,RandomForestClassifier,,,,,,,,,,,,,,,,,,,,,,,,68.0,11.0,,,,,,COMPLETE,0.0,,,,,,,,,,,,,,,,,,,,
59,59,0.5966285100740858,2023-08-23 15:26:30.176998,2023-08-23 15:26:35.226985,0 days 00:00:05.049987,,,,,RandomForestClassifier,,,,,,,,,,,,,,,,,,,,,,,,61.0,11.0,,,,,,COMPLETE,0.0,,,,,,,,,,,,,,,,,,,,
60,60,0.5858892454904547,2023-08-23 15:26:31.600569,2023-08-23 15:26:38.462503,0 days 00:00:06.861934,,,,,RandomForestClassifier,,,,,,,,,,,,,,,,,,,,,,,,91.0,11.0,,,,,,COMPLETE,0.0,,,,,,,,,,,,,,,,,,,,
61,61,0.5875879559157116,2023-08-23 15:26:32.194647,2023-08-23 15:26:33.927245,0 days 00:00:01.732598,,0.7000000000000001,3.0,,LightGBM,,,,,0.7000000000000001,,,,1.1727982018967644e-08,1.277857656627088e-08,,70.0,,,,,,,,,,247.0,,,,,,,,,COMPLETE,0.0,,,,,,,,,,,,,,,,,,,,
62,62,0.5938758467976506,2023-08-23 15:26:34.042286,2023-08-23 15:26:40.180423,0 days 00:00:06.138137,,,,,RandomForestClassifier,,,,,,,,,,,,,,,,,,,,,,,,91.0,12.0,,,,,,COMPLETE,0.0,,,,,,,,,,,,,,,,,,,,
63,63,0.33644722508326547,2023-08-23 15:26:34.199885,2023-08-23 15:26:34.484503,0 days 00:00:00.284618,5.361323702004581e-05,,,gblinear,XGBoost,0.6045120025113538,,,,,,,0.02962778652895311,,,,,,,,,,,,,,,,,,,,0.48520044356759534,,,COMPLETE,0.0,,,,,,,,,,,,,,,,,,,,
64,64,0.5895346036218163,2023-08-23 15:26:34.616382,2023-08-23 15:26:41.668304,0 days 00:00:07.051922,,,,,RandomForestClassifier,,,,,,,,,,,,,,,,,,,,,,,,91.0,14.0,,,,,,COMPLETE,0.0,,,,,,,,,,,,,,,,,,,,
65,65,0.3357921744708146,2023-08-23 15:26:35.303238,2023-08-23 15:26:39.825217,0 days 00:00:04.521979,,,,,SVC,,,,,,,,,,,,,,,,,,,,,,,,,,,,,0.0025616224552845023,poly,COMPLETE,0.0,,,,,,,,,,,,,,,,,,,,
66,66,0.3357921744708146,2023-08-23 15:26:36.736685,2023-08-23 15:26:41.759423,0 days 00:00:05.022738,,,,,SVC,,,,,,,,,,,,,,,,,,,,,,,,,,,,,0.0014420398778392008,poly,COMPLETE,0.0,,,,,,,,,,,,,,,,,,,,
67,67,0.3357921744708146,2023-08-23 15:26:38.561066,2023-08-23 15:26:43.663139,0 days 00:00:05.102073,,,,,SVC,,,,,,,,,,,,,,,,,,,,,,,,,,,,,0.002429375508916319,poly,COMPLETE,0.0,,,,,,,,,,,,,,,,,,,,
68,68,0.5980307146037482,2023-08-23 15:26:39.932277,2023-08-23 15:26:44.920078,0 days 00:00:04.987801,,,,,RandomForestClassifier,,,,,,,,,,,,,,,,,,,,,,,,58.0,14.0,,,,,,COMPLETE,0.0,,,,,,,,,,,,,,,,,,,,
69,69,0.5976391284841955,2023-08-23 15:26:40.244998,2023-08-23 15:26:44.503804,0 days 00:00:04.258806,,,,,RandomForestClassifier,,,,,,,,,,,,,,,,,,,,,,,,56.0,14.0,,,,,,COMPLETE,0.0,,,,,,,,,,,,,,,,,,,,
70,70,0.5830608360379708,2023-08-23 15:26:41.824624,2023-08-23 15:26:45.850934,0 days 00:00:04.026310,,,,,RandomForestClassifier,,,,,,,,,,,,,,,,,,,,,,,,58.0,9.0,,,,,,COMPLETE,0.0,,,,,,,,,,,,,,,,,,,,
71,71,0.5874973629220357,2023-08-23 15:26:41.855225,2023-08-23 15:26:45.574924,0 days 00:00:03.719699,,,,,RandomForestClassifier,,,,,,,,,,,,,,,,,,,,,,,,61.0,8.0,,,,,,COMPLETE,0.0,,,,,,,,,,,,,,,,,,,,
72,72,0.5927018783496013,2023-08-23 15:26:43.762342,2023-08-23 15:26:48.170862,0 days 00:00:04.408520,,,,,RandomForestClassifier,,,,,,,,,,,,,,,,,,,,,,,,57.0,9.0,,,,,,COMPLETE,0.0,,,,,,,,,,,,,,,,,,,,
73,73,0.5790292990811713,2023-08-23 15:26:44.624435,2023-08-23 15:26:50.027805,0 days 00:00:05.403370,,,,,RandomForestClassifier,,,,,,,,,,,,,,,,,,,,,,,,49.0,15.0,,,,,,COMPLETE,0.0,,,,,,,,,,,,,,,,,,,,
74,74,0.5966905248422312,2023-08-23 15:26:45.016045,2023-08-23 15:26:48.649621,0 days 00:00:03.633576,,,,,RandomForestClassifier,,,,,,,,,,,,,,,,,,,,,,,,44.0,8.0,,,,,,COMPLETE,0.0,,,,,,,,,,,,,,,,,,,,
75,75,0.5653567810102764,2023-08-23 15:26:45.710450,2023-08-23 15:26:47.055737,0 days 00:00:01.345287,,,,,RandomForestClassifier,,,,,,,,,,,,,,,,,,,,,,,,39.0,2.0,,,,,,COMPLETE,0.0,,,,,,,,,,,,,,,,,,,,
76,76,0.5439839575626348,2023-08-23 15:26:45.968542,2023-08-23 15:26:47.186813,0 days 00:00:01.218271,,,,,DecisionTreeClassifier,,log_loss,28.0,,,,,,,,,,,,,,,,,,,,,,,,,,,,COMPLETE,0.0,,,,,,,,,,,,,,,,,,,,
77,77,0.5397740217070677,2023-08-23 15:26:47.171272,2023-08-23 15:26:48.020736,0 days 00:00:00.849464,,,,,DecisionTreeClassifier,,entropy,26.0,,,,,,,,,,,,,,,,,,,,,,,,,,,,COMPLETE,0.0,,,,,,,,,,,,,,,,,,,,
78,78,0.5788328017302065,2023-08-23 15:26:47.286502,2023-08-23 15:26:48.899525,0 days 00:00:01.613023,,,,,RandomForestClassifier,,,,,,,,,,,,,,,,,,,,,,,,13.0,16.0,,,,,,COMPLETE,0.0,,,,,,,,,,,,,,,,,,,,
79,79,0.5884717383051025,2023-08-23 15:26:48.133786,2023-08-23 15:26:53.780162,0 days 00:00:05.646376,,,,,RandomForestClassifier,,,,,,,,,,,,,,,,,,,,,,,,50.0,15.0,,,,,,COMPLETE,0.0,,,,,,,,,,,,,,,,,,,,
80,80,0.5911625522296177,2023-08-23 15:26:48.327819,2023-08-23 15:26:53.447499,0 days 00:00:05.119680,,,,,RandomForestClassifier,,,,,,,,,,,,,,,,,,,,,,,,50.0,15.0,,,,,,COMPLETE,0.0,,,,,,,,,,,,,,,,,,,,
81,81,0.5879742579066336,2023-08-23 15:26:48.726540,2023-08-23 15:26:50.705359,0 days 00:00:01.978819,,,,,RandomForestClassifier,,,,,,,,,,,,,,,,,,,,,,,,17.0,14.0,,,,,,COMPLETE,0.0,,,,,,,,,,,,,,,,,,,,
82,82,0.599596872563501,2023-08-23 15:26:49.020813,2023-08-23 15:26:57.400733,0 days 00:00:08.379920,,,,,RandomForestClassifier,,,,,,,,,,,,,,,,,,,,,,,,94.0,14.0,,,,,,COMPLETE,0.0,,,,,,,,,,,,,,,,,,,,
83,83,0.5916580799821819,2023-08-23 15:26:50.139953,2023-08-23 15:26:58.434529,0 days 00:00:08.294576,,,,,RandomForestClassifier,,,,,,,,,,,,,,,,,,,,,,,,93.0,13.0,,,,,,COMPLETE,0.0,,,,,,,,,,,,,,,,,,,,
84,84,0.5885901420145443,2023-08-23 15:26:50.796859,2023-08-23 15:26:51.429329,0 days 00:00:00.632470,,1.0,1.0,,LightGBM,,,,,0.8,,,,1.9138477455850927e-06,0.951851768206471,,80.0,,,,,,,,,,6.0,,,,,,,,,COMPLETE,0.0,,,,,,,,,,,,,,,,,,,,
85,85,0.5900510347674354,2023-08-23 15:26:51.518554,2023-08-23 15:26:51.844483,0 days 00:00:00.325929,9.51409789594515e-06,,,dart,XGBoost,0.9605841826985457,,,0.3115715758161293,,5.431658863799832e-08,lossguide,0.0009726690178356027,,,3.0,,10.0,,,,,,,,tree,,1.1208956736214196e-08,,,weighted,0.49352228814009813,0.6261459113886213,,,COMPLETE,0.0,,,,,,,,,,,,,,,,,,,,
86,86,0.5888038196532204,2023-08-23 15:26:51.928374,2023-08-23 15:26:59.267582,0 days 00:00:07.339208,,,,,RandomForestClassifier,,,,,,,,,,,,,,,,,,,,,,,,94.0,13.0,,,,,,COMPLETE,0.0,,,,,,,,,,,,,,,,,,,,
87,87,0.6026176667318759,2023-08-23 15:26:53.569326,2023-08-23 15:27:01.590293,0 days 00:00:08.020967,,,,,RandomForestClassifier,,,,,,,,,,,,,,,,,,,,,,,,94.0,13.0,,,,,,COMPLETE,0.0,,,,,,,,,,,,,,,,,,,,
88,88,0.5819358861991379,2023-08-23 15:26:53.877407,2023-08-23 15:27:01.481583,0 days 00:00:07.604176,,,,,RandomForestClassifier,,,,,,,,,,,,,,,,,,,,,,,,94.0,13.0,,,,,,COMPLETE,0.0,,,,,,,,,,,,,,,,,,,,
89,89,0.5919465832486236,2023-08-23 15:26:57.490290,2023-08-23 15:27:06.272239,0 days 00:00:08.781949,,,,,RandomForestClassifier,,,,,,,,,,,,,,,,,,,,,,,,94.0,18.0,,,,,,COMPLETE,0.0,,,,,,,,,,,,,,,,,,,,
90,90,0.5786318933011168,2023-08-23 15:26:58.528688,2023-08-23 15:27:06.944923,0 days 00:00:08.416235,,,,,RandomForestClassifier,,,,,,,,,,,,,,,,,,,,,,,,95.0,17.0,,,,,,COMPLETE,0.0,,,,,,,,,,,,,,,,,,,,
91,91,0.5962181526428889,2023-08-23 15:26:59.372203,2023-08-23 15:27:08.068516,0 days 00:00:08.696313,,,,,RandomForestClassifier,,,,,,,,,,,,,,,,,,,,,,,,96.0,18.0,,,,,,COMPLETE,0.0,,,,,,,,,,,,,,,,,,,,
92,92,0.5899848652186362,2023-08-23 15:27:01.568129,2023-08-23 15:27:08.330491,0 days 00:00:06.762362,,,,,RandomForestClassifier,,,,,,,,,,,,,,,,,,,,,,,,69.0,18.0,,,,,,COMPLETE,0.0,,,,,,,,,,,,,,,,,,,,
93,93,0.5971457696228339,2023-08-23 15:27:01.675927,2023-08-23 15:27:08.897118,0 days 00:00:07.221191,,,,,RandomForestClassifier,,,,,,,,,,,,,,,,,,,,,,,,79.0,18.0,,,,,,COMPLETE,0.0,,,,,,,,,,,,,,,,,,,,
